gen_info,env_info,food_info,study_info,office_info,facil_info,mhct_info,help_info,etc_info
"FHWN 그러니까 University of Applied Science, Wiener Neustadt는 Wien에서 남쪽으로 차로 한 40여분, 기차로는 30분에서 1시간 정도 떨어진 Wiener Neustadt라는 작은 도시에 있습니다. 동쪽으로 기차를 타고 40-50분 정도면 헝가리 국경의 작은 도시도 갈 수 있습니다. 학교의 크기는 건물 3개가 합쳐진 정도이며 연세대학교 공대건물을 합쳐놓은 정도를 생각하면 될 것같습니다. 기후는 한국과 비슷한 기후를 보입니다. 다만 학교와 기숙사 주위는 바람이 많이 불며 안개가 자욱하게 끼어있는 경우도 많습니다. 따라서 해가 떠있어도 부는 바랍대문에 약간 쌀쌀하게 느끼는 경우도 많습니다. 제가 있던 겨울은 오히려 한국보다 더 따뜻했으며, 여름은 시원했습니다.","대학주변에 많은 것이 있지는 않습니다. 학교와 기숙사는 걸어서 10분이내에 있으며 기숙사 가까운 곳에 수영장이 있습니다. 도시의 중심부라고 할 수 있는 기차역과 센터는 버스를 타고 나가며, 걸으면 30-40분 정도 걸립니다. 센터에는 많은 마트와 식당과 펍, 옷가게 등이 있습니다. 기숙사에서 걸어갈 수 있는 거리에 Billa, Hofer, Lidl 등 다양한 마트가 있으며 맥도날드와 버거킹도 조금 걸으면 갈 수 있습니다.","모든 교환학생은 예외없이 기숙사에 살게 됩니다. 자신이 원하거나 혹은 다른 방법으로 방을 구해서 Wien 혹은 Wiener Neustadt에서 통학을 할 수도 있지만, 모든 교환학생이 함께 기숙사에 모여사는 것도 그 나름의 재미가 있기에 기숙사에 사는 것을 추천합니다. 기숙사 관리인이 매우 까다롭게 굴어서 좋아하는 사람이 아무도 없기는 하지만 기숙사 시설 자체는 매우 좋습니다. 침대와 책상이 있는 방은 혼자 쓰면서 주방, 욕실은 2명이 함께 씁니다. 빨래는 지하에 시설이 있으며, 헬스장이나 당구시설도 경우에 따라서 사용이 가능합니다. 오븐이 있는 공용주방은 제가 있을땐 봄엔 안열어주고 가을학기엔 열어주어서 사용할 수 있었습니다. 원래는 열어줘야 하는 것이기에 요구하면 열어줄 가능성이 큽니다. 식사는 혼자 해먹어야 합니다. 주위에 식당이 걸어서 꽤나 나가야 하는 거리에 있기 때문에 간단하게라도 스스로 해먹거나 친구들과 함께 먹거나 하는 경우가 많습니다. 전기밥솥을 작은거라도 가지고 가거나 스스로 구하거나 한다면 밥도 먹을 수 있고, 크게 식사때문에 문제될 것은 없을 것 같습니다. 다만 2명이 쓰기에는 조금은 작을 수도 있는 냉장고는 고려해서 쓰시면 될 듯 합니다. 라면과 같은 경우는 센터에 있는 China shop에서 팔았습니다. 다수의 한국 음식이나 재료도 구할 수 있습니다. 좀 더 요구되는 것들은 비엔나에 나가면 한인 마트에 가면 많이 있습니다.","수업은 시간표를 어떻게 짜느냐에 따라 다르지만 크게 어렵지는 않습니다. 대학원 수업의 경우 난이도가 있기는 하지만 한국에 비해서 크게 어렵다는 생각은 들지 않았습니다. 다만 저는 마케팅을 주로 들었기에 그러할 수도 있다는 생각을 할 수도 있습니다. 재무과목의 마스터과정은 난이도가 있는 것으로 들어 알고 있습니다.
시간표의 경우 짜는 것에 따라서 매우 달라집니다. 매일 수업이 있을 수도 있지만 또 한동안 없다가 며칠 몰아서 수업을 듣기도 합니다.
학년에 맞춰서 짠다면 크게 쉬는 기간 없이 매일 3시간 정도씩 수업이 있을 가능성이 큽니다. 그렇지 않다면 하루에 7시간 수업듣고 며칠 쉬는 경우도 있습니다. 중간고사는 거의 없습니다. 팀프로젝트 혹은 개인 발표, 수업참여와 함께 기말고사를 통해서 평가됩니다. 절대 평가로 이루어지며 점수에 맞추어 성적이 차등으로 주어지며 기말고사 60%미만은 재시험을 봐야합니다.
도서관에는 많이 가보지는 않았지만 잡지와 관련 도서들이 있습니다. 오리엔테이션 기간에 도서관에 대한 설명이 있습니다. 공부할 수 있는 자리는 많지는 않지만 어느정도 있습니다. 사람이 많이 있는 것을 본적은 없습니다.","International Office 사람들 너무 좋습니다. 1년동안 있으면서 IO 사람들과 너무 친해져서 나중에는 재미있게 놀기도 하고 그랬습니다. 어려운점이 있거나 필요한것이 있으면 언제든 메일로나 방문하여 물어보면 친절하게 답해줍니다. 제가 있으면서 교환학생들이 1학기에 큰 사고를 한번쳐서 IO에서 매우 문제가 된적이 있는데, 2학기 오리엔테이션 시간에 그 마저도 웃으면서 이야기하고, 잘 처리했던 것이 기억에 납니다.","다른 동아리는 참여해본적이 없습니다. 다만 한학기에 한번씩 운동수업이 열립니다. 수업이라고 하기엔 뭐하지만 참여해서 배우거나 함께 즐기는 시간이 열리고 참가비를 지불합니다. 배드민턴 수영 인라인스케이트 축구 등등 다양한 스포츠가 열립니다. 
텐덤이라고 언어교류프로그램도 있습니다만 한국어에 관심있는 사람은 없는걸로 압니다. 텐덤프로그램은 비엔나에서도 있는데 비엔나대학교 한국어학과 학생들이 많이 있으며 매우 잘 이루어지고 있는 것으로 알고있습니다. 이 부분은 연결이 가능 할 수도 있습니다.","문화적인 충격은 크게 없었습니다.
다만 오스트리아는 생각보다 개방적인 나라입니다. 비엔나 시청앞에서 게이퍼레이드가 열리기도 하는 나라입니다.","교내에서는 IO를 가시면 됩니다. 무슨 사고를 치거나 궁금하거나 아프거나 무슨 일이 있다고 하면 IO를 가시면 됩니다.
혹은 buddy들이 있습니다. IO에서 임명받은 버디들이 기숙사에 혹은 기숙사 근처에 거주하면서 교환학생들과 즐겁게 놉니다. 그들또한 학생이기도 하고 다른 나라에서 온 사람들이 많긴 하지만 독일어도 잘 하고 도움도 잘 줍니다. 물론 그것보다 노는것이 좋습니다.
정 어려운 문제는 대사관에 문의하면 됩니다.","돌아온지 3개월 정도가 되었지만 아직도 꿈에 떠오르는 곳입니다.
오스트리아. 그것도 빈이 아닌 작은 도시 Wiener Neustadt. 처음엔 왜 이곳에 왔을까를 고민하기도 했지만 이곳에 온 것이 너무나도 좋은 선택이었다고 생각합니다. 유럽의 중심이기도 하면서도 너무 아름다운 나라이고 안전한 나라이기도 합니다. 사람도 너무 좋고 할 수 있는 것도 많고. 여전히 오스트레일리아와 오스트리아를 혼동하는 사람들이 너무나도 많은 잘 알려지지 않은 장소일 수도 있겠지만 그곳에서 보낸 1년은 영원히 잊을 수 없을 것입니다.

오스트리아로 교환학생 가는것을 추천합니다. 그 장소가 비엔나이면 더 좋겠지만 그것이 아니라면 Wiener Neustadt를 매우 추천합니다. 가셔서 제가 느낀 좋은 점을 함께 느낄 수 있음 좋겠습니다.
문의가 있다면 cloudjw@gmail.com으로 연락주시면 친절하게 답 해드리도록 하겠습니다."
"비너노이슈타트는 비엔나에서 빠른 기차로 30분, 국철로 1시간 정도 떨어진 곳에 위치합니다. 비엔나에 가려면 왕복 9유로정도 듭니다. 여러 사람이 같이 갈수록 기차티켓이 할인됩니다. 정도학교가 위치하고 있는 곳은 들판 우선 학교의 크기는 매우 작은 편입니다. 빌딩 두 세개 정도가 합쳐져 있으며, 우리 학교처럼 수업을 듣기 위해 뛰어가는 일은 없습니다. 겨울날씨는 한국과 비슷하지만 바람이 매우 많이 붑니다. 그래서 학생들 사이에서 윈디 비너노이슈타트로 유명합니다.","우선 비너노이슈타트의 시내는 G버스라인으로 10분 정도 떨어진 곳에 위치합니다. 학생증을 제시하면 G라인만 무료로 이용할 수 있습니다. 시내에는 Billa, Spar라는 식료품점이 있습니다. 여행을 가기 위해선 기차역을 반드시 지나쳐야 하는데 기차역은 기숙사에서 버스로 5분 정도 떨어진 곳에 위치합니다. 역시 G라인을 이용하면 무료로 갈 수 있습니다. 하지만 G라인 버스는 저녁 7시에 끊깁니다. 아니면 기숙사에서 20분정도 걸으면 역시 Hoffer, Euro spar, 또 하나의 마트가 있습니다. 유럽에서 살면 살이 찌기 쉽기 때문에 일부러 산책 겸 장을 보러 걸어서 다녀오곤 했습니다.","기숙사는 세 개가 있습니다. 하지만 교환학생에게 배정되는 기숙사는 FH dorm으로써 시설이 뛰어나지는 않지만 교환학생끼리 모여 살기 때문에 같이 어울려 놀기 좋습니다. White dorm은 시설이 최신식입니다. 하지만 걸어서 5분 정도 떨어진 곳에 위치해 있기 때문에 교환학생들과 어울리기 불편합니다. 기숙사비는 매달 250유로입니다. 매달 1일까지 입금해야하며 3일 정도 늦게 내면 10유로 벌금이 있습니다. 첫달에 한학기의 기숙사비를 입금한 친구도 있었습니다. 방은 혼자 쓰며 다른 한명의 하우스메이트와 주방, 샤워실, 화장실을 같이 씁니다.
학교 주변에 차이니즈 부페가 있습니다. 9유로 정도 했으며 꽤 만족할 정도였습니다. 하지만 유럽에서 외식하기란 학생 입장에서 부담이 많이 가는 편이라, 대부분 만들어먹었습니다. 장을 봐서 만들어먹으면 식비를 굉장히 줄일 수 있습니다. 유럽에선 특히, 과일과 유제품이 싸서 즐겨 먹었습니다. WN(비너노이슈타트)에 저번학기에는 한국에서 온 교환학생이 6명 있었는데 같이 모여 한국 음식을 만들어 먹기도 하고, 때론 외국인 친구들을 불러 음식 소개도 하고 어울렸습니다. 시내에는 케밥집이 있으며 3~4유로 정도 합니다.","수업은 우리 학교에 비하면 평이한 수준이지만 전공과목이기 때문에 전공을 영어로 배우는 데 어려움이 있었습니다. 수업마다 책을 사야했던 과목이 있긴 했지만 대부분 PPT로 출력해서 보면 충분했습니다. 중간고사는 대부분 퀴즈로 봅니다. 비중은 2,30 퍼센트정도였고 기말고사가 중요했습니다. 팀 프로젝트가 있는 수업도 있는데 정규학생들이 정말 친절하게 잘 도와주었습니다. 그리고 교수님 대부분도 교환학생에게는 친절하게 대해주며 영어를 못 하는 것에 대한 배려가 많았습니다.","International office를 찾아가면 Claudia가 있는데, 정말 친절하고 상냥하게 잘 도와줍니다. 처음에 수강신청기간동안 IO에 갈 일이 많습니다. 온라인으로 수강신청을 하는 것이 아니라 클라우디아를 거쳐 해야 하기 때문에 처음에 많이 만나게 됩니다. 그리고 학교에서 주최하는 field trip도 클라우디아가 총괄합니다. 교환학생은 한 학기 동안 네번의 필드트립을 가게 됩니다. 꼭 가야 하는 것은 아니지만 참석하면 친구들과 더 친해질 수 있고, 오스트리아와 유럽에 대해 더 많은 경험을 할 수 있습니다.","학교에는 Buddy 시스템이 있습니다. 버디가 정해지면 버디가 공항에 마중을 나옵니다. 버디와 함께 기숙사로 와서 방배정 받는 것을 도와주고 오스트리아에 살면서 궁금한 것들을 물어보고 도움을 받을 수 있습니다. 저의 버디는 졸업반이었고 미국에 여행을 가는 바람에 많은 도움을 받을 수는 없었습니다. 그리고 두 번째로 Tandem시스템이 있습니다. 정규학생과 1:1로 언어교환을 하는 것인데 한국어를 가르쳐주고 배우고 싶은 언어를 선택해서 배울 수 있습니다. 배울 수 있는 언어로는 헝가리어, 독일어, 폴란드어, 영어 등 선택의 폭이 넓습니다. 문제는 그 친구들이 한국어를 많이 선택해주어야할텐데 말입니다. 저는 탄뎀 신청을 했지만 파트너랑 약속이 잘 안 맞아 한 번도 만나지 못 했습니다. 하지만 잘 활용한다면 많은 언어를 경험하는 데 좋습니다. 굳이 탄뎀 아니라도 수업에서 만난 친구와 사귀는 것이 더 좋습니다. 저는 반 친구로부터 지난 시험지들과 노트를 받을 수 있었습니다.","유럽 학생들 영어 정말 잘 해서 깜짝 놀랐습니다. 사실 영어권이 아니라 우리랑 비슷한 수준인 줄 알았으나, 발음은 미국식이 아니더라도 미국인 친구들과 의사소통하는데 전혀 어려움이 없을 정도로 잘 합니다. 그리고 기숙사에서 남녀생활을 같이 하다보니 유럽문화가 개방적이라는 게 실감이 났습니다.
기숙사에는 매달 마지막 수요일 Keller Party가 열립니다. 자신이 마실 맥주, 와인을 사서 춤을 추며 놀 수 있습니다. 무료이며 기숙사 지하에서 열리기 때문에 학교 친구들이 전부입니다. 첫 번째 파티를 가는 것이 중요합니다. 친구들과 사귈 수 있으며 뜻하지 않게 도움을 받을 수 있습니다. 저는 버스가 끊겨 WN 기차역에서 택시를 타려고 기다리고 있는데 파티에서 저를 보았다는 헝가리 친구가 저한테 다가와 택시비가 비싸니까 기차를 탈 수 있다며 알려주길래 기차를 타고 같이 기숙사로 돌아온 적이 있습니다. 덕분에 7유로 정도하는 택시비를 아낄 수 있었습니다. 기차는 1유로입니다.","비엔나에 한인교회가 있다고는 하나, 굳이 교회를 가지 않아도 되었습니다. 이미 지내고 있는 아시안 친구들이 밥솥, 토스트기, 전자레인지를 갖고 있어 필요할 때마다 빌려쓰곤 했습니다. 또한, 흔쾌히 빌려줍니다. 현지 학생들이 정말 착합니다. 문제가 있으면 도와주려고 하고 친하게 지낼 수 있습니다. 다만 아시아인이 흔하지 않기 때문에 먼저 못 다가오는 것일 수 있는데 우리가 먼저 다가가면 그들도 반갑게 맞아줍니다.","7시에 버스가 일찍 끊기기 때문에 기숙사로 돌아오려면 택시를 타야 하지만 돈을 아낄 수 있는 방법이 있습니다. WN기차역에서 국철S라인을 타면 기숙사까지 1유로에 올 수 있습니다. 기차는 1시간에 1대꼴로 있지만 시간만 잘 맞다면 돈을 아낄 수 있습니다. 시간표가 과목마다 Fixed돼 있지 않기 때문에 주말, 평일 망라하고 시간만 잘 활용하면 유럽 여행하기 정말 좋습니다. 저는 1학기 동안 유럽의 10개국을 돌고 왔습니다. 4월 중순쯤에는 부활절이 있어서 2주간 학교가 쉬었습니다. 가을 학기에도 2주간 방학이 있다고 들었습니다. 여행 중에 호스텔이나 민박에서 만난 사람들과도 쉽게 친구가 될 수 있습니다. 정말 평생에 다시 할 수 없는 경험을 만들고 왔습니다! 좋은 기회 놓치지 마세요!"
"학교가 있던 위치는 Wiener Neustadt 라는 지역입니다. 빈과는 차로는 40분, 기차로는 30분~1시간 정도 걸렸습니다. 학교는 그다지 규모는 크지 않지만 세 건물로 이루어져 있구요 학교 안에 모니터가 있어서 과목명과 강의실, 수업시간을 알려줍니다. 저는 2월부터 6월까지 머물렀는데요 겨울날씨는 우리나라랑 비슷합니다. 날이 따뜻해져도 바람이 좀 많이 불구요 우리나라처럼 봄 없이 바로 여름으로 넘어가지 않아요 봄 날씨가 참 좋았습니다.","Wiener Neustadt는 작은 도시인데요, 학교는 기숙사와 10분정도 거리에 위치해 있습니다. 학교와 기숙사는 걸어서 10분정도 거리에 위치해 있습니다. G버스라고 해서 학생증을 제시하면 무료로 이용할 수 있는 버스가 있습니다. 버스는 30분에 한대씩 운행합니다. 버스 타고 시내에 나가면 은행, 시청, 식료품점 등이 있습니다. 제가 머무는 동안은 날이 점점 풀리면서 시내중심지에서 종종 장이 열리곤 했습니다. 그리고 기차역과 시내도 멀지 않아서 기차역에서 시내 걸어가는 동안에도 음식점이나 쇼핑할 수 있는 상점들이 있습니다.","기숙사는 총 3건물이 있는데 건물 색에 따라서 white dorm, orange dorm, FH dorm으로 불립니다. 대부분의 교환학생들은 white dorm에 거주하고 있습니다. 기숙사는 방은 각자 사용하고 주방과 화장실을 공동시설입니다. 자신의 방 외에도 common room이라고 해서 전자레인지나 오븐 사용할 수 있는 곳이 있습니다. 저는 공유기를 가져가서 인터넷을 사용해서 속도가 그리 느리지 않은 편이었습니다. 식사는 주로 만들어 먹었습니다. 일주일에 한번 장보고 나서 파스타, 샌드위치, 피자 등 먹었습니다. 쌀은 1kg에 원화로 1500원 정도여서 쌀밥도 언제든 먹을수 있었습니다. 마트에서 구매해서 만들어 먹는 편이 쌌기 때문에 식당은 별로 안 간편이구요, 그치만 시내에 차이니즈 부페라든가 카페도 많은 편이었습니다","수업은 일주일에 한번 2시간 반에서 3시간반 정도였습니다. 가끔 발표수업이 있을때는 하루종일 듣는 수업도 있습니다. 저는 경제학 전공으로 가서 경제학 수업을 주로 들었는데 한 기업의 시장가치 분석하는 주제로 조모임도 하나 했었습니다.. 성적의 비중은 주로 시험이 차지합니다. 중간고사는 거의 없는 편이고 퀴즈를 본다든가 과제나 조모임으로 대체됩니다. 기말고사가 60%정도의 비중을 차지합니다. 수업시간이 바뀔경우에는 메일로 시간변경을 알려줍니다.
도서관은 작지만 수업에 필요한 책들은 구비되어 있습니다. 학생들이 도서관에서 별로 공부하지 않아서 그런지 한산한 편입니다.",국제처 직원분들은 매우 친절하십니다. 직접 방문하거나 메일로 문의하면 바로바로 답을 해주십니다. 처음에 수강신청도 도와주시고 사소한 부분도 잘 도와주십니다.,동아리 활동은 따로 있는 거 같지 않았습니다. 저는 tandem이라고 해서 언어교환 친구 만날 수 있었습니다. 학교 시설은 쾌적하구요 학교 1층에 인포센터가 따로 있는데 거기서 프린트 충전이라든가 학교시설에 대한 도움을 얻을 수 있습니다.,큰 문화충격은 없었습니다. 소소한 부분에서 다르구나 라고 느낀 점은 강의실마다 뒤쪽에 옷걸이가 있다는 점입니다. 우리나라는 강의실에서도 겉옷을 입고 있거나 자신의 무릎에 올려놓는데 여기는 학생들이 강의실 들어오면서 자연스럽게 겉옷을 옷걸이에 다 걸어놓고 앉아서 수업을 듣는다는 점이었습니다. 또 하나는 수업시간에 학생들이 정말 큰 소리로 코를 푼다는 점이었습니다. 교수님이 강의 하시고 있는 목소리보다 크게 코를 풀어도 아무도 신경 쓰지 않고 수업에 집중한다는 점이었습니다.,"저는 대부분 학교 국제처나 버디로부터 도움을 얻었습니다. 버디는 정규학생들이라서 학교관련부분이나 생활에 많은 도움을 주고요, 정규학생들인 경우는 교환학생들을 여러 부분에서 도와주려고 합니다.","처음에는 빈이라고 알고 있었는데 막상 가보니 빈이랑도 멀고 도시도 작아서 많이 실망했습니다. 하지만 도시와 멀었기 때문에 컸던 장점은 교환학생들과 정규학생들과 더욱 친해질 수 있다는 점입니다. 기숙사 복도에서 매일 마주치고 짧게나마 서로에게 인사하고 마주치던 모든 시간들이 참 기억에 남습니다. 또 오스트리아가 유럽의 중심부에 있어서 여행 다니기도 유리한 위치입니다. 학교에서 교환학생들을 대상으로 4번의 여행을 저렴하게 보내주어서 더욱 다양한 경험을 할 수 있었습니다. 외국인친구들과, 유럽 여행의 소중한 경험을 만들 수 있었던 즐거운 시간을 Wiener Neustadt에서의 교환학생생활이었습니다."
오스트리아의 수도인 비엔나에서 40분 정도 떨어진 위치에 있는 Wiener Neustadt라는 곳에 위치해 있습니다. 학교는 연세대학교의 공과대학 합쳐놓은 정도의 크기 입니다. 제가 있을 때가 겨울과 봄이 였는데 한국의 봄 겨울과 비슷하였습니다. 초여름에는 한국처럼 덥지 않고 선선한 날씨입니다.,Wiener Neustadt는 그리 크지 않은 도시입니다. 학교가 있는 주변에는 기숙사가 있고 15분정도 떨어진 위치에 쇼핑을 할 수 있는 곳이 있습니다. 학교주변에서 이용할만한 식당은 케밥집 하나정도 입니다. 버스를 타고 20분 정도 가면 도시의 중심가가 있습니다. 그곳에 은행과 시청 등이 있고 쇼핑할 만한 것들도 있습니다. 하지만 그리 크지는 않습니다. 시내까지 가는 버스는 학교학생증 소유시에는 무료입니다. 일요일은 제외 입니다. 버스는 일찍 시작해서 8시쯤에 끊깁니다.,"교환학생들은 모두 기숙사에서 생활 했습니다. 그곳의 정규학생들 중에서도 많은 학생들이 기숙사에 살았습니다. 학교에서 운영하는 기숙사가 아닌 사설기숙사였습니다. 기숙사는 두명이 각각의 방을 가지고 주방과 화장실을 share하는 형태였습니다. 각자 사용하는 방하나 크기는 매우 컸습니다. 기숙사가 인터넷이 느린것을 제외하고는 매우 마음에 들었습니다. 식사는 대부분 음식을 직접만들어 먹었습니다. 학교내에 식당이 있지만 가격이 싸지 않고 맛도 별로 입니다. 주변에는 식당이 없어서 대부분 직접 음식을 하고 친구들과 같이 먹거나 합니다. 아시아마켓이 비엔나에만 있기 때문에 대부분 끼니를 파스타나 샐러드, 피자, 빵 등으로 해결하였습니다. 15분 정도 걸으면 여러종류의 마트가 모여있습니다. 그곳에서 일주일에 한번정도 장을 보았습니다.
가끔 아시아 음식이 먹고싶으면 근처의 차이니즈식당을 가거나 비엔나에 가서 먹었습니다. 비엔나에는 아시아마켓이 있어서 그곳에서 재료를 사서 음식을 해먹을 때도 있었습니다.","수업은 우리나라와 완전 시스템이 다릅니다.
블락수업이라고 해서 하루종일 수업해서 3주에 끝나는 것도 있습니다.
그리고 어떠한 수업은 학기가 끝나기 한달전쯤에 시작하는 것도 있습니다.
이렇다 보니 중간고사 기말고사 기간이 수업마다 다릅니다.
연세대학교 수업에 비하면 워크로드가 크지 않습니다. 언어가 되면 수업을 따라가는 것은 어렵지 않습니다.도서관은 매우 작습니다. 수업에 필요한 책을 찾는 것은 어렵지 않습니다. 시험기간에도 자리는 거의 비어있습니다.",매우 친절한 직원들이 있습니다. 궁금한 것이 있거나 부탁이 있어서 방문할때마다 항상 반갑게 맞아주고 문제를 해결해 주었습니다.,따로 동아리 활동은 보지 못하였고 가끔 마음 맞는 친구들끼리 축구를 하기는 하였습니다. 학교 시설은 깨끗하고 좋습니다.,특별한 문화적 충격은 없었습니다.우리나라와 다르다고 생각한 것은 기숙사를 남여가 같이 사용할 수 있다는 것입니다. 커플인 친구들은 아에 방을 같이 쓰기도 하였습니다. 그리고 한국과 다르게 대부분의 샵이 오후 6시 쯤이면 문을 닫습니다. 관공서나 은행의 경우는 더욱 일찍 끝납니다. 오후 3시쯤이면 문을 닫습니다. 그래서 생활 주기가 빨라져야지 안그러면 문이 닫혀있어서 필요한 일을 하지 못하거나 장을 못보는 경우가 있습니다.,한인회나 교회한인회가 비엔나에 있습니다. 하지만 학교내에 버디시스템이 있어서 정규학생들이 많이 도와주고 대부분의 문제는 International Office에서 해결해 줍니다.,사실 처음 배정 받았을 때는 잘 알지 못하는 곳이고 작은 곳이여서 실망하였었습니다. 하지만 그곳에서의 한학기는 정말 잊지 못할 시간 이였고 저의 제 2의 고향이라고 말하고 싶은 곳이였습니다. 오스트리아가 9개나 되는 국가에 둘러싸인 나라인 만큼 그 학교에 다양한 국가의 학생들이 있었습니다. 그래서 더욱 많은 문화를 경험할 수 있었습니다. 그리고 여행을 정말로 많이 할 수 있었습니다. 교환학생의 목적이 공부보다는 여행이나 다양한 문화와의 만남이라면 Wiener Neustadt는 최고의 학교라고 생각합니다.
