gen_info,env_info,food_info,study_info,office_info,facil_info,mhct_info,help_info,etc_info
"FHWN은 비교적 작은 학교입니다. 빈까지는 기차를 타면 30분에서 40분 정도 소요됩니다. 기숙사에서 버스 타고 기차역까지 가는 시간을 포함하면 1시간 정도 걸린다고 생각하시면 됩니다. 헝가리 국경과도 근접해서, 헝가리 소프론까지는 금방 갈 수 있어요. 학교 근처 역은 civitasnova이고, 여기서 기차를 타면 중앙역에는 정말 금방(3분?) 도착합니다. 중앙역 말고도 역이 하나 더 있는데, 밤 늦게 비엔나에서 돌아올 때 그 역에서 내려서 기숙사까지 걸어오곤 했어요. 기차는 처음에 역에가서 20유로 정도 내고 학생으로 등록하면 더 싸게 이용하실 수 있습니다.저는 비너노이슈타트에서 가을과 겨울을 지냈는데, 한국과 기후가 비슷합니다. 9월, 10월에는 날씨가 좋았고, 11월부터는 추워지기 시작했던 것 같습니다. 유럽이다 보니 라디에이터가 있는데, 저는 추위를 많이 타기도 해서 방에 있으면 좀 추울 때도 있었습니다. 전기장판 얇은 거 가져가서 정말 유용하게 썼어요. 그리고 KIKA가서 커튼 사다가 다니까 바람 안들어오고 좋더라구요!","학교 주변에는 대학 건물과 기숙사 외에는 공장 건물과 마트들 뿐입니다. 약간 휄하다고 느낄 수는 있지만, 저는 조용하고 좋았어요. 하지만 G버스를 타고 10분, 15분 정도 가면 시내로 갈 수 있는데, 음식점, 옷가게, 시청 등등이 있습니다. G버스는 학생증이 있으면 무료이므로 장보러 갈 때나 시내에 나갈 때 G버스를 타시면 편하실 거예요.","기숙사는 2인 1실인데, 밖에서 문을 열고 들어가면 주방과 식탁이 있고, 또 문이 있어 방이 2개 더 있는 형태라 거의 혼자 방을 쓰는 거라고 생각하시면 됩니다. 주방, 욕실, 화장실을 두 명이서 공유하는 형태입니다. 보통 교환학생들은 White house 1층을 사용하는데, 한국인과 방을 쓰고 싶다면 기숙사 신청하실 때 적어 보내면 됩니다. 1층 바로 밑에 지하에 세탁실이 있는데, 세탁기 카드를 따로 만들어서 충전해서 써야해요. 처음에 은행에 가서 충전하면 됩니다. 그리고 지하에서 파티를 하는 경우에는 시끄러울 수 있어요. 저는 1층에 살지 않아서 몰랐지만 다른 친구들이 정말 시끄러웠다고 하더라고요. 하지만 매주 그런 건 아닌 것 같아요. 저는 같이 간 한국 친구 2명이 같은 방을 써서 그 방에서 항상 밥을 해먹었어요. 학교에서 사먹는 경우는 거의 없었고(약간 비싸고 맛도 그닥..이라는 생각이 들어서요!), 과일이나 식빵에 잼 발라서 도시락 싸 가지고 다니기도 했습니다.","수업 난이도나 로드는 그렇게 높은 편은 아닙니다. 독일어나 일부 강의를 제외하면 강의가 한 학기 내내 진행되는 경우는 드물어요. 9월에 끝나는 수업도 있고, 11월에 시작하는 강의도 있습니다. 시간표 잘 짜시면 여행 많이 다니실 수 있을거에요. 저는 10월에 수업이 거의 없어 여행하며 즐겁게 시간 보냈습니다. :) 시험은 족보와 비슷하게 나오는 경우가 많으니 페이스북에서 자료 잘 얻어서 공부하세요. 정규학생들이 족보 다 공유하는 편이더라고요!","워낙 교환학생 제도가 활발히 시행되고 있고, 매 학기 오는 교환학생들도 많다보니 국제교육부가 체계적으로 잘 조직되어있습니다. 궁금한 게 있거나 도움이 필요한 부분이 있을 때 국제교육부에 가서 이야기 하시면 친절히 안내해주실거에요. 학기에 4번 정도 여러 활동들을 준비해주는데, 9월에는 다 같이 버스타고 할슈타트 다녀왔어요. 볼프강에서 유람선도 타고요! 이런 것들은 여행자로 왔으면 경험하지 못했을 것 같다는 생각이 들었습니다. 그리고 재학생 중에서 버디들이 있는데, 생활하는 동안 정말 친절히 잘 도와줄거에요. 학교 생활할 때도 자주 보고, 따로 만나서 밥을 먹기도 하고, 국제교육부에서 주최하는 activity에 동행해서 많은 부분을 도와줍니다. (처음 빈 도착할 때 버디가 데리러 나와요!)",,,,혹시 더 궁금하신게 있으시다면 mjmj802@gmail.com으로 연락주세요!
"FHWN의 규모는 작은 편입니다. 특정 몇몇 학과만 있다보니 건물 개수도 많지 않고, 금방 구조를 익히실 수 있습니다. 오스트리아 자체가 유럽 가운데에 있다보니 여행하기 매우 편리했고, 날씨는 다소 흐릴 때가 많았습니다.","비너노이슈타트는 수도인 빈에서 약 40분 정도 떨어져 있는 작은 마을입니다. 학교와 기숙사는 8-10분이면 갈 수 있고 주변에는 사실 유럽이라고 느껴지지는 않을 만큼, 갈대와 공장 몇 개 정도밖에 없어요 그래도 조금 걷거나 학생증이 있으면 무료로 탈 수 있는 G버스를 타면 마트도 금방 갈 수 있고, 도시의 가장 중심부인 City center까지도 15분 정도면 갈 수 있습니다. City center에서 5분 정도면 중앙기차역(Haupbahnhof)도 갈 수 있어서 아마 지내시는 동안 거의 이 G버스만 이용하셔도 될 거에요. 학생증만 있으면 무료이니 매우 편리합니다. 가끔 버스가 늦게 오기도 하니까 여행을 목적으로 중앙역 가실 때에는 넉넉히 시간을 잡고 가시는 것을 추천합니다. 버스보다 빠른 교통수단은 기차가 있는데요. 학교 뒷편으로 Civitasnova라는 간이역?이 있어요. OBB 어플리케이션에서 출발을 Civitasnova로 하시면 중앙역에 2분만에 도착할 수 있습니다. 빈에 갈 때 두 번 구매하시지 마시고 아예 출발을 civitasnova로 잡고 예매하시면 더 저렴해요. 저희의 경우에는 중앙역을 갈 때는 기차를 이용했고, city center나 마트를 갈 때에는 G버스를 애용했습니다.","기숙사는 유럽 대부분이 그렇듯 학교에서 직접 운영하는 것이 아니라 Wihast라는 업체에서 따로 운영을 합니다. Reception desk는 오전9시부터 오후1시까지 열려있는 것으로 알고 있고, 이곳에서 기숙사비 납부, 건의사항 등의 업무를 볼 수 있습니다. 입사 전 한국에서 미리 보증금+첫 달 기숙사비를 보내고, 나머지 기간 에는 현금으로 직접 납부했습니다. 마지막에 방 안을 꼼꼼하게 검사하신 뒤 이상이 없으면 청소비를 제외한 보증금을 돌려주십니다. 보통 기숙사 1층에서 교환학생들이 함께 생활하게 되고, 1층에는 공용주방 1개가 있습니다. 여기서 음식을 하기도 하고 간단한 파티를 열기도 해요. 기숙사 지하에는 세탁실과 클럽이 있습니다. 크고 좋은 시설은 아니지만 학생들이 운영하는 클럽이라 행사가 있을 때나 특정 요일에 개방하여 놀 수 있게 된 곳입니다. 파티에 참여하지 않을 때에는 시끄럽다고 느끼실 수 있어요ㅠㅠ기숙사 방은 아주 만족스러웠습니다! 일단 2인 1실이라고는 하지만 각자 방에 또 방문이 있어서 1인 1실을 쓰는 기분이에요. 처음에 첫 방문을 열면 작은 주방과 선반, 테이블이 나오고, 각자 방 문이 따로 2개 있습니다. 그리고 변기만 갖춰진 화장실과 세면대, 샤워실이 있는 화장실이 따로 있어서 이것도 무척 편리했습니다. 방은 혼자 쓰기에 크기가 넓은 편이고, 옷장과 수납장, 침대, 책상과 서랍이 있습니다. 저는 한국인 언니와 같이 방을 썼는데요. 알고 보니 룸메이트 언니는 기숙사 지원할 때 한국인과 방을 쓰고 싶다고 미리 말을 했다고 하더라구요. 미리 말씀드리면 고려해주시는 것 같습니다. 교환학생 생활을 하면서 직접 요리를 많이 하게 됐는데 들 다 한국인이다보니 저희 방에서 한식을 거의 매일 해먹을 수 있었어요.","수강신청의 경우에는 개강하고 1주일 정도의 기간 동안 얼마든지 바꿀 수 있어요. 연세대학교처럼 월/수/금 이렇게 정기적으로 수업시간표가 나오지는 않고, 크게 한 학기를 3semester로 나눠서 한 학기 내내 정해진 시간에 하는 수업도 있고, 한 달에 몰아서 끝나는 수업도 있습니다. 학교 홈페이지에서 월별 시간표를 보시며 날짜를 잘 조율하시면 여행도 더 자주 다니실 수 있을 거에요. 수업은 모두 영어로 진행되고 독일어기초, Intercultural business skill, introduction to Austria와 같은 수업 이외에는 현지 학생들과 교환학생들이 같이 듣게 됩니다. 전반적으로 독일어 선생님이 영어가 조금 약하셔서 독일어를 독일어로 가르치시다시피 하셨던 것 빼고 나머지 수업의 강의는 좋았던 것 같아요. 시간표 자체가 한국에 비해서 빽빽하지 않고, 8번 만에 끝나는 수업도 있어서 수업에 대한 부담은 적은 편이었습니다.",국제처에서 모든 것을 친절히 도와주십니다!!,,,,"전반적으로 부담스럽지 않은 수업 강도와 오스트리아의 지리적 위치 덕분에 여행도 자주 다닐 수 있었고, 기숙사 방도 넓고 좋아서 무척 만족스러운 교환학기였습니다. 학교 주변에만 머무르는 평일에는 유럽에 있다는 느낌이 살짝 들지 않을 수도 있지만...기차만 타면 빈까지 매우 가깝기 때문에 끝날 즈음에는 거의 일주일에 2번씩 빈으로 놀러갔던 것 같아요! 혹시 필요하시다면 answltn1960@naver.com으로 연락주시면 제가 아는 선에서 답해 드리겠습니다!"
"FHWN은 많이 큰 규모의 대학교는 아니에요~! 경제경영 직렬은 BCI라는 단과대로 분류되어 있는데 사실상 다른 단과대랑은 거의 교류가 없기 때문에 (간혹 기숙사에서 정규학생인 공대 친구들을 볼 수도 있겠지만...) 총 학생이 200명인 대학교에 다닌다고 상상하시면 될 것 같습니다. 그래서 세부전공인 HR, Marketing, Finance이 같은 친구들과는 거의 시간표가 겹치게 됩니다. 저는 이게 오히려 장점이라고 생각했던 것이 한 학기만 다녀도 정말 많은 정규학생 친구들을 알게 되고 친해지게 돼요. 덕분에 적응의 문제가 의외로 쉽게 해결되어서 정말 좋았습니다. 날씨는 Windy Neustadt 라고 할 정도로 바람이 많이 불어요! 저는 처음에 태풍이 온 줄 알았습니다ㅜㅜ 봄 학기였는데도 5월 중순까지는 꽤 추웠으니 따뜻한 옷을 많이 챙겨가면 좋을 것 같습니다. 지리적으로는 비엔나 근교지만 아주 가깝지는 않습니다. 우리나라의 일산 같은 거리이지만 문제는 기차를 타고 가야하기 때문에 교통비가 꽤 많이 듭니다. youth할인을 받아도 왕복이 약 10유로이니 비엔나에 생각만큼 자주 나가지는 않게 됩니다! (저는 맨날 갈 줄 알았어요...) 비너노이슈타트는 소도시 느낌인데 시티센터와 쇼핑센터에 나름 먹거리와 놀거리가 있어서 그래도 즐겁게 놀 수 있습니다. city center에서 엄청 맛있는 젤라또를 1유로에 (여름에는 1.2유로) 팔고 있으니 참고하시면 더 즐겁게 지낼 수 있습니당! 그리고 헝가리와 지리적으로 인접해 있어서 비엔나 가는 거리와 헝가리 소포론 가는 거리가 거의 같습니다. 이 이외에도 동유럽은 기차나 버스로 싸게 금방 갈 수 있어서 여행하기에는 최적의 위치입니다.","가시거리 안에서는 정말 딱 대학교랑 기숙사 밖에 없어요. 그렇지만 20분 정도 걸으면 장 볼 수 있는 마트(LIDL)랑 드럭스토어가 있습니다. 맥도날드랑 버거킹이랑 수영장도 가까이 있습니다. G 버스라는 학생 무료 버스를 타면 시티센터에 갈 수 있고 시티센터에는 더 많은 마트(BILLA , SPAR)와 옷가게, 음식점, 바 등등이 있습니다. 쇼핑센터에 일식집도 있어서 가끔씩 오는 아시아 음식에 대한 그리움을 잘 달랬습니다! 기차역은 G버스로 가는 비너노이슈타트 중앙역과 간이역 같이 생긴 도보거리에 있는 역이 있어서 교통편은 크게 걱정하지 않으셔도 될 것 같아요ㅎㅎ","기숙사 내에는 공용주방과 룸메와 같이 나눠쓰는 2인 1실 내의 작은 주방이 있습니다. 학식이 맛있기는 한데 8000원~10000원 대라서 정규학생들도 자주 먹는 분위기는 아니고, 같이 만들어 먹거나 도시락을 싸와서 먹는 경우가 많습니다. 그렇지만 같이 음식을 요리하면서 친해지기도 하니까 오히려 장점이 될 수도 있는 것 같아요. 거주 형태는 2인 1실인데 각각 개인실을 쓰고 둘이서 화장실과 샤워실, 미니 주방과 냉장고를 공유하는 방식입니다. 그리고 교환학생들은 모두 한 층을 같이 써서 모여서 놀기에 편하고 좋습니다.","처음에 가면 수강신청을 1주일동안 정정할 수 있습니다. 그리고 좋은 점이, 수강인원에 구애받지 않고 자유롭게 신청, 취소를 하며 조정할 수 있어요. 단, 세부전공이 다른 수업은 서로 겹칠 수가 있어서 주의가 필요합니다. 수업은 매 주마다 시간표가 다르게 나옵니다. 저 같은 경우에는 6월 1주 동안 5시간씩 해서 끝내는 초단기 수업도 있었어요. 그리고 교환학생들은 교환학생용 독일어 과목을 듣게 되는데 (독일어를 독일어로 수업하시지만 또 반복해서 듣다보니까 어떻게 이해가 되기는 합니다ㅜㅜ) 차근차근 알려주시고 activity가 많아서 잘 배울 수 있습니다. 마트 직원분이나 택시 운전기사 분 등등과 대화 할 때 의외로 영어가 잘 안 통하는 경우가 많아서 독일어 과목은 굉장히 유용합니다. 교환학생들끼리 친해지기에도 좋구요. 나머지 수업들은 모두 영어로 진행되고, 학생들이나 교수님 모두 영어를 잘하므로 언어 부분은 크게 걱정하지 않아도 됩니다! 시험도 어렵지 않아요. 도서관에서는 우리나라와 다르게 도서 무한 연장이 가능해서, 마음만 먹으면 한 학기 내내 책을 빌리는 경우도 가능합니다. 엄청 좋은 책 스캐너도 있어서 30분 내에 책 한권을 스캔할 수도 있습니다. (물론 상업적 유통을 하면 불법입니다...)","국제처에서 4번의 당일치기 활동을 주관합니다. 제가 있을 때는 스케이팅, 할슈타트&잘츠부르크 여행, 양궁체험, 래프팅이었는데 학기마다 조금씩 달라질 수도 있을 것 같아요. 국제처에는 담당 선생님께서 계시고 언제든지 친절하게 도움을 받을 수 있습니다. 교환학생들이 수강신청 및 정정이 가능한 곳도 국제처입니다.","기숙사 지하에 파티를 할 수 있는 장소가 있고, 기숙사 바로 옆에 수영장이 있어요. 작은 규모지만 유수풀 1개 (진짜 작아요...강강 수월래 하는 것처럼 보일 정도로요ㅎㅎ), 슬라이드 한개도 있어요. 또 공용주방에서 종종 모여서 생일파티도 해서 좋습니다. 동아리는 financial club이외에는 교환학생들이 참여하는 걸 보지는 못했지만 존재하는 것 같습니다!","담배를 공공장소에서 필 수 있게 되어있어서 (금지법안이 2018년 즈음에 시행된다고 합니다!) 생각보다 간접흡연을 많이 겪게 돼요. 예를 들어 파티를 하거나 정규학생 친구들과 놀 때면 자리를 비키지 않고 흡연을 합니다. 그렇지만 상대방을 무시하는 게 아니라, 오스트리아에서는 그 것이 괜찮다고 여겨지는 분위기이기 때문이므로 너무 충격받지는 않으셨으면 좋겠어요ㅜㅜ","교내에서는 국제처에서 도움을 받을 수 있고, 기숙사 내부가 고장 났을 때는 기숙사 관리실에 말씀드리면 도움을 받을 수  있습니다.",^^
"비너노이슈타트라는 도시는 오스트리아 비엔나에서 대략 1시간 정도 떨어져 있는 곳입니다. (빠른 기차는 30분도 걸리지만, 기차역까지 가고 하는 시간 등을 모두 계산해보면 편도에 대략 1시간) 따라서 빈에 자주 다녀올 수 있는 장점이 가장 크다고 할 수 있습니다. 학교 건물은 우리 학교 상대, 상대 별관 정도로 상당히 작은 편입니다. 그래도 도서관이랑 식당 등 있을 건 다 있는 편입니다. 오스트리아 자체가 상당히 날씨가 기복이 심하지만, 전반적으로는 우리나라와 기후가 비슷하다고 할 수 있습니다. 저는 가을 학기에 갔는데 첫 1~2주는 등이 타들어갈 것처럼 덥다가 그 다음 몇 주는 패딩 입어야 할 정도로 매우 추웠습니다. 학교에서 시내까지는 학교 앞에서 마을 버스같은 것을 타고 10~15분 정도 걸립니다. 걸어서는 한 50분? 오가는 버스가 하나밖에 없는데다가 걸어서 가기 힘든 정도라 그렇게 자주 가게 되지는 않습니다. 그래도 학교랑 기숙사 주변을 보면 정말 촌동네같지만 시내를 가면 있을 건 다 있어서 생필품, 옷 등을 구매하는 데는 거의 아무 문제가 없습니다.","대학 주변에는 거의 친환경 공장, 회사들만 있고 아무것도 없습니다. 한 15분 거리?에 맥도날드랑 버거킹 있고, 저렴한 아시안 뷔페도 하나 있습니다. 마트랑 영화관 모여 있는 곳도 걸어갈 수 있는 거리에 있기는 합니다. 만약 수려한 자연환경에 둘러싸인 오스트리아의 시골 마을을 생각하고 오신다면 오산입니다. 하지만 빈이랑 가깝다는 점 하나만으로도 가치가 있다고 생각합니다.","거주 형태는 학교에서 십분거리에 있는 기숙사에서 모든 국제학생들이 한 층에 거주합니다. 방은 침대랑 책상 있는 방에서 혼자 생활하고 룸메이트랑 부엌이랑 화장실, 샤워실을 같이 씁니다. 혹시 룸메이트가 외국인이길 원한다면 미리 기숙사비 낼 때 따로 말하는 게 좋을 것 같네요, 저는 아무 말도 안했더니 한국 사람이랑 지정이 되었어요. 원래 같은 문화권끼리 거의 다 묶어주나봐요. 식사는 기숙사 주변에 먹을 곳이 별로 없고 시내에 나가도 가격이 비싸다 보니 거의 마트에서 식료품 사와서 해먹습니다. 식료품도 우리나라보다 싼 건 싸고 비슷하구요.","전공 수업은 거의 다 경영학 수업이고, 꽤 다양하게 열리는 편입니다. 특이한 점은 교양이 경영관련이나 언어 관련된 것밖에 없습니다. 우리나 미국학교처럼 운동이나 취미, 이런 거 관련된 교양 수업이 없습니다. 전체 교환학생이 40명도 안되기 때문에, 각 수업마다 교환학생들을 많이 배려해주는 편인 것 같습니다. 수업을 정규학생들과 같이 듣지만, 교수님도 학생들도 교환학생이라는 점을 인지하고 대해주기 때문에, 크게 부담을 갖지 않아도 될 것 같습니다. 수업의 질도 사실 상당히 좋은 편인 것 같습니다. 특히 교수님들이 대부분 실무 경험이 많다보니 경영학의 특성상 그런 면에서 이점이 있는 것 같습니다. 도서관은 우리학교 도서관에 비해면 굉장히 작지만 깔끔하게 잘 해놔서 공부하기 좋습니다.","학교측 국제처에서 교환학생들을 위해 여러 행사나 excursion을 많이 준비합니다. 행사에서는 본인 나라 음식을 해서 소개하고 하는 활동을 주로 했습니다. 그래서 각 나라 음식들을 다양하게 뷔페처럼 먹어볼 수 있는 시간이 있었는데, 좋은 경험이었습니다. 그리고 네 번의 excursion의 경우, 프로그램 상으로는 상당히 부실했던 면들이 있었지만, 교환학생들끼리 시간을 함께 보낸다는 것만으로도 참여의 가치는 있었습니다.",동아리 같은 건 거의 없는 듯합니다. 돈을 지불하고 야외 활동 같은 걸 하는 프로그램은 있었습니다.,"생각했던 것보다 문화적으로 충격을 받은 일은 없었던 것 같네요. 외국 학생들도 정말 술먹고 놀러다니는 걸 좋아하는구나를 느꼈습니다. 거의 매주 파티 나잇이 있고, 기숙사 휴게실에서 술도 많이 먹습니다. 놀랐던 건 기숙사 자판기에서 술을 판다는 점?","국제처의 claudia한테 메일을 보내면, 거의 근무 시간에는 바로바로 답장이 오는 편입니다. 버디도 정해지는데, 제 버디의 경우, 기숙사 생활하는데 정말 많은 것을 도와주었습니다. 방에 커튼 다는 걸 버디네 엄마가 와서 저렴한 커튼 고르고 다는 것까지 일일이 다 도와줄 정도였어요.","사실 애초에 오스트리아로, 더구나 이 학교로 교환학생을 오게 될 줄은 몰랐습니다. 다른 곳이 다 떨어지고 여기에 오고 나서 자연 경관이 좋지도 않고 주변에 할 것도 정말 없는 곳이라 실망도 했었던 것 같네요. 그런데 생활하다보니 이곳의 정말 큰 장점은 오스트리아의 수도인 비엔나에 교통수단을 이용해서 정말 간편하게 오갈 수 있다는 점입니다. 우리나라 수도권에서 서울 왔다갔다 하는 느낌이에요. 그래서 비너노이슈타트 생활하는 동안 빈에도 정말 많이 다녀왔고, 주변 국가 여행도 정말 많이 했습니다. 오스트리아 빈에 살지는 못하지만 빈을 정말 느껴보고 싶은 사람이라면 이 학교를 추천하겠습니다.궁금한 것이 있다면 sjcho9311@gmail.com으로 연락주세요."
