gen_info,env_info,food_info,study_info,office_info,facil_info,mhct_info,help_info,etc_info
"Karl-Franzens-Universitat Graz 대학교는 오스트리아 Graz라는 도시에 있는 city based 대학교입니다. 도시 Graz는 비엔나 다음으로 오스트리아에서 가장 큰 도시로, 오스트리아 제 2의 도시입니다. 수도 비엔나보다 남쪽서쪽에 위치한 Graz는 비엔나에서 기차로 2시간 반 정도 걸립니다. 대학교는 Graz 도시 전체에 캠퍼스가 퍼져 있기 때문에 그 크기를 연세대학교와 비교할 수는 없지만, 제가 있었던 Karl-Franzens-Universitat는 인문대학으로 연세대학교 경영대 사과대 문과대 정도를 합친 크기가 될 것 같습니다. 생각보다 규모는 작았습니다. 기후는 생각보다 좋았습니다. 겨울은 춥기도 하지만, 한국만큼 강추위는 아니었습니다. 6~7월에도 정오를 기준으로 햇볕만 매우 강하게 내리쬘 뿐 밤에는 선선한 날씨였습니다. 비는 예보 없이 내리기도 합니다만 해를 볼 수 있는 맑은 날씨가 대부분이었습니다. 때문인지 건성 피부를 가진 저에게 오스트리아는 너무나도 건조한 곳이었습니다. 하지만 장마철 눅눅한 한국보다는 선선해서 좋았습니다. 날씨는 건조한 점만 제외하면 정말 최고였습니다.","사실 오스트리아 제 2의 도시라고는 하지만 생각보다 매우 작습니다. 대학 주변에는 1~4층의 낮은 건물이 주를 이루고, 식당과 바 등이 있습니다. 도시 중심부는 학교에서 15~20분이면 도착할 수 있습니다. 우리나라 중심가처럼 크고 화려한 번화가는 아니지만, 웬만한 것들은 구할 수 있을 정도로 필요한 것들이 잘 갖추어져 있습니다. 유럽의 아기자기한 풍경과 거리 모습이 아름다운 곳이 많습니다.
또한 음악의 나라라고 불리는 오스트리아는 음악을 접할 수 있는 기회가 많습니다. 오케스트라나 트리오, 솔로 등 전 세계적으로 유명한 아티스트들의 연주를 싼 가격에 관람할 수 있습니다. 또한 오페라나 뮤지컬도 너무 대중화가 되어있어서 이것 역시 싼 가격에 공연을 관람할 수 있다는 장점이 있습니다.","저는 ISEP으로 파견되었기 때문에 학교에서 제공해주는 기숙사에서 살았습니다. 그렇기 때문에 기숙사 가격에 대한 정보는 자세히 모릅니다. 도시 전체에 대학교 캠퍼스가 있는 city-based 캠퍼스이기 때문에 우리 학교처럼 따로 기숙사 위치가 정해져 있지는 않고 도시 전체에 퍼져있습니다. 저는 WIST라는 기숙사에서 살았습니다. 외국인 룸메이트와 함께 지냈습니다. 기숙사가 아파트처럼 되어 있는데, 기숙사 한 호실에 6명 정도 살고 있습니다. 한 호실에 방이 5개 정도 있고, 부엌 1개, 화장실 2개가 구비되어 있습니다. 제가 살던 호실에는 제 방만 2인실이었고, 나머지 방 4개는 다 1인실이었습니다. 화장실은 3명당 1개를 사용하였습니다.
가장 주의해야 할 점은 모든 숙식을 스스로 해결해야 한다는 점입니다. 저는 처음에 기숙사 밑에 학교 식당 같은 게 있을 거라고 생각하고 갔었습니다. 하지만 말만 기숙사지 아파트와 다름없습니다. 지하에 세탁실과 운동 시설 등이 갖추어져 있지만, 식당은 없습니다. 고로 모든 음식은 자신이 직접 만들어서 먹어야 합니다. 그리고 주변에 딱히 먹을 만한 식당이 있는 것도 아닙니다. 교환을 가기 전 오스트리아로 교환학생을 나갔던 사람이 밥솥을 챙겨가라고 하기에 챙겨 왔던 것이 큰 도움이 되었습니다. 현지 음식을 사먹거나 자신이 직접 요리를 해 먹어야 하기 때문에 생각보다 불편하지만 요리 실력은 일취월장 한답니다. 뿐만 아니라 한국처럼 외식 문화가 발달하지도 않아서 외식할 만한 식당도 거의 없습니다. 고로 전 제가 짬뽕과 같은 음식을 먹고 싶을 때는 순전히 제가 만들어서 먹어야만 했습니다. 또한 중국 상회가 존재해서 간단하게 라면이나 간장, 고추장, 된장 등은 살 수 가 있습니다만, 더 이상의 물품은 구할 수가 없습니다. 저는 엄마가 거의 다 부쳐주셨습니다. 음식 부분이 가장 힘들었던 것 같습니다. 그 외에 의주(衣住)에서는 크게 어려움이 없었습니다.","신문방송학과가 없었기 때문에 저는 경영학부와 영어학부로 교환을 신청하였습니다. 그래서 현지 학생들과 교환학생들과 영어 수업을 많이 들었습니다. 미국 문화와 역사라는 과목이라든지 영어 작문 수업 등을 수강하였습니다. 저는 독일어를 하나도 공부하지 않아서 독일어로 진행하는 수업은 듣지 않고, 모두 영어로 진행하는 수업만 신청하여 들었습니다. 저는 한 학기동안 6과목 정도를 수강하였지만, 수업 시간이 한국과 비교하여 적기 때문에 10학점 정도 인정될 것 같습니다. 수업 수준은 한국과 비교하면 좀 낮습니다. 비교적 쉬운 주제로 수업이 진행됩니다. 제가 영어 관련 수업을 주로 수강해서 그런지는 모르겠습니다만 다 쉽고 흥미를 끌만한 수업들이 대부분이어서 고등학교에 온 착각이 들 정도였습니다. 공대 쪽은 한국과 비슷한 수준이라는 얘기를 듣긴 했습니다만 인문학부는 우리학교와 비교하면 수준이 낮은 것 같습니다. 
그리고 한 가지 주의해야 할 점이 있습니다. 1년을 교환 오시는 분들은 아마 학점 인정에서 불리하실 것입니다. 저는 모두 교양으로 인정되는 수업을 들었습니다. 그럴 수밖에 없었던 것은 우선 신문방송이 아닌 다른 전공학부로 신청했다는 것이 일차적일 것 같습니다. 하지만 부전공으로 경영을 하고 있었기 때문에 경영 관련 과목을 수강하여 대체 인정을 받으려 했으나 master 과정이기 때문에 수강할 수 없었습니다. 제가 수강을 희망했던 경영대학 과목이 우리 대학에서는 3000 단위로 그렇게 어려운 수업이 아니며, 학부에서 진행되는 수업이었는데, 이곳에서는 master 과정이기 때문에 제가 들을 수 없다고 했습니다. 결국 우리 학교 경영 과목과 과목명과 커리큘럼이 겹치는 그 수업을 수강할 수 없었습니다. 또한 그 과목 외에는 더 이상  대체 인정이 되는 경영 수업도 없었기 때문에 저는 모든 수업을 교양으로 인정되는 수업만 들을 수밖에 없었습니다.
또한 수강신청 시스템도 큰 변수로 작용할 수 있습니다. 제가 처음에 수강신청에 관련된 정보를 현지 대학에서 들었을 때는 선착순이 아니기 때문에 신청만 하면 된다고 하더군요. 그래서 전 제가 원하는 과목을 모두 신청했습니다. 하지만 confirmed 이 뜬 과목은 전체 과목 중 1/2 밖에 없었고, 나머지 수업은 수업 첫 시간에 찾아 가서 교수님과 면담을 해서 결정해야 한다고 했습니다. 첫 수업시간에 인기 강좌는 정말 많은 인원이 왔고, 교수님은 confirmed 이 뜨지 않은 학생들 중에 1/5 정도만 호명하여 수업에 넣어 주겠다고 하시더니 나머지는 나가라고 하더군요. 전 교환학생이라고 사정을 이야기 했지만 소용이 없었습니다. 차라리 선착순이 훨씬 공정하다는 생각이 들었습니다. 호명된 학생들만 왜 수강이 가능한지 정당한 이유도 알려주지 않았습니다. 어떠한 방식으로 수강신청이 정해지는지 몰라도 좀 황당한 시스템이었습니다. 그래서 전 결국 1/3에 해당하는 과목에서 모두 수강 거절을 당하였고, 결국 10학점 정도 밖에 수강을 할 수가 없었습니다. 그렇기 때문에 졸업을 앞둔 분들은 좀 생각을 해보시고 가시는 게 현명할 것 같습니다.

도서관 등 학교 시설은 우리 학교와 비교하면 좀 낡았습니다. 교실도 연세대처럼 대형 강의실이 거의 없습니다. 하지만 공부하기에는 무리가 없습니다. 중앙 도서관 외에도 경영대, 영문학부 도서관 등이 있어서 공부하기는 편합니다. 하지만 우리 학교처럼 크고 웅장하고 현대 시설이 갖추어진 도서관은 아니라는 점입니다. 비교적 낮고 아담한 건물로 캠퍼스가 이뤄져 있으며 정말 평화로운 분위기의 캠퍼스를 느끼실 수 있습니다.",학교 1층에 국제 학부가 있습니다. Christa 라는 교환학생 담당 선생님이 계시는데 매우 친절하십니다. 저도 그 선생님께 많은 도움을 받았습니다. 질문이 있으면 바로 찾아가신다면 아주 친절하게 답해 주십니다.,"저는 처음에는 교환학생들과 놀았습니다. 동아리 같은 것은 많지 않아서, 국제처 기관에서 학생들이 주최하는 파티에 주로 참석하였습니다. 4월쯤에는 합창 동아리에 들어가기도 했습니다만 대체적으로 동아리 시스템이 활성화 되어있지는 않습니다. 대부분이 교환학생을 위주로 열리는 행사에 참석하는 방식으로 교외 활동이 진행됩니다.","특별히 문화충격을 받은 적은 없습니다. 단지 한국보다 개방적이라는 것과 파티가 많다는 것이었지만, 파티는 그냥 우리가 친한 친구나 선배, 후배가 모여서 친목 도모의 자리를 가지는 것과 비슷한 개념으로 이해하시면 좋겠습니다.",국제처에 학생들이 운영하는 ESL이라는 동아리가 있습니다. 그 동아리에서 많은 도움을 받으실 수 있습니다. 또한 위에서 언급한 국제처 담당 선생님도 매우 친절하십니다. 한인회가 존재한다는 것 같았습니다만 한국 사람이 많지 않아서 한국 사람들을 만나기 쉽지 않을 뿐 아니라 도움을 받기도 쉽지는 않습니다. 우선 학교 측에서 도움을 받는 것이 가장 좋은 방법일 것 같습니다. Graz에 있는 한인 대부분은 음대 대학생과 대학원생들이기 때문에 한국 사람들에게 도움을 받으시려면 음대 쪽에 문의하시면 되는 걸로 알고 있습니다.,"오스트리아는 독일어를 모국어로 사용하는 나라입니다. 물론 독일에서 쓰는 독일어와 단어 측면에서 살짝 다르기는 합니다만 독일에서 사용하는 독일어를 구사한다 하더라도 큰 문제는 되지 않습니다. 전반적으로 고학력자는 영어에 매우 유창하지만, 오스트리아에 이민을 와서 사는 노동자 분들(버스 기사나 택시 운전사, 마트 직원)은 영어를 아예 알아듣지 못합니다. 그러므로 간단한 생활 독일어는 숙지하고 가시는 게 좋습니다. 저는 독일어 Hallo 하나만 알고 갔더니 처음에 매우 힘든 점이 많았습니다. 물론 수업은 영어로 진행되는 수업이 많기 때문에 독일어 부담은 가지지 않으셔도 됩니다. 그러므로 기본적인 독일어만 숙지하고 가신다면 수업을 듣는 것에서나 생활하시는 점에서나 큰 문제점은 없으실 거라고 봅니다. 
가장 좋았던 점은 바로 여행이었습니다. 유럽의 중심부에 위치한 오스트리아는 여행을 하기에 매우 좋은 나라입니다. 스위스, 독일, 이탈리아와 국경이 맞닿아 있어서 접근성이 좋으며, 이 나라들 외에도 저가 항공사 비행기를 통해 영국, 스페인 프랑스도 문안하게 다녀올 수 있습니다. 뿐만 아니라 동유럽과도 지리상 매우 가까워서 기차나 버스로 매우 쉽게 다녀올 수 있습니다. 교환학생을 나가신다면 유럽의 문화를 경험하고 여행으로 견문을 넓히는 좋은 기회가 될 것입니다.
마지막으로, 제가 우리학교에서는 처음으로 이 대학에 배정받아서 사전 정보가 없다보니 다른 곳으로 파견 나가는 교환학생보다 많이 힘들었습니다. 그래서 무조건 좋은 점 보다는 주의하셔야 할 점들을 위주로 적었는데, 이 글을 통해서 다음에 파견되는 분들께 도움이 되었으면 합니다. 혹시 궁금한 점이 있으시다면 메일로 문의주세요."
