gen_info,env_info,food_info,study_info,office_info,facil_info,mhct_info,help_info,etc_info
"학교의 공식 이름은 팍혹슐레 비너노이슈타트(Fachhochschule Wiener Neustadt, 이하 FH)입니다. 비너노이슈타트에 있는 전문고등교육기관이란 뜻으로 경영, 공대 등의 실용적인 학문만을 가르치는 대학교입니다. 비너노이슈타트(Wiener Neustadt)는 도시 이름인데 독일어로 ‘빈의 신도시’라는 뜻입니다. 하지만 한국의 신도시와 같은 개념이 아니고 1100년대에 건설된 신도시입니다. 그래서 빈 보다는 오래된 건물들이 많지 않지만 작고 아기자기한 도시입니다. 비너노이슈타트는 오스트리아의 수도인 빈에서 차로 30분, 전철(S-Bahn 1, 2 ; Schnell Bahn, )로는 1시간, 기차(REX 혹은 Regional)로는 20~30분 정도가 걸립니다. 요금은 26세이하면 기차할인카드(OeBB Vorteilscard)를 20유로를 내고 가입할 수 있는데 이걸로 할인받으면 5유로, 정가는 9유로 정도였습니다. 수도인 빈에서 많은 것들을 할 수 있기 때문에 빈에 기차를 타고 매우 자주 다녔는데 빈과 가깝다는 것이 아주 큰 장점입니다.FH는 작은 학교입니다. 5층정도의 건물이 두 개가 있는데 우리 학교로 치면 상대 본관과 별관 두개가 이어져있는 느낌이었습니다. 그래서 학생들도 적습니다. 제가 간 국제경영학과(International Business Consultancy)에는 짐작건대 한학년에 100~150명 정도의 학생이 있는 것 같습니다. 그래서 한 학년 애들과 한 학기만 지내도 거의 모든 학생들과 낯이 익게 됩니다. 그런데다가 인사를 쉽게 하고 파티를 자주 하는 문화이다보니 매우 가족적인 분위기를 느낄 수 있습니다.가을과 겨울에 머물렀기 때문에 날씨 걱정을 많이 했는데 날씨는 한국보다 좋은 편이었습니다. 여름에는 한국보다 덜 덥고 겨울에는 덜 춥습니다. 비도 많이 오지 않으며 오더라도 잠깐동안 조금 내리는 편이라서 우산을 쓰지 않는 현지인들도 많이 있습니다. 겨울에도 눈이 거의 오지 않고 오더라도 잠깐 온 후 금방 녹습니다. 특징적인 것은 바람이 매우 많이 분다는 것이지만 그렇다해도 많이 춥진 않습니다.","FH는 비너노이슈타트의 교외지역에 위치해있어서 매우 시골처럼 느껴집니다. 비너노이슈타트 시내를 도는 G버스가 30분 정도의 간격으로 오는데 학교가 하는 날에 학생증을 제시하면 무료로 이용할 수 있습니다. 버스를 타면 30분 정도면 시내와 중앙기차역(Hauptbahnhof)에 갈 수 있고 10분 정도면 마트들이 많은 쪽에 갈 수 있습니다. 그곳은 걸어서 20분 정도 걸리는 곳이라 장을 보러 갈 때는 주로 걸어다녔습니다. 기숙사에서 10분 거리에 비너노이슈타트 시비타스 노바(Wiener Neustadt Civitas Nova), 20분 거리에 비너노이슈타트 북역(Wiener Neustadt Nord)이 있는데 이곳에 전철(S-bahn)이 정차하기 때문에 자주 이용했습니다.","모든 교환학생들과 대부분의 정규학생들이 학교에서 걸어서 5분 거리에 위치한 기숙사에 거주합니다. 기숙사가 앞서 말했듯 교외에 있어서 기숙사에서 학생들끼리 자주 놉니다. 그래서 아이들과 금방 친해질 수 있습니다. 기숙사는 2인이 부엌, 화장실을 공유하고 방은 각자 있는 형태입니다. 기숙사비는 매월 280유로(한화 약 40만원)였고, 인터넷은 6개월에 15유로를 냈습니다. 방에서 와이파이를 이용하기 위해 무선공유기를 들고 가시길 권합니다.   학교에 학생식당(Mensa)이 있으나 최소 5유로부터이고 만족스럽지 못해서 장을 봐서 부엌에서 요리를 해먹었습니다. 식료품 가격이 마트에서 한국과 비슷하거나 더 싼 것들도 있기 때문에 요리 해먹는 것이 돈을 아끼는데 도움이 됩니다. 주로 냄비로 밥을 해먹고 파스타를 해먹었는데 처음에는 요리를 잘 못했으나 계속 하다보니 어느 정도는 하게 되었습니다. 빈에 몇 군데 한인마트가 있는데 빈 서역(Westbahnhof) 근처에 있는 낙원 슈퍼마켓(Nakwon Supermarket)이란 곳은 꽤 크고 없는 것이 없어서 많은 한국음식들을 사다 해먹었습니다. 맥주나 와인이 아주 싸고 맛있어서 자주 사다 먹었습니다.","저는 원래 경제학과인데 그곳에는 경제학과가 없어서 경영 수업을 들었습니다. 경영학과 수업은 100% 영어로 진행됩니다. 수업은 대체로 한국과 비슷한 강의형태의 방식입니다. 학생들의 질문과 발표가 아주 활발하다는 게 한국과의 차이점이었습니다. 수강신청은 국제처(International Office)에서 담당자인 클라우디아 브루크너씨를 통해 직접 해야하고 시간표가 겹칠 수가 있기 때문에 처음 몇 주 간은 시간표 조정에 신경을 써야합니다. 교환학생들을 위한 독일어 필수 수업이 있고 교양과목으로 영어, 독일어, 스페인어, 러시아어 등 다른 언어들과 체육 수업도 있습니다. 이런 것들을 듣기 위해서는 학교에서 오는 메일들을 잘 읽고 개인적으로 메일을 보내서 신청해야합니다. 저는 이런 식으로 독일어를 늘리기 위해 독일어 수업을 3개 들었는습니다.    도서관은 우리 학교의 단과대학 도서관 정도로 작은 크기입니다. 전공서적들이 대부분이고 학생증을 이용해 대출을 할 수 있습니다. 대출해서 연기가 무제한으로 되는 것 같아서 교과서를 여기서 빌려서 볼 수 있습니다. 또 컴퓨터를 사용할 수 있고 공부를 할 수 있는 테이블들이 있습니다. 학생들이 썼던 중고서적을 개인적으로 메일로 연락해서 사고 파는데 교과서들이 비싸기 때문에 저는 거의 이런 식으로 책을 샀습니다.","FH는 교환학생들에게 지원을 많이 해줍니다. 국제교육부(International Office)에서 교환학생들을 관리하는데 직원분들이 친절하십니다. 이곳에서 교환학생들을 위한 프로그램을 많이 주최합니다. 학교에 대한 소개와 교환 학생 생활에 대한 조언부터 시작해서 세계문화행사 등을 개최합니다. 가장 좋은 것은 국제교육부에서 교환학생들만을 위한 소풍(Excursion)을 4차례 주최하는데, 싼 가격에 좋은 경험을 많이 할 수 있습니다. 제가 다닌 학기에는 오스트리아 여행(인스부르크, 잘츠부르크, 할슈타트), 래프팅, 클라이밍, 빈 크리스마스마켓을 갔습니다. 그 다음 학기에는 베니스를 갔다는 얘기를 들었는데 매번 같은 곳을 가는 건 아닌 것 같습니다",학교 동아리는 못 본 것 같고 스포츠 활동을 신청해서 할 수 있습니다. 탄뎀(Tandem)이라는 언어교환 프로그램을 파트너를 정해 할 수 있습니다. 기숙사에서 학생들끼리 파티를 주최하는데 건전하게 술을 마시며 친해질 수 있는 좋은 기회입니다. 또 기숙사에 미디어룸이 있는데 프로젝터와 스크린이 있어서 학생들끼리 여러 번 영화를 함께 보고 정말 좋았습니다. 축구를 좋아하는 아이들끼리 모여서 간단히 축구를 하기도 했습니다,충격까지는 아니어도 한국과 다르다는 걸 많은 부분에서 느꼈습니다. 개인적으로 가장 힘든 것은 물과 화장실이었습니다. 한국에서는 어디서나 물은 무료로 마실 수 있고 화장실도 무료로 이용할 수 있는데 유럽은 대부분이 물을 사마시고 화장실도 유료로 이용해야 했습니다. 그리고 파티나 클럽문화가 한국과는 다르게 친구들끼리 술을 마시며 떠들고 가볍게 춤을 추는 건전한 곳이라는 것도  충격 아닌 충격이었습니다. 유럽 내에서는 기차나 버스로 쉽게 국경을 넘나들 수 있어 외국 여행도 쉽고 저렴하게 다녀올 수 있다는 것도 정말 좋았습니다. 나라마다 분위기가 다르고 개인별로 경험이 다르긴 하지만 저는 오스트리아에서는 인종차별을 당한다고 느낀 적이 없었습니다. 오히려 사람들이 친절하고 인사를 잘해서 한국에 돌아와서 무뚝뚝한 종업원들이나 인사를 안 하는 걸 보고 놀라기도 했습니다. 영어가 대부분 통해서 영어로 물으면 영어로 대답해주고 독어로 물으면 독어로 대답해줍니다.같이 수업을 듣는 학생들끼리는 스스럼 없이 인사하고 파티에서도 금방 친해질 수 있다는 것도 아주 좋은 점입니다.,공식적으로는 국제교육부(International Office)에서 교환학생들을 관리하기 때문에 많은 도움을 받을 수 있습니다. 또 교환학생이나 정규학생들 모두 매우 가족적인 분위기라 서로 도움을 주고 받을 수 있습니다. 정규학생 중 교환학생들을 도와주는 버디나 그 학교를 졸업한 선배 같은 아이들도 교환학생들에게 많은 조언과 도움을 해줍니다.,"원래 빈을 가고 싶었지만 비너노이슈타트를 가게 된 것이 탁월한 선택이었다고 생각합니다. 소규모의 학교여서 인종, 국가와 상관없이 다양한 친구들과 고루 친해질 수 있습니다. 다양한 학생들과 대화하기 위해 영어가 늘지 않을 수 없습니다. 영어로 공부를 하며 부가적으로 독일어도 배울 수 있어서 정말 좋았습니다. 또한 문화 행사가 아주 많이 열리고 문화유산이 풍부한 빈과도 가깝고 문화 행사들에 저렴한 비용으로 참여할 수 있어서 비너노이슈타트는 최상의 도시입니다. 유럽의 정중앙에 위치한 특성 때문에 유럽 어느 곳으로든 쉽게 갈 수 있습니다. 저는 이탈리아 로마에 갔다가 야간열차를 타고 비너노이슈타트로 돌아오기도 했습니다.또한 서유럽이나 남유럽만을 좋아하고 관심을 가지고 있었는데 그쪽뿐 아니라 헝가리, 체코, 슬로바키아 등의 동유럽도 직접 가보고 그곳에서 온 친구들도 많이 만날 수 있어서 문화적 경험을 매우 다양하게 쌓을 수 있습니다. 대학생으로서 교환학생은 반드시 가야할 특권이자 기회라고 생각합니다. 비용이 많이 들 것 같지만 오스트리아라면 비용도 적게 들고 정말 다양한 경험도 쌓고 언어도 습득할 수 있는 정말 좋은 기간입니다. 게다가 FH는 소수의 규모가 가족같은 분위기로 공부하고 놀 수 있는 환경이라 최고의 환경입니다. 저는 다른 분들에게 교환학생을 강력 추천해드리는 바이며 그 중에서도 비너노이슈타트를 권합니다."
"저는 가을/겨울을 보내고 와서... 화창할 때는 말로 표현하기 어려울 만큼 맑고 아름답습니다. 그리고 하늘에서 별을 그렇게 많이 본 적이 없어요. 별똥별도 가끔 떨어지구요. 그런데 10월부터는 유럽 대부분이 그렇듯 우중충한 날씨가 보통이에요. 안개가 자주 끼는데 심할 때는 몇 미터 앞도 잘 안 보여요. 바람도 많이 불어서 학생들 사이에서 Windy Neustadt라고 부를 만큼. 그런데 그런 날씨조차 사랑하게 되실 거예요. 9월부터 쌀쌀한데 한국과 비교해서 딱히 심하게 춥진 않아요.

  처음에는 당황하실 수도 있습니다. 학교와 공장 건물이 띄엄띄엄 덩그러니 있거든요. 그런데 저는 복잡한 곳에서만 자라서 그런 여유 있는 분위기 좋았어요. 빈 중심부에서 30분 떨어져있다고 이야기하지만... 사실 기숙사에서 나와서 버스 타고 기차 타고 나가는 시간 다 하면 한 시간 정도 생각하셔야 돼요.

  학교는 저희처럼 캠퍼스가 있는 것이 아닙니다. 기숙사에서 가까운 곳에서 대부분의 수업을 듣게 될 것이구요, 간혹 Zentrum (City Center)에 있는 건물에서 들어야 하는 강의도 있어요. 학생증 있으면 무료로 탈 수 있는 G-line 버스 타고 가면 되는데 첫 수업에는 학생들 헤매지 말라고 택시 불러주는 배려까지 해줍니다.","앞서 말씀드렸듯 주변에 별 다른 시설이 없습니다. 저녁에는 걸어서 10~15분 거리에 있는 주유소 말고 여는 곳도 없어요. 물론 City Center에 있는 바, 클럽 등은 갈 수 있지만 비싸구요. 다들 기숙사 건물 로비나 복도에서 모여 놀아요. 매우 안전합니다. 저녁에 나가서 산책하고 와도 될 정도로 ^^

  기숙사에서 걸어서 10분 정도 가면 수영장이 있어요. 학생증 제시하면 매우 싸게 이용할 수 있구요, 시간 나실때 걸어서 여기저기 가 보세요. 15분 정도 걸어나가면 공원도 있고, 식물이나 목재 파는 큰 가게도 있고... 구경하기 좋아요.","다른 글들에서 전반적인 이야기는 다루어져 있으니... 저는 자잘하고 사소하지만 제가 처음에 가장 궁금했던 것, 그리고 가서 알게 되기 전까지 당황했던 정보들 위주로 말씀드리겠습니다.

  교환학생들은 모두 기숙사에 모여서 삽니다. 기숙사는 학교에서 걸어서 5~10분 정도 되는 거리에 위치하고 있어요. 학생들 사이에서 Gray dorm, Orange dorm, White dorm이라고 불리우는 곳인데요. Gray dorm과 Orange dorm은 학교에서 운영하는 것이 아니라 외주 맡긴 기숙사이구요, White dorm은 학교에서 운영하는 기숙사로 알고 있습니다. 교환학생들은 모두 Gray dorm 0층 (간혹 몇몇은 1층)에 배정 받아요.
  기숙사 관리인이 근무 시간도 짧고 업무 처리도 느린 데다 친절하지 못한 성격이라서 학생들과 트러블이 있기도 하지만, 준비 빠릿빠릿 하셔서 작성해달라는 서류, 기숙사비 지불 등 철저히 하시고, 기숙사 기물 파손만 하지 않으시면 딱히 부딪힐 일 없습니다.

  좋은 점은, 2인 1실이라고는 하지만 집 문 열고 들어오면 바로 있는 부엌/화장실/샤워실 이 세 곳만 룸메이트와 공유하고 열쇠 딸린 자기 방이 따로 있어요. 유럽이다보니 좀벌레 같은 것이 간혹 보이긴해도... 전반적으로 깔끔하구요, 저는 시설 매우 만족 했습니다. 핫플레이트나 수도꼭지, 냉장고 등이 자잘한 고장을 일으킬 수 있지만 고쳐주시는 기사 아저씨께서 친절하게 바로바로 고쳐 주세요. (여기에서 ''바로바로''라고 함은, 업무 시간 내에 건의를 하실 경우의 이야기입니다.)

  학교와 기숙사가 매우 가깝고 학교 Mensa (학생식당)에서 사먹는 음식 값이 싸지는 않기 때문에 보통은 다들 직접 요리해 먹습니다. 친구들과 같이 요리해 먹는 것도 쏠쏠한 재미 중 하나였어요.

  Gray dorm의 경우 오븐과 전자레인지가 있는 공동 부엌이 2 곳, 운동 기구 몇 개 갖추어 놓은 짐이 한 곳 있습니다. 그 곳 열쇠를 관리하는 학생이 매 학기 선정되구요, 그 친구들한테 미리 이야기만 하면 공간 빌리는 것은 어렵지 않아요. 다 같이 모여서 영화를 볼 수 있는 장소도 있습니다.

  세탁은 지하실에서 할 수 있습니다. 처음에 가면 거주지 등록을 해야합니다. 그 이후에 오스트리아 뱅크 등 현지 은행에서 계좌를 만들게 될 거예요. 그러면 체크카드를 받는데, 우리 학교 학생증 전자결제 기능처럼 ''Quick''이라고 하여 일정 금액을 충전하는 기능이 있어요. 은행 ATM 기계에서 Quick을 충전하여 세탁기와 건조기를 쓸 수 있습니다.","처음에 수강신청할 때 조금 당황하실거예요. 시간표가 중복되는 것이 가능한 구조입니다. 그 학생들 커리큘럼에 맞게 한 학년 수업만 듣는다면 수업이 겹칠 가능성이 적지만, 우리 학교 인정과목도 고려해서 들어야하기 때문에 시간표 중복을 피하기 어려워요. 처음에는 이리저리 시간표를 수정하셔야 해요. 그런데 IO에서 친절하게 도와주니 걱정마세요. 또한 한국처럼 일정하게 정해진 시간표를 가지고 한 학기동안 수업을 듣는 것이 아닙니다. 어떤 강의는 일주일에 한 번 3시간씩 한달 반 만에 끝나기도 합니다. 강의실이 자주 변경되는 것도 있어요. 이것도 처음에만 혼란스럽고 적응하시면 편합니다.

  도서관은 크게 기대하지 마세요. 수업에 필요한 책은 대부분 갖추고 있지만 전공서적만 갖추고 있어서 소설책 같은 것은 기대하기 힘들어요. 하지만 영어공부나 독어공부하기 좋은 책들은 있어요. ^^ 복사 이용 방법, 책 대여 방법 등은 가면 OT 때 다 안내 받을 수 있습니다.","교환학생 담당은 Claudia Bruckner라는 분인데요, 일도 빠릿빠릿 처리해주시고 성격도 시원시원하십니다. 항상 친절하세요. 주변에 다른 학교로 교환학생 다녀온 친구들 말 들어보면 FHWN International Office만큼 좋은 곳은 없었습니다. 큰일이든 작은일이든 언제나 친절하고 신속하게 처리해주세요.
  학교에서 저렴한 가격에 교환학생들 대상으로 excursion을 준비해주는데요, 가격을 떠나서 친구들이랑 어울려 추억 쌓는 것만으로도 전참의 가치가 있는 행사라고 생각 돼요.","운동 할 수 있는 모임도 있고, 학교 수업 외에 외국어 배울 수 있는 시간도 있어요. 그렇지만 교환학생들이 잘 이용하지는 않습니다.
  언제든 쓸 수 있는 컴퓨터실, 조모임 할 수 있는 장소 등... 갖출 건 다 갖추고 있습니다. 그리고 학교 복도에 쉬는 시간에 누워서 쉴 수 있는 편안한 소파(?)도 있어요. 그리고 학교 Mensa (Cafeteria)에서는 생맥주나 와인도 팝니다. ^^",사람 사는 곳 다 똑같다는 말 맞습니다. 컬쳐 쇼크라 할만한 것은 없었습니다.,도움 받아야만 할 일이 생긴다면 International Office에 이야기 하시는 것이 가장 빠릅니다. 교환학생 담당자께서도 메일 수시로 확인하십니다. 그리고 Business Consultancy International이라는 경영학과의 정규학생들 자체도 워낙 다양한 국가에서 온 친구들로 구성되어 있고 규모도 작습니다. 그렇다보니 정규 학생들이 교환학생에게 매우 친절합니다.,혹시 특별한 도움이 필요하시거나 궁금하신 점 있으시면 연락 주세요. 89net@hanmail.net
