gen_info,env_info,food_info,study_info,office_info,facil_info,mhct_info,help_info,etc_info
"우선 오스트리아의 기후는 한국과 꽤 비슷한 것 같아요. 하지만 꽤 이른 때에 눈이 온다든지 하는 이상기후가 가끔 나타날 때도 있어요! 비도 꽤 자주 오구요. 제가 파견된 9월초에는 날씨가 참 좋았는데, 겨울이 되니 굉장히 춥더라구요. 겨울을 보내시는 분들은 패딩을 꼭 챙겨가시길 바래요. 오스트리아에는 우리나라처럼 따뜻한 패딩들을 잘 팔지 않더라고요. 칼프란츠 대학은 우리 학교보다는 작은 규모입니다. 캠퍼스가 그냥 도시 한 중간에 있어요.그라츠는 이탈리아, 독일이나 다른 동유럽 국가와 가깝다는 지리적 이점이 있어요. 그래서 굳이 비행기를 이용하지 않아도 버스 타고 여행을 많이 다녔어요. flixbus나 studentagency 같은 버스에이전시를 기억해두시고 잘 찾아보시면 쉽게 여행 하실 수 있어요. 또 비엔나에 갈 일이 종종 생기는데 그라츠와 약 2시간 30분 정도 거리입니다. 또 그라츠도 굉장히 매력적이고 아름다운 도시에요.무어강 주위는 산책하기도 좋고 언제 봐도 예뻐요. 에겐베르크나 슐로스베르크는 유럽 다른 여행지와 견주어도 아름다운 곳이니 꼭 들려보시길 바라요~","그라츠는 오스트리아에서 두번째로 큰 도시지만, 우리나라 도시들처럼 번화하지는 않아요. 하지만 필요한 물건은 중심가인 하우프트플라츠나 야코미니플라츠에서 거의 구할 수 있구요. 우리나라처럼 학생들이 카페에서도 공부를 많이 하는데, 스타벅스처럼 우리에게 잘 알려진 카페는 없고, 그라츠에 3군데 정도 지점이 있는 TRIBEKA라는 곳에 자주 갔었어요.전 수업이 연강으로 있는 경우가 거의 없어서 학교 근처에서 밥을 많이 사먹지는 않았지만, 학교 가까이에 케밥집이나 베이커리겸카페, 캐쥬얼한 일식집도 있으니 잘 찾아보시고 이용하세요","ISEP으로 가시는 경우 스스로 방을 알아보실 필요는 없구요, 아이셉이 제공하는 기숙사를 이용해야 합니다. 솔직히 이 점이 제가 가장 불만스러웠던 사항이에요. ISEP이 제공하는 기숙사는 제가 알기로 Ghegagasse 와 Moserhofgasse 두군데에 있는데요, 랜덤으로 배정이 됩니다. 싱글룸인지 더블룸인지만 고르면 그 이후에는 아이셉 측에서 통보하는 시스템입니다.제가 살았던 ghegagasse는 학교와는 꽤 가까웠지만 주변 환경이 약간 위험했어요. 시설 자체도 노후했구요. 저는 룸메이트와 잘 맞지 않아 싱글룸으로 방을 바꾸려고도 시도해보았지만 커뮤니케이션도 잘 되지 않았습니다.여러분은 신중하게 고민하셔서 방 타입을 결정하시길 바라요.. 또 시간이 지나면 방을 바꾸기가 어려우니 처음 거주등록을 하기 이전에 빨리 isep 측과 협의를 하셔야 합니다! 식사 같은 경우 저는 곳곳에 있는 아시안 마켓들을 많이 이용했어요 . 특히 야코미니 플라츠에 있는 아시안마켓에서 김치나 간장 같은 것들을 구매했습니다. 우리나라보다 비싸긴 하지만 덕분에 한국에 있는 것처럼 잘 먹었어요!저는 미니 밥솥을 한국에서 사가서 거의 매일 밥을 지어 먹었는데요. 밥을 자주 드시지 않거나 사먹으시는 분들, 귀찮으신 분들은 냄비밥도 많이 해먹더라구요. 쌀은 SPAR나 BILLA에서 살 수 있는 RUNDKORN이 한국 쌀이랑 거의 유사해요. 또 식료품 물가가 한국보다 싼 편입니다.버터나 치즈 같은 유제품은 한국보다 훨씬 저렴해요. 삼겹살도 정육 코너에서 팔아서 종종 사서 구워먹었어요.","우리나라보다 다양한 형태의 수업이 제공돼요. 대형강의도 있고, 소수인원이 토론식으로 수업을 진행하는 세미나 형식도 있습니다. 수업에 대한 정보는 처음 오티에 가면 이야기 해줍니다. 기본적으로 수강 신청을 어떻게 해야하는지나 수업 유형에는 어떤 것들이 있는지 자세히 알려주니 집중해서 들으셔야 나중에 헷갈리지 않아요!저는 주로 VU 강의를 들었던 것 같아요. 수업마다 상이하겠지만, 제가 들은 수업들은 보통 수업 자료를 수업 전에 업로드해주시면 그것을 미리 읽고 자기 생각을 정리해가야 했어요. 중간, 기말고사도 객관식보다는 자기 의견을 수업내용과 관련지어 서술하는는 방식이었고요. 한국 수업보다 주체적으로 준비해가야 얻는 것이 많은 수업들이었어요. 그리고 우리나라보다 학생들이 수업에 임하는 자세가 적극적이에요. 질문이나 의견을 말하는 친구들이 많아서 수업시간의 반 이상이 학생들의 주도로 이루어졌습니다.저는 전공 수업이 거의 열리지 않아서 우리학교 교양 범주에 속하는 수업들을 많이 들었는데요, '폭력의 심리학'. '젠더의 사회학' 등등 재밌는 수업들이었습니다.","크리스타 선생님이 아이셉 학생들을 총괄해주시는데, 항상 이메일에 친절하게 답변해주세요. 또 아주 유용한 정보들(행사들이나 수업 관련)이 이메일로 많이 오기 때문에 꼼꼼하게 자주 체크하시면 좋을 것 같아요.","그라츠에서는 아주 다양한 종류의 스포츠 수업이 저렴한 가격으로 많이 열려요. 아마 학기 초에 모집할 텐데 저는 신청했던 수업이 생각보다 너무 외진 곳에서 열려서 중간에 환불받고 취소했는데요, 안 열리는 스포츠가 없을 정도로 많은 수업이 열리니 잘 알아보시고 배워보시길 추천드려요. 그리고 에라스무스에서 주최하는 행사에 자주 참여하시면 교환학생 친구들도 쉽게 사귈 수 있어요. 초콜렛 공장 견학이나 원숭이 산 소풍, 와이너리 체험등 흥미로운 이벤트들이 많아요. 또 그라츠에 한국에서 온 다른 학교 대학생들도 많이 있으니, 만약 교류하고 싶으시면 에라스무스 행사에서 한국 친구들을 찾아보세요!","확실히 성적으로 우리나라보다 굉장히 자유롭고 개방되어 있다는 걸 느낄 수 있었어요.학생들이 수업에 참여할 때 굉장히 적극적이었던 점도 인상적이었구요.사람들이 여유로웠던 것도 기억에 남아요. 토요일, 일요일에는 보통 모든 상점이 문을 닫기 때문에 미리미리 장을 봐 놓으셔야 해요. 중앙역 SPAR는 주말에도 문을 여니 급한 경우에는 이곳을 이용하시면 될 것 같아요. 처음에는 굉장히 불편했는데 나중에는 적응이 되더라구요. 또 교통수단에 애완동물을 데리고 타는 경우가 정~말 많습니다! 대형견도 우리나라보다 훨씬 많아요.","학기가 시작하기 전에 신청할 수 없는 버디 프로그램을 신청하시면 처음 거주등록 할 때나 학교에 관한 문의사항이 있을 때 많은 도움을 받을 수 있습니다. 물론 무책임한 버디들도 종종 있는데요, 제가 만난 버디는 정말 친절하고 좋은 친구여서 종종 만나기도 했어요.",적극적으로 뭔가 시도할수록 얻어가는 것이 많은 게 교환학생 생활인 것 같아요. 나중에 돌아보면 힘들었던 것도 다 추억이 되더라구요. 인종차별이나 가족에 대한 그리움 등 가끔 외롭고 슬플 때도 있었지만 새로운 경험도 많이 해보고 교환학생에 오지 않았더라면 몰랐을 것들도 정말 많이 깨닫고 얻어왔어요. 여러분들도 좋은 추억 많이 만들고 오시길!
칼 프란츠 대학(보통은 uni graz라고 더 많이 부릅니다)이 위치한 그라츠는 오스트리아에서 두번째로 큰 도시입니다. 그렇지만 인구가 30만명도 되지 않는 작은 도시로 우리나라의 부산과 같은 대도시를 생각하면 곤란합니다. 그라츠는 오스트리아의 남서쪽에 위치하여 비엔나에서 기차와 버스로 약 2시간 가량 떨어져 있으며 슬로베니아와 매우 가깝습니다. 기후는 우리나라와 상당히 비슷하지만 변덕스러운 편으로 제가 있었던 학기에는 10월보다 9월이 더 춥고 비바람이 많이 불었습니다.,"그라츠에는 칼프란츠 대학 뿐 아니라 TU graz를 비롯한 공대, 음악대학 등 다양한 대학들이 위치하고 있어 학생들이 사용할 수 있는 편의 시설이 잘 갖추어 진 편입니다.교통의 중심이라고 할 수 있는 야코미니플라츠 근처에 마트와 대부분의 편의시설, 오페라 하우스와 시청 등이 있습니다. 만약 좀 더 제대로 된 쇼핑센터 방문을 원한다면 야코미니에서 트램이나 버스를 타고 30분 정도 교외로 나가면 큰 쇼핑센터에 방문할 수 있습니다.무어강변에 다양한 카페들도 있고 그라츠의 대표 건축물이라고 할 수 있는 kunsthous graz도 있어 산책하기에 좋습니다.","저는 ISEP로 교환학생을 가게되어 기숙사를 배정받아 갔는데, 기숙사의 형태가 우리나라와는 달리 플랫으로 되어있어 4-6명의 학생들과 거실과 부엌을 공유하고 개인실이 있는 형식이었습니다. 이때 1인실과 2인실로 나뉘는데 저는 1인실을 사용하는 것이 보다 생활하기에 편리했었던 것 같습니다. 플랫메이트는 정말 만나기 나름인데 아무래도 오스트리아가 독일어권이다보니 독일어를 유창하게 했다면 좀 더 편하게 소통했을거라고 생각합니다.ISEP로 칼프란츠대학에 교환학생을 오게되면 매달 식비로 약 300유로의 스티픈을 받게됩니다.대학 내에 uni mensa 라는 학교 식당이 있긴하지만 가격대비 맛이 좋지 않아 잘 사용하지 않았고 근처의 area5나 bearbaroon과 같이 저렴한 가격의 식당을 상대적으로 자주 갔었습니다.그러나 비용을 아끼기 위해서는 외식을 삼가고 플랫에서 직접 요리해서 먹는 것이 좋습니다. 오스트리아는 인건비는 비싸지만 식료품 자체를 구입하는 것은 우리나라보다 훨씬 저렴하기 때문에 요리를 할 경우 절약하는데에 큰 도움이 됩니다.야채나 과일은 landplatz에 위치한 터키가게에서 구입하는 것이 제일 저렴했던것 같습니다. 그 외에는 spar나 hofer에서 대부분 구할 수 있었던 것 같습니다. 무엇보다 고기나 치즈, 주스가 저렴해서 많이 먹었던것같아요..graz에는 한인마트가 따로 있지는 않지만 아시아마켓에서 대부분 원하는 것을 구할 수 있고, 여기서도 구하기 어려울때는 비엔나에 방문했을때 한인마트에 들려서 구입했었습니다.",저는 전공수업이 없어서 복수전공을 생각하고있는 경영학과 수업을 위주로 들었습니다.생각보다 영어강의가 많이 없어서 수강신청하는데 어려움이 있긴했지만 수업자체는 괜찮았어요.여행 다닐 것을 생각해서 intensive course를 들었는데 6시간 이상 영어로 수업을 듣는것이 생각보다 힘들었습니다. 수강신청하실때 고려해보시면 좋을것같아요.도서관은 unigraz홈페이지에서 등록을 해야 들어갈 수 있습니다. 도서관에 방문하면 담당자분이 친절히 설명해주실거에요. 시설이 뛰어나게 좋은건 아니지만 예쁘고 공부하기 좋은 분위기 입니다. 저는 중앙도서관보다 경영대도서관을 더 많이사용한것같아요. 우리나라처럼 24시간 운영하지 않는다는 점 유의하시면 좋을것같습니다.,"국제교육부 담당자분과 생각보다 연락할 일이 많았어요. 거주등록, 장학금관련, 수강신청 등등... 담당자 분이 매우 친절하게 대해주셔서 좋았습니다.",동아리는 있다고 들었는데 저는 관심이 없었고 대부분의 교환학생들이 1학기만 있기때문에 동아리에 적극적으로 활동한 친구는 보지 못한것 같습니다.,플랫에 남녀가 같이 산다는것과 같은 독일어를 써도 독일과 인사말이 조금씩 다르다는게 신기했던것같습니다.그외에는 딱히 없었던것같아요.아.. 생각보다 길거리에 담배피우는 사람이 많다는것..? 우리나라보다 흡연이 훨씬 자유로운것 같습니다. 정류장에서 담배피우는 사람이 정말 많아요.,ESN에서 운영하는 버디프로그램에 참여하는 것을 추천합니다. 국제교육부 담당자분께서 안내메일을 보내주시는대로 신청하는것이 좋아요. 물론 버디에 따라 호불호가 갈리긴하지만 좋은 버디와 함께라면 훨씬 즐겁게 한학기를 보낼 수 있을거라 생각합니다. 공항에서 시내로 가는것부터 다양한 행정 업무까지 모두 많은 도움을 받았습니다.,
"그라츠 카를 프란츠 대학은 오스트리아에서 2번째로 큰 도시인 그라츠에 위치해있습니다. 관광도시로 유명한 곳은 아니라서 많이들 모르지만, 유네스코 세계문화 유산에 도시 전체가 지정되었을 정도로 오래된 예쁜 건물들이 많은 도시입니다. 저는 지내다보니 익숙해져서 예쁜 줄 몰랐는데, 나중에 여행하면서 그라츠가 여기보다 예쁜데? 라고 생각한 적이 몇번 있습니다 ㅎㅎ 대학의 위치는 그라츠 시내에 있어서 기숙사에서 멀지 않습니다. 저는 그라츠 중앙역 근처에 기숙사가 있었는데, 학교까지 버스 한 방으로 15분 내외 걸렸습니다. 기후는 한국보다 덜 춥고 덜 덥습니다. 그래도 춥고 더운건 마찬가지니 옷은 계절감에 맞게 잘 챙겨오시길 바랍니다. 유럽와서 옷 사야지~ 하고 많이 안가져오시면 만약 옷이 취향에 안맞을 경우 피볼 수 있습니다! 그리고 그라츠는 슬로베니아랑 크로아티아와 가깝습니다. 여행가기에 좋습니다.","그라츠 대학은 주변에 tu graz(그라츠 공과대학), 약대/의대, kunst uni(예대) 그리고 멀리 요한네움 까지 대학이 정말 근처에 많습니다. 그만큼 도시에 대학생 비율이 높아서 젊은 도시라고 볼 수 있죠. 대학 주변에 식당도 적당히 있고 카페도 있습니다. 또 uni mensa라고 학생식당이 있는데 가격이 싼편도 아니고 맛도 그냥 그렇기 때문에 체험삼아 가보고 그 다음부터는 안 가는게 나을 것 같습니다. 그리고 주변에 싼 식당은 area5 와 비슷한 계열인 종이에서 재료 선택에서 피자/파스타/판델...등등 먹을 수 있는 곳이 있는데 거기 자주 갔습니다. 그래도 되도록 밥은 해드세요 해먹는게 제일 저렴합니다 !","위에서 말했듯이 밥은 해먹는게 제일 좋습니다. 오스트리아 슈퍼는 스파(spar), 빌라, 후퍼가 있는데 삼겹살 팝니다. 한인마트는 없지만 아시아마켓이 여러 곳 있어서 라면, 고추장, 한국 음식 재료 사기 쉽습니다. 그래서 한국음식을 요리해 드실 수 있어요. 물론 한국보다 비싸게 파니까 고추장 많이 챙겨가세요! 정말 유용합니다!! 김도 많이 가져가세요 외국인 친구들도 좋아합니다 ㅎㅎ 그냥 음식은 많이 가져갈수록 좋았습니다. 한국에서 지낼 때 고추장을 찾은 적이 없었는데 오스트리아 가니까 정말 꿀 아이템, 핫템이었습니다. 안가져가려던거.. 챙겨주신 어머님께 감사를 드립니다... 또 isep으로 교환을 가시게 되면 기숙사가 랜덤 배정됩니다. 대부분 게가가세(ghegagasse)나 모져호프가세에 사는데 저는 중앙역 근처인 게가가세에 살았습니다. 근처에 스파(spar)가있어서 장보기에 편했고 학교도 가깝고 좋았습니다.한 플렛에서 6명이서 살았는데 모두 다른 나라 사람이었고, 교환학생 4명 정규학생 2명이었습니다. 저는 싱글룸을 썼는데 후회는 없습니다. 정말 좋았거든요... 혼자만의 공간이 필요합니다 왜냐면 ... 6개월은 길거든요.. 하지만 룸메이트가 있으면 친구가 한 명 더 생기는 거니까 2인실도그 나름대로 좋은 점이 있습니다. 본인 성향에 맞게 잘 선택하세요! 그리고 플렛메이트는 본인의 운에 맡기세요 ! 어떤 플렛은 다같이 친하고 어떤 플렛은 서로 이름도 모르고 그러거든요. 교환학생이 많은 플렛이면 더 친해지기 쉬울 겁니다. 부엌, 화장실을 공유하는데 공동공간은 청소를 잘해야해요 안그러면 플렛메이트한테 욕먹습니다 ㅠㅠ 그리고 플렛에 친구들 너무 자주 부르지 마세요.. 또 욕먹습니다... 그래도 너무 눈치보지말고 공동생활에 지장안주면서 플렛에서 잘 즐기시길 바랍니다!","아.. 수업은 .. 일단 저는 학기 시작 전에 독일어 선수과정을 들었습니다. 저는 독일어가 배우고 싶어서 그 수업을 들은게 아니라 친구를 먼저 사귀고 싶어서 들었는데, 기초가 A1-1 부터 시작하는 데, 반이 3개가 나뉩니다. 그 반마다 분위기가 다른데, 저희 반은 정말 수업만 하는 반이어서 친구사귀기가 어려웠습니다. 그래도 제일 친해진 외국인 친구가 그 수업에서 만난 친구였기 때문에 어려울지라도 친구를 사귈 수는 있습니다. 하지만 독일어에 대한 열정이 없어서 스트레스를 많이 받았어요. 미리 독일어 지식을 조금 쌓아두시고 가면 좋을 거 같습니다. 정말 기초라도! 저는 아무것도 모르고 가서 힘들었습니다. 그리고 학기 중에는 수업을 여러 개 듣지 않아서 ... 딱히 드릴 말씀이 없지만 영어로 진행되는 수업만 들었고 토론 수업도 들었는데 나름 흥미로웠습니다. 그리고 생각보다 오스트리안들도 영어 수업을 많이 들어서 우리나라 학생들이 영강 듣는 거랑 비슷한 느낌?이었습니다. 혹시 그리고 좋은 영어 발음을 연습하고 싶으시면 prononciation(발음) 수업도 추천드립니다 2크레딧밖에 안되는 수업이지만 유치원생이 된 것 마냥 재미있었습니다. 그리고 실제로 발음도 좀 더 좋아진거 같아요 L발음 R발음 또 Z발음 S발음 K발음 G발음... 재미있습니다 ㅎㅎ 아 그리고 생활디자인학과 관련된 수업은 아쉽게도 없었습니다. 그래서 저는 듣고 싶은 수업 아무거나 들었고 다 교양학점으로 처리가 될 것입니다. 경영경제 정치외교 심리학 등등 수업은 많았습니다. 만약 예술쪽 전공을 유럽에서 듣고 싶으신 거라면 그라츠 대학에서는 어렵고 차라리 요한네움대학은 인포메이션 디자인에 관한 수업이 있기때문에 좋으실 것 같습니다. 대신 isep으로는 우리학교랑 연결이 안되는 것으로 알고있습니다. 저는 교환의 목적이 유럽에서 전공수업을 듣자는 것은 아니었기때문에 후회하지 않았지만 약간의 아쉬움은 있습니다.",오스트리아 국제처에 크리스타라는 분이 담당자이신데 친절하십니다. 메일도 개인적으로 자주 주고 받고요 그런데 너무 많은 교환학생이 오다보니 사람 대 사람으로 교류를 하긴 힘들었습니다. 처음에 그라츠왔을 때 거주 허가증만들고 뭐 UNI GRAZ 홈페이지 사용법 이런거 알려줄 때 강단에 서는 분들이 국제교육부 사람들입니다. 개인적으로 마주할 일은 별로 없습니다 ㅎㅎ,"버디 프로그램을 신청하세요. 물론 버디도 버디나름이지만 저는 제 버디 덕분에 채식주의자의 삶에 대해서도 생각해 볼 수 있는 기회가 되었고, 오스트리안들만 있는 버디 친구의 생일파티에 초대 되기도 하고 가끔 만나서 어떻게 지내는 지 삶을 나누고 한국요리도 해주고 맛집도 버디가 데려가 주고 아주 좋았습니다. 버디 프로그램 꼭하세요! 동아리는 뭐.. 모르겠습니다 체육프로그램이 있는데 저렴한 가격에 다양한 거 배울 수 있습니다. 저는 에어로빅 신청했는데 나름 재미있었습니다. 선착순이라 마감이 일찍 되는데, 발리볼 같은 거 신청해서 1박2일 발리볼 캠프 이런 것도 가보시면 좋을 거 같네요..","인종차별을 심하게 당한 적 이 두 번 있었습니다. 단순히 아시아인에 대한 호기심인지 조롱인지는 사람을 보면 바로 알 수 있어요. 저는 인종차별에 대한 대응법을 배운 적이 없어서 인종차별을 심하게 당했을 때 화가나고 너무 짜증이 났지만 욕말고는 뭘 해야할지 모르겠더라고요.. 국제처에서 교환학생 가는 친구들에게 어떤 대응을 해야하는 지 가르쳐주었으면 좋겠네요! 물론 오스트리아에 인종차별자가 많지는 않습니다. 저도 7개월 있으면서 호된 인종차별은 2번뿐이었으니까요. 하지만 너무 상처받고 낙담하지 마세요.. 피부색, 인종에 우열은 없습니다! 그리고 사실 우리부터 먼저 인종차별을 하지 말고 백인우월주의 사상에 빠지지 말아야한다고 생각합니당 ㅎㅎ",위에 썼듯이 버디프로그램을 통해 많이 도움을 받으실 수 있어요. 또 ESN이라고 교환학생 프로그램 관련 단체가 있는데 그 곳에서도 도움을 받으실 수 있습니다. ESN페이지에서 버디도 신청할 수 있고 교환학생 관광 프로그램이나 축제도 주최합니다!,아마 처음에 유럽에 IN 하실 때 그라츠 공항으로 바로 가는 편보다는 비엔나로 가는 항공편이 더 싸고 많을 거에요. 저는 비엔나에서 그라츠로 기차를 타고 왔습니다. OBB라는 오스트리아 철도청에서 빨리 예매하시면 9유로 정도에 그라츠에 가실 수 있습니다. 혹은 FLIX BUS를 타고가시면 비엔나 공항에서 그라츠 시내로 한방에 가실 수 있으세요 가격은 시간별로 다릅니다. 비행기표 구매하시고 그라츠 가는 편을 미리 준비해 두시는 게 좋을 듯 합니다. 그라츠 내에서 교통수단은 정기권을 구매하시는 것을 추천합니다. 자전거를 사도 트램이나(오스트리아에서 트램은 빔이라고 부릅니다.) 버스를 탈 일 이 많습니다. 그리고 오스트리아에서 구글맵으로 길을 찾아도 트램으로 가는 방법을 안알려줘서 별로안좋습니다. BUS BHAN BIM이라는 어플이나 QANDO WIEN까시면 루트 찾아줍니다 ㅎㅎ FLIXBUS랑 OBB(OEBB)도 어플있으니까 다운받으시면 QR코드로 탑승가능해요 ! 도움이 필요하신 분은 la***@naver.com으로 메일주시면 감사하겠습니다. 나와있는 내용말고 다른 내용을 물어봐주시길 바라고 즐거운 교환생활하세요~~
