gen_info,env_info,food_info,study_info,office_info,facil_info,mhct_info,help_info,etc_info
"Swinburne University of Technology는 호주 Victoria 주의 주도인 경제, 문화의 중심지 Melbourne에 위치한 Hawthorn에 본 캠퍼스를 두고있는 종합대학으로서 말레이시아에 위치한 international campus를 비롯하여 Croydon, Lilydale, Healesvile, Prahran, Wantirna 등 모두 7개의 캠퍼스를 두고있습니다. 본교인 호손캠퍼스의 경우 크기적으로는 연세대학교의 삼분의 일에도 못미치지만 전체 캠퍼스 면에서 볼 때는 학생수(full time, part time 학생 모두 포함)가 연세대학교의 두배 정도에 해당하고 작년 호주내 대학 종합평가에서 4위를 차지하는 등 짧은 역사에도 불구하고 우수한 교수방법과 참신한 수업방식으로 호주내에서도 점차 입지를 다져가고 있는 대학교 입니다.
경영 경제, 공학관련 수업은 주로 본교인 Hawthorne캠퍼스에서 진행됩니다. Hawthorne 캠퍼스는 train 역 상으로는 Glenferrie station에 위치하며 멜번의 중심가인 city지역에서 Lilydale 혹은 Belgrave 방향의 열차를 타고 15분 정도 걸리면 도착할 수 있습니다. train 상으로는 오랜시간이 걸리지 않으나 열차를 기다리는데 최대 30분까지도 소요될수 있으므로 미리 열차 시간을 알아두고 움직이는것이 편리합니다. 열차시간표는 train station에서 구할 수 있으며 열차 시간이 상당히 정확하므로 믿고 이용할 수 있습니다. train 말고도 tram이나 버스를 이용해서도 city나 그 밖의 지역을 갈 수 있으나 배차 간격이 매우 크고 굉장히 저속운전을 하므로 train을 이용하는것이 여러모로 편리합니다.
디자인 관련 수업은 주로 Prahran캠퍼스에서 진행됩니다. Prahran 캠퍼스는 Sandringham행 열차를 타고 Prahran 역에 내리면 도보로 10분 거리에 위치하고 있습니다. 주요 학교 시설, 기숙사, 교환학생처 등이 모두 본교인 Hawthorn 캠퍼스에 위치하고 있는만큼 Prahran 캠퍼스는 보다 작고 단조롭습니다. 그러나 아름다운 해변가인 St Kilda에 가깝게 위치하고 있으며 멜번의 유행을 가장먼저 느낄수 있는 chaple street와도 가깝게 위치하고 있어 디자인 캠퍼스 다운 멋과 낭만이 있습니다.
신방과 수업과 사회학 수업은 Lilydale 캠퍼스에서 진행됩니다. 앞에서 말한 hawthorn 캠퍼스와 Prahran캠퍼스는 30분 정도의 거리에 위치하고 있는 반면 Lilydale 캠퍼스는 Lilydale line의 종점이니만큼 위의 두 캠퍼스와 지리적으로 상당히 멀리 떨어져 있습니다. 호주의 train요금제는 거리제입니다. city를 중심으로 거리를 기준으로 zone 1, zone 2, zone 3으로 구분되는데 앞에서 언급한 hawthorn, prahran의 경우는 zone 1에 해당하지만 lilydale은 zone 3에 해당하는만큼 멜번중심가에서도 상당히 멀리 떨어져 있습니다.
멜번의 기후는 호주대륙의 남쪽에 위치한 만큼 시드니나 브리즈번에 비해 춥습니다. 그러나 결코 우리나라의 겨울만큼 춥지는 않습니다. 심지어 한겨울에도 슬리퍼를 신고 다닐 정도로 많이 춥지는 않으나 한국이 여름일때 호주에 도착하면 겨울이므로 호주 기준으로 겨울에 입국하게 되면 상대적인 추위를 느낄 수 있습니다. 두꺼운 옷 하나 정도는 장만해 가는 것이 좋습니다. 멜번은 하루에 사계가 있다는 말이 무색하지 않게 일교차가 상당히 크므로 대부분의 사람들은 여러개의 옷을 겹쳐입고 날씨에 맞게 조절하여 입고 벗습니다. 겨울에는 비가 자주 옵니다. 심한 비만 아니면 현지인들은 대부분 우산없이 그냥 비를 맞고 다니나 비 맞는 것에 익숙하지 않다면 우산을 항시 준비해 다니는 것이 좋습니다. 그러나 한국의 비와는 달리 굉장히 깨끗하므로 약한 비에는 그냥 다니거나 모자정도만 쓰고 다니는 것도 괜찮은 듯 싶습니다. 봄이 되면서 비오는 횟수가 줄어들고 감탄이 나올만큼 아름다운 호주의 봄, 여름 날씨를 즐기실 수 있습니다. 보통 9월 말부터 날씨가 풀리기 시작해서 10월이면 날씨가 본격적으로 따뜻해 집니다. 멜번의 여름기후는 굉장히 건조하면서 덥습니다. 저의 경우는 스윈번에서 한학기만 수학하고 돌아왔기 때문에 호주의 한여름을 경험하지는 못하였으나 여러 친구들의 말에 의하면 숨이 막힐 정도로 덥다고 합니다. 그리고 대부분의 호주내 건물들이 단열, 방음 시설이 제대로 되어있지 않으므로 여름엔 덥고 겨울에는 춥습니다. 얇은 전기장판이 있다면 준비해 가는것이 좋고 도착해서는 방 정도를 덥힐 수 있는 미니히터 (30불정도 임)를 하나 장만하는것이 좋습니다. 제가 묵었던 기숙사의 경우에는 히터는 설치되어있었으나 냉방시설은 없어서 얼음선풍기로 여름을 견뎌냈습니다. 그러나 거주민 만족도 전 세계 1위를 차지하는 도시이니 만큼 날씨를 비롯한 여러면에서 굉장히 살기좋은 도시입니다.","멜번은 굉장히 아름다운 도시입니다. 과거와 현대가 세련되게 공존하고 있는 멜번이라는 도시는 city는 city 나름대로, 그 밖에 지역은 그밖에 지역 나름대로 굉장히 살기 편하고 즐기기에 좋은 환경을 갖추고 있습니다. 먼저 city는 멜번의 다운타운을 말합니다. 각종 은행과 회사의 본사가 들어서 있는 city지역은 늘 사람들로 붐비고 활기가 넘칩니다. 제가 머물렀던 glenferrie로 부터는 train으로 20여분 정도 걸리는 가까운 거리였으므로 저는 train을 타고, 혹은 룸메나 친구의 차를 타고 city에 자주 나갔습니다. 스윈번에 갓 도착한 교환학생들을 상대로 여는 session기간 동안에 교통요금을 할인받을 수 있는 concession card 신청서를 나누어 주는데 그것을 신청하여 갖고다니면 교통요금 할인혜택을 받을 수 있습니다. 제가 머물렀을 때에 zone 1에 해당되는 거리를 2시간 내로 이용할 경우, full fare의 경우 3.2불, concession fare의 경우 1.8불이었으므로 concession card 신청요금 22불을 감안한다 하더라도 상당히 저렴한 요금이 아닐 수 없습니다. city에는 한국인 슈퍼도 두개나 있으며 굉장한 규모의 재래시장인 빅토리아 마켓, 대형 쇼핑몰도 있어 저는 이렇듯 싼 교통요금의 덕을 보며 city에 자주 나갔었습니다.
city뿐만 아니라 hawthorn 캠퍼스 가 위치한 glenferrie에도 역시 부족함 없이 편리합니다. 우선 대형 슈퍼마켓인 coles와 safe way 가 있으며 호주 4대 은행(ANZ, National, commonwealth, westpac)의 지점과 ATM기, 각종 패스트푸드점, 옷-신발 가게, 빵집, boost, 정육점, 세탁소, 아시아 슈퍼, 우체국, 등을 비롯해 각종 커피숍, pub등이 즐비해 있어 생활하기나 즐기기에 전혀 부족함이나 불편함이 없습니다. 다만 pub을 제외한 대부분의 상점들이 다섯시면 문을 닫기 때문에 한국에서의 생활패턴을 고수하면 굉장한 불편함을 느끼게 됩니다. 치안이 잘 되어있기로 유명한 멜번이지만 밤 늦게 돌아다니는 것은 상당히 위험할 수 있습니다. 일단 대부분의 가게들이 문을 닫아 거리가 밝지 않고 돌아다니는 사람들 자체가 상당히 적습니다. 특히 glenferrie역에서 기숙사로 들어가는 길은 밤이 되면 매우 컴컴하니 특별히 조심하여야 합니다. 그러나 금요일 밤이 되면 많은 젊은이들이 pub이나 club으로 몰려들고 거리에는 취기에 소리를 지르거나 큰소리로 노래를 부르는 젊은이들을 심심치 않게 보게 됩니다.","거주형태는 크게 학교내에서 거주하게 되는 student residence와 학교밖에서 개인적으로 생활하게 되는 share형태로 나눌 수 있습니다. student residence는 다시 college형태와 apartment형태로 나뉘어 지는데 college는 한국에서 흔히 생각하는 기숙사의 형태로 각각의 기숙사 생은 각자의 싱글룸을 사용하게 되고 1층에 마련되어 있는 laundry room, dining room, kitchen을 공동으로 사용하게 됩니다. 3층과 5층에는 티비가 마련되어 있어 티비를 시청할 수 있고 2층엔 스터디 룸, 4층엔 스터디룸과 컴퓨터가 있습니다. 1층 입구에는 reception이 있는데 이곳은 college resident들 뿐만 아니라 apartment resident들을 위한 일도 동시에 하고 있습니다. 따라서 아파트 형 기숙사에 살고있는 학생들도 도움을 받거나 각종 전화요금, 기숙사비를 납부하려면 그곳으로 가야 합니다. Anne이라는 담당자가 기숙사에서 일어나는 여러 문제점을 들어주고 해결해 줄 것입니다.
저는 college가 아닌 apartment에 살았기 때문에 apartment를 중심으로 적어나가겠습니다. 제가 머무른 기간 동안에는 2동의 apartment가 있었는데 하나는 william street에 위치해있고 나머지 하나는 park street에 위치해 있었습니다. 두 곳 모두 학교에서 3분거리에 있었으며 지금 새롭게 짓고 있는 apartment 역시 학교에서 매우 가까운 위치에 있습니다. apartment에는 다양한 option이 있는데 기간과 방의 개수에 따라 기숙사 비가 달라집니다. 저의 경우 22주에 방 3개짜리 기숙사에 살았는데 매우 만족스러웠습니다.
구조는 방 세개에 거실과 연결된 부엌, 거실, 샤워실과 세탁실, 화장실, 베란다로 구성되어 있습니다. 방의 크기는 꽤 큰편이며 침대 하나와 넓은 책상하나, 서랍장이 구비되어있고 벽면 한쪽은 서랍장이 많이 달린 옷장으로 되어있습니다. 각 방마다 전화가 설치되어있고 입주 후 reception으로 가서 전화를 등록하고 개인별 pin code를 부여 받으면 전화를 사용할 수 있습니다. 집전화를 이용하면서 시중에 나와있는 선불 전화카드를 사용하면 굉장히 저렴한 가격으로 국제전화를 이용할 수 있습니다. 침대는 메트리스만이 준비되어있어 침대보와 이불, 베개는 가져가던가 그곳에서 구입하셔야 합니다. 거실에는 커다란 히터 하나와 식탁, 식탁용 의자와 쇼파형 의자가 있습니다. 티비용 선반은 있으나 티비나 비디오는 구비되어 있지 않으니 룸메들과 상의하여 중고 티비를 구입하는게 좋을 듯 합니다. 부엌에는 싱크대, 가스레인지, 그릴, 오븐등이 갖추어져 있고 냉장고, 토스트기, 전기포트, 전자레인지등이 갖추어져 있습니다. 전기 밥솥이라던가 식기구, 냄비등은 구비되어있지 않으므로 이 역시 룸메들과 상의하여 구입하는 것이 좋을 듯 합니다.
샤워실과 화장실이 분리되어 있어서 세명이 한 집을 사용함에도 불구하고 의외로 큰 불편함 없이 사용할 수 있습니다. 세탁실이라고 볼 수 있는 화장실과 샤워실 사이의 공간에는 세탁기와 건조기, 큰 손빨래를 할수 있는 개수대가 하나 있습니다. 드라이어가 마련되어 있으므로 별도의 건조대는 필요 없습니다. 다리미 같은 경우도 구비되어 있지 않으니 룸메들과 상의하여 구입하여야 합니다. 그러나 스윈번의 경우는 교환학생만의 기숙사동이 따로 마련되지 않아서 대개의 경우 유학생들이나 현지인들과 함께 생활하게 됩니다. 따라서 그런 친구들은 보통 장기적으로 기숙사에 머무르기 때문에 교환학생이 새로이 기숙사에 입주시 이미 다른 룸메이트 들은 그 집에 수년간 살아온 경우가 대부분입니다. 저의 경우도 입주당시  이미 다른 룸메이트들이 2년 가까이 그 집에서 살아왔으며 티비, 디비디 플레이어를 비롯하여 자잘한 식기도구 하나하나까지 모든 집안 살림이 이미 마련되어 있어서 굉장히 편리하고 저렴하게 지내다 올 수 있었습니다. 그러나 모든 경우가 이렇다고 보장할 수는 없으므로 기숙사를 신청하고 방이 배정 된 후에 집으로 오게되는 기숙사 관련정보서류에 기재되어있는 앞으로의 룸메이트 연락처를 통해 서로 연락을 해서 필요한 것을 서로 미리 알아보아서 한국에서 챙겨 갈 것은 챙겨가고 share할만한 것은 share하는 것이 좋을 것입니다.
기숙사의 경우는 모든 전기세, 수도세는 기숙사비에 포함되어있습니다. 다만 전화세, 인터넷 요금은 따로 지불하여야 하는데 인터넷의 경우는 모뎀선을 이용하면 선불카드를 구입할 시 접속할 때 마다 22cent 만을 지불하면 되어 보다 저렴하게 사용할 수 있으나 느리다는 단점이 있고 기숙사 전용인터넷 선을 연결하면 보다 빠르긴 하나 사용용량에 따라 요금이 부담되고 선불카드 사용에 비해 약간 비쌉니다. 또한 swinnet이라는 무선 인터넷을 공짜로 이용할 수도 있으나 접속이 자주 끊깁니다. 따라서 한글을 이용하는 일이 아니라면 학교 컴퓨터를 이용하는 것이 좋은 방법이 될 수도 있습니다. 학교내에서 이용하는 컴퓨터는 공짜이며 속도도 매우 빠릅니다.
식사는 아파트의 경우는 세끼 모두 자체적으로 해결해야 합니다. 재료만 준비된다면 식사를 준비하는데 아무런 어려움이 없도록 부엌은 제대로 갖추어져 있고 재료 구입은 기숙사에서 5분정도만 걸어나가면 되는 대형슈퍼마켓인 safe way와 coles가 있으므로 재료 구입역시 아무런 불편함이 없을 것입니다.
또한 glenferrie는 각종 레스토랑이 즐비하여 있어 외식을 함에 있어서도 좋은 조건을 갖추고 있습니다. 세계 각국의 그리 비싸지 않은 가격에 맛볼 수 있고 한국인 식당또한 기숙사에서 십분 거리에 있습니다.
glenferrie에 한국 슈퍼마켓은 없으나 세 곳의 아시아 슈퍼에서 거의 모든 한국식품,물건을 구할 수 있습니다. city로 나가면 한국인 슈퍼가 따로 있지만 한국인 슈퍼에 있는 거의 대부분의 물건이 아시아 슈퍼에 있다고 보시면 됩니다. 김치 또한 세 슈퍼마켓 모두에서 3불정도의 저렴한 가격으로 구입할 수 있습니다. 따라서 출국하실때에 한국음식을 챙겨나갈 필요가 전혀 없습니다.
또 다른 거주 형태로는 학교밖에서 독립적으로 생활하는 share형태가 있습니다. share는 어떤 사람이 집 자체를 rent하고 share생을 구하는 방을 학교 게시판이나 인터넷 사이트를 통해서 올려놓는데 보통 방은 개인적으로 쓰게되고 공적구역(거실, 부엌, 화장실)은 공동으로 사용하며 전기세, 수도세, 전화세 등을 share하는 경우가 많습니다. 가격은 학교 기숙사에 비해 훨씬 저렴하나 (제가 있을 당시에 college형식의 기숙사는 일주일에 210불, apartment형식은 159불, share는 보통 전기세-수도세 제외해서 평균 110불 정도 이었습니다.) 그러나 share가 싸다는 장점이 있지만 share하는 사람들 사이에 결속력을 만들어줄 어떠한 공통점도 없으므로 집안에서 말한마디 안하고 사는 경우가 허다합니다. 학교 아파트에서 생활할 경우 같은 스윈번 학생이라는 공통점이 큰 결속력으로 작용하여 룸메이트끼리 가족같이 가깝고 정겹게 지낼수 있게 됩니다. 또한 기숙사에서 열리는 갖가지 행사나 파티에도 참석 할 수 없을 뿐만아니라 여러 보안이나 안전 면에서도 기숙사가(college, apartment) 교환학생이 거주하기에 월등히 나은 환경을 갖추었다고 생각합니다.","수업은 제가 경영학과인 관계로 경영학 수업을 중심으로 이야기 하도록 하겠습니다. 대부분의 경영학과 수업은 lecture와 tutorial수업으로 나누어져 진행되는데 보통 일주일에 lecture두시간 tutorial한시간으로 구성되어있습니다. lecture는 보통 나이가 많으신 정 교수님이 하시는 대형강의 형태이고 tutorial은 젊은 조교분들이 진행하시는데, lecture시간의 학생들이 여러분반으로 나뉘어져 각자의 tutrial반으로 들어가게 됩니다. 보통 lecture는 한 class에 100여명 정도가 되고 각 tutrial반은 20명 남짓 됩니다. lecture시간에는 보통 ppt나 교재, 유인물을 바탕으로 수업 진도를 나가고 tutorial시간에는 lecture시간에 했던 수업내용을 바탕으로 질문을 하기도 하고 받기도 하는등 feedback을 하게 됩니다. 팀 프로젝트의 발표나 중간 시험, case분석 등도 보통 tutorial시간에 이루어 지며 대개의 수업에서 tutorial 시간의 수업참여도를 평가하므로 질문에 대답도 열심히하고 lecture시간에 이해가 가지 않았던 부분이나 궁굼했던 점 등을 물어보면 좋을 것입니다.
호주의 수업 커리큘럼은 대체로 다른 나라에 비해 힘들다고 합니다. 경영학 수업의 경우 보통 거의 모든 수업에 팀 프로젝트가 있으며 중간시험을 두번에 걸쳐서 보는 경우가 많기 때문에 정규 시험만 총 세번을 보게 됩니다. 또한 쪽지시험도 잦고 케이스 분석등의 숙제도 틈틈히 주어지기 때문에 pass하는것을 결코 만만하게 볼 수 없습니다. 보통 대여섯개의 평가기준에 의해 취합된 점수의 합산이 50점이 넘지 못하면 non pass가 되는데 평가기준이 많다보니 각 평가기준에서 조금씩만 깎여도 합산하면 큰 점수가 되므로 수업준비와 시험준비를 소홀히 해서는 안됩니다.
도서관은 이용하기에 매우 편리하게 되어있습니다. 그러나 연세대학교에 비해 공부를 할수 있는 공간은 많지 않고 조모임이나 스터디 등을 할 수 있는 스터디 룸과 같은 공간은 많이 확보되어있습니다. 밀폐된 스터디룸은 1층 reception에서 ID카드를 가지고 대여 할 수 있으며 그곳에서 노트북이나 빔 프로젝터 등도 대여해 줍니다. 또한 시험기간에는 도서관을 24시간 개방하는데 이 기간동안 밤 10시 이후에 도서관을 이용하기 위해서는 따로 카드를 발급받아야 합니다. 이 카드 역시 1층 reception에서 발급받을 수 있습니다.
컴퓨터실은 hawthorn 캠퍼스의 경우 BA building(경영대), EN building(공대), 도서관에 위치하고 있습니다. 프린트는 선불카드를 사서 하게되는데 대부분의 수업자료 출력을 이곳에서 하게됩니다. 출력은 흑백 A4 기준으로 한장에 11cent이므로 그렇게 비싼 편은 아닙니다. 교재는 text book을 구입하게 하거나 교수님이 직접 제작하신 nox를 구입하도록 하는데 보통 text book은 100달러 정도 하고 nox는 20불 안팎 입니다. 학기초에 union building 2,3층에 있는 게시판이나 각 단과대 게시판을 보면 second hand 교재를 판다는 광고가 많이 걸리므로 이를 이용하거나, 소장하고 싶다면 union building 2층에 있는 서점에서 구입하면 됩니다.","스윈번의 본 국제교류부는 hawthorn 캠퍼스에 위치하나 Prahran 캠퍼스의 경우도 디자인 전공 교환학생들을 관리하는 국제교류부가 Prahran에 따로 존재합니다. 그러나 본 국제교류부가 hawthorn캠퍼스에 있는 관계로 대부분의 행사는 hawthorn에서 열리게 됩니다. 국제교류부는 BA building 8층에 있고 그곳에 가면 Sarah라는 담당자와 Karen이라는 담당자가 친절하고도 따뜻하게 맞아 줄 것입니다. (듣기에 올해부터는 Brett이라는 담당자가 주요 업무를 맞게 된다고 합니다.) 문제가 생기거나 부탁해야 할 일이 생기면 주저없이 찾아가서 고민도 털어놓고 상담하면 힘 닿는데 까지 도와주실 것입니다. 제 경우에는 스윈번에 도착하기 전부터 계속 메일 연락을 하여 여러가지 부탁도 하고 친분도 쌓았습니다.
그러나 스윈번의 경우 다른 교환대학에 비해 교환학생들을 위한 행사 자체는 많지 않습니다. 물론 매주 금요일 happy hour라고 하는 교환학생들 끼리 만나서 맥주도 마시며 이야기 하는 시간이 있긴 하지만 너무 자율적이다 보니 참여율이 떨어지는 게 사실입니다. 또한 기숙사 생활도 교환학생들끼리 하는것이 아니어서 교환학생들의 행동반경이 다르다보니 자신이 조금이라도 소극적으로 생활하다보면 교환학생들끼리 친하게 지내기가 어려울 수도 있습니다. 게다가 스윈번은 대개 미국과 유럽에서 교환학생이 오기때문에 동양인 교환학생을 찾아보기가 쉽지 않습니다. 따라서 초반부터 부끄러움을 버리고 모든 행사에 적극적으로 참여하고 서구 친구들과도 자신감있게 생활하는 것이 중요합니다. 저희의 경우는 국제교류부에서 주선해 주는 행사보다는 교환학생 친구들이 개인적으로 파티를 열어 서로서로 연락하여 어울려 놀았던 경우가 더 많았습니다. 그래도 국제교류부에서 교환학생들이 현지에 잘 적응하도록 매주 여러 행사나 여러 알아둘만한 정보를 담은 메일을 보내주기도 하고 여러가지로 신경을 써 주어서 매우 감사했습니다.","스윈번은 연세대학교 처럼 교내에 다양한 부대시설을 갖추고 있지는 않습니다. 그러나 체육관, 서점(문구류도 판매), 식당, 건강 서비스, 카페(저녁에는 주류도 판매함)등 주요 부대시설은 갖추고 있기에 학교생활하는데에 있어 하등의 불편함도 없습니다. Swinergy라고 불리는 체육관에서는 헬쓰, 요가, 필라테스, 복싱, 에어로빅 등의 체육활동 외에도 레져활동과 각종 여행등의 레크레이션도 주관하고 있습니다. 저는 헬쓰장을 이용했는데 헬쓰는 한달 50불이면 매일 자유로운 시간에 이용할 수 있어서 좋았습니다. 그밖에 요가, 필라테스, 복싱 에어로빅 등은 요일이 정해져 있어서 추가비용을 더 내면 참여할 수 있습니다. 레크레이션에는 ski trip, outback tour, rafting, sky diving, scuba diving등이 있는데 시중보다 저렴한 비용으로 참가할 수 있어 좋았습니다.
서점에서는 수업중에 쓰는 모든 교재와 참고서적을 구입할 수 있으며 각종 문구와 종이류, 간단한 소모품 등을 판매합니다. 이 역시 가격이 시중보다 싸며 종류도 다양하므로 이용하기에 좋았습니다. 교내 식당역시 시중보다 가격이 저렴하여 보통 4불정도이면 한 끼 식사를 해결 할 수 있었습니다. 또 haddson이라는 카페에서는 낮에는 커피와 소프트 드링크만, 저녁에는 주류도 판매하는데 야외에도 좌석이 마련되어있고 분위기 또한 좋아 늘 사람들로 붐비고 국제교류부에서 매주 마련하는 happy hour또한 그곳에서 열립니다.
동아리활동에 관심이 있다면 union building 1층에서 동아리에 관한 정보를 얻고 신청서를 작성해 제출하면 됩니다. 그러나 한학기 혹은 일년동안만 짧게 생활하고 돌아오는 교환학생으로서는 클럽활동 외에도 여러가지 경험하고 즐길것이 많기 때문에 동아리 활동은 약간 버거울 수도 있습니다.",특별한 문화적 충격은 없었던 것으로 기억합니다.,"우선적으로 교환생활 전반에 걸친 문제는 국제교류부에 문의하면 친절하게 도움을 주실 것입니다. 그리고 기숙사 생활을하다 발생하는 문제는 기숙사 1층 reception에 있는 Anne에게 문의하면 역시 친절하게 도움을 줄 것입니다. 또한 국제교류부에서 swinmate라고 불리는 도우미를 교환학생과 1대1로 연결해 주는데, 이 swinmate는 호주 현지학생으로서 타국으로 교환학생을 다녀온 경험이 있는 학생들로 구성되어있습니다. 보통 그 swinmate가 교환생활을 마치고 온 국가에서 온 교환학생과 연결해 주게 됩니다. 이 스윈메이트와 가깝게 지내면 현지인 만이 해결할 수 있는 부탁을 할수도 있고 친분관계도 넓어져 즐겁게 지낼 수 있을 것입니다. 또한 스윈메이트 말고도 국제교류부에서 처음 호주에 도착해서 오티가 시작되기 전까지 멜번 생활 및 학교생활에 관해 안내해주는 유학생 친구들을 연결해 주는데 그 친구를 통해서도 많은 도움을 받을 수 있었습니다.",지금도 그냥 떠올리기만 해도 미소지으며 행복해 질수 있는 소중한 한학기였습니다. 물론 힘들때도 있었고 좌절할 때도 있었지만 많은것을 배울 수 있었고 마냥 행복할 수 있었던 대학생활 최고의 한학기였습니다. 여러분들도 아름다운 도시 멜번에 있는 스윈번 대학으로 오셔서 대학생활 최고로 값지고 아름다운 한 때를 만들어가셨으면 좋겠습니다.
