gen_info,env_info,food_info,study_info,office_info,facil_info,mhct_info,help_info,etc_info
"스윈번 공과대학은 연세대학교에 비하면 매우 작습니다. 캠퍼스 끝에서 끝까지 매우 가깝습니다. 하지만 공과대학인만큼 디자인과 학생이나 공대학생들이 관심있어할 만한 여러가지 기계들이 있습니다. (ex. 3D 프린터, 레이저 커터, 열선커터, 비닐커터, 프로토타이핑 룸, 워크숍 등) 스윈번 공과대학은 Glenferrie역에서 가장 가까우며 한양대역이 한양대 안으로 들어와있듯, Glenferrie역도 학교 캠퍼스 내로 연결되어 있습니다. 멜버른의 기후는 매우 변덕스럽습니다. 다만 여름 기간은 완전한 건기로 비가 거의 오지 않고 습도도 매우 낮습니다. 여름에는 기온이 40도를 넘어갈 정도로 햇빛이 강합니다. 겨울에는 비가 자주 오고 거의 대부분 흐린 날씨입니다. 비가 오더라도 강한 비가 오는 날보다 흐린 날이 더 많습니다. 하루에도 비가 왔다 안 왔다 하는 날씨인지라 우산을 쓰고 다니지 않는 경우도 많습니다. 하지만 겨울이라고 해서 한국의 여름만큼 습하지는 않습니다.","앞서 말씀드렸듯이 학교에서 가장 가까운 역은 Glenferrie 역이고, Glenferrie 역사 안으로 Woolworths라는 대형마트가 들어와 있습니다. 이 woolworths에서 장을 보거나 학교 수업 중에 배고프면 간식을 사먹기도 합니다. 학교 주변으로 Bewon 이라는 한식당과 여러 아시안 퀴진들이 있습니다. 들리는 소문에는 Bewon은 19년 11월에 영업을 종료한다고 합니다.","학교에서 제공하는 기숙사는 기숙사라기보다는 일반 아파트입니다. 제공 업체가 사실은 학교가 아니라 사설 업체인지라 가격도 많이 비싼 편입니다. 신청 시기를 놓치면 입주가 거의 불가능하다 싶을 정도로 늘 만원입니다. 기숙사는 보통 집 하나에 방을 하나씩 assign하는 방식이며 집에는 부엌과 거실이 들어와있습니다. 방의 크기에 따라 같은 집에 살아도 rent를 다르게 냅니다. 저는 기숙사가 너무 비싸서 기숙사에 살지 않고, 스윈번에서 알려준 여러 사이트 (flatmate, swinburne housing data base, realestate.com.au 등)에서 직접 발품팔아서 shared flat을 구했습니다. 한인 사이트 (멜번스카이, 호주바다 등)를 이용하시는 것도 방법인데, 한인 사이트에는 glenferrie근처 매물이 잘 나오지 않습니다. 그렇지만 사람 일은 모르는 것이니 한 번쯤 확인해보세요!저는 한국에서도 외식은 거의 하지 않고 식단에 신경쓰는 편이라, 호주에서도 외식은 거의 하지 않아서 맛집 추천은 해드리기 어렵습니다. 하지만 요리 좋아하시면 장봐서 밥 해먹는 물가는 호주가 한국보다 싸서 식비는 많이 아끼실 수 있습니다. 외식을 하신다면 보통 외식비는 15불 선으로 생각하셔야 합니다. 학교 근처에서 10불 내외로 식사를 해결하실 수도 있지만, 저는 10불 내외의 식사도 그닥 만족스럽지 않아서 자주 먹지는 않았습니다.  학교 근처에 indo mart라는 아시안 식료품점도 있고 이 곳에 한국 식재료도 많이 팝니다. 한인 마트와 한인 식당은 시티에 여러 곳 있으니 특별히 꼭 먹고 싶은 음식이 있으실 때 방문해보세요! 참고로 저는 외식할 때 zomato라는 맛집 리뷰 어플에서 많이 검색해보았어요.","저는 크게 경영, 회계, 디자인 수업을 들었습니다. 제가 들었던 수업들은 전반적으로 쉬웠습니다. 디자인 수업은 어디를 가든 손이 많이 가고 품이 많이 듭니다. 팀플을 하게 될 경우는 팀원에 따라서 여러분의 한 학기 삶의 질이 달라집니다. 그런데 높은 확률로 한국인 학생들은 외국인 학생들이 해오는 과제의 수준에 만족하지 못해서 혼자 답답해 하는 것을 많이 봤습니다. 스윈번의 도서관은 많이 작아서 잘 이용하지 않았습니다. 도서관 1층은 Student HQ와 합쳐져서 학생들이 자유롭게 공부하고 이야기할 수 있는 공간으로 형성되어 있는데, 이 곳에서는 종종 시간을 보내기도 했습니다.","스윈번의 국제처에서는 교환 학생들이 잘 정착할 수 있도록 여러 이벤트를 기획합니다. 학기 초에 교환학생들을 위한 여러 Info Session 과 OT를 많이 하니 적극 활용해보세요! 그리고 학기 중에 시간표를 바꾸어야 할 때 연세대와 스윈번 국제처 모두와 이야기를 할 필요가 있는데, 스윈번 국제처에서는 대응이 조금 느린 편입니다. 그렇지만 꾸준히 두드리면 일이 처리되기는 합니다...","저는 한국에서부터 댄스스포츠와 운동을 좋아했어서 스윈번에 있는 탱고 동아리와 요가 동아리에 가입해서 활동했습니다. 스윈번에서  e이라는 사이트를 운영하는데, 여기서 스윈번에서 운영되는 동아리들을 볼 수 있습니다. 한국 동아리, 일본 동아리, 말레이시아 동아리 등 문화 관련 동아리도 많습니다. 또 여행 동아리도 있어서 호주에 있는 동안 멜버른 근교로 여기저기 탐험하고 싶으신 분들은 활용하셔도 좋을 것 같습니다. 저는 매주/ 격주로 들어가는 여행 경비가 부담스러워서 가입하지는 않았습니다.","제가 언더우드국제대학 소속이다 보니 컬쳐쇼크라고 할 만한 일을 겪지는 않은 것 같습니다. 외국인들의 느긋한, 하지만 저에게는 답답한 일처리때문에 복장이 여러 번 터졌던 것이 컬쳐 쇼크라면 컬쳐 쇼크라고 말할 수 있겠습니다.","스윈번의 국제처, 연세대의 국제처, 주변에서 사귀게 되는 친구들, 한국 영사/대사관에서 도움을 받으실 수 있습니다. 제 주변에서 여권이 물에 젖어서 파손되었던 분이 계셨는데, 한국 영사관 (대사관이었는지 잘은 기억이 안납니다)이 멀지 않은 곳에 있어서 바로 찾아가서 해결했다는 이야기를 들었습니다. 신변의 문제가 생겼을 때는 바로 한국 영사관, 대사관을 찾아 가세요. 시간표, 학교 생활 등의 문제가 생겼을 때는 스윈번의 국제처, 연세대의 국제처로 바로 이야기를 하시는 것이 좋습니다. 문제를 발견하셨을 때는 미루지 말고 바로 연락하세요. 바로 연락해도 답장이 늦게 옵니다. (가끔 제때제때 연락이 오기도 합니다)","호주에서의 1년을 저는 절대 후회하지 않아요! 외국 생활이 처음이시라면, 1년 동안 혼자 외국에 나와있는 게 어렵고 외로울 거에요. 그렇지만 너무 혼자 외로워말고 밖으로 열심히 다니고 호주의 맑은 공기와 좋은 자연을 맘껏 즐기세요!"
