gen_info,env_info,food_info,study_info,office_info,facil_info,mhct_info,help_info,etc_info
"그야말로 꿈같던 일년이었습니다. 우선 제 소중한 경험을 여러분께 알리게 되어 기쁘기 그지 없습니다. 또 이 글을 쓰려고 하니 지난 일년 동안의 셀 수 없이 많은 흐믓한 추억들이 떠오릅니다. 어떻게 이 기분을 설명할 수 있을까요? 
Swinburne Uni(호주에서는 대학교를 그냥 Uni라고 부릅니다)는 2005년 호주 연방정부의 Department of Science, Education and Training (DEST, 우리나라의 교육부 같은 부서)에 의하여 ‘No. 4 in Australia for Learning and Teaching Quality’에 선정되는 등 호주 내에서 꽤 그 이름이 알려진 대학교입니다. 특히 학교가 위치한 멜번(Melbourne, 우리나라에서는 주로 ‘멜버른’ 이라고 부르는 도시)을 비롯, Victoria주 전역에서 많은 학생들이 진학하는 학교입니다. 학교 이름에서 느껴지듯이 공대가 특히 강하고, 경영대 또한 우수하다고 알려졌습니다. 캠퍼스는 Victoria주 내에 Hawthorn, Croydon, Healesville, Lilydale, Prahran, Wantirna 6군데와 말레이시아의 Sarawak(말레이시아에서 온 친구에게 들은 바로는 말레이시아에서 가장 좋은 학교 중의 하나라고 한다), 총 7군데에 걸쳐 있는 꽤 큰 학교입니다. 각 Faculty에 따라 각 캠퍼스에 속해지는데, 공대와 경영대, 사과대 등 학교의 주된 학과들은 주로 본교인 Hawthorn 캠퍼스에 있으므로, 연대에서 파견되는 교환학생들은 주로 이 곳에서 수업 듣고 생활하게 될 것입니다. 이 중 Hawthorn 캠퍼스와 Prahran 캠퍼스가 멜번 시내에 위치했는데, 참고로 Prahran 캠퍼스는 미대, 특히 디자인과로 특화된 곳입니다. 스윈번 대학교는 호주에서 디자인과로도 유명하다고도 하더군요. 따라서 홍대 미대에서도 매학기 1명이 치열한 경쟁 끝에(홍대에서 온 학생에게 들은바에 의하면) 파견되는데 아마 그 학생이 전체 교환학생 커뮤니티에서 유일하게 만날 수 있는 한국인일 것입니다. 물론 그 학생은 다른 캠퍼스에서 생활하게 되므로 사실 자주 만날 기회도 없습니다. 주로 생활하는 집단에서 연대에서 파견되는 교환학생은(주로 한학기 딱 1명) 유일한 한국인이라고 생각하시면 될 겁니다. 온전히 외국 친구들과 어울리며, 외국 문화를 익히기에는 안성맞춤이죠. 
멜번은 빅토리아 주의 수도로써 호주에서 가장 긴 역사를 자랑하는 도시입니다. 시드니보다훨씬 앞서 이미 1956년에 올림픽을 치룬 도시입니다. 아시다시피 호주가 유럽과 아메리카, 아시아 등 전세계의 이민자들이 정착한 국가인데, 멜번은 초기 정착기이기도 하며 특히 19세기 골드러쉬 시기에 크게 번영하였습니다. 주로 초기부터 유러피안들이 정착한 곳이라 ‘호주의 유럽’이라는 별명답게 유럽식 건물과 문화, 분위기가 자리잡고 있습니다. 그만큼 너무나 아름답고, 시내 곳곳에 현대식 건물과 옛 건물, 너무나 예쁜 야라 강과 곳곳의 공원들이 어울린 그림에서나 볼 수 있을 법한 도시입니다. 혹시 KBS 드라마 “미안하다 사랑한다”를 보신 분 이라면 멜번의 한 모습을 잘 아실 것입니다. 두 남녀 주인공이 처음 만났던 장소, 해외 로케 촬영지가 바로 멜번 이었으니까요. 호주 대륙의 동남쪽에 위치하여 있고, 바다와도 닿아 있어서 St. Kilda 비치처럼 아름다운 해변, 또 멜번 항구도 시내에 위치하고 있습니다. 이해를 돕자면, 빅토리아 주는 우리나라의 경상도 정도의 위치로 생각하시면 되고(물론 빅토리아 주는 우리 나라 전체보다도 훨씬 큽니다), 멜번은 그 중 부산으로 생각하시면 됩니다. 
매년 유엔 조사에서 전세계 살기 좋은 도시 1위에 뽑히는 도시인 만큼 생활여건이나 기후, 자연환경이 훌륭합니다. 바닷가에 위치하고 있어서 하루 중에도 날씨가 변덕스럽기는 하고, 호주의 우기인 겨울(6월~8월)에는 흐린 날씨가 가끔 있기도 합니다. 하지만 겨울이라도 그리 춥지 않고(한밤에도 최저기온 영상 5도 정도), 여름에는 건기라서 30도 안팎의 기온이지만 땀이 별로 나지 않고, 그늘에만 들어가면 시원함을 느낄 수 있습니다. 그러나 날씨만 맑다면 구름 한 점 없는 파란 하늘 아래 펼쳐진 햇살 어린 아름다운 시내를 감상할 수 있고, 시내의 야경 또한 일품입니다. 하지만 바다에 근접해 있어서인지 해가 진 뒤는 꽤 추운 편이며, 유러피안 스타일의 집들인 만큼 난방 시설이 잘 안되어 있어서 방안에서는 특히 추운 편입니다. 개인적으로는 한국에서 준비해 간 전기 장판을 꽤 유용하게 사용하였습니다. 전기장판은 잠잘 때만 사용할 수 있기에 취침시간 외에는 추위를 이기기 위해서 현지에서 조그마한 히터를 사기도 했습니다. 20불 정도 했던 걸로 기억하는데 얼마 비싸지 않으니까 하나 구입하시는 것도 좋을 듯 합니다. 비는 자주 내리지 않고, 내리더라도 우리나라처럼 폭우가 아니라 가랑비 정도 이므로, 우산을 쓸 일이 거의 없었습니다. 또 산성비가 아니라서 호주인들은 그냥 맞고 다니더군요.","사실 행정구역상 멜번은 멜번 시티만을 가르킵니다. 우리나라의 서울 도심과 같은 CBD만을 가르키지요. 그 외에는 각 Suburb로 이루어져 있습니다. Hawthorn도 그 suburb중 하나입니다만, 멜번 시티와는 Train(우리나라의 지하철)으로 불과 15분 거리, 차로는 10분도 걸리지 않는 거리이므로 그냥 시내로 봐도 무방합니다. 실제로 많은 학생들이 멜번 시티에서 거주하며 통학합니다. 저는 연대학생들이 주로 생활하게 될 Hawthorn 캠퍼스만을 중심으로 설명하겠습니다. 호손 캠퍼스는 Glenferrie Rd.에 위치해 있습니다. 참고로 호주의 주소체계는 우리나라처럼 동으로 구분짓는 것이 아니라 Street와 Road로 구분됩니다. 예를 들면 ‘Flinders St. 123’ 이렇게 말입니다. 사실 글렌페리 로드는 굉장히 긴 길인데, 그 중 train 라인의 ‘Glenferrie’ 역이 바로 호손 캠퍼스와 닿아 있습니다. 따라서 굉장히 교통이 편리한 곳입니다. 길에는 버스와 Tram이 다닙니다. 전차로 생각하시면 되는데 호주 전체에서 특히 멜번에 트램이 잘 발달하여 있습니다. 길 한가운데에 다니는 트램의 모습이 멜번 특유의 낭만을 더합니다. 시간되시면 카메라 하나 들고 트램에 올라타 멜번 곳곳을 구경하시는 것도 좋습니다. 참, 학생을 위하여 주 정부에서 컨세션 카드가 발급됩니다. 멜번의 교통시설을 50%할인 받을 수 있죠. 이는 유학생에게는 허락되지 않고 호주 시민들에게만 지급되는데, 우리 교환학생에게는 특별히 똑같이 발급됩니다. 교환학생이 아닌 다른 유학생들에게 늘 부러움의 대상이었던 걸로 기억합니다. 발급은 스윈번대학교에 도착을 신고하자마자 교환학생처에서 친절히 안내해주므로 걱정하실 필요 없습니다. 참고로 교통비는 2시간 짜리는 1.9달러(컨세션 적용하여), 종일은 3.2달러였습니다. 일요일에는 선데이 세이버라고 해서 2.5달러에 종일 이용할 수 있는 표가 있으므로 그것을 사용하는 것이 현명합니다. 
또 캠퍼스 주변 글렌페리에는 큰 공원도 있고, 종합 운동시설도 있습니다. 이 곳에는 50m, 깊이 3m의 실외 수영장이 있는데, 자유롭게 물장난 하는 야외 풀장으로 생각하시면 안되고 여러 라인이 있는 주민들을 위한 운동 시설입니다. 스윈번 유니 학생들은 특별히 무료로 이용할 수 있습니다. 개인적으로 수영을 좋아하느라 따뜻한 햇볕 아래 자주 수영을 하곤 했습니다. 재미있는 사실은 지난 봄 우리나라의 박태환 선수가 멜번 세계 수영 선수권 대회 기간 동안 훈련을 한 곳이기도 합니다. TV에서 박태환 선수가 바로 제가 수영하던 그곳에서 훈련 하는 모습을 보고 무척 반가웠던 기억이 납니다. 
멜번의 어느 거리나 각종 레스토랑이 즐비합니다. 특히 이민자들의 나라인 만큼 너무나 다양한 민족, 나라들의 정통 음식점이 그들의 진짜 솜씨대로 펼쳐집니다. 캠퍼스 주변만해도 베트남, 타이, 중국(중국 각 지역별로), 일본, 이태리, 그리스, 인도, 인도네시아, 말레이시아, 포루투갈, 프랑스 등 셀 수 없이 많은 음식점 들이 진짜 그곳에서 온 주인, 요리사들에 의하여 운영되고 있습니다. 가격도 그리 비싸지 않아서, 싸게는 10달러 안팎, 비싸도 30달러 안팎이면 요리를 맛볼 수 있습니다. 물론 한국 음식점도 한군데 있습니다. 멕도날드, 서브웨이, 스타벅스는 세계 여느 곳처럼 당연히 있구요. 하지만 한국에서 맛 볼 수 없었던 신기한 음식들이 즐비하다 보니 그런 곳에는 잘 안 가게 되더군요. 
호주의 차별화되는 한가지 장점으로는 굉장히 안전한 곳이라는 것입니다. 총기 소유가 허용되지 않고, 인권이 무엇보다 존중되는 선진국이므로 치안의 위협은 전혀 느낄 수 없었습니다. 자신들의 삶을 소중히 여기는 사람들이라서 상점들도 오후 6시 정도면 문을 닫지만(멜번 시티는 예외) 음식점, 술집(pub), 클럽 들은 새벽까지 문을 엽니다. 밤이 되면 거리에는 친구들과 술 한잔 같이 한 친구들을 많이 볼 수 있습니다. 그러나 어디까지나 안전하고, 친구들과 가까워지기에는 가장 좋은 방법이므로 벽을 쌓고 피하는 것이 그리 좋은 방법은 아닌 것 같습니다. 
주변에 각종 편의시설은 모두 있습니다. 은행도 회사별로 서너군데 있고(학생카드와 여권만 있으면 계좌 오픈은 무척 쉽습니다. 학생은 계좌사용이 무료입니다), 대형 슈퍼마켓도 Coles, Safeway(Woolworth) 모두 있습니다. 호주에서는 이 두개 브랜드가 주요 유통업체입니다. 생활에 필요한 것은 주로 여기서 모두 구할 수 있습니다.","저는 두학기동안 캠퍼스 내의 기숙사에서 생활했습니다. 기숙사는 크게 세가지 종류가 있습니다. Student residence(전통적인 기숙사 형태, 1인 1실), Student apartment(2인이나, 3인이 각자의 방을 쓰며 아파트 하나를 쉐어하는 형태), 최근에 새로 지은 아파트인 Swinburne place(이 역시 2인부터 4인까지 쉐어하는 아파트 형태이나 새로 지은 덕에 보다 현대적이고 세련된 디자인이지만 좀 더 비쌈) 이렇게 세가지 입니다. 이중 두번째 학생 아파트는 세 군데에 걸쳐서 세 동이 있는데, 저는 William st.의 아파트에 살았습니다. 캠퍼스 한가운데의 수업 듣는 건물들 가운데에 있어서 무척 좋았고, 무엇보다도 Luke라는 호주친구와 Julian이라는 프랑스 친구와 일년을 함께 할 수 있어서 무척 좋았습니다. 개인적으로 교환학생 생활의 성공은 어떤 친구들과 Flat mate가 되고 그들과 어떻게 지내느냐가 많은 비중을 차지 하는 것 같습니다. 그것이 영어 목적이든지, 문화 교류 목적이든지, 글로벌 우정을 나누는 일이든지 말입니다. 하루 중 가장 많은 시간을 함께 보내기 때문입니다. 너무나도 친절히 모든 것을 살펴주던 루크 덕분에 호주인과 호주 사회, 문화에 대해 깊이 알 수 있었고, 또 파리지앙(그의 자랑) 줄리안 덕분에 유러피안들의 문화와 생활 양식도 익힐 수 있었습니다. 그들과 깊은 우정을 나누었고 덕분에 차로 5시간 거리(여전히 빅토리아 주)의 Port fairy에 있는 루크의 집에 초청받아 호주의 전형적인 가정에 일주일 가까이 머물기도 하였습니다. 줄리안과는 늘 파티에 동행하였으며 울룰루(에어즈락) 등의 호주 아웃백을 함께 여행하기도 하였습니다. 그 밖에도 호주는 물론 세계 각지에서 온 많은 이웃들과 너무도 친해져서 함께 교류하고 우정을 나누었습니다. 물론 기숙사가 아닌 캠퍼스 밖에서 ‘쉐어’(현지에선 우리나라 자취나 월세의 개념을 이렇게 부릅니다)를 구하는 것도 그리 어렵지는 않습니다. 기숙사보다 싼 편이고 잘만 구하면 시설도 괜찮습니다만 교환학생으로서 경험할 수 있는 것 중 가장 큰 것이 외국 친구들과의 우정 쌓기, 문화 교류라면 자연스럽게 그것을 이루는 기회를 제공하는 기숙사 생활을 추천하고 싶습니다. 물론 그 안에서도 자기가 하기 나름임은 분명합니다. 자신이 먼저 적극적으로 다가가야 하고 먼저 호의를 베풀어야 합니다. 외국인 특히 백인들은 분명 친절하고 매너도 나이스 하지만, 타인 특히 자신들과 생김새가 다른 아시안에게 먼저 다가오는 경우는 많지 않습니다. 그것은 그들이 아시안을 차별해서가 아니라, 타인에 대한 낯설음, 두려움 때문이고 굳이 그렇게 하지 않아도 그들은 아쉬운 것이 없기 때문입니다. 
기숙사 아파트에는 일반 가정집과 같은 형태이기에 3명이 같이 쓰는 주방이 있고 요리를 자유롭게 할 수 있습니다. 사실 교환 학생 생활에서 가장 어려운 것 중의 하나가 먹고 사는 문제인데, 저 같은 경우에는 출국 전에 할 줄 아는 요리가 아무것도 없었지만 막상 현실에 마주치니 하나 하나 할 줄 아는 요리가 늘더군요. 파스타 같이 간단한 것은 외국 친구들한테 배운 것도 있었고, 나름대로 응용도 하게 되고 말이죠. 주변에 슈퍼도 있고 아시안 마켓도 있으니 재료도 많습니다. 호주는 고기가 품질이 좋고 싸기로 유명한 나라입니다. 도심만 벗어나면 끝이 보이지 않는 초원에 방목되어서 한가로이 풀을 뜯고 있는 소, 양 들을 언제나 볼 수 있는 나라입니다. 따라서 소고기 값도 엄청 싸지요. 소고기가 닭고기 가격보다 싸기도 하니까요. 덕분에 매일같이 고기를 구워먹었던 기억이 납니다. 김치도 비싸지 않은 가격(500g에 3.5불이었음)에 바로 앞 아시안 마켓에서 구할 수 있습니다. 또, 호주는 음식 소스가 매우 발달해 있어서 마켓에 가면 다양한 브랜드에서 내 놓은 각종 flavour의 소스를 구할 수가 있습니다. 외국 친구들은 주로 그것을 사다가 후라이팬에 고기와 함께 익혀서 밥이나 빵과 함께 먹더군요. 매우 간단합니다. 우리는 가끔 자기 나라의 요리를 선보이기도 하며 자주 식사를 같이 하였고 때로는 다른 친구가 살고 있는 이웃집에 초대되어서 또 그 나라 음식을 맛보기도 하였습니다. 외국 친구들과 가까워 지는 방법이라는 측면에서는 한 두개 한국 요리 하는 법을 익혀서 가는 것도 좋은 방법인 것 같습니다. 참고로 제 프렌치 플렛메이트는 한국의 라면과 김치에 중독되어서 나중에는 자기가 직접 아시안 마켓에 가서 그것들을 늘 사다가 먹곤 하였죠. 서양 애들에게도 우리나라의 맵고 자극적인 음식이 충분히 어필하니까 선보이면 좋아할 것 같습니다. 
만약, 그런 것 보다는 멜번 시티의 이국적이고 아름다운 주/야경, 다양한 문화적 행사, 볼거리 정취를 원 없이 즐기고 싶다고 생각하시는 분이라면 시티에 사는 것도 좋습니다. 기숙사비와 비교했을 때 특별히 비싼 것도 아니고(물론 통학 시에 추가적인 교통비는 들겠지만) 멜번은 그야말로 문화의 도시이기 때문에 모든 곳이 각각의 특별한 아름다움을 간직한 곳입니다. 큰 행사나 유명한 레스토랑, 파티, 클럽 들은 시티에 있기 때문에 막차 시간(주로 자정 안팎)에 쫓겨 아쉬움을 남긴 채 귀가해야 되는 일도 없겠죠. 또, 어짜피 룸메이트를 구해서 같이 살아가기 때문에 문화적 교류도 자기가 하기 나름에 따라 할 수 있습니다. 또 교환학생들끼리, 또 그 외의 학생들끼리 네트워크가 형성되는데(이 네트워크는 멜번 내의 다른 대학교들까지 연결되기도 합니다) 많은 학생들이 실제로 시티에도 살기 때문에 각자 자신의 집으로 친구들을 초대해서 파티를 열기도 합니다. 수많은 파티를 통해 서로를 더 알아가고 우정을 나누는 것 이것은 교환학생 생활의 가장 큰 즐거움 중의 하나이기도 합니다.","호주의 커리큘럼은 우리와는 조금 다릅니다. 한 학기 최대 50 credit까지 들을 수 있는데 주로 한과목이 12.5 credit이므로 4과목까지 수강할 수 있습니다. 과목에 따라 한 주에 할애하는 시간은 다른데, 제가 수강했던 과목들은 주로 주당 3시간짜리 수업이었습니다. 또한, 각 과목은 lecture와 tutorial시간으로 구성되어 있습니다. Lecture는 대형 강의이고 tutorial은 소규모 학습시간입니다. 과목에 따라 렉쳐의 이해를 돕는 문제풀이 시간일 수도 있고 토론 수업일 수도 있으며 개인 또는 그룹별 발표 시간일 수도 있습니다. 과목에 따라 둘 간의 비율은 다릅니다. 공대나 이과대에서 수업했던 친구들에 의하면 그 쪽에는 lab시간도 많다고 합니다. 제가 속해지는 Faculty of Business의 경우, 우리와는 달리 호주는 전공이 세분화되어 있습니다. 즉 그냥 우리처럼 경영학과가 아니라 Accounting, Finance, International business, Marketing, HR, Business law 등 각각의 전공 코스로 세분화 되어 있는 것이죠. 그만큼 각 세부 전공에 따른 다양한 과목들이 있습니다. 연대 보다 더 세부적이고 다양한 전공 과목들이 있습니다. 으레 처음 자기소개 할 때 늘 주고 받는 질문이 “너 무슨 공부해? 무슨 전공이야?”인데, 제가 “경영학” 이러면 좀 의아하게 생각합니다. 그러면 한국은 그냥 경영학과로 자신이 관심을 갖는 과목을 자유롭게 수강할 수 있다라고 설명하면 그제서야 이해들을 하곤 하죠. 하지만 걱정하실 필요는 없습니다. 교환학생은 특별한 제한 없이 선수 기초과목만 수강하였다면 아무 과목이나 원하는 과목을 수강하게끔 해 줍니다. 
한가지 수업에서 크게 다름을 느낄 수 있는 점은 교수님과 학생과의 격이 없고 너무나 자유롭게 열띤 수업을 벌인다는 점입니다. 철저하게 문답식으로 주고 받는 식이죠. 학생들이 교수님을 어려워하지 않고 그저 선배 정도로 여기는 것 같습니다. 이는 그들의 문화방식이기도 하죠. 호주에서는 교수님을 Professor라고 부르지 않고 그냥 Lecturer라고 부릅니다. 권위의식을 갖지 않는 것이죠. 그리고 호칭은 그냥 친구처럼 서로의 이름으로 합니다. 농담을 주고 받기도 하구요. 수업 중에 자신의 생각을 자유롭게 쏟아 낼 수 있고 그것을 통해 서로가 발전해 가는 모습이 부러웠습니다. 수업에 있어서 lecturer나 tutor가 아시안이라고, 잠시 머물다 가는 교환학생이라고 차별을 하거나 불이익을 주는 경우는 전혀 없습니다. 오히려 친절하게 학습에 도움을 주려고 합니다. 그렇다고 평가에 있어서 점수를 후하게 주는 등의 특혜를 주는 경우는 없습니다. 
호주 대학가는 우리처럼 중간고사 시즌, 기말고사 시즌, 사이의 좀 널널하게 숨돌리는 시즌이 따로 없습니다. 3개월 남짓 되는 한 학기 동안 쉴새 없이 리포트 과제와 시험, 발표 등이 이루어집니다. 그리고 종강 후에 약 3주간의 기말고사 시즌이 따로 있습니다. 따라서 자연스럽게 호주 학생들은 한 학기 내내 열심히 공부를 하더군요. 과목을 패스 하려면 한학기 내내 열심히 하셔야 합니다. 성적 평가 제도는 여느 호주 대학교들처럼 절대평가이며 HD(high distinction, 85~100%), D(distinction, 75~84%), C(credit 65~74%), P(pass, 50~64%), Not pass(낙제)로 이루어집니다. 적어도 낙제를 피하고 학점을 이수하려면 교수님이 요구하는 것의 반 이상은 따라가야 한다는 말입니다. 쉬워 보일 수도 있으나 그리 쉽지만은 않습니다. 발표나 리포트, 중간 중간의 short test 또는 multiple test는 그럭저럭 따라간다 해도 기말고사는 한 학기 전체의 수업을 범위로, 때로는 교과서 전체를 봐야 할 경우도 있는데 특히 대개 한 두 시간에 걸쳐서 주어진 문제에 대하여 몇 장의 에세이를 써야 하는 방식입니다. 벼락치기는 무척 힘들기 때문에 평소에 공부하는 습관을 들여야 합니다.
스윈번 유니는 블랙보드라는 웹 시스템을 제공합니다. 우리의 와이섹 같은 개념이지요. 여기에 각 과목의 lecturer들이 강의 pt와 각종 학습 자료를 올립니다. 교과서를 꼼꼼히 준비하기는 쉽지 않으므로 이 강의안들을 효과적으로 이용하는 지혜가 필요합니다. 미리미리 출력해가서 필기를 한다면 도움이 많이 될 것입니다.
제가 두학기에 들었던 과목들은 다음과 같습니다.
<1학기>
Australia: a global context – 호주의 역사, 문화, 정치, 경제 등을 살펴보는 과목. 과목 성격답게 교환학생 친구들이 많이 수강하였음
Academic communication skills – 어떻게 영문으로 리포트를 쓰고 표현, 인용을 하며, 발표를 하는지 등에 대하여 배우는 수업으로 정통으로 그들의 방식을 배울 수 있어서 좋았음. 과목의 성격답게 비 영어권 유학생들이 많이 수강 
Macroeconomics – 거시 경제학
Human resource management in contemporary organisations – 인적자원관리. 주로 발표와 문답으로 이루어짐
<2학기>
International Finance – 국제 재무. 주로 외환 거래에 대해 경제학적으로 접근하는 수업. 꽤 어려웠던 과목
Foundations of international business – 국제 경영학의 입문과목. 국제 무역, 경제 경영 이슈에 대해 그들의 시각으로 살펴 볼 수 있었음
Law in global business – 영국을 위시한 Common law 중 상법에 대하여 배우는 과목. 개인적으로 가장 어려웠던 과목. 근대 common law의 수많은 케이스와 그 의미, 응용을 까다로운 법률 어휘로 구성된 영어로 배워야 했음. 특히 케이스 풀이를 해야 했던 기말고사의 압박.
Business strategy – 경영 전략. 과제가 많긴 하였지만 나름대로 재미있었고, 특히 tutorial 시간에 꼬박 두시간 동안 조원 3명이 다임러 크라이슬러에 대해 발표하던 잊지 못할 기억이 남.","스윈번 유니에서 좋았던 점 중 하나는 다른 학교들과 비교했을 때 학기 내내 교환학생들을 특별히 배려하고 많은 행사를 기획하며 생활을 보살펴 준다는 점이었습니다. 교환학생처의 Xenia가 스윈번에서 머무는 교환학생들을 보살피는 역할을 하고 있습니다. 너무나 나이스하고 친근한 누나 같은 사람이므로 아무 거리감 없이 다가갈 수 있을 것입니다. 이미 오리엔테이션 이전에 웰컴 세션을 갖고 학교에 도착하는 데로 생활을 안내하고 편의를 제공합니다. 오리엔테이션 시간을 통해 교환학생들과의 네트워킹 형성을 돕는 여행, 식사 시간 등의 자리를 마련하구요. 이에 관한 정보는 출국 전부터 메일을 통해 친절히 안내됩니다. 학기 중에도 교환학생들만을 대상으로 footy(호주식 럭비로 호주의 가장 인기있는 스포츠) 경기를 함께 관람하는 등의 다채로운 행사가 있고, 특히 ‘swin mate’라고 해서 호주 로컬 학생을 멘토로 엮어줍니다. 저는 운 좋게도 Kevin이라는 좋은 친구를 소개받아서 도움을 많이 받았습니다. 그 친구는 모바일 폰을 일년동안 빌려주기도 하였지요. 지난 주에는 저를 보겠다고 한국에 며칠간 한국에 놀러 오기도 하였습니다. 또 스윈번 학교 자체적으로도 국제 유학생들을 위한 프로그램이 잘 갖추어져 있어서, 유학생들에게 많은 편의를 제공합니다. 영어가 부족한 학생들을 위하여 특별한 영어 수업을 무료로 제공하기도 하고, 리포트 작성을 도와주는 부서도 있습니다. 가장 좋았던 서비스는 한달에도 몇 차례 거의 매 주말에 걸쳐서 멜번 근교 명소에 다녀오는 단체 일일 투어를 기획하는 것이었습니다. 차를 가지고 있지 않은 유학생들에게 유명한 장소를 친구들과 저렴한 가격으로 다녀오는 것은 스윈번 유니만의 독특한 서비스였습니다. 방학 때에는 일주일 이상의 큰 규모의 여행도 있어서, 앨리스 스프링스의 울룰루, 킹스캐년 등으로의 아웃백 투어와 타즈매니아(우리나라의 제주도 같은 성격의 남쪽 바다 큰 섬) 여행이 있었습니다. 주로 교환학생들이 많이 가기 때문에 우정을 더욱 깊이 하는데 좋은 기회입니다. 저는 독일, 멕시코 교환학생 친구들과 타즈매니아 투어를 다녀왔었는데 재미있었습니다. 이러한 모든 정보들은 모두 스윈번에 등록된 메일로 전달됩니다. 학교내 정보 뿐만 아니라 현재 멜번에서 벌어지고 있는 문화 행사 정보들도 많으므로 이 정보들만 잘 챙겨도 즐거운 교환학생 생활을 하는 데에 큰 도움이 될 것입니다. 
스윈번 유니에서 한학기에 교환학생은 약 100명 가까이 됩니다. 이중 미국, 멕시코, 독일에서 온 친구들이 많은 부분을 차지하고 있고, 그 밖에도 네덜란드, 덴마트, 노르웨이, 핀란드, 이태리, 프랑스 등의 유럽국가 들에서 온 친구들이 대부분입니다. 그 밖에는 약간의 일본 친구들과 저와 홍대 미대에서 온 한국인 친구였습니다. 자연스럽게 교환학생들끼리 교감을 갖고 네트워크를 형성하게 됩니다. 호주에서 생활하면서 가장 친한 친구들도 이 중에서 만나기 쉽습니다. 기숙사에 살던, 멜번 시티를 비롯한 밖에서 살던 간에 자주 각자의 집에서 파티를 갖고 우정을 나눕니다. 이 때 BYO(bring your own drink)라고 해서 자기가 마실 거리는 가지고 가는 것이 암묵적인 매너입니다. 외국 문화를 접하고 그들에 대해서 이해할 수 있는 가장 좋은 기회이므로 가능한 한 많이 참석해서 자신을 알리고 친구를 만들어 나가는 것이 중요합니다. 개인적으로는 거의 매주 열렸던 멕시칸 파티와(그들은 정말 쿨하고 정열적입니다) 서로가 괴기한 분장에 여념 없던 할로윈 파티가 가장 재미있었던 것 같습니다. 하지만 중요한 것은 다시 한번 얘기하지만, 먼저 자신을 열고 다가가야 한다는 점입니다. 처음에는 그들의 다양한 인사말조차 알아듣기 힘들고 자신이 영어도 잘 못하는 생김새 다른 유일한 아시안이라 할지라도, 그렇게 다가가다 보면 언제간 진정한 친구가 되어 있을 것입니다. 저 같은 경우에는 늘 적극적으로 부딪히려 하였고 그들의 주류에 서서 우정을 나누고자 노력하였습니다. 친구들도 저를 인정해주었고, 일례로 핀란드 친구는 학기가 끝난 뒤 호주 동부 해안 여행을 먼저 저에게 제안하기도 하였습니다. 유럽 친구들과 4wd 차를 렌트해서 골드코스트를 시작해서 브리즈번을 거쳐 프레이져 아일랜드까지 한달 가까이 호주 곳곳의 아름다운 자연을 구경했던 여행은 가장 소중한 추억입니다.","앞에서 말씀드린 주민들을 위한 학교 밖 운동, 레크레이션 시설 외에 학교 내에서 ‘swinergy’라는 조그마한 gym이 있습니다. 학생을 대상으로 하니 그리 비싸진 않은 것 같구요. 또 Union building(우리의 학관 정도)에는 서점이 있고, 학습에 필요한 교과서 및 문구류는 여기에 있습니다. 하지만 기숙사에 산다면 꽤 괜찮은 도서관이 바로 앞에 있으므로 비싼 교과서가 부담된다면 굳이 살 필요는 없을 것 같습니다. 필요한 책들이 여러 권 비치되어 있기 때문입니다. 또 중고 책 매매 가 활발하므로 학기초에 중고책을 구입하거나 자신의 책을 다시 팔 수 있는 기회도 많습니다. 도서관에 아쉬웠던 점은 수업관련 책들은 많으나 가볍게 읽을 수 있는 소설류의 책이 부족했던 점이었습니다. 컴퓨터 랩은 도서관과 공대 건물에 마련되어 있는데 저는 주로 출력을 위해 이용했었습니다. 충전식 프린트 카드를 구하시면 됩니다. 개인적으로 한국에서 가져간 물건 중 가장 유용했던 물건은 랩탑이었으므로 없으신 분은 하나 장만하여 가시면 좋습니다. 과제 등을 위해서 원하는 시간에 자유롭게 사용할 수 있고 한글 윈도우가 깔려 있으니까요. Union building에는 많은 동아리가 있습니다. 학기초에 우리 들처럼 데스크를 설치하고 홍보활동을 하기도 합니다. 또 학생회 활동이 활발합니다. 특히 국제 학생회가 잘 운영되는 듯한 느낌을 받았습니다. 학교의 지원을 받아 학기 중에 여러 활동을 하고 한 주에 걸쳐 international fair를 열기도 합니다. 캠퍼스 안에서 여러 국가의 문화행사를 열고 음식을 접대하기도 합니다. 교환학생들은 단기간 동안 머물고 이미 자신들의 커뮤니티가 있기에 대개 여기에서 활동하진 않지만 관심이 있으시다면 가입해서 활동하는 것은 어렵지 않고 누구에게나 열려있으니 활동하신다면 좋은 경험을 쌓으실 것 같습니다.","특별한 culture shock는 없었습니다만, 굳이 얘기하자면 호주는 너무나도 ‘Multicultural’ 사회라는 점입니다. 정부의, 사회의 지침이 이것이고, 호주 국민들은 어렸을 때부터 철저하게 이것에 대해 교육을 받습니다. 오히려 우리가 우리 자신, 다른 민족에 갖고 있는 선입견들을 그들이 이상하게 생각할 정도로 말입니다. 그것은 호주가 철저히 이민자들이 정착한 국가이고 이민자들이 건설하고 성장시킨 국가이기 때문입니다. 원주민인 aborigine은 물론, 다양한 민족의 고유한 문화를 인정하고 보존하려고 노력하는 모습을 볼 수 있었습니다. TV에서는 늘 이에 대한 계몽 광고가 나오고 아예 다민족을 위한 공중파 채널(SBS)이 있을 정도 입니다. 멜번에서 가장 좋았던 점 중의 하나는 매주 새로운 문화적 경험을 위하여 멜번 곳곳을 돌아다니는 것이었습니다. 예를 들어 시티 근처의 어느 한곳의 스페니쉬 클럽에 가서, 나이 지긋한 스페인 할아버지의 스페니쉬 기타 선율과 구슬픈 노래에 맞춰 진짜 스페인 남녀 댄서의 플라멩고 댄스를 보면서 스페인 음식을 먹고 있으면 그 2시간 동안은 내가 진짜 스페인에 여행 와 있는 기분이었습니다. 호주, 또 멜번은 이렇게 multicultural을 사랑하고 지키려고 하는 도시이며 여러분이 그곳에 가신다면 이렇게 다양한 문화의 향기에 흠뻑 젖을 수 있습니다.","우선 가장 도움을 줄 수 있는 사람은 국제교류부의 교환학생 담당인 Xenia입니다. 언제든지 그녀와 만날 수 있습니다. 기숙사에 살고 있다면 기숙사 담당인 Ann이 주거와 관련된 도움을 줄 것입니다. 그 밖에도 수업에 관련된 사항이라면 담당 교수, lecturer를 찾아가는 것이 가장 빠른 방법일 것입니다.","20여 년을 살아오던 영역을 벗어나 태평양 건너 먼 타향에서 살아간다는 것이 쉽지만은 않았던 것이 사실입니다. 그러나 어떠한 후회도 남지 않는 행복한 기억만이 가득한 일년이었습니다. 지금까지 살아 오는 동안 가장 멋진 시간이었고 최고의 일년이었다고 자신 있게 말할 수 있습니다. 그곳 스윈번 캠퍼스에서, 멜번에서, 호주 전역을 여행하며 얻었던 소중한 추억, 친구들과의 우정, 고마웠던 사람들, 자연 풍경 하나하나가 아직도 머리 속에 가득합니다. 진정한 평화가 무엇인지, 여유가 무엇인지를 가르쳐준 시간이었습니다. 여러분께 자신 있게 권해드릴 수 있는 학교, 도시, 나라입니다. 여러분도 그곳에서 소중한 추억 만들어 가시기를 바랍니다."
