gen_info,env_info,food_info,study_info,office_info,facil_info,mhct_info,help_info,etc_info
"York University는 토론토에서 토론토 대학교 다음으로 규모가 큰 종합대학입니다. 그리고 캐나다 내에서는 3번째로 큰 종합대학입니다. 홈페이지에 따르면 47,062의 학부생, 6,143 대학원생이 다닌다고 하네요. (이는 full-time과 part-time을 합친 수치입니다.) 홈페이지에서 학교 MAP을 보시면 아시겠지만 캠퍼스 규모가 꽤나 크며 연세대 보다 조금 큰 규모라고 보시면 될 것 같습니다. 
 토론토 내에는 두 개의 York U의 캠퍼스가 위치해 있는데, 하나는 Keele Campus로 Keele 4700 Keele Street, Toronto, Ontario, M3J 1P3(Tel : 416-736-2100)에 소재하고 있습니다. 다른 하나는 Glendon Campus인데, 2275 Bayview Avenue Toronto, Ontario, M4N 3M6 에 위치하고 있습니다. Glendon Campus의 경우에는 French만 사용하도록 특화된 캠퍼스로 많은 수업들이 French로 진행되고 있습니다. 저는 Keele Campus에서 주로 수업을 들었는데요. 곳곳에 호수가 있고 잔디 및 조형물이 있어서 캠퍼스는 전반적으로 아기자기한 편입니다.
 기후에 대해서 말씀 드리자면, 캐나다는 아메리카 대륙에서 북쪽에 위치하고 있기 때문에 전반적으로 겨울이 긴 편입니다. 보통 10월부터 3-4월까지 겨울 날씨가 유지된다고 보시면 되고, 4월부터 날씨가 풀리면서 봄-여름-가을 날씨를 차례로 느끼실 수 있습니다. 4-8월이 대학생들에게는 방학기간인데 딱 이 기간동안 날씨가 좋답니다. 저는 9월부터 5월까지 캐나다에 거주했기에 아쉽게도 캐나다의 맑고 청명한 날씨를 보지 못하고 돌아오게 되었습니다. 
 토론토의 경우 캐나다의 북쪽지방에 있는 도시보다는 상대적으로 덜 추운편이지만 거주자들의 말을 들어보니 2009년에 폭설이 내렸고 한동안 영하 -10 이하의 날씨를 보였다고 합니다. 제가 지냈던 겨울에는 운이 좋게도 눈도 많이 내리지 않았고 춥지도 않았는데요. 혹시 가시게 된다면 겨울의 추운 날씨를 확인하시고 가시기를 권장 합니다. 어그는 필수!","토론토는 아무래도 대도시이다 보니 교통편이 잘 마련되어 있는 편입니다. (TTC : Toronto Transit Commission 이라고 하기도 하는데요http://www3.ttc.ca) 버스와 지하철을 잘 활용하신다면 토론토의 이곳저곳을 잘 구경다니실 수 있으실 듯 합니다. 
 York U는 토론토에서 약간 북서쪽 지역에 위치하고 있으며, 토론토의 Downtown에서는 약 1시간 정도 떨어진 거리에 위치하고 있습니다. 버스를 타고 20분정도 이동, Downsview 역으로 가셔서 지하철을 30분정도 타시면 다운타운인 King St. 이나 Queen St. 같은 지역으로 이동이 가능합니다. 그러나 한 2-30분정도 소요하는 거리에 Yorkdale이라는 큰 쇼핑센터 및 영화관이 있는 종합몰 이 있으니 참고하시고 쇼핑 및 엔터테인먼트를 즐기시길 권장합니다. 그리고 학교에서 버스를 한번 타고 Finch St. 쪽으로 가시면 영화관 및 대형 식품매장이 있으니 장을 보러 가실 때 활용하여도 좋을 듯합니다. 
 학교 주변에 도보로 갈만한 슈퍼마켓은 20분정도 소요되는 거리에 있는 곳에 하나 있는데, 캠퍼스에서 Sentinel Rd.를 쭉 타고 나가시다보면 왼쪽편에 하나 보이실 겁니다. 차가 있으면 장을 보는 것이 어렵진 않으나 차가 없으면 grocery를 이용하기가 생각보다 수월하지는 않습니다.","저는 Stong Residence라는 곳에 거주하였습니다. 
사실 거주 방식은 다양하게 있을 수 있습니다. 저처럼 기숙사를 신청하여 On-campus 거주를 할수도 있고, 캠퍼스 근처에 있는 곳에서 Off-campus housing을 선택하실 수도 있습니다. 유럽에서 온 한 교환학생은 아예 다운타운에 집을 잡고, 학교에 3일정도만 오도록 시간표를 짜는 경우도 보았고, 다른 아시아에서 온 교환학생은 Downsview역 근처에서 렌트를 하는 경우도 있었습니다. 저는 외국에서 거주하는 것이 처음이라 안전하게 기숙사를 신청하였으나, 막상 가보니 렌트를 할 것이라는 아쉬움이 들었습니다. 물론 장단점은 있습니다. Residence 거주시에 안전하고, Residence 내에서도 이벤트가 있고, 두 개의 층마다 Don이라는 한 학생이 Residence 거주자들의 의견을 수용하고, 관리해주기는 장점은 있습니다. 그러나 York U학생들의 말을 따르면 기숙사 비용이 렌트에 비해서 비싼 편이라고 합니다. 또한, 제가 거주한 Stong Res의 경우에는 건물이 오래되어서 방음이 잘 안되었고, 무엇보다 Co-ed 형식의 화장실이 었기에.... 한 층에 사는 남녀가 샤워실과 화장실을 공유하게 됩니다. (한 층에는 대략 15명 정도 됩니다) Bethune Res. 처럼 오래된 기숙자의 경우 Co-ed 이며, 만약 Co-ed가 싫으시다면 각 기숙사마다 하나의 층은 여성 전용층으로 운영하니 기숙사 신청시에 꼭 여성 전용층을 신청한다고 미리 기재하시기를 바랍니다.  
 물론 기숙사중에서도 Calumet 나 Pond Res. 같은 경우에는 부엌이 있고 좀더 적은 학생이 화장실을 공유하니 잘 알아보시고 결정하시기 바랍니다. 저같은 경우에는 Calumet를 신청하였으나 TO가 나지 않아서 Stong으로 임의로 배정되었고, 나중에 배정된 후에 기숙사를 바꾸려고 했으나 잘 되지 않았습니다. 따라서 결정전에 잘 생각하시기 바랍니다.
 그리고 기숙사에 살게되면 Meal Plan을 강제적으로 구입하여야 되는데, 이것 역시 장단점이 있습니다. 장점은 비싼 Tax를 내지 않아도 되는 점입니다. 그러나 단점은 학교의 음식을 학기 내내 계속 먹어야 하는 것이겠지요. York U는 외부 업체들이 학교에 들어와서 음식을 제공하기 때문에, 다양한 음식 옵션들이 있는 하지만, 역시 그 음식을 오랜기간 먹는 것은 무리가 있습니다. 생각나는 음식점들을 적어보자면 Tim Hortons(캐나다의 대표 커피도넛 체인이지요;-) 어딜가나 있답니다), Second Cup(꽤 괜찮은 까페), Timothy''s(Schulich 빌딩안에 위치), KFC, 파파이스, 그리스 음식, 중동 음식, 인도 음식점, 타코빌라, Orange Snail(이탈리안 음식), 사쿠라(한식, 일식), 중식점, Blueberry Hills (웨스턴풍) 등 이 있습니다. 스무디킹 같은 영양쉐이크를 파는 Booster도 있기도 합니다.
Student Centre 뿐만 아니라 기숙사나, 빌딩 안에 하나씩 음식점이 있는 경우도 있으니 잘 찾아보고 이용하시길 바랍니다. 또한 한국분들이 상점들을 많이 운영하고 계십니다. 음식점 뿐만 아니라, 우체국, 학용품점 등 곳곳에 계십니다.","저는 2학기동안 각각 5과목씩 총 30학점을 수여하고 왔습니다. 
저는 경영과 경제과목들만 수강하고 왔는데, 사실 York U는 영화나 Arts, 음악대학이 많이 특성화 되어 있습니다. 뿐만 아니라 인문학과 사회학에서 명성을 떨친다고 합니다. 인문학 관련으로 많은 수업들이 열려있으니 가능하면 최대한 다양한 대학내의 수업을 수강하시기를 권장합니다. 수강신청은 생각보다 쉽지 않습니다. 연세대 portal시스템과는 다르기 때문에, 약간 불편하지만 수강 경쟁률은 연세대와 유사하니 인기과목은 빨리 신청하시기 바랍니다. Acting이나 음악대학 수업을 신청하려하였으나 저는 실패한 경험이 있답니다 =[ 
 도서관은 central library가 있고, osgoode과 schulich에 각각 도서관이 있습니다. 열람실도 있고, 프린트가 가능하도록 비치되어 있구요. 중도는 연대 구중도보다 조금 더 큰 규모입니다.","York International 이라는 곳에서 교환학생의 전반적인 케어를 담당합니다. York U는 규모가 큰 종합대학이다 보니 매학기마다 찾는 학생들의 수가 많습니다. 200명이 넘는 규모인 듯합니다. 현재는 Student Centre 2층에 York international가 자리 잡고 있습니다. 행사가 있을시에는 메일로 알려주기도 하고, 페이스북을 운영하고 있으니 그곳에서 교환학생들과 소통하고 또 행사를 체크하시길 바랍니다. 제가 참여했던 행사들은, Glendon 캠퍼스를 방문하여 탐방하거나, 학교측에서 버스를 대절하여 Niagara를 투어하기도 하였습니다. 또한 Cultural Gala라는 것도 있는데 저는 참여못하였지만, 여러 행사를 나름대로 마련하려고 하는 편이니 참여하여서 교환학생들과도 많이 교류하시기를 바랍니다.
http://international.yorku.ca/exchange/incoming/info.htm 이 주소로 들어가시면 York U로 파견온 교환학생들에게 필요한 정보들을 제공하고 있습니다.","York U에는 GYM 이 있습니다. 정확하게 기억나지는 않으나 10불 또는 20불 정도를 지불하면 1년간 GYM을 계속 이용할 수 있습니다. 헬스장, 수영장도 있고, 스쿼시장도 있으니 잘 활용하셔도 좋을 듯합니다. 특히 여성분들... Meal Plan으로 찌운 살들을 태우실 때 운동하기에 좋습니다^^ 
그리고 스케이트장이 있는데, 자유롭게 개방하는 시간이 있습니다. 스케이트도 대여해주니 스케이팅 좋아하시면 하셔도 좋을 것 같고, 개인 교습을 받으셔도 좋을 듯! 한국보다는 더 저렴하게 배우실 수 있습니다.
학교에 댄스 동아리가 Open Class 차원으로 춤 강연을 하기도 하는데, 그 때 Gym에 있는 한 연습실에서 춤을 배우기도 한 것도 기억에 납니다.
York U에는 다양한 동아리들이 있습니다. 매 학기마다 학생들을 유치하기 위해 동아리 축제? 같은 느낌으로 축제를 하는데, 모든 동아리가 나와서 데스크를 서서 학생들에게 홍보를 하기도 합니다. 
저같은 경우에는 KCF 라는 Korean Christian Fellowship 한인 2세들의 기독교 동아리에 참여하여 함께 활동하였습니다. 기독교인이라면 많은 도움을 받을 수 있는 곳이니 참고하셔도 좋을 듯합니다. 2세 친구들이었기에 한국말은 못하지만 저를 따뜻하게 맞이하여 주었습니다. 제겐 정말 잊지 못할 인연들이었습니다.
또한 토론토 자체에도 한인이 많지만, York U에도 한인이 많기 때문에 한인 커뮤니티가 잘 형성되어 있습니다. 한인 기독교 단체도 두세개 있었고, 한인 커뮤니티도 있었습니다.(이름은 기억이 잘 나지 않습니다..) 처음에는 의지도 되고 도움을 많이 청할 수 있으나, 저같은 경우에는 영어학습에 중점을 두었기 때문에 몇몇 친구들과만 교류하였고 한인 단체에는 들어가지 않았습니다.
캐나다 학생들은 전반적으로 굉장히 친근하고, York U 자체가 다양한 ethnic background를 가진 학생들이 많이 모여있기 때문에 굉장히 개방적이고, 따뜻하게 맞이해주는 편입니다. 저는 아예 외국인 학생들 단체에도 참여해본 적이 있는데 따스히 맞이해주었습니다. 동아리방은 Student Centre 윗층들에 위치하여 있으니, 먼저가서 방문을 두드려 보시기를 추천합니다 ^^
 그리고, York U에는 한국의 타대학에서 오는 교환학생들도 많이 있습니다. 고대, 이대, 한양대 등 한국 교환학생들이 많이 있는데요. 한국에서 미리 연락처를 알아 내셔서 서로 소통한 후에 캐나다로 출국하시는 것을 추천하는 편입니다. 참고로 연대의 경우에는 York U 종합대학 소속으로 배정되는 학생과, Schulich으로 배정되는 연세대 경영학과 학생들이 있습니다.","캐나다 사람들은 굉장히 따뜻하다는 것에 놀랐습니다. 굉장히 친근하고, 아무에게나 지나가는 길에 질문을 하여도 굉장히 친절하게 답하여 줍니다. 이 점은 제가 캐나다를 좋아하게 하는 가장 큰 이유가 아닐까 싶습니다. Thank you, Sorry를 자주 사용하고, 꼭 뒷사람에게 문을 잡아주는 배려가 있습니다. 안하게 되면 굉장히 무심해보인다는... 캐나다를 다녀온 후로 이제는 항상 문을 열고 지나갈 때 항상 뒤를 돌아 뒷사람을 위해 문을 잡아주곤 합니다.
또한, 약간은 부정적일 수 있으나 모든 것이 느리게 진행됩니다. 전반적으로 사람들도 여유가 있구요. 커피를 사기위해 긴 줄을 서서 10분정도 기다리는 것은 일상적입니다. 날씨가 춥고 나라가 워낙 크고 건물간, 사람간의 공간이 넓게 존재하다 보니 그런 것이라 생각되었으나, 한국과는 많이 다른 점이었기에 제게는 나름대로 culture shock이 아니었나 싶습니다. 그러나 한국에서는 느낄 수 없는 여유있는 삶을 그곳에서 느낄 수 있기 때문에, 여유를 원하신다면 캐나다를 가셔도 좋을 듯합니다.
그리고 캐나다는 정말 다양한 인종들이 존재하는 나라입니다. 그래서 상대방의 문화나 의견을 존중하고 다 들어주는 문화가 사회전반에 깔려 있는 듯 합니다. 직접적으로 비판하거나 공격적으로 말하는 경우는 거의 없고, 다름을 배려하려는 특성을 많이 발견하였습니다. 반면, 다양한 인종들이 있기에 대학생들은 인종끼리 뭉치는 경우가 많습니다. 이민자, 유학생들이 많다보니 어쩔 수 없는 현상일 수도 있습니다. 그러나 본인이 노력하는 여하에 따라 다양하게 어울릴 수 있으니 먼저 노력해보시기를 바라요 ;-)","가장 실질적인 도움을 받을 수 있는 것은 한인이 아닐까 싶습니다. 저처럼 외국 거주 경험이 없는 분의 경우에는 더더욱 그럴 것입니다. 2세 동아리인 KCF나 한인 기독교 동아리를 찾아보시는 것도 좋을 듯합니다.  
York International에서하는 OT는 왠만하면 꼭 가시고, Niagara Trip과 같은 기회는 저렴하고, 편안하게 여행을 다녀오실 기회이니 활용하시길 바랍니다. 학기가 시작하기 전에 York International에서 OT에서도 말하는 사항이지만 이전 교환학생들이 남기고 간 생활용품들을 가져가도록 하는 시간도 있으니 참고하시구요.","종합대학이고, 워낙 규모가 크다보니 연세대에서의 생활과 전혀 다를 것이 없었습니다. 따라서 본인이 기회를 찾고 뛰어다니지 않으면 아무것도 얻을 수 없습니다. 적극적으로 찾아다니시고, 먼저 묻고, 먼저 문을 두드리시길 권장합니다.
 그리고 토론토는 미국과 가까이 위치하여 있기 때문에 미국 여행하시는 것도 추천해드리며, 몬트리올과 퀘벡은 꼭 다녀오시길 추천하구요! 저는 두번 다녀왔습니다 ;-) 캐나다의 작은 유럽(프랑스)에 온 느낌을 만끽하실 수 있으실 겁니다. 캐나다에서 남미쪽으로 여행하기도 좋으니 한번 알아보시구요. 
 그리고 6개월 이상 거주하시게 되면, 학생 비자를 발급 받으실 겁니다. 그러면 On-campus job을 구하는 것이 가능해집니다. 저같은 경우는 Service Canada에서 Social Insurance Number(한국의 주민등록번호같은)을 발급받고 Timothy''s라는 캠퍼스 내 까페에서 Part-time을 하기도 했습니다. 물론 한인 음식점에서 일하는 경우도 많지만, 까페이긴 했어도 외국인 매니저아래에서 외국인들과 함께 어울려 일을 하는 경험은 제게 많은 것을 배울 수 있게 해주었습니다. 또한, 캐나다에는 무급으로 인턴을 고용하는 경우가 많습니다. 무급의 경우에는 비자관련 없이 고용할 수 있는 경우도 있으니 참고하시고, 학교 커리어 사이트나 다른 고용 사이트들도 있으니 York U의 로컬학생들에게 물어서 정보를 찾아내시길 권장합니다. 
 또 저는 Art Fair 같은 것에 봉사를 하기도 하면서 캐나다 미술에 대해서 접하기도 하고, TIFF(Toronto International Film Festival) 기간에 영화도 관람하거나 Toronto Clothing Fair와 같은 행사 등 다양하게 구경을 다녔습니다. 토론토가 대도시이다 보니본인이 원하시면 언제나 새로운 경험들을 얻으실 수 있답니다. 부지런히 움직이고 찾아보셔서, 견문을 넓히고 새로운 경험과 추억 마음껏 얻어 오시기를 바랍니다."
