gen_info,env_info,food_info,study_info,office_info,facil_info,mhct_info,help_info,etc_info
"제가 약 일년여동안 몸담았던 요크대학교는 캐나다에서 University of Toronto(토론토대학교) 다음으로 규모가 큰 종합대학이자 온타리오 주에서 두번째로 규모가 큰 대학원을 보유하고 있습니다. 총 학생수는 약 50,000여명에 육박하여 모교인 연세대학교의 1.5배에 육박하는 실로 엄청난 규모를 자랑하는 대학이라 사료됩니다. 지식사전에 따르면 요크대학교는 1959년 3월 토론토대학교와의 연합체제로 설립되었으며 1960년 9월 토론토 대학교의 팰코너 홀(Falconer Hall)에서 76명의 학생을 데리고 첫 수업을 시작하였습니다. 1961년 첫 캠퍼스인 글렌던 대학(Glendon College) 자리로 이전하였고 1965년 토론토대학교와의 연합체제에서 벗어나 독립대학이 되었습니다. 현재에는 킬(Keele) 캠퍼스와 글렌던(Glendon) 캠퍼스가 있으며 킬 캠퍼스는 요크 대학교의 메인 캠퍼스로 이과계열, 문과계열, 예체능계열 등에 다양한 학과들이 있습니다. 또한 경영학과의 경우, 슐리히 MBA 스쿨(Schulich School of Business)이 자체적인 수업을 진행하고 있습니다. 보다 규모가 작은 글렌던 캠퍼스에서는 주로 문과계열 수업이 진행되며, 영어뿐만 아니라 프랑스어로도 수업이 진행되는 캐나다 유일의 이중 언어 캠퍼스입니다. 2010년 기준 환경학부, 미술학부, 글렌던 대학, 일반대학원, 인문 및 직업학부, 교육학부, 보건학부, 오스구드 홀 로스쿨, 슐리히 경영스쿨, 과학 및 공학부 등 10개 학부, 94개의 학과 그리고 24개 연구센터로 되어 있습니다. 요크대학교의 경우, 정치를 제외한 사회문화, 교육, 경제, 여가 등의 중심지인 토론토 시에 소재하고 있어 각종 파견기간 중, 시내외에서 펼쳐지는 각종 축제(ex.Toronto International Film Festival, Carnival) 및 볼거리들이 풍성해 특별히 좋았던 것 같습니다. 기후의 경우, 처음 맞이하였던 9월의 날씨가 빅적 온화하고 시원한 가을의 향이 물씬 풍겼던데 반해, 10월 중순에 접어들며 을씨년스러운 초겨울 날씨에 접어들더니 이내 다음 해 4월까지 하늘에서 눈이 내리는 걸 보고 놀라움을 금치 못했습니다. 기후적인 측면에 있어, 유년시절을 대구, 샌프란시스코에서 보냈던 저로서는 매일같이 허벅지까지 닿는 눈들을 헤치고 가는 등교길에 고전 했던 기억이 있습니다.","요크대학교는 토론토 시에서 비교적 낙후된 북쪽 끝자락(외곽)에 위치하고 있으나 다행스럽게도 규모가 매우 큰 종합대학답게 학생의 절반 이상이 버스, 택시, 지하철 등의 대중교통 수단을 이용해 등하교 하는 commuting system을 갖추고 있습니다. 인근 지역은 일반 주택가, Jane & Finch라는 일명 빈민가 그리고 허허벌판이 자리해 돌아다닐 일이 그닥 없으나 버스, 지하철, 차 등을 통해 20여분만 투자하면 토론토의 상징물인 CN Tower가 자리잡은 시내(downown)번화가에 당도할 수 있어 별다른 문제는 없다고 사료됩니다. 수업이 끝나는 오후, 기회 되는대로 틈틈이 시내로 나가 맛집도 들리고 mall에 가 쇼핑도 하고 클럽 파티에도 참석해 즐거운 시간을 보낸 기억이 납니다.","요크대학교 내에는 대략적으로 4~5가지 등급의 기숙사 시설이 존재합니다. 파견 직전인 2-1학기에 연세대학교에서 파견 대학에서 쓰게 될 기숙사를 정하는 문서를 작성하는 때가 있었는데 다행스럽게도 원했던 바와 같이 세계 각국에서 온 교환학생들과 함께 어울려 지낼 수 있는 Pond Residence에 배정되어 무척이나 기분이 좋았습니다. Pond Residence는 선택할 수 있는 가장 좋은 기숙사로서 호실 내부에 각기 2개의 방을 2인이 나누어 쓰고 방앞에 원탁의자와 식탁, 냉장고, 부엌 그리고 화장실을 구비해 여타 기숙사 시설과는 달리 꼭 meal plan을 이용해야하거나 볼일을 보러 외부 출입을 해야하는 강제성 및 번거로움이 없어 좋았습니다. 지은지 얼마되지 않아서 방음이 잘 되어 있었고 방 내부에는 큰 창문이 있어 햇볕이 잘 들고 원활히 환풍을 할 수 있게끔 되어 있었습니다. 아울러, 1층에는 Pond에 지내는 학생들을 위한 휴식공간이 마련되어 마땅히 할게 없을 때 책을 읽으며 시간을 보내거나 TV시청 또는 미니축구게임 등을 할 수 있어 매우 유익했습니다. 식사의 경우, 평상 시에는 학교에서 적극 권유하는 바와 같이 meal plan을 신청해 학교 내 구내식당에서 타코, 그리스 음식, 햄버거, 중국 음식 등으로 끼니를 해결했지만 이따금씩 시간이 날 때는 가까운 편의점에서 장을 봐 집 안에서 스테이크나 에그롤 등을 해먹기도 하였습니다. 허나 집에서 어머니가 해주시는 진수성찬에 비할바는 못 되었고 ''역시 집이 최고''라는 결론에 이르게 되었습니다.","수업과 도서관은 1년여 간의 파견기간 중 가장 큰 비중을 차지한 부분이라 사효됩니다. 토론토에 당도한 이 후 처음 3주 간 저는 어떤 수업을 수강할 지 도무지 판단이 서지 않았습니다. 따라서 여러 수업에 발에 불이 나도록 찾아다니며 교수님과 대화를 통해 제가 지닌 영어실력에 비례해 무사히 수업을 이수할 수 있을지에 대해 원하는 답을 얻은 뒤에야 겨우 수강신청을 완료할 수 있었습니다. 저의 경우, 향후 스포츠 기자가 되어 해당 분야에서 인정받아 중년에 접어 들때에 특파원이 되고자하는 분명한 목표 의식이 있었기 때문에 커뮤니케이션 수업들과 실용영어, 영화의 이해, 지리학 그리고 흑인음악과 같은 수업들을 수강하게 되었습니다. 연세대학교에서 진행되었던 수업내용과 비교하자면 우선 요크대학교는 수업이 꼭 한학기에 한하는 것이 아니라 일년내내 진행되는 것 또한 있었고 6학점과 9학점이 존재했습니다. 제가 수강했던 교과목들은 전반적으로 읽어야하는 텍스트물들이 많았고 조별과제가 비교적 적은 반면, 개인과제 및 프레센테이션들이 많았습니다. 또 몇몇의 과목은 튜토리얼이 있었는데 이는 200명 이상의 많은 학생들이 참여하는 수업에서는 학생 한명한명을 일일이 챙겨줄 수 없기 때문에 도태되는 학생을 최대한 도우기 위해서 수업 외 별도의 모임을 지정하는 제도입니다. 연세대학교에서는 수업과 yscec을 필두로 한 온라인 커뮤니티에 적극적으로 참여하고 조별과제에 공을 들이고 중간, 기말고사를 잘보는 것을 통해 좋은 학점에 대한 기대치를 가지 수 있었지만 요크대학교에서는 책을 많이 읽고 그에 대한 본인 의견을 많이 쓰고 쓰면서 마냥 주관적이기 보다는 각종 사례나 예시를 조사해 근거로 활용하고 수업 시간 때 의문점이 드는 사안에 대해 많이 질문하는 시스템이어서 초반에는 적응에 꽤나 애를 먹었습니다. 대학 분위기도 사뭇 달랐는데 이를테면 우리나라 학생들은 좋은 대학에 진학키 위해 중,고교 시절부터 공부 외적인 것을 포기하면서까지 학업에 심혈을 기울이며 자신이 부여한 기대치에 상응하는 결과가 나오지 않을 시에는 재수, 삼수까지 결심하는데 반해 캐나다의 고등학생들은 법대, 의치약학대와 같은 고도의 전문성을 요구하는 학과가 아닌 이상, 진학을 희망하는 대학과 학과에 입학할 수 있는 기회를 부여 받습니다. 말 그대로 입학이 쉽고 졸업은 어렵습니다. 따라서, 수업 진도에 따라가기 위해 그리고 유종의 미를 거두기 위해서 공부하고 또 공부해야 했습니다. 학교에는 Vari Hall(홀) 이라 불리우는 큰 광장이 있고 그 안에 Scott Library(스캇 도서관)이 있습니다. 저는 그 곳에서 종종 과제나 숙제 등을 하곤 했습니다. 50년이 넘는 세월 동안 개보수를 하지 않아 도서관 내 책상, 의자 그리고 책을 대출,반납하는 시설 및 시스템은 노후 되었지만 만서도 방대한 자료와 넘쳔는 서적은 필요한 정보를 손쉽게 찾을 수 있도록 도와주었습니다.","국제교육부에서는 학기가 시작하기 전, 한 차례 단체 미팅을 가지며 앞으로 짧게는 4개월, 길게는 8개월 동안 교환학생 신분으로 학교를 다니면서 해야할 것과 하지 말아야 할 것을 일러 주었습니다. 대여섯분의 담당자가 계셨는데 각 담당자는 본인이 맡은 2~30명의 교환학생들에게 학교나 토론토시에서 주최하는 행사 및 이벤트나 학생 개인의 개별적인 의문사항(궁금한 점) 등을 이메일을 통해 알려주는 역할을 담당 하였습니다. 아쉬운 점이 있다면 저의 경우, 2-1학기 연세대학교에 재학 중인 당시에 요크대학교에서 명시해 놓은 날짜에 학교 홈페이지에 들어가 수강신청을 해야했는데 전산장애로 말미암아 아 학기가 시작할 당시까지 0학점인 상태였었습니다. 이 같은 바를 국제처에 알리고 도움을 줄 것을 요청했지만 돌아오는 대답은 수강을 원하는 수업에 찾아가 해당 교수에게 슬랏(slot)을 열어줄 것을 부탁하라는 말 뿐이었습니다. 마음고생이 이만저만이 아니었고 우리나라와는 달리 캐나다는 꼭 교환학생이 아닐지라도 널린게 외국학생이기에 ''교한학생 프리미엄''이 전무하다는 사실이 저를 가슴 아프게 하였습니다.","구내식당, 도서관, 기숙사 외에 요크대학교가 구비한 부대시설로는 교내의 체육관을 꼽을 수 있겠습니다. 10불만 내면 일년동안 무료 헬스, 수영, 체조 및 농구, 스쿼시, 당구와 같은 구기 운동을 즐길 수 있습니다. 따라서, 학교를 다니면서 실로 많은 학생들이 한겨울에도 반바지에 탱크탑 내지 간소한 트레이닝복 차림으로 구슬땀을 흘리며 운동하는 모습을 보았고 저 역시나 스포츠레저학과 학생으로서 낯선 타지생활에서 건강유지를 명목으로 유산소운동, 체지방운동 등을 하곤 했습니다. 동아리의 경우 무수히 많은 동아리가 있으나 저의 경우, 타이트한 학과 생활로 말미암아 동아리 생활을 영위할 수 없었습니다.","여러가지 경우의 문화충격이 있었습니다. 미시적으로 접근하면 우선, 어떤 기숙사는 남녀가 화장실을 같이 쓴다는 점 그리고 본인이 충분히 마음만 먹는다면 이성이 샤워를 하는 모습을 훔쳐볼 수 있다는 점이었습니다. 물론, 그럴 경우는 0%에 가깝고 실제로 그런 일이 발생할 시, 해당 학생은 퇴학과 같은 강한 징계를 받게 될 것이기 때문에 걱정하실 필요는 없겠습니다만 우리나라 정서 상, 이에 익숙치 않은 분들이 많이 계실 것이라 생각합니다. 거시적으로 보면 캐나다인의 생활 속 ''여유''가 부럽기도 하면서 심히 답답하였습니다. 예를 들어 행정서류를 떼러 공공기관에 방문해서 부탁을 하면 족히 2달 심하면 일년내내 기다려야 하는 경우도 발생하며 버스를 타고 가다보면 급작스레 기사가 운전을 멈추고 갓길에 정차를 하고난 뒤, Tim Hortons(캐나다의 커피전문점)에 들러 커피를 테이크아웃 해서 나오는 장면과 이에 전혀 항의하지 않는 손님들이 무척 신기하게 느껴졌습니다. 또한 우리나라 사람은 뒤에 누군가 오고 있다치더라도 자신이 통과한 문을 잘 붙잡아 주지 않는데 반해 캐나다인들은 약 20m 뒤에 사람이 총총걸음으로 오고 있어도 문을 잡아주는 놀라운 장면이 연출되곤 합니다. 학생들의 의식 역시 마찬가지로 판단할 수 있겠습니다. 잘 아시다시피 캐나다는 사회주의 국가입니다. 어떤 계층을 막론하고 수입의 절반이 좀 못미치는 정도를 세금으로 납부합니다. 그래서 이(teeth)를 제외한 모든 의료가 무상으로 제공되고 학생들은 가계형편이나 성적과 관계없이 장학금을 받습니다. 이와 같은 복지제도가 참으로 부러운게 사실이나 한편으론 이 같은 사회의 보호망으로 인해 캐나다에는 일확천금이 없는 듯 해보여 사람들에게서 다아니믹함이 느껴지지 않았습니다. ''난 퇴학 당해도 개의치 않아, 다시 적성에 맞는 학과에 가면 되고 하고 싶은 일 하면서 살면 돼."" 이는 필터링을 당하는 기로에 서 있던 친구가 제게 넌지시 건넨 말입니다. 캐나다에 있는 동안 무한 경쟁 속에서 다들 열심히 살아가는 한국이 무지 그리웠습니다.","도움 받을 수 있는 곳은 일차적으로 국제교욱부(국제처)가 있겠습니다. 얼마나 신속정확한 도움을 받을 수 있을지는 미지수이지만 분명한 건, 그들 또한 교환학생이 요크대학교에서 지내는 동안 최대한의 행복과 기쁨을 누리기 바란다는 것 입니다. 차선책으로는 저의 경우, 한국에 있을 때부터 알고 있던 친구의 누님이 한 분 계셨고 또 기숙사 5층에 사는 친구들과 친하게 지내며 휴대폰 및 생필품 구입, ride 그리고 학교생활 적응 지침에 이르기까지 많은 도움을 얻을 수 있었습니다. 마지막으로는 교내 종교 동아리 혹은 교회에 다니며 신앙심을 기르고 교인들을 알아나가는 방법이 있겠습니다. 절대 어려움에 처한 양을 물끄러미 쳐다보기만 하지 않을테니까요.",jeonbryan@yahoo.com
"York 대학교는 기존 경험보고서의 내용과 마찬가지로 상당히 큰 대학교입니다. 지하철 University-Spadina Line의 왼쪽 위 끝의 정류장인 Downsview 정거장에서 196번 혹은 106번을 타고 20~30분을 가면 학교에 도착합니다. 대학교의 큰 규모와 비교적 가까운 물리적 거리에 비해 버스를 갈아타야 하는 등 대중교통이 불편하여 현재 Downsview 정거장에서 대학교 내까지 지하철을 연장하는 공사를 진행하고 있습니다. 하지만 공사를 시작한지 얼마 되지 않아서 완공년도는 적어도 14년 이후이니 참고하시기 바랍니다.
캐나다 토론토의 기후는 역시 캐나다답게 상당히 춥습니다. 한 겨울에는 영하 20도밑으로 내려가며 눈은 11월부터 오기 시작한다고 합니다. 하지만 제가 경험했던 2011년 가을 겨울은 생각보다 많이 포근했습니다. 현지 친구들에게 물어봐도 이번 겨울은 이상할 정도로 춥지 않았다고 하며 실제로도 제대로 된 눈은 제가 출국하기 하루 전 딱 한 번 보고 왔을 정도입니다. 실제 일기예보 상의 기온도 한국과 비교하여 오히려 높을 정도였습니다. 실외활동을 하기에는 좋았습니다만 혹독한 캐나다의 겨울을 체험하지 못하고 한국으로 돌아온 것이 못내 아쉬울 정도였습니다. 하지만 일반적으로 캐나다는 눈이 상당히 많이 오고 춥다고 하니 방한용품을 챙겨가시는 것을 추천해드립니다.","대학 바로 주변은 사실 아무것도 없다시피 합니다. 걸어갈 수 있는 거리에 있는 것은 커피&#49406;인 Tim Horton과 그릴바, 중고교과서서점 이정도 뿐입니다. 저는 학기 초에 교과서를 살 때 학교 내 서점에서 구입하지 않고 이 중고교과서서점에서 구매하였습니다. 사실 중고교과서가 많진 않지만 새 교과서도 5불에서 10불정도 저렴하기 때문에 이 곳에서 구매하였습니다. 워낙 땅이 넓은 캐나다인 만큼 모든 것이 조금은 여유롭게 자리잡고 있기 때문입니다. 하지만 버스와 지하철을 타고 조금만 이동하게 되면 왠만한 편의시설을 찾아볼 수 있습니다. 196번 혹은 106번을 타고 Downsview 정거장에서 지하철로 갈아타고 세 정거장만 가면 Yorkdale 정거장이 있는데 여기에 큰 쇼핑몰이 있습니다. 각종 의류브랜드, 전자제품, 영화관 등이 있기 때문에 자주 이용하는 곳 중에 하나였습니다. 또한 60번 버스를 타고 종점에서 내리면 Finch역에 하차하게 되는데 이 곳은 코리아타운이라고 할 수 있을 정도인 곳으로 각종 한국음식점, 식품점, 한국식 카페, 미용실 등이 밀집해있습니다. 저는 미용실을 이용하러 가끔 갔었습니다.","저는 Apartment라고 불리는 곳에 살았습니다. 말 그대로 15층짜리 아파트 형태인데요 내부 형태는 일반적으로 개인 방을 따로 소유하고 주방과 화장실을 공유하는 형태의 기숙사와는 달리 제 방에 주방과 화장실이 모두 갖추어져 있는 원룸형태의 기숙사였습니다. 쉽게 말해서 호텔을 떠올리시면 될 것같습니다. 엘리베이터를 타고 올라가 복도를 지나 자신의 호실에 열쇠를 사용하여 열고 들어가는 방식입니다. 사실 이 apartment는 대학원생 혹은 만 23살 이상의 학부생들이 이용할 수 있는 기숙사입니다. 저는 한국에서 기숙사를 신청할 때 단순히 만 23살 이상이었기 때문에 apartment를 신청하게 되었지만 만 23살 이상이더라도 혼자 사는 것보다 한 집에서 다른 친구들과 함께 어울리는 기숙사 생활을 하고 싶은 분들은 문의하여 일반적인 기숙사를 신청하시는 것도 좋을 듯합니다. 그 이유는 방안에 화장실과 주방이 모두 있기 때문에 한 층에 대략 10개의 호실이 있다 하더라도 서로 교류가 전혀 없습니다. 이런 저런 이유로 스트레스받지 않는 혼자만의 공간이 필요한 분들에게는 추천하는 바이나 기숙사 친구들과의 친목도모를 통한 활기찬 생활을 원하시는 분들은 일반적인 기숙사가 좋을 듯합니다.
 식사는 주로 student center나 york lane에 있는 음식점들을 이용하게 됩니다. 우리에게도 친숙한 subway나 popeyes와 같은 패스트푸드도 있고 그리스 음식점, 인도 음식점, 심지어는 한국 음식점도 있습니다. 하지만 대부분의 음식들이 매우 기름지고 맛 또한 9불 이상하는 가격 대비 좋은 편은 아니기 때문에 저는 주로 음식을 해먹었습니다. 걸어서 30분 버스를 타고 15분 정도 가면 superstore라는 대형 마트도 있고 60번을 타고 centerpoint mall 정거장에서 내리면 갤러리아라는 큰 한국 마트도 있어서 식재료를 구함에 있어서는 어려움이 없었습니다. 저는 apartment에 살았기 때문에 meal plan이 없었는데 일반 기숙사에 사신다면 meal plan를 반드시 해야하는 경우도 있습니다. 그러한 경우에는 학생카드에 미리 몇천불의 돈을 충전해놓고 위에서 말한 학교내 음식점에서 학생카드를 이용해 결제하는 방식입니다.",저는 총 네 과목 12학점을 이수하고 돌아왔습니다. 우리학교와 달리 수강신청 기간이 매우 깁니다. 제가 파견갔던 가을학기의 수강신청이 6월말부터 시작하였는데 그 당시 제가 기말고사기간이어서 기말고사를 끝나고 확인해보니 인기있는 과목들은 이미 수강인원이 꽉 차있었습니다. 하지만 9월말까지 자유롭게 수강과목을 변경할 수 있으니 잘 주시하고 있으면 원하는 과목들을 수강할 수 있습니다. 저는 경제학과 과목 3개와 경영학과 과목 1개를 수강하고 왔는데 대형강의여서 혹은 경제학과목의 특성상 질문과 토론위주의 수업은 아니었습니다. 하지만 교수님들 모두 질의응답에 굉장히 꼼꼼하게 답변해주시고 수업 중간에도 학생들의 피드백을 세심하게 채크하십니다. 특히 교수님들을 찾아갔을 때 교환학생이라는 것을 밝히면 학업에 필요한 전반적인 사항을 챙겨주시고 특히 저는 에세이를 쓰는 것에 어려움을 느껴서 교수님께서 특별히 따로 숙제를 봐주시기도 했습니다. 도서관의 경우 메인 도서관인 scott library는 제가 느끼기에 살짝 노후하고 조명이 어두워 공부하기 좋은 조건은 아니었습니다. 그래서 학기 초에는 교내에서 가장 시설이 좋은 로스쿨 빌딩의 osgood library에서 공부를 하였는데 중간고사 이후로 ID 검사를 하여 타과생이 들어오지 못하게하는 바람에 그나마 시설이 좋은 stacie 도서관을 이용하였습니다. 하지만 제가 가장 공부를 많이 했던 공간은 완벽하게 독립된 공간이었던 제 기숙사였습니다.,York International이란 이름의 국제처에서 유학생들과 교환학생들을 담당하고 있습니다. 학기가 시작하면 국제처에서 오리엔테이션을 주최하는데 이는 신입생인 유학생들과 교환학생을 대상으로 실시합니다. 저는 이 국제처에서 주최한 첫 오리엔테이션에서 제가 4개월간 함께 했던 친구들을 만났습니다. 모두가 신입생들이어서 아직 학교 내에 친구들이 없는 상황이라 서로 친해지기 쉬웠습니다. 이 첫 번째 오리엔테이션말고는 딱히 큰 행사가 없는데 한 가지는 학기 초에 국제학생들 대상으로 나이아가라 폭포를 저렴한 가격에 단체로 다녀오는 행사를 합니다. 표가 정해져 있는데 이를 미리 알려주지 않아서 저는 신청기간에 갔음에도 표를 구하지 못해 가지 못했습니다. 그래서 표를 팔기 시작하는 시간에 미리 가서 구매하시길 추천해드립니다.,"저는 한 학기만 파견을 가서 아쉽게도 동아리 활동을 하진 못했습니다. 하지만 우리 학교와 같이 굉장히 많은 동아리가 존재하며 학기 초에 데스크를 열고 신입 회원들을 모집합니다. 가장 맘에 들었던 시설은 tait 체육관이었습니다. 연회비 15불만 내면 헬스, 농구, 수영, 스쿼시, 탁구 등을 위한 시설을 자유롭게 이용할 수 있었습니다. 탁구 스쿼시 라켓 등의 기구들도 대여해주며 대여비 또한 한 셋트에 2불로 굉장히 저렴합니다. 사실 학교 주변에 시간을 보낼만한 곳이 없다시피 하기 때문에 저는 친구들과 이 곳을 자주 이용하였습니다.","이민족의 국가라고도 할 수 있을 만큼 캐나다는 정말 다양한 인종들이 모여서 한 사회를 이루고 있습니다. 따라서 정말 다양한 문화들이 혼재하고 있고 그 중에는 우리나라와 비슷한 면도 있고 다르지만 배울 점도 많았기 때문에 문화적인 차이로 인한 문제는 없었습니다. 가장 놀랐던 점은 토론토에도 나이아가라 폭포에도 뉴욕 시내 한복판에도 한국인이 정말로 많았다는 것입니다. 적어도 제가 보기에는 세계 곳곳에 뻗어있는 중국의 화교, 이민자 사회 못지않은 규모였습니다. 여행자 뿐만 아니라 이민자, 유학생 또한 정말 많았습니다. 따라서 저는 이러한 환경 속에서도 영어를 사용하는 환경을 만들기 위해 현지친구들을 사귀고 그 친구들과 같은 그룹에 속해있는 한국인 2세 친구들을 만나 함께 어울렸습니다. 한국인 2세 친구들과도 영어를 사용하였고 또한 현지친구들과 대화할 시 영어로 표현하기 어려운 부분이 있으면 2세 친구들에게 한국말로 물어보면서 오히려 현지친구들하고만 지낼 때보다 더욱 도움이 되었습니다.",역시 도움을 받을 수 있는 곳은 한인단체이긴 합니다. 저는 학교에서 멀지 않은 곳에 있는 한인 교회를 주일마다 나갔습니다. 사실 마트를 가는 길에 우연히 한인 교회를 발견하게 되어 주일마다 예배를 드리러 나가게 되었는데 목사님과 사모님도 굉장히 좋으시고 규모가 크지 않은 교회라서 가족같은 분위기였습니다. 보통 외국에 오게되면 영어공부를 위해 한국사람들을 멀리해야한다고 생각하지만 초기에 정착하는데 필요한 정보들을 혼자서 혹은 현지인들을 통해 얻는데에는 시간이 걸립니다. 또한 일년 이상 외국에 있을 경우 한 번씩 찾아오는 향수병도 덜 수 있습니다. 이러한 실용적인 이유외에도 좋은 인연을 만나고 하나님도 접하게 되는 소중한 기회가 될 수 있으니 한인 교회를 가보는 것도 추천해드리고 싶습니다.,"캐나다 토론토는 북미의 유럽이라고도 불리우는 퀘벡과 나이아가라 폭포, 미국과도 굉장히 가깝기 때문에 시간을 내서 꼭 여행을 다니는 것을 추천해드리고 싶습니다. 특히 현지에서 친구들을 사귀어서 그 친구들과 여행을 간다면 더욱 소중하고 평생 간직할 추억이 될 것입니다."
