gen_info,env_info,food_info,study_info,office_info,facil_info,mhct_info,help_info,etc_info
"<위치> 홍콩은 신계(뉴테리토리)지역과 구룡(카우룬), 홍콩섬 세 지역으로 나누어집니다. 시티유는 구룡지역의 고급 주택가에 위치하고 있습니다. 홍콩섬쪽으로 갈수록 영어사용자가 많고 신계쪽으로 갈수록 광동어 사용자가 많습니다. 구룡은 그 중간지점입니다. 따라서 구룡지역은 서양인보다는 홍콩사람들이 주로 거주하는 지역이며, 거리에서 들려오는 말도 영어보다는 광동어입니다. 이 부분은 처음 시티유에 와서 제가 가장 당황했던 부분이며 홍콩에 대한 약간의 실망감을 안겨주었던 부분이었습니다. 
시티유가 위치한 카우룬통은 교통의 중심지입니다. MTR과 KCR 두개의 전철노선이 연결되어있으며 학교 옆 백화점과 KCR역에 2개의 버스터미널이 있습니다. 시티유 학생들은 주로 가까운 몽콕이나 침사추이에서 문화생활을 즐기며 때때로 코즈웨이베이나 센트럴에 나가기도 합니다.

<크기> 시티유의 캠퍼스는 연대에 비해 훨씬 작습니다. 건물 6개로 구성된 compact한 캠퍼스입니다. 국제교루부와 스포츠센타 동아리방, 학생식당 등이 위치한 amenities building, 주로 수업을 듣게 될 academic building, 그 외 FYW building, CYC building 등 6개의 건물로 구성된 메인캠퍼스와 학교 뒤편에 위치한 한번도 가보지 않은 부속 캠퍼스로 구성되어있습니다. 학부수업은 대부분 아카데믹빌딩과 FYW, CYC 빌딩에서 이루어집니다. 이 세 빌딩은 각각 다른 빌딩이지만 여러가지 통로로 연결되어있습니다. 건물마다 규모가 크고 구조가 복잡해 학기 초에 종종 강의실을 찾다가 수업에 늦기도 했습니다.

<기후> 홍콩에 1월 초부터 12월말까지 머무르면서 홍콩의 사계절을 모두 경험할 수 있었습니다. 가장 기후가 좋을 때는 11월과 12월입니다. 적당히 시원한 날씨에, 정말 오랜만에 보는 파란하늘과, 날마다 맑고 건조한 기후를 즐기실 수 있습니다. 우리나라 가을날씨라고 생각하시면 됩니다. 낮에는 긴팔티셔츠 하나로 생활할 수 있고 아침 저녁으로 쌀쌀하므로 걸칠 옷을 준비하면 적당합니다.(홍콩은 1년 내내 냉방을 하므로 여름이나 겨울이나 걸칠옷은 필수입니다)
1월부터 2월은 꽤 춥습니다. 때때로 전기장판의 필요성을 느끼게 되고, 두꺼운 겉옷을 준비해 가지 않았다면 충동구매의 욕구를 느끼게 됩니다. (이 기간은 세일의 폭이 상당히 큰 시즌으로 짐의 부피가 부담스럽다면 그냥 홍콩에서 하나 지르시는것도 나쁘지 않을거라 생각됩니다) 11월 12월의 파란하늘은 더이상 볼 수 없고 희뿌연 날씨가 계속됩니다. 그렇다고 비가 자주오거나 습한 날씨는 아닙니다. 
3월부터 습도가 올라가기 시작합니다. 그렇게 덥다고 느껴지진 않지만 도시를 한겹 둘러싸고있는 습기를 느낄 수 있습니다. 4월부터 더위가 시작되지만 5월 초까지는 견딜만한 더위입니다. 
5월중순부터는 7월까지는 우기입니다. 무더운 날씨는 비가 쏟아져도 시원해지지 않고 비가 오지않는 날도 습도는 90%에 달합니다. 하지만 그래도 실내는 냉방때문에 춥습니다. 우리나라 냉방시설과는 차원이 다른 강한 냉방이니 그에 따른 대비가 필요합니다. 가끔 태풍주의보가 발효되고 호우경보가 게시판에 붙기도 하지만 홍콩에서 우리나라만큼 심각한 태풍과 폭우는 본적이 없습니다.
8월은 그냥 덥습니다. 비도 오지 않고 강한 태양이 내리쬐는 날씨입니다. 떄문에 많은 홍콩사람들이 맑은날 거리에서 우산을 쓰고 다닙니다. 자외선차단제는 필수입니다.
9월부터는 여름의 기세가 한풀 꺾입니다. 태양은 여전히 뜨겁지만 어느새 바람은 선선해집니다.1학기보다는 2학기의 날씨가 더 좋다고 생각합니다.","학교와 연결된 고급 백화점인 festival walk에서 쇼핑과 음식을 즐길 수 있습니다. 하지만 고급 백화점이니만큼 가격의 부담이 만만치않습니다.
학교 후문쪽으로 나가면 남산촌과 shek kip mei(쉐킵메이)라는 곳이 있는데 저렴하고 맛있는 음식점들이 있습니다. shek kip mei에 위치한 sai kung seng(사이쿵셍) 이라는 베트남,타이 음식점과 ban hui lang이라는 홍콩음식점을 추천합니다. 또 걸어서 20분쯤 가면(기숙사 맞은편 버스정류장에서 2F버스 이용) 삼수이포지역에 도착하는데 우체국이 위치해 있고 street market에서 필요한 생필품들도 마련할 수 있습니다.
홍콩사람들은 음주를 즐기지 않아 학교주변에 학생들이 갈만한 술집은 없습니다. 
장을 볼때는 주로 festival walk에 있는 taste를 이용했습니다. 가격은 싸다고 할 수 없으나 품질이 좋은 물건을 구입할 수 있습니다. 특히 수입품이 많이 구할 수 있습니다. 학교에서 MTR로 한정거장만 가면 jusco라는 일본 대형 할인매장이 있고(E마트같은) 학교 후문으로나가 10분정도 걷다보면 wellcome이라는 홍콩 슈퍼마켓이 있습니다(l이 두개입니다ㅋ). 또 페스티발워크를 지나쳐 곧장 20분쯤 걸어가면 또 다른 wellcome 마트와 우체국이 있습니다.","시티유의 기숙사는 홍콩내 대학중 최고의 시설을 자랑합니다. 한국의 기숙사와 비교해보아도 크게 뒤떨어지지 않습니다. 총 9개의 건물로 구성되어 아파트단지같은 느낌을 줍니다. 각각의 동마다 두명의 경비가 있으며 24시간 출입이 자유롭습니다. 기숙사는 2인 1실이며 화장실은 두방이 한개의 화장실을 함께 사용하게 됩니다. 방의 크기는 두명이 살기에 불편함을 느끼지 않을 정도의 크기이고 개인책상과 침대 그리고 옷장이 주어집니다. 그리고 돈을 충전해서 사용하는 에어컨이 방마다 구비되어있습니다. 그리고 층마다 있는 common room에는 TV와 조리기구들이 갖추어져 있습니다. 저의 경우 밥을 직접 해먹었습니다. 
룸메이트는 중국 본토학생일 수도 있고 홍콩학생일 수도 있습니다.
중국학생이나 홍콩학생이나 영어를 매우 잘한다고는 볼 수 없습니다. 때때로 의사소통이 불편한 경우도 있습니다. 주로 두가지 경우에 룸메이트간 불화가 생기는데 그 중 한가지는 생활패턴의 차이로 생기는 문제이고 다른 한가지는 친구를 방에 데리고 오는 문제입니다. 특히 이성친구를 방에 잘 데리고 오는데 이것이 싫다면 처음에 분명한 의사표명을 해야합니다.
학교내 이용할 수 있는 식당은 캠퍼스안에있는 식당과 기숙사 식당이 있는데 기숙사식당의 경우 영어가 통하지만 학생식당은 영어가 통하지 않아 메뉴이름을 한자로 적어가거나 광동어이름을 외우곤 했습니다. 캠퍼스내 학생식당의 아침메뉴는 꽤 먹을만 합니다. 저의 경우 아침 10시 반까지 제공되는 딤섬메뉴를 자주 이용했습니다. 또 학관(amenities 빌딩) 8층에 위치한 chinese레스토랑에서도 딤섬을 저렴한 가격에 먹을 수 있습니다.
식비는 한국에 비해 매우 저렴한 편입니다.","수업은 주로 영어로 진행되지만 수업시간에 광동어를 섞어서 사용하는 교수님도 계시고 학생들은 광동어를 사용하기를 더 좋아합니다. 그래서 그룹프로젝트나 실험을 할때 답답한점이 없지 않았습니다. 그리고 한학기에 한분씩 영어를 정말 못하는 교수님을 만났습니다. 하지만 대부분의 교수님이 교환학생이라고 말씀드리면 특별히 배려해주고 신경써 주셨습니다. 수업 방식은 한국과 거의 같고 학생들의 수업태도는 깜짝 놀랄만큼 엉망입니다.
저는 1년동안 공학 전반에 관한 수업을 다양하게 들었습니다. 총 12개의 수업을 들었으면 간략하게 수업에 대해 소개하겠습니다.

urban design- 재미를 위해 수강했던 수업으로 건축과 3,4학년 학생들을 위한 수업이었지만 저와같이 재미삼아 듣는 타과 학생들도 꽤 있었습니다. 이론수업보다는 현장학습이 많았으며 실제로 홍콩의 한 지역을 재계발하기위한 계획서를 작성하는 그룹프로젝트가 있었던 수업이었습니다. 덕분에 홍콩 친구들과 몽콕을 구석구석 다녀보기도 하고 여러가지 조사도 했던 활동적인 수업이었습니다. 그리고 학기중에 학교의 지원금을 받고 1주일정도 싱가폴로 study trip을 다녀왔던 아주 유익하고 기억에 남는 수업이었습니다.

wave and optics, fundamental of the laser optics, geometrical and instrumental optics, advanced optic lab 학점인정을 위해 들은 광학수업이었는데 한국의 수업방식과 매우 유사했습니다. 실험과목의 경우 조원들이 영어를 잘 못해 얻은게 별로 없는 수업이었습니다. 

computer aided engineering(Robert Li), digital image processing(Hong Yan), Biomaterial(Kelvin Yeung) 추천할만한 과목과 교수님입니다. 뜻도 발음도 명확한 영어를 구사하시며 수업에 열정이있고 실력있는 교수님들이셨습니다.


Medical physics, CAD/CAM, micro processor and assembly language, 
smart English for young professionals 이 수업들에 대해 궁금하시면 개별적으로 연락 주세요.


아카데믹 빌딩 3층은 도서관입니다. 한층이라 규모가 크지 않지만 소장도서수는 연세대학교와 비슷한 수준이거나 오히려 더 많다고 들었습니다. 1년동안 자주 이용하였습니다. 도서관의 분위기는 다소 산만합니다.",국제교육부는 amenities building 6층에 있습니다. 교환학생을 위한 행사를 주관하는곳인데 모든 필요와 도움을 그곳에서 받을 수 있습니다. 그리고 국제교육부 뿐 아니라 모든 학과사무실에서 교환학생들을 친절하게 도와줍니다.,"학교내 동아리들이 점점 교환학생에게도 개방되고 있는 추세입니다. 동아리 가입을 한다면 더 특별한 기억을 남길 수 있을 것입니다. 

교환학생들에게 한학기 동안 노트북을 빌려줍니다.
CSC 와 도서관에서 컴퓨터와 프린터를 자유롭게 사용할 수 있습니다.","우리나라보다 훨씬 서구적인 사회입니다. 영어를 사용하다보니 나이에 상관없이 수평적인 인간관계가 형성되고, 성(性)문화도 개방적이어서 성적인 농담들이 아무렇지도 않게 오가기도 합니다. 남을 의식하지 않는 사고방식이 자리잡고 있어 남이 무엇을 하든 별로 이상하게 생각하지 않습니다. 하지만 그러한 사고방식이 가끔은 남을 배려하지 않는 태도로 나타날때도 있습니다.","위클리홍콩이라는 홈페이지에 각종 생활정보가 담겨있습니다. 네이버 카페인 포에버홍콩에서도 좋은 정보를 얻을 수 있습니다. 하지만 정보를 얻는것만으로 채워지지 않는 감정적인 무언가가 있다면 한인회 모임에 나갈수도 있고 교회나 성당에 나갈 수도 있습니다. 
저는 제가 1년동안 몸담았던 교회를 추천합니다. 저는 학교에서 택시로 5분거리인 홍콩제일교회에서 1년동안 많은 도움과 위로를 받았고 좋은 추억을 쌓았습니다. 교회에서의 신앙생활도 물론 좋았지만 다양한 분야에서 일하시는 집사님들을 통해 실질적인 진로결정에 필요한 조언도 들을 수 있었고 병원소개나 아르바이트같은 도움도 얻을 수 있었습니다. 주일예배는 오전 9시와 11시에 두번 있고 1시에 청년부 교제와 나눔의 시간이 있습니다.
홍콩제일교회는 학교에서 가장 가까운 한인교회로 kowloon Tong, cumberland road(金巴倫道)21번지에 위치하고 있습니다.
http://www.hkcheil.org/hkjeil/index.asp
교회홈페이지에서 자세한 위치와 정보를 얻으실 수 있습니다.","홍콩은 대중교통이 상당히 잘 되어있습니다. 대중교통을 이용하면 홍콩의 구석구석을 다 둘러볼 수 있는데, www.centamap.com 을 이용하면 현지인처럼 대중교통을 이용할 수 있습니다. 지도에서 가고싶은 곳을 클릭하거나 목적지를 검색하면 주변의 지하철 역과 버스번호들이 검색되는 홈페이지 입니다. 물론 현지인 친구를 사귀어 안내를 받을 수 있다면 더 좋습니다. 

홍콩의 일기예보를 볼수있는 사이트입니다. http://www.hko.gov.hk/wxinfo/currwx/fnd.htm 

홍콩한인사회의 정보교환 공간입니다
http://www.weeklyhk.com/
이용하기 나름이겠지만 저의 경우에 꽤 유용했다고 생각되어 소개합니다.


이상으로 제가 1년간 경험했고, 느꼈고, 배웠던 홍콩이야기를 마칩니다.
홍콩은 저에게 최고의 선택이었습니다. 한국과 비슷한 생활환경으로 인해 적응에 필요한 시간을 단축할 수 있었고 정서적으로 비슷한 홍콩의 친구들과 이질감 없이 굉장히 친밀한 관계를 형성 할 수 있었습니다. 그리고 그들의 문화를 좀 더 빨리, 그리고 깊이 이해할 수 있었습니다. 작고 교통이 편리한 홍콩과 1년이라는 시간은 공부과 여행 두마리 토끼를 모두 잡을 수 있게 해주었습니다. 영어도 장족의 발전을 이뤄내진 못했지만 교환학생 친구들과 어울리면서 자연스럽게 배울 수 있었습니다. 한국에 돌아올때 1년간 친하게 지냈던 호주 친구가 ""너 영어 많이 늘었다"" 말할 정도로. (하지만 역시 영어공부에 목적을 둔다면 홍콩은 부족한 곳이라 생각됩니다)"
