gen_info,env_info,food_info,study_info,office_info,facil_info,mhct_info,help_info,etc_info
"홍콩 Kowloon Tong역 근처에 위치한 City U는 연세대학교에 비하면 크기가 많이 작은 학교입니다. 하지만 학생 수가 많지 않고 공간이 효율적으로 활용되고 있기 때문에 그렇게 답답하게 느껴지지는 않았습니다. 오히려 학교 어디든 기숙사에서 10분 안에 갈 수 있는 것이 편했습니다. 다만 건물들의 층수가 높고 서로 조금 복잡하게 연결되어있어 처음에는 길을 잃을 수 있습니다. 학기 초에 이곳저곳 둘러보며 길 익혀두는 것도 좋을 것 같네요.City U가 위치한 Kowloon Tong은 주로 주거지역으로 구성된 조용한 동네입니다. 하지만 홍콩 내에서도 중심부에 위치해 있기 때문에 홍콩 어느 곳이든 가기가 편리합니다. 또 학교가 Kowloon Tong MTR역과 연결되어 있기 때문에 교통 역시 편리합니다. 덕분에 학기 내내 홍콩의 대표적인 번화가인 Mong Kok, Tsim Sha Tsui, Central은 물론 Lan Tau, Sai Kung 등등 홍콩 외곽 까지 다니며 놀 수 있었습니다. 심지어 기숙사 바로 앞 정류장에 공항 직행 버스가 다녀 교환학생 입장에서는 City U가 홍콩 내 학교 중 위치가 가장 좋은 학교가 아닐까 싶네요.제가 홍콩에서 보낸 봄학기는 1월에 시작해 5월에 마무리 되는데요, 제가 느낀 홍콩의 기후는 같은 기간 한국에서보다 일정하고 쾌적했습니다. 우리나라 초봄부터 초여름까지의 날씨라고 생각하시면 될 것 같네요. 1월, 2월에는 날씨에 따라 갑자기 추워지는 날도 있는데, 홍콩에는 따로 난방시설이 없기 때문에 전기담요를 챙겨 가면 좋습니다. 저는 작은 크기의 전기담요를 챙겨 갔는데 덕분에 불편함 없이 홍콩의 겨울을 잘 날 수 있었습니다. 4월 초부터 쾌적했던 날씨가 점점 더워지기 시작하는데요, 홍콩의 건물에는 냉방시설이 굉장히 잘 갖춰져 있기 때문에 야외활동을 피한다면 여름에도 쾌적하게 지내실 수 있습니다. 저는 오히려 너무 빵빵한 에어컨 탓에 감기가 걸린 적이 있네요... 긴팔옷 하나 챙기고 다니는 것이 좋습니다.","학교와 연결되어 있는 쇼핑몰 Festival Walk(MTR역이 이 건물과 연결되어 있습니다) 안에는 다양한 매장과 레스토랑, 푸드코트, 식료품 매장인 Taste가 있습니다. 워낙 큰 쇼핑몰이라 정말 없는 것이 없을 정도지만 전체적으로 가격대가 비싼 편입니다. 학교와 조금 떨어진 곳에 NamShan Estate라는 아파트가 있는데, 그곳 1,2층에는 여러 가게와 식당들이 있습니다. 위생이 조금 염려되는 부분이 있으나 몇몇 식당들은 꽤나 맛있고 저렴한 음식들을 팝니다. 저녁 9시 무렵에 까이단짜이라고 불리는 홍콩식 계란와플을 파는 아주머니가 계셨는데 맛이 괜찮아 자주 가서 먹었습니다. NamShan Estate 바로 옆에 welcome market이라는 마트가 있는데, 그곳의 물가가 Taste에 비해 저렴하기 때문에 장을 볼 때 자주 이용했습니다. Kowloon Tong역에서 한 정거장 떨어진 Lok Fu역에도 쇼핑몰과 여러 식당들이 있습니다. 비교적 저렴한 가격에 깔끔하고 맛있는 음식들을 파는 곳이 많아 친구들과 종종 가서 밥을 먹고 돌아오곤 했습니다. 기숙사 근처에 편의점들이 꽤나 먼 거리에 있기 때문에 밤에 갑자기 뭘 사러 나가기가 귀찮은데, 기숙사 아래쪽 주유소에 미니마트가 하나 있습니다. 간단한 간식거리나 맥주 사러 가기에 좋습니다.학교 근처에 크고 작은 공원들이 있습니다. 기숙사 바로 옆에 있는 Shek Kip Mei Park는 축구장, 농구장, 테니스장, 트랙 등을 갖춘 홍콩에서는 보기 드문 꽤 큰 종합운동장입니다. 시설들을 이용해 본 적은 없지만 종종 친구들과 나가 운동하며 놀기도 했습니다. Festival Walk 뒤편에는 러닝트랙과 몇몇 기구를 갖춘 조그마한 공원이 있습니다. 사람이 많지 않아 조용히 운동하기에는 좋은 곳입니다. 학교에도 체육관이 있는데 따로 신청을 해야지만 이용할 수 있습니다.","교환학생의 경우에는 기숙사가 거의 보장되는 것으로 알고 있습니다. 다행히 이번에 한국에서 온 교환친구들은 전부 기숙사에서 살았네요. 엄청난 홍콩 집값에 비하면 기숙사 비용은 상당히 저렴한 편이기 때문에 많은 로컬 친구들도 기숙사에서 거주하기를 원합니다. 기숙사 Hall마다 선발 기준이 조금씩 다르지만 전반적으로 Hall Activity 참여 점수가 중요하기 때문에 기숙사 활동들이 굉장히 많고 참여가 활발합니다. 덕분에 저도 같은 Hall 친구들과 체육대회 등 여러 활동에 참여 하면서 즐거운 추억을 많이 쌓았습니다. 사실 몇몇 활동들은 하면서 ‘내가 이걸 왜 하고 있지’라는 생각이 드는 것도 있었지만... 돌이켜 생각해보니 피식피식 미소 지어지는 추억들도 많이 있네요.기숙사는 1인실, 2인실, 3인실이 있는데 대부분 2인실에 거주하는 것 같습니다. 2인실의 경우 두 개의 2인실이 하나의 화장실을 사이에 두고 연결되어 있는 구조입니다. 그래서 화장실을 공유하고 있는 건너편 방의 친구들을 Toilet Mate라고 부르는데, 저 같은 경우는 넷 다 서로 많이 친해져서 오며가며 자주 놀았습니다. 기숙사에는 층마다 Common Room이 있어서 요리를 해서 먹을 수 있습니다. 재료를 사다가 밥을 해먹기도, 종종 친구들과 모여 술도 한 잔 하며 놀기도 했네요. 그리고 Hall 마다 조금씩 다른 것 같은데 1층에는 공용 Common Room, Computer Room, Piano Room 등이 있습니다.학교에는 크게 AC1, AC2, AC3, 기숙사 식당 이렇게 네 곳의 식당이 있습니다. 식당마다 메뉴의 컨셉이 달라 돌아다니며 이 메뉴 저 메뉴 먹어보는 것도 재미가 있습니다. AC1 식당 뒤편으로 돌아가면 케밥과 피자를 파는 작은 식당이 있습니다. 또 Amenities Building 8층에 위치한 중식당이 있는데 가격대가 외부 식당보다 저렴하고 맛도 꽤 괜찮습니다. 학교 곳곳에 여러 카페들도 있으니 위치를 알아두었다가 이용하시면 될 거 같습니다. 사실 홍콩 번화가로 나가면 다양하고 맛있는 음식을 파는 좋은 식당들이 많습니다. 종종 시간 내서 친구들과 함께 하나씩 먹고 오는 재미도 쏠쏠 합니다.","수업과 토론은 기본적으로 모두 영어로 진행됩니다. 영어 회화에 조금 자신이 없어 걱정을 했었는데 차근차근 하나씩 해나가다 보니 크게 어려운 점은 없었습니다. 조금 특이한 점은 홍콩에서는 팀프로젝트 발표를 할 때 파트를 일일이 나누어 각자 맡은 파트에 대해 자료 및 피피티 제작, 발표까지 전부 책임지는 것이 일반적으로 보였습니다.(물론 전체 방향에 대해 함께 의논을 합니다) 처음에는 한국에서의 방식과 달라 조금 당황했지만 하다 보니 프로젝트 진행하기도 편했고 더 많은 부분을 배울 수 있었던 것 같습니다. 덕분에 전에 없던 영어 발표를... 많이 경험해보게 되었네요. : )들었던 수업 중에 몇몇 추천을 하자면,Interactive Communication: 특이하게도 수업을 한국인 교수님께서 진행하십니다. 젊은 교수님이신데 굉장히 친절하십니다. 학기의 절반은 Interactivity와 관련된 이론을 공부합니다. 역시 이론은 조금 지루한 면이 있지요... 나머지 학기의 절반은 팀프로젝트 발표와 몇몇 특강으로 이루어지는데요, Prototype, 3D Game Design, Sound Remix, VR 등 특강에서 다룬 소재들이 흥미로운 게 많았습니다. Sound Remix 특강의 경우 실제 DJ가 와서 디제잉을 선보이셨는데, 강의실이 클럽이 되어버린...둠칫둠칫 그 순간을 잊을 수 없네요ㅋㅋㅋ 두 번의 시험과 한 번의 팀프로젝트, 그리고 몇몇 과제들이 있는데 어렵지는 않았습니다.International Communication: 수업의 대부분은 실재하는 국제적 이슈를 토대로 어떤 과정을 통해 서로 다른 뉴스가 생산 되는지를 다룹니다. 교수님은 친절하시지만 사실 나름 빡센 수업입니다. 두 번의 시험, 두 번의 팀프로젝트 발표... 다행히 재미있는 팀원들을 만나 잘 마무리 했지만 꽤나 힘들었던 수업이었습니다. 하지만 수업 내용은 흥미로운 것들이 많아 미디어 전공 학생이라면 수강하는 것을 추천합니다.Search for Modern Chinese-self: 제목 그대로 근현대 중국의 정체성을 찾아가는 수업입니다. 지루한 내용일 것 같지만 친절한 교수님과 함께 중국의 여러 소설과 영화를 보며 이야기를 나누면서, 흥미로운 지점을 꽤 발견할 수 있었습니다.(생각보다 재밌는 중국 영화가 많았습니다.) 내용들이 중국에 한정된 것이 아니라 동아시아 문화권을 꿰뚫고 있는 것들이 많아 평소에 관심 있는 분들이라면 재미있게 들으실 수 있을 것 같습니다. 중국 문화, 역사가 궁금하신 분들에게도 흥미로운 수업일 겁니다. 팀프로젝트 발표가 하나, 두 번의 글쓰기 과제가 있습니다.",학교에 교환학생과 외국인 유학생이 꽤 많아서 그런지 신경을 많이 써주는 편인 것 같습니다. 학기 시작 전부터 메일을 통해 여러 필요한 정보를 안내해주고 문의 시 친절하게 설명해줍니다. 또 여러 나라에서 온 학생들을 위한 행사를 많이 진행하니 학교 메일로 오는 공지 보고 시간되시면 참여하는 것도 좋습니다. 한 번 여러 나라 음식 만들어서 함께 나눠먹는 행사에 참여 했었는데 김밥이 그렇게 손이 많이 가는 음식인 걸 처음 알았네요. 힘들긴 했는데... 홍콩에서 잊지 못할 추억 중에 하나네요 : ) 혹시 하시게 된다면 떡볶이 하세요. 외국 친구들에게 인기가 좋고 무엇보다 요리하기가 편합니다.,"City U에서는 동아리 활동이 정말 많고 또 활발하다고 느꼈습니다. 저는 따로 동아리 및 단체에 들어가지 않았지만 거기서 진행하는 행사에는 꽤 많이 참여했습니다. 씨티투어도 하고, 자전거도 타러 가고, 음식도 해먹고... 돌이켜보니 정말 이것저것 많이 했네요. 친구도 많이 사귀었고요. 학교 메일 혹은 게시판 통해 공지가 오는데 종종 확인하셔서 흥미로운 활동 참여 하는 것도 꽤나 좋을 것 같네요. 그리고 City U에는 한인 축구팀이 있습니다.(그만큼 홍콩에는 한인 유학생이 많습니다.) 주로 한국인 유학생들로 구성된 축구팀인데, 홍콩 내 다른 대학 한인 축구팀들과 함께 리그를 열어 경기를 합니다. 축구 좋아하시는 분들은 한인 유학생 분들 통해서 연락해보세요!","홍콩 자체가 워낙 다양한 국적, 문화를 가진 사람들이 함께 사는 곳이라 그런지, 특별히 홍콩에 지내면서 Culture Shock이랄 것을 크게 느낀 적이 없었던 것 같습니다. 대도시 문화 안에서 서로를 인정하며 나름대로 각자의 문화를 지켜가는 느낌이랄까요. 다만 오랫동안 중국과 별도로 정치, 경제, 문화적 성장을 이뤄온 홍콩이 최근 중국으로 다시 반환 되면서 ‘홍콩인’의 정체성에 대한 갈등을 종종 볼 수 있었습니다. 제 친구들을 비롯한 대다수 홍콩 출신 사람들은 스스로를 ‘중국인’이 아닌 ‘홍콩인’으로 생각하는 것 같았습니다. 반대로 대륙 출신 중국인들은 그것을 무시하는 경향이 있었고요. 때문에 이 문제를 이야기 하실 때는 조금은 조심스럽게 다루셔야 할 것 같습니다.홍콩의 제1언어는 광동어입니다. 학교 및 주요 시설에서는 대부분 영어로 원활히 소통 가능하지만, 밖에서는 영어로 소통이 충분하지 않은 상황이 꽤 있습니다. 광동어가 모국어이신 분들도 대부분 보통화(우리가 일반적으로 알고 있는 중국어)로 어느 정도 소통이 가능합니다. 때문에 보통화를 하실 줄 아신다면 홍콩 생활에 큰 도움이 될 겁니다. 물론 광동어를 하실 줄 아신다면 더 좋겠지만 제 경험으로는 광동어 익히기가 아주 어려웠습니다.","홍콩에는 연세대학교 동문회가 잘 조직되어있습니다. 학기 중간 중간 동문회에 참여 했었는데 친절한 선배님들, 다른 학교에 교환 온 동문들과 함께 좋은 시간 보냈습니다. 가을 학기에는 홍콩에서 미니 연고전을 개최한다고 하니 그 때 교환 가시는 분들은 더 재밌는 시간 보내실 수 있겠네요. : )","홍콩을 생각할 때 대도시의 이미지가 강하지만 의외로 좋은 산과 바다가 많은 곳입니다. 또 트레킹 코스가 매우 잘 갖춰져 있기 때문에 시간 내셔서 친구들과 이곳저곳 다녀보시는 것도 좋을 것 같네요. 개인적으로는 홍콩 동해안 쪽 Sai Kung 트레킹 코스와 해변 추천합니다. 그곳의 아름다운 바닷가 마을 풍경이 기억에 많이 남네요.그리고 매주 수요일마다 홍콩 내 박물관, 미술관들이 무료 개방을 합니다. 평소에도 학생증이 있다면 저렴한 가격에 입장 할 수 있으니 시간 내서 이곳저곳 둘러보는 것도 좋을 것 같습니다. 꽤나 잘 되어 있는 곳이 많습니다. 맨날 미루다가 못 가본 곳이 많아 아쉽네요.파견보고서 작성하다 보니 잠시 잊고 있던 교환 생활을 다시 돌아보게 되었는데요, 즐거운 추억들도, 못해본 것들에 대한 아쉬움도 많이 생각나네요. 혹시 홍콩 생활에 대해 더 궁금하신 점이 있다면 *******@naver.com로 연락주세요! 친절하게 설명 해드리겠습니다. : )"
"제가 다녔던 홍콩 씨티유는 kowloon tong역에 위치해있습니다. 홍콩의 대부분 역은 쇼핑몰과 연결되어 있는데요, kowloontong역은 페스티벌 워크 라는 큰 쇼핑몰과 연결되어 있고 쇼핑몰과 학교 또한 연결되어 있어서 굉장히 편리했습니다. 역 자체도 홍콩 큰 번화가들(센트럴,몽콕,완차이 등등)과 크게 떨어져 있지 않아서 지하철 몇번만 타면 다 갈 수 있었습니다.  학교 크기는 매우 작습니다. 건물은 크게 AC1,2,3 / creative media 건물/ 기숙사 건물 등으로 이루어져 있습니다. 크기는 작아도 건물들이 거의 연결되어 있어서 매우 편리했습니다. 교내에 학생들이 자유롭게 앉아서 공부하거나 팀프로젝트를 할 수 있는 공간도 많아서 좋았어요.  기후 같은 경우에는, 제가 간 봄학기는 1월부터 5월 중순까지 였습니다. 1~3월은 홍콩에서도 겨울축에 속합니다. 겨울이라고 하더라도 지리상의 이유때문에 우리나라 겨울처럼 춥진 않지만, 홍콩은 난방시설이 갖춰져 있지 않습니다. 그래서 유난히 춥게 느껴졌던것 같습니다. 전기담요같은 것을 챙겨가라는 말을 듣고 가져갔었는데 꽤 유용하게 사용했어요! 이 시기에 감기걸렸던 한국 친구들이 많았던 것 같아요. 4월부터는 서서히 더워지기 시작해서 한국오기 전까지는 정말 더웠습니다. 특히 습기! 홍콩의 여름은 우리나라보다 훨씬 습해요. 에어컨을 틀지 않으면 숨을 쉴 수 없을정도였습니다. 봄학기에 교환학생을 가신다면 1~3월에 야외활동 많이 하시는걸 추천드립니다. 더워지면 정말 나갈 수 없어요... 전 초반에 하이킹이나 이곳 저곳 여행을 많이 다닌걸 다행이라고 생각합니다.","우선 앞서 말씀드린 것 처럼 학교와 페스티벌 워크라는 쇼핑몰과 연결되어 있어요. 쇼핑몰 지하에 마트가 있어서 자주 이용했습니다. 생필품이나 음식들을 거의 이곳에서 많이 구매한 것 같아요. 쇼핑몰안에 영화관, 스타벅스, 드럭스토어, 전자제품 파는 곳도 있고,제일 윗층에는 푸드코트와 맥도날드가 있습니다.  푸드코트에 한국음식점도 있구요, 가끔 홍콩 친구들과 이것 저것 시도해서 먹었던 기억이 있어요. 맥도날드도 자주 갔구요ㅋㅋ 아 가끔 푸드코트 직원분들이 영어를 전혀 못하시는 분들도 계세요. 대기번호 숫자도 광동어로 부르셔서 당황했던 적이 몇번 있네요.  그리고 학교와 가까운 Nam Shan Estate 라는 주거지역이 있습니다! 이곳도 로컬 친구들과 굉장히 자주 갔던 곳인데요, 이 곳에 웰컴마트가 있습니다. 웰컴마트는 홍콩 주요 마트 체인 중 하나인데요 정말 홍콩 어디를 가도 보실 수 있을 거에요. 앞서 말했던 페스티벌워크 지하 마트보다 가격이 상대적으로 저렴해서 이곳도 자주 이용했습니다. 정말 자주 가시게 될거에요. 또 학교와 가까운 곳에 shek kip mei park라는 공원이 있습니다. 이곳에서 가끔 운동도 하고 친구들과 자주 놀았어요~","홍콩은 집값이 엄청나기로 유명한 곳이죠...당연히 기숙사에서 거주했습니다! 많은 로컬 친구들도 기숙사에서 거주하기 때문에 친구들과 만나기에는 정말 좋은 환경이었습니다. 기숙사는 hall1부터11까지 있구요 숫자가 뒤로 갈 수록 최근에 지어진 것입니다. 홀11밑에 작은 gym이 있어서 정말 부러웠어요. 기숙사 배정은 first come, first served라고 공지 되어있기는 하나 친구들 말을 들어보면 명확한 기준을 알 순 없더라구요. 각각의 홀마다 특징이 다르고 액티비티가 다릅니다! 로컬 친구의 말을 들어보면 홀 액티비티에 적극적으로 참여하여 점수를 쌓아야 다음 번에도 기숙사에서 지낼 수 있기때문에 굉장히 활발하게 활동하더라구요~홀끼리 스포츠 경기나 여러 활동이 있구, 홀 디너 라고 해서 같은 홀에 있는 친구들끼리 밥을 먹으면서 친해지는 활동들도 있습니다. 적극적으로 참여하시면 더 많은 로컬 친구들과 친해질 수 있는 좋은 기회인것 같아요. 저 같은 경우는 홀6에 거주했는데요, 홀마다 세탁룸이나 에어컨 트는 방법이 다른 경우가 많아서 기숙사 생활에 대해서는 룸메이트나 토일렛메이트와 같은 로컬 친구에게 도움을 청하는게 가장 좋은 방법인것 같습니다. 두개의 방이 하나의 화장실을 공유하는 형태라서 토일렛 메이트가 있습니다~! 식사는 학교 건물인 Ac 1,2,3마다 칸틴이 있어요. 각각 칸틴마다 판매하는 메뉴가 달라서 학기 초반에 메뉴탐방 했던 기억도 있네요ㅋㅋㅋ 기숙사와 가장 가까운 곳에 홀 칸틴(이름이 정확하게 기억이 안나네요)도 있습니다. 간단한 메뉴와 간식, 휴지 물과 같은 생필품을 판매해요~ 로컬 친구들과 친해지면 정말 이곳 저곳 먹을 곳을 많이 데려가줘서 식사에 대한 걱정은 크게 안하셔도 될것 같습니다.","저 같은 경우는 전공이 교환대학에 없어서 한국에서 관심있었던 교양위주로 수강했습니다. 우선 만다린! 저는 고등학교때 제2외국어로 중국어를 배운 상태라서 기본은 알고 있었습니다. 중국어 시간은 교수님께서 정말 진도도 천천히 나가시고 교환학생들의 만남의 장 같은 느낌이라 친구도 많이 사귀고 즐겁게 공부할 수 있는 시간이에요. 퀴즈 준비만 착실히 하면 큰 어려움은 없는 수업입니다.  visual storytelling & cultural thinking 수업은 수업과 튜토리얼로 구성됩니다. 튜토리얼은 조교님께서 맡아서 진행하셨어요. 저는 개인적으로 영화나 색채, 그림에 관심이 많았어서 굉장히 재밌게 들었던 수업이에요. 교수님께서 수업시간에 굉장히 많은 시각적인 자료를 보여주려고 하셔서 지루하지 않고 재밌게 들었습니다. 영화의 구성요소, 그림이나 사진의 구성요소, 어떤 작품이 좋은 작품인가 와 같이 생각할거리를 많이 던져주시는 수업이었습니다. 중간 중간 튜토리얼 시간에 복습 개념의 퀴즈를 봤구요, 학기말에 조를 이루어서 영화를 정해 분석하여 발표하는 큰 프로젝트가 있었습니다. 또한 제가 있었던 봄학기가 홍콩 아트워크 기간과 겹쳐서 교수님과 함께 전시회도 보고 왔던 경험이 있습니다. 수업 자체는 굉장히 자유롭지만 대형강의이다보니 출석이 엄격했던 기억이 있네요. introduction to digital media 수업은 중간 프로젝트로 영상 만들기, 기말 프로젝트로 프로토타입 디자인으로 구성되어 있었습니다. 저는 영상 만들기에 관심이 있어서 들었습니다. 모든 수업은 팀 프로젝트로 진행되고 저는 로컬 친구들과 한팀이어서 친구들도 많이 사귀고 정말 재밌게 들었던 수업입니다! 영상 찍으면서 이곳 저곳 홍콩 친구들만 알고 있는 장소들도 가보고 여러 음식점도 가보고 재밌는 추억을 많이 만들었던 수업이었습니다. 교수님께서도 피드백도 잘해주시고 재밌었어요.","학교에서 교환학생들에게 버디를 지정해줘요. 버디들과 만남을 갖는 친구들도 있지만, 저 같은 경우는 수업시간에 만난 로컬 친구들과 더 자주 만나고 도움을 받았던 것 같아요.",,"딱히 컬쳐쇼크는 없었습니다. 홍콩 친구들 중에 한국 가수 드라마를 좋아하는 친구들이 굉장히 많고, 한국 대학교로 교환학생 프로그램을 왔던 친구들도 많아서 한국어를 할 줄 알거나 관심있는 친구들이 많아서 빨리 친해질 수 있었어요. 아 한가지 주의할 점이 있다면, 다른 분들이 경험 보고서에 쓰신 것 처럼 홍콩사람들은 본인들을 중국인이라고 생각하지 않아요. 이 점은 주의하셔야 할 것 같습니다.",,
