gen_info,env_info,food_info,study_info,office_info,facil_info,mhct_info,help_info,etc_info
"길림대는 중국의 동북3성 중 길림성의 성도인 장춘에 위치한 학교이다. 중국의 10대 명문대 중 하나이기도 한 이 대학은 법학과 행정학으로 유명한 대학이란다. 이 대학은 주변 3개 학교를 통합하여 설립되었기에 규모도 크고 교육의 질도 우수하다고 한다. 길림성 장춘시의 기후는 정말 혹독하다. 10월 초부터 추위가 찾아들기 시작하여 4월 중순까지 계속되고, 우리나라와는 달리 많이 건조하다.","유학생은 길림대의 남교에서 주로 생활하게 된다. 그 곳에 유학생 기숙사인 '우의회관'이 있는데, 생활과 수업이 여기서 이루어진다. 우의회관 근처에는 여러가지 필요한 물건들을 구입할수 있는 마켓과 길림마트가 있다. 길림마트가 생긴 이후로는 비교적 거리가 조금 멀리 있는 월마트는 잘 안 찾게 된다. 음식과 생필품들은 전부 여기서 구입이 가능하다. 남교 근처에는 마켓과 마트 이외, 조그만 식당들이 위치해있는 것을 제외하면 상당히 조용한 편이다.","유학생들은 보통 우의회관에서 등록을 하고 거주를 하게 된다. 유학생 기숙사이므로 교환학생들은 30% 할인된 금액으로 거주를 할 수 있고, 보통은 이인실 방에 머무르게 되고 원한다면 가기 전에 미리 연락을 취해 일인실 방을 예약할 수도 있으나, 일인실은 주로 국비장학생들을 위해 마련하므로 지급을 받기가 어려울 수 있다. 이인실이 좁고 답답해 우의회관 근처 아파트인 양광청에서 생활을 하는 유학생들도 있다. 그리 비싸지 않은 가격에 생활이 편리하기 때문에 많은 학생들이 이용한다. 식사 역시 크게 걱정할 필요가 없다. 학교 근처에 조그만 식당들이 위치해있고, 우의회관 뿐 아니라 그 근처 곳곳에 한국 식당이 있다. 우의회관 앞 쪽으로는 '일송정', 뒤 쪽으로는 '옥자'와 '패밀리'가 있어서 한국 유학생들이 자주 이용한다.","수업은 보통 우의회관 내에서 이루어진다. 우의회관 국제 교류부에 등록을 하면 본인의 성적에 맞게 반 배정이 이루어지고, 반에 따라 시간표도 정해져 있다. 보통은 이런 어학수업이 가장 기본으로 이루어지고, 나머지 학교 내에서의 중국인과 함께 수업을 듣는 교양, 전공 수업등은 본인이 선택하여 들을 수 있다. 하지만 그런 수업은 보통 어느정도 적응이 되고 난 2학기 때에 들을 수 있도록 허락하신다. 우의회관 7층부터 11층까지 각 층마다 열람실이 구비되어 있어 공부하기에 편하고, 학교 내에 도서관도 있다. 도서관은 출입증을 만들어야 이용할 수 있다.(한국 돈 6만 5000원 정도의 보증금을 주고 출입증을 만들어 사용한 후, 돌아오기 전에 반납하면 돈을 되돌려 받을 수 있다.)","1층과 2층에 선생님들이 계신 교육부가 있다. 보통 1층의 유학생 사무실을 훨씬 더 많이 이용하게 된다. 유학생 사무실에는 조선족 선생님이 두 분 계시고, 어려운 일이 있을때는 그 분들께 도움을 청할 수 있다. 시험일정과 성적은 2층에 계신 '수 선생님'(중국인)께 문의가 가능하다.","중국은 9월에 1학기가 시작되기 때문에 보통 9월 초에 학교 내에 들어가면 우리 학교에서 보여지는 것과 똑같이 각 동아리에서 신입회원을 모집하는 것을 볼 수 있다. 각종 동아리들이 많을 뿐 아니라, 동아리에 가입하면 중국 친구들을 사귀는 것도 용이하므로 많이 가입하여 활동하는 것이 좋다. 
학교 주변 이외 유학생들이 주말등을 이용하여 자주 찾는 곳은 '꾸이린루'라고 하는 곳인데 소위 말해 시내이다. 쇼핑도 하고, 맛있는 것도 먹고, 커피숍에서 수다도 떨 수 있는 곳이다.","문화적인 충격이랄 것은 사실 거의 없었다. 문화적인 차이가 큰 서양도 아니고, 모든 것이 보통 한국과 비슷하다고 보면 된다.",보통 우의회관 내의 국제 교육부를 이용하면 된다. 우의회관 내에 한국 학생들도 많으니 모르는 것은 그 친구들에게 물어보면 될 것이다.,"중국은 무한한 가능성을 지닌 나라이다. 하나의 나라이지만 가는 곳마다 다른 느낌을 가지고 있는 나라는 전 세계적으로 드물것이다. 무한한 가능성을 가지고 있어 무한한 호기심을 자극케하고, 또 다시 가고 싶게 만드는 곳이다. 중국에서 언어를 배우는 것도 중요하지만, 그 나라 사람들의 생활과 문화와 습관을 익히는 것도 중요할 것이다. 중국의 5.1절과 10.1절, 방학등을 이용해 많은 곳에 여행을 다녀보라고 권하고 싶다. 언어를 배우는 것보다 여행을 통해 얻는 것들이 나중에 훨씬 더 값지게 남을 것이다. 전혀 다른 시간, 전혀 다른 공간 속에서의 나를 본다는 것, 언제 생각해도 가슴 설레는 일이다."
"길림대학은 중국 대학 평가에서도 10위권안에 드는 소위 ‘명문대학’중에 하나이다. 중국에서는 ‘중점대학’이라는 것을 정부에서 지정하여 집중적으로 육성하는 데, 길림대학은 그 중점대학 중에 하나로써 당당히 이름을 올리고 있고, 동북 3성에서는 가장 우수한 학교이다. 원래 길림대학의 규모는 그다지 크지 않았지만, 중점대학으로 지정된 이후 장춘에 소재하고 있던 (장춘은 동북3성에서도 유명한 교육도시이기도 하다) 많은 대학들이 길림대학교에 편입되면서 거대한 규모로 탈바꿈하게 되었다. 특히 캠퍼스가 한 곳에 집중된 것이 아니라, 도시 곳곳에 퍼져있어서 심지어 ‘길림대학교 안에 장춘시가 있다’라는 현지인의 농담도 있을 정도이다. 교환학생이 파견되서 활동하게 되는 주 캠퍼슨 ‘남교 캠퍼스’로써 도심에서 남쪽에 자리잡고 있다. 도심까지 30분안에 연결되는 그리 멀지않은 곳이다. 혹 몇 몇 학생은 남교캠퍼스에서 10분정도 떨어진 남호캠퍼스에서 수학하기도 했는데, 특히 중국어 초중급반이 여기에 있는 것으로 안다. 길림대 남교는 크기가 우리학교 면적의 3분의 2에서 반정도 되는 것 같았다.

길림대학은 길림성 장춘시에 소재하고 있다. 길림성은 요녕성, 흑룡강성과 함께 ‘동북3성’으로 불리며 대학이 소재한 장춘시는 그 동북 3성의 가운데, 즉 교통의 요지에 자리잡고 있다. 요녕성의 성도인 심양까지 3시간, 흑룡강성의 성도인 하얼빈까지 2시간등 주변 대도시와의 연결이 편하다. 교통의 요지인 만큼, 장거리 이동도 매우 편리한데, 심지어 서북쪽의 간수성의 성도인 란저우, 최남단에 가까운 광동성의 광저우와도 직통 열차가 연결될 정도이다. 

장춘의 기후는 사시사철 바람이 매우 강하다는 특징을 지니며 특히 겨울의 날씨가 매우 혹독하게 추운것으로 알려져있다. 글쓴이의 경우 2월에 도착했는데, 한국보다는 춥지만 그래도 견딜만은 했던 것 같다. 특히 현지인들이 입는 내의류등의 방한복들은 날씨 극복에 아주 많은 도움이 될 것이다. 참고로 겨울이 약간 길어서 4월 말까지도 점퍼를 입고다녔고, 눈구경을 했던 것으로 기억한다. 그렇기 때문에 실내 난방은 대부분 잘 되어 있는 것 같았다. 봄은 길지 않고, 여름은 6월정도부터인데 습하지 않고 아침 저녁으로 선선하기 때문에 한국보다는 훨씬 지내기가 편하다.","교환학생이 지내게 될 남교캠퍼스 주위는 매우 조용하고 번잡하지 않다. 대부분의 상점이나 식당은 학생들을 주 고객으로 하고 있으며, 연세대학교 주변과 같은 술집이나 유흥업소는 거의 없다고 보면 된다. 반면에 식사를 해결할 만한 식당들은 매우 풍족한 편이다. 특히 조선족들이 거주하는 관계로 한국음식을 파는 식당들이 몇 곳이 있는데, 가격 또한 중국음식에 비해서 크게 비싸지 않고, 한국보다는 훨씬 싼 가격에 한식을 먹을 수 있다. (그러므로 식사 걱정은 별로 안하고 와도 무관하다고 생각한다.) 일단 교환학생이 먼저 거주하게 될 우의회관 1층에 한식당이 있고, 주변 아파트 상가에 인기 있는 두 집인 ‘옥자’와 ‘패밀리’가 있다. 24시간 영업을 하는 한식당 ‘일송정’도 있다. 한 편, 중국에 온 만큼 중국음식을 많이 먹는 것을 추천하는 데, 괜찮은 중국 식당들이 많은 편이다. 가격 또한 여러 사람이 먹는 다면 한 끼에 10원 이하로도 해결할 수 있다. 
생활 필수품의 경우는 두 가지 선택이 있는데, 하나는 간편한 월마트를 이용하는 것이고, 하나는 학교 정문 앞 상가 ‘Market’을 이용하는 것이다. 월마트의 경우 교환학생 정착 초기에 많이 이용하게 되는 데, 우의회관에서 도보 10분거리에 위치하고 있다. 규모도 꽤 있는 편이라 필요한 물건은 대부분 여기서 구입할 수 있고, 일용품의 경우 가장 저렴하고 확실한 품질을 기대할 수 있다. 반면 학교앞 상가 마켓은 상가안에 작은 가게들이 몰려있는 곳이며, 전자제품부터 서점까지 여러가지 종류의 제품들이 있다. 여기서는 100% 흥정을 잘 해야 한다. 물론 몇 원짜리 살 땐 예외지만, 어학기등의 상대적으로 고액의 제품을 살 땐 본인 능력 여하에 따라 월마트보다 훨씬 저렴한 가격에 살 수 있고, 나름대로 중국어 향상에도 도움이 될 여지가 있다. 

의류등은 시내 중심인 ‘중경로’와 ‘계림로’에서 구입하면 좋다. 이 곳은 명동, 신촌등과 같이 사람들이 많고 붐비는 곳이므로 어찌되었던 많이 찾게 된다. 맛있는 식당과 해적판 DVD를 저렴하게 구입할 수 있는 곳 또한 이 곳이다. 

전자제품의 경우 ‘歐亞’라는 곳에 가면 좋다. 이 곳은 ‘홍치지에’에 자리 잡고 있는 상가이름인데, 이 상가의 6-10층은 용산과 같이 소규모 전자매장이 몰려 있는 곳이다. 한편 ‘홍치지에’는 쇼핑하기 좋은 상가들이 여럿 몰려있기 때문에 중국 현지인들이 많이 찾는 곳이다.","한 학기 파견의 경우 대부분 학교에서 제공하는 기숙사인 우의회관에서 거주하게 된다. 우의회관은 사람마다 평이 엇갈리지만, 확실한 것은 북경의 왠만한 대학교들의 낙후된 기숙사를 고려할 때 정말 나쁘지 않은 시설이라고 생각된다. 작성자와 또 함께 파견된 연대학생은 미리 독방을 예약해서 썼는데, 다른 학생들의 경우를 보니 독방은 기숙사측에서 잘 내어주지 않는 분위기이다. 독방의 경우 교환학생 20%할인을 적용받아 1일에 25원 가량 했던 것으로 기억된다. 기숙사에서의 생활은 전반적으로 편리하다. 매 층마다 뜨거운 식수을 공급해주는 열탕기가 있고, 관리원들이 층 당 1-2명씩 있어서 사소한 문제를 해결해 준다. 독서실 또한 작은 규모로 매층에 있고, 자리는 항상 있는 편이다. 온수는 시간을 정해서 하루에 2-3시간정도 공급되는데 오전에 1시간, 오후에 2시간으로, 시간은 잘 기억나지 않는다. (오후 8시-10시였던듯) 단, 주의할 것은 꼭대기층인 12층은 수압이 낮아 샤워하기가 매우 불편하다. 가급적 저층을 이용하는 것이 좋다. 

1년정도의 장기간 파견일 경우 외부거주도 고려할만 하다. 본인의 경우 1학기 파견임에도 불구하고 파견된 지 2달정도 되는 시점에 외부 아파트에 들어갔다. 집을 찾고 계약을 하고 하는 과정도 매우 좋은 중국체험이었다. 우의회관 주변에는 몇 개의 아파트 단지가 있는데, 그 중 ‘양광청’단지가 가장 새로 지었고, 시설이나 교통이 편리하다. 본인은 친구 두 명과 함께 꽤 넓은 집을 월세로 빌려 살았는데, 1인당 한 달에 700원정도였다. 외부 거주의 경우 무엇보다 자유로운 생활과 자유로운 주방 이용(본인은 별로 요리를 하지 않았지만..)등이 좋은 점이고, 중국 생활에 좀 더 가까워진 듯 한 느낌도 받을 수 있다. (전기비등도 모두 직접 내기에) 

식사는 앞서 언급한 식당들을 이용하면 되고, 본인 의지에 따라 우의회관의 주방이나 외부 거주장소의 주방을 이용해 식사를 해도 된다. 우의회관의 경우 본인이 직접 조리기구를 준비하는 것이 위생에 좋을 것 같다.","교환학생으로 파견되면 학교에서 권장하는 수업은 대외한어반, 즉 유학생 중심의 어학반이다. 어학반 수업은 초급, 중급, 고급반으로 나뉘며, 각 단계에서도 2-3개의 소분류가 있다. 그 외에 우의회관에 소속되어 있는 한어 전공의 본과반도 있다. 이 한어 전공 본과반은 대부분 한국 장기 유학생들이다. 수업 열의나 태도는 아무래도 먼저 언급한 대외한어반이 훨씬 낫다는 평을 대부분 한다. 대외한어반에 소속된 경우, 본교의 본과수업을 듣기가 꽤 힘든 데, 중국의 대학교들은 단과대학이 넘어가면 남의 학교와 같이 여러 허가절차등이 필요하기 때문이다. 하지만 결과적으로는 들을 수 있으니 반드시 포기하지 말고 끈질기게 물어늘어질 필요가 있다. (중국학생들이 연대로 파견되서 자유롭게 수업을 듣는 점을 강조하자). 다만 본교의 본과수업들은 대부분의 경우 대형강의라 수업질이 떨어진다는 단점이 있다. 회화를 중시한다면 대외한어반 수업을 주로 들어보는 것이 좋을 것이고 중국학생들과 좀 더 가까이 지내고 싶다면 본과 수업을 듣는 것도 괜찮을 것이다. 본과는 개강 일자와 대부분의 학사과정이 대외한어반과 다르기 때문에 본과 수업을 들을 학생들은 미리 길림대에 확인을 해볼 필요가 있다. 또한 길림대에 도착해서도 수업에 대한 내용을 미리 유학생 사무실의 선생님들과 상의를 해야한다. 

학교 중앙 도서관은 지은 지 얼마 안되어 최신식의 시설을 자랑한다. 그러나 외국학생들이 도서관 출입증을 만들려면 우리돈으로 보증금 6만원 남짓을 도서관 측에 지불해야만 한다. 글쓴이는 우의회관이나 거주지의 책상들을 이용하고 도서관을 이용하지 않아 자세한 내용을 쓰기는 힘들다. 한편 방학중에는 도서관 개방을 하지 않는 것으로 알고 있다. 

HSK경우 시험 전 한 달 전부터 학교측에서 유학생들을 상대로 무료 강의를 해준다. 나름대로 열의가 있으니 참여하는 것도 나쁘지 않다. 시내나 우의회관 주변에 있는 사설 학원에 다니는 학생들도 있었는데, 자세한 사항은 모르겠다.","우선 우의회관 1층에 자리잡은 유학생 사무실에는 조선족 선생님 두 분이 계시다. 그러나 이 쪽 분들은 주로 유학생 수속과 관련된 업무를 처리하시기 때문에 교환학생과 관련된 업무는 2층 국제교류부사무실의 ‘장지아오’ 선생님과 상담하는 것이 좋다. (나름 전도연을 닮은 분을 찾으면 된다;;) 이 분은 영어도 잘 하실 뿐만 아니라, 자기 업무가 아닌 부분에도 교환학생이 부탁하면 열의를 가지고 도와주신다. 나의 경우 초반에 본교 본과 과목을 신청할 때 이 분의 도움으로 비교적 쉽게 신청할 수 있었다. 대부분 사무실 분들은 매우 친절하기 때문에 어려움이 있을 때는 바로 찾아가서 상담을 해보는 것이 좋다. 단 1층 사무실의 여권/비자 담당 여 선생님은 피하는 게 좋다. 정말 답답한 관료주의적 교직원의 본보기이고, 오히려 혼란만을 주기 때문에, 비자문제의 경우 본인이 직접 공안국에 가서 해결하는 편이 좋다. (단 1년 교류생의 초기 비자 수속은 단체로 하기 때문에 그냥 사무실에서 하면 된다)","학교안으로 들어가면 목욕탕에서 은행까지 각종 시설들이 즐비하다. 이용하기에 따라서 매우 편리하고 도움이 될 수 있다. 중국학생들은 운동을 좋아하기 때문에 운동에 관련된 시설들이 전반적으로 잘 되어 있지만, 우의회관 지하에 있는 헬스장은 열악하다. 캠퍼스 안에 있는 대운동장은 늦은 저녁에 가도 가벼운 운동을 하는 학생들로 붐빈다. 우의회관 1층에는 복사등의 업무를 처리하는 가게가 있고, 인터넷을 쓸 수 있는 컴퓨터실이 있다.(시간당 1원) 다만 MSN등 안되는 서비스가 몇 개 있기 때문에 회관 주변에 있는 왕바를 이용하는 것이 더 나을 수 있다. (시간당 2원) 

동아리의 경우 나는 3월 파견이었는데, 중국 학기는 9월에 시작해서 동아리 모집을 하지 않았다. 듣기로는 9월 개강후 캠퍼스 곳곳에서 동아리 모집을 한다고 하니 본인이 직접 알아보는 것이다 좋을 것이다..","문화차이측면에 있어서 중국은 우리나라와 가까우면서도 먼 나라이다. 유교적인 영향이 분명히 느껴짐에도 불구하고 오랜 공산화문화는 오히려 우리보다 훨씬 서구적인 사고방식을 그들에게 남겨준 것 같다. 문화차이라는 것은 분명히 느낄 수 있다. 하지만 정작 문제가 되는 것은 많은 수의 한국인들이 중국에 입국할 때부터 편견과 우월의식에 사로잡혀 살아간다는 것이다. 한 학기동안 중국에서 생활하며 그런 부류의 한국인들을 너무 많이 보아왔고 가장 부끄러운 부분이기도 하다. 단언컨데, 그런 태도로는 중국사람들을 사귈 수도 없고, 개인의 안목이나 중국어 향상도 꿈꿀 수 없다. 중국 사람들도 그러한 한국사람의 태도를 잘 알고 있으며, 때문에 그런 부류의 한국인을 대할 때 트러블이 생기기 마련이다. 본인의 경우 다른 것은 몰라도, 존중하는 마음과 배워보려는 마음으로 중국인을 대했고 그 결과 아주 오래남을만한 깊은 친구들을 사귈 수 있었다. 본인의 일을 더 먼저 걱정해주고 더 먼저 배려주려는 그들의 태도를 볼 때, 결국 문화충격도 개인의 태도에 달렸구나라는 생각을 헀다. 한비야씨의 ‘중국견문록’에도 언급되는 내용이 있다. “…….이렇게 무서운 힘과 저력을 가지고 있는 중국이다. 자, 아직도 당신은 중국의 화장실에 문이 없는 것이 궁금한가?’” 결론적으로 열린 마음을 가진 대학생이라면 극복하지 못할 문화차이는 많지 않다. 다만, 동양적사고와 서양적사고의 어딘가에서 줄타기를 하고 있는 중국인의 의식세계를 완전히 이해하기는 힘든 것 같다. 그리고 대중이 몰렸을 때의 질서문제는 한번쯤 혀를 내두르게 될 것이다.","일단 유학생이 많기 때문에 도움을 구할 만한 곳은 적지 않다. 유학생회가 있는데, 본인의 경우 가입하지 않아서 자세한 사항은 모르겠다. 연대 학생의 경우 고대 학생들과 좋은 관계를 유지하며 도움을 받는 것도 나쁘지 않다. 고대의 경우 이미 오랜기간 파견이 이루어져 있기 때문에 나름대로의 정보 네트워크가 형성되어 있는 것 같다. 천주교나 기독교의 경우 한인 공동체가 존재하기 때문에 그 곳에서 도움을 받는 것도 좋다. 천주교의 경우 시내와 가까운 곳에 성당이 있다. 그리고 주변에 있는 조선족분들도 도움을 주실 때가 있다.","중문과도 아닌 행정학도로써 중국으로의 교환학생을 택한 것은 사실 여러가지 고민이 많았다. 하지만, 교환학기를 끝내고 장춘공항을 빠져나올 때, 내 선택이 틀리지 않았다는 확신을 할 수 있었다. 중국어를 특히 잘하지 못했던 내가, 장춘공항의 출국관리관에게 ‘중국어 정말 잘한다’라는 말을 들으며 교환학기를 끝낸 것도 큰 보람이다. (물론 실제 실력과는 관계 없이..) 사실 장춘은 그 어느 곳보다도 언어환경이 좋다. 길거리에서 수박을 파는 아줌마도 깨끗한 표준어를 구사하는 곳은 중국 전역에서 정말 손을 꼽을 것이다. 길림대학 또한 저 멀리 사천성과 운남성에서도 그 이름을 알 정도로 괜찮은 중점대학이다. 우수한 학생들이 많다는 이야기이다. 더군다나 마음을 열고 다가갈 경우 정말 순수하고 순진한 사람들을 많이 만날 수 있는 곳도 장춘이다. 그러나 중요한 것은 무엇보다 나 스스로에게 달렸다는 것을 잊으면 안된다. 여느 다른 중국 도시처럼 자칫 한국어만 쓰고 한국사람만 만나고 한국음식만 먹다 오는 것도 가능하기 때문이다. 모든 것은 자신에게 달렸다는 것을 다시 한 번 깨달아야 한다. 

마지막으로, 이후 중국에 파견될 후배들에게 당부하고 싶은 것은, 기회가 되는 대로 여행을 많이 가라는 것이다. 본인은 틈틈히 시간을 내서 동북 지역의 많은 곳을 다녔고, 방학때는 1달이 넘게 남서부를 여행했다. 교실안에서, 동네에서 만나는 중국이외에 피부로 와닿는 여러 경험을 할 수 있을 것이다. 

중국은 누가 뭐라고 해도 정말 무한한 가능성을 가진 나라이다. 중국을 알고, 중국사람을 아는 것은 글로벌 시대를 살아갈 우리에게 적지않은 재산이 될 것이다. 연세대학교의 교풍답게 가슴을 열고, 적극적인 태도를 가질 수 있다면, 길림대학의 교환학생 경험은 분명 큰 도움이 될 것이다"
