gen_info,env_info,food_info,study_info,office_info,facil_info,mhct_info,help_info,etc_info
"홍콩은 크게 3개의 지역으로 나뉩니다. 홍콩섬, 구룡반도, 신계(New Territory) 중 CityU는 구룡반도 한 가운데 Kowloong Tong에 위치해있습니다. 대부분 유명 관광지는 홍콩섬과 구룡반도 남쪽 끝에 있지만 교환기간에는 다양한 경험을 할 수 있기 때문에 CityU에서 어느 곳이든 1시간내로 다닐 수 있습니다.학교는 5개의 건물로 나눌 수 있습니다. AC1, 2, 3, CMC, 체육관이 있습니다. 이 중 CMC만 기숙사 뒷편에 떨어져 있고 나머지 건물들은 매우 가깝게 붙어있습니다. 영문과, 컴퓨터과학과, Creative Media Art 등 몇몇 과를 제외하고는 전부 AC1, AC2, AC3에서 수업이 진행됩니다. 건물간 연결이 되어있고 건물내에 엘레베이터, 에스컬레이터들이 잘 되어있지만 학생들이 많아 학기중에 사용하기 조금 버겁습니다.저는 1월부터 5월 말까지 이었습니다. 1월부터 4월 초까지는 날씨가 가을날씨로 매우좋습니다. 늘 영상 10~15도 정도이면 가볍게 위에 긴팔을 입고 다니시면 됩니다. 다만 바람이 많이 부는 바닷가 근처는 좀 더 두꺼운 옷을 입고 나가시면 좋습니다. 3월 말부터 가끔 썬더스톰이 옵니다. 그 강도와 시간에 따라 수업이 취소된다고도 하는데 제가 있을때에는 저녁에만 폭풍우가 와서 한번도 취소된 적은 없었습니다. 다만 바람이 엄청 강하고 비도 장대처럼 와서 홍콩에서 산 우산들이 견디지를 못 하고 휘거나 부러집니다. 평소에 오는 비는 안개비보다 강도가 좀 더 강할뿐 보통 1시간 이내로 그칩니다. 4월 말부터는 날씨가 더워지고 습도도 올라갑니다. 에어컨없이는 버티기 힘듭니다. 그리고 학기말과 시험기간에는 학교에 학생수가 적다보니 교내 건물에서도 에어컨을 잘 안 틀어주는 것도 하나의 특징입니다.","CityU의 주변 환경이 다른 홍콩내의 대학보다 월등하게 좋습니다. 교통편은 학교와 바로 연결되어 있는 MTR(지하철이라 생각하시면 됩니다.)과 공항에서 바로 학교 기숙사 앞으로 오는 버스(40분)가 있습니다. (과기대 같은 경우 MTR역에서 내려서 버스를 두번 갈아타야 되는 매우 불편한 곳에 위치해있습니다.) 또한 동네 주변이 부촌이여서 학교 앞 쇼핑몰(Festival Walk)에 유니클로, H&M, I.T. 편집숍, Giga Sports, 고다이바, 스타벅스 등등 각종 브랜드와 Taste라는 마트가 바로 붙어있습니다. 몇몇 브랜드는 학생증만 보여주면 추가 할인이나 사이즈업이 됩니다. 또한 쇼핑몰 윗층에 푸드코트가 있어서 학교식당이 질리시면 멀리 가실 필요가 없습니다. AC1 제일 밑으로 가시면 NamSan Estate 또는 남산춘이라고 불리는 지역이 있습니다. 이 곳은 정부임대 아파트가 들어서 있어서 학교 앞과 달리 물가가 훨씬 저렴합니다. 품질이 조금 떨어지지만 과일과 채소가 훨씬 쌉니다. 시장이 조금 불안 하시면 Welcome Mart라는 SSM 같은 곳에서 사셔도 됩니다. 또한 759라는 체인 가계가 있는데 이곳에서 5뚜기 햇반도 싸게 팝니다.탕수육이 그리우신 분들은 남산춘 위의 식당에서 Sweet sour pork 드시면 됩니다. 가격은 조금 나가지만 맛도 좋고 양도 적당히 나옵니다.남산춘에서 조금 더 걸어가시면 Sham Shui Po라는 남대문 시장 같은 곳이 나옵니다. 이곳은 용산 같기도 하면서 온갖잡화를 파는 곳입니다. 처음 도착하면 Ikea에서 침구류를 사러 가는 프로그램이 있지만 이불 배게만 대략 $500 정도가 필요합니다. 조금더 싸게 사실분은 Sham Shui PO로 가시면 됩니다. Ikea는 학교에서 하늘색 선으로 두정거장 떨어진 Sha Tin역에 있습니다.홍콩은 군대군대 공원이 많습니다. 기숙사 바로 앞의 공원에도 테니스장, 농구장, 축구장이 다 있습니다.CMC쪽으로 쭉 가시면 둘레가 700M가 되는 큰 공원이 하나 더 있습니다. 달리기 좋아하시는 분은 큰 공원 추천드립니다.","저는 2인 1실의 기숙사에서 지냈습니다. Hall 10과 Hall 11이 2012년도에 지어져서 가장 최신 건물이고 방마다 선풍기가 있습니다. 화장실과 샤워장은 두개의 방이 하나를 나눠쓰는 형식입니다. 반대편 방의 친구들을 toilet mate라고 부릅니다. 룸메이트는 홍콩사람이거나 다른 나라에서 온 친구일 수 있습니다. 방은 무악 학사와 비슷하게 생겼습니다. 특이했던 점은 스탠드 대신 형광등이 각 책상마다 별도로 달려있어서 굳이 스탠드를 사실 필요가 없고(이전 낡은 건물에는 없을 수도 있습니다.) 화이트보드가 있어서 필요한 메모를 편히 할 수 있습니다.(보드 마카도 처음 도착한 날 하나씩 받습니다.) 각 층마다 Common Room이라는 큰 방이 있습니다. 이 곳에는 큰 냉장고가 2대가 있어 층의 모든인원의 음식을 수용할 수 있습니다. 다만 음식을 훔쳐가는 경우가 종종 있으니 주의하시기 바랍니다. 조리시설도 잘 되어있습니다. 가끔 설거지를 안하는 floor mate가 있을 수 있으니 홍콩에서 식기를 사시면 편합니다. 가스 대신 전열기구로 조리하다보니 냄비를 사실때 꼭 전류가 통하는지 확인 하시고 사셔야 됩니다. 홍콩음식은 채소가 거의 없다고 보시면 됩니다. 따로 채소 삶은걸 주문하시면 되지만 이 곳에서 먹는 채소의 종류는 그렇게 많지 않습니다. 다행히 학교 앞 Taste에서 국내산 김치를 팔고 있습니다. 또한 음식과 차를 항상 마시는데 대부분의 음식점들이 차값을 따로 받습니다. 적게는 $3부터 많게는 주전자당 $30를 받기도 합니다. 음식은 다행히 저와 잘 맞았습니다. 하지만 종종 쟈스민쌀(태국쌀)이 입에 안 맞는 학생들도 있는데, 그런 분들은 위의 759에 가셔서 오뚜기 햇반을 드시거나 빵 드시길 권합니다.한국 음식이 그리우신 분들은 침사추이의 한인마트 두세군데 둘러보시면 됩니다.특이한 점은 교내에서 흡연은 금지이고, 버스 및 MTR(지하철)에서 음료 및 음식 취식이 금지입니다. 홍콩 일부 거리가 금연구역이기 때문에 담배 피우시는 분들은 주의하시기 바랍니다. 담배 또한 가격이 국내보다 비싸서(7천원 이상) 한국처럼 편히 피기 힘드십니다.","도서관은 AC1 3층에 위치해있습니다. 우리학교 처럼 열람실 구역이 넓지는 않습니다. 하지만 건물 곳곳에 자습이 가능하도록 책걸상이 많이 놓여있어 공부하시는 곳을 찾기에 어렵지 않으실 겁니다. 개인적으로 날 좋은날 공부를 해야 되면 CMC 9층의 옥상에서 했습니다. 참고로 CMC 내의 Pacific Coffee는 학생할인 되어 좋은 커피를 밖에서보다 싸게 마실 수 있습니다. 하지만 도서관이 아닌 곳은 자유롭게 떠들수 있다보니 때에 따라 시끄러울 수도 있습니다.수업은 국내와 똑같습니다. 스크린에 PPT를 띄워주고 그에 관해 교수님의 영어로 설명해주십니다. 교수님에 따라 영어 발음이 천지차이이긴 하지만 PPT와 같이 보시면 크게 어렵지 않게 들을 수 있습니다. 저는 공대 전공을 3개를 들었습니다. 수업에 따라 실험이 포함되어 있습니다. 다행히 매주 실험이 있는게 아니고 학기중에 5~6번 정도만 실험을 나가면 됩니다. 즉 우리 학교 처럼 실험과목이 따로 있는게 아니고 수업과 실험, 실습이 하나로 묶여 있습니다. 수강인원이 많은 수업은 실험반도 여러반이 있으니 시간표 짜실 때 편하게 짜실 수 있습니다. 또 다른 특이한 점은 수업 시간이 아침부터 저녁까지 다양하게 분포해있습니다. 제가 들은 전공들은 주로 저녁 7시에 시작하여 10시에 끝났습니다. 덕분에 낮에 여러곳을 여행 다니기도 했습니다.",CityU의 국제처는 MEAO라고 불립니다. 위치가 찾아가기 힘들어서 대부분 이메일로 질문하고 답변을 받았습니다.한국에서 잘 준비해 가시면 찾아갈 일이 크게 없습니다.,"바베큐장과 스포츠 시설이 잘 되어 있습니다.모두 예약만 하면 무료 또는 $5이내의 요금만 내시고 사용이 가능합니다.탁구대가 기숙사에 있는건 무료이지만 체육관에 있는건 돈을 내셔야 됩니다.헬스장도 사용이 가능한데, 1달 단위로 결재하는 우리나라와 달리 한번 가실때마다 $3 정도 내시면 됩니다.또한 가실때 마다 도장을 찍어서 도장 갯수에 따라 상품도 무료로 줍니다.바베큐장은 예약하고 시간에 맞추어 챠콜과 불지필것과 음식을 사가지고 가시면 됩니다. 홍콩 사람들은 주로 꼬챙이에 음식을 꽂아 굽지만 한국식으로 불판을 만드셔서 구으셔도 됩니다.프린트는 1년에 1600장이 무료로 제공됩니다.단 프린트 시설이 넉넉하지 않아서 사람이 몰리는 오후 시간대에는 30분 정도 기다리셔야 됩니다.저는 제 노트북에 네트워크로 연결하여 미리 출력 명령을 시켜놓고 프린트 기기 줄만 기다렸습니다.홀 10이나 홀 11분은 바로 옆 CMC 4층에 가셔서 뽑으셔도 됩니다. 그 곳은 상대적으로 줄이 짧습니다.","건물 층수 표시가 유럽식이라 우리나라와 다릅니다. G가 1층, LG1이 지하1층, UG가 2층 등등 다릅니다. 또한 건물마다도 방식이 다르기에 익숙해지기 전까지 조금 불편하실 수 있습니다.서비스업이 한국보다 덜 발달하여 음식점에서 가끔 젓가락을 꺼내서 던지시는 종업원들이 있습니다. 당황하지 마시고 주문하시고 음식 드시면 됩니다.(특히 학교 내 딤섬매장)",저는 주로 버디에게 도움을 받았습니다. 우리학교의 언어교환이라 생각하시면 됩니다. 또한 기숙사 층마다 RA같은 학생이 있습니다. 부담없이 물어보시면 친절하게 도와줍니다.,"도착하시면 짐 간단히 푸시고, 학생증 만드시고, 학생용 교통카드 신청하시면 정착에 필요한 기본은 다 되신겁니다.학생용 교통카드는 MTR을 절반 가격에 타실 수 있기 때문에 일반카드보다 훨씬 좋습니다.OT 프로그램들은 꼭 참석하실 필요가 없으시지만, 캠퍼스 투어는 추천 드립니다.기타 궁금하신 사항은 아래 메일주소로 연락주세요.neopjs89@gmail.com"
Next to festival walk in kowloon tong,"really nice area, lots of greenery and tables which you can study at (outdoor!)",dim sum is amazing! hong kong is a great place to meet people from all over the world!,"library is small, but cozy. Classes were very interesting and the professors were always glad to help us, and open to lots of questions","the international office is very helpful, always go there for help whenever you need. not very helpful with housing unfortunately","always join the city u facebook group! they have many activities such as hiking, dinners, boat parties put up there. be sure to attend!",Houses are so small!,,
위치한 곳은 구룡반도 위쪽에 위치하고 있습니다. 번화가인 침사추이와 central역에서는 조금 멀어보이지만 홍콩이 기본적으로 크지 않다는 점 그리고 학교가 역에 바로 붙어있다는 점을 고려하면 이곳저곳 돌아다닌데 있어서는 큰 무리가 없습니다. 제가 다녀온 겨울 봄 기간동안 기후는 서울에 비해서 매우 따듯하고 좋았습니다. 다만 여름 초입부터는 매우 습해지고 더워집니다.,홍콩시립대 바로 옆에는 큰 쇼핑몰이 있습니다. 홍콩 내 다른 쇼핑몰들에 비하면 상대적으로 저렴하지는 않지만 그만큼 깨끗합니다. 그 외 시설로는 공원과 시장정도가 있습니다. 다시 말해 생활하는데는 전혀 무리는 없지만 심심할 수 있습니다. 하지만 위에서 말했듯이 교통이 좋아 어디든 나가기 쉽습니다.,"기본적으로 기숙사에 살았으며 저는 1인실에 있었습니다. 1인실 2인실은 기본적으로 2방이 같이 화장실을 공유합니다. 즉, 3명 혹은 4명이 하나의 화장실을 씁니다. 기숙사는 약 10개정도가 있는데 나중에 지어진 기숙사일수록 시설이 좋습니다. 주로 식사는 공용 부엌에서 해먹거나 학관에서 사먹었습니다. 종종 주변에 있는 시장과 쇼핑몰에 가서 먹기도 했습니다.","수업은 기본적으로 쉽습니다. 제가 들었던 수업들에 한해서는요 (경영과목 및 중국어 수업. 제가 주로 마케팅이나 전략쪽을 들어서 회계,금융 및 그 외 부분은 어떠한지 모르겠습니다)
도서관은 크지 않습니다. 하지만 공부하기에는 전혀 무리가 없습니다.",친절합니다. 기본적으로 중요한 학사관리는 교환학생 담당자분을 중심으로 지원이 이루어지며 그 외 소소한 사항에 대해서는 홍콩시립대 학생들이 도와줍니다. 오리엔테이션 때 연락처를 주고 받아 궁금한 사항이 있으면 연락하면 됩니다.,"학교 시설은 좋았습니다. 수업이 이루어지는 건물은 총 3개인데 최신식 건물부터 가장 오래된 건물까지 수업하는데 있어서는 전혀 문제가 없었습니다. 쾌적했습니다. 그외 기타 시설로는 수영자, GYM, 바베큐공간 등이 있는데 매우 저렴한 가격에 모두 이용할 수 있었습니다.",없었습니다. 하나 굳이 뽑자면 홍콩사람들은 자신들이 중국 본토 사람들과 하나로 묶여서 여겨지는 것을 싫어합니다.,기본적으로 학교내에서 모든 지원이 이루어지기 때문에(학사지원 및 의료 등) 생활하는데 크게 외부의 도움은 필요 없었습니다.,
학교 크기 자체는 작습니다. 예쁜 캠퍼스는 아니지만 있을 것만 있어서 이동하기 참 편한 장점이 있구요. 홍콩 지하철 중간에 있어서 침사추이나 센트럴 같은 중심가도 30분만에 갈 수 있습니다. 저는 1월에 출국했는데 겨울이지만 영상의 날싸라 따뜻합니다. 그런데 따뜻한 나라이다보니 난방에 대한 개념이 없어서 기숙사가 겨울애 참 춥습니다. 전기장판은 꼭 가져가셨음합니다. 여름은 무척 습하고 덥습니다.,"대학 주변이지만 번화가는 아닙니다.  홍콩의 대학생들은 음주를 즐기지 않
는 지 주위에 유흥가가 없어서 참 깨끗하고 주변에 고급맨션이 있어서 치안도 매우 좋습니ㅣ다.
특이하게도 학교에 페스티벌 워크라는 대형 복합 쇼핑몰이 있어서 거의 모든 것을 해결할 수 있습니다.
타임 스퀘어처럼 영화도보고 푸드코트도 있고 명품매장도 있고 spa매장도 있고 
지하에 대형슈퍼마켓도 있어서 생활하기에 굉장히 편리합니다.","거의 기숙사에서 생활하고 기숙사는 크고 2인실입니다. 화장실은 4명이서 함께 쓰고
청소해 주시는 분이 있어서 항상 깨끗한 화장실을 쓸 수 있습니다. 홍콩 집값이 굉장히 비싼데
거의 기숙사 배정을 해주기 때문에 집값 걱정이 없습니다. 기숙사비도 매우 
저렴했던 것으로 기억합니다.기숙사 식당은 호미 키친인대 저와 친구들은 여기 음삭을 너무 좋아했어요
맨날 여기서 열두시까지 수다떨고 잔디밭에서 맥주마시고 참 즐거웠습니다.
기숙사식당 밥값은 3천원대 였던걸로 기억하구요. 침사추이나 몽콕 센트럴 가면 먹을 것
천지예요. 처음에 홍콩음식을 못먹다가 나중에는 맛집탐방 먹방 찍으러 다녔습니다.
신촌에도 있눈 공차가 2천원 밖애 안하니 많이많이 드세요. 이밖에 딤섬 완탕면 등등
참 많이 먹었는데 친구들이 먹으러 홍콩 갓갔냐며","수업은 기본적으로 영어로 진행되고 공용어인 광동어를 쓸 일은 별로 없습니다.
홍콩 친구들도 영어를 잘 하니 의사소통에 문제가 없구요. 도서관도 깔끔하고
시설이 참 좋았습니다.",버디도 신청할 수 있고 생활 전반에 문제가 발생했을 때 매우 친절합니다.,"저는 한 학기 교환학생을 갔기 때문이 동아리나 이런 건 가입하지 않았고
씨티유에 교환학생을 간 한국친구들과 거기서 유학하는 한국친구들이랑
많이 친해져서 같이 엠티도 가고 아직까지 연락할 만큼 좋은 인연을 많이
만들었습니다. 그런데 본인이 원하면 동아리나 여러 활동을 활발하게 할 수 
있습니다.","쇼핑을 위한 나라같았습니다. 어딜 가든 까르띠에 같은 명품매장이 즐비해 있어서 과연 이게
다 팔릴까하는 의구심이 들었습니다. 그리고 참 차를 많이 마셔서 음식이 기름진데도 사람들이 다 날씬하고
건강했습니다. 홍콩 친구들 중에 한류에 관심있는 친구들이 많아서 한국인이라능 이유만으로도 
너무 친절하게 대해 주어서 참 고맙고 신기했고 한국 남자들은 다 현빈같이 생겼냐고 물어보기도
했습니다.","저는 제 룸메이트에게 도움을 많이 받았습니다. 룸메이트가 여러 궁금증 힘든 것등에 대해
많이 도와줘서 참 고마웠습니다.","홍콩으로의 교환학생 잊지 못할 추억으로 남았습니다. 
잊지못할 사람들도 많이 만나고.. 최고의 경험이었습니다."
"CityU는 홍콩 내 구룡반대의 까우롱통이라는 곳에 위치하고 있습니다.
처음 도착했을 때는 숨막힐 정도의 높은 습도에 날씨때문에 애를 많이 먹었지만, 점차 적응되고 11-12월 경에 이르면 활동하기 딱 좋은 날씨가 됩니다. 
교환대학의 크기 홍콩 내 대학 중에서도 제일 작을 정도로 정말 작은 편이나 쇼핑몰, 지하철 역과 연결이 되어있어 교통편이 매우 편리하다는 장점이 있습니다.","주변환경은 지하철역, 쇼핑몰이라는 시설 빼고는 대부분이 주택가입니다. 홍콩내에서도 손꼽히는 고급 주택지역으로 씨티유 기숙사에서 내려다보는 전망이 정말 멋있습니다. 주변에 baptist university라는 또 하나의 대학도 있으며 홍콩은 치안이 매우 좋은 편이라 시간이 될 때 산책하는 것도 주변환경을 익히는데 좋은 방법입니다.","교환학생들은 학교에서 오르막길로 약 5분가량 떨어진 기숙사에서 생활하게 됩니다. 기숙사는 9개의 건물이 있고, 특별한 사유가 없는 이상 2인실이나 3인실에서 주로 생활하게 됩니다. 시설은 대체적으로 깔끔한 편입니다. 각 층마다 kitchen이 있어 가끔 라면이나 햇반 등의 한국 음식이 먹고 싶다면 요리해 먹을 수 있습니다. 그 밖에 기숙사 식당과 교내 식당이 있는데 두 군데 다 맛은 나쁘지 않았던 것 같습니다. 또한, 학교에서 연결된 쇼핑몰에 푸드코드에 가면 한식을 포함한 여러가지 메뉴를 고를 수 있어 먹을 걱정은 크게 없이 지냈습니다.","수업은 대체적으로 연세대에 비해 크게 어려운 것은 없습니다.
홍콩 학생들의 영어 수준도 생각했던 것보다 높지 않은 것으로 느꼈고, 교환학생을 나가는 학생들 정도의 영어실력이면 충분히 수업을 잘 따라갈 수 있을 것이라 생각됩니다.
하지만, 경영학과의 경우 출석 3번만 빠져도 Fail이라는 엄격한 규칙이 있으니 출석관리에 신경쓰시기 바랍니다. 

연세대와 마찬가지로 경영학과 수업에는 조모임이 많습니다. 조모임은 로컬 친구들을 사귀어 홍콩 구석구석을 체험해볼 수 있는 좋은 기회이므로 적극적으로 참여하는 것이 좋습니다. 한국과 마찬가지로 수강 변경기간이 있으므로, 첫 주에 수업을 들어가보시고 다른 수업들로 변경하는 것도 대부분 가능한 것 같습니다. 

들었던 수업 중 기억나는 것에 적어보자면, 

HRM: 연세대 수업에 비해 평이했다고 느꼈으며, 조별 과제도 부담되는 것은 없었습니다. 기업을 하나 정하여 조원끼리 회사에 방문하여 인사과 직원과 인터뷰를 직행하여 리포트를 작성하였는데 홍콩의 로컬 회사를 방문하고 느껴볼 수 있는 좋은 기회입니다.

Consumer Behavior(소비자 행동론): 역시 수업내용이나 방식은 평이한 수준이었고, 특별한 것은 없었습니다.","INSO라는 국제교육부에서 교환학생 관련 행사를 자주 개최하는데, 이메일이나 기숙사에 붙은 전단 등을 참고하면 정보를 찾을 수 있습니다. 이러한 행사들에 적극적으로 참여하면 교환학생과 로컬 학생들을 많이 사귈 수 있습니다.
기숙사나 다른 부분에 있어서 모르는 것이 있을 때 방문하면 친절하게 응대해주므로 문제가 있을 시에는 부담없이 방문해도 좋을 것 같습니다.","학교 앞에 공원이 있고 뒤로는 산책로가 있는데 한국과 분위기가 많이 다르고 저는 가끔 운동을 할 때 이용하였습니다. 

기숙사에서는 여러가지 Hall별, 층 별 크고 작은 행사가 열리는데 층 별 행사같은 경우는 모르고 있어도 층에 행사를 담당하는 학생이 와서 알려주므로 가능하시면 놓치기 마시고 참여하시기 바랍니다.","몽콕에 가면 특유의 냄새를 힘들어하는 한국 학생들을 많이 보았습니다.
하지만, 한국인 입맛에 맞는 음식도 찾아보면 많기 때문에 다양한 음식을 시도해보실 것을 추천합니다.

홍콩은 또한 외국인이 엄청 많고 서양문화에 대한 동경 같은 것이 존재하기 때문에 학교 내에서도 서양인들이 소란을 많이 피우는 편입니다. 

홍콩 여성들은 서양 남자들에게 정말 놀라울 정도로 개방적이고, 서양 친구들은 홍콩에서 아시아 문화를 즐기고 가고 싶어하기 때문에 자신이 중심이 못잡는다면 일탈의 유혹도 많을 것입니다. 특히, 여학생의 경우 이러한 부분을 염두에 두셨으면 좋겠습니다.","재홍콩 연세 동문회에서 연락을 주시는데, 참가하면 홍콩에서 오랫동안 살거나 일하고 계신 선배들을 많이 만날 수 있습니다.
홍콩에서 일하는 것에 관심이 있거나 하시는 분들은 정말 좋은 정보를 많이 얻을 수 있습니다. 선배님들이 밥도 잘 사주시구요~","저는 홍콩에 있는 동안 가까운 마카오나 중국 심천이외에는 방문해보지 못했는데, 자신이 부지런하게 움직인다면 여행을 다니기 정말 좋습니다.
홍콩 구석구석 많이 보시고 여행도 많이 다니시고 많이 느끼고 오는 것이 좋은 경험이 될 것입니다. 
홍콩이란 곳이 워낙 작기때문에 1-2개월 지나면 답답함을 호소하는 친구들도 많았습니다. 날씨와 문화에 잘 적응하고 이것저것 바쁘게 생활하신다면 좋은 교환학생 생활 경험하실 수 있을 것입니다.

여기에 다 쓰지 못한 이야기들도 엄청 많은데, 궁금한 점이 있으시면 이메일로 물어보셔도 좋습니다.
junyounc@naver.com"
