gen_info,env_info,food_info,study_info,office_info,facil_info,mhct_info,help_info,etc_info
"길림대학교는 중국 길림성 장춘시에 위치하고 있습니다. 중국 동북 지역인만큼 겨울에는 매우 춥긴 하지만, 난방 시설이 잘 되어있고 4월 중순~말이면 우리나라 봄과 비슷해지기 때문에 봄 학기에 가시는 분이라면 추위에 크게 걱정하실 필요는 없다고 봅니다. 다만 6월 초중순부터 갑자기 무더워지는데 냉방 시설은 잘 되어있지 않아서 더위를 타는 저는 좀 힘들었습니다. 북방 지역이라 많이들 안 더울 것이라고 생각하지만 햇볕이 따갑고 우리나라보다 여름이 갑자기 옵니다. 더위를 타시는 분이라면 이를 고려하시는 게 좋을 것 같습니다.","기숙사 우의회관은 길림대 남교 북문 근처에 있습니다. 길림대 남교 캠퍼스는 넓고 예쁜 편입니다. 안에 편의 시설도 있고 산책하기 좋은 운동장과 호수들도 있습니다. 캠퍼스 주변에는 학생들이 많이 있기 때문에 식당, 카페, 마트 등이 있습니다. 조금만 걸어나가면 큰 월마트도 있기 때문에 생활 관련 물품을 사는 데 있어서 큰 어려움은 없습니다. 주변에 헬스장도 있는데 우리나라에 비해선 가격이 저렴하고 시설도 나쁘지 않은 편입니다. 저는 4개월 권을 끊어서 이용했는데 꾸준히 운동할 수 있어서 좋았습니다. 필요하다면 이용해도 좋을 것 같습니다. 버스나 택시를 타면 번화가인 꾸이린루로도 나갈 수 있지만, 규모가 크진 않으므로 큰 기대는 안하고 가는 것이 좋습니다.","우의회관은 유학생 전용 기숙사로 아래 층들은 호텔, 위 층들은 기숙사로 이용합니다. 그래서 방 형태는 2인실 호텔 형태입니다. (1인실도 있긴 하지만 대부분이 2인실에 배정된다고 알고 있습니다.) 방 안 구조는 싱글 침대 두개와 책상 두개 옷장 화장실로 되어있습니다. 호텔식이지만 낙후되어 있기 때문에 벽이나 화장실이 깔끔하지 못한 것은 감수해야 합니다. 요리는 공동 주방에서 할 수 있습니다. 저는 한 학기밖에 있지 않아서 굳이 직접 요리해 먹지는 않았습니다. 그렇지만 식재료가 싸기 때문에 식당 음식이 입에 맞지 않는 분은 직접 요리를 해서 먹어도 될 것 같습니다. 바깥 식당 음식들은 대체로 저렴한 편입니다. 다양한 식당들에 가서 중국 음식을 경험해봐도 좋을 것 같습니다.","저는 본과 수업을 수강하기에는 전공과 관련된 수업이 없고 조건이 맞지 않아서 어학 수업만 수강했습니다. 어학 수업이기 때문에 기숙사인 우의회관 1층에 있는 교실에서 들었습니다. 어학 수업은 기본적으로 독해,듣기,구어,쓰기 수업으로 이루어져 있고 초급1,2/중급1,2/고급1,2 반으로 나뉘어 있습니다. 첫주에 수업을 들어보고 자신의 수준에 맞는 반으로 골라서 들어가면 됩니다. 도서관은 캠퍼스 내부에 있는데 안에 자습 가능한 공간이 있습니다. 학생증을 발급 받은 후에는 책을 빌리는 것도 가능한 것으로 알고 있습니다.","우의회관 1,2층에 사무실이 있습니다. 등록 등 궁금한 점이 있다면 직접 가서 물어보면 됩니다. 한국말을 하시는 선생님도 계시니 너무 걱정하지 마세요.",중국은 9월에 학기가 시작하기 때문에 제가 갔던 봄 학기에는 특별히 동아리 가입을 하는 시기는 없었습니다. 그렇지만 관심이 있다면 길림대 학생들에게 물어봐서 동아리에서 활동할 수 있을 거라고 생각합니다.저는 길림대학교 한국어학과 학생과 교류하면서 큰 도움을 얻었습니다. 중국인 친구들과 교류하는 기회를 잘 활용하시길 바랍니다.,"신호를 지키지 않는 차들, 실내에서도 태연하게 담배를 피는 사람들, 큰 도로에서도 겁없이 무단횡단을 하는 사람들.. 이런 것들도 문화적 충격이라 할 수 있겠지만, 저에게 가장 충격이었던 점은 중국은 대륙인만큼 우리나라와 사고방식이 다르다는 것이었습니다. 사고의 틀이 더 대범하고 어찌보면 한국보다 더 자유롭다는 점이 흥미로웠습니다.","국제처에 문의해도 되고, 한국 유학생들에게 어느 정도 도움을 받는 것도 좋다고 생각합니다.","전공과 무관한 중국어를 공부하기 시작해서, 덜컥 교환학생까지 신청해서 중국 생활을 하고 왔습니다. 신청 전에도, 길림대로 출발 전에도 많은 걱정들이 있었습니다. 그렇지만 길림대에서 생활을 하면서, 여러 중국인들을 만나면서 즐기게 되었습니다. 중국은 가깝지만 저에겐 너무나도 모르는 미지의 세계나 다름없었는데 직접 와서 부딪히면서 조금이나마 중국이란 나라를 이해할 수 있었습니다. 아마 중국에 와서 직접 겪지 않았다면 깨닫지 못했을 것들을 많이 느낄 수 있었습니다. 한국의 생활에 갇혀 있던 저에게 길림대에서의 생활은 색다른 시야, 더 큰 시야를 갖게 해준 좋은 경험이었습니다."
"길림대학교는 중국 길림성 장춘에 위치하고 있고, 이전 장춘에 있던 여러 캠퍼스들이 길림대로 통합되면서 그 크기가 더 커졌습니다. 하지만 교환학생들이 주로 이용하는 캠퍼스는 吉大南校?이고 이곳중에서도 어학수업은 기숙사겸 강의실인 友???에서만 열리기 때문에 체감하는 캠퍼스 크기는 그리 크지 않을 겁니다. 본과수업 역시 바로 우의회관 앞쪽에 있는 남캠퍼스에서 들을 수 있는데, 연대 캠퍼스와 비교했을 때 비슷하거나 약간 더 큰 정도라 등하교시 어려움은 크게 없습니다. 다만 제가 간 2학기 교환학생에는 장춘의 겨울이 포함되어있어 기후적인 어려움은 있었습니다. 겨울 평균기온이 영하 20도 안팍으로 형성되는 지역인데다, 눈도 많이 내리고 바람도 세게 불어서 겨울학기에 길림대로 파견가시는 학생분들은 꼭 방한준비를 철저히 하시길 바랍니다. 보통 북방지역은 실외가 춥더라도 실내 난방이 잘 되어있어 추위를 견디기에 좋다고들 하지만, 낙후된 건물은 여전히 춥고, 장춘은 다른지역에 비해 그리 발전된 도시가 아니다보니 가끔 동파로 인해 물이 안나오는 경우도 있습니다. 하지만 이 역시도 지나보면 즐거운 추억이니 한번 경험해보시는 것도 나쁘지 않을 것 같습니다.","입주하시게 될 우의회관 근처에는 생활에 필요한 모든 것들이 있습니다. 식당은 물론 큰 마트와 헬스장도 있습니다. 저는 英派斯라는 이름의 헬스장에서 주로 운동을 했는데, 우의회관에서 걸어가도 5분내외이기때문에 공부와 다이어트를 계획하고 계신 학우분들이라면 엄청난 효과를 보실 수도 있습니다. (저는 평균 영하 20도안팍의 추의에 학교밖을 벗어나기 무서워서 주로 저녁이면 헬스장을 갔는 데, 4개월 꾸준히 운동하니 10키로가 빠졌습니다!) 헬스장 외에도 좀 더 나가면 월마트도 있고, 꾸이린루나 충칭루에는 비교적 번화한 상점가가 있습니다. 보통 한국인은 꾸이린루에서 노래방도가고 한국음식도 먹고 그러는데, 저희 고급반 회식을 주로 꾸이린루 근처에서 했습니다. 중국친구랑은 충칭루에서 많이 놀았습니다. 다만 충칭루나 꾸이린루 모두 시내다보니 물가는 학교 근처보다는 비싼편입니다. 하지만 답답한 시골 장춘에서 숨통 틀 유일한 장소이니만큼 유학생활 중 종종 찾게되실 것 같습니다.제가 학교다닐때 완공되었는데 교내에 일신루라는 건물이 지어졌습니다. 여기는 영화관 수영장 각종 쇼핑몰, 푸드코트들이 있는데, 저는 자주 이용하지 않았지만, 보기에 상당히 괜찮았고 영화관도 회원권을 끊으면 저렴하게 영화를 볼 수 있다고합니다.","유학생은 주로 우의회관이나 남호회관이라는 두 곳의 기숙사 중 한 곳에 입주하게 됩니다. 조건은 우의회관이 훨씬 더 좋은편입니다. 첫번째로 유학생들이 듣게될 어학수업이 주로 우의회관 1층 강의실에서 열리게 되기때문에 만약 남호회관에 입주하게 된다면 매일 아침마다 셔틀버스를 타고 등교해야합니다. (예전에는 셔틀버스도 없어서 택시나 도보로 등교했다고 합니다. 거리가 상당해요) 둘째로는 우의회관보다 남호회관이 더 깨끗합니다. 남호회관에는 바퀴벌레같은 벌레들도 많은 편이고 상당히 지저분하다고해요, 전 우의회관에 입주하면서 바퀴벌레를 본 적은 없어서, 그나마 괜찮습니다. 하지만 둘다 거기서 거기에요. 중국 기숙사를 한국 기숙사에 비교해서 생각해선 안되고 조건도 그렇게 좋지 않습니다. 예전에 남호회관에서는 온수를 계속 사용할 수 있었던 반면 우의회관은 오전 7~8시, 오후 8~10시까지만 온수를 사용할 수 있었는데, 이젠 남호회관도 우의회관의 정책과 비슷해져 버린 바람에 그나마 있던 장점까지 사라져버렸습니다. 따라서 우의회관으로 배정받지 못한다면 근처 외주를 생각해보시는 것도 좋을 것 같아요. 저같은 경우는 우의회관을 길림대측에서 무료로 제공해주어서 그나마 버티며 살았지, 만약 제 돈을 내고 입주해야하는 것이었다면 그냥 근처 양광청(아파트 이름)같은 곳에서 외주를 했을 것 같습니다. 와이파이는 월 70원씩 매번 로비에서 지불해야하고, 보통 2인 1실이기때문에 룸메이트랑 35원씩 지불하면 될 것 같습니다. 하지만 와이파이가 있다고하더라도 중국 인터넷 속도가 빠르지 않아서 상당히 답답할거에요. 다행히도 화장실은 좌변기가 있으니 이부분은 안심하셔도 됩니다. 기숙사에서 식사는 따로 제공하지않고 본인이 알아서 사먹어야하는데, 주변에 맛있는 식당이 많고 기숙사 근처에 미식광장이라는 곳에는 푸드코트처럼 이것저것 많기때문에 먹을 거리 걱정은 안하셔도 됩니다. 특히 대만철판볶음밥이라고 기숙사 뒷편에 있는데 블로그나 현지 도착하셔서 친구들한테 물어보면 다 알거에요. 이곳이 상당히 맛집이고 저도 개인적으로 일주일에 몇번은 가서 먹었던 곳입니다. 저는 중국음식류를 별로 안좋아해서 현지에서 먹거리로 고생할까 걱정했는데, 생각보다 맛있었고 되려 귀국후에는 그 음식들이 생각날 정도로 좋았습니다.","수업은 우의회관 1층에서 어학수업을 듣고, 대부분의 본과수업은 남캠퍼스(南校?)에서 열립니다. 중국은 우리와 달리 시간표를 직접 짜는 시스템이 아니고, 매 학년 학과마다 짜여져 나오는 시스템입니다. 때문에 어학수업과 본과수업을 함께 듣고 싶다면, 직접 찾아가 소속학부 학번을 따로 받아서 학과사무실로 찾아가 신청하는 과정을 거쳐야합니다. 저로 예를 들자면, 저는 본과수업도 들어야하지만, 어학수업도 필요하기때문에, 기본 시간표는 국제교육원의 고급반 시간표를 두고 거기에 몇가지 불필요한 수업들을 안듣고 (신청은 되어있지만, 출석을 하지 않음) 따로 문학부 중어중문학과 소속학번을 받았습니다. 그리고 학과사무실로 찾아가 우리학교 전공수업제목 및 커리큘럼과 일치하는 수업을 몇가지 선택해서 들었습니다. 타전공의 경우도 마찬가지로 진행하시면 될 것 같습니다. 도서관은 남캠퍼스 구석에 있고 많은 학생들이 공부를 하고 있습니다. 저는 기숙사와 너무 멀리떨어져있기도하고, 추워서 주로 기숙사내에서 공부했기 때문에 도서관에 대한 부분은 잘 모르겠습니다.","국제교육부는 우의회관 1층에 있고 운영시간은 문앞에 공지되어 있습니다. 보통 중국어로 교류하는데, 한국어를 하시는 선생님도 계시고, 영어도 통하는 걸로 알고 있습니다. 일처리는 한국과 비교할 수 없이 느리고, 사실 길림대 국제교육부에서는 유학생이 워낙 많아서 그런가 특별한 관리랄게 없습니다. 각종행사 참여해라 하고 안내하지도, 동아리를 가입하는 법 등등을 알려주지 않기때문에 스스로 찾아야합니다. 그나마 좋은점은 길림대에 한국어학과가 있기때문에 중국친구를 쉽게 사귈 수 있고, 그들을 통해서 여러 정보를 얻을 수도 있습니다. 저는 1학기 파견이라 그런지 학생증카드를 따로 발급해주지 않았지만, 종이로된 학생증은 부탁하면 발급받을 수 있습니다. (이걸로 중국 관광지 입장시 학생할인을 받을 수 있습니다, 사실 연대학생증으로 할인이 되는 곳이 있는데 간혹 엄격하게 관리할때는 중국학생증만 반영하는 경우가 있습니다. 예를들면 하얼빈의 빙등제의 경우 중국학생증과 만24세(?) 이하의 연령이어야 학생할인을 받을 수 있습니다. 이런 예외적인 경우를 제외하고는 대부분 학생증이 없어도 큰 문제는 없지만, 중국학생증을 만드는데 따로 돈을 지불해야하는 것이 아니니 주변지역을 여행할 계획이라면 우선적으로 만드는 것이 좋습니다.)","앞서 말씀드렸다시피 동아리에 대한 정보는 학생이 직접 찾아야합니다. 학교차원에서 한국어학과와 교류모임을 1회정도 마련해주는데, 그때 좋은 친구를 잘 찾아 다른 중국학생들만 있는 모임에 가입하는 것도 좋은 방법입니다. 왜냐하면 한국어과 학생들이랑만 어울리다보면, 주로 한국어만 하게될 가능성이 있기 때문입니다.","일처리가 늦다, 화장실이 더럽다등 중국에 대한 부정적인 인식을 가지고 교환학생에 온 탓인지, 되려 저는 중국에 교환학생으로 있으면서 인식이 좋게 바뀌었습니다. 역시 사람사는 곳은 다 똑같구나 하는 깨달음인데, 기대가 크면 실망고 크다고 애초에 많은 기대를 버리고 교환학생에 임하신다면 예상치 못한 많은 즐거움을 얻어 가실 수 있을 것 같습니다.","저는 대부분의 일처리를 스스로 해결했습니다. 혼자 파견된 영향도 있거니와 본래 성격상 남한테 부탁을 잘 못해서 행정업무상 일처리를 제외하고는 스스로 해결했습니다. 길림대에는 그래도 한국인 유학생이 상당히 많은 편이니, 어려운 일이 있을때 서로 도움을 받기 좋을 것 같습니다.","저는 이전에 동북삼성지역을 배낭여행으로 온 적이 있기때문에, 이번 교환학생 기간동안에는 하얼빈 빙등제를 제외하고는 크게 여행을 다녀온 적이 없습니다. 하지만 이런 경험이 없는 학우분들이라면 주변에 고구려, 발해, 독립운동들을 주제로한 유적지들이 많기 때문에, 또 거리도 가깝기 때문에 한번쯤 다녀오시는 것도 좋을 것 같습니다. 나름 성실하게 작성한다고 작성했지만, 부족한 부분도 있을 것 같습니다. 혹시나 이외에도 궁금한 사항이 있다면 kwanghistory@naver.com로 물어보세요. 감사합니다."
"다들 알겠지만 길림대학교는 장춘시에 위치하고 있는데 장춘시에 길림대학교가 있는지 길림대학교 캠퍼스 안에 장춘시가 있을지 모를정도로 곳곳에 나눠져 있고 아주 큰 귀모를 자랑한다. 그렇지만 교환학생자격으로 가게되면 남교에 해당하는 길림대학교에서 공부를 하게 될것이다.
북쪽에 위치한지라 엄청난 추위를 자랑한다~ 영하 30도까지 경험하고 돌아온 본인은 그 추위에 귀국을 빨리하고 싶었을정도이다. 그렇지만 집에 들어가거나 건물안으로 들어가면 추위를 못 느끼니 걱정은 하지말라. 다만 중국인과 같이 수업하기위해 본교수업을 들으려면 많이 걸어야하므로 단단히 준비하고 가는것이 좋다.",한국 어디에 살고 있느지따라 달라지겠지만 서울에서만 지내다가 간 본인의 경우는 완전 시골이라는 생각밖에 안들었다~ 길림대학교 남교는 그냥 대학교만 있고 근처에 식당 몇개정도가 그뿐... 그리고 그곳을 다니는 학생들이 사는 거주지 정도가 다이다. 시내에 나가면 조금 즐거운 시간을 보낼 곳이 있으나 그마저도 중국친구들과 친하게 지내다보면 나갈 기회가 많지 않아서 그냥 심심한 학기 생활~ 방법은 그냥 친구들과 재밌게 지내는것~ 어차피 겨울에 이 접어들면 추워서라도 안 나가게 되니 걱정 안해도된다.,"본인의 경우 우의회관에 있던 기숙사를 보고 경악을 금치 못하고 3일만 지내다가 바로 나온 케이스로 근처 집에 관해서 안내를 해주겠다. 다들 가보면 알겠지만 우의회관의 경우는 싸다고 하지만 막상 조금만 더 내면 천지차이의 좋은 아파트에서 중국인과 살 수 있으니 그걸 추천한다. 확인을 해보니 가기전에 미리 길림대학교 측에 연락을 취해서 1인실에 거주할 경우에는 아주 좋은것 같다 아주 조금 다른 방보다 넓으니말이다. 기숙사에 살면 사람들과 같이 지내다 보니 외로움은 덜 수 있으나 확실히 한국인과 만날 기회가 너무 많아진다. 그래서 진정으로 중국어 공부를 하고 싶은 학생들이나 중국인들과 많이 지내고 싶은 학생들 밖에서 살기를 적극 추천한다. 영어권 어학연수를 다녀온 친구들은 현지인과 사귀기 어렵다고 비슷한 수순의 외국인을 만나는게 더 좋다고 생각할지 모르나 중국인과 사귀는 것은 그것과는 정말 많이 다르고 친구되기도 쉬우니 꼭 중국인들과 살고 나오길 바란다.
근처에 여러아파트가 있는데 처음에는 발품을 좀 팔아야한다. 본인의 우의회관옆에 있는 양광청에서 거주했는데 아주좋다!! 난방도 좋아서 꼭 지낼만하다. 혹시 방을 구하는데 도저히 구하기 힘든경우에는 연락하면 내가 살던곳 주인과 연결해줄터니인 연락바란다. 다만 중국어를 좀 해야한다. 못하면 소통이 조금 어려울지도..  학교도 바로 옆에 있다보니 접근도 좋고 어러모로 좋다!! 꼭 나가서 살기를 바란다!!","중국은 우리나라 대학과 다르게 단과대마다 완벽한 구분이 이루어진다. 그래서 처음에는 어학반에서만 수업을 듣게 되는데 중국친구들과 수업을 같이 듣고 싶어하는 친구들은 본과수업을 듣게된다. 본과수업을 들으려면 처음부터 교환학생관리를 하는 과에 미리 얘기를 해두어야한다.
어학반은 알다시피 한국사람이 반이상이고, 거의 모든것이 한국사람들 중심으로 돌아간다. 외국인이라고 해봐야 별로 안되고 태반이 한국사람들, 특히 고대학생들로 이루어진다. 그래서 중국어만 공부하고 싶은 친구들은 많은 어려움이 있을지도 모른다. 꼭 중국인 친구들 만들기 바랄뿐이다.
도서관의 경우 우리 신분으로는 입장이 조금 곤란하다. 따로 신청을 해야하는데 이래저래 귀찮고 해서 본인이 한 방법은 그냥 들어가서 부탁을 한 다음 들어가는것이다. 다음으로 할 수 있는 방법은 중국친구들이 빌려주는 도서관 카드다. 본인의 경우 처음 한두번은 부탁하고 들어갔으나 후에는 중국친구가 그냥 도서관 카드를 주어 그걸로 다녔다. 그러나 중국친구들을 사귀어보면 알겠지만 그 친구들은 4개정도 정해진 건물에서 자습을 하게끔 되어있어서 그냥 강의실에 수업이 있는지 없는지 확인하고 그냥 들어가서 공부를 하면 된다.",국제교육부에는 白玉老师가 담당하시고 계시는걸로 안다. 그런 거의 세세한 일은 1층의 최선생님이 모두 담당하신다. 본과수업을 안 들을 경우에는 白玉老师과 접촉을 안하는 편이다. 특히 최선생님이 한국어를 더 잘 하셔서 그분을 통해서 하는 사람들이 많다. 아주 친절하게 해주시니니 걱정하지말고 질문하기 바란다. 그러나 되도록이면 혼자처리했으면 좋겠다. 스스로 해가는 과정에서 여러모로 많은 도움을 얻으니!! 중국어뿐만 아니라 외국에서 생활하면서 혼자 어떻게 살아가야하는지 혼자 느끼는 외로움을 어떻게 해결해가야하는지 강인한 사람이 될 수있으니 말이다. 되도록이면 중국사람들과 접촉의 기회를 많이하고 그사람들을 통해 정보를 얻고 여행도 다니기 바란다.,부대시설 및 동아리... 이곳에 관해서 다른친구들은 어떻게 적은지 모르나.. 사실 매우 열악하다. 길림대학교 안에 중국친구들이 하는 동아리가 있으나 들어가기도 좀 그렇고 사실 중국아이들마저 재미없다고 할 정도니.. 조금 그렇다~ 기회가 좋게 좋은 동아리에 들어가면 좋을듯 하나 확실히 조금 어렵다. 그냥 중국친구들을 사귀고 같이 여행다니고 같이 놀러다니는게 더 좋을 듯 하다.,사실 본인은 어려서 중국에 지냈던 지라 별로 어려움은 없었으나 그냥 중국인의 자존심은 워낙쎄고 쉽게 과장을 한다고 생각했으면 좋겠다. 그걸 그냥 비판하고 들어갈게 아니라 친구가 되고 싶다면 그냥 편히 들어줬으면 한다. 처음에는 조금 별로같으나 좋은 녀석들도 있으니 친해지고 하다보면 정말 잊지못하고 연락을 할거다. 지금도 녀석들과 메일 주고 받고 있다.,교내 최선생님이나 선생님들.. 그리고 대학선배들이나 여러사람들이 있다. 나에게도 연락주면 바로 가르쳐줄테니 걱정말고 연락하길 바란다. 혹시 어려움이 생기면 내 중국친구들도 소개해줄테니 걱정말기 바란다.,"외국생활, 특히 교환학생으로 간다는것 자체가 정말 좋은기회다. 제발 제발 한국사람들과 지내지말고 외로워 죽는 한이 있더라도 꼭 중국사람들과 지내길 바란다~!! 제발 그러길 바란다!! 중국어를 배우는 것은 아주 작은 부분일뿐이고, 외국사람과의 생활, 외국에서의 생활, 인생, 어떻게 내가사회를 만날것인가 등 정말 많은 것을 알게된다. 주님과도 더 가까워지는 시간~!! 그리고 우리가 한국사람이라는 걸 잊지 않았으면 한다!! 나의 아주아주 작은 행동까지 한국사람이라는 이름아래 우리 국민 모두가 욕을 먹으니 말이다. 반대로 내가 아주 잘하는 행동 하나로도 한국 좋다, 한국사람들 멋지다는 소리를 들을 수 있으니 정말 멋진 경험이다. 나를 통해 많은 중국인들이 한국사람 욕하다가도 아니다라고 당당하게 말할 수 있겠다고 말할걸 보고 너무 기분이 좋았었다. 항상 중국친구들과 역사과 현대 우리나라와의 문제점들을 가지고 토론을 했는데 그속에서 우정도, 서로에 대한 이해도, 더 나아가 우리나라의 위상도 높이는 정말 좋은 기회였다~! 꼭 이런것까지 경험하고 왔으면 좋겠다.

급하게 적느라 말이 안되는 곳이 많을테지만 끝까지 읽어줘서 감사합니다. 혹시 어려움있거나 궁금한것 있으면 rlarygus1@empal.com으로 연락 주세요."
