gen_info,env_info,food_info,study_info,office_info,facil_info,mhct_info,help_info,etc_info
"교환대학의 크기, 지리적 위치 기후 등
City University of HK의 크기는 생각보다 작았습니다. 학교 건물의 내부는 색깔별로 Green, yellow, blue, purple zone 으로 구분 되어 있어서 심한 길치인 저도 쉽게 강의실을 찾아다닐 수 있었습니다. 학기 초에 교환학생들에게 조그만 교내 지도를 나눠 주는데, 초반에는 이것을 들고 다니면 하지만 가끔은 좁아서 갑갑한 기분도 들었습니다. 

하지만 학교의 위치는 매우 좋습니다. 이 학교의 가장 뛰어난 장점 중 하나는 위치라고 생각하는데, 학교가 홍콩의 중앙쯤에 위치해 있는데다가(Kowloon Tong) 교통의 요지에 있기 때문에 홍콩 어느 곳을 가든 이동하기가 쉽게 되어 있습니다. 학교가 위치해 있는 곳이 부촌과 빈촌이 중간 즈음이기 때문에 조금만 돌아다니다 보면 홍콩에 살고 있는 다양한 계층의 사람들의 생활 모습을 볼 수 있습니다. 

저는 1월부터 4월까지 홍콩에 있었는데 1월 한 달은 꽤 추웠지만 곧 날씨가 따뜻하게 풀렸고, 4월쯤엔 너무 더워서 나가기가 싫을 정도였습니다. 하지만 1월엔 날씨가 추운 데다가 방안에 난방이 없고, 이불은 개인이 준비해야 하기 때문에 이불을 준비해 가시던지 아니면 홍콩에 오자마자 구입 하시기를 권합니다.(보통 IKEA에서 구입하는데 적당한 가격에 괜찮은  저는 첫날 시간도 없고, 어디서 구입해야 할지도 잘 몰라서 그냥 자보려고 했는데, 옷을 몇 겹이나 껴입어도 추워서 잠이 잘 들지 않았습니다. 결국 페트병 가득 뜨거운 물을 받아서 그것을 안고 잠을 청할 수밖에 없었습니다.","대학 주변 환경

근처 쇼핑 장소
1) Festival Walk
City Univ. of HK은 독특하게도 Festival walk라는 대형 쇼핑몰과 연결이 되어 있습니다. 한번은 이곳이 홍콩을 소개하는 관광 책자에도 실려 있는 것을 보았는데, 내부엔 음식점부터 식작해서, 장난감 가게, 옷 가게, 화장품 가게 등 다양한 브랜드의 제품들이 들어와 있습니다. 많은 학생들이 이곳의 지하에 있는 식료품 가게를 종종 애용하곤 하는데, 일반 슈퍼에서는 볼 수 없는 다양한 수입 제품들이 많은데다가 제품별로 돌아가면서 세일을 하기 때문에 매우 유용합니다. 하지만 과일이나 일반 냉동식품은 비싼 경우가 더 많기 때문에 잘 비교해 보시고 사는 것이 좋습니다.


2) Nam San Estate 
학교에서 Shekip Mei로 걸어가는 길에 볼 수 있습니다. 2층으로 된 재래시장이 있어서 야채와 과일 고기 등을 싸게 살 수 있습니다. 맛있는 중국 음식점이 있는데, 손님이 많아서 기다려야 할 때가 많습니다. 기숙사에서 친구들과 hot pot을 만들어 먹곤 했는데 그때마다 이곳에서 야채와 고기 등의 재료를 사오곤 했습니다. 





3) Sham Shui Po 
기숙사에서 2F 버스 타고 갈 수도 있고 MTR타고 갈 수도 있지만 기숙사 옆 공원을 지나서 조금만 걸으면 금세 도착할 수 있기 때문에 전 종종 걸어 다니곤 했습니다. 전자 기기도 싸게 살 수 있고, 저렴하고 맛있는 가게도 많기 때문에 질리지 않는 곳입니다. 맛있는 디저트 가게와 라면 가게가 있는데, 정확한 가게 이름이 생각나진 않지만 현지 친구들에게 물어보면 바로 알려줄 것입니다.","기숙사 생활
기숙사는 보통 2일 1실에 화장실은 4명이 같이 쓰는 형식이지만 크게 불편하지는 않습니다. 제 룸메이트는 중국 본토 아이였는데, 중국 아이들은 워낙 서로의 사생활에 대해 신경 쓰지 않기 때문에 마치 방을 혼자 쓰는 것만 같았습니다. 만약 1인실을 사용하고 싶으시면 한국에서 미리 신청서를 보내야 하는데, 방 수가 적어서 건강상의 문제로 독방을 써야 한다는 것을 증명할 수 없으면 독방을 쓰기 어렵습니다. 기숙사는 각기 다른 Hall로 나누어져 있는데(1-9까지) 저는 Hall2에 살았습니다. 각 홀마다 각기 다른 파티가 있는데, 친구가 있다면 다른 홀의 파티에 참석해도 상관이 없습니다. Hall2는 특히 잘 놀기로 유명했었는데, 저희 층 같은 경우에는 매주 목요일을 dessert day라고 정한 뒤, 각 방마다 번갈아 가면서 그 층의 전체 친구들이 먹을 수 있는 간식을 준비하여 모여서 수다도 떨고 간식도 먹으면서 밤을 보내곤 했습니다. 또 홀끼리 운동 경기, 실내 내부 장식 경쟁 등 같은 홀 친구들은 물론이고 다른 홀의 친구들과 함께 놀 수 있는 기회는 다양합니다.
기숙사 1층에는 컴퓨터실, 주방, 텔레비전, 공부방, 피아노방 등 다양한 활동이 가능한 방들이 준비되어 있습니다. 
기숙사 옥상에는 세탁기와 빨래를 건조시키는 곳이 있으며, 그 아래층에는 guest room이 있는데, 초대된 가족이나 친구들이 묵을 수 있는 이 방들은 수도 적은데다가 인기가 많아서 금방 예약이 끝나 버리니 미리미리 확인을 하셔야 합니다. 저는 2인실을 빌린 적이 있었는데, 욕조, 부엌, 마루, 등 넓은 방과 깨끗한 시설을 갖추고 있었기에 강력 추천해 드리고 싶습니다. 
안타깝게도 기숙사 근처엔 편의점이 없습니다. 기숙사에서 제일 가까운 슈퍼는 Festival Walk 지하의 매장인데, 12시에 닫는 대다가 멀리 있어서 가끔 불편할 때가 있습니다. 기숙사에서 큰 길을 타고 쭉 내려가면 24시간 편의점이 하나 있는데, 그 옆에 호프집도 하나 있습니다. (근방에서 유일한 호프집이기 때문에 이곳에선 city U에 다니는 외국인 학생들을 많이 만나볼 수 있습니다.)","수업
정말 솔직히 말씀드리자면 저는 영문과 전공 수업을 듣고 싶어하는 학생들에겐 이 학교를 별로 추천해주고 싶진 않습니다. 저희 학교와는 달리 ‘영문’을 전문적으로 가르치는 수업은 없기 때문입니다. City U에는 영어 영문학과 대신 ‘Dept. of English''가 있는데 문법이나 회화, 또는 듣기 등 주로 실용적인 영어를 가르치고 문학 수업은 제가 들을 당시, Shakespeare의 작품을 가르치는 수업 하나밖에 없었습니다.(셰익스피어 수업은 정말 강력히 추천해 드립니다. 교수님께서 다양한 인터넷 자료들을 적극 활용하시기 때문에 지루한 순간이 없고, 학생들이 수업에 참여할 기회가 많은 열린 수업이었기 때문입니다.)
Dept. of English의 수업 중 광고 copywriting에 관한 수업도 하나 들었는데, 교수님도 열정적이셨고 매우 흥미로운 수업이 되었던 것 같습니다. 
Dept. of English의 수업 중 영화 관련 수업이 있었는데, 이는 많이 실망스러웠습니다. 영화에 대해서 좀 더 심도 있는 내용을 다뤘으면 했는데, 매번 받아쓰기만 했기 때문입니다.
대부분의 교수님께서는 홍콩식 영어 발음을 사용하시는데, 처음에는 조금 낯설겠지만 금세 적응이 되면 알아 듣는 데엔 불편함이 없습니다.",,,,,"Tips
중국 본토 친구들과 홍콩 친구들의 사이가 별로 좋지 않습니다. 서로 생활 패턴이 완전 반대인대다가 중국인들은 홍콩이 중국의 속국이라는 생각과 자부심과 동시에 홍콩보다 가난하다는 열등감을 가지고 있으며, 홍콩 사람들이 홍콩은 중국과 별개의 공간이며 중국 사람들이 홍콩 사람들을 무시한다는 생각을 가지고 있는 경우가 많았습니다. 이와 관련된 이야기는 조심스럽게 하는 것이 좋을 것 같습니다. 

홍콩 사람들은 외국인에게 부담스러울 정도로 친절을 베풉니다. 길을 물어보면 그 곳까지 같이 가주는 일이 태반이며, 항상 웃는 얼굴로 외국인들을 대합니다. 특히 한국 사람들을 아주 좋아하는데, 한국 드라마의 영향으로 한국 남자들은 다 키가 크고 잘생겼으며, 한국 여자들은 다 예쁘고 날씬하다고 생각하고 있었습니다. 한국 드라마에 대해 기본적인 지식 정도만 알고 나가도 홍콩 현지인들과 대화를 시작하는 데 많은 도움이 될 것 같습니다. 

홍콩에서는 웬만하면 택시를 타지 않는 것이 좋습니다. 영어가 전혀 통하지 않는데다가 매우 비싸기 때문입니다. 피치 못할 사정으로 만약 이용하게 된다면 말로 위치를 알려주기보다는 장소를 적어서 보여주는 편이 낫습니다. 학기 초에 INSO에서 기숙사의 주소가 적힌 명함을 나눠주는데, 이를 지갑에 넣어 다니다가 택시를 탔을 때 꺼내서 보여주면 편리합니다.

제가 City U에 있었을 때 교환학생들이 주관하는 세계 각국의 문화를 소개하는 축제가 개최되었습니다. 한국 사람들끼리 모여서 준비하고 계획을 짰는데, 무대에서 한복 패션쇼도 하고  전통 요리도 준비하는 등 여러 가지 활동 결과, 한국이 우승하여 많은 상금을 획득할 수 있었습니다. 한복과 같은 경우엔 City U에 계신 한국 교수님께서 빌려 주셨는데, 그 외엔 한국을 알릴 수 있는 소품이 부족하여 조금 아쉬웠습니다. 한국에서 미리 조금 챙겨오는 것도 좋을 것 같습니다. 

홍콩은 다양한 나라에서 온 외국인들이 많이 머물고 있는 도시인만큼 각국의 독특함 음식점들이 많이 있습니다. 저는 개인적으로 외국에 나가면 그 나라의 음식을 반드시 먹어봐야 한다고 생각하기 때문에 홍콩 현지 친구들에게 물어서 여러 맛있는 맛집들을 찾아다니곤 했습니다. 홍콩에서 외식하는 비용이 싼 편은 아니지만 평소엔 기숙사에서 직접 저렴하게 요리를 해 먹으며 돈을 절약해 두었다가 한 번씩 나가서 맛있고 이국적인 음식들을 먹어보는 것도 좋을 것 같습니다. 

홍콩은 나라가 작기 때문에 길을 잃더라도 조금만 걷다보면 금세 MTR(한국의 지하철)역이나 버스 역을 찾을 수 있습니다. 게다가 홍콩은 치안이 잘 되어 있고 안전한 나라이기 때문에 개인적으로는 될 수 있는 한 많이 다양한 곳을 돌아다녀 보라고 권장해 드리고 싶습니다. 버스 정류장엔 영어로 역명이 표현되어 있지 않은 경우가 종종 있기 때문에 목적지의 한자 정도는 알고 다니는 것이 좋을 것 같습니다.

저는 중국어와 영어를 동시에 잡아 보고자 홍콩으로 갔는데, 개인적으론 원했던 결과를 얻을 수 없었습니다. 홍콩엔 중국 사람들이 워낙 많기 때문에 원한다면 얼마든지 그들과 어울려 놀면서 이야기 할 수는 있으나, 보통 현지인들은 광동어를 사용하는데다가 중국 표준어를 가르쳐 주는 곳이 특별히 없었기 때문입니다. 제 생각이지만 이미 영어를 수준급으로 구사할 수 있는 학생이라면 영어 실력을 향상시키겠다는 생각만으로 홍콩에 오는 것은 아니라고 봅니다. City U에서 제공하고 있는 다양한 활동들과 좋은 수업들을 맛보러 오는 것이라면 적극 추천해 드리지만 위에서도 이야기했듯이 홍콩은 영어 발음도 다르고 홍콩 학생들 역시 영어를 제2외국어로 배우는 입장이기 때문에 그들 역시 잘못된 영어를 사용할 때가 이따금 있기 때문입니다. 

.
.
.
.

한국에 돌아와서 후회하지 않기 위해 홍콩에 있는 동안 다양한 곳을 가보고 다양한 음식을 먹어보려고 애썼는데, 막상 돌아오니 또 아쉬움이 남네요. 
궁금한 점이 있으면 언제든지 연락 주세요 :)
gochos88@naver.com"
