gen_info,env_info,food_info,study_info,office_info,facil_info,mhct_info,help_info,etc_info
"Uni.Oulu는 상당히 규모가 있는 학교다. 하지만 핀란드의 인구가 서울 인구의 절반 정도라는 것을 염두에 둔다면, 핀란드에서 큰 학교이지만 연대캠퍼스에 비하면 훨씬 작다. 북위 65도에 있는 도시여서 그런지, 학교가 하나의 건물로 되어있다. 정문으로 들어가도 단과대 강의실을 여럿 거치면 문과대 강의실로 갈 수 있다. 처음에는 지도를 들고 다니면서 익혀놓으면 익숙해 질 수 있다.","학교캠퍼스는 기숙사와 매우 가깝다는 장점이 있지만, 시내와는 6km정도 떨어져 있기 때문에, 시내에 나가려면 버스를 타야한다. 대학 주변에 수퍼마켓이 2개, Pizzaria, Pub, Chinese restaurant, gift shop, pharmacy 등이 있어서 기본적인 생필품을 구하는 데는 전혀 부족함이 없다. 나중에 근처 지리에 익숙해지면 25분 정도 걸어가는 거리에 큰 마트 2개가 있어서 세일하거나 괜찮은 식자재를 살 때면 이 곳을 이용하게 된다. 캠퍼스안에 atm이 있고, 수퍼마켓 근처에도 2개가 있다. 시내에는 Stockmann이라는 백화점이 있고, 많은 술집과 클럽, 바, 레스토랑, 각종 샵들이 있다.","ISEP을 통해 교환을 가게 되면, 학비 뿐만 아니라 식비와 기숙사비까지 교환이 된다는 장점이 있다. 그래서 직접 교환 대학과 비슷한 수준의 대학이라면, 특히 생활비나 집세가 비싼 곳이면 ISEP을 통해 가는 편이 더 나은 선택이다. 미리 교환배정을 받을 때, 한번에 일년치의 생활비와 기숙사비를 내야 등록이 가능한데, 이렇게 내고 오면 알아서 International Office에서 기숙사를 배정해주고, 은행계좌를 만들면 일정한 금액의 식비를 넣어준다. 은행계좌는 오리엔테이션 기간에 핀란드친구들이 은행까지 데려가서 도와준다. 기숙사는 학교캠퍼스와 매우 가깝다. 굳이 자전거를 따로 살 필요는 없을 정도지만, 개인적으로 좋아한다면 싼 값에 중고로 사면 나중에 편하다. 식사는 학교식당에서 한 끼에 2.5유로, 베지테리안 1.8유로로 먹을 수 있다. 꼭 학생증이 필요하며 없다면 조금 더 비싸게 먹어야 한다. 나는 일주일에 두번정도만 식당에서 먹었는데, 수업이 짧거나 공강이 있다면 기숙사에 가서 먹고 와도 되기 때문이다.","Oulu도시 자체가 IT Cluster의 특색이 있기 때문에, 이 학교 또한 공대로 매우 유명하다. 나는 영문학과로 교환을 갔는데, 생각보다 전공수업이 다양하게 있지 않아서 당황했었다. 연대실라버스와 맞아떨어지는 수업을 선택해야 하는데, 기본적인 수업이 대부분이라서 재밌는 과목이나 골라듣는 재미는 기대할 수 없었다. 핀란드는 유럽의 학점제도를 사용하기 때문에, 학점인정을 받기가 상당히 까다로운 과목이 대부분이다. ECTS학점은 보통 우리학교에서는 절반만 인정하는데, 영문과수업은 과목당 평균3, 4학점이기 때문에 비슷한 두 세과목을 들어야 인정받을 수 있다. 그 곳에서 한 학기당 5, 6과목을 수강했지만, 정작 돌아와서는 인정받기가 힘든 단점이 있다. 핀란드에서는 책값이 매우 비싸기 때문에 보통 수업교재는 복사물을 쓰거나, 도서관에서 대출한다. 교재는 대부분 넉넉하게 준비되어 있어 도서관카드로 대출하기만 하면 된다. 영어책도 상당히 많이 있지만, 수업 이외에 따로 소설을 빌려 본 적은 없다. 도서관은 7시 정도에 문을 닫고, 우리나라처럼 24시간 열람실의 개념은 전혀 없다. 핀란드 나라 자체가 일찍 일어나고 일찍 퇴근하거나 닫는 나라이기 때문에, 처음에 가면 당황할 만한 일이 많다.","교환학생과 관련한 일은 모두 Internationaloffice에서 관리하며, 메인 건물 1층에 위치한다. 모든 교환학생들은 ID@oulu.fi 로 이루어지는 메일계정을 가지게 되고, International
office에서 교환학생 업무와 관련한 소식들을 모두 여기로 보내준다. 특히 mailing list에 등록하면 등록한 메일주소로 international coordinator가 각종 행사와 소식을 전하는 메일을 보내준다. 중고 물건을 판다, 혹은 빌린다는 학생들의 메일이 종종 오기도 했으며 본인이 직접 mailing list로 단체메일을 보낼 수도 있다.","연대에는 멘토스 등 교환학생, 외국인친구들을 도와주는 동아리가 있다. 오울루대학교에도 그런 동아리가 있는데, 그 곳에 소속된 핀란드 학생 1명당 교환학생 7~8명이 한 조로 묶여 처음 적응기간에 도와준다. 학교시설로는 Gym이 기숙사와 가깝게 있다. 매 학기 18유로 정도를 내면 카드를 발급해주는데, 보통 이곳에 가기 보다는 외부에서 걷거나 조깅을 많이 한다.",,International office에서 교환학생업무와 관련한 모든 일을 담당한다.,
"오울루 대학교는 오울루라는 작은 도시에 있는 학교입니다. 연세대에 비하면 그 규모는 매우 작게 느껴지는 학교이지만 많은 학생들이 이 학교에서 재학하고 있습니다. 핀란드 학생들뿐만 아니라 다른 유럽 국가에서 온 학생들도 많습니다. 제가 간 학기에는 200명 가량의 교환학생들이 왔습니다. 특이한 점은 학교 건물들이 모두 연결되어 있다는 것인데, 일단 학교 안으로 들어오면 어디로 이동하든 바깥으로 나갈 필요가 없습니다. 혹독한 겨울 추위 때문에 만들어진 건물구조 같습니다. 오울루는 핀란드의 수도인 헬싱키에서 북쪽으로 약 600km 정도 떨어져 있는 작은 해안 도시입니다. 핀란드 중앙 기차역에서 기차를 타고 이동하면 낮에는 6시간 밤에는 8시간 가량 걸립니다. 핀란드는 북유럽 국가로 지구상에서 상당히 북쪽에 위치한 나라입니다. 그래서 평균기온이 우리나라보다 현저히 낮습니다. 추위가 굉장히 빨리 찾아와서 10월 초부터 눈이 내리기 시작합니다. 1월이 되면 기온이 많이 떨어져 매우 춥다고 합니다. 핀란드의 겨울은 해가 무척 짧아서 많은 야외활동을 하기가 어렵습니다. 어두운 겨울 때문에 우울증에 걸리는 사람도 있다고 합니다. 여름은 겪어보지 않아서 잘 모르겠지만 듣기로는 덥지 않고 그냥 서늘하다고 합니다. 핀란드의 지형은 매우 평평해서 산과 언덕은 없지만 호수가 매우 많습니다. 인구도 500만 명 정도 밖에 되지 않아 나라 전체가 매우 한적한 분위기입니다.","대학교 주변으로 호수가 두 개 있습니다. 산책하기에 괜찮은 곳들입니다. 겨울에는 호수들이 모두 꽁꽁 어는데 스케이트를 구해서 즐기실 수 있습니다. 학교에서 버스를 타고 10분쯤 나가면 시내가 있고 백화점이나 여러 상점, 유흥을 위한 곳들이 있습니다. 학교 앞쪽으로 도로를 건너면 학생들을 위한 아파트 형식의 집들이 있고 그 뒤쪽으로 Tokmanni 라는 중형 슈퍼마켓이 있습니다. Prisma라는 대형 슈퍼마켓은 학교에서 걸어서 10분 정도 떨어진 곳에 있고, 학교 옆으로 체육센터가 있습니다. 대학교 주변 동네의 이름은 Linnanma 입니다.","아파트는 두 종류가 있는데 2명이 하나의 Flat을 사용하는 곳과 4명이 함께 사는 Flat이 있습니다. 저는 2명이 생활하는 곳에서 지냈는데 flat으로 들어가면 방은 1인실이 두 개가 있고, 화장실과 조그마한 부엌을 flat-mate와 함께 사용합니다. 부엌에는 전기렌지와 오븐과 냉장고 주방도구들이 준비되어 있습니다. ISEP을 통한 학생들은 International Center를 통해서 생활비를 지급받게 되고 방세는 미리 내고 가므로 현지에도 또 내지 않아도 됩니다. 생활비를 받기 위해서 은행 계좌를 개설해야 하는데, 현지에서 Kummi (도우미)학생이 잘 도와줍니다. 식사는 주로 점심은 학교 식당에서 먹게 되는데 학교 식당이 매우 좋습니다. 학생증을 발급받아서 보여주면 학생가격으로 식사를 할 수 있는데 저렴한 가격에 질 좋은 식사를 할 수 있습니다. 메뉴를 먼저 보고 먹고 싶은 것을 접시에 던 후 계산하는 뷔페식입니다. 학생증 발급 시 학생회비와 카드발급비를 내라고 하는데 학생회비도 ISEP측에서 해결해주므로 카드발급비만 내면 됩니다. 학교 식당이 문을 일찍 닫는 편이므로 저녁은 집에서 만들어 먹는 일이 많습니다. 근처에 아시아 음식재료를 구할 수 있는 곳이 없으므로 한국에서 고추장, 된장, 간장, 춘장 등의 재료를 싸가시는 게 좋습니다. 주로 가까운 Tokmanni 슈퍼마켓을 이용하여 식료품을 구입하게 됩니다.","수업은 자기가 듣고 싶은 과목을 수강편람에서 검색해 본 뒤 시간표를 확인하고 그냥 수업에 참여하면 됩니다. 수강신청 같은 것은 따로 없고 출석을 체크하는 수업의 경우 첫 수업에 참여하셔서 이름을 적거나 교수님에게 따로 연락을 취하면 됩니다. WebOodi 라는 시스템을 사용하여 시험등록을 하고 시험일정에 따라 시험을 칩니다. ISEP 학생들은 Course enrollment form을 작성하여 ISEP coordinator에게 확인 받으면 됩니다. 수업이 마음에 들지 않는다면 언제든지 목록에서 뺄 수도 있으니 매우 유연성이 높은 수업시스템입니다. 저는 전공 두 과목을 듣고, 영어 두 과목을 들었습니다. 학점 시스템은 ECTS credit을 사용하며 연세대에서 3학점 수업을 대체 받으려면 6ECTS 이상의 credit을 주는 수업을 들어야 합니다. 6ECTS를 주는 영어수업이 많지 않아 불가피하게 핀란드어로 강의하는 수업을 들을 수도 있습니다. 이런 경우 영어로 된 강의노트를 구할 수가 없는데 교수님이나 조교에게 직접 문의하면 영어 교재를 따로 마련해 줍니다. 강의가 핀란드어로 진행될 경우 스스로 공부하여 시험을 쳐야 합니다. 학교의 교수님들과 선생님들은 매우 친절하므로 궁금한 것이 있으면 언제든지 이메일을 쓰거나 방문해서 질문하는 것이 좋습니다.
도서관은 크진 않지만 학교 내에 세 군데가 있습니다. 중앙도서관에는 교과서를 모아놓은 곳이 따로 있어 수업교재를 살 필요가 없습니다. 학교 수업에서 사용되는 모든 교재가 있으므로 대출하여 사용하면 됩니다. 강의노트를 판매하는 곳도 있는데 수업에 사용되는 강의노트가 있으면 구매해야 합니다. 조용히 공부할 수 있는 열람실은 중앙 도서관에 있는데 많은 학생들이 도서관에서 공부하지는 않습니다. 평일은 저녁 7시에 도서관이 문을 닫고, 학교 내에 따로 공부할 수 있는 장소가 마땅히 없으므로 밤에는 집에서 공부해야 합니다. 학교 내에서는 어디든지 무선 인터넷이 로그인 절차 없이 사용가능 하므로 노트북컴퓨터가 있다면 유용하게 사용할 수 있습니다.","학교 내에 있는 International Center에서 교환학생과 관련된 모든 업무를 담당합니다. 이 곳에 ISEP coordinator의 사무실도 있습니다. 주로 집이나 ISEP, 생활비 지급 등에 관한 것에 문제가 있을 시 이곳을 찾게 됩니다.",동아리에 참여하고 싶다면 게시판에 붙어있는 동아리 홍보 게시물을 보고 따로 연락을 취해서 참여할 수 있습니다. 체육활동을 하는 동아리들이 많습니다. 그리고 많은 스포츠 활동이 시 주최 하에 개설되는데 학교 근처의 체육관이나 시내에 있는 체육관에서 진행됩니다. 시내 체육관에는 수영장이 있는데 화요일과 목요일 저녁 7시부터는 학생할인을 받아 1유로에 수영장을 사용할 수 있습니다.,문화적으로 특별히 충격을 받을만한 것은 없습니다. 핀란드 사람들은 수줍음을 많이 탄다고 합니다. 다른 사람에게 관심을 많이 보이지 않아 무뚝뚝하게 보이지만 먼저 인사를 건네고 대화를 하다 보면 금세 친해지게 됩니다. 교환학생들이 많아 파티가 매우 많이 열리는데 파티에 참여해서 친구들을 많이 사귈 수 있습니다. 조금 색다른 점은 사우나입니다. 사우나가 매우 대중화 되어 있어 어딜 가나 사우나 시설이 마련되어 있습니다. 학교 앞의 학생 아파트에 사우나는 두 군데 있으며 시간을 나누어 남자와 여자가 따로 사용하게 됩니다. Mix time(혼용 시간)도 있는데 이 때 약간의 신선한 충격을 경험할 수도 있습니다.,"현지에 도착하여 처음 몇 일간은 Kummi(도우미) 학생에게 많은 도움을 받게 됩니다. 교환학생으로서 오울루 대학에서 생활하는 것에 대한 모든 것을 도움 받을 수 있습니다. 저는 오울루로 교환학생을 온 한국 학생 몇 명을 알 수 있었지만, 오울루에서 한국인을 보기는 매우 힘듭니다. 다른 한국학교에서 교환학생으로 온 사람이 없다면 한국인은 없다고 해도 무방합니다.","한 명의 Kummi 학생이 8명 정도의 교환학생을 책임지게 되는데 이 때 그룹내의 다른 나라 학생들과 친해지게 되면 교환학생이 끝날 때까지 좋은 친구로 남을 수 있습니다. 그리고 ESN이라는 교환학생을 위하여 많은 행사를 하는 단체가 있는데 이 단체에서 하는 행사에는 빠짐없이 참여해 볼 것을 권합니다. 많은 교환학생들과 함께 어울릴 수 있는 기회이므로 친구를 만드는데 많은 도움이 됩니다.
저는 핀란드의 가을과 겨울 밖에 겪어보지 못했지만 그래도 참 많은 인상을 주는 나라라는 생각이 듭니다. 청명한 가을의 날씨와 맑고 깨끗한 호수와 바다는 더럽혀지지 않은 자연을 느낄 수 있게 해주고, 겨울에는 어두운 날이 많지만 눈이 많이 내리는 날은 또 다른 풍경을 감상하게 해줍니다. 사람이 많지 않아 심심할 때도 있지만 조용한 세상을 겪어보는 것도 색다른 경험이었습니다. 무엇보다 핀란드로 세계 곳곳에서 많은 교환학생들이 온다는 것은 놀라운 사실이었고, 전세계를 걸쳐 친구를 만들 수 있는 좋은 기회이기도 했습니다."
"Oulu는 아래위로는 핀란드의 중간쯤, 옆으로는 서쪽 해안에 위치해 있는 핀란드 중북부의 주도시입니다. 헬싱키에서는 기차로 6시간을 위로 올라가는 곳이므로 헬싱키보다 춥고 겨울도 일찍 시작됩니다. 1-2월엔 영하 30도까지도 내려가는 강추위가 있다고 하지만, 제가 있었던 9월부터 12월까지는 한국의 가을, 겨울 기온과 그닥 큰 차이는 없었습니다. 12월에는 오후 3-4시쯤이면 해가 져서 우울하게 느껴지기도 하지만, 그 환경에서 이루어져 온 그들의 문화를 느끼는 일도 즐거운 추억으로 남습니다.
오울루 대학의 캠퍼스는 시내에서 버스로 15분 정도 떨어진 Linannma에 위치해 있습니다. 단, 제가 다녔던 건축과는 시내에 있었습니다. 캠퍼스는 우리 학교와 비교하면 크지 않은 규모이지만, 다양한 학과가 있고 박물관, 도서관도 잘 마련되어 있으며 무엇보다 교환학생 프로그램이 매우 체계적으로 갖춰진 대학이라는 것을 느낄 수 있었습니다.","대부분의 기숙사가 캠퍼스 바로 맞은편에 있고, 주위에 대형 수퍼마켓이나 식당 등 편의시설이 대부분 갖추어져 있어 생활에 불편은 없습니다. 버스도 시내로 자주 다니고, 자전거로 다니거나 산책할 수 있는 길도 잘 되어 있습니다. 핀란드 답게 주위에는 침엽수 숲이 있습니다. 핀란드 학생들은 대부분 자전거를 가지고 있어 캠퍼스와 시내를 오갈 때도 자전거를 이용하지만, 학생할인을 받을 수 있고 배차간격도 길지 않기 때문에 저는 버스를 주로 이용하였습니다.","저는 4개의 방이 있고, 부엌겸 거실과 샤워실, 화장실을 공동으로 사용하는 기숙사에서 살았습니다. 같은 건물에 방 2개 짜리 플랫도 있으며, International relation office를 통해 기숙사를 신청한 교환학생 대부분은 이런 형태의 기숙사에 배정받게 됩니다.
식사는 플랫에서 해 먹거나, 오후 3시 전까지는 학교 안에 있는 카페테리아에서 2~3유로에 식사를 할 수 있습니다. 학교 식당의 식사는 부페식으로 되어서 메인 요리(감자나 밥 + 고기류/소스) 와 샐러드, 빵, 음료수(물이나 우유, 쥬스 등등) 이 나옵니다.","저는 Nordic Design Program을 수강했습니다. 핀란드 건축에 대한 강의(영어강의)와 설계 과제를 수행하는 스튜디오 프로그램으로 건축이나 산업디자인을 전공한 교환학생을 위해 잘 짜여져 있다는 인상을 받았습니다. 건축과에는 나무나 플라스틱 등을 이용해 모형을 만들 수 있는 다양한 설비들도 갖춰져 있어 유용하게 이용할 수 있었습니다. 또한 오울루 뿐 아니라 핀란드의 건축을 이해할 수 있도록 헬싱키, 유바스쿨라 등지로의 다양한 견학 프로그램이 준비되어 있었습니다. 수업은 건축과 건물에서 이루어졌고, 각자 자리가 배정된 스튜디오도 마련되어 있었습니다.
이외 전공 학생들은 메인 캠퍼스에 있는 강의실에서 수업하며, 도서관과 컴퓨터도 자유롭게 이용할 수 있습니다. 캠퍼스 내에서는 무선인터넷도 잘 되어 있습니다. 수강할 과목에 대해서는 학기 초에 있는 오리엔테이션을 통해 안내되기 때문에 어려움 없이 신청할 수 있습니다. 
모든 교환학생 프로그램이 잘 짜여져 있고, 핀란드 곳곳으로 견학도 여러번 마련되어 있어서 다양한 체험을 해 볼 수 있습니다.","Office hour가 조금 짧긴 하지만, 근무 시간중이면 언제나 International Relation Office에서 도움을 받을 수 있습니다. 국제교육부에서는 교환학생들을 위해 Kummi student와 Kummi family 프로그램을 진행하고 있습니다. 이는 교환학생과 현지 학생, 가족을 맺어주어 현지 적응을 쉽게 하고, 핀란드의 문화를 직접 체험할 수 있는 프로그램으로, 저에게도 많은 도움이 되었습니다.","오리엔테이션에서 활동할 수 있는 동아리를 소개해 줍니다. 동아리들은 가까운 핀란드 내의 도시 뿐 아니라, 러시아나 스웨덴으로의 견학을 기획하는 등 활발한 활동을 하고 있습니다.","기후나 숲이 많은 환경 등 낯설게 느껴지는 점들이 있긴 했지만, 그다지 문화충격을 경험하지는 못했습니다. 핀란드인들은 대부분 영어를 잘 구사하고, 무척 친절하기 때문에 생활하는 데 문제가 생기는 일은 거의 없다고 생각합니다. 같은 기숙사에 살고 있는 친구들이 세계 각국에서 모인 교환학생들인 경우가 많으므로 다양한 문화를 접해볼 수 있습니다.",캠퍼스에 국제처가 있어서 도움을 청하면 친절하게 도와줍니다. 기숙사와 아주 가까운 곳에 메디컬 센터도 있으므로 건강에 이상이 있으면 바로 찾아가 진료를 받을 수 있습니다.,
