gen_info,env_info,food_info,study_info,office_info,facil_info,mhct_info,help_info,etc_info
"요엔수는 헬싱키 공항에서 SR이라는 기차를 타고 4-5시간을 달려야 도착할 수 있는 도시입니다. 헬싱키보다 북쪽에 있기 때문에 겨울이 더 일찍 옵니다. 그렇기때문에2학기에 오시는 분들은 요엔수에 도착한 후 9월 즈음의 화창하고 맑은 날씨를 충분히 즐기시기를 추천합니다. 추위에 대한 소문은 익히 들어 다들 철저하게 대비해오는 것 같습니다. 반면, 10월 이후 해가 일찍 지는 것은 매일 겪어도 놀라운 일이었습니다. 1시쯤 점심을 먹고 점심 설거지를 하다 보면 창문 너머로 해가 지는 것을 볼 수 있습니다. 익숙해진 뒤에는 그 시간에 친구들과 호수에 가서 선셋을 즐겼지만, 처음에는 기상한 지 몇 시간 만에 하루가 끝나는 것 같아 아쉽기도 했습니다. 이러한 계절의 변화를 대비하여, 비타민 D를 꾸준히 챙겨 드시고 깜깜해진 하루의 나머지를 혼자 보내기보다는 친구들과 다양한 실내 활동을 통해 채워가기를 추천합니다. University of Eastern Finland(Joensuu Campus)는 건물 간 간격이 좁은 소규모의 캠퍼스입니다. 제 경우에는 연강이 전혀 없기도 했고, 건물 간 이동도 등교할 때 타고 온 자전거로 움직였기 때문에 캠퍼스 내 이동의 어려움은 없었습니다.","Joensuu는 대학교가 위치한 City Center가 중심이 되고 그 주변에 주거 지역들이 자리한 구조입니다. City Center는 규모는 작지만 복합 쇼핑몰, 마트, 미술관, 영화관, 펍, 클럽, 도서관, 식당, 약국, 자전거 대여점 등 없는 것이 없는 말 그대로 번화가입니다. City Center에서 북쪽으로 조금 올라가면 창고형 세컨핸드샵과 Prisma나Lidl 같은 대형 마트가 있고, City Center 동쪽으로 흐르고 있는 강을 건너면 SR을 탈 수 있는 기차역과 광역 버스를 탈 수 있는 버스 정류장이 있습니다.","University of Eastern Finland는 기숙사를 따로 제공하지 않고, 학교에서 중개해주는 Joensuu Elli 라는 Housing 담당 기관을 통해 아파트를 배정받을 수 있습니다. 해당 사이트에서 거주하고자 하는 지역, 아파트 형태, 비용 등을 고려하여 2-3지망 아파트를 신청하면 그 중에서 배정받는 시스템입니다. 교환학생들은 보통 가구가 포함되어있는, Flat 형태의 아파트를 선택하기 때문에 주로 Karjamaentie 또는 Latolankatu에 모여 살게 됩니다. 월세는 가구가 포함된 Karjamaentie 3인 플랫 기준으로 약 30만원이었습니다. 두 지역의 분위기에 대한 평가는 매 학기 달라지기 때문에 특정 학기에 대한 평가에 의지하여 선택하기 보다는, 위치나 주변 시설을 고려하여 선택하시는 것을 추천합니다. 제가 살았던 당시의 Karjamaentie는 비교적 조용한 편이었고 소음 문제도 전혀 없었습니다. 3인 플랫 구조는 개인 방 3개에 부엌과 샤워실, 화장실을 공유하는 형태입니다. 개인 방은 생각보다 많이 커서 가져온 짐을 전부 풀어도 비어 보였습니다. 또한 제 경우에는 3인 플랫에서 1명이 사정상 첫 달에 본국으로 돌아가고 다른 플랫 메이트도 여행으로 집을 비우는 경우가 많아서 저는 거의 혼자 살다시피 했습니다. 그래서 친구들을 집에 초대하거나 친구네 집에 놀러가서 같이 밥을 먹는 경우가 많았습니다. 요리를 좋아하기도 했지만 외식을 자주 하기에는 경제적인 부담이 커서 거의 직접 요리를 해먹었습니다. Karjamaentie에서 자전거 10분 거리에 K-Market과 S-Market이 있습니다. 상품에 따라 두 마트 간의 가격 차이가 날 수 있기 때문에 번갈아 방문하며 가격을 비교하면 같은 제품도 저렴하게 구입할 수 있습니다. 일반적으로 감자, 채소(녹색 채소 제외)나 과일, 육류는 우리나라 마트에 비해 훨씬 저렴하지만 과자와 같은 공산품이나 해산물은 비쌉니다. 그래서 주로 돼지고기, 닭고기, 채소들을 구입해서 한국에서 가져온 각종 양념으로 한국 음식을 자주 해먹었습니다. 야채나 과일의 경우, 포장되어 있는 것도 있지만 보통 직접 필요한 개수만큼 담아 저울에 달고 직접 가격표를 붙여서 구매합니다. City Center에 아시아 식료품점도 있어서 그곳에서 김치나 한국 양념들을 구입할 수는 있으나 가격이 비싸고 종류가 다양하지 않기 때문에 챙겨오는 것을 추천합니다. Karjamaentie에서 학교까지는 자전거로 30분정도 걸리고 길의 경사가 큰 편입니다. 대부분의 학생들이 자전거를 타고 이동할 텐데Joensuu에는 자전거 대여점이 한 곳밖에 없기 때문에 도착한 후 최대한 빨리 자전거를 대여하시길 추천합니다. 대여하지 못할 경우 페이스북 중고 거래를 통해 구매해야 하는데 경쟁이 치열하고 자전거의 상태를 확인하는 것이 꽤 번거롭습니다. 그밖에 자전거를 타는 게 능숙하지 않거나 겨울에 땅이 얼어서 자전거를 타기 어려운 경우에는 버스를 이용할 수 있습니다. 버스 요금은 Zone 구분에 따라 가격이 달라지며, 보통 집에서 학교까지의 거리는 편도 약 2.3유로로 이용 가능합니다. 요금이 비싸기 때문에 버스 카드를 이용하여 할인을 받았습니다. 충전 식으로 사용할 경우 편도 2유로이고, 한 달 이용권으로 사용할 경우 50유로를 내고 한 달간 무제한 이용 가능합니다. 버스 도착 시간은 학교에서 사용하는 Tuudo 어플로 확인할 수 있습니다. 가장 좋았던 시설은 아파트 단지 내 공용 사우나입니다. 평소에는 예약을 통해 비용을 지불하고 이용하지만, 매주 특정 요일, 특정 시간에는 무료로 개방하기 때문에 자유롭게 이용할 수 있습니다. 남녀 이용시간이 구분되어 있고, 건물마다 이용 시간이 다르기 때문에 Joensuu Elli 사이트에서 확인해야 합니다.","제가 수강한 수업은 다음과 같습니다. - Trends in Theoretical Thinking: 사회과학 분과의 속한 다양한 분야에서 통용되는 이론적 사고에 대해 배울 수 있는 수업입니다. 매 수업마다 다른 교수님께서 수업을 진행하시지만, 이 수업을 총괄하시는 교수님이 따로 계십니다. 수업 자료나 시험, 출결에 대한 문의는 담당 교수님께 하면 됩니다. 각 교수님께서 사용하시는 PPT에 기반하여 서술형 문제가 출제되기 때문에 시험 준비를 하기 편하고, 출결은 평가 항목이 아닙니다. 수업을 듣고 Course diary를 작성하는 것이 3 Credit, 시험을 치는 것이 2 Credit, 총 5 Credit을 받을 수 있는 수업입니다. Course diary는 사회학과에서 자주 작성하는 쪽글과 유사한 개념입니다. - Methodological Approaches in the Social Sciences: 이 수업의 운영방식은 상기한 과목과 동일하며 내용만 다릅니다. 사회과학 분과의 여러 분야에서 사용하는 방법론적 접근에 대해 배울 수 있는 수업입니다. 두 수업 모두 사회과학의 다채로운 군상과 이를 바라보는 시각의 다양성을 접할 수 있다는 점에서 의미 있는 수업이었습니다. - Basics of Finnish Music Education: 핀란드 초등학교 음악 수업 방식대로 음악 수업을 직접 받으면서 핀란드의 음악 교육이 어떻게 이루어지는 배울 수 있는 수업입니다. 매 수업마다 다양한 악기를 사용하여 수강생들과 합주를 하거나 핀란드 전통 동요에 맞춰 춤을 추었습니다. 시험이 없어 필기를 할 필요도 없고 과제는 핀란드의 학교의 음악 수업을 관찰하고 보고서를 작정하는 것이 전부라 수업시간을 어린 아이가 된 것처럼 마음 편히 즐길 수 있었습니다. 살면서 들을 수 있는 몇 안되는 행복한 수업이었기 때문에 다른 교환학생 분들에게도 추천합니다. - Survival Finnish: 말 그대로 생존에 필요한 수준의 핀란드어를 배우는 수업입니다. 인사말과 일상 생활에 유용한 단어들을 배울 수 있습니다. 수업 내용은 복잡한 동사 변형때문에 다소 어렵게 느껴질 수 있지만, 시험은 오픈 북, 온라인 시험인 데다 내용도 평이합니다. 수업을 듣고 난 뒤 마트에서 번역기를 사용하는 횟수도 줄고 마트 직원분들에게 능숙하게 인사하는 제 자신을 보며 뿌듯했습니다. 도서관은 좌석 개수가 적어 시험기간에 보통 만석이고 컴퓨터 좌석은 특히 늘 만석입니다. 도서 보유량도 많지 않아 수업에 필요한 자료가 있다면 최대한 빨리 확보하는 것이 좋습니다. 도서관 카드로 한 학기 100장 이상의 무료 프린트도 가능합니다. 프린트 사용에 문제가 있으면 도서관 내 IT 서비스 데스크에 문의하면 됩니다.",학교 들어서자마자 가장 앞쪽에 있는 Aurora 빌딩 1층에서 대부분의 일 처리가 가능합니다. 등교 첫 날 각종 서류 처리할 때와 출국 전 서류를 제출하러 간 것 외에는 방문할 일이 없었습니다. 출국 시기 임박해서는 사무실 휴가 일정과 겹칠 수 있으니 공지를 잘 확인하셔야 합니다.,학교 시설과 프로그램에 대한 전반적인 소개는 학기 초 오리엔테이션 시간에 이루어집니다. 그 밖의 학교 학생회와 ESN에서 주최하는 행사들에 대한 정보는 페이스북을 통해 공지되거나 화요일마다 한 주의 행사와 소식을 전달해주는 메일을 통해 확인할 수 있습니다. 흥미로운 행사들이 많으니 수시로 확인하고 다양한 모임에 참여하는 것을 추천합니다.,"문화 충격보다 오히려 핀란드 사람들에 대한 편견을 깰 수 있었습니다. 무뚝뚝하다는 통념과 달리 제가 만난 모든 핀란드 사람들은 친절했습니다. 트렌치 코트의 허리끈이 자전거에 걸려 움직일 수 없었을 때 먼저 다가오셔서 도와주신 할머니, 짐을 정리하기 위해 박스를 구하러 다닐 때 가장 큰 박스를 찾아주려 애쓰던 마트 직원들이 기억납니다. 게다가 핀란드인 모두가 영어를 유창하게 한다는 것이 인상적이었고 동시에 그들이 받는 효과적인 영어 교육이 부러웠습니다.","튜터에게 가장 도움을 많이 받았고, 다른 교환학생 친구들에게도 정보를 많이 얻었습니다. 학교나 학생 연합에 이메일로 문의하는 것도 좋습니다. 일 처리가 오래 걸릴 거라는 예상과 달리, 대체로 빠른 답변을 받았습니다.","여유로운 요엔수에서의 삶이 단조롭다고 느껴질 수도 있습니다. 아무리 혼자만의 시간을 좋아한다고 해도 어느 순간이 되면 권태로워질 수 있고, 활력 넘치는 교환 생활을 꿈꾸고 오셨다면 더욱 그럴 수 있습니다. 그렇기때문에 이왕 교환학생이라는 큰 결심을 하고 요엔수에 오셨다면, 자신의 교환 생활을 알록달록하게 꾸며나가길 바랍니다. 요엔수는 아무것도 하지 않고 혼자 보내기엔 너무 조용한 곳입니다. 날이 좋다면 맥주 한 캔 사 들고 친구들과 노을을 보러 나가시고, 저녁 식사에 친구들을 초대해서 한국 음식도 해주시고, 파티가 있다고 하면 여기저기 따라가보세요. 저는 캘린더에 매일 하나의 특별한 일정을 추가하여 매일을 특별하게 보내려고 했습니다. 알아듣지 못한 영화를 보기도 하고, 다른 튜터 팀의 할로윈 파티에 초대받아 놀러가기도 하고, 케이크가 맛있다는 카페에 가보기도 했어요. 한국을 향한 향수는 누구나 조금씩 있겠지만, 이렇게 열심히 놀러 다닌 덕분에 우울하다고 느꼈던 적은 없었습니다. 짧은 낮에는 햇빛과 자연의 소중함을 느끼시고, 긴 밤은 좋은 사람들과 좋은 시간으로 채우길 바랍니다.*annakim0585@naver.com"
"핀란드인 수도인 헬싱키에서 기차로 네시간 떨어져있는 평화로운 도시입니다. 헬싱키 보다는 조금 춥고 10월부터 눈이 내립니다. Joensuu 라는 도시에 위치한 학교로 city center 라는 시내가 존재하며 이곳에서 쇼핑, 음식등을 먹을 수 있습니다. 이곳은 한적한 동네로 대부분 사람들은 5층 정도의 빌딩 또는 주택에서 생활하고 있으며 나무와 강등이 대부분을 이루고 있는 조용하고 아름다운 곳입니다.","대학교에서 5분 정도 걸어가면 city center라 불리는 시내가 있는데 이곳에는 펍, 빈티지 샵, 도서관, 쇼핑몰, 음식점, 자전거 대여소, 영화관등이 있습니다. 시티 센터는 걸어서 30분 정도면 한 바퀴를 돌아볼 수 있을 정도의 크기이며 자전거를 타면 10 분 정도에 둘러볼 수 있습니다. 시티센터 주변으로 강이 흐르고 있는데 강가에는 자전거를 탈 수 있는 길이 따로 나있어 이곳에서 자전거를 타며 풍경을 감상하곤 했습니다. 시티센터에서 자전거를 타고 나오면 다른 빈티지 가게, prisma 라는 큰 마트, 공동묘지, 성당, abc 마트 등이 있습니다.","핀란드는 housing 이라는 제도를 통해서 집을 직접 구해야 하는데, 대학교에 합격했다는 통지를 받으면 학교에서 housing 을 신청할 수 있는 사이트를 제공해 줍니다. elli 라는 곳에서 housing 을 담당하고 있으며 인터넷으로 월세비용, 크기 등을 고려하여 신청이 가능 합니다. 그리고 신청이 완료되면 elli 에서 메일을 보내 deposit 금액을 요청하는데 이경우에 먼저 돈을 입금하면 됩니다. 제가 살았던 곳은 latolankatu 라는 곳이었는데 이곳은 교환학생들이 대부분 모여 살고 자전거를 타고 학교까지 15-20 분 정도 걸리는 살기 좋은 곳이었습니다. 주변에 s - market, k -market 이 존재하고 테니스장, 강가 등이 있습니다. latolanktu 에는 수요일 한번 사우나를 공짜로 이용할 수 있는 시설이 있어서 좋았습니다. 3명이 한 아파트에 살았으며 개인 방을 사용하고 화장실과 부엌은 공유를 합니다. 한달에 30-35 만원 정도를 냈던것 같고 다른 비용은 부담하지 않았습니다. 대신 열쇠를 가지고 다녀야 했던 점이 조금 불편했던것 같습니다. 학교에서 오기전에 튜터를 배정해주는데, 튜터가 elli 에 가서 먼저 열쇠를 찾아 주는 경우도 있지만 찾아주지 않는 경우 직접 elli 에 가서 열쇠를 수령해야 합니다. 월세를 내는 방법은 , Elli 에 가서 매달 월세를 내고 싶다고 말하고, 바코드가 담긴 종이를 받은 뒤 city center 에 위치한 곳에 가서 납부를 하면됩니다 (이름이 기억이 나지 않으니 elli 에 가서 물어보시면 될것 같습니다 ㅜㅜ ) 가장 먼저 하셔야 할 일은 자전거를 빌리고 교통카드를 사는 일인데, 아마 학교에서 학생회에 가입하라는 메일을 보내고 돈을 지불하고 신청하고 난뒤 학교에 도착하면 survival package 를 수령할 수 있을것입니다. 그때 자전거를 빌릴 수 있는 주소가 적힌 종이를 주는데 그곳에 가서 자전거를 빌리면 됩니다. 1학기에 35 유로 정도의 가격을 내고 빌렸으며 교통편이 편리하지 않은 joensuu 에서 자전거는 필수품이었습니다. 또는 페이스북에서 자전거 거래를 할 수도 있습니다.교통편은 그리 편리하지 않았는데, 버스는 1시간에 2대 정도가 운행을 하였으며 어플을 다운받고 학생 번호를 입력하면 버스가 언제 도착하는지 알 수 있었습니다. 어플이 없는 경우 버스정류장에 버스가 도착하는 시간이 언제인지 부착되어 있으니 사진을 찍어 사용하시면 될 것 같습니다. 교통비는 한달에 44유로 정도로 처음 교통카드를 사면 교통카드 비용을 포함해서 50 유로가 조금 넘었던것 같습니다. 12시 정도에 막차가 끊기며 택시를 한번 타면 5분 정도에 16유로로 매우 비쌌습니다 ㅜㅜ 되도록이면 버스나 자전거를 이용하시기 바랍니다. 자전거로 5분 걸어서 10 분정도 가면 마트가 나오는데 외식할 수 있는 곳이 많이 없는 요엔수에서는 거의 음식을 해먹었습니다. 고기와 야채 값이 매우 저렴합니다. 핀란드에서는 야채나 과일을 사기 위해서는 비닐봉투에 원하는 만큼 담고 저울에 올려놓은 뒤 각각의 물품 번호를 누르면 가격이 적힌 스티커가 출력되는 방법을 사용합니다. 도시에 아시아 마트는 city center 로 나가는 경우에만 갈 수 있었으며 1개 정도 있었던것 같습니다",수업은 거의 없었고 도서관 시설은 매우 좋은 편이었습니다. 수업은 대부분 책을 읽고 학생들과 토론하는 형식으로 이루어 졌고 보고서를 썼습니다. 도서관에서 제공하는 학식은 학생증을 보면 할인을 해주었고 빵이나 버터는 무제한으로 이용해 먹을 수 있었습니다. 도서관은 6시 이후에는 이용할 수 없었지만 한학기에 40유로를 내고 도서관 키를 대여하면 6시이후부터 새벽까지 계속 이용할 수 있었습니다. 나중에 키를 반납하면 40유로를 돌려주므로 이용하면 좋을 것 같습니다.,국제 교육부는 매우 친절했으며 일처리가 다른 곳에 비해 빠릅니다. 다만 주기적으로 업무를 쉬곤 하니 잘 확인해서 가시길 바랍니다,"종종 교환학생을 위한 행사를 학생회에서 주최하곤 하는데 할로윈 파티, 교환학생 환영 파티 등을 열어 도시 전체를 돌아다니며 미션을 수행하고, 도장을 받으며 도시에 있는 술집을 돌아다니며 도장을 받거나, 교환학생들만 모여 할로윈 파티를 수행하거나 종종 홈파티를 하곤 했습니다. 특히나 latolankatu 에 살았을 때 매일 교환학생들의 초대를 받아 홈파티에 놀러가서 다양한 나라의 외국인 친구들과 음식을 해먹으며 놀곤 했습니다.",culture shock 은 거의 없었습니다. 도시가 매우 작고 유흥시설이 없었기에 조용하고 평안한 분위기에서 쉬고 올 수 있었습니다. 다만 조금 힘들었던 것은 대중교통이 그리 편리하지 않았다는점과 10월부터 눈이오며 12월이 되면 매우 추워진다는 점입니다. 전기장판을 가지고 가면 매우 좋을 것 같습니다.,,
