gen_info,env_info,food_info,study_info,office_info,facil_info,mhct_info,help_info,etc_info
"지도를 찾아보면 알겠지만, 핀란드는 러시아, 스웨덴, 노르웨이와 국경을 같이 하고 있다. 한때 스웨덴, 러시아에 각각 종속됐던 적이 있어서 핀란드 곳곳에서 그 흔적들을 찾을 수 있다. 꾸오피오Kuopio는, 핀란드 동부-중부에 위치한 도시로, 가장 최근에 위키피디아에서 찾아본 결과 핀란드내 8,9번째로 큰 도시라고 한다. 하지만 인구밀도가 높은 우리나라와는 달리, 일단 국가 면적도 넓고 인구가 그렇게 많지 않아 큰 도시라는 생각은 들지 않는다. 수도인 헬싱키까지는 기차로 4,5시간은 걸린다. 서울-부산간 거리보다 약간 멀다. 핀란드에서 눈 없는 생활을 상상하기는 힘들다. 물론 봄, 여름, 가을도 있고 그런 계절의 날들도 화창하고 좋긴 하지만, 일년에 몇 개월 되지 않는 듯 하다. 빠르면 11월부터 눈이 내리기 시작해서 늦게는 4월까지는 오는 것 같다. 봄-여름의 날씨는 정말 화창하고 맑고 좋다. 위도가 높다보니 여름이 다가올 수록 해가 늦게 지는데, 5월 중순에는 자정까지도 날이 어슴푸레하게 밝은 것을 볼 수 있었다. 다녀온 UKU(University of Kuopio, 이제는 근처 지역의 대학들과 통합돼 University of Eastern Finland의 Kuopio 캠퍼스가 되었다.)는 꾸오피오 시내에서 자전거로 20분 정도의 거리에 있다.","UKU의 주변에는 먼저 대학병원이 있고, 도보로 5-10분 정도의 거리에 Prisma라는 대형마트가 있다. 그 외에는 주변에 학교 건물들 뿐이다.","외국인 학생들을 포함해서, 꾸오피오 거주 학생들은 Kuopas꾸오파스라는 시 운영의 학생임대아파트에서 아파트를 배정받아 거주한다. 교환학생들은 주로 Puijonlakso뿌욘락손, Sarkiniemi쌀끼니에미, Neulamaki네울라마끼라는 동네에서 산다. 모두 학교 주변에 위치해있다. Puijonlakso 동네는 건물이 깨끗하고 넓지만 대신에 임대료가 약간 비싸며 학교 앞 대학병원 근처에 있고, Sarkiniemi의 건물도 깨끗하지만, Puijonlakson의 건물보다는 좁고 싸며, 학교에서 Sarkiniemi로 가는 길목에 언덕이 없다는 것이 장점이다. Neulamaki는 셋 중에서 건물이 가장 오래돼 보이고, 임대료가 싸고, 학교에서 Neulamaki로 가는 중에 언덕을 올라야 한다는 안타까운 일이 있지만, 교환학생들이 다른 두 곳에 비해 좀 많다. 가끔 운 없는 학생들은 핀란드에서 제일 크다는 Raunalahti라우나라띠 근처로 배정받는데, 시내/학교에서 모두 멀다. 

식사는 보통 학교 식당에서 해결한다. Snellmania, Canthia, mediteknia, medistudia 등 여러 동이 있는데, 각 건물마다 하나씩은 식당이 있고, 없으면 샌드위치나 음료, Pulla뿔라 등을 파는 매점이 있어서 간단히 끼니를 해결 할 수 있다. 학교 식당은 학생증 소지시 2 유로로, 학생증이 없을때면 그 배가 되는 가격을 내야 한다고 들었다. 그리고 이 학생증은 다른 도시의 학생식당을 가도 쓸 수 있다고 한다. 식당 메뉴는 빵, 샐러드, 주 메뉴 2-3가지, 음료로 이루어져 있고 채식주의자를 위한 식단도 갖춰져 있어서 입맛에 따라 먹을 수 있어 좋았다. 나는 따로 집에서 채소를 챙겨먹지 않아서 학교 식당에 가서 샐러드만 왕창 퍼서 먹곤 했다. 학교 식당은 오전 10시 부터 오후 3시까지로, 아침-점심-저녁 모두 해결할 수 있는 한국의 학교 식당과는 달라 처음에는 오후 늦게 끝나는 수업을 듣고는 배가 고파서 밥을 먹으려 했지만 식당 문이 닫혀 있어 낭패를 본 적도 있었다. 

학교 식당외에서 끼니를 해결하는 경우는, 시내에 나가서 외식을 하지 않는 이상 보통 집에서 해결한다. 학생들이 사는 곳이 아파트 형태라 거실, 주방, 화장실, 창고 들이 다 갖춰져 있다. 슈퍼나 대형마트에 가면 쌀을 구할 수 있어서 냄비나 한국에서 공수해 온 전기밥솥으로 밥을 해 먹을 수도 있고, 역시 부모님들이 부쳐주시는 김치, 조미료 등등으로 한국식 밥상을 차려 먹을 수 있다. 나는 굳이 한국식으로 밥을 먹어야 겠다는 생각이 없어서 유럽친구들이 어떻게 해먹나 보고 따라해서 먹거나, 창의력을 발휘해서 나만의 음식을 개발해 만들어 먹기도 했다.","1년 동안 지내면서 제일 신기했던 점이 수업이었다. 수업은, 우리나라 처럼 한 시기에 모든 수업이 시작되는 것이 아니고, 수업 시작하는 날짜/끝나는 날짜가 제각각이고, 수업도 짧게는 하루에 6시간 연강으로 종강하기도 하고, 일주일, 한달, 혹은 학기내내로 진행돼서 시간표를 짜다가 적게는 일주일, 많게는 한달 정도 시간이 남는 경우를 봤다. 그렇게 남는 시간에는 교환학생 친구들은 보통 집에 다녀오거나, 고향에서 친구가 놀러와서 같이 핀란드를 여행한다던가 했다. 이것은 교환학생 친구들 이야기고, 알던 핀란드인 친구는, 학기내내 수업이 없이 자신이 책을 읽고 집에서 공부하고 시험치는 강의를 들어서 학교에 나오는 일이 없었다. 그리고 인터넷 강의도 잘 돼 있어서, 동영상 강의를 듣기만 하고 시험치고 끝이 아니라, 매주 주어진 과제를 완성해서 제출하고, 수시 때때로 퀴즈를 보고, 최종 에세이를 써내기도 하고, 웹상에서 그 수업을 듣는 학생들과 게시판으로 주어진 문제에 대해 토의하기도 하는 등 요구하는 것이 많았다. 한국에서 대학수업으로 인터넷 강의를 들어보질 않아서 정확히 한국이 어떤지는 모르겠으나, 경험자들에게서 듣던 한국식 인터넷 강의와는 달라 신기했고, 좀 더 배울것이 많고 내가 찾아서 해야하는 것이 많아서, 그 수업을 듣는 과정은 힘들었지만 성취감은 높아서 좋았다.","특이 사항으로는, 현재 국제교육부 직원분들 중 2,3분이 출산휴가로 자리에 없다는 것과, 근무시간이 아주 짧다. 오전 10시부터 오후 1시까지는 학생 상담이 가능하지만 그 이후로는 문을 닫고 학생상담외 업무를 본다. 그리고 일주일 내내 학생상담이 가능한 것도 아니고, 월-금 중 하루는 쉰다. 가끔 근무 시간을 잘 숙지하지(?) 못해 헛걸음을 하기도 하지만, 가면 직원분들은 친절하게 학생들을 대해 주신다.","부대시설로는, 15에서 20유로 정도의 보증금을 주고 사용할 수 있는 24시간 개방 컴퓨터실이 있고, Studentia스튜던띠아라는 건물은 사우나, 운동기구 등이 있어 원하는 학생들은 운동을 할 수도 있다. 그리고 일주일내내 요가, 스트레칭, 태권도, 검도 등 여러 운동을 배울 수 있는 스케줄 표도 있어서 원하는 운동을 배워 볼 수도 있다. 종목에 따라 무료/유료 강좌가 있다. 

동아리는 KISA(Kuopio International Student Association)라는 것이 있다. international이라는 단어가 들어가지만, 핀란드 학생도 가입 가능하고, 교환학생들의 경우 KISA메일링을 신청하면 KISA키사가 주관하는 여러 행사들에 대해 알 수 있고 참여할 수 있다. 때로는 KISA에서 교환학생들을 위해 라플란드, 스웨덴의 스톡홀름, 에스토니아의 탈린, 러시아의 상트페테르부르크로 가는 여행을 조직한다. 나는 개인적으로 친구들과 러시아의 상트페테르부르크를 제외하고는 다 다녀와서 키사 트립을 가지 않았지만, 다녀온 친구들의 말로는 재밌었다고 한다. 

UKU의 학생들은 학교 학사관리시스템에 접속할 수 있는 아이디와 비밀번호를 부여받는데, 이것을 가지고 학교 곳곳에 설치돼 있는 컴퓨터를 이용할 수 있다.","공중전화가 없다는 것이 은근 큰 충격이었다. 처음 도착했을 때 나를 마중나올 사람과 연락이 안돼서 연락을 해야 하는데 공중전화가 없어서 발만 동동 굴렀던 일이 있었다. 한국도 공중전화가 점점 없어지고 있긴 하지만, 아예 없지는 않으니깐 좀 놀라웠다. 

상점이 문을 늦게 열고, 일찍 닫는 것. 가기전에 핀란드 공부를 하겠다고 여러 책을 읽어봤지만, 이런 내용은 나오지 않아서 당황했다. 배는 고프고 냉장고에 음식은 하나 없는 늦은 밤, 집 앞 마트에 갔지만 마트는 문이 닫혀 있고, 우리나라에서는 24시간 운영 편의점이지만 그곳에서는 10시면 문을 닫는 편의점이 있었다. 공휴일이면 꼬박꼬박 문을 닫는 상점들, 우리나라에서는 공휴일이래도 대형마트는 문을 닫는 걸 본 적이 없어서, 문 닫을 시간이 아닌데 문이 닫힌 대형 마트를 보며 황당했었다. 핀란드로 가시는 분들, 집 앞 국기 게양대에 핀란드 국기가 걸리면 그 날은 상점이 문을 닫는 날이다.","International office에서 교환학생들에게 tutor를 짝지어준다. 핀란드 학생들로, 이들은 정착 초반에 은행계좌 여는 것, 시내 관광등 여러 도움을 준다. 꾸준히 연락 가능한 튜터도 있지만, 처음에만 보고 그 이후로는 얼굴을 볼 수 없는 튜터도 있다. 하지만 대체로 이것저것 궁금한 것이나 도움이 필요한 일이 생겨서 튜터에게 도움을 청하면 도와줄 것이다. International office에 가도 도와주고, 관광/여행 자료나 꾸오피오 시내 상점등에 대해 궁금한게 생기면 꾸오피오 시내의 tourist information을 가면 된다.",
