gen_info,env_info,food_info,study_info,office_info,facil_info,mhct_info,help_info,etc_info
"University of Eastern Finland(이하 UEF)는 Kuopio, Joensuu, Savonlinna의 세 지역에 있는 캠퍼스로 이루어져 있는데, 그 중에서도 제가 있었던 Joensuu(요엔수)는 거의 러시아와 국경을 맞대고 있을 만큼 정말 핀란드의 동부에 위치하고 있습니다. 사실 요엔수는 헬싱키에서 기차를 타고 네시간 정도 걸리는 등 지리적으로 여행 다니기 좋은 위치에 있지는 않습니다. 하지만 학기 중에 학교에서 러시아 여행, 스웨덴 여행이나 산타마을이 위치한 핀란드 북부의 라플란드 지역 여행 등을 기획하기 때문에 원한다면 다양한 경험을 할 수 있습니다.

저는 요엔수에 8월 말에 도착했는데, 9월 중순 정도까지는 날씨도 맑고 선선하고 해도 길었으나 10월 초에는 첫눈이 오는 등 갑작스레 추워졌습니다. 11월달에는 본격적으로 눈이 오기 시작하여 11월 말에는 영하 22도까지 떨어졌습니다. 온도계를 보고 놀라긴 했지만 사실 체감온도는 영하 10도정도로 서울보다 그렇게 춥다고 느끼지는 않았던 것 같습니다. 또 이쯤 되어서는 해도 세네시쯤이면 져서 금방 어두워졌습니다.","요엔수는 핀란드어로 ''강의 입구''라는 뜻이라고 하는데, 실제로 곳곳에서 큰 호수들을 볼 수 있으며 또 숲도 굉장히 많습니다. 수도인 헬싱키도 서울에 비해서는 작고 조용한만큼, 요엔수는 요엔수 사람들 스스로도 ‘city’라고 불러도 되는지 모르겠다고 우스갯소리로 말할 만큼 작고 평화로운 도시입니다. 사실 심심할 수도 있지만, 그만큼 교환학생들끼리 파티도 많이 열고 국제교육처에서도 다양한 프로그램을 제공하려고 노력하기 때문에 찾아본다면 얼마든지 알차고 즐겁게 보낼 수 있는 것 같습니다.","교환학생들은 대부분 Joensuu Elli라는 중개업체를 통해 방을 구하게 됩니다. 저도 지원할 때는 주로 학교에서 가까운 Niinivara 등을 신청했지만 나중에 보니 교환학생들은 대부분 Karjamaentie, Latolankatu, Noljakka와 같이 학교에서 4~5km 정도 멀리 떨어진 곳에 배정받았습니다. 저는 karjamaentie에 살았는데, Elli의 대부분의 집들은 한 집에 세 명이 각각 방을 따로 쓰고 부엌, 화장실과 샤워실을 공유하는 식이었습니다. 
이외에 2013년 2학기에 문을 연 city center에 위치한 Riverside Residence라는 곳이 있었는데 정보가 없어 신청을 못했었습니다. 하지만 학기 중에 제일 부러웠던 학생들이 Riverside Residence에 사는 학생들이었습니다. 일단 요엔수는 대중교통비가 굉장히 비쌉니다. 학생 할인도 거의 되지 않아서 버스를 한 번 탈때는 3.3유로를 내야하기 때문에 대부분의 학생들은 비가 오나 눈이 오나 20~30분정도 자전거를 타고 통학했습니다. Karjamaentie도 좋았지만, Riverside Residence는 지리적으로도 좋은 위치에 있을 뿐만 아니라 공용 부엌에서 자주 파티가 열려 서로 친해지기도 좋았습니다. 동시에 조금 시끄러울 수도 있다는 단점이 있지만 이를 제외하고는 괜찮은 것 같습니다. 

식사의 경우에는 대부분 학교 카페테리아에 가거나 집에서 직접 요리를 해먹었습니다. 외식비가 굉장히 비싸고 맛도 별로 없었기 때문에 주로 장을 봐서 요리를 하는 식이었습니다. 일단 학교 카페테리아는 학생증이 있으면 메인 메뉴에 샐러드와 빵을 무제한으로, 저렴하게 먹을 수 있습니다. 요엔수가 교통비와 외식비는 비쌌지만 막상 마트에서 장을 보는 것은 한국과 별로 차이가 나지 않거나 오히려 과일이나 유제품과 같은 경우 더 쌀 때도 있었습니다. 또 요엔수에 아시안 마켓이 있다는 것을 늦게 알았는데, 한국 음식으로는 캔김치를 약 사천원, 신라면을 이천원 정도로 살 수 있습니다.","핀란드 대학의 수업 형태는 굉장히 다양해서 우리처럼 고정된 일주일 시간표를 가지고 그에 따라 수업을 들으러 다니는 것이 불가능합니다. 심지어 매 수업마다 강의 시간이나 강의실이 바뀌는 경우도 비일비재해서 반드시 수업 듣기 전에 다시 한번 확인해야 했습니다. 사실 제가 들었던 영문과 수업들은 한국에서처럼 거의 9월에 시작해서 12월 초에 끝났지만, 다른 친구들의 수업들을 보면 혼자 책 몇권을 읽고 레포트를 제출하는 것으로 수업이 끝나 학교에 한번도 갈 필요가 없는 수업도 있었고, 또 한달동안 집중적으로 수업을 해서 예를 들어 수업이 10월 초에 시작해서 10월 말에 끝나는 등 한국에서는 볼 수 없는 형태의 수업들이 많았습니다. 저는 전공 외에 Survival Finnish라는 한학기 교환학생을 대상으로 한 핀란드어 수업을 들었는데, 기본적인 핀란드어 회화를 배울 수 있기도 했지만 다양한 전공의 친구들을 만날 수 있어서 좋았습니다.

또 교수님들께서 학생들의 사정을 잘 배려해주십니다. 유럽 대학들은 ECTS라는 우리와는 다른 학점 체계를 사용합니다. 6ECTS가 우리나라 학점체계로는 대락 3학점정도인데, 대체로 제가 들은 핀란드 수업들은 4~5ECTS로 본교에서 학점을 인정받기에 애매했기 때문에 교수님께 말씀드렸더니 추가 레포트 등을 통해 추가로 1~2ECTS를 더 받게 해주셨습니다. 또 시험 성적이 마음에 안들 경우 얼마든지 다시 칠 수 있는데, 러시아 여행 등이 시험과 겹쳤을 경우에도 시험을 다시 치게 해주셔서 시험에 대한 부담은 별로 없었습니다.","UEF에는 ESN Joensuu 등 교환학생들을 위한 다양한 단체가 있는데, 저도 한 학기 동안 많은 도움을 받았습니다. 일단 학기가 시작하기 전에 학교에서 교환학생들에게 튜터를 배정해줍니다. 튜터 한 명에 여섯 명에서 여덟 명 정도의 튜티가 배정되게 되는데, 튜터는 튜티가 핀란드에 도착하기 전부터 개인적으로 친해져서 핀란드 생활에 적응할 수 있게 도와줄 뿐만 아니라 핸드폰, 은행 계좌와 같은 실용적인 문제 등을 해결하는 데도 도움을 줍니다. 튜터에 따라 다르기는 하지만 튜티들끼리 친해질 수 있도록 주기적으로 튜티들끼리의 모임을 주선하는 튜터들도 있었습니다. 그리고 Student Union에서는 Survival Package라고 해서 이불커버, 냄비 등 한 학기 동안 쓰려고 사기는 부담스러운 것들을 보증금과 약간의 사용료를 받고 빌려주는데 유용하게 잘 쓸 수 있었습니다. 

이런 실용적인 것들뿐만 아니라 ESN Joensuu에서는 Get to Know Each Other Party와 같은 교환학생들을 대상으로 한 파티들이나 볼링과 같은 스포츠 모임들도 자주 주최해서 교환학생들끼리 만나는 기회를 제공해줍니다. 또 위에서 적은 것처럼 국내외 여행도 주최하기 때문에, 평소에는 조금 가기 힘든 나라들을 학기 중에 다녀올 수 있습니다. 특히 할로윈 때는 다른 지역의 ESN과 연합해 스톡홀름으로의 여행 프로그램을 개설해서, 핀란드 다른 지역들의 교환학생들과도 만날 수 있었다고 들었습니다. 
그리고 Finnish Friend라고 해서 학생들과 핀란드 학생 혹은 가족 등을 연결해주는 프로그램이 있습니다. 저는 시내에서 40km 떨어진 곳에 사시는 아주머니와 매칭이 되어 그 분의 집에 놀러가 같이 요리도 하고 숲에서 베리도 따보는 등 핀란드 문화를 접할 수 있었는데 매우 좋은 경험이었습니다.","동아리도 몇 개 있는 것 같긴 한데 마땅히 교환학생들이 참여할만한 동아리는 없어 보였습니다. 그 외에 ESN Joensuu가 진행하는 프로그램 중에 Language Cafe라는 프로그램이 있습니다. 영어, 독일어, 프랑스어, 일본어 등 각 언어의 팀을 구성해서 가르치고 싶은 교환학생이 직접 자신의 언어를 가르치는 건데, 언어를 배우는 데도 좋지만 서로 친해지는 데 좋은 기회가 되는 것 같습니다.","컬쳐쇼크라고 할만한 것은 마땅히 겪지 않은 것 같습니다. 한가지 놀란 것을 꼽자면 핀란드 사람들은 신기할 정도로 영어를 잘한다는 것입니다. 그냥 마트에 가도 점원들이 대부분 영어를 합니다. 
그리고 사우나도 특별한 경험이었습니다. 보통 사우나를 하면서 중간중간에 차가운 물로 샤워를 하는데, 특히 겨울에 사우나를 하고 나서 눈 속에 들어가거나 차가운 연못 안에 들어간다는 얘기를 듣고 깜짝 놀랐는데 막상 하니 재밌고 새로웠습니다.",저는 주로 튜터나 핀란드 친구들에게 도움을 구했던 것 같습니다.,"사실 핀란드에 가기 전에는 걱정도 많이 했지만, 갔다 온 지금은 요엔수에 교환학생으로 다녀온 것이 정말 최고의 선택 중 하나였던 것 같습니다. 제가 간 학기에는 저 포함 한국인이 네 명 있었는데, 네 명이서 Korean Party를 열어서 외국 친구들에게 한국 음식을 요리해준 것도 생각이 납니다.  4개월이 채 안 되는 짧은 시간이었지만 앞으로도 계속 요엔수가 그리울 것 같습니다. 혹시 더 궁금한 점이 있으시면 jieun7852@naver.com 으로 연락해주시면 감사하겠습니다."
"University of Finland(이하 UEF)는 3개의 캠퍼스(요엔수, 쿠오피오, 사본린나)로 이루어진 종합대학입니다. 저는 그 중에서 Joensuu(요엔수)라는 곳에 배정을 받았고, 전공에 따라서 캠퍼스 배정이 나뉘는 걸로 알고 있습니다. 연세대학교와 비교했을 때, 캠퍼스의 크기가 그리 큰 편은 아니지만 시설 면에서 크게 불편함을 느낀 적은 없었습니다. 대부분의 건물이 캠퍼스 중심부에 있는 도서관을 중심으로 도보 10~15분 안에 이동할 수 있을 정도라고 보시면 됩니다. 끝없는 오르막의 연속인 백양로에 비해서 대부분이 평지이기 때문에 걷는데 그리 힘들지는 않습니다. 

요엔수라는 도시는 수도인 헬싱키에서 기차를 타고 북동쪽으로 4~5시간 떨어진 곳에 위치하고, 지리적으로는 러시아와 상당히 근접해 있습니다. 핀란드 기준으로 보았을 때 요엔수는 열손가락 안에 들 정도로 큰 도시이지만, 한국 기준에서는 소도시 규모입니다. 따라서 서울처럼 대중교통을 자주 이용하지 않으며, 대부분의 이동은 자전거를 대여하여 이루어지게 됩니다. 실제로 버스비도 한 번 타는데 거의 3.3유로(약 5천원)를 내야하기 때문에 쉽게 탈 수가 없습니다. 자전거를 직접 구입하는 방법도 있고, 대여하는 방법도 있는데 이 부분은 나중에 각자의 상황에 맞게 선택하시면 될 것 같습니다. 보통 교환학생들이 배정받는 임대아파트에서 센터나 학교까지 이동하려면 자전거로 20분정도 걸리고, 한달정도만 생활하다보면 도시 구석구석까지 알 수 있습니다. 비록 규모는 작지만, 센터에 백화점도 있고, 웬만한 물건은 다 구할 수 있었으므로, 상점이 문을 일찍 닫는다는 점만 제외하고는 크게 불편한 점은 느끼지 못했던 것 같습니다.

제가 있던 가을학기는 생각만큼 많이 춥지는 않았습니다. 이상기후로 인해서 기온이 평소보다 많이 높았기 때문에 눈이 오는 것보다는 비가 오는 경우가 많았습니다. 여름(6~8월)의 핀란드 기후는 정말 좋은데 반해, 10~11월에는 비가 오고 흐린 날이 많다고 하는데 실제로도 그랬습니다. 첫 눈이 10월 중순에 왔고, 특히나 해가 빨리 지기 때문에 상대적으로 날씨가 더 흐리다고 느낀 것 같기도 합니다.","도시 자체가 그리 크지 않기 때문에, 학교 주변에서 도보로 5~10분정도 떨어진 센터가 전부입니다. 센터에는 조그마한 광장이 있고, 비정기적으로 마켓이 열리고, 행사가 있을 때 그 곳을 사용하기도 합니다. 광장을 중심으로 대부분의 번화가가 몰려있으며, 식당이나 상점, 그리고 펍 등을 쉽게 찾을 수 있습니다.","입학허가서를 받을 때, Joensuu Elli라는 곳에 임대아파트를 신청하라는 공지도 같이 옵니다. UEF에는 기숙사가 없기 때문에, 보통 Elli에서 제공하는 임대아파트에 거주하거나 그 외에 Riverside Residence 혹은 Greenstar hotel 같은 곳에 거주하게 됩니다. 

대부분의 학생들은 Elli에서 제공하는 아파트에 거주하게 되는데, 임대아파트의 경우 보통은 3인이서 한 공간을 공유하는 형태입니다. 주방과 화장실, 그리고 거실을 같이 공유하게 되며 방은 개인별로 하나씩 주어집니다. 대부분은 룸메이트가 교환학생이지만, 경우에 따라서 핀란드의 다른 지역에 거주하는 학생이거나 혹은 그냥 직장인인 경우도 있습니다. (요엔수에는 UEF 외에도 North Karelia라는 조그만 대학이 하나 더 있어서, 모든 교환학생이 다 UEF 학생은 아닙니다.) 보통 아파트 신청을 할 때, 가구가 비치된 방을 신청하게 되는데, 이 경우에는 센터에 있는 아파트를 거의 배정받지 못하고 대부분 센터나 학교에서 자전거로 20분정도 떨어져있는 Karjamentie, Latolankatu 그리고 Noljakka에 배정을 받게 됩니다. 

저의 경우에는 Noljakka 지역에 있는 Nuottaniementie라는 곳을 배정받았고, 다른 두 곳에 비해서 교환학생들의 숫자가 조금은 적은 지역이었습니다. 상당히 조용하고 근처에 커다란 호수가 있어서 자연경관은 정말 좋았지만, 가끔은 심심하다고 느낄 때도 있었습니다. 방의 크기는 예상보다 넓었고, 한국에서 자취나 하숙을 해본 경험이 있으신 분이라면, 웬만한 하숙방보다 넓다고 생각하시면 됩니다. 학생할인이 적용되기 때문에 비용은 200유로 안팎이었고, 인터넷 비용 및 가구렌트비를 합치면 한달에 240유로(36만원)정도 지불했습니다. 다만 임대아파트의 경우, 본인이 센터 근처에 있는 곳을 신청하더라도 거의 99%는 위에서 언급한 세 지역으로 배정이 되기 때문에, 자전거를 타지 못하시는 경우에는 조금 불편할 수 있습니다.(자전거로 20분, 도보로 50분). 특히 비가 오거나 겨울에 눈이 많이 와서 길이 얼었을 경우에는 자전거를 타기에 조금 위험할 수가 있습니다. 물론 제설작업은 정말 빠르게 이루어지기 때문에 엄청 쌓여있거나 그런 경우는 거의 없지만, 아무래도 급할 때는 귀찮은 점이 없잖아 있습니다.(사실, 남는게 거의 시간이어서 특별히 아침 일찍 학교를 가야하는 경우를 제외하고는 서둘러서 움직였던 적은 많이 없었던 것 같습니다)

만약에 자전거를 타지 못하시는 경우에는 Riverside Residence를 선택하는 방법도 있습니다. 이 곳과 관련한 정보는 학교에서 따로 제공해주지 않기 때문에, 페이스북 Erasmus Joensuu 페이지 같은 곳에 물어보는 것이 오히려 빠를 것입니다. 센터에 위치해 있기 때문에 접근성은 제일 좋고, 크기는 임대아파트와 비교해서 작지만 개인방과 화장실이 제공된다는 장점도 있습니다. 하지만 3~40명의 친구들이 주방을 공유해야하고, 주말마다 파티가 벌어지기 때문에 조금은 정신이 없을 수도 있습니다. 또한 개인의 성향마다 다르겠지만, 저는 이 곳도 크게 나쁘지는 않은 것 같습니다. 비용은 Elli에서 제공하는 임대아파트와 비용이 거의 비슷합니다.  

식사의 경우, 학교 식당은 5시까지만 운영했기 때문에 점심만 학교에서 해결하고, 저녁은 보통 집에서 먹었습니다. 학교 식당은 학생할인을 적용하여 2.25유로(약 3500원)에 메인메뉴 하나와, 빵과 샐러드는 무한으로 제공되는 형태였습니다. 메인메뉴는 파스타, 덮밥종류 혹은 닭고기 종류가 대부분이었는데 맛은 그럭저럭 괜찮았습니다. 가끔 메인메뉴가 마음에 들지 않더라도 샐러드와 빵이 무한이었기 때문에 충분히 배를 채울 수 있었습니다. 마트에서 한국 쌀과 비슷한 형태의 쌀을 구할 수 있기 때문에, 저녁에는 밥을 지어먹었고, 파스타 면이 많이 저렴해서 파스타를 해먹은 적도 많습니다. 시내에 있는 큰 마켓에 가면 고추장이나 라면과 같은 한국음식을 구할 수는 없지만, 일본 스시용 간장이나 초밥용 김 정도는 구할 수 있습니다. 그리고 태국인이 운영하는 조그마한 아시안마켓이 시내에 있는데, 그곳에 가면 신라면(한 봉지에 1.2유로)과 캔에 들어있는 볶음김치(한 캔에 2.5유로)정도는 구할 수 있었습니다. 혹시 갔는데 다 팔렸을 때는, 마트에 부탁하면 물건을 가져다주기도 했습니다. 

핀란드에서 외식을 하려면 최소한 10유로 정도는 들기 때문에 학생 입장에서 외식을 하기는 거의 힘들다고 보면 되는데, 가끔씩 특별한 음식이 먹고 싶을 때는 중국음식점에 가기도 했습니다. 중국음식점이 2개정도 있었는데, 한 곳은 가격이 평균 12유로정도 했고, 한 곳은 점심 때 갔을 경우에 10유로 이내였던 것으로 기억합니다. 그리고 피자가 생각보다 저렴하기 때문에 6~7유로 정도만 내면 한 끼를 해결할 수 있었고, 햄버거가 먹고 싶을 때는 센터에 있는 HESBURGER를 가거나 센터에서 자전거로 10분거리에 있는 맥도날드를 가기도 했습니다.","수업은 총 7개를 들었습니다. 아무리 영어로 제공되는 수업이 많다고는 하지만, 기본적으로 핀란드어가 모국어이므로 선택의 폭이 많이 넓지는 않았습니다. 교수에 따라서 학생이 요청하면 핀란드어 수업을 영어 수업으로 바꾸어서 진행하는 경우도 있다고 들었습니다. 제 전공이 교육학이라서 그랬는지는 몰라도, 제 전공 수업의 대부분은 강의가 주로 이루어지는 수업이라기보다는 참여를 유도하고 토론하는 형태의 수업이 대부분이었습니다. 한국에서 강의형 수업을 많이 찾아듣고 선호했었기 때문에 처음에는 조금 고생했지만, 기본적으로 학생에게 많은 부담을 주는 형태의 수업들은 아니었던 것 같습니다. 대부분의 수업은 시험 대신에 에세이 몇개와 발표로 대체되었고,(다른 전공은 아닌 경우도 있었습니다) 수업 시간에 계속해서 각자 나라의 교육에 대해서 토론하고 생각을 공유하도록 유도하는 것이 인상적이었습니다. 그리고 Survival Finnish라는 수업을 통해서 기본적인 핀란드어를 배울 수 있습니다. 딱히 강의를 들으면서 한국처럼 압박을 받거나 부담을 느끼지는 않았던 것 같습니다.

도서관은 캠퍼스 중심부에 있는 Carelia 빌딩 내에 있습니다. 처음에 진행되는 오리엔테이션에서 도서관 이용방법을 설명해주며, 도서관 대여에 필요한 절차나 카드 발급 등에 대해서 설명을 해주었기 때문에 크게 이용하는 데 불편함은 없었습니다. 신중도에 있는 IC구역처럼 컴퓨터가 꽤 많이 구비되어있어서 필요할 때마다 이용할 수 있는데, 다만 연세대학교처럼 시간 제약이 있는 것은 아니라서 대기시간이 생기는 경우가 종종 있습니다. 딱히 시험기간이 정해져있는 것이 아니라서 열람실에 공부할 자리가 없다거나 이런 경우는 없었고, 스터디룸 같은 경우에도 스터디룸 앞에 이름을 쓰면, 언제든 원할 때 가서 공부할 수 있었습니다. 다만 밤늦게까지 운영하거나 그러진 않기 때문에 그런 점은 가끔 불편하긴 했습니다.","초반에 오리엔테이션을 받은 후에, 학생증을 수령하거나 각종 서류를 준비해야할 경우를 제외하고는 거의 방문할 일이 없습니다. 정확히 빌딩이름이 기억나지는 않습니다만, 오리엔테이션 기간에 다시 한 번 설명을 받으실 수 있을겁니다.","Erasmus Joensuu에서 주최하는 행사는 대부분 참여하는게 좋습니다. 요엔수에서 하는 다양한 파티는 물론, 러시아 상트페테르부르크 여행, 발틱크루즈, 라플란드 여행 등 다양한 이벤트에 참가하면서 새로운 경험을 했던 것이 개인적으로는 많이 기억에 남습니다. 동아리가 체계적으로 운영되는지는 잘 모르겠지만, 연극, 악기연주, 성가대 등이 있다고 들었습니다. 그리고 동아리 형태는 아니지만 매주 화,목요일에 정기적으로 모여서 근처에서 축구를 하는 친구들이 있었고, 수요일에는 학교 체육관에서 매주 농구를 하는 친구들도 있었습니다. 그리고 Language cafe라는 이벤트를 통해서 매주 배우고 싶은 언어를 배울 기회도 마련해줍니다. 본인의 의지에 따라서 할 수 있는 활동은 상당히 많으므로 시간이 있으면 많이 참가해서 많이 경험하셨으면 좋겠습니다.","컬쳐쇼크까지는 아니지만, 룸메이트가 폴란드 친구였는데, 주방을 쓰거나 화장실을 사용하는 스타일 등 생활방식이 조금 달라서 초반에 조금 불편함을 느꼈습니다. 이런 부분에 대해서 직접적으로 이야기했고, 시간이 지나다보니 괜찮아졌는데, 만약에 불편함을 느낀다면, 직접 얘기해서 푸는 방법이 제일 괜찮은 것 같습니다.","UEF에서는 교환학생 여러 명과 핀란드 학생 한 명을 튜티-튜터로 묶어줍니다. 따라서 초반에 어려운 점들은 대부분 튜터에서 물어서 해결했습니다. 혹시나 튜터를 배정받지 못했거나, 연락이 잘 되지 않은 경우에는 주변 교환학생 친구들의 튜터를 통해서 도움을 받는 경우도 보았습니다. 아니면 페이스북 페이지 혹은 그룹 Erasmus Joensuu를 통해서 정보를 얻는 방법도 있습니다.",준비하는 과정에 혹시나 궁금한 점이 있으시면 언제든지 이메일(dongace277@naver.com)로 연락주세요~
