gen_info,env_info,food_info,study_info,office_info,facil_info,mhct_info,help_info,etc_info
"다른 많은 유럽의 대학교들처럼 Middlesex University의 캠퍼스는 크다면 크고, 또 작다면 작은 크기이다. 이러한 표현이 가능한 이유는 다른 대륙들과는 달리 유럽에서는 대학교가 도시 군데군데에 널리 분포된 형태로 설립되어 있기 때문이다. 따라서 복수의 개별 캠퍼스들이 존재하게 되고 각 캠퍼스의 크기는 작지만, 전체적인 규모는 큰 것이라 할 수 있다. 

 Middlesex University는 네 개의 캠퍼스를 보유하고 있다. 그 중 내가 다닌 Hendon 캠퍼스는 런던의 북쪽 지역에 위치하고 있는데, 런던의 한복판(Central)에서 Hendon 역까지 지하철로는 30분정도가 소요된다. 중심에서 떨어져있는 만큼 공기가 맑은 편이며 훨씬 한적하다. 

 영국의 날씨는 구름이 잔뜩 끼어 흐리다고 알려져 있지만 반드시 그런 것은 아니다. 오히려 여름에는 맑은 날이 더 많다고 느꼈을 뿐 더러 구름이 끼고 비가 와도 하루 중 일시적인 현상으로 생각하면 될 것 같다. 지내다 보면 비와 구름에 크게 개의치 않는 데에 익숙해질 것이다. 여름엔 한국보다 시원한 편이며, 겨울은 한국과 비슷한 정도로 춥다. 내가 지냈던 2008년 겨울에는 우박과 폭설이 내리기도 했다.","Hendon 캠퍼스는 Hendon Central 역에서 도보로 5분 거리에 있다. 런던의 중심가와 멀리 떨어져있는 탓에 이곳 Hendon 은 지역 사회에서 센트럴 역할을 담당하는 마을이다. 그렇기 때문에 역 주변에는 식당들과 가게들이 꽤 많은 편이다. 학생들이 패스트푸드와 헬스클럽, 미용실, 카페를 찾을 때는 주로 역 근처의 것을 이용한다. 

 Hendon Central 역에서 세 정거장 정도 가면 Golders Green 이라는 마을도 있다. 이 마을도 지역 사회의 상권이 몰려있는 곳이며, 특히 Middlesex University에 파견된 학생이라면 한국 식당과 슈퍼를 만날 수 있다. Brent Cross에는 몇 개의 쇼핑센터가 위치하고 있다.

 축구를 좋아하는 학생이라면 런던의 주요 네 개 팀 중에 Arsenal 이 가장 가까운 위치에 기반을 둔 팀이다. Emirates Stadium과 영국 국가대표 축구경기장도 근처에 있다. 문화와 역사의 도시 런던의 센트럴에 대한 설명은 지면의 한계로 생략하기로 한다.","Hendon 캠퍼스에서 수강하는 학생들은 Hendon Central 역에서 한 정거장 떨어진 Colindale 에 있는 기숙사 Halls of Residence에 거주하게 된다. 이 역은 Northern Line 상에 Hendon Central 역과 함께 있다. 이 마을은 Hendon Central 과 달리 주로 거주 목적을 위해 구성된 지역이며, 따라서 몇 개의 슈퍼마켓과 레스토랑을 제외하면 대부분의 건물은 아파트나 주택이다. 

 기숙사 주변에는 축구경기장과 주민 체육시설이 바로 길 건너에 위치하고 있으며, Colindale 역 근처에도 슈퍼마켓이 있다. 기숙사 뒷편에 새로 들어선 주상복합 건물에는 편의점(Tesco)도 있는데, 주로 이곳에서 음식 재료를 구매했다. 

  사실 기숙사 건물이 아주 좋은 편은 아니다. 하지만 나쁘게만 볼 것은 아닌 것이, 오래된 문화와 전통을 사랑하는 유럽의 생활방식을 체험할 수도 있기 때문이다. 기숙사는 100여년 전에 지어진 마을 교회건물을 개조하여 사용하고 있으며, 앞에 넓은 잔디밭도 있다. 글로 설명을 들으면 일견 낭만적으로 보일지 몰라도, 낙후된 내부 시설들에 실망할 수도 있다. 하지만 온수와 난방은 잘 되는 편이다. 개인적인 생각이지만, 아무런 제약 없이 자기만의 생각과 아이디어로 방을 디자인해보기에는 이렇게 허름하고 빈티지한 방도 꽤 적절하다고 생각된다.","Hendon 캠퍼스 내에서도 건물은 몇 개로 분할되어 있다. 건물들이 한 블록에 모여 있기는 하지만, 우리 학교처럼 건물마다 진행되는 학부의 수업들이 모두 다르기 때문에 정확히 기억해두는 것이 중요하다. 나는 사회과학부의 정치외교학 관련 수업들을 수강했는데, 이는 Williams Building에서 진행되었다. 

 캠퍼스의 가장 중심이 되는 건물에는 강의실과 Quadrangle이라 불리는 광장, 카페, 사무실 등을 모두 갖추고 있다. 학생들은 주로 Quadrangle에서 만남을 갖는 편이며, 공강 시간에도 이 장소에서 책을 읽거나 대화를 하는 식으로 시간을 보낸다. 

 Hendon Campus의 Sheppard Library 건물은 캠퍼스내 건물들 중 가장 최신식 시설을 자랑한다. 완공된 지 얼마 되지 않은 이 도서관은 첨단 어학시설과 컴퓨터 교육 시설을 갖추고 있다. 이 도서관의 출입을 위해서는 별도의 출입 ID카드를 발급받아야 하는데, 이는 오리엔테이션 기간 동안 도서관 지하에서 안내를 받아 할 수 있다. 출국 전 증명사진을 미리 챙겨가는 것이 도움이 될 것이다. 

 사회과학부의 수업은 주로 프리젠테이션과 토론 위주로 진행된다. 교수님은 수업의 진행 방향을 설정하고 토론의 진행자가 되며, 때로는 패널이 되기도 하여 학생과의 구분이 모호해질 만큼 능동적이고 활발한 교류를 증진시킨다. 한국에서 모든 수업을 경영학으로 듣는다고 할 때보다도 많은 수의 프리젠테이션을 준비해야할 것 같다. 

 수업의 학생들은 발표와 질의응답에 매우 적극적이며, 따라서 영어에 자신이 없는 학생이라면 주눅이들 지도 모르겠다. 나도 처음에는 크게 소극적인 자세로 임했으나, 운 좋게도 친절한 교수님과 동료들 덕분에 갈수록 향상되는 모습을 보였다. 하지만 그것이 일반적인 영국의 교수님과 학생들의 면모라고는 할 수 없을 것 같다.","방문학생의 출국 전, 후로 SAF(Study Abroad Foundation)의 담당자와 연락을 취하게 된다. 출국 한달 정도 전에 담당자와 비자관련 문제와 수강신청, 공항 픽업 등 전반적인 문제에 관하여 연락을 취하게 될 것이다. 

 런던에 도착하면, 우선 캠퍼스 내의 International Students Office에 찾아가 입국했음을 알리는 것이 좋다. 수강신청은 사전에 연락을 취했던 대로 자동으로 입력되지만, 변경이나 취소를 원할 경우엔 수강 변경기간에 직접해야한다. 국제 교육부 직원들이 매우 친절한 편이며, 대학생활 뿐만 아니라 영국 생활 전반에 관한 조언도 들을 수 있다. 

 특히 오리엔테이션 기간에는 Middlesex University에서 자발적으로 구성된 학생 단체가 환영행사를 비롯해 학교 생활에 대해 자세히 설명을 해주며, 런던 시내 투어와 캠퍼스 투어도 진행된다. 또한 이 기간에 비자 문제와 의료보험, 신용카드와 교통 학생 할인 등 구체적인 사안들도 다루게 된다.","사립학교인 Middlesex University의 장점은 학생들의 활동에 대한 투자가 많다는 것이다. 동아리 활동은 물론, 파티, 여행, 스포츠에 대한 지원도 많다. 우선 동아리는 음악, 사진, 미술, 학회, 스포츠 등 거의 모든 형태의 것들이 활성화되어 있으며, 학생회(MUSU; Middlesex University Students Union)의 선거와 그 활동도 민주적으로 투명하게 이루어지는 편이다. 학생들의 동아리와 오락 활동은 MUSE(Middlesex University Students Entertainment)에서 관리하고 있다.

 캠퍼스 내에는 테니스 코트와 농구 코트가 구비되어 있으며, 그 뒤편으로는 하나의 카페테리아를 갖춘 학생 회관 개념의 건물이 위치하고 있다. 캠퍼스 내에서의 식사는 주로 이곳이나 Quadrangle의 카페에서 해결하는 편이며, 수업 시간에 여유가 있다면 Hendon Central 역 근처를 찾기도 한다. 

 캠퍼스 바로 옆에는 주민 도서관도 위치하고 있으니, Sheppard Library 와 겸하여 이용하는 것도 좋겠다. 캠퍼스 내에는 병원과 우체국도 갖추어져 있다.","영국은 서양 국가 중 하나이지만, 유럽의 몇몇 국가들처럼 전세계에서 온 사람들이 모여 있는  다문화 국가이기도 하다. 기본적인 것들은 알고 있으리라 생각되지만, 알면서도 쉽게 적응할 수 없는 것이 또한 국가 간의 문화차이가 아닌가 생각한다. 민족주의와 제국주의의 발상지답게 영국에는 인종차별이 아직도 다양한 형태로 잔존해있다. 상대적으로 더 젠틀하고 매너 있어 보이는지 몰라도 은연중에 드러나는 인종차별적인 행동들이 아직도 남아있는 것이다. 공적 장소에서는 아무래도 덜 느끼겠지만, 기숙사를 함께 사용(Flat Share)하는 경우와 같이 사적인 영역에서는 종종 느낄 수 있다. 지내다 보면 영국의 사회 제도가 기본적으로 인종차별을 넘어서 신분제 사회에 가까운 형태를 유지하고 있음을 눈치챌 수 있을 것이다. 

 성에 대한 개방성에 대해서도 큰 충격을 받는 편이다. 알다시피 영국은 성문화에 아주 개방적인 편이다. 거리에서 성인용품 상점을 쉽게 볼 수 있으며, 그곳을 당당하게 들락거리는 사람들도 쉽게 볼 수 있다. 술은 Pub이나 바에서 마시기도 하지만, 인원이 많은 경우 개인 주거 공간에서 파티의 형식으로 즐기는 편이며, 남녀가 한 공간에 있게 되는 경우가 많은 것도 당연하다. 기본적으로 개인주의가 바탕이 되는 문화이므로, 셰어메이트가 이성 친구와 한 방에 들락날락하는 것이 자연스럽게 받아들여진다. 자연스럽다기보다는 타인이 관여할 부분이 아니라고 생각하는 것이 맞는 것 같다. 

 공공장소에서의 당당한 스킨십에도 놀랄 수 있다. 그들이 바라보는 스킨십은 연인 관계인 두 남녀가 할 수 있는 당연한 행동이므로, 역시 타인이 눈살을 찌푸리거나 하는 일이 없다. 런던 시내에는 특히 동성애자들이 자주 이용하는 Pub이나 나이트클럽이 많이 있다. 이 상점들은 가게 문구에 무지개 문양이 들어가 있는 것으로 식별될 수 있다. 문화와 방식의 차이이므로 크게 놀라기 보다는 경험의 일부로서 생각하는 것이 적절한 대처인 것 같다. 

 한편 최고급 호텔이나 유적지, 미술관 등의 경우에는 일정 수준의 복장과 품위를 갖추어야 입장하라 수 있는 곳도 있다.","영국은 미국의 여느 도시만큼이나 한인들이 많이 거주하고 있지만, 한인 타운은 중심부에서 남쪽으로 멀리 떨어져있는 지역(Wimbledon 부근)에 위치하고 있어 자주 방문하기가 어렵다. 대신 센트럴에도 몇 군데에 한인 교회와 식당, 식료품 가게들이 있으므로 이곳들을 방문하여 도움을 요청할 수도 있다. Tottenham Courtroad, Holbourn, Leicester Square, Golders Green 은 대표적인 한인 가게들이 위치한 지역이다. Tottenham Courtroad 역의 Centre Point 건물 1층 식료품가게에는 여러 가지 물품 뿐만 아니라 한인 생활과 여행, 숙박, 어학연수 등에 대한 다양한 서비스, 정보를 제공하고 있다. 영어 연수를 목적으로 한국인을 기피하려는 학생들이 있을 지 모르지만, 그렇지 않은 경우라면 어느 정도 한국인 친구들을 사귀는 것이 향수병을 달래는 데에도 도움이 될 것이다.",
