gen_info,env_info,food_info,study_info,office_info,facil_info,mhct_info,help_info,etc_info
"코벤트리 대학교는&#160;영국 중부 코벤트리의 중심부에 위치하고 있습니다. 학교는 도시와 동떨어진 하나의 캠퍼스 형태라기보다 대학 건물 외 다른 여러 건물들과 어울어져 자유로운 분위기를 형성하고&#160;있습니다. 코벤트리는 영국의 제2도시 버밍엄에서 30분 거리이며, 런던에서는 기차로 1시간 30분, 버스로 2시간 30분 정도 걸립니다. 중부에 위치하고 있기 때문에 런던 외에도 다른 영국 도시들을 다니기에 좋았습니다. 특히, 기숙사 바로 앞이 버스 터미널이어서 부담없이 다른 도시로 여행다닐 수 있었습니다.&#160;
  1월 초&#160;런던에 도착했을 때는 영하 15도까지 내려가는 한국의 겨울에 비해 훨씬&#160;따뜻하다고 느꼈으나, 그러한 10도 이하의 날씨가 5월 무렵까지 계속 되었습니다.&#160;3월 말에도 종종 눈이 왔고, 하루에도 날씨가&#160;몇번씩 바뀌어서 일기예보를 시간별로 봐야했습니다. 이번 봄이 영국 보통의 봄보다도 유난히 추웠다고 들었는데, 귀국 전 6월초까지&#160;전기장판을 사용해도 무방한 날씨였습니다.&#160;생각보다 비는 많이 오지 않았지만 우중충한 날씨가 많았고,&#160;비는 한국처럼 주룩주룩 내리지 않기 때문에 우산을 쓰고 다니는 사람을 찾아보기가 힘들었습니다. 겨울에는 해가 짧아서 오후 4시쯤 되면 어두워지며, 3월 마지막 일요일 써머타임 시작 이후로 해가 점점 길어져 6월에는 저녁 9시까지 밝았습니다.","대학이 도시 중심가에 있어서 장을 보거나 쇼핑을 하기에 매우 편했습니다. 기숙사에서 걸어서 5분 거리에 대형마트인 세인즈버리가 있으며,&#160;학교에서 7분 거리에 있는 광장 근처에 쇼핑센터와 시장이&#160;위치하고 있습니다. 평일&#160;오후까지 문을 여는 coventry market 이 있는데 한국의 재래시장처럼 과일과 식료품을 값싸게 살 수 있고, 그 근처에 이케아(IKEA)가 있어서 필요한 생활용품과 가구를 구입할 수 있습니다.&#160;중국 식료품 가게에서 김치나 한국 라면을 구할 수도 있습니다. 그외에 다른&#160;한국음식을 구하고 싶다면&#160;버스로 10분 거리에 한인마트가 있으니 그곳을 이용하면 됩니다. 다만 대부분의 가게가 저녁 대여섯시쯤이면 문을 닫기 때문에 그 전에 미리 이용해야 합니다. 
  기숙사 바로 앞에 대성당이 있고, 조금만 더 가면 예배볼 수 있는 오래된 교회도 있습니다. 근처에 갤러리와 교통박물관이 있어 코벤트리의 역사를 알아보고 몇몇 예술품들을 감상할 수 있으며,&#160;20분 거리에 영국 전형의 큰&#160;공원인 war memorial park가 있어서 산책을 하거나 운동을 하기에 좋습니다. 학교 스포츠센터도&#160;각종 프로그램이 다양하게 이루어지고 있고,&#160;시에서 운영하는 체육관도 기숙사와 가까워서&#160;배우고 싶은 운동이 있다면 쉽게 이용할 수 있습니다. 고디바 동상이 있는 광장에서 공연을 하거나 장이 서는 일이 종종 있습니다.&#160;","저는 여러 형태의 기숙사 중에 식사를 제공하는 기숙사(Priory Hall)를 선택했었습니다. 해당 기숙사는 다른 기숙사들보다 학교 건물들에 가장 가까웠습니다. 때문에&#160;수업을 다니기도 편하고, 밤에도 다른 곳에 비해 훨씬 안전했습니다. 1인 1실의&#160;형태로&#160;방에는 책상과&#160;수납장, 옷장, 세면대, 침대가&#160;구비되어 있습니다. 방은 한 사람이 사용하기에 충분히 넓고 쾌적한 편이고,&#160;중앙에서 관리하는 라디에이터는 자신이 조절할 수 있는 형태입니다.&#160;다만&#160;라디에이터가 나오지 않을&#160;때에는&#160;방이 으슬으슬하게 추웠기 때문에 전기장판이 매우 유용하게 쓰였습니다. 또 식사가 제공되기 때문에&#160;기숙사 내에서 요리를 하는 것이 불가능합니다. 공용 냉장고와 전자레인지만 구비된 부엌이 있을 뿐이며, 화장실은 남녀 공용이고 샤워실은&#160;대략 15명 당&#160;한 칸을 쓰게 됩니다. 하지만&#160;6개월간 지내본 결과&#160;화장실과 샤워실 이용에는 큰 불편이 없었습니다.&#160;한 층에&#160;구역별로 각각 샤워실이 있고 그 중 어느 곳을 이용해도 무방했기&#160;때문입니다.&#160;&#160;&#160;
  식사는 주말을 제외하고 매일 아침과 저녁, 하루 2끼씩 기숙사 근처 HUB이라는 건물 식당에서 먹었습니다. 아침은&#160;English&#160;Breakfast 형태로&#160;삶은 콩과 소세지, 베이컨, 팬케익,&#160;베이글,&#160;시리얼, 과일 등 다양한 메뉴로 뷔페식으로 골라먹을 수 있었습니다. 저녁은 매일&#160;채식주의자를 위한 메뉴를 포함하여 4개의 주 메뉴 중 하나를 선택해서 먹고 그외의 감자칩과 샐러드 같은&#160;사이드&#160;메뉴를 곁드리는 식이었습니다. 후식과&#160;커피,&#160;차 등도 자유롭게 먹을 수 있었습니다. 다만 영국 음식&#160;자체가 그리 맛있는 편이 아니어서&#160;적응하는 데에&#160;어려움을 겪었고, 주말에는 식사가 나오지 않아&#160;주변 중국 음식점이나 마트 등을 이용해야 했습니다. &#160;&#160;&#160;&#160;","보통 영국 대학의 수업은 렉쳐와 세미나로 구성이&#160;됩니다. 그런데 제가 수강한 전공(Media Production)&#160;특성상 수업이 다른 과목들과는 다른 방식으로 이루어졌습니다. 수업은 교수님들의 강의와 그 이후 실습 및 조모임으로 꾸려졌습니다. 강의보다는 학생들 스스로 직접 프로젝트를 실행하고 작품을 만들어 내는 데에 중점이 맞춰져 있었기 때문에, 조모임과 그 후 교수님과의 대면까지 모두&#160;수업으로 간주되었습니다. 강의는 일주일에 한번 이루어졌고, 그 외의 시간은 작품 제작을 위한 시간으로 쓰이게 됩니다. 종종 영상관련 장비에 관한 workshop을 열어 출석여부를 체크하기도 하였고, 단체로 전시회를 가는 등의 수업도 있었습니다. 마감 기한까지 조별로 작품을 만들어 시사회를 하고, 레포트와 작품에 대한&#160;피드백을 교수님들께 받으면 수업이 끝납니다. 조모임이 주가 되기 때문에 친구를 사귀기에 훨씬 수월했습니다.&#160; 관련 장비들을 무료로 대여해주는 Media loan shop이 있어서  좋았습니다. 
  도서관은&#160;각&#160;학부별 전공 도서가 층별로&#160;배치되어 있고 내부에 열람실과 컴퓨터까지&#160;구비되어 있었습니다. 평상시에는 24시까지,&#160;시험 및 과제 제출 기간에는 24시간&#160;운영했습니다.&#160;도서관 이외에 HUB이라는 공간에서도 컴퓨터를 이용하거나 조모임을 할 수 있는 시설이 잘 되어 있었습니다. &#160;&#160;","코벤트리 대학에서&#160;교환학생&#160;프로그램 자체가 그리 활성화 되지 않아 교환학생이 많지 않고, 교환학생만을 대상으로 하는 행사도 특별히 없습니다. 다만 국제학생들을 대상으로 하는 오리엔테이션이나 친목 프로그램, 해당부서 등이 잘 되어 있으므로, 그러한 것들을 이용하면 어느 정도의 정보를 얻을 수 있을 것입니다.&#160;","학교 스포츠센터는&#160;학교 기숙사에 살고 있는 학생들에 한해서 무료로 이용이 가능합니다. 시설이 깔끔하고 운동기구도 많이 갖춰져있어 자주 이용하였습니다. 저는 매주 화요일 국제학생들끼리 모여서 영어로 이것저것 대화할 수 있는 English Language Club에 가입했었는데, 다른 나라 학생들과의 교류를 통해 영국 문화뿐만 아니라 다른 나라 문화도 접할 수 있어서 좋았습니다.&#160;","생각보다 일을 잘 못하고 이러저러한 일이&#160;많이 일어나는 편입니다. 학교에서 어떤 일을 처리하려고 할&#160;때&#160;몇 번씩 찾아가서 확인하지 않으면 나중에 낭패를 보게 될 수도 있습니다. 그러나&#160;보통 대부분의 사람들이&#160;친절하고, 자신이 할 수 있는 범위 이상으로 도움을 주려고 노력하는 모습을 볼 수 있습니다.&#160;PUB문화가 발달하여&#160;낮에도&#160;야외 테이블에서 맥주를 즐기는 사람들을 심심치 않게&#160;보게 되는데, PUB을 벗어난 공공 장소에서 공공연하게 술을 마시는 것은 벌금을 물 수도 있다고 들었습니다. &#160;&#160;",국제학생들을 위한 오피스나 학생회관을 이용하면 학교와 관련된 여러 문제를 해결할 수 있을 겁니다. 그리고 학기가 시작할때 멘토링 프로그램에 가입을 하면 학교에서 2년 이상&#160;생활했던 학생과&#160;연락하며 학교 생활과 관련된 사소한 궁금증을 해소할&#160;수 있습니다. &#160;,"코벤트리에 가기까지 해당 학교와의 소통 문제로 이러저러한 일들이 많았지만, 막상 가서는 즐거운 교환학기를 보내고 왔습니다. 듣고 싶은 수업, 해보고 싶은 활동이 있다면 적극적으로, 몇번이고 담당자를 찾아가야 하더라도 꼭 해보시길 바랍니다. 6개월이라는 짧은 시간동안 저는 제가 듣고 싶었던 수업을 들을 수 있어서 좋았고, 외국인 친구들과 함께 작품을 만들 수 있어서 즐거웠고, 언제든 가고싶은 곳으로 여행갈 수 있어서 행복했습니다. 날씨가 좋은 날이 많지 않지만 그래서 맑은 날을 더 즐길 수 있었고, 우중충한 날조차도 그 자체로 영국의 분위기가 느껴지는 것 같아 좋았습니다. 조금 더 구체적인&#160;정보가  필요하시다면&#160;kerryjr@naver.com으로&#160;메일을 보내주세요."
