gen_info,env_info,food_info,study_info,office_info,facil_info,mhct_info,help_info,etc_info
"런던에서 기차로 한 시간정도 떨어진 교외입니다. 정말 단순히 런던과 가깝다는 이유에서 선택한 곳인데 분위기는 사뭇 달라요. town이 아니고 city는 city지만 한적한 교외 도시입니다... 그래도 있을 것은 다 있습니다.저는 1월부터 5월까지 있었는데, 기후는 상당히 온화해요. 춥긴 하지만 살을 에는 한파 같은 것은 없습니다. 하지만 5월까지도 겨울코트를 입고 다녔었어요. 현지인 친구들은 올 봄은 좀 늦게 온다고 하긴 했지만요. 날씨가 변덕스럽긴 합니다. 비가 많이 온다기보다는, 비가 왔다가 흐렸다가 맑았다가 또 비가 왔다가 하는 식으로요. 제가 체력이 좀 허약한 편이긴 하지만 덕분에 파견 말에는 건강이 많이 안좋아졌어요. 건강 잘 챙기시길 바랍니다.","학교는 시티 센터를 중심으로 학과 건물이 산재해있는 느낌입니다. 조금만 걸으면 식당도 많고 편하게 다닐 수 있어요. 외국답게 종종 흉악범죄 (누가 칼에 찔렸다던가..) 소식이 들리긴 하지만 그래도 치안 면에서는 꽤 괜찮은 편인 것 같습니다. 시티센터를 좀만 벗어나면 갑자기 주택단지같은 풍경이 펼쳐지는데, 더 걸어가면 war memorial park 라고 엄청 큰 공원도 있어 좋습니다.","저는 다른 친구들과 달리 private housing을 구해서 썼어요. 기숙사가 1월부터 7월까지 의무적으로 계약을 하게 되어있는데, 저는 5월이면 영국을 떠날 예정이었기에 굳이 두 달 치 집세를 더 내고 싶지 않았기 때문입니다. 다른 친구들은 여행을 하며 영국을 거점처럼 들를 예정이었기 때문에 그 조건이 괜찮았다고 해요. 저는 그냥 많이 안알아보고 광고 이메일에 뜬 곳 중에 한 곳으로 했어요... 사실 싸서 고른 곳인데, 제 학과건물까지 20-30분 걸어야 도착할 수 있었어요. 사실 좀 멀죠. 그래도 조금 더 혼자인 생활이 괜찮으시다면 나쁘지 않은 선택입니다. 여기는 집값이 엄청 비싸진 않은 모양인지, 아니면 개인 공간을 중요시 여기기 때문인지 몰라도 모두 1인실이예요. 싱어홀도 그렇고 여기 또한.. 같이 사는 친구들은 있지만 룸메이트가 아니라 하우스 메이트 개념이었습니다. 식사는 주로 요리해먹었구요. 제 경우엔 근처에 큰 asda가 있어서 거기서 주로 사서 요리했네요.","저는 sociology 전공이었는데, 사실 수업의 질이 높지 않아서 조금 실망스러운 편이었습니다. 4시간 단위고 2시간 수업 2시간 토론 방식으로 이뤄졌는데, 그곳 학생들로부터 큰 인상을 받지 못했던 것 같네요. 도서관은 상당히 좋은 편입니다. 자유로운 분위기이고 제공하는 자료들도 많아요. 학생들 개개인에게 포인트 내에서 공짜로 프린트를 할 수 있게 해줍니다. 그리고 흥미로웠던 경험 하나 얘기하자면, 독서실처럼 꾸며진 공간에서 공부를 하는데 앞에 학생이 ""would you keep an eye on my laptop""이라고 물어와서 이건 대체 무슨 요구인가 했는데 이곳은 아무래도 우리나라만큼 절도가 없는 편이 아니다보니 자기 짐을 봐달라고 한 것이었네요. 여러분도 도서관에서 한 번.. 짐 봐달라고 부탁해보셔도 좋을 듯 합니다...","교육부는 그야말로 친절하죠... 여러가지 정말 기본적인 것 여쭤봐도 ""처음이시니까..""하시면서 잘 설명해주셨던 것이 감동으로 남아있습니다.","Buddy Program이라고 학교 정규 학생과 교환학생을 연결해주는 프로그램이 있는데, 덕분에 친구들을 만나는 기회가 되어 좋았어요. 이외에 학교에서 나름 여러가지 행사를 하곤 합니다. 친구를 많이 사귈 수 있는 기회까지는 아닐지라도 다른 문화를 접할 수 있는 좋은 기회가 되었네요. 이외에 일주일에 한 번 학교에서 운영하는 랭귀지 스쿨에서 영어 수업을 들었는데, 덕분에 친구도 조금 사귀고 이왕 왔으니 영어도 더 말하고 다른 문화권 친구들도 접하고 좋았네요. 조금 무섭긴 했지만 고급영어반에 들어갔었는데 널널한 분위기라서 무리없이 섞일 수 있었습니다.","현지인 친구가 영국에 대한 자부심이 엄청났다는게... 컬쳐쇼크였네요. ""우리는 한 때 가장 위대한 나라였고""라는 식의 일장연설을 실제로 듣게 되어 놀랐습니다. 서구권 친구들은 생각보다 식견이 아주 좁습니다. 인종차별주의자나 제국주의자 등을 만나도 너무 놀라지 마세요.학기 초반에 친구를 한 명 잘못 만나서 고생한 기억이 있습니다. 영국 도착 첫날에 학관에서 학생등록 대기줄에 서있는데 인도 남자애가 말을 걸어와서 '이것이 외국인들의 스몰토크 및 친구사귀기인가보다'하고 즐거워했는데 그런것 아니었고 플러팅이었습니다. 떨쳐내느라 고생했어요. 우리나라에서와 마찬가지로, 이성이 접근하거든 너무 열린 마음으로 응하지 마시고 경계해보는 것도 좋을 것 같습니다.","영국에서는 의료기관을 공짜로 이용할 수 있습니다... NHS라고 있는데, 병원비 걱정하지 마시고 예약을 잡아서 가세요. 물론 우리나라처럼 이비인후과/내과 등 구분이 되어있는 곳은 아니지만요. 유선 상에서는 한국인 통역사가 필요하다고 하면 붙여주기도 합니다. 다 집주인이 알려준 팁이었네요. 학교 내에도 의료 센터가 있습니다. 인터넷으로 예약하면 됩니다.",
한국과 다르게 캠퍼스 건물이 여기저기 흩어져 있는 형태라서 정확한 크기는 말하기 어렵습니다. 영국이 비가 매우 많이온다고 들었는데 제가 있었을때는 그정도는 아니었던것 같아요. 주로 맑은데 바람이 아주 심하게 불었습니다. 롱패딩을 대략 3월까지도 입었던 것 같습니다. 코벤트리 도시 자체는 크지 않은데 근처에 버밍엄이 있고 런던에서 그다지 멀지 않습니다. 기차로는 한시간정도 걸리는 것 같아요. 버스를 충분히 미리 예약하면 런던에 가는 비용도 그다지 비싸지 않았습니다.,생활적으로는 필요한 것들이 다 있습니다. 이케아에서 이불을 기숙사까지 이고 날랐던 기억이 아직도 나네요ㅎㅎ; 조금 힘들긴 한데 여자 혼자 들고 나를수 있는 거리입니다. 중국마트같은 것들도 있고 세인즈버리도 가깝구요. 영국은 가게들이 빨리 닫는데 조금 더 늦게까지하는 세인즈버리 로컬도 하나 있습니다. 학교와 시티센터가 멀지 않아서 대부분은 도보로 다닐 수 있는 거리에 있습니다. 가보지는 않았지만 무슨 교통박물관같은게 학교 근처에 있었습니다.,기숙사옵션이 아주 많이 존재하는데 한학기 생활이 가능한 것으로 추리면 한두개가 남습니다. 저는 싱어홀을 썼는데 괜찮았던 것 같아요. 방이 정말 엄청나게 크고 안에 세면대가 있어서 간단한 세면은 방안에서 할 수 있습니다. 공용세탁기가 각 플랫마다 있는게 아니라 중앙의 관리사무소에 있는게 조금 불편했는데 주로 주말에 빨래를 해서 괜찮았습니다. 싱어홀은 여섯명이 하나의 플랫을 쓰는데 대부분의 경우에는 동성끼리 묶어주는 것 같습니다. 싱어홀은 식사를 애초에 포함하지 않기때문에 세인즈버리를 이용했습니다. 학생회관 위층에 학생식당같은게 있긴 하던데 저는 그다지 갈 일은 없었습니다. 학생회관은 싱어홀에서 가깝긴 합니다.,조모임이 있는 수업은 조를 직접 짜야 하는 시스템이라서 조금 힘들었습니다. 처음에 조를 못 짰는데 저한테 남은 애들(다른 조 못짠 애들)한테 연락해보라고 다른애들 메일을 보내주셨습니다. 연세대에서는 대부분 그룹을 지정해주기 때문에 조금 당황했던 것 같아요. 수업은 솔직히 수준이 높지는 않다고 느꼈고 수업의 목적 역시 명확하지 못하다고 느꼈습니다. 대신 그만큼 과제도 금방 제출할 수 있었던 게 장점같습니다. 학생증으로 전자출결을 관리하는데 성적에 전혀 반영되지 않기때문에 수업로드는 높지 않은 편이었습니다.,모든 문제가 생겼을 때 국제교육부에 연락을 하면 일단 답장이 오고 알아봐줍니다. 저는 처음에 비자를 놓쳐서 문제가 될뻔 했는데 잘 처리해줬어요. 이후 기숙사 보증금같은문제도 기숙사측에서 메일을 씹어서;; 국제처에 문의해서 해결했습니다.,동아리는 그다지 재미있어보이는게 없었고 한달에 한번정도 학교에서 일일여행을 갈 수 있습니다. 직접 기차를 예매하는 것보다 저렴한 가격이고 기차등 대중교통으로 가기에는 너무 오래걸리는 곳들도 갑니다.,수업시간에 무슨 락앤락통에서 샐러드를 퍼먹는 학생을 본게 기억납니다,언제나 FBL에 문의하는 것이 가장 빠릅니다.,학교에서 좋은 프로그램을 제공해주어서 좋은 경험을 하고 돌아온 것 같습니다. 코벤트리에 있으면서 여러 다양한 경험을 했고 이외의 여러 영국지역에 방문하기도 하면서 세상을 보는 조금 더 넓은 시야를 가지게 된 것 같습니다.
"코벤트리 대학은 런던에서 기차로 1시간 남짓 걸리는 곳에 있는 아담한 대학교입니다. 코벤트리는 가운데 자리한 대학가를 중심으로 대학마을이 동그랗게 형성되어 있고 외곽으로 여러 산업단지가 있는 도시입니다. 중심부는 학부건물들과 기숙사들이 옹기종기 모여있는 평화로운 분위기이나 20분만 걸어나가도 분위기가 사뭇 다른 골목들을 만날 수 있습니다. 기숙사와 학교는 비교적 가까워 10-20분 내로 통학이 가능하고 곳곳에 필요한 잡화점들이 모여있어 학기를 지내는 동안 코벤트리 안에서의 교통비로 인한 지출은 거의 없습니다.우중충하고 비가 항상 내린다는 영국의 악명 높은 기후에 대한 우려를 안고 가서 그런지 생각보다 날씨는 근사했습니다. 마음 속 날씨에 대한 기대를 내려놓을 수만 있다면 청명하고 맑은 공기와 하늘 그리고 가끔씩 비춰지는 태양빛을 즐기며 지낼 수 있습니다. 깨끗한 비를 적당히 맞으며 돌아다니는 것도 예상외로 기분이 좋아요. 1월부터 5월까지 영국에 있었는데, 비가 자주 내리고 해가 잘 안 들긴 해도 기온이 영하로 떨어지는 경우가 드물어서 우리나라 한파만큼의 살을 에는 추위는 없습니다. 하지만 실내 난방에 별로 신경 쓰지 않는 분위기라 전기장판이나 난방용품을 한국에서 챙겨가시는 것을 추천해요. 저는 현지에서 유탄포 하나를 사서 요긴하게 썼습니다. 또 바람이 세서 귀가 자주 시렵기 때문에 너무 긴 패딩이나 돕바보다는 목도리나 모자와 같은 겨울용 아이템을 내실 있게 챙기는 것이 좋습니다.","대학에서 10분 정도만 걸어나가면 갈 수 있는 City Center에 웬만한 음식점, 옷가게, 생필품점, 전자기기 중고판매점, 마켓, 서점, 약국 등이 밀집되어 있습니다. 곳곳에 영국판 슈퍼마켓 Sainsbury가 있어 장을 봐서 요리하기도 좋고, Oriental Market이 네 군데 정도 있어 한식 재료들을 쉽게 구할 수 있습니다. 이외에도 Fargo Village는 아기자기한 플리마켓이나 샵, 카페가 있어 친구들과 놀러 가기 좋습니다. 30분 정도 걸어나가면 War Memorial Park에 갈 수 있는데, 광활하고 평화로운 공원입니다. 근방에 사는 모든 강아지들이 산책을 나오고 모두가 여유롭게 잔디밭에 누워 조곤조곤 이야기를 하는 곳입니다. 돗자리와 음료수, 샌드위치 같은 것들을 싸 들고 가 몇 시간이고 아이들과 강아지들이 뛰어 노는 소리를 듣다 보면 만병이 치료되는 느낌입니다. 제가 지냈던 기숙사 Singer Hall에서 도보 5분 거리에 있는 Coach station(버스 정류장)이나 도보 15분 거리에 있는 기차역을 이용하여 쉽게 대도시로 나갈 수 있습니다. 기차로 10분을 타고 나가면 영국의 제 2의 수도 버밍엄에 갈 수 있습니다. 대규모 쇼핑센터가 있으니 모쪼록 의류는 버밍엄에서 사는 것을 추천합니다. 기숙사와 가깝다 보니 버스를 자주 이용했는데 날짜와 시간대가 맞으면 6파운드에 런던행 버스를 구매할 수 있었습니다.","대부분의 교환학생은 Singer Hall 기숙사에 머무르게 됩니다. 1인실에 한 층당 6명이 함께 살며 주방과 욕실, 화장실을 공유합니다. 이성과 섞이거나(mixed sex), 동성으로만 구성된(single sex) 플랫을 고를 수 있고 방음이 잘 되진 않습니다. 방은 1인실치고 넓으며 한 쪽에 세면대가 있어 편리했습니다. 매주 청소부께서 공용 공간들을 청소해주시고, 각 방에서 나온 쓰레기를 비닐봉지에 담아 복도에 내놓으면 수거해가시는 점이 좋았습니다.식사의 경우, 외식비용이 비싸기 때문에 보통 요리를 자주 해먹습니다. 저는 가자마자 Wilko라는 저렴한 가전제품점에서 식기구들을 사, 일주일에 대략 4번은 요리를 했던 것 같습니다. 과일이나 고기, 빵 종류가 저렴해서 간단하게 끼니를 때우는데 어려움이 없었고 가끔씩 외식을 하는 정도였습니다.","하나의 수업은 lecture + seminar + group work 세 가지로 이루어집니다. Design Practice 3라는 졸업반 학년의 수업을 들었는데 lecture는 일주일에 두 시간을 넘어갔던 적이 없었을 정도로 짧았고 대부분이 seminar와 group work로 이루어졌습니다. Seminar는 교수님과 2-3팀이 모여 공동 크리틱을 하는 시간으로, 매주 캐주얼하게 발표를 하고 모두가 이에 대한 피드백을 진행하는 시간입니다. 디자인학과 특성상 크리틱과 발표는 익숙했지만 수평적이고 열려있는 피드백을 주고 받는다는 점이 달랐습니다. 교수님보다 학생들끼리의 열정적인 토론시간이 되는 경우도 허다했습니다. 본인이 준비한 프로젝트에 대한 발표이고, 모두가 이를 발전시키고자 도와주기 때문에 세미나는 언제나 긴장되는 동시에 보람찼습니다. Group work는 공개적인 조모임 시간으로, 시간에 맞추어 출석을 하고 팀별로 모여 말 그대로 조모임을 하는 시간이었습니다. 교수님께서 주변에 상주하시기 때문에 자유롭게 피드백을 받을 수도 있고 잠깐씩 밖에 나가 밥을 먹고 오기도 하고, 4시간이라는 수업 시수가 무색하게 반나절 혹은 종일 남아 작업을 하는 시간이었습니다. 학생증으로 강의실마다 달린 전자출결 기기에 출석체크를 하는 방식이지만 출결이 성적에 크게 반영되지 않아 부담은 없습니다. 캠퍼스의 북동쪽에 위치한 도서관은 본교에 비해 아담한 크기지만 시설이 좋습니다. 학생 아이디만 있다면 노트북을 자유롭게 대여해갈 수 있으며 맥북 또한 여러 데 있어 디자인 작업을 하기에 편리합니다. 그러나 열람실 좌석이 많지 않고 예약좌석제가 아니기에 시험기간에 아침 일찍 가지 않으면 자리를 차지하기 힘듭니다.","학기가 시작되기 전 교환학생이나 유학생들을 위해 학교 차원에서 Induction program을 진행해주는 데 이 행사에 참여하면 캠퍼스에 대한 기본적인 이해를 할 수 있어 좋고, 무엇보다 같은 교환학생들을 만날 수 있어 추천합니다. 그 후에도 학생회관에서 진행하는 동아리 박람회, 각종 국제문화교류 행사, 도서관에서의 해외학생들을 위한 티타임 등이 열리기 때문에 유학생을 만날 기회는 얼마든지 있습니다. 코벤트리 대학은 유학생 비율이 높아 교양 수업들 중에서도 스피킹 능력향상을 위한 영어수업이나 영국교양문화에 대한 이해와 같은, 외국인을 위한 수업이 많아 좋았습니다. 또한 정규수업과 별개로 Lingu Mundi라는 언어교류 교육과정이 있어 저렴한 가격에 다양한 언어를 배울 수 있습니다.","학기 초 자주 방문하게 될 곳은 기숙사센터인 Futurelet입니다. 행정 속도가 우리나라와 달리 느려서 괜찮은 방을 얻기 까지 꽤나 많은 시간이 소요될 수 있으므로 마음의 준비를 하는 것이 좋습니다. 이메일을 보내놓고 마냥 기다리기 보다는 직접 찾아가서 뭐든 부딪혀보는 것을 추천합니다. 학생회관 안에 있는 CUSU는 학생자치단체로 학생회와 비슷하다고 보면 되는데, 학기 중에 일어나는 굵직한 행사들을 주최, 관리하고 유학생을 위한 복지센터 또한 구비되어 있으니 유용하게 활용하시면 됩니다.","상상도 못한 문화의 충격이라기보다 익숙해지느라 시간이 들었던 것들은, 식당문화와 교통수단에 대한 이해였습니다. 우선 식당에 들어서면 앉고 싶은 자리에 앉고 테이블 위에 놓여있는 메뉴판을 보고 곧바로 주문을 하는 한국의 방식과는 달리, 식당에 들어서는 그 순간부터 오로지 웨이터에게 몸을 맡겨야 하는 방식이 참 낯설었던 것 같습니다. 안내해주는 곳으로 들어가 앉고, 메뉴판을 받기까지 5분, 주문을 시키기까지 10분, 또 다 먹은 뒤 계산을 하기 위한 제스처를 보내기까지 10분, 카드 리더기를 가지고 오기까지 5분. 그 후에야 비로소 가게로부터 벗어날 수 있었기 때문에 여유롭고 느긋한 식사를 추구하는 영국의 레스토랑 문화에 적응하기까지 시간이 걸렸던 것 같습니다. 카페나 식당에서 굳이 메뉴판을 보지 않고 주문할 수 있었다는 점도 재밌었습니다. 한국은 가게마다 메뉴가 특화되어 있는 경우가 있어 가령 ‘레드벨벳 눈꽃라떼’, ‘우울할 때 먹는 파스타’ 따위의 독특한 이름의 요리가 있기도 하여 메뉴판을 꼼꼼히 봐야 하는데, 외국의 식당은 그러한 개성이 없는 경우가 많아 대부분의 카페에 들어가서 그저 ‘black coffee’를 달라고 말하면 모든 것이 해결됩니다. 이렇다 할 충격은 아니지만 묘하게 이질감을 많이 느꼈던 부분이었습니다.또 하나는 공공 교통수단을 대하는 시민의식에 대한 믿음입니다. 영국에서 버스나 기차를 많이 타다 보면 어느 순간, ‘이 정도면 티켓 없이도 충분히 여행 다니겠는데?’ 라는 생각이 들 정도로 어처구니 없이 허술한 검사 시스템에 놀랄 때가 있습니다. 그러나 이후 무임승차를 하다 걸리면 어마어마한 벌금을 내야 하기 때문임을 알고 수긍하였습니다.","혼자서 해결할 수 없는 일이 생긴다면 앞서 언급한 학생자치단체인 CUSU에 가볼 것을 권합니다. HUB(학생회관) 1층에 위치하고 있고 유학생들을 위한 프로그램들을 기획, 관리하기 때문에 외국인이 겪는 어려움에 대한 이해도가 높아 도움을 받기에 용이합니다.",교환학기를 떠난 모든 사람 한 명 한 명이 각기 다른 이색적인 경험을 하고 돌아옵니다. 소중한 기회이자 한 번뿐인 교환학기 보람차게 다녀오시길 바랍니다?더 궁금한 것이 있다면 nyrina114@naver.com 으로 메일 주세요!
"코벤트리 대학은 코벤트리라는 지역 전체라고 볼 수 있는 곳입니다. 도시 자체에 코벤트리 대학이 차지하고 있는 부분이 굉장히 크고, 그만큼 대학생들이 생활하기에는 편리한 편입니다. 런던과 버밍험은 버스와 기차를 타고 2시간 정도면 갈 수 있기 때문에 주말에 자주 놀러 갈 수 있습니다. 저는 1월부터 6월까지 있었는데, 1월에도 한국보다는 비교적 따뜻한 편이었습니다. 그러나 날씨는 하루에 눈,비,구름,해를 모두 볼 수 있을 정도로 굉장히 역동적인 날씨입니다. 그리고 영국 특성상 굉장히 자주 비가 내리며 어지간한 비에는 사람들이 우산도 쓰지 않으므로 바람막이는 필수 입니다.","코벤트리 대학 주변은 거의 대부분 대학생들이 거주하고 있습니다. 그래서 특별히 위험하다거나 하지는 않습니다. 치안쪽으로는 크게 문제가 없다고 생각합니다. 또한, 학생들이 많이 살기 때문에 저렴한 쇼핑센터나 세인즈버리와 같은 마트도 굉장히 가깝습니다. 저는 priory hall이라는 대학 기숙사에서 살았는데 그곳은 학교의 모든 건물과 가까우며 코벤트리 내에 마트, 쇼핑센터와도 굉장히 가까워서 살기엔 굉장히 편리했습니다.","저는 대학 기숙사에서 생화했습니다. 그리고 그 기숙사에서는 아침과 저녁을 학교 식당에서 먹을 수 있고 취사가 불가능한 형태입니다. 아침 식사의 경우, 잉글리쉬 브렉퍼스트, 즉, 삶은 토마토, 삶은 계란, 소시지, 베이컨 등이 나오며, 저녁 식사의 경우 매번 바뀌는데 장기간 먹는 사람의 경우 질린다고들 하는 평이 있었습니다. 기숙사에 냉장고, 싱크대, 전자레인지는 있기 때문에 간단한 음식은 먹을 수 있습니다. 다만, 냉장고에서 도난이 많이 일어난다는 것이 좀 흠입니다. 다른 취사가 되는 기숙사를 추천드리는 바입니다.","수업은 우리나라와 다른점이 많았습니다. 아예 수업 자체가 이론 하루, 논문예시 토론 수업 하루 이렇게 진행되는 수업이 있었고, 아트 쪽 수업 같은 경우, 전체가 다 실기 수업인 경우가 있었습니다. 그리고 토론수업이 굉장히 활발하게 진행되는 수업이 있었습니다. 학국에서보다는 훨씬 역동적이고 활발한 형태의 수업이었으나 영어가 부족하면 좀 따라가기 힘들 수 있다는 생각이 듭니다.  도서관은 비교적 괜찮은 편입니다.","코벤트리 대학은 사실 교환학생 제도가 그렇게 제대로 이루어져 있는 곳은 아니었습니다. 오히려 유학생이 대부분이었고, 교환학생에 대한 지원은 솔직히 다른 대학에 비해 좀 부족했다는 것이 솔직한 평입니다. 그래도 유학생과 교환학생을 한꺼번에 묶어 international student에 대한 교육이 초반에 진행되며 초반에 국제학생들을 위한 어학수업같은 것을 신청하시면 오히려 외국인 친구들을 사귀기 쉽습니다.",동아리 활동이 활발하게 이루어져 있습니다. 학교에 hub은 학생회관 같은 곳으로서 굉장히 편안한 분위기에 여러 학생들이 모이는 곳입니다. 자주 유용하게 이용할 수 있는 공간입니다.,"우리가 알고 있는 미국 영어와는 다른 표현들이 은근히 많습니다. 그런 단어들을 하나씩 알아가는 것도 쏠쏠한 재미입니다:) 그리고 굉장히 학생들이 개방적인 성격입니다. 도서관에 가면 전혀 모르는 학생들이 ""내가 지금 만들고 있는 ppt어때?""이렇게 친한 친구인냥 대화를 걸어온 적도 있습니다. 그정도로 대화를 서슴없이 걸어오는데 그런 것에 대한 거부감을 가지는 거보다는 보다 열린 마음으로 함께 대화를 하는 것이 더 많은 외국인 친구를 사귀고, 본인의 영어 대화 실력을 높이는데 도움이 될 것이라고 생각됩니다.  인종차별의 경우 특별히 심하진 않지만, 국제 학생들이 많이 있는 기숙사에서는 특히 밥먹을 때 보면, 영국인들은 영국인들끼리만 친하는 경우가 좀 많습니다. 그러나 이게 백인, 흑인 이런 개념의 인종차별이라기 보단 영국인들과 비영국인으로 나뉘는 것이기 때문에 절대 기죽거나 그럴 필요는 없습니다.","해당학교의 2-3학년인 학생들과 1대1 멘토링도 진행되며 국제학생회에 여러나라 학생들이 초반에 가면 학교에 대해 설명을 진행합니다. 이때, 학교에 대한 궁금증을 해결할 수 있을 것입니다. 한국인 유학생들 그룹에 들어가는 것은 추천하지 않지만, 유학생 한 명 정도는 알아두는 것이 빠르게 학교 생활과 지역에 대한 정보와 도움을 얻는 바탕이 될 것입니다",
