gen_info,env_info,food_info,study_info,office_info,facil_info,mhct_info,help_info,etc_info
덥고 덥고 덥습니다^^; 가을이지만 정말 더워요 겨울에는 좀 쌀쌀해지니 반팔+긴팔+외투 이렇게 챙기시면 좋을 거예요 전 두꺼운 바막 하나 가져갔더니 아주 추울 때 몇번 꺼내입고 그 외에는 자주 입지 않았어요.,카페 딱 하나 있고 시내 나가려면 트램 타고 나가야 됩니다. 별로 멀지는 않지만 이스라엘 물가 특성상(6.9세켈 편도인데 환산하면 2100원 좀 넘죠) 좀 비싸긴 해요. 트램 10회 할인권 사서 타고 다니는 것도 방법입니다.,기숙사(핵비쌈;) 혹은 룸쉐어. 룸쉐어는 발품도 많이 팔아야 하고 좋은 사람 만나야 하니 처음 가자마자 하긴 어렵구요. 레즈닉이라고 현지인들 쓰는 저렴한 긱사 있는데 거기 넣어달라고 부탁할수는 있습니다만... 학교 차원에서 레즈닉 안 넣어주려고 할 거예요 이것도 일종의 장사라.... 한 학기에 제 기억에 300만원 했습니다 딱 삼개월 쓰는데도요^^; 부담스럽다 싶으시면 현지에서 빡세게 발품 파는 것도 방법. 단 사기당할 위험 줄이려면 한국인 커뮤니티 이용하세요~,"도서관 아주 좋음. 수업 아주 좋음. 앞에서 후기 적어주셨듯 저도 이-팔 갈등에 관심이 있어서 간 거라 Nafez Nazaal의 팔레스타인 역사 수업 들었구요. 그 외에도 유대교 역사, 이스라엘 정치경제적 역사 등 들었습니다. 수업은 저는 uic라 큰 무리 없었지만 영어가 자유롭지 않으시면 좀 힘들 수 있어요.... 거기 오는 외국인들 대부분이 영국계, 미국계 유태인이고 수업하시는 분들도 마찬가지거든요. 그냥 버버버 하는 영어가 아니라 아주 고급지고 유창하고 아카데믹한 영어 쓰십니다. 준비해 오셔야 할 거예요..^^; 부담스러우시면 본대 영어수업 신청하시면 훨씬 낫습니다 그분들은 거기서 나고 자라신 이스라엘리 유대인들이라서요. 본대 영어수업 들으면 히브리대 특유의 질문, 토론식 수업도 경험하실 수 있습니다. 다만 본대 영어수업은 한 단과대에 1~2개밖에 안 열린다는 단점이.",친절합니다 다만 여기도 미국계 유태인들 많아서 영어 커뮤니케이션 필수구요. 히브리어를 못하신다면 미리 적어가시면 좋을 거에요. 찾는 사람이 많고 동양인들한테 굳이 친절하게 설명하는 분위기가 아니라서 못 알아듣고 있으면 짜증내면서 나가라고 성질낼 수도 있어요. 이스라엘 사람들이 겁나게 솔직하고 짜증도 좀 많습니다....,"동아리는 들 수 있는 데가 잘 없구요. 그냥 교환학생애들끼리 하는 클럽이나 크레브 마가(운동) 수업, 댄스교실 등 학교 내외에서 실시하는 것들 찾아서 하실 수 있습니다. 박람회나 연락 따로 오지 않으니 정 원하시면 수소문하셔야 할 거예요.",여러 면에서 컬쳐쇼크. 교수를 코너까지 모는 집요한 질문과 자유로운 토론 분위기는 제가 uic에 있다 왔는데도 좀 낯설 정도였어요. 개인적으로 참 좋았습니다. Rothberg에 머무신다면 유대인 분위기보단 미국 분위기가 크긴 해요. 진짜 이스라엘+아랍 문화권의 컬쳐쇼크를 느끼고 싶으시다면 예루살렘 밖으로 자주 다니시고 현지인들이랑 교류도 많이 하셔야 할 거예요! 따로 유대교 회당이나 예배도 가 보시고..ㅎㅎ 아 그리고 학교 앞에 검문소 잇어서 매일 검문하셔야 합니다 폭발물 위험때문에... 폭탄 예방 교육 같은 것도 따로 받아요 그럴 땐 아 내가 분쟁국가에 와 있구나 실감하게 돼요. 로스버그 건물에서 내려다보이는 서안지구도 상당한 매력이 있습니다 ㅎㅎ,딱히....한인교회....? 어디라도 그냥 가서 붙잡고 물어보면 연결시켜주긴 하는데요. 전반적으로 이방인에게 친절한 곳은 아닙니다.,"물가, 안전만 제외하시면 아주아주아주 추천할 만한 곳입니다. 물가도 뭐... 집에서 만들어먹으면 충분히 버텨요. 꼭, 꼭 추천드리는 바입니다. 다만 이스라엘에 한인들이 그리 많지 않고 동양인들도 중국인들이 많아서요. 서양인들 사이에 죙일 있다보면 좀 외로울 수 있다는 점 알려드립니다.ㅎㅎ"
"제가 교환학생으로 파견을 갔던 히브리 대학은 중동의 한가운데인 이스라엘의 예루살렘에 위치해 있습니다. 이스라엘은 북쪽으로는 레바논, 시리아, 그리고 동쪽으로 요르단, 남서쪽으로 이집트 시나이반도와 국경을 마주하고 있습니다. 이중 레바논과 시리아는 적국이기때문에 해당 국가로는 이동이 불가능합니다. 히브리대는 예루살렘에서도 동예루살렘 지역에 있습니다. 예루살렘은 팔레스타인 무슬림들이 많이 거주하는 동예루살렘지역과 서예루살렘 지역으로 나뉘는데요. 67년 전쟁때 예루살렘을 탈환하면서 지금의 히브리대학이 재건되었습니다.(히브리대는 이과캠과 교환학생들이 가는 국제학부가 속한 MT.Scopus캠퍼스 두개가 있습니다. 이 중 Mt.Scopus캠퍼스는 1900년대 초반에 세워졌는데 예루살렘을 요르단에 뺏기면서 67년에 와서야 다시 건설되었습니다.) 교환학생을 가시면 Rothberg International School(연세대학교 UIC와 비슷한 국제학부입니다.)에 소속되어서 공부를 하시게 되는데요, 예루살렘은 해발 800미터 정도에 위치해있기 때문에 텔아비브 같은 도시보다는 덜 덥습니다. 그리고 겨울에는 꽤 쌀쌀하고 눈과 비가 내리기도 하는데요, 제가 교환학생을 갔던 2월 말에는 눈이 내려서 교통이 마비되기도 했습니다. 전반적으로 3월까지는 조금 쌀쌀하고 마지막 겨울비가 내리고 난 후 3월말부터 날이 맑아지고 더워지기 시작합니다. 저는 6월에 한국에 돌아왔는데 그때까지는 온도가 30-40도 정도 되었지만 한국보다 훨씬 쾌적하고 에어컨을 켜지 않고도 지낼만 했습니다. 7-9월은 꽤 덥다고 하므로 해당기간에 예루살렘에 거주하실 때에는 더위에 대한 대비를 하셔야 할 것 같습니다.요약하면 중동에 위치하지만 800미터 정도 높이에 위치하므로, 겨울에는 꽤 쌀쌀하고 여름에는 생각보다 쾌적한 날씨였습니다.","학교는 프렌치힐이라는 꽤 잘사는 동네에 위치해있습니다. 학교에서 도보로 10분정도 걸리는 곳에 기숙사가 있습니다. 기숙사 북문으로 나가면 마트와 다른 아파트들이 많이 있어서 전반적으로 안전한 환경입니다. 또한 예루살렘 뉴시티와 올드시티로 가는 트램과 버스가 많이 있어 쉽게 시내로 나갈 수도 있고(걸어서도 20-30분이면 충분합니다.) 동예루살렘 지역도 아랍버스나 도보를 이용해서 가실 수 있습니다. 제가 이스라엘을 교환학생으로 선택한 이유는 중동, 아랍, 무슬림에 관심이 많았기 때문입니다. 이스라엘에는 생각외로 아랍인들이 많이 살고 있었습니다. 또한 학교 주변 아랍마을에 자주 놀러갔었는데, 한국의 Kpop과 드라마를 좋아하는 무슬림 여자들이 말을 걸고 호의적이었습니다. 학교 주변 아랍마을로는 와디알조즈, 이사위야, 슈아팟이라는 동네들이 있는데요, 저는 와디알조즈와 슈아팟으로 야채나 계란등을 사러 자주 갔습니다. 이사위야는 좀 위험한 동네라서 가보진 못했는데 학교에서 언덕아래에 위치해있기 때문에 그쪽 사람들의 생활상을 보실 수 있습니다.그리고 이스라엘에서 가장 중요한 안전, security 관련한 문제는 생각보다 괜찮았습니다. 일단 테러의 위협이 높은 나라이기 때문에 대비를 잘 하고 있는데요. 공항에서 입국할 때부터 정말 까다롭습니다. 여행자 입장으로서는 귀찮기도 할텐데 이러한 과정을 통해 상당히 안전하다는 느낌도 받았습니다. 그리고 학교 주변으로 팔레스타인 지역을 장벽으로 쌓아놨는데요. 장벽이 2005년 쯤에 건설되었는데 그 이후로는 테러가 많이 줄어들었습니다. 팔레스타인 사람들이 예루살렘으로 쉽게 넘어오지 못하기 때문이죠. 하지만 예루살렘 안에 사는 무슬림들의 테러가 간혹 있기도 합니다. 제가 있던 기간에는 근처 트램정류장에서 팔레스타인 무슬림이 경찰을 칼로 찌르는 사건이 있기도 했습니다. 하지만 저는 외국인, 특히 동양인으로서 이스라엘에서 안전하다는 느낌을 많이 받았고, 팔레스타인(특히 학교에서 가장 위험하다고 가지말라는 곳인 A지역인 라말라, 헤브론 등등)을 거의 매주 여행했는데 위험한 일은 없었습니다.그리고 예루살렘 뉴시티에서는 쇼핑몰도 있는데 한국에 비해서는 많이 별로구요, 센트럴버스스테이션을 통해 이스라엘의 다른 도시(텔아비브, 하이파 등)으로 가실 수도 있습니다. 그리고 올드시티는 정말 볼게 많구요, 올드시티 근처 아랍버스 정류장에서도 팔레스타인 도시로 가는 버스를 탈 수 있습니다. 저는 주로 렌트를 해서 여행을 다녔는데, 24시간 렌트하면 기름값 포함 보통 8-9만원정도 소요되었습니다.","학교에 있는 기숙사에서 생활하는데요, 기숙사는 아파트 형식으로 한 flat안에 방이 5개, 화장실 두개, 샤워실 한개, 주방 및 거실로 이루어져 있습니다. 학교 학생식당의 한끼 식사 가격이 최소 만원이상이기 때문에 자주 사먹지 못했구요, 이스라엘에서는 외식을 통해 괜찮은 한끼 식사를 하려면 2만원정도는 소요됩니다. 그렇기 때문에 모든 학생들이 기숙사에서 직접 해먹는게 당연하구요, 직접 해먹으면 한국보다 저렴하게 해먹을 수 있습니다. 야채나 계란 등은 많이 저렴하구요, 소고기와 닭고기도 한국보다 저렴합니다. 다만 돼지고기는 유대인과 무슬림 모두 먹지 않기 때문에 구하기가 힘든데요, 예루살렘에서는 러시아마켓에서 살수 있고, 저는 베들레헴에 있는 팔레스타인 기독교인이 운영하는 정육점에서 삼겹살을 사와서 먹었습니다. 렌트를 할 때, 베들레헴에 들려서 3-4키로(키로 당 12,000원 정도)를 사다놓고 먹었습니다. 고기질은 한국 삼겹살보다 꽤 괜찮았습니다.그리고 보통 같은 교환학생 또는 유대인, 아랍인 학생고 같은 플랫을 쓰는데요. 서로 청소와 같은 규칙을 정해놓고 생활하게 됩니다. 저는 제 룸메중 한명이 청소를 잘 안해서 심하게 뭐라고 했더니, 그 이후로는 청소를 잘 했습니다.그리고 추가적으로 이스라엘에서는 정말 한국 식품을 구하기가 어렵습니다. 중국마켓에서 고추장, 간장 같은걸 팔기는 하는데 라면은 정말 파는 곳이 없습니다. 저는 중간에 한번 집에서 택배를 받았는데, 미리 가시기 전에 라면과 고추장 정도는 가져가시는게 좋습니다.","저는 총 12학점을 들었는데요. 영어를 잘하시면 수업의 난이도는 연세대학교 보다 낮은 것 같습니다. 본교 수업은 들어보지 않았지만, 국제학부 수업은 주로 교환학생들이기 때문에 수업의 집중도도 떨어졌던거 같습니다. 충분히 수업을 잘 듣고 과제제출하면 좋은 학점을 받을 수 있습니다. 그리고 예상하고 갔지만, 상당히 많은 학생들이 수업에서 적극적으로 자기 생각을 말하는 점은 놀라웠습니다. 저도 교환학생을 다녀온뒤 저도 모르게 능동적인 태도를 갖게 되었습니다.도서관은 학교에 있는 본교 도서관과, 고고학 도서관, 그리고 국제학부 도서관 등이 있는데요. 모든 도서관이 공부하기에 괜찮습니다. 그리고 히브리대에 이과캠에는 National Library가 있습니다. 학교에서 운행하는 셔틀버스를 타면 20-30분 정도 걸려서 이과캠에 도착하는데 그 곳에 있는 도서관에는 정말 많은 책들이 있고 시설도 훨씬 좋습니다.","처음에 학교에 도착하면 교환학생 오리엔테이션을 합니다. 국제학부 교환학생 담당 직원분들이 계시고, 수강신청 담당 선생님도 계십니다. 항상 질문이 있거나 필요한 일이 있어 갈때면 친절하게 설명해주시고 처리해주십니다.","동아리 활동은 거의 없는거 같았습니다. 그 외 교환학생들을 대상으로 포인트를 사서 사막지역으로 여행을 간다던지 하는 활동들이 있었는데, 1포인트당 가격이 4만원?정도 해서 꽤 비쌌지만 다른 친구들과 같이 의미있는 활동을 하는 것이 좋았습니다. 이 부분은 학교에 도착하면 오리엔테이션 기간에 설명을 해줍니다.","이스라엘, 특히 예루살렘에는 한국인을 포함한 동양인이 거의 없습니다. 그래서 저를 신기하게 쳐다보는 사람들이 많았는데, 대부분 무슬림들이었습니다. 그리고 팔레스타인 지역(체크포인트 검문소를 통과해야 들어갈 수 있습니다.)으로 들어가게 되면 유대인들은 아예 없고 무슬림들만 거주하는 마을들에 가게 됩니다. 그 곳에서는 저에게 말을 걸어오는 사람들도 많았고, 조금 거친 사람들도 있었지만 그것이 아랍인들의 친근함의 표현이었습니다. 저는 가장 놀랐던게 생각보다 팔레스타인 무슬림과 유대인들이 같이 살아가고 있다는 것입니다. 따로 분리되어서 사는 줄 알았는데, 그들은 서로에게 의지하는 부분이 상당히 많았습니다.",국제학부 사무실에 Assia씨가 친절하게 도와주셨습니다. 그리고 학생마다 담당 도우미 학생이 배정되는데 그 친구들도 파티에 초대해준다던지 많은 도움을 줬습니다.,이 외에 궁금한 점이 있으면 qownseh@gmail.com 으로 질문해 주세요.
"[교환대학 위치]저는 Mt.Scopus 캠퍼스에서 공부했습니다. Mt.Scopus는 중동전쟁의 격전지 중 하나이기도 하며, 순례객들이 찾는 성지도 자리하고 있습니다. 역사적 배경과 더불어 야트막한 담과 정원이 운치를 더하기도 합니다. 교환학생들이 주로 공부하는 국제대학으로 가는 길에 botanical garden이 꾸며져 있습니다. 경치를 즐기며 천천히 등하교해보세요![기후]덥습니다. 피부가 바짝바짝 타오르는 여름을 경험하실 수 있습니다. 11월 초까지 해변가로 파티를 갈 수 있는 날씨입니다. 저는 한국에서 자외선 차단제를 5통 사갔는데, 모두 쓰고 왔습니다. 한국의 햇볕과는 차원이 달라요. 선크림, 선블록 꼭 잊지 마세요!그리고 제가 거주할 당시, 이례적인 수치의 폭설이 내렸습니다. 서울과 비교하면 아무것도 아니지만, 몇 십면만의 폭설로 인해 예루살렘 일대의 교통이 마비되고 3일 넘게 휴교가 계속되었습니다. (당시 매일 아침마다 휴교를 염원하며 학교의 메일을 기다리기도 했습니다)","[캠퍼스]Mt.Scopus 캠퍼스는 인문대학, 사회과학대학, 예술대학 등이 위치해 있습니다. 개인적으로 예술대학 건물에 가 보시는 걸 추천드려요. 친구를 따라 유리 공예 수업을 참관했는데, 자유로운 분위기로 작업하는 어린 예술가들을 직접 만날 수 있는 기회였어요![편의시설]발품을 팔 수록 싼 물건을 구입할 수 있습니다. 기숙사의 매점, 기숙사 근처의 유대인 마트는 가격이 다소 비쌉니다. 기숙사에서 멀리 떨어진 아랍 마트, 그리고 트램으로 몇 정거장 떨어진 마하네 예후다의 시장으로 가면 싸게 식료품을 구입할 수 있습니다. 특히, 마하네 예후다의 시장은 숨겨진 맛집이 많습니다. 시장 입구를 기준으로 왼쪽 두번째 블럭 안쪽에 위치한 식당은 동유럽 풍의 일품 요리와 더불어 *무한 리필* 피타빵이 제공됩니다. 준비한 하루 분량이 끝나면 장사를 접기 때문에 점심 일찍 가야 합니다.","[기숙사]5인 5실로 구성되어 있습니다. 룸메이트들과 거실과 주방, 화장실과 샤워실을 공유합니다. 좌식 생활에 익숙한 제게 밖에서 신던 신발 그대로 집안을 돌아다니는 광경은 6개월이 끝날 때까지 익숙해지지 않았습니다. 처음 기숙사 입사 당시엔, 개인 방만은 물걸레로 닦으면서 생활했는데, 친구들이 방에 놀러오기 시작하면서 쓸모가 없어졌습니다.[식사]저는 앞 서 소개한 시장에서 식재료를 사와 요리를 해 식사를 해결했습니다. 점심 시간을 위해 도시락을 준비하기도 했구요. 식재료 가격이 싸기 때문에 한국에서는 시도하지 못했던 새로운 메뉴에 도전하기도 했습니다. 호평을 받은 것은 뇨끼였습니다. 감자 5kg을 3000원 남짓한 가격에 구매하여, 감자를 삶아서 으깨고, 반죽까지 하는 긴 여정이었지만 나름 재밌었습니다.","[수업]1. Ulpan정규 학기보다 먼저 진행됩니다. 히브리어의 알파벳부터 천천히 가르쳐주니, 큰 부담없이 참여하실 수 있습니다. 커리큘럼이 촘촘히 쌓여 있어, 체계적인 어학 수업이 진행됩니다. 주 5일, 9시부터 3시까지 같이 수업을 들으면서, 자연스럽게 반 친구들과 친해질 수 있습니다. 2. Modern Hebrew: Aleph, Intermediate Level정규 학기 시작 후 또 한번 더 히브리어 수업을 듣게 됩니다. 의무사항이라고 고지가 되어 있는만큼, 울판에 참가했던 대부분의 학생들이 수업에 참여합니다. intermediate인 만큼 울판보다는 타이트하게 수업이 진행됩니다. 3. Foreign Policy of Israel나이 지긋한 교수님이 진행하시는 수업입니다. 수업 중간중간 이스라엘 건국에 참여한 주요 인사들과의 일화, 중동전쟁 참전 경험을 말씀해주십니다. 동네 할아버지가 옛날 이야기를 해주시는 것처럼 들을 수 있습니다. 학생들이 수업 중간에 손을 들어 자유롭게 의견을 공유하고, 의문을 제기할 수 있는 분위기입니다.4.  Israeli Politics이스라엘 정치, 문화, 사회 전반을 다루는 수업입니다. 저는 수업 중 basic law와 emergency rule이 인상적이었습니다. 헌법이 존재하지 않는 이스라엘에서 우위에 서는 법이 존재하느냐에 대해 심층적으로 분석하는 내용이었습니다. 학기 중간에 이스라엘 법원과 국회의사당에 방문하기도 합니다. 특히 현직 국회의원과 직접 만나 토론을 하는 자리도 있습니다. 진보 성향으로 분류되는 두 명의 국회의원을 만나 주로 이스라엘-팔레스타인 2국가 체제에 대해 토론하였습니다. 5. Colloquial Arabic- I (Beginners) 생활 아랍어를 배울 수 있습니다. 특히 요르단, 레바논, 팔레스타인 지역에서 주로 사용하는 아랍어를 배웁니다. 팔레스타인 여행 중 유용하게 쓸 수 있었습니다. [도서관]국제대학 내 도서관은 본교 단과대 도서관 같은 분위기입니다. 대부분의 학생들이 책을 열람하고 커다란 테이블에서 공부를 합니다. 한편, 중앙 도서관은 180도 다른 모습입니다. 대체적으로 시끌벅적한 분위기이기 때문이죠. 학생들은 도서관 열람실에서 열정적으로 토론을 하는 한편, 한 켠에 마련된 커다란 쿠션에 누워 책을 보기도 합니다. 처음에는 당황했지만, 나름의 매력에 푹 빠져 본교 도서관을 자주 방문하기도 했습니다. 도서관 이층(혹은 삼층)의 도서 진열대를 크게 돌아 나가면 햇볕이 잘 드는 소파가 있는데, 제 나름의 아지트였습니다.","문제가 있을 때, 언제든지 찾아갈 수 있는 TA들이 있습니다. 교환학생들이 맞닥뜨리는 문제들을 해결하기 위해서 적극적으로 도와줍니다. 등록 비용의 차액 문제로 교내 financial office를 방문한 적이 있었는데, 중동의 일처리 속도에 대한 무시무시한 악평과는 반대로 빠르게 해결할 수 있었습니다.","[부대시설]교환학생을 위한 OSA 프로그램을 운영합니다. 프로그램 이수기간에 따라 포인트를 발급하는데, 교내 휘트니스 센터 및 각종 필드 트립에 참여하는데 쓸 수 있습니다. 저는 휘트니스 센터의 운동 세션(킥복싱, 줌바, 필타테스 등이 있습니다)에 2포인트, hot spring field trip과 교환학생 교류 프로그램에 각각 1포인트씩을 썼습니다.[동아리]저는 히브리대학 본교에 있는 동아시아학부 친구들과 언어 교환 프로그램을 통해 자주 만났습니다. K-pop과 K-drama에 관심이 많은 친구들이어서, 나중에는 언어 교환이라는 목적을 잃고, 몇 시간이고 실시간 업데이트 되는 아이돌 이야기, 한국 연예계 가십을 떠들며 시간을 보내기도 했습니다. ""어제 이거 봤어?"", ""ㅇㅇㅇ의 ㅇㅇ가 나왔는데""로 이어지는 대화는 한국 친구들과 소소한 일상을 공유하는 것처럼 편안했습니다. 한국 문화를 아끼고 좋아하는 친구들을 만난 건 큰 행운이었다고 생각합니다.","[인종차별]인종차별이 심합니다. 인종 뿐만 아니라 여성이라는 성별만으로도 위험을 감수할 때도 있습니다. 도시 한 복판에서 발 밑으로 날아 온 돌에 맞은 적도 있습니다. 팔레스타인 10대 무리였는데, 태어나서 처음으로 신변의 위협을 느꼈습니다. 겉으로는 화난 표정으로 하지 말라는 의사를 확실히 밝혔지만, 속으로는 정말 무섭고 억울했습니다. 팔레스타인 도시 방문을 기념하기 위해 지나가던 행인에게 사진 촬영을 부탁했는데, 정확히 저를 가리키며 ""너 같은 동양인이 왜 서양인과 다니느냐""며 사진구도에서 나가라고 비아냥거린 일도 있었습니다. (함께 간 친구들이 저보다 더 흥분해 싸움으로 번질 뻔 했습니다) 버스에서 유대교 극단주의자 복장(턱시도 정장에 길게 구렛나루를 길렀습니다)을 한 사람의 옆자리에 앉자, 바로 일어나 제 반대 방향에 서서 가는 일도 있었구요.","교내 TA에게 도움을 요청할 수 있습니다. 그래도 가장 큰 도움을 주는 건 친구들이 아닐까 싶습니다. 기숙사 기간이 끝난 뒤에도 이스라엘에 머물 수 있도록 집 한 켠을 내준 친구들, 함께 가는 곳마다 대신 통역을 해주던 현지 친구들 덕분에 이스라엘에서의 삶이 더욱 풍부해질 수 있었습니다.","예루살렘의 Old city는 종교에 따라 4개의 구획으로 나뉘어져 있습니다. 기독교, 유대교, 이슬람교, 천주교의 성지가 낮은 벽을 사이에 두고 마주하고 있는거죠.하얀 셔츠에 긴 턱시도, 꼬마 병정같은 모자를 입고 구렛나루를 길게 기른 초정통파 유대인이 통곡의 벽 앞에서 기도를 할 때, 철조망 건너의 황금돔에서는 깐두라에 케피야를 쓴 무슬림이 메카를 향해 기도를 올리는 곳. 예루살렘을 기억할 때 가장 강렬하게 떠오르는 장면입니다.제가 기억하는 예루살렘은 전쟁과 평화라는 두 단어가 뜨겁게 공존하는 곳이었습니다. 도시 곳곳에 남아있는 격전의 흔적과 거리의 예술가들이 남긴 평화의 메시지가 하나의 풍경으로 녹아 들어가 있는 곳이었습니다. 이스라엘에서의 경험들은 언어화되지 못한 채, 단편적인 감상으로만 남아 있습니다. 이 때문에 경험 보고서로 잘 풀어내지 못한 것 같아 아쉬움이 남습니다.교환학생 파견 전, 제게 이스라엘은 기대치가 없는 곳이자 예상 불가능한 곳이었습니다. 새로운 문화, 새로운 사람들에 둘러 쌓여 있었던 6개월의 시간동안 저는 '나 다움'이 무엇인지 고민해 볼 수 있었습니다. 자신을 찾고 단단하게 쌓아올 수 있는 곳을 원한다면 이스라엘을 추천합니다."
