gen_info,env_info,food_info,study_info,office_info,facil_info,mhct_info,help_info,etc_info
"저는 2013년 겨울학기(winter Ulpan)와 봄학기를 히브리 대학교에서 교환학생으로 지냈습니다.  히브리 대학교는 1월 말에서 2월 말까지 겨울학기 이후 5일 정도의 봄방학이 있고 2월 말부터 곧바로 봄학기가 시작됩니다.  저는 히브리 대학교의 Rothberg International school(우리학교로 따지자면, 연세대학교 국제학교 정도가 될 것입니다)에 속해 있어서 6월 초에 봄학기를 끝냈습니다.  만약, 히브리 대학교 본대의 수업을 듣는다면 6월 말까지 수업을 들으실 수 있을 겁니다. 물론, 기숙사 기간도 그때까지 연장 될 수 있을 거구요. 
이스라엘의 기후는 기본적으로 한국과 좀 다릅니다.  한국은 계절에 따라 옷을 갈아입는데, 예루살렘은 낮과 밤이 다르고, 어제 오늘 다릅니다.  기후 변화가 심한 편인데, 겨울 학기에도 반팔과 반바지를 입는 학생이 있는 반면 5월 말이라도 밤에는 날씨가 쌀쌀해서 얇은 점퍼를 입고 다니곤 했습니다.  하지만 아무리 추워도 (제가 겪은 바로는) 한국의 3월 초보다도 따뜻하기 때문에 두꺼운 옷은 거의 필요가 없다고 보시면 됩니다.  저는 예루살렘이 춥다는 이야기를 듣고 피코트를 입고 갔는데 인천공항에서 벗은 이후로는 단 한 번도 입지 않은 기억이 있네요.  이전의 많은 경험보고서에서 기술되었듯이 얇은 점퍼를 많이 가지고 가는 게 좋습니다.
  좋은 점은 습하지 않다는 것입니다. 아무리 더워도 건물에만 가면, 그늘에만 가면 시원하니 이스라엘 날씨의 최대 장점이 아닐까 생각합니다.  바람이 조금만 불어도 상당히 시원합니다. 하지만 마치 해를 이스라엘 바로 앞에다가 갖다 댄 것처럼 햇볕이 짱짱하고 따가우니 선글라스는 필히 챙겨가시길 바랍니다.  해안 도시 텔아비브는 물론이고 내륙 지방인 헤브론(팔레스타인)에서도 해가 지기 전까지는 따가울 정도로 햇빛을 받게 되니 선글라스는 필수입니다.  당연히 물통도 필수.
 히브리 대학교의 캠퍼스 자체는 연세대학교보다 조금 작은 것 같습니다만 건물 사이사이에 잔디밭이 여기저기 있어 친구들과 두런두런 담소를 나누기에 편리합니다.  아, 다만 잔디 운동장이 없습니다.  축구화까지 바리바리 챙겨갔던 저로서는 상당히 실망스러운 부분이었는데, 만약 축구를 좋아하시는 분이라면 기숙사 내 조그마한 풋살장이나 예루살렘 시내의 잔디구장으로라도 마음을 달래시길 바랍니다.
 어떤 학생들은 ‘기숙사에선 예루살렘을 제대로 경험할 수 없어’라고 말하기도 합니다.  기숙사 자체가 예루살렘 시내와 조금 떨어져 있기 때문입니다.(그래봤자 걸어서 30분이면 예루살렘 시내에 닿을 수 있으니 서울과 비교하면 떨어져 있다고 하기에도 뭐합니다.)  그럼에도 불구하고 기숙사 주변을 자세히 둘러보면 이스라엘의 단면을 살펴볼 수 있습니다.  기숙사 주변에는 아랍계, 여러 정통파 유대인 그룹들이 함께 모여 있기 때문입니다. 아침에 달리기를 하다 서로 다른 모습의 사람들이 함께 모여 사는 모습을 지켜보고 있자면 신기하기도 합니다.  또한 기숙사에서 조금만 걸어나가면 아랍 마을에 40채 정도의 유대인 마을이 들어서 있고 이들을 보호하기 위한 경찰의 감시탑도 있습니다.  사실 기숙사는 동예루살렘에 속해있는데, 이 지역은 원래는 UN에 의해 팔레스타인에게 배정되었다가 1967년 이스라엘이 아랍국가들의 전쟁 이후로 얻은 영토입니다.  따라서 동서남북 어디로 가든 ‘갈등’의 흔적을 볼 수 있습니다. 동네 하나 하나 뜯어보면 대내외적 갈등을 품고 사는 이스라엘의 광경을 볼 수 있습니다.","학교는 기숙사에서 걸어서 10분-20분이면 도착합니다.  대학교는 도시에 외따로 떨어져 있는 느낌이 들지만 워낙 도시가 좁아서 세상과 멀어지거나 그런 느낌이 드는 건 아닙니다.  단지, 신촌처럼 술 마실 데가 없다 정도? 오히려 워낙 날씨가 좋아 잔디밭에서 노상으로 자주 놀게 될 것입니다.  또한 기숙사 내에 펍이 있어서 저는 축구 경기를 보기 위해 자주 갔습니다.  그다지 신기할 것이 없는 술집이지만 나름 애용했던 기억이 나네요.
대학 자체가 산 위에 있어서 아침에 러닝을 하면 한 쪽에서는 예루살렘 시내를 내다 볼 수 있고 다른 한 편에서는 팔레스타인의 수도 라말라와 요르단 강까지 볼 수 있습니다.  건강한 삶, 상쾌함을 즐기기엔 최적입니다.
실제로 팔레스타인과 요르단은 봄방학이나 여러 휴일을 이용해서 많이 찾아갑니다. 학교에서는 팔레스타인에 가지 말라고 말 , 아마 안 가는 교환학생은 거의 없을 겁니다.","기숙사는 5명이 화장실, 부엌, 욕실, 거실, 냉장고 등을 공유하고 혼자 방을 쓰는 구조로 되어있습니다. 화장실 두 개, 샤워실 1개가 있는데 딱히 불편한 점은 없었습니다. 청소 문제만 잘 협의하면 문제없이 살 수 있습니다.  룸메이트들은 주로 교환학생으로 온 친구들입니다.  제 경우에는 특정 빌딩에 교환학생들을 몰아 넣었는데, 이상하게 저만 다른 건물에 배정이 되어 히브리 대학교의 다른 캠퍼스(Givat Ram)에서 음악을 공부하는 친구, NGO에서 일을 하는데 숙소를 기숙사로 얻은 친구, 그리고 다른 교환학생 친구 한 명과 함께 지냈습니다.  기숙사를 옮기는 건 거의 아무런 절차 없이 사무실에 말만 하면 되니 적응을 못할까봐 걱정하실 필요는 없습니다.  안 맞으면 옮기면 되니까요.  이스라엘 친구들과 같이 지내려고 방을 옮기는 사람들도 보았는데 장단점이 있습니다.  이스라엘 애들은 거기가 생활터전이기 때문에 상당히 바쁘게 지냅니다.  수업 끝나고 알바하고 또 공부도 열심히 하고. 한국과 비슷하다고 볼 수 있습니다.  그래도 이스라엘 학생들의 삶을 가까이서 보고 싶다면 같이 사는 게 좋을 것 같고, 소위 말하는 ‘교환학생 라이프’를 즐기며 조금 더 열심히 놀고자 한다면 국제학교 학생들과 사는 것도 좋은 선택입니다.
식사는 해먹지 않으면 돈이 어마어마하게 나갑니다.  학교 식당에서 우리나라 돈으로 8000원 정도의 식사를 파는데, 잘 나오긴 하지만 매끼 사먹기에는 부담스러운 금액입니다.  샌드위치로 때우기도 했는데 이것도 커피나 음료와 같이 먹으면 양도 적은 것이 한국 돈으로 6000원은 쉽게 넘습니다.  저는 식사량을 중요시하는 편이라 집에서 도시락을 싸갔습니다. 그나마 학교가 싼 편이고 나가서 먹으면 15000원은 주어야 제대로 된 식사를 할 수 있습니다.  
슈퍼마켓은 크게 세 군데가 있습니다.  기숙사 내, 기숙사 북쪽 걸어서 3분 중형 마켓, 기숙사 남쪽으로 걸어서 10분 아랍 마켓.  순서대로 가격이 저렴합니다.  저는 싸게 사려고 아랍 마켓을 다녔습니다만 물품에 따라 오히려 3분 거리의 마켓이 더 저렴한 경우도 있으니 이건 살면서 적응하시면 될 것 같습니다.  사실 가장 저렴하게 장을 볼 수 있는 곳은 예후다 마켓이라는 곳입니다.  우리나라 지방 도시의 재래시장처럼 몇 블록이 시장으로 조성되어 있는 곳인데 가격이 많이 저렴해서 이스라엘 사람들도 장을 볼 때는 이곳을 애용한다고 합니다.","도서관은 학교 건물 곳곳에 있는데 제가 가본 곳은 국제 대학 내의 작은 도서관과 Main Library 두 곳입니다.  책은 예약자가 없으면 자동 연장이 되어 최대 50일 정도까지 대여가 가능합니다. 한 번에 대여할 수 있는 책의 개수는 7권 이었던 것 같습니다.  다만, 메일 확인을 잘 하셔야 합니다.  아마 반납이 하루 늦으면 벌금이 30셰켈이었던 것으로 기억하는데 연대 벌금 100원 생각했다가는 큰 코 다칩니다.  예약자가 생기면 일주일 전에 메일로 언제 반납해야 한다고 말해주니 확인을 잘하도록 합시다.
연대 도서관처럼 히브리 대학교 메인 도서관에도 DVD를 볼 수 있는 시설이 있습니다. 다만 연대 멀티미디어실의 BLU-LEY는 따라가지 못하더군요.  역시 등록금을 두 배나 내니 이런 데서 이득을 보는 구나 싶었습니다. 역시 연대는 돈 값 하는 학교입니다. (참고로 히브리 대학교는 1년 등록금이 400만원 수준입니다.) 이스라엘의 유명한 영화를 찾아보면 그들의 삶을 조금 더 이해할 수 있습니다.  한국에 개봉된 영화는 ‘바시르와 왈츠를’ 정도가 유명할 것 같은데, ‘캠프 파이어’와 같이 국제 영화제에서 상을 받았는데 한국에서는 공감대가 없을 것 같아 개봉되지 않은 영화를 찾아보면 이스라엘을 이해하는 데 도움이 될 것입니다.
*아래 부분은 전의 보고서와 내용이 다릅니다.(히브리어 울판 수강 관련)
저는 출국 전부터 히브리어 수강이 강제가 아니라는 공지를 받았습니다.  하지만 히브리어 수업료와 그 기간 동안의 기숙사 비용이 따로 추가되지 않기 때문에 미리 외국 생활을 경험해 볼 겸해서 저는 겨울학기로 울판을 들었던 기억이 납니다.  봄학기만 들으나 겨울학기에 울판을 추가해서 들으나 돈은 똑같았습니다.  이 부분은 중요하니 메일로 확실히 확인을 다시 해보시는 게 좋을 듯해요.
  히브리 대학교는 식생활비 교환학교라 연세대학교에 등록금과 기숙사비, 식비를 내고 식비의 일부를 돌려받았습니다.  연세대학교에 등록금, 기숙사비 160만원, 식비 180만원을 냈고, 히브리 대학교에서 식비 명목으로 한 달에 1234셰켈(대략 40만원 정도)씩 4달간(2,3,4,5월) 돌려받았습니다.
  수업은 종교, 유대인의 역사, 팔레스타인 이스라엘의 현대 역사, 정책, 건축, 고고학 관련 수업 등이 있습니다.  제가 들었던 수업은 다음과 같습니다.
1.	Modern history of State of Israel, Doctor Mandelsson
영국에서 어릴 때 이민 오신 교수님이 진행합니다.  감히 최고의 수업이라 추천합니다. 고등학교 때 이름만 들어보았던 밸푸어 선언이라든지 후세인-맥마흔 협정을 읽고 역사적으로 어떻게 이스라엘이라는 국가가 형성되었는지 보여주는 수업입니다.  그리고 그러한 변동에 따라 이스라엘과 그 주변의 정세가 어떻게 변화해왔는지를 추적하고 있습니다.  이를 해석하는데 (아주 당연하게도) 이스라엘의 관점이 베어있는 것은 사실입니다만 아주 낮은 수준의 프로파간다 수업은 아닙니다. 아주 미묘한 부분에서 이스라엘의 관점이 드러나기는 하지만 제 3자의 입장에서는 이스라엘이 역사를 해석하는 방식을 엿볼 수 있는 기회이기도 했습니다.
2.	The Palestinians : Modern history and culture, prof, Nazzal
    교수님은 팔레스타인에서 태어난 뒤, 미국에 가서 학위를 따고 히브리 대학교에서 학생들을 가르치고 계십니다.  전에는 팔레스타인의 대학교에서도 강의를 하셨는데, 2013- 봄학기에는 히브리 대학교에서만 수업을 하셨습니다.  교수님의 아들, 사촌이 모두 팔레스타인의 정치계에 몸을 담고 있어서 비하인드 스토리를 많이 들었던 기억이 납니다.  1번에 소개했던 수업에 비해 조금 더 감정적입니다만, 교수님의 진심을 느낄 수 있어서 좋았던 기억이 납니다.  한편으로는 철저히 국제 정세의 논리를 기반으로 역사를 해석하는 이스라엘과 어느 정도 감정이 개입되어 역사를 해석하는 팔레스타인의 차이를 보는 것 같아 슬프기도 했습니다.  1,2 번 수업에서 서로의 관점을 비교하는 것은 흥미로운 일이었습니다.
  다만, 한 학기에 너무 많은 이야기를 다루려고 하다 보니 ‘논리’가 아니라 ‘이야기’ 중심으로 얕게 훑고 지나간다는 느낌도 받았습니다. 
3.	Islam ritual, Prof Freidmann
슬로바키아에서 이민 오신 교수님의 수업입니다. 유대인이고 종교를 가르치시는 분이지만 흥미롭게도 믿는 종교가 없다고 말씀하셨습니다.  수업에서는 코란을 읽으며 어떤 식으로 이슬람이 발전해오고 지금 어떻게 호도되는지 또는 변화하고 있는지를 살펴봅니다.  수업이 코란의 문구를 읽고 이에 대한 해석을 해주시는 방식이기 때문에 ‘이슬람 세계의 사회상’보다는 ‘이슬람이라는 종교 그 자체’에 집중을 하고 있습니다.  
4.	Gender politics in the middle East. Hannah Ovnat
중동의 다양한 여성학자들의 논문을 읽으며 각 나라들의 젠더에 대해서 다룹니다.  저는 중동의 젠더 문제에 대해서 ‘사례’를 다룰 것이라 생각하고 이 수업을 신청했는데, 오히려 중동의 케이스보다는 서구의 사회학자, 여성학자듣의 논의를 먼저 다루기 때문에 조금 어려웠습니다. 예컨대, 푸코, 에드워드 사이드의 글을 읽고 그들의 관점으로 이스라엘의 젠더 문제를 해석하는 연습을 하는 것입니다.  학기 중반을 넘어가서야 예맨, 이집트의 여성 운동 등에 관한 글을 읽으며 수업을 하니 그 전까지 상당히 힘들었던 기억이 납니다.
5.	Issues in Israel society- 이스라엘 사회에 대한 가장 기초적인 수업이 아닐까 하는 생각이 듭니다.  캐나다에서 이민 오신 교수님이 가르치는데, 매주 각 주제별로 이스라엘의 이슈를 다룹니다.  정통파 종교 세력과 세속적 세력과의 정치적 갈등과 변화, 이스라엘의 군사주의에 대한 관점, 아랍과의 갈등 등 다양한 주제를 다룹니다.  다양한 주제를 다루는 만큼 깊이 있는 분석은 동반되지 않았던 것 같습니다만, 이스라엘에 대해서 전혀 모르고 있던 저에게는 수준에 맞는 수업이었습니다.
저는 이렇게 5개의 수업을 들었습니다.  최소 이수학점은 15학점이며 최대 이수학점은 아마 제한이 없었던 것 같습니다.  이슬람 수업을 제외한 모든 수업에 리더가 있어서 각 수업 당 매주 2-3편의 영어 논문을 읽는 게 힘들기도 했지만, 막상 하다 보면 또 따라는 가게 되어 있습니다.  과제의 양은 딱히 많지 않았습니다.  젠더 관련 수업과 이스라엘 현대 여사 수업만 학기 중에 세 네 개 정도의 쪽글이 있었고 나머지는 중간, 기말로만 평가를 받았습니다.
수업을 들으면서 가장 좋았던 점은 역시 피드백입니다.  쪽글이든 보고서든 시험이든 교수님이 친절히 코멘트를 적어서 주십니다. 성적만 명시하거나 한 줄 두 줄 적어주는 것도 아니고 꽤나 자세하게 적어주시는데, 한국과는 많이 다른 부분이라 가장 기억에 남았습니다.  대학 와서 피드백 한 번 제대로 받아본 기억이 없는데 많이 부러웠던 부분이었습니다.","크게 도움 받을 일은 없었습니다.  필통 잃어버렸을 때 사무실에 찾아가서 분실물함 확인한 것과 학기 말에 성적표 수령과 기숙사 체크아웃 관련해서 찾아갔던 것 빼면 딱히 갈 일은 없었습니다.  가끔 사무적인 일들을 처리하러 사무실에 가면 Arlene 이라는 직원 분이 친절히 도와주십니다.(매우 친절하심!) 아, 좋은 점은 기말 고사에 대한 피드백도 받을 수 있다는 점입니다.  성적표 수령을 신청할 때 자신이 낸 기말 보고서와 기말 고사 시험지를 받아보고 싶다고 이야기하면 교수님의 코멘트가 달린 그대로 한국으로 보내줍니다.
교환학생 프로그램에서 제공하는 weekend trip이 많습니다. 교환학생들과, 국제학교 사무실에서 근무하는 이스라엘 대학원생들이 길게는 2박 3일, 짧게는 당일치기 여행을 가는 프로그램입니다.  나중에는 따로 친구들과 놀러 다닐 수도 있지만, 학교에서 진행되는 프로그램 이다 보니 식사도 나오고 교통편도 편하고 심지어 숙박도 해결됩니다.  여행 가이드도 따라 붙고 권총을 찬 사설 경비원까지 따라붙습니다. (물론 경비원이 총에 손을 대는 건 본 적도 없습니다만, 아무튼 나름 무장 경비원입니다.) 
WEEKEND TRIP은 교환학생이라면 기본적으로 몇 가지는 무료로 이용할 수 있습니다.  저는 한 학기 교환학생이어서 5POINTS를 무료로 받았고, 이를 이용해서 1POINT 예루살렘 마라톤, 1POINT 키부츠 답사, 2 POINT는 마사다 여행에 썼습니다.  주어진 포인트를 다 쓰면 그 다음부터는 1POINT에 30달러를 주고 구매해야 하지만, 아마 직접 여행을 다니는 것보다는 싼 가격일 것입니다.","학교와 바로 근접한 거리에 체육관이 있습니다. 가격이 비싸서 저는 신청하지 않았습니다만, 가까운 거리에 있다 보니 운동하기도 편하고 시설도 좋아 보였습니다.  수영장, 테니스 코트, 헬스장이 구비되어 있었습니다. 히브리대 교환학생일 경우에는 조금 더 싸게 신청할 수 있다고 들었는데 정확한 가격은 잘 모르겠습니다.","크게 놀랄만한 일들은 없습니다.  길거리에 군인들이 정말 많다는 것과 그들이 모두 장총을 어깨에 메고 있다는 것, 허벅지의 주머니에 실탄을 갖고 다닌다는 것, 혹시나 테러리스트에게 납치 당할까 봐 이어폰은 한 쪽만 사용한다는 것, 모두 글자로 접하면 무시무시하지만 막상 그곳에 가면 아무 일 없이 안전하고 평온하게, 바깥에서는 보는 것과는 다르게 잘만 굴러 갑니다.
아침에 달리기를 하다가 Ultra-Orthodox 유대인 마을에 잘못 들어서서 친구와 부리나케 도망쳐 온 기억이 있는데, 쏟아지는 시선이 조금 신경 쓰이지만 딱히 신체적 위협이 있거나 그런 건 아닙니다.  한국에서는 쉽게 볼 수 없는 모습이고, 생활 속에서 종교에 헌신하는 사람들을 지켜보는 게 사실 이해하기 쉽지 않아 그게 가장 culture shock한 일이었던 것 같네요.
아, 이 행사의 주기를 정확히 모르겠는데, 5월 말에 텔아비브라는 도시에서 게이 퍼레이드를 갔던 기억이 납니다.  게이 퍼레이드라고는 하는데 그냥 남녀노소 유모차 끌고 나오고 해변에 있던 사람들이 길거리에서 쏟아져 나와 술 마시며 노래 부르며 걷고, 그냥 축제입니다.  한국에서는 접하기 쉽지 않은 광경이라 기억에 남네요.  즐거운 축제입니다.  혹시 기회가 되신다면 꼭 한 번 즐겨보시길.  이스라엘은 정말 미남 미녀의 나라라는 걸 새삼 깨달았습니다. 
아2, 히브리 대학교 앞에서 30명 정도의 학생들이 가두 시위는 것을 본 적 있습니다.  사실, 학교 앞이라고 해 봤자 조그마한 마을 몇 개 있는 것이 다인데 거기서 가두 시위를 했다고 경찰들이 출동을 했고 그 모습이 꽤나 충격적이었습니다.  한국처럼 도로에서 하는 것도 아니고 도보만 이용해서 학생들이 시위를 했는데 장총을 어깨에 멘 경찰과 입을 틀어막은 큰 개, 사복 경찰까지 출동했던 게 충격이었습니다.  게다가 시간은 겨우 저녁 9시가 지난 시각, 이제 막 학생들이 시위를 해산하려는 순간에 경찰들이 지켜보다가 몇 몇 학생들을 잡아가는데 놀랐습니다.  한국의 경찰이 그래도 12시 전에는 질서 유지를 우선으로 하는데 반해, 이 곳은 시위를 ‘진압’하는 것이 먼저라는 생각이 들었습니다.  하지만 지켜보는 것은 전혀 위험하지 않고, 게다가 주동자(?)만 아니면 잡혀가는 것 같지는 않으니 너무 무서워할 필요는 없을 것 같습니다.","저는 안 가봐서 잘 모르겠습니다만, 한국 교회가 있다고 들었고 한국인 커뮤니티가 잘 되어 있기 때문에 교회에서 여행도 같이 다니고 음식도 얻어 먹는다는 이야기를 들었습니다.
주이스라엘 한국 대사관이 텔아비브에 있는데, 하루가 멀다 하고 ‘여행 제한 국가에 거주하고 있으니 조심하라’는 문자 메시지가 옵니다.  그걸 보며 내가 위험한 곳에 있긴 있는 거구나라는 생각을 했던 기억이 납니다.  그런 문자라도 없으면 여기가 중동인지 어디 날씨 좋은 휴양지인지 알 수가 없습니다. 그래도 대사관 전화 번호 정도는 알아두는 게 낫지 않을까 합니다.","제가 이스라엘에서 생활한 지 세 달 정도 되었을 때 언어 교환에 대한 메일이 왔습니다.  지금 연세대학교에서 하고 있는 것처럼 말입니다.  4월 말에나 메일을 받았으니 거의 처음 시행되는 것 같았는데, 이스라엘을 알아가기에는 역시나 사람과의 대화만큼 좋은 게 없는 것 같습니다.  저는 한국학과 경영학을 이중 전공하는 친구와 언어 교환을 하게 되었고 매주 두 시간씩 한국과 이스라엘에 대해서 이야기하는 시간을 가졌습니다.  물론, 한국어도 알려주면서요.  물론, 자신이 한국어 말고도 다른 언어를 할 수 있다면 그 쪽 단과대에 연락해보는 것도 나쁘지 않을 것 같습니다.  스페인어권 친구와 일본인 친구에게도 그러한 메일이 갔다는 걸 들었거든요.
이스라엘의 이미지가 사실 팔레스타인 침공, 유대인들은 최악의 여행객이다. 등으로 좋지 않았는데 기억에 남는 건 친절한 사람들뿐입니다. 이스라엘 사람이 인종 차별적 언행을 한다거나 뭐 그런 걸 경험한 적도 없습니다.  어딜 가나 외국인으로서 긴장은 하면서 다녔지만, 이스라엘은 무서운 나라도 아니었고 단지 우리처럼 바쁘게 살아가고 익숙지 않은 것을 볼 때 시선을 돌리는 그러한 사람들이었습니다.  예루살렘에서 어리버리하게 있을 때 친절히 도와주겠다며 길을 알려준 대학생, 공항에서 나와 어버버 할 때 차를 태워주신 아주머니, 버스에서 옆자리 앉은 인연으로 이것저것 이스라엘 여행 정보를 알려주신 정보부대 출신 누나, 이륙하는 비행기에서는 이런 저런 이유로 만났던 사람들을 생각하며 조금 울컥했습니다.  다들 좋은 사람들이라서. 이제 막상 가면 한국 사람들도 생각보다 많고 날씨도 좋고 이국적 풍경에 하루가 즐겁습니다.  만약 이스라엘에 가게 된다면 분명 후회하지 않을 겁니다.  저는 이 글을 마치면 언제쯤 다시 예루살렘을 떠올릴 수 있을지 모르겠네요. 굿바이 예루살렘.  tjdghks11001@hanmail.net"
