gen_info,env_info,food_info,study_info,office_info,facil_info,mhct_info,help_info,etc_info
"히브리대는 이스라엘 최고의 대학으로, 예루살렘 동북부 Mt.Scopus 지역에 위치하고 있습니다. 연중 온난한 기후를 가지고 있으나, 겨울에는 비가 자주 옵니다. 하지만 그리 심한 비는 아닌지라, 우산을 쓰는 사람을 찾아보기 힘들 정도며, 우산을 쓰더라도 고지대인 탓에 우산이 잘 고장나게 됩니다. 예루살렘만을 놓고 본다면 여름에도 건조하여 꽤 쾌적한 편이나, 예루살렘을 벗어난 이스라엘에서의 여름은 조금 견디기 힘들 정도입니다. 텔아비브, 하이파 등 지중해와 인접한 도시들, 그리고 남부의 에일랏과 그 사이의 베르셰바 등, 어느 곳 하나 우리나라의 여름에 익숙해져 있는 사람이 여름을 나기 좋은 곳을 찾아볼 수 없습니다. 

 이스라엘은 매우 아름다운 나라입니다. 남한의 반정도 되는 규모의 국토에, 지중해, 사해, 홍해, 그리고 갈릴리 호를 가지고 있습니다. 남쪽으로는 사막이, 북쪽으로는 화산지대로 알려져 있는 골란 하이츠가 있습니다. 교환학생 기회를 통해 이스라엘을 구석구석 잘 돌아본다면 매우 좋은 경험이 될것입니다.

 이런 자연적인 요소 뿐만 아니라, 이스라엘은 인류의 역사를 온몸으로 보여주는 황홀한 곳입니다. 카르멜 산 지역에는 고고학적 가치가 매우 높은 고대 인류의 동굴이 있습니다. 예루살렘에서 하이파로 가는 길인 Via Mares, 왼쪽으로는 지중해가 오른쪽으로는 카르멜 산맥이 펼쳐진 그 길 위에는, 로마시대의 흔적이 남아있습니다. 그 외에도 성서에서 4개의 성스러운 도시로 불리는 예루살렘, 헤브론, 티베리아, 그리고 사페드가 있고, 아코, 케사리아 등 역사적으로 빼놓을 수 없는 아름다운 땅입니다. 

 그리고 종종 사람들이 종교를 위해서, 혹은 자신의 종교적 정체성을 찾기 위해 이스라엘을 찾는 데에서도 알 수 있듯이, 이스라엘에 있는것 만으로도 종교적 정체성에 관해 심각한 고찰을 하게 됩니다. 이에 히브리대로의 파견은 예루살렘을 가득 메운 유대교와 그리스도교의 오랜 역사, 그리고 이슬람의 살아있는 모습을 통한 매우 특별한 종교적 경험을 안겨줄 것입니다.  

 그리고 지중해 국가의 하나이기 때문에, 주변의 중동국가인 레바논, 시리아 등지를 제외한 모든 국가를 여행하기 매우 좋습니다. 저는 학기가 종료 된 6월 이후, 사이프러스, 이집트, 터키, 그리스, 이탈리아를 4개월간 여행을 하고 돌아왔습니다. 그 외에도 동쪽으로 사해를 사이에 두고 인접해있는 요르단 또한 히브리대 파견 시 반드시 가보아야 할 곳입니다.","예루살렘 시내에서는 약간 변두리 지역에 위치하여 있으나, 도시 반대편 끝에 위치한 중동 최대라는 Malha 몰을 제외하고는 모두 버스를 이용할 경우 30-40분 내의 거리에 위치해있습니다. 히브리대 주변에는 학생의 문화는 찾아보기 어렵습니다. 기숙사로 보통 제공되는 카파르 스투단팀에서는 약 10분거리에 큰 슈퍼마켓, 피자가게, 베이커리, 은행, 세탁소, 미용실, 구멍가게, 비디오 대여점 등이 있습니다. 조금 더 걸어가면 도미노 피자도 발견할 수 있습니다. 대체로 히브리어로 하르 하쪼핌이라 불리는 마운트 스코퍼스 지역은 아랍인의 비율이 높습니다. 하지만 전혀 위험한 사항은 없으며, 학교 지역이라 오히려 안전합니다. 

기숙사 근처에는 Leaner center라는 예루살렘 최대의 스포츠센터가 있습니다. 학교학생일 경우 할인혜택을 받을 수 있습니다. 저는 6개월권을 15만원 정도를 내고 등록하여 매일 수영을 즐겼습니다. 시설이 매우 좋고 깔끔하여 이용을 추천합니다. 봄철에는 수영장 바깥으로 나있는 잔디밭에서 일광욕을 즐기는 사람들로 매우 붐비기도 합니다.

학교에서 기숙사로 가는 길에는 French Hill Falafel이라는 구멍가게가 있습니다. 거기서 팔라펠 샌드위치 혹은 팔라펠과 라파를 8셰켈과 12셰켈, 음료는 6셰켈에 판매합니다. 1셰켈은 200원 정도로 생각하시면 편리합니다. 학교 주변의 먹거리 가운데는 가격에 비해 가장 좋은 질을 가지고 있습니다. 학교 바로 옆에는 Aroma라는 이스라엘에서 만들어진 체인카페가 있는데, 우리나라의 체인카페의 분위기를 그대로 느낄 수 있습니다. 하지만 가격이 비싸고 저같은 경우는 음식을 먹은 뒤 약을 먹게 된 경우가 종종 있어서, 가급적이면 이용을 자제하실 것을 권유합니다.","기숙사는 3가지 종류가 있는데, Reznik, Idelson, 그리고 앞서 언급한 Kfar Studantim이 그것입니다. 레즈닉은 2인 1실, 1층에 6개 방이 함께 샤워실과 부엌, 거실을 공유합니다. 중앙에 홀을 두고 바람개비처럼 방이 배치되어 있습니다. 겨울에 난방이 잘 되나, 여름에는 에어컨이 없어 매우 덥습니다. 저는 학교측의 실수로 약 1주일간 레즈닉의 싱글룸(2인실을 혼자 쓰게 해줍니다)을 이용하였습니다만, 레즈닉에 사는 것이 더 좋을 것이라는 생각을 하기도 합니다. 책상과 냉장고를 룸메이트와 함께 사용한다는 것이 조금 불편할 수는 있으나, 오래된 기숙사이니 만큼 주변에 식물들이 매우 많이 자라 기숙사 가운데 가장 아름답습니다. 그리고 고양이들이 매우 많아 재미있는 일이 많습니다. 남녀는 층으로 구분되어 있습니다.

이델슨은 레즈닉 다음으로 만들어진 기숙사입니다. 카파르 스투단팀 옆에 위치하고 있는데, 역시 2인 1실이며, 방 3개가 모여 한 아파트를 이룹니다. 그 아파트 안에서 샤워와 부엌, 거실을 공유하며, 남녀 구분되어 있는 것으로 알고 있습니다. 

카파르 스투단팀은 가장 최근(지난해 9월)에 만들어진 기숙사입니다. 기본적으로 교환학생들이 들어가게 되는 기숙사의 형태는 1인 1실, 5개의 방이 모인, 샤워와 부엌, 거실을 공유하는 하나의 아파트입니다. 보통 남자, 여자로 아파트가 구분되나, 남녀가 함께 사는 아파트도 있습니다. 혹 이성과의 아파트 공유가 꺼려지신다면, 사무실에 요청하실 수 있습니다. 저는 학기중 2명의 여자룸메이트와 한 아파트에서 살았고, 이후에는 기간을 조금 연장하여 4명의 남자 룸메이트와 살았습니다. 기숙사에는 놀이터, 미니마켓, 바, 카페, 지하주차장 등의 시설이 있고, 바깥에서는 무선인터넷이 가끔 제공되나 기숙사 내에서는 따로 Bezeq이라는 통신사에 개별적으로 신청을 하여 요금을 내며 사용해야 합니다.

식사는 따로 제공되지 않으며, 식생활비 교환대학이므로 학교에서 지급되는 1300 셰켈정도의 돈으로 한달동안 생활을 해야 합니다. 학교의 식당에서 사먹을 수도 있고, 집에서 식사를 만들어 먹을 수도 있습니다. 학교에서는 샌드위치는 12셰켈정도, 음료는 6-10셰켈정도에 살 수 있으며, 샐러드는 20셰켈 이상입니다. 그리고 히브리대 본대의 식당으로 가면 meal을 25-35셰켈에 먹을 수 있는데, 음식이 매우 잘나오는 편입니다. 하지만 가급적이면 집에서 룸메이트들과 음식을 만들어 먹는 것을 추천합니다. 특히 룸메이트가 이스라엘인일 경우, 보통 주말에 이스라엘학생들은 집으로 돌아가 부모님이 해주시는 음식을 가지고 돌아옵니다. 그런 음식들을 나누어 먹으면서 생활하는 것이 문화적으로도 더 가까워질 수 있는 기회를 만드는 방법이라고 생각합니다. 그리고 음식을 사먹기 시작하면, 한 달에 1300셰켈(30만원 미만)로 이스라엘에서 지내는 것은 조금 무리가 있습니다.","수업은 모두 영어로 진행됩니다. 그것은 히브리대에 파견되는 교환학생들은 본대가 아닌, Rothberg International school에서 수업을 받게 되어있기 때문입니다. 일정 수준 이상(level gimel)의 히브리어 수준을 가지고 있다면, 본대에서 수업을 듣는것도 가능합니다. 

 히브리어 수업은 방학중의 ulpan(이것은 선택사항이 아니라 필수이수사항입니다. 연대에서 파견 전에 확실히 공지가 안되고 있으므로, 반드시 이수해야 하는 과정임을 아셔야 합니다.)과 학기중의 7학점 이수로, 총 12학점을 필수적으로 이수하게 됩니다. 울판 이후 학기에 들어가기 전에 레벨테스트를 보게 됩니다. 레벨테스트 성적이 좋을 경우, 학기중에는 Bet의 두번째 레벨로 진행하게 되고, 그렇지 않을 경우 Advanced Beginners라는 울판레벨의 다음단계 수업을 듣게 됩니다. 학교의 수업이 처음부터 차근차근 잘 진행되므로, 히브리어에 대한 선행학습이 필수적이지는 않습니다. 

 저는 학기중에 히브리어와 함께 Arab-Israeli Conflict: A documentary History(Dr. Nisan)라는 이스라엘지역 분쟁해결과 관련된 수업, Tourism and Urban Change: Israeli Cities as Case Studies(Dr. Shoval)라는 관광업의 발전을 통한 이스라엘 주요 도시의 변화양상과 해외사례와의 비교분석 수업, Genetics and Society(Ms. Shkedi) 그리고 Belief and Ritual in Early Islam(Dr. Friedmann)이라는 과목들을 들었습니다. 저는 전공인 교육학이 영어로 개설되는 코스가 없었기에, 이스라엘에서 얻을 수 있는 수업이라고 생각 되는 것들에 중점을 맞추고 수업을 들었고, 제게 있어서는 매우 보람있는 경험이었습니다. 

 예루살렘 내에 4개의 캠퍼스를 가진 히브리대에서 연세대학교 파견학생이 수업을 들을 수 있는 곳은 이 하르 하조핌 캠퍼스 뿐입니다. 다른곳에서는 영어강의가 진행되지 않습니다. 하르 하조핌 캠퍼스는 인문학, 사회과학, 예술 수업만이 이루어집니다. Rothberg와는 관련이 없으나, Rothberg 자체에서도 그 탓인지 주로 인문학, 사회과학 관련 수업만이 이루어집니다. 


 히브리대의 수업 행정 관련 특징은, 수강신청을 함에 있어서 제한학점이 없다는 것입니다. 연세대학교의 경우, 최대 18학점, 초과학점 이수시 21학점까지 가능합니다만, 히브리대는 최소 9학점이라는 하한선만 있을 뿐, 학생의 능력이 닿는 데까지 수업을 많이 들을것을 권유합니다. 보통 본대의 학생들은 한학기에 7-8개의 수업, 많게는 9-10개까지 수강합니다. 수업 역시 일주일에 2회, 90분씩 진행됩니다. 이것은 매우 좋은 시스템이라고 생각합니다. 히브리대에 파견되실 경우, 이러한 장점을 백분 활용하시기를 적극 추천합니다.

 도서관은 국제학교인 Rothberg의 1층, 그리고 중앙도서관, 법대도서관 등이 있으나, 주로 Rothberg와 중앙도서관을 이용하게 됩니다. 도서 대출은 중앙도서관 1층에서 학생증에 스티커를 하나 붙여주는 것으로 가능하게 됩니다. 빌릴 수 있는 도서의 권수에 있어서도 보통 제한이 없으며, 대출 기간은 3주이나 대출 도서를 요청한 사람이 없을 경우 자동으로 대출기한이 연장됩니다. 즉, 도서관에서 반납요청을 하기 전까지는 보고싶은 만큼 책을 사용할 수 있습니다. 

 전교내에서 무료 무선 인터넷 사용이 가능합니다. 그리고 컴퓨터 사용은 Rothberg의 1층과 3층의 컴퓨터실(3층의 것이 더 시설이 좋습니다.) 그리고 히브리대 본대의 인문학, 사회과학 건물 몇몇 동의 3층에 각각 자리잡고 있습니다. 그리고 포럼 진입 전 컴퓨터팜이 있어, 각종 인쇄시설과 스캐너 등 또한 구비하고 있습니다. 컴퓨터 팜에 출입할 경우 학생증을 반드시 지참해야 하며, 학생과 교직원 외에는 출입이 불가능합니다. 교내 컴퓨터 이용에 관해서는 학기가 시작하면서 나누어 주는 자료와 학교 웹사이트에 상세하게 나와 있습니다.","연대에서 파견된 국제학생에 대한 관리는 히브리대 본대 건물에 사무실이 하나 있는데(포럼과 연결됩니다), 이 곳에서는 식생활비 교환과 관련하여 수표를 받느라 찾아가게 됩니다. 

 그리고 국제교육부 자체는 히브리대 본대, Beit Hillel 건물 바로 옆에 큰 사무실이 있습니다만, 교환학생으로서 그곳에 찾아갈 일은 발생하지 않습니다. 주로 이용하게 되는 것은 Rothberg안 5층에 있는 Rothberg 학부생을 위한 학생행정사무실들로, 거기서 기숙사, 장학금, 성적에 관련된 모든 것을 해결할 수 있습니다.","히브리대는 매우 놀라운 곳입니다. 건물은 허름해 보일지라도, 그 속의 잠재력은 상상을 초월합니다. 공강시간 등을 이용해 학교를 구석구석 둘러보실 것을 권유합니다. 학교 안에는 매우 큰 Botanical garden이 있고, 예루살렘 시내가 한눈에 보이는 전망대도 다수 존재합니다. 연대에서 교환학생으로 파견될 경우 교환학생들끼리만 생활해야 한다는 단점이 있지만, 본인의 노력에 따라서 이스라엘 친구들을 만날 기회를 만들 수 있는 가능성도 얼마든지 열려있습니다. 따로 동아리같은 것은 존재하지 않습니다만, Beit Hillel에서 열리는 행사에 참여하거나(행사공지가 히브리어로 되기 때문에 약간 어려움이 따릅니다만), OSA라는 국제학생전문모임을 통한 각종 문화행사에 참여하신다면 히브리대에서 얻을 수 있는 것 가운데 상당수의 것을 체험하실 수 있으실 겁니다. 

 또 Rothberg 뒷편에 있는 미술대학에 자주 들르실 것을 권유합니다. 그곳에는 실력있는 학생들의 전시회가 매우 자주 열리고, 또한 그곳에서 볼 수 있는 예루살렘의 동쪽, 요르단과 사해, 팔레스타인의 모습이 매우 인상깊습니다.","이렇다할 문화적 충격은 없었습니만, 가끔 동양인으로서 유대인에게 겪는 인종적 경시 경향에 비위가 상하는 경우도 있었습니다. 그것을 제외하면 열린마음으로 이스라엘에서 생활했을 때 문화적 충격이라고 기술할 사항은 찾아보기 어렵습니다.

 생활하는 가운데 조금 다른점이라면 보안상의 이유로 어떤 건물에 들어가든지 소지품을 검사한다는 것입니다. 금속탐지기를 지나는 것은 매우 흔한일이고, 학교에 들어갈때는 신분확인을 합니다. 이것이 처음에는 조금 귀찮을 수도 있으나, 이스라엘의 생활을 한결 안전하게 해주는 요인임을 인식하고 잘 따를 수 있으셔야 할 것입니다.","교내에서는 학부생 사무실이 모여있는 4층과 5층에서 담당교수 혹은 1학년 담당자인 Keri에게 많은 도움을 받을 수 있습니다. 저같은 경우 Keri와의 심리상담을 통해 많은 도움을 받았습니다. 또 히브리어에 관해서는 4층에 위치한 히브리어 부서에 가면 많은 도움을 줍니다. 

 교외에서는 이스라엘 한인교회가 있습니다만, 학교와 관련된 도움보다는 이스라엘에서 한국사람을 만난다는 데에 의의를 두는 것으로 충분할 것으로 생각합니다.","이스라엘로의 교환학생 파견은, 어디로 파견되든지 그 경험은 뜻깊은 것일 것이나, 매우 특별하다고 생각합니다. 학교에서 공부하는 학기중에는 미국인, 캐나다인들과 영어로 의사소통을 하게 되며, 교육환경 또한 미국과 동일합니다. 단지 미국행만 최대의 목표로 학교를 결정할 것이 아니라, 보다 다양한 방면에서의 경험과 교환학생 제도의 의의를 생각해 볼 때 선택의 폭을 넓혀 보다 의미있는 경험을 하시기를 바랍니다. 

 이스라엘로 파견을 생각하시는 분들은 제게 연락을 주셔도 좋겠습니다. 이메일은 jiyeonpark0117 gmail.com 입니다. 사진과 주변국 여행관련 자료도 가지고 있으니, 파견에 도움이 된다면 얼마든지 제공해드리도록 하겠습니다."
