gen_info,env_info,food_info,study_info,office_info,facil_info,mhct_info,help_info,etc_info
"릿쿄대학교는 크게 이케부쿠로캠퍼스와 니자캠퍼스로 나뉩니다. 이케부쿠로캠퍼스는 세 번 정도 밖에 갈 일이 없었기 때문에 정규학기 다녀오신 분들의 후기를 참고하시면 되겠습니다.  릿쿄중학교, 릿쿄고등학교가 같이 있는데, 규모 자체는 학과 3~4개가 모인 정도라 크지는 않습니다. 이케부쿠로캠퍼스의 대표적인 건물이 연희관 쪽 건물들과 닮았는데, 니자캠퍼스는 위치도 그렇고 회색빛의 신식 건물이라 송도캠퍼스 느낌이 납니다.니자캠퍼스는 정확히는 도쿄가 아닌 사이타마에 있으며, 시키역에서 걸어갈 수 있는 거리에 있습니다. 이케부쿠로에서 토조토부선 급행을 타면 금방 갈 수 있는데, 신주쿠나 시부야 등도 와코시를 통해 환승과 급행을 잘 이용하면 40분 안에 갈 수 있습니다. 그 반대편인 사이타마 쪽으로 타고 가면 에도 풍 거리와 고구마로 유명한 가와고에를 20분 안에 갈 수 있으니 주말에 한 번쯤 가보시는 걸 추천합니다.저는 1월 초부터 3주간 진행된 겨울프로그램(SIJP)에 참여했는데, 기후는 우리나라보다 한 달 이른 거로 생각하시면 됩니다. 롱패딩은 안 가져갔고, 3주 동안 갈수록 따듯해져서 숏패딩 하나와 롱코트 하나로 충분했습니다. 따듯한 나라에서 온 친구들은 좀 추워하기는 했습니다. 우산은 사려고 하면 비싸니 작은 거 하나 가져가시길 추천합니다.","교내에는 패밀리마트(24시X) 하나, 학생식당 두 곳과 빵집, 각 건물 층마다 음료 자판기가 있습니다. 점심시간이 길지 않아서 사실상 여유가 없으니 편의점 혹은 큰 학생식당 한 곳을 주로 가게 됩니다. 성당 쪽 문 길 건너에 바로 “Inagaya”라는 식료품 마트가 있는데 편의점보다 저렴하고, 저녁에는 타임세일을 많이 합니다. 음식점은 학생들이 많이 이용하는 듯한 인도 카레 집, 라멘집이 있고 그 외에 다이소, 생필품 마트, 각종 편의점, 역 반대편으로 좀 더 걸으면 북오프와 음식점이 몇 군데 더 있습니다. 가장 많이 이용할 시키역이 걸어서 15분 정도 걸리고 학교 근처보다 저렴한 마트, 드럭스토어, OIOI, 각종 프렌차이즈와 음식점이 즐비합니다. 시키 자체가 그렇게 큰 지역이 아니고 거주 구역이라 높은 건물도 별로 없고 관광지는 아니지만 살기 좋은 동네입니다.","학교 정문 바로 안쪽에 있는 “Tachigawa Memorial Hall”을 기숙사로 이용했고, 2인실 혹은 4인실 선택이 가능합니다. 2인실은 복불복으로 개인 욕실과 책상이 있으나, 책상을 쓸 일은 별로 없고 공용욕실도 충분해서 여러 친구와 지낼 수 있는 4인실을 추천합니다. 시설은 매우 깨끗하고 신식으로 좋습니다. 매일 공용 공간 청소, 주 2회 정도는 방 청소와 쓰레기 수거도 해 주십니다. 이층짜리 건물로 규모 자체는 SIJP 참가자들만 사용해서 꽉 찰 정도로 작고, 공용화장실, 공용샤워실, 로비(전자레인지, 냉장고), 식당(식사, 행사 때만 개방)이 있습니다. 샴푸, 바디워시는 갖춰져 있으니 처음에 필요한 물건 사러 나갈 때 둘러보시고 가기를 추천합니다. 안내실에서 드라이기와 실내 슬리퍼를 빌릴 수 있고, 휴지, 종이컵, 젓가락, 얼음물과 끓인 물을 얻을 수 있습니다.아침 식사가 평일에 와식과 서양식 번갈아 제공됩니다. 일단 정말 맛있고, 챙겨주시는 분이 계시는데 들어갈 때 반갑게 인사해주시고 많이 신경 써주셔서 감사했습니다. 통금시간이 매우 매우 엄격하게 있으며 자원봉사 학생이 방마다 돌면서 체크하는 점호도 있습니다. 점심, 저녁, 주말에는 교내 식당, 편의점, 근처 마트 혹은 식당에서 주로 해결합니다.","<일본어 수업>레벨테스트 후 A, B, C 클래스로 나뉘었습니다. 제 일본어 실력은 당시 N3 정도, 학교에서 일본어(2), (3)을 무난하게 수강한 정도, 회화는 간단한 대화 정도였습니다. 한국에서는 잘하는 편이 아니지만, 참가자 30여 명 중 한국인은 저 혼자였고 호주에서만 25명 이상, 그 외 영어권에서 온 친구들인데 히라가나도 모르는 사람이 태반이었습니다. 유일하게 저와 비슷한 실력이었던 친구 한 명이 있었는데, 감사하게도 그 친구와 둘로만 C반을 만들어 주셨습니다. 다른 학교 프로그램 대비 일본어 수업이 절대적으로 많았기 때문에 거의 과외식으로 수업을 받을 수 있었습니다. 교재는 마루마루를 썼고 내용 자체는 굉장히 쉬웠지만 사람이 적어서 최대한 원하는 대로 수업을 진행해 주셨습니다. 덕분에 처음에 집중하고 싶다고 요청했던 회화가 정말 쑥쑥 늘었습니다. 선생님 여러분이 돌아가면서 수업을 하셔서 매시간 선생님은 달라지지만 커리큘럼을 철저하게 지켜서 가는 식이라 오히려 다양한 분들과 회화를 할 수 있어 좋았습니다. 실력이 애매한데 이번 기수처럼 대부분이 입문자라면 애매하게 배정되어서 크게 배우는 게 없을지도 모르는데, 어느 정도 하신다면 예상외로 일본어가 엄청나게 늘어서 올 수 있습니다.마지막에 주제발표를 하는데, A, B반은 일본어 자기소개와 영어로 일본 관련 자유주제 발표를 했고, C반은 일본어로 자유주제 발표를 했습니다. C반은 일본어 발표라 다른 친구들은 들어오지 않았지만 Vice President 교수님과 릿쿄대 재학생들이 청중으로 들어왔습니다. 준비 과정에서 선생님들과 릿쿄대 학생들이 많이 도와주어서 일본학교에서 발표하는 방식도 체험(?)해볼 수 있었습니다. 수업과 기숙사에서 도움을 주었던 릿쿄대 친구들과 친해질 기회도 되었습니다. 엄청나게 부담을 가질 정도의 발표는 아니니 자신이 목표한 바에 따라서 과제 수행 정도냐 무언가를 남기느냐가 되겠습니다.<사회 문화 수업과 필드트립>세 번 정도 이케부쿠로 캠퍼스에 가서 교수님들께 수업을 듣고 필드트립으로 에도 도쿄박물관, 우체국, 국립농악원에서 견학 및 체험을 했습니다. 개인적으로 매우 흥미로운 주제들이었기 때문에 꽤 만족감이 높았습니다.<그 외>자유롭게 신청을 받아 참여하는 프로그램이 여럿 있는데 가정방문 외에는 전부 참여했습니다. 가장 자주 있는 점심시간에 글로벌라운지에서 운영하는 프로그램은 부담 없이 참여할 수 있고 재미있습니다.테니스부 체험은 20여 명이 사전신청을 했는데 전날 피곤한 일정이 있었던 탓인지 당일에 저와 늦게 온 친구 둘만 참여해서 모두가 매우 당황했지만, 저에게는 프로그램 중 가장 기억에 남는 추억 중 하나일 정도로 좋은 경험이었습니다. 열심히 준비한 테니스부 친구들에게는 미안하지만 소수로 참여했기 때문에 영어 대신 일본어를 쓸 수 있어서 소통이 더 원활했고 다른 활동보다 더 재미있었습니다. 이 친구들과도 계속해서 연락을 이어가고 있습니다.Noh 관람은… 일본 문화의 거의 모든 부분을 좋아하는 저에게도 높은 장벽이었습니다. 심지어 유료였는데 결국 같이 갔던 친구들과 끝까지 못 보고 나왔습니다. 유튜브로 찾아보시고 신청하시길 바랍니다.도서관은 초반에 투어를 하는데, 아주 크진 않지만 쾌적합니다. 학생증으로 출입 가능하며 책도 빌릴 수 있고 시설도 전부 이용 가능합니다. 열람실은 없지만 조용히 공부할 수 있는 공간과 이야기하면서 할 수 있는 공간이 잘 갖춰져 있습니다. 단, 24시는 아니고 쉬는 날도 있습니다.",단기프로그램 자체가 국제교육부 소관이라 프로그램 전반에 걸쳐서 국제교육부 선생님들을 만날 기회가 아주 많습니다. 프로그램 중에는 영어가 기본이 되며 일본어로도 소통이 가능합니다. 업무시간 중에는 사무실로 직접 찾아가도 되고 가장 빠른 연락수단은 처음에 가르쳐 주시는 이메일입니다.,"앞서서 대부분 설명이 되었습니다. 체육관이 사전에 오리엔테이션을 참석하면 출입증을 받아서 자유롭게 무료로 사용 가능합니다. 원래 운동을 하진 않지만 궁금해서 오리엔테이션을 다녀오긴 했는데 한 번도 이용하지 않았습니다. 기본적인 시설은 갖춰져 있는 것 같습니다. 단기프로그램이라 딱히 부 활동이나 클럽에 들 기회는 없었습니다. 그리고 1월 중이라면 학교는 기말고사 기간이고 어쩌면 일본 수능과 릿쿄 입학시험과 겹칠 수도 있습니다. 제가 참여했을 때는 둘 다 겹쳤는데, 그중 하나에서는 수험생 배려를 위해 전원 시키역 근처 호텔로 옮겨 주말을 보내기도 했습니다. 공휴일이 걸려있으면 쉬고, 대신 토요일에 보충 일정이 있을 수 있습니다.",특별히 없었습니다.,"릿쿄대 재학생들이 자원봉사로 꽤 많이 참여합니다. 기숙사에 3~4일씩 돌아가면서 두 명씩 상주하며, 방과 후에 로비에 기다리면서 숙제를 도와주거나 대화를 할 수 있습니다. 숙제가 사실 도움받을 만한 건 별로 없고 대부분 참여자끼리 놀거나 쉬느라 로비에 가는 친구들이 별로 없었는데, 저는 적극적으로 활용하시길 강력하게 추천합니다. 기본적으로 프로그램에 속해서 참여 학생들에게 큰 관심을 가진 친구들이라 적극적으로 말을 걸어주어서 재미있었고 일본어를 정말 많이 사용해볼 수 있었습니다. 일본인 또래를 만나기 쉽지 않은데 정말 좋은 기회였습니다. 거기서 만난 친구들과 프로그램 이후에 도쿄에서 만나기도 했고 지금까지 연락하며 지내고 있습니다. 프로그램 참여하면서 참여하는 친구들과 친해지는 것도 너무 소중하고 좋은 추억이지만, 한편으로 프로그램에 적극적으로 참여하면서 일본 친구들을 만드는 것도 다시없는 기회이기 때문에 딜레마 아닌 딜레마를 겪을 수도 있습니다. 3주가 긴 시간이 아니라 어떻게 해도 아쉬움은 남습니다.","단기프로그램 정보는 찾기가 힘들어서 가능한 한 자세히 적어보았습니다. 프로그램 종료 즈음 중국인 룸메이트가 명절을 앞두고 그때만 해도 중국 한 도시의 문제인 줄 알았던 코로나-19 소식으로 걱정했던 게 생각나네요. 보고서를 쓰는 현재 상황으로는 여름프로그램이 열릴지 미지수지만, 기회가 된다면 강력하게 추천합니다.저는 처음에는 정규 프로그램 참여를 못 하게 되어서 아쉬운 마음에 단기프로그램에 참여했는데 오히려 그만의 장점을 많이 누렸습니다. 정규학기 파견과 별개로 신청해도 좋겠다고 생각이 들 정도입니다. 일본어가 목표 시고 기본기가 있으시다면 회화를 중심으로 해서 확 늘 수 있습니다. 프로그램이 워낙 잘 짜여 있기도 하고, 특히 일본인 또래를 만날 기회가 충분하므로 기회를 잘 살리면 저처럼 프로그램 이후 따로 만나기도 하고 계속 연락을 이어가는 친구도 만들 수 있습니다.한편으로 일본어보다 많이 쓰는 게 영어이고, 프로그램 자체도 영어가 기본이라서 영어 쓸 일이 굉장히 많습니다. 예상은 했지만 당장 룸메이트부터 해서 예상보다 훨씬 더 영어로 소통할 일이 많습니다. 정규학기 다녀오신 분들도 많이 이야기하지만 나름 일석이조의 공부가 되는 것 같습니다. 또 재미있었던 점은, 먼 곳에서 온 친구들이 많아서, 이 친구들은 온 김에 최대한 많이 도쿄를 돌아다니고 싶어 하기 때문에 주말마다 마음 맞는 친구들끼리 곳곳으로 나갈 수 있었습니다. 이때 가능한 한 많이 나가서 좋은 추억을 많이 쌓으시길 바랍니다. 요즘은 SNS가 많이 발달해서 그때 친해진 친구들과 만든 페이스북 그룹 채팅 등에서 가끔 추억을 회상하고 있습니다.언젠가 여유가 생기면 블로그에 기록해 보고 싶은데, 언제가 될지 모르겠지만, 궁금한 점이 있으시다면 아마 네이버에 검색하면 단기프로그램 수기를 쓴 블로그가 거의 유일하게 나올 테니, 물어보시면 도와드리겠습니다! 겨울프로그램으로 1월 6일에 도착해, 한해의 시작을 릿쿄에서, 3주라는 짧지만 잊을 수 없는 굵은 추억을 남길 수 있어 행복했습니다."
