gen_info,env_info,food_info,study_info,office_info,facil_info,mhct_info,help_info,etc_info
"난잔대학교는 나고야캠퍼스와 세토캠퍼스로 나누어져 있다. 이 중에서 교환학생들이 공부하는 Center for Japanese Studies는 나고야캠퍼스에 위치하고 있는데, 난잔대학교 나고야캠퍼스의 규모는 그리 크지 않지만, 비교적 쾌적하고 깨끗했다. 특히 Green area등의 잔디밭이나 나무가 우거진 곳이 많아서 경관도 꽤 좋은 편이다. 
대학교는 시내 중심부(&#26628;, 나고야역)에서 지하철로 2,30분 정도 떨어진 곳에 위치하고 있고, 학교주변은 우리 학교와 비교해보았을 때, 주택가 안에 자리를 잡고 있어서인지 매우 조용했다. 학교의 정문부터 가까운 지하철역인 八事日赤, いりなか역까지는 걸어서 10~15분 정도의 시간이 소요된다. 근처에는 난잔대학교 뿐만 아니라 나고야대학교, 메이죠 대학교 등이 모여 있어서 조용한 학습분위기가 조성되어 있다. .

나고야의 기후는 내가 생활한 겨울과 봄은 기온상 서울보다 따뜻했지만, 그래도 가끔 바람이 심하게 불 때가 있어서 조금 춥다는 느낌을 받을 정도였다. 그러나 현지 친구들에 의하면 여름은 정말 덥고 길다고 하니, 가을학기에 파견되는 학생들은 준비가 필요할 듯 하다. 또한 출발 전 지진에 대해서 주의를 들었고, 난잔대학교에서도 지진에 대해서 교육을 받았는데, 내가 생활한 5개월 동안에도 낮은 강도의 지진이 2번 정도 있었으나, 별 문제는 없었다.","대학교 주변에는 별다른 유흥시설을 찾아보기 힘들고, 고급주택이 밀집해 있다. 처음 난잔대학교에 도착했을 때는 조금 답답하고, 심심할 것 같은 느낌이 들었으나, 오히려 학교와 시내가 떨어져 있어서 공부를 할 때에도, 놀 때에도 집중할 수 있어서 더 좋았던 것 같다. 그래도 주변에 생활에 필요한 마트나 약국, 병원, 식당 등은 갖추어져 있어서 생활에 불편함을 느끼지는 않았다.","난잔대학교로 파견된 학생은 학교와 가장 가까운 나고야교류회관, 야마자토교류회관, 그리고 여러 개의 사설기숙사, 홈스테이 중에서 한 곳에 들어가게 된다. 나의 경우는 Rainbow house라는 사설기숙사에 들어가게 되었는데, 학교로부터는 조금 멀리 떨어진 곳에 위치해 있는 곳이었다. Rainbow house는 Suggino라는 분께서 난잔대학교에 기증해주신 기숙사로 겉모습만 보았을 때는 보통의 가정집과 별반 차이가 없다. 기숙사에는 일본인학생 1명과 외국인 유학생 5명이 생활하는 share house의 형태로 각자의 방이 있고, 부엌과 화장실, 욕실 등을 공동으로 사용하는 형태이다. 방에는 침대나 책상, 옷장 등 생활하는 데 필요한 가구나 물건이 대부분 갖추어져 있고, 부엌의 경우도 냄비나 접시 등의 조리도구 등이 갖추어져 있으니 rainbowhouse에 배정받은 학생은 참고하기를 바란다. 다른 기숙사에 비해서 작기 때문에 큰 파티나 행사 등은 없지만, 대신에 다른 나라의 학생들과 더욱 가족적인 분위기로 생활 할 수 있고, 일본인 친구와 같이 생활하기 때문에 일본어실력을 키울 수 있는 좋은 기회도 제공된다. 청소나 식사, 세탁 등은 기숙사에 비치되어 있는 것들을 사용하여서 각자 해결하고, 공동으로 사용하는 물건 중 소모품 등은 한 달에 한 번 관리하시는 분을 통해서 공동으로 구입하여 사용하도록 되어있다. Rainbow house는 우에다역에서 15분 정도 떨어진 곳에 위치하고 있고, 학교까지는 지하철을 이용하여 통학하게 되어있다. 일본의 지하철요금은 비싸기 때문에 한 달에 한 번, 통학정기권을 구입하여 사용하였으며, 매달 기숙사비 이외에도 인터넷비용과 전기료를 따로 납부하였다. 
식사의 경우는 개인이 해결해야 하므로 보통은 기숙사에서 만들어 먹거나, 식당에서 사먹게 되는데, 나의 경우는 기숙사가 학교에서 멀었기 때문에, 아침과 저녁은 기숙사에서 만들어먹고, 점심은 학교에 있는 학생식당이나 도시락을 이용하였다. 특히 점심시간의 경우, 학교 안에 있는 식당에 비해 학생수가 많아서 벤치나 잔디밭에서 도시락을 사먹는 경우가 많았다. 우리나라보다는 배달문화가 발달되어 있지 않아서 편의점이나 가판대의 도시락을 이용하는 학생이 더 많다. 또한 일본은 인스턴트 음식이나 도시락이 잘 발달되어 있어서, 요리를 못하는 나도 5개월 간 식생활에 별 지장이 없었다. 그러나 가끔 룸메이트들과 함께 각자 자신의 나라의 요리를 만들어 소개하고 나누어 먹을 기회가 있으므로, 간단한 요리법을 알아가는 것도 큰 도움이 될 것 같다.","교환학생들은 유학생별과에 소속되어서 전반적으로 보통의 일본인 학생과는 별개로 수업을 듣게 된다. 수업수업은 오전과 오후로 나눌 수 있는 데, 오전은 보통 일본어레벨테스트를 걸쳐서 결정된 반에서 일본어수업을 들었다. 내가 속한 레벨의 학생은 30명 정도였는데, 이를 10명씩 3반으로 나누어서 소수의 학생이 같이 수업을 들었다. 단어나 한자, 문법 등 매일매일 쪽지시험이 있고, 2주에 한 번씩 종합시험, 그리고 중간고사와 기말고사까지… 생각보다는 숙제나 시험이 꽤 있어서, 공부할 수 있는 분위기를 만들어주었다. 매우 어렵거나 시간이 소요되는 숙제나 시험은 없으므로 매일의 숙제와 복습만 꾸준히 한다면 그다지 힘들지 않을 것이라고 생각한다. 
    오후 수업의 경우, 일영번역, 일본의 경제, 정치, 문학, 역사 등의 수업이 영어로 진행되고, 다도(茶道), 서예, 이케바나 등의 문화체험수업은 일본어로 진행된다. 나의 경우 영어강의에 대한 두려움도 있었고, 일본에 온 만큼 일본문화를 체험하고 싶다는 생각에 문화체험수업을 위주로 수강하였다. 언어를 공부할 때, 가장 필요한 것이 그 나라의 문화와 정신을 이해하는 것이라고 하는데, 오후의 문화체험수업은 그러한 부분은 가장 잘 충족시켜주는 수업이었다고 생각한다. 
   도서관은 1학기 동안 그리 많이 이용하지는 않았기 때문에 상세하게 알고 있지는 못하지만, 일본인학생들의 시험기간을 피해서 이용하기만 한다면 아늑하고 조용한 분위기에서 공부할 수 있다. 또한 도서관 2층에는 CJS학생들을 위한 섹션이 마련되어 있어서, 외국어로 된 서적이나 일본어공부에 필요한 자료를 쉽게 찾을 수 있게 되어서 편리했다. 도서관 이용과 관련하여서는 오리엔테이션에서 상세하게 설명을 해주어서 이용이 어렵지는 않다.","국제교육부(Center for International Studies)에, 교환학생들이 공부하는 Center for Japanese Studies (CJS)가 소속되어있다. 국제교육부 건물은 정문에서부터 약 3,4분 정도 걸리며, 건물 앞에는 Greenarea가 있어서 점심시간이나 쉬는시간이면 학생들이 잔디밭에 앉아서 이야기를 나누거나 도시락을 먹는 등 활기가 넘치는 곳이다. 건물 1층에는 CJS Office라고 하여서 CJS학생들의 학업과 생활에 걸친 전반적인 관리를 하고 있으며, 2층의 경우에는 수업과 관련한 강사분들이 계시는 강사실이 위치하고 있다. 1층 Office의 경우에는 Office내부에 개별 우편함이 설치되어 있어서 하루에 한 번 이상 찾아가도록 되어있다. 개별우편함을 통해서 숙제를 되돌려 받거나, 정보를 취득하는 것 뿐만 아니라 문제발생이나 알림사항을 바로바로 체크할 수 있도록 하고 있다.
Office에서는 학생들의 학습, 보건, 거주, 보험, 아르바이트 등 생활과 학교생활의 전반적인 것을 담당하는데, 오전 9시부터 4시반까지 언제든지 자유롭게 상담할 수 있다. 또한 직원분들 모두가 친절하셔서, 문제가 생기거나 안내받고자 하는 것이 있을 때 부담없이 찾아갈 수 있었다. 휴일의 경우도 비상연락망을 통하여서 상담을 받을 수 있었다. 
Office에서는 유학생들이 일본생활을 즐길 수 있도록 여러가지 체험행사나 견학 등도 관리하고 있었는데, 내가 있었던 봄학기에는 나고야투어와 시라카와코, 히코네 탐방 등과 도요타 자동차 공장 견학 프로그램, 가부키 관람 등의 프로그램이 있어서 저렴한 비용으로 여행을 가거나 여가를 즐길 수 있었다.",,"처음 나고야에 도착했을 때부터 한국으로 돌아올 때까지, 별다른 문화적 충격은 경험하지 못했다. 그것은 내가 아무곳에서나 무엇에나 쉽게 적응하는 성격이기도 하거니와 전반적으로 일본과 한국은 많이 닮아있기 때문이라고 생각한다. 그러나 여러나라의 학생들과 지내다보면 불편한 점을 느끼거나 이해할 수 없는 부분이 있을지도 모르겠다. 하지만 그것을 이해하고 수용하면서 같이 어울리는 것이야말로 큰 경험과 공부가 될 것이라고 생각한다.",,"5개월이라는 시간이 짧아서일까. 아직도 일본에서의 생활이 어젯밤의 꿈같이 느껴진다. 비록 짧은 기간이었지만, 많은 것을 배우고 깨달으면서 나의 미래에 대해서도 조금 진지하게 고민해 볼 수 있었다고 생각한다. 교환학생에 대해서 생각해보고 있는 분이 있다면, 대학생일 때 누릴 수 있는 특권을 최대한 활용하라고 이야기해주고 싶다."
"난잔대학교는 나고야에 위치한 4년제 종합대학이다. 나고야는 일본 본토 중앙에 위치한 도시로, 오른쪽에 도쿄를 왼쪽에 교토 및 오사카를 두고 중앙에 위치하고 있어 어느 곳을 관광하기에도 편리한 지리적 위치를 자랑하고 있다. 도쿄처럼 화려한 볼거리가 가득한 도시는 아니지만 또한 일본에서는 손가락으로 꼽는 큰 도시라 할 수 있다. 시내 곳곳이 지하철 및 전철로 연결되어 있어 교통은 매우 편리하다.
나고야의 기후는 기본적으로 서울과 비슷하지만, 평균 4,5 도 정도씩 더 덥다고 생각하면 된다. 내가 도착한 2005년 1월, 한국에서 입고 간 두꺼운 코트가 일본 도착하고서 꽤 덥게 느껴졌던 기억이 떠오른다. 나고야의 겨울에 적응되어 돌아온 2005년 12월, 서울의 추위가 새삼 매섭게 느껴질 정도로
겨울이 꽤 따뜻한 만큼 여름은 정말로 덥다. 나고야의 무더운 더위는 잊을 수가 없다. 습도도 높고 그 무더운 여름도 한 4개월 지속되는 듯한 기분이었다.
나고야 하면 바로 이 더위와 함께 대표적인 것이 지진이 자주 일어난다는 것이라고 한다. 그래서 가기 전 지진에 대해 걱정을 많이 하고 갔는데 사실 나는 지진을 경험한 적이 아쉽?게도 한번도 없다. 내가 머무른 2005년 1년동안 지진이 두 번 정도 있었는데 미미한 정도였으며 더구나 그 때 지하에 있어서 그랬는지 전혀 느낄 수가 없었다. 지진발생시의 적절한 대처방법을 평소에 교육받았었으며 생명의 위협을 느낄 정도의 지진은 확률적으로 매우 적다고 하기 때문에 크게 걱정을 하며 지내진 않았었다. 
외국생활을 하고 있다는 것을 순간순간 잊고 살 정도로 일본은 한국과 크게 다르지 않았다. 생활하는 데 있어 외국인으로서 불편함이 없었다는 측면을 말하는 것이다.(거주하던 기숙사는 국제학사라 물론 일본인, 외국인들이 많았다). 공공기관의 친절한 서비스 및 다양한 편의시설, 이용에 편리한 다양한 상품,한국인에 대한 일본인들의 호의과 관심 등은 나의 일본 유학생활을 한층 편안하고 풍요롭게 해주었다. 
관광으로 도쿄, 규슈, 홋가이도, 교토 등 일본 열도 여러곳을 돌아다녀봤으나, 도쿄처럼 복잡하지도 않고 교토, 아사카처럼 항상 관광객으로 붐벼 들떠있는 분위기도 아닌 나고야야 말로 한마디로 살기에 제일 편하고 좋은 도시라는 생각을 하고 있다.
나고야의 중심에 위치하고 있는 난잔대학교는 크기는 그다지 크지 않지만 그 나름의 아담한 멋을 지니고 있다. 가기 전 연세대학교에 비해 그리 크지 않다는 선배들의 경험보고서를 보고 짐작은 했기 때문에 실망같은 건 그다지 크지 않았다. 오히려 교환학생으로서 학교에 빨리 적응할 수 있는 이점이 있었으며 친구들과의 교류에도 도움이 되었다. 정문에서 백양로와 같은 길을 따라 들어가면(길이는 4분의 1 정도) 왼쪽에 중앙도서관이 위치하고 있고 그 안쪽으로 양측에 3,4층 정도의 건물이 자리하고 있다. 한 10분쯤 걸어들어가면 제일 안쪽에 학생회관이 있고 바로 후문이 있다. 그러니까 길이 상으로는 10~15분 정도면 학교 끝에서 끝까지 오갈 수 있다는 이야기다. 그러나 그 양쪽으로 건물과 넓은 잔디밭 광장 등이 있어 구석 구석 캠퍼스를 즐길 곳은 의외로 많다. 이렇듯 학교 전체의 분위기는 작고 아담하고 아기자기하며 주위를 둘러볼때마다 아는 얼굴이 곳곳에서 보이는 환경때문에 금방 익숙해지고 학교생활을 편히 즐길 수 있는 큰 장점이 된다고 생각한다.","난잔대학과 가까운 지하철 역은 세 곳이 있다. 메이조센 나고야대학 역, 야고코 닉세끼역, 추루마이센 이리나까역, 이렇게 세 역인데 각각 내려서 도보 10~15분 정도면 대학교에 도착할 수 있다. 
주변에는 병원, 약국, 편의점, 음식점, 우체국, 은행, 비디오 대여점, 서점, 각종 대형 슈퍼 등 기본적인 시설이 잘 되어 있기 때문에 생활하는 데 불편함은 전혀 없다고 보면 된다. 유동인구라고 해봤자 대학교 학생, 인근지역 주민 들이 전부이기 때문에 항상 조용하고 차분한 분위기이다. 특히, 대학인근이라고 해도 술집이나 노래방 등 유흥시설이 별로 없어 시끄럽고 복잡한 분위기는 전혀 느낄 수 없어 한층 여유로운 생활이 가능했다.","나는 난잔에서 공부하는 1년동안 [난잔대학 나고야 교류 회관] 이라는 국제 기숙사에서 거주했다. 난잔대학교 정문에서 신호등을 건너면 바로 앞에 위치한 건물로, 대개  기숙사에서 교실까지는 10분이라 해도 될 정도로 가깝다.
교통비가 비싼 나고야에서 차비가 안 드는 것이 가장 큰 장점이며 시간 절약도 상당한 이점이 될 수 있다.  기숙사 내는 아파트 식으로 되어 있어 한 아파트에는 개실이 4개, 그 외 부엌, 거실, 욕탕, 화장실 등은 공동으로 쓰는 형태이다. 자기만의 방이 있으면서 그 외는 3명의 룸메이트들과 공동으로 사용하기 때문에 프라이버시도 보장되면서 동시에 외롭지 않은 이러한 아파트가 총 14~15호실 되기 때문에 다른 호실에도 자유로이 드나들며 같이 저녁도 먹고 이야기하며 숙제도 하는 등, 함께 할 기회가 자연스레 주어진다. 티비, 비디오, 등 공동 편의시설이 잘 되어 있기 때문에 한결 즐거운 생활이 가능하다. 룸메이트는 4명으로 구성이 되는데 기본적으로 일본인은 1명 정해져 있다. 그외 유학생이 3명으로 아시아, 영미권, 등 비율을 적절하게 섞어주기 때문에 다양한 국가의 다양한 친구들을 만나볼 수 있는 기회가 된다. 
식사는 기본적으로 각자가 해먹는 형태이다. (참고로 식당은 없다.)부엌에는 우려와는 달리 냉장고, 전자렌지, 토스터기, 밥솥, 식기류, 조리기구 등 전반이 모두 갖추어져 있어 전혀 불편함이나 어려움이 없었다. 요리법만 한국에서 몇 개 익혀 간다면, 가져간 요리책을 보면서 혼자 요리해보는 재미도 쏠쏠할 것이다. 사생 모두가 이렇게 요리를 해 먹기 때문에 다들 요리가 늘 뿐 아니라 세계 각지에서 온 친구들 덕분에 일본요리 뿐 아니라 세계 각지의 요리를 먹어볼 수 있고 그 문화를 체험할 수 있다. 언뜻 생각하면 취사를 하는 것이 귀찮게 생각될 수도 있지만, 나의 경우에는 그것을 기회로 나 또한 한국요리도 많이 익히게 되었고 같이 요리를 하고 밥을 먹는 이러한 시간을 통해 친구들과도 더더욱 친하게 될 수 있었다고 생각한다. 
기숙사 1층에는 관리인실, 세탁실, 외부 방문객을 위한 미팅룸, 각종 행사 및 자유로운 사내 교류를 위한 커뮤니티 룸 등이 있다. 관리인 분은 4분이 계시는데 모두 사생을 가족처럼 아끼고 챙겨주신다. 기숙사 생활 전반을 관리해주며 격주로 각방 침대 시트를 갈아주기도 한다. 
나고야 교류회관은 난잔대학교의 4,5 곳의 기숙사의 중심이 되는 곳으로 유학생들을 위한 각종 파티와 행사를 주최하며 말 그대로 상호교류를 주선, 촉진하는 역할을 한다. 때문에 교류회관 사생에게는 그러한 기회를 통해 자연스레 사생간 뿐 아니라 외부에서 방문하는 일본인 및 타 유학생과도 친해질 수 있는 기회가 주어진다. 홈스테이도 물론 일본 가정과 문화를 체험한다는 점에서 좋지만, 유학생들과의 보다 폭넓은 교류, 가까운 위치, 독립심의 배양 등을 생각한다면 이 교류 회관을 강력히 추천한다.
개인적으로 일본 유학생활 하면, 일본어를 배운 것보다 이 교류회관에서의 꿈같은 생활이 가장 먼저 떠오를 것 같다.","난잔에서 유학생 수업은 크게 오전수업과 오후 수업으로 나뉘어 진다. 오전수업은 IJ수업으로 일본어를 가르쳐주는 수업이다.IJ 200,300,400,500,600,700 반 이렇게 모두 7개 반으로 나뉘어진다. 가자마자 오티 첫날 분반 테스트를 받고 수준별로 각 반에 배치된다. 각 반은 20~30명이지만, 섹션을 나누어 수업을 하기 때문에 실제로 수업은 거의 10명 안 팍의 친구들과 하기 때문에 매우 세세하고 효율적인 일본어 수업을 받을 수 있다. 한 학기가 끝나면 다음 학기는 자동적으로 그 윗반으로 올라가며 분반 테스트에서 좋은 성적을 거두면 원하는 자에 한 해 월반도 가능하다. 나의 경우는 기나긴 여름방학을 내내 일본에서 지내며 일본어 공부에 주력했기 때문에 두 개의 반을 월반할 수 있었다. 초기에 일본어를 거의 구사하지 못했던 나의 경우는 IJ수업에서 엄청난 도움을 받았다고 생각한다. 학생 한 명 한 명의 수준과 특징을 파악하고 유치원 아이들 관리하듯 일본어 실력을 향상시켜 준다. 매일 많은 양을 공부하지만 수업이 전혀 지루하지 않기 때문에 즐겁게 수업에 참여하다보면 그 누구라도 어느새 일본어 실력이 쑥 늘어났음을 느낄 것이다.  
오후 수업은 두 가지 형태인데, 영어로 진행되는 일본 정치, 경제, 문화 등에 관한 수업, 일본어로 진행되는 일본어 작문, 비지니스 회화 수업, 일본 사회연구, 그 외 번역 수업, 일본인재학생들과 함께 들을 수 있는 세미나 수업 등 다양한 과목이 개설되어 있다. 분반에 따라 시간표가 짜여져 있는 오전수업에 비해 오후는 전적으로 본인의 선택에 의해 시간표가 정해진다. 다양한 과목이 개설되어 있기 때문에 선택의 폭이 넓고 본인이 원하는 목표에 맞춰 그 목표를 달성할 수 있다. 영어도 동시에 공부하고 싶은 사람들은 외국인친구들과 영어 수업을 듣기도 하고 오전에 공부한 일본어를 보충하고 싶은 사람들은 일본어 관련 수업을 듣는다. 그 밖에 일본 예술 문화를 체험해볼 수 있는 일본 전통 꽂꽂이 및 서예, 수묵화 등에 관한 수업도 있다.",국제 교류 업무를 담당하고 교환학생의 모든 사항을 관리해주는 난잔의 국제교육부는 Center of Japanese Studies 라는 이름의 부서이다. 유학생 별과에 소속된 유학생들은 거의 매일 같이 CJS 오피스에 가서 개인 메일 박스를 확인하고 각종 공지나 안내를 받는다. 이곳에서는 단순 서무만 담당하는 것이 아니라 원활한 유학생활을 위해 웰컴 파티 등 각종 행사도 주최하며 도요타 공장 등 유명한 곳의 견학 및 명소 관광도 주관하여 학생들이 쉽게 유학생활을 해나가도록 지도해준다. 처음 이런 저런 복잡한 절차 및 상황에 부딪힐 때마다 매번 이곳 CJS 오피스 직원들로 인해 수월하게 해결할 수 있었다. 1년 동안 정말 많은 도움을 받으며 늘 고마운 마음을 가지고 학교를 다닌 기억이 난다.,"난잔대학은 동아리 활동이 정말 활발하다. 스포츠는 물론이고 각종 취미생활, 문화생활, 종교 생활 등을 동아리 활동을 통해 모두 할 수 있을 정도로 그 종류도 다양하고 활동 수준도 상당하다. 이름만 제각각이고 실제는 친목회에 가까운 클럽이 아닌, 정말 그 활동에 관심과 열정을 가지고 있는 사람들이 모여 심도있게 활동하는 모습이 곳곳에서 보인다.
나의 경우는 유학생 별과의 행사, 기숙사 행사, 그 외 아르바이트 등으로 시간적 여유가 없어 동아리 활동을 해보진 못했지만, 주변 친구들을 보면 본인 의지만 있으면 언제든, 어떤 동아리든 가입해 적극적으로 활동하며 유학생활을 즐길 수 있는 것 같다. 유학생이 많은 난잔대학교인 만큼 일본인 재학생들도 유학생들을 받아들이는 데 매우 익숙해져있기 때문에 커뮤니케이션 및 적응 등의 부분도 전혀 문제가 되지 않는다고 생각한다. 굳이 동아리를 들지 않더라도 마음껏 학교 체육시설을 이용할 수 있는데, 나의 경우는 시간이 날 때 마다 수영장을 가서 수영을 하기도 했다. 그 외 헬스장, 농구장, 탁구장 등 학생들이 이용할 수 있는 체육시설이 잘 되어 있어 매우 편리하게 이용할 수 있었다. 교내에 여행사도 있어서 항공티켓을 알아볼 때, 투어여행을 알아볼 때 등 요긴하게 이용할 수 있다.","일본 내에서 일본인들에게 느끼는 문화충격은 크게 없었다. 충격이라기보다는 아, 이런 점이 일본인들의 특징이구나, 이러한 공통점이 있구나 하는 정도의 깨달음이었다. 다만 워낙 영미권 학생들이 많다보니, 그리고 미국 캐나다 등에서 서양인들과 함께 살아본 경험이 없다보니 자연히 그 쪽에서 느끼는 문화충격이 더 컸던 게 사실이다. 너무 많아 하나하나 열거할 순 없지만, 말로만 듣던 개인주의를 직접 몸으로 깨달은 것이 가장 주된 것일 것이다. 처음엔 단순히 소위 '정 떨어진다'라는 식으로 느꼈었지만 시간이 지나고 더 많은 사람들을 겪고 좀더 넓은 시야로 판단하게 되면서 그 문화를 보다 깊게 이해할 수 있게 되었다. 이러한 것 때문에 매우 혼란스러워하거나 친구들을 사귀는 데 큰 어려움은 없었다. 오히려 누구나 한번쯤은 겪어볼 만한 뜻깊은 경험이 되리라 생각된다.",나는 무슨 문제가 발생하면 언제나 국제교육교류부 CJS직원들에게 의논하고 조언을 얻곤 했다. 그러나 크게 곤란한 일을 당한 적이 없고 대부분 학교 교내의 사소한 문제였기 때문에 거의 금방 해결이 되었던 것 같다. 딱히 문제가 아니더라도 알아보고 싶은 것이 있을 때는 가서 물어보고 도움을 받았던 기억이 있다. 큰 문제라 해도 일단은 CJS에 알리고 조언을 구하는 것이 제일 확실하고 안전할 것이라 생각된다.,
