gen_info,env_info,food_info,study_info,office_info,facil_info,mhct_info,help_info,etc_info
"릿쿄대학의 캠퍼스는 도쿄도 토시마구의 이케부쿠로 캠퍼스와 
사이타마 현 니자시의 니자 캠퍼스의 두 곳으로 나뉘어져 있습니다.
관광학부와 복지학부를 제외한 대부분의 학부는 이케부쿠로 캠퍼스에
있어, 저는 이케부쿠로 캠퍼스에서만 생활했습니다.
처음 릿쿄대학의 캠퍼스를 접했을 때의 느낌은 '작다'였습니다.
하지만, 작다는 것이 결코 안좋은 의미는 아닙니다. 캠퍼스 안에서 
이동할 때, 어디를 가더라도 도보 5분이면 충분하기 때문에
강의와 강의 사이의 휴식시간 10분동안 강의실을 이동하는 데에
부족함이 없어 여유있게 다닐 수 있었습니다. 

캠퍼스 근처에 있는 이케부쿠로역은 JR各線、西武池袋線、東武東上線、
地下鉄丸の内線、有楽町線이 교차하는 큰 역이기 때문에, 교통은
상당히 편리한 편입니다. 

동경의 기후는 서울에 비해 온화한 편입니다. 
여름은 생각했던 것 보다 그렇게 덥지는 않았지만, 겨울은 기온보다
일본 가옥의 난방 구조상의 문제로 상당히 춥게 느껴졌습니다. 
겨울을 지내게 된다면 전기장판을 사용하는 것이 좋을 것입니다.","릿쿄대학이 위치한 이케부쿠로에는 西武、東武등 대규모 백화점 네 곳과
각종 상점들이 자리잡은 번화가입니다. 어떻게 보면 신촌 거리의 규모를
조금 확대해 놓은 듯한 느낌이기도 합니다. 캠퍼스가 위치한 쪽인 
이케부쿠로 역 서쪽보다, 반대편인 동쪽이 더 번화한 느낌이었습니다.
생활하는 데 불편함은 크게 느끼지 못했습니다.","저는 올해 처음 계약을 맺은 J-Dream富士見台라는 기숙사에서 생활했습니다.
이케부쿠로 역에서 西武池袋線보통열차로 15분쯤 걸리는 富士見台역에서
도보 3분 정도 거리에 위치한 기숙사인데, 저의 경우에는 2인 1실로
생활했습니다. 방에는 욕실과 베란다, 조그만 부엌이 갖추어져 있으며,
냉장고, TV, 컴퓨터 1대, 전기밥솥, 그리고 책상 2개가 있습니다. 
방에서 LAN 케이블로 인터넷 접속이 가능하며, 요금은 관리비에 
포함되어 있습니다.
다만, 식사는 제공되지 않으므로 직접 해결해야 합니다. 저는 주로 
직접 요리를 해 먹었습니다. 富士見台역의 마트와 근처의 主婦の店、
LAWSON 100에서 식재료를　저렴하게 구입할 수 있으므로, 직접 요리를 
하게 된다면 식비를 절약할 수 있을 것입니다. 

제가 있을 때에는 한국인 매니저가 있었는데, 처음 생활하는 데 있어 많은
도움을 받았습니다. 전체적으로 방이 두 사람이 지내기에는 좁은 
느낌이지만, 생활하는 데 큰 불편은 없었습니다.","릿쿄의 수업은 주 1회, 90분 강의로 2단위가 됩니다. 제가 수강한 경영학과
과목의 경우 대부분의 수업이 대형 강의였으며, 우리학교와 다른 점은 
'조모임'이 없었다는 것입니다. 다만, '세미나'과목은 한 교수님 밑에서
소수의 학생들이 스터디를 하는 것으로, 한 분야에 대해 깊이있는 
공부를 할 수 있습니다. 주로 조모임 같은 분위기로, ppt를 이용한 발표,
다른 학교 세미나와의 공동 발표, 그룹 논문 작성 등의 활동을 합니다.

그리고, 일본어 능력이 어느 정도 되면, 담당 교수와의 면접을 거쳐
제2외국어 과목을 수강할 수 있습니다. 저는 중국어를 들었는데,
잘하는 사람이 절반 이상인 우리학교의 제2외국어 과목과 달리
모두 처음 배우는 수준이어서, 기초부터 잘 배울 수 있었습니다.
흥미있는 외국어가 있다면 수강해 보는 것도 좋을 것입니다.

도서관은 중앙도서관, 사회과학도서관, 인문학도서관 등이 있습니다.
장서의 양은 많았지만, 소장하고 있는 책이 여러 도서관에 분산되어 
있는 점은 조금 불편하게 생각되었습니다. 각각 분위기가 조금씩 다르므로
자기가 느끼기에 편안한 곳을 이용하면 될 것입니다.
중앙도서관에서는 노트북을 대여할 수 있고, 열람실 좌석에서 LAN 케이블을 
통해 인터넷 접속이 가능합니다.  아직 우리학교와 같은 무선랜 서비스는
시행되고 있지 않았습니다. (2006년 현재)","릿쿄대학의 교환학생 수는 그렇게 많지 않기 때문에 국제센터에서 
관심을 갖고 많은 배려를 해 줍니다. 일본에서 생활하면서 힘들거나
궁금한 점이 있으면 일단 찾아가서 상담하는 것이 좋을 것입니다.","처음 릿쿄에 도착해 오리엔테이션을 하게 되면, IFL이라는 국제 교류
동아리에서 외국인 등록 등을 도와줍니다. 주로 점심 식사를 같이 먹으면서
일본인 학생과 유학생 간의 친목을 도모하는 동아리인데, 깊이 있는 친구를
많이 사귀지는 못했지만, 花見든지, 한달에 한 번 정도 다같이 1박 2일정도로
가는 여행은 좋은 추억이 되었습니다. 그 밖에 4월이 되면 여러 동아리에서
신입 부원을 모집하므로 자기가 관심 있는 분야의 동아리에 들어 보는 것도
좋은 경험이 될 것이라고 생각합니다. 

다만, 저는 처음에 라켓볼 동아리에 들어가려고 했었는데, 신입부원 환영회
까지 참가한 다음에 '유학생은 가입할 수 없다'는 말을 들어서 상당히 불쾌했던 기억이 있습니다. 이것이 동아리 활동을 포기하게 된 큰 이유였습니다. 
동아리에 가입할 의향이 있다면, 이런 점을 사전에 잘 알아보고 가입하는 
것이 좋을 것입니다.","특별히 컬쳐 쇼크라고 할 만한 것은 느끼지 못했지만,
TOEIC이 무슨 시험인지도 모르는 학생들이 꽤 됐다는 것, 
성적에 거의 관심이 없는 학생이 많았다는 것에서 우리나라와
다르다는 느낌을 받았습니다.","국제센터나, 국제센터에서 소개받을 수 있는 릿쿄 레이디스 클럽의 선생님께
도움을 받을 수 있습니다. 레이디스 클럽은 릿쿄대학을 졸업한 여성들의 
모임으로, 자원봉사로 1대1 일본어 교습을 비롯해, 여러 가지 행사를
마련하고 있습니다. 주로 연세가 많은 분들이므로, 일본어 회화 뿐 아니라
일본 생활에 있어 어려운 점이라든가, 힘든 일이 있을 때 여러 가지 조언을
받을 수 있습니다. 일본어 레슨은 꼭 받아 보시길 권합니다.",..
"릿쿄대학의 크기는 연세대학교에 비해 그 크기가 현저히 조그맣습니다. 저는 池袋캠퍼스에만 다녔는데 강의실이 그렇게 여기저기 퍼져있지도 않고, 5분이면 충분한 거리의 동선이 대부분이기 때문에, 크기라고 말하면 연세대학교에 비교해 절반보다 조금 작은 크기라고 봅니다.
지리적 위치는 池袋. 역자체도 굉장히 크고, 여러 지하철과 철도가 지나가기 때문에 교통면에서는 나쁘지 않은 편이라고 봅니다. 단지 자신이 학교 이외의 주로 가는 지역이 어느곳이냐에 따라 조금의 멀고 가까움은 있다고 봅니다만, 절대적으로 나쁜 위치는 아니라는 생각이 듭니다.
기후는 현저히 서울보다 따뜻하고, 조금 더운 정도 입니다. 겨울같은경우 올해 겨울에 동경에는 거의 눈이 안왔습니다. 여름은 습기가 많기에 약간 지칠수도 있지만 그러한 것도 적응하고 나면 큰 문제는 아니라고 봅니다. 단지 일기예보가 한국에 비해 잘 안맞는다는 느낌이 들었습니다. 대륙성기후가 아니기에 그렇게 맞추기가 힘든것인지도 모르지만, 전날 확인한 일기예보는 그다지 큰 도움이 되지 않으므로 당일 아침에 일기예보를 확인하는 것이 좋다는걸 한참을 지나 겨우 깨달았습니다.","학교 주변의 환경은 보통의 번화가라고 보시면 됩니다. 사람마다 기호가 있기 때문에 좋아할수도 있고, 싫은수도 있지만 저 같은 경우 너무 복잡한 지역은 그다지 좋아하는 편이 아니기 때문에 학교 주변에서는 별로 시간을 보내지 않았습니다. 단지 객관적으로 보면 여러 백화점과 상업시설이 존재하고, 그 규모가 굉장히 넓기 때문에 학교 주변의 지역을 마스터 하는데에는 많은 시간이 요구됩니다.","기숙사에 들어가지 않았기에 기숙사에 관해서는 말씀드릴수 있는 것이 없습니다. 동경23區안에서 거주를 한다고 하면 家賃이 만만치 않게 들기 때문에 그다지 추천해 드리고 싶지는 않습니다. 통학거리가 조금 멀게 되더라도 시내부에서 조금 떨어진 지역에 살면서 급행열차등을 이용해 통근하는 것도 하나의 좋은 방법이라고 생각합니다. 같은 가격이면 두배 크기의 집을 구할수 있다고 생각됩니다. 결국은 둘중 하나이지요. 집이 좁더라도 매일 가까운 거리를 다니느냐, 조금 멀더라도 집다운 집에 사느냐. 
식사는 그다지 다르지 않습니다. 단지 혼자서 식사를 하는 것에 거부감이 없는 나라이기에 어느 음식점을 가나 혼자서 간단히 먹을수 있는 공간이 마련되어 있다는것. 캠퍼스 안에서는 도시락을 사서 먹는 학생도 절반 정도 이고, 학교 식당에서 먹기도 하지만, 편의점이나 식당 앞에서 파는 도시락을 사서 바깥 벤치나 강의실에서 먹기도 합니다. 참고로 점심시간이 정해져 있습니다.(12시 10분~13시10분) 물론 그 시간에만 식당이 하는것은 아니고요. 저는 그 시간 식당이나 주변이 다 붐비기 때문에 되도록 그 시간을 피해서 식사를 했습니다.","수업은 전공과목의 경우 일주일에 한번 90분 수업하는 것이 2단위 입니다. 교양과목 중에는 전공과목과 똑같은 수업시간을 하면서도 1단위가 오는 경우도 있습니다. 수업은 햑교에서 차임벨이 시작과 끝을 알려줍니다. 시간은 09:00-10:30 / 10:40-12:10 / 점심시간 / 13:10-14:40 / 14:50-16:20 / 16:30-18:00 이런 구성입니다. 
수업중에는 방학때 집중해서 5일정도 하는 집중과목도 있습니다. 보통 교양과목중 스포츠 과목이 이에 해당하는데요, 여름에 저는 요트수업을 참가했습니다. 약간의 비용이 들기는 하지만, 마음이 맞는 친구를 사귈수도 있는 기회도 되고, 물론 수업자체도 상당히 좋았습니다. 
도서관은 본관도서관이 있고, 사회과학도서관, 인문도서관, 이공계열 도서관이 있습니다. (제가 알고 있는 한에서는)본관 도서관이 가장 규모가 크고 이용자수가 많은것 같습니다. 단지 제가 귀국할때 쯤에 일부분 공사를 했었기에 저는 다른 도서관도 많이 이용했습니다. 사회과학도서관에서는 한국신문이 놓여져 있어서 가끔씩 이용했고, 인문도서관은 열람석이 적은대신 그만큼 조용하고, 아늑한 맛이 있습니다. 이공계열도서관은 저도 한참이 지나서야 그 존재를 알았고, 릿쿄의 친구들 중에는 그 존재조차 모르는 학생도 있었습니다. 이용해본 적은 없고요. 본인이 여러 도서관을 이용하면서 기분에 맞게 사용하는것도 하나의 재미라고 봅니다.","국제센터는 정말 친절했습니다. 교환학생을 가기 전부터 하나하나 친절히 설명해주시고, 언제나 도움을 주시려고 하는 곳이였습니다. 平井さん이라는 미인분도 계시고.단지 자신이 어느 부분의 도움이 필요한지를 정확히 표현하는것도 중요합니다. 그래야 국제센터에서도 거기에 맞는 부분을 적극적으로 찾아 주시거든요.","제가 이용한 부대시설은 학교의 트레이닝 센터였는데요, 강습회를 한시간정도 받으면 이용할수 있는 이용권을 배부해 줍니다. 그 이후에는 수업시간이 없는 경우에 한해 사용할수 있습니다. 샤워시설이 없기는 하지만, 가끔씩은 이용할 만 하다고 봅니다. 池袋캠퍼스 자체가 전체적으로 깔끔하고 세련된 건물이 많기에 여기저기 적응하면서 자신만의 공간, 쉴수 있는 공간을 발견하는것도 좋다고 봅니다. 참고로 11호관은 제가 귀국하기 직전에 일본에서 굳디자인상을 수상한 건물입니다. 주로 대학원생들이 사용한다고는 하지만요. 
정문 입구에 들어서면 양쪽으로 정말정말 커다란 나무가 있는데요, 겨울에 이곳에 장식하는 트리는 일본내에서도 손꼽힐 정도의 일루미네이션입니다. 학교의 선생님들 중에는 이 밑에서 프로포즈 했다는 분도 계신다는군요. 
동아리는 저같은 경우 제미가 워낙 바빠서 들어갈 염두를 못냈습니다. 제미 등으로 바쁘지 않다면 자신이 관심있는 동아리에 먼저 적극적으로 어필하는것도 좋은 교류가 된다고 봅니다.","대학생들이 공부를 안한다는 것. 수업에 관한 열의가 거의 느껴지지 않는다는 것. 물론 전부라고는 말하지 못하지만, 수업자체가 대형강의가 대부분인데다가 학생들이 수업에 대한 열의가 부족하고, 요령껏 다니려는 학생이 많다는 것이 culture shock였습니다. 또 다른것은 컴퓨터, 예를 들면 ppt라든가 구사 능력이 한국에 비해 떨어진다는 것.","큰 의미에서는 주변의 모든 분들에게서 도움을 받을 수 있습니다. 사소한 것이라도 이쪽 입장에서는 새로운 정보가 될수 있으니까요. 학교의 국제센터에서도 언제든지 도움을 받을 수 있고, 만약 아르바이트 같은 것을 한다면 그쪽에서도 도움을 얻을 수 있고, 미리 가있는 유학생 친구분들이 있다면 그분들에게도 도움을 받을 수 있을 것입니다.","교환학생을 가는 목적을 분명히 해두고 늘 염두에 두시길 바랍니다. 제미라는 유형의 일본대학 공부는 많이 들어보셨을 거라 생각하는데, 저 같은 경우 청강이 아니고, 직접 같이 활동을 했습니다. 물론 제미에 따라서도 그 강도가 다를거라 생각하는데요, 학습계획서를 작성할때 슬라버스등을 잘 읽어보고 쓰시길 바랍니다.  참고로 저는 ARIMA ZEMI에 들었었는데요 조금 빡세긴 하지만 정말정말 충실한 일본대학생활이 가능하게 해 주었던 제미이기도 합니다. 
학교 생활 이외에도 적극적으로 아르바이트도 해보시길 권합니다. 일본의 프리터들과 사귈수 있는 기회도 되고, 그 안에서 일본의 立敎생과는 다른 부류의 사람들과도 교류가 가능하니까요."
