gen_info,env_info,food_info,study_info,office_info,facil_info,mhct_info,help_info,etc_info
"도쿄 신주쿠에 위치한 메지로 대학은 생각보다 크지 않습니다. 5개의 건물과 고등학교 운동장이 붙어 있는 형태입니다. 도심과의 접근성이 좋은 점도 특징입니다. 교내의 가장 높은 건물에 올라가면 신주쿠 마천루가 한 눈에 보일 정도였습니다. 실제로 이케부쿠로와 신주쿠 역까지는 학교에서 전철로 20분이 채 걸리지 않을 만큼 가까웠습니다. 
날씨는 덥고 습도가 높았습니다. 제가 도착했던 9월에는 마지막 무더위가 기승을 부렸고, 10월에는 태풍이 오기도 했습니다. 비가 상당히 자주 왔던 기억이 납니다. 반면 겨울은 생각보다 지낼 만했습니다. 한국의 추위보다는 덜 혹독했습니다.",학교는 조용한 주택가에 둘러 싸여 있습니다. 도쿄에 위치한 대학교이지만 신촌의 번잡한 분위기와는 사뭇 다른 면학 분위기입니다. 작은 규모의 학교였지만 그만큼 조용하고 쾌적하다는 장점이 있습니다. 근처에 위치한 역으로는 나카이역이 있습니다. 그곳에서 지하철을 타고 신주쿠 역으로 가거나 전철을 타고 이케부쿠로역으로 가곤 했습니다.,"제가 거주했던 곳은 릿코국제회관이었습니다. 메지로 대학이 아닌 민간이 운영하는 기숙사로 메지로 대학 교환학생 중 일부는 릿코회관에 거주해야 했습니다. 기숙사비는 한달에 3만 6000엔이었습니다. 싸지도 비싸지도 않은 그런 가격이라고 합니다. 
기숙사는 학교와는 도보로 40분, 자전거로 20분 거리. 자전거는 기숙사로부터 거주하는 기간 동안 저렴한 가격에 임대받을 수 있었습니다. 
기숙사는 전형적인 일본 주택가에 위치하고 있습니다. 조용하고 깨끗한 동네입니다. 무엇보다 좋았던 점은 교통이 매우 편리한 곳이었다는 것입니다. 코타케무카이하라라는 지하철 역과 에코다라는 전철 역이 기숙사로부터 도보로 10분이 되지 않는 곳에 위치합니다. 급행 노선이 다니던 역으로서 시부야까지 20분이면 도착할 수 있었습니다. 
식사는 개인이 각자 해결할 수밖에 없었습니다. 기숙사에는 식당과 부엌이 있었는데, 손수 밥을 지어먹을 정도로 부지런하지 못했던 저는 보통 에코다역 근처의 저렴한 동네 식당을 찾아 끼니를 해결했습니다.","일반 학부수업과 일본어 어학당 수업에 해당하는 JALP 수업을 한 학기 중 동시에 수강할 수 있었습니다. 일본어 실력이 부족하다면 JALP 수업의 비중을 늘려서 수강하는 것을 권합니다. 저의 경우는 JALP 9학점과 학부 10학점(2학점x5개 과목) 총 19학점을 한 학기 동안 수강했습니다.
공강 시간에는 도서관을 찾았는데, 언제나 번잡하지 않고 조용했습니다. 이틀의 시간차를 두고 도서관에는 한국 신문이 배달되었는데, 도서관을 찾은 이유는 그것 때문이었습니다.","메지로 대학에는 국제교류센터가 교환학생을 비롯한 유학생들의 업무를 담당하고 있습니다. 한국 유학생을 담당하는 교직원으로는 교류센터의 이마다 선생님이 있습니다. 친절하고 세심하게 유학생들을 배려해줘 학생들로부터 신망이 높은 분입니다. 한국어를 유창하게 하고, 한국적인 정서를 잘 이해하는 지한파라고 할 수 있습니다. 여전히 근무하고 있다고 합니다. 메지로 대학으로 파견된다면 그분의 도움을 받을 수 있을 겁니다.",학교 내에 테라스라는 두 개 층 규모의 공간이 있습니다. 일종의 휴식공간으로서 학생들이 편히 간식을 먹거나 담소를 나누는 곳입니다. 학교에서 유일하게 시끌벅적한 곳이라고 할 수 있습니다.,"처음 생활을 시작했을 때, 학교의 일본 학생을 보고 ‘일본도 젊은 애들은 별 거 아니구나’라는 마음이 들었습니다. 우리나라 대학생에게서 쉽게 찾을 수 있는 치열한 경쟁의식은 다른 나라 얘기였고, 다들 수다스럽고 가벼워 보였습니다. 장래희망을 물어보면 “현재 취업이 확정된 회사가 있는데 그곳에서 정년까지 일하고 싶다”, “교직원이 되고 싶지만, 원래는 결혼해서 전업주부가 되는 것이 진짜 꿈”이라는 등의 대답을 했습니다. ‘젊은 애들이 왜 이리 포부가 없고 진지하지 못할까’라는 생각이 들었습니다. 
그러던 어느 날, 아르바이트를 시작한 기숙사의 한국인 친구가 ""여기 애들은 알바를 목숨걸고 한다""고 했습니다. 아르바이트생인지 직원인지 구분이 안 가, ''이렇게 열심히 하는 것을 보니 나만 빼고 다 직원이구나'' 생각했다고 하더군요. 실제로 그랬습니다. 일본인 친구가 아르바이트를 하는 동네 라면집에 찾아간 적이 있었습니다. 그는 근무시간이 되자 자신의 역할에 충실해졌습니다. 노랗게 염색한 머리에 치렁치렁한 장신구가 불량한 인상을 주고 있었지만, 그는 참으로 야무지게 일했습니다. 앳되어 보이는 학생도 있고 나이 서른이 넘어 보이는 사람도 있었지만 누구도 건성으로 일하지 않았습니다. 매뉴얼과 복종의 미덕만 있으면 일은 프로처럼 하는 게 일본의 보통 아르바이트생이었습니다.
컬쳐 쇼크는 이런 것이었습니다. 이들은 틀에 짜인 직분이 주어지기만 하면, 역할지향형 인간으로 재사회화를 하는 듯했습니다.",무엇보다 국제교류센터 이마다 선생님의 도움을 가장 크게 받을 수 있습니다. 기숙사였던 릿코회관 내에서는 다나카라는 분이 많은 편의를 제공했습니다.,"메지로 대학은 으리으리하고 유명한 학교는 아니었지만 나름대로의 매력을 가진 곳이었습니다. 이를테면 도쿄에서 몇 안 되는 한국어학과가 이곳에 소재하고 있다는 점입니다. 그런 까닭에 한국 유학생에게 호의적인 분위기가 있었습니다. 유학생이 적응하는 데 그만큼 수월하다는 뜻입니다. 
메지로 대학에 파견되어 뜻 깊은 경험을 할 수 있기를 바랍니다."
"학교의 크기는 크지 않습니다. 연세대학교의 큰 캠퍼스에 적응되어서 이 크기가 표준적인 대학 크기라고 느껴지는 분에게 이 정도 캠퍼스 크기는 학교로 안 느껴질 지도 모르겠습니다. 연세대학교에 비유하자면 실제로 학생이 사용할 면적은 위당관~상경관 정도의 크기이지만 중-고등학교랑 붙어있고 전체 크기를 따지자면 이보단 조금 크겠습니다. 학교가 작은 덕분에 학교 전체를 둘러보는 데 10분이면 충분하고 기숙사에서 교실까지 5분이내에 도달 가능합니다. 도쿄 신주쿠 캠퍼스인 만큼 전철로 10분에 신주쿠까지 도착하며 학교부터 출발 시에 역까지의 거리를 계산한다고 해도 20분이면 도착합니다.(전철 대기시간 제외) 도쿄의 날씨는 덥습니다. 2010년은 폭염의 해이기도 했는데 5월부터 습하기 시작해 해를 보기는 어려운데도 찌는 날씨 속에서 땀을 흘려댔습니다. 7,8월은 더위의 피크이며 9월 중순까지도 덥다고 할 수 있습니다. 반면에 겨울은 굉장히 따듯해 한국에서 만큼 껴 입지 않아도 됩니다. 영하로 거의 떨어지지 않는다고 볼 수 있고 겨울에 발이 시린적이 한 번도 없었습니다. 여름 날씨가 흐리고 굉장히! 습하고 더운 반면에 겨울은 건조하고 맑고 화창합니다. 여름에 고생한 만큼 겨울에 대한 만족도는 큽니다.",주택단지 내에 고등학교 있듯이 대학교가 있습니다. 굉장히 조용한 중상층의 주택단지이고 역까지 10분에 도착할 수 있는데도 역 근처에는 거의 아무 것도 없습니다. 학생이 갈 만한 식당은 그나마 두 세 군 데뿐이며 놀이 문화도 즐길 수 없습니다. 조금 나은 식당을 원한다면 5분 정도 더 걸어 대로변으로 갈 경우 조금 비싸지만 나은 식사를 즐길 수 있습니다. 신주쿠까지 가까운 편이라 놀러 갈 때 접근성이 편리합니다. 원룸을 구할 경우 일본인도 가격 때문에 쉽게 거주하지 않는 곳에 싼 가격에 기숙사 생활을 할 수 있으니 좋다고 할 수 있습니다.,"기숙사에 살았는데 남/녀기숙사가 분리되어 있습니다. 남자기숙사는 60년대에 지은 건물을 2000년대에 리모델링하였는데 시설은 거의 최신식으로 완벽을 자랑합니다. 가격도 저렴하여 비슷한 시설의 인근 원룸이 68000엔/월(최저, 2011기준)인것에 비해 기숙사는 43000엔/월(2011년)입니다. 더군다나 신형 여학생 기숙사가 좁은 방에 2인 1실인 것에 반해 남자기숙사는 리모델링 하며 큰 방에 1인 1실로 설계해 큰 방을 홀로 편히 쓸 수 있었습니다. 하지만 남자 기숙사는 방간 방음이 전혀 이루어 지지 않는데(나무 벽) 여자 기숙사는 방음이 좋으며 화장실과 세면대가 방에 있습니다. 남자 기숙사에서 화장실, 샤워실, 부엌은 공용이고 한 층에 1~3개의 대변기가 있습니다. 1-4층은 4개방, 2-3층은 8개방으로 이루어 져 있으며 1층이 화장실 개수도 많고, 샤워실 부엌으로 접근성이 좋아 편리합니다. 샤워부스는 총 6개이나 기숙사가 꽉 차지 않을 뿐더러 개개인의 활동시간이 달라 붐비지 않습니다. 학교로부터 제공되는 식사는 없으며 직접 재료를 사서 만들어 먹든지 학교 혹은 외부에서 사먹었습니다. 학교 식사는 450~500엔(점심만 제공), 외부의 경우 싼 경우 500~600엔,일반적으로 650~850엔, 비싼경우 그 이사입니다. 재료는 한국처럼 대량판매하지 않고 개(個), 팩 단위로 판매하며 한국보다 조금 비싼 수준입니다. 직접 간단하게 만들어 먹는 경우 식사비로 1만엔이 최저로 든다고 보면 되고 오로지 사먹는다면 2~3만엔 이상은 생각하셔야 합니다.","프로그램이 영어로 진행되는 것이어서 오전의 일본어 수업(1주일에 6시간)을 제외하고는 모두 영어 수업이었습니다. 일본의 아이누(AINU)민족, 일본 문화, 일본 정치경제전반 등등 일본에 관한 교양 과목의 수준이었습니다. 이들 중 두,세과목 정도는 전공 과목 수준으로 만족할만한 수준의 내용이었습니다. 도서관은 우리학교 법학도서관 정도 크기인 듯합니다. 평일 9시-21시, 토요일 9-17시, 일요일 및 공휴일 폐관이며 밤샘은 할 수 없습니다. 도서관엔 각종 일본 잡지와 신문(영자,한국동아일보,홍콩밍빠오,중국인민일보 등등 포함)이 배치되어 있어 자주 이용했습니다.","이마다 상이 연세대학교 어학당에서 한국어를 배운 분으로 한국 학생들에게 호의적이며 각종 불편한 점, 필요한 점에 대한 상담을 들어줍니다. 제가 들은 과정의 총 책임자는 호주인 Lyndell로 일본어 수준이 높아 영어/일본어로 소통이 가능합니다. 필요한 점이 있을 때마다 수시로 방문하여 물어보고 요청하였고 대부분 긍정적인 결과로 이어졌습니다.","교환학생도 대부분 동아리에 가입할 수 있습니다. 밴드, 운동(배드민턴, 테니스, 농구, 야구 등등), 취미동아리(영화제작, 만화 등등) 수가 많으며 활동할 시 친구를 쉽게 사귈 수 있겠습니다. 매점이 있는데 학교 직영 매점이 아니라 외부 편의점(AM/PM)이 들어와 있습니다. 학생들이 공강시 노는 장소는 테라스라고 불리는 2층짜리 라운지 건물과 본관 지하 식당입니다.","일본 친구들은 사귀기 어렵다고 합니다. 실제로 일본인은 상대방에 폐끼치는 것을 굉장히 싫어해 적극적으로 먼저 다가오지 않습니다. 하지만 그 반응이 친구가 되기 싫다는 것을 의미 하지 않으므로 먼저 다가가서 활동을 만들고 만나간다면 친구가 될 수 있을 것입니다. 
일본 사람은 매일같이 욕조에서 목욕(5-10분 입욕)하는 습관이 있는데 한국사람들은 샤워만 한다고 하면 조금 충격 받는 모습을 보입니다. 일본 외에 많은 나라 사람들이 보통은 매일 샤워만 한다고 말해주세요. 조금 고급스러운 집에서는 화장실(변기)와 샤워실이 분리되어 있습니다. 일본인은 이 둘을 같이 두기를 꺼려합니다.
좌측통행은 금방 적응하실 겁니다.
목재 건물이 많은데 방음이 되지 않아 기숙사에 사시지 않고 목조건물에 사신다면 소음에 주의를 기울여야 합니다.","국제교류부, 듣는 수업의 교수 정도면 충분하지 않을까 싶습니다.",
