gen_info,env_info,food_info,study_info,office_info,facil_info,mhct_info,help_info,etc_info
"나고야에 위치한 난잔대학은 지하철역에서 10분정도의 거리에 자리하고 있다.
학교는 그다지 크지 않고 아담한 크기이지만 오히려 필요한 건물을 가고자 할때 그리 서두르거나 멀지 않아서 편하다고 생각했다. 지하철역에서 학교까지 가는 길에 언덕이 자리하고 있어 덥고 습기가 심한 일본의 여름에는 땀을 흘리며 걸어갔던 기억이 있다. 겨울은 그다지 춥지 않아서 한국보다는 따뜻한 겨울이라고 생각하면 될 될 듯하다. 처음 난잔대학에 들어가면 지진의 위험성이나 응급상황에 대한 설명을 받게 되는데 2학기 있으면서 2번의 지진과 방사능위험에 대해 겪었다. 지진을 가벼운정도여서 특별히 위험함을 느끼진 못하였지만 처음겪어보는 지진은 일본이 위험한 나라라는 인식을 주기도 하였다. 또한, 방사능의 위험이 있었지만 나고야는 방사능의 위험으로부터 떨어진곳에 위치하였기 때문에 위험성을 느끼진 못하였다.","대학주변은 고급주택가로 구성되어있다. 한국에서는 대학주변이 술집이 많고 노는 분위라면 난잔대학교 주변은 주택가로 저녁에도 굉장히 조용한 편이다. 기숙사에서 친구들과 파티나 이런것을 하면 주변에 양해를 구하고 파티를 해야할 정도로 조용한 곳이였다. 또한, 학교 주변에는 우체국, 편의점, 대형마트와 같은 곳이 근처에 자리하고 있어 자주 애용했던 기억이 난다. 15분정도만 걸어가면 서점이 있어서 그곳에서 책을 사거나 dvd를 빌려서 볼 수도 있어서 친구들과 자주 영화를 볼 수 있었다. 술집이나 식당은 이리나카라는 역근처에 있어서 저녁이나 친구들과 어울릴 때는 이리나카 주변을 자주 갔었다.","유학생이 거주할 수 있는 형태는 크게 기숙사와 홈스테이이다. 기숙사는 여러군데 위치하고 있어서 본인도 자세히는 알지 못하지만 학교근처의 나고야교류회관과 야마자토기숙사가 학교 근처에 자리하고 있다. 본인은 친구의 소개로 나고야교류회관이란 곳을 지원해서 그 곳에 살게되었는데 학교바로 앞에 있는 기숙사이다. 방은 총 4개와 거실, 화장실, 샤워실로 구성되어있고 외국인3명과 일본인1명이 같은 방을 쓰게된다. 일본인 한명이 외국인을 도와주는 역할로 소식이나 모임이 있으면 알려준다. 방에는 요리를 할 수 있는 편의시설이 구비되어 있어 본인은 가끔 요리도 해먹기도 하고 외국인친구들과 방에서 모여서 서로 요리를 만들어서 각 국의 요리를 소개했던 기억도 난다. 하지만 데부분의 저녁은 친구들과 식당에서 자주 먹었었다.","모든 유학생은 cjs office라는 곳에서 총체적인 관리를 해준다. 학교에 궁금한 상황이나 문제가 발생하였을 때는 이곳을 이용하여 문제를 해결한다.난잔대학에 들어가면 처음에 외국인의 일본어 수준을 알기 위한 테스트를 보게된다. 이 테스트에 따라서 어떤 레벨의 일본어 수업에 들어가게 되는가가 정해지고 이 일본어 수업은 월요일부터 금요일까지 오전시간에 배정받게된다. 그리고 오후 수업은 자신이 듣고 싶은 교양수업을 듣게된다. 교양수업을 선택할 때에는 영어와 일본어를 사용하는 두가지 종류의 수업이 있으므로 자신의 영어, 일본어의 수준을 생각하여 수업을 결정하는 것이 좋다.  도서관은 학교정문을 통과하여 1분정도의 거리로 왼쪽편에 자리하고 있다. 그다지 크지는 않지만 필요한 서적을 빌리는 것도 가능하고 공부할 수 있는 좋은 분위기이다. 수업이 끝나면 글로벌 라운지라는 곳에 모여 일본인과 소통할 수 있는 장소가 있다. 시간에 따라서 사용하는 언어가 정해져 있어 본인은 첫학기때에는 거의 가지 않았지만 2번째 학기에 한국어로 이야기하는 시간이 개설되어 가끔 갔었던 기억이 있다. 한국의 위상이라고 해야할까 없었던 한국어 시간이 개설되어 있어서 뿌듯했던 기억이 있다. 또한, 일본인이 듣는 수업중에는 한국어 과목도 있어서 들어가서 첨강했던 적이 있는데 많은 일본인이 한국에 관해 좋은 이미지를 갖고 있고 관심이 많다는 것에 놀랐었다.","모든 유학생은 cjs office가 관리해준다. 처음 교환학생을 가면 당연히 모르는 것도 많고 유학생이 신청하거나 해야하는 것이 많은데 이 곳에 가서 물어보면 굉장히 친절하게 대답해준다. 또한, 그곳에는 자신의 사물함이 있어서 그곳에 테스트 결과나 소식을 쪽지로 넣어주어 혹시 본인이 해야할 일을 잊어버렸을 경우에도 cjs office에서 챙겨주는 편이다. 국제 교육부 주체로 하는 행사도 많이 있어서 참여 여부와 같은 것은 이 곳에 알려주면 유학생이 참여하는 것에 상당히 감사해하는 분위기라고 할까 굉장히 기뻐한다.","학교에는 체육관이 있는데 그곳에 농구장, 수영장등 여러가지 편의시설이 준비되어있고 본인은 헬스를 하러 그곳을 자주 애용하였다. 시설도 깔끔하고 규칙만 잘 지킨다면 전혀 문제가 없다. 본인은 축구를 좋아해서 축구 동아리에 들어가서 활동 한 적이 있다. 축구과는 좀 다른 풋살이었지만 풋살장은 학교에는 구비되어 있지 않아 전철을 타고 10분걸리는 곳에 건물 옥상에 준비되어있는 곳에가서 일본인들과 풋살을 하곤 했다. 체육관 옆에는 운동장이 있어서 외국인 친구들과 가끔 축구도 하곤 하였다. 
본인이 가장 좋아하였던 장소는 green area 였다. 말 그대로 여름에는 녹색 벌판과 같은 느낌으로 친구들과 앉아서 점심을 먹거나 말을 걸어오는 일본인들과 인사를 나누거나 하면서 편안한 분위기에서 휴식을 취할수 있는 공간이다.","일본인과 한국이 많은 부분이 닮아 있어서 컬쳐 쇼크까지는 아니지만 한 아이의 어머니가 아이 옆에서 담배를 피고 있는 것은 놀랄 만한 일이었다. 한국에도 있을지 모르겠지만 일본에 와서 본 것이 처음이었기 때문에 컬쳐쇼크라고 할 수 있을 정도였다. 
한번은 외국인 친구에게 일본에 와서 느낀 컬쳐쇼크는 무엇이냐고 물어본 적이 있는데 외국인의 대다수의 대답은 엠블란스가 너무 천천히 간다는 것이었다. 난잔대학교 옆에는 큰 병원이 있어서 자주 엠블란스가 지나가는 것을 볼 수 있었는데 외국인 친구의 말에 의하면 일본의 엠블란스는 너무 천천히 가서 위급한 상황 처럼 보이지 않는 다고 대답해 주었다.",본인이 도움을 받았던 적은 일본인 친구들이나 기숙사의 관리인분이나 cjs의 사람들이었다. 이정도만 알고 있다면 교환학생기간동안 큰 어려움을 없을 것으로 생각된다.,"9개월간의 일본 교환학생의 경험을 돌이켜보면 정말 짧았던 것 같다. 처음에 일본에 갔을 때는 외롭다고 느낀 적도 있고 한국에 있는 가족이나 친구들이 보고 싶었던 적도 있다. 하지만, 일본생활에 익숙해지고 친구들과 재미있는 경험이나 여행을 하면서 많은 생각을 하게되고 본인이 좀더 성숙해진 계기가 아닌가 생각한다. 항상 우물안에 개구리처럼 좁게만 세상을 보았던 나에게 외국인친구들, 외국에서의 생활 경험은 본인이 발전할수 있는 좋은 밑거름이 된것 같다. 지금도 연락하고 있는 외국인 친구들과 크리스마쓰때나 특별한 날에 편지를 보내주는 친구들을 보면 나의 유학생활이 헛되지 않았구나 본인이 큰 자산을 얻었구나 하는 느낌을 갖게 해준다. 9개월간의 교환학생경험을 무엇과도 바꿀 수 없는 소중한 자산이다."
