gen_info,env_info,food_info,study_info,office_info,facil_info,mhct_info,help_info,etc_info
"University of Maastricht, UM은 네덜란드 중에서도 최남부에 위치하고 있습니다. 수도인 Amsterdam과는 기차로 3시간 정도 걸리는 반면 벨기에나 독일은 버스로,심지어는 걸어서 갈 수 있을만큼 가까워서 국경 개념이 확실한 한국인에게는 신기하게만 보입니다. 
날씨는 가을에는 15-25도, 겨울에는 -5-10도 정도로 서울보다 대체로 따뜻한 편입니다. 그러나 늦가을부터는 바람이 많이 불고 흐린날이 계속되어 해가 쨍쨍한 날이면 반가워했던 기억이 납니다. 예고없이 비가 내리고 내리다가도 몇분만에 그치기 때문에 저는 귀찮아서 우산도 사지 않았습니다:P 대신 젖지 않는 재질의 옷, 모자가 달린 패딩 등을 활용했습니다. 
연세대학교와 달리 Maastircht라는 도시에 단과별로 건물이 산재해있는 것이 특징입니다. 제가 공부했던 SBE(School of Business and Economics)는 네덜란드 학생들만큼 독일학생들이 많고 특히 교환학생이 몇백명 정도로 많은 비율을 구성하고 있어 다양한 국적의 친구들과 공부하고 어울려 놀 수 있어서 좋았습니다.","SBE 빌딩은 main기숙사인 c,p빌딩하고도 가깝구요, 자주 가게 되는 Student Service Center, Inner city library와도 가깝습니다. SBE 건물 주변은 신촌과는 달리 주택가와 공원으로 매우 조용합니다. Pub이나 쇼핑센터는 Vrijthof, Markt로 조금 걸어서 나가야해요. SBE 정문 앞에는 샌드위치가게(유명해요)와 서점 등이 있는 정도입니다.","저는 Main 기숙사인 C building, single room에서 살았는데요, C빌딩에 사는 Asian은 손에 꼽을 정도여서 친구들이 신기해했던 기억이 납니다. 주방을 공용으로 사용하기 때문에 마음만 먹으면 복도 친구들과 쉽게 친해질 수 있는 장점이 있지만 주방이 정말 더럽습니다. Sink에 한달동안 설거지가 안된 접시들이 쌓여 있었을 정도이니까요. 저는 요리하는것을 좋아하지 않아 평소 시리얼,빵,과일샐러드를 주로 먹었기 때문에 괜찮았지만 요리 자주 하실 분이라면 생각해 보셔야 합니다. 다양한 국적의 친구들과 Pot luck party를 자주 했었는데 한국음식 요리하기 위해서 결국엔 저만 사용하는 냄비를 하나 샀었습니다.","한학기 2개의 block, 한 block에 대개 2과목, 한과목당 일주일에 2-3번 수업, 강의는 거의 없고 학생들이 10명-15명 정도의 그룹으로 나뉘어져 토론으로 수업이 진행이 됩니다. 토론을 위해서는 물론 수업 전에 책 1-2 chapter, reading materials 읽고 가셔야 합니다. 대부분의 수업에서는 한 학생이 discussion leader가 되어 수업을 진행하고요, 교수가 아닌 tutor는 강의의 흐름을 조정하고 참여 평가, 결론이 나지 않을 때 개입하는 정도입니다. 과목마다 한 번씩은 발표를 맡게 되는데요, 10분 15분 단위가 아닌 1시간넘게 발표를 진행해야 하므로 부담이 적지 않습니다. 타 네덜란드 대학에 대해서도 얘기를 많이 들었었는데 학업량은 Maastricht University가 최고인 듯 합니다. SBE는 특이한 수업 방식으로 유럽에서도 유명한데 그만큼 과목 pass하시려면 열심히 공부하셔야 합니다. 교환학생은 물론 정규 학생들도 pass하지 못하고 재시험 치는 경우를 많이 보았습니다.","교환학생 신분으로 네덜란드에 머무르고 출국,입국하기 위해서는 Residence Permit이 필요합니다. 발급받기 위해서는 몇십만원의 돈이 들고 도착해서도 TBC검사, 서류제출해야 하므로 visa office에서 연락이 자주 옵니다. 기재한 메일 계정을 수시로 확인하세요.
기숙사 관련 문제는 main 기숙사 데스크에 문의하면 되고
수업 관련 문제는 개강 전 Incoming day라고 해서 오리엔테이션 행사 때 나눠주는 책자에 cordinator email 주소가 있으니 온라인 상으로 의뢰하면 됩니다.","메인 기숙사에는 테니스 코트가 있어 desk에서 대여후 사용하실 수 있고요, um sports는 강 건너편으로 멀어서 가보지도 않았습니다. 자전거 타는 것만으로도 근육이 많이 생겼어요.. 
교환학생이 SBE 동아리 드는 경우는 거의 없는 편이구요, 주로 ESN에서 주최하는 단체여행(독일 옥토버페스트,프랑스 디즈니랜드 등) 혹은 Beer party의 티켓을 미리 구매해서 참여하는 정도입니다.","기숙사 남,여 공용은 물론 샤워실도 남,여 공용이어서 처음에는 당황했지만 나중에는 샤워하며 같이 수다 떨 정도가 되었습니다. C빌딩 shared room에는 남여 같이 배정이 될수도 있다는 것 정도가 shock였달까요.","한국에서 주로 암스테르담 공항으로 네덜란드에 도착하실 텐데요, 무거운 짐을 들고 암스테르담 스키폴 공항에서 기차를 타고 마스트리흐트 역에 도착하면 버스,택시 다 잘 모르니 막막하실겁니다. ESN이라고 Erasmus Student Network 단체에서 교환학생에게 pick up service를 제공하니 미리 신청하셔서 이용하시면 좋을 것입니다.",Maastricht에 대해 더 궁금하시다면 danawon@hanmail.net으로 메일주세요 :)
"마스트리트는 네덜란드 남쪽에 위치한 아담한 도시입니다. 암스테르담보다는 벨기에와 독일이 더 가까운 국경도시입니다. 독일의 아헨까지는 버스로 한 시간 ,벨기에까지는 걸어서 또는 자전거로도 갈 수 있습니다. 이 때문인지  듣기로는 다른 네덜란드 도시 들과 다른 분위기를 가진다고 합니다 . 

 매우 조용하고 , 여유롭고, 언뜻보면 농가적인 분위기도 나서 처음에는 답답하게 느껴질 때가 있었습니다. 그러나 적응하고 보니 이 여유와 아름다움을 즐길 수 있었습니다.  

 기후는 앞의 보고서에서 볼 수 있듯이, 변덕스럽기 그지 없습니다. 날씨가 좋다가도 갑자기 비가 쏟아진다거나 어느 경우는 우박이 쏟아지기도 했고 심한 안개를 경험하기도 했습니다. 저 역시 처음에는 적응을 못하다가 어느순간 비가 오는 날 우산 없이도 자전거를 타는 사람으로 변해있었습니다. 
 보통은 흐리고 , 변덕스러운 날씨지만 제가 있던 시기에는 이상기후 라고들 하던데 맑은 날씨가 한동안 지속되었던 기억이 납니다. 그러나 대체적인 기후는 변덕스럽지만 우리나라보다 평균적인 온도는 높았던 걸로 기억합니다.","UM은 각 단과대가 도시 곳곳에 흩어져서 위치하고 있습니다. 제가 공부했던 SBE 역시 다른 단과대 건물과 떨어져 위치하고 있었지만, 학생 센터와 쇼핑센터 ,마을 광장과 가까웠습니다. 그래서 쇼핑하기도 좋고 , 강가와도 가까워 수업마치고 종종 산책을 나갔던 기억이 납니다. SBE 밑쪽으로 쭈욱 따라 내려오다 보면 역사가 오래된 성곽길을 볼 수 있는데, 고즈넉한 분위기를 즐기기에 좋았습니다.

 다만, 처음에 도착하면 건물 찾기가 상당히 어려울 수 있습니다. 높은 건물을 거의 찾아볼 수 없는 오래된 도시답게 길 역시 골목골목으로 복잡하게 나 있습니다. 초창기에는 항상 도시 지도를 들고 다니시기를 추천합니다.   

 SBE에서 가까운 도심에는 다양한 레스토랑, 카페테리아, 옷가게, 잡화점, 아시안 마켓등이 위치하고 있습니다. 작은 도시지만 크게 부족함을 느끼지 못할 정도로 필요한 가게들이 있었습니다.","많은 우리 학교 학생분들은 C나 P 빌딩에 묵으셨지만, 저는 조금 다른 곳에서 한학기를 보내고 왔습니다. 저 역시 신청은 C나 P빌딩으로 이른 시기에 신청했지만 , 어떤 문제때문인지 Talienruwe라는 기숙사를 배정받게 되었습니다. 그래서 이 곳에 대해 써보려 합니다. 

 Talienruwe는 SBE와는 비교적 멀리 떨어진 곳에 위치하고 있습니다. 어찌보면 외곽이라고 말 할 수 있을만큼 , 도시 중심과는 떨어진 곳에 위치하고 있습니다. SBE 까지는 걸어서 45분 ,자전거로는 20분 정도 걸렸고, 마을 중심까지도 이 정도로 걸렸습니다. 


※교통수단 : 아래 보고서에서도 볼 수 있듯이 주 교통수단은 자전거 입니다. 학기 초에는 자전거 수요가 매우 많아 구하기가 쉽지 않을 것이니 발품을 많이 파세요 ! 저는 메인 기숙사앞 임시 자전거 시장에서 샀는데, 결국 마지막 한달에 고장이 났습니다. 그 이후로는 걷거나 버스를 타고 다녔습니다. 잘 골라서, 도난당하지 않도록 관리를 잘 하세요. 자전거 도난은 이 도시에서 매우 흔합니다. 
 저는 종종 걷거나 자전거 타기가 귀찮거나 어려울때는 버스를 이용했는데 , 교통 카드가 있더라도 한번에 1.5유로 씩 나가게 됩니다. 무턱대고 놀러 나간날은 거의 하루에 15유로를 교통비로 썼던 기억이 납니다. (교통카드는 우리나라의 교통카드와 비슷한 시스템입니다. 돈을 충전하고 할인받아서 타게되는 시스템입니다. 자전거가 주 교통수단이 될테지만, 필요한 경우가 있으니 역에서 7유로를 주고 구입하는 걸 추천합니다. )



 다시 기숙사 얘기로 돌아와서 , 제가 살았던 Talienruwe는 접근성은 떨어지지만, 시설 자체는 매우 독립적이고, 깔끔했습니다. 아파트 형식 (flat 형식 ) 이라서 , 2인이서 주방과 화장실 세탁실 샤워실을 공유하고 , 각 자의 방이 있는 형태입니다. 
따라서 마음대로 요리해 먹거나, 공간을 매우 넓게 쓰고 싶거나, 독립적인 생활을 하기에는 적합합니다. 다만, 주방이나 , 복도를 공유하는 P나 C 같은 기숙사 보다는 이웃들과 유대관계를 맺기 힘들 수 가 있습니다. 저 역시 처음에 도착했을 때 ,제가 생각했던 기숙사와 달라 매우 당황하고, 외로워 했던 기억이 납니다. 이런 점은 자신이 조금 더 적극적으로 나서면 해결되는 문제라고 생각됩니다.

 식사는 외식물가가 비싸서 하기가 쉽지는 않았습니다.  그러나 케밥 ,샌드위치 등등 학교 근처나 마르크트에 위치한 곳에서 간단히 한끼를 해결 할 수 있습니다.  저는 한국음식을 좋아해서 , 요리를 주로 해 먹었습니다. 처음에는 만들 수 있는 것이 아무것도 없었는데 , 돌아올 때 다양한 요리들을 만들 수 있었습니다. 닭도리탕, 불고기 , 김밥 등은  외국친구들 역시 대부분 좋아하니까 , 하나쯤은 만들 수 있다면 처음에 음식을 만들어 주며 친구 사기기에도 좋을 것입니다. 

 이런 한국음식이나 식재료등은 인근 슈퍼마켓에 가면 구할 수 있고, 도시 중심의 Mosae Forum 이라는 건물의 지하에 가게되면 커다란 아시안 마트에서 많은 종류의 한국음식을 구할 수  있을 것입니다. 저는 브뤼셀 포트의 알버트 하인이나 C1000 보다는 기숙사에서 가까운 곳에 위치한 JUMBO에서 주로 장을 봤는데 , 점보에서는 가격은 C1000과 비슷하지만 , 더 깔끔한 분위기에서 더 좋은 품질의 상품을 살 수 있었습니다. 아시안 마트에서는 고추장, 된장, 라면 , 만두 , 떡 , 김치 , 칼국수 면 등 중요 한국 식품은 거의 다 팔고 있었습니다. 맛이 한국것과 조금은 다르지만, 맛있게 만들어먹을 수 있을 것 입니다.  참기름이나 김 또는 김밥용 김은 가져가시면 좋을 것 같습니다. 구하기도 어렵고, 구하더라도 맛이 달랐습니다. 



 전반적인 물가는 외식등을 제외하고는 우리 나라랑 비슷한 느낌 이었습니다. 오히려 어떤 제품은 더 저렴하기도 했구요. 생활비는 크게 걱정하시지 않아도 될 듯합니다.","앞서 다녀오신 분들이 알려주셨 듯이 이 대학교는 독특한 수업방식인 PBL(Problem based Learning) 을 통해 수업을 진행합니다. SBE(School of Business and Economics ) 에서  제가 들은 수업은 대부분이 토론 수업이었습니다. 이러한 토론 수업은 미리 교과서나 논문 내용을 숙지하고 가야 수업에 참여 할 수 있으므로 , 영어가 그리 유창하지 않은 저로서는 초반에 꽤 많은 어려움을 겪었습니다. 교과서,논문 내용이나 수업의 난이도 자체는 높지 않으나 영어로 이해하고 , 많은 분량을 읽고, 토론 한다는 것이 꽤나 어려웠습니다. 또한 제가 들은 수업들은 조모임이 많은 부분을 차지하고 있어서 처음에는 적응 하기가 쉽지 않았습니다. 그러나 용기를 가지시고, 조원들에게 도움을 요청하거나 , 수업의 튜터 에게 궁금한 것은 스스럼 없이 물어보신다면 잘 해낼 수 있을겁니다. 

 제가 들었던 대부분의 수업들은 30분 가량의 개인 발표를 요구하는 수업들이어서 처음에는 매우 당혹스러웠지만, 주위 친구들이나 튜터들에게 조언을 구하면서 해냈던 기억이 납니다. 당시에는 어려웠지만 ,  지금은 뜻깊은 경험이 되었네요. 외국친구들 과의 조모임 또한 새로운 경험이 될 것 입니다.
앞서 다녀오신 분들이 알려주셨 듯이 이 대학교는 독특한 수업방식인 PBL(Problem based Learning) 을 통해 수업을 진행합니다. SBE(School of Business and Economics ) 에서  제가 들은 수업은 대부분이 토론 수업이었습니다. 이러한 토론 수업은 미리 교과서나 논문 내용을 숙지하고 가야 수업에 참여 할 수 있으므로 , 영어가 그리 유창하지 않은 저로서는 초반에 꽤 많은 어려움을 겪었습니다. 교과서,논문 내용이나 수업의 난이도 자체는 높지 않으나 영어로 이해하고 , 많은 분량을 읽고, 토론 한다는 것이 꽤나 어려웠습니다. 또한 제가 들은 수업들은 조모임이 많은 부분을 차지하고 있어서 처음에는 적응 하기가 쉽지 않았습니다. 그러나 용기를 가지시고, 조원들에게 도움을 요청하거나 , 수업의 튜터 에게 궁금한 것은 스스럼 없이 물어보신다면 잘 해낼 수 있을겁니다. 

 제가 들었던 대부분의 수업들은 30분 가량의 개인 발표를 요구하는 수업들이어서 처음에는 매우 당혹스러웠지만, 주위 친구들이나 튜터들에게 조언을 구하면서 해냈던 기억이 납니다. 당시에는 어려웠지만 ,  지금은 뜻깊은 경험이 되었네요. 외국친구들 과의 조모임 또한 새로운 경험이 될 것 입니다.","저는 학교의 Visa Office 말고는 따로 국제교육부란 곳을 찾을 일이 없었습니다. 메일로 도움을 요청할 경우 우리나라보다 시간이 꽤 오래 걸리긴 해도 , 친절히 도와주시고 , 답변도 잘 해주시니 크게 걱정할 필요가 없었습니다. 교환 오기전 코디네이터로 배정 받으신 분에게 종종 메일을 보냈었는데 ,답변이 늦더라도 잘 해결해주시니 괜찮았습니다.","대부분의 교환학생들은 동아리 활동을 하지 않고 , ESN이라는 교환학생을 위한 동아리에서 주최하는 모임이나, 활동에 참여합니다.
 UM Sports 라는 곳에서 운동을 하는 학생들도 있었으나 저는 멀어서 시도도 해보지 않았습니다.","마스트리트에서는 정말 다양한 국가에서 온 친구들을 만나실 수 있을 것 입니다. 제가 만난  친구들은 세네갈, 홍콩, 독일,보스니아 ,네덜란드 ,호주 , 이탈리아 등지에서 온 친구들이었는데 , 어떻게 다가가야 할지 몰라서 처음에는 고민했었던것이 고민거리 였을뿐, 큰 컬쳐쇼크는 없었습니다","저는 학교의 Visa Office 말고는 따로 국제교육부란 곳을 찾을 일이 없었습니다. 메일로 도움을 요청할 경우 우리나라보다 시간이 꽤 오래 걸리긴 해도 , 친절히 도와주시고 , 답변도 잘 해주시니 크게 걱정할 필요가 없었습니다. 교환 오기전 코디네이터로 배정 받으신 분에게 종종 메일을 보냈었는데 ,답변이 늦더라도 잘 해결해주시니 괜찮았습니다.","마스트리트에서의 이점중 하나는 여행을 자유로이 다닐 수 있다는 것입니다. 기차로 한시간 타면 대부분의 저가항공이 취항하는 아인트호벤 공항에 갈 수 있습니다. Skyscanner라는 저가항공 검색을 통해 저렴하게 여행을 할 수 있습니다. 독일 프랑스 벨기에 등등 다양한 곳으로 이어지는 철도도 가격이 비싸지만 , 잘 발달되어 있으니 많은 경험을 하고 돌아오세요 ! 

 친절하고 , 여유로운 도시입니다. 다양한 것을 즐기고 오시길 바랍니다."
