gen_info,env_info,food_info,study_info,office_info,facil_info,mhct_info,help_info,etc_info
"마스트리흐트라는 도시는 네덜란드 최남부에 위치하였으며, 동쪽으로는 독일, 서쪽으로는 벨기에와 가깝습니다. 특히 벨기에 국경은 차로 30분이면 넘을 정도로 가깝습니다. 학교 소개 시간에서 마스트리흐트라는 도시를 ""heart of Europe"" 이라고 소개할 정도입니다. 여행을 많이 다니기에는 정말 최적의 도시입니다. 프랑스 파리, 스위스 취리히까지 야간버스로 7-8시간만 걸리며, 편도 30유로 정도로 항공권에 비해 굉장히 저렴합니다. 또한 브뤼셀 샤를루아 공항, 네덜란드 아인트호벤 공항에서 항공권을 구하신다면 5만원 넘지 않는 가격에 라이언에어 티켓을 구하실 수 있습니다. (저는 스톡홀름까지 왕복 3만원대로 다녀왔습니다). 그 밖에도 브뤼셀 자벤텀(내셔널)공항 , 쾰른공항 등을 이용하였으며 암스테르담 공항은 멀어서 여행다닐 때에는 이용하지 않았습니다. 마스트리흐트는 굉장히 깨끗하고 생활 수준이 높은 도시입니다. 저는 다른 네덜란드 지역을 여행하면서 홈리스를 보았는데, 마스트리흐트에서는 한 번도 보지 못했습니다. 새벽에 혼자 돌아다녀도 괜찮을 정도로 치안도 수준급입니다. 개인적으로 치안이 좋은 점이 굉장히 마음에 들었습니다. 도시 전체가 깔끔하고, 중세 시대 모습 역시 보존하고 있습니다. 날씨는 전형적인 유럽의 날씨입니다. 저는 가을-겨울학기에 파견되어서 가을, 겨울 날씨만 말씀드리면.. 일단 10월 초중순까지는 맑은 날도 많고, 굉장히 쾌적합니다. 그런데 갑자기 비가 내리기도 합니다. 등교길에 날이 맑아서 자전거를 타고 나갔다가 하교길에 비가 엄청 내려서, 비를 쫄딱 맞으면서 자전거를 타고 온 기억이 몇 번 있습니다.. 겨울에 들어서면서 맑은 날은 거의 찾아보기 힘들고 비가 많이 내립니다. 비가 거세지는 않지만 바람이 많이 불어서 자전거 타기에 힘들었습니다. 저는 파견보고서를 읽다가 날씨가 너무 안 좋다는 얘기만 듣고 걱정했는데, 겨울에 따뜻한 남쪽 나라(그리스 등) 으로 여행 많이 다니시면..괜찮습니다.ㅎㅎ..","저는 SBE 건물에서 수업을 주로 들었고, 다른 단과대도 주위에 건물이 있는 걸로 압니다. 캠퍼스는 도시 전체에 흩어져 있습니다. 대학 근처에는 공원도 있고, 카페도 있고, 레스토랑도 있고.. 시내 쪽에 가면 술집도 많습니다. 뭔가가 없어서 불편하다거나 그런 것은 느끼지 못했습니다.","저는 한국인들이 많이 사는 M빌딩에 신청을 못 해서, 강 건너편 Raccordement 거리에 있는 플랫에 살았습니다. 한 플랫에 다섯 명이 있고, 각자 개인 방을 쓰며, 화장실, 샤워실, 주방을 공유했습니다. 제가 사는 플랫에는 일주일마다 청소를 해 주시는 분들이 오셔서, 화장실과 주방 등 공용공간은 다 청소해 주시고 휴지와 비누 등도 다 리필을 해 주셨습니다. M빌딩은 청소도 각자 하고 공용물품이라는 것이 없다고 들었습니다. 플랫이 작아서 플랫메이트를 누구를 만나느냐에 따라 삶의 질이 많이 좌우되는데, 저희 층 플랫메이트들은 굉장히 개인주의적이고 조용했습니다. 또 주방을 깔끔하게 청소해서 좋았습니다. 하지만 플랫에 따라 주방을 심각하게 치우지 않거나, 밤까지 주방에서 시끄러운 플랫도 있었습니다. 이건 운이라고 생각합니다. 1인실이기에 방세가 좀 비쌌습니다. 하루에 19유로였습니다. 그런데 정말 화가 났던 것은.. 제 방에 베드버그가 있었습니다. 9월 초쯤부터 자고 일어나면 물린 자국이 생겨 있고 간지러워서, 처음에는 모기인 줄 알고 모기 약을 처방받고 모기향을 피웠습니다. 하지만 거의 두 달이 지나도록 모기는 보이지도 않고 계속해서 물렸습니다. 정말 의아해하고 있던 차에 벽으로 기어가는 어떤 벌레를 눌러 죽였는데.. 거기서 제 피가 튀어나왔습니다. 그 당시 기분을 절대 잊을 수 없습니다. 학교 측에 연락했더니 pest control을 불러 주었습니다. 그런데 제 침대에서 발견하지 못했다고 하더라고요.. 맨날 물리는데^^ 약을 쳐 주고 가긴 갔는데 그 이후로도 계속해서 물렸습니다 ㅠ 그 이후에 몇 마리를 잡아 죽였고.. 또 한번 더 불러서 약을 치고 가긴 했는데 그 이후로도 물리긴 물렸습니다. 기숙사 측에서 아무 보상도 안 해주고 미안하다는 말 밖에 안하더라고요..?ㅎㅎ 그래서 한때 정말 힘들었습니다.. 외식 물가가 굉장히 비싸고 장바구니 물가는 그에 비해 무척 저렴하다 보니, 외식을 한 적이 손에 꼽습니다. 비싸더라도 맛있으면 먹겠는데, 대부분 가격에 비해 별로 맛이 없었습니다. AO(Amazing Oriental) 에서 아시아 식재료를 사기도 하고, 한국에서 부모님이 택배를 보내주셔서 한국 음식을 많이 해 먹었습니다. 서브웨이 샌드위치도 많이 포장해서 먹었습니다.","제가 파견된 학기에 경제학과 학생이 저밖에 없었어서 경제학과 수업 정보를 드리고자 합니다. 저는 총 두 과목(period 당 한 과목)을 들었습니다. 다들 처음에는 열의에 넘쳐서 period 당 두 과목을 꽉꽉 채워서 왔는데 여행 다니다보니 다들 드랍하더군요.. 저랑 같이 파견된 사람들 중에 세 과목 이상을 pass 해서 간 사람은 한명도 없었고, 최대가 두 과목이었습니다. 마스의 학업량이 꽤 빡세다보니, 여행하면서 들으려니까 한 피리어드 당 두 과목은 절대 못 듣겠더라고요..Development Economics - PBL이 없다고 해서 신청한 과목이었습니다. 대신 일주일에 한번씩 팀별로 문제 푼 것을 나와서 발표해야 했습니다. 다시 말해서 매주 팀플이 있었습니다^^.. 굉장히 귀찮았습니다. 그리고 배우는 내용도 한국의 경제학에서 별로 중요하게 다루지 않는 내용이다 보니 재미가 없었습니다. 또 교수님의 강의가 총 세 번이 있는데, 이 강의와 교과서의 난이도 차이가 너무 심하게 나서 어떻게 시험 공부를 해야 되는지 감이 잘 잡히지 않았습니다. 비추합니다. Economics and Society in Contemporary Asia- 저와 같이 파견된 모든 SBE 한국인 학생들이 period 2에 이 과목을 수강했습니다. 저는 첫 피리어드 때 들었던 과목이 별로 마음에 들지 않았던 터라 이 과목이 상대적으로 만족스러웠습니다. 다만 부담되었던 것은 매 시간마다 참여 정도를 일일히 튜터가 기록한다는 것이었습니다. (development economics 수업은 튜터가 너희가 내성적인 성격이면 말을 하지 않아도 좋다 라고 말할 정도로 participation을 깐깐하게 보지 않았습니다) 그게 부담스러웠지만 적응되고 말을 많이 하면서 괜찮아졌습니다. 또 이 수업을 듣는 학생들이 아시아로 인턴을 곧 나가는 학생들이어서 기본적으로 아시아에 대한 지식도 굉장히 많고 훨씬 오픈마인드라는 생각이 들었습니다. 시험은 리딩에서 나오는데 리딩 양이 많긴 하지만 시험 전 하루 정도 투자하면 무난히 패스할 수 있습니다.도서관은 연세대에 비해 훨씬 작은 편입니다. 시험 기간에 자리를 찾기 어렵다는데 저는 항상 느즈막히 가서 그런지 자리는 있었습니다..ㅎㅎ 다만 조금 방해되었던 것은, quiet room 이 아닌 곳에서는 취식이 자유롭다는 점입니다. 제 옆에 앉아 있던 학생이 하루 종일 파스타를 먹어서, 소리와 냄새때문에 방해되었던 기억이 있습니다.","sbe 에 국제교육부 비슷한, 학생들을 관리하는 학사처? 같은 곳이 있습니다. 저는 직접 찾아가 본 적은 없고 메일로 계속 대화했습니다. 유럽권이 답장이 느리고 일처리가 느리다고 해서 걱정했는데, 웬만하면 2일 안에는 답장을 주셨습니다.",동아리는 들지 않아서 모르겠습니다. 학교 밥이 맛이 없다는 소리를 듣고 학교 식당은 한 번도 이용하지 않았습니다.,"학생과 교수 사이 위계질서의 부재가 가장 놀라웠습니다. 물론 각 수업에 들어오시는 분들은 엄밀히 말하면 교수는 아닌 튜터지만, 그래도 교수와 거의 비슷한 지위인데 질문이나 이의 제기가 굉장히 자연스러웠습니다. 저희 분반이 참여율이 적다고, 튜터가 예정되지 않은 퀴즈를 본 적이 있었습니다. 물론 전 시간에 퀴즈를 본다고 공지했으며, 퀴즈 점수는 참여 점수에 포함된다고 공지했습니다. 저를 포함한 아시아 학생들은 별다른 이의 없이 퀴즈를 봤었는데, 정규 학생들이 수업 도중 이의 제기를 했습니다. 대충 "" 이런 식으로 퀴즈를 보는 것은 참여하고자 하는 나의 의지를 더욱 떨어뜨리며 이건 블합리하다 "" 이런 내용이었습니다. 결국 퀴즈는 점수에 반영되지 않았습니다. 또 같은 플랫에 여자와 남자가 같은 샤워실을 쓰며, 샤워가운을 입고 복도에서 자연스럽게 이야기 나누는 것도 굉장히 새로운 경험이었습니다.","따로 도움을 받은 적이 없지만, 이메일로 문의를 드리면 답장을 잘 해 주십니다.","저는 유럽 여행을 하고 싶어서 유럽, 그 중에서도 영어를 모든 국민이 다 잘 한다는 네덜란드에 가겠다고 일찌감치 마음을 먹고 있었습니다. 네덜란드 도시 중에서도 마스트리흐트는 정말 예쁘고, 치안도 좋은 도시입니다. 오히려 암스테르담에 갔으면 밤에 돌아다니기 무서웠을 것 같더라고요.. 또 여행다니기 정말 좋은 위치여서, 위치와 도시 분위기에 만족하며 학교를 다녔습니다. 파견보고서를 보면 학업량이 많다는 말이 많은데, 한 period 당 한 과목만 들으면 들을 만 합니다. 그리고 무엇보다 PBL 방법에 적응하기 위해 스파르타적으로 스피킹을 하다 보니 영어 스피킹이 많이 늘었습니다. 읽어야 되는 리딩도 많아서 읽다 보면 자연스럽게 리딩 능력도 향상됩니다. 교환을 다녀온 직후 토플 점수가 필요해서 시험을 다시 쳤는데, 토플 점수가 갑자기 만점에 가까운 점수가 나와서.. 정말 놀랐는데 이게 다 마스트리흐트에서 영어를 많이 쓴 덕분이라고 생각합니다. 저는 한 학기 동안 정말 좋았고, 베드버그가 없었다면 더 좋았을 것 같지만.. 많은 분들께 추천드리고 싶습니다."
"마스트리히트는 네덜란드 최남부에 위치한 도시로, 네덜란드에서 가장 오래된 도시로 알려져 있습니다. 부유한 실버타운 느낌이고, 대학이 도시 전체에 퍼져 있습니다. 그러다보니 절반은 학생이고 절반은 노인입니다. 위험하지 않고 평화로운 도시입니다.비가 자주 옵니다. 살다보면 비오는 데 익숙해져서 비가 와도 우산 안 쓰고 자전거 타고 다닙니다. 독일과 벨기에와 국경을 마주하고 있습니다. 자전거 타고도 다른 나라를 갈 수 있을 만큼 기차 여행하기에 좋습니다. 그러나 비행기 타려면 Amsterdam 까지 가야해서 불편했습니다.","마스 강을 끼고 있는 시청 근처에 레스토랑, 펍, 옷가게 등 상가가 모여있습니다. 레스토랑은 물가가 비싸 자주 가지는 않았습니다.","저는 기숙사(https://www.sshxl.nl)에서 지냈습니다. 대부분 교환학생이 기숙사에 지냈으나, 기숙사를 구하지 못한 친구들은 따로 방을 구해서 살았습니다. 기숙사보다 가격이 비싼데 방 크기가 작기 때문에 웬만하면 기숙사에 사는 것을 추천합니다. 주차장이 보이는 frontside와 달리 backside(X00~X15호)는 매일 노을이 지는 걸 볼 수 있습니다. 덕분에 인생샷 많이 찍었습니다. 기숙사에서 걸어서 5분 거리에 마트 Jumbo와 Albert Heijn이 있습니다. 여기서 식재료를 사서 직접 해먹었습니다. 기숙사 로비에서 샌드위치나 햄버거를 팔지만 식사용으로 적합항 양은 아닙니다. 자전거로 10분 거리에 있는 시청 옆에 아시안 마트가 있습니다. 웬만한 한식 재료는 다 구할 수 있습니다.","FASOS(사과대) 수업을 따라가기에 다소 힘이 듭니다. 매 수업 전 읽어야 할 자료가 100 페이지에 달합니다. 읽은 내용을 토대로 토론 수업을 합니다. 그러다보니 SBE(경영대)에 비해 NP를 받은 친구들이 많았습니다. Minor European Studies를 들었는데, 유럽연합의 생성 및 발전 과정을 배우고 이 과정에서 각 나라 사이의 갈등에 대해 배웠습니다.도서관이 쾌적하고 꽤 넓습니다. 소음 단계별(절대엄숙, 작은 소음 허용, 잡담 가능)로 구분해서 사용할 수 있습니다 .",이용한 적 없습니다,ESN(유럽 전역 학생 조직) 단체에서 교환학생을 대상으로 다양한 파티를 주관합니다. 멤버십 가입을 하지 않아도 무료 프로그램을 즐길 수 있습니다. 친구를 사귀기 전인 초반에만 참여하고 후반에는 참여하지 않았습니다. 저는 동아리에 들어가지 않았습니다. 제 친구는 밴드 동아리에 들어가서 활동한 걸로 알고 있습니다. 교환학생이어도 동아리에 들어갈 수 있는 것 같습니다.,없었습니다,메일로 문의하면 빠르고 친절하게 답해줍니다.,
