gen_info,env_info,food_info,study_info,office_info,facil_info,mhct_info,help_info,etc_info
"UvA는 한국의 대학과 달리 암스테르담 도시 곳곳에 캠퍼스가 흩어져 있기에 본인이 수업을 듣는 건물이 아니라면 학기가 끝나도록 가보지 않을 수도 있습니다. 저는 문과대 수업과 교양을 들어서 PC Hoofthuis와 Oudemanhuispoort (OMHP)를 주로 이용하였습니다. 두 건물 모두 센트랄 역 근처에 위치해 이동이 편리하고 서로 걸어서 15분 정도의 거리여서 하루에 두 건물을 오가는 것이 가능했습니다. PC Hoofthuis는 시설이 좀 오래된 편이나 USC라는 학교와 제휴를 맺은 헬스장이 있어 편리했습니다. OMHP는 구글맵에 찍고 찾아가면 처음에는 입구를 찾기 힘들 수 있는데 중고책을 파는 복도 가운데로 난 문을 통해 정원을 가로질러 들어가시면 됩니다. 학교 시설은 연세대와 달리 주말에는 문을 열지 않아 당황스러웠던 경험도 있습니다.암스테르담은 유럽 여행을 다니기에 정말 좋은 위치에 자리잡고 있습니다. 벨기에, 독일, 프랑스 등은 버스로도 오갈 수 있으며 더 먼곳으로의 항공권도 저렴한 편입니다. 스키폴 공항은 유럽 공항치고 정말 깨끗하고 잘 정돈되어 있으며 인천국제공항에 비하면 사람이 매우 적어 유럽 내 이동일 경우 출발 한 시간 전에만 도착해도 문제가 없는 수준입니다. 여행을 많이 다니고 싶다면 암스테르담이 좋은 선택이 될 것입니다.봄학기는 어떤지 모르겠지만 네덜란드의 가을학기는 매우 춥습니다. 8월에 처음 도착해서 3주간은 눈부실 정도로 햇살이 강렬하고 더웠으나 금방 바람이 불고 비가 오기 시작합니다. 비바람이 매우 심하기 때문에 절대 기온만 보고 옷을 준비하면 안되고 한국보다 먼저 추워진다고 생각해야 합니다. 9월까지가 여행 다니기에 적합한 날씨이고 10월부터는 체감상 겨울입니다. 네덜란드로 가신다면 조끼패딩과 접는 우산은 필수입니다. 저는 기온을 보고 롱패딩은 안 가져갔으나 가져가는 것을 추천합니다. 네덜란드 뿐만 아니라 근처의 다른 나라들도 가을겨울에는 매우 춥습니다. 장갑, 목도리, 내복, 전기장판은 꼭 가져가시거나 도착 후라도 마련하시기 바랍니다.",제가 주로 이용한 PCH와 OMHP는 센트랄에 위치해 공강 또는 하교 후 쇼핑이나 외식을 하기에 편리했습니다. 학교 건물에서 십분 정도만 걸으면 암스테르담의 가장 번화한 쇼핑 거리가 나옵니다. 특이점을 찾자면 근처에 홍등가도 위치해있어 등굣길에 놀라실 수 있습니다. 서울과 비교하면 암스테르담은 훨씬 한적해서 뭔가를 하고싶으면 생각없이 센트랄로 향하게 되는 경우가 많은데 학교를 다니면서 도시와 내적 친밀감을 쌓을 수 있었습니다.,"저는 UvA를 통해 Camelot Europe이라는 부동산 회사와 매칭이 되었는데 이 회사만큼은 피하시길 바랍니다. 만족도가 워낙 낮아 이제는 UvA와 계약하지 않을 수도 있다고 들었습니다. 렌트와 같은 기본적인 공지사항도 제대로 전달해주지 않으며 계약금도 제때 돌려주지 않아 같은 기숙사에 사는 왓츠앱 채팅방은 항상 불만으로 가득 차있었습니다.저는 Camelot Europe의 WASA Student Village라는 기숙사에 거주했는데 신축이라 다른 기숙사에 비해 깔끔했으나 매우 매우 좁아서 공간 활용을 잘 해야했습니다. 집 안에 빈 공간이 별로 없어 친구를 데려오기 힘든 수준이었습니다. 그래도 개인실 내에 부엌과 화장실 모두 딸려있어 불편함 없이 사용할 수 있었습니다. 다만 신축인 점과 개인 시설임을 고려해도 이곳이 제가 나중에 알게 된 암스테르담의 기숙사 중 가장 렌트가 비쌌기에 굳이 추천해드리지는 않습니다. 위치는 Sloterdijk역 앞이라 Flix Bus를 탈 때에는 편리했으나 그 외에는 장점이 별로 없었습니다. 주변에 네덜란드의 가장 대표적인 슈퍼마켓인 Albert Heijn조차 없어 다른 동네에서 장을 봐오곤 했고 메트로를 타면 도심까지 시간이 너무 오래 걸려 매일 기차를 타고 다녔습니다.암스테르담의 외식 물가가 매우 비싸고 맛은 값에 비해 떨어지기 때문에 학생들은 대부분 식사를 집에서 해결합니다. Albert Heijn에는 재료들이 소분이 잘 되어있고 장바구니 물가는 나쁘지 않아 혼자 요리해먹기 괜찮습니다. Shilla라는 한인마트에 가면 한식에 필요한 웬만한 것들은 다 팔아서 한식 위주로 먹는 것도 가능합니다. 양념장, 라면, 햇반, 콩나물, 심지어 깻잎 장아찌까지 팔기 때문에 한국에서 음식을 싸갈 필요가 없습니다. 다만 사이즈가 작은 밥솥을 원하신다면 한국에서 가져오시는 것을 추천합니다.저는 외식을 많이 해본 편인데 비싼 걸 사먹어도 맛있는 경우가 많지 않기 때문에 집에서 요리를 해드시는게 훨씬 낫습니다. 굳이 외식을 한다면 주로 아시안 음식이 실패율이 낮은 편입니다. 네덜란드인들은 맛에 관대한 편이기 때문에 외식을 할 때에는 구글맵에 최소 평점 4점짜리로만 찾아다니는 것을 추천하며 이렇게 찾아가도 그냥 먹을만한 수준입니다.","UvA의 한 학기는 세 block으로 나뉘어져 있어 수강신청 할 때 어떤 블럭에 열리는 수업인지 확인해야 합니다. 교환학생들은 보통 한 블럭에 두 과목 정도를 수강하며, 여행 또는 귀국을 위해 세번째 블럭에는 주로 아무것도 듣지 않습니다. 또한 모든 과목이 패논패로 (10점 만점에 5.5 이상) 평가됩니다. 저는 12 ECT짜리 교양 한 과목, 6 ECT짜리 전공 두 과목을 듣고 들어왔는데 한국에 비하면 워크 로드가 정말 가벼웠습니다. 애초에 수업 시간이 많지 않기 때문에 시간표를 잘 짜면 일주일에 한두번 등교하는 것도 가능합니다. 여행을 많이 다닐 계획이라면 등교 일수를 줄이고 자잘한 과제보단 시험이나 에세이로 끝내는 과목을 선택하는 것을 추천합니다.도서관에서 공부하고 싶다면 UvA 도서관을 가도 되지만 센트랄 역 근처에 OBA라는 시립 도서관이 시설도 좋고 접근성이 뛰어나 저는 이곳을 애용했습니다. 별다른 가입이나 예약 절차 없이 이용할 수 있지만 시험기간에는 자리가 금방 차는 편입니다. 또한 도서관 예절이 한국에 비해 엄격하지 않아 공부하는 자리에서 친구와 떠들거나 도시락을 챙겨먹는 모습도 볼 수 있습니다.",이메일로 많은 정보를 알려주는데 특별히 신경쓰셔야 할 점은 없습니다. 도움 요청할 사항이 없다면 한 학기 내내 교류할 일이 없습니다. 교환학생들이나 외국인들을 많이 만나보고 싶다면 International Student Network (ISN)에서 하는 행사들에 참여하시면 됩니다. 하지만 이 또한 필수는 아니고 19-2에 연세대에서 저와 함께 교환을 간 친구들 중 아무도 ISN에 열심히 참여하지 않았습니다. 한국인 학생들끼리는 알음알음 알게 됩니다.,USC라는 헬스장 체인이 학교와 제휴를 맺기 때문에 학기 초에 굉장히 저렴한 가격에 등록할 수 있습니다. 암스테르담 내 여러 지점을 자유롭게 이용할 수 있고 미리 예약한다면 각종 클래스나 PT까지 추가 지불 없이 이용할 수 있어 만족스러웠습니다.UvA 동아리를 하는 교환학생은 잘 보지 못했으나 동아리처럼 다양한 활동을 원하신다면 ISN에 참여하시면 됩니다. 또한 Global Student Ambassador이라는 활동도 이메일을 통해 모집했던 것 같습니다.헬스장 외에는 학교 부대시설을 쓸 일이 별로 없습니다. PCH의 경우 카페테리아가 있지만 한국같은 학식이 아니라 정말 빈약한 샌드위치와 쿠키 정도를 팔기 때문에 식사는 도시락이나 외식으로 해결하는 것이 낫습니다. 교내 자판기나 프린터는 학생증을 등록 후 결제할 수 있는데 굳이 등록하지 않아도 괜찮습니다.,예상하고 갔기 때문에 아주 놀랍지는 않았지만 대마 냄새가 정말 많이 납니다. 길을 가다 보면 일반적인 카페와 대마를 파는 커피샵을 비슷한 빈도로 찾을 수 있습니다. 홍등가 또한 처음에는 충격적이지만 워낙 도심 한가운데에 위치하고 있고 사람들이 아무렇지 않게 지나다녀 무서운 분위기는 아닙니다.컬쳐쇼크라고 할 것은 없지만 네덜란드 사람들은 영어를 정말 잘 하기 때문에 더치어를 한마디도 몰라도 충분히 잘 생활하실 수 있습니다. 굳이 어려운 부분을 꼽자면 장 볼때 상품에 영어 설명이 없을 때가 많은데 구글 번역기를 사용하시면 괜찮습니다.네덜란드에는 자전거가 정말 많습니다. 교통의 가장 기본적인 형태가 자전거 이용이라 대중교통이나 자동차를 이용하는 것과 자전거를 타고 가는것이 시간 소요 측면에서도 별로 차이가 없는 경우가 많습니다. 네덜란드 사람들은 자전거를 아주 능숙하게 타기 때문에 처음에는 무서울 수 있습니다. 자전거 도로가 인도보다 넓은 경우도 많은데 밟지 않게 주의해야 합니다. 이처럼 네덜란드인에게는 기본이지만 자전거가 익숙하지 않다면 없이 생활하셔도 됩니다. 저는 자전거를 가져갔음에도 불구하고 집이 도심과 떨어져 있어 어차피 대중교통을 이용해야 했기에 자전거를 타지 않았고 함께 교환 간 다른 친구들도 거의 자전거 없이 생활했습니다. 자전거가 없다면 대중교통과 걷는 것에 익숙해지면 됩니다. 살다보면 30분 거리 정도는 그냥 걸을만 하다고 생각하게 됩니다.,학교생활에 관해서는 교수님께 질문하면 친절하게 도와주십니다.네덜란드 생활에 대해 궁금한 게 있다면 보통 같이 교환 간 친구들과 함께 서로 물어가며 적응하게 됩니다. 또한 페이스북에 '낮은 땅 높은 꿈'이라는 네덜란드 거주 한인 그룹에 질문해도 친절하게 답해주십니다.,
"다른 분들 후기에서도 나와있듯이 암스테르담 대학교의 건물은 도시 곳곳에 펼쳐져 있습니다. 제가 가장 많은 수업을 들은 PC Hoofthuis는 Dam Square와 주변 쇼핑 거리와도 가까워 공강이나 수업이 끝난 후 맛있는 것을 먹고 돌아다니기에 매우 좋았습니다. 하지만 다른 캠퍼스와는 거리가 좀 있어서(REC까지 걸어서 20분) 수강 신청 시 수업 시간을 고려해야 할 수도 있습니다. 그렇다고 해도 암스테르담 자체가 작은 도시이기 때문에 캠퍼스 간 이동 시에 뚜벅이로 충분히 가능합니다.저는 8월 16일부터 1월 21일까지 암스테르담에 머물렀는데, 처음 몇 주에는 정말 여름날씨였습니다. 운하에 들어가 수영을 하는 더치들을 많이 볼 수 있었습니다. 하지만 그 후에는 한국보다 훨씬 빠르게 추워졌습니다. 한국보다 온도는 높지만 바람이 많이 불고 비가 자주 와서 저는 더 춥게 느껴졌습니다. 비는 정말정말정말 자주 옵니다. 우산은 가방에 매일 들어있어야 해요. 네덜란드를 교환국으로 선택하는 많은 분들이 여행의 편리성을 이유로 선택하시기도 할텐데요. 암스테르담은 특히 더 여행하기 좋습니다. 제가 살던 Maassluisstraat는 공항까지 대중교통을 이용해 25분이면 도착할 수 있었습니다. 또한 파리, 벨기에, 독일 등으로 가는 버스를 탈 수 있는 Sloterdijk역 또한 지하철로 10분이면 갈 수 있기 때문에 여행을 많이 갈 계획이시라면 UvA가 좋은 선택지입니다.","UvA는 위에서도 말했듯이 암스테르담 곳곳에 있습니다. 다 센트럴을 중심으로 위치해 있어 식당, 할 거리, 볼 거리들을 쉽게 찾을 수 있습니다. 굳이 도착한 초반부터 열심히 돌아다니지 않아도 도시 자체가 작아서 한 학기 동안 학교를 다니면서 충분히 둘러볼 수 있습니다.","기숙사 선택 과정은 다른 후기에서도 찾아볼 수 있으니 저는 제가 머물렀던 Maassluisstraat 기숙사에 대해 알려드리겠습니다. Maassluisstraat는 암스테르담 센트럴 기준으로 남서쪽에 위치한 곳으로 센트럴까지는 대중교통을 이용해서 30분 정도 걸립니다. 네덜란드는 대중교통이 한국에 비해 비싸기 때문에(기숙사 센트럴 왕복 약 5유로=6500원 정도) 센트럴에 자주 나가실 생각이시라면 최선의 선택지는 아니라고 생각합니다.(센트럴과 가까운 기숙사: Prins Hendrikkade, Prinsengracht 정도로 알고있어요?) 하지만 저는 집에 있는 것을 좋아하기도 하고, 부엌과 화장실 모두 혼자 쓰고 싶었기 때문에 Maassluisstraat를 골랐습니다. Maassluisstraat에는 두가지의 방타입이 있는데 0층과 1층은 부엌은 공유하며 각자의 방에 침대와 화장실이 있는 타입이었고, 제가 산 2층부터 6층까지는 부엌, 화장실 모두 개인의 방 안에 있는 원룸 형식이었습니다. 부엌을 공유하는 타입이 조금 더 저렴하긴 합니다. 이건 개인의 성향에 따라 고르시면 될 것 같아요. 걸어서 5분 거리에 네덜란드의 이마트 같은 albert heijn, 조금 더 저렴한 편인 Lidl, 다이소 같은 Action이 모두 위치 해 있기 때문에 생활하는 데에는 전혀 불편함이 없었습니다. 그리고 친구들이 부러워 했던 것은 Shilla라는 한인마트와 가깝다는 점(지하철 2 정거장)이었습니다.+같이 교환 생활을 한 친구들의 기숙사를 모두 가 봤는데, Maassluisstraat가 제일 깔끔했어요!","UvA의 한 학기는 총 3개의 block으로 나누어져 있습니다. (9~10월: Block 1, 11~12월: Block 2, 1월: Block 3). 저는 block 1에 2과목, block 2에 2과목 총 24ECTs(각 6ECTs)를 수강했습니다.교양: Dutch Culture and Society in European Context      Mindfulness Across the Life Span영어영문: Authors in Focus: Oscar Wilde: Melodrama vs. Drama          Shakespeare: Works in the World수업 별로 수업 방식이 상이합니다. 어떤 수업은 한국처럼 수업 내내 교수님께서 lecture를 하시기도 하고, 어떤 수업은 학생들의 발표와 토론으로 대부분이 이루어지기도 합니다. 이는 수강신청 전 강의계획서를 보고 본인의 성향에 맞게 선택하시면 될 것 같아요. 중요!: 수강신청 시 분반을 유의하세요. 분반에 따라 수업 요일과 시간이 모두 바뀝니다. 연세대학교와 달리 수업끼리 시간이 겹쳐도 일단 수강신청이 되니 미리 타임테이블을 만들어 보는 것이 좋아요.+시간표를 잘 짜면 일주일에 한 번만 학교를 갈 수도 있습니다. 여행을 많이 할 계획이시라면 정말 좋은 시간표일 거에요!",대학에 지원을 한 후부터 정보성 메일이 자주 옵니다. 당시에 필요한 정보들은 대체로 이 메일에서 얻으실 수 있을 거에요. 개강 직전에는 단과대별로 OT를 진행하는데 여기서 주는 정보들도 사실 나중에 메일을 통해 다 알려주더라고요. 꼭 가야하는 건 아니에요. 학교 국제교육부 외에 ISN이라는 단체가 Introduction Week이나 Buddy Program 등 국제학생들을 위한 다양한 행사들을 주최합니다. 이 행사들을 통해서 다양한 외국 친구들을 만날 수 있습니다.,"이용해 본 적은 없지만 CREA에서 다양한 취미 활동을 할 수 있다고 들었습니다. USC라는 학교 내 헬스는 학기 초반에 promotion을 하니 이용해보는 것도 좋을 것 같습니다. 학교 내에 학식당(?)같은 것은 우리 학교의 학식당을 기대하시면 안 되구요. 많은 더치들은 대부분 도시락을 싸서 다니더라구요. Cafeteria에서는 커피머신, 음료 자판기, 빵이나 쿠키, 수프 등을 이용하고 사먹을 수 있지만, 전혀 가격적 메리트가 없기 때문에 굳이 추천하지는 않습니다. 학교 내 cafeteria나 프린터 등은 학생증을 충전해서 사용할 수 있는데, cafeteria는 학생증이 아니어도 계산할 수 있기 때문에 프린터를 많이 사용하실 계획이 아니라면 굳이 충전할 필요가 없습니다. (나중에 남은 돈은 refund가 되기는 하지만 수수료를 엄청 떼가요.)","대마초나 홍등가에 대해서는 이미 익히 들었던 터라 이들에 대해 충격을 받은 일은 없습니다. 생각보다 놀랐던 것은 정말정말정말 자전거를 많이 탄다는 사실이었습니다. 네덜란드에서 우선순위는 자전거>사람>자동차 순인 것 같았습니다. 보도블럭이 있는 부분이 인도, 매끄럽게 포장된 부분이 자전거 길이니, 자전거 잘 살피면서 인도로 잘 다니시길 바랍니다. 처음 갔을 때 모르고 자전거 길로 다니다가 욕 먹었어요.","대부분의 네덜란드 사람들은 영어를 잘하기 때문에 어려움을 겪을 시 영어로 물어보면 다들 잘 대답해주십니다. 학교 생활에 문제가 있을 시에는 단과대 메일로 도움을 요청하거나, 교수님께 직접 말씀드리면 친절한 답변을 얻을 수 있습니다. 기숙사 내의 문제는 각 기숙사별로 RA가 있기 떄문에 그들에게 메일을 보내면 또한 답변을 얻을 수 있습니다.",
