gen_info,env_info,food_info,study_info,office_info,facil_info,mhct_info,help_info,etc_info
"처음 네덜란드에 도착해서 놀랐던 점은 캠퍼스가 따로 없다는 것이였어요. 미국에 있는 대학을 주로 ''해외 대학''이라고 생각했던터라 캠퍼스가 있고 건물들이 모두 모여있는 환경을 상상했었어요. 하지만 학부 건물들은 제각기 흩어져 있답니다 ! 제가 수업을 들었던 문과대학건물은 도시의 중심부에 있는가 하면 교육대학건물은 상대적으로 도시 외곽에 있었어요. 건물들은 모두 방대해요 ! 문과대학건물이 적어도 네개는 되는 것으로 알고 있고 각각의 건물에 컴퓨터실 랩실 다 있구요 ! 건물들이 암스테르담 곳곳에 퍼져있기 때문에 지리적인 위치는 건물마다 달라요. 제가 공부하던 건물은 바로 옆에 좋은 사진 박물관도 있고 문화공연을 볼 수 있는 극장도 있었어요. 

날씨는 제가 갔던 겨울이 천년만의 유럽 혹한이라고 하기에 엄청나게 겁먹고 갔지만, 며칠 추워던거 빼고는 괜찮았어요. 대신 네덜란드의 그 변덕스러운 날씨는 맞추기가 어렵더라구요. 아침에 비와서 분명 우산들고 왔는데 점심때 즈음 되면 이미 다 개어버려서 우산들고 있는 손만 귀찮은 ... 그런 일들이 많았어요 ! 하지만 네덜란드 사람들, 그리고 딱 한달 먼저온 친구들은 이미 적응해있더라구요. 저도 ... 나름대로 곧 적응 했어요 ^_^","대학이 도시 사방에 퍼져 있어서 대학 주변의 환경이라고 단정짓기는 어렵고, 도시 자체와 뭉쳐져 있는 것 같아요. 학교 건물 주변에는 대개는 학교 건물들이 모여있구요 그렇지 않은 경우에는 간단한 편의시설들이 있어요. 워낙 도시 자체가 큰게 아닌지라 바로 옆에 쇼핑거리도 있는 건물들도 있구요, 옆에 식당가가 즐비한 학교 건물들도 있답니다.","학교가 캠퍼스가 없어서 기숙사가 연대에서처럼 학교에서 10분거리가 아니예요. 학교에서 중계해주는 업체를 소개시켜주는데요, 그곳에 문의하고 시키는 메일 제때제때 작성하면 집을 배정해줍니다 ! 암스테르담 안에 있는 기숙사들도 있지만 저는 암스테르담 외곽에 있는 도시에 있는 기숙사에 살았어요. 대신 중심부에 있는 집들과 비교해서 좋은 점이라면, 혼자 살고 개인 화장실이 있음에도 가격이 비싸지 않다는 점 ! 그리고 본의 아니게 계속 자전거로 통학을 하게 되어서 운동을 열심히 하게 된다는 점? 입니다. 저는 사십분 정도 자전거를 타고 가면 있는 diemen이라는 도시의 기숙사에 배정되어 친구들의 동정을 샀었지요. (꽤나 멀어서) 하지만 ! 사십분 자전거 ... 일주일 타고나면 훗! 하실 거예요. 트램이나 버스 메트로 등 교통편은 다양하지만 기본적으로 모두!모두! 자전거를 애용하는 것이 네덜란드 사람들인데요, 심지어는 제 자전거 옆에 세워둔 자전거를 실수로 넘어뜨렸는데 그것이 교수님 자전거여서 나중에 꾸지람을 들었..던 적도 있었어요. 여하간 거주 형태는 기본적으로는 학교에서 집을 구할 수 있게끔 최대한 도와주니까 걱정마셔요 ! 하지만 밀플랜이 없으니 요리 실력을 ... 쑥쑥 키우실 수 있을거예요.

학교 건물에 카페테리아는 있지만 연대 학관처럼 끼니를 마련해주는 건 아니고 간단히 요기 할만한 샌드위치 간단한 스프류 과자, 음료수 정도가 구비되어있어요. 하지만 이것으로는 ... (저는) 배가 차지 않아서 ... 매번 집에 와서 음식을 해먹었던 기억이 나요. 스스로 요리하시거나 가까운 마트에 가서 사드셔도 되구요. 하지만 네덜란드 물가가 그렇게 싼 축이 아닌지라 ... 외식은 종종! 기분이 좋을때나 ... 환율이 내린 것을 자축하는 의미로 ... 간혹 했었습니다. 그리고 개인적인 의견이지만 ... 외식하는거 보다 제가 해먹는게 나은게 대부분의 경우였던거 같아요. 그런데 립 무제한 이런 외식집은 놓치면 안되겠죠 !! +_+","수업은 교환학생이 들어가는 수업이기 때문에 영어로 이루어집니다 ! 선생님들의 영어발음이란 캬 ! 영국식 발음 사용하시는 선생님도 간혹 계신데 그런 수업 들어가시면 행운권 당첨 되신거예요 ^_^ 제가 들었던 수업들은

Pragmatics 
화용론에 관한 영문과 전공 수업입니다!
매주 책읽고 사례 분석글 쓰고 개인 발표도 하고 레포트 두번쓰고 현지조사해서 field study도 한번 했습니다. 

Cultural Conflicts and Negociations 
한국에는 없는 학문분과인 것 같아요. conflict study 석사과정의 예비단계이자, 이 전공자체를 공부하는 학생들을 위한 입문 수업이였어요. 그간 이름만으로만 만나던 학자들 텍스트 한번씩 다 읽었습니다. (아감벤, 옴니바바, 맑스, 알튀세르, 벤야민, 엥겔스, 홀, 스피박, 라깡 등) 그리고 나서 오십여명 가량되는 학생들 앞에서 컨퍼런스 형식으로 발표하고 나서 질문 받았습니다. 그리고 레포트 길게 두번 썼는데 선생님이 제시하시는 질문에 답을 하되, 읽은 내용을 인용해야 하는 것이었어요. (죽을 ... 뻔했어요) 물론 난이도가 있는 수업이었지만 정말로 재밌는 친구들 많이 만난 수업이었습니다 ! 선생님의 열정도 대단하셔서 개인면담을 어찌나 많이 잡으시던지 ... 재치도 있으시고 수업이 즐거웠어용 ~

British and American Culture I 
영문과 전공수업입니다. 노턴앤솔로지 가지고 하는 수업입니다. 여러명의 선생님들이 돌아가시면서 강의시간에는 크게 강의를 하시고 소그룹 시간에는 한분씩 그룹을 맡으셔서 팀티칭을 하시는 새로운 ! 형식의 수업이었습니다. ""영문학을 공부하는 유럽학생들은 도대체 어떤 사람인가?"" 하는 궁금증이 있으시다면 강추하는 수업입니다. 저는 여기서 아마 21세기의 셰익스피어들을 보고 온 ... 느낌이랄까 ... 기초수업이라고 해서 난이도가 쉬운거 절대 아니구요 학생들 모두 수업에 임하는 자세도 진지하고 배울게 많은 친구들이라 많이 도움 받았아요 ^_^

PHILOSOPHY OF PSYYCHOANALYSIS, FREUD AND LACAN
정신분석학 전반에 관한 수업입니다. 철학과 석사과정 기초수업인데 이번에 학부로 내려온거라며 선생님은 난이도 조정을 절대로 안하시겠다고 하시더라구요. 무서웠습니다. 프로이트 텍스트 유명한거 라깡의 텍스트 유명한거 ... 속독했어요. 그리고 이 수업의 학생들이 가장 ... 대단했다고 생각했는데 어찌나 다들 철학도 냄새를 풀풀 풍기던지 정말로 똑똑하더라구요. 저는 열심히 ... 관조하며 ... 나름의 길을 뚫었어요. 텍스트 읽어보고 안되면 물어보고 적당선에서 타협하는 자세로 ...

이렇게 네가지 수업을 듣고 청강한답시고 들어갔던 수업에서는 친구만 사귀고 놀았답니다 (호호) 요지는 수업들이 모두 학문적인 영감?을 주었다는 것이여요. 학생들이 학부3년석사1년이 세트로 묶여있기 때문에 제가 파견당시 3학년이라고 한다면, 다들 이미 학부과정에 대한 전반적인 이해는 마친 상태였던터라 모두들 전공지식이 더 풍부했던것 같아요. 하지만 수업듣는데는 큰 장애는 없었구요, 흔히들 네덜란드라고 하면 생각하는 자유^^와 관용^^의 정신 모두를 느끼면서 여러가지 자극을 받을 수 있어서 좋았어요.

놀랍게도 도서관 역시 여러개랍니다 ^_^ 그리고 당연히 한곳에 모여있지 않죠. 다른 도시에 있는 도서관도 있답니다 ! 각각의 도서는 인터넷에 들어가서 찾아본뒤에 책의 위치를 파악한 다음 그곳에 가서 빌려야하고 대여하기 전에 대출을 하겠다는 연락을 미리 해야한다고 합니다. 아무래도 제가 보려고 했던 책들이 운이 나쁘게 그런 책들이었던 것 같아요. (번거로와서 저는 ... 학교도서관에서는 책을 빌리지 않았어요) 학교 도서관 말고도 시립도서관 정말정말 좋아요 ! 중앙역 바로 옆에 있기 때문에 접근성이 매우 좋구요 ! 건물이 예쁘고 책도 방대하고 책읽는 자리도 정말 편안하고 !!! 그리고 이런 도서관이 도시마다 있다는거 ! 그래서 저는 믿거나 말거나 할일이 없으면 제가 살던 도시에 있는 도서관에서 여유로운 ~ 그리고 교양있는 주말을 보냈답니다 (잉?)","국제교육부는 학교에 속해있는 곳이구요, 이곳에서는 대개 행정적인 절차 혹은 학교에서 하는 일들 중 문서와 관련된 일을 도와주는 곳입니다. 상냥하시고 메일도 답장 잘해주시니까 모르는거 있으면 곧장 물어보시면 되구요.

ISN이라고 국제학생들 모임인 단체가 따로 있어요. 같이 노는게 주목적이구요 그것 말고도 응?이건뭐지? 이런 사항들이 생기면 질문하면 다 도와준답니다. 

다른 나라보다 네덜란드 사람들이 매우! 영어 잘하니까요, 모르는거 있으면 우물쭈물하지 마시고 곧바로 물어보시면 되어요.","동아리는 정말 여러개있지만, 네덜란드어를 주로 사용하는 환경이라 지원하고 싶지만 쉽지 않았어요. 그래서 도시에 있는 여러가지 박물관들 방문하고 친구사귀었었어요. 개인차가 물론 있지만, 보석같은 박물관들이 종종 있어서 ^_^ 그리고 저는 뭔가 ... 학교 안에서 보다 학교 밖에서 친구들을 많이 사귀어서 동아리로는 관심이 잘 가지 않았던 것 같아요.","문화적인 충격이라 ... 

지금생각해보면 상점들이 문을 매우! 빨리 닫는다는 것이 가장 충격적이었어요. 아니 ... 오후 여덟시인데 ... 왜 ... 문열은 상점이 없지 ... ? 하고 배곯았던 날이 종종 있었어요. 하지만 날짜에 따라 다르고 익숙해지면 오히려 늦게 여는 상점이 더 비싸서 안가게 되더라구요. 

또 다른 거는 행정적인 처리가 한국의 속도 반의 반 정도 되는 것 같아요. 일주일 내내 아침 아홉시부터 저녁 여섯시까지 열려있는 관광서 거의 없구요 날짜 맞춰서 제가 찾아다녀야 하고 470유로정도를 내고 받은 거주허가증이 ... 네덜란드 출국 한달전에 나온거로부터 시작해서 사연이야 많습니다. 하지만 이것도 적응하게 되면 생활 템포 자체가 ''빨리빨리''에서 벗어나서 마음이 차분해지는 기분이 들어요. 

그리고 자동차 많이 안 타고 자전거를 많이 사용하는 것도 충격이었구요.
비가 오나 눈이 오나 바람이 부타 다들 자전거 탄답니다.","한국대사관도 좋구요, 한국인 유학생을 아신다면 도움 받을 수도 있고, 아까 말했던 ISN도 좋구요 ! 바로 옆집 사람들에게도 물어도 도움은 항상 받을 수 있어요 !","처음으로 집에서 떨어져 사는 것이었고, 해외에 나가는 것도 정말 15년 이상 된일이었어요. 그래서 어찌나 두근두근 하고 기대를 많이 했었는지 몰라요. 
지금 생각하면 네덜란드에서 만난 친구들 하나하나가 정말 소중하고 있었던 우여곡절 하나가 기억나요. 한국에 다시 온지 얼마 되지도 않았는데 벌써부터 네덜란드가 몹시 그리워요 ^_^"
"암스테르담은 네덜란드의 수도이기는 하지만 비교적 도시의 크기는 작기 때문에 자전거 하나면 모든 곳을 갈 수 있습니다. UVA는 우리학교처럼 캠퍼스의 형태가 아닌 도시 전체에 산발적으로 위치하고 있기 때문에 그 크기는 이렇다라고 말하기가 어려운 것 같네요
네덜란드는 전반적으로 유럽에서 중앙부에 위치하고 있기 때문에 (북유럽을 포함하였을때) 어디든 여행을 하기가 매우 좋습니다. 유로라인이라는 버스를 이용할 수도 있고 저가항공 라이언에어를 이용할 수도 있으며 가까운 스키폴 공항에서는 이지젯이라는 중저가 항공을 이용할 수 있습니다. 
비가 많이 오는 우울한 날씨라고도 하지만, 저는 일 년이라는 시간을 있어서였는지, 아니면 너무나도 극단적인 덥고 춥고를 반복하는 한국의 날씨에 익숙한 까닭이었는지, 날씨는 매우 좋다고 생각하였습니다. 비가 자주오긴 하지만, 소나기나 태풍처럼 강하게 오는 날은 거의 없었고, 대부분 가랑비처럼 얇은 비였습니다. 게다가 여름에는 약 20도를 웃도는 날씨이기에 여름을 보내기 서늘하여 매우 좋았고 겨울 역시 해양성 기후라 그렇게까지 추워지지 않는 까닭에 네덜란드의 날씨에 불만을 가져본 적은 없었던 것 같습니다. (물론, 겨울엔 4시면 해가 지는 까닭에 우울해 하기도 했지만요)",대학은 도시 중심부에 자리잡고 있기 때문에 주변 환경은 매우 좋다고 할 수 있습니다. 기숙사 역시 Diemen 이라는 곳이나 Amstel 지역에 자리잡고 있지 않는 한 대학 건물에서 매우 가깝고 (저는 방에서 교실까지 자전거를 타고 5분밖에 걸리지 않았었습니다.) 그 근처에 모든 상점들이나 카페가 자리잡고 있습니다.,"제가 머물렀던 곳은 Weesperstraat 이라는 7층 건물의 한 층에 19명이 사는 그런 곳이었는데요. 19명이 살고 있음에도 불구하고 개인 방이 있고 부엌과 화장실 정도만 공유하는 덕에, 그리고 다들 각기 다른 생활패턴을 지니고 있기 때문에 그렇게까지 불편하지는 않았었습니다. 국제학생들이 사는 층이 따로 있어서 그곳에서 파티도 많이 열고 해서 놀기에는 매우 좋았습니다. 기숙사 역시 도시 중심가에 위치하고 있었기 때문에 정말 좋았습니다. 저는 이곳에 산 걸 절대 후회하지 않고 제가 행복한 교환학생 생활을 할 수 있었던 것도 이 곳에 배정받았기 때문에 외국인들과 만날 수 있는 기회가 더 많았던 것 같네요.
식사는 살인적인 물가 탓에 절대로 밖에서 자주 먹지는 않고 대부분 Albert Heijn이라는 곳에서 사서 요리해 먹었습니다. 전 가기 전 라면밖에 못했었는데 가니까 저절로 하게 되더군요. 그래도 네덜란드는 북유럽에 비해 고기의 가격이 그다지 비싸지는 않기 때문에 잘 먹고 다닌 것 같습니다. 저는 개인적으로 네이버 키친의 도움을 많이 받았습니다. 그리고 방이 학교 근처에 있었기 때문에 따로 싸들고 다니지 않고 수업이 끝나면 방으로 돌아와서 식사를 하는 형태였습니다.","수업은 모두 영어로 진행되고, 외국인 학생들도 많습니다. 그렇게까지 어렵거나 까다롭진 않지만, 그렇게까지 쉬운것도 아닌 것 같습니다. 저는 기말 페이퍼로 10페이지 4500자 분량의 에세이를 총 세번 제출해야했었습니다. 제가 들은 수업은 experiencing differences, Migration development, Color and culture, 19th century art, Lecture series: Aid 이정도였습니다. 수업마다 난이도가 매우 달라서 한가지로 종합하여 말하기는 어렵네요. UVA가 워낙 좋은 학교이기도 한 까닭에 너무 쉽지만은 않지만, 그래도 교수님들께서 영어가 버겁다는 점을 이해하시기 때문에 (네덜란드 교수님들도 영어가 모국어는 아니니깐요) 수업만 열심히 나가신다면 비교적 수월하게 Pass는 하실 수 있으실 겁니다.
학교 도서관도 도시 이곳저곳에 산재해있는 것으로 알고 있지만, 저는 암스테르담 중앙역 근처에 있는 시립도서관을 이용하였습니다.","국제교육부는 주로 PHK라는 Prins Hendricade에 위치하고 있는 건물입니다. 그러나 국제학생들이 서로 친해질 수 있도록 도움을 주는 우리학교의 멘토스나 IYC와 같은 동아리는 ISN이라는 Internationsl Social Network라는 곳입니다. 매주 화요일마다 술집을 통째로 빌려서 국제학생들을 초대하여 서로가 얼굴을 익히고 친해질 수 있도록 해주며, 여러가지 이벤트들을 기획하여 교환학생들이 여러 경험을 할 수 있도록 도와줍니다. 제가 있었을 때에는 파리로 스키를 타러가는 것도 있었고, 더셀도르프라고 독일의 작은 도시에 크리스마스 마켓을 구경하는 것 등 여러가지 이벤트들이 있었습니다.","Crea라는 문화공간이 있는 것으로 알고 있지만, 저는 이용한 적이 없습니다.","여러가지가 있었지만, 네덜란드만의 문화충격을 고르면, 한가지는 도로의 왕이 자전거라는 점입니다. 자동차도 아니고 사람도 아닌, 자전거가 도로를 점령하고 있으며, 돌아다니실 때에는 자전거를 항상 조심하셔야 합니다. 그들은 멈추지 않고 가니까요. 그렇지만, 아마 직접 자전거를 타고 다니시면 그 마음을 이해하게 될 거에요. 정말 자전거도로가 잘 만들어져 있습니다.
또 한 가지는 그들의 키가 매우 크다는 점인데요. 저는 네덜란드 인들과 대화하기 위해 까치발을 들었고, 그들은 허리를 숙여야했습니다. 
마지막으로는 네덜란드만의 전통음식이라고 할 수 있는 빵치즈였습니다. 다른 토마토나 햄 등은 전혀 들어가지 않은 치즈만을 넣은 샌드위치를 익숙하게 먹습니다. 저 역시 처음에는 놀랐으나 나중에는 똑같이 먹었습니다. 아무래도 훌륭한 치즈를 생산하는 나라인 까닭이겠죠.",ISN이나 국제처로 메일을 보내면 잘 도와줍니다.,저는 정말 제 인생에 두번다시 없을 그런 후회없는 훌륭한 일년을 보냈습니다. 여러분도 저와같은 경험을 할 수 있길 바랍니다. 혹시 더 궁금한 사항이 있으시면 메일 보내주세요. claire900207@yahoo.co.kr
