gen_info,env_info,food_info,study_info,office_info,facil_info,mhct_info,help_info,etc_info
"UvA는 우리나라 대학 캠퍼스와는 다르게 암스테르담 전체에 대학 건물이 흩어져 있는 대학교에요. 그래서 사실 어느 학부의 어느 수업을 듣느냐에 따라 통학거리도 달라지고 하는데요, 암스테르담 자체가 굉장히 자그마한 도시여서 웬만한 곳은 다 자전거로 통학 가능했어요. 저 같은 경우는 두 건물에만 수업이 있었는데 둘 다 걸어서 15분이면 도착할 수 있었구요.
암스테르담은 영국 런던이랑 위도가 비슷해서 날씨도 비슷하다고 들었는데요, 특히 운하가 많아서 그런지 처음 도착했을 땐 무시무시한 바람에 정말 경악을 금치 못했어요. 안 그래도 커다란 짐을 끌고 낯선 도시를 찾아다녀야 하는데 거기다가 비바람이 몰아치는 바람에 사실 도시의 첫 인상이 썩 좋지는 않았어요. 그 이후에도 날씨 자체는 뭐... 더 좋아지지는 않았답니다. 암스테르담 자체는 참 작고 예쁘고 정말정말 좋은데, 매일 흐리고 비오고 바람 부는 날씨가 가장 에러였어요. 날씨 안 좋단 말이야 암스테르담 교환학생이나 유학에 관해서 찾아보면 가장 많이 나오는 이야기인 것 같던데, 그거 다 과장 아니구요 본인 기분이 날씨 영향을 많이 받으신다거나 막 화창하고 반짝반짝한 놀기 좋은 날씨를 원하신다면 암스테르담은 피하시는 게 좋을 거에요. 올해도 정말 5월까지 우중충하고 비오고 흐리고 그랬어요. 4월까지는 눈오고 겨울이었구요 ㅎㅎ 그러니까 딱! 하나 암스테르담에 비추하는게 있다면 기후인 것 같아요.","위에도 말씀드렸다시피 UvA은 캠퍼스가 따로 있는 게 아니라 건물마다 암스테르담 전체에 흩어져있는 구조에요. 저는 International students만 듣는 수업 하나와 사회과학쪽 수업을 하나 들었었는데요, OMHP라고 student service center의 바로 옆?에 있는 원래 law department인 건물과 BG5라고 또 바로 그 몇 건물 떨어져있는 건물에서 수업을 받았어요. 여기는 중심가와 굉장히 가까운 곳이어서 걸어서 10~15분이면 댐 광장에 도착할 수 있었어요. 가는 길에는 쇼핑 스트리트도 있어서 수업 끝나고 자주 가곤 했었죠 ㅎㅎ. 아 그리고 OMHP에는 중고 책시장이 있어요! 여행책자 론리플래닛 같은데 보셔도 꼭 언급되는 곳이에요. 건물들 앞에는 바로 운하가 있어서 경치도 너무 좋았구요.
문과대 건물도 가봤는데 조금 오래된 건물이긴 했지만 역시 중심가에서 얼마 떨어지지 않았었구요, 그 주변엔 멋지게 그라피티된 건물들이 많아서 인상깊었네요. 유리로 되어있는 세련된 비즈니스 건물은 제가 살던 플랫에서 제일 가까운 건물이었구요, 조금 먼 곳은 amstel이라고 남쪽으로 조금 더 내려가 있는 건물도 있었어요.
도시가 워낙 작고, 자전거 교통이 워낙 발달되어 있다 보니까 사실 암스테르담 중심 쪽은 전부 ‘주변’이라고 생각되었던 것 같아요. dam 광장이나 센트럴 스테이션도 정말 가까웠고 쇼핑 스트리트 뿐만아니라 다양한 음식들과 여러 가지 잡화들을 싸게 살 수 있는 시장들도 많았구요, 램브란트플레인이랑 지금 이름이 생각이 안나는데 아무튼 바랑 클럽 많은 동네도 다 가까워요. 다만 자전거도 음주운전은 위험하니까 주의하시구요!ㅎㅎ","UvA는 사설회사랑 연계해서 교환학생들에게 거주시설을 제공하는데요, 저는 De Key라는 회사에서 배정해준 Weesperstraat라는 곳에서 지냈어요. 한 flat에 무려 17명이나 살았는데 화장실도 2개 샤워실도 2개라서 처음엔 정말 충격적이었죠. 방은 각자 쓰되 부엌과 욕실을 공유하는 형태였는데, 부엌에는 두더지만한 쥐가 나오고 세탁기랑 건조기는 자꾸 고장나고 2개밖에 없는 샤워실마저 하나는 자물쇠가 안 잠기고... 사실 시설 자체는 정말 열악했어요. 다만 그나마 중심가에서 가장 가까운 건물이라 위치는 가장 좋았구요, 플메들이 17명이나 되다보니까 저절로 친구가 16명이 생기는 효과?! 이게 제일 큰 메리트였던 것 같아요 ㅎㅎ. 플메들끼리 놀러도 자주 다니고 다같이 식사도 하고, 그랬던 게 가장 큰 추억이거든요. 아, 다른 플랫과는 달리 TV가 구비되어있고 식기며 오븐이며 식기세척기며 따로 구입할 필요가 없다는 것 역시 또다른 메리트! 다만 사람이 너무 많다보니까 뭘 해도 계속 마주치고 이야기하고 해야 한다는 게 약간은 스트레스가 될 수도 있어요. 다른 곳은 10명이 쓰는 flat도 가봤고 2명이 쓰는 곳과 아예 부엌 욕실까지 혼자 쓸 수 있는 곳도 가봤는데, 제가 살던 곳은 접근성이 좋은 만큼 시설은 내려가고 가격은 올라갔던 반면 멀면 멀수록 시설도 좋아지고 가격도 내려가더라구요. 숙소가 de key에서 그냥 배정해주는 거라 선택할 수는 없지만 가격 같은거 선호 조건 선택할 때 이런거 잘 고려하셔서 선택하셔야 할거 같아요.
식사는 거의 늘 직접 해먹었어요. 물가가 너~~~무 비싸서 사먹으려면 출혈이 엄청나요. 인건비가 비싸서 사람 손이 닿으면 가격이 막 뛰거든요. 그래도 식재료는 싼 편이라고들 하고 무엇보다 혼자서도 해먹을수 있도록 육류며 채소며 작게 포장이 다 잘 돼서 나와요! 원래 요리를 잘 안 해먹어서 몰랐는데 다시 한국 와보니까 알겠더라구요, 우리나라는 안그렇다는걸 ㅠㅠ. 아무튼 저도 요리 진짜 못하고 아무것도 몰랐는데 준비 같은거 안하고 가셔도 닥치면 다 하게 되있어요 ㅎㅎ. 고추장 같은거는 중심가에서 자전거타고 한시간정도? 가면 한인마트 있는데 거기에서 다 샀어요. 근데 비싸고 나중에는 물엿이며 고추장이며 다 잔뜩 남겨서 너무 아까웠어요. 한국분들끼리 같이 사서 용기 같은거에 나눠서 쓰시면 더 좋을 것 같아요. 저는 옆방에 살던 싱가폴 친구가 한국요리를 좋아해서 둘이 같이 샀는데도 잔뜩 남았네요ㅠㅠ. 아무튼 플랫 키친이 항상 북적거려서 같이 갔던 다른 한국 친구들처럼 호화롭게 이것저것 차려먹지는 못했지만, 저도 대충이나마 요리랍시고 이것저것 해먹고 그랬어요 ㅎㅎ. 플메들한테 이것저것 먹여보고 플메들이 만든거 나눠주기도 하고, 재밌었어요.","UvA는 학기 시스템이 좀 특이해요. 한 학기가 3개의 block으로 다시 나뉘어서 2~3월, 4~5월, 6월 이렇게 수업이 각각 있어요. 6 credit 짜리는 block 하나, 12 credit 짜리는 block 두 개에 걸쳐있구요 보통 교환학생들은 6월에는 수업이 없어요. 6 credit이 우리로 치면 3학점이고 12가 6학점인데 교환학생들은 40까지 들을 수 있는 걸로 알고 있구요, 보통 정규학생 애들도 한 block에 수업 3개 들으면 많이 듣는 거고 4개 들으면 미쳤다고 그래요 ㅎㅎ. 수업 시수 자체는 그렇게 많지 않은데 여기는 수업에서 뭘 가르쳐준다기보다는 각자 literature랑 paper 그 주에 할당된 거 다 읽어오고 수업에서는 자기 생각 토론, 모르는 거 질문 위주로만 진행되기 때문에 그런 개인 공부시간까지 다 계산한 학점이라고 해요. 저도 원래는 12짜리 3개 신청해서 우리나라로 치면 18학점을 채워들으려 했었는데, 일주일에 실제 시수는 10시간밖에 안되었는데도 리딩과 과제가 너무 많아 버거워서 결국 하나는 drop했답니다 ㅠㅠ. 수업 굉장히 빡세요 교환학생이라고 만만하게 보시고 가시면 피보실거에요 ㅎㅎ.. 이게 나라와 학교마다 다 다른 것 같은데, UvA는 좀 많이 빡빡했어요. 제가 Introduction to Conflict Studies랑 Dutch Identity를 들었는데, 뒤에 꺼는 그나마 다 international students만 듣는 수업이라서 조금 널널했었지만 conflict studies는 정규학생도 듣는 수업이어서 정말 정말로 굉장히 빡셌어요. 점수도 짜게 주시는 편이었구요 매주 리딩있고 조발표 있고 개인과제 매주 하는 거 있고 중간보고서는 또 다른 조보고서로 했고 기말은 개인보고서로 5000단어 냈어요 ㅠㅠ. 무엇보다 두 수업 다 출석이 2번 넘게 빠지면 바로 fail이라고 해서 다른 교환학생들처럼 학기중에 수업 막 빠지고 여행다니는 거는 꿈도 못꿨어요. 그렇지만 그만큼 수업이 수준있고 또 우리나라와는 달리 자유로운 토론이 이루어지는 분위기여서 학문에 뜻이 있으신 분들한테는 정말 최고일거 같다는 생각이 들었어요. conflict studies같은 경우에는 가자지구 인턴이라던지 그 분야 유명인의 특강이라던지 이런 수업외 활동들도 계속 공지해주고 연결해주고 그랬거든요. 저도 처음에는 토론수업에도 익숙하지가 않고 성격 자체도 낯가림을 많이 타는 성격이라 굉장히 위축되었었는데 교수님께서 그런만큼 더 신경 써주시고 부추겨주셔서 나중에는 나름 재밌게 수업 받았던 것 같아요. 다시 그런 기회가 있다면 더 잘할 거 같은데 조금 아쉽기도 하구요.
도서관은 제가 공부를 도서관에서 하는 타입이 아니어서 별로 드릴말씀이 없네요. 센트럴 역 근처에 있는 시립도서관은 한번 가봤었는데 카페테리아도 있고 도서관 자체도 넘 예쁘구 사실 공부는 많이 안했지만 시설은 참 좋았어요. 학교 도서관도 각 건물마다 잘 되어있다고 하니까 찾아보시면 많을 거에요. 아! 프린트는 컴퓨터실에서 칩카드로 해야되지만 복사는 student center 건물에서 공짜로 할 수 있으니까 기억하시길!!!ㅎㅎ",국제교육부에서 처음에 OT도 잘 해주고 웰컴미팅이나 정보알려주는 세미나? 같은 것도 자주 개최하고 그랬어요. 그런데 다 의무라고 무섭게 써놓긴 하는데 사실 출석체크 같은거 하는거도 아니고 안 가는 사람도 많아서 굳이 필요 없을 것 같으면 안가도 되더라구요. 다만 웰컴드링크 이런거 모이면 사람 만나기도 좋고 공짜 음료도 마실 수 있고 하니까 가셔서 나쁠 건 없어요. 처음에는 워낙 정보가 별로 없으니 진짜 필요한 정보를 얻을 수 있기도 하구요.,"ISN이라고 국제학생교류모임이 있는데요, 아마 여기루 교환 가시는 거의 모든 분들이 가입하실 거에요. 처음에 친구들도 만날 수 있고 학교에 적응하는 것도 도와주는 고마운 프로그램이죠. 대학 OT하듯이 그런 느낌이에요. ISN에서 만난 친구들과 계속 친하게 지낸다는 분들도 많으니 추가비용이 들더라도 가입하시는걸 권해드려요. 다만 저는 오히려 플메들과 더 친하게 지내긴 했네요.
그리고 Buddy 프로그램도 있는데요, 우리학교에서 하는 것 비슷하게 교환학생과 본교 정규학생을 매칭해주는 거에요. e-mail로 안내가 오니 안내대로 가입하실 수 있을 거구요, 정규학생 수가 적어 1:1은 아니었지만 아무래도 이것저것 사소한 것들을 물어볼 수 있는 진짜 Dutch 친구를 사귈 수 있어 좋았어요. 따로 가입비용이 있는 것도 아니니 이것 또한 가입하시면 좋을 것 같아요.","교환학생으로 간 처음 얼마간은 정말 컬쳐쇼크도 많이 받았는데요, 그 중 첫 번째는 아무래도 마약이 아닐까 싶어요. dutch 친구들 뿐 아니라 교환학생온 다른 친구들도 플랫 키친에서 아무렇지 않게 마리화나를 말아 피우는 모습이 정말 충격적이었답니다..... 하지만 그런 풍경엔 곧 익숙해지구요, 사실 저 같은 경우엔 끝까지 익숙해지지 못한 건 클럽 문화였어요. 한국에서도 클럽을 잘 안다니는 편인데 유럽은 사교활동?의 중심이 클럽이어서 처음엔 조금 힘들기도 했구요. 하지만 클럽 좋아하시는 분이라면 정말 재밌게 지내실 수 있을거라는 생각도 했어요. 워낙 다양하고, 다 새벽 동틀때까지 열고, 멀어봤자 자전거로 30분 이내니까 놀려면 정말 한도끝도없이 놀 수 있을 것 같더라구요.
다른 것들 중 하나는 자전거 문화였어요. 이건 정말정말 좋았어요. 자전거 도로도 정말 잘되어 있구요 어딜가든 자전거로 타고 다닐 수 있어서 건강도 좋아지는 것 같고 기분도 좋고 운하가 있는 풍경도 예쁘고 교통비도 안들고, 암스테르담에서 제일 좋았던게 바로 이 자전거였어요. 저는 자전거를 정말 못타서 걱정 많이 했는데 조금만 용기내고 노력하시면 금방 배우실수 있구요 무엇보다 정말 편해요. 금세 일상적으로 자전거를 찾고있는 자신을 발견하실 수 있답니다 ㅎㅎ","저는 개인적으로 도움을 필요로한 경험이 없어 잘 모르지만 병원을 가야할 땐 학교 주치의?같은 게 있어서 거기루 연락하면 된다고 들었어요. 그 외엔 student service center나 교환프로그램 담당자 분께 여러 가지 도움받을 수 있구요. 자전거를 고쳐야 한다면 damn, a flat tire라는 페이스북 페이지로 많이 들어가더라구요. isn online market이라는 페이스북 페이지에서는 자전거를 포함한 중고 물품 매매가 활발히 이루어지고 있구요, ‘낮은 땅 높은 꿈’ 페이지는 네덜란드 한인 커뮤니티이니 가입해놓으면 도움받을 일도 있으실 거에요.","암스테르담은 정말로 아름답고 평화롭고 작지만 다양한 모습을 갖춘 멋진 곳이에요. 공부면 공부, 놀이면 놀이, 여행이면 여행, 또 영어면 영어. 교환학생을 통해 얻고자 하는 게 무엇이던 암스테르담에서 다 찾으실 수 있을 거에요. 우중충한 날씨에 기분도 쉽게 우울해지는 분이시라면 조금 더 생각을 해보시라고 말해드리겠지만, 날씨 하나는 포기할 수 있으시다면 정말 강력히 추천합니다. 암스테르담에 가시게 되실 분들 모두 너무 부럽네요!!^^

제 메일주소는 sh91sz@naver.com이니 문의사항있으신 분은 언제든 연락 환영이에요^^"
