gen_info,env_info,food_info,study_info,office_info,facil_info,mhct_info,help_info,etc_info
"‘University of the Philippines‘(이하 줄여서 UP)는 필리핀 최고의 대학이다. 규모와 연구수준, 인지도, 사회진출도 등 모든 면에서 한국의 서울대와 그 지위가 같다. UP는 필리핀 전역에 4개의 캠퍼스를 가지고 있는데, 본부격이라고 할 수 있는 UP-Diliman(이하 UP)의 경우 연세대학교 신촌캠퍼스의 5배 이상의 규모를 가지고 있다. UP는 필리핀의 수도인 메트로마닐라(Metro Manila)의 퀘존시티(Quezon City) 동북쪽에 위치해 있다. UP 바로 근처에는 미리암 여자대학교(Miriam Woman University)와 필리핀 제 2의 대학인 아테네오 대학교(Ateneo University)가 있어 대학가를 이루고 있다. 
  필리핀은 열대성 해양기후이다. 필리핀은 ‘계절이 hot summer, hotter summer, hottest summer’ 라는 말이 있을 정도로 기본적으로 더운 나라이다. 3,4,5월이 여름이며 , UP는 summer vacation 이 있다. 이때 summer semester를 운영하는데 많은 교환학생들이 이때부터 실제적인 교환학생 생활을 시작한다. 참고로, UP는 6월-10월이 1학기, 11월-2월이 2학기이다. 6월부터 10월까지는 우기이며, 일주일에 1~2일 정도 맑은 날을 볼 수 있고 아시아의 태풍은 모두 필리핀 동쪽에서 발생하기 때문에 이 기간 동안 많은 태풍들이 지나간다. 태풍의 강도가 강할 경우, 수업이 취소되거나 아예 학기시작이 1주일 이상 미뤄지는 경우도 있다. 11월부터 2월까지는 건기이며, 낮에는 여전히 덥고 일교차가 심하다.","UP는 퀘존시티에서도 비교적 동북쪽 끝에 있다. 캠퍼스는 매우 크고 잔디와 울창한 숲이 많기 때문에 학생들뿐만 아니라 지역주민들도 조깅코스로 많이 이용한다. 한편, UP는 매우 크기 때문에 필리핀의 대표적인 교통수단인 지프니(Jiffney)가 운영되는데, 학교도로를 이용하려는 외부차량들과 지프니 등으로 소음과 매연이 적지 않다. 다만, 일반적인 필리핀 도심에 비해서는 매우 양호한 편이다. 캠퍼스에서 10분에서 30분 이상 지프니나 택시를 이용하면 큰 쇼핑몰이나 패스트푸드점 한국식당들을 이용할 수 있다. 또한 차로 15분에서 20분 거리에는 MRT와 LRT 라는 전철을 이용할 수 있어, 마닐라 도심쪽으로 방문이 가능하다. 그밖에 캠퍼스에서 10분 거리에 마닐라 도심으로 가는 많은 교통수단들(FX, 버스, 지프니 등)이 있다.","UP에서 제공하는 기숙사는 교환학생의 경우, International Center 와 Camagong Resident Hall이 있다. Camagong Resident Hall은 새 건물이고 깨끗하다는 장점이 있지만, 수업을 듣는 곳에서 비교적 멀리 떨어져 있고, 취사가 금지되어 있는 단점이 있으며 비용은 월 우리돈으로 약 7~8만원 정도이다.  International Center(이하 IC)는 200여명의 교환학생과 정규학생들이 생활한다. 1960년대에 세워져 건물이 낡았고 근래에 UP에 대한 정부의 지원이 대폭 줄어들면서 시설 개보수가 더디다. 남성의 경우 2인 1실로 화장실과 샤워실, 냉장고 등을 2 방이 함께 사용하는 구조이다. 여성의 경우 3인 1실이고 공동실을 1방이 모두 쓴다. 비용은 월 우리돈으로 약 12,000원 정도이다. IC는 설립 목적이 국제학생들의 교류이기 때문에 매월 교류행사가 이루어지고 다양한 나라의 학생들과 교류할 수 있다는 장점이 있고 학교중심부근에 있어 수업을 듣는 곳과 부대시설에 접근성이 좋다. IC의 나라별 학생 현황을 보면 한국인이 30여명, 일본인이 20여명, 그밖에 각각 1~3명씩의 중국, 인도, 네팔, 파키스탄, 부탄, 베트남, 인도네시아, 오스트리아 학생들이 있다. 룸메이트는 기숙사 메니저가 정해주며, 보통 한국학생들은 한국학생들끼리 방을 같이 쓰지만, 본인이 원할 경우 메니저와 상의하여 바꿀 수 있다. 
식사의 경우, 기숙사 내에 음식을 조리할 수 있는 공동 부엌이 있어 취사가 가능하다. 이 경우 재료는 캠퍼스 안의 마트나 외부에서 쉽고 싸게 구입할 수 있다. 본인이 직접 취사할 경우 평균 식비는 우리돈으로 월 평균 약 20만원 정도면 충분하다. 
또한 캠퍼스 안에는 많은 식당들이 있다. Shopping Center(이하 SC)와 각 단과대마다 크고 작은 식당들에서 필리핀 현지 음식을 판다. 한끼에 우리돈 1,500~2,500원이다. 한편, SC 안에는 ‘맛있다’라는 한국, 일본 분식점이 있어 김치볶음밥, 김밥, 롤, 라면 등을 먹을 수 있다. 가격은 2,500~3,500원 정도이다.
그 밖에 외부에서 패스트 푸드를 배달시켜서 먹을 수도 있고, 근처에 한국식당등을 이용할 수도 있다. 한국식당의 음식 가격은 평균 7~8천원 정도이다.","수강신청 절차는 다소 까다롭다. 우리대학처럼 전산화가 안되어 있기 때문에 직접 수강신청서를 작성하고 여러 사무실을 방문하는 절차를 거쳐야 한다. 하지만 이 모든 과정을 대외 협력부와 ‘아리랑’이라는 한국 동아리 학생들이 처음부터 끝까지 친절하게 도와주기 때문에 큰 어려움은 없다. 대외협력처는 교환학생들에게 보통 3과목 수강을 추천하고 4과목까지 허용한다. 그 이상은 별도의 비용을 요구한다. UP는 1학기가 19주로 이루어져 우리 대학보다 조금 길다. 1학점이 주당 1시간으로 한과목이 3학점이다. 수업은 주로 일주일에 두 번 1시간 30분씩 진행한다. 모든 수업은 영어로 이루어진다. 나는 전공으로 교육학 과목과 영어학 과목을 들었는데, 영어학의 경우 쉬는시간에도 학생들은 영어로 대화한다. 하지만 전공별로 학생들의 영어사용도는 다소 차이가 있다. 그럼에도 불구하고 영어가 공용어인 필리핀에서 최고의 대학이기 때문에 영어를 사용하는데에는 전혀 문제가 없다. 다만, 필리핀은 아시아에서 교수가 아닌 대학원 생들이 학부강의를 하는 몇 안되는 나라중에 하나인데, 보통 나이가 많은 교수들보다 앞서 말한 젊은 강사들의 영어발음에 적응하는데에는 시간이 걸린다.
법대, 의대 그리고 몇가지의 수업만 빼고는 모든 수업의 기회가 교환학생들에게 주어진다. 교수들과 학생들이 매우 친절하기 때문에 교환학생들에게 매우 호의적이며 친절하게 잘 도와준다.
도서관의 경우, 각 단과대별로 도서관이 있으며 학교 아이디 등록 절차후 인터넷 사용이 가능하다. 또한 중앙 도서관이 있다. 도서관은 평일 7시에 문을 닫으며 공휴일에도 문을 닫는다. 단과대 도서관들은 에어컨이 있지만 중앙도서관은 에어컨이 없다. 또한 절전 캠페인 때문에 도서관에서 노트북 사용을 위해 전기를 쓰려면 시간당 500원을 내야 한다.",교환학생들을 실질적으로 관리하는 직원은 1명이고 그 일을 돕는 보조 대학원생이 있다. 한학기당 교환학생이 약 50명정도 되는데 도움을 받는데 어려움은 없다. 영어로 의사소통에 문제만 없다면 언제나 친절하고 잘 도와준다.,"앞서 말한대로 학교 안에는 각 단과대마다 식당들이 있다. 또한 shoping center가 있어서 pc방, 안경점, 중형 마트, 식당, 문방구, 기념품점, 약국 등을 이용할 수 있다. 또한 UP health service를 통해 무료로 진료받을 수 있다. 실제로 현지 생활을 하다보면 몸이 아플 수 있는데 각 과별로 진료를 하기 때문에 도움을 받을 수 있다. 
필리핀에도 한류는 큰 영향을 미치고 있는데, 한국 동아리인 ‘아리랑’은 비교적 큰 활동을 하고 있다. 이들은 수강신청부터 과제까지 한국학생들을 도와주고 한국문제에 관한 포럼도 개최하며 비교적 많은 활동을 한다. 일부 학생들은 한국으로 교환학생을 다녀온 경험도 있기 때문에 한국말을 잘한다. 이들에게 도움을 받으면 학교생활을 하는데에 큰 도움이 된다. 
그밖에 많은 동아리들이 있는데 교환학생들이 참여하는 경우는 잘 보지 못했다. 내가 알고 있는 동아리는 매주 주말마다 외부로 봉사활동을 다니는 봉사동아리와 한국학생들로 이루어져 매주 금요일 기도모임을 하는 CCC 모임이 있다.","필리핀의 학제는 한국과 다르다. 초등학교 6년 후 중고등학교 통합 4년의 과정을 거친다. 따라서 같은 수업의 동급생들은 대부분 17, 18살이거나 많게는 20살이 넘지 않는다. 그래서 모든 수업이 그렇지는 않지만 자칫 교실의 분위기도 처음에는 고등학교 교실에 온 기분을 느낄수도 있다. 
한편, 필리핀에서 한국인들은 돈이 많은 것으로 인식되어 있기 때문에 택시를 이용할 때나 물건을 구입할 때, 그리고 심지어 경찰과 어떤 일을 처리할 때 돈을 더 요구받거나 부당한 대우를 당할 수 있다.
또한 필리핀은 돈만 있으면 값싸게 유흥을 즐길 수 있기 때문에 주의해야 한다. 실제로 교환학생들 중에 도박과 값싼 술값, 그리고 매춘 때문에 교환학생 기간을 망치는 경우도 종종 있다.","첫째, 기본적으로 메트로 마닐라의 마카티에 한국대사관이 있다. 여권 업무나 기타 도움을 받을 수 있다. 다음으로는 필리핀 한인회가 있다. 둘째, 교민사회가 비교적 크게 발달하였기 때문에 한국인으로서 권익보호나 어려운일이 있을 경우 교민회에 연락하여 도움과 정보를 얻을 수 있다. 셋째, 교내에는 대외 협력처가 있다. 이곳에서 교환학생으로써 필요한 절차들을 모두 처리해 준다. 넷째, 동아리 ‘아리랑’ 이 있다. 이곳에서 실제적인 학교생활을 정보를 구할 수 있고 친구들도 사귈 수 있다. 다섯째, 현지 한인 교회를 추천한다. 한국인으로서 필요한 정보를 구할 수 있고, 비교적 중산층인 한인들의 보호와 충고를 받을 수 있으며, 심리적으로도 안정감을 가질 수 있다. 한국 음식을 먹을 수 있는 것 또한 해외생활에서 큰 메리트 이다.","기숙사 근처에서 많은 교환학생들이 영어 훈련을 위해 개인 튜터들을 이용한다. 튜터들은 경험이 많기 때문에 비교적 수준은 훌륭하다. 보통 시간당 5,000원 정도를 받는다. 튜터가 싫으면 어학원을 이용할 수도 있다. 특히 학기가 6월에 시작하기 때문에 3월부터 시간이 되는 학생이 영어 증진이 교환학생의 목적이라면 질 좋은 어학원을 이용하는 것도 나쁘지 않다. 필리핀은 다른 서양 나라들에 비해 쾌적하지 않은 것이 분명하다. 하지만 필리핀은 그 나름대로의 맛을 경험할만한 충분한 가치와 유산이 있는 나라이고 UP는 그 나라를 대표하는 대학교이다."
