gen_info,env_info,food_info,study_info,office_info,facil_info,mhct_info,help_info,etc_info
"대학의 크기가 큰 것은 아니지만 시카고 남부에 위치해 다운타운까지 지하철이나 버스로 쉽게 이동할 수 있다는 장점이 있습니다. 학기가 시작할때 4개월분의 학생용 지하철 패스를 발급하는데 이를 이용하면 4개월간 무제한으로 버스와 지하철을 이용할 수 있어 매우 편리합니다. 7~10월정도까지는 한국의 여름과 기후가 비슷한데 대신에 매우 건조해서 오히려 땀도 잘 안나고 그늘에 있으면 서늘해요. 그 다음부터 점점 추워지는데 12월정도까진 한국과 비슷하고, 제일 추운 1, 2월에는 심할경우 -30도정도까지 내려간다고 합니다. 작년에는 눈이 4~5월까지 왔다고 해요. 발목까지 오는 패딩과 털모자는 필수.","캠퍼스에서 걸어서 30분정도 밑으로 내려가면 5대호중 하나인 미시간호가 있습니다. 호수 하나가 거의 대한민국 크기와 맞먹는다고 하네요. 또 학교에서 도보 15분정도의 위치에  화이트삭스의 홈 구장이 있습니다. 학교 주변은 흑인들의 마을이므로 함부로 혼자 돌아다니지 않는것이 좋아요. 지하철과 다운타운은 늦은 시각만 아니면 생각보다 위험하진 않습니다. 생필품은 학교에서 지하철타고 한정거장 가면 있는 루즈벨트역 타겟에서 대부분 구입할 수 있어요. 위쪽으로 올라가면 커다란 링컨파크와 필드 뮤지엄이라는 자연사박물관이 있구요, 다운타운에 볼거리는 말 할 것도 없이 많습니다.  
시어스타워(윌리스타워), 존 행콕 센터, 시카고 아트 뮤지엄, 치즈케&#51084; 팩토리, 밀레니엄파크 정도는 말 안해도 아시겠지만 한번 더 추천때립니다.","기숙사는 구기숙사(MSV)와 신기숙사(SSV)가 대표적이구요 보통 2인 1실에 구기숙사는 무악학사와 비슷한 형태고 신기숙사는 좀 더 넓고 깨끗합니다. 구기숙사는 샤워실과 화장실을 공용으로 사용하고 신기숙사는 두 방이 욕실 하나를 사용하는 모양인데, 한국인 말고 매일 샤워를 하는 사람들이 별로 없어서.. 공용도 그리 불편하진 않아요. 남녀가 구분없이 한 층을 공용하니 좀 불편하긴 한데 익숙해지면 괜찮습니다. SSV가 조금 더 개인주의적인 것 같더군요. 기숙사보단 아파트같은 느낌으로.. 식사는 학교 식당인 COMMONS에서 대부분 한끼이상 해결하게 되는데요, Meal plan을 선택해서 4개월동안 사용하는것이 보통입니다. 제일 적은 creat your own, 그리고 일주일에 14식, 그 이상..이정도인데 제일 작은거 선택해도 남아요. 하루 두끼 먹는 날 별로 없구요, 시카고 왔으니 놀러다니고 할텐데 밖에서도 많이 먹을거구요, 여행도 다닐테니 제일 작은거 하셔도 돼요.","건축학이 유명한 학교인데 저는 비즈니스와 건축수업을 둘 다 들었습니다. 건축은 워낙 기초적인걸 들어서(기초드로잉이나 기초 CAD같은거) 별로 수업의 질이 좋은지는 모르겠고 비즈니스 수업에서 한국과 다른 점은 일단 애들이 공부를 잘 못..해서 아무래도 한국보단 학점따기가 쉽구요..참여를 매우 유도합니다. 수업마다 다르겠지만 발표하는거 중요시하고. 근데 어렵게 가르치진 않아요.
Freehand drawing : 그림그리기 수업. 과제가 좀 많구요..
Cad in practice : 캐드, 라이노, 래빗을 배울 수 있는 수업인데 사실상 캐드만 하다 끝났구요, 초보자보단 경험자 대상으로 하는거라 처음 배우는 저는 어려움이 많았어요.
Management Science : 고등학교 수학정도의 개념이 나오는 경영과학 수업. 학점따기 쉬워요
Organizational behavior : 교수님이 엄청나게 참여를 유도하지만 참여하지 않아도 B정도는 나옵니다
Non-native writing : 쉬어가는 글쓰기 과목.
도서관은 학교 내에 garvin library 가 있는데 무지하게 작아요. 근데 자리는 항상 남습니다..
도서관 바닥에서 배깔고 누워서 컴퓨터하고 공부하던 외국인들 모습이 기억에 남네요.","메인빌딩 4층에 있는데 처음 도착해서 학생신고할때, 캐나다 가려고 허가받을때 두번 갔네요","주말마다 한인교회(쉼터교회?)에서 버스로 데리러 오더라구요. 학교 내에 루스채플처럼 작은 교회도 있고.
교회다니시는 분들은 참고하세요~ 동아리도 여러개 있는 듯 한데 제가 참여를 안해서 잘 모르겠네요.
그리고 학교 변두리에 GYM이 있는데 헬스장, 농구장, 라켓볼장, 테니스코트, 수영장 등등이 있어요
저는 가끔 운동하러 갔는데 좋더라구요!","쌍꺼풀 없는 동양적인 외모가 외국인한테 먹힌다고 하던데 하나도 안 먹혀요.
그리고 제 룸메이트(중국인)이랑 제 아는오빠 룸메이트(흑인)이랑 사겼는데 기숙사에서 애정행각을 좀 심하게 해서 좀 충격이더라구요. 전 괜찮았는데 아는 오빠는 방에도 못 들어가고 스트레스 받더라구요 참 안 좋은 예이긴 한데..",모르는부분은 교수님께 메일 보내거나 상담받으세요. 친절하게 가르쳐주신다고 합니다.,
"Illinois Institute of Technology(이하 IIT)는 미국 시카고에 있는 건축학으로 유명한 학교입니다. 이 학교는 학교 규모는 매우 작지만, 현대 건축의 거장이라는 미스 반 데어 로에가 학장으로 있어서 유명해 진 학교입니다. 시카고의 지리적 위치는 미국의 북부중부, 미시간 호수의 서쪽에 위치하고 있습니다. 그래서 겨울이 많이 춥고, 바람도 많이 붑니다. 어떤 사람들은 농담으로 시카고에는 사계절이 있는데, 그게 6월, 7월, 8월, 그리고 겨울이라고 합니다. 하지만 한국에서보다 조금만 따듯하게 입는다면 생활하는 쪽으로는 불편함이 없습니다.","학교주변은 흑인들이 주로 사는 시카고의 남쪽 지역입니다. 학교 내에 지하철이 있고, 주변에 다른 노선이 있어 다운타운으로 나가는 데에는 큰 어려움이 없습니다. 지하철을 타면 15분 정도면 다운타운으로 나갈 수 있습니다. 불편한 점은 뭘 하나 사려해도 다운타운을 나가야 한다는 점 입니다. 우리나라와는 달리 대학주변이라고 술집이나 음식점이 있지 않습니다. 슬럼가에 툭 학교가 들어앉았다고 생각하면 됩니다. 초기 시카고 건축가들이 IIT와 레이크 메도우라는 대형 아파트 단지를 조성 해 이 주변을 변화시키려 했으나, 정부의 어중간한 간섭으로 덜 성공한 면이 있습니다. 시카고는 초고층빌딩들이 즐비하고, 많은 문화적 컨텐츠가 있지만, 20세기 초에 큰 대형 화제로 인해 다운타운에 있는 모든 건물들은 새로 지어진 건물들이라 보셔도 됩니다. 그래서 2블록 안에 대형마트가 있고, 박물관들이 한군데에 모여 있는 등, 관광하기에는 최고의 도시라고 보아도 됩니다. 모든 관광지를 걸어 다닐 수 있습니다.","기숙사는 크게 4가지의 형태로 나뉩니다. 가장 저렴하고 친구들을 많이 만날 수 있는 기숙사로는 MSV가 있고, 이 기숙사는 아주 좁은 방을 2명이 쉐어하고, 한 층에서 화장실을 공동 사용합니다. 키친은 없으나 전자렌지가 있는 조그만 데이룸이 매 층마다 있습니다. SSV는 이와는 반대로 헬무트 얀이라는 현대 스타 건축가가 지은 도서관입니다. 방이 넓고 2명이 방을 쉐어하며, 4명 당 화장실을 쉐어합니다. 또한 층마다 주방이 있어서 식사를 할 수 있습니다. 대부분의 교환학생이 두 곳에서 생활을 하는데, 한국사람이 워낙 많아, MSV는 한국 기숙사로 가끔 느껴지기도 합니다. SSV는 가격이 두 배이고, 한국사람들이 별로 없는 반면, 외국인친구도 사귀기 힘들 수 있습니다. MSV가 한 층에서 여러 프로그램이 있지만, SSV는 그런 프로그램들이 별로 없는, 사생활이 보장되는 기숙사 입니다. 하지만 일찍 알아보신다면 MSV에서는 Fowler Hall은 크기는 SSV 크기이지만 가격이 MSV와 같고, 곤잘레스라는 또 다른 기숙사가 존재하는데, 거기 들어가면 식당도 방마다 있고, 저렴한 방도 구할 수 있습니다. 곤잘레스를 제외한 MSV와 SSV는 밀플랜을 선택 해야만 합니다. 보통 14식과 Create Your Own을 선택하는데, 반드시 Create Your Own을 선택하시기 바랍니다. 저는 아침도 꼭 먹는 편이었는데도 일주일에 14식을 먹기 힘들었습니다. 또한 14식은 봄 방학 등의 학교 쉬는 날에도 돈을 내는 걸로 되어있습니다. 친구들 집에 초대 받아서 밥을 먹지 못하는 경우도 많았고, 수업이나 과제 등으로 밥을 거르는 경우도 많았습니다. 반면 Create Your Own은 1학기에 175식을 먹으면 됩니다. 일주일에 10식을 먹으면 되는데, 보통 교환학생들이 아침을 거르고 주말에는 여행이나 친구 집으로 가므로 충분합니다.","도서관은 크기가 매우 작고, 주말에는 일찍 닫고, 평일에도 12시면 문을 닫습니다. 그 외에 건축학과 건물 안에 또 다른 도서관이 있는데, 크기는 작지만 수많은 건축 책들이 진열되어 있습니다. IIT는 건축 책들을 제외하고는 많은 책들을 보유하고 있지는 않지만, 다른 대학 도서관들과 연계가 되어 있어서, 신청을 하고 연장만 제 때 한다면 한 학기 내내 다른 학교 책들을 빌리고 있을 수 있습니다.


저는 아래와 같은 수업들을 들었습니다. 
20th Century Skyscrapers, Illumination and Acoustics, Architectural Studio, Human/Computer Interaction, Probability and Statistics

20th Century Skyscrapers 는 수업전체가 토론으로 진행되고, 중간 기말고사 없는 대신, 발표와 5장 에세이 2개, 그리고 12장 에세이를 써야 합니다. 시카고가 초고층으로 유명한 수업인지라, 많은 도움이 되었습니다. 하지만, 교수님이 Sennott교수님 수업이었는데 이 교수님은 A를 잘 안주기로 유명하신 교수님입니다.

Illumination and Acoustics 는 건축공학과 학과장인 Muehleisen교수님의 수업인데, 디자인 쪽은 아니지만 전반적인 음향학에 대해서 배울 수 있는 수업입니다. 학점은 과제와 시험으로 나누어 지는데, 과제의 비중이 높고, 2주에 한 번 정도 과제가 있습니다. 중간고사와 기말고사 그리고 과제를 통해 성적을 매깁니다. 과제를 꼬박 다 하고 시험공부를 적당히 한다면 한국사람들은 성적을 받기 쉬운 과목입니다.

Architectural Studio는 건축공학과에 있는 스튜디오 수업인데, 주로 레빗과 Civil 3D로 수업을 진행합니다. 

Human/Computer Interaction 수업은 일반 선택으로 들은 수업인데, 수업진행은 보통 실습을 많이 하고, 중간 기말고사가 없고, 과제도 쉽고 제출을 하기만 하면 A를 받을 수 있는 과목입니다. 하지만 수업에는 한국 사람들과 인도사람들이 많고, 미국 학생들은 거의 없습니다.

Probability and Statistics 수업은 우리나라가 수학은 워낙 잘하는지라 설명을 덧붙이지 않겠습니다.","학기 연장을 하거나, 영어 토론 이벤트를 주최합니다. Main Building 5층에 위치합니다.","저는 3개의 동아리 활동을 했는데, 배드민턴 부는 IIT안의 작은 중국인 동호회 이었고, Coffee House는 매 주 시카고 여행을 하고, 같이 차를 마시는 동호회였습니다. 볼링동아리 활동을 가장 많이 했는데, 일주일에 한 번 볼링을 치고, 한 팀에 4명이고, 총 15팀이 있었던 것으로 기억합니다. 팀들간에는 교류가 적지만 같은 팀과는 많은 대화를 할 수 있었습니다. 미리 아는 친구가 없다면 회장이 임의로 팀을 만들어줍니다. 모든 비용은 공짜입니다. &#61514;","우리나라와 똑같지만, 좀 더럽다는 것에 충격을 받으실 겁니다. 또한 팁 문화에 빨리 적응하시기 바랍니다. 특히 시카고는 미국에서도 택스가 가장 비싸기로 유명합니다.","Wisnick hall 2층에 가면 writing center가 있아서, 에세이나 레포트 같은 것들을 첨삭받을 수 있습니다. 에세이를 쓰지 않고 가도, 스트럭쳐나 쓰는 방법도 알려주니 꼭 가보시기 바랍니다.","시카고는 사람의 손이 많이 들어간 도시입니다. 그만큼 인위적인 느낌도 많이 받겠지만 한편으로는 살기 편하고 같은 양식의 건물들이 많은 아름다운 도시입니다. 또한 시카고는 스포츠면 스포츠, 미술이면 미술, 음악이면 음악 모두 다 알아주는 도시입니다. CAF라는 협회에서는 매주 수요일 공짜 강의가 있으며, Art Institute of Chicago에서도 매주 목요일 저녁 공짜 입장과 강의가 있습니다. 다른 박물관들도 구글에서 검색 해 보면 공짜인 날이 많이 있으니, 학교에서보다 학교 밖에서 더 많이 얻을 수 있는 도시라고 생각됩니다."
"다운타운 근처에 있어서 다운타운에 가서 놀기에 좋습니다. 기후는 겨울에는 춥지만 겨울만 아니면 생활하는데 날씨는 좋습니다. 일교차가 커서 감기만 조심하면 됩니다. 
학교 근처에 흑인들이 많이 살지만은 생각보다 위험하지 않습니다. 35번가 인근에 스타벅스 맥도날스 핸드폰가게 신발가계 은행등이 있어서 급할 때 이용하면 좋습니다. 하지만 밤에 돌아다니는 것은 추천하지 않습니다. 또한 Jewel이라는 식료품가게도 한 10분에서 15분 정도 걸어가면 있습니다.(지하철을 타고 한 정거장만 가도 Jewel이 있습니다.)",위에서 언급했듯이 대부분 필요한 물건은 루스벨트역에서 jewel(식료품) taget(우리나라 이마트)에서 구입해서 사용합니다. 화이트 삭스구장이 근처에 있어서 가끔 놀러가면 재미있습니다. 또한 자전거를 빌려서 미시간 호수를 하이킹하는 것도 추천합니다. 네이비피어까지 놀러 갈 수 있습니다. 루스벨트역 인근에서 조금만 걸어가면 필드뮤지움등 여러가지(?) 볼거리도 있습니다.,대부분 SSV나 MSV를 사용하게 되는데 SSV의 경우에는 주방이 있어서 음식을 해먹을수 있고 MSV를 그러한 곳이 없습니다. SSV가 더 좋고 비싸기는 한데 바로 옆으로 지하철이 지나다녀서 조금 시끄럽습니다. 또 SSV는 조금 개인적인 공간이어서 기숙사에서 사람들 끼리의 공유는 많이 없습니다. MSV는 2명에서 한방을 사용하거나 개인적으로 비용을 더내면 혼자서 사용할 수도 있는데 대부분의 학생들이 이곳을 사용합니다. 기숙사지하에 공부를 할수 있는 공간이 있고 로비등에서도 학생들이 공부를 하거나 많이 모임을 같습니다.,"수업은 생각보다 따라가는게 어렵지는 않습니다. 두려워 말고 듣고 싶은거 들으세요
Accounting
회계학의 기초적인 내용을 배우는데 어렵지 않고 재미있습니다.
Control system
기계공학 전공과목인데 조금 어려울수 있으나 기초수학과목을 들으셨다면 문제가 안됩니다.
Probability and Statistics
확률통계인데 미국학생들은 대부분 수학을 못해서 공부하기가 수월합니다. 하지만 문제해석을 잘못하거나 용어를 모르면 시험에서 고생할수 있습니다.
Non-native writing
간단히 말해서 쉬어가는 과목입니다. 글쓰기 수업인데 부담없이 들으면 되는 수업입니다.

4과목을 들었는데 10명에서 40명 사이의 조그만한 강의가 대부분입니다. 

도서관은 크지는 않지만 공부하는 자리는 넉넉합니다. 한국과 다르게 기숙사나 집에서 공부하는 것 같더군요 도서관에 특이하게 큰 쿠션이 있어서 사용 할 수 있습니다. 깔고 누워서 공부하거나 자거나 다양한 모습을 볼 수 있습니다.",메인빌딩 꼭대기에 있습니다. 처음에 도착하자마자 신고를 할 때 가보고 가본적 없습니다.,"교회를 다니시는 분이면 주일 12시에 MSV앞에 한인교회(쉄터교회, www.cyworld.com/) 버스가 출발합니다. 또한 미리 말씀하시면 처음 오실 때 공항에서 학교까지 목사님께서 라이드를 해주시는 경우도 있습니다. 
매주 수요일 금요일 학교 안에서 모임도 있습니다. 

또 포크댄스 동아리 요가 동아리등 많음 동아리가 있는 것으로 알고 있습니다.",생각보다 아시안이 학교에 많습니다. 그것을 제외하고 그렇게 문화적인 충격은 없습니다.,"롸이팅 센터에서 에세이들은 첨삭받을 수 있습니다.
또 그냥 지나가는 학생들에게 물어보면 친절히 가르쳐 줍니다. 
교수님들도 시크하지 않고 친절히 가르쳐 주십니다.",GYM에가시면 헬스장이 있고 또한 학생들과 농구를 할 수 있습니다. 기숙사 바로 옆에 테니장이 있어서 테니스도 칠 수 있습니다. Meal plan을 신청하게 되는데 14식 보다 create own을 추천합니다. 14식은 거의 다 못 먹습니다.
시카고 시내에서 15분정도 거리이고 학기초에 학생용 지하철 패스를 발급받습니다 시카고 남부에 있지만 남쪽끝이 100번가 정도임을 감안하면  30번가 정도이므로 아주 끝은 아닙니다 날씨는 10월중순정도부터 11월초정도까지 인디언썸머라고 해서 여름처럼 더울 기간이 한동안 지속되지만 곧 다시추워지고 눈도 많이 내리는 편입니다,"캔퍼스 주변은 서쪽으로는 큰도로가 있지만 다리 밑이므로 별 상관은 없는 곳이고 시카고 화이트삭스의 홈구장인 us셀룰러필드(구 코미스키 파크 )가 있습니다 또 이곳은 라티노들이 많이 사는곳입니다 반대로 학교주변은 흑인들이 많이 사는 동네로 가끔은 낮에도 강도사건이 일어난다고 합니다만 학교주변에 경찰서가 있어서 그렇게 많은 일이 벌어지지는 않는다고 합니다 
 시카고 다운타운은 미국3대도시답게 크기도 크고 다양한 공간들이 있습니다
날씨가 좋을땐 오바마대통령이 연설을 했던 그랜트파크도 가보길 바라고 시카고 아트 인스티튜트나 다른 미술관들도 가보길 바랍니다. 
존행콕타워에 올라가서 친구들과 한잔하는것도 재미있었던걸고 기억합니다
또한 게이 스트릿이 있는데 그곳도 재미있고(게이들이 와서 말걸거나 위협하지는 않으니 안심하여도됨) 스웨덴이민자들이 많이 살던 동네도 있습니다.
또한 링컨스트릿쪽으로는 클럽들이 많이 있으니 친구들과 파티하러 가는것도 좋을것같습니다","룸메이트와 2인1실을 사용하는데 원한다면 학생용아파트에서 거주할수도 있습니다. 기숙사는 남녀 같은 건물을 쓰기는 하지만 층구분은 있고 구형기숙사는 공동샤워, 신형기숙사는 두방이 한 욕실을 쓰는 식입니다","수업은 학국과 비슷한식이고 전체적으로 큰과제보다는 작은 과제를 여러개 하는 식이었고 시험도 잘게 나눈어서 세네번에 걸쳐보았습니다
 도서관은 작은 편이지만 작은만큼 이용하는 사람도 적어서 조용하게 공부할수 있습니다 또한 잡지들이 많이 준비되어있어서 편하게 가져다 읽을수도 있습니다",국제처 사무실은 가보지 않아서 모르겠지만 메인빌딩에 있고 비자나 여행에 관련된 문의를 하면 잘도와줍니다,동아리가 있기는 하지만 그다지 많은 사람들이 참여하고 있지는 않는거같고 각자 작은규모의 사모임들에 소속되서 활동한다고 보면맞을것같습니다,,,"야구를 좋아하시는분은 가볼만한 곳이라고 생각합니다
컵스경기는 2-3일전에 미리 경기장에가서 표를 사면 70달러정도에 가장좋은 자리를 구입할수 있고(암표로 같은자리 사려면 경기당일 200달러 넘습니다)
개인적으로 3루 쪽(컵스덕아웃)을 사게되면 불펜에서 선수들 몸푸는것도 볼수 있고 가끔씩은 포즈도 취해줍니다 
화이트 삭스 (도 마찬가지로 3루쪽이 화이트삭스덕아웃)경기장은 좀더 큰편이라서 좀 쉽세 구할수 있을지는 모르겠지만 여전히 좋은 자리는 구하기 힘듭니다 
다만 야구장의 단점은 음료수를 못가지고 들어간다는것(가방을 다 검사합니다) 그리고 핫도그나 맥주가격이 상당히 비싸다는것 하지만 한번쯤을 가볼만한곳입니다 참고고 컵스의 리글리필드는 메이져리그에서 가장오래된 경지장입니다 그리고 대부분 낮경기가 열리니 참고하시길)"
