gen_info,env_info,food_info,study_info,office_info,facil_info,mhct_info,help_info,etc_info
"IIT는 미국 일리노이주 시카고시의 중심 시내에서 남쪽으로 4~5 km 떨어져있습니다. 학교의 체감 크기는 연세대학교 남서쪽부분(공과대, 이과대, 대운동장) 정도로, 크지 않고 기숙사부터 도보 5분이면 수업 듣는 거의 모든 강의실에 갈 수 있습니다. 봄학기는 1월초부터 5월초까지인데 저는 개인사정으로 8월초까지 머물렀습니다. 3월까지는 한국의 겨울과 기온은 비슷하지만 바람이 많이 불어 더 춥게 느껴지고 4월까지도 꽤 춥습니다. 1,2월 중 바람이 많이 부는 날에는 손이 시려워서 사진 찍기도 힘들었던 기억이 납니다. 5월중순부터 8월까지는 가끔 무지 더운 날이 있지만 대체적으로 날씨가 아주 좋고 걸어다기니 좋습니다. 가을학기는 있어보지 못햇지만 들은 얘기로는 10월초까지는 시원한 편이고 10월중순이 지나면 한국의 같은 때보다 약간 더 춥고 바람이 많이 분다고 합니다. 봄,가을학기 어느 학기를 가더라도 겨울옷은 필수이고 5~8월(여름방학)때 시카고에 머무는 것이 아니라면 여름옷은 구지 필요 없을 것 같습니다. 시카고시의 바로 동쪽에는 미시건호라는 호수가 있는데, 대한민국 절반 정도의 면적을 가진 큰 호수입니다. 해수욕장도 몇 군데 있고 경치도 좋아 자주 갔었습니다.
구글맵 IIT 위치 링크해놓겠습니다. 학교 위치나 크기, 주변 지리 등 참고하세요.


http://maps.google.com/maps?q=Illinois+Institute+of+Technology,+South+Federal+Street,+Chicago,+IL,+United+States&hl=ko&ll=39.095963,-83.232422&spn=55.977817,114.169922&sll=41.834973,-87.621717&sspn=0.026699,0.055747&vpsrc=6&hq=Illinois+Institute+of+Technology,+South+Federal+Street,+Chicago,+IL,+United+States&t=m&z=4&iwloc=A","학교의 북쪽에는 차이나타운이 있어 중국 음식 등을 먹거나 마트에서 한국 라면을 사기도 했습니다. IIT를 기준으로 그 남쪽으로는 흑인 거주지인데, 저녁에 혼자 다니면 강도를 당할 확률이 높아 위험합니다. 시카고 전철 IIT역이 학교와 붙어있어서 2정거장이면 북쪽에 있는 시카고 시내로 갈 수 있습니다. 한국 지하철에 비해 정거장 사이의 거리와 소요시간이 편차가 큰 편인데, 학교에서 다운타운까지는 2정거장, 약 15~20분 정도 걸립니다. 많은 박물관, 미술관, 전망대, 동물원, 아쿠아리움 등 세계적인 수준의 관광거리가 이 다운타운에 몰려있어 시간을 내서 가보시길 권합니다. 학교에서 북쪽으로 전철 1정거장이면 대형 할인마트, 식료품점 등이 있어 장보러 자주 가시게 될 겁니다. 다운타운에서 북쪽으로 한인마트도 있는데 전철을 한번 갈아타고 40분 이상 가야해서 자주 가지는 않았습니다. 메이저리그 시카고 야구팀 화이트삭스의 홈 경기장인 셀룰러필드도 학교에서 걸어서 15분이면 갈 수 있습니다. 가끔 학교를 통해 표를 구하면 10불 정도에 경기를 볼 수 있는 기회가 있습니다.","저는 MSV라는 기숙사에 살았습니다. MSV는 2인1실이고 한 방에는 침대 두개와 책상 두개, 수납장 등이 있습니다. 한 층에는 10~20개의 방이 있고, 층마다 다르긴 하지만 대부분 남,녀 화장실이 하나씩 있습니다. 화장실 안에는 샤워부스가 2~4개 있습니다. 룸메이트는 한국으로 배치되는 경우도 꽤 있습니다. 저같은 경우에는 처음에 한국인으로 배치되었다가 우연히 미국인 친구를 알게 되어 방 변경기간에 변경 신청을 해서 그 미국인 친구와 룸메이트로 지냈습니다. 기숙사 건물은 4층이고 엘레베이터는 없습니다. 방 청소는 각자 알아서 하지만 복도나 화장실, 라운지 청소는 하지 않아도 됩니다. 라운지나 화장실 청소상태는 꽤 깨끗한 편입니다.
식사는 기숙사 앞 건물의 학생 식당(Commons)에서 주로 해결했습니다. 부페식이고, 각국 요리, 피자, 햄버거, 샐러드, 요거트, 탄산음료, 우유나 디저트 등 많은 종류의 음식을 먹고 싶은 만큼 먹을 수 있어 좋았습니다. 어떤 식당이든 계속 이용하다보면 질리긴 하지만 깨끗하고 먹을만 했습니다. 한국음식에 비해 기름지고 짠 음식이 많은 편입니다. 한국음식이 생각나면 가끔 한인마트에서 다량 사다놓은 라면을 먹기도 했습니다. 학교내에 아인슈타인베이글, 세븐일레븐, 까페 등이 있어 핫도그나 샌드위치, 베이글 등으로 끼니를 해결하기도 합니다.","저는 4과목 12학점을 들었습니다. 수업시간은 한국에 비해 많지는 않고, 숙제의 양이 많지는 않지만 언어적인 문제 때문에 숙제를 하는데 걸리는 시간이 조금 더 걸려서 많게 느껴졌습니다. 교수님이 영어권 국가 사람이 아닐 경우(예를 들어 인도인), 발음문제로 수업을 듣는데에 애로사항이 많다고 들었습니다. 

Bridge and Structural Design - 제가 들은 유일한 토목공학 전공 과목입니다. 4학년 과목입니다. 매주 1회 숙제가 있었고 굉장히 해결하기 까다로웠습니다. 중간, 기말 시험을 보았고 개인 설계 프로젝트가 있었습니다. 강의식이고, 온라인에 녹화된 강의를 보고 복습할 수 있습니다. 전공과목들은 녹화강의를 제공하는 경우가 많습니다.

Probability and Statistics - 확률통계입니다. 공대 전공과목들이나 수학과목들은 한국에서의 강의와 방식이 유사합니다. 강의식이지만 학생들의 질문이 조금 더 많은 수준이었습니다. 가끔 퀴즈가 있는데 어렵지 않고, 매주 숙제가 있었는데 연세대학교의 수학 과목들과 비슷한 분량이었습니다. 영어를 편하게 구사할 수 없는 경우에는 토론 수업이나 인문학 수업 등을 무리해서 신청하는 것보다는 수학이나 전공과목 등 강의식 수업을 듣기를 추천드립니다.

Writing in the University for Non-Native Students - 글쓰기 과목입니다. 토플 라이팅을 한번이라도 해본 적이 있는 실력이면 어렵지 않습니다. 1,2주에 한번 꼴로 글을 써가야하는데, 어렵다기보다는 시간이 많이 걸리는 숙제들이었습니다. 수업도 어렵지 않고, 그룹 글쓰기 등을 통해 외국인 친구들과도 함께할 수 있는 수업이었습니다.

Brain, Mind and Behavior - 심리학 교양과목입니다. 조별 토론 등을 할 수 있다는 생각에 신청했지만, 영어를 잘 못하는 외국인이라 배려받을 생각이면 추천하지 않습니다. 수업시간 내내 많은 학생들이 자진 토론을 하는데, 발음이나 억양 때문에 생각보다 다른 학생들의 발언을 이해하기가 쉽지 않고 내 생각을 말하기도 쉽지 않았습니다. 교수님이 말할 때에는 알아듣기 쉬웠지만 학생들과 소통하기가 어렵다는 점에서 회화가 어느 정도 수준 이상 된다고 생각한다면 얻는 것도 많고 재미있는 수업이라고 생각합니다. 


도서관은 24시간 이용할 수 있고, 학교 수업에서 쓰이는 책들은 도서관 내에서만 2시간 단위로 대출할 수 있습니다. 천장이 아주 높고 널찍널찍하게 앉을 수 있어 쾌적했습니다. 시험기간이 아니면 자리는 항상 많고, 시험기간에도 자리가 없어 이용하지 못했던 적은 없습니다.","Main Building의 International Center에는 처음 학교에 도착했을때 체크인을 하거나, 주말 등을 이용해 해외여행을 하는 경우가 생기거나, 비자 문제 등의 경우가 아니라면 자주 갈 일은 없습니다. 하지만 외국에서 온 교환학생이 한국에 비해 굉장히 많은 편이기 때문에, 외국 학생이 문제가 생길 경우 이곳에서 도움을 잘 받을 수 있다고 들었습니다.","학교 내에 큰 체육관이 있습니다. 체육관 안에는 수영장, 헬스장, 라켓볼장, 농구장, 배드민턴장 등이 있습니다. 한학기동안 실내축구 리그가 진행되었는데, 매주 일요일마다 경기가 있었습니다. 동아리는 학기초에 학생회관에서 홍보를 하는 날이 정해져있는데, 종류가 꽤나 많습니다. 배드민턴 동아리를 들었었는데, 매주 2회씩 배드민턴만 치고 따로 만나서 모임을 갖거나 하진 않았습니다. 토론, 아카펠라, 각종 스포츠, 종교 등 여러 동아리가 있었습니다.","생각보다 외국인이 많습니다. 인도인, 중국인이 많고 유럽, 한국인 학생도 꽤 있습니다. 수업 들어가면 40% 정도는 외국인이었던 것 같습니다.

밤이 되면 모든 가게가 문을 닫고 돌아다니기도 위험합니다. 가장 번화한 다운타운에서도 대부분의 가게들이 오후 6~7시면 문을 닫고, 날씨가 추운 1~4월에는 8,9시만 지나면 거리에 사람이 거의 없습니다.

위험합니다. 전철 등을 밤에 혼자 이용하면 소매치기나 강도를 당하는 경우가 많습니다. 자기 물건에 잠시 소홀하면 도난당하는 경우도 많습니다.

여러 나라의 학생들이 모여서 친하게 지낼 것이라 생각하고 갔지만, 같은 나라에서 온 학생들끼리 모여다니는 경우가 대부분입니다. 외국인 친구와 친하게 지내려면 그만큼 많이 노력해야합니다.

수업시간 질문이 아주 자유롭습니다. 교수님이 말하는 도중에 끊고 질문을 하는 학생들도 있습니다. 바보같고 엉뚱한 질문들도 당당하게 하고 교수님들은 친절하게 답해주려고 노력합니다.","교내 Main Building의 International Center에서 도움을 받을 수 있습니다.
교회를 다니는 사람은 교외 한인교회에서 도움을 받거나 조언을 구하기도 합니다.","한양대, 아주대, 건국대, 동아대, 국민대 등 여러 학교에서 교환,방문학생, 편입이나 복수학위과정으로 온 많은 한국학생들을 만날 수 있습니다. 도움을 받거나 조언을 구할 한국 한생들이 많으므로 두려움 갖지 않았으면 좋겠습니다.
영어실력 향상을 하나의 목적으로 생각하고 계신 분이라면, 스마트폰에 영어사전을 이용한다거나 미국 드라마를 애청하는 등의 노력이 꼭 필요합니다. 따로 신경쓰고 노력하지 않으면 생각보다 영어실력이 늘지않습니다."
"IIT는 비교적 작은 학교입니다. 캠퍼스 끝에서 끝까지 걸어서 15분 정도 걸립니다. 시카고 다운타운에서 20분정도 떨어져 있는데, CTA RED line과 Green line 역이 가까이 있어서 교통에 크게 불편함은 없습니다. 저는 1월부터 5월까지 있었는데, 엄청 춥고 눈이 많이 내립니다. 4월까지 겨울 옷 입고다니고, 5월에도 왠만해선 두꺼운 긴팔입고 다녔습니다.","학교 가까이에 지하철 역이 두 곳이나 있고, 다운타운까지 20분정도 걸리기 때문에 돌아다니기에는 편합니다. 다만, 근처가 Ghetto라서, 밤에 학교 주변으로 돌아다니기에는 조금 위험할 수도 있습니다. 지하철 역 한 정거장 떨어진 곳에 큰 마트도 있고 해서, 크게 불편한 점은 없습니다.","저는 SSV(아파트 형 기숙사)에 살았고, Fraternity에 들어갔기 때문에 대부분 방에서 요리를 해서 먹거나, Fraternity에서 끼니를 해결했습니다. Meal plan이 의무라 Create your own meal인가 하는 175식짜리를 신청했는데, 많이 가지는 않았습니다.","공대수업의 경우 크게 차이는 없다고 보면 됩니다. 영어 수업에 토론 위주보다는 지식 전달형의 수업이 많습니다. 그렇지만, 학생들의 질문이 한국에 비해 잦고, 그런 질문들에 관해서 토론을 하기도 합니다. 교양수업의 경우는 확실히 토론이나 참여하는 방식의 수업이 대다수였습니다.","처음에 등록할 때 한 번 가고 이용하질 않아서 정확히는 모르겠습니다만, 교환학생을 위한 Conference같은 행사를 가끔 주최합니다. 생활 정보 같은 것도 보내주는데, 학기말 쯤에는 세금 refund에 관한 메일을 보내줍니다.","꽤나 많은 Student Organization이 있고, 따로 모집기간이 없고 관심있으면 참여하는 방식입니다. 저는 German Club이랑 Frisbee Club에서 활동했었는데, 우리나라처럼 가입해서 활동한다기보다는 시간 맞는 사람들끼리 모여서 활동하는 그런 개념입니다.
부대시설로는 체육관이 있는데, 학생증 있으면 무료로 사용할 수 있습니다. 웨이트 트레이닝, 수영장, 농구코드 등 있을 건 다 있습니다.","문화적 충격이라기 보다는 그냥 느낀 점인데, 생각보다 애들이 많이 친절합니다. 먼저 와서 말도 걸고, 행사 같은 거 있으면 불러주기도 하고 교환학생에 대해 배려를 많이 해줍니다.","현지 친구들
대부분의 한국 학생들이나 중국 학생들은 자기들끼리 어울려다녀서 물어봐도 잘 모르는 경우가 많습니다. 그냥 미국인 친구들 사귀어서 도움 받는 수 밖에 없습니다.",교환학생 가면 한국 사람들 피해다니세요
학교는 연대캠퍼스보다 작은편입니다. 평지에 도로를 따라 건물이 쭉있지만 대부분건물이 작고 20분이면 먼 건물도 갈수 있습니다. 학교위치는 다운타운과 대중교통으로 15~20분으로 가깝습니다. 저는 봄학기에 가서 내내 춥고 바람이 많이 불었던 기억만 있지만 여름에는 많이 덥다고 하더군요,다운타운이 학교와 가깝고 버스로 10분거리에 대형마트도 많아서 쇼핑이나 시내구경하기에는 좋습니다. 그러나 학교가 흑인거주지역 경계선 쯤에 있어서 학교밖을 늦은시간에 걸어다니거나 하는 것은 별로 추천하고 싶지 않습니다.,"구기숙사인 MSV를 사용했고 기숙사에 살기위해선 밀플랜이 의무였기때문에 정확한 숫자는 기억나지 않지만 175 plan?(한학기동안 175끼)을 선택했던 것같습니다. 처음한달은 그럭저럭 먹을만했지만 나머지 기간은 오직 샐러드만 먹었던것 같네요.. 입에 맞는다는 분들도 계시지만 외국친구들도 학교식당은 sucks라고 하더군요,,한끼에 10달러가 넘는 비싼 가격이기 때문에 가능한한 작은걸로 선택하시고 남으시면 포인트로 바꿔서 차라리 베이글이나 음료를 사먹는게 낫습니다. 하지만 포인트로 바꾸면 한끼가 6달러로 취급되기 때문에 큰 손해죠.. 밀플랜 생각하면 그냥 부엌딸려있는 비싼 기숙사쓰는게 나을 것 같기도 해요.","수강신청하기는 몇수업을 제외하고 편한 편이지만 일단 인원이 차면 더 받아주는 경우는 별로 없는것 같습니다. 제가 들었던 화학공학과 수업의 경우 연대에서 듣는 것과 별 차이가 없었고 대학원수업은 대부분 시험이 없고 talking이나 수업위주이기 때문에 오히려 편했습니다. 
 도서관은 작지만 자리가 많아서 공부하기는 좋은것 같아요. 그러나 문여는시간과 닫는시간을 잘 체크해야합니다.",국제교육부에 있는 직원들은 친절하고 거기서 일하는 학생들도 친절했습니다. 비자등의 문제가 생겼을때 가서 물어보면 잘 도와줍니다.,체육관에서 수영이나 운동을 할 수 있고 일주일에 한두번씩 요가 같은 클래스가 열리니 시간맞춰듣는다면 좋은것 같아요. 학교가 작아서 그런지 동아리가 활성화된 것은 별로 없었고 저도 해보려고 햇지만 찾기 쉽지 않더라구요. 워낙 교환학생이 많아 오히려 미국인을 찾기가 힘들었고 중국인 인도인은 물론 많습니다. 교환학생이 많다보니 각 나라별로 끼리끼리 다니는 경우가 많았던것 같고 학교자체에 파티같은 프로그램도 별로 없어서 외국친구사귀기가 쉬운학교는 아니였어요. 룸메를 잘 만나는 것도 중요하구요. 저는 스윙댄스모임에 가서 놀았는데 애들이 모두 프랜들리하고 하다보니 재미가 붙어서 꾸준히 나갔던것 같아요.,"한두번만난 외국친구들이 같이 놀러갈래? 하면 yes하고 그냥 따라가세요. 얘네는 친한사이가 아니면 두번 안물어보더라구요. 
 밥보다 감자칩이나 초콜렛을 많이 먹는 민족인것 같습니다. 감자칩이 주식인 느낌.. 한국도 그렇겠지만 방안에만 있는 애들도 있고 운동열심히하고 여러활동하는 친구들도 있고 그렇습니다.",학교 국제처에 가면 잘 도와주는 것 같아요.,귀찮다고 학교에만 잇지마시고 몸을 움직여 밖으로 여기저기 나가보고 외국친구한테 말도걸고 그러시면 더 기억에 많이 남는 교환학생 생활이 될 것 같습니다. 저는 좋은 사람들 많이만나서 만족하는 교환학생이었지만 학교자체내에서 딱히 프로그램이 많이 없기 때문에 스스로 찾아서 돌아다니는 것이 중요한것 같아요.
"캠퍼스의 크기는 그리 크지 않습니다.
보통 수업 듣는 건물들은 기숙사와 가까이 있습니다.
학교는 시카고의 다운다운보다 약간 아래쪽에 있지만 버스나 지하철을 타면 그리 멀지 않아요.
날씨는 바람이 많이불고 춥지만 생각보다는 많이 춥지 않았어요.
서울과 비슷하다고 보시면 돼요.","저는 주로 캠퍼스 안에서만 생활했고요,
버스나 지하철을 타면 가까운곳에 마트가 있어서 자주 갔습니다.
그리고 다운타운도 20분정도면 가는데 쇼핑할 곳도 많아요.","기숙사는 두종류가 있는데 보통은 구기숙사에서 많이 생활하세요.
다른점은 신기숙사에선 키친을 이용할 수 있다는 거구요, 좋은점도 많지만
많은 학생들이 구기숙사에 있기 때문에 사람들과 친해지고 싶다면 구기숙사가 좋아요.
2인1실이지만 돈을 더 지불하시면 1인실로 사용하실수 있어요.
화장실과 샤워실은 붙어있고 공동으로 생활하시는 거에요.
샤워할 때 기다린적은 거의 없었던 것 같아요.
약간 불편하기도 하지만 저는 여자기숙사에서 생활해서 더 좋았어요.
여자기숙사는 한곳 뿐이고 거의 공용이에요.
식사는 학생식당을 필수로 이용해야 하는데요..
비싸고 횟수가 정해져 있는데 많이 남았어요..","수업은 글쓰기, IPRO, 열과물질전달, 열역학2를 들었어요
글쓰기는 한학기에 4-5번의 에세이를 내야하는데
매주마다 과제가 있어요. 약간 힘들었어요
IPRO는 토론식 수업이고 반별로 주제가 있어서 조사도 하고 나중에 발표도 하는건데요 토론식이라서 따라가기가 엄청 힘들었었어요..
열역학2는 시험을 5번정도 봤던 것 같아요. 퀴즈도 있구요, 과제도 매주 있어요. 처음엔 대강해서 어려웠지만 자주자주 퀴즈를 보고 과제도 있으니까 오히려 공부를 더 하게되어서 좋았어요.
열과물질전달은 퀴즈가 가끔씩 있구요, 시험은 3번이 있어요. 과제도 매주 있었어요.

도서관은 우리 학교처럼 열람실은 없구요, 그냥 테이블이 있어서 공부할 수 있어요. 그런데 보통은 거기서 안하구요 기숙사 지하에 열람실처럼 되어있어서 거기를 자주 이용했어요. 컴퓨터실도 있고 프린트도 할 수 있어요.",이건 잘 모르겠네요..,매주 금요일마다 Rejoyce라는 기독교 모임에서 기숙사로 와서 같이 게임을 하거나 노는데요 매주 참여했어요. 매주 월요일에는 채플에서 예배같은게 있어요.. 거긴 자주 가진 않았지만 그 사람들과 친해져서 좋았어요.,.,.,"한국인이 아주 많아서 처음엔 약간 실망을 했지만
학교에서 하는 여러 행사나 모임같은걸 참여하면 외국인 친구들과 친해질 수 있을 거에요. 저는 그렇게 잘 하지 못했었는데 약간은 후회가 되네요.
하지만 재밌었고 좋은 경험이었습니다.
Rejoyce 사람들과 많이 친해져서 나중에 많이 만나고 도움도 많이 받았는데 정말 고마웠구요. 
영어로 의사소통이 원활한 상태로 가면 더 많이 즐길 수 있을 것 같아요.
영어 공부 많이 하시고 가세요."
