gen_info,env_info,food_info,study_info,office_info,facil_info,mhct_info,help_info,etc_info
"San Jose State University(SJSU)는 22개의 CSU Campus 들 중의 하나로 Silicon Valley로 유명한 San Jose에 위치하고 있습니다. IT 산업이 발달해 있어서 주변에 Apple, IBM 같은 미국의 유명한 회사들이 많이 있고 한국기업으로는 삼성과 LG도 진출해있다고 합니다. San Jose는 캘리포니아 북부에 있는 도시로 San Francisco와는 차로 약 1시간 거리에 위치하고 Sacramento, Berkley, 그리고 Stanford 대학이 있는 Palo alto 등의 도시와도 비교적 가까운 편입니다. 버스로 한 시간 정도 떨어진 곳에 산타크루즈 해변도 있습니다. San Jose의 기후는 대체로 항상 햇살이 뜨겁고 건조하지만 날씨는 정말 좋아서 거의 매일 청명하고 구름 한 점 없는 하늘을 볼 수 있습니다. 여름에는 더운 날이 계속되고 가을에는 일교차가 좀 큰 편입니다. 겨울에서 봄 초기에 이르기까지는 다른 계절에 비해 비가 많이 오지만 기온이 많이 떨어지지는 않습니다. 학교의 크기는 연세대학교보다 작고 정사각형 모양으로 되어있어 이동하기가 편리해 수강신청을 할 때 건물간의 거리를 고려할 필요는 없습니다.","SJSU는 San Jose Downtown 가까이에 위치해있어서 레스토랑, 스타벅스, 맥도날드, 술집, 슈퍼마켓, 은행, 우체국 등의 시설을 쉽게 이용할 수 있고 영화관이나 뮤지컬/발레 공연장도 있어서 문화시설 또한 즐길 수 있습니다. 학교의 Student Union에서 발급하는 VTA 스티커를 학생증에 붙이고 다니면 버스나 Light rail을 무료로 이용할 수 있어서 월마트나 타겟 같은 대형마켓, 엘카미노에 있는 한국마트, San Jose 아이스하키 경기장, San Francisco까지 가는 Cal train을 탈 수 있는 Cal train 역, Valley fair 쇼핑몰, Great Mall 아울렛 등 좀 더 먼 곳도 다녀올 수 있습니다. 하지만 한국에 비해 배차시간이 굉장히 길기 때문에 주의하는 것이 좋고 너무 늦게 타지 않는 것이 좋습니다.","기숙사로는 Campus Village와 International House(IHouse) 이 두 가지가 있습니다. 제가 두 학기 동안 거주한 International House는 해외에서 온 학생들을 위한 기숙사로 약 30개 나라에서 온 70명 남짓한 학생들이 살고 있는데 미국학생들도 약 20명 정도 됩니다. 반면 Campus Village는 시설면에서는 IHouse보다 훨씬 좋고 취사가 가능한 방도 있으며, 혼자 방을 쓸 수도 있어 사생활보호가 된다는 장점이 있습니다. IHouse의 경우 방은 1인실, 2인실, 3인실이 있는데 1인실은 오래 머무른 학생들에게 우선권이 있어 현실적으로 힘들고 3인실은 드물기 때문에 보통 한 명의 룸메이트와 함께 2인실을 사용하게 됩니다. 같은 나라에서 온 학생들은 룸메이트가 되지 못하는 것이 원칙입니다. 다양한 행사를 통해 서로를 알아가는 시간을 많이 갖는 편이라서 가족적인 분위기이고 여행도 기숙사 학생들끼리 함께 계획해서 떠나는 경우가 많습니다. 매주 크고 작은 행사가 많아서 굳이 찾아다니지 않아도 미국 학생들뿐만 아니라 다른 나라에서 온 친구들과도 좋은 시간을 보낼 수 있다는 것이 장점이라고 생각합니다. 앞서 언급했듯이 시설면에서는 Campus Village에서 뒤쳐지나 지하 부엌에 거의 모든 취사도구가 마련되어 있어 취사가 용이하게 되어있고 화장실과 샤워실도 공용이지만 자리가 모자라서 불편했던 적은 없었습니다. 하지만 이들 두 기숙사는 가격이 꽤 비싼편이므로 캠퍼스 밖에 살면 이동에 따른 불편함은 있을 수 있지만 돈은 절약할 수 있습니다. 

IHouse에 사는 학생들에게는 Meal Plan이 의무여서 5일plan과 7일plan 중에 한 가지를 선택할 수 있습니다. 기숙사에서는 아침식사와 저녁식사만 제공 하지만 교내의 Dining Commons(DC)에 가면 아침부터 밤까지 항상 디저트까지 마련돼 있는 뷔페식 식사를 할 수 있습니다. 아침식사는 주로 스크램블에그, 토스트, 팬케익, 오트밀, 우유, 주스 등의 메뉴가 일반적이고 점심이나 저녁 때에는 비교적 다양한 메뉴를 제공하나 크게 달라지지는 않아서 나중에 기호에 맞지 않는 부분이 생기기도 하기 때문에 5일plan을 선택해서 주말에는 외식을 하거나 부엌에서 요리를 해먹는 경우도 많습니다. Meal Plan이 없는 학생들은 캠퍼스의 Student Union 안에 있는 여러 식당들에서 식사를 해결할 수 있고 캠퍼스 주변에서도 비교적 다양한 먹거리를 찾을 수 있습니다.","학기가 시작하고 난 후에 시간표를 급작스럽게 바꿀 일이 생겨서 첫 학기에는 원하는 수업을 모두 넣지 못해 교양 위주로 수강하였고 두 번째 학기에는 전공 위주로 들으려고 노력했습니다. 

첫 학기에는 Public Speaking (non native class), Aerobics, Electrical Optical and Magnetic Properties of Solids, Linear Algebra-1, Introduction to Human Nutrition을 수강하였습니다. 

Public Speaking (non native)의 경우 과목 이름은 non native이나 어렸을 때나 학창시절에 미국으로 건너와서 영어를 매우 잘하는 학생들이 대부분이기 때문에 처음에는 좀 힘들게 느껴졌지만 사람들 앞에서 하는 영어 말하기 연습을 통해 얻은 것은 많았던 수업이었습니다. EO&M Props Solids 과목은 전공과목이었는데 Lab이 있어서 다른 과목이 비해 더 많은 시간을 소요해야하지만 Lab 사람들과 친해질 수 있다는 것이 장점입니다. Lab은 주로 정해진 실험 후에 데이터를 엑셀에 입력해서 분석하고 네 차례 긴 보고서를 작성하는 식으로 이루어졌습니다. Lecture 수업의 경우 수업내용은 연대에 비해 크게 어렵지는 않았으나 돌발 퀴즈를 자주 보았고 학생들이 질문을 정말 많이 한다는 것이 특징이었습니다. Linear Algebra의 경우 기초반을 수강하게 되었는데 숙제를 꾸준히 잘 해나가면 큰 어려움은 없습니다. 다만, 이 수업의 경우 연대에서 학점인정을 받으려면 Algebra-2까지 이수해야 한다는 것을 참고하시기 바랍니다. Introduction to Human Nutrition은 영양학 기초 과목이었는데 실생활에 관련된 영양학 상식들을 배울 수 있습니다. 

두 번째 학기에는 Latin Dance(Beginning), Introduction to IC Process Design, Structure Analysis of Materials, Thermodynamics, Acting을 수강하였습니다. 

첫 학기에 수강했던 Aerobics처럼 Latin Dance도 굉장히 편하게 들을 수 있는 과목인데다가 SJSU에서는 한국에는 없는 몇몇 PE과목들도 제공하고 있기 때문에 PE과목 하나쯤은 수강하시기를 추천하고 싶습니다. Introduction to IC Process Design은 전공과목인데 Lecture에서 CMOS Wafer 공정에 대한 내용을 배우면 Lab 수업에서 실제로 그 공정과정을 통해 한 학기 내내 CMOS를 만들고 결과를 test하는 과목이었습니다. 공정 과정 중에 실수가 생기면 처음부터 다시 하는 경우가 있어서 굉장히 시간을 많이 들인 과목이지만 실제 silicon valley의 wafer 공정 회사들이 거치는 과정을 하나하나 직접 해 볼 수 있어서 좋은 경험이 된 것 같습니다. Structure Analysis of Materials 과목 또한 전공과목인데 7명 밖에 수강하는 학생이 없어서 교수님과의 분위기가 좋았습니다. 이 수업에서는 Silicon Valley의 Hitachi 공장과 Stanford 대학의 Synchrotron을 견학하는 두 번의 Field trip이 있어서 그 분야의 사람들로부터 직접 설명을 들을 수 있었습니다. Thermodynamics의 경우 문제풀이 위주로 수업이 이루어져서 매 수업시간마다 정해진 그룹 친구들과 문제를 풀었습니다. Acting 수업은 제 미국 룸메이트가 소심한 성격에 도움이 되었다며 추천해준 과목입니다. 평가는 둘이 짝을 지어하는 연극과 monologue로 이루어지는데 현직 연극배우인 교수님이 알기쉽게 가르쳐주셔서 색다른 경험을 할 수 있었습니다.  

도서관은 시설이 굉장히 좋고 쾌적합니다. 도서관 카드를 만들면 다양한 책과 전공서적, DVD 등을 대여할 수 있습니다. 컴퓨터와 프린터도 마련되어 있으며 공부하기 좋은 곳은 주로 6,7,8층입니다. 조모임을 할 때에는 도서관 사이트에서 열람실 책장 뒤에 위치한 study room을 예약해서 자주 이용하였습니다.",Clark Hall 5층에 Study Abroad Center가 있습니다. 담당자는 Dave Rudel인데 수강신청을 제대로 못하여 수강할 학점이 너무 적은 경우나 미국 이외의 다른 나라를 여행하기 위해 DS2019에 서명을 받을 때 찾아가면 도움을 받을 수 있습니다.,"학생들은 Student ID card를 제시하면 Gym과 실내수영장, 실외수영장을 무료로 이용할 수 있습니다. 영화관도 학생할인을 받을 수 있는 요일이 정해져 있어서 그 요일에 가면 꽤 많이 할인을 받을 수 있습니다. 동아리는 그렇게 수가 많은 것 같지 않았고 주로 fraternity와 sorority 중심이었습니다. 저 같은 경우에는 전공 교수님께 수업에 관련된 상담을 받으러 갔을 때 교수님이 소개해 주신 우리 과 Chemical and Materials Engineering(CME)모임에 들게 되었었는데 자주 참석하지는 못했으나 학기에 정해진 날짜에 자주 바베큐파티나 친목도모 모임 등을 열었습니다. 연대로 말하자면 과방 같은 것도 있어서 숙제를 할 때 이용하기도 했습니다.",특별한 Culture Shock은 없었지만 한 방에서 다른 나라 룸메이트와 산다는 것이 쉽지만은 않았던 것 같습니다. 애매한 태도는 오히려 상대방을 혼란하게 할 수 있기 때문에 불만이 생기면 대화로 푸는 것이 좋습니다.,Study Abroad Center나 IHouse의 Kristen과 Leann에게서 도움을 받을 수 있습니다.,"미국 대학교 생활부터 세계 여러 나라에서 온 친구들과의 기숙사 생활, 미국 곳곳으로 다녀온 여행을 통해 더 많은 것을 경험하고 느낄 수 있었습니다. 더 적극적으로 더 많은 것을 누리고 오시기 바랍니다."
"SJSU(San Jose State University)는 캘리포니아 전역에 걸쳐 23개의 캠퍼스로 이루어진 CSU(California State University)의 한 캠퍼스로서, 샌프란시스코에서 남동쪽 방향으로 승용차로 약 1시간 정도 소요되는 산호세에 위치하고 있습니다. Main Campus의 크기는 연세대학교에 비해 작고, 건물들이 서로 밀집되어 있기 때문에 공강시간에 캠퍼스를 옮겨 다니는 데 따른 큰 불편함은 없습니다. 기후는 1년 내내 따뜻하고 습하지 않은 날씨, 쾌적한 바람을 즐길 수 있는 전형적인 캘리포니아 날씨라고 할 수 있습니다.","SJSU는 산호세의 downtown에 위치하고 있습니다. 다른 대도시에 비해 downtown이 크지는 않지만 식당, 영화관, 박물관, 술집 등 대부분의 시설이 다 갖추어져 있기 때문에 큰 불편함을 느끼지 않았습니다. 특히 학교 근처에 우리나라의 이마트에 해당하는 safeway가 있어서 그곳을 자주 애용했습니다.
대중교통은 산호세를 비롯해 인근 도시에 걸쳐 VTA(Value Transporation Authority)에서 운영하는 Light Rail과 Bus가 운행되고 있는데 학교에서 학생증을 만들면서 나누어주는 VTA스티커를 제시하면 이들을 무료로 이용할 수 있습니다. 하지만 우리나라처럼 도시 곳곳에 구석구석 교통망이 뻗어있지 않고 저녁시간부터 배차시간이 오전과 낮에 비해 많이 길어지기 때문에 다소 불편한 점이 있습니다. 때문에 주변에 자동차를 갖고 있는 친구들과 친해지면 더 편하고 재미있는 생활을 누릴 수 있을 것입니다.
산호세는 실리콘밸리의 중심지로서 구글, 애플, HP 등 세계적인 기업의 본사가 밀집해 있는 도시입니다. 자연히 도시의 전체적인 소득수준이 높고 고가의 좋은 집들이 많이 밀집해 있지만 그에 못지않게 소득이 낮고 집이 없는 사람들도 많이 분포하는 양극적인 모습을 보여주고 있습니다. 그렇기 때문에 치안이 나쁜 밤과 새벽에는 되도록 외출을 삼가는 것이 좋습니다.","기숙사는 크게 International House(이하 I-house)와 Campus Village 두 개로 이루어져 있습니다. I-house는 교환학생과 어학연수학생들을 중심으로 하여 만들어진 기숙사로서 항상 다양한 행사가 있고 다양한 나라의 학생들과 금세 친해질 수 있다는 장점이 있지만, 지은 지 오래되었기 때문에 다소 낙후된 시설, 주방공용, 비싼 기숙사료라는 단점이 있습니다. 반면에 Campus Village는 건물시설도 훨씬 좋고 내부 취사가 가능하며 학교와 조금 더 가까우면서 I-house보다 다소 저렴한 기숙사료의 장점이 있지만, 교환학생들보다는 현지학생들의 비율이 더 많기 때문에 낯을 많이 가리는 분들에게는 좀 불편할 수도 있는 단점(?)이 있습니다. 하지만 이것 역시 단점 아닌 단점이기에 개인적으로는 Campus Village를 좀더 추천하고 싶습니다. 그러나 저는 두 기숙사 모두 가격이 다소 비싸 craiglist라는 웹사이트를 통해 같은 학교에 재학하는 룸메이트들이 사는 집을 구해 살았습니다. 개인적으로 상당히 만족할 정도로 위치와 집안 시설 등 모든 게 좋았습니다.
식사는 학교 내에 Dinning Commons(이하 DC)나 Student Union이라는 곳에서 해결할 수 있습니다. DC는 뷔페식 식사를 제공하는 식당으로서 미리 Meal Plan을 끊어서 정해진 기간 동안 이용할 수 있습니다. Student Union은 우리 학교의 학관과 비슷한 곳으로서 다양한 종류의 식당들이 입점해 있는데, 본인의 입맛에 맞는 곳에서 식사할 수 있습니다. 이 밖에도 캠퍼스 외부에 다양한 식당들이 입점해 있기 때문에 학교 내에서만 해결하기 원하지 않는 분들은 고려해 볼만 합니다.","저는 한 학기 동안 3학점 경영전공수업 3개(Intermediate Accounting I, Global Dimensions of Business, Retail Marketing Management), 3학점 교양수업 1개(Public Speaking), 1학점 체육수업 2개(Beginning Judo, Beginning Weight Training) 이렇게 총 14학점을 이수했습니다.

1. Intermediate Accounting I 
우리말 그대로 중급회계(1)으로서, Elizabeth Grace라는 금발의 중년 여 교수님께서 가르치셨습니다. 교수님께서 수업에 대한 열정이 대단하셔서 단 한 명의 학생도 낙오시키지 않으려고 최선을 다하셨습니다. 매번 복습을 하고 학기 중 4번에 걸친 시험을 치러야 해서 다소 압박감이 느껴졌지만 그만큼 다른 어떤 수업보다도 도전적이고 얻는 게 많은 수업이었습니다.

2. Global Dimensions of Business
Charles Fishel이라는 백발의 노교수님께서 가르치신 수업으로 우리말로는 ''국제경영론''이라고 해석하시면 좋을 것 같습니다. 글로벌 기업이 자국이 아닌 세계를 무대로 하여 성공적인 기업경영을 이행하기 위한 전략, 국제경영을 하면서 맞닥뜨리게 되는 제반 문제들과 그에 대한 대처 방안 등에 대해 배웠습니다. 노교수님이 하시는 말씀이라 알아듣기가 상당히 어렵다는 단점이 있었지만, 조를 만들어 파트너 조와 함께 기업간 가상 계약을 체결했던 프로젝트는 미국에서의 조모임을 몸소 체험했다는 점에서 매우 인상 깊었습니다.

3. Retail Marketing Management
우리나라의 ''소매경영''에 해당하는 마케팅 과목으로서 Havens라는 중년의 남교수께서 가르치셨습니다. 과목에 관한 기본개념을 배우고 미국의 주요 도소매점들은 이를 어떻게 실행하고 있는지 알아보는 수업이었는데 개인적으로 한 학기 동안 들은 수업들 중 최악의 수업이었습니다. 일단 교수가 수업을 가르치려는 의지가 전혀 없어 보였고 가르치는 내용들도 지극히 원론적인 것들에 불과했습니다. 자연히 학생들도 수업에 흥미를 잃어 중반에 이르러서는 수업분위기 자체가 몹시 나빠졌던 걸로 기억합니다.

4. Public Speaking
영어 말하기 수업으로 native와 non-native용이 있는데 저는 후자를 택해 들었습니다. Elizabeth Harris라는 중년의 여선생님이 가르치셨는데, speaking을 위해 만드는 outline의 작성법, public speaking의 준비부터 발표 후의 피드백까지 꽤 체계적으로 배운 수업이었습니다. 학생 개개인의 speaking을 비디오로 녹화한 뒤 그것을 직접 lab실에 보면서 피드백을 받은 게 많은 도움이
됐습니다. 

5. Beginning Judo
Dave라는 젊은 흑인 강사 분이 가르친 유도수업으로서 처음에 별 생각 없이 수강신청을 하고 들어갔는데 이 강사 분이 알고 보니 올림픽 금메달리스트였습니다. 그리고 SJSU가 미국 전역에서 유도에 관해 손가락 안에 꼽히는 굉장히 유명한 학교라는 것도 그 때 알게 됐습니다. 매 번 유도복을 갖고 다니고 주말마다 빨래해야 하는 번거로움이 있었지만 유도의 기본부터 실전 기술까지 체계적으로 배울 수 있는 좋은 기회였습니다.

6. Beginning Weight Training
유도수업과 마찬가지로 나름 젊은 흑인 강사님(이름 기억 안 남)께서 가르친 웨이트 트레이닝 수업으로서, 모든 학생들의 성별, 몸무게에 맞춰 개인별 목표치가 할당이 되어 그것의 달성을 위해 한 학기 동안 열심히 운동에 매진했던 수업이었습니다. 이전에 헬스장에서 뚜렷한 목표치 없이 잘못된 방법으로 운동하던 것에서 완전히 벗어나서 체계적으로 몸을 가꿀 수 있는 기회를 준 유익한 수업이었습니다.

* 도서관은 학교 캠퍼스 북서쪽 끝에 위치한, 시에서 지은 건물로서 학생뿐만 아니라 시민들도 이용가능합니다. 도서관에서 library card를 발급받으면 인터넷을 무료로 이용할 수 있습니다. 도서관 시설은 상당히 깨끗하고 만족스러운 수준이었습니다.","Clark Hall이라는 곳에 Study Abroad Center가 있는데 이 곳에서 교환학생을 포함한 International Students에 관한 모든 업무를 담당합니다. 학기 시작 전에 오리엔테이션에 가시면 이 곳에서 일하는 교직원들과 면식을 틀 수 있는데 모두가 친절하고 적극적으로 학생들의 문제 해결에 나섰던 것으로 기억합니다. 보통 보험, 수강신청, 비자, 미국 외 국가 여행 등의 문제들로 학생들이 많이 방문합니다.","연세대와 같은 동아리보다는 서로간의 유대관계를 끈끈이 하고 인맥을 구축하는 정도의 목적을 갖고 있는 fraternity, sorority들이 이 곳의 주요모임이었습니다. 교환학생들은 다소 이들에게 이질감을 느낄 수 있을 것입니다.",특별한 문화적 충격은 없었지만 일상생활 곳곳에서의 미국 학생들과의 이질감 때문에 그들과 가벼운 이야기는 많이 나눈 반면 깊은 이야기는 많이 시도하지 못했던 것으로 기억합니다. 오히려 그곳에 온 유럽 학생들과 말이 잘 통해서 기억에 남는 유럽친구들을 많이 사귀었습니다.,"study abroad center, 한인교회, 한인학생회 등을 이용하시면 많은 도움을 받으실 수 있습니다.","미국에서의 한 학기는 비록 짧았지만 저에게 너무나도 값지고 소중한 시간이었습니다. 다른 나라의 수업을 듣고, 문화를 체험하고, 여행을 다니고, 사람을 사귀고, 음식을 맛보는 모든 것들이 저에겐 새로운 인생 경험이었습니다. 다만 한 가지 주의할 점은 이 모든 것들이 가만히 앉아 있기만 하면 저절로 얻어지는 것이 아니라는 점입니다. 외국학생들에게 본인이 먼저 다가가고 먼저 베풀고 먼저 도전을 해야만 값진 성과들이 뒤따라 올 것입니다."
