gen_info,env_info,food_info,study_info,office_info,facil_info,mhct_info,help_info,etc_info
"NAU는 애리조나주의 Flagstaff에 위치하고 있습니다. 해발고도 2125m로 매우 높은 지형이고, 드넓은 소나무 숲이 펼쳐져 있는 관광 휴양지입니다. 날씨는 여름에는 온도가 매우 높지만 우리나라 여름과는 다르게 습기가 없고 건조한 기후라 활동하기 좋은 날씨입니다. 하지만 햇빛이 강렬해 선글라스는 필수죠!! 겨울은 우리나라의 겨울만큼은 아니지만 두꺼운 외투와 목도리, 장갑이 필요할 정도로 춥고 눈이 매우 많이 옵니다!! 하지만 겨울에도 낮에는 햇빛이 강렬하고 날씨가 맑아 두꺼운 외투 없이 가볍게 입고 활동할 수 있습니다. 일교차가 매우 크다고 생각하면 됩니다. 눈이 쌓여 휴강이 된 적도 있다고 합니다. 학교는 연세대학교의 2~3배? 된다고 생각하시면 되고, 학생들의 편의를 위해 캠퍼스 안에 셔틀버스가 다닙니다. 하지만 주요 건물은 중앙에 모여 있어 캠퍼스의 크기에 따른 불편은 없을 것으로 예상됩니다.","Flagstaff는 작은 도시입니다. 학교를 중심으로 10분 거리에 대형 마트인 target이 있고(이마트, 월마트쯤이라고 생각하면 됩니다) 다운타운이 있습니다. target에서 필요한 물품은 거의 다 구할 수 있고 다운타운은 pub들과 음식점, 옷가게, 초콜렛 가게 등 여러 가게가 모여 있지만 신촌 같은 번화가의 느낌은 아닙니다. 하지만 다운타운에서 축제 같은 것들도 열리니 잘 알아보고 참여하시면 좋겠습니다. Flagstaff에 사는 사람들은 거의 다 친절합니다. 학교에서도 인종차별 같은 것은 없다고 느꼈고 백인이 더 많지만 교환학생을 온 아시아인들도 많고 인디언들도 있습니다(나바호족이라 하여 정착하여 살았던 인디언들-하지만 문명화가 덜 되었다거나 이런 상상은 버리시길, 그냥 똑같은 학생이나 시민이라고 보면 됩니다) 
 한국인 유학생 비율은 적어요.(10:1?) 우리학교에서는 제가 최초로 갔다 왔구요(혼자서..) 하지만 거기에서 이화여대와 숭실대에서 온 친구 두 명을 만났습니다. 거기는 서울여대가 많이 파견되었더군요. 열 명쯤? 하지만 미리 시간표를 같이 짜지 않는 이상 수업에서 한국인을 마주칠 일이 거의 없습니다.(하지만 코리안 클럽이라고 하여 외국인들에게 한국어를 가르쳐주는 동아리가 있는데 그곳에서 한국인들을 만날 수 있고 외국 친구들도 사귈 수 있으니 걱정마세요) 
 교환학생이 끝나고 미국의 동서부를 여행하며 느꼈던 것은 flagstaff가 정말 친절하고 깨끗하고 안전한 도시라는 것입니다! 물론 밤늦은 시간에 돌아다니는 것은 한국이라도 위험하니 미국에서도 주의하세요. 하지만 거리에 노숙자들이나 무서운 사람들도 없고, 그 곳 대부분의 사람들은 말을 걸기 좋아하고 상냥하며 친절합니다.
 다운타운과 반대 방향으로도 다양한 가게들과 물건을 파는 곳들이 있으니 이 곳 저 곳 친구들과 많이 돌아다녀 보시기 바랍니다. 식료품을 싸게 파는 곳도 있고 세컨드핸드 샵도 있으니 돈을 많이 절약 할 수 있습니다.(위치는 그 곳 친구들에게 물어보면 잘 알려 줄 겁니다) 버스를 이용하여 삼사십분 떨어진 곳에 있는 대형 쇼핑몰에 갈 수 있습니다. 옷들과 신발들이 필요하다면 그곳을 이용해도 됩니다. 아 그보다 더 가까운 거리에 있는 마트도 있는데 그 주변에 은행과 핸드폰을 개통하는 곳도 있습니다. 버스의 배차간격과 차가 끊기는 시간을 잘 알아 보세요. 차가 끊기면 그 거리를 자가용이 없는 이상 걸어서 와야 합니다.(불가능하니 차 끊기는 시간을 잘 알아서 그러한 불상사가 없도록 합니다) 
 플래그스태프는 작은 도시이지만, 살기 좋고 깨끗하고 자연 경관도 좋습니다. 특히 하늘이 매우 가깝게 느껴지죠! 주변에 그랜드캐니언도 차로 세 네 시간 거리면 갈 수 있고, Sedona라는 곳도(그랜드캐니언만큼 유명한 관광지) 차로 두 세 시간에 갈 수 있으니, 차가 있는 친구와 친해진다면 같이 놀러갔다 오시기 바랍니다. 정말 황홀한 광경이 펼쳐지는 곳들입니다.","저는 ISEP프로그램을 통해서 갔기 때문에 국제 기숙사에서 머물며 밀플랜을 지급받았습니다.(우리학교에 기숙사비와 식비를 내면 됩니다) 밀플랜으로 학내 식당-뷔페를 비롯하여 타이푸드, 멕시칸 음식, 피자 등-을 자유롭게 이용할 수 있고 그 안에 있는 스타벅스와 잠바쥬스도 사용 할 수 있습니다. 매일 아침을 드시는 것이 아니라면 밀플랜으로 충분히 넉넉하게 모든 것을 이용하며 풍족하게 생활할 수 있습니다. 외식을 하지 않는이상 식비는 따로 더 들일이 없습니다. 국제 기숙사는 지은 지 얼마 되지 않아 시설도 좋고 RA들도 관리를 잘하여 조용하고 쾌적한 기숙사를 이용할 수 있습니다. 뿐만 아니라, 기숙사 안에서 각종 행사나 파티들도 진행하여 세계 각지에서 온 교환학생들을 만날 수 있습니다. 기숙사 안에는 빨래하는 곳, 티비 보는 곳, 운동하는 곳, 공공 부엌 등이 있습니다.","시간표를 혼자 짜고 나면 수강신청을 하기 전에 교환학생의 시간표를 도와주는 사람에게서 연락이 옵니다. 그리고 그 사람이 다른 수업을 추천해주기도 하고 이 것 저 것 설명해주니 궁금한 것들을 물어보세요. 운동할 수 있는 수업들도 매우 잘 되어 있으니 알아보시고 참고하시기 바랍니다. 건물이 매우 좋아요!!! (물론 무료 운동 수업들도 있으니 시간표를 보고 가서 자유롭게 참여하면 됩니다.) 교수님들도 매우 친절하시고 교환학생들을 도와주려고 하시니 필요한 부분들은 질문하고 도와달라고 요청하면 됩니다.
 도서관도 편안한 분위기로 매우 좋습니다. 공부를 하면서 먹을 수도 있고 프린트도 할 수 있습니다. 컴퓨터를 사용할 수 있고 노트북도 빌릴 수 있어요. 궁금한 것이 있으면 도서관 가운데에 있는 데스크에 물어보면 친절하게 설명해줍니다.","처음 오리엔테이션 시간에 설명을 듣겠지만, 교환학생이 수업이 어렵다고 느껴질 때 도와주는 교실도 있고 글쓰기 교실 같은 것들도 있었습니다. 또 주로 어려운 점들은 교환학생 담당하시는 분께 얘기하면 친절하고 빠르게 도와줍니다.(교환학생 배정이 되면 그 분들에게서 메일로 연락이 올 겁니다.)","앞서도 언급했지만, 코리안 클럽을 강력하게 추천합니다. 한국인 유학생들과 교환학생들이 주축이 되어서 한국어를 배우고 싶어 하는 외국 학생들을 가르치는 것입니다. 그 곳에서 중국, 일본인들을 비롯하여 한국에 관심이 있는 미국인들도 많이 만날 수 있습니다. 유창하게 한국어를 할 줄 아는 미국인들도 있었어요! (우리 학교에 교환학생을 왔었던 사람도 만났죠) 그 클럽에서 같이 어울리고 정말 친하게 지낸 좋은 미국 친구들을 많이 만날 수 있었어요. 
 또 학기 초에 동아리 박람회를 해서 50개??가 넘는 동아리들에 대한 정보를 얻을 수 있는 기회가 있으니 꼭 참여해서 마음에 드는 동아리에 가입하시기 바랍니다. 그리고 체육관이 정말 좋으니 잘 알아보고 무료 운동을 즐기세요!!","컬쳐쇼크는 딱히 없었고, 그 곳 사람들이 매우 친절했다는 점을 들 수 있습니다. 그리고 처음 보는 사람에게도 함박웃음을 지어주며 하이라고 인사를 건네는 모습은 정말 우리나라에 도입하고 싶은 문화였습니다. 엘리베이터를 기다려주거나 문을 열고 나갈 때 사람들을 꼭 배려해주세요!! 그 곳 사람들은 저 멀리 오는 사람을 보고도 문을 잡고 한참을 기다려줘서 정말 감동이었어요.",앞서 얘기했듯이 NAU에 파견이 결정되면 그 곳 담당자로부터 연락이 오는데 모든 문제들은 그 분들을 통해서 이야기 하면 됩니다. 문제를 이야기하면 필요한 부처에 연락도 해주고 메일도 보내줍니다. 또 그 밖의 도움은 우리학교 국제처를 이용하시면 될 것 같습니다.,"혹시 교회에 다니시는 분이라면, 학교와 멀지 않은 곳에 교회가 있으니 다니시길 권합니다. 한인 교회도 있지만 미국 교회에 가보는 것도 좋은 것 같습니다. 신앙 활동과 더불어, 사람들이 정말 정말 친절하고 무엇이든 도와주려 하며 친구를 사귀기 좋습니다. 성경공부와 게임을 같이하며 영어로 이야기 할 수 있는 기회도 많고 다양한 활동을 할 수 있으니 교회에 다니시는 분은 꼭!!! 가시기 바랍니다.

그리고 궁금한 것이 있으신 분은 leeahj@gmail.com으로 메일주시면,
언제든 친절히 답해 드리겠습니다. 저도 처음에 정보가 하나도 없어서
찾아보느라 정말 고생했거든요.. 혹은 구글에 서울여대 NAU 파견후기 이런 식으로 검색해도 나올 거에요. NAU에서의 교환학생은 정말 황홀한 경험이었습니다. 건강하게 잘 다녀오세요 ^^ 그리고 꼭!!! 메일 주세요 저도 많이 그 곳이 그립네요 ㅋㅋ"
