gen_info,env_info,food_info,study_info,office_info,facil_info,mhct_info,help_info,etc_info
"디킨슨 컬리지는 Liberal Arts College로서 인문학을 비롯한 기초 학문 교육에 집중하는 소규모의 학교입니다. 펜실베니아주의 주도인 해리스버그, 그중에서도 칼라일에 위치해 있으며, 제가 머물렀던 가을 학기에는 크게 덥거나 춥지 않은 무난한 날씨가 지속되었던 기억이 납니다. 학교의 크기가 작은만큼 제가 파견된 학기에는 연세대학교에서 저 혼자 디킨슨에 가게 되었지만, 교환학생이 아닌 한국 학생들은 있으므로 생활에 어려움이 있거나 교류가 필요하다면 그분들을 찾아 만나보는 것도 좋으리라 생각합니다. 디킨슨을 선택한 데에는 항목에서 언급하고 있는 대학의 크기(소규모의 정원으로 기초적인 학문을 배워보고 싶었던 것), 지리적 위치(일단 해리스버그까지 차를 탈 수 있다면 뉴욕에 비교적 접근성이 좋으니까요) 모두가 중요한 역할을 했는데 정작 주말 등의 여유 시간을 이용해 뉴욕에 놀러가거나 한 적은 학기가 끝나기 전까지는 없었습니다. 그렇지만 본인이 주말에 충분한 여유를 낼 수 있고 직접 운전을 하거나 차편을 제공할 주변인이 있다면 학기 동안 틈틈이 여행을 하는 것도 가능하리라 생각합니다.","칼라일은 캠퍼스를 중심으로 주택가가 있는 작은 마을(시골은 아니지만 아주 도시의 번화가도 아닌) 느낌이라 전반적으로 안전하고 평온한 환경이라고 느꼈습니다. 학기 중에 한 번 총탄이 발사된 소리가 들렸다며 사건을 조사 중이니 주의하라는 메일을 학교 측에서 받은 적 있지만, 사건이 잘 마무리되었으며 그 외에 크게 사고나 사건이 있던 적은 없었던 것으로 기억합니다. 또한 한국의 대학과는 다르게 대학에서 자체적으로 운용하는 경찰/경비 팀이 있어서(디킨슨만 그런 것인지 미국 대학 전반이 그런지는 모르겠지만요) 크게 걱정할 일은 없을 것이라고 생각합니다.","송도나 신촌에서처럼 한 건물 전체를 기숙사로 사용하는 한국과는 다르게 디킨슨에서는 캠퍼스 주변에 일반 주택처럼 보이는 작은 하우스들이 여러 개 배치되어 있었습니다. 저는 여러 다른 나라에서 온 다른 교환학생 친구들과 함께 I house 라고 불리는 International House에서 지냈습니다. I house에 사는 모든 학생들이 교환학생인 것은 아니었고, 제 룸메이트는 디킨슨을 본교로 재학 중인 친구였습니다. 식사권은 이전의 파견 학생 분들이 설명해주신 것처럼 any20, flex 등이 있습니다. 저는 flex를 신청했으나, 퍽퍽한 고기 위주의 식단이 잘 맞지 않아 학기가 지날수록 학생 식당을 잘 가지 않게 되어서 학기말에 포인트가 많이 남아 후회했던 기억이 납니다. 저처럼 학기말이 되어서 포인트를 소진하지 못하는 일이 없도록 본인의 식사 패턴에 알맞은 식권을 선택하시길 바랍니다. 저는 학생식당을 덜 가는 대신 식사는 주로 학교 주변의 식당들, Issei Noodle(일본 및 태국을 비롯한 아시아 면요리들을 파는 곳)에서 먹거나 그 맞은편 피자 가게에서 피자를 포장해와 먹거나 했었습니다. 학생식당 중 초밥을 파는 곳이 있어서 그곳에서 초밥을 사먹기도 했습니다.","저는 앞서 언급했듯 Liberal Arts College라는 디킨슨의 학문적 환경에 매력을 느꼈고, 그래서 전공 관련 수업을 듣기보다는 평소 관심이 있었던 다양한 인문학 및 사회과학 수업을 듣기로 결정하였습니다. 저는 anthropology for 21st century(문화인류학), introduction to literature studies, monsters and madness: secret lives in Victorian literature(영문학), feminist perspective and theories(여성학) 이렇게 총 네 개의 수업을 들었습니다. anthropology for 21st century: 다른 수업들에 비해 널널한 편이어서 그런지 한국 대학교의 교양/입문 강의 같은 느낌이었습니다. 간단한 퀴즈와 조를 짜서 하는 간단한 발표가 있고, 수업에서는 인류학 입문 교재를 사용하는 한편 교수님이 지정한 두 권 정도의 논픽션 서적을 읽어야 합니다. 개인적으로 경제/사회적 구조로 인하여 부모로부터의 독립과 관련해 달라진 양상을 보이게 되는 세계 청년들의 이야기를 다룬 Accordian Family라는 텍스트가 저 그리고 동시대 한국 젊은이들과의 연관성 속에서 무엇보다도 흥미롭게 느껴졌습니다. 하지만 수업 자체는 아무래도 루즈한 편이라 인류학을 보다 심도있게 공부하길 희망하는 분께는 추천하지 않을 것 같습니다.introduction to literature studies: 수업 이름이 드러내듯 문학의 기초적인 개념들과 이론들을 배웁니다. 그러나 이 수업은 기존의 문학개론 수업들과 달리 그러한 개념과 이론을 공부하기 위한 텍스트로 백인, 남성 위주의 고전들이 아닌 유색인종/여성들의 문학을 채택하고 있고 그 점이 마음에 들었습니다. 물론 소설과 시를 영어 원문으로 읽으며 수업 진도를 따라잡는 것은 힘든 일이었지만, 한국에서는 홀로 접하기 어려웠을 의미있는 문학 작품들을 읽고 또 그에 적용할 수 있는 관점이 되는 문학 이론들을 배울 수 있어 즐거웠습니다. 또한 영문학 수업이기 때문에 교수님이 글쓰기를 직접적으로 지도해주시는데, 평소 무계획적으로 글을 쓰던 저에게는 수업 그리고 학교 writing center에서 가르쳐주는 체계적인 방법론이 신선하고 도움이 되었습니다(글쓰기를 하나의 기술로서 접근하는 관점을 얻었다고 느낍니다.) monsters and madness: secret lives in Victorian literature: 역시 영문학 수업이지만, 앞의 개론 수업과는 달리 일종의 테마가 있는 수업입니다. 바스커빌 가의 개, 지킬 박사와 하이드 등 빅토리아 시대의 문학 중에서도 ‘괴물’ 혹은 괴이한 현상/사물이 등장하는 문학 작품들을 읽는 수업입니다. 아무래도 한국인 학생으로서 빅토리아 시대라는 역사적 배경에 대해 무지하고 낯설음을 느끼긴 했지만, 하나의 테마를 가지고 여러 가지의 문학 작품들을 연속적으로 읽는 경험을 해볼 수 있었다는 점이 좋았습니다. 물론 수업에서는 빅토리아 시대의 문학이기에 볼 수 있는 특징들을 이론적으로 분석하고 학습하지만, 장르 문학의 시초라고 볼 수 있는 문학 작품들을 직접 원문으로 접하고 즐기는 경험을 할 수 있었다는 것이 저에게는 큰 재미였습니다. 아무래도 영어가 제1언어도 아니고 영어 텍스트에 대한 접근성이 낮은 삶을 살아왔기 때문에, 영문학 수업을 두 가지나 들으며 생에 가장 많은 영어 텍스트를 읽었던 것이 하나의 언어적 기억 내지 체험으로 남은 것 같습니다(수업 내용과는 별개로요)feminist perspective and theories: 연세대학교에서 페미니즘 강의를 수강하면서 페미니즘의 원류가 되는 이론들의 역사를 배우고 싶다는 생각을 갖게 되었습니다. 훌륭한 수업들이었지만, 이론을 위주로 현대 사회에서의 젠더 불평등 그리고 페미니즘적 쟁점들을 직접적으로 다루는 수업들이었기 때문에 이론들을 더 배워보고 싶었고, 그래서 여성학 코스가 개설되어 있는 디킨슨의 장점을 이용하여 페미니즘 이론 수업을 신청했습니다.  수업은 Feminist Theory (Kolmar 외)라는 텍스트북을 가지고 진행되며, 페미니즘 담론의 역사에서 중요한 의미를 갖는 이론가들의 발췌 텍스트들을 미리 읽어간 다음 그 텍스트에서 중요하게 다루는 쟁점, 던지고 있는 질문이 무엇인지를 함께 공부합니다. 미국 대학의 수업이라는 점을 감안하더라도, 다른 수업에 비해서도 더 적극적인 참여를 교수님이 요구하시고, 강의도 일방적으로 전달되기보다는 함께 만들어간다는 느낌입니다. 페미니즘 이론의 역사와 계보를 배우는 수업답게, 기말 과제로 이론들이 사용하는 용어나 관점, 주요 쟁점들을 구조적으로 정리하는 맵과 그 논리적 구조를 설명하는 레포트를 제출해야 했었는데 여러모로 기억에 남는 의미있는 과제였습니다.도서관은 조용히 공부하는 공간, 학생들이 모여 조별과제를 위해 혹은 여가시간에 이야기하는 공간, 컴퓨터와 프린터를 사용하는 공간, writing center 등으로 이루어져 있습니다. 학교가 소규모인만큼 도서관 자체가 아주 거대한 느낌은 아니었지만, 그럼에도 장서량이나 자료가 부족하다는 느낌은 들지 않았습니다. 또한 건물의 내부/외부가 하나의 건축 예술 작품으로 느껴질 만큼 아름답습니다. 저는 주로 writing center를 이용하기 위해 도서관에 갔는데, 글쓰기의 기술적 과정(드래프트-초고-고쳐쓰기 등)을 진행하는 데 있어 튜터 학생분들의 도움을 많이 받았습니다. 수업에서도 교수님들이 writing center 이용을 추천하거나 권하시겠지만, 교수님들이 권하시는 것 이상으로 센터를 적극적으로 이용하기를 추천드립니다. 또한 여느 도서관이 그렇듯 필요한 정보나 자료를 찾아보는 데에 전문 사서들의 도움을 얻을 수 있으니 정보 검색에 있어서는 사서 선생님의 도움을 받아보는 것도 추천드립니다.","혹 비자 및 여권 관련 문제를 겪게 된다면(여권 분실 등) 국제교육부에 문의하시면 됩니다. 특별한 문제가 없더라도 국제교육부에서 오리엔테이션 기간, 그리고 학기 중간중간 처리해야 하는 서류들(교환학생과 경제활동을 병행해서는 안된다는 안내를 받고 갔기 때문에 대부분의 한국 학생들은 그에 해당하지 않으리라 생각하지만, 납세 및 SSN 관련 서류들을 중간중간 처리하게 됩니다)에 대해 메일로 안내해주기 때문에 제때 메일을 체크하고 서류를 제출해주시면 됩니다. 또한 교환학생을 포함한 외국인 학생들을 위해 애써주시는 분들이기에 개인적인 고민이나 문제가 있을 때 메일 등을 통해 질문하거나 조언을 구하면 도움을 주실 것입니다.","저는 동아리 박람회(와 비슷한 행사)가 있는 날에 심한 알레르기로 인해 병원을 오가느라 해당 행사에 참석하지 못했기 때문에 동아리에 대한 정보가 별로 없기도 했고, 한 학기 다니는데 동아리에 가입할 수 있을까/해야 할까 하는 생각에 동아리에는 가입하지 않았습니다만 지금 생각하면 동아리에 가입하여 다른 외국인 친구들과의 접점을 늘리는 것도 친구를 만드는 데 좋은 방법이라고 생각합니다. 꼭 동아리에 가입할 생각이 아니더라도 동아리 박람회 정도는 살펴보는 것을 추천합니다.학교의 부대 시설로는 체육관이 있는데 헬스 트레이닝 프로그램에 등록하거나 개인 운동을 할 수 있습니다. 수영장이 있는 체육관이기 때문에 수영을 등록할 수도 있습니다. 시설이 무척 좋으므로 머무르시는 동안 적극적으로 이용하면 좋을 것입니다.그리고 우편을 찾으러 가는 HUB가 있는 건물 지하에는 devil’s den이라는 구내 매점(편의점)과 서점이 있습니다. 월마트나 다른 편의시설은 도보로 15-20분 정도 걸렸기 때문에 차가 없는 한 자잘한 간식이나 소모품들은 이곳에서 자주 사게 됩니다.",미국 혹은 서양권 학생들의 문화가 한국의 청년/대학생들의 문화에 비해 크게 충격적이거나 다르다고 느낄 일은 그다지 없었습니다.,"일단 저는 디킨슨에 머무르는 동안 3-4번 정도 이유 모를 심한 알레르기를 겪었기 때문에, 병원에 급하게 혹은 그냥 갈 일이 생긴다면 학교에서 안내하는 DPS medical van을 이용하기를 추천드립니다. 아무래도 미국에서 병원을 간다는 것이 부담스럽기는 하지만, 학교 차원에서 보험이 가입되어 있기 때문에 그렇게 큰 비용을 부담하게 되는 일은 생각보다 없었습니다. 생활 관련해서 도움 받을 수 있는 곳은 가장 기본적으로는 교환학생들을 담당하는 현지 국제처 교직원들, 그리고 교수님들이라고 생각합니다. 특히 교수와 학생 간의 관계가 한국에서와는 달리 대체로 경직되기보다는 친근한 경우가 많아서, 저는 학기 말에 개인적으로 힘든 일이 있을 때 교수님들과 상담하고 논의함으로써 도움을 많이 받았습니다(과제나 성적에 있어서는 엄격하시지만요). 학교 오티 기간에 프로그램에서 일본인 교수님을 소개받긴 했지만(연결할 수 있는 한국인 교수님이 안 계셔서 그랬던 것 같습니다. 이전 어떤 후기에서는 한국인 교수님이 계셔서 찾아가보아도 좋을 거라고 조언해주신 걸 보면 한국인인 교수님이 아예 없지는 않을 것 같습니다) 꼭 같은 아시안 교수님을 찾아갈 필요 없이 수업을 가르치시는 교수님들로부터도 많은 도움을 받을 수 있었습니다. 그리고 병원 이용과는 별도로 학교에 상담 센터가 존재하기 때문에, 아무래도 언어의 벽이 존재하기는 하지만 타지에서 홀로 외로움이나 우울함을 겪게 된다면 센터를 찾아가 보는 것도 추천합니다.","언어의 장벽이 있더라도 그를 의식하여 주눅들지 말고, 다른 학생들과의 다양한 접점을 찾아 최대한 ""적극적으로"" 어울리고 생활하다 보면 교환학생 생활에서의 좋은 기억을 많이 남길 수 있을 것이라 생각합니다."
