gen_info,env_info,food_info,study_info,office_info,facil_info,mhct_info,help_info,etc_info
"산호세 대학교는 한적하고 평화로운 캘리포니아에 위치하고 있습니다. 샌프란시스코에서는 차로 1시간, 엘에이에서는 차로 5시간 정도 걸리는 곳입니다. 차로 한시간 거리에는 스탠포드 대학교, 버클리 대학교, 구글과 페이스북 본사(일명 실리콘 밸리), 해변들(산타크루즈, 카멜, 몬트레이) 등 많은 놀거리가 있습니다. 유명 와이너리 나파밸리나 17mile drive course 또한 산호세에서 꼭 가보아야할 곳으로 꽤나 가까이에 위치하여 있습니다. 5시간을 운전하여가면 Lake Tahoe나 Yosemite National park에도 갈 수 있습니다. 하지만 모든 주요 놀거리는 차를 이용해야만 편히 갈 수 있다는 것이 단점입니다. 주요 도시인 샌프란시스코만 보더라도 차로 간다면 한시간 내로 갈 수 있지만, 대중교통을 이용하게 된다면 두시간 정도가 필요합니다. 때문에 운전면허를 따서 가시는 것을 적극 추천합니다
산호세의 날씨는 대부분의 캘리포니아 날씨가 그러하듯 사계절 내내 따뜻한 기후입니다. 여름에는 기온이 높긴 하지만 날씨가 건조해 그늘로 들어가거나 바람이 불면 선선하고, 겨울은 약간 쌀쌀한 날씨입니다. 바람이 세게 부는 샌프란시스코나 무더운 엘에이와 비교해 보았을 때, 산호세의 날씨는 완벽하다고 할 수 있습니다.
산호세 대학교는 정사각형으로 크지 않습니다. 쉬는 시간 내에 다음 수업으로 이동할 수 있어 동선을 고려하지 않으셔도 됩니다. 연세대학교와 다르게 평지에 위치하여 있어, 학생들은 자전거나 킥 보드 또는 스케이트보드를 많이 이용하는 편입니다.","산호세 다운타운은 캠퍼스에서 15분내에 위치하여 있습니다. 다운타운에는 커피숍, 식료품점, 식당, 술집이나 클럽, 박물관 등이 있습니다. 다운타운은 크지 않아 모두 걸어다닐 수 있습니다. 박물관 중 테크 뮤지엄은 산호세에서 유명하다고하나, 저는 가보지 못했습니다. 라이트레일이나 버스를 이용하면 산호세에 있는 많은 쇼핑물을 이용할 수 있습니다. 그 중 그레이트몰이나 발리페어, 이스트리지 몰이 유명합니다. 
산호세는 치안이 다른 지역에 비해 좋습니다. 하지만 가끔 강도사건이나, 총기사건이 발생하기 때문에 밤 늦게 다니는 것을 
추천하지는 않습니다. 혹시나 밤에 외출하시려면 많은 친구들과 함께 하는 것이 좋습니다. 
산호세는 살기좋은 곳이지 놀기 좋은 곳이 아닙니다. 도시에 사는 것을 좋아하시는 분들에게는 추천해드리고 싶지 않습니다.","산호세 캠퍼스 기숙사에는 크게 캠퍼스 내에 campus village와 캠퍼스 밖에 ihouse로 나누어지는 것으로 알고 있습니다. 저는 Ihouse에 일년 동안 살았습니다. Ihouse는 국제학생들 70명 정도가 모여 사는 조그마한 기숙사입니다. 대부분의 학생들이 자기소개서를 써서 지원하는 만큼 모두가 친절하여 친구를 쉽게 사귈 수 있습니다. 아이하우스에는 여러가지 이벤트도 있어서 한 학기를 즐겁게 보낼 수 있고, 친구들과 친해질 수 있습니다. 방은 대부분이 2인 1실이며 가끔 3인 1실이나 1인 1실도 있습니다. 친구들을 사귀고, 영어를 늘리기 위해서는 1인 1실은 추천드리고 싶지 않습니다. 룸메는 Leann이라는 아이하우스의 총책임자에 의해 결정되게 됩니다. Leann은 모든 지원서를 읽어보고 룸메를 매칭시켜주는데, 대부분이 그에 만족하며 지냅니다. 하지만 만일 특별한 요구사항이 있다면 지원서에 쓰는 것도 괜찮습니다. 아이하우스의 인터넷은 한국의 인터넷과 차이가 없을 정도로 빠른 편입니다. 하지만 큰 용량의 파일의 업로드나 다운로드는 금지되어 있습니다. 이전에는 video skype 역시 금지되어 있었으나, 이제는 video skype도 가능합니다. 
아이하우스에 살기 위해서는 5day나 7day meal plan을 구입하여야 합니다. 5day meal plan과 아이하우스 기숙사 가격을 합쳐 한학기에 $5,800정도로 꽤나 비싼 편에 속합니다. 하지만 이 meal plan을 이용한다면 아침, 점심, 저녁 상관없이 언제나 Dining commons(이하 DC)에서 부폐 형식으로 식사를 할 수 있습니다. DC에는 간단한 빵종류부터, 햄버거, 피자, 중국음식, 멕시코음식, 롤, 수프, 커피, 잠바쥬스(=스무디킹과 비슷합니다) 등이 준비되어 있습니다. DC에 들어가면 이 모든 것들은 무료로 제공되어 원하는 것을 골라 먹을 수 있습니다. 하지만 우리나라 음식에 비해 기름진 것들 것 많아, 질릴 경우가 종종 있습니다. 때문에 7day meal plan보다는 5day meal plan을 추천 드립니다.","저는 첫학기때는 14학점, 두번째 학기때는 18학점을 수강하였습니다. 
1. Public Speaking(non native)&#8211; Elizabeth Harris + Seminar
Speaking을 연습하는 수업으로 발표가 대부분입니다. 학기 중 5번의 speaking을 해야 하고 보고서도 있습니다. 수업과 과제는 조금 힘들지만 친구를 사귀고 영어를 늘리기에는 좋다고 생각됩니다. 저는 non native 수업을 택해서 들었지만, 사실 3명정도를 제외하고는 모두가 native speaker여서 당황했던 기억이 있습니다. 차라리 native speaker 수업을 듣는 것이 더 도움이 될 것이라 생각됩니다. 
2. International Economics-Warren Gibson
국제 경제학을 배우는 수업입니다. 거의 모든 것이 칠판 위주와 교제로 이루어집니다. 일주일에 한번씩 퀴즈가 있고, 시험도 세 번이 있었던 것으로 기억됩니다. 하지만 교수님의 발음이 미국식이며 정확해서 타 수업에 비해 알아듣기 쉬웠습니다. 
3. Economic Development-Mark Brady
개발경제학을 배우는 수업으로 흥미로운 내용들이 많습니다. 매 수업에 퀴즈가 있으며 교재를 항상 읽어가야하는 수업입니다. 교재와 교수님의 강의가 중요한 편인데, 교수님이 말이 빠르고, 영국식 영어인지라 알아듣기 힘들어 수업을 녹음했던 기억이 있습니다. 시험은 대부분 퀴즈에서 나왔습니다.
4. Labor Economics-Husein Aytug
터키에서 온 교수님의 수업이었습니다. 시험은 두 번이고 보고서가 한번 있었습니다. 수업 내용은 쉬운 편이었고 교수님의 영어도 알아듣기 쉬운 편이었습니다만 크게 도움 되던 수업은 아니었습니다.
5. Self Defense-Gong Chen
호신술 수업이었고 대부분 여자 학생들이 많이 수강했습니다. 실기 시험은 세 번 정도였고, 필기 시험도 두 번 있었습니다. 친구를 사귀기에 좋고, 교수님이 활기차신 분이어서 수업에 갔다 오면 기분이 좋아졌던 기억이 있습니다. 
6. Intro to Advertisement-Robert Nelson
Advertisement department에 있던 과목으로 교양차 수강한 과목입니다. 교수님의 발음을 알아듣기 쉽고 모든 것이 파워포인트로 진행되었지만 강의가 조금 지루한 부분이 있습니다. 시험은 두번, 과제는 세번이 있었습니다. Advertisement에 대한 기본 지식들을 얻을 수 있었던 강의였습니다.
7. International Marketing- Sak Onkvisit
동양계 교수님의 강의하시는 국제 마케팅 수업이었습니다. 마케팅 과목을 배운 적이 없었지만 수업 내용을 이해하는데 큰 무리가 없었습니다. 다만 교수님의 말씀이 알아듣기 어렵고, 수업이 지루하다는 것이 단점입니다. 시험은 대부분 교수님의 강의에서 나와 교수님의 모든 말씀을 받아 적는 것이 좋습니다. 대부분의 마케팅 수업과는 다르게 조모임이 없었습니다.
8. Industrial Organization-Matt Holian
한국에 산업 조직론에 해당하는 과목으로, 젊은 교수님이 가르치는 과목입니다. 대부분 게임이론과 시장의 진입 장벽, 산업 구조에 대하여 배웁니다. 매 수업마다 예습하는 편이 도움이 되며, 토론을 좋아하시는 교수님입니다. 또한 질문에도 친절하게 답해주십니다. 시험은 두번이고, 두번의 퀴즈, provocative라는 lecture 한번 참석, problem set 다섯번 또한 supplement reading을 읽고 세번을 요약해야 합니다. 숙제가 많은 편에 속하는 수업이었지만 도움이 되었다고 생각합니다.
9. Topics in corporate Finance-Ninh nguyen
꽤나 어려움을 겪었던 수업입니다. 이 수업은 선수과목 Econ 137A를 꼭 수강한 뒤 듣기를 추천드립니다. 교수님은 친절하고 모든 것을 쉽게 설명해주시려고 노력하나, 저는 선수과목을 수강하지 않은채 수업을 들어 힘들었습니다. 시험은 네번으로 구성되고 다른 숙제나 조모임은 없습니다.
10. Money and Banking-Dr. Hummel
두학기를 합쳐 가장 어려웠던 수업입니다. 학부 수업이나 거의 대부분의 학생들이 대학원생이거나 senior입니다. 수업 내용 또한 방대하고 교수님이 말이 monotone이며 빠른 편에 속해 알아듣기가 굉장히 힘들었습니다. 다른 숙제는 내주시지 않으나 매 수업 시간마다 퀴즈를 보아 매주 방대한 분량의 책을 읽어야 했습니다. 다른 Economics 수업이 30명 내외에서 진행 된다면 이 수업은 50명 정도가 수강하였습니다. 교수님은 친절하여 질문에 답변을 잘해주시고, 토론 또한 좋아하시는 편입니다. 
11. Regional Economics-Mike Pogodzinski
노교수님이 진행하시는 수업으로 지역 경제학에 대해 배우던 수업입니다. 지역 경제 분석에 필요한 도구들을 배우고 직접 지역 분석을 해보는 수업입니다. 내용은 꽤나 흥미롭고 시험도 쉬운 편에 속합니다.","국제교육부는 Clark Hall 5층에 위치하여 있고, 대부분 빠르고 친절하게 답변해줍니다. 수강신청에 문제가 생겼을 때나 학교 생활에 문제가 있을 때 찾아가면 가장 발빠르게 해결해줍니다.","학교에는 많은 동아리가 있으나 대부분이 Fraternity으로 친목도모 형식으로 짧게 6개월, 1년 동안 머무를 학생들에게는 가입이 어려운 것으로 알고 있습니다. 경제학부에는 Economics club이 있는데, 주로 모여 강의나 세미나를 듣는 것으로 알고 있지만 직접 참가하지는 않습니다. 
학교에는 Gym과 야외 수영장이 있는데, 교환학생들에게도 무료이므로 많이 이용하는 것이 좋습니다. 또한 Health Center도 있어 아플 때 그곳으로 가면 됩니다. 교환학생들은 무료로 진료를 받을 수 있으나 약값은 health center 내의 약국이나 학교 밖 약국에 지불해야 합니다. Bookstore도 학교 내에 있어 textbook이나 대부분의 문구류는 그곳에서 살 수 있습니다",컬쳐 쇼크는 크게 없었습니다. 한국도 미국의 영향을 받아 대부분의 것들이 익숙했던 것 같습니다. 처음 미국에 도착해 가장 놀라웠던 점은 미국인들의 친절함이었습니다. 처음 보는 사이임에도 친절한 모습에 조금은 당황스러웠습니다.,"교내외로는 한인 교회가 있습니다. 산호세에는 많은 한인 교회가 있으므로, 알아보시고 다니는 것이 좋을 것 같습니다. 저는 두 번째 학기부터 교회를 다니기 시작했는데, 많은 분들이 친절하게 도와주셨습니다.","저는 영어에 자신이 없고 수줍음이 많아 첫번째 학기에는 친구들을 소극적으로 대했습니다. 두번째 학기에는 훨씬 더 나아졌지만, 아직도 후회가 많이 남습니다. 후회를 남기지 않기 위해서는 적극적으로 친구를 사귀고 모든 것을 즐기고, 도전하고 오시길 바랍니다 :)"
