gen_info,env_info,food_info,study_info,office_info,facil_info,mhct_info,help_info,etc_info
"지리적 위치로는 미국 중부에 있는 Missouri주의 중간정도에 있는 Maryville에 위치하고 있습니다. 미주리 주의 유명한 도시로는 Kansas city와 St.Louis정도가 있겠군요.(참고로 두 도시에 가기 위해서는 승용차나 그레이하운드 버스를 이용해야 합니다). 이 외에도 많은 도시들이 있지만 미주리 주 자체가 도시냄새가 많이 나지 않는 관계로 뉴욕, 보스턴 등의 도심을 기대하고 이 학교에 지원하시면 후회를 많이 하실거라고 생각됩니다. 물론 시골도시에서의 휴양과 친절한 미국 친구들을 만나고 싶으시면 이 학교 이상의 선택은 없을 것입니다.
학교는 크지 않습니다. 중요건물들은 도보 10분내로 모두 갈 수 있으며, 기숙사 건물이 여러개 있으나 그 거리 또한 매우 가깝습니다. 단지 문제는 학교밖의 시설들을 이용할 때 인데요, 그 거리는 매우 멉니다. 아마 도보로는 월마트를 가거나 외식을 하는 것은 거의 불가능에 가깝다고 보시면 됩니다. 그러나 다수의 학생들이 승용차를 가지고 있기 때문에 차를 얻어타는 것은 어렵지 않으므로 이 점은 걱정하지 않으셔도 됩니다. 
저는 가을학기를 보냈기에 기후는 큰 문제가 되지 않을 것이며, 12월에 귀국하기 때문에 월동준비를 전혀 해 가지 않았지만 이로 인하여 많은 고난을 겪어야만 했습니다. 저는 8월 말부터 있었는데 초반에는 반팔티셔츠를 입었지만 금방 긴팔티셔츠, 11월 초중순부터는 점퍼를 입어야만 했습니다. 여기서는 쇼핑을 하기가 용이하지 않기 때문에 미리 점퍼를 구비해두시는게 좋을 것입니다. 아주 두꺼운 패딩점퍼류가 있어야 11월 말과 12월 초를 버티실 수 있을 것입니다. 정말 춥습니다. 한국에 처음 왔을때 너무 더울 정도였습니다.
부대시설 또는 유흥시설은 매우 적습니다. 저 같은 경우는 미리 다녀온 선배님을 소개받아 미리 이야기를 듣고 갔기 때문에 충격이 없었지만, 상상을 잘 안하고 가신다면 큰 낭패를 겪으시리라 생각됩니다. 가실만한 곳들을 생각나는대로 모두 나열해보면 
마트 : 월마트,하이비
외식 : 버거킹,맥도날드, 서브웨이 샌드위치, 피자헛, 도미노피자, 중국식 레스토랑 2군데, 양식 레스토랑 몇 군데 등등
술집 : 몇 개 산재해 있으나 가보지는 않아서 잘 기억은 없네요. 한국의 클럽보다 아주 작은 클럽 2군데가 있습니다.(걍 술집에 스테이지 만든것)","작은 마을인 관계로 코리안 레스토랑이나 슈퍼는 없구요, 캔사스 시티에 친구의 승용차를 얻어 타고 가게 되시면 오리엔탈 마켓이라는 곳에서 필요한 것들을 사실 수 있습니다. 캔사스시티 Trip은 Maryville에 사는 한국친구들의 낙이라고 할 수 있겠습니다. 
그러나 월마트에 가시면 나름 사발면도 구매하실 수 있고 김치도 팝니다(좀 비싸요). 그리고 모든 잡다한 것들과 미국 핸드폰 등도 사실 수 있기 때문에 월마트에 가시면 뭐 다 할 수 있다고 생각하셔도 됩니다.(즉석식품도 다양해요)
학교 주변은 전형적인 시골의 모습을 하고 있다고 생각하시면 되겠습니다. 옥수수 밭 같은거 있고요, 조금만 가면 소들이 떼를 지어 있는 모습을 심심치 않게 보실 수 있습니다. 전원적인 분위기 좋아하시고 복잡한거 싫어하시는 분들께 제대로 추천드립니다. 편한 마음으로 공부 적당히 하고 한 학기 친구들 만나며 휴양하다가 가기엔 이만한 학교가 없다고 생각합니다.",,"수업은 당연하지만 영어로 이루어집니다. 수업의 난이도가 어떻냐는 것은 교수님마다 그리고 전공 및 수업마다 상이하겠으나, 전반적으로 많이 쉽다고 느끼실 것입니다. 미국의 학교들이 그렇지만 절대평가로 학점이 주어지기 때문에 학점도 후한 편이고, 시험기간에 미친듯이 공부하지 않아도 대부분 A가 나오실 것이라고 생각합니다.(물론 공부하지 말라는 말은 아닙니다. 그러나 공부보다 많은 친구들과 놀고 그들의 언어,문화를 배우면서도 충분히 좋은 학점이 취득 가능하다는거죠~). 영어면접보시고 토플공부 하신 분들이면 충분히 강의스피드도 따라가실 수 있으시리라 생각합니다. 또한 개인적으로 영어 글쓰기 수업을 추천합니다. 기초적인 글쓰기 실력을 다지고 싶으신 분들은 
English Writing 110을 들으시면 됩니다(Introduction to writing)
좀 더 난이도 있는거 들으시고 싶으시면 Writing 111을 들으시면 되구요(아마 Composition일 것입니다)
저는 경제학과였기 때문에 경제학개론, 국제경제학을 들었고
회계원리1, 마케팅을 같이 들었습니다. 교수님들 성함을 원하시면 추후에 밑에 기재된 메일로 보내주세요. 다 괜찮은 교수님들께 들었습니다.
도서관은 단 하나입니다. 크지도 않고 매우 작고, 1층은 중도2층 구조에 좀 시끄럽다고 보시면 되고, 컴퓨터가 많이 있습니다.
2층은 그보다 좀 더 조용하다고 보시면 되고요, 3층에는 한국사람들이 좋아하는 칸막이식 열람식이 많습니다. 
처음가면 도서관 자리가 별로 없는 것 같고, 작아서 걱정들 하시는데 걱정하지 않으셔도 됩니다. 자리 남아돕니다. Final 기간에만 그나마 좀 차는 편이지만 언제 가도 자리는 항상 있기 때문에 자리맡고 하시는 수고를 할 필요가 없습니다.(이 학교 친구들 공부보다는 파트타임과 즐기는 인생을 추구하기에 항상 여유있게 도서관 이용 가능합니다) 도서관은 평일에는 8시30분부터 밤 12시까지구요, 토요일에는 오전 11시~5시(불확실), 일요일에는 오후 1시~12시까지 이용하실 수 있습니다. 주말에는 뭐 공부 하지 말라는 소리냐 하고 생각하실 수 있지만 계시다 보면 아실 수 있듯이 공부 본인도 안하게 됩니다.
도서관에서는 학생증으로 책을 빌리실수 있고, 연대와 마찬가지로 음식물 섭취 금지입니다.(휴게실 제외) 1층에는 컴퓨터가 많은데 오히려 열람실보다 컴퓨터에 사람들이 더 많은 것을 알 수 있습니다. 이 외에 최신은 아니지만 DVD나 CD같은거도 대여하실 수 있습니다. 역시 궁금한거 더 있으시면 기타에 있는 메일로 보내주세요.","수업은 당연하지만 영어로 이루어집니다. 수업의 난이도가 어떻냐는 것은 교수님마다 그리고 전공 및 수업마다 상이하겠으나, 전반적으로 많이 쉽다고 느끼실 것입니다. 미국의 학교들이 그렇지만 절대평가로 학점이 주어지기 때문에 학점도 후한 편이고, 시험기간에 미친듯이 공부하지 않아도 대부분 A가 나오실 것이라고 생각합니다.(물론 공부하지 말라는 말은 아닙니다. 그러나 공부보다 많은 친구들과 놀고 그들의 언어,문화를 배우면서도 충분히 좋은 학점이 취득 가능하다는거죠~). 영어면접보시고 토플공부 하신 분들이면 충분히 강의스피드도 따라가실 수 있으시리라 생각합니다. 또한 개인적으로 영어 글쓰기 수업을 추천합니다. 기초적인 글쓰기 실력을 다지고 싶으신 분들은 
English Writing 110을 들으시면 됩니다(Introduction to writing)
좀 더 난이도 있는거 들으시고 싶으시면 Writing 111을 들으시면 되구요(아마 Composition일 것입니다)
저는 경제학과였기 때문에 경제학개론, 국제경제학을 들었고
회계원리1, 마케팅을 같이 들었습니다. 교수님들 성함을 원하시면 추후에 밑에 기재된 메일로 보내주세요. 다 괜찮은 교수님들께 들었습니다.
도서관은 단 하나입니다. 크지도 않고 매우 작고, 1층은 중도2층 구조에 좀 시끄럽다고 보시면 되고, 컴퓨터가 많이 있습니다.
2층은 그보다 좀 더 조용하다고 보시면 되고요, 3층에는 한국사람들이 좋아하는 칸막이식 열람식이 많습니다. 
처음가면 도서관 자리가 별로 없는 것 같고, 작아서 걱정들 하시는데 걱정하지 않으셔도 됩니다. 자리 남아돕니다. Final 기간에만 그나마 좀 차는 편이지만 언제 가도 자리는 항상 있기 때문에 자리맡고 하시는 수고를 할 필요가 없습니다.(이 학교 친구들 공부보다는 파트타임과 즐기는 인생을 추구하기에 항상 여유있게 도서관 이용 가능합니다) 도서관은 평일에는 8시30분부터 밤 12시까지구요, 토요일에는 오전 11시~5시(불확실), 일요일에는 오후 1시~12시까지 이용하실 수 있습니다. 주말에는 뭐 공부 하지 말라는 소리냐 하고 생각하실 수 있지만 계시다 보면 아실 수 있듯이 공부 본인도 안하게 됩니다.
도서관에서는 학생증으로 책을 빌리실수 있고, 연대와 마찬가지로 음식물 섭취 금지입니다.(휴게실 제외) 1층에는 컴퓨터가 많은데 오히려 열람실보다 컴퓨터에 사람들이 더 많은 것을 알 수 있습니다. 이 외에 최신은 아니지만 DVD나 CD같은거도 대여하실 수 있습니다. 역시 궁금한거 더 있으시면 기타에 있는 메일로 보내주세요.","학교안에는 3개의 헬스장이 있습니다. (램킨홀, 사우스컴플렉스, 하나는 기억이 잘..) 램킨홀에서 헬스 끊으시면(저때는 한 학기 65$이었습니다.) 운동을 어디서나 하실 수 있구요, 아마 가신 후 일주일 정도 지나면 이용하실 수 있으실 겁니다. (남자분들을 위해 말씀드리면 월마트에서 보충제가 정말 싸기 때문에 몸짱이 되서 돌아오실 수 있습니다. 푸드코트에서 닭가슴살도 팝니다. 여성분들도 여성트레이너도 상주하고 있기 때문에 원하시는 운동들을 하실 수 있고, 이용도 많이들 하십니다)
이 외에도 공짜로 이용 가능한 Rec Center(간단한 헬스도구, 싸이클, 러닝트랙, 농구장, 배드민턴채, 스쿼시 시설)이 있습니다. 그리고 아까 말씀드린 교내편의점이 몇 군데 있고요, Java Coffee가 두 군데 위치하고 있습니다(학생회관 2층,스테이션). 학생회관 2층에는 아이스크림과 스무디와 잡화를 파는 The Runt가 있습니다. 이 정도가 부대시설이구요.
동아리는 다양하게 있습니다.(심지어 일본 애니 동아리까지..). 저는 기독교 학생 동아리인 The Christian Campus House에서 있었고요(다양한 계파가 있고 교직원도 있어서 체계적으로 잘 운영됩니다. 교회다니시는 분들은 추천) 이외에도 다양한 동아리들이 있습니다. 동아리 박람회 같은것을 학기초에 하게 되는데 거기서 원하시는 동아리 찾아 보시고 꼭 Sign-up 하세요.
아 참고로 국제학생 동아리인 ISO는 뭐 거의 나가게 됩니다. 매주 목요일마다 집회가 있고 다양한 행사를 하기 때문에 추천합니다. 또한 아시안 학생회인 ASA(일본인,중국인이 대부분입니다;한국 사람은 아마 없었는 듯), 한국 학생회인 KSA(한국인들 모임) 등이 있습니다. 더 자세한건 이메일 문의 주시면 답해드리겠습니다.","문화충격은 없었습니다. 개인적으로는 학교생활 자체가 원주캠퍼스에서 계절학기 들었을 때와 동일하다고 느꼈기 때문에 익숙했습니다. 단지 어려웠던 점은 피자와 햄버거를 별로 안 좋아해서 음식이 잘 넘어가지 않았고(이것은 WOK에서 볶음밥 드시면 해결됨) 외국을 처음 가봐서 교수님을 어떻게 대해야 되는지 조금 어려웠습니다(그냥 편하게 대하시면 됩니다. 프로페서나 미스터 붙여가면서 호칭만 잘하면 되죠). 이외에는 없었습니다. 복장은 다들 편하게 입고 다니기 때문에(여성분들도 그냥 청바지나 츄리닝 거의 입고 다닙니다) 그냥 편하게 입으시면 될거 같구요, 참고로 남자분들은 토드백보다는 그냥 백팩 메시는게 타인들의 따가운 시선을 피하는데 좋으실 것입니다. 
그리고 마트에서는 대부분 조용히 다녀야 하는 분위기더라구요.","기본생활적인 문제는 기숙사의 도우미인 RA(플로어마다 1~2명정도씩 있었는것 같네요)에게 문의하세요. 본인이 모르면 기숙사 전체 도우미인 Bridge에게 연결해주고, IIC까지도 가기도 합니다. 그러나 교환학생의 행정적인 문제라면 RA보다는 학관 2층의 국제학생부인 IIC에 직접 문의하시는게 바람직합니다. 교외는 도움받기 마땅한 곳이 없다고 생각하시면 됩니다. (교외나가기도 힘들고, 교외에서 문제 생기기도 힘듭니다. 미국에서 2번째로 안전한 도시로 선정되기도 했다는 도시입니다.)
너무나 어려운 상황인데 전달하기가 어려우시다면 한국 친구들에게 도움을 요청하는게 가장 방법이 될 수 있겠네요.","개인적으로 교환학생에서 친구들과의 미친듯한 Crazty 파티, 그리고 유흥과 향락, 뉴욕의 야경을 꿈꾸시는 분들께는 그렇게 추천하고 싶지 않습니다. 그러나 미국에서 한 학기 안정을 취하시면서, 외국학생들에게 호의적인 미국친구들과 함께 어학실력도 증진시키시고, 기숙사에서 스낵 나눠 먹으면서 영화도 보고 소소한 행복을 느끼시고 싶은 분이시라면 강력하게 추천드립니다. 
미국 여행이나 쇼핑 좋아하시거나 외식 자주 안하면 힘든 분들께도 어려움을 있을 수도 있겠습니다. 왜냐면 공항까지 갈 마땅한 방법이 없기 때문이죠.
(참고로 교환학생 프로그램 시작하고 끝날때 캔사스시티공항까지 가는 셔틀버스는 학교에서 제공해줍니다.) 그래서 추수감사절이나 주말에 어디 놀러가기도 마땅치 않은 점이 단점이라고 할 수 있습니다. 그러나 저는 개인적으로 만족했고, 많은 미국 친구들도 만날 수 있었습니다. 시골친구들이라서 그런지 순박하고 진심으로 마음을 열어주기 때문에 웃으면서 돌아오실 수 있을거라고 확신합니다! 벌써 Maryville이 그립네요.
더 문의사항 있으신 분들은 메일 주시면 하루안에 답변 드립니다.yo5ive@naver.com 로 메일 보내주세요"
