gen_info,env_info,food_info,study_info,office_info,facil_info,mhct_info,help_info,etc_info
산호세는 캘리포니아 북부에 자리잡은 도시이고 샌프란시스코와 매우 근접한 곳에 위치하고 있습니다. 캘리포니아의 전형적인 기후를 볼 수 있는 곳이고 크게 덥거나 춥지는 않은 것 같습니다. 한국보다 훨씬 건조하여 크게 덥지 않았고 눈이나 비가 거의 오지 않았 던 걸로 기억됩니다. 때문에 날씨 때문에 스트레스를 받거나 선택을 고려할 필요는 전혀 없다고 말씀드릴 수 있습니다.,산호세는 college town은 아닙니다. 때문에 주변에 주택가와 각종 기업들이 많습니다. 전반적으로 크게 외진 곳은 아니고 downtown이 학교로 부터 10블록 정도 떨어져 있어 걸어서 가기에 충분히 가깝습니다. 학교 바로 주변에도 여러 음식점들과 식료품점들이 있어 쉽게 이용할 수 있습니다. downtown에는 주로 술집과 클럽들 혹은 각종 문화 생활을 위한 시설들이 있고 버스로 조금만 이동하면 하키 전용구장이 있어 편하게 관람가능합니다. 캘리포니아의 활기차고 역동적인 모습들을 기대하기는 힘들고 생각보다 조용하고 적막한 때가 많았던 것 같습니다. 때문에 저처럼 집에 있기를 즐기는 분들이라면 기대했던 교환학생 생활을 체험하기는 거의 불가능에 가까울 수도 있으니 염두해두세요!,"애초에 저는 교환학생 기간동안 국제 학생들을 위한 기숙사에서 살기를 원했지만 지원이 늦어진 관계로 국제 기숙사 입성에 실패하고 말았습니다. 낙심하고 있을 세도 없이 저는 당장 off campus에서 살곳을 구해야만 했고 craiglist 를 뒤지기 시작했습니다. craiglist는 미국에서 가장 대중적인 정보 교환 사이트로 주거, 임대, 각종 물품등의 교환을 원하는 수요자와 공급자가 만나 거래를 하는 굉장히 유용한 사이트입니다. 저는 당장 적정 임대료와 위치등을 고려하여 적당한 option 들을 비교해보기 시작했고 최종적으로 채택된 곳들에 연락을 취하기 시작했습니다. 당장 미국에 가자마자 묵어야 할 공간이 필요했기에 하는 수 없이 집을 직접 방문하기 전에 list 에 올라있는 사진과 집주인과의 몇번의 contact 만으로 집을 선택할 수 밖에 없었습니다. 처음 제가 택한 option 은 학교와 매우 인접한 곳에 위치한 집이 었는데 단점이라면 그 당시 리모델링이 진행되고 있어 2주 동안 다른 곳에 머물고 있어야 했다는 점이었습니다. 다행히 산호세 인근에 제가 개인적으로 알고 있는 분이 계셔서 2주 동안의 거처를 마련할 수 있었기에 저는 가장 저에게 적합한 곳이라고 생각 되는 그 곳을 최종적으로 선택했고 미국행에 올랐습니다. 하지만 2주 동안 집주인은 리모델링이 생각보다 오래 진행 될 것 같다며 저에게 추가적으로 2주를 더 기다려 줄 것을 요구하더니 나중에는 다른 곳을 찾아보는게 좋을 것 같다는 말로 일을 복잡하게 만들기 시작하였습니다. 너무나 당황스럽고 화가 났지만 일단 생각을 정리한 뒤 study abroad center로 찾아가 저의 상황을 전달했고 금방 도움을 얻을 수 있었습니다. 국제 기숙사의 staff 중 10년 넘게 그 곳 인근에서 생활을 해온 분이 주변 지인들에게 연락을 돌렸고 그로부터 3분에게 거주가 가능하다는 연락이 돌아왔습니다. 3곳을 모두 방문해 본 뒤 저는 저에게 가장 적합한 곳을 최종적으로 결정했고 미국 도착 한 달 만에 저의 보금자리를 가질 수 있게 되었습니다. 학교와 불과 10분 거리에 위치해 있고 국제 기숙사와는 5분 거리에 있어 여러모로 학교 생활을 하는데 매우 유리했고 또 집주인 부부가 여러가지 생활용품을 자유롭게 쓸 수 있도록 허락해 주셔서 정말로 만족스러운 생활을 할 수 있었습니다. 대체로 집을 rent할 경우 한 달 임대료에 전기, 물 사용비와, 냉장고나 식기를 사용할 경우 추가요금을 요구하는 경우가 많은데 저희 집 같은 경우는 이모든 요금을 요구하지 않고 한 달에 600불에 임대료만을 원하셔서 매우 적은 비용으로 호사스러운 생활을 할 수 있었습니다. 산호세 대학교 주변에는 다운 타운으로 넘어가기 이전이 모두 주택가로 이루어져 있어 실제로 학교 밖에서 집을 구하는 것이 어렵지는 않지만 그 당시 수요가 많았던 탓에 점점 가격도 올라가고 경쟁이 치열해지고 있다고 합니다. 처음 입주했던 당시에는 저 혼자 였지만 2달이 지난 후 이란에서 온 룸메이트가 생겨 얼마간 같은 집에서 함께 생활을 하기도 하였습니다. 기숙사에 들어가지 못한 저의 경우 학교에서 제공해주는 식사권을 이용하기 위해서는 추가요금을 지불하고 식사권을 구매하여야 했습니다. 하지만 가격이 만만치 않고 기숙사에 살지 못하게 된 이상 굳이 학교 식당을 이용할 필요가 없을 거란 생각이 들어 저는 야심차게 혼자만의 살림을 꾸려나가기로 결정하였습니다. 기본적으로 주변에 도보로 이동할 수 있는 거리에 다양한 마트들이 있어 장을 보기에 큰 어려움은 없었습니다. 저는 주로 마트에서 파는 고기와 야채, 각종 유제품 등을 구입하여 아침과 점심은 집에서 해결하고 저녁은 구내 식당이나 주변 레스토랑에서 먹곤하였습니다. 마트에서 살 수 있는 고기는 대부분 돼지고기와 닭고기 위주였는데 한국에서 인기있는 고기와는 약간 다르지만 가격은 훨씬 저렴하고 먹기 좋게 손질되어있어 아침식사용으로 매우 적합하였습니다. 대신에 제가 느끼기에 고기와 야채들이 기본적으로 냉장보관을 하여도 쉽게 상하고 변질되어 3,4일을 넘기지 않고 먹는 것이 좋을 것 같다고 생각합니다. 버스를 타고 25분 정도 이동하면 한인타운으로 갈 수 가 있고 그 곳에 있는 한인마트에 가면 수 많은 한국 음식들을 구입할 수 가 있었습니다. 쌀을 팔기도 하였지만 그보다 햇반을 판매하고 있어 밥도 부담없이 먹을 수 가 있었고 각종 고기 , 생선 , 김치 ,밑반찬 , 과자, 음료 등 왠만한 것들은 모두 손쉽게 구할 수 가 있습니다. 때문에 저도 한국 음식이 생각나는 날 혹은 한국 친구들과 파티를 하는 날이면 그 곳에서 장을 잔뜩 봐서 함께 먹곤 하였습니다. 한인타운의 경우 다양한 한국 음식점이 많아 한국음식을 쉽게 접할 수 있었습니다. 물론 한국보다 가격은 1.5배 정도 비쌌지만 타국에서 한국의 맛을 느낄 수 있는 기회를 제공한다는점에서 가끔 이용할 만한 가치가 있다고 생각합니다. 저녁식사의 경우 주로 학교 주변 식당이나 학교 구내 식당을 이용하곤 했습니다. 학교 주변의 경우 피자, 햄버거, 브리또와 같이 미국에서 대중적인 음식들을 파는 식당을 이용하였습니다. 물론 조금만 시간을 더 들인다면 중국, 베트남 음식도 쉽게 맛볼 수 있었습니다.","저는 전공관련 수업 세 과목과 교양 한 과목을 수강하고 돌아왔습니다. 우선 전공관련 수업은 투자론, 노동 경제학, 법 경제학을 수강하였고 교양으로는 와인의 이해라는 수업을 수강하였습니다. 미국에서의 수업은 한국에서와 마찬가지로 일주일에 3시간을 한 단위로 하여 진행됩니다. 대신 제가 들었던 수업은 일주일에 1회 수업을 하여 2시간 45분씩 수업이 진행되는 것들이 대부분이었습니다. 전공 관련 수업 중에서 가장 기억에 남았던 것은 바로 법경제학이었습니다. 경제와 법과목의 상당히 긴밀한 연관성에도 불구하고 법과 관련된 수업을 수강해 본적이 없었기에 처음 과목을 선택할때부터 많은 기대를 안고 있던 터였습니다. 수업은 기본적으로 법을 세분화하여 매시간 다른 분야를 공부할 수 있도록 짜여져 있었기 때문에 한 학기 동안 다양한 법 분야를 탐색해 볼 수 있었습니다. 매시간 다른 법을 다루면서 그와 관련된 실제 케이스를 공부해 볼 수 있었는데 이 때문에 보다 쉽게 다양한 법들의 본질을 이해할 수 있었던 것 같습니다. 학생들의 참여 또한 높아서 자유롭게 자신들의 의견을 교환할 수 있었고 교수님은 그에 대해 적절한 피드백을 통해 학생들의 이해를 증진시켜 나갔습니다. 또한 학생들이 특정 법을 보다 심도있게 탐구 할 수 있는 기회를 주고자 학생들로 하여금 특정 법을 선정하여 기본 개념과 여러가지 사례들을 발표할 수 있도록 하는 issue brief 를 진행하기도 하였습니다. 저는 마술과 패션에 관한 법을 선택했고 관련 이슈에대한 리서치 과정을 통해 상당히 흥미있는 부분들을 발견할 수 있었습니다. 마술과 관련된 법의 경우, 실제로 우리나라에서 발생한 마술 관련 소송이 있어 어렵지 않게 마술이라는 엔터테인 장르에 법이라는 요소를 결합시킬 수 있었습니다. 패션법 역시 매우 흥미로운 주제였는데 패션 분야에서의 copy는 다른 종류의 지적재산권 침해와는 달리 패션 트렌드의 회전율을 높이고 새로운 패션의 탄생을 가속화 한다는 점이 매우 재미있었습니다. 한 학기동안 총 세번의 시험을 치렀고 형식은 모두 주관식이었습니다. 쓰기에 익숙하지 않아 남들보다 조금 더 많은 시간을 들였음에도 짧고 세련되지 못한 문장을 쓸 수 밖에 없었지만 기본 개념에 대한 언급이 있다면 남들과 동등한 조건에서 성적을 부여 받을 수 있었던 것 같습니다. 노동 경제학과 투자론 수업은 한국에서의 여타 경제 수업들과 비슷한 방식으로 진행되었습니다. 교수님이 자체 제작하신 유인물을 통해 기본 개념 위주로 수업을 진행하고 중간중간 퀴즈를 통해 학생들의 이해도를 체크하였습니다. 투자론의 경우 중간중간 내야하는 보고서가 몇 가지 있었는데 그 중에는 실제 자신의 미래 포트폴리오에 관한 것도 있었습니다. 기업 단에서 행해지는 주요 결정 사안을 나 스스로에게 적용해보니 개념에 대한 이해를 높일 수 있는 시간이었던 것 같습니다. 마지막으로 와인의 이해라는 수업은 말 그대로 와인에 관한 이해를 높이고 학생들이 와인을 보다 잘 즐길 수 있도록 다양한 와인 지식을 가르쳤던 과목이었습니다. 와인에 대한 지식 뿐만 아니라 매시간 교수님께서 준비하신 와인을 테이스팅 해보고 직접 맛을 감정해 보는 경험을 통해 실제로 와인에 대해 잘 이해할 수 있게 되었습니다.","Clark hall 5층에 International Office가 위치해 있고, 수강신청 및 국제학생들의 전반적인 사항들에 대해 처리해 주는 곳입니다. 이 곳에서 일하는 분들과 좋은 관계를 유지하면 학기 중에 필요한 서류를 요청하였을 때 매우 친절하게 빨리 처리해주기도 하고, 좋은 정보들도 제공해 주기도 합니다. 학기 전 국제학생들을 위한 오리엔테이션을 진행합니다.","기본적으로 학내에서 학교 생활과 관련된 모든 것을 해결 할 수 있는 정도의 부대시설을 지녔다고 생각합니다. 학관은 식당과 기념품 점, 서점과 볼링장등의 시설을 갖췄고 운동을 할 수 있는 시설 역시 잘 구비되어 있습니다. 학생들은 무료로 fitness center와 농구장 라켓장을 이용할 수 있고 이 곳에서 다양한 수업이 진행되기도 합니다. 학내 곳곳에 자전거를 주차할 수 있는 공간이 마련되어 있고 현금 인출을 위한 atm기 자동차를 위한 주차 공간도 마련되어 있습니다. 또한 학교에서 1,2 블록 떨어진 곳에 학교에서 운영하는 각종 센터들이 있어 학생증 발급, 종교생활 과 같은 활동들을 모두 학교 근처에서 해결할 수 있었습니다. 

동아리에 경우 매 학기 초에 학내 전체에서 각 동아리들의 홍보 부스가 설치됩니다. 정말로 다양한 종류의 동아리가 존재하고 이런 동아리들은 사이트 내에 community 검색을 통해서도 모두 찾아 볼 수 있습니다. 실제로 저는 financial management association 이라는 금융관련 동아리에서 활동 했는데 한국의 동아리들과 달리 가입 조건이 까다롭지 않아 누구든 활동이 가능했습니다. 이 동아리의 경우 매주 실무자를 섭외하여 실무단에서 요구되는 능력과 기술들에 관한 조언을 해주고 각종 활동을 통해 학생들이 함께 참여할 수 있는 시간을 갖기도 하였습니다. 대신 학생들간에 교류가 거의 없어 한국의 동아리 개념처럼 긴밀한 인간관계를 갖는 것은 상대적으로 힘들었던 것 같습니다. 수많은 동아리들이 존재하지만 그 중에서 지속적으로 관리가 안되고 있는 동아리들이 다수 존재하기 때문에 가입 전에 담당 학생들에게 미리 여러가지 질문을 해봄으로써 동아리 선택에 소요되는 시간을 절약하는 것이 현명하다고 생각합니다.",아시아인의 비중이 높은 곳이어서 상대적으로 편했던 것 같습니다. 생활하는 동안 생전 처음 보는 기이한 광경을 목격했던 적은 없었습니다. 대신 외국생활이 처음이었던 저에게 지나치게 friendly했던 그들의 모습이 살짝 불편했던 건 사실이지만 그건 저의 성격 탓인 것 같습니다. 아마 큰 충격 없이 쉽게 적응할 수 있으리라 믿습니다.,교환학생의 경우 우리 학교에 국제처와 같은 곳에서 대부분의 도움과 지원을 받을 수 있습니다. 특히 도착 시점까지도 주거 문제가 해결되지 않은 경우 반드시 국제처에 도움을 청하는 것이 좋습니다. 저 또한 주거 문제를 해결함에 있어서 그분들로부터 결정적인 도움을 받았습니다. 대부분 그 주변에서 오랜시간 거주해온 분들이기 때문에 생각보다 쉽고 빠르게 도움을 받을 수 있었습니다. 기숙사에 사는 분들에 경우 기숙사 staff에게 도움을 청할 수 있고 기숙사에 사는 경우가 아니더라도 필요한 경우 기숙사 staff의 도움을 받을 수 있습니다. 산호세는 매우 안전한 지역이지만 만일에 사태에 대비하여 적어도 하나 이상의 커뮤니티에 가입할 것을 권유합니다. 학생들이 주도적으로 모든 커뮤니티를 운영해 나가기 때문에 현지 학생들로부터 상당한 도움을 받을 수 있을 거라고 생각합니다.,"현지에서 운전을 하시려면 국제 면허증이 필요합니다.
한국에서 사용하던 운전면허증을 면허 시험장에서 국제 면허증으로 새로 발급만 받으면 되니까 꼭 발급해 가시기 바랍니다.

an.maloh@gmail.com"
"San Jose State University(이하 SJSU)는 캠퍼스 규모가 연세대학교보다 작습니다. 경사가 진 연세대학교 캠퍼스와는 달리 평지에 위치하고 있어, 건물 간 이동시 매우 편리하며 스케이트보드나 자전거를 타고 다니는 학생들도 매우 많습니다.

산호세는 캘리포니아 북쪽에 자리잡고 있으며 샌프란시스코로부터 동남쪽 방향으로 차로 한시간 정도 거리에 위치하고 있습니다. 
날씨는 대체적으로 따뜻하고 건조한 편입니다. 제가 1월에 도착하였을 때에는 낮에는 반팔을 입을 수 있을 정도였고, 오히려 2월부터 기온이 살짝 내려가긴 했지만 영상 10도 정도의 기온을 유지하였습니다. 5~6월에는 영상 20도 정도여서 따뜻하고 매우 건조하기 때문에 그늘이나 실내에서는 선선합니다.","학교 주변은 매우 한적하고 조용합니다. 비록 다운타운이 학교 바로 가까이에 있지만, 전체적인 분위기는 연세대학교 주변 환경과는 매우 많이 다릅니다. 그래서 놀기에는 좋지 못한 곳이기도 하지만, 개인적으로는 서울과 달리 한적하고 조용한 산호세에서 마음이 편해지는 느낌이었습니다. 다운타운에는 술집, 영화관, 커피숍, 음식점 등이 있습니다. 대중교통을 이용하여 월마트나 야구경기장에 갈 수 있습니다.","기숙사에는 Campus Village와 International House(이하 ihouse) 등이 있습니다. 저는 ihouse에 거주하였는데, ihouse에는 미국학생10명 정도를 포함하여 20개국 이상에서 온 국제학생들 70명 정도가 사는 기숙사입니다. Campus Village는 ihouse보다 규모가 훨씬 크고 시설도 훨씬 좋은 편입니다. 1인실과 2인실을 선택할 수 있고, 방 세 개 정도가 하나의 욕실과 부엌을 공유하는 형태의 기숙사입니다. 시설이 좋고 개인공간이 확보된다는 장점이 있지만, 다른 방이나 다른 층의 학생들과 교류할 기회는 거의 없습니다. ihouse는 3층짜리 건물로 2층에는 주로 여학생들, 3층에는 주로 남학생들이 거주하고 대부분 2인실이며 간혹 몇 개의 방은 3인실인 경우도 있습니다. 저는 3인실에 거주했었고 남자들 방 중에 유일한 3인실이었습니다. 화장실은 층마다 있어 공유하고, 부엌 역시 공용이며 지하에 있습니다. 개인공간이나 개인적인 시간이 상대적으로 적다는 단점이 있지만, 70명 정도의 학생들끼리 거의 대부분 친해질 수 있고 다양한 행사 및 여행을 쉽게 갈 수 있다는 장점이 있습니다. ihouse에 거주할 경우 meal plan을 선택하여야 합니다. 5day(주말제외)와 7day(주말포함)이 있습니다. meal plan이 있으면 Dinining Common이라고 하는 학생식당에 횟수 제한 없이 먹을 수 있습니다.(평일 아침8시정도부터 밤10시정도까지) 저는 5day meal plan을 택해서 주말에는 외식을 하거나 기숙사에서 요리를 해 먹었습니다. Dining Commom은 스시, 피자, 스파게티, 햄버거, 덮밥 종류 등이 거의 매일 같은 메뉴로 나오기 때문에 쉽게 질린다는 단점이 있지만 식당 안에 커피숍이나 jamba juice(스무디킹 같은 종류) 또한 무료로 주문할 수 있다는 장점이 있습니다.","저는 15학점을 들었고 그 중 전공은 Unit Operation과 Hazardous Material 수업 두개(7학점)를 들었습니다. Hazardous Material은 화공과, 지질학과, 대기학과 등의 교수 3분이 학기를 삼등분하여 각각의 파트를 나누어 강의하는, lecture 방식의 수업이었습니다. Unit Operation은 일주일에 3시간의 강의와 3시간의 lab시간으로 이루어졌는데, 강의에서 배운 내용을 토대로 lab을 팀단위로 진행하였습니다. lab에 참여하기 전 교수님이 미리 문제를 제시해주고, 각각의 팀은 그 문제에 적용할 수 있는 가정과 수치 자료들을 조사하여 정리한 후 lab시간 동안 그 문제를 해결하여 결과를 제출하는 방식이었는데, 각 팀마다 조사해온 자료들이 다르기 때문에 결과도 다를 수 있고 그렇기 때문에 학생들이 자유롭게 토론할 수 있었다는 수업방식에서 한국과는 많은 다른점을 느끼기도 했습니다.
전공 수업 외에는 Public Speaking과 Gospel Choir, 그리고 Wine Appreciation 수업을 들었습니다. Public Speaking은 매 학기 담당교수마다 수업방식이 다르지만, 저의 경우에는 총 5번의 Speech와 중간고사, 기말고사가 있었습니다. Public Speaking의 경우 native를 위한 수업과 non-native를 위한 수업이 있어서 non-native를 위한 수업을 들었는데, 동양인들도 많았지만 non-native들은 교환학생이 아닐 뿐이지, 어렸을 때부터 미국에서 자랐거나 영어를 써온 학생들이 대부분이기 때문에 영어 실력은 대부분 좋습니다. 하지만 public speaking은 대중 앞에서 말하는 것을 평가하기 때문에, 한국사람들 중에서도 많은 한국 사람들앞에서 한국말로 발표하는 것을 쑥스러워하는 사람들이 많듯이, 이 수업에서도 영어를 잘하는 학생들이 발표를 잘 못하는 경우가 많습니다. 
Gospel Choir(가스펠 콰이어)는 African-American 성가 음악인 가스펠 합창을 배우는 수업인데 흑인 음악을 좋아하거나 그들의 문화를 배우고 싶은 학생들에게 매우 추천하고 싶은 1학점 짜리 수업입니다. 20명 정도의 학생들과 함께 학기 중에 가스펠 음악을 배우며(저는 무교입니다) 학기 말에 3번 정도의 공연과 축제를 열기도 합니다. 
Wine Appreciation은 와인을 평가하는 방법을 배우는 수업입니다. 우선 만21세 이상만 신청 가능합니다. 와인을 시음하는 방법을 단계적으로 배우고, 45명 정도의 학생들을 9그룹 정도로 나누어 각 그룹이 전 세계 9개 지역(프랑스, 스페인, 그 외 유럽, 미국, 남미 등등)을 맡아 그 지역에 대한 발표를 하는 수업방식으로 진행되었습니다. 그렇기 때문에 매 수업마다 각 지역의 와인 2개 정도를 시음(각 두 모금 정도)할 수 있는 기회가 있습니다. 중간고사 후 캘리포니아 최대의 와인생산지역인 Napa Valley를 방문하여 세 개 정도의 Winery에서 와인 테이스팅을 할 수 있는 기회도 있습니다.(교수님과 함께 가며, 평일에 가는 것이기 때문에 가는 것은 의무 아니고 선택입니다.)

책을 대여하려면 1층에서 도서관 카드를 따로 발급받아야 합니다. 도서관은 매우 깔끔하고 조용합니다. 어떤 층은 외부에도 공개되기 때문에 사람이 많지만 높은 층들은 학생들에게만 공개되기 때문에 공부하기에 매우 좋은 환경입니다.","Clark hall 5층에 International Office가 위치해 있고, 수강신청 및 국제학생들의 전반적인 사항들에 대해 처리해 주는 곳입니다. 이 곳에서 일하는 분들과 좋은 관계를 유지하면 학기 중에 필요한 서류를 요청하였을 때 매우 친절하게 빨리 처리해주기도 하고, 좋은 정보들도 제공해 주기도 합니다. 학기 전 국제학생들을 위한 오리엔테이션을 진행합니다.","학교 농구팀이나 야구팀, 아이스하키 팀의 경기가 있는 날에 학생증을 지참하면 저렴한 가격으로 경기를 관람할 수 있습니다. 한국과 달리 자신의 학교 팀의 스포츠 경기에 많은 학생들이 참여하여 응원하기 때문에 매우 재미있습니다. 또한 학생회관에는 볼링장이나 탁구장 등이 있습니다. 학생증 지참시 학교 내 gym 과 야외수영장을 무료로 이용할 수 있는데, 시설이 매우 좋습니다.","특별한 Culture Shock는 없지만, 다양한 나라에서 온 학생들과 생활하다보면 다양한 문화를 배울 수 있습니다. 저 같은 경우 밥을 먹다가 식사 예절에 관해 얘기한다던지, 대화를 하다 호칭이나 인사 예절에 관해 얘기한다던지 등 많은 문화를 듣고 받아들이기 위한 노력을 하였습니다.","교내에는 Clark Hall에 있는 International Office 등에서 도움을 받을 수 있고, 교외에는 저의 경우에는 거주하였던 ihouse의 책임자인 Kresten과 Leann에게서 도움을 받았습니다.",캘리포니아 지역은 스페니쉬를 사용하는 사람들이 많습니다. 기회가 된다면 교환파견 전이나 파견 중 스페니쉬를 공부한다면 사용할 일이 많을 것입니다.
