gen_info,env_info,food_info,study_info,office_info,facil_info,mhct_info,help_info,etc_info
"University of Georgia (UGA)는 연대의 3배 크기를 자랑하는 거대한 캠퍼스를 가지고 있습니다. 밑에서 더 설명하겠지만 대부분의 교환학생들이 거주하게 되는 교내 기숙사 East Campus Village(ECV)에서 교양/문과대/경영대 수업들이 이루어지는 캠퍼스 북쪽과 정문까지는 걸어서 40분 내외라고 생각하시면 될 것 같습니다. 교내 버스가 평일에는 다양한 경로로 다니기 때문에 평일에 이동하실 때는 큰 불편함이 없으실 겁니다. 다만, 학생들이 수업을 들으러 가기 위해 몰리는 시간대에는 서울의 출퇴근 시간 지옥철과 맞먹는 인파와 함께 등교하셔야 합니다. 하지만 그 시간대를 피해 5분만 일찍 나와도 조금은 한적한 버스를 이용하실 수 있습니다. UGA는 조지아주의 주도인 Atlanta에서 차로 약 1시간 반 거리에 위치한 Athens라는 college town에 위치해 있습니다. College town인 만큼 학교 주변 상권은 대부분 학교를 중심으로 돌아가고 그 규모가 그렇게 크지는 않습니다. 학생들은 주로 학교 정문 쪽으로 나가면 위치해 있는 downtown에서 많은 일들을 처리하고 (스타벅스, 음식점, 은행, 미국의 편의점 CVS 모두 downtown에 위치해 있습니다.) 가끔은 five points라는 정문보다는 기숙사에서 조금 더 가까운 곳에서 밥을 먹기도 하고 스무디킹도 이용하곤 합니다. 절대 신촌과는 비교할 수 없는 아주 작은 규모의 downtown이지만 그래도 있을 건 다 있고 학교 버스로 Walmart나 Krogers(식료품점)도 이용 가능하기 때문에 생활하는 데 큰 어려움은 없습니다. 물론 Uber나 Lyft를 이용하는 방법도 있구요! 기후는.. 덥습니다.. 사실 제가 UGA를 선택한 이유 중 가장 중요했던 이유도 날씨라 할 수 있는데요, 저는 날씨의 영향을 많이 받는 사람이라 조금 덥더라도 해가 많이 나고 날씨가 좋은 곳에서 1년을 생활하고 싶었습니다. 조지아주는 그런 저에게 정말 만족스러운 날씨를 경험하게 해 주었습니다. 다만, 한 가지 말씀드리고 싶은 건 해가 한국과는 비교도 안 될 정도로 정말 뜨겁기 때문에 sun burn이나 타는 거 조심하셔야 합니다! (나름 선크림 잘 바르고 다녔다고 생각했는데 반바지 입고 다니다보니 선명한 경계가 생기더라구요..) 그리고 해가 정말 강렬하기 때문에 선글라스를 챙겨 다니시는 것도 추천드려요! 어쨋든 따뜻하고 매일 기분 좋은 햇살을 느끼고 싶으신 분들에게는 조지아주가 정말 날씨를 즐기기에 좋은 곳입니다 :) 그렇다고 매일 덥고 뜨거운 날들만 계속 되는 건 아니고, 간간이 태풍의 영향도 받고 나름 장마철도 있습니다. 겨울에도 눈이 오는 경우가 거의 없어서 눈이 오면 수업들이 취소 되는 경우가 많습니다. 신기하게도 제가 있었던 해에는 눈이 펑펑 온 날이 있었는데 오랜만에 눈을 봐서 기분 좋았던 기억이 있네요! 조지아주에서는 눈이 귀하기(?) 때문에 이렇게 눈이 오는 날이면 정말 많은 학생들이 나와서 사진과 동영상을 남기기 바쁩니다 ㅋㅋ","위에서도 언급했듯이 UGA 정문 근처에 위치한 downtown에는 꽤 많은 음식점들과 카페, 바들이 위치하고 있습니다. 학교 근처라 그나마 안전하긴 하지만 그래도 미국 특성상 밤에는 매우매우 어둡고 낮에도 술에 취해 거리를 거니는 사람들이 간간이 보이기 때문에 항상 조심하셔야 합니다. 교내 bookstore나 자판기, 혹은 campus market에서 간단한 음식이나 군것질거리를 구입할 수는 있지만 물건들이 한정적일 수밖에 없습니다. 그럴 때는 downtown에 있는 CVS에 가시거나 우버로 10분 정도 거리에 있는 Walmart/Krogers에서 장을 봐 오시면 됩니다. 차가 있는 친구와 같이 갈 기회가 있으면 좋긴 합니다! ㅋㅋ 그 외에도 영화관, 볼링장 등 있을 건 다 있습니다.","대부분의 교환학생들은 캠퍼스 정문과 정반대 방향에 있는 East Campus Village (ECV)라는 곳에 거주하게 됩니다. 이것도 필수는 아니지만 대부분의 학생들이 이 방법을 선택하긴 합니다. 처음 교환을 가게 되면 같이 살 사람을 찾는 것도 어렵고 대부분 식사도 meal plan을 이용하는데 ECV 바로 앞에 식당이 하나 위치해 있어서 여러모로 편리하기 때문이죠. 물론 다른 교환학생 친구들과 만나기도 쉽구요! 우선 ECV의 거주형태는 아파트 형태라고 보시면 됩니다. 4인이 한 호실을 사용하는데 거실 하나에 4명 각자 방이 있습니다. 그 안에서도 둘씩 방이 가까이 위치해 있고 그 둘이 화장실을 공유하는 형태입니다. 교환학생들은 대부분 현지 미국인 룸메이트 2명과 다른 교환학생 1명과 플랫메이트가 되며 그 다른 교환학생 친구와 화장실을 같이 사용하게 됩니다. 각자 방이 있다는 점이 저는 굉장히 편하고 자유롭고 행복했습니다 ㅋㅋ 스스로 방을 꾸며보기도 하고 방에서 혼자 편하게 생활할 수 있어서 정말 여유롭고 평화로운 학교생활을 할 수 있었습니다. 방에서 화기사용은 금지되어 있어서 가스레인지는 없지만 냉장고와 전자레인지는 있습니다. 그리고 많은 학생들이 1인용 혹은 2인용 휴대용 버너? 같은 것을 구입해 방에서 간단한 요리들을 해 먹는 경우도 있었습니다. 저도 나중에는 Amazon에서 주문한 버너 같은 걸로 요리해 먹었습니다. ECV는 village답게 4개의 건물들이 모여 있는 기숙사입니다. 제가 가 있을 때는 80-90%의 학생들이 Busbee Hall에, 나머지 학생들이(저 포함) McWhorter Hall에 배정받았습니다. Busbee가 가장 큰 건물이고 가장 많은 학생들이 모여 있기에 친구들과 모이기 가장 편하고 쉬운 곳이긴 하지만 사람이 많은만큼 엘리베이터 이용도 조금 어렵고 빨래 문제도 많다고 들었습니다. 반면, 제가 거주했던 McWhorter는 교환학생 친구들은 조금 적지만 그래도 Busbee보다 조용하고 빨래 문제도 상대적으로 매우 적은 빌딩이라고 보시면 됩니다. Busbee와 McWhorter는 중간에 작은 yard(?)를 사이에 두고 있으며 걸어서 1-2분 거리에요. 식사는 Meal Plan을 이용하는 방법과 혼자 해결하는 방법이 있지만 meal plan을 이용하는 것이 학교 수업을 들으며 식사를 해결하기에도 편리하고 식당에서 공부를 할 수도 있고 친구들도 많이 만날 수 있기 때문에 많은 학생들이 밀플랜을 선택합니다. 음식의 질도 미국 대학 중 꽤 상위 랭킹을 차지하고 있는 걸로 알고 있어요. 다만, 저는 1년 교환학생이었기 때문에 두 번째 학기에는 똑같은 음식에 물려서 중간에 밀플랜을 끊고 Krogers에서 사온 식료품들로 혼자 방에서 간단한 음식을 해 먹었습니다.  식당은 다 뷔페 형식이라 원하는 음식을 원하는 만큼 드실 수 있어요! 교내 식당은 총 5군데가 있는데 학생들이 가장 많이 이용하는 식당은 Bolton이랑 ECV(Village Summit)일 것입니다. Bolton은 수업이 많이 열리는 캠퍼스 중앙 부근에 위치해 있으며 가장 다양한 메뉴를 드실 수 있습니다. ECV는 기숙사에서 가장 가까운 식당으로, 여기서는 정말 갈 때마다 교환학생 친구들을 만나게 되는 것 같아요!","저는 가을학기에는 15학점, 봄학기에는 12학점을 들었습니다.가을학기- 21C Black Writers (영문과 전공, 3학점)- Lit and Cinema (비교문학 전공, 3학점)- Intro to Anthropology (교양, 3학점)- Appreciation of Theatre (교양, 3학점)- Contemp Found I (교양, 2학점) - 현대무용- Univ Philharmonia (교양, 1학점) - 오케스트라봄학기- Contemp American Lit (영문과 전공, 3학점)- Criticism and Culture (영문과 전공, 3학점)- Topics of American Lit (영문과 전공, 3학점)- Music Theory for Non-majors (교양, 3학점)제가 들은 수업들은 대부분 영문과 전공 수업들입니다. 수업에 관해 궁금하신 점 있으시면 연락주세요! 다만 제가 말씀드리고 싶은 건 혹시 3-4천 단위 영문과 전공 수업을 들으실 예정이라면 절대 한 학기에 2개 이상 듣지 마세요ㅠㅠ 한 주에 책 한 권씩 끝내야하는데 그런 수업들이 2개가 넘어가기 시작하면 절대절대 감당하지 못하게 됩니다..","저는 개인적으로 UGA의 국제교육부가 정말 잘 되어 있고 학교 측에서도 교환학생들을 아주 반기며 잘 챙겨준다는 느낌을 받았습니다. 미국은 일처리가 느리다는 말을 많이 들어서 저도 한 번 문의를 하면 정말 오래 걸릴 거라 생각했는데 절대 그렇지 않았어요! 사소한 것도 정말 친절하게 답변해주시니까 궁금하신 점 있으시면 혼자 앓지 마시고 꼭꼭 담당자분께 문의드려 보세요!! 이런 이메일 처리 말고도 매주 금요일마다 International Coffee Hour라고 해서 매주 다른 교내 국제학생동아리들이 본인들 나라의 음식도 (무료로) 제공하고 커피도 제공하고 가끔은 공연도 준비해서 사람들이 모여서 이야기하고 친해질 수 있는 기회도 있습니다. 실제로 많은 교환학생 친구들이 이 coffee hour에서 많은 현지 친구들을 만들기도 했습니다! 여튼, 조지아주가 다양한 문화권의 사람들이 공존하는 곳인만큼 이러한 다양성을 포용하려는 모습이 정말 보기 좋았습니다. 또, Global Buddies 프로그램도 있어서 international student 한 명과 현지 미국인 친구 한 명을 짝지어주는 프로그램도 있어요. 이것은 언어교환이라기보다는 그냥 정말 1대1로 친해질 수 있는 기회가 되는데, 저는 이 친구와 이 친구를 통해 알게 된 다른 친구와 영화관도 가고 밥도 먹고 요가도 같이 하러 가고 방에서 같이 팝콘 먹으면서 영화도 보는 등 정말 다양한 경험을 함께 했습니다! 혹시 친한 미국인 친구를 사귀고 싶은데 coffee hour처럼 불특정 다수가 있는 자리에서 친구를 만들기 어렵겠다고 생각하시는 분들은 이 프로그램 정말 추천드려요!","UGA하면 Ramsey Student Center를 빼놓을 수 없어요! 정말 큰 규모의 체육관으로, 배드민턴장, 수영장, 배구장, 농구장, 큰 헬스장, 작은 헬스장, 라켓볼장, 암벽등반 등 정말 많은 활동들을 즐길 수 있는 곳입니다. 체육관에서 테니스 채만 제외한 다른 라켓과 공은 대부분 빌려주고, 교환학생들은 무료로 이용하실 수 있는 곳입니다! 심지어 ECV랑 엄청 가까워서 정말 마음만 먹으면 운동 제대로 할 수 있는 환경입니다. 또한, 학교에서 제공하는 small group training 이용권을 끊으면 태권도, 마샬 아츠, 요가, 필라테스, 근력운동도 마음껏 즐길 수 있으니 운동 제대로 해보고 싶으신 분들이라면 이것도 추천드려요! 저는 봄학기에 이거 끊어서 했는데 정말 운동 열심히 하게 되고 좋았습니다. 규모가 큰 학교인만큼 동아리도 정말 많아요. 저는 원래 춤을 추는데, 현대무용은 접해본 적이 없어서 이번 기회에 현대무용을 제대로 배워보고 싶어 현대무용 동아리에 들어갔습니다. 이런저런 이유로 매학기 하던 공연을 제가 있을 때는 못하게 됐지만 ㅠㅠ 거기서 사귄 친구랑 같이 영화도 보고 카페 가서 공부도 하고 이렇게 친목을 다지기에도 참 좋은 것 같아요. 다만 한 가지 주의하실 점은 대부분의 운동 동아리와 댄스 동아리들은 tryout 혹은 audition이 있는데 그게 생각보다 학기 초반이라 미리 검색해보시고 tryout 날짜 확인해두시는 걸 추천드립니다!","미국에 와서, 혹은 미국 친구들과 생활하면서 받은 문화충격은 별로 없었던 것 같아요. 요즘은 워낙 지구 반대편에서 어떻게 살아가는지도 쉽게 보고 접할 수 있는 환경이 되었다보니. 다만 저는 개인적으로 유럽 문화권에서 온 친구들로부터 조금 문화충격을 받긴 했던 것 같습니다. 제가 생각했던 것보다도 훨씬 개방적이고 정말 이렇게 파티를 좋아하는 친구들을 처음 봐서 조금 신기했던 것 같아요 ㅋㅋ 그래도 전반적으로 1년 동안 교환학생 생활하면서 크게 충격을 받은 건 없습니다!","제 경험상 UGA employee들은 대부분 저희 교환학생들의 궁금증을 주의 깊게 들어주고 해결해주려고 노력하시는 것 같았습니다. 특히, 교환학생 담당자분 (저희 때는 Alyssa Johnson이라는 분이셨습니다)께서 정말 저희 궁금증 하나하나 다 들어주시고 챙겨주시니 주저말고 문의하시면 좋을 것 같습니다! 그리고 교수님들께서도 교환학생들에게 최대한 많은 도움을 주려고 하시니 도움이 필요할 때는 망설이지 말고 정중하게 질문해보는 것을 추천드려요 :)","저는 예전부터 미국 대학교를 경험해보는 게 하나의 소원이었는데 UGA에서 1년 동안 정말 잊지 못할 추억들과 행복한 경험들 가져갑니다 :) 제가 적은 것 이외에도 궁금하신 게 있으시다면 언제든 pueyong@yonsei.ac.kr로 메일 주시면 제가 아는 선에서 답해드리도록 하겠습니다! Go Dawgs!P.S. 아 다 적고 나서 생각났는데 사실 여행 다니기 쉬운 곳은 아니에요ㅠㅠ 공항 가는 것도 힘들구 흑흑 그래도 같이 갈 친구들 잘 구하면 정말 충분히 여유롭고 알찬 여행 가능합니다! 저는 부득이하게 코로나로 인해 일찍 귀국하느라 여름에 계획했던 서부 여행은 못 갔지만 New Orleans(루이지애나주), 플로리다, 뉴욕 2번, 보스턴, 시카고, 사우스캐롤라이나, 그리고 조지아 이곳저곳 등 정말 동부 여행은 많이 다녔어요! 여행도 꼭 많이 해보시길 추천드려요! 미국 너무 멀잖아요ㅠㅠ그리고 UGA가 풋볼 정말정말 잘하기로 유명한 학교입니다!! (가끔 경기 보면 믱 할 때도 있긴 하지만요) 학생표는 정말정말 싸게 살 수 있으니까 그거 시즌 표 다 끊어서 많이많이 가보시길 추천드려요!! 응원도 진짜 재밌고 경기 시작 전에 친구들이랑 잔디밭에서 술 마시면서 노는 것도 재밌고(tailgating).. 갈 때마다 연고전 생각나서 정말 즐거웠습니다!!"
"크기는 매우 큽니다. 처음에는 어디가 어딘지 알 수 없을 만큼 크다고 느꼈습니다. 우리학교보다는 당연히 크고, 서울대보다도 큰 것 같습니다. 캠퍼스는 매우 넓지만 익숙해지면 버스를 타고 캠퍼스 내의 어디든 편하게 갈 수 있습니다. 주말에는 버스가 좀 시간간격도 크고 노선이 weekender하나라서 불편한 편입니다. 하지만 town이 크지 않아서 uber나 lyft를 이용해서 가까운 곳은 싸게 갈 수 있습니다. 날씨는 따뜻합니다. 여름에는 많이 더운 편입니다. (맑은 날이 많아서 그런 것 같기도...) 9월까지, 아니 10월까지도 좀 더웠던 걸로 기억합니다. 하지만 겨울은 그렇게까지 춥지 않습니다. 눈이 오면 모든 수업이 취소될 정도로 눈이 오는 일이 적습니다. Atlanta에서 약 한시간 반 거리에 있는 Athens는 전형적인 대학타운이고, 제 기준 시골입니다. 하지만 대학가이기 때문에 놀 거리는 많습니다. 안전하다는 점과 따뜻한 기후가 제일 마음에 들었습니다.","다운타운까지 걸어갈 수 있습니다. 기숙사(East Campus Village)에서는 30분 정도 걸리긴 하지만 할 일 없을 때는 걸어가도 됩니다. 다운타운에서 자취하는 친구들도 있었는데 거기 살면 수업 들으러 가기는 좀 더 편합니다. 캠퍼스가 남북으로 길게 있다고 치면 남쪽이 기숙사쪽이고 북쪽이 다운타운입니다. 그 중간에 여러 수업듣는 건물들이 있습니다. 저는 새벽 2-3시에도 많이 돌아다녀 봤고, 밤에는 아무래도 시골이라 다운타운이 아니면 거의 다 학생들이고 사람이 많지 않습니다. Gameday(풋볼 하는 토요일)에는 정말 많은 조지아 주민들이 학교로 와서 경기를 보고 Tailgating을 하기 때문에 북적거립니다. 그 때 빼고는 북적거리는 일이 거의 없습니다. 그냥 대부분 학생들이 돌아다닌다고 보시면 됩니다. 미국이라는 걸 감안할 때 정말 안전한 편입니다.","저는 East Campus Village에서 다른 교환학생 친구 한명과 미국 친구 두명을 룸메이트로 생활했습니다. ECV의 장점은 일단 다른 미국학교들에 비해서 싼 편인 기숙사비와 다양한 편의시설, 혼자 쓸 수 있는 방이 있다는 점입니다. 화장실은 룸메 한 명과 공유하지만 방은 각자 가지게 됩니다. 혼자 있을 수 있는 시간이 누구보다 중요했던 저는 방을 혼자 쓸 수 있다는 점이 매우 좋았습니다. 4명이 한 아파트먼트에서 살고, 2명씩 화장실을 공유합니다. 화장실을 같이 쓰는 룸메랑만 잘 맞으면 편하게 생활할 수 있습니다. 거실에는 소파가 있고, 미국 친구들은 TV를 집에서 들고 오기도 해서 말만 잘 해서 같이 보면 좋습니다. 식사는 한학기동안 7일짜리 밀플랜을 하다가 두번째 학기에 취소했습니다. 사실 음식은 매우 맛있습니다. 상도 받았다고 하고 영양도 잘 신경쓰는 그런 식단입니다. Bolton/Joe Frank Harris/O-house/Snelling 등 다양한 식당에 무제한으로 출입할 수 있다는 점이 가장 큰 장점입니다. Bolton은 제가 수업을 들었던 건물과 가까워서 많이 갔고, Joe Frank는 기숙사와 가까워 아침을 먹고나서나 운동을 한 후에 많이 갔습니다. 음식은 맛있었지만 평소 밥을 그렇게 많이 먹는 편이 아니라서 2학기에는 밀플랜을 취소하고 사먹거나 아마존에서 한국음식을 시켜서 해먹었습니다.","수업은 강의 계획서를 잘 보고 고르셨으면 합니다. 시험만 보는 과목들도 있고 팀플만 하는 과목도 있습니다. 저는 주로 Terry college의 경영 수업과 Grady College의 미디어/언론 수업을 들었습니다. Terry 에서는 1학기에 Principles of Accounting 1을 들었고, Grady에서는 Brandstorytelling(추천, 교수님 스윗), Public Relations(매우 쉬움.), Graphic Communication(온라인강의)를 들었습니다. 온라인 강의는 한학기에 한 개만 들을 수 있습니다. 2학기에는 Terry에서 Principles of Fintech(교수님 착하심, 많이 배움, 3시간 통강), Princicples of accounting 2(교수님 좀 까다롭지만 수업은 잘 하심), Risk management and Insurance(시험만 잘 보면 쉬움, 출첵 안함), Principles of Marketing(시험 4개로 성적 평가, 출첵 안함)을 들었습니다. Grady에서는Media, News and Consumers(전출, 꿀강) 을 들었습니다.제 경험 상 추천은 1. 출석 안보는 수업을 잘 선택하기 2. 팀플 있는지, 비중은 어떤지 확인 3. Rate my professor 사이트 들어가서 교수님 후기 확인이정도만 잘 하시면 원하는 수업 찾으실 수 있을겁니다. 아쉬운 점은 좋은 교수님 수업들은 교환학생들이 수강 우선권이 있는 게 아니기에 들어가기 어렵습니다. 수변때 스나이핑 필요합니다. 도서관은 Main library - 화이트보드에 쓰면서 공부 가능한 곳 있음. MLC - 접근성 좋고 시설 좋음. 친구들이랑 스터디룸에서 공부하고 바로 Bolton가서 밥먹기 좋음.나머지는 잘 안가서 모르겠습니다. Science library 도 좋다고 합니다. 대게 도서관이 넓고 맥북 24시간동안 빌릴 수 있고 카메라 삼각대 7일간 빌릴 수 있고 충전기도 빌려줘서 시설은 매우 좋습니다.,",ISL(international student life)에서 하는 오리엔테이션이 돈은 좀 들지만 참여하시길 추천드립니다. 그 때 친구들을 많이 사귀어서 1년 내내 행복하게 보냈습니다. 물론 오티는 우리나라에서 하던 새터 같기도 하고 아침 일찍 일어나서 프로그램 참여하는 게 피곤하기도 합니다. 하지만 전 참여한 걸 후회하지 않습니다. 다른 학교들에 비해 uga가 좋은 점이 ISL에서 국제학생들을 잘 챙겨준다는 점이라고 생각합니다. 프로그램이 다양해서 그것들만 참여해도 친구들 많이 만들 수 있습니다. 그 외에도 국제 교육부에서 담당자 분들이 잘 챙겨주십니다. 이메일로 안부 묻기도 하고 수강신청 관련해서도 Alyssa Johnson(담당자)께서 친절히 도와주셔서 전혀 문제 없었습니다.,"동아리도 많고 Engagement fair라고 해서 동아리박람회 같은 행사를 학기마다 합니다. 다들 친절하게 설명해주고 팜플렛도 나누어주기 때문에 가서 말 걸고 친해진 친구들도 있고요. 그리고 동아리를 꼭 들지 않더라도 어떤 동아리에서 주최하는 행사에 참가해서 친구를 사귈 수도 있습니다. Ramsey Student Center 는 ECV(기숙사)에서 매우 가까워서 운동을 하기 너무 좋습니다. 올림픽 규격 사이즈의 수영장에서 수영을 할 수 있고, 탁구채, 테니스라켓, 라켓볼 라켓과 공 모두를 빌려줍니다. 교환학생친구들끼리 배구팀/농구팀/축구팀을 만들어서 리그 경기에 참여하기도 했는데 재밌었습니다. 운동시설은 정말 단연 최고입니다. 동아리 하나 정도 들어서 활동해보면 좋을 것 같습니다. 들어간다고 하고 노느라 바빠서 자주 안가기도 했지만 대부분 동아리들이 활동 자주 하고 친구들도 많이 사귈 수 있습니다. ECV 가까이에 Lake Herrick이라고 호수가 있는데 거기는 걸어서 산책도 가고 조깅도 가고 날씨 좋은 날 돗자리 펴고 공부해도 좋습니다. 그 호수에서 Paddle board 타는 동아리가 있는데 추천드립니다. 카약을 Ramsey에서 빌려서 호수에서 타보세요 (저는 귀찮아서 못했는데 하면 좋을 것 같습니다.)","그렇게까지 큰 컬쳐쇼크는 없었고, 미국 드라마나 영화에서 보던 전형적인 컬리지 라이프를 즐기고 싶으시다면 UGA를 추천드립니다. 풋볼 시즌에는 꼭 시즌티켓을 끊고 친구들과 게임을 보러 가세요. 술도 먹고 응원도 하고 약간 연고전 같은 느낌 들고 재밌습니다. 그냥 성생활이 자유로운 게 좀 쇼크였다면 쇼크일 수도 있을 것 같습니다. 연애 같은 부분에서 이해가 안되는 미국 친구들 사고방식도... 그리고 조지아주 자체는 보수일지 몰라도 Athens는 정치적으로 진보적인 편입니다. 그래서 매우 자유롭습니다.",교환 담당자 (ISL / Global engagement 부서 / immigration) 이렇게 세 곳에 이메일이나 전화로 도움 요청할 수 있습니다. 조지아 한인교회 쪽 연락처 얻어서 도움 받았다는 분도 있었습니다. Global buddy 프로그램에 참여하시면 자신과 매칭된 buddy에게 도움 요청하셔도 됩니다. ISL 오티에서 이끌어주는 uga학생들은 World leader 라고 불리는데 그 친구들 번호 받아서 도와달라고 하셔도 됩니다.,"정말 후회 없이 잘 놀고, 배우고 왔습니다. 미국 교환학생 하면 떠올릴 수 있는 재밌는, 유익한 경험들은 다 했다고 생각합니다. 특히 살면서 1년 간 가장 여행을 많이 다녔습니다. 한국에서 오고 가는 것 합쳐 총 비행기를 탄 횟수만 해도 20번은 되는 것 같습니다. 안타깝게도 Athens는 여행다니기에는 접근성은 안좋습니다. 공항과 멀기 때문이죠. 친구들을 잘 사귀어서 공항갈 때 우버를 같이 타면 돈을 절약할 수 있습니다. 궁금한 점은 songmj1023@hafs.kr로 문의해 주세요."
