gen_info,env_info,food_info,study_info,office_info,facil_info,mhct_info,help_info,etc_info
"안녕하세요. 2016년 가을학기에 Eckerd college에 파견이 결정 되고 한 학기동안 정말로 즐거운 시간을 보냈습니다. 이 학교는 플로리다 서부 St.petersburg에 있는 College입니다. 학생 전체수로 보면 연세대학교와 비교할 수 없을정도로 적은 학생들이 다니고 있습니다.시간이 지나면 캠퍼스에 다니는 친구들이 다 거기서 거기라 자연스레 많이 친해 질 수 있는 기회를 많이 가질 수 있습니다. 모두들 나이스하고 인종들이 다양해서 이민자의 나라라는 수식이 굉장히 어울리는 공간이라고 말씀드리고 싶습니다. 인종별로 백인과 히스패닉이 주를 이루고 아프리카계 흑인이 그 다음인 것 같습니다. 아시아인은 대체로 찾아볼 수 없으며, 제가 갔을 당시에는 한국인은 딱 한명이 있었는데 미국 시민권자였습니다. 기후에 대해 말씀드리면,  플로리다라고 하면 다들 아시다시피 기후적으로는 어느 지역에 손색없는 최상의 기후 조건을 가지고 있는 지역입니다. 제가 파견나왔던 기간동안 항상 20도 이상을 상회하였고, 9월 첫 달은 다소 습하고 소나기가 내렸지만 이후로는 항상 상쾌하고 따뜻한 기상이 지속되었습니다. 여기에 거주하는 사람들 대부분은 12개월 내내 반팔과 반바지 옷차림이며 가끔 가다 바람막이가 필요할 때를 제외하고는 바다에 항상 들어가 해수욕을 즐겨도 손색이 없는 날씨가 계속됩니다. 날씨를 많이 따지시는 분들이라면 이 학교야 말로 최적의 조건을 가진 학교라 말씀드리고 싶습니다.","미국에 위치한 대학교라 생각하면 대부분 부대시설이 멀리 떨어져 있어 자가용이 필요하다고 많이 생각하실 겁니다. 자가용이 있으면 물론 좋겠지만 그 단점을 상쇄하고도 남을정도로 학교 근처에 부대시설이 많이 위치하여 생필품 조달이나 외식 혹은 문화 여가생활에는 전혀 문제는 없으실 겁니다. 자전거로 10~15분정도 위치한 거리에 2개의 대형마트와 수도없이 많은 패스트푸드점, 레스토랑이 위치해 있으며, 40~50분정도 타고 가면 St.pete 해변이 나타납니다. 자전거 타기가 부담스러우시다면 Uber나 Lyft라는 쉐어라이딩 어플을 이용하여 언제든지 시내로 가셔도 됩니다. 비용은 5~10달러로 혼잡시간에 따라 상이합니다. 친구들과 나눠서 비용을 내면 왕복으로 4~5천원 내외로 시내에 쉽게 갈 수 있으며, 영화관, 레스토랑, 펍, 쇼핑몰을 즐길 수 있습니다. 뿐만 아니라 학교에서 자체적으로 시행하는 버스 시스템을 통해 매주 금요일마다 시내를 왕복해서 운행하는 노선을 이용할 수 있고, 매주 수요일마다 월마트까지 왕복하는 셔틀 시스템을 이용하시면 됩니다. 부대시설과 여가시설이 학교와 근접해있어서 교통 때문에 어려움을 겪거나 비용이 많이 나가는 상황은 없습니다.","교환학생이라면 현지 학생과 2인 1실을 사용하게 됩니다. 모든 학생이 기숙사에 살고 있기 때문에 마음만 먹는다면 현지 친구들과 친해질 수 있습니다. 스스로 혼자 지내는 내향적인 스타일이라면 활발하고 에너지 넘치는 학교의 분위기와 맞지 않을 수 있습니다. 먼저 말 걸어주는 친구들이 많이 있으며, 아시아 문화권을 네이티브로 하는 친구들이 없기때문에 아시아쪽에서 교환학생 온 친구들에게 호기심을 많이 가지고 있습니다. 식사는 주로 Main Cafeteria에서 해결하며 이 학교에 지원하셨을 경우 이미 Meal plans을 지불하셨기 때문에 세끼 모두 이곳에서 해결하게 됩니다. 식사형태는 부페형식으로 구성되며 피자 햄버거 핫도그 뿐만 아니라 다양한 샐러드바와 시리얼, 다양한 고기종류가 있어 자신의 취향에 맞게 드시면 무방합니다. 다만 식단이 고정적이라 쉽게 물릴 수 있는데 그럴 경우에는 바로 옆에 있는 Pub에서 다양한 종류의 버거와 Pita, 퀘사디아 등을 드시면 해결이 됩니다. Pub에 경우에는 Mealplan에 포함되어있는 것이 아니라 학생증에 Flex dollors의 개념으로 한학기당 15만원을 사용할 수 있습니다. 이 돈으로 Pub에서 메인 카페보다 맛이 좋은 메뉴들을 이용하시면 됩니다. 다시 기숙사에 대해 말씀드리면, 기숙사는 Alpha부터 Zeta까지 많은 수의 기숙사가 있으며 여러분들은 2인 1실의 기숙사에서 생활하게 됩니다. 각 동마다 RA가 있으며 문제가 생길경우 바로 얘기하면 해결해 줄겁니다. 화장실은 공동화장실이지만 작년에 보수공사를 해서 사실상 개인화장실처럼 이용할 수 있어서 사생활 침해나 성관련 범죄로부터 굉장히 안전합니다. 뿐만 아니라 매일 청소하는 분이 계셔서 매우 깨끗하게 시설이 유지 되고 있습니다. RA 활동이 매우 활발하여 항상 기숙사에서 이벤트나 엑티비티가 있으니 그것에 참여하여 친구를 만들거나 즐거운 시간을 보낼 수 있습니다.","이 학교는 제 전공이 없었기 때문에 거시경제학, 중동정치의 이해, 동아시아 문화, 연극 수업을 들었습니다. 수업 별로 난도는 대체로 평이하고, 인원은 대개 소규모로 10~15명 정도로 진행되며 토론식 수업을 지향하는 분위기입니다. 저의 경우 영어사용이 제한적이라 매우 걱정이 되었지만, 학기초에 양해를 구하고나니 교수님 뿐만 아니라 수업을 듣는 학생들이 많이 도와주었습니다. 아무래도 네이티브가 아니기 때문에 퀄리티가 낮을 수 있지만 현지학생들과 마찬가지로 수업참여에 적극성을 띤다면 성적을 평가하실 때 약간의 보정을 통해 좋은 점수를 받을 수 있습니다. 이것은 공식적인 것은 아니지만 제 경험을 미루어봤을때, 교수님들이 약간은 그 부분을 고려하시는 것 같습니다. 다만 이 학교를 선택하기전에 고려하셔야 할 점은, 수업의 퀄리티나 학생들의 수업 참여도등이 연세대와 비교했을 때 다소 떨어진다는 점입니다. 공부 외에 다른 문화적 요소나 Activity를 추구하시는 분이라면 이 학교를 적극 추천합니다. 도서관의 경우는 우리학교 학생회관 크기정도의 건물 한 동이 있습니다. 그 곳에서 프린트를 하거나 컴퓨터를 이용하실 수 있습니다. 장서량은 절대적으로 부족하고 시험기간을 제외한 경우에는 비교적 한산한 모습을 보입니다. 저는 교환학생 친구들과 매일 같이 도서관 세미나실에서 하루를 보냈는데, 시설은 굉장히 깨끗하고 아늑해서 공부를 안해도 그 공간에서 시간을 많이 보냈던 것 같습니다.","국제교육ㅂ에서는 여러분들이 처음에 왔을 때 교환학생들을 대상으로 진행하는 학교 투어형식의 오리엔테이션을 제외하면 학기중에는 그다지 갈 일이 없으실 겁니다. 그곳에 계신 선생님들께서는 대체로 국제학생들의 고충을 적극적으로 들어주시고 해결해 주시려는 모습을 보여 저에게는 그다지 트러블이 있거나 하지 않았습니다. 다만 다른 친구들의 말을 빌려보자면, 수강변경을 위해 찾아갔는데, 지난번에 결정한 것을 왜 번복하느냐고 나무랐다며 매우 불친절하고 국제학생들을 위해 하는 일이 없다는 그런 푸념을 늘어놓기도 했습니다. 사람마다 그리고 상황에 따라 다르기 때문에 이점은 참고만 하시면 좋겠습니다. 대개 첫 날에 만난 다른 교환학생들이 이 학교를 와서 처음 만난 친구이기 때문에, 본인들의 소속이 국제학생인것은 감안하면 아무래도 학기생활을 하면서 주로 만나는 친구가 될 것입니다. 하지만 가능성을 열어두시고 현지 친구들과도 많이 친해지려고 노력하신다면 충분히 네트워크를 넓히실수 있을 것입니다.",옐로 바이크/ 파티/ 워터프론트,LGBT 소수자,교회나 한인 타운 x,
