gen_info,env_info,food_info,study_info,office_info,facil_info,mhct_info,help_info,etc_info
"크기
교환대학의 크기는 아주 큰 편은 아니지만 아주 작지도 않습니다. 끝에서 끝으로 걸어가는데 한 30분이면 넉넉합니다. 연대와는 다르게 평지에 건물이 다 있어서 걸어서 캠퍼스 안을 다니는데 불편한 점은 없습니다. Bowling Green이 학교도시이기 때문에 학교를 뺀 도시 전체는 매우 작습니다. Downtown이라고 해도 그다지 크진 않습니다. 차를 타고 Main Street을 지나가면 한 5분이면 다 지나갈 수 있습니다.

지리적위치 및 기후
지리적 위치는 미국 북동부에 위치해서 아주 춥습니다. 제가 파견되어 있던 해에는 그나마 겨울이 아주 춥지 않다고 했는데도 10월부터 눈이 오기 시작했고 가장 추울 때는 영하 18도를 넘나들었습니다. 그리고 겨울도 아주 길어서 제가 그 곳에 있을때는 4월까지 눈이 왔었습니다. Bowling Green은 눈이 오면 엄청 많이 옵니다. 가을 학기 도중에 눈이 너무 많이 와서 snow day라고 이틀이나 학교를 쉰 적이 있습니다. 흔한 일은 아니라고 하지만 그정도로 눈이 오면 많이 옵니다. 처음 8월에 도착하면 날씨가 덥긴 하지만 습하지가 않아서 아주 덥게 느껴지지는 않았습니다. 에어컨 시설도 잘 되어있어서 실내에 있을때는 춥게 느껴진 적도 있습니다. 5월은 tornado의 계절이라 가끔씩 토네이도가 출현하기도 합니다. Bowling Green 도시 자체가 매우 평평하고 산도 없고 대부분 콩밭이나 옥수수밭이기 때문에 자주 출현한다고 합니다. Bowling Green날씨 중에서 가장 견디기 힘들었던 것은 거센 바람입니다. 사시사철 바람이 너무 강하게 불어서 특히 겨울에는 더 춥습니다. 봄에도 날씨는 매우 화창한데 바람이 너무 심하게 불어서 춥게 느껴진 적도 많습니다.","위에서도 말했듯이 Bowling Green 도시가 학교도시이기 때문에 학교 주변에 아주 다채롭게 할 것이 있지는 않습니다. 학교 어디에서 캠퍼스를 벗어나는지에 따라 다르긴 하지만 학교에서 나가면 subway와 Mcdonald같은 패스트푸드 점이 있고 서점 및 기념품 잡화매장이 하나 있습니다. 학교 바로 바깥에는 이처럼 음식점이나 스타벅스가 전부이고 좀더 나가서 Main Street로 나가면 바, 클럽, 식당, 커피숍, 식당 등 bg학생들이 주로 노는 곳들이 있습니다. 미국은 만 21살 이상이 되어야 술을 마실 수 있기 때문에 바에는 만 21살 이하면 대부분 출입이 불가합니다. 반면에 클럽은 출입은 가능하되 술은 마실 수 없습니다. 식당은 대부분 미국화된 멕시칸 식당이나 이탈리안 식당이 대부분입니다. 또 메인 스트리트에는 은행들이 집중되어 있는데 key bank, sky bank, huntington bank, fifth-third bank가 있습니다. 학교도시라 학생거주율이 많은 도시라서 파티가 많은 편입니다. 대부분 친구 집에 모여서 술을 마시는 거하지 않은 파티이지만 학기 시작 바로 전 1주일부터 학기 시작하고 나서 한달간은 많이 하는 편입니다. 학기 시작하고 나서 친구를 사귈 수 있는 좋은 기회이기도 합니다. Wall-mart나 Kroger같은 큰 마트는 학교에서 좀 멀리 떨어져 있어서 걸어가기는 힘듭니다. 그러나 셔틀버스를 이용하면 갈 수 있으니 마트를 다니는데 아주 불편하지는 않습니다. 학교 내에도 편의점은 있어서 왠만한 물품은 다 살 수 있지만 학교 안에서 사는것이 비싼 편이어서 되도록이면 물건은 밖에서 사는것이 낫습니다. 그리고 주유소에도 편의점이 있으니 마트를 가기가 너무 멀고 번거로우면 학교 바깥 주유소 편의점을 이용 할 수 있습니다.","보통 교환학생으로 파견되면 Kreischer Compton Hall의 International floor에 배정받게 됩니다. 대개는 룸메이트는 미국인으로 배정받게 됩니다. 대개 같은 층에 배정된 미국인은 외국에 관심이 많거나 International study를 하는 학생인 경우가 많습니다. 그래서 다른 미국인들보다는 대체로 외국인에 대해 호의적이고 호기심이 많습니다. 기숙사방은 아주 작고 침대 2개 책상 2개 옷장 2개 그리고 서랍 2개가 있습니다. 침대가 2층침대 높이로 위에 있으나 1층 침대는 없어서 침대 밑에 가구를 놓을 수 있게 되어 있습니다. 처음에는 위에서 자는게 익숙하지 않았지만 나중엔 익숙해 질 수 있었습니다.

식사는 저는 주로 기숙사에 근처에 있는 Sun Dial에서 먹은적이 대부분입니다. 학교 식당인데 처음에 meal plan을 하고 나면 학교 카드를 현금카드처럼 쓰는 시스템입니다. 학교식당의 음식은 맛이나 질에 비해서 매우 비싼 편이지만 기숙사랑 가깝기 때문에 자주 이용했습니다. 그리고 Asian grill sector가 있어서 그나마 어설프긴 하지만 아시아 음식을 먹을 수 있습니다. 아시안 그릴을 제외한 다른 부분에서 주로 나오는 음식은 샌드위치나 햄버거 또는 라자냐 등이라서 외국음식이 입에 잘 안맞는 사람은 음식 때문에 고생할 수가 있습니다. 그러나 위에서 언급한 바와 같이 아시안 그릴에 가면 한국 쌀이랑은 다르지만 밥을 먹을 수 있습니다. Sun Dial외에 Commons, Union 등에서 식사를 할 수가 있습니다. 커먼스는 Subway 샌드위치처럼 샌드위치를 직접 만들어 주는 곳입니다. 유니언에서 가장 먹을 것이 많은데 Compton에서 가장 먼 것이 흠입니다. 유니언 2층에는 부페도 있어서 질 좋은 식사를 할 수가 있습니다. 기숙사 안에 주방이 있어서 음식 재료만 있으면 한국 음식을 해먹을 수가 있지만 도구와 주방 키를 빌려야 하는 번거로움 때문에 잘 안 만들어 먹게 됩니다. 그리고 주방에 밥솥이 없어서 정말 한국 밥을 먹고 싶을 때는 다른 한국인이나 일본인 친구에게 부탁하곤 했습니다.","수업은 첫학기는 16학점 둘째 학기는 12학점을 들었습니다. 12학점이 최저 학점이라 12학점 밑으로 등록할 수 없는 것으로 알고 있습니다. 처음 가면 오리엔테이션을 하는데 그 동안에 영어 시험과 필요한 사람은 수학 시험을 보게 됩니다. 그래서 ESL과목에 지정을 받게 됩니다. 영어 과목은 그 학교에서 특정 학점 이상을 들어야만 졸업을 할 수 있기 때문에 그 학교를 졸업하고자 하는 학생은 꼭 들어야 하지만 교환학생은 듣지 않아도 됩니다. 첫번째 학기에 저는 ESL Academic Comp II, Production-Operations Mgt, Org'l Theory and Behavior, Intro Mgmt Info Sys, Elementary French II를 들었습니다. 수업방식은 교수님의 특성에 따라 토론식 수업 위주인 수업이 있고 강의식 수업 위주인 것이 있습니다. 특히 조직 같은 경우는 그룹 프로젝트가 있어서 조모임을 해야 합니다. 2학기에는 Money and Banking, Internatl Trade Fin, Personal Finance, Business Finance 이렇게 들었습니다. 모든 과목에서 요구하는 수학은 그다지 문제가 되지 않을 정도로 고난도의 수학능력을 요구하지 않았습니다. 다만 Internatl Trade Fin과목은 토론이 많고 외국인이다 보니 교수님이 물어보시는게 많아서 수업시간 도중에 혼자 말해야 하는 경우가 많았습니다. 하지만 이것도 교수님의 특성에 따라 많이 좌지우지 되는 것 같습니다. 보통 경영과목은 시험이 한 학기에 기말까지 포함하여 3-4번 있고 숙제도 자주 내 주는 편입니다. 숙제는 아주 많은 양이 아니고 보통 30분이면 다 끝낼 수 있는 숙제입니다. 보통 다음 배울 부분을 읽어 오거나 관련 기사를 읽어오는 숙제가 많습니다. 재무의 경우는 연습문제 푸는 숙제가 많았습니다. Money and Bankingd의 경우는 aplia라는 새로운 홈페이지에 등록해서 매주 있는 숙제를 풀어야 했는데 그 숙제를 하는 것이 시험공부에도 많은 도움이 되었습니다. 

저는 룸메이트가 조용한 편이어서 주로 방에서 공부했습니다. 도서관은 7층과 8층에 독서실 같은 분위기의 학습실이 있고 1층에도 공부할 수 있는 공간이 있습니다. 도서관에서 복사도 할 수 있고 노트북도 빌릴 수 있습니다. 컴퓨터도 1층에 여러대 구비되어 있어 레포트를 쓰기에도 편하게 되어 있습니다.",처음 오리엔테이션에서 처음 접하는 부서가 국제교육부입니다. 오리엔테이션에서 교환학생 및 외국인 학생 담당자와 여러번 대면 할 기회가 있고 또 처음 수강신청을 할 때에도 국제교육부를 통해서 하게 됩니다. 문제가 생기거나 교환학생 제도에 대해 미국쪽에 문의가 있을 때는 국제교육부를 통하는 것이 가장 빠릅니다. 다만 수강신청을 할 때라든가 자체 행사를 계획할 때 국제교육부는 많은 도움이 되지 못합니다. 저도 그래서 2학기 수강신청 기간에는 저 혼자 경영학부에 찾아가서 담당 비서를 다 만나가면서 대기자 명단에 올리고 등록하고 했었습니다. 하지만 교환학생 제도에 대해서는 국제교육부 만큼 아는 부서나 사람이 드물기 때문에 교환학생 제도가 미국에서 어떻게 진행되는지에 대해서 문의가 있으면 국제교육부에서 문의하시는게 가장 빠릅니다.,학교 안에 rec center가 있는데 그 안엔 웨이트 트레이닝 기구 및 런닝 머신 등 휘트니스 센터만큼 잘 구비되어 있고 수영장과 농구장도 있어 운동을 하기에 좋습니다. 게다가 Bowling Green학생이면 공짜이기 때문에 자주 이용하는데 부담도 없습니다. 그 외에 학교 안에 골프장도 있어서 골프를 즐기시는 분이라면 자주 이용하실 수가 있습니다.,미국문화가 저에게 아주 생소하진 않아서 그다지 큰 culture shock는 없었습니다. 우리나라보다 성문화가 문란한 것도 사실이고 언변의 자유가 매우 강하고 다인종 국가이기 때문에 어느정도의 인종차별주의가 있는것도 사실입니다.,처음 들어가면 외국인 학생을 도우려고 하는 교회단체가 많습니다. 잘 곳이 필요하다든지 이동수단이 필요하다든지 할 때 가장 먼저 선뜻 도움을 주는 곳이 교회봉사단체입니다. 그러니 처음 가셨을 때 교회봉사단 중 한명을 잘 알아두시는게 좋습니다. 그 외에도 학교 동아리에서 도움을 받을 수 있고 학교 내 단체에서도 도움을 받을 수 있습니다.,외국생활은 어떤 친구를 만나느냐에 따라 많이 좌지우지 되는거 같습니다. 저는 정말 좋은 친구들을 만나서 외국생활을 즐기면서 많은 경험을 할 수가 있었습니다. 친구를 사귈 기회는 파견기간 내에 꾸준히 있지만 오리엔테이션 기간에 가장 빨리 그리고 쉽게 사귈 수가 있습니다. 친구를 사귀려면 적극적으로 내가 먼저 다가가는 태도가 필요합니다. 수줍어서 먼저 다가가지 못하면 먼저 와서 말을 걸어주는 경우는 드물다고 할 수 있습니다. 이 외에도 수업에서나 평소에나 적극적인 태도를 갖는것이 교한학생 생활을 뜻깊게 보낼 수 있는 방법입니다. 영어를 다른 주위사람들보다 못한다고 너무 주눅들지 않는 것도 중요합니다. 그럼 Bowling Green에서 뜻깊고 즐거운 교환학생 생활을 누리시길 바랍니다.
