gen_info,env_info,food_info,study_info,office_info,facil_info,mhct_info,help_info,etc_info
"Creighton은 미국 중부 Nebraska주에 있는 Omaha라는 도시에 있다. 중부이기 때문에 한국인들에게 생소한 도시이지만 Warren Buffet이 사는 도시로 유명하다. 사립학교로 그 크기는 작지만 비교적 소수 정원의 수업들이 밀도있고 교수와 학생들이 친밀감있게 진행된다. 완전한 내륙 지방이기 때문에 겨울에는 매우 춥고, 여름에는 매우 덥다. 겨울에는 눈이 많이 내려서 캠퍼스에서 녹지 않은 눈을 4월까지도 볼 수 있었다. 여름에는 온도가 매우 높은데, 습한 더위가 아니어서 우리나라의 여름과는 다른 더위를 느낄 수 있다. Creighton 학교는 공항과 그리 멀지 않아서, 공항에서 택시를 탈 경우 15불 정도면 학교에 도착할 수 있다. Omaha로 가는 비행기를 타면 알 수 있겠지만 중부로 White America의 문화를 잘 느낄 수 있는 곳이라 생각한다. 학교에서도 Hawaii에서 오는 친구들을 제외하고는 흑인이나 아시안 계열 학생들이 동부나 서부에 비해서 현저히 적음을 알 수 있다. 학교 재학생들 중에서 타 주에 비해 한국인들이 많지 않다.","Omaha라는 도시가 비교적 작고 조용한 도시이기 때문에 한국 학생들이 익숙한 LA나 New York과 같은 대도시에 비해서 할 수 있는 것이 많지 않은 것이 사실이다. 하지만 학교에서 멀지 않은 Downtown의 Old market이라는 곳에 가면 생각지 못했던 재미난 것들을 많이 경험할 수 있다. 오마하가 Steak로 유명한 도시인데 스테이크를 즐길 수 있는 많은 음식점들과 수제 아이스크림집, 또 많지는 않지만 다른 나라의 음식을 맛볼 수 있는 음식점들도 많이 찾아볼 수 있다. 또 관심있게 살펴보면 어느 기간에 따라서는 Old Market에서 여러 행사가 개최되기도 하기 때문에 충분히 즐거움을 찾을 수 있다. 쇼핑을 할 수 있는 Mall은 아주 많거나 가까이 위치하지는 않지만 ride를 구해서 친구들과 함께 가면 충분히 가능하고 식생활에 필요한 물건들을 사기 위한 어려움은 없다. 다만 White America의 본고지라 할 수 있는 중부이니만큼 Korean Town이 따로 형성되어있지 않고 한국 음식점들도 많지 않다. 차를 타고 가야하는 거리에 있어서 차가 없는 교환학생들의 경우에는 자주 한국 음식을 먹기는 쉽지 않다. 근처에는 걸어갈 수 있는 거리에 Museum이 있고, 차를 타고 갈 수 있는 거리에 여러 공연을 즐길 수 있는 곳도 있다.","Creighton은 대부분의 학생들이 기숙사 생활을 한다. Kennefick,Heider, McGloin, Kiewit, Davis Square, Opus Hall, Degleman 등이 있다. 이 중 Davis 와 Opus의 경우는 아파트 형식으로 Junior와 Senior학생들이 사는 Dorm인데 굉장히 좋은 시설을 갖춘 건물들이다. 그리고 다른 건물들과는 달리 각방이 있어서 룸메이트가 있지만 서로 잠은 따로 잘 수 있게 되어있다. 
실제로 첫 학기를 Mcgloin (Sophomore)에서 살고, 두번째 학기 때 Opus에서 살았는데 건물의 차이가 엄청나다. 부엌, 화장실 등 모든 시설이 Opus의 경우는 굉장히 잘 갖추어져있다. 식사의 경우 Meal plan을 신청했는데 학교의 Cafeteria에서 시간대에 맞춰서 식사를 할 수 있다. 대표적인 Cafeteria로 대부분의 학생들이 Brandeis Hall에서 많이 식사를 하는데 실제로 이곳은 내가 있었던 2011년 여름방학 기간동안 remodeling을 해서 굉장히 위생적이고 modern하게 바뀌었다. Cafeteria는 단순히 식사만 하는 곳이 아니라 여러 친구들을 만나서 안부를 묻고 이야기 할 수 있는 공간이다. 학교가 크지 않기 때문에 학교 식당에서 밥을 먹다 보면 친구들을 많이 만날 수 있는데 그때마다 친구들과 만나 웃고 대화하는 시간이 Creighton의 대학 생활에서 빼놓을 수 없는 즐거움이자 추억이었다. Cafeteria는 부페 형식으로 먹고 싶은 음식을 마음껏 먹을 수 있지만, 주로 아시안 음식들은 거의 나오지 않기 때문에 음식을 가리거나 짠 음식들을 싫어하는 학생들에게는 조금 어려움이 있을 수 있다. 하지만 다양한 음식이 있기 때문에 큰 어려움은 없을 것이다. 그리고 한국음식이 먹고 싶으면 ride를 구해 아시안 마켓에 가서 재료를 구입해 음식을 해 먹을 수 있다.","수업의 경우 앞서 말했듯이 소수 정원으로 주로 이루어진다. 우리 학교에서 경험할 수 있는 100명이 넘는 학생들이 함께 듣는 대형강의는 거의 없는 것으로 알고 있다. 실제로 내가 들은 수업들 중 학생들이 가장 많았던 수업은 최대 40명 정도 되는 수업이었다. 따라서 교수들은 학생들에게 훨씬 더 많은 personal attention을 갖게 하고, 이것은 처음에는 익숙지 않고 부담으로 느껴질 수 있지만 익숙해지면 훨씬 더 많이 배우고 느끼는 좋은 조건임을 깨닫게 된다. 또한 한국과는 달리 교수와 학생들의 관계가 굉장히 편하고 가까워서 질문이나 수업 중 발언에 대해서 굉장히 관대하며 환영하는 쪽이 더 가깝다. 따라서 토론이나 그룹 모임들이 자연스럽게 수업 중에 많이 이루어지기도 한다. 도서관의 경우 대개 평일과 일요일에는 12시까지 문을 열고 금요일과 토요일에는 이른 저녁까지 문을 연다. 하지만 시험기간에는 새벽 2시까지 개방된다. 또 24시간 개방되는 common room이 있어서 열람실이 개방하는 시간 외에는 그 곳에서 공부를 할 수 있다. 그리고 빈 강의실에서도 공부를 하는 학생들이 있기 때문에 늦게까지 공부하기를 원할 경우 친구들과 함께 빈 강의실에서 함께 공부하는 것도 충분히 가능하다. 학업을 위한 환경에서는 거의 어려움을 느낄 수 없었다. 또한 도서관에 있는 사서들에게 도움을 청하면 굉장히 친절하게 도움을 주기 때문에 두려워하지 말고 도움을 요청해 누릴 수 있는 것들을 많이 이용하는 것이 현명한 방법이다.","Harper Center에 4층에 가면 International Office가 있는데, 떠나오기전 건물을 옮길 계획이라는 얘기를 들어서 이 점은 따로 확인을 할 필요가 있다. International office에서 일하는 분들은 정말 너무나 친절한 분들이다. 학생들이 영어에 어려움이 있다는 것도 알고, 국제 학생들의 이외 어려움에 대해서도 가장 잘 아는 분들이기에 우리에게 최선의 서비스를 제공해 주시는 분들이다. 따라서 아주 사소한 문제라도 의문점이 있거나 어려움이 있을 때마다 그 분들을 찾아가는 것을 주저하지 말아야 한다. 그 어떤 문제에 대해서도 늘 친절하게 도와주시고자 한다. 또한 학기 시작 전에 Orientation 기간을 갖게 되는데 그 기간동안 많은 정보와 도움을 주시기 때문에 학교 생활을 하는데 많은 도움을 받을 수 있다. 실제로 1년이란 기간동안 많은 어려움들이 있었지만 그곳에서 도와주는 분들이 계셨기 때문에 학교 생활을 잘 할 수 있었고, 그렇기에 가장 많이 찾아가고, 가장 많이 감사했던 곳이 바로 국제 교육부다.","학교 학생회관이 정말로 잘 되어있다. 학생들을 위한 복지가 너무나 잘 되어있다는 것을 느낄 수 있는 대표적인 부대시설이다. 학생회관은 체육관과 연결되어 있는데 매점과 여러 자판기뿐만아니라 안마의자, 포켓볼, 피아노 등등 학생들이 정말 편하게 쉬고 즐길 수 있는 환경을 제공하는 곳이다. 또한 Gym도 굉장히 잘 되어있어서 다양한 운동들을 즐길 수 있다. 라켓볼, 테니스, 배드민턴, 헬스 뿐만아니라 에어로빅, 요가, 축구, 배구, 농구 등등 거의 모든 스포츠를 즐기는 것이 가능하다.","다른 나라에서 생활하는 것이 처음이었던 나에게 Creighton에서의 생활은 하루하루가 새롭고 배울 것으로 가득했다. 미국 문화가 우리 문화에 비해 개방적이고 언어에 대한 어려움 때문에 힘들고 적응이 안될 수 있는 것이 사실이다. 하지만 새로운 문화를 경험하러 간 만큼 나 자신도 개방적이고 적극적이고자 노력하는 것이 필요하다. 또 LA나 New York과 같은 대도시를 생각하고 간다면 그 차이점에 어려움을 겪을 수도 있다. 하지만 아시안인이나 흑인들을 흔하게 볼 수 없는 그 특성 때문에 백인들의 문화를 좀 더 직접적으로 경험할 수 있는 좋은 도시이기도 하다. 미국 친구들은 Sexual 농담을 서슴지 않게 하는 경우가 많아 처음에는 많이 당황했었는데, 시간이 가면서 그 문화를 점점 알게 되면 그런 어려움들은 자연스레 해소될 수 있다.","International Office에서 많이 도움을 받았으며, 수업을 해주시는 교수님들을 직접 찾아가 도움을 청해도 흔쾌히 도와주신다. 또 현재 Creighton에 한국인 교수님이 한 분인가, 두 분 계시다. 그 분들을 찾아보는 것도 좋은 방법이다.또한 한국인들이 많지는 않지만 KSA라는 한국 학생회가 있어 연락을 해보는 것도 도움이 될 수 있다. 종교활동을 위해 Omaha에 있는 종교 기관(성당, 교회)등을 알아봐서 연락을 하면 역시 많은 도움을 받으 수 있다.",cysrosa@gmail.com 로 연락주시면 문의사항 답해드리겠습니다^^
"Creighton은 미국 Mid-west의 Ivy leagure라고 불릴 정도로 한국에 잘 알려지진 않았지만 그 나름의 Name Value를 충분히 갖고 있는 학교이다. 비교적 작은 규모의 학교이지만, 교수당 학생수 비율이 낮아서 교수와 학생간의 친밀도가 매우 높다. 
지리적으로 미국 중서부인 Nebraska에 위치해 있으며 내륙지방이기 때문에 겨울에는 매우 춥고 여름에는 더운 편이다. 특별히 Creighton은 Omaha라는 Nebraska주의 가장 큰 도시에 위치하고 있으며 이 도시는 세계적인 거부 Warren Buffet으로 유명한 도시이다. 이  도시는 MIssouri River을 경계로 Iowa주와도 접경하고 있다. Creighton의 위치는 Airport와 가까워 공항에서 내리자마자 택시로 10분 정도 거리에 학교가 위치해 있어 어렵지 않게 학교를 찾을 수 있다. 또한 이 곳은 미국 중서부의 전형적인 특징을 가장 잘 보여주는 도시가 아닐까 생각한다. 미국의 Coastlines에서 사는 새침스러운 사람들과는 달리 매우 따뜻한 마음씨를 지닌 미국인들을 사귈 수 있으며 대체적으로 사람들이 conservative하고 religious하다. 미국의 여러 곳을 돌아다녀 보았지만, 전형적인 Caucasian oriented culture을 제대로 경험할 수 있는 곳은 이곳 Omaha, Nebraska가 가장 적합하다고 생각한다.","미국 동부나 서부 coastline에 위치하는 metropolitan areas들과는 달리, 비교적 조용하고 작은 도시에 속하기 때문에 특별히 즐길만한 곳은 많지는 않다. 하지만 downtown area의 old market이라는 곳에 가게 되면 원하는 모든 것을 경험해 볼 수 있다. 특별히 Omaha는 steak가 전세계적으로 유명한데 여러 Steak house를 비롯하여, wine을 즐길 수 있는 bar들과 Mexican, Italian, French, Greek, Irish음식들을 경험해 볼 수 있고 게다가 여러 수제 아이스크림집과 수제 cady shop까지 말그대로 없는 것 빼고 모두 해 볼 수 있다. 특별히 토요일 아침마다 열리는 Old market의 전통샂ㅇ에는 여러 꼬마 악사들이 나와서 연주하고, 매우 fresh한 야채들과 , 빵, 고기등을 맛 불 수 있다. 학교 근처에서 갈 수 있는 Grocery store는 drug store인 Walgreens밖에 없지만 ride를 구해서 main street인 Dodge street으로 나오게 되면 여러 대형 Mall들과 Target, Walmart, Hyvee등을 이용할 수 있다. 이 곳 Omaha가 재미있는 것은 세계적으로 dominant한 Starbucks가 그다지 많지는 않다는 것고 Dunkin Doughnuts가 없다는 것 심지어 매우 시골인 Arkansas에도 Starbucks는 매 corner마다 만날 수 있는데 이 곳은 그렇지 않다는 것이라는 점이다.","Creighton은 거의 80%이상의 학생들이 기숙사 생활을 한다. 그래서 학교 안에 기숙사가 매우 많은 데, Kennefick, Heider, McGloin, Kiewit, Davis Square, Opus Hall, Degleman 등이 있다. 특별히 Creighton의 Junior와 Senior들을 위해서 지은 Apartment형식인 Davis Sqaure와 Opus Hall 건물이 있는데, 이곳은 기숙사라기 보다 Town house난 Single House형식의 Complex라고 볼 수 있다. 그만큼 훌륭한 시설을 갖추고 있다. 나는 Opus Hall의 Loft형식의 집에서 한학기를 지낼 수 있었는데 침대와 책상, 의자, closet, drawers가 이미 갖추어져 있었으며, 두명이서 함께 사용하는 화장실 그리고 욕실, living room과 couch, kitchen and stand bar 그리고 stool, microwave, oven stove, washing machine, refrigerator등 모든 것이 다 갖추어져 있다. Loft형식이었기 때문에 lower level에는  나와 하우스메이트가 사용하는 2개의 bed room 과 bathroom living room, kitchen이 있고, upper level에는 2명의 또 다른 housemates가 사용하는 2 bedroom rhk 1 bathroom 과 1bathroom 그리고 dining room이 있다. 식사는 meal plan을 신청했기 때문에 학교의 Cafeteria에서 먹고 싶은 것을 시간 대에 맞추어 order해서 먹을 수 있거나 Brandeis Hall나 Baker hall이라는 Cafeteria에서 Buffet형식으로 원하는 음식을 양껏 먹을 수 있다. 이 meal plan을 신청해서 더욱 좋았던 것은 밥을 먹으면서 여러 친구들을 사귈 수 있었다는 것이다. 아침, 점심, 저녁 식사를 함께 하면서 함께나누는 담소는 나에겐 정말 잊을 수 없는 소중한 추억임과 동시에 사귀게 된 친구들은 나에게 너무나도 소중한 재신이다. 영어가 느는 것은 당연히 부수적으로 따라오는 advantage가 되겠다.","교수 1인당 학생수가 비교적 적기 때문에 상대적으로 교수의 학생에 대한 관심도(집중도)가 증가하게 된다. 게다가 대부분의 수업이 (물론 교수의 성향에 따라 다르기도 하지만) 토론식 숟업, 발표식 수업이 많이 진행되기 때문에 학생들의 참여를 매우 많이 요구한다. 미국에서는 Plagiarism이 한국 보다도 더 큰 issue이기 때문에 creative하게 자신의 논리를 스ㅡ로 펼치는게 더욱 중요하다. 적어도 내가 들은 수업들에서는 남의 생각을 그대로 옮겨오거나 베끼는 것에 대해 수치스럽게 생각하고, 스스로 창작하는 것을 즐기며 자신의 창작성을 드러내는 일을 매우 당연하게 생각했다. 그렇게 수업을 준비하는 시간이 많아지면서 수업에 참여하는 참여도 또한 매우 높아지게 되었다. 
학교 자체가 큰 규모가 아니라 연세대 중앙도서관 만큼 큰 도서관은 아니었지만, 공부하기에 좋은 모든 시설을 갖춘 Reinert Alumni Library가 있다. 이 곳에서의 나의 favorite spot은 2층의 개인 백열등 아래서 cushioned high stool이었는데 이곳에서 책 읽는 것을 즐겼고, 시험기간에는 친구들과 함께 study room에서 토론 하며 시험에 대한 정보도 공유하면서 공부하는 것을 즐겼다.","Harpers Center에 가게 되면 4층에 국제교육부가 있는데, 입국전 입국 후 출국전 후까지 많은 도움과 care를 받을 수 있는 곳이다. 교환학생에게 자세한 orientation과 적응하는데 필요한 모든 정보와 도움을 제공한다. 처음에 은행 account open하는 것과 shopping하는 것 까지 도와주셔서 어렵지 않게 적응 할 수 있다. 종종 국제교류행사를 가져, 어러 다른  나라에서 온 국제학생들과도 친분을 맺을 수 있도록 장려하기도 한다. 특별히 2월 달에 열린 International Student Banquet 2009에서는 한국의 문화를 소개하는 기회도 갖고 전세계의 다른 문화를 동시에 체험하는 좋은 기회를 갖도록 해주었다.","의대, 치대 간호대, 약대 oriented schoo이므로 상대적으로 인문학 분야가 약하다. 하지만 science이외에도 여러 다양한 전공들이 있기 때문에 여러 과목들을 체험해 보는데에 무리가 없다. 교환학생 신분으로 여러가지를 경험해보자는 일념으로 나는 연세대에서 시간에 쫓겨 듣지 못하고 있었던 music class, dance calss, exercise class들을 register해서 여러 가지를 경험해 보았는데 너무나 소중한 경험이었다. 다양한 분야의 친구들을 사귈 수 있는 또 하나의 기화가 되기도 한다.","제작년에 1년 휴학을 하고 Maryland에서 생활을 했기에 미국생활에 적응하는데 별 어려움은 없었다. 하지만 미국 중서부는 매우 Americanized society이기 때문에 미국의 diversity를 느낄 수 있다기 보다 Caucasian 중심의  culture를 직접 경험 할 수 있다. (내가 들은 수업의 대부분은 나 혼자가 유일한 동양인이고 나머지는 모두 백인이었다.) 일찍이, 동유럽과 Germna쪽에서 많은 사람들이 이주해왔기 때문에 종교적으로 Lutheran이 많다. 비교적 Catholic도 많은 편이다. East Coast에서 살 때에는 한국인을 보는 일이 드물지 않았는데 이 곳은 동양인 보기가 드문 신기한 도시이다. 인구 비율적으로 Caucasian이 다른 인종들 Hispanic과 African American보다도 우세한 white oriented city and schoo이라고 성격을 정의 할 수 있겠다.","워낙 한국인이 많지 않은데다가 내 스스로 한국인 사회를 찾지 않고 이 사회 그대로에 적응하려고 노력하다보니 많은 한국인을 알지는 못하지만, 들은 바에 의하면 Omaha라는 큰 도시에 약 1,000명 가량 만의 한국인이 살고 있다고 한다. 그러나 학교에 한국인 교수님 두분을 알게 되어 마음으로 의지할 수 있는 버팀목이 되어주셨다. 한분은 Business school에 계시는 Dr. Hoh, 다른 한분은 Biology Department에 계시는 Dr. Cho. 이 두분의 e-mail주소로 연락을 드리면 정말 반갑게 맞아주실 것이다. 한국인의 전형적인 정 문화를 느낄 수 있어 Homesickness를 날려 버릴 수 있는 기회가 될 것이다.","학교의 북쪽으로는 되도록 걸어서 돌아다니는 것을 삼가한다 (안전을 위해서). 가끔 사건, 사고가 자주 일어나는 곳이기 때문이다."
