gen_info,env_info,food_info,study_info,office_info,facil_info,mhct_info,help_info,etc_info
"안녕하세요 저는 2005학년도 1학기에 Bowling Green State University에 교환학생으로 파견되었던 01학번 김민경이라고 합니다. 
제가 교환학생으로 공부한 Bowling Green State University는 미 북부 Ohio 주에 있는 Bowling Green 이라는 중소도시에 위치한 주립대학교 입니다. Bowling Green 은 그리 크지 않은 도시로 번잡한 거리와 바쁘게 지나가는 사람들 대신 오후에 햇살을 맞으며 산책할 수 있는 여유를 갖게 하는 조용하고 소박한 곳입니다. Bowling Green State University는 앞의 파견 보고서에서 나왔듯이 Ohio 주는 물론이고 다른 주에서도 아는 사람이 많을 정도로 탄탄한 명성을 갖춘 주립대학교 입니다. 1910년 교육대학교로 시작한 학교답게 교육학이 유명하며 그 밖에 경영학을 비롯한 사회과학 쪽과 음대가 유명한 학교입니다. 저희 학교와 교환학생을 체결한 지는 꽤 오래된 학교로 그쪽 관계자 분의 말에 의하면 우리학교가 교환학생 프로그램을 체결한 미국대학교 순으로는 5번째 안에 든다고 합니다. 
그밖에 추운 오하이오주에 위치한 대학답게 미국 대학 아이스하키계의 강팀으로 꼽히며 여자 농구 와 미식축구 팀 또한 유명합니다. 학교의 공식 색깔은 Orange색이고 마스코트는 Falcons입니다. 저희 학교처럼 학교 곳곳에서 Orange 색과 Falcons 그림을 발견하실 수 있습니다.
학교의 크기는 상당히 큰 편으로 우리학교의 1.5배에서 2배 정도 되며 학교 안에 순환버스가 정기적으로 운행되고 있습니다. 입학한지 2년까지는 전원이 기숙사 생활을 해야 하는 학교라서 학교 안에 기숙사가 골고루 많이 퍼져 있으며 학교중심에는 시계탑이 인상적인 Bowen-Thompson Student Union과 함께 여러 종류의 Sorority와 Fraternity가 위치하고 있어 학교는 항상 활기에 차 있습니다.

교통수단
Bowling Green은 Toledo 공항에서 차로 20-30분 정도 걸리며 Detroit 공항에서는 1시간 30분 정도가 걸립니다. 한국에서 Toledo공항으로 도착 시 학교에서 Pick up 서비스를 제공하니 참고하시길 바랍니다. 특히 BG는 대중교통수단이 그리 발달되지 않아 개인차량 없이는 공항에서 학교까지의 이동이 불편하니 처음에 학교에 도착하실 때 이점 유의하셔야 합니다. 하지만 학교생활을 하면서는 학교 안 모든 건물은 도보로 이동가능하며 또한 잦은 배차간격의 학교순환버스가 운행되어 편리합니다. 또한 편의시설을 비롯한 거의 모든 시설이 학교 안에 있기 때문에 이런 대중교통수단의 문제는 그리 크게 불편하지 않았습니다. 가끔씩 멀리 나갈 일이 있으면 다른 학생들과 마찬가지로 저도 차가 있는 친구나 선배님들에게 부탁해 나가곤 했습니다.

날씨
우리나라처럼 4계절의 날씨를 가지고 있다. 하지만 BG의 겨울은 길고 춥고 눈이 많이 그리고 자주 오기로 유명하다. 물론 길은 항상 제설차가 다니기 때문에 통행에는 문제가 없다.  한겨울에는 정말 추워 두터운 방한복은 필수품이며 눈이 많이 오기 때문에 특히 발목까지 덮어주어 따뜻하며 또 미끄러지지 않는 부츠형 신발이 유용하다. (또한 BG는 눈이 많이 오고 또 바람이 많이 불기 때문에 모 소재의 코트도 좋지만 패딩 같은 눈비에 잘 견딜 수 있는 옷이 필요하다.)  제가 있었을 때는 3월 달에 마지막 눈이 내리며 날씨가 풀리기 시작했지만 3월말까지는 코트를 입고 다녀야 할 정도로 날씨가 쌀쌀했습니다. 조금 얇은 옷을 입을 수 있었던 것은 학기가 거의 끝날 무렵 이였습니다 (하지만 BG의 여름은 또 덥다.) 그렇지만 하얀 눈이 연출해내는 자연경관은 정말 아름다웠습니다. 또한 높고 맑은 하늘 또한 BG의 자랑이다. 서울에서는 보기 힘든 깨끗하고 높은 하늘을 볼 수 있으며 밤에는 별빛이 참 아름답다. 짧은 봄과 무더운 여름 그리고 가을이 있는데 BGSU 캠퍼스는 가을에 예쁘기로 유명하다. 색 색깔의 단풍과 맑은 하늘을 감상할 수 있다고 한다.","Bowling Green 과 가장 가까운 도시로는 Toledo가 있다. 차로 20-30분 거리에 있는데 BG보다는 조금 큰 도시로 서너 개의 한국식당과 식품점이 이곳에 위치하고 있습니다. 미시간주의 Detroit 과는 차로 1시간 30분 정도 가야 하는 거리에 있다. 그곳에 꽤 큰 도시로 미시간 대학교가 위치해 있어 그 주변이 대학거리로 유명하고 또 여러 유명한 쇼핑몰들이 위치해 있어 학생들이 주말을 이용해 갔다오곤 한다.   
BG는 자그마한 도시로서 학교주위에 그리 큰 번화가가 있는 것은 아니다. 학교 밖의 식당으로는 기숙사에서 조금만 올라가면 학교 밖에 위치한 맥도날드 같은 패스트 푸드점들이 있고 조금 더 많이 걸어가면 중국부페, 일식집이 있는데 그리 자주는 가지 못했습니다. 또한 학교에서 제일 가까운 시내는 Main St.로 도보가 가능하다. 이곳은 약간 고풍스러운 느낌이 드는 작은 시내이다. 제가 있을 때는 오래된 고풍스러운 영화관도 있었는데 제가 그곳을 떠날 때쯤 문을 닫았습니다. 여러 아기자기한 카페들과 식당 그리고 아이스크림 가게가 있으며 이곳에서 벗어나 차로 10여분 정도 가면 큰 영화관과 새로 개장한 큰 상점들이 있는 쇼핑거리가 위치해 있다.","기숙사 생활
거의 모든 교환학생은 처음에 Kreischer Quadrangle에 속한 Compton이라는 기숙사에 배치된다. 하지만 그렇다고 해서 Compton에 교환학생만 있는 것은 아니며 실제로 미국학생들의 수가 교환학생들의 수보다 훨씬 더 많다. 
BGSU는 주로 학년별로 기숙사가 달라지는데 특히 1,2학년들은 의무적으로 기숙사에 살아야 하기 때문에 기숙사에 1,2학년의 수가 압도적이며 또한 그만큼 학교의 기숙사 수와 그 규모가 크다. Compton은 주로 신입생들이 많이 배정받는다. 기숙사 각층에는 남녀별로 공동 화장실과 샤워실, 부엌(전자레인지와 오븐, 식탁 등이 구비되어 있다.), 세탁실, 프린터 시설이 갖춰진 컴퓨터실, 그리고 TV가 있는 라운지(이곳 라운지에서는 여러 학생들이 모여 공부를 하거나 TV를 보거나 파티를 할 수 있는 누구나 이용 가능한 곳이다. 기숙사층마다 배정되어 있는 RA(Resident Assistant)들이 공지사항을 알리거나 기숙사 실원 전원을 대상으로 한 파티를 열 때도 이곳을 이용하기도 한다.) 방은 2인 1실로 양쪽 벽에 침대가 있으며 책상과 붙박이 장이 있다. 각 방에 전화가 있으며 인터넷 선이 장착되어 있어 노트북을 가져가면 방안에서도 편리하게 인터넷을 사용할 수 있다. (그렇다고 꼭 노트북이 필요하지는 않다. 기숙사에 넓은 컴퓨터실이 있어 노트북이 없더라도 불편하지는 않을 것이다.) 또한 TV선도 방안에 장착되어 있고 거의 하루 종일 최신영화를 방영하는 채널을 포함 여러 채널을 시청할 수 있어 많은 미국학생들은 자그마한 TV를 방안에 설치해두기도 한다. 저는 제 룸메이트가 그곳에서 미리 1학기를 마친 교환학생으로 전자레인지와 냉장고를 이미 가지고 있어 비교적 편리한 생활을 할 수 있었습니다. 매 학기 초마다 교환학생들이 본국으로 돌아가면서 이런 간단한 전자제품들을 팔고 사는 경우가 많다고 합니다. 1층 입구에는 기숙사 관계자와 RA가 항상 상주하는 Front desk와 개인 우편함, 포켓볼 시설이 되어 있는 라운지와 피아노가 있는 악기 연주실이 있다. Front desk 에서는 부엌기구들을 빌릴 수 있으며 DVD 플레이어와 여러 DVD를 대여해준다. 또한 팩스기도 설치되어 있어 기숙사에서 바로 팩스를 보낼 수 있다. 기숙사는 매번 출입할 때마다 카드키를 써서 출입하기 때문에 기숙사의 실원이 아니면 출입이 어렵다. 또한 일종의 통금시간이 정해져 있어 12시 이후에는 기숙사 스텝이 현관에서 출입자들을 일일이 확인하고 방 번호와 이름을 확인한다. 방의 한 라인마다 RA가 2명 이상씩 같이 상주해서 기숙사 실원들을 생활들을 도와주며 규율한다. (대부분 RA는 3,4학년 학생이 맡는다.) 모르는 일이 있거나 도움이 필요한 일이 생기면 이런 RA들에게 도움을 요청하는 것도 좋다. 혹시 신입생들이 많아 시끄럽지 않을까 라는 우려는 안 해도 될 것 같다. 가끔 금요일밤에 파티 소리를 듣기도 하지만 전체적으로 조용하고 쾌적한 분위기에서 생활 할 수 있다. 또 학생들의 활기찬 분위기가 항상 기숙사에 감돌아 싱그럽다.
특히 같은 기숙사 생활을 통해 서로서로 친해져 서로의 방을 방문하거나 같이 영화를 보는등 교류가 빈번해 친구들을 많이 만날 수 있으며 다양한 문화를 접할 수 있다. 

식생활
 Compton이 속한 Kreischer 기숙사는 그 카페테리아가 다른 기숙사에 비해 크고 시설이 좋기로 유명하다. SunDial 이란 이름의 카페테리아는 샐러드바, 피자, 중국식 볶음, 매일 메뉴가 바뀌는 2개의 바, 샌드위치 바 등 각 섹션별로 다른 종류의 요리를 팔고 있다. 그밖에 도넛, 아이스크림, 커피, 요거트, 과일, 빵 등 여러 가지의 음식을 종류별로 고를 수 있다. 하지만 주의할 점은 카페테리아가 일찍 문을 닫는다는 사실이다. 저녁 시간이 끝나면 곧 문을 닫고 그대신 저녁에만 문을 여는 Shadow라는 작은 식당이 여는데 여러 간식과 아이스크림 등을 판다. 특히 이곳의 아이스크림 쉐이크는 종류도 많고 양도 커 학생들의 늦은 밤 군것질 음식으로 인기가 좋다. 하지만 주말에는 이 Shadow 또한 열지 않기 때문에 매 학기 초마다 그 스케줄을 확인할 필요가 있다. BGSU 학생들은 매 학기마다 의무적으로 meal plan 을 신청해서 학기 시작 전에 돈을 선불로 내야 한다. 이 meal plan을 일단 구입하면 학생카드로 교내 모든 카페테리아 (Student Union의 카페테리아 포함)에서 음식을 구입할 수 있으며 학교 내 편의점등 모든 곳에서 돈 대신 사용할 수 있어 아주 편리하다. 교환학생들은 거의 그 액수가 가장 적은 International Student Meal Plan 을 택하는데 그 가격은 $500이다. 하지만 이것으로는 한학기내 내 쓰기엔 부족해 중간에 다시 충전해서 쓰곤 한다. 충전할 때는 자기가 액수를 임의로 정해서 할 수 있다. 수업중간 중간에는 기숙사까지 갈 시간이 없어 학교 중앙에 위치한 Student Union의 카페테리아를 자주 이용했습니다. Student Union은 항상 학생들로 붐비며 이곳의 카페테리아에서는 식사하시는 교수님들도 자주 뵐 수 있다. 웬디스가 입점해 있어 인기가 많으며 카페테리아가 크고 그 음식도 다양해 인기가 많다. 특히 이곳의 스무디는 맛이 아주 좋아 남녀학생을 불문하고 인기가 많았다. 또한 학교 순환버스를 타며 학교밖의 Kroger라는 제법 큰 Grocery store가 있어 간단한 생필품과 신선한 음식들을 싼값에 살 수 있다. 저는 처음 2-3개월은 카페테리아에서 모든 끼니를 해결했지만 그 뒤론 튀기고 기름진 음식에 약간 물려 일주일에 한번씩 유학생 선배님의 도움을 받아 한국식품점과 음식점을 가곤 했습니다. 한국 식품점에서 산 라면과 김, 그리고 햇반을 아주 유용하게 썼습니다. 특히 제 룸매이트는 일본에서 온 교환학생이었는데 제가 산 김과 룸메이트가 산 1회용 일본 된장국을 자주 교환해 먹었던 기억이 납니다. 저는 1학기만을 교환학생생활을 했기에 전기밥솥을 살 엄두가 안 났지만 시중에 1인용으로 아주 작은 전기밥통이 많아 만약 1년을 계획으로 교환학생을 온다면 구입을 고려해 보는 것도 나쁘지 않을 것 같습니다.","수업

Introduction to the International Studies. 

국제학 개론 수업으로 각 대륙 별로 나라군을 정해 그 기본적 성립배경과 발전과정을 배우고 세계적으로 이슈가 되고 있는 국제적 문제들의 원인과 그 해결방법을 모색해보는 것을 주 목표로 한 수업이다. 개인적으로 이 수업은 이론적으로나 실제적으로나 큰 영향을 준 수업이었다. 수업의 구성원들은 단순히 미국인 학생들로 구성되어있지 않았고 중동, 아프리카, 아시아, 유럽 등 각 나라에서 온 유학생들이 포함되어 있었다. 그 결과 보다 더 역동적인 수업이 실감적으로 진행되었다. 수업은 강의, 토론, 소그룹토론, 발표로 진행되었고 개인의 생각과 학기초부터 만들어진 각각의 조 들이 자신들이 맡은 나라의 입장에 대해 자유롭게 토론할 수 있는 분위기를 형성했다. 교재는The Lexus and the Olive Tree를 주 교재로 다른 2권의 부교재를 더 사용했는데 교수님께서 나눠주시는 프린트와 영상자료 또한 그 양이 만만치 않아 매주 정해진 분량을 읽고 보고서를 쓰는 일이 약간 힘들었다. 주 에세이 2개와 기말고사 그리고 학기말 그룹 발표가 성적의 많은 부분을 차지했으나 매주 제출해야 했던 과제들과 소그룹 발표들의 비중 또한 작지 않아 한 학기 내내 긴장을 놓지 못했던 수업이기도 했다. 이 수업을 통해 우리들은 지금 현재 떠오르고 있는 국제적 문제들의 해결을 위해서는 각 나라들이 서로의 차이점과 공통점을 서로 이해하는 과정이 선행되어야 한다는 사실을 발견하였다. 또한 개인적으로는 세계 여러 나라들의 학생들로부터 그들 나라의 입장을 실감적으로 듣고 배우며 지금 현재 일어나고 있는 국제적 분쟁을 같이 걱정하고 그 해결방안을 모색했다는 사실이 보람되고 뿌듯했다. 

Russian culture 

노문과 전공으로 미국에서는 과연 냉전시대 자신들의 제일 큰 경쟁자이며 벽이었던 러시아를 어떻게 바라보는지가 궁금했다. 이 수업을 맡고 계시는 Dr. Pogacar 교수님은 Department of German, Russian and East Language의 학장님으로 Bowling Green 어문학부에서는 상당히 유명한 분이시다. 교수님께서는 수업을 매우 다양한 방식으로 이끌어나가셨다. 러시아의 성립배경, 역사, 문화, 문학, 건축, 미술, 음식, 춤, 의상, 그리고 현재 러시아의 사회적 상황 과 그 주변국들과의 관계 등을 총체적으로 다루셨다. 이 수업 또한 매주 일정한 과제와 퀴즈가 주어졌고 사이버 수업과 발표 또한 활발히 이루어졌다. 그 중에서도 자신이 정한 주제에 관한 책을 읽고 책의 내용과 자신의 의견을 설정해 제출하는 Book Report와 러시아에 관한 한 분야를 정해 조사하고 자신의 주장을 정하고 그 주장을 자신이 조사한 내용을 통해 논리적으로 전개해나가는 Research Paper 그리고 중간, 기말 고사가 제일 큰 비중을 차지하였다. 국제학 수업과 더불어 과제가 제일 많았던 수업으로 기억된다. 특히 앞에서 언급한 두개의 paper는 교환학생 기간에 제일 힘들었던 과제였다. 하지만 과제가 많고 힘들었던 만큼 보람 또한 있었다. 책들과 씨름하면서 자료를 수집하면서, 주장과 생각을 정리하면서 과연 내가 할 수 있을까? 라는 생각을 많이 했다. 하지만 결국 기한 내에 잘 해냈고 좋은 점수를 받아 무척이나 보람되었고 또 실제적으로 내 자신이 paper를 쓰면서 이론적 지식을 많이 배웠다는 것을 깨달았다. 교수님 또한 여러 가지 다양한 형태의 수업방식을 보여주셨는데 러시아에서 연수하러 오신 선생님들의 특강, 직접 러시아 민속 인형 만들기, 수업 중 러시아 연극하기, 다양한 장르의 러시아 영화보기 등 다양한 수업 내 활동 외에도 매주 마다 학교와 인근 도시에서 열리는 러시아문화에 관한 전시회 공연 등을 알려주시며 참여를 유도하셨다. 개인적으로 러시아에 대해 더 많이 그리고 더 뜻 깊게 다가갈 수 있는 시간이었다. 

Asian Civilizations. 
한국과 중국 일본, 베트남을 포함한 동북아시아와 인도의 성립배경과 역사, 문화 그리고 이들이 서구 문명을 만나면서 벌어진 근대역사를 살펴보며 아시아 특유의 문화와 시각을 서구적 입장에서 이해하려고 노력한 수업이다. 이 수업의 교수님인 Dr. Kawashima는 History Department에서 제일 인기 있고 명망 있는 교수님 중 한 분이셨다. 특히 이 교수님은 젊은 시절 우리 연세대학교에서 공부하셨던 분으로 우리학교와 BGSU간의 교환학생 프로그램을 위해 많은 공헌과 노력을 하신 분이다. 언젠가 상담을 하러 이분 방에 갔다가 연세대학교 재학 당시 같이 방을 썼던 친구와 선후배들이 쓴 책이라며 책을 보여주셨는데 그 저자 분들이 모두 지금 한국의 유명하신 교수님들이셔서 깜짝 놀랐던 경험이 있다. 이분께서는 또한 우리학교에서 수학하신 후 하버드대를 졸업하신 재원으로 기본적으로 영어, 일본어, 한국어, 중국어에 능하셨다. 수업은 교수님의 강의와 학생들의 발표로 이루어졌는데 필기를 중요시하셨던 것으로 기억한다. 그래서 수업시간에 한시도 긴장을 늦출 수 없었다. 모든 학생들이 발표에 참여하길 유도하셨으며 여러 주제를 제시하셔서 각자 흥미 있는 주제를 채택해 조 발표를 하도록 하셨다. 같은 사실을 각자의 관점에 따라 다르게 받아들이는 역사적 과정이 흥미롭게 다가왔으며 수업을 듣는 학생들이 예상외로 아시아에 대한 지식이 풍부하다는 사실에 놀랐다. 교수님이 수업시간 중간중간에 연세대학교를 홍보하시면서 한국의 Harvard, Yale 이라는 말씀을 하시며 한국에 관한 이야기를 설명하셨던 일들이 특히 생각난다. 에세이 두 개와 중간, 기말고사 그리고 그룹발표가 있었는데 인도와 중국의 나라간의 차이점을 비교하며 간디와 마오쩌둥의 자서전을 읽고 두 인물을 비교했던 에세이는 새롭고 참신한 주제여서 기억에 남는다.  

ESL Academic Comp (2), ESL Acad Oral/Aural Sk (2)
Bowling Green 의 모든 교환학생들과 유학생들은 오리엔테이션 기간에 영어 시험을 보고 ESL 수업을 몇 개 들어야 할 지가 결정된다. 통상 가을학기에 esl(1) 수업이, 봄학기에 esl(2) 수업이 개설되는데 학기말에 각 개인들의 성적을 매겨 다음 (2)수업으로 넘어갈 것인지 아니면 면제될 것인지가 결정된다. 특히 글쓰기 수업은 esl (1), (2) 를 수료한 후에야 일반 미국 신입생들과 정식으로 글쓰기 수업을 들을 자격이 주어지기에 한학기동안 개인이 얼마만큼 하느냐에 따라 그 다음 학기의 수업을 무엇을 들을 지가 결정된다. 하지만 저는 1학기 교환학생으로 봄학기에 왔기 때문에 그냥 그대로 esl(2) 수업에 들어갔습니다.
개인적으로 ESL 수업은 다른 수업을 듣는데 아주 유용했다. ESL Academic Comp(2) 와 ESL Acad Oral/Aural Skill (2)란 수업을 들었는데 글쓰기 수업은 다른 수업에서 어떤 방식으로 Essay를 써야 하는지에 대해 알려주며 주제별로 여러 방식의 글쓰기 형식을 공부했다. 특히 미국의 Essay 쓰는 방식은 한국과 많이 틀려 그 일정한 형식에 맞춰 쓰지 않으면 아예 과제를 안받아 주시는 교수님도 있고 내용이 아무리 좋아도 큰 감점을 받기 때문에 정확한 형식을 숙지하는 것은 아주 중요한 일이었다. 또한 한 단계의 글쓰기를 마치면 좀더 높은 수준의 글쓰기 방식을 시도해보는 방법을 통해 학기를 끝마칠 때는 자신의 발전 정도를 한눈에 알아볼 수 있었다. 한 학기가 끝날 무렵 학기 동안 쓴 모든 글쓰기를 교수님께서 최종 평가 하신 후 다시 English Department에서 진급심사를 통해 다음단계 수업의 진입여부를 결정한다.
말하기 수업은 한 반이 소수의 학생들로 이루어져 교수님과의 1대1 대화시간이 많았으며 일반 수업을 대비해 발표과제가 많아 거의 매주 발표를 하곤 했다. 이 발표 또한 한 단계가 끝나면 더 높은 수준의 주제와 어휘력을 요구해 마지막 발표는 정말 진땀을 뻈던 기억이 있다. 또한 각자 취약한 발음과 학생들이 공통적으로 어려워하는 발음들과 억양을 집중 연습하였는데 교수님께서 학생들 각각의 문제점에 따른 개별 과제를 내주시거나 공통과제를 내주셔서 자신의 발음과 억양을 직접 녹음해 들어보도록 하셨다. 정기적으로 이러한 녹음을 제출해야 했고 교수님은 다시 이러한 과제들을 평가하여 고칠 점을 알려주셨다. 또한 미국학생들을 반에 초대해 미국대학생활에 대해 직접 설명하고 물어보는 시간을 갖기도 하였으며 서로의 문화적 차이에서 올 수 있는 오해에 관해 수업을 하기도 하였다. Bowling Green의 ESL 수업은 그 우수성이 다른 학교에 알려질 정도로 뛰어나다는 소리를 들었었는데 실제로 그러하였다. 꼭 듣기를 권한다. 
중앙도서관 
Compton 기숙사 근처에 중앙도서관인 Jerome Library가 위치해 있다. 총 8층으로 구성되어 있으며 1층에는 각종 잡지와 신문, 정기 간행물 등이 있으며 열람실 또한 1층에서부터 시작된다. 그 밖에 Computer lab, Conference Room 등이 있다. 또한 Reserve Room이 위치해 있어 수업진행에 필요한 비디오나 책을 교수님이 이곳에 맡겨두시면 학생은 확인절차를 걸쳐 이 곳에서 그 비디오를 보거나 책을 읽을 수 있다. 6층까지는 각종 도서실들이 주제별로 분포되어 있고 7,8층에는 혼자서 공부할 수 있는 공간과 조모임을 할 수 있는 공간들이 있다. 도서관 운영시간은 매일 다르며 24시간 개방은 하지 않는다. 책의 종류와 그 자료의 양이 방대하며 직원들 또한 친절해 자료나 도서를 찾는 일이 어렵지 않으며 7,8층은 조용하며 창문을 통해 탁 트인 경치를 배경으로 공부할 수 있어 좋다.","Center for International Programs <국제교류교육원>

Offenhauer West에 위치해 있으며 Compton기숙사와 는 약간 멀지만 학교 순환 버스를 타면 그리 멀지 않다. 꽤 큰 규모이며 교환학생과 일반 유학생들의 전반적인 사항들을 책임지고 있다. Mr. Jeffrey M. Grilliot 교수님이 총책임자이시고 Ms. Ann Saviers가 Assosiate Director이시다. 특히 Ms. Ann Saviers께서는 학생들의 세세한 생활까지 상담해주고 조언을 주신는 역할을 하신다. 이 두 분과는 따로 전화를 해 상담시간을 잡을 수 있다. 입학하기 전 거의 일주일이 넘는 오리엔테이션이 이곳 국제교육교류원에서 열린다. 이 오리엔테이션 기간은 되도록이면 빠지지 말고 참석하여 정해진 수순을 밟는 것이 좋다. 건강검사, 학생카드 만들기, 보험가입 등 꼭 필요한 일들을 그날 그날 단체로 하기 때문에 헤맬 필요가 없고 편리하다. 그 외에도 한 학기 내내 교환학생과 유학생들을 위한 여러 프로그램과 크고 작은 행사(단체 여행, International Picnic, International Dinner등) 들을 운영한다 또한 World Student Organization 이란 학교내의 유학생단체도 지원하는데 이 단체에서 각종 행사를 열고 매주마다 모임을 갖는데 참여해보는 것도 좋을 듯 하다. 직원들 모두 항상 친절하니 모르는 것이 있으나 도움이 필요할 때 항상 이용하길 바란다.","수강신청
오리엔테이션 마지막 날 수강신청을 하였습니다. 수강편람과 인터넷을 보고 미리 과목을 정한 뒤 수강신청 전날 Academic Advisor와 만날 약속을 정했습니다. 그리고 수강신청 당일 날 AA에게 제가 짠 수강신청계획안을 보여주고 상담을 하였습니다. 수강신청 전 AA와의 상담은 필수적입니다. AA는 기본적으로 그 수업에 관한 정보를 제공해주고 학생의 의견을 들으며 학생이 작성한 계획서를 토대로 학생에게 적합한 수업을 추천해줍니다. 기본적으로 처음 학기를 시작하는 외국인 학생에게는 12학점 정도를 추천하는데 거의 모든 외국인 학생이 처음학기에는 ESL 수업을 들어야 하니 15학점도 그리 어렵지는 않다고 생각합니다(저도 15학점을 들었습니다.) AA와의 상담이 끝나면 수강신청을 하는데 저 때에는 교환학생들이 맨 마지막 날 수강신청을 해서 원하는 과목에 못 들어가는 경우도 있었습니다. 물론 수강변경기간도 있지만 그전에 교수님께 부탁해 볼 수 있다는 조언을 듣고 교수님에게 직접 메일을 보내 허락을 얻어 수업에 들어가기도 했습니다. 

수강신청을 한 후 약간 걱정이 되었습니다. 과연 잘 할 수 있을까? 그냥 12학점만 신청할걸 그랬나..등의 고민을 하며 떨리는 마음으로 첫 수업을 들어갔던 기억이 납니다. 힘들고 벅찼지만 그래도 시간이 갈수록 15학점을 듣길 잘했다는 생각이 들었습니다. 수업은 힘들었지만 뒤쳐지지 않도록 노력했고 또 노력한 만큼의 보람이 있었습니다. 제가 드리고 싶은 말은 처음부터 겁내지 마시고 자신을 믿고 적극적으로 수업에 임한다면 틀림없이 좋은 결과를 얻으실 수 있다는 것입니다. 그러니 너무 걱정하지 마시고 원하시는 수업에 꼭 참가하여 좋은 경험 많이 하시길 바랍니다.  

Writing Center
외국학생들뿐만 아니라 정규 미국인 학생들도 자주 애용하는 곳으로 자신이 쓴 혹은 쓰고 있는 에세이를 교정 받고 토론할 수 있는 곳이다. 미리 전화로 예약을 해야 하는데 각 학생당 선생님과의 1대1일 교정시간이 약 1시간 정도로 주어진다. 예약 시 자신이 원하는 선생님을 선택할 수도 있고 그쪽에서 선생님을 추천해주기도 한다. 에세이를 교정 받는다고 해서 일방적으로 선생님이 문법만 지적하고 끝내는 것이 아니라 학생이 자신의 에세이의 주제와 교수님이 제시하신 조건, 그리고 자신의 의견을 설명하면 선생님은 직접 틀린 곳을 지적해주시기 보단 학생이 자신의 잘못을 발견하도록 유도하고 자신의 의견을 논리적으로 정렬할 수 있도록 도와준다. 선생님은 writing에 조예가 깊은 대학원생 혹은 박사과정 학생 등으로 구성되어 있는데 정말 친절하고 글쓰기에 필요한 여러 기초적 방법과 팁을 자세히 설명해준다. 저는 에세이를 쓸 때마다 이곳에 꼭 들리곤 했는데 유용한 많은 도움을 받았습니다. 또 학생이 이곳에서 상담을 받은 사실과 그 내용은 담당 교수님께 전해져 담당교수님과의 상담에도 또한 많은 도움을 준다. 중간, 기말고사 기간엔 여러 학생들이 한꺼번에 몰려 예약하기가 힘드니 미리미리 에세이를 진행시켜나가면서 여유롭게 만나는 것이 좋은 방법이라고 생각된다. 또한 글쓰기만 도움을 받는 것이 아니라 학기초에 신청하면 정기적으로 시간을 정해 말하기지도도 받을 수 있으니 꼭 신청해보길 바란다.

서점
Bowen –Thompson Student Union 1층과 2층에 중앙서점이 있다. 매 학기 초에는 교과서를 사는 학생들로 많이 붐빈다(중고교과서와 새 교과서를 파는데 중고교과서는 값이 싸 빨리 나간다.) 이곳에는 책 이외에도 학용품, 간단한 생활용품들과 BGSU 기념품 등을 판다. 또한 학교 밖에는 자그마한 학교서점이 있는데 이곳에는 주로 중고 교과서를 취급해 싼값에 살 수 있으며 Student Union에 위치한 서점에 없는 책이 이곳에 있기도 한다. 많은 학생들이 학기가 끝나면 자신이 썼던 책들을 다시 서점들에게 되팔아 다시 다음학기의 교과서를 사곤 한다. 
Club Activities
다른 대학교도 그러하듯이 BGSU도 클럽활동이 활발하다. 교환학생이라고 주저하기 보단 용기를 내어 이런 클럽의 문을 두드려보는 것도 좋은 방법일 것 같다. Russian Club, Japanese Club 등 각나라의 문화를 알아보는 Club 이외에도 광고동아리, 운동동아리, 봉사동아리등 매우 다양한 Clubㅇ 있다. 매 학기 초에 이러한 클럽에 대해 자세히 설명된 책자와 설명회가 개최되니 주의 깊게 보고 자신의 취향에 맞는 club에 참여하는 것을 권유하고 싶다.","현지인과의 교류
BGSU에는 한국 유학생들이 많지 않다. 그래서인지 몰라도 학생들 중 한국에 대해 잘 알지 못하는 학생들도 많았고 한국에서 왔다고 하면 신기한 시선으로 보는 경우가 많았다. 그럴수록 더욱 한국에 대해 설명해주려고 노력했다. 교환학생을 가기 전 나름대로 우리나라를 소개하는 책자와 엽서 그리고 기념품들을 가져갔는데 반응이 좋아 가져간 기념품들과 엽서가 부족했었다. 그리 비싸지 않은 조그마한 기념품들과 엽서였지만 그 사람들에게는 아주 신기하고 특별한 선물이 되었고 그러한 것 들이 매개가 되어 우리나라에 대해 설명하는 일이 한층 더 수월했고 효과적이었다.

수업에서의 교류
수업을 들으면서 느꼈던 점으로는 항상 적극적으로 수업에 참여하여야 한다는 것이었다. 되도록 많이 교수님께 질문하고 옆의 친구들에게도 물어보도록 노력했다. 처음에는 질문을 하는게 무척 어렵게 느껴졌지만 교수님과의 대화를 통해 그리고 친구들과의 대화를 통해 내가 알고싶었던 것 뿐만 아니라 미처 생각하지 못했던 중요한 사실들을 깨닫는 경우가 많았다.또한 친구들과는 이렇게 자주 물어보면서 자꾸 얼굴을 익히고 친해졌다.  어떠한 일이든지 적극적인 태도를 보일 때 그 일을 해결할 수 있는 방법과 그것을 도와주려는 사람들을 만나게 되었다. 낙천적이고 적극적인 자세만 있다면 자신이 원하는 좋은 결과를 얻을 수 있을 것이라고 생각한다. 

부과적 ESL 활동.
매학기마다 학교에서 Conversation partner라는 프로그램을 운영한다. 학기초에 신청을 받아 미국인 학생 한 명과 외국인 학생 한 명을 각각 연결시켜준다. 한 학기동안 1주일에 한번씩 이 Conversation Partner를 만나 대화를 하거나 영화를 보거나 쇼핑을 하러 가는 등 일상적인 친교활동을 한다. 또한 매주 금요일 오후마다 영화를 보며 영어를 공부할 수 있는 프로그램을 운영하는데 약간의 다과도 준비되어 있어 딱딱한 수업이 아닌 영화를 보며 웃고 음식을 먹으며 즐길 수 있는 편안한 분위기에서 영어를 배우도록 유도한다.","Mr.Kawashima 교수님
위의 수업소개에서 언급한 교수님으로써 CIP와 함께 우리학교와 BGSU의 교환학생프로그램을 위해 일하시는 교수님이시다. 주로 BGSU에서 우리학교로 오는 교환학생들을 모집하시고 선발하는 일에 많은 관여를 하시는데 우리학교에서 파견되는 교환학생들에게도 많은 관심과 지원을 해주신다. 저는 그분의 수업을 들어서 종종 교수실에 찾아가곤 했는데 그때마다 많은 힘이 되는 말씀을 해주셨으며 저희 학교에 대해 많은 관심과 애정을 가지고 계시다는 것을 느낄 수 있었습니다. 어려운 일이 있거나 상담할 일이 있을 때 그분의 수업수강 여부를 떠나 연세대학교 교환학생이라고 하시면 아주 반갑고 낯익은 미소로 여러분들을 맞아주실 것 입니다.

Host Family
기숙사는 오리엔테이션 기간이 끝난 후 학기 시작 시에 열기 때문에 오리엔테이션 기간 동안 임시로 있을 곳이 필요하다. CIP에서는 일단 Host family 프로그램을 통해 학생들에게 임시 거처를 마련해주고 남은 학생들은 일정한 기숙사를 개방하여 생활하게 된다. 저는 오리엔테이션이 시작하기 이틀전 에 BG에 도착했는데 다행히 Host family를 만나 오리엔테이션 기간 동안 그 집에서 머물 수 있었습니다. 개인적으로 지원 원서를 낼 때 꼭 Host family를 신청하기 바란다. 대부분 Host family를 하시는 분은 외국학생들에게 관심이 많고 자신의 문화를 소개하려는 의욕이 강하셔서 직접적으로 미국문화를 체험할 기회가 많아진다. 저도 교환학생 기간 내내 많은 도움을(음식, 차량제공 등) 받았습니다. 명절 때나 생일 등 행사가 있을 때 초대받아 가끔씩 외로울 수 있는 교환학생 기간에 가족의 따뜻함을 느끼며 재충전을 할 수 있는 계기가 되었습니다. 설사 도착해서 Host family를 만나지 못하고 기숙사에 머물더라도 오리엔테이션 기간이나 학기초에 CIP(Center for International Programs) 의 주최로 다시 Host family 프로그램을 소개하고 신청을 받기에 걱정하지 않아도 된다.","그 밖의 생활
운동
Compton의 또 다른 좋은 점 한가지는 바로 건너편에 BGSU가 자랑하는 크고 넓은 Recreation Center가 있다는 점이다. BGSU의 모든 학생들이 이용가능하며 입장 시 학생카드를 제시하면 된다. 지하와 1.2층으로 구성되어 있고 아주 넓은 수영장과 다이빙 시설 (이곳에서 수영대회가 열리기도 한다.), 스쿼시장, 농구장 등이 있으며 웨이트트레이닝실 그리고 사우나 시설과 작은 즈쿠지 시설이 있다. 1층, 2층에는 농구장, 런닝트랙, 에어로빅과 체조를 할 수 있는 넓은 공간, 런닝머신, 자전거, 실내 암벽타기 시설 등이 있으며 매일마다 에어로빅, 요가, 파워댄스, 아쿠아로빅 등 신청만 하면 무료로 혹은 약간의 등록비만 내면 참가할 수 있는 여러 프로그램들이 준비되어 있다. 또한 야외스포츠 프로그램 또한 풍부하다. 항상 학생들도 붐벼 사람이 많은 밤시간에 가면 런닝머신등 을 하기 위해 기다려야 하는 경우도 있을 만큼 그 인기가 높다. 또한 신청을 하면 트레이너의 관리를 받을 수 도 있다.
보험
학생보험은 학교측에서 필수적으로 요구하는 사항이다. 저는 교환학생을 가기 전 한국에서 들어야 하나 라고 생각했지만 미국대학에서 자신들 나름대로의 기준에 맞는 보험만을 인정하기에 복잡할 것 같아 그냥 학교 보험을 들기로 하고 일단 오리엔테이션에 참가했습니다. 역시 거의 모든 학생들이 학교의 보험을 선택하였고 가격도 그리 비싸지 않았습니다. 오리엔테이션 기간에 국제교육교류원에서 친절히 설명해주고 단체로 한꺼번에 신청하기에 신청하는 것도 그리 어렵지 않습니다.

돈
저는 학교 내에는 은행이 없어 기숙사 근처에 있는 은행에 Checking account를 신청하여 사용했습니다. 이 account를 신청하면 카드가 나오는데 우리나라의 체크카드처럼 돈을 뽑는 것은 물론이고 통장의 잔고만큼 모든 곳에서 신용카드처럼 쓸 수 있습니다. 주로 이 구좌는 학교 외에서 돈을 쓸 때 사용했고 학교내에서는 학생카드 하나(meal plan)로 거의 모든 것을 다 계산할 수 있기에 학생카드를 이용했습니다. 또한 학교에서 공식적으로 청구하는 비용은 홈페이지의 Bursar section에 가면 실시간으로 확인이 가능해 그 항목을 확인한 뒤 (예를 들면 보험비) 인터넷상으로 결제했습니다.

Student Health Center
오리엔테이션 기간에 이곳에서 건강검진을 받는다. 그 후에도 몸이 아프거나 할 때 이곳을 찾으면 의사와의 진료도 가능하고 간단한 약도 받을 수 있다. 병원비는 Bursar 계좌로 청구되며 학교 보험을 들 시 학기말쯤 보험회사에서 다 공제해주기 때문에 거의 돈이 들지 않는다. 교환학생기간 중 제일 중요한 것은 건강이라고 생각한다. 몸이 좋지 않을시 미리미리 방문하여 사전에 치료받을 수 있도록 하자.

맺는 말
교환학생을 준비하면서 또 그곳에 도착해 공부하면서 많은 생각과 고민을 하였습니다. 저는 비교적 늦게 (4학년 1학기)에 교환학생을 가게 되어 그만큼 더 부담감도 있었고 고민도 많았던 것 같습니다. 하지만 그때도 그랬고 지금도 역시 전 교환학생을 온 것은 잘한 선택이었다고 생각합니다. 정말 학생 때가 아니면 경험할 수 없는 특별하고 소중한 기회였습니다. 혹시라도 교환학생을 계획하고 계시지만 학기가 얼마 남지 않아 고민하시는 분들, 혹은 ‘과연 내가 가서 잘 할 수 있을까’ 라는 고민으로 주저하시는 분이 계시다면 자기 자신을 믿고 꼭 지원하셔서 적극적으로 자신이 원하시는 것을 성취하시라고 말씀 드리고 싶습니다. 이 글을 빌어 제가 그곳에 있는 동안 많은 도움을 주셨던 그곳의 교수님들과 CIP 관계자분들, Host Family 역할을 해주셨던 Cheryl 아주머니와 그 가족분들, 한국 유학생 선배님들, 후배들 그리고 수업 혹은 기숙사생활을 통해 만나 저에게 많은 것을 가르쳐주고 느끼게 해준 여러 친구들에게 감사의 마음을 전합니다. 끝으로 제가 교환학생을 갔다 올 수 있도록 항상 많은 지원과 격려를 해주신 부모님, 교수님들, 그리고 이러한 기회를 제공해준 학교에게 감사의 말을 올립니다."
