gen_info,env_info,food_info,study_info,office_info,facil_info,mhct_info,help_info,etc_info
"Athens에 위치한 UGA는 학교 내에만 버스노선이 5-6개 있을 정도로 규모가 매우 크고 아름다운 학교입니다. Atlanta에서는 차를 타고 한시간에서 한시간반정도 걸립니다. 
가을학기의 경우 여름부터 겨울까지를 모두 경험할 수 있습니다. 여름의 경우 해가 강해서 덥지만 습도가 높지는 않아 잔디밭에서 누워있기 딱 좋은 환경입니다. 가을이 되면 학교 캠퍼스는 단풍으로 아름답게 변하고 학교 내를 걸어다니기 즐거워집니다. 겨울로 갈수록 추워지지만 한국의 겨울보다는 따뜻합니다. 그래도 비가 올 경우에는 많이 춥고 가끔 며칠에 걸쳐 비가 오는 때에는 감기에 특히 주의해야 합니다. 
항상! 에어컨과 일교차에 대비하여 가디건이나 후드티를 들고 다니시는 게 좋습니다.","Athens는 UGA를 중심으로 이루어져있다고 해도 과언이 아닙니다. 정말 말그대로 차 없이는 학교 캠퍼스에서 벗어나기 힘듭니다. 하지만 학교 캠퍼스 자체가 크고 자연환경이 너무나 잘 가꾸어져 있다는 장점이 있습니다.
걸어서 갈 수 있는 downtown은 반나절 정도면 모두 구경이 가능합니다. 목요일이나 금요일의 경우 downtown의 레스토랑이나 바등의 대부분은 UGA 학생들로 가득차게 됩니다. 심지어 웨이트리스들까지도 학교 학생인 경우가 있습니다. 작은 downtown이지만 특색있는 카페들과 부티크들, 스타벅스, 벤엔제리, 일본음식점 그리고 한국 음식점과 한국 노래방도 있습니다.
특히 생활에 정착하기 위해서 학기 초에 많이 가야하는 wal-mart나 target등은 걸어서 갈 수는 없지만 차를 타면 15분내로 모두 갈 수 있습니다. 영화관이나 볼링장등도 마찬가지입니다.","남부는 음식으로 유명합니다. 특히 UGA의 경우 학교 식당이 상을 여러번 받았을 정도로 잘 되있습니다. 배정받게 되실 ECV 기숙사는 음식을 직접 해먹는 것이 가능하지만 meal plan을 하시는 것을 추천합니다. 음식을 할 기구, 장보기, 직접하기 등 매우 번거로운 일이 많습니다. 또한 식당이 만남의 장이 되기도 하니 meal plan은 꼭 하시기를 바랍니다. meal plan을 하면 학교 내의 4개의 dining hall에서 부페식으로 제한없이 식사가 가능합니다. 위에서도 말했듯이 학교 식당이 좋은 품질을 자랑하고 메뉴가 갯수가 많고 조금씩 계속 바뀌기 때문에 1-2학기 보내는 교환학생으로서는 질린다는 느낌은 없습니다. 
먹는 음식에 따라 돈이 차감되는 형태가 아니기 때문에 식당에 들어가서 커피나 쿠키, 과일등을 먹으면서 친구들과 오랜 시간을 보낼 수 도 있습니다. 시험기간의 경우 식당에서 공부를 하는 학생들도 많습니다.
가끔씩은 음식을 시켜먹기도 하고 친구들과 나가서 먹기도 했습니다. downtown에도 많은 식당들이 있으니 가끔은 친구들과 음식점 탐방을 해보시는 것을 권합니다.","미국에는 생명공학이라는 과가 존재하지 않아서 저는 전공은 한 과목만 듣고 나머지는 영어, 스페인어, 체육등을 들었습니다. 학점에 여유가 있으시다면 전공을 들어서 시험에만 열중하기 보다는 교환학생 생활 자체를 즐기셨으면 합니다. 특히 스포츠는 꼭 들으시기 바랍니다. Atlanta에서 올림픽이 열렸을 때 학교 내 체육관인 Ramsey를 만들었고 실제 거기서 올림픽이 열렸습니다. 그만큼 Gym 시설이 눈이 휘둥그레질만큼 잘 되어있으며 수업의 종류도 많고 수업의 질도 좋습니다. 어떤 수업을 들으셔도 재미있고 출석만 제대로 하신다면 pass할 수 있으니 추천합니다.",많은 행사들을 열어주고 처음에 자리를 잡는데 매우 도움을 많이 줍니다. 일단 학교 생활에 정착을 하게 되면 크게 도움 받을 일이 없게 됩니다. (없기를 바래야 합니다..) 하지만 어떠한 일이라도 나면 가장 먼저 도움을 청해야 할 곳이기도 하므로 contact information정도는 정확히 알아두시기를 바랍니다.,1학기를 다녀왔기 때문에 동아리등은 하지 않았습니다.,"Culture Shock이라면 무엇보다도 편안한 옷차림이 아닐까합니다. 학교에 어느 누구도 힐을 신지 않고 운동화나 슬리퍼에 츄리닝 심지어 모두가 기숙사에 살기 때문에 거의 잠옷 차림을 하고 다니기도 합니다. 물론 미대쪽에 있다보면 특이하게 혹은 매우 스타일리시한 학생들도 가끔있지만 대부분의 학생들이 편한 옷차림을 선호합니다.
또 학생들의 공부하는 스타일이 매우 다릅니다. 도서관의 칸막이 책상을 선호하는 한국 학생들과 다르게 미국 학생들은 잔디밭에 누워서, 기숙사 침대에 엎드려서, 건물들의 복도바닥에 앉아서, 정말 말 그대로 여기저기서 공부를 하는 신기한? 모습을 볼 수 있습니다.",,
UGA는 조지아주 내륙에 위치한 작은 캠퍼스 타운이다. 애틀란타와 인접해 있으나 고속도로를 쉬지않고 2시간 가량 달려야 하는 거리라 결코 가까이 위치해있지는 않다. 파견초기에는 주말에 가끔 의욕적으로 버스를 타고 애틀란타 구경을 가기도 했으나 점차 시간이 지나면서 athens에 주로 머물게 되었다. athens는 작은 도시 (사실 도시라고 부르기도 어중간한 작은 마을정도이다. 교통수단이 변변치 않아 행동반경이 그리 넓지 않을 것이기 때문에 도시는 더 작게 느껴질 것이다.) 이기 때문에 화려한 미국 도시문화를 기대하시는 분들은 한번더 신중히 고민해 보시길 권한다. 학교의 크기는 매우 크다. 연세대학교의 주요건물들이 중앙에 밀집해 있는 것을 고려한다면 체감적으로 연대의 세배이상의 크기이다. 특정 전공과목만 집중해서 듣지 않는다면 매 수업시간마다 거대한 캠퍼스 곳곳을 거쳐야 할지도 모르지만 교내 순환버스가 거의 매분 간격으로 운행하니 걱정할 필요는 없겠다. 날씨는 정말 환상적이다. 겨울엔 결코 눈이 오지 않을 정도로 따뜻하고 여름에도 내내 화창한 날씨지만 습도가 낮아 서울보다 덥게 느껴지지 않는다. 비가 거의 오지 않아 우산을 들고 다닐 필요가 없다. 가끔 비가 올때면 우산대신 노스페이스 잠바를 입고 그냥 교내를 돌아다니는 미국친구들을 발견할 수 있다.,"대학주변 환경에 대해선 별로 말씀드릴 것이 없다. 앞서 말했듯 athens자체가 UGA를 중심으로 형성된 작은 캠퍼스 타운이기 때문이다. 다운타운에도 여러가지 가게들 - 옷가게, pub, 클럽 등 - 이 있어 금요일밤에는 길거리가 매우 붐비기도 한다. 그러나 대체적으로 학교밖에서 보다는 학교 기숙사등에서 파티를 벌이는 경우가 더 많다. 정문 바로 건너편에 Bank of America가 있으니 파견이 된다면 얼른 통장부터 개설하고 체크카드를 만들기를 권한다. 학교 밀플랜이 지겨워지면 가끔 다운타운쪽의 타이, 한국 음식점들을 이용하곤 했다. 다운타운에서 쇼핑은 거의 하지 않았었다. 라이드를 구하거나 해서 학교에서 한시간쯤 나가면 좋은 옷을 싸게 살 수 있는 아울렛이 많았기 때문이다. 다만, 역시 접근성이 떨어지는 곳들이기 때문에 한번 쇼핑을 할때에는 철저히 계획적으로 그리고 대량으로 해줘야 한다. 학교의 담장이 없기 때문에 학교 안팍의 경계가 모호하다. 그래서 학교건물들을 해치며 한쪽으로 나가다보면 어느새 가정집들이 쭉 늘어선 길들이 나타날 것이다. 차도 별로 다니지 않고 항상 날씨도 좋기때문에 산책을 하기에도 좋다. 실제로도 웃통을 벗고 조깅을 하는 미국인 친구들을 연중무휴 어느시간대나 만날 수 있다.","교환학생을 일괄적으로 ECV(East Campus Village)에 배정된다. 다소 비싸기는하지만 그 이상으로 시설등이 훌륭하다. 본교 기숙사에 한학기 정도 살았던 적이 있는데, 본교측엔 죄송한 말이지만 그 퀄리티의 차이는 비교가 안된다. 보통 4인이 하나의 suite을 사용하는데 물론 각자 방을 가지게 되고, 두명이서 하나의 화장실을 이용하게 된다. 거실도 꽤 넓은 편인데 보통 미국친구들이 티브이를 가져올것이고 운이 좋다면 비디오게임기도 구비되어 있을지도 모른다. 방에선 거의 공부를 하는 경우가 없어 (물론 책상은 마련되어 있다) 저녁엔 다들 거실에 나와 티브이를 보거나 이야기를 나누게 된다. 나의 경우는 룸메이트들이 티브이를 보기보단 주로 대화를 많이 했었다. 세명중 두명이 교내 토론클럽 소속이었던터라 밤마다 여러 주제들에 대해 열띤 공방이 오가곤 했는데 그들은 조용히 있는 내게 어떻게 생각하냐며 끊임없이 참여를 유도했으나 난 무슨 내용들이 오가는지 파악하기에 바빴던 기억이 난다.

식사는 정말 만족스러웠다. 사실 UGA를 선택했던 것에 밀플랜이 정말 괘찮다는 이전 경험보고서가 큰 요인이 되었던 것도 사실이다. 학교엔 네개의 다이닝홀이 있으며 네개의 식당이 비슷하면서도 다른 메뉴들을 시간대별로 다양하게 제공한다. 미국음식이 기름지긴 하지만 그외 저칼로리의 식단들도 다양히 마련되어있기 때문에 의지만 강하다면 충분히 체중관리도 가능할듯 싶다. 부페식으로 마련된 음식들 외에 즉석에서 주문을 받는 간단한 음식들도 이용할 수 있는데 맛있는 만큼 줄이 길다. 사람이 없는 한적한 시간을 이용해도 괜찮을 듯 하다. 입장하는데 횟수제한 같은것이 없어 가끔 네번씩 밥을 먹었던 적도 있었다. 일부 다이닝홀은 늦은 시간까지 운영하기 때문에 친구들과 피자를 먹으로 밤늦게 종종 걸어가기도 했었다. 그리고 여름방학 일정기간 동안에는 밀플랜이 중단된다. 이 시기에는 근처 월마트등을 이용하여 식량을 비축해둬야 한다.","수업자체나 학생들의 수준이 전반적으로 그리 높지는 않은 편이나 역시 문제는 영어이다. 심지어 과제물에 대한 공고를 제대로 듣지 못해 수업후 찾아가 묻는 경우도 많았다. 개인적으로 수업에 대한 적응기였던 1,2월이 가장 바쁘고 힘든 시기였던것 같다. 물론 그 이후로 영어가 대폭 늘어나 막힘없이 수업을 들을 수 있었던 것은 아니다. 다만 눈치가 급속도로 늘게 되었다.

RMIN4000
전공과목이라서 그리고 약간의 관심에 수강하게 되었는데 기대이상의 만족을 준 과목이다. 수업내용과 PPT자료들만 잘 정리하면 어렵지 않게 학점을 받을 수 있다. 미국보험제도의 법률적인 부분과 간단한 상품들에 대해서도 다루며 특별히 복잡한 내용없이 상식적인 내용들이 많아 괜찮았다. 수업보다도 교수의 시원하고 또렷한 영어발음이 많이 반가웠었다 (Charles Lankau)

FINA4200
본교의 기업재무 과목이다. 과목특성상 재무관리랑 겹치는 부분이 많다. 또한 수리적인 스킬이 요구되는 과목이라 어렵지 않게 들을 수 있을거라 생각했던 과목이엇는데 뚜껑을 열어보니 큰 착각이었다. 실제 시험에서는 수리적 문제보다는 에세이 문제가 더 큰 비중을 차지했으며 매시간 나눠주는 케이스나 보충과제들도 많아서 많은 스트레스를 받았던 기억이 난다. 

MARK 4100
소비자행동론이다. 본교 마케팅과목과 비교를 해봐도 결코 내용이 심오하거나 난해하진 않았던 것 같다. 시험역시 단답식인것도 마음에 들었고, 토론식으로 수업이 진행될때가 많아 다른 미국친구들의 발표를 듣는 것도 유익했다. 클래스내 외국인 학생이 나혼자라 (사실 대부분의 수업에 교환학생이 거의 보이지 않았다. 나중에 다른 교환학생들을 사귀게 되었을때 그들 중 경영학과 전공이 거의 없다는 것을 알 수 있었다) 교수님은 나에 대해 매우 반가워하며 다른 문화권의 의견을 들을 수 있다는 사실을 좋아하여 수업초기에 나를 극도로 부담스럽게 만들었다. 나는 결코 나서서 발표를 하지 않았음에도 가끔 나를 지목하여 말을 시키곤 했는데 버벅거리는 내 말들을 주의깊게 잘 들어주려 했던 교수님과 학생들이 지금 생각해도 많이 고맙다. 얘기가 나와서 하는 말인데, 이곳 학생들은 정말 친절하다. 한차레 홍역을 겪은 남부지역이라 인종차별이 - 적어도 겉으로는 - 전혀 나타나지 않으며 항상 웃는 얼굴로 나를 편하게 대해줬다.

ECON4100
본교의 화폐금융론 정도에 해당하는 과목이겠다. 사실 과목 타이틀만 보고 관심이 가서 수강을 했는데 가장 나를 고생시킨 과목이다. 우선 수업의 전반부에서는 수학적인 개념은 일절 나오지 않으며 해방전후부터 현대까지의 미국 경제사를 통화주의적 관점에서 다루는데, 매시간 케이스가 나왔으며 그것을 토대로 다음시간 수업이 이뤄졌다. 매시간마다 십수장의 케이스를 소화해야했는데 처음엔 그냥 준비없이 갔다가 그날 수업을 하나도 못듣고 멍한 상태로 있다가 기숙사로 돌아와야했다. 그 이후로 그 케이스를 준비해가는데 정말 많은 시간을 투자해야했다. 게다가 할아버지 교수님이였는데 약간 더듬거리는 말투라 아무리 집중해도 도무지 제대로 귀에 들어오는 문장이 별로 없었다. 결국 교수님께 수업레코딩을 허락받아 매일 저녁마다 레코딩한 파일로 수업을 복기하고 다시 혼자서 수업을 리뷰하는 식으로 시간들을 보냈다. 힘든만큼 지금 생각해보면 영어실력 향상에 많은 도움이 된 과목인것 같다. 아무튼 추천하지 않는다.","국제교육부에서는 주로 Julie라는 담당자를 통해 도움을 받게 될 것이다. 매우 친절하기 때문에 파견전후로 큰 도움이 될 것이다. 초기에 수강희망과목들을 제출하면 거기에 맞게 조정도 해주고, 또 수강이 불가능할때는 교환학생에게 적합한 여타 과목에 대한 조언도 받을 수 있다. 사실 파견전 그리고 초기적응기 외에는 컨택할 일이 별로 없으나 언제든 도움을 받을 수 있다.","UGA의 교환학생 파견의 가장 큰 장점은 (밀플랜 다음으로) 램지센터이다. 한국에선 없어서, 그리고 비싸서 또 멀어서 줄기지 못했던 운동들을 실컷 즐길 수 있다. 대형 피트니스 짐은 물론이고 초대형 수영장, 암벽등반, 스쿼시, 농구코트 등등 직접가서 보고 놀라길 바란다. 각종 볼, 라켓들도 무료로 대여가 가능하다. 램지센터가 없었다면 귀국할때쯤 정말 알아볼수 없이 부은 모습으로 돌아왔을지도 모른다. 특히나, 교내 골프장을 이용하보길 권한다. 교내 버스를 타면 어렵지 않게 도달할 수 있다.

SLC 역시 UGA의 큰 장점이다. 본교에서는 미리예약을 해서 사용할 수 있는 스터디룸을 아무때나 혼자 차지해서 공부를 마음껏 할 수 있다. (물론 혼자 이용시에는 2인이상에게 우선권이 주어지므로 관리자에의해 퇴실요청을 받을 수도 있다. 그러나 스터디룸 말고도 혼자 공부할 수 있는 조용한 공간도 굉장히 많다. 자리가 없거나 혹은 좁아서 공부를 못하는 일은 결코 없다) 1층에는 카페가 있으며 거의 층마다 컴퓨터실이 있어서 편하게 이용할 수 있다.

그리고 Main Library에는 SLC와 달리 지하에 칸막이가 있는 공간들이 있으니 본교 도서관의 스타일이 본인에게 더 맞다면 이용해도 괜찮을 듯 하다.",생각보다 컬쳐쇽은 거의 없었다. 이미 한국에 있을때부터 미국문화에 많이 익숙해져 있었던 탓인것 같다. 식당에서 더블치즈버거 세개를 쌓아서 지나가는 흑인친구들을 보고 처음에 조금 놀랬던 적이 있기는 하다. 또 한가지 느낀점은 확실히 외국 친구들의 생활이 연대생들의 그것보다 여유가 넘친다는 것이다. 외국까지 나가서 조급하고 타이트하게 생활하기 보다는 주변 환경에 속도를 좀 맞춰보는 것도 좋은 경험이 될 것 같다.,"우선 앞서 밝혔듯이 국제교류부의 쥴리를 통해서 대부분의 문제를 해결하거나 도움을 받을 수 있다.

그리고 학교 가까이 위치한 한인교회에서도 많은 도움을 받을 수 있다. 신자를 불문하고 많은 도움을 주신다. 라이드를 얻어 아틀란타나 다른 외곽지역을 다니기도 했었고 한국음식을 얻어 먹기도 했다.","몇가지 아쉬운 점을 적어본다면,

출국하기전에 너무 무방비 상태로 지내고 있었다는 생각을 해본다. 단순히 외국에서 생활하면 영어가 자연히 늘거라는 생각을 했던게 사실이다. 물론 영어는 는다. 다만, 그전에 좀더 체계적으로 선수학습 따위를 하고 갔다면 더 많은 효과가 있었을 것 같다. 토플준비가 끝났다는, 파견대학이 결정되었다는 해방감에 잠깐 긴장을 늦췄던게 약간은 실수라면 실수였던 것 같다.

또한 가기전에 자신의 교환학생 생활에 대해 구체적인 플랜을 - 적어도 하나의 컨셉이라도- 세워두고 가기를 바란다. 막연히 이것저것 부딪혀 보겠다는 생각은 위험할것 같다. 1년이나 6개월이라는 시간은 생각보다 짧은 시간이다. 어떤 부분에 더 집중할 것인지, 그래서 어떻게 생활하고 어떻게 행동해볼 것인지를 미리 생각해보기 바란다. 스스로 그런 계획이 부족하여 교환학생 생활내내 여기저기 마음이 휩쓸렸던 것 같아 아쉬움이 남는다.

한가지 팁인데, suite내엔 취사도구가 전자렌지 밖에 없고 가스불을 이용하려면 건물 1층 코너의 공용주방으로 가야하는데 사실 많이 귀찮은 일이다. 월마트등에가면 전기코드로 사용하는 버너를 구입할 수 있는데 많이 유용했던 것 같다. 특히 밀플랜이 중단되는 기간동안 라면을 끓여먹는다던지, 룸메이트들이 다 집에 가있는 시기에 한국친구들과 냄새나는 음식을 해먹는다던지 했던 것일들 역시 좋은 추억인 것 같다.

이건 다들 알고 있겠지만, 국제면허증을 만들어가길 바란다. 다운타운 클럽등이나 심지어 마트에서 맥주를 살때에도 신분확인은 필수이다. 여권은 분실우려가 있으니 시간이 있다면 준비해가길 바란다.

sejinkim82@gmail.com"
