gen_info,env_info,food_info,study_info,office_info,facil_info,mhct_info,help_info,etc_info
"크기는 훨씬 작고 전교생이 8000명 정도라고 들었습니다. 아기자기합니다.지리적위치...최악입니다. 주말같은 때에 미국에서 여행같은거 꿈꾸신분들 죄송합니다.개인적인 차가 없으면 학교자체를 벗어나질 못하고, 차타고 20분타고 나가봐야 술집몇개 레스토랑 몇개 끝입니다.","아무것도 없어요 대형마트 나가려면 차타고 20분 걸리고 어느정도 번화가, 즉 시내에 나가려면(캔자스시티) 2시간은 걸립니다.한국인은 약 20명정도 있습니다.","교환학생들은 무조건 기숙사, 식사를 신청해야 하며 이둘이 합하여 한학기에 450만원 정도 나왔습니다. 이정도 가치가 있는지 의문입니다","수업내용자체는 너무 쉽습니다. 수학 같은경우는 우리나라 고등학생이 더 잘합나다. 대부분과목이 절대평가를 채택하고 있고 교수님도 점수를 잘주는 편입니다. 도서관은 연대 도서관 구중도 1층2층3층 정도 크기가 됩니다. 11시 45분에 문을 아예 닫고, 그 이상으로 공부할만큼 수업과정이 요구하지 않습니다",OT한번 하고 끝입니다. 교환학생을 위한 프로그램을 기대하긴 어렵습니다.,식당 한개 있고 교환학생은 무조건 거기서 먹어야합니다. 맛도 없고.... 동아리는 50개 정도 있는데 한학기 있다 간다하면 그냥 그렇거니 하고.... 우리나라처럼 뭐 자주모이고 뒷풀이등의 결속력을 기대하긴 어렵습니다.,없읍니다,가자마자 코디네이터 한명을 붙여줍니다. 이분이 주로 어려운점이 있으며 바로 상담할 수 있는 사람이며 사실도움받을일이 한학기 내내 없었습니다.,
"크기는 훨씬 작고 전교생이 8000명 정도라고 들었습니다. 아기자기합니다.지리적위치...최악입니다. 주말같은 때에 미국에서 여행같은거 꿈꾸신분들 죄송합니다.개인적인 차가 없으면 학교자체를 벗어나질 못하고, 차타고 20분타고 나가봐야 술집몇개 레스토랑 몇개 끝입니다.","아무것도 없어요 대형마트 나가려면 차타고 20분 걸리고 어느정도 번화가, 즉 시내에 나가려면(캔자스시티) 2시간은 걸립니다.한국인은 약 20명정도 있습니다.","교환학생들은 무조건 기숙사, 식사를 신청해야 하며 이둘이 합하여 한학기에 450만원 정도 나왔습니다. 이정도 가치가 있는지 의문입니다","수업내용자체는 너무 쉽습니다. 수학 같은경우는 우리나라 고등학생이 더 잘합나다. 대부분과목이 절대평가를 채택하고 있고 교수님도 점수를 잘주는 편입니다. 도서관은 연대 도서관 구중도 1층2층3층 정도 크기가 됩니다. 11시 45분에 문을 아예 닫고, 그 이상으로 공부할만큼 수업과정이 요구하지 않습니다",OT한번 하고 끝입니다. 교환학생을 위한 프로그램을 기대하긴 어렵습니다.,식당 한개 있고 교환학생은 무조건 거기서 먹어야합니다. 맛도 없고.... 동아리는 50개 정도 있는데 한학기 있다 간다하면 그냥 그렇거니 하고.... 우리나라처럼 뭐 자주모이고 뒷풀이등의 결속력을 기대하긴 어렵습니다.,문화충격...이랄게 사실 없습니다. 너무 isolated 한 집단이라 사실 식당에서 밥먹다보면 여기가 한국인지 의심될정도로 미국스럽지 않습니다.,가자마자 코디네이터 한명을 붙여줍니다. 이분이 주로 어려운점이 있으며 바로 상담할 수 있는 사람이며 사실도움받을일이 한학기 내내 없었습니다.,"궁금하신 점 있으면 we******@naver.com 로 연락주세요.물론 이학교에 지원하지 않는게 최선이지만...혹시 영어실력이 부족하신분들은 최대한 연습해서 가세요. 외국인과 친해지는거, 영어실력이 부족하면 은근히 어렵습니다"
"교환대학의 크기는 음 서강대보다 작구요, 연대보다는 한참 작습니다.외대 정도 크기일 것 같네요.지리적 위치가 참 중요합니다.최악이라고 할 수 있겠습니다.중부 중에서도 중부인 미주리주에서 북쪽에 있는데,가장 가까운 캔자스시티(KC) 까지 차타면 한시간 반 걸립니다.KC공항까지는 한시간 걸리구요.그런데 문제가 KC까지 가는 버스가 하루에 한 대 있고 그마저도 오는거는 새벽 2시에 도착합니다.......가격도 편도 40-50불이구요공항까지 가는 대중교통은 전무해서 (매리빌 안에서는 택시밖에 없고, 어딜가든 6불입니다.) 택시를 타야하는데 편도 100불입니다.여러명이서 가서 나눠내면 오히려 싸긴 싸죠.저같은 경우는 미국인 친구들에게 부탁했는데, 개념치않고 태워주긴 하는데 귀찮아하더라구요. 사실 교환가서 중간중간 여행다니는 것도 쏠쏠한데저같은경우는 서부 일주하고 KC 그리고 시카고 이렇게 밖에 못갔습니다. 동부의 경우는 학기 시작하기 전에 돌고 왔네요.차후 서술하겟지만 이 학교에 오는것은 추천해드리고 싶지 않은데 그 이유중에 하나기도합니다.여행을 하실거면 학기 시작 전이나 끝난 뒤에 그냥 쭉 도시는 걸 추천드립니다.기후는 한국과 거의 비슷한데 여름이 더 늦게 끝나고 겨울에 더 늦게온다는 점이 다릅니다. 별로 특이한 기후는 아니었어요.","대학 주변 환경은 음....화천군 사창리 아시나요? 7사단 27사단 사령부가 있는...그곳보다 더 낙후되었습니다.인구도 적고 대학마을(도시라기는 민망합니다)인 매리빌 특성상술집이 있긴 한데 고만고만한 술집들 네 개 정도 있습니다.아 술집에서 미국애들이랑 많이 친해지긴 했네요 혼자가도 말 잘 걸어줍니다.저는 특이하게 한국에서 일했던 주한미군과 영어강사 아저씨를 만나서 미국에서는 흔치않게 얻어먹는 경험도 해봤네요. 학교 후문 뒤편에는 광활한 옥수수 밭이 펼쳐져 있구요... 음 가장 가까운 슈퍼는 걸어서 20분 거리에 있구요 주류판매안하고, 30분 거리에 주류판매하는 Gas station이 있고 (편의점같은느낌입니다.) 하이비 도보 40분 월마트 45분거리에 있습니다. 몇몇식당들 형편없는 식당들 그냥 맥도날드 피자헛 정도 있구요 그 흔한 치폴레 하나 없는...곳입니다. 파이브가이즈도 당연히 없구요 이건 차로 편도 40분정도 거리에 있는 saint joseph 가시면 있긴 합니다.","교환학생은 무조건 기숙사 거주해야하더라구요. 매리빌이 시골이라 그런지 밖에 렌트하는게 저렴하던데, 집도 좋고 무조건 기숙사에 거주해야합니다.여기서 문제가 저는 가장 좋다는 South Complex에 거주하였는데, 그 곳은 2인 1실이고 6인이 화장실을 하나 같이 씁니다.우선 저는 영어를 배우고, 외국 문화를 체험해보고자 간건데 처음에 타 학교에서 배정받은 한국인과 같이 들어가서 방을 바꾸는데 이 과정에서3주간 소요되었습니다.한 학기 15-16주인데 20프로간 이미 소모한거죠.그리고 진짜 큰 문제는....화장실 청소를 한달에 한번 (정확히는 4주에 한 번 )합니다.나머지는 구성원들보고 알아서 하라그러는데 청소도구도 없고휴지채워다놓는 수준입니다.아무래도 학생들이 어리다보니 (저는 4학년 1학기에 갔고, 군필이다보니 외국애들은 확실히 어리더군요.)혹은 자기 집이 아니라그런지 용변을 보고 내리지도 않고 가는 경우, 또 더럽게 쓰는경우남자분들 한정해서 변기커버에 그냥 소변을 묻혀놓는 경우가 비일비재하여 개인적으로 화장실에서 대변보기가 꺼려질 정도였습니다 식사는 기숙사에 거주하면 무조건 강제적으로 학교 카페테리아 식권을 구매해야하는데저는 이전 보고서를 보고 주5일 사용가능한 것으로 신청했습니다.(이게 최소단위에요) 음 그래도 많이 질리더라구요. 처음에는 운동하면서 닭가슴살이랑 야채, 과일만 먹었는데 도저히 안되겠어서 (다른 음식은 부리또, 피자, 햄버거, 미국식 동양볶음밥 (판다익스프레스류긴한데 너무 질이 떨어지는...) 밖에 없어서..미국 가정식 같은게 없어요!) 자주 월마트에서 장봐서 요리해먹곤 했습니다 (기숙사 주방이 있습니다 주방기구 다 있어서 빌려쓰면됩니다.)","수업은 음 굉장히 쉬웠습니다.공부를 아예 안하고 가도 final을 0점 맞아도 b는 충분히 나오는 과목도 있었구요저같은 경우는 경제학과다보니노동경제학 - 인터넷강의로만 개설되었고 굉장히 쉽습니다. 성백남 교수님 노동경제학을 들으시는걸 추천합니다.스포츠경제학 - 마찬가지로 인터넷강의로만 개설되었고 굉장히 쉽습니다. 경제학 입문 수준입니다. 국제경제학 - 이것 역시, 거시경제원론 수준보다 쉽게 나와서요........글쓰기 - 고대영같은 느낌인데 한국인임에도 우수에세이에 선정되는 ..... 심리학입문 - 이것 역시 학교에서 들은 어떤 과목보다도 꿀교양이었습니다.음. 모든 과목이 다 굉장히 쉬웠습니다.그냥 미국애들이랑 노시고, 공부는 시험전날 두시간씩만 해주셔도 패스받으시는데 충분하실겁니다. 도서관같은경우 아담한 3층짜리인데 1,2층은 얘기 가능하고 3층은 조용한데3층도 다 떠듭니다. 면학환경이 조성되어있지는 않구요 모든 취식이 가능하단게 장점이자 단점이겠네요.","제가 이 학교를 비추천하는 이유중에 하나가 국제교육부입니다.교환학생은 총 8명이었습니다. 연대 1명, 기타한국인 2명, 벨기에 2명 프랑스 1명 독일 1명 브라질 1명 이렇게였는데 각설하고, 교환학생을 위한 프로그램이 전무합니다. 주립대인데도 돈에 민감해서.. 어학연수 프로그램애들을 챙기는 곳이 국제교육부이지 교환학생은 가끔 어학연수애들 소풍갈 때 껴주는 정도에 그쳤습니다. 일처리가 굉장히 별로라.... 지금도 저랑 같은 학기를 보낸 한국인 타대 학생은 성적표를 수령하지 못했다고 합니다. 저도 수강신청을 할 때도 메일을 통해 신청하게 되는데 (아마 최초 서류에도 있을겁니다.) 어차피 그거 깡그리 무시하셔도 가서 교수님께 부탁드리면 다 해주시더라구요. 제대로 해 주지를 않습니다.또 등록금 낼 때 포탈에 로그인해서 내듯 그렇게 하는데 아이디, 비밀번호를 학교에 도착할 때 까지 알려주지 않습니다. (메일로 문의해도 안가르쳐줍니다. 저는 다섯 번 정도 문의하니깐 알려주더라구요. 학번 어딨냐? 동봉한 서류에 있다.그 부분이 찢어져있는데? 다시 확인해봐라 찢어져있다 -> 학번을 알려줍니다.비밀번호는 뭐냐? 비밀번호는 뭐뭐다 이런 식이었구요그 때는 이미 등록급 납부일이 지나서 연체료를 물었습니다 저만 찢어져있는게 아니라.... 모든 교환학생들이 다 찢어져있었고 연체료까지 물었네요 ㅎㅎㅎㅎ )무슨 서류 필요할 때도 이리저리 왔다갔다하게합니다. 아 정말 최악이네요 다시 생각해도 짜증납니다.",동아리는 이것저것 많습니다.연대처럼 뭐 만화니 축구니 많구요 저는 축구동아리를 했는데 수준은 많이 떨어집니다.운동신경 좋은 친구들은 다들 미식축구나 농구를 하더라구요.한국인 유학생 한 명은 정강이뼈가 부러졌으니 (애들이 과격합니다.)유의하세요 가서 볼 차실분은!부대시설은 뭐 교내에 아인슈타인베이글 칙필레 파파존스 이정도 있고이거는 meal change 라고 1주에 한 번 (저같은 경우 월-금 식권인지라 월-금 사이에만) 무료로 먹을 수 있었습니다.,"파티에 가도 별 거 없었습니다.파티스쿨로 유명한 학교들과는 다르더라구요 오히려 연대 캠퍼스보다 커플도 덜 보이고, 키스는 커녕 뽀뽀하는 커플도 정말 한 달에 한 두 번 볼까말까였습니다.다만 파티에 가니 서로 부모 욕을 하면서 놀더라구요. 한국에서는 결례냐고 물어봐서 서로 절대 안할거라니깐 제게 하지는 않았는데 신선했습니다.욕 먹은 친구도 자기 부모님을 욕하는 모습이 신기했네요 아 그리고 룸메이트가 성적소수자였습니다.개인적으로 성적소수자를 좋아하지는 않고, 제 앞에서 애정표현도 서슴치 않아 조금 불편했네요.","글쌔요 도움을 어디서 받을 수 있을까요저는 처음에 궁금한 점을 고교 동창들 중에 대학원이나 학부 유학중인 친구들에게 물어봤고, 다른 도움은 안받았습니다.아 미국가족과 연계하는 프로그램이 있는데 저는 그 가족이랑 밥먹고 술먹고 뭐 물어보면 알려주고 도움 주고 했는데, 이건 정말 가족마다 너무 달라서요.한인학생회가 있긴한데 수가 워낙 적고 (신입생들이 많이 들어와서 30명정도 될겁니다.) 제대로 운영되지도 않고.. 내부적인 문제도 많고제가 딱히 같이 어울릴 필요성을 못느껴서 ..... 그래도 도와는 줄거에요.","저는 비추천입니다.미국 학부 유학을 다녀온 사촌의 말을 듣고저는 무조건 시골! 시골! 하면서 시골로만 썼습니다.9지망인가 11지망이였는데요 이곳이(시골로가야 영어가 는다는 말을 들었습니다.)음... 영어는 뭐 늘긴 늘죠 사는데, 그런데 오히려 대도시는 아니더라도 좀 도시에서 여러사람들 (학교에서 학생들만 만나면 뭐 영어욕은 많이 배웠네요 늘긴 늘었습니다 토익스피킹점수보면 )과 얘기해보는게 다양한 상황이 발생해서 더 좋은 것 같아요.아 그리고 교내 금연 금주라 흡연자들은 밖에 나가야하구요.캠퍼스 안에서 피다 교내경찰에게 걸리면 벌금 100불가까이 냅니다. 다만 필 사람들은 새벽에 몰래 피더라구요.술도 룸메이트랑 잘 통하면 몰래 마시는 경우가 있긴한데 케이스바이 케이스니깐요.저는 개인적으로 연대가 이 학교와 교류를 끊었으면 좋겠습니다.궁금하신점은 ogoldatcom@hanmail.net으로 문의해주세요."
"NWMSU는 Missouri주의 북서부 거의 경계선과 가깝게 위치한 작은 시골 마을에 있는 학교이고, 주변 Iowa주나 Nebreska주와 가깝게 인접하여 있습니다. Missouri주 내의 주변 큰 도시로는 자동차로 1시간 30분쯤 떨어진 Kansas City가 있고, 30~40분 거리에 St.Joseph 이라는 나름대로 Mall도 있고 조금 큰 도시가 있습니다.   기후는 주 안에서도 가장 북쪽에 위치한 만큼 다른 도시들 보다 겨울에 춥고, 눈이 많이 옵니다. 8월에 가서는 한국보다 기온이 더 높았던 것으로 기억하고, 10월부터 추워지기 시작하면서 영하 20~30도까지 내려가기도 합니다. 기온과 상관없이 거의 바람이 많이 부는 날씨가 지속되어서, 기온이 많이 떨어지게 되면 체감하기에 굉장히 춥습니다. 최대한 두꺼운 옷을 반드시 챙겨가시기 바랍니다. 10월부터 추워진다고 하더라도, 다시 따뜻해지기 때문에 두 달 이상을 추운 날씨에서 보내는 것은 아닙니다. (날씨 변동이 심합니다.)","Maryville은 시골 마을이라고 한 것만큼 주변에 많은 문화시설은 없지만, 대학이 위치하고 있어서인지 월마트, 하이비 등 큰 마트들은 셔틀버스나 차로 5분~7분 거리에 있습니다. (편도 도보 40분쯤) 음식점 같은 경우 맥도날드, 타코벨, 버거킹, KFC 등이 있고, A&G, Simply Siam, Happy Garden, Joy wok, Mandarin 등 개인 음식점도 꽤 많이 찾아볼 수 있습니다. (많이 고급스러운 곳은 기대하기 힘드나, 맛은 대부분 나쁘지 않은 편입니다.) 또한 멀지 않은 거리에 대학생들이 주로 찾는 바들이 있습니다. Mollys와 Palms, Pub을 주로 가는데 친구를 사귀기에 좋습니다. 야간에 Safe Ride를 이용하셔서 가셔도 되고, 친구 차를 얻어타서 가시면 됩니다. (걸어서도 크게 멀지 않기때문에 날씨가 나쁘지 않으면 걸어다닐 수 있습니다.) Maryville 물가는 다른 도시와 비교했을 때 상대적으로 낮은 편이기 때문에 부담없이 즐기실 수 있을 것 같습니다.","교환학생은 기숙사에 거주하게 되고, South Complex와 Tower suite 중에 선택을 할 수 있습니다. 저는 Tower suite에서 거주했는데, 2명씩 두 방을 하나의 거실(?)과 화장실을 공유하여 쓸 수 있는 형태였습니다. Tower suite에 들어오는 친구들은 보통 2학년 이상으로 신입생은 없습니다. (하지만 룸메이트에게 들은 바로는 다음학기부터인지는 정확히 모르겠으나 Hudson&Perin Hall으로 가야할 신입생들을 Tower suite에 받겠다는 공지메일을 받았다고 합니다.) 2학년 이상의 친구들은 대부분 전에 기숙사에서 쓰던 TV나 냉장고, X-box 등을 가지고 오기 때문에, 거실에 놓고 같이 볼 수 있을 가능성이 크고 잘 어울릴 수 있으리라 예상합니다.   식사는 Meal Plan을 학기에 Gold/Silver 등으로 구매해서 이용하며 Union에 1층에 위치한 Bearcat Commons (주로 식사를 하게 되는 곳)를 이용할 수 있습니다. (입장제한 없고 새벽 한 시까지 운영). 한 학기 끝자락 쯤에는 좀 질릴 수도 있으나, 학교측에서 메뉴를 다양하게 하려고 노력하는 모습이 있고, 음식도 나쁘지 않아 만족하면서 먹을 수 있었습니다. Meal Plan을 구입하면, 부가적으로 일주일에 한 번에 한해서 2층에 있는 Einstein Bagels, Zen, Chickfil-a 또는 The station에 있는 파파존스에서 Meal Exchange를 사용하여 무료로 먹을 수 있습니다. (Meal exchange 할 수 있는 메뉴리스트는 한정되어있습니다.)   외식을 하실 경우 위에 적은 레스토랑에 가셔서하셔도 되고, Happy garden이나 Jimmy Johns에서 배달을 시켜먹을 수도 있습니다.","수업은 가을학기에 Human Resource Management, Intercultural communication, Intro to college writing, Logistics Management를 들었고, 봄학기엔 Commercial Recreation(경영학과 수업은 아니나, 레져산업 등을 주제로 한 소규모 비즈니스 사업계획서를 한 학기동안 만들어가는 수업입니다.), Consumer Behavior, Leisure and Society, Managerial Communication을 들었습니다.   운좋게 쉬운 수업을 들은 것인지, 학교 전체 수업이 그런 건지는 모르겠으나 체감상 수업을 듣는데에 큰 어려움은 없었습니다. 사실 학교위치 특성상 수업 외의 시간에 할게 많지 않아 여유시간에 과제하고 교수님이 하라는 것만 따라가면 수월하게 좋은 학점 받으실 수 있을 것 같습니다. 교수님들도 굉장히 친절하시고, 도움이 필요하면 적극적으로 도와주시는 편입니다.   도서관은 3층 건물로 1층에는 스타벅스가 있고, 컴퓨터, 프린터 등이 있습니다. 보통 조모임을 1층에서 하고, 층수가 높아질 수록 조금씩 더 조용하게 공부를 할 수 있습니다. 3층이 가장 조용하다고 합니다. (직접 가본적은 없어 잘 모르겠습니다.) 2층도 Whisper room 이라고 쓰여있긴 하나 가끔씩 큰 소리로 얘기하는 친구들이 볼 수 있습니다. 또, 2층에 writing center가 메일을 보내고 가면 리포트 쓴 것 등을 봐주기도 하고, conversation partner라고 해서, 일주일에 한 번 이십분 정도 스피킹 연습할 수 있는 친구를 붙여주기도 합니다.","NWMSU 국제처에서 교환학생을 담당하는 Jeaneth를 통해 대부분의 문제를 해결할 수 있습니다. Officer가 그렇게 많지 않기 때문에 두루두루 얼굴을 익히고 친해지면 좋을 것 같습니다. 2주에 한 번씩 International Coffee Hour라고 국제처 오피스에서 커피와 다과들을 제공해주고 모이는 시간이 있었는데, 시간 되시면 참석하셔서 찾아오는 교환학생들이나 유학생, 학교학생들과 친해지는 계기를 갖을 수 있습니다. FIS (Friends with International Student)라는 것도 있는데 Maryville에 사는 주민 중에 International 학생들에게 관심있는 사람과 매칭되는 프로그램입니다. Picnic도 가지고, 연락을 잘한다면 좋은 인연을 만들 수 있는 프로그램입니다. 이 외에도 학기 중에 Field Trip을 갈 수 있는 기회도 있으니 참여하시면 좋을 것 같습니다.","운동하시는 분들은 학교 헬스장이나 Community Center에서 한국에 비하면 굉장히 싼 가격으로 시설을 이용할 수 있습니다. (물론 기구들이나 시설은 한국 헬스장에 비해 떨어질 수 있습니다.) 농구, 스쿼시, 테니스 등 이용할 수 있는 걸로 알고 있고, 체육관 건물 또 짓고 있는데, 수영장도 생긴다고 들었습니다.  동아리는 취미 동아리로는 만화, 낚시, 축구 등이 있던 걸로 기억하고, 학술적인 동아리는 기억하기에 꽤 있었습니다. 본교에도 있는 인액터스도 있었고, 재무, 회계, 광고동아리도 있으니 Organization Fair에 들리셔서 관심 동아리가 있는지 확인하고 가입하시면 될 것 같습니다.","사실 크게 컬쳐쇼크를 느끼진 못한 것 같습니다. 한국과 미국의 큰 차이점이 무엇이냐는 질문도 꽤 들었지만, 쉽게 답하진 못했던 만큼 개인적으로 그렇게 큰 차이를 느끼진 못한것 같습니다. (각기 다른 종류의 풍습이 존재한다는 그런 것 외에는..)   NWMSU에 있는 학생들은 지역 특성상 아시안을 (사실 아시안말고도 유럽인, 인도인 등 모두 포함한 다른 문화지역 사람들) 만나볼 기회가 거의 없는 학생들이기 때문에, LA나 뉴욕에 비해서 다른 문화권 사람들을 어떻게 대해야하는지 잘 모르는 경우가 많습니다. 그래서인지 저보다 오히려 더 조심스러워 할 때도 많아서 적극적으로 다가가고, 표현하신다면 많은, 좋은 친구를 사귀실 수 있을 것입니다. (대부분 학생들이 친절하고, 착합니다.)",위에 말한 국제처의 Officer들이나 KSA라는 한국인 연합회에 궁금한 사항이나 필요한 사항 물어보신다면 대부분의 문제는 해결될 것입니다.,.
