gen_info,env_info,food_info,study_info,office_info,facil_info,mhct_info,help_info,etc_info
캠퍼스는 아주 크지 않습니다. 걸어서 30분 안에 캠퍼스를 투어할 수 있을 정도 입니다. 태양은 확실히 한국의 것보다 강렬하지만 아주 좋은 날씨를 제공합니다. 한국처럼 습하지가 않아서 에어컨 없이도 살 수 있습니다. 햇빛이 너무 강렬해 선글래스를 가지고 다니는 것을 추천합니다. 지리적으로 가깝고 여행많이 가는 곳으로는 샌프란시스코가 있습니다. 기차타고 10달러로 1시간 정도면 갈 수 있습니다. 산호세로 올 때 샌프란시스코 비행기표를 끊고 거기서 택시를 타거나 기차로 오는 방법도 추천을 합니다.,"down town에 캠퍼스가 있어 술집, 음식점, 놀거리를 쉽고 가까운 거리에서 접할 수가 있습니다. 캠퍼스 맵을 구할 수가 있는 데 그걸로 식료품점이나 음식점 같은 곳을 찾을 수가 있어요.","저는 International House 란 기숙사에서 1년간 살았는데 의무적으로 meal plan을 신청해야해서 비쌉니다. 가격은 한학기에 600만원 정도로 비쌉니다. 전형적인 기숙사(건물 안에 복도에 호텔처럼 방들이 있는 거)가 아니라 큰 집처럼 되있고 1층은 같이 쓰는 dining room, tv room, office 등이 있으며 지하에는 study room, kitchen, 놀 수 있는 탁구대, 당구다이 같은 것들이 있는 공간이 있습니다. 저는 거기서 내 인생에서 다신 경험하지 못할 값지고 행복한 생활을 했답니다. 일반 기숙사에 갔더라면 정말 혼자서 할 거 없고 심심했을 겁니다. 인터네셔널 하우스에서는 여러 나라에서 온 애들과 얘기하고 사귈 수 있는 기회가 있으며 기숙사에서 가는 필드 트립이나 이벤트 같은 것이 있어 무료한 시간이 별로 없었습니다. meal plan도 좋았습니다. 하루에 몇번이고 부페식으로 되어있는 학생 식당을 들어 갈 수 있습니다. 무엇보다도 요리하고 설거지하는 시간을 줄여주어 매우 편리했습니다. 주 5일, 주7일이 있는 데 주5일을 추천합니다. 매일 먹으면 질릴 수가 있기 때문이죠. 주말엔 친구들끼리 밖에서 사먹고 그런 식으로 하면 좋을 것 같네요.","Lecture와 같은 대규모 강당 강의 class와 같은 소규모 수업 강의가 있는 데 제가 있었던 학교는 소규모 클래스(약 30, 40명)정도가 많았던 거 같네요. 교수님에 따라 스타일이 다른데 저같은 경우 Canvas 를 많이 활용하는 교수가 좋았어요. 과제나 수업내용을 Canvas에 항상 올려 주기 때문에 영어를 완벽하게 하지 못하는 저에게 많은 편리함을 주었어요. Clifford 교수님의 Personality of Psychology 강의가 그런 수업방식이었어요.그리고 수업 수강 신청 기간을 유의해 주세요. 학기 도중에 다음 학기의 시간표를 짤 수 있는 기간이 있습니다. 저는 한국과 다른 그런 시스템을 모르고 있다가 그 기간을 놓치고 나중에 수강 신청을 해서 듣고 싶은 과목을 많이 못 들었답니다.도서관은 10층 짜리 정도의 건물로 캠퍼스에서 제일 크고 일반 시민들로 출입이 가능합니다. 높은 층에 올라가면 경관도 좋고 조용해서 공부하시기 좋은 자리가 많습니다.",이벤트같은 거 참여하라고 국제부에서 메일은 많이 받았는데 가본 적은 없네요.외국인들을 친절하게 도와주고 상담해 줄 수 있는 곳입니다.,교환학생들에게도 gym이나 swimming pool을 무료로 이용할 수 있게 해서 자주 이용하면 좋습니다.meal plan 이용이 질리면 student  에가서 외부 음식을 섭취하실 수 있어요. 한 한기마다 meal plan 신청시 dining dollar을 학생증에 채워줘서 거기서 그걸 돈처럼 쓸 수 있어요. 한학기가 끝나면 돈이 소멸되는 점을 유의하시길 바랍니다.,저는 남자입니다. 우리나라 기숙사랑은 달리 방에 여자를 데려 올 수 있다는 거에 놀랐습니다. 물론 여자 학생의 경우도 마찬가지지요. 저는 3명이 살 수 있는 방에 살았었는데 한 미국인 룸메이트가 여자 친구를 데려와 자주 같이 자는 것 때문에 트러블이 있었기도 했습니다. 상관없으면 괜찮겠지만 불편하면 숨기지 말고 기숙사 manager 한테 보고해서 다 같이 상담하고 해결 방안을 모색할 수 있습니다. 여긴 문화가 개방적이라 그냥 까놓고 오픈 하는 게 중요합니다. 안 그러면 아무도 신경 안 쓰고 괜찮은 줄 알아요.,여기 사는 친구를 사귀는 것이 많이 도움이 되었습니다. 특히 차있는 애들이 도움이 되죠. 워낙 땅이 넓어서 차가 없으면 어딜 가기가 상당히 부담이 됩니다. 차 있는 애들과 친해지면 그런 부담을 많이 떨쳐 버릴 수가 있죠.,저는 전공 과목 몇개 듣는 것 때문에 산호세 쪽 캠퍼스를 선택했는데 다른 대도시의 캠퍼스가 더 좋고 넓은 경험을 할 수 있는 거 같아요. 산호세는 관광으로 유명한 도시가 아니라 놀러 다닐 때가 근처에 없어서 조금은 지루 한 life가 될 수가 있어요.
"학교의 크기는 많이 크지는 않습니다. 제일 끝과 끝인 기숙사에서 도서관까지 천천히 걸었을 때 넉넉히 잡아 20분 정도 걸립니다. 캠퍼스내에 잔디밭이 넓게 있고 굉장히 평화로운 분위기 입니다. 다운타운에 위치해 있으며 주변에 주거시설이나 상점이 잘 발달 되어 있습니다. 하지만 샌프란시스코와 같은 대도시의 다운타운의 느낌은 아닙니다. 산호세의 장점은 대도시 처럼 너무 시끄럽지 않고 편안하며, 무엇보다 여행을 갈 때 최적의 위치에 있다는 점인 듯 합니다. 샌프란시스코로 가는 직행 기차가 있으며 약 1시간 30분 정도 소요되기 때문에 샌프란시스코로 부담없이 가실수 있습니다. 기후는 보통의 캘리포니아 날씨이지만, 산호세는 북부 캘리포니아에 해당 하기 때문에 여름에도 너무 덥지 않고 겨울에는 춥지 않습니다. 습하지 않기 때문에 그늘에만 가셔도 시원한 정도입니다. 겨울날씨는 겨울임을 감안할때 춥지 않지만 겨울 옷은 챙겨 가셔야 합니다.","학교 주변에는(남,동,서쪽) 대부분 주택가이며 학교의 북쪽 다운타운 지역에는 많은 음식점과 마트(SAFE WAY)가 있습니다. 버스를 한번 갈아타야 하지만 자전거가 있으시다면 충분히 갈수 있는 거리에 월마트가 있습니다. 산호세 지역에는 많은 한인들이 모여있는 마을이 있는데 버스를 타고 가시면 쉽게 한인 마트에 가실 수 있습니다. 그 지역에는 3개의 큰 한인 마트와 많은 음식점, 노래방, 미용실 등 편의시설이 있습니다. 미국 다른 곳에 비해 산호세는 크게 위험한 지역은 아니나, 여자분인 경우는 너무 늦은 시간에 혼자 다니는 것은 좋지 않습니다. 학교 안에 늦은 시간에 가이드를 해주는 것이 있는데 그 것은 OT할때 학교에서 더 자세하게 얘기해 줄겁니다. 그 외에 아울렛몰과 같은 편의시설도 대중교통으로 쉽게 접근 가능합니다.","교환학생의 선택권은 보통 international house, CVB, 혹은 집을 렌트하는 것입니다.  저같은 경우, CVB에 추가 합격이 되어 그곳에서 1학기를 지내고, 2학기는 international house에서 지냈습니다. 집이나 아파트 렌트는 개인적으로는 추천하지 않으므로 CVB와 international house를 비교해보겠습니다. CVB에서는 보통 룸메이트들이 미국인인 경우가 대부분입니다. 장점은 미국인 친구들과 직접 부딪친다는 점, international house에 비해 시설이 좋다는 점, 취사가 가능하다는 점과 프라이버시가 더 잘 보장된다는 것입니다. CVB에 살 경우 룸메이트와 방을 같이 쓰는 더블룸과 싱글룸의 선택권이 있으며 한 아파트에 조그마한 거실, 부엌, 두개의 화장실(하나일 수도 있음)로 구성되어 있습니다. CVB의 단점은 (특히 여자인 경우) 룸메이트와의 마찰입니다. RA나 기숙사 사무실에 가서 여분의 방이 있다면 도중에 옮길 수 있지만, 그 전에 룸메이트와의 사이를 중재해줄 사람이 없습니다. 또한 룸메이트가 파티를 좋아한다면, 늦은 밤 방에 친구들을 데려와 큰 소리로 음악을 트는 경우도 가끔씩 있습니다.(모든 미국인 룸메들이 그러는 것은 아닙니다.)International house의 경우, 많은 이벤트로 인해 기숙사 친구들끼리 친해질 기회가 많고, 대부분 외국인 학생이기 때문에 여행을 같이 다니기 좋습니다. 와이파이를 하우스 전체에서 사용하실 수 있으며 지하에 스터디룸과 당구대가 있는 놀이방이 있습니다. 적은 돈이지만, 운이 좋다면 기숙사 내에서 일을 할수 있는 기회가 있고 RA제도가 있기 때문에 밤에 조용하고 기숙사가 CVB와 다르게 관리가 됩니다. 무엇보다 International house임에도 불구하고 꽤 많은 미국인들이 있고, 많은 영어권 나라의 학생들과, 대부분 영어를 정말 잘하기 때문에 영어를 배우지 못할 것 같다는 우려는 전혀 하시지 않으셔도 됩니다. 하지만, 반드시 밀플랜을 사야 한다는 점과 그에 따라 가격이 비싸다는 점이 가장 큰 단점이며 시설이 낡았다는 것과 싱글룸에 대한 선택권이 없다는 것(반드시 방을 같이 써야함), 공용 화장실과 샤워실입니다.(물론 커튼으로 가려져 있습니다)아파트나 집 렌트를 추천하지 않는 이유는 정보를 얻기가 비교적 어렵고(I HOUSE> CVB> 아파트) 친구를 사귀기 어렵기 때문입니다. 특히 가을에 갈 경우 보통 교환학생은 8월 초에 가게 되는데 이미 좋고 저렴한 방 역시 구하기가 쉽지는 않기 때문에 메리트가 없습니다.당부드리고 싶은 말씀은, 첫 학기 때 international house에 지원했지만, 인원이 많아서 떨어졌고 집을 못구한채 미국으로 갔습니다. 혹시 저와 같이 집을 못구하셨다고 해서 CRAGSLIST를 통해서 확인도 하지 않고 집을 계약하시는 것은 정말 비추입니다. 또한 SJSU로 배정을 받았지만 학교 측으로부터 공식적인 합격 통보를 못받았다고 해도, 그것과 상관없이 무조건 기숙사는 최대한 빨리 지원하시기 바랍니다. I house의 경우는 에세이가 중요하며 특히 빨리 지원하는 것을 추천합니다.1년 동안 여러 기숙사를 살고 싶으시다면 i house-> CVB OR 아파트 렌트를 추천합니다.","저는 1학기때는 organizational behavor, Fundamental of HR, Public speaking, Yoga, Weight training, Hiking&back packing을 들었고 2학기 때는 diversity management, money matters, supply chain management, beginning of photography, beer appreciation 을 들었습니다.우선 영어를 원어민 만큼 하는 것이 아니라면, 첫학기에 비영어권의 교수님의 수업을 듣는 것은 비추입니다. organizational behavor 수업에서는 교수님의 이탈리아 악센트 때문에 고생을 많이 했습니다. 개인적으로 Rick Patridge 교수님의 Fundamental of HR이나 diversity management를 추천합니다. 수업이 어렵지 않고 diversity management에서는 차별에 대해서 다시 생각해볼 수 있는 좋은 기회였습니다. 시험은 오지선다와 t/f 와 짧은 에세이 였습니다.supply chain management 수업 역시 강추입니다. 성함이 Ming Joe 교수님이셨던 것 같은데 중국인 분이시지만 특유의 악센트가 강하지 않아서 수업 듣는데 지장이 없습니다. 시험 가이드라인을 주셔서 시험 공부하는데 어렵지 않고, 많은 것을 아시고, 수업 역시 흥미롭습니다. 시험은 오지선다, t/f, 짧은 에세이, 계산 문제 입니다.Public speaking 수업은 많은 경험보고서에서 추천을 하시길래 신청했습니다. 교수님은 Elizabeth 교수님이었고 지금은 영어권/비영어권으로 나눠서 수업하시지 않습니다. 2-3주마다 피피티를 준비해서 발표를 준비하는 수업이었고, 개인적으로 가장 힘들었지만 유익했던 수업이었습니다. 사진 수업(Mendoza)은 이미 조금이라도 지식이 있으시다면 강력추천하고 싶습니다만 아니라면 조금 어려울 수는 있습니다. 하지만 굉장히 창의적으로 흥미롭습니다. 수강 신청 학점이 남는다면 BEER CLASS 꼭 들으시길 바랍니다. Dr, Kate 교수님이신데 매주 다양한 국적의 맥주를 맛볼 수 있고 가볍게 듣기 좋습니다.",국제 교육부에는 굳이 찾아갈 일이 별로 없었습니다. 하지만 질문을 하러 가면 잘 알려주십니다.,,"미국 어느 지역에서나 홈리스 피플들을 보실 것이며 산호세 역시 존재합니다. 그러나 대부분 위협을 가하거나 하는 등의 행위는 하지 않습니다. 대부분의 주에서 대마초를 하는 것을 허가하거나 별로 엄격하게 처벌하지 않습니다만 안하시기를 권유합니다. 컬쳐 쇼크는 아니지만, 미국은 만 21살 이후 부터만 술을 마실수 있으며 비교적 강하게 체크합니다.",국제 교육부에서 도움을 받을 수 있지만 보통 international에 사신다면 그 곳 매니저와 의논 하시면 될 듯 합니다.,"산호세 안에 한인마을이 형성 되어있고 큰 아울렛을 가면 많은 한국인들이 있지만, 정작 학교내에서 한국인을 만나는 일은 흔하지 않습니다. 저 역시 두달 가까이 한국인을 만나지 못했습니다. 한국인이 많은 곳을 피하고 싶지만 한인 시설을 이용하기 용이한 곳을 찾으시는 분께 적합한 곳이라고 생각합니다.또한 아직 지원 전이라면 ISEP을 통한 SJSU로의 지원도 권유해드로 싶습니다."
