gen_info,env_info,food_info,study_info,office_info,facil_info,mhct_info,help_info,etc_info
"Indiana State University는 인디애나주의 Terre Haute이라는 작은 도시에 위치해 있다. 캠퍼스의 크기는 연세대학교와 거의 비슷한 편이지만 빌딩들이 낮아, 규모가 더 작게 느껴진다. 하지만 넓은 잔디밭은 많이 볼 수 있다. 인디애나는 산이 거의 없고 평지로 이루어져 있다. 그래서 기온차이도 극심하다. 그래도 덥고 추운 정도가 우리나라와 비슷해서 그다지 날씨 적응에 힘들지는 않았다. 가끔 바람이 너무 세게 불어서 놀랐던 경험은 있다. 
 인디애나주는 시카고 아래에 위치해 있어 처음 학교에 갈 때, 인천-시카고를 경유해서 인디애나폴리스 공항에 내렸다. 인디애나폴리스에서 Terre Haute까지는 차로 1시간 정도 걸리는데, 공항에 갈 일이 있을때마다 주변사람에게 Ride를 구해야지 그렇지 않으면 택시로 100불 넘게 나오니 주의해야 한다. 나는 처음 학교에 갈 때는 International office의 coordinator분이 나오셨었다. 
 인디애나가 중동부 정도에 위치해 있어 이곳 저곳으로 여행하기는 좋았다. 가끔 인터내셔널 친구들끼리 주말에 차를 렌트해서 가까운 도시로 여행을 가거나, 휴일이 있을 때는 비행기로 캘리포니아, 워싱턴, 뉴욕 등으로 여행을 가기도 했다.","Terre Haute은 한마디로 지루한 곳이다. 캠퍼스 가까이에 우체국, social security office등 공공기관이 있고, 몇 개의 레스토랑, 상점, pub 등이 있지만, 그냥 조용한 동네이기 때문에 신촌에서의 즐거움을 절대 기대해서는 안된다. 처음에는 조용하고 아담한 것이 마음에 들었지만 금방 싫증이 나서 좀 답답해했었다. 
 Wal-mart는 차로 5분정도 거리에 있어서 누군가의 Ride가 꼭 필요했다. 월마트 가는 길에 쇼핑몰 하나가 있는데 가끔 그곳에 가서 쇼핑을 하는 것이 스트레스 해소에 도움이 된다. 꼭 월마트나 쇼핑몰에 가야할 일이 있는데 ride가 없다면 버스를 이용해도 된다. 캠퍼스 바로 옆에 버스정류장이 있는데 정해진 시간마다 온다. 버스 시간이 맞지 않아 택시를 이용해야 한다면 10불 내외로 나온다. 
 아시안 마켓이 아주 가까이에 있다는 것은 좋다. 한국음식 왠만한것은 거의 구할수 있었고, 거기서 재료를 사다가 다른 나라 친구들과 같이 요리를 해먹기도 했다. 대부분 미국의 교환 대학교들이 이렇게 크지 않은 도시에 위치해 있는걸로 알고있다. 마냥 심심해하고 지루해하면서 금쪽같은 시절을 보내기 보다는, 다양한 나라에서 온 친구들과 같이 이것저것 놀거리들을 찾아다녀야한다. 캠퍼스에서 열리는 각 종 행사에 꼭 참여하고, 파티나 클럽에도 가고, 영화관고 볼링장도 걸어갈 수 있는 거리에 있으니, 열심히 찾아다니면서 놀아야한다^^","나는 두학기 모두 기숙사에서 생활했다. ISEP은 미리 식비와 기숙사비를 내고 가는 것이니 어쩔수 없다. 첫 학기는 Mills Hall에서 지냈고 두번째 학기는 Jones Hall에서 보냈다. Mills Hall은 인터내셔널 학생과 저학년, 운동부 학생들이 대부분이라 매우 소란스럽고 한편으로는 교류도 많다. 첫학기는 그냥 시끌벅쩍한 분위기가 나름 괜찮아서 옮기지 않고 있었다. 나는 처음 배정 받은 방에 문제가 많아서 방을 두번이나 바꿨는데, 자기가 원하면 Area Director에게 말해서 언제든지 바꿀수 있다. 
 나는 두학기 모두 미국인 룸메이트와 함께 지냈다. 미국인과 미국 문화에 대해 쉽게 이해할 수 있다는 점은 좋다. 다들 미국인 룸메이트와 함께 생활하면 영어가 많이 늘 것으로 기대하지만, 그것도 룸메이트와 취향이 맞아야 가능하다. 오히려 다른 나라의 친한 친구와 함께 방을 쓰는 것이 대화거리도 많고 더 좋을거라 생각한다. 보통 같은 ISEP의 친구들과 룸메이트가 되기쉽다. 
 두번째 학기는 120불을 더 내고 Jones Hall로 옮겼다. 그곳은 고학년들만 쓰는 기숙사라 어쩔때는 심심하다 싶을정도로 조용하다. 하지만 Mills Hall과는 다르게 에어컨디셔닝 시스템도 있고 방마다 Bathroom이 있다. 방 크기도 더 크고 깨끗해서 한 학기에 120불이 아깝지 않다. 
 식사는 ISEP에 처음에 돈을 내고 가면 ID카드에 credit과 commons cash를 넣어준다. 이 시스템이 처음에는 매우 이해하기 힘들지만 자꾸 친구들을 따라다니다 보면 저절로 익숙해 질 것이다. 보통 기숙사 식당에서 크레딧을 사용하고 Commons라는 곳에서는 commons cash를 사용한다. Commons에는 버거킹, 타코벨 등이 있어서 Take out을 해서 먹을 수 있고, 차이니즈 식당도 있어서 밥생각이 날 때는 항상 갔었다. 하지만 credit에 비해 훨씬 적은 commons cash를 주기 때문에 펑펑 쓸수는 없다.  음식은 대체적으로 괜찮고, 다양하게 부페식으로 먹을 수 있다. 그래서 자칫하면 살이 찔 수 있으니 조심해야한다.","수업은 예상보다 어렵지 않게 들었다. 미국 교수들이 후하게 점수를 주고, 절대평가 방식이라 할 것만 잘하면 나쁘지 않게 점수를 받는다. 
 나는 첫학기에는 13학점 두번째 학기는 12학점을 신청했다. 미국에서의 생활을 공부하는데만 보내고 싶지 않아서 넉넉하게 시간을 비워놨었다. 지금도 그게 잘한 선택이라고 생각한다^^ 
 봄학기에는 전공으로 가구디자인, 드로잉, Women Artists를 듣고, ESL 과목 하나와 재즈댄스를 들었다. 전공과목들은 우리나라에서와는 다르게 직접 체험하는 수업이 많아서 새로웠다. 예를 들어 가구디자인 시간에는 우리가 직접 목재를 고르고, 커다란 기계를 가지고 나무를 자르고 다듬었다. ESL과 Women Artists는 과제가 많아서 좀 버거웠지만 과제를 많이 쓰는 만큼 영작실력에 많은 도움이 된다. 댄스과목은 학기말에 댄스쇼를 가진다. 친구들을 초대하고 좀 민망하지만 애들 앞에서 한 학기동안 배운 춤을 보여줘야한다. 
 가을학기에는 전공으로 그래픽 디자인과 인테리어 디자인 과목을 듣고 커뮤니케이션과 중국어를 들었다. 이 학기의 모든 수업들은 개인적으로 참 마음에 들었다. 인테리어 수업에서는 주변의 도시로 field trip을 여섯번 정도 나갔다. 가까운 곳에서부터 시카고도 갔었는데, 교수와 함께 유명한 건축가들의 건물을 볼 수 있는 뜻 깊은 시간들이었다. 커뮤니케이션 수업은 미국학생들 앞에서 발표를 서너번 할 수 있는 기회가 있어서 좋았고, 1학년 수업이라 빡빡하게 진행되지도 않는다. 중국어는 중급반이라 학생이 나와 미국 여학생 딱 두명이었다. 그래서 과외지도 같은 수업이었다. 중국에서 오신 교수님이 집에 초대하셔서 중국음식을 직접 만들어 먹기도 했고, 다양한 Activity가 있는 수업이었다. 
 인디애나 주립대학의 도서관은 연세대학교 중도에 비하면 작은 건물이다. 그리고 의외로 공부하는 학생들이 많지 않아서 또 놀랍다. 나는 조모임이 있을 때나, DVD를 빌리러, 아니면 도서관에 있는 Coffee Ground에서 공부하러 가끔씩 갔다.","국제교육부는 새로 지은 Stalker Hall 2층에 위치해 있고, Janis라는 분이 코디네이터로 계신다. 거의 할머니에 가까운 연세 있으신 분인데, 교환학생들의 갖가지 일들을 도와주시고 상담해주신다. 나는 봄학기와 가을학기로 갔기 때문에 중간에 4달정도 되는 긴 여름방학을 어떻게 보내느냐 하는 것이 문제였다. 그 때 Janis분께서 나에게 포스터와 표지제작하는 일을 맡기셔서 잠깐 일을 하고, 또 그 일한 경험을 가지고 Social Security Number를 받을 수 있었다.","학교에 있는 헬스클럽에 등록하면 1년에 60불 정도 되는 돈으로 이용할 수 있다. 또 수영장이나 테니스장, 농구장도 이용할 수 있다. 나는 체육관에서 무료로 운영되는 스포츠 교실에 가끔 갔었다. 나는 킥에어로빅을 했는데, 요가나 스텝에어로빅등 다양하게 있다. 일주일에 한 두번 가서 몸을 풀고 오면 아주 좋다. 미국에서 특별히 병원을 이용할 일은 없었지만, 무슨 일이 있으면 학교내의 보건소를 이용하면 된다. 기본적인 진료는 모두 가능하다.","미국 대학생들은 목요일 밤에 모두들 클럽에 가서 춤을 추고 노는데, 처음에는 그 춤추는 모습이 조금 당황스럽기도 했다. 가끔 아, 미국 사람들이 이렇구나.. 하고 놀랄 때가 있었지만 그냥 문화적 차이라고 생각하고 대부분 넘겼다. 어차피 교환학생의 중요한 목적 중의 하나가 새로운 문화를 경험하는 것이니 자연스럽게 어울리는 것이 좋다고 생각한다.",아까 이야기했던 국제교류부의 Janis라는 분이 가장 편하게 도움을 받을 수 있는 곳이다. 그리고 ISEP으로 가면 같은 ISEP 프로그램을 통해서 온 친구들과 항상 어울려 다닌다. 모두 국적은 다르지만 친구들이 항상 내 가족처럼 도와주고 챙겨준다.,"1년이라는 시간동안 정말 많은 것을 경험했다. 내가 그냥 한국에 머물러 있었다면 평생 경험하지도 못 했을 것이다. 
 특히 긴 여름방학동안 한국에 돌아가지 않고 혼자 살아보려고, 무작정 뉴욕으로 넘어가 집을 알아보고 3달을 그곳에서 혼자 지냈다. 혼자 살림살이를 하고, 그냥 발길이 닿는대로 뉴욕여행을 하면서 보고 느끼고 얻은 것이 많다. 정말 교환학생 기간동안에는 쇼핑을 많이 하는 것보다 그 돈을 모아서 여행 한번 더 가는것이 훨씬 좋다. 나는 최대한 많은 곳을 보려고 했고, 마지막에는 6개주를 돌면서 로드트립도 했다. 
 좋은 경험, 나쁜 경험 골고루 많지만, 이제와 생각해 보면 내가 교환학생이라는 기회가 없었다면 대학시절에 절대 얻지 못했을 소중한 추억들 뿐이다."
"교환대학의 크기: 주립대학이지만 연세대학교정도이거나 작은 것 같다. 하지만 학생수가 우리학교보다 적어서 생활하기는 (도서관 이용이라든지, cafeteria) 불편이 없다. Terre Haute이라는 Indiana의 주도인 Indianapolis에서 1시간~ 1시간 30분정도 거리에 있다. 몇 년전 까지는 Terre Haute 공항이 있어서 학교와 30분 정도 떨어져있었으나, 지금은 폐쇄되어 Indianapolis가 가장 가까운 국제공항이다. 그래서 Ride가 필요한데, 나같은 경우는 ISU에서 admission과 J-1 서류가 오면서 Greyhound라는 미국전역을 다니는 버스(고속버스는 아니고..)를 이용할 것을 권유(?)받아 그것을 이용했는데 별로 추천하고 싶지 않다. 차라리 ISU에 있는 어학연수기관 (Interlink라는 학원이 있음)에서 제공하는 Ride나($100이라고 들었음) 한국학생회에서 제공하는 Ride 신청을 하는 것이 좋다. (약간의 비용을 지불해야함. -KOSA라고 불리는 한인학생회가 있음, http://mama.indstate.edu/kosa) Terre Haute은 그 크기의 도시 중에서 가장 안전한 도시 중에 하나라고 한다. 해가 진 후에는 거의 사람들을 찾아보기 힘들 정도이다. 기후는 한국과 같이 명목상은 4계절이 존재하는데, 실제로는 여름과 겨울만 있다고 해도 과언이 아니다. 3월 초를 중심으로 2월 말까지는 눈이 내리고 영하의 날씨를 보이다가 3월 초에 있는 Spring Break 직후부터는 초여름의 날씨를 보인다. Terre Haute을 Terrible Hot이라고 외국유학생들 사이에는 부르니, 그 더운 정도를 알 수 있을 것이다. 그리고 긴 여름을 지나서 10월 중순까지 덥다가 11월초가 되면 갑자기 겨울이 된다. 겨울의 특징은 눈이 많이 온다는 점이다.","워낙 조용한 도시가 되어서 학교 주변에는 놀 곳이 전혀 없다고 해도 과언이 아니다. 그런데 서쪽지역 (West Terre Haute)은 아직도 인종차별(백인우월주의 깉은것)이 남아있어 가지 않는 편이 낫다고 한다. 학교 주위에는 fast food점 몇 개가 전부다. 학교 내 Student Union(학생회관)에 있는 Cupboard에서 간단한 생필품(비누, 치역, 간단한 음료수 등)은 살 수 있다. 하지만 그것보다는 주위 친구에게 부탁해서 15분 정도 떨어져 있는 Wal-mart 라든지 K-mart, Kroger에서 구입하곤 했다. 아는 사람을 찾을 수 없는 경우 bus를 이용해도 된다고 한다.(오후 5시 정도까지만 운행한다고 들었다.) 20분 정도 떨어진 Wal-mart 주변에는 restaurant, mall 등이 있어서 식사와 쇼핑을 할 수 있다. 다행히 걸어갈 수 있는 거리에 Asian Market이 있어서 한국음식(라면, 김치, 쌀 등...)을 사먹을 수 있다. 그리고 중국인 주인에게 한글로 이름만 적어주면 대부분은 구입할 수 있다고 한다. Terre Haute이라는 도시에는 한국식당은 없고 (중국식당은 많다) 1시간~ 1시간 30분이 걸리는 Indianapolis나 Bloomington에 가면 된다.","ISEP을 통해 교환학생을 가는 경우 기숙사에서 사는 것이 의무인 것으로 알고 있었고, 그래서 기숙사에서 살았다. 두 학기 다 미국인 Roomate와 방을 썼고, 나름대로 미국인들의 생활을 볼 수 있었다고 생각한다. 기숙사는 충분했고 층마다 여자층 남자층이 구분되어 있었다. 이론상으로는 계단이나 엘리베이터를 키로만 열수있도록 해서 여자층에 남자들은  들어올 수 없도록 되어있었다(escort받는 경우 제외). 그리고 샤워실과 화장실은 한 층에 2개씩 있고 한 층이 함께 share하도록 되어있었다. 예상과는 달리 사용하는데는 전혀 불편이 없었다. 하지만 고학년(3학년이상)과 대학원생들만 입실할 수 있는 Hines Hall은 한 장을 2명이 함께 쓰는 것을 같으나 방안에 화장실이 있고 조용하다. Pickerl Hall은 Hines Hall과 마찬가지로 고학년들만 사용가능 하고, 독방으로 되어있다. 각 dorm마다 컴퓨터실이 있다. 또한 각 층 마다 RA라고 해서 즉 resident assistant라고 하여 그 층을 담당하는 학생이 있어서 모르거나 어려운 일이 있을 때는 자기 층 담당의 RA를 찾아가서 물어보면 된다. 그 이외에는 off-campus에 University Apartment라고 불리는 기혼자 apartment가 있었다.식사는 기숙사에 있는 학생은 meal plan을 구입하는 것이 필수이다. 교환학생에게는 아래서 2번째 단계의 meal plan을 제공한다. (ISEP으로 교환학생을 가는 경우 출국 전에 기숙사비와 식비를 학교에 납부한다. 나 같은 경우는 한 학기에 250만원 정도씩 2번 납부했다.) credit이라는 것으로 식비를 지불하는데 아침은 6credit, 점심은 8 credit, 저녁은 11 credit이고 한 학기에 1600credit 정도를 지급 받는다. 혼자 사용하는 경우 매일 3번 식사하는 데 부담이 없다. 식사는 cafeteria 형식으로 들어갈 때 credit을 지불하면 원하는 것을 다 먹을 수 있다. 그리고 이 외에도 commons cash라는 것이 있는데 이것은 학교 내에서는 현금처럼 사용할 수 있다. 이 commons credit과 commons cash를 잘만 사용하면 학교 내에서는 현금을 사용하지 않을 수도 있다.","첫 번째 학기에는 13학점, 두 번째 학기에는 15학점을 수강하였다. 첫 번째학기에는 영어에 대한 부담감 때문에 최소 신청 학점인 12학점에 체육과목을 신청했다.ENG103A English Second Language (Dr.Barret)- 외국인 학생들을 위한 미국 문화의 이해를 도와주는 과목이다. 다른 나라와 미국이 다른 면에 중심을 두어 수업이 진행된다. 대부분 학생들이 자기 나라는 어떠한 상황에 이렇다를 토론하고 essay를 쓴다. 조를 짜서 미국학생들에게 설문조사를 하기도 한다. 시험은 없고, 수업 중에 쓴 essay을 가지고 평가한다. 그리고 final 기간에 지역 초등학교에 가서 (미국 초등학교 과정에 세계의 여러 나라를 배우는 시간이 있다고 한다.) 자기 나라를 소개하는 시간이 있다. 내가 갔을 때는 초등학교에 Pokemon이 대유행하고 있어서 일본학생들이 가장인기가 많았다. 이 시간이 가장 기억에 남는다. ENG 310 English Grammar (Dr.Barret)- 영어에 자신없는 나에게 adviser가 추천해 주었다. 걱정 많이하고 수강하였으나 생각보다 미국학생들의 영문법 실력은 형편없었다. 미국학생들은 많이 drop 했으나 나와 몇몇 일본 학생들은 쉽게 점수를 얻을 수 있었다. 2~3주에 한번씩 있는 Quiz와 몇 개의 assignment, final로 성적을 산출하였다. P E 103 Jogging & Fitness Walk- 학교에서만 살아서 운동부족을 염려하여 신청하였다. 지루하였지만 미국인 친구를 몇 명 만들 수 있는 기회였다. PE과목을 많이 수강하면 짝지어 하는 것이 많기 때문에 미국인 친구를 많이 만들 수 있다고 한다.  PSCI 201 American Government (Dr. Goidel) - 미국학생들의 general education 과목이면서 Political Science의 전공과목이었다. 미국에서 미국정부에 대해 배우고 싶어서 신청했다. 잘 못알아 들었거나 미국 학생들이 고등학교에서 배우고 오는 기본 지식을 몰라서 수업이 끝난후에 질문하면 교수가 매우 친절히 가르쳐주었다. PSCI 460 American Foreign Policy (Dr.Erisman)- 학부와 대학원생이 함께 듣는 과목이었는데, 내 관심사와 맞는다고 advisor가 추천해준 과목이었다. 학생도 10명정도 뿐이었고 토론식으로 진행하여 나한테는 좀 힘들었다. 마지막에 20장 이상의 term paper를 제출했는데 그것이 가장 힘들었다.  두 번째 학기에는 우리학교에서 전공학점으로 인정 받을수 있는데 국한되지 않고 미국에서만 배울 수 있는 과목에 중점을 두어 수강하였다. COMM 101A Introduction Speech Communication (Mr.Spinks)- ISU 학생의 필수 general education 과목이었고 외국인 학생용이었다. public speech와 presentation 등을 배우는 시간이었다. 2번의 presentation을 하고 team을 짜서 토론하고 paper를 내는 것을 했다. conference라는 면담시간이 있었다.  ENG 103B Writing English Second Language (Dr.Sego)- ENG103A의 이수생들이 듣는 과목으로 ISU학생들의 필수 과목인 ENG105 (Writing)을 수강하기 전 단계이다. 여러 가지 종류의 essay를 써본다.    PSCI 305 State Local Government (Dr.McDowell)- 미국의 연방제와 지방정부에 대해 배우는 과목이었다. 한국적인 시각으로는 미국의 연방제를 이해하기 힘들었던 나에게 매우 유용한 과목이었다. PSCI 319 Survey West Political Thought (Dr.Pukett)- 지루하긴 했지만 서양 정치 사상을 배웠다. 2주에 한번씩 essay 시험을 보았는데 힘들었다. PSCI 414 American Presidency (Dr McDowell)- 이것도 대학원 학생들과 함께 수강하는 과목이었다. 마침 2000년 겨울에 미국 대통령 선거가 있어서 그에 대한 생생한 체험을 할 수 있으리라는 생각에서 신청했는데 전혀 그렇지 않았다. advisor도 ""미국 대통령 선거가 있는 해에 정치학도가 미국에서 공부할 수 있는 것은 행운이다.""라고까지 말했는데 그 정도까지는 아니었던 것 같다. 도서관(Cunningham Memorial Library)은 예상했던 미국 대학의 도서관과는 달리 작고, 학생은 거의 아시아계 뿐이다. 도서관 안에는 carrel이라고 불리는 공부할 수 있는 개인 공간 있는데 이는 대학원생만 신청할 수 있다. 그리고 아시아계 학생의 불만을 가장 사는 것은 밤 12시면 도서관을 닫는다는 사실이다. 이것은 시험 때도 마찬가지여서 (시험 때는 1시간만 더 연다.) 시험 때 공부할 데가 없는 어려움이 있다. 2층에는 Computer Lab실이 있어서 컴퓨터를 사용할 수 있다. 그리고 한글을 사용하지 않는 경우는 굳이 2층에 갈 필요도 없이 도서관에 있는 많은 컴퓨터를 사용하면 된다. 또한 지하(LL)에는 신문과 잡지가 있는 곳이 있는데 Chicago판 한국 신문이 2종류가 있고 1주에 2번씩 배달되어 한국 신문을 읽을 수 있다.","Erickson Hall 이라고 불리는 건물 6층에 있었고, 교환학생 Coordinator로는 Janis Halpern 이라는 분이 있었는데 친절했다. 그리고 다른 전공의 수강신청은 잘 모르겠는데 정치학과의 경우 International Office에 있는 교수님 중 한 분이 Political Science 전공이셔서 그분의 상담을 받고 수강신청을 하였다. 관심분야를 말하면 그것과 관련된 과목을 추천해주고 그 담당 교수의 특징까지도 설명해 주는데 참 놀랐다. Janis가 처음 왔을 때 기숙사 apply, 학생증 만들기.. 등 많은 것을 도와준다. 또한 무슨 어려운 일이 있을 때도 Janis와 상의하면 된다.","Gym이라는 체육관이 있는데 학생증만 있으면 들어가서 농구, 스쿼시, 배드민턴, 테니스, 수영, 헬스를 할 수 있으며(이용시간에 제한이 있다.) 학생증을 이용하여 라켓, 공 등을 빌릴 수 있다. Student Union 안에는 Le Club이라는 헬스센터가 있는데 학생증을 제시하면 1년에 $50이라는 저렴한 비용을 내고 운동을 할 수있다. Student Union 근처에는 Computer Lab이 있어서 computer를 사용할 수 있다. 꽤 많은 컴퓨터(window용, Mac)가 있어서 거의 기다리는 일없이 사용할 수 있다. 사용에 문제가 있으면 봉사하는 학생에게 물어보면 된다. 학생마다 계정을 지급하기 때문에 한글 프로그램을 설치해놓으면 한글 사용에 불편이 없다. 또한 컴퓨터 2대 당 한 대의 프린터가 있어서 무료로 이용할 수 있으나, 레이저 프린터를 이용하는 경우 printer card를 미리 구입해서 사용하여야한다. Root Hall에는 Writing center가 있어서 외국인 학생의 essay를 영어를 전공하거나 교육을 받은 학생들이 문법 사항이나 구조 등을 고쳐준다. 의외로 미국 학생도 많이 오니까 걱정하지 말고 가서 도움을 청하면 된다. 그리고 특수교육을 전공하는 학생들이 지도하는 Pronunciation Disorder라는 프로그램이 있다. 원래는 장애아들의 발음을 교정해주기 위한 것인데, 자리가 남는 경우 외국인 학생들의 발음을 교정해 주기도 한다고 한다. Education Building 4층에서 신청하면 된다. 하지만 장애아 우선이기 때문에 외국인들이 지도 받을 수 있는 가능성은 매우 낮다. 학교 안에 Terre Haute First National Bank가 있어서 그곳에서 account를 만들고 부모님으로부터 송금도 받을 수 있었다.",,,"ISEP을 통해 교환학생을 가는 경우, 봄학기, 가을학기를 가게 되면 처음에는 봄학기만 admission이 나오게 된다. 봄학기에 있었던 학교가 맘에 들지 않는 경우 교환학교를 바꿀 수 있다는 장점은 있지만 첫 visa가 5개월짜리 밖에 나오지 않기 때문에 여름방학에는 visa를 받기 위해 한국에 왔다가야 한다는 단점이 있다. 그래서 ISEP을 통해 가는 경우 반드시 가을학기와 봄학기로 연결해서 가길 바란다. 또한 ISU의 학기는 가을학기 8월말에 시작해서 12월 중순에 끝나고 (중간에 3일 가량의 Thanksgiving Break가 있음), 봄학기는 1월 초에 시작해서 5월 초에 끝난다 (3월 초에 1주일간의 spring break 가 있다.). 나는 여행을 좋아해서 이곳 저곳을 갔던 거 같은데 이 또한 추천하고 싶다. 워낙 시골이기 때문에 우리가 생각하는 개방적이고 외국인에게 친절한 미국인이 흔하지는 않지만 미국 중부에 위치하여 여행하기는 좋았던 것 같다. 한국교포는 거의 없고, 한국 유학생은 100명 가량 된다. 한국인교수님은 3~4분 정도 계신다. 위에서도 말했듯이 한국학생회(KOSA)가 있어서 설날, 추석 정도에는 한국 음식을 먹고 서로 인사하는 시간을 갖는다. 그리고 미국은 교재비가 배우 비싸다. 보통 전공서적의 경우 soft cover인데도 $50을 넘는 경우가 많다. 교재는 한 학기에 $250 정도 든다고 보면 된다. used book을 살수도 있지만 새 책과는 가격차이가 별로 없다. 물론 학기가 끝난 후에는 책을 다시 팔 수도 있다. 나는 ISEP을 통해 교환학생 가는 것을 추천하고 싶은데 그 이유는 의료보험은 물론이고 많은 것을 학교에서 다 해결해주기 때문이다.연락처: 018-344-3447"
