gen_info,env_info,food_info,study_info,office_info,facil_info,mhct_info,help_info,etc_info
"Bowling Green은 미국 중서부 오하이오주에 위치한, 인구가 3만 정도밖에 되지 않는 작은 도시입니다.
내륙에 위치한 도시여서 건조하며, 여름엔 덥고 겨울엔 추운 날씨를 느낄 수 있습니다. 특히 도시 전체가 평지로 이루어져 있어 연중 내내 바람이 많이 불었고 겨울에는 임시적으로 휴교를 하기도 할 만큼 눈이 많이 내렸습니다. 제가 있던 해에도 겨울이 많이 추워서 체감온도가 영하 20도까지 내려가기도 했는데, 먼저 있던 사람들의 말에 의하면 그 지난 해에는 훨씬 더 추웠다고 합니다.
Bowling Green 주립대의 크기는 연세대와 비슷한 정도였지만 직사각형 모양의 캠퍼스에 건물들이 고루 퍼져있고 언덕이 없어 한 시간 정도면 도보로 캠퍼스를 둘러볼 수 있고 각 건물 사이를 이동하는 것이 비교적 편리합니다.","캠퍼스에서 20-30분 정도 떨어져 있는 Main St.와 캠퍼스에서 Main St.까지를 연결하는 East Wooster St.에는 상점들과 음식점, 카페 등이 있고, Union 앞에서 셔틀버스를 이용하면 Kroger라는 식료품점과 Woodland이라는 작은 몰에 가서 식료품을 사거나 영화를 볼 수 있습니다.","거주 형태로는 기숙사와 off-campus의 apartment를 구하는 방법이 있는데, 저는 1년 동안 기숙사에서 생활했습니다. 처음에는 Kreisher라는 큰 기숙사에 살았는데 Sundial이라는 cafeteria가 기숙사 건물에 있어 편리하긴 했지만 친구를 사귀기가 불편해서 한 달 후에 Global Village라는 작은 기숙사로 옮겼습니다. Global Village는 30-40명의 학생이 전부인 기숙사로 기본 취지는 미국인 학생과 국제학생을 룸메이트로 연결해 주어 교류하게 하는 데 있으며, 작은 커뮤니티이기 때문에 기숙사에 사는 모든 사람들이 서로 알고 친하게 지낸다는 장점이 있습니다. 기숙사에 살게 되면 meal plan을 선택하는 것이 의무이기 때문에 주로 Sundial이나 Union의 cafeteria를 이용하였고 Outtakes라는 캠퍼스내의 작은 편의점 같은 곳에서도 meal plan을 사용하여 간식거리 등을 살 수 있었습니다. 그 외에도 Global Village에서는 부엌을 비교적 자유롭게 사용할 수 있었기 때문에 요리를 해 먹기도 했습니다.","저는 2학기 동안 영문과 수업 3과목, Communication 수업 2과목, 독일어 수업 2과목, 그리고 음대 수업을 들었는데 영문학 수업에서는 읽어야할 책이 많아서 고생을 하기도 했지만 영어가 모국어인 다른 학생들에 비해 어려움이 있을지 모른다고 생각하셨는지 교수님들이 많이 배려해주시고 신경써 주셔서 재미있게 수업을 들을 수 있었습니다. 그리고 음악 전공이 아니어도 음대 수업을 들을 수 있고 레슨을 받을 수 있었던 것이 좋았는데, 저의 경우에는 바이올린과 피아노 개인레슨을 교수님께 받을 수 있었고, 전공생들과 오케스트라에서 함께 연주할 수 있었던 경험이 제 인생에 나중에까지 큰 도움이 될 것 같습니다. 음악에 관심이 있는 분이라면 오디션을 통해 어떤 수업도 들을 수 있으니 한 번 시도해 보시기 바랍니다. 그리고 음악이 아니더라도 교환학생으로 있는 동안 지금껏 하지 못했던 색다른 관심분야에 도전해 본다면 더욱 즐거운 시간들을 누리다 오실 수 있을 거라 생각합니다.","국제교육부에 연락을 하고 면담을 신청하면 국제처장(?)과의 면담이 가능한데 저는 주로 수강신청, 선수과목 문제 해결을 위한 도움을 받기 위해 국제교육부를 이용했습니다. 매번 친절하게 문제를 해결하려고 노력해주신 것이 참 감사했지만 국제처와 다른 부서들 사이에 연락이 원만히 이루어지지 않았던 것 같아 아쉽기도 했습니다.","학생증이 있으면 Rec. Center를 무료로 이용할 수 있는데, 헬스와 수영, 암벽등반 등 여러 가지 운동 시설을 편리하게 사용할 수 있었습니다. 서울에서와 달리 Bowling Green이라는 작은 도시에서 지내다보면, 특히나 기숙사에 거주하다보면 많이 걸어다닐 일이 없는데 Rec. Center를 이용하여 규칙적인 운동을 하는 것도 좋을 것 같습니다.","우리나라도 많이 세계화, 또는 미국화가 되어서 그런지 특별한 Culture Shock은 없었습니다. 가끔씩 한국 문화와 다르다고 느껴지는 일들이 있긴 했지만 Culture shock으로 기억될만한 것은 없었던 것 같습니다.","처음 학교에 도착해서 오리엔테이션을 시작하는데 그 때 International Friendship Progrom에 지원하면 Host Family처럼 국제학생을 보살펴주는 가족을 만날 수 있게 됩니다. 저는 두 가족을 만나게 되어 가끔 식사도 함께 하고 ride를 부탁하기도 하고, 각종 행사에 함께 가기도 하는 등 많은 교류를 하고 또 도움도 많이 받았습니다. 그 외에도 Cross Cultural Conversation Connection Program를 통해 CCCC partner라고 불리는 회화 파트너를 만날 수 있는데, 이 프로그램을 통해 좋은 친구를 만나 영어로 깊이 있는 대화를 할 수 있는 동시에 미국 문화에 대해서도 더욱 깊이 알아갈 기회를 갖게 되고 개인적으로 ride 등의 부탁을 받을 수도 있었습니다.","Bowling Green은 작고 인구가 많지 않은 도시이기 때문에 서울과는 많이 다른 모습입니다. 가끔은 지루하다 느낄 수도 있고, 편의시설이 인접해 있지 않아 차가 없으면 생활하기에 불편할 때도 있을 지 모릅니다. 하지만 맑고 순수한 친구들을 만나면서, 평화로운 그 도시를 보면서, 그리고 따뜻한 사람들을 겪으면서 두 학기를 지내고 돌아와 생각해보니 Bowling Green은 참 예쁘고도 평화로운 곳이었다는 생각이 듭니다."
"Bowling Green State University는 오하이오주의 북쪽에 위치해 있고 Toledo공항과 Detroit공항에서 각각 차로 30분과 1시간 정도가 소요되며, 가까운 도시에는 Toledo, Detroit, Columbus, Chicago 등이 있습니다. 학교는 직사각형 형태이며 평지이고 그다지 크지 않기 때문에 도보로 이동이 가능합니다.
 미국의 내륙지방이기 때문에 우리나라와 비교해 건조한 편이며 연중 비가 자주 옵니다. 하지만 강수량이 많지 않고 주로 금방 그치기 때문에 우산을 거의 쓰지 않았습니다. 봄, 가을이 긴 편이고 여름은 그다지 덥지 않았지만, 겨울은 굉장히 춥고 바람이 많이 불었습니다. 가끔 눈보라가 칠 때면 밖을 나가기가 힘들었고 수업이 휴강되곤 했습니다.","Bowling Green은 대학교를 중심으로 형성된 아주 작은 도시입니다. 자전거를 타고 30분에서 1시간 정도면 도시를 거의 둘러볼 수 있습니다. 도시의 가운데에는 Main street이 있는데 이곳에는 바, 레스토랑, 커피숍, 클럽 등이 모여 있으며 가을에는 Black Swarm Festival이라는 공예품을 가지고 나와파는 축제를 합니다. 이를 중심으로 3개의 마트(Walmart, Kroger, Meijer)가 각 북, 남, 서쪽에 위치해 있습니다. 학교에서부터 Kroger를 경유하는 셔틀버스가 있으며, Kroger를 조금 지나면 Woodland라는 아주 작은 몰 하나가 있습니다. 그리고 이 몰에는 영화관이 있어 싼 가격(주중 $2.50 / 주말 $4.50)에 영화를 볼 수 있습니다. 또한 도시에는 2~3개의 공원이 있습니다.","거주 형태는 기숙사 또는 아파트를 얻어 생활할 수 있습니다. 기숙사는 두 종류가 있는데 $2,200 정도의 일반 기숙사가 있고 $300 정도가 더 비싼 기숙사가 있습니다. 일반 기숙사는 냉방시설이 없고 중앙난방이며 한 층에 공동으로 쓰는 화장실과 샤워실이 있는 반면, 조금 비싼 곳은 3방을 한 단위로 냉난방 시설과 샤워실, 화장실이 갖춰줘 있습니다. 아파트를 얻어 생활하는 경우 한 달 $4~500정도에 투룸을 렌트할 수 있기 때문에 룸메이트와 생활하면 훨씬 돈을 절약할 수 있습니다.
 기숙사에서 생활하면 밀플랜을 필수적으로 구입해야 하는데 International 학생을 위한 밀플랜은 $690입니다. 학교 내의 식당은 대부분 질에 비해 가격이 비싸고 제 입맛에 맞지 않아 주로 음식을 해먹었습니다. 저는 Global village라는 커뮤니티에서 살았는데 부엌이 있어 편리했습니다.","ESL 2과목, 영문학 4 과목, 국제관계학, 수학, 컴퓨터공학 수업을 한 과목 씩들었습니다. ESL의 경우 처음에 수강시청을 하게 되는데 원하지 않을 경우 담당자와 상의하여 철회할 수 있습니다. ESL이 pass, non-pass basis이기 때문에 학점인정에 문제가 있을 수 있으니 주의하시기 바랍니다.
 영문과 과목은 에세이를 평균 한 과목에 3개씩 제출했고, 시험과 퀴즈를 비롯해 시간투자가 많이 필요했습니다. 또한 과목마다 많은 양의 reading material이 주어졌기 때문에 꽤 고생을 했습니다. 단, 평가에 있어서는 후한 편이었던 걸로 기억됩니다.
 국제관계에 대한 수업은 강의도 훌륭했고 미국인들의 세계를 바라보는 시선을 느낄 수 있어 남은 것이 남는 수업이었습니다. Class에 저와 일본인이 있어서 교수님이 수업 중에 한국에 대해 이것저것 여쭤보시곤 하셨습니다.
 수학과 컴퓨터 공학은 진도가 빠르지 않고 설명이 아주 쉽고 직관적이어서 쉽게 따라갈 수 있었습니다. 3~4번의 시험과 퀴즈가 잣았지만 수업시간에 다룬 내용을 확인하는 수준이었기 때문에 큰 어려움은 없었습니다.

 제롬이라는 8층짜리 도서관이 하나 있는데 그다지 큰 편은 아니지만 시험기간에도 학생들이 별로 없어 언제나 조용한 환경에서 책을 볼 수 있었습니다.",International 학생들을 위한 부서가 따로 있습니다. 하지만 이를 이용해본 적이 없어서 별다른 정보는 없습니다.,"학교 내에 체육관이 있어 수영, 농구, 스쿼시, 피트니스 등 여러 가지 스포츠를 즐길 수 있습니다. 축구의 경우 여러 개의 잔디가 깔린 축구장과 실내축구장 또한 갖춰줘 있습니다. 또한 학교 내에 골프장과 연습시설이 있어 저렴한 가격으로 배울 수 있습니다.
 동아리는 가을 학기가 시작할 때 학생회관(Union) 근처에서 모집을 하던 것으로 기억합니다. 주위에서 일본클럽 활동을 하는 친구들을 많이 보았고, 주로 Greek house를 중심으로 활발한 활동이 이루어 집니다.",학생 대부분이 오하이오 출신이기 때문에 이곳의 기후에 익숙해진 듯합니다. 추운 겨울날에도 반바지와 반팔을 입고 다니는 학생들을 볼 때면 놀랄 수 밖에 없었습니다. 또한 미국에서는 21세부터 술을 마실 수 있기 때문에 Underage Drinking에는 굉장히 민감한 반면에 마리화나를 비롯한 약물에 대해서는 자유로운 태도를 보이는 것이 특이하게 생각되었습니다. 그리고 학생 중에 상당수의 동성연애자가 있고 이들에 대한 자연스러운 시선이 우리와는 사뭇 다르게 느껴졌습니다,"학업에 관해서는 여러 튜터링 센터가 존재하고 저는 개인적으로 writing center에서 많은 도움을 받았습니다.
 이 곳에는 학부와 석사 박사 과정을 포함하여 한국인이 20명 내외로 있지만 잘 구성된 한국학생회가 있어서 riding을 비롯해 많은 도움을 받을 수 있었습니다. 혹시 도움이 필요하시 분을 위해서 한인회 홈페이지 주소를 남겨놓겠습니다. bgkoreancommunity.com",Bowling Green은 조용한 마을로 겨울에 조금 추운 것만 제외하면 미국문화를 체험하고 영어를 공부하기에 굉장히 적합한 곳인듯 합니다. 학생 대다수가 백인이고 거의 이 지역 출신들이기 때문에 다른 나라에서 온 학생들에게 조금은 서먹함을 느끼는 것도 사실이지만 그만큰 더 관심을 보이기도 합니다. 먼저 마음을 열고 다가갈 때면 항상 친절하고 다정한 사람들이었던 것 같습니다. 변두리에 위치해 있기 때문에 가끔은 지루할 때도 있었지만 이들의 문화를 보고 느끼면서 앞으로의 인생에 큰 도움이 될 중요한 경험을 얻었다고 생각합니다.
"Bowling Green State Univeristy는 Ohio State에 있는 Bowling Green City에 위치하고 있습니다. Ohio에 큰 도시 중에서는 Toledo가 제일 가깝고 (차로 30분 정도 거리), Cleveland와는 두시간, Columbus와는 두시간 반 정도 떨어져 있습니다. Bowling Green State University의 크기는 연대의 반정도라고 생각합니다(학교의 끝에서 끝까지 걸어서 15-20분 정도 소요되는 것 같습니다.) 학생수는 만오천명에서 이만명정도라고 들은 듯 합니다. 전체적으로 연세대학보다는 작다고 생각하시면 될 듯 합니다 .기후는, 일단 Bowling Green의 지형이 매우 flat하기때문에 겨울에는 바람이 굉장히 심하게 불고, 지리적으로 북쪽에 있기 때문에 춥습니다. 4월까지 눈이 올 정도이니까 겨울이 굉장히 긴 편이고, 여름은 상대적으로 선선한 편입니다.","Bowling Green 자체가 학교도시다 보니까 주변 환경에 그렇게까지 볼 건 없습니다. Main St에 가게라든지 Bar가 좀 있는데, 걸어서 갈 수 있는 거리입니다. 북쪽으로 가다보면 Woodland mall이라고 mall이 있는데 거기 영화관이 있어서 가끔 친구들과 영화관에서 영화를 보곤 했습니다. Kroger(N.Main st), Walmart(Gypsy lane), Meijer(highway 건너서) 큰 슈퍼는 이 세개가 있고, Kroger는 학교 셔틀버스를 타고 갈 수 있습니다. Walmart가 이것저것 사기에는 제일 편했던 것 같습니다.","Off campus/On Campus로 나뉩니다. On campus Dorm은 Founders, Offenhauer, Koul, Kreischer, Harshman, McDonald 가 있습니다. 여기 학생들 사이에는Founder>Offenhauer>Koul>Kreischer, Harshman, McDonald 순의 선호도인듯 했습니다. McDonald같은 경우에는 freshman이 좀 많이 살아서 여기 학생들 사이에서 좀 안좋다는 인상이 있었습니다(실제로 저기에서 sexual harassment 사건이 터져서 저도 그런 인상을 좀 받았습니다). 개인적으로는 Spring semester에는 Kreischer, Bachelder에 살았었고, 여름방학에는 아파트를 구해서 룸메와, 2학기에는 아파트에서 혼자 살았었습니다. 식사는 아무래도 한국음식은 찾아보기 힘들고, 피자, sub, 샐러드, 멕시코 음식(burrito, taco..) 그리고 미국 음식이 주가 되는 식생활입니다. On campus Dining Service를 저는 많이 이용하였습니다. Kreischer의 Sun Dial, 학교 가운데에 있는 Commons, Union에 있는 Falcon nest를 제일 많이 이용하였습니다. 메뉴는 비슷비슷합니다. 아, union에는 starbucks가 있어서 많이 이용하였습니다.(비싸지만...) 학교에 안 갈때면 밥해서 먹기도 했습니다. Toledo에 한국 마켓이 있는데 가면 한국음식을 구매할 수 있습니다.","Spring Semester에는 12학점, 여름계절로 3학점, Fall에 21학점을 이수하였습니다. 여기는 Fall이 1학기이기때문에 Spring에 원하는 수업을 얻기가 힘들었습니다. Spring에는 ESL Oral, Microecon, 통방, Linear Algebra, Summer로 Discrete math, Fall에 Real Analysis 1, Probability& Statistics 1, Regression, Nonparametric , ESL Writing, SAS programming, Basic Non-Major Guitar, 그리고 GIS 수업을 들었습니다. 18학점 이상을 듣기 위해서는 Dean에게 찾아가서 Letter를 받아야 해서 그걸 Registration office에 낸 후에야 추가로 수업을 더 들을 수 있었습니다. 도서관은 학교 한 가운데에 Gerome Library가 있는데, 1,7,8층에 공부할 자리가 마련되어 있습니다.",Center for internetional programs? 라는 부서가 있습니다. 제일 처음에 하는 Orientation을 마련해주는 곳이기도 합니다. 뭔가 질문사항이 있을때 문의하면 친절하게 답변해주는 곳입니다.,"Rec Center를 학생이라면 공짜로 이용할 수 있습니다. 수영장도 있고, 좋습니다. Locker는 Daily Locker는 공짜고 그게 아니면 한 semester당 10불? 쯤 했던걸로 기억합니다. Student Health Center가 학교 중앙에 있어서, 아플 경우 도움을 받을 수 있습니다.","우리나라보다 성적으로 좀 더 개방적이고, 개인적인 문화가 있는 것은 사실입니다. 그렇지만 알면 알수록 문화의 차이는 문화의 차이일 뿐, 역시 같은 사람이구나 하는 생각을 많이 했습니다.",CIP에 문의하시면 도움을 받을 수 있으리라 생각합니다. 그 이외에 international 학생들을 도와주는 동아리같은게 있다고 듣긴 들었는데 잘 모르겠습니다.,"Bowling Green에서 뜻깊은 교환학생 생활 하시길 진심으로 기원하고, 이 경험보고서가 조금이나마 도움이 되었으면 하는 바람입니다."
