gen_info,env_info,food_info,study_info,office_info,facil_info,mhct_info,help_info,etc_info
"안녕하세요. 좀 편안하고 재미있게 보고서를 적어보려고 했더니 각 부분이 댕댕강댕강 9토막으로 나누어져 있네요. 따라서 전혀 개의치 않고 처음 부분에 기본적인 사항들을 적겠습니다. 
개인적으로 ASU에서의 교환학생 기간동안 평생동안 해보지 않은 많은 경험을 했습니다. 또한, 교환학생의 삶이란 정말 본인이 얼마만큼 준비가 되어 있는가에 따라 천차만별이구나 라는 것도 느꼈습니다. 기본적으로 교환학생을 가며 듣던 학점수도 줄고, 한국에 비해 학점의 압박도 덜하기 때문에 개인 시간이 많이 남게 마련입니다. 이 개인시간을 어떻게 사용하는가, 이것이 교환학생 생활의 핵심입니다. 처음에는 미국에 왔으니 미국 친구들을 사귀어야지, 많은 경험을 해야지 하다가도 시간이 흘러보면 어느새 미드와 한국 드라마를 종류별로 시즌별로 처음부터 끝까지 반복 시청하고 있는 자신의 모습을 발견할 수도 있습니다. 모 양의 말을 따르면 프린세스 메이커2 그 힘들다는 공주를 10번 만들었다는 사람도 있었고(여성입니다), 쇼핑의 귀재가 되어 매일매일 지름신 강림으로 파산 위기를 맞았다는 사람도 있습니다. 친구들은 모두 백인 외국 친구들로 사귀어야지 하다가 어느새 정신차려보면 한국말만 늘어서 다시 돌아오는 경우도 심심찮게 보게 됩니다. 

교환학생 생활이 매우 즐거웠던 반면, 내가 조금 더 준비했다면, 조금 다르게 생할했다면 더 좋았을텐데 하는 아쉬움이 남습니다. 이후에 ASU로 가실분들이나 다른 곳으로 교환학생으로 가시는 모든 분들께 저와 같은 실수하지 않고 더 즐겁게, 많은 경험하고 오시라는 마음에 개인적인 경험들을 솔직하게 나누고자 합니다. 이 글이 도움이 되어서 즐거운 시간 보내고 오시길 진심으로 바랍니다.




ASU는 현재 65,000명 정도로 미국에서 가장 학생 수가 많은 대학입니다.  매년 엎치락뒤치락 변동 사항이 있습니다만, 현재 학장이 학교 몸집을 키우는데 매우 크게 신경을 쓰고 있기에 특히 학생 수 증가가 덧보입니다. 따라서 학교의 크기도 상당히 큽니다. 대부분의 학생들은 4개의 켐퍼스 중 Main Temple Campus에서 생활하실텐데, 쉽게 비교해서 연대에서 연대 기숙사까지를 포함한 너비로 생각하시면 될 겁니다. 더운 날씨를 감안할 때 자전거를 타고 다닐 것을 적극 추천합니다. 
날씨는 모두 알다시피 전형적인 사막 기후입니다. 여름 날씨가 10월말에서 11월초까지 지속되며, 11월이 중순이 되어야 날씨가 풀리기 시작합니다.
12월부터 2월까지는 가히 천국의 날씨라고 해도 좋을 정도로 환상적인 날씨를 자랑하며, 2월에서 3월부터 다시 더워지기 시작합니다. 
기본적으로 비는 매우 적게 내리고 항상 햇볕이 뜨겁고 강하기 때문에 날씨 때문에 기운이 우울해지는 경우는 매우 적습니다. 햇볕이 매우 강한지라 썬크림이 꼭! 필요합니다. 매일매일 햇볕이 강하다 보니 귀찮아서 안 바르는 경우가 생기는데, 1년 뒤에 돌아오면 내가 왜 그랬을까 하고 후회할 수 있으니 꼭 썬크림 챙겨 바르시고 다니시길 바랍니다. 
비는 안 올 것이라고 생각하는데, 뒤통수 맞는 경우가 생길 수 있습니다. 이상기후혔다고 생각합니다만, 같이 살던 룸메이트의 말로는 매년 한번씩은 이런식으로 홍수에 가까운 비가 쏟아진다고 하니 대비해서 알아두십시오.(대략 2월-3월 경이었습니다) 비가 오는 경우 book store에 가면 우산을 팝니다. 아리조나 사막에서 왠 우산이냐, 하겠습니다만 알아두시면 도움 될 겁니다.","사실, 이미 많은 분들이 소개해준 Mill Avenue를 제외하면 학교 주변에서 걸어서 돌아다닐 수 있는 곳은 많지 않습니다. 대부분의 미국 학생들은 사실 차가 있어서 차를 타고 돌아다니고, 주변에서 걸어서 가는 곳에서 놀자라고 하면 대부분 Mill Avenue입니다. 조금 후에 설명드릴 동아리 중 Global devil에 들어가신다면 로 스시와 Q Club을 많이 가시게 될 겁니다. 
교환학생들처럼 차가 없는 학생들의 경우 주변 친구를 사귀어서 같이 ride를 부탁하거나, Light rail이라고 하는 전차와 버스를 이용하여 돌아다닙니다. 가격은 1.75불이며, 한 학기동안 사용할 수 있는 패스를 40불에 팝니다. 패스를 구입해도 사실 본전까지 사용하는 경우는 드물 수 있지만, 패스를 구입하면 집에 있는 대신 더 돌아다니게 만든다는 장점이 있습니다.

쇼핑을 하는 경우 scottsdale이나 Chandler에 쇼핑센터가 괜찮고,
중저가 쇼핑을 하고 싶다면 Arizona Mill에 가시면 됩니다.(대부분의 사람들은 이곳은 추천하지 않습니다) 모두 다 바로 가는 버스가 있으니 가는 것 자체는 어렵지 않을 겁니다.","저는 도착하기 전에 아파트를 하나 예약했었습니다만, 가서 미국 학생들이 살고 있는 집에 House mate로 들어갔습니다. 방이 4개가 있었고, 각각 방은 하나씩 쓰고 부엌과 거실은 공용으로 사용했지요.

대부분의 학생들은 기숙사를 사용할텐데, 장점과 단점이 있습니다.
장점은 첫째 무엇보다 새로운 친구들을 사귀고 어울리기에 기숙사만한 공간이 없다는 는 점 둘째로 Global Vilige라는 곳에 소속이 되는데 그곳에서 종종 행사를 열고 외부인은 들어올 수 없는 경우가 있다는 점...인데 사실 두번째는 장점을 하나만 제시하기는 좀 그래서 억지로 생각해낸 거고, 첫번째가 제일 중요합니다. 단순히 사람들을 처음에 만나는 것 뿐만이 아니라, 차후에 사람들과 놀러가는 경우에도 기숙사에 있지 않으며 같이 행동하기가 매우 힘듭니다. 기숙사 외의 곳에 사는 사람들은 자연스럽게 멀어지는 경우가 많습니다. 솔직히 밖에서 살다보면 가끔 외로움이 생기는 경우가 있습니다. 대부분의 교환학생 친구들이 기숙사 또는 그 주변에 산다는 점을 고려하면더 그렇지요. 
단점은 첫번째로 매우매우 비쌉니다. 한학기에 2900에서 3300불 정도로 기억합니다만, 약 4달 정도 있는 다는 것을 감안할 때 한달에 750에서 800불 가량입니다. 두 번째로, 방을 독방을 사용하는 것이 아니라 대부분 share를 하게 됩니다. 즉, 두명이서 한방을 사용하게 되는데 룸메이트가 잘 맞는다면 상관이 없지만 잘 안 맞는 경우, 개인적인 장소를 원하는 경우 힘들 수 있습니다. 세번째로, 집이 비좁습니다. 집이라고 하기에 조금, 아니 매우 작습니다. 물론, 이 모든 것은 배정되는 곳이 초야라고 하는 기숙사이기 때문이며, 더 좋은 기숙사로 배정된다면 상관이 없습니다. 하지만, 기본적으로 모든 교환학생들은 초야로 배정이 되기 때문에 감안하시기 바랍니다. 예외적인 경우가 없지는 않았습니다.

저의 경우와 비교하면 저는 유틸리티까지 합쳐서 한달에 430불 정도를 지불했으며, 방은 제 개인방을 사용했습니다. 부엌과 꽤 넓은 거실이 있어서 친구들을 초대해서 같이 놀거나 밥 해먹기 매우 좋은 장소였습니다. 문제가 있다면 아까 말했듯이 친구들과 떨어져 있기 때문에 가끔 외로움이 들 수 있다는 점, 그리고 룸메이트간의 갈등입니다. 저처럼 미국 집에 그냥 들어가는 경우 룸메이트를 고르는 것이 아니라 원래 있던 룸메이트들과 살게 되는 겁니다.
대부분의 경우 문제가 없습니다만, 사람을 잘못 만나는 경우 문제가 생길 수 있습니다.

저의 선택은 사실 제 3의 선택으로 저와 같은 선택을 하는 사람은 드물고, 보통 기숙사를 선택하지 않으며 아파트를 선택합니다.(홈스테이를 하는 사람도 가끔 있다고 들었습니다) 아파트는 집보다는 조금 작지만 각방을 사용하고 가격은 기숙사보다 싸다는 장점이 있습니다. 집보다는 조금 비쌉니다만, 만약 아는 사람과 같이 아파트를 잡으면 원하는 룸메이트를 잡을 수 있다는 장점이 있습니다. 마찬가지로 교환학생 친구들과는 떨어진다는 단점이 있습니다. 미국 사람들은 매우 개인주의이기 때문에 실제로 룸메이트와 갑자기 친해진다는 것이 쉬운 일만은 아니니 감안하시기 바랍니다.

식사는 기본적으로 해먹을 것을 추천합니다. 요리를 할 수 있다면 해먹는 것이 건강상도, 가격상도 제일 좋습니다. 기숙사에 사는 경우 부엌이 조금 작다는 단점이 있습니다만, 그래도 요리해서 룸메이트랑 같이 나눠먹고 하면 친해지는 데도 도움이 되고 일석이조입니다.
만약 사먹을 경우 한국음식을 먹는 경우 초야 기숙사 바로 맞은 편, 웬디스 옆에 이찌방이라는 일식집 점 한식집이 있습니다. 이 집이 걸어다닐 수 있는 거리에서는 한국 음식으로 제일 맛있습니다. 가격은 다양하지만 9불-15불 정도입니다. 그 외에 하와이안 바베큐도 맛이 괜찮습니다만, 미국 입밧에 맞춰서 약간 짤 수 있습니다. 가격도 7불-10불 정도로 좋습니다. 위치는 패스. 마지막으로 아일랜드 그릴이라고 한국에서 살다 온 베트남인(또는 필리핀)이 한국식 바베큐 형태로 갈비와 고기를 파는데 한국식 고기맛은 여기가 제일 좋습니다. 가격도 약 10불 정도로 나쁘지 않고, 위치는 설명하기 애매하네요. PANDER EXPRESS 건너 편 쪽입니다. 하와이안 바베큐와도 가깝습니다. 
밖에서 먹지 않고 학교 안에서 먹을 경우 MU에서 대부분 먹게됩니다. 이 때 학교 식당은 싸다라는 생각은 확실히 버리시기 바랍니다. 일반 식당과 가격이 동일하고, 어떤 경우는 더 비쌉니다. 한 학기를 있던 2학기를 있던 MNG라고 학교 식당에서만 사용하는 돈을 구입하기를 추천합니다. 100불 넘게 구입시 5%, 200불 넘을 시 10%, 300불 15%, 400불 20%를 보너스 카드로 받을 수 있습니다. 본인이 학교 식당 맛이 질릴 수 있다는 것을 감안하고 구입하시기 바랍니다.","1년간 있으면서 총 9개의 수업을 들었습니다.
1학기 
ENG 107 English for Foreign Students          Davis 
ENG 107 자체는 들을만한 수업입니다. 영어 글쓰는 것이 어렵고 시간이 많이 걸리기는 해도 본인에게 도움이 될테니 들을 것을 추천합니다. 총 4번의 essay로 구성되며 중간 중간 숙제가 있습니다. Writing Center를 자주 애용하게 되며, 보통 영어 선생님들은 성적을 잘 준다고 들었습니다. 단, Davis 라는 사람 것은 듣지 않는 것이 본인에게 좋습니다. 결과적으로 성적은 잘 나왔습니다만, 배우는 것은 적고 깐깐하며 연세가 좀 있으셔서 본인은 읽은 글을 기억하지 못하거나 받은 숙제를 잃어버리는 경우가 있습니다.


FIN 361 Advanced Managerial Finance           Garrett 
우리로 치면 기업재무입니다만, 재무관리와 기업재무 중간에 가깝습니다. 교수님이 매우 착하고 인상 좋으며, 동부 출신이라 체격이 조금(?) 있으십니다. 
시험은 매우 쉽습니다. 기본적으로 사실상 모든 시험에 대한 정보를 주고 시험을 보기 때문에 실수만 하지 않는다면 좋은 성적을 얻을 수 있습니다.
재무에 관련된 영어 단어들이 나오기 때문에 익숙하지 않다면 수업이 한귀로 듣고 한귀로 빠져나가는 경우들이 생길 수 있으니 조심하기 바랍니다.  

MKT 402 Consumer Behavior            Davis, Lastovicka 
소비자 행돈론으로, 수업 자체는 매우 배울 것이 많았던 수업 입니다. 교수님이 주는 숙제가 매우 많으며, 화 목 수업 중에서 매번 갈 때마다 10-30페이지의 reading 및 문제풀이 숙제가 있어 고생했던 수업입니다. 매우 배울 것이 많지만, 동시에 추천하고 싶지 않은 수업이기도 합니다. 특히 마지막에 내주는 프로젝트의 경우, 본인이 1시간 가량의 인터뷰를 하고 그 내용을 영어로 타자로 쳐야 되는 숙제를 내주기 때문에 외국인인 우리의 경우 매우매우 고생할 수 있습니다. 인터뷰 후 타자로 치는 것만 20시간 이상 소요된 걸로 기억합니다. 중간고사와 기말고사가 있지만, 기말고사는 TAKE 홈에 중간고사 성적으로 대체하고 싶은 사람은 대체하는 것까지 가능해 중간 기말 성적은 매우 잘나옵니다. 다만, 프로젝트 점수의 비중이 워낙 크기 때문에 조를 잘못 만날 경우 성적은 잘 받기 어렵습니다. 

WPC 494 Topic: Critical Analysis of Emerging Business Challenges             Mittelstaedt 
우리 나라에는 없는 수업입니다. 당시 ASU 경영대학장님이 가르치는 수업이라고 해서 지원했던 수업으로, 개인적으로 좋아했던 수업입니다. 다만, 원체 바쁘신 분이라 앞으로 다시 가르치실 계획은 없다고 본인이 말씀하셔서 언제 열릴지 미지수입니다. 4번의 에세이와 퀴즈, 발표, 기말로 구성되었으며, 여러 CEO들을 직접 초청해 그들에게 발표하고 피드벡을 듣는 시간도 포함되었습니다.

DCE 194 Topic: Latin/Salsa I            Mitchell 
개인적으로 ASU에서 가장 추천하고 싶은 수업 중 하나입니다. 힙합도 매우 좋다고 합니다만, 지원률이 높기 때문에 수강신청이 쉽지 않습니다.
강사가 미국에서 SALSA 관련 상도 몇번 수상할 정도로 실력자로, 매우 잘 가르칩니다. 반복 학습을 시키기 때문에 처음 시작하는 사람도 전혀 무리없이 배울 수 있습니다. 성적도 기본적인 스탭만 받을 수 있으면 A를 주며, 살사/차차/룸바/머렝게/스윙 등 다양한 댄스의 기본 과정을 다 가르쳐줍니다. 
MGT 440 Entrepreneurship          Goussevskaia 
기업가정신 이라는 수업으로 창업가에 대한 수업입니다. 창업을 할 때 어떤 사항에 유의해야하며, 돈을 빌려주는 VENTURE CAPTALIST들은 어떤 사항을 고려하고, 장기적인 발전을 위해서 어떤 점을 유의해야하는지 등에 대해서 배웁니다. 토론식 수업으로, 매주 해야할 reading 숙제는 많지만 얻는 것도 꽤 많은 수업입니다. 교수님이 러시아 사람으로 영어를 조금 못한다는 것이 재미있습니다만, 수업을 진행하는데는 전혀 문제가 없었습니다. 
중간 기말 두번과 프로젝트, 그리고 참여 정도에 따라 성적이 매겨지며 성적을 매우 잘 주기 때문에 중간과 기말고사만 잘보면 성적은 잘 나옵니다. 
MGT 450 Consulting Projects            Nosky 
기업들로부터 직접 프로젝트를 받아 수행하는 수업입니다. 여러 기업들이 참여하여 하나의 기업이 하나의 팀과 연결되는 형식으로 진행되며, 저의 경우 Chase Bank로부터 프로젝트를 받아 수행했습니다. 컨설팅을 해보고 싶은 사람들의 경우 좋은 수업이며, 기말고사 중간고사가 사실상 없으며 모두다 프로젝트의 수행 정도에 따라 점수가 평가됩니다.  

MGT 494 Topic: Negotiations            Myrowitz 
협상 수업입니다. 이 교수님은 이번에 다른 학교로 옮기셨고 새로운 교수님이 오는 것으로 알고 있습니다. 경영 수업들 중 가장 재미있고 흥미로웠던 수업입니다. 협상에 대한 이론을 배우고 그후 각 상황에서 역할을 배정하여 협상하는 형태로 진행됩니다. 기말고사와 각 협상 결과, 에세이, 주변 동료들로부터의 평가로 성적이 결정됩니다.
PGS 350 Social Psychology            Cohen, Perea 
사회심리학입니다. ASU의 널널한 수업 중에서도 최고로 널널한 수업입니다.
교수님이 수업과 관련되지 않은 다른 이야기를 하는 경우가 많기는 하지만, 성격은 굉장히 좋으시고 재미있는 분입니다. 
4번의 시험만으로 성적이 나오며, 일체 기타 프로젝트 및 숙제가 없습니다.","1년 이상 교환학생으로 있는 학생의 경우 외국으로 나갈 시 교환학생 사무실(국제 교육부)에 가서 i-20에 서명을 받아야 합니다. 시간이 10일정도 걸릴 수 있으니 외국으로 나갈 계획이 있는 사람들의 경우 미리 받기를 추천합니다. 
그 외에 미국에서 인턴을 하고 싶은 경우에도 여기서 해당 절차를 밟게 되니 알아두시기 바랍니다.","일반적으로 교환학생들이 처음에 가보는 동아리는 Global Devil이라는 국제 학생 동아리입니다. 외국 학생들과 외국학생들에 관심있는 미국 학생들이 모이는 동아리로, 처음에 친구들을 사귈 때 여기서 사귀는 경우가 많습니다. 
많은 외국 교환학생들이 처음에 여기로 오고 행사를 나오기 때문에 미국 외 다양한 유럽 및 기타 등지 외국 친구들을 사귀기에 매우 적절한 곳입니다.

저의 경우 이 외에 경영 동아리로 Asian Business Leaders나 Business Mentoring Network ASU에 참여했으며, 특히 Business Mentoring Network ASU의 경우 다양한 기업 인사들을 초청하여 대화하는 시간을 갖기 때문에, 표현하기 그렇지만 ''인맥 쌓기''에 좋은 기회가 될 수 있습니다.
저의 경우 이곳에서 만난 기업가 분에게 인턴십을 부탁했고 얻었으며, 현재 까지 연락이 되고 있는 분도 있습니다.

저는 개인적으로 Global Devil을 처음에 적극 이용하시길 추천합니다. 아시아 사람들은 기본적으로 아시아 사람들끼리 뭉쳐다니는 경향이 굉장히 강합니다. 저도 그곳에서 사람들이 왜 그러는지 이해할 수 있었습니다. 뭔가 백인들과 거리가 있다고 할까요, 솔직히 아시아인들끼리 모이는게 더 편한 것이 사실입니다. 그 중에서도 한국인은 한국인끼리, 일본인은 일본인끼리 다 끼리끼리 모여서 결국에는 한국말만 하다가 가는 경우가 많습니다.
Global Devil은 영국, 프랑스, 이탈리아, 독일, 미국, 오스트리아, 호주 등 각지에서 모인 사람들이 오기 때문에 외국 사람들을 사귀는데 있어서 아주 좋습니다. 특히 처음에 주체할 수 없이 남는 시간을 어떻게 써야 할지 모를 때 도움이 됩니다.","이번 5월 기말고사 시작 전에 Underwear run이라는 행사가 있었습니다.
한마디로 학생들이 자신들이 입고 있던 옷을 다 기부하고 속옷만 입고 뛴다는 행사인데, 솔직히 우리의 관점에서 보면 대체 어떻게 이 행사가 학교 공식 행사로 인정받을 수 있나라는 생각이 드는 행사입니다. 나중에는 미국 방송국에서 나와서 직접 촬영을 하더군요.
미국 문화에 많이 익숙해져 있다고 생각했는데도, 이런 장면은 정말 현실감이 없없습니다. 정말 영화를 보고 있는 것 같은, 그런 느낌이더군요.","저는 개인적으로 교회에서 정말 많은 도움을 받았습니다. 나중에는 진심으로 미안하다고 느낄 정도로 큰 도움을 받았습니다. 이 기회에 템피감리교회 모든 분들한테, 정말 감사하다고 말슴드리고 싶습니다. 
교회를 추천합니다. 교회에 다니지 않는 분들도, 미국에 있는 동안 교회에 한번 가보시는 것도 여러가지로 좋은 기회입니다.
교환학생이나 유학생들이 미국에 갈 경우 여러 어려움에 봉착하는 경우가 많습니다. 차가 없으니 장을 보는 것부터, 라이드, 휴대폰 개통 등 다양한 일들이 있으며, 무엇보다 힘든일이 생겼을 때 가족과 떨어져 혼자라는 것은 쉽지 않은 일입니다. 
저는 여기저기 여행을 꽤나 많이 갔다왔는데 대부분의 경우 템피 감리교회에서 라이드를 받았고, 다쳤을 때 도움을 받았으며, 심심하고 외로울 때 종종 다같이 전도사님 댁에 모여 샤브샤브를 해먹거나 야참 먹는다고 모였습니다.
마지막에는 아예 원래 있던 집에서 나와서 전도사님 대에서 이틀 정도 있다가 한국으로 왔는데, 정말 다른 분들 기쁘게 돕고 다른 사람 위해서 울어주는 사람들이 많이 있습니다.

가보시면 후회 안하실테니까, 한번 가보시기 바랍니다.","드디어 제 마음대로 적을 수 있는 공간이 생겼네요. 솔직히 지금껏 교환학생 보고서 읽으면서 그냥 읽기만 했는데, 생각보다 시간이 정말 많이 걸리는 작업이네요. 지금껏 성심성의껏 써주신 분들, 미국에 있는 동안 도움이 많이 되었습니다. 진심으로 감사합니다.

부족하지만 제 경험담과 함께 몇가지 말씀 드리고자 합니다.

첫번째, 교환학생 올 때 목표를 확실히 정하십시오.
일단 미래에 무엇을 하고자 하는지 목표를 정하십시오. 쉽게 대학원 가는 것일 수도 있고, 취직하는 것일 수도 있고, 성격 변화 및 개조일 수도 있습니다. 그 것을 위해서 무엇이 필요한지 생각해 보세요. 학점일수도 있고, 영어 일수도 있고, 인턴일 수도 있고, 다양한 경험일 수도 있습니다. 

대학원, 그 중에서도 미국 대학원으로 가고자 하는 분들한테 미국 학교에서의 성적은 매우 중요합니다. 그런 분들은 기본적으로 학점은 기본으로 잘 받겠다고 생각하셔야 합니다. 또한, 미국 교수님으로부터 받는 추천서는 후에 도움이 될 수 있으므로 그런 준비를 미리 해야 합니다. 
저의 경우 미국으로 오기 전에 3-4분 정도 받겠다고 생각을 했고, 오면서 교수님 만나서 드릴 수 있는 작은 기념품들을 준비해서 갔습니다. 한국 토종 인형, 부채 등 한국을 설명할 수 있는 비싸지 않은 기념품들이 많이 있습니다. 한국에 대해서 아직도 모르는 사람들이 많이 있기 때문에 한국 문화를 설명해주는 데도 매우 유용합니다. 또 교수님들로부터 추천서 받겠다고 하면서 성적을 망쳐놓으면 아무 의미가 없으니, 수업을 들을 때 내가 이 교수님으로부터 추천서를 받아야겠다고 생각했으면 최선을 다하고 다른 사람보다 나은 모습을 보여줘야 합니다.

인턴의 경우도 마찬가지입니다. 솔직히 전 인턴을 해야겠다는 생각은 하지 못하고 갔습니다. 가고 나서 문득 생각이 들더군요. 미국에서 인턴을 할 수 있다면 좋은 기회가 될 수 있다는 생각이, 미국에 가고 나서야 들더군요.
학교를 정할 때 인턴 자리를 보고 정하는 사람은 거의 없을 겁니다. 하지만, 만약 미국에서 차후에 일할 생각이 있는 사람이라면 미국에서의 인턴자리는 틀림없이 도움이 될 겁니다. 아쉽게도 아리조나는 지방이기 때문에 큰 회사들은 없고, 그 때 미국 가고 싶은 지역을 고를 때 인턴을 포함시키지 않은 것이 실수라는 것을 깨달았지요. 물론 외국인으로 인턴을 구한다는게 쉬운 일이 아니라는 것도 나중에 알았지만.

결론부터 이야기하면, 인턴을 미국에서 할 수 있습니다. 좋은 회사들은 아리조나 주변에 많지 않기에(특히 우리가 차가 없기에 멀지 않아야 한다는 점을 감안하면 더더욱) 어렵지만, 작은 기업들이라도 본인이 원하는 것은 해볼 수 있습니다. 단, 이 경우 교환학생 사무실(국제처)에 가서 여러가지 절차를 거쳐야 합니다. 일단 돈받는 것은 안되고(학교 내에서 일하는 경우만 돈을 받을 수 있습니다) 회사 사람으로부터 교환학생인데 인턴을 한다는 서명도 받아야 합니다. 우리가 생각하면 조금 어이가 없고 화가 나지만, ''미국인이 아니면서 미국인의 직장을 뺏는다''라는 논리인 거지요. 설사 무급이더라도 마찬가지입니다. 
기본적으로 ASU 사인할 때 보시면 아시겠지만 인턴 금지라고 명확히 적혀 있기 때문에 못한다고 생각하는 경우가 많습니다. 그리고 사실 학교 담당자가 누구냐에 따라서 못한다고 이야기하는 사람도 있을 수 있습니다. 
하지만, 그건 정말 본인이 하기 나름입니다. 본인이 하고 싶다면 방법은 얼마든지 있는 것이고, 사실 그보다 중요한 것은 ''인턴 자리를 어떻게 찾는가''가 될 겁니다. 외부 인사들을 초청해서 만남의 시간을 가질 때 이야기하면서 자연스럽게 기회가 생길 수도 있고, ASU 웹사이트에 연결된 Sun Devil Carrer Link를 통해 구할 수도 있습니다. 
기억해 둘 것은, Sun Devil Carrer Link에 구하는 인턴 숫자가 많지만 많은 경우 중소 기업이고 ''미국 시민권자''를 요구한다는 겁니다. 좋은 회사를 찾기 위해서는 노력이 필욯며, 미국 시민권자를 요구하더라도 그냥 넣어보는 배짱도 필요합니다. 그러면 연락이 옵니다. 

두번째, 목표에 따라 자유 시간에 무엇을 할지 생각을 미리 해보십시오.
말씀드렸다시피, 틀림없이 시간이 남을 겁니다. 학점은 적게 듣고, 하는 동아리나 학회도 없고, 주변에 말리는 부모님도 없고 시간은 틀림없이 남습니다. 그 남는 시간동안 무엇을 하는가가 제일 중요합니다. 아까 정한 목표에 도움이 되도록 시간을 사용하세요. 
이건 경험담입니다. 제가 그렇게 하지 못했기 때문에 너무나 많은 시간을 낭비했습니다. 저도 처음에 미국까지 가서 컴퓨터로 미드보거나 게임한다는 사람들 이야기 들었을 때 ''그 비싼돈 내고 가서 할짓이 그렇게 없나?''라고 생각했습니다. 부끄럽지만, 제가 그렇게 되는데 몇달 안 걸리더군요. 차라리 미국에서 새로운 경험을 하면 차라리 낫은데, 보통 시간을 그냥 어영부영 보내게 되기 쉽상입니다. 주변에 말리는 사람도 없으니 그렇게 되기가 정말 쉽습니다. 저와 같이 후회하지 않았으면 하는 마음에서 경험담으로 드리는 말씀이니 도움이 되었으면 합니다. 


교환학생으로 간다는 것은 참 양면성을 가지고 있습니다. 
보통 ''쉬러 간다''라는 표현을 많이 하지요. 한국의 이 힘들고 일명 ''빡센'' 분위기로부터 벗어나서 여유를 즐긴다. 네, 맞는 표현입니다. 필요하기도 한 경험이고, 여유를 얻을 수 있습니다. 
반면에, 이 여유를 얻는다는 것은 다시 말해 한국으로 돌아오면 그만큼 한국에서 산 것만큼 열심히 노력한 결과물이 없다는 것도 보게 됩니다. 
만약 미국에서 계속 여유있게 살 것이라며 문제가 없겠지만 결국 한국으로 돌아와서 노력해야 하는 실정을 볼 때, 아무 생각없이 그냥 ''여유만 즐기고 온다''라고 한다면 1년간 잘 놀다 온 여행 외에 아무것도 아닙니다.
비싼 돈 들이고, 3학년과 4학년 가장 중요한 시기를 바쳐서 1년간 잘 놀다오는 것이 놀때는 좋았는데 막상 돌아와보니 그렇지 않을 수 있더군요.

여유를 갖는 것, 중요합니다.
하지만 동시에 목표를 잃지 안으면서 여유를 갖는 것이 중요하다는 것을 이제 알겠더군요. 
오해하지 마세요. 교환학생까지 가서 한국의 이 터무니없이 왜곡된 취직 시장 및 현실을 바라보고 살라는 것이 아닙니다. 
오히려 반대지요. 미국에서는 미국에서만 얻을 수 있는 것들이 있습니다. 그것들을 목표로 해서 즐기면서, 또 얻어오세요. 헛되이 시간을 버리는 것이 아니라, 무엇을 미국에서 얻을 수 있을지를 생각하고, 미국에서만 할 수 있는 것들을 하면서 오세요. 솔직히 미국에서의 인턴은 아직도 한국 현실에 얽매여 있던 내가 선택했던 길이고, 미국에서만 하고 배울 수 있는 것들이 얼마든지 있습니다.

마지막으로 말하고 이만 접겠습니다.
제 룸메이트(하우스메이트지요)는 유대인인데 종종 병에 걸린 사람들을 돕기 위한 자선 기금을 모으는 일을 합니다. 파티를 열거나 아니면 행사를 열어서 그 돈을 모아서 단체에 기부를 하는 거지요. 
헤비타트 같은 봉사 단체 역시 마찬가지로, 한국보다 훨씬 활성화가 많이 되어 있습니다. 한국에서 하기 쉽지 않은 미국에서의 활동들이  얼마든지 있지요.
여행도 있지요. 한국에서 볼 수 없는, 미국만의 문화를 느끼고, 경험하고, 세상에 정말 다양한 인생들이 산다는 것을 깨닫는 것.

미국에서만 배우고 할 수 있는 것들이 많이 있습니다. 
그것들을 한국에서도 시간낭비로 치부하던 그런 것들로 낭비하지 마세요.

소중한 시간들 후회없이, 즐겁게, 여유를 즐기며, 많이 배우면서 보낼 수 있기를 진심으로 바랍니다."
