gen_info,env_info,food_info,study_info,office_info,facil_info,mhct_info,help_info,etc_info
"이 학교는 미국중부의  Missouri주에 위치하고 있으며 그 중에서 Maryville이라는 중서부의 작은 마을에 위치하고 있습니다. 중부날씨가 다 그런것인줄은 잘 모르겠지만 기본적으로는 한국과 같이 사계절이 다 존재합니다. 다만 그 정도차가 좀더 심해서 여름에는 더 덥고 겨울에는 더 춥고 합니다. 가을학기에 가게 되실텐데 아마 겨울준비를 잘 하고 가셔야 후회없이 다니실거라 생각됩니다. 가장 추운 1~2월에는 귀국하시게 되겠지만 11월부터 추워집니다. 제가 다닐때에는 10월부터 눈이 오기 시작했습니다. 
아무래도 지리적 위치가 위치인만큼 영화에서 흔히 보이는 도시의 모습이 쉬이 보이지가 않습니다. 가장 가까운 도시가 캔자스시티인데 그조차도 한번 가려면 차로 1시간 반정도 걸리니 영화에서처럼 바쁜 도시생활을 기대하시는 분들은 실망하실지도 모르겠습니다만, 한적하고 느긋한 분위기를 느낄 수 있는 곳을 찾으신다면 좋은 선택이 되실 것 같습니다. 저도 처음에 이 학교에 가기전에 그냥 조용한 곳이다라고 얼핏 이야기만 듣고 갔기에 생각보다 더 한적한 분위기에 놀랐지만 막상 지내보니 정말로 행복한 시간을 보낼 수 있었습니다. 또한 이곳 친구들 모두 참 친절하고 착해서 친해지기도 쉽습니다. 느긋하다보니 같이 놀 수 있는 시간도 많구요.","기본적으로는 대학과 가와사키라는 오토바이 공장이 먹여살리는 마을인지라 주변환경은 뭐 없습니다. 한국식당이나 한국슈퍼도 없어 구매를 하시고자 한다면 캔자스 시티에 가셔야겠네요. 하지만 메리빌에도 가끔 가면 맛있는 각종 레스토랑들과 댄싱스테이지를 포함하고 있는 bar나 월마트, 패스트 푸드점들 있을 것들은 다 있습니다. 단지 한국과는 달리 미국은 땅덩이가 넓어서 차가 없으면 쉽게 가지 못한다는것이 단점인데요. 차같은 경우는 미국친구들과 조금만 친해지면 ride를 제공해주니 문제가 없을 거구요. 그쪽에 있는 한국인 친구중에도 차를 갖고 있는 친구가 있으니 도와줄 겁니다. 생필품을 구매하게 될 월마트나 하이비등은 학교에서 국제학생들을 위해 셔틀을 제공합니다. 셔틀타고 다니셔도 되구요. 그외에 레스토랑이나 bar등은 좀 힘들어서 그렇지 걸어갈만한 거리는 됩니다. 
기본적으로는 조용한 마을입니다. 안전한 마을이구요. 맘편하게 심신을 정화하기에는 이보다 좋은 곳이 없다고 생각합니다.","거주는 학교 기숙사에서 하게 되구요. 식사는 학교 식당에서 하게 됩니다. 처음에 지원하시게되면 tower suite 과 south complex 중 선택하라고 합니다. 학교에 어림잡아 10개정도 되는 기숙사가 있는 데요. tower suite은 4인 1실에 2명이 1방을 갖는 형태로 학교에서 두번째로 좋은 기숙사입니다. 장점으로는 확실히 좋다는것과 편의점의 개념인 station이 가까워 밤에 쫄래쫄래 나가서 이것저것 군것질하는 것과 공부하기가 좋다는 것이 있습니다만 단점으로는 수업받는 건물들과 멀다는 점이 있겠군요. 그래도 가까운 편입니다. 시간을 재보니 평균 8분정도 걸리더군요. south complex의 경우는 그 아래 단계의 기숙사인데 보통 여기를 많이 갑니다. 학교 한가운데 있어 어느 수업을 받더라도 약 5분안에 다 도착할 수 있고 주변 부대시설과 가까워 최고라고 생각합니다. 여기서 변수가 생길수가 있는데 저같은 경우에도 south complex를 신청했는데 franken이라고 좀 안좋은 기숙사에 배정되었습니다. 질적인 측면에서 상당히 많은 차이를 보이는데요. 이곳 친구들같은 경우는 국제 학생들이 많아 중국인 일본인등 세계적으로 친구들을 사귈수가 있다는 장점이 있긴 합니다. 
식사는 학교 식당에서 하게 되는데 그다지 다양하지 않습니다. 8~9개 정도의 코너가 있고 코너마다 많은 메뉴를 자랑하고 있지만 맛은 대강 비슷하므로 여성분들은 어떨지 모르겠지만 남성분들같은 경우는 1달째 되면서 질리기 쉽습니다. 그래도 한 석달 지나면 다시 익숙해지니 괜찮을 겁니다.","수업은 쉽습니다. 제가 쉬운것만 골라들은 탓도 있겠으나 전반적으로는 기초부터 차근차근 생각하는 힘을 길러주는 방식의 수업이 주가 되는 탓에 부담없이 따라갈 수 있으시리라 생각합니다. 전 investment와 회계원리1, English110, Microeconomics 4개를 들었는데요. investment의 교수님의 발음이 좀 알아듣기 힘들었다는 점만 제외하면 처음부터 따라갈 수 있을정도의 수준들이었습니다. 발음같은 경우는 학기가 끝날때쯤 되면 어느 덧 알아듣게 되구요. english110같은 경우는 글쓰기입니다. 저도 교환학생보고서를 읽고 수강했는데 많은 것이 남는 과목입니다. 영어 실력 상승에도 도움이 많이 되구요.
도서관은 조용합니다 총 3층으로 구성되어 있는데 1층에는 컴퓨터실과 조모임공간 비슷한게 있어서 좀 시끄럽지만 2층과 3층은 조용합니다. 3층같은 경우는 공부만 하는 곳이라 많이 조용합니다. 그리고 기본적으로 이 친구들은 여유가 있기때문에 시험기간을 제외하고는 텅텅비기 때문에 조용합니다. 시험기간에도 좀 차긴 하지만 그래도 역시 자리는 가서 그냥 잡을 수 있을정도입니다.","학교에 지원하시게 되면 Jeaneth Puriel에게 메일이 오게 될터이고 가기전에도 많이 주고 받게 될겁니다. 그 쪽 친구들말로는 성격이 괴팍하다 하였으나 자기가 담당하고 있는 Exchange student들에게는 천사와 같습니다. 힘든일이 있으면 이야기하면 어떻게서든 해결해주려하며 많은 도움을 줍니다. IIC라고 국제처 같은 곳이 있는데 그 쪽에 가시면 친절하게 많은 도움을 줄겁니다. 그리고 가면 아시게 되겠지만 IIC에 일하는 한국 학생이 한명있습니다. 그 친구가 많이 도와줍니다. 
문제가 생기면 바로바로 Jeaneth에게 연락하시고 도움을 받으시면 됩니다. 그러나 제경험상 국제교육부와 많은 연락을 할 필요는 없을 겁니다.","부대시설같은 경우는 제가 잘 이용을 하지 않아서 정확히 이용법은 모르겠습니다만 헬스장이 있다고 합니다. 들어보면 요가 수업도 하고 이것저것 많은 것 같습니다. 그리고 농구장과 헬스기구 라켓볼장, 트랙을 붙여서 만들어 놓은 rec center라는 곳이 있는데 이곳은 무료입니다. 수영장도 있는데 락스냄새가 좀 난다는 것만 빼고는 쓸만합니다. 
동아리의 경우 처음가시면 ISO라고 국제학생 연합회와 KSA라고 한인학생회 이 두가지를 들게 되실 겁니다. 저같은 경우는 ISO에서 나오라고 연락이 왔지만 나가지는 않았으므로 어떤 행사가 진행되는지는 잘 알지 못하지만 참석하는 친구의 이야기를 들어보면 국제 학생들과 많이 친해질 수 있다고 합니다. KSA의 경우 시기적으로 잘 맞아 떨어지면 이것저것 행사를 하시게 될텐데 여러 미국친구들에게 한국을 알릴 수 있는 기회가 됩니다. 한국에 관심을 갖고 오는 미국 친구들을 보면 신기하면서도 재밌는 경험이 될것입니다.",미국영화가 하도 많은 세상이다 보니 별다른 충격은 없었습니다. 단지 좀 다른 점은 사람들이 그다지 꾸미고 다니지 않는다는 것입니다. 다들 그냥 후드 입고 다니고 추리닝 입고 다니고 합니다. 의외로 이것저것 예쁜 옷보다는 그냥 편하면서 태가 나는 옷들 위주로 챙겨가시면 될 것 같습니다.,기숙사에서 문제가 생기면 기숙사 각 층마다 존재하는 RA(일종의 기숙사 짱)친구들에게 이야기를 하면 해결해 줍니다. 그 외에는 IIC Puriel에게  문의하면 거의 해결해줍니다. 어디에 물어봐야 할지 모르겠다 싶으면 그쪽에 있는 한국 친구들에게 물어보면 친구들이 잘 가르쳐 줄겁니다.,맑은 공기와 느긋한 분위기 친구들과의 따듯한 만남을 원하시는 분께 추천하고 싶은 학교입니다. 더 궁금하신점 있으시면 메일 보내주세요
"지리적 위치로는 미국 중부에 있는 Missouri주의 중간정도에 있는 Maryville에 위치하고 있습니다. 미주리 주의 유명한 도시로는 Kansas city와 St.Louis정도가 있겠군요.(참고로 두 도시에 가기 위해서는 승용차나 그레이하운드 버스를 이용해야 합니다). 이 외에도 많은 도시들이 있지만 미주리 주 자체가 도시냄새가 많이 나지 않는 관계로 뉴욕, 보스턴 등의 도심을 기대하고 이 학교에 지원하시면 후회를 많이 하실거라고 생각됩니다. 물론 시골도시에서의 휴양과 친절한 미국 친구들을 만나고 싶으시면 이 학교 이상의 선택은 없을 것입니다.
학교는 크지 않습니다. 중요건물들은 도보 10분내로 모두 갈 수 있으며, 기숙사 건물이 여러개 있으나 그 거리 또한 매우 가깝습니다. 단지 문제는 학교밖의 시설들을 이용할 때 인데요, 그 거리는 매우 멉니다. 아마 도보로는 월마트를 가거나 외식을 하는 것은 거의 불가능에 가깝다고 보시면 됩니다. 그러나 다수의 학생들이 승용차를 가지고 있기 때문에 차를 얻어타는 것은 어렵지 않으므로 이 점은 걱정하지 않으셔도 됩니다. 
저는 가을학기를 보냈기에 기후는 큰 문제가 되지 않을 것이며, 12월에 귀국하기 때문에 월동준비를 전혀 해 가지 않았지만 이로 인하여 많은 고난을 겪어야만 했습니다. 저는 8월 말부터 있었는데 초반에는 반팔티셔츠를 입었지만 금방 긴팔티셔츠, 11월 초중순부터는 점퍼를 입어야만 했습니다. 여기서는 쇼핑을 하기가 용이하지 않기 때문에 미리 점퍼를 구비해두시는게 좋을 것입니다. 아주 두꺼운 패딩점퍼류가 있어야 11월 말과 12월 초를 버티실 수 있을 것입니다. 정말 춥습니다. 한국에 처음 왔을때 너무 더울 정도였습니다.
부대시설 또는 유흥시설은 매우 적습니다. 저 같은 경우는 미리 다녀온 선배님을 소개받아 미리 이야기를 듣고 갔기 때문에 충격이 없었지만, 상상을 잘 안하고 가신다면 큰 낭패를 겪으시리라 생각됩니다. 가실만한 곳들을 생각나는대로 모두 나열해보면 
마트 : 월마트,하이비
외식 : 버거킹,맥도날드, 서브웨이 샌드위치, 피자헛, 도미노피자, 중국식 레스토랑 2군데, 양식 레스토랑 몇 군데 등등
술집 : 몇 개 산재해 있으나 가보지는 않아서 잘 기억은 없네요. 한국의 클럽보다 아주 작은 클럽 2군데가 있습니다.(걍 술집에 스테이지 만든것)",,,,,,,,
