gen_info,env_info,food_info,study_info,office_info,facil_info,mhct_info,help_info,etc_info
"Clarion 은 펜실베니아 서쪽에 위치한 아주 작은(!) 도시입니다. 가장 가까운 공항이 피츠버그 공항인데, 차로 2시간 정도 걸립니다. 이 때 학교에서는 학교와 연결된 픽업 서비스를 제공하는데, $140정도 하는 가격이므로 차라리 choice cab을 이용하는 것이 $100정도로 쌉니다. 다른 택시회사는 $250정도 요구하는 곳도 있으므로, 주의하여야 합니다. 이렇게 공항까지 가는 일이 어렵기 때문에 여행을 자주 다니기는 어렵습니다. 그것이 가장 큰 문제라고 할 수 있는데, 여행 다니지 않으면서 영어를 꼭 많이 배워오고 싶다! 는 분은 권해드릴만 합니다. 아주 작은 마을이고, 제목도 그렇듯이 매우 조용하고 여유로운 곳입니다. 백인 비율이 매우 높고, 아시아 계 학생들은 중국학생들이 단체로 있는 것을 빼고는 거의 없습니다. 제가 갔을 당시 한국인은 아무도 없었습니다- 상당히 외롭긴 하지만 한국인 전혀 없는 곳을 찾으시려면 대단히 좋은 초이스라고 생각합니다. 

학교는 그리 크지 않지만 웬만한 전공들은 많이 개설되어 있고 학교 끝과 끝까지는 20분 정도 소요됩니다. 

제가 처음 갔던 8월 말에는 정말 날씨가 화창하고 따뜻했는데, 10월이 되자 갑자기 펑펑 눈이 내리며 기온도 어마어마하게 내려갔습니다. 겨울에 가시는 분은 두꺼운 옷 한두벌 쯤은 꼭 준비해 가시길 권합니다. 눈이 무릎까지 올 때도 있었습니다. 

백인이 많고 매우 보수적인 동네라서 주민들이 거의 그 지역을 떠나 본 적이 없는 경우가 많습니다. 한국 사람은 처음이라고 north? south? 를 묻는 사람도 많습니다. 그만큼 사람들이 순수하고 착하기도 하지만 그들의 세계로 편입하기엔 어려움이 있습니다.","도시 자체가 대학 도시인만큼, 학교 주변은 그야말로 조용합니다. 한국의 시골 같은 분위기라고 생각하면 됩니다. 매우 한가하고 여유롭습니다. 학교에서 5분정도 걸으면 main street가 나오는데 cvs, 레스토랑, 각종 패스트푸드점, 서점, 교회와 성당 등이 있습니다. 한시간에 한번씩 학교에서 월마트까지 셔틀버스가 다니는데, 병원이나 몰도 갈 수 있습니다. 월마트는 15-20분 정도면 도착할 수 있습니다. 클럽과 같은 유흥시설은 없고 bar가 3개정도 있는데 주말에는 사람이 아주 많습니다. 주류도 싼 편이고, 춤을 출 수 있는 stage도 마련되어 있어 클럽 같은 분위기가 나기도 합니다. 

약 30분 거리에는 꽤 큰 prime outlet이 있는데, 아웃렛 치고 상당히 괜찮은 수준이므로 친구들과 택시를 이용해 다녀오기도 합니다. Clarion mall에는 jc penny, k mart, 등이 있고 영화관이 있어 자주 영화를 보러 다녔습니다. 학교에서 할인티켓 ($3) 도 가끔 팔기 때문에 저렴하게 이용할 수 있습니다. 

학교 근처에 유해 시설이라든지 유흥 시설이 거의 없다고 보시면 되기 때문에 (물론 하우스 파티는 제외하고라도) 공부를 목적으로 가시는 분에게는 매우 추천드립니다. 

정말 주변에 놀 거리가 없기 때문에 연휴가 길면 다들 고향으로 가는데 교환학생들은 학교에 남아있어야 하기 때문에 매우 지루하실 수 있습니다. 저도 4일정도 휴일이었는데 내내 기숙사에만 있다 보니 (상점도 문 다 닫으니까요) 정말 뛰쳐나가고 싶을 정도로 할 일이 없었습니다.","기숙사는 남, 여 기숙사가 각각 1개, 공동기숙사가 2개 있습니다. 많은 학생들이 공동기숙사를 선호하는데 교환학생들은 기본적으로 남녀가 따로 생활하는 곳에 배정이 됩니다. (culture shock를 방지하기 위해서라고 하더군요) 하지만 공동기숙사도 east, west wing에 따라 나뉘어 생활하므로 별로 불편을 겪을 일은 없습니다. 기숙사들이 학교 곳곳에 위치해 있어 각자의 전공수업이 이루어지는 학교 건물과 가까운 곳을 미리 알고 신청하는 것이 좋습니다. (예를 들어 경영학과 건물은 공동기숙사에서는 3분거리이지만, 여자기숙사에서는 15분 정도가 걸립니다.) 기숙사는 2인 1실이고, extra money를 낸다면 혼자 생활하는 것도 가능합니다.

교환학생들은 대부분 기숙사에 살지만, 미리 신청한다면 학교 밖에 있는 eagle house나 reinherd village에 살 수 있습니다. 학교까지 들어오는 무료셔틀이 있고 그리 멀지는 않지만, 학교 내에서 이루어지는 많은 행사들에 참가하거나 많은 사람들을 만나려면 기숙사에서 생활하는 것이 좋습니다. 하지만 기숙사에 살면 밀플랜 이 일주일에 19개가 기본입니다. 19개는 주말에는 brunch가 제공되는 것을 생각하면 매 끼 학교식당에서 식사를 하는 것이 됩니다. 대부분의 학생들이 아침을 거르고 교환학생들은 기름진 음식이 입에 잘 맞지 않으므로 19개를 다 사용하는 것은 거의 불가능합니다. 많은 교환학생들이 이 시스템에 불만을 가져 학교에 건의도 하였지만 아직 시정되지 않았습니다. 하지만 학교 밖에서 살면 밀플랜을 5개나 10개쯤으로 신청하고 나머지는 알아서 만들어 먹거나 flex dollar를 신청하여 학교 내 샌드위치점이나 피자가게, 카페 등에서 식사를 할 수 있습니다. 
학교 식당 메뉴는 부페식인데 고정메뉴로 서브웨이 식의 샌드위치, 3가지 종류의 피자, 파스타가 있고 매일 다른 메뉴들이 7~10가지 정도 제공됩니다. 디저트도 쿠키, 케이크, 아이스크림이 항상 준비되어 있어 체중조절에 심각하게 신경쓰셔야 합니다^^

하지만 미국음식이 심하게 입에 맞지 않는다 싶으신 분들은 학교 밖에서 사는 것을 권해드립니다.","도서관에는 책이 그다지 많지는 않지만 공부하기엔 아주아주 좋습니다. 일단 도서관에 사람이 많이 없고, 스터디룸도 많이 마련되어 있고, 책상도 넓고, 날씨가 좋은 날엔 창가쪽 넓은 책상에서 공부하기가 최고입니다. 

수업 자체는 그다지 어려운 편이 아닙니다. 3-4천단위를 들으셔도 괜찮으실 듯합니다.
저는 investments, visual literacy (영화론), visual art, literary experience, concert choir, piano1 을 들었습니다. Investments는 우리학교의 기업재무 정도의 수준이고, 영화론은 수업 자체에서 배우는 것은 별로 없지만 영화를 하나 정해서 분석하여 소논문 수준의 paper를 쓰는 과정에서 많은 것을 배웠습니다. 발표도 2번이나 있기 때문에 영어울렁증이나 발표공포증을 해소하는 데도 도움이 될 것이라고 생각합니다. Visual art는 제가 가장 좋아했던 수업으로, 미술사와 디자인, 건축, 미술 전반에 관해서 폭넓게 배울 수 있습니다. 과제가 15개 정도 있어 귀찮긴 하지만 전혀 어렵지 않습니다. 

음악을 좋아하시는 분은 concert choir도 추천해 드립니다. 상당히 많은 인원이 참여하므로 사교성이 좋으신 분들은 친구도 많이 사귈 수 있습니다. 제가 있을 때는 모차르트 곡만으로 콘서트를 꾸며 공연을 했습니다. 

악기를 다룰 줄 아시는 분들은 기타 악기 수업을 신청하셔도 좋습니다. 저는 피아노를 오래 쳐 왔기 때문에 피아노 수업을 들었는데, 교수님와 1:1로 레슨을 받을 수 있습니다. 매 주 30분~1시간 정도 교수님 방에서 개인레슨을 받는데, 저에게는 상당히 좋은 경험이었습니다. 음대 건물에는 아무 때나 연습할 수 있는 연습실이 20개 정도 있어서, 시간 날 때마다 연습을 할 수 있었습니다.","국제교류부는 워낙 교류 규모가 작다보니 그렇게 활발한 도움을 기대하긴 어렵습니다. 2명의 전담 선생님이 계신데, 생각보다 친절하고 자주 컨택한다면 도움을 받기 쉽습니다. lynn hepfl이 담당자인데, 사교성이 풍부하고 이야기를 잘 들어줍니다. 

하지만 규모가 작아서 교환학생들끼리의 교류를 기대하긴 사실 어렵습니다.
국제교육부에서 주최하는 cultural night, fashion show, day trip 등이 있지만 교환학생끼리 친해진다거나 행사참여가 많다거나 하지는 않습니다. 

국제교육부에서 나서서 해주는 일이 많지 않기 때문에 먼저 가서 요청하고 상담하셔야 합니다. 특히 한국학생이 거의 없기 때문에 특별히 신경써주는 일이 없습니다. (중국학생들은 10명 정도 있어서, 그 그룹 전체에 신경을 써줬던 것 같습니다)","gym은 무료로 이용할 수 있어 규칙적으로 운동하시는 분들께 매우 좋습니다. 수영장도 있다고 하고, 실내 암벽 등반이나 체조실도 있습니다. 

학교가 작다보니 교내 동아리가 활성화 되어 있습니다. 교환학생이시라면 텐트 여행을 하는 곳도 괜찮을 듯 합니다. 학교 곳곳에 있는 게시판에 사람을 모집하는 글들이 많으니 관심에 따라 많이 가입하시면 좋을 듯합니다. 

저는 신문방송을 이중전공하고 있어 교내 방송국에서 뉴스를 만들었는데, 영어에도 도움이 되고 인간관계를 늘리는 데도 큰 도움이 됐습니다. 

이 곳 사람들이 먼저 다가와서 말을 많이 걸거나 관심을 보이는 경우는 드물기 때문에, 어떤 동아리에 들어가든 먼저 열의를 보이는 게 중요한 것 같습니다.",딱히 문화 충격이라고 할 만한 일들은 없습니다. 하지만 남녀 공용 기숙사의 경우에는 원칙은 금지되어 있지만 룸메가 가끔 이성 친구를 데려와서 자고 가는 일도 있다고 합니다. 그런 것에 민감한 분들이시라면 남녀가 분리된 기숙사를 신청하시는 것이 좋습니다. 사실 교환학생들은 처음부터 분리된 기숙사를 쓰지만 (culture shock 을 막기 위해) 이런 것을 모르고 일부러 공용 기숙사를 선택하셨다가는 약간 거북하실 지도 모르니 주의하시기 바랍니다.,한국 학생은 없었지만 사회복지 쪽에 한국인 교수님이 한 분 계십니다. (김영경 교수님) 너무나 친절하시고 많이 도와주시고 한국 음식도 가끔 해 주셨습니다. 한국 학생이 워낙 없다보니 (아마 제가 거의 처음이었을 듯) 많이 도와주시고 싶어하고 잘 챙겨주십니다. 가끔 마트에도 데려가시고 급히 차가 필요할 때도 도움을 주셨습니다.,"제가 있었을 때는 한국 학생이 하나도 없었습니다. 몇년 전 한 명 왔었던 걸로 기억한다... 고 국제교육부 선생님이 그러셨으니, 앞으로도 그리 많지는 않을 것으로 예상됩니다. 우리 학교 외에도 몇 곳과 ISEP 교환 협정을 맺고 있어서 그 이후에 얼마나 우리나라에서 나갔는지는 알 수 없지만, 다른 지역에 비해 월등히! 정말 월등히! 아시아계가 적습니다. 한국 사람 많은 곳이 싫다, 영어 공부 하고 싶다, 조용하게 산책하고 독서하고 여유롭게 지내다 오고 싶다... 이런 분들은 정말 제 경험상 매우 추천해드립니다. 하지만 친구 만나는 것 좋아하거나 한식을 너무 좋아하거나 (한국 음식 먹을 기회 거의 없음) 파티, 클럽 등을 즐기기를 원하시거나 미국 각 지역을 많이 돌아다니고 싶다... 하시는 분께는 강력하게 비추입니다. 그러기엔 너무 조용하고 교통이 불편하고 유흥시설이 거의 없습니다. 전자의 성향이신 분들은 영어 실력 늘려가기엔 딱 좋은 곳인 것 같습니다. 후자시라면... 우울증이 찾아오실 지도."
