gen_info,env_info,food_info,study_info,office_info,facil_info,mhct_info,help_info,etc_info
공과대학과 경영대학 두가지 단과대가 같이 있는 작은 규모의 학교입니다. 캠퍼스 시카고 시내에서 대중교통 1-20분 거리에 있어 도시를 만끽하기에는 좋은 위치에 있습니다. 여름에 입국하여 가을 끝자락까지 시카고에 있어서 그런지 혹독한 추위를 느껴보지는 못했습니다. 작은 규모임에도 녹지 조성이 잘 되어있어 여러가지 활동도 할 수 있습니다. 얼마 길지 않은 여름이 지나가며 가을이 오는 풍경이 시원스레 좋았습니다.,"대학생들이 많이 거주하는 Bridgeport 에는 작은 상권이 조성되어 있어 부담없이 다녀오기 좋았습니다. 밤을 새고 아침을 먹으러 가던 카페, 새벽에 배가고파 치킨을 사러갔던 슬럼가 등 기억에 많이 남습니다. 시카고 시내 남쪽에 위치하고 있어 서울 시내만큼 안전한 분위기는 느끼기 힘듭니다. Gun <x-alert 를 짧은 기간임에도 몇번씩 공지 받았던 기억이 납니다. 그래도 CTA Red Line 이 24시간 운영하므로 여러 사람들과 무리지어 다니거나 혼자 다님에도 직접적으로 위험한 상황을 많이 겪진 않았습니다. 독특한 색깔을 가진 시카고 도심과 그 주변의 시가지를 다양하게 경험할 수 있는 위치라고 생각합니다.","교환학생에겐 기숙사가 의무였습니다. 여러종류의 기숙사가 있지만 가장 크게 MSV, SSV로 나눌 수 있는데 저는 별다른 선택의 기회를 갖지못하고 MSV에 살았습니다. 세탁기가 고장나고, 샤워기가 고장나는등 잘 정돈된 환경은 아니었지만 한학기를 지내기엔 충분한 상태였던것 같습니다. 중국인 룸메이트와 함께 지냈고 특별히 불편한 점은 없었습니다. 하지만 유의해야할 것은 음주에 대해 상당히 민감합니다. 미국 동부 대부분의 도시들이 그렇듯이 공공장소에서의 음주는 특별한 상황 빼고는 엄격하게 금지하며 기숙사 내에서도 음주가 발각되면 쫓겨나는등의 상당한 제재를 가하는 것으로 압니다. 그래도 캠퍼스에서 걸어서 5분거리에 술가게가 있어 자주 사러가곤 했습니다. 개인공간이 보장되는 만큼 책임감있게 대처하면 별다른 문제가 없을것처럼 보입니다.  식사의 경우 기숙사비에 Meal plan 이 포함되어 결제가 됩니다. 학생증에 1주일에 몇번 혹은 한학기 동안 몇번의 식사티켓이 발급되어 MTCC 건물에 있는 식당에서 매 끼니마다 식사할 수 있습니다. 뷔페식이며 메뉴 변동은 크지않아 자주 이용하지 않았습니다. 주변에 차이나타운이 있어 밤늦게 배달하는 식당도 있고, 피자, 치킨집등이 있어 음식 해결에 큰 문제는 없었습니다. 다만 캠퍼스 주변에 늦게까지 열어있는 패스트푸드점에는 차가 있지 않은 이상 혼자가지 않는것을 추천합니다. 새벽늦게 갔다가 거지들, 약 중독자들에게 위협당한 기억이 있습니다.","수업은 개인이 하기에 따라 성과가 나오는것 같습니다. 교수님들은 학생들에게 관심을 가지며 접근하지만 언어의 문제 혹은 다른 문제로 피하게 되면 좋은 대우는 바라지 않는것이 좋습니다. 저같은 경우 건축 설계수업을 듣는동안 교수님과 이야기를 많이 했습니다. 전공 뿐만 아니라 사는 방식, 여러 사건들, 호기심들에 대해 이야기를 하다보니 많은것을 배울 수 있었습니다. 건축 전공이 아닌 친구들에게 듣기론 일방적인 주입식 수업도 있었다고 얘기를 합니다. 도서관은 책을 보러 간다기보단 새벽에 공부나 작업을 하다가 쉬러가는 용도로 사용했습니다. Crown Hall 옆에 위치한 도서관에는 서고에 빈백이 마련되어 있어 매일 밤 누워 자는 사람이 수두룩 합니다. 보완관리가 철저해 안전합니다.",많이 방문할 일은 없었습니다. 다치거나 아팠을 때 보험관련하여 문의하고 또 학비납부영수증 들을 발급받기 위해 가보았습니다. 계신분들 친절하였고 처리에 걸리는 시간도 짧았습니다. 그외엔 국제학생들이 IIT에서 많은 비중을 차지하기 때문에 많은 행사를 주최하는것 같았습니다. 아시아 학생들에 많이 집중하는것처럼 보였습니다. 참가해 보지는 않아 자세한 내용은 알지 못합니다.,"특별한 경우가 아니고선 학교에 위치한 농구장, 배구장, 축구장등 많은 운동시설들을 개방해 놓아 자유롭게 이용하였습니다. 학생증과 적절한 의상만 갖추면 무료로 이용할 수 있어 편리했습니다. 헬스 트레이닝을 위한 시설도 잘 되어있고 또 활발히 사용되기 때문에 관리가 매우 잘 되어있었습니다. MTCC 건물에는 탁구대, 포켓볼도 위치하여 학생들이 많이 이용하는 모습을 볼 수 있었습니다. 건축과 건물 2동같은 경우 컴퓨터실과 인쇄실이 수준높게 마련되어 있어 매우 유용하였습니다. 컴퓨터 사양도 무난하였고 대형인쇄기의 경우도 대기자가 밀리면 사용하기 힘들었으나 결제도 쉽고 인쇄도 빨라 맘편하게 사용할 수 있어 좋았습니다.","미국의 시스템적, 전반적인 조직화된 모습이 미국 사람들의 실생활을 관찰할 때도 볼 수 있는 것이 놀라웠습니다. 한국보다 더 매뉴얼, 프로토콜에 익숙한 사람들의 모습이 그다지 행복해 보이지는 않았습니다. 한국의 사회가 최고를 쫓는다면 미국 사회는 중산층, 안정을 쫓는다고 표현할 수 있을까요. 미국 전역내에서도 높은 랭킹을 가진 학교의 학생들사이에서도 불꽃튀는 욕심을 본 기억이 많지 않습니다. 제가 어울리던 친구들의 성향때문일지도 모르겠습니다.",도움받을 사항이 보통 실생활에 관련된 것이기 때문에 기숙사에 위치한 학생처를 추천합니다. 직접적인 도움을 준다기보단 다른 곳으로 연결시켜줍니다. 국제학생들이 많다보니 차분하게 설명해 줍니다. 주변에서 듣기로는 MTCC에 위치한 국제학생 관련 사무실에도 학생들이 많이 방문한다고 들었습니다.,입학생들에게 주는 아이패드는 방문학생들에게도 해당되니 꼭 받으세요.
캠퍼스는 그다지 크지 않습니다. 학교 끝에서 끝까지 10분정도면 걸어서 갈 수 있는 거리이고 학교 안으로 도로가 뚫려있기 때문에 학생회관 바로 앞에서 버스를 탈 수 있어요. 시카고 내에서는 외진 지역에 위치하고 있으나 버스와 지하철이 바로 가까이에 있기 때문에 교통이 불편하거나 하진 않아요. 날씨는 대체적으로 한국과 비슷한데 여름이 매우덥고 겨울이 매우 춥습니다. 하지만 한국과 달리 건조하기 때문에 여름 날씨는 매우 좋고 겨울은 굉장히 추워요.,"학교에서 더 시카고 외곽 쪽으로 나가면 흑인 슬럼가라서 위험합니다. 밤 8시 이후에는 가급적 돌아다니지 않는 것이 좋아요. 버스로 두정거장 거리에 대형마트가 있어서 도착하자마자 생필품을 구입할 수 있고, 간간히 먹거리 등을 구입하기도 편합니다. 버스나 지하철을 타고 15분정도 나가면 다운타운(시내)으로 갈 수 있습니다. 도시의 규모는 서울에 비해 작지만 백화점, 음식점, 고층빌딩, 뮤지엄 등 굉장히 많은 볼거리들이 있어요. 쇼핑하기도 편하고 구경하기도 좋아요. 특히 세계에서 2번째로 높은 시어스타워(윌리스타워) 200층의 뷔페는 오기전에 꼭 들러보길 추천하고 싶습니다. 그리고 학교에서 다운타운 반대쪽으로 20분정도 걸어가면 미국의 5대호중 하나인 미시간호에 다다를 수 있어요. 시내까지 쭉 연결된 이 호수는 남한의 크기보다 크다고 합니다. 미시간 호에서 조깅을 하거나 산책을 하는 사람들도 흔히 볼 수 있어요.","기숙사는 신기숙사/구기숙사로 나뉘어져 있고 따로 하숙을 하거나 룸메이트를 구해서 사는 형식을 취할 수 있는데요, 저는 구기숙사에서 생활하였습니다. 구기숙사는 연세대학교의 기숙사와 크게 다르지 않아요. 층별로 라운지가 있는데 텔레비전과 전자렌지가 있고, 지하에 세탁실이 있습니다. 세탁은 한번에 1달러, 탈수는 1.5달러정도 했던 것 같아요. 식사는 학교안에 각종 밀플랜이 있어서 미리 구입해도 되고, 식당에 갈때마다 새로 구입해서 먹어도 됩니다. 근데 한꺼번에 식권을 구입하는것이 더 저렴하다던가 하진 않았던 것 같아요. 학생식당에서 한끼가 12불정도 하며 경험상 제일 적은 플랜을 구입해도 다 먹지 못하는 사람이 많기 때문에 그냥 식당에 갈때마다 구입하는 것이 나을 것 같습니다. 식사는 파스타, 육류, 샐러드, 스프, 디저트, 피자 등이 뷔페처럼 나뉘어져있어 먹고싶은만큼 가져다 먹으면 되요. 처음에는 신세계지만 계속 먹다보면 질려서 나중에는 샐러드만 먹게 되서 한끼에 12불이나 내고 먹기는 좀 아까워요. 학교 안에 세븐일레븐 편의점이 있는데, 여기서 한국 라면을 사먹을 수 있어요. 컵라면 하나에 4불정도.","수업은 당연하지만 모두 영어로 진행됩니다. 국제교류가 많은 학교여서 그런지 중국인, 인도인, 스페인계 친구들이 많아요. 저는 경영수업 2개랑 건축학 수업 2개, 글쓰기수업 하나를 들었는데 별로 힘들지 않았어요. 일단 C학점만 넘기면 학점인정이 되기 때문에 편하게 들었던 것도 있지만, 수학이나 암기가 필요한 시험의 경우 한국인 친구들 성적이 굉장히 좋습니다. 수업은 정말 편하게 들었어요.","교육부는 처음 도착했을때랑 마지막 떠나기 전에만 방문했는데, 다들 친절하고 잘 도와주셨던 것 같습니다. 혹시 캐나다로 여행가길 원하시는 분이면 국제교육부에서 서류를 받아야 했던 걸로 기억해요.","학교에 동아리도 많이 있지만 저는 따로 동아리는 신청하지 않았어요. 지금 생각해보면 좀 후회되는데, 동아리에 가입해서 외국인 친구들을 많이 사귀는 것도 좋을 것 같습니다. 학교 외곽쪽에 GYM에 가면 각종 헬스 기구와 수영장, 스쿼시장, 농구코트 테니스코트 등이 있습니다. 무료라서 꾸준히 운동할 수 있어요.","밖이나 버스 안에서 쉽게 말을 거는 것, 며칠 입은 옷이어도 쉽게 환불받을 수 있는 점(아는 친구는 심지어 세탁기에 빤 청바지도 환불받음). 정~~말 많이 먹는다는 점. 상상할수도 없이 비만인 사람이 매우 많다는 점. 시카고에 있을 때에는 제가 제일 마른 편이었는데 한국 오니까 통통한편이라 놀랐어요.","매주 한인교회에서 셔틀을 보내주는데, 한인교회에 다니면 유용한 정보들이나 도움들을 받을 수 있다고 해요.",한국사람들이랑 같이 다니지 않는게 좋아요.
"IIT는 공과대학이기 때문에 연세대와 비교하면 놀랄만큼 캠퍼스가 작습니다. 건물도 다 2-3층짜리 낮은 건물들이라 작고 아기자기합니다. 캠퍼스는 시카고 다운타운에서 15~20분 거리에 있습니다. 한국 학생들이 버스를 잘 몰라서 대부분 L(지상전철)만 타고 다니는데 29번 버스가 캠퍼스 내 State st.을 따라 남북으로 다닙니다. 학교에서 동쪽으로 20분 정도 걸어가면 호수가 나오는데 그것보단 그냥 북쪽에 있는 진짜 beach에 가시길 추천합니다. 학교 근처에서는 각종 범죄가 많이 일어나서 (한인 유학생들에게 정말 많이 듣습니다) 캠퍼스 내에만 있으시길 권합니다. 기후는 가을학기에 참 좋고 겨울방학부터 봄학기까지는 다소 춥습니다. 원래 시카고의 겨울은 정말 혹독하게 춥기로 유명한데 제가 있었던 2011-2012년 겨울은 너무 이상하게 기온이 높았습니다. 오히려 서울에선 이상한파로 난리였는데 시카고는 서울보다 따뜻했으니 말 다 했죠. 그래도 바람 한번 불면 진짜 추위가 말로 표현 못합니다. 장갑, 어그부츠, 귀마개 필수고 발목까지 오는 패딩파카 많이 입고 다닙니다. 시카고는 무엇보다 하늘이 항상 새파랗습니다. 한국에 와서 가장 먼저 느낀 차이점이 그거일 정도로 하늘이 늘상 파란색이어서 눈이 시원합니다. 대신 선글라스+자외선 차단제도 필수.. 가을학기에 가시는 분들은 추워지기 전에 무조건 많이 놀러 다니세요. 봄학기엔 날 풀리면 많이 다니시고..","우선, 학교 주변에는 아무것도 없습니다. 특히나 신촌의 번화한 거리에 익숙할 연대생에겐 가히 충격적일 정도로 황량합니다. 그나마 다행스럽게 캠퍼스 내에 L(지상전철) 역과, 버스 정류장이 있어서 다운타운에 쉽게 나갈 수 있습니다. 학교 주변에서 먹을만한 음식점은 35th st.에 스타벅스와 작은 피자가게, 샌드위치 가게가 있습니다. 그리고 바로 그 옆에 White sox 구장이 있습니다. 학기 초에는 학교에서 공짜 티켓을 나눠주기도 해요.","교환학생이 이용할 수 있는 기숙사로는 msv, ssv가 있습니다. ssv는 매우 비싸서 대부분 msv를 이용하게 될텐데, 저는 학교 meal plan이 워낙 맛이 없다는 얘길 들어서 처음부터 부엌이 있는 기숙사로 들어갔습니다. housing 담당자와 연락하면 위의 두 기숙사와는 다른 곳으로 갈 수 있어요. 제가 묵었던 곳은 carman hall로 대학원생 전용 기숙사입니다. 부엌이 딸린 아파트 형인데 바퀴벌레가 엄청 많아요... 건물이 워낙 낡아서; msv는 취사가 불가능하고, ssv는 새 건물이라 벌레걱정 없이 깨끗하다고 들었습니다. 저는 첫 학기에 기숙사에서 못된 룸메이트와 벌레 때문에 엄청 맘고생 하다가 결국 다음 학기에 시내에 있는 아파트로 나갔습니다. 모든게 우리나라랑 다르고 생소해서 다들 그냥 편하게 학교에서 하라는대로 하실텐데 최대한 많이 알아보세요. 사실 기숙사가 질 대비 아주 비싼거거든요. 아파트 잘만 구하면 기숙사와 같거나 어쩌면 더 싼 가격으로 한 학기 보낼 수 있습니다. 기숙사에서 얻을 수 있는 장점이라면 당연히 외국 학생들과의 소통이겠지요. 하지만 이것도 사람 나름인게, 학교 내에 한국인이 엄청 많아서 한국 사람들이랑 노는 애들은 그냥 계속 한국 애들이랑만 놀더라고요. 물론 안 그런 친구들은 기숙사에서 이나라 저나라 외국 친구들 많이 사귀고 잘 놀러다니기도 했고요. 저는 학교 밖에서 산 대신에 수업시간에 애들이랑 많이 얘기하고 놀고 그랬어요. 저는 일년 내내 직접 밥을 해 먹었는데, 보통 msv에 살게 되면 meal plan을 선택해서 학교 식당에서 먹게 됩니다. 부페식이고 매일 조금씩 달라진다고는 하는데 개강 후 첫 일주일만 맛있고 그 후로는 어쩔 수 없이 먹는다는게 모두의 공통된 의견입니다. 많은 친구들이 가장 많은? 밀플랜 신청했다가 대부분 create your own? 그거로 바꾸더라고요. 참고하세요.","저는 두 학기 동안 최대한 연세대에 없는 수업을 들으려고 했습니다. 제가 이미 학교에 있는 대부분의 전공과목을 들었기 때문이기도 하고, IIT가 건축학과로 유명한 학교이니만큼 정말 다양하고 fundamental한 수업이 많습니다. 첫 학기에는 Visual Training 1, Freehand Drawing 1, Image Processing in CAD, Digital Photography and Processing, Writing in the University for Non-Native Students 다섯 과목을 들었습니다. VT 수업은 미스가 IIT에서 학생들에게 가르쳤던 전통 있는 수업으로 말 그대로 눈을 훈련시키는 과목입니다. 미학에 가까운 수업이고 일년 커리큘럼입니다. Drawing 수업은 미술기초 과목인데 1학기에는 연필, 차콜 등으로 스케치합니다. 과제량이 많은 편이지만 야외수업도 여러 번 하고 마지막 한달 간은 누드화를 그려서 재밌는 경험이었어요. 마찬가지로 일년 커리큘럼입니다. IPC 수업은 제목엔 cad라고 돼 있지만 실제로는 캐드를 제외한 다른 3D 툴을 다룹니다. 라이노, 맥스, 레빗 세가지를 동시에 진행하고 과제가 은근히 많아서 한 번 밀리면 감당하기 힘듭니다. 하지만 그만큼 배우는 게 많고 교수님이 엄청 친절하게 차근차근 가르쳐 주십니다. DPP 수업은 건축사진을 배우는 수업인데 이 또한 과제량이 많으나 강력 추천합니다. 이 수업을 듣기 위해서는 우선 dslr이 있어야 하고, 삼각대도 필요합니다. 사진에 대한 경험이나 지식이 많으면 좋으나, 전혀 없어도 무방합니다. Writing 수업은 최소학점을 채우기 위해 어쩔 수 없이 집어넣은 과목이었습니다. 제가 속한 분반에 저를 포함한 3명이 한국인이고 나머지 25명 가량이 모두 중국 학생이었습니다 -.- 숙제는 어렵다기 보다는 귀찮은 정도.. 학점이 모자란 경우가 아니라면 듣지 마세요. 두번째 학기에는 Visual Training 2, Freehand Drawing 2, The Dwelling 세 과목과 설계 스튜디오 수업을 들었습니다. VT, Drawing 수업은 1학기의 연장선으로 Drawing 수업에선 흑백 스케치를 벗어나 채색을 합니다. 수채화, 파스텔 등등. Dwelling 수업은 건축과 초년생이 모두 거쳐가는 중요한 수업인데.. 매우 빡셉니다. 매주 핸드드로잉 과제가 아주 많고, 결정적으로 미국의 주거 환경에 대해 배우기 때문에 우리나라와는 소소한 것부터 근본적인 차이까지, 많이 다릅니다. 듣고 나면 아주 좋은 경험이 되지만 빡세다는걸.. 각오하시고 들으세요. 스튜디오 수업은 일주일에 세 번입니다. 월수금 설계 수업을 하고 일화목 수업 준비를 하면 일주일 내내 설계에 파묻혀 살게 됩니다 ^^ 그래도 이 곳 IIT에서 가장 들어봐야 할 과목이죠. 모든 건축학 책에 나오는 Crown Hall에서 작업하는 것만으로도 가슴이 벅찹니다. 물론 초반에만… 어쨌든 세계 각국의 아이들과 함께 밤새 작업하며 중국음식 배달도 시켜먹고 同’居’同樂 외국 친구들과도 금방 친해지고 설계에 대한 열정도 생겨나고, 배우는 것도 많고 사고의 폭도 넓어지고, 스튜디오는 꼭 들어야 합니다. 도서관은 우리 식으로 중앙 도서관이 있고 건축학과 도서관이 따로 있습니다. 중앙 도서관인 Galvin Library는 거의 이용하지 않았습니다. 규모도 작고, 조용히 공부할 자리가 많지도 않아요. 학기 초에 도서관 이용 안내 투어를 하는데 참여하시면 소소한 정보를 많이 얻을 수 있습니다. 건축학과 도서관은 Crown Hall 지하에 있는 GRC라고 하는데 건축 관련 서적들이 꽤 방대하게 있습니다.",처음에 학교 가면 학생등록이었나 그런걸 하고 건강검진 진단서 같은걸 제출하러 international center에 가야 하는데 그때 이후론 한번도 이용하지 않았습니다.,"기숙사 옆에 gym이 있는데 1층엔 농구코트가 있고, 지하엔 수영장, 스쿼시룸, 탈의실, 헬스시설 등이 있습니다. 학생증 찍으면 모두 공짜로 이용 가능하니 운동 많이 하세요. 특히 meal plan 신청하시면 운동.. 꼭 하셔야 돼요. 다들 최소 5kg씩 쪄서 돌아갑니다. 동아리도 찾아보면 많이 있습니다. 미국 학생들이 모두 friendly할거라는 생각은 버리세요. 간혹 외국학생이 찾아오는 것에 대해 시큰둥해 하거나 못마땅해 하기도 합니다.","저는 특별히 없었는데 msv 사는 친구들 말로는 기숙사에 남자친구, 여자친구 데리고 와서 애정행각을 벌인다거나 화장실에 수건 한 장 두르고 다닌다거나.. 뭐 그런 얘길 들었어요. 그리고 이게 저한테는 culture shock이 아니었는데, 행여나 미국사람들이 다 나에게 친절하게 대할 거라는 환상을 가지는 분이 계실까 해서 적습니다. 그네들은 우리한테 완전 무관심해요. 정말 아주 예쁜 여학생이 아니라면 전혀 관심도 없습니다. 궁금한 게 있으면 적극적으로 물어보고 친해지고 싶으면 계속 말도 붙이세요. 물론 기본적인 영어실력이 수반돼야 합니다. 냉혹하게 들릴지 모르나 영어를 못하면 결국엔 같이 영어 못하는 한국, 중국 학생들끼리만 친해지게 돼요. 미국 땅 밟기 전에 영어 공부 최대한 많이 해 가세요.","Writing center라고 레포트 쓸 때 도움을 받을 수 있는 곳이 있습니다. 시험기간엔 풀 예약되니 미리 약속을 잡으셔야 합니다. 그리고, 학기가 시작하면 학교 내(특히 msv 기숙사)에 각종 한인 교회 사람들이 다니면서 맛있는 한국음식들로 한국학생들을 유혹합니다. 저는 신자도 아니고 얽매이는 게 싫어서 안 나갔는데, 같이 교환학생 갔던 친구는 사람들 만나러 나간다고 하더라고요. 거기 계신 분들 다 착하고 어려운 일 있으면 잘 도와주신다고 합니다. 아마 미국에서 만날 수 있는 가장 큰 한인 커뮤니티가 교회가 아닐까 싶습니다. 처음에 좀 나가다가 먹튀하는 사람도 있다고 하고 끝까지 좋은 인연으로 남는 사람도 있다고 해요. 이건 개인적으로 잘 선택해야 할 것 같습니다. 그리고 건축과 한인학생회가 따로 있습니다. 가을학기 시작할 때 크게 모임?을 하는데 그때 나가면 건축과 한국 학생들은 다 알게 됩니다.","리브인시카고 라는 다음 까페가 있는데 각종 중고 물품 거래도 하고 집 렌트도 많이 올라옵니다. 물건들 가서 자잘하게라도 새거 사려면 다 비싼 돈인데 중고로 장만하셨다가 깨알같이 다 팔고 오세요. 판 돈으로 귀국 전 쇼핑하면 기쁨이 두 배ㅋ 한가지 더, 꼭 말씀 드리고 싶은 것은, 시카고에 있는 Art Institute of Chicago입니다. 미국 3대 미술관 중 하나로 규모도 크고 소장작품도 방대합니다. 저는 건축학도임에도 미술에 문외한이었고 좋아하지도 않았는데 우연히 수업 때문에 한번 갔다가 반해서 연간 회원권 끊어서 다녔습니다. 다운타운 한가운데에 그렇게 큰 미술관이 있다는 게 놀라울 따름입니다. 시카고 거주학생이면 한번 입장료가 $10인데, 학생 연간 회원권이 고작 $40불이고 동반 1인까지 무료 입장입니다. 친구랑 돈 나눠서 하면 두 번씩만 가도 본전 뽑는 셈인데, 이런 돈 문제를 떠나서 매일매일 아무 때나 돈으로 환산할 수 없는 가치의 세계적인 작품을 볼 수 있다는 게 가장 큰 메리트죠. 한국에서는 예술의 전당에서 어쩌다 한번 크게 기획전시 하면 초딩부터 노인까지 바글바글한 곳에서 사람에 치이면서 힘들게 볼 것들을 이곳에서는 날마다 여유 있게 볼 수 있습니다. 시카고에서 돌아온 후로 가장 그리운 곳 중 하나입니다. 쓰기 시작하니 시카고 생각도 많이 나고 도움에 됐으면 하는 마음에 엄청 길게 썼는데 더 궁금한 점 있으시면 주저 말고 이메일 (7916story@yonsei.ac.kr) 보내주세요. 기억나는 만큼 최대한 많이 답변해드릴게요 :)"
