gen_info,env_info,food_info,study_info,office_info,facil_info,mhct_info,help_info,etc_info
"학교가 굉장히 넓은 편입니다. 그리고 다른 지역에 캠퍼스도 많구요. 저는 매주 두 번씩 학교 셔틀 타고 tempe campus에서 west campus까지 갔다 왔습니다.애리조나는 굉장히 뜨거운 지역입니다. 하지만 저는 오히려 더위보다 추위 때문에 고생했어요. 에어컨 때문에, 건물이 너무 추운 경우가 많습니다. 애리조나의 여름을 겪고 나면 조금만 추워져도 굉장히 춥다고 느껴집니다. 저는 한국에서 패딩 안 가져온 걸 후회할 정도로 추웠어요. 그리고 학기 끝나고 여러 지역 여행 다닐 생각이면 따뜻한 옷은 더욱더 필수입니다. 결론, 한국의 가을, 겨울 옷 다 가져오세요.","thrift shop : 구글지도에 thrift shop이라고 치시면 돼요. 아마 가장 가까운 곳이 gracie’s thrift shop일 겁니다. 헤어 드라이어, 고데기, 청소기, 밥솥 등등 각각 5천원이면 다 살 수 있는 중고매장입니다. 무조건 꼭 가세요.food city : 먹거리 사기에 적합한 곳입니다. 가격은 safeway 보다 싸요.safeway : 한국의 농협. 먹거리 사기에 적합한 곳입니다. 깨끗하고 정돈된 곳에서 장보고 싶으시면 여기로 가세요.cvs : 대형 편의점 정도 생각하시면 됩니다. 월마트나 타겟 가기에는 시간이 없을 때, 어쩔 수 없이 이용하는 곳입니다.walmart : 한국의 홈플러스 정도 생각하시면 됩니다. 생필품 사는 곳.target : 월마트랑 비슷합니다.amazon : 위에서 서술한 것들과 관련있어서, 여기에 서술할게요. 한국의 11번가, 옥션, 지마켓 정도의 쇼핑 앱입니다. amazon prime을 무료로 이용하는 방법이 2가지가 있습니다. 하나는 그냥 1달 무료이용을 신청하는 겁니다. 그리고 다른 하나는 student amazon prime이라고 학생임을 인증하면 6달 동안 무료로 이용할 수 있습니다.","한국에서 온라인으로 방을 구해서 가야 하나, 가서 거기서 직접 다니면서 방을 구해야 하나 고민하시는 분들이 있을 겁니다. 저는 온라인으로 방을 구해가는 것을 추천합니다. 왜냐하면 개강 맞춰서 가면 저렴하고, 좋은 방들은 이미 다 매진일 겁니다.저는 12fifty5라는 곳에 거주했습니다. 절대 여기 가지 마세요. 여기서 살면 안되는 이유로 에이포 한 페이지 채울 수 있습니다. 922 place나 Nexa 추천합니다.","저는 수학과 전공이라서, 수학과 과목 위주로 들었습니다. 연세대 수학과 실력이면, ASU에서 A학점 쓸어오실 겁니다.Discrete Math Structure : 연대에서 이산수학 전공선택으로 인정받기 위해 들었던 과목입니다. 공부 안 하셔도 돼요. 한국 고등학교 수학 복습입니다.History and Philosophy of Mathematics : 연대에서 수학사 전공선택으로 인정받기 위해 들었던 과목입니다. 강의 녹음하시고, 강의 그대로 받아적어서 요약하시면 돼요.Applied linear algebra : 연대에서 수학사 선형대수로 인정받기 위해 들었던 과목입니다. 굉장히 쉬운 것만 가르치십니다. 시험 전에 2~3일 정도만 추천문제 풀어가면 돼요.Complex analysis 1 : 연대에서 수학사 복소해석학으로 인정받기 위해 들었던 과목입니다. 시험 전에 시험 예비 문제를 주시는데, 정말로 예비 문제와 유형이 똑같이 나와요. 예비 문제 관련 문제들만 풀면 됩니다.Concert band : 아마추어를 위한 학교 공식 윈드 오케스트라라고 보시면 돼요. 곡은 상당히 쉽습니다. 한 학기에 2번 정기 공연이 있습니다. 학점은 오직 출석으로만 매깁니다.","저는 주로 아파트 계약 관련해서 많은 도움을 받았습니다. 마지막에 아파트 정리하고 나갈 때, 보증금을 받아야 하는데, 외국으로는 또 안 보내준다더군요. 그래서 국제처 가서 상황을 얘기하니, 여기서 보증금을 받고 저한테 보내주기로 했습니다.",어느 동아리든지 속해서 동아리 사람들과 어울리는 걸 매우 추천합니다. 저는 다양한 나라의 사람들과 친해질 수 있는 교환학생을 위한 동아리를 찾아봤습니다. Friends of international이라는 동아리는 한 번 갔다가 그 뒤로 안 갔습니다. 실제 가보니 인도인밖에 없더군요. ICU도 꽤 괜찮은 곳입니다. 저는 주로 Bridges라는 곳에서 사람들과 어울렸습니다.,"여기 도서관에서는 큰 소리로 얘기하는 것, 밥 먹는 것, 전화하는 것 등등 모든 행위가 허용됩니다. 저는 주로 silent area에서 공부했어요. 또, 화장실 갈 때도 항상 자기 소지품 소지하고 다녀야 합니다. 언제 어디서 도난 사고가 발생할지 모릅니다.사람 서비스가 들어간 경우, 가격이 너무 비쌉니다. 식당이 정말 너무 비쌉니다. 그리고 이발비도 정말 비싸고, 실력은 형편없습니다.배송이 너무 느립니다. 생필품의 경우 월마트나 타겟 가서 직접 고르고 사는게 속 편합니다.대중교통 이용할 생각하지 마세요. 중고차를 사는 것도 매우 추천합니다. 아니면 자전거를 사는 것도 좋은 방법이에요. 자전거는 너무 당장 급하게 사야 한다면 walmart에서 사는 게 가장 저렴하구요, 시간이 있으면 ASU property shop(오프라인 중고매장) 또는 craiglist 같은 중고사이트를 이용하시면 돼요.",국제교육부 항목 참조.,"미국에서 미국 계좌 만드세요. 저는 chase bank 계좌를 만들었습니다. chase 계좌를 만들 경우, 장점이 너무 많기 때문에 서술하지 않겠습니다. 학교랑 제휴된 arizona bank는 그닥 추천드리지 않습니다.생수는 대형매장에서 생수를 사 먹으세요. 1갤런(약 3.7L)에 1달러 정도 합니다.요약하자면, 따뜻한 옷 많이 챙겨갈 것 / thrift shop 갈 것 / 12fifty5에는 살지 말 것 / 개인용 이동수단을 확보할 것, 이렇게 4가지입니다.더 질문 있으시면 blue4116@naver.com으로 이메일 주세요."
"ASU 는 정말 큽니다. 크게 5개의 캠퍼스가 있는데 저는 Tempe 캠퍼스에 수업이 다 있어서 Tempe 에만 있었습니다. Tempe 캠퍼스만 하더라도 학교가 꽤 커서 이동할 때 스쿠터를 타고 다녔습니다. 날씨는 여름에 정말 덥습니다. 가을학기라 8월 중순쯤에 애리조나에 도착했는데, 살인적인 더위였습니다. 낮부터 저녁까지 온도가 무려 45도까지 지속됐습니다. 밖에서 정말 10분도 서있기 힘들었습니다. 학교에서 걸어서 10-15분 거리에 숙소를 잡았는데, 도무지 걸어갈 수가 없어서 우버를 타고 가곤 했습니다. 9월 말부터 날씨가 조금씩 풀리기 시작하더니 10월 이후에는 날씨가 정말 최고였습니다. 20-25도 정도 날씨가 유지됐고, 비도 거의 안 오고 하늘이 맑아서 좋았습니다.  너무 덥기 때문에 항상 걸어다니는 것은 무리입니다. 자전거나 자동차를 장만하는 것은 필수입니다. 저는 전동 스쿠터를 사서 타고 다녔는데, $400 달러를 주고 사서 $150 에 되팔았습니다. 스쿠터를 산 것은 애리조나 와서 가장 잘한 일이라고 생각합니다.","저는 주로 학교와 집에서만 시간을 보내서 주변 환경에 무엇이 있는지 생각나는 게 별로 없습니다. 어딜 나가려고 해도 차가 필수인데 차가 없었기에 많이 다니질 못했습니다. 버스나 우버를 타고 Scottsdale Fashion Square, Arizona Mills 이라는 쇼핑몰을 몇 번 간 기억이 납니다.","기숙사를 지원하려고 했지만 모두 찼다고 해서 어쩔 수 없이 off-campus 아파트에서 지내게 됐습니다. 한 학기만 있는 관계로 short-term lease 가 가능한 아파트만 알아봤습니다. 학교측에서 세 군데를 추천해줬는데, 그 중에서 가장 싼 12fifty5 라는 아파트에서 있게 됐습니다. 저는 정말 운이 좋아서 2인실 돈을 내면서 혼자 스튜디오에서 묵게 됐는데, 혼자서 부엌, 거실, 화장실, 세면대, 옷장, 침실을 다 누릴 수 있는 호황을 누렸습니다.   한국에서 온라인으로 application 을 했고, 2인실에 묵는 조건으로 사인까지 했습니다. 하지만 도착해서 방을 보니 청소가 안 돼있는 더러운 방이었습니다. 그래서 다시 오피스로 가서 따졌더니 우선 방을 청소하는 기간동안 1인실 스튜디오에 묵으라고 하면서 키를 줬습니다. 스튜디오엔 당연히 길어야 1-2 주일 정도 있을 줄 알았는데, 그 뒤로 방 뺄때까지 연락이 없었습니다. 이 아파트가 일처리가 늦는다는 후기가 많았는데, 저는 그 덕에 꼬박꼬박 2인실 돈을 내면서 운좋게 스튜디오에서 살게 됐습니다.   12fifty5 은 낡아서 시설이 좋지 않았습니다. 저는 운좋게도 벌레가 나온적은 한 번도 없었지만, 다른 교환학생들의 말을 들어보니 바퀴벌레가 빈번히 출몰한다고 하더군요. 저도 이런저런 시설들이 잘 작동이 안된 경우는 있었지만, 그래도 운좋게 스튜디오에서 묵고 있어서 불평은 하지 않았습니다. 위치 자체는 학교에서 걸어서 10-15 분 정도로 가깝습니다. 가격은 렌트가 한달에 $570, 관리비 $75, 그리고 저는 단기간 묵어서 매달 $100 를 추가로 지급했습니다. 보험이랑 세금 등 합해서 한달에 770 정도 낸 것 같습니다. 그래도 원래 스튜디오 가격이 $1000 이 넘는데, 770 만 내면서 묵었기에 정말 만족하면서 지냈습니다.   식사는 주로 학교에서 해결했습니다. Meal Plan 을 사지는 않았지만 M&G 라는 걸 사서 학교 구내식당에서 끼니를 떼웠습니다. M&G 를 사면 학교에서 먹을 때 세금이 붙지 않고, 400달러 이상 결제하면 20%를 추가로 지급해줍니다. 그래서 초반에 400 달러를 결제해서 거의 마지막 즈음에 M&G를 다 썼습니다. Memorial Union 이라는 곳에 식당이 거의 몰려있는데, 그 중에서 멕시칸 식당 Qdoba, 치킨버거집 chick-fil-a, 그리고 중국음식 peiwei 를 가장 많이 갔습니다. 밑에 서브웨이랑 버거킹, 잠바주스도 있는데 거의 가지 않았습니다. 가격은 보통 7-9 달러 사이에서 왔다갔다 하는데, 세금도 안내고, 보너스도 20% 받았기에 나름 합리적인 가격에 잘 먹었다고 생각합니다.   초반엔 집에서도 요리를 하려고 했는데, 혼자 살고 차가 없다보니 장 보는 것 부터 시작해서 요리랑 설거지까지 되게 손이 많이 가서 잘 안 해먹게 됐습니다. 중간에 부모님이 햇반, 카레, 참치, 김 등 한국식품들을 택배로 보내주셔서 그것들을 간단히 조리해 먹었습니다. 아무래도 장 보는게 쉽지는 않다보니 Safeway 라는 곳에서 필요한 것들을 주문해 시켰습니다. 아마 처음 2-3 번은 배송비가 무료이고, 생각보다 크게 비싸지 않았고 다음날 바로 배송해주어서 잘 활용했습니다. 그리고 기타 장비들은 보통 amazon 에서 주문했습니다. 학생이면 6개월 동안 amazon prime 이 무료인데, 이를 활용하면 2-3일 내로 배송비 없이 배송을 해 주어서 정말 혜택을 많이 봤습니다.","수업은 총 17학점을 들었습니다. 1. CSE 494 Topic: Introduction to Machine Learning (Maneparambil)  컴과 수업이고 사전 지식이 많지는 않았지만 생각보다 들을만 했습니다. 이번에 처음 개설된 수업인데, 되게 유익한 지식들을 많이 배워 갔습니다. 우선 모든 수업은 Python 으로 하고, 초반에는 기본적인 Machine Learning 알고리즘들을 배웁니다. KNN, Bayesian Network, Naive Bayes, SVM, 등등의 알고리즘들의 기본 개념을 배우고, 그걸 코드로 어떻게 구현하는지 등을 배웁니다. 후반에는 Deep Learning 을 아주 얕게나마 훑고 지나가는데, 프로젝트로 Keras 와 Tensorflow 를 이용해 기본적인 CNN 코드를 구현하는 연습을 했습니다.    교수님이 인도 분이셨는데, 발음이 아주 명확하지는 않으셔서 하시는 말씀을 100% 알아듣지는 못했습니다. 그래도 학생들을 위해서 여러가지 조언도 해주시고 또 상담을 받으러 갔을 때도 많은 동기부여를 해주셔서 교수님을 정말 잘 만났다고 생각합니다. 수업 때 잘 이해하지 못한 내용들은 조교의 Office Hour 을 잘 활용해서 부족한 점들을 채웠습니다. 특히나 초반에 과제나 프로젝트를 진행하는데 많은 애를 먹었는데, 조교의 도움을 받으면서 성공적으로 잘 마무리 했습니다.   파이썬을 다룰 줄 알고, 인공지능 쪽에 관심이 많다면 아주 수월하게 들을 수 있는 수업이라고 생각합니다. 과제가 총 6-7 개로 적지는 않지만, 그래도 기간은 넉넉하게 줘서 촉박하게 했던 기억은 없습니다. 시험은 총 3번을 보는데 배웠던 알고리즘들에 관한 개념 위주로 나오고 코딩은 나오지 않습니다. 한 가지 아쉬운 점이 있다면 수업이 금요일 오후 3-5시에 열렸는데, 이것 때문에 다른 행사들을 참여하지 못한 점입니다. 2. EEE 304 Signals and Systems II (Tepedelenlioglu)  우리학교에서 통신이론과 유사한 수업입니다. 초반에는 신호 및 시스템 1 에서 배웠던 내용들을 복습하는 시간을 가지고, 이후에 Sampling, Communications theory 등을 배웁니다. 수업 시스템 자체는 사실 아주 마음에 들진 않았습니다. 강의 자료가 없었고, 교수님이 모든 수업을 판서로 작성하셔서 수업 내내 필기를 했던 기억이 납니다. 그래도 교수님이 강의력이 좋으셔서 수업을 따라가는 데는 문제가 없었습니다.    4학점 수업이다 보니 Lab 을 필수적으로 해야하는데, 그게 정말로 귀찮았습니다. Labview 라는 프로그램을 사용해서 배웠던 내용들을 시뮬레이션 돌리는 과제들이었는데, 생각보다 시간을 많이 잡아먹어서 싫었습니다. 그리고 랩실에 가면 다른 학생들이 항상 떠들어서 집중하기도 어려웠습니다. 총 5번의 Lab 을 제출해야 합니다. 과제는 책에 있는 연습문제들을 내주고, 크게 부담되지 않았습니다.   시험은 총 3번을 보고 수업시간에 배웠던 개념들과 기본 개념들 위주로 나옵니다. 보통 교수님이 시험 직전 수업에 예상 문제들을 알려주시는데, 이 문제들과 HW 문제들 위주로 공부하면 수월하게 볼 수 있습니다. 1차 시험 때 공부를 되게 많이 했는데, 생각보다 시험이 쉽게 나와서 그 뒤로는 적당히 공부를 하게 되었습니다. 수업시간에 배운 내용들에서 많이 나오기 때문에 수업을 잘 듣는 게 중요하다고 느꼈습니다. 3. EEE 350 Random Signal Analysis (Maurer)  우리 학교에서 확률과 랜덤변수와 유사한 과목입니다. 정말로 꿀강의입니다. 출석체크를 전혀 안하고, 과제도 책의 연습문제들을 제출하면 되는데 전혀 부담되지 않습니다. 시험은 총 3번을 보고, 매우매우 쉽습니다. 수업을 거의 듣지 않아도 연습문제만 풀 줄 알면 100점 받을 수 있습니다. 그리고 2차 3차 시험은 교수님이 일주일 전부터 시험을 위해 몇 가지 문제들을 풀어주셨는데, 이 문제들만 완벽하게 풀 수 있으면 수월하게 성적을 받을 수 있습니다.   꿀강의긴 하지만 크게 배운 내용은 없습니다. 교수님의 강의력이 아주 좋은 편은 아니라서 수업을 들은 기억이 거의 없습니다. 4. EEE 498 Topic: Python for Rapid Engineering Solutions (Hartin)  이름이 예사롭지 않은데 코딩쪽을 더 심화해서 배우고 싶어서 수강했습니다. 하지만 생각보다 로드가 너무 많아서 드랍 고민을 수없이 많이 했습니다. 과제는 거의 첫 주부터 마지막 주까지 끊임없이 나옵니다. 총 과제가 6번, 플젝이 4번 나왔는데 하나가 끊나면 바로 다음 과제를 내주셔서 정말로 이 과목에 시간을 많이 투자했습니다. 처음엔 기본 파이썬 문법부터 시작해서 Regular Expression, 머신러닝, 기본 리눅스, 그리고 Optimization 등을 다뤘습니다. 교수님이 수업시간에 정말 아주 얕은 지식만을 알려주시고 학생들이 당연히 이해할 것이라고 기대를 하시는데, 모두 따라가기엔 솔직히 벅찼습니다.   또 힘들었던 점이 수업시간이 월수금 오전 8:35-9:25 이라는 점입니다. 초반에는 잘 나가다가, 나중에는 못 일어나서 일주일에 1-2번 꼴로 수업을 나가게 됐습니다. 매 수업 출석을 sign up sheet 에 이름을 써서 제출해야 합니다. 그래서 수업을 많이 빠져서 출석점수 때문에 걱정을 많이 했는데, 마지막 수업 때 교수님이 출석이 성적에 안 들어간다는 말을 듣고 한편으로는 안심했고 한편으로는 속은 느낌이 들었습니다. 결과론적으로 과제와 플젝을 다 제출하고, 시험도 나쁘지 않게 봐서 성적은 잘 받았다만, 시간을 되돌릴 수 있다면 절대 수강하지 않을 겁니다. 5. MAT 343 Applied Linear Algebra (Welfert)  공과대 학생들을 위한 선형대수 수업인데 전혀 부담되지 않은 수업입니다. 시험이 생각보다 너무 쉽게 나와서 놀랐는데, 평균 점수가 너무 낮아 다시 한 번 더 놀랐습니다. 하지만 귀찮은 점이 매주 과제가 나왔다는 점입니다. Webwork 라는 웹사이트에서 문제를 10-20 문제 정도 풀어야 되는데, 난이도가 어렵진 않습니다. 하지만 매주 거의 두 번씩 풀어야 해서 매우 귀찮았습니다. 그것 말고도 Matlab 을 이용해서 기본적인 선형대수 개념들을 활용해서 Lab 을 총 6번 제출해야 했습니다. 시험이 쉽게 나와도 불가피하게 시간은 어느정도 투자를 해야하는 수업입니다.6. PPE 240 Topic: Racquetball  재미로 1학점 수업을 넣었습니다. 생각보다 라켓볼이 재밌진 않았는데, 부담없이 학점을 이수해서 좋았습니다.",국제교육부는 거의 활용하지 않았습니다. 이메일로 이런 저런 Event 들을 많이 보내주긴 합니다. 거의 참여하지 않은 것 같네요.,"ASU 의 SDFC 체육관이 정말 잘 돼있습니다. 헬스장만 총 3개가 있고, 라켓볼, 농구장, 풋살장, 탁구장, 수영장 등 정말 많은 부대시설이 있습니다. 저는 헬스장과 수영장을 많이 활용했습니다. 특히 수영장은 야외에 있었는데, 애리조나의 더운 날씨에서 오아시스같은 존재였습니다. Sunbed 가 여러개 있고 튜브도 많이 있어서 갈때마다 휴양지에 온 기분이었습니다.  학기초에 Passport to ASU 라는 행사가 있는데, 여기에 참여하셔서 관심 있는 동아리에 들어가시면 될 것 같습니다. 저는 AI Club, Epic Movement, ASU Outdoors Club 이렇게 세 군데에 참여했습니다. AI Club 은 인공지능 동아린데 몇 번 세미나를 하는 것 외로는 크게 하는 활동이 없습니다. Epic Movement 는 기독교 동아리인데, 처음에 기독교 동아리인지 모르고 들어갔다가 무교인데도 계속 나가게 되었습니다. 사람들이 좋다보니 계속 나가게 되었는데, 절반 정도 지난 시점에서는 너무 재미가 없어서 되게 현타가 왔습니다. 무교라면 기독교 동아리는 들어가지 않길 바랍니다. ASU Outdoors Club 은 주로 학생들끼리 Hiking 이나 Camping 을 하는 동아리입니다. 보통 금요일 낮에 출발해 일요일에 돌아오는데, 저는 금요일 오후에 수업이 없어서 한 번도 참여를 못하게 됐습니다. 같이 그랜드 캐년, 세도나 등 재밌는 활동을 많이 했는데 참여를 못해서 너무 아쉬웠습니다.",크게 문화충격을 느꼈던 적은 없습니다. 조금 다르다고 느낀 건 사람들이 말을 되게 쉽게 건다는 것입니다.,,"저는 한 학기 동안 그랜드캐년과 세도나를 못가봤습니다. 이게 교환 생활동안 가장 후회되는 것 중 하나입니다. 친구를 많이 사귀지 못했고, 그리고 수업 시간표를 금요일 오후에 잡아놔서 Outdoors Club 에 하는 행사를 참여를 못했습니다. 다른 교환학생들은 최소 한 두번씩은 갔다 왔던데, 너무 아쉬웠습니다. 혼자 가는 것은 무리이기에 친구를 꼭 사귀셔서 갔다오시길 바랍니다.   그래도 비행기를 타고 틈틈히 다른 주들 여행을 했는데, studentuniverse 라는 사이트를 활용하시면 비행기표를 싸게 구할 수 있습니다. 그리고 20discount 를 promo code 를 입력하면 20 달러가 그대로 할인됩니다. (원래는 pay $10 now and save $20 later 이라고 돼있는데, 그냥 20discount 를 입력하면 모든 항공권에 적용이 되더라고요 ㅎㅎ) 그리고 왕복 가격이 편도 두 번이랑 똑같기에 편도 두번 각각에 promo code 를 적용해서 비교적 저렴한 가격에 비행기표를 끊을 수 있었습니다."
