gen_info,env_info,food_info,study_info,office_info,facil_info,mhct_info,help_info,etc_info
"학교 크기는 연대와 비교해도 작을정도로 그리 크지 않은 학교였습니다. 작은 도로를 끼고 양옆으로 학교가 위치하고 있는데 지도를 보고 일주일 정도만 돌아다녀도 지리를 다 익힐 수 있는 정도라고 생각됩니다. 학교 주변에 버스 정류장도 있고 지하철도 다니고 있어서 교통에는 아무런 불편함이 없습니다. 하지만 이런저런 시설들이 많고 쇼핑에 용이한 Loop라고 불리는 다운타운으로 부터는 20분정도 떨어져 있다는 점이 불편하다면 불편한 점이라고 할 수 있습니다. 1월달에 학교를 방문한 저는 한국에서의 추위와는 비교도 할 수 없을 정도의 추위에 깜짝 놀랐습니다. 4, 5월달까지도 아우터를 입어야 할 정도로 춥고 눈도 많이 옵니다. 가시게 된다면 가을하기를 추천합니다.","주변에는 별 이렇다할 만한 시설이 없습니다. 약간은 번화가에서 떨어져있는 지리적 위치땜문에 밤이 되면 학교 밖을 나서는 일이 좀 위험하다는 생각이 들정도 입니다. 또 학교 근처에 흑인들이 많이 거주하고 있어서 해가 지고 나서 9시 정도 이후에는 전반적으로 외출을 삼가하는 것이 안전합니다. 대신 학교가 Chicago에 위치하고 있기 때문에 조금만 번화한 곳으로 나가게 되면 누릴수 있는 혜택이 많아집니다. Chicago 교향악단의 오케스트라 연주를 감상할수도 있고 Art institute of Chicago에서 미술 작품을 감상할 수도 있으며 Field 박물관이란 곳에서 자연과 문화환경에 관련된 공부를 할 수도 있습니다. 그외에도 천문대도 있고 공원도 잘 꾸며져 있어서 조금만 찾아다니는 노력을 한다면 한국에서 쉽게 누릴수 없는 경험을 할 수 있습니다. 또한 학생 할인을 많이 해주는 편이어서 학생할인을 꼭 이용하기를 추천합니다. 스포츠를 좋아하는 학생이라면 시카고 불스의 농구경기, 화이트 삭스와 컵스의 야구경기 등을 학교를 통해 싼가격에 관람할 수 있기도 합니다. 쇼핑같은 경우에는 백화점이 곳곳에 위치해 있으므로 언제든지 즐길 수 있습니다.",MSV라는 기숙사에서 거주하게 되는데 2인 1실로 사용하게 됩니다. 저는 추운계절에 갔었기 때문에 난방을 걱정하였는데 반팔 반바지만 입고 있어도 될 정도로 난방을 잘 되는 편입니다. 전반적으로 방음도 잘되고 난방도 잘되고 환경은 좋았다고 생각됩니다. 총 4구역으로 기숙사가 나누어져있는데 구역별로 신축 건물과 구 건물이 있어서 자신이 원하지 않는다면 더 좋은곳으로 이동을 요구할 수도 있습니다. 룸메이트의 경우 외국인이 배정이 되었는데 한국 사람들과 교류를 많이 하기보다는 외국인 룸메이트와 많은 대화를 하고 활동을 하는 것이 영어 공부에 도움이 될것입니다. 물론 룸메이트에 불만이 있다면 교체 가능합니다. 식사의 경우 학교에 있는 Commons라는 식당에서 해결하게 됩니다. 식사에 여러가지 옵션이 있는데 무제한을 선택할 경우 가격도 비싸고 친구들을 사귀게 된다면 밖에서 식사를 할 경우가 많이 생기게 되므로 무제한 보다는 한달에 몇끼로 횟수가 정해진 것을 선택하는 것이 좋습니다. 식사의 질은 매우 좋은 편이며 육류뿐만 아니라 야채 및 과일도 많이 나옵니다.,수업은 한국에 비해서 조금 편하다는 생각이 들 정도로 여유있게 진행됩니다. 수업시간에 무조건 진도만 나가지 않고 많은 이야기를 들려주고 학생과 토론을 하는 방식으로 수업이 진행되어서 그렇게 느꼈다고 생각합니다. 과제는 한국의 수업들과 비슷한 수준으로 나왔다고 생각되고 생각보다 과제에 부여되는 점수가 많았다고 생각합니다. 영어에 자신이 있다면 충분히 쉽게 수업을 들을 수 있을 것입니다. 도서관의 경우 그리 크지 않은 규모이고 한국처럼 조용하기만한 분위기가 아니라서 많이 활용하지 않았습니다만 시설은 좋은 편이라고 생각합니다.,처음에 학교에 와서 관련된 서류를 제출하고 학기가 끝날때 성적표에관해서 물어보는 일 외에는 방문한 적이 없습니다. 학생들이 친절하고 담당교수도 상담을 잘해주기 때문에 그들을 통해 도움을 받는 것이 더 편하다고 생각합니다.,수업을 듣고 미국내 여행을 다니는 것을 주 목적으로 하고 갔기 때문에 학교에 그리많은 관심을 가지고 둘러보지 못했습니다. 학교에는 여러가지 시설이 갖추어져 있습니다. 큰 수영장도 있고 농구코트도 있으며 야구를 할수 있는 시설도 잘 갖추어져 있습니다. 물론 축구장도 보유되어 있습니다. 그렇기 때문에 운동을 좋아한다면 충분히 운동을 즐길 수 있는 환경이 마련되어져 있습니다. 종교적인 활동도 꽤나 활발한 편이었는데 현지 학생들과 함께 친해질 수 있는 좋은 방법이라고 생각됩니다. 동아리의 경우에는 활동을 한 것이 없어서 잘 모르겠으나 학기 초에 대대적으로 동아리 가입을 권유하는 활동이 많이 있는것 같습니다.,해외에서 살아본 경험이 있어서 특이사항 없었습니다.,아무래도 룸메이트나 학교 관련인들 Faculty들에게 쉽게 도움을 받을 수 있습니다. 서비스 정신이 투철한 편이어서 문의사항이나 불만사항이 있다면 정말 열심히 도와줍니다. 수업적인 면이라면 왠만한 교수들이 다들 면담을 하는것을 즐긴다는 생각이 들정도로 오픈마인드이기 때문에 교수들과 대화를 많이하는것을 추천합니다. 또한 담당교수가 한명씩 지정이 되는데 그 교수님과 친해지면 많은 도움을 받을 수 있습니다. 한교에는 주기적으로 순찰을 도는 세큐리티들이 많으므로 혹시 안전에 위험을 느낀다거나 도난을 당한다면 그들을 찾아가면 친절하게 도움을 줍니다.,공개된 장소에서 술을 마시고 취한체 거리를 활보할 경우 잘못하면 체포될 수 도 있습니다. 또한 나이가 안될경우 절대 술을 마시지 않길 바랍니다. silvermind4e@naver.com
"IIT는 종합대학은 아니라서 캠퍼스 자체는 그리 크지 않지만, 시카고 downtown과 가깝고, 학교 내로 지하철이 들어와서 교통이 굉장히 편리합니다.
그리고 윈드시티라는 별명에 걸맞게 바람이 많이 불지만, 한국과 달리 습하지 않아서 겨울을 제외하면 살기에는 좋은 편입니다.","학교 주변은 흑인 동네라 조금 위험하긴 하지만, 근처에 화이트삭스 홈구장이 있고, 시내에 나가면 유명한 건축물이나 박물관이 많아서 놀기에는 매우 적합합니다. 우선 시카고가 지하철이 매우 발달해있어서 학기 시작전에 발급하는 교통카드를 이용하면 무제한으로 버스와 지하철을 이용할 수가 있는데, 이를 가지고 시카고 구석구석을 여행해보는 것도 다른 지역에서 공부하는 학생들에 비하면 매우 큰 장점입니다. 또한 버스나 지하철을 이용해서 조금만 나가면 근처에 싼 마트가 있어서 생활용품이나 식재료를 사러 가기에도 편리합니다.","방문학생으로 지원해서 가게되면 학교 기숙사를 이용할 수가 있는데, 세가지 정도 고를 수가 있는데, 저는 가장 저렴한 MSV를 이용했습니다. 교내에서 가장 이동하기 편한곳에 위치하였고, 여러 학생들과 교류가 가장 잦은 곳이라 생활하는데 있어서도 좋습니다. 또한 기타 부대시설도 괜찮은 편이라 비용이 부담된다면 적극 추천해드립니다. 
그리고 Meal plan은 다른 분들 글을 봐도 아시겠지만, 여러 plan 중에서 create your own으로 선택하는 것이 제일 합리적입니다. 저는 학생식당을 매일 꾸준히 이용하였는데, 점심 저녁은 물론, 아침식사도 왠만하면 이용하려고 했습니다. 그렇게 이용해도 거의 부족하지 않고, 만약 부족하면 남는 친구들 식사권을 이용하기도 할 수 있어서 좋습니다. 그리고 학생식당이 부페식인 것이 매우 큰 장점이고, 아침식사는 점심 저녁과 다르게 전형적인 미국식 아침을 즐길 수 있다는 점을 알아두시면 좋을 것 같습니다.","저는 총 12학점을 신청하였고, 전공 3개, 교양 1개과목을 수강하였는데, 전공 수업은 생각보다 학생들이 열심히 하는 학생들이 드물고, 외국인 유학생들이 많아서 성적을 받기에는 조금만 열심히 하면 충분히 잘 받으실 수 있습니다. 교양과목은 거의다 non-native writing수업을 수강하는데, 한국학생들이 매우 수강을 많이 하여 거의 쉬는 시간이라고 보셔도 무방합니다.
도서관은 그리 크진 않지만 자리가 모자르지는 않고, 생각보다 아늑하고 공부가 잘 되는 편입니다. 프린트나 복사기를 이용하기도 편리하고, 세미나 룸도 있어서 크기에 비하면 효율적으로 이용하실 수 있습니다.",,"한 학기만 있을 경우 동아리는 거의 하지 않고, 남자의 경우 외국인 유학생들끼리 축구모임을 자주 갖는데, 저도 거의 매주 참여하여 친목도모을 할 수 있었습니다. 동아리에 참여하지않아도 교내 행사가 많은 편이라 행사에 적극적으로 참여하시면 좋은 추억을 많이 남길 수 있습니다.
교내 부대시설은 주로 학생회관에 몰려있고, 행정쪽은 본관이나 IIT타워를 이용하시면 되는데 이용하는데에는 크게 어렵지 않습니다. 그리고 학교에 체육관이 하나 있는데, 무료로 헬스장이나 스쿼시, 수영, 농구 등 여러 시설을 이용할 수 있는 것은 큰 장점입니다.","시카고는 재즈의 도시 답게 흑인들이 굉장히 많아 인종차별이 적을편이라고는 생각이 되지만, 백인들은 주로 downtown 북쪽, 흑인들은 주로 남쪽에 거주하고, IIT는 남쪽에 위치해서 조금 위험하긴 합니다. 그리고 눈에 띄지 않게 조금씩은 차별이 있기때문에 주로 외국인 유학생과 어울리기가 쉽습니다. 하지만 그 차별 정도는 국내에서 우리가 동남아인이나 중동쪽 사람들 생각하는 정도라고 생각하시면 될 것 같습니다.","부대시설 얘기할 때 거의 말씀드렸지만, 교내에 도움받을 수 있는 곳이 잘 되어있어서 모르는 부분도 친절하게 얘기해주기때문에 어렵지는 않습니다. 다만 미국은 우리나라처럼 온라인서비스나 즉시 해결해주는 서비스가 발달해있지는 않아서 되도록 본인이 발품팔아서 직접 가서 조르면 친절하게 잘 해주니 이 점만 주의하시면 될 것 같습니다.","커다란 캠퍼스를 생각하고 웅장한 캠퍼스 라이프를 하기는 힘들지만, 굉장히 놀기 좋고 학점을 받기도 크게 무리없는 곳입니다. 즐겁고 보람찬 생활을 할 수 있으니 많은 관심을 가지고 알아보기실 바랍니다."
"시카고 다운타운에서 남쪽으로 전철 정류장 2개정도 아래에 위치해 있어서 생활하기 매우 편한 편입니다. 다만 학교를 기준으로 아래로 내려갈 수록 위험한 동네이므로 학교 캠퍼스 안에 있는 green line을 바로 이용하여서 다운타운으로 이동하는 것이 좋습니다. 실제로도 캠퍼스 바로 옆블럭에서 위험한 범죄사건이 일어나므로 매우 조심해야 합니다. 캠퍼스 안에서는 public safety를 믿고 안전하게 생활하실 수 있으나 캠퍼스 주변이 위험지역이므로 거의 학교내로 들어오는 버스29번을 타거나 green line, red line 전철을 타시고 바로 다운타운으로 이동하는 것이 좋습니다.
 시카고의 기후는 상대적으로 겨울이 매우 길어서 10월말부터 3월 초까지 눈이 오므로 가을학기에는 도시가 거의 눈에 덮여 밖에 사람이 다니지 않는 고요하고 심심한 학기가 될 수 있습니다. 눈이 많이 오는 경우에는 무릎을 넘어서까지 쌓이지만 시카고는 워낙 눈이 많이 오는 도시라서 아무리 폭설이 내리더라도 일상생활에 불편함이 없이 밤사이에 다 눈을 처리해서 치워버립니다. 눈이 항상 쌓여있다고 보면 되므로 방수되는 신발을 필히 신고 다녀야하며 바람이 많이 부는 도시이므로 눈만 내놓고 따뜻하게 방한되는 옷을 입으면 크게 서울의 추위와 다르게 느껴지지는 않습니다. 4월말까지 춥다가 갑자기 봄이 없이 여름이 옵니다. 시카고의 여름은 더운 편이나 매우 화창한 편이며 습기가 없고 미시간 호수가 바다와 같은 역할을 하기 때문에 바람의 도시인 만큼 바람이 선선하게 불어서 굉장히 쾌적한 생활을 하기에 좋은 계절입니다.","green line에서 한정거장 거리에 roosevelt에 있는 jewel과 target에서 생필품을 구입하여 생활하였습니다. 대학 주변 환경은 별로 좋은 편은 아니지만
시카고 다운타운에서 비교적 가까운 학교이기때문에 주로 학생 친구들과 다운타운으로 나가서 노는 경우가 많았습니다.","기숙사 종류에는 msv와 ssv,gonsalas hall이 있는데요, msv가 가장 학생들간에 교류가 많이 일어나는 곳이라고 생각됩니다. 주로 기숙사 같은 층에 묵는 친구들과 친해지는 경우가 많으므로 조금 독립적이고 아파트형식인 ssv와 gonsalas보다는 왁자지껄하고 그룹지어 많이 노는 msv가 친구들과 어울려 놀기 좋은 곳입니다. 이 학교에는 교환,방문학생 외에도 영어연수프로그램, 인턴프로그램으로 한국학생들이 많이 오기때문에 상대적으로 msv에는 한국인이 많기는 하지만 자신의 선택에 따라서 외국학생과 어울리기를 원한다면 한국인들이 모여있는 무리에 들어가는 것보다 독립적으로 생활할 것을 추천드립니다. 룸메도 처음에 배정받았을 때 불편하다는 생각이 드시면 바로 룸체인지 신청을 하시는 것이 좋습니다.
기숙사에 묵게 되면 meal plan을 신청하여서 주로 기숙사 앞 건물에 있는 commons에서 식사를 하게되는데 학교 주변에 사먹을 곳이 별로 없고 장보러 가는데 기차나 버스를 타고가야하는 번거로움이 있으므로 거의 학교학생들 대부분이 meal plan 으로 식사를 합니다. 이 학생식당에서 식사를 하다보면 거의 전교생 대부분을 볼 수 있으므로 학교에 적응하기 더 쉬울 것으로 생각됩니다.",수업은 크게 다른 것이 없습니다. 영어 실력을 늘리거나 색다른 수업을 듣고 싶은 분에게는 토의 수업이 많은 1학년 과목introduction to ~ 과목이나 프로젝트를 수행하는 ipro 과목을 추천합니다. 실험수업은 실험report쓰는 것이 어려운 편이라고 생각되므고 너무 많은 실험과목을 듣는 것은 힘들 수 있습니다. English Writing 수업도 writing 연습을 많이 할 수 있는 유용한 과목입니다.,international center는 굉장히 친절하고 학교생활 전반에 도움을 많이 주는 곳입니다.,"학교에 있는 gym에서 수영과 헬스, 스쿼시 요가 등을 할 수 있습니다. 동아리는 종류가 많은 편은 아니지만 engineers without borders라는 동아리에서 봉사활동이나 사회적인 프로젝트를 학생들이 직접 기획해서 매주 모이는 활발한 활동을 하므로 참여를 열심히 한다면 매우 의미있을 것이라고 생각합니다. 공식적인 동아리 외에도 비공식 모임 coffee club에서는 2주일에 한번씩 시카고에 있는 예쁜 카페와 특별한 가게에 놀러가며 친목을 다지는 매우 즐거운 활동이 될 수 있습니다.
학기 초에 fratenity를 모집하는데, 이 모임은 기숙사도 따로 있고 가족과 같은 매우 친밀한 관계를 쌓는 모임이므로 한국인이 많은 이 캠퍼스에서 외국학생들과 더 어울리고 싶은 사람에게 매우 추천합니다.",아무 스스럼없이 옆에 있는 사람에게 말을 겁니다.,"학교 내의 writing center를 잘 활용하면 매우 도움이 될 것입니다. 영어 작문 실력을 늘리고 싶으시다면 writing center를 자주 찾아가서 첨삭을 받으면 한국에서 배웠던 글쓰기와는 확연히 다른 영어 글쓰기를 제대로 배울 수 있습니다. 특히 resume나 paper를 쓰는 방법을 정통으로 배울 수 있기때문에 원어민 교수, 강사에게 수준높은 영어 글쓰기를 배울 수 있을 것입니다.
학교생활이나 학교서류에 관한 것은 international center에서 거의 대부분의 도움을 받을 수 있습니다.
비상시나 위급한 도움이 필요할 때에는 교내 public safety에 연락하시면 됩니다.",
