gen_info,env_info,food_info,study_info,office_info,facil_info,mhct_info,help_info,etc_info
"디킨슨 칼리지는 펜실베니아 주의 칼라일(Carlisle)이라는 작은 시골 마을에 위치해 있다. 미국 북동부의 기후가 그렇듯, 날씨는 그리 좋지 않다. 학생들 말에 따르면 칼라일의 지형적 특성상 연중 비가 많이 내린다고 한다. 실제로 본인이 파견된 가을 학기에는 거의 매일 비가 부슬부슬 내려 방수가 되는 바람막이 옷과 레인부츠가 유니폼이나 마찬가지였다. 겨울에는 춥고 눈이 많이 내린다고 하나, 파견 당시는 이상기후 때문인지 평년보다 따뜻해고 눈도 10월 말에 한 번만 오고 말았다. College 특성상 학교 크기는 전교생이 2,000명 밖에 안 될 정도로 매우 작다. 대부분의 수업이 많아야 20~25명 정도의 학생이 함께 듣는 정도이다. 하지만 학교 건물들이 마을 전역으로 넓게 배치되어 있기 때문에 체감 규모는 그리 작지 않다.","칼라일은 작고 평화로운 시골 마을이다. 그 흔한 스타벅스 하나도 없다. 다운타운이라고 해도 우리나라 시골의 읍내 수준에도 못 미칠 정도이다. 하지만 오히려 그렇기 때문에 로컬 레스토랑과 로컬 샵들에 더 애착이 간다. 실제로 로컬 레스토랑의 수준은 나쁘지 않고 분위기도 무척 좋다. 학교에서 약 10분거리에 있는 High St.과 조금 더 가면 있는 Hanover St.이 칼라일의 중심지이다. 마을이 작기 때문에 왠만한 거리는 다 걸어서 이동할 수 있어서 좋다. 디킨슨 학생들(Dickinsonian)이 자주 찾는 곳으로는 Mt.Fuji(스시, 일식), Issei Noodle(라면, 볶음밥, 아시아 퓨전), Amy''s Thai(태국 요리), Miseno(피자), Massey''s Frozen Custard(아이스크림), Back door Cafe(카페), Alibis(바) 등이 있다. 걸어서 20분 거리에 Walmart와 Giant(식료품점)이 있는데 가격면에서는 Walmart가 조금 싸지만 신선도면에서는 Giant가 낫다. 특히 칼라일에서 좋았던 곳은 Dana Hall 맞은편에 있는 Carlisle Public Library였다. 학교 도서관과는 또 다른 매력이 있는 곳으로 무척이나 푸근해 마치 할아버지의 서재에 들어 온 느낌이다. TV에서만 보던 벽난로, 푹신한 소파에 앉아서 어느 새 책과 함께 잠이 드신 할아버지, 큰 눈을 굴리며 열심히 엄마와 함께 책을 읽는 아이 등 도서관의 모든 풍경이 참 아름다웠다. 또 가끔 아침 조깅을 하곤 했는데 아침 안개를 가르면서 뛸 때의 그 상쾌함은 아직도 잊을 수가 없다. 

마을이 워낙 작기 때문에 큰 사건 사고가 발생하지는 않는 편이다. 가끔 사건이 발생하면 주의하라고 학교 보안 당국(DPS)에서 메일이 날아오곤 했지만 다른 지역에 사는 친구들과 비교할 때 칼라일은 정말 안전한 곳이다. 그래도 미국인들은 평상시 밤이면 모두 집에 일찍 들어가기 때문에 밤 늦게는 되도록이면 혼자 돌아 다니지 않는 것이 좋다. 

옷이나 신발이 필요한 경우, 직접 쇼핑을 하고 싶으면 해리스버그(Harrisburg)로 나가는 방법 밖에 없다. 해리스버그는 차로 약 40분 떨어져있는 펜실베니아의 주도로 칼라일에 비하면 큰 도시이다. 학교에서 매주 금요일과 일요일 해리스버그까지 나가는 셔틀을 운행하기 때문에 돈을 지불하고 이용하면 된다. 그 외에 가끔씩 HUB(학생회관)에서 옷과 신발, 악세사리 등을 판매하기도 하는데 대부분은 인터넷 쇼핑을 많이 한다.","디킨슨 칼리지는 residential college로 전학생이 기숙사 생활을 해야 하는 학교이다. 사실 캠퍼스 대부분이 기숙사 건물들로 이루어져 있다. 보통 학년별로 기숙사가 나뉘는데 1-2학년은 on campus, 3-4학년은 off campus housing에 거주하는 경우가 대부분이다. 본인의 경우 HUB에서 10분 정도 떨어진 factory apartment에 배정되었다. 아파트형 기숙사였기 때문에 크기가 일반 기숙사보다 크고 거실과 부엌이 갖추어져 있는 점이 좋았으나 따로 관리인이 없었기 때문에 스스로 청소해야 한다는 점이 조금 불편했다. 하지만 3-4학년이 주로 거주했기 때문에 fire alarm 외에 시끄러운 소동이 발생하지 않고 전반적으로 조용해서 좋았다. 

모두가 기숙사에 살기 때문에 meal plan도 무조건 신청해야 한다. meal plan에는 traditional, flex I, flex II 세 가지 유형이 있는데 가격의 차이는 없다. traditional은 자동으로 아침, 점심, 저녁에 따라 포인트가 차감되는 시스템이고 flex는 내가 먹을 때에만 포인트가 차감되는 유형이다. 포인트는 dining hall, union station(흔히 Snar라고 부름), underground, quarry, biblio cafe 에서 쓸 수 있다. Dining hall은 메인 식당으로 부페형식으로 운영되는데 메뉴가 rotation되기 때문에 약간 질릴 수가 있다. 매번 dining hall에서 식사를 할 계획이라면 traditional이 적합하다. Union station은 샌드위치와 버거, 스낵 종류를 파는 곳인데 즉석에서 만들어주기 때문에 따뜻한 음식을 즐길 수 있는 점이 좋다. Underground는 스시가 주 메뉴이다. Quarry는 디킨슨 학생들이 애용하는 카페로 각종 베이커리와 커피, 음료, 피자를 파는 곳이다. Biblo cafe는 도서관 내에 위치한 카페인데 전반적으로 Quarry가 맛이 훨씬 좋다. 다양한 카페테리아에서 식사를 하고 싶다면 Flex 유형을 선택하는 것이 좋다. Flex I과 II는 쓸 수 있는 포인트와 부수적으로 주어지는 Declining Balance에서 차이가 나는데 자신이 포인트와 balance 어느 쪽을 더 많이 쓸 것인지에 따라 결정하면 된다. Declining Balance는 내 계좌에 deposit된 현금으로 생각하면 되는데 devil''s den(학교 편의점)과 bookstore에서 구매는 물론 각종 비용까지 지불할 수 있다. 

디킨슨의 식당에 대해서는 평가가 다양하나 ''먹을 만하다''는 의견이 대부분이다. 본인 역시 처음 한 달은 미국음식의 강하고 자극적인 짠 맛과 단 맛에 고생을 했지만 이후에는 어느덧 적응을 하여 골고루 잘 먹게 되었다. 특히 디킨슨의 Halloween Dinner와 Christmas Dinner는 평소에 학식을 먹지 않는 학생들까지 모두 와서 먹을 정도로 음식 맛이 제일 좋고 종류도 다양하게 갖추어진 큰 연회가 열리니 꼭 놓치지 않기를 바란다. 

한국 음식이 그리워진다면, 근처에 한국 음식점이 없어서 직접 해먹는 수밖에 없다. 한국 식료품점 역시 차타고 가야 하는 위치에 있기 때문에 주로 온라인 마트를 이용했다. (http://www.hmart.com)","학교가 작기 때문에 전공 수업이 다양하게 열리지 않지만 liberal arts college답게 다양한 과목의 수업이 개설되어 있다. 특히 디킨슨은 language class가 유명한데 월~금 매일 한 시간씩 하는 수업 외에도 language table, TA 제도, 각종 행사 등을 개최해 외국어를 끊임없이 접할 수 있는 기회를 많이 만든다. 또한 music class의 경우 원한다면 악기를 빌려서 들을 수 있고 암벽타기, 발레, film making 등 다양하게 자신의 소질과 취미생활을 개발할 수 있는 수업이 많이 갖추어져 있다.  

본인은 전공 두 과목, 중국어, 체육 수업 총 4과목을 수학했다. 

전공 과목들은 사회과학 특성상 reading 양이 무척이나 많아 거의 매일을 책과 논문을 읽으며 보낸 기억이 난다. 이것을 안 해갈 수도 없는 것이 시험에 모든 것들이 다 나오고 특히 토론 수업의 경우에는 리딩에 기초해 진행이 되고, 교수가 이름을 불러서 질문하기까지 했기 때문에 항상 게을리 하면 안 되었다. 

International Terrorism : 강의식으로 진행이 되어 한국에서의 수업 방식과 크게 다르지 않았지만 학생들의 적극적인 질문 참여, 그리고 교수와 학생 간의 수평적인 관계가 인상깊었다. 교수님이 전직 CIA 비밀요원이었다는 사실이 흥미로웠다. 

U.S. diplomatic History : 토론식 수업으로 시험은 없었지만 과제량과 리딩이 많아 매우 고된 수업이었다. 또 교수님이 직접 이름을 호명해 질문을 하기 때문에 항상 긴장감이 감돌았다. 매주 교실 밖 강의를 듣고 감상문을 제출하고 book review, google map project, final paper 등 과제가 끝나면 또 다음 과제가 있었기 때문에 잠시도 쉴 수가 없었다. 특히 미국 역사를 잘 모르는 외국인 입장에서 수업을 따라가기가 힘들어 더 많이 시간 투자를 해야했다. 처음에 토론에 참여하기 힘들어하는 모습을 보고 교수님께서 직접 불러 조언을 주시고 보고서를 쓸 때마다 방향성을 제시하고 항상 feedback을 주시는 점 등 학생 하나하나에 신경써주시는 것이 한국과 다르다고 느꼈다. 토론수업이라 조금 겁먹었는데 사실 듣고보면 다른 학생들도 대단한 것을 말하는 것이 아니었기 때문에 참여에 의의를 두고 일단 내 생각을 말하는 것이 중요하다는 것을 느꼈다. 마지막 20장 분량의 final paper는 며칠 밤을 새면서 작성했는데 그만큼 자료조사를 열심히 하고 원문까지 찾아 대조해가면서 제대로 공들여 쓴 보고서는 처음이었던 것 같다. 정말 고생을 많이 했지만 그만큼 얻어간 것이 많은 수업이었다. 나중에 알게 된 것이지만 이 수업을 가르치는 교수님은 디킨슨에서 고되고 힘들기로 악명높아 학생들이 피하는 교수님이라고...

Chinese 101 : 사실 스페인어를 듣고 싶었지만 본교 학생들의 수요가 높기 때문에 교환학생은 들을 수 없다는 통보를 받고 중국어를 선택했다. 중국 원어민 교수님이 가르치기 때문에 오히려 한국에서 배우는 것보다 더 좋았던 것 같다. 매일 수업과 퀴즈가 진행되기 때문에 꼬박꼬박 복습을 할 수 있었다. 수업 외에도 중국어학부에서 마련하는 시낭송회, moon festival, chinese ballet concert 등 다채로운 행사에 참가하면서 중국어를 재밌게 배울 수 있었다. 

Aerobic activities : 체육수업은 중간고사를 기점으로 1st term과 2nd term으로 나뉜다. 따라서 한 학기에 원한다면 체육과목을 두 개 수강할 수 있는 것이다. Aerobic class는 우리가 생각하는 ''에어로빅''이 아니라 말 그대로 유산소 운동 시간이다. 특별한 것이 없었고 그냥 gym에 가서 수업시간 동안 운동기구를 한 시간 이용하면 되는 아주 간단한 수업이었다. 

도서관 : 디킨슨 도서관은 여러번 우수 도서관으로 선정되었는데 그만큼 훌륭하다. 연세학술정보관보다 규모는 작지만 도서관에 걸맞는 시설과 인테리어를 갖추고 있어 모두가 좋아하는 곳이다. 건물이 통유리로 되어 있어 해가 뜬 날이면, 창살로 들어온 햇빛을 받으며 푹신한 소파에 기대어 책을 읽기에 아주 그만이다. 스터디 공간도 여러 군데 마련되어 있어 친구들과 함께 공부하기에도 좋다.","Stern Center에서 국제학생들을 담당하는데 학기 중에 크게 이용할 일은 없었다. 특히 교환학생의 경우는 그 수가 작아서 그런지 교환학생을 위한 행사가 학기 초 외에는 자주 개최되지 않아 조금 아쉬웠지만, 항상 질문에 친절히 답해주며 학생들의 안부를 물어 신경써주는 모습이 고마웠다.","인문학 또는 사회과학 전공자의 경우 essay를 제출해야하는 경우가 상당히 많은데 이 경우 학교에서 운영하는 writing center를 이용하기를 권한다. 외국인학생 외에 원어민들도 에세이를 제출하기 전에 자주 이용하는데 개요를 잡는 것부터 문법 검사까지 함께 도와준다. writing center를 이용하게 되면 그 수업의 교수에게 writing center 이용 사실이 전달되는데, 일부 교수님들은 이를 두고 성실성을 판단하기도 한단다. 

도서관 외에 또 잘 되어 있는 곳은 fitness center이다. 오리엔테이션만 하고 나면 바로 이용할 수 있다. 왠만한 헬스클럽 못지않게 넓고 쾌적하며 많은 운동기구를 보유하고 있다. 미국 음식 자체가 칼로리가 높기 때문에 남녀노소 모두 열심히 운동하는 모습을 볼 수 있다. 

동아리는 학기 초반에 데스크를 만들어 부원을 모집한다. 본인은 한 학기만 하기 때문에 들지 않았지만 친구를 사귀기에는 더할 나위 없이 좋은 것 같다. 

이 외에도 학교에서 마련하는 행사가 많으니 항상 게시판과 메일을 자주 확인하길 권한다. 나가서 즐길 거리가 많지 않기 때문에 학교에서 하는 행사에 자주 참여하는 것이 좋고, 실제로 대부분의 학생들이 그렇게 보낸다. 특히 저렴한 가격에 DC와 NY에 다녀올 수 있는 기회가 있는데 여행 프로그램이 잘 짜여져 있으므로 추천한다.  

또한 학교 보안 당국인 DPS는 학생들의 안전을 책임지는데, 늦은 시간에 혼자 기숙사에 돌아가기가 걱정된다면 DPS에 ride 서비스를 요청할 수 있다. 무료이며 이용횟수에 제한도 없으므로 부담없이 이용할 수 있다. 

디킨슨은 등록금이 1년에 6000만원이 넘는 ''부자학교''이다. 하지만 그만큼 그 돈을 학생 복지를 위해, 학생들을 위해 쓰고 있으므로 학교에서 제공하는 여러 혜택들을 절대 놓치지 않기를 바란다.","특별한 문화 충격은 없었지만, 우연치 않게 남녀혼숙 기숙사에 배정되었다. 실제로 남녀같이 방을 쓰는 미국인들은 거의 없었는데 중국인의 경우 친한 남녀끼리 같이 방을 쓰는 경우가 종종 있었다. 본인 역시 룸메이트 모두 중국인이었다. 크게 거슬리는 점은 없었지만 아무래도 같이 화장실을 써야했기 때문에 언제나 신경이 쓰였다. 그래도 이전에는 중국인들에 대해 약간 안 좋은 선입견을 갖고 있었는데 같이 생활하면서 오히려 같은 아시아인끼리 느낄 수 있는 동질감, 유대감을 통해 중국인들에 대해 좋은 인식을 갖게 되었다. 

칼라일이 작은 마을이어서 그런지 몰라도 눈인사, 문을 잡아주는 것은 기본이고 모르는 사람이어도 서로 시시콜콜한 얘기를 할 수 있다는 것이 좋은 문화 충격이었다. 친절한 사람들 덕분에 소소한 행복을 느낄 수 있었다. 그래서 오히려 한국에 돌아왔을 때 여유가 없는 사람들의 딱딱한 얼굴, 문을 홱 밀치는 모습에서 역으로 문화충격을 받았다.",교환학생 생활 중 질문이 있으면 언제든지 Stern Center의 담당 직원에게 문의하면 친절하게 대답해줄 것이다. 본인은 우연히 디킨슨의 한국 유학생들을 알게 되어 그들에게 도움을 받을 수 있었다. 또한 현지 디킨슨 학생들 역시 많은 도움이 되었다. 아무래도 같은 학생의 입장에 있기 때문에 학생들을 사귀는 것이 현실적으로 많은 도움이 된다.,"교환학생 지원시 디킨슨을 선택한 이유는 한국인이 적고, 시골에 위치해 있어 언제 내가 시골에 살아보겠느냐 하는 차원에서였다. 그러나 처음에 한국인 유학생들을 만나기 전에는 무척이나 힘들었다. 또 학교가 작기 때문에 우리학교처럼 교환학생을 위한 단체가 없기 때문에 적응하는 데도 조금 시간이 걸렸다. 게다가 여태까지 도시에서 살다가 처음 시골에 살다보니 그 답답함이 상상을 초월했다. 상상했던 것, 기대했던 것은 역시 현실과는 많이 달랐다. 교환학생 생활 역시 마냥 재밌는 것만은 아니었다. 특히 끊이질 않는 과제와 리딩에 한숨을 푹푹 내쉬고 혀를 내두른 적이 한 두번이 아니었다. 대학에 입학할 때는 우리나라 학생보다 못할지라도 졸업할 때는 왜 미국인들이 뛰어난 지 알 수 있을 만큼 대학생활 중 학업이 엄청난 비중을 차지했다. 그래도 중간중간 휴일에 다닌 여행이 있었기에 그나마 재충전을 할 수 있었다. 이미 예전에 미국 여행을 했었기 때문에 주요 관광지보다는 미국 친구 집에 초대되어 그들의 삶을 체험했던 것이 제일 기억에 남는다.  

역시 시간이 지나면 기억은 아름다워지는 것 같다. 다사다난했던 교환학생 생활이었지만, 지금은 그 모든 힘든 것들을 이겨낸 내 자신이 자랑스럽고 또 거기 두고 온 친구들이 그립다. 다시 한 학기를 보낸다면 더 잘해낼 자신도 있다. 처음은 분명히 많은 시행착오가 자리한다. 하지만 좌절하지말고 현명하게, 그리고 즐겁게 이겨낸다면 분명 보람찬 교환생활을 하게 될 것이다."
