gen_info,env_info,food_info,study_info,office_info,facil_info,mhct_info,help_info,etc_info
학교는 그렇게 크지도 작지도 않아요. 학기 초에 자전거 저렴하게 살 수 있는 행사가 있어서 나름 저렴하게 샀지만 한두달 타고 고장나서 그 뒤로 걸어다니고 셔틀버스 타고 다녔는데 그렇게 힘들지 않았어요. NAU학교는 아리조나의 flagstaff라는 도시에 위치해 있는데 학교가 산 위에 있다 보니 조금 걷거나 뛰어도 숨이 금방 차고 낮에는 해가 뜨겁게 날씨가 좋지만 밤에는 엄청 추워집니다. 그래서 낮에는 선글라스 꼭 써야 할 거에요. 저는 가을학기에 가서 대부분 날씨가 정말 좋았지만 flagstaff는 4월이나 5월까지 눈이 온다고 합니다. 11월 까지는 낮에 햇빛도 좋아서 가만히 광합성도 하고 벤치에 앉아서 얘기도 하고 과제도 하기에 정말 좋았어요. 겨울에는 11월 말 즈음 되니 눈이 많이 쌓이도록 내리고 바람도 불어서 눈보라처럼 심하게 내린 적도 있었습니다. 눈이와서 학교 수업도 종종 취소되었어요. 저는 아리조나라고만 생각해서 확실히 알아보지 않고 여름 옷들만 잔뜩 가져가서 겨울 옷들 까지 다 사야하는 상황이었기 때문에 혹시 지원하시게 되면 겨울 옷 단단히 챙겨가시면 좋을 것 같습니다. 학교 주변에는 버스로 3시간 정도 거리에 pheonix라는 도시가 있는데 이곳은 정말 정말 더운 곳이기 때문에 겨울에도 낮엔 따뜻하고 밤에 쌀쌀한 정도여서 자주 놀러가시기에 좋고 그랜드캐년이나 세도나같은 관광지도 근처에 있어서 꼭 가보시면 좋을 것 같아요.,"학교 내에서는 날씨가 좋은 날이면 잔디밭에 누워있거나 햇볕을 쬐는 사람들을 많이 볼 수 있어요. 저는 한국에서 햇볕이 따갑고 싫어서 피해다녔었는데 이곳은 굉장히 따사로운 햇살 느낌이라서 저도 일부러 볕드는 곳에 앉고 했습니다. 마을버스가 학교 내에 다니는데 route 10번 버스를 타면 다운타운까지 무료로 다닐 수 있습니다. 다운타운까지는 날씨 좋을 때는 걸어가도 될 만큼 가까워서 버스로 금방 가기 때문에 맛있는 거 사먹고 싶을 때나 밤에 놀고 싶을 때 자주 타고 갔습니다. 다운타운에 hawaiian barbeque 라는 곳이 있는데 정말 한국식 불고기나 갈비처럼 하는 곳이어서 맛있게 잘 먹었습니다. 밤에는 mayor나 monsoon, collins, gopher hole 같은 곳에서 놀다 보면 친구들도 보고 술도 마시면서 즐겁게 놀 수 있습니다. 학교 근처에 월마트랑 타겟이 있어서 필요한 물건들은 그 곳에서 구매할 수 있었어요. 또한 학교 근처에 그레이하운드 지점이 있어서 pheonix 를 가거나 할 때 버스타고 갈 수 있어요. 서부는 대중교통이 그렇게 많은 곳이 아니라서 차 있는 친구를 만나면 여기저기 다닐 수 있지만 그렇지 않으면 좀 번거로울 거에요. 차를 렌트해서라도 꼭 주변 도시 관광 가보세요!","저는 ISEP프로그램 통해서 간 것이기 때문에 밀플랜은 1주마다 19끼를 받았어요. 하루에 세끼를 먹는다 해도 일주일이면 21끼니까 19면 정말 많은 거 아시겠죠. 하지만 19끼로는 식사 말고도 스타벅스나 잠바쥬스 같은 음료도 해당 하기 때문에 저는 밥 말고도 커피나 쥬스 사먹고 친구들 많이 사주는 걸로 자주 이용 했어요. 확실히 밀플랜만 이용하면 따로 식비가 들 일이 많지 않아서 좋긴 했지만 쓰면서 좀 손해라는 생각은 했습니다. ISEP이 아니었다면 밀플랜 신청하지 않았을 것 같아요. 그리고 듣기로는 작년이나 재작년 까지는 밀플랜 이용하는 게 제한이 없었다고 하는데 제가 있을 때는 한번에 3번만 결제가 가능해서 무한정 친구들을 사줄 수는 없었어요. 그래도 자주 밥/음료를 제공하면서 사람들과 친해지고 좋았습니다. 식사는 여러 음식들을 한번에 먹을 수 있는 부페식도 있고, 아시안 음식, 서브웨이, 피자나 파스타, 핫도그, 햄버거, 멕시칸 음식 등 여러가지가 있어요. chick-fill-a 라는 버거집이나, 덴버거는 정말 맛있어요. 체인점이니까 학교에서 아니더라도 밖에서 꼭 드세요.기숙사는 campus heights 라는 기숙사에서 지냈는데요, 주택처럼 거실/주방과 방2개, 화장실 1개 가 포함된 집이었습니다. 한 층에 3채씩, 2층짜리 건물에 여러 건물들이 모여 있었는데 방이 1개인 집도 있어요. 방이 2개라면 각각 1인실, 2인실로 1인실은 NAU학생이 사용하고, 2인실이 국제학생들이 지내는 식이었습니다. campus heights에 지내려면 초반에 기숙사 신청할 때 따로 한번 더 신청해야 하는게 있었어요. 시기 놓치시지 마시고 꼭 지원하세요! 저는 정말 만족합니다. 국제학생들이 대부분 모여있는 곳이고, 집이 다들 가까워서 같이 놀기도 편하고, 학교 내에서 중앙에 있어서 위치도 정말 좋아요. campus heights 말고 south village라는 곳에 사는 친구가 있어서 가봤는데 집이 더 넓긴 하지만 말그대로 south에 있어서 다른 곳에 수업이 있다면 정말 번거로울 거에요. 또 주변이 좀 음침해서 밤에 무서울 것 같았어요.","도서관은 시설이 정말 좋아요. 스터디룸도 자주 이용했구요. 이런 저런 프로젝트룸도 많아서 효율적으로 이용하실 수 있을 거에요. 도서관 분위기는 정말 자유로워서 도서관 내에서 뭐 먹으면서, 얘기하면서, 공부할 수 있어요. 물론 우리나라처럼 칸막이 있는 열람실같은 곳도 있어요. 하지만 저는 탁 트이고 자유로운 분위기가 더 좋았어요.제 전공 수업은 많이 열리지 않아서 몇 개 듣지 못했는데, 개인적으로 정말 만족한 수업들이었습니다. 기계공학의 열역학2를 들었는데 설명도 잘하시고 발음도 좋으시고 재밌으셔서 굉장히 열심히 들었습니다. 50명 정도 되는 강의였는데 교수님이 학생들 이름을 어느 정도 다 알고 계시는 것 같았어요. 학기 초에 공장 견학 가는 날도 있었는데 저는 시험이 겹쳐서 가지 못했어요. 공대생이라면 정말 추천하는 수업입니다.저는 2학년 때 파이썬을 해본 적이 있고 컴퓨터 수업도 들어보고 싶어서 java수업을 들었는데 꽤 힘들었습니다. 우선 교수님이 안좋았어요. 이번에 새로 오신 분이라고 들었는데 아랍계통 분이셔서 영어 발음이 많이 아랍어 같으신 분이라 집중집중해서 들어야 했습니다. 대신에 이 수업은 실습수업도 들었어야 하는 수업인데 실습은 조교들이 하는 수업이라 그런지 더 나았어요. 또 실습수업은 2인1조로 하는 수업이라서 친구의 도움을 받기도 하고 주기도 하면서 과제를 했던 기억이 납니다.또한 biochemistry수업을 들었는데 이 수업은 시험이 6번인 것을 제외하면 괜찮은 것 같아요. 그리고 이 수업은 그 교수님께서 수업을 어떤 어플로 진행하시는데 그 어플 가입하는데 돈 따로 들고, 매주 과제하려면 돈 따로 들고 해서 많이 당황했었습니다. 우리나라는 등록금 내면 예체능 과목 말고는 따로 돈 드는 일이 없었는데 여기는 수업료를 따로 내더라구요.교양 수업으로는 펜싱, 스쿠버 다이빙 들었었는데 펜싱은 시간대가 안맞아서 중간에 드랍했지만 스쿠버 다이빙은 한달 코스라 들을 만 해요! 수영장도 넓고 크고 깊어서 다이빙도 할 수 있고 온천같이 따뜻한 곳도 있어서 매주 수영장가는 게 귀찮기도 했지만 나름 재밌었습니다. 들으신다면 자격증까지 따실 수 있으니까 꼭 해보시는 것 추천합니다.또 학기 시작할 때 국제학생이라 영어가 부족할 수 있다는 것을 교수님께 어필하신다면 교수님께서 많이 배려해주실 수도 있어요. 저는 그러진 않았지만 제 친구들 중에는 교수님께서 많이 챙겨주시고 신경써주셔서 좋았다고 한 친구가 있었어요.",학교 내에 국제처가 있지만 저는 많이 이용하진 않았습니다.,"학기 초에 수업료를 낼 때 일반적으로 부대시설 이용료도 내기 때문에 학교 내에 gym 이나 수영장 등 여러 시설을 따로 이용요금 없이 이용가능 합니다. gym에는 실내 농구장도 있고 탁구, 포켓볼, 라켓볼 등을 즐길 수도 있고 실제 헬스장처럼 운동할 수도 있습니다. 학기 중간에서야 알게 된 것은, gym에서 여러가지 수업들이 무료로 진행되고 있어서 시간대 맞추어 수업을 들을 수 있다는 것입니다. 사이클링 수업, 댄스, 클라이밍 등 정말 많은 여러가지 수업들이 있으니 시간맞춰서 친구랑 가시면 좋을 것 같아요.동아리는 학기초에 동아리 박람회처럼 열리는 것이 있는데 구경해보시고 가입하시면 돼요. 사진 찍는 동아리에서 멀리 떠나서 사진도 찍어보고 했는데 엄청 활동적인 동아리는 많지 않은 것 같았어요. 국제학생들은 international club을 많이 가입하더라구요. 또 korean club이라는 외국인들에게 한국문화랑 한국어 가르치는 동아리도 있어서 이곳에 가입하시면 외국인 친구들 편하게 많이 만날 수 있을 거에요.","컬쳐쇼크라기에는 좀 사소한 것들인데, 우선 한국에서와 달리 여기는 다른 사람들의 시선을 거의 신경쓰지 않아요. 특히 옷 입는 것에 신경쓰지 않아서 저도 모르게 점점 사람들의 시선에 무관심 해졌습니다. 이건 좋은 것 같아요. 또 하나는 보행자가 우선이에요. 한국에서 차조심하고 차보느라 멈칫멈칫하던 습관이 있었는데 여기는 제가 신호 없는 횡단보도 에서 멀리부터 걸어와도 멈춰서 지나가기 기다려요. stop빨간 표지판 있으면 주변에 사람이 있든 말든 무조건 멈췄다 가고. 신기했습니다. 건물 입구에 유리문도 제가 멀리서 걸어와도 자주 잡아주는 친절함이 좋았어요. 또한 수업시간에는 분위기가 많이 자유로워서 질문을 수없이 해요. 단순히 궁금한 질문부터 시험관련 질문까지 눈치 안보고 하더라구요. 또한 아리조나 주는 대마초가 불법이지만 굉장히 흔하고 엄격하게 관리되는 편이 아니라서 정말 많이 보실 수 있을 거에요. 담배처럼 생각하는 것 같아요.",,궁금하신점 있으면 aiqv***@gmail.com 으로 연락주세요:)
"학교 캠퍼스 자체는 매우 큽니다. 연세대에서 다닌 것처럼 걸어 다니려고만 하면 조금 벅차실 수 있어요. 저는 학기 초에 garage sale로 아주 저렴하게 판매되었던 자전거를 구매해서 요긴하게 타고 다녔어요. (경쟁률은 매우 치열하지만 가격은 놀라울 정도로 저렴하니 꼭!! 줄 일찍 서서 구매하세요. 저는 20불에 자전거 사서 정말 잘 다녔어요!) Louie line이라고 하는 학교 셔틀버스와 시내버스 Route 10이 학교 안에 운행됩니다. 학교 셔틀버스는 주중에만 운행되는 것이 단점이지만 연세대 셔틀에 비교하면 정말 자주 오는 편이에요. 	NAU는 Flagstaff라고 하는 아주, 아주 작은 마을에 위치해 있습니다. 이 곳은 한국의 한라산보다 고도가 높다고 해요. 그래서인지 햇살이 아주 강하니 선글라스는 꼭 챙겨가세요:) 또 바람이 아주 많이 불어서 추위를 많이 타는 저에게는 여름에도 꽤 쌀쌀했을 때가 많았구요, 애리조나 사막기후의 특성인지는 모르겠지만 해가 떨어지는 순간부터는 정말 추워졌어요. 막 부담 없이 입으실 수 있는 가디건도 챙겨가시는 게 좋을 듯 합니다.","학교 주변의 다운타운은 학교 내를 돌아다니는 Route 10을 타서 종점에서 내리면 됩니다. 북쪽 캠퍼스에서는 걸어가기에 무리가 없는 거리에요. 다운타운의 규모는 작은 편입니다. 아담하고 아기자기한 맛이 있어서 저는 개인적으로 좋았는데, 단점은 즐길거리가 다양하진 않다는 것입니다. 여성분들은 예쁜 local store들을 둘러보고 맛있는 것 먹으시면서 소소한 즐거움을 느끼실 수 있을 거예요. 하지만 뉴욕 같은 대도시를 좋아하시는 분이라면 실망하실 수도 있어요. 학생들이 찾는 바나 라운지도 3-4군데로 한정되어 있어서, 목요일부터 토요일까지 다운타운에 놀러 가면 항상 보던 국제학생들을 만날 수 있는 웃지 못할 광경이 벌어지고는 했어요. 예를들면, Collins라는 가게가 11시를 넘어가면 DJ가 와서 음악을 믹싱하기 시작하는데요, 거의 모든 학생들이 1차적으로 여기로 모입니다. 굳이 약속을 하지 않아도 친구들을 모두 만날 수 있는 장점이 있어요. (실은 이 가게가 burger가 정말 맛있는데, 친구들은 놀러만 오지 먹어본 사람들이 생각보다 없더라구요. 꼭 드셔보세요! 저는 다운타운에서 제일 유명하다는 Diablo Burger보다 더 좋았어요.) 저는 워낙 집순이라서 번거롭게 돌아다니지 않아 좋을 때도 많았는데, 뒤로 갈수록 항상 되풀이 되는 주말이 지겨워 지기도 하고, 덧없어 지기도 하더라구요. Flagstaff는 outdoor sports에 보다 강점이 있는 곳인 것 같아요. 특히 겨울에는 눈이 우박처럼 내려서 스키나 보드타기에 좋은 환경이 조성된다고 들었습니다. City life보다 등산이나 스포츠를 즐기시는 분들에게 더 적합한 것 같아요. 그렇지 않은 경우는 4개월 남짓 있었는데도 flagstaff에 질려하는 친구들도 꽤 있었어요. 다운타운에서 버스를 한 번 더 갈아타고 나가시면 Flagstaff Mall에 가실 수 있는데요, 이 쇼핑몰도 크지 않습니다. 저 같은 경우는 가을학기여서 할로윈을 지냈는데 몰 근처의 Savers에서 정말 저렴하게 costume을 구매했어요. 한번 들러보세요!","저는 잘 모르고 기본적인 기숙사 신청만 했다가 South Village에 배정받았는데요, 이 곳은 기숙사 최남단에 위치해 있어서 경영관이나 사회과학관(SBS)에서 수업 듣지 않는 이상 다른 곳으로 접근성이 떨어지는 치명적인 단점이 있어요. Campus heights라고 대부분의 국제학생과 타국가 문화에 관심이 많은 로컬 학생들이 사는 이 기숙사는 캠퍼스 중심부에 위치해서 많은 학생들이 선호하는데 여기에 살기 위해서는 따로 신청을 한 번 더 해야 한다고 들었어요. 하지만 꼭 붙는 것은 아니고, 떨어질 확률도 존재하는데 지원서를 꼼꼼히 읽어보고 선발한다고 하니 신경 써서 제출하셔야 할 듯 해요. 떨어진다고 너무 낙담하실 필요는 없는 게, 다른 기숙사들도 꽤 좋다고 들었고 South Village도 Campus heights에 비해서 부엌과 화장실이 더 넓어서 전 개인적으로 큰 불만은 없었어요.	연세대 학생 같은 경우에 NAU는 ISEP 프로그램을 통해서 배정받아야 하는데요, 이 프로그램의 특성상 Meal Plan을 의무적으로 신청해야 합니다. 1주일에 19끼가 제공되는데 저 같은 경우는 한 끼당 5천원으로 계산해서 돈을 내고 갔기때문에 이걸 모두 써야 하는 압박이 꽤 컸어요. Meal plan을 쓰는 방법은 크게 두 가지로, 뷔페식 학교식당(Hot Spot, The DuB)과 학교 내에 입점 되어 있는 프랜차이즈 음식점/커피숍을 이용하는 것으로 나누어 볼 수 있어요. 후자, 즉 meal (plan) transfer를 통해서 학교 내 프랜차이즈 음식점이나 커피숍을 이용하실 경우에는 구매할 수 있는 메뉴가 한정되어 있으니 확인하고 드세요! 커피를 좋아하시는 분들이라면, meal plan으로 Starbucks에서 blended 음료를 제외한 모든 음료를 Grande사이즈로 즐길 수 있으니 무리 없이 쓸 수 있으실 것 같아요:) 저는 meal plan을 남기기 아까워서 주변 친구들에게 아낌없이 사주고 왔습니다.","수업은 한국에서와 마찬가지로 어떤 수업을 듣느냐에 따라 격차가 있지만, 대체로 과목당 3번의 시험과 수많은 과제로 이루어져있다고 보시면 될 것 같아요. 저 같은 경우는 졸업 때문에 3,4학년 과목을 듣다 보니 수업에 외국인은 저 한명인 경우가 많았는데 수업 첫 날에 교수님께 제가 international student라는 것을 밝히면 아주 조금은 더 신경 써주시는 것 같더라구요. NAU의 가장 큰 단점이 국제 학생들을 위한 시스템이 잘 구축되어 있지 않은 것이라고 생각하는데요 (제가 갔었던 2015 가을학기가 NAU 역사상 교환학생이 가장 많이 방문한 학기였다고 하더라구요. 이제 막 교환학생 제도를 규정화해가는 단계인 것 같습니다. 어떻게 보면 대부분의 미국 대학교가 그런 것 같기도 하고요.) 제가 들은 수업들이 고학년을 위한 깊이 있는 수업이어서 그랬는지 학생들도 그렇고 교수님들도 그렇고 외국 학생을 꽤 낯설어 하는 느낌이었어요. 그래서 그냥 연세대에서 영어 수업 듣는다는 느낌으로 특별대우 바라지 않고 열심히 했습니다. 생각 이상으로 모든 수업의 교수님들이 ‘대학생다운 글쓰기’를 중요시 하시고 문법을 꼼꼼히 체크하시더라구요. 저는 외국인이니 grammar points가 항상 만점이 나오지 않았지만, 다른 부분에서 충분히 만회가 가능하니 너무 겁먹지 마세요! 무엇보다 제가 수업에 관해서 학생들께 드리고 싶은 말씀은 수업시간에 절대 겁먹지 말고 당당하게 발표하시라는 점이에요. 굳이 연세대로 국한지을 이야기도 아니고, 한국 대학생들 절대 미국 학생들에게 뒤지지 않는 발표 실력을 갖고 있다고 생각해요. 미국 학생들은 놀라울 정도로 교수님께 편하게 자기 의견을 피력합니다. 마치 조금 위의 선배에게 말하는 것처럼요. 머릿속에 떠오른 생각을 한, 두 문장 툭툭 말하기도 하고 횡설수설 수다떨듯이 말하기도 해요. 그러니 너무 어렵게 생각하실 필요도 없이, 평소 하시던 대로 차근차근 말씀하시면 될 것 같아요. Participation에 관한 점수도 꽤 칼같이 주시더라구요. 그러니 나는 영어가 모국어가 아님에도 이렇게 노력하고 있다!는 모습을 보여주시면 될 것 같아요:)","NAU 캠퍼스의 북쪽에 국제학생들을 위한 센터(CIE)가 있어요. 대부분 국제학생 관련한 일 처리는 이곳을 방문하시면 됩니다. 도서관이나 Student Technology Center에서 글쓰기를 도와주는 프로그램이 있다고 들었어요. 저는 시간이 잘 맞지 않아서 이용하진 않았었는데 도서관에 자주 갔던 친구들은 도움을 많이 받았다고 해요. 오리엔테이션 주에 공부에 도움이 되는 여러 가지 정보들을 제공하니 큰 걱정은 안 하셔도 될 것 같아요. 경영관에는 resume 쓰는 것이나 채용을 도와주는 센터도 있었는데요, 1대1로 아주 친절히 상담해 주시니 관심 있으시다면 들러보시는 것도 나쁘지 않을 것 같아요.","HLC에는 연세대 학관의 연습실처럼 거울이 달려있는 연습실이 있어요. 이것도 미리 예약을 해놓고 쓸 수 있었는데, 시설이 아주 좋으니 춤과 같은 활동에 관심 있으신 분들 활용해 보세요. 여기서 라틴댄스 강좌가 무료로 열리기도 하니 시간 있으실 때 참여해 보시는 것도 좋은 추억이 될 것 같아요.저는 도서관의 studio를 애용했는데요, 마이크부터 Mac 컴퓨터의 여러 소프트웨어도 구비되어 있으니 producing에 관심 있으신 분들은 꼭! 꼭! 한 번 들러보세요. NAU Library 홈페이지에서 예약하실 수 있고 몇 일 전에 미리 예약해 두시면 큰 경쟁 없이 쓸 수 있어요. 저는 이 시설이 다른 그 어떤 시설보다 가장 부러웠습니다. 방음 시설도 되어있어서 다른 학생들이 별다른 신경도 쓰지 않더라구요.      NAU 동아리들은 그렇게 다양하지 않아요. 저 같은 경우는 음악에 관심이 많아서 기대를 많이 했었는데, 춤 동아리도 전체에 하나 밖에 없고 수준이 그렇게 뛰어나지 않아요. 노래하는 동아리도 한국 대학교의 밴드 개념이 아닌, 아카펠라 동아리가 두 개 정도 있었던 것 같아요. 대부분의 국제 학생들은 Japanese club, Korean club, International club 이 정도를 많이 했어요.","첫째로 컬쳐쇼크라고 느꼈던 부분은 옷을 입는 방식이었던 것 같아요. 미국 학생들은 춥지도 않은지 저와 독일친구가 패딩으로 꽁꽁 싸매고 있던 때에도 반팔, 반바지를 입고 햇살이 좋은 때에는 한겨울임에도 불구하고 나시에 칠부바지를 입고 다니더라구요. 특히 밤에 다운타운 놀러 가면 계절감이 실종된 복장을 쉽게 보실 수 있어요.      무엇보다 가장 컸던 컬쳐쇼크는 drugs에 관한 부분이었습니다. 술보다 마약에 더 관대한 나라가 미국이구나 하는 것을 절실히 깨달았습니다. 한국에서 마약이 극도로 금기시 되는 존재인 것과 달리, 한 미국 친구는 술에 취하는 것보다 약에 취하는(high되는) 것이 더 안전하다는 사고방식을 갖고 있더라구요. 이것이 대부분의 미국인이 가진 사고방식을 대변한다고 느낀 게, 많은 학생들이 기숙사 안에서, 파티장에서, 공간이 없으면 길거리에서 자유롭게 weed를 핍니다. 이러니 다른 친구들에게 권하는 것도 쉬울 수 밖에 없겠다는 생각이 들었습니다.","학기가 시작되기 전에 CIE 센터에서 이메일을 보내 누구에게 어떤 분야를 문의하면 되는지 알려줍니다. 물론 답장이 돌아오기까지 소모되는 시간은 있지만 정말 친절하게 도와주세요. 모르는 것은 CIE 센터에 망설이지 말고 여쭈어 보시면 될 것 같아요. 또 저 같은 경우는 flagstaff의 다른 가족들과 이어주는 프로그램인 Flagstaff Friends를 했었는데요, 제가 매칭된 노부부께서 정말 큰 도움을 주셨어요. 저는 이 프로그램 적극 추천하니 꼭 신청하셔서 외국에 가족을 얻는다는 느낌으로 든든하게 생활하시면 좋을 것 같아요.","NAU에 대한 궁금증이 있으신 분은 hotayo10@gmail.com으로 메일 보내주세요:) 저도 정보가 많지 않아서 고생했었는데, 어려워 하시지 말고 언제라도 연락 주세요!"
