gen_info,env_info,food_info,study_info,office_info,facil_info,mhct_info,help_info,etc_info
"1.대학의 크기- 학교의 크기는 경영 단과대인만큼 굉장히 작습니다. 우리 학교 경영관보다 조금 작은 크기의 건물이 2동 있습니다. 하지만 우리 학교 경영관만큼이나 건물이 최신식입니다. 강의실도 쾌적하고 도서관도 조용히 공부하기 좋습니다. 2.지리적 위치- 쿠프슈타인은 오스트리아 서쪽 티롤 주에 독일과 국경을 접하고 있는 작은 도시(?)라기보다는 마을에 가까운 도시입니다. 인구는 18,000명 정도이고 그마저도 노인분들이 굉장히 많은 것으로 보였습니다. 산책을 나가면 폴대를 짚으며, 또 개와 함께 산책하시는 노인분들을 거의 항상 볼 수 있었습니다. 젊은 사람들은 대부분 FH Kufstein에 다니는 대학생들이 주 거주민인 것 같습니다. 오스트리아 자체가 유럽의 중심부에 위치해 있는 데다가 비엔나가 동쪽 끝에 가깝다면 쿠프슈타인은 서쪽 끝이라 서유럽 쪽도 정말 쉽게 이동할 수 있습니다. 또, 쿠프슈타인이 작은 마을임에도 불구하고 기차역이 있어 꽤나 교통의 요지 역할을 하기 때문에 웬만한 가까운 옆나라 도시들은 모두 기차를 타고 이동할 수 있습니다. 게다가 독일 뮌헨의 경우 1시간이면 갈 수 있어서 뮌헨 중앙역에서 환승하면 갈 수 있는 선택의 폭이 더 넓습니다. 저 같은 경우도 아프리카 여행을 할 때 빼고는 모두 기차를 타고 여행했습니다.3. 기후- 사실 가을, 겨울학기에 가게 되어 가장 걱정했던 것이 추운 날씨였는데 같은 기간 한국보다 훨씬 덜 추웠습니다. 그 때 유난히 한국이 추웠기도 한데 제 기억으로는 대부분 아무리 추워도 영하로 내려가는 날은 많지 않았습니다. 게다가 날도 맑은 날이면 정말 알프스로 둘러싸인 천혜의 자연 환경속에서 정화되는 느낌을 받으실 수 있을겁니다.","학교는 작지만 쿠프슈타인이라는 작은 마을의 중심부에 위치해 있으며 마을의 각종 크고 작은 행사가 학교 앞에서 열리기도 합니다. 학교 'ㄷ'자 모양으로 되어 있는 학교 앞에는 잔디가 깔려 있고 그 앞으로는 아이들이 놀 수 있는 놀이터와 카페가 있습니다. 그리고 그 앞으로 해서 마을의 온갖 쇼핑몰과 마트, 식당들이 몰려 있습니다. 마을 자체가 대학을 중심으로 짜여진 모양새입니다.그리고 그 상권 앞으로는 큰 강이 흐르고 있습니다. 강물 색은 옥빛에 가까운데 석회 성분 때문에 그렇게 보인다고 들었습니다. 강물 흐르는 양 옆으로 있는 산책로에서 벤치에 앉아 강물만 봐도 심신이 안정됩니다.그리고 조그만 마을 치고는 없는게 없습니다. 강변 앞에 Segabar라는 클럽 비스무레한 바와 시내 중심부에 위치한 pure라는 바는 교환학생을 비롯하여 현지 학생들도 자주 갈 수 밖에 없는 작은 마을 안에서 거의 독점 기업의 위상을 확보하고 있는 바입니다. 학기 중엔 거의 매주 파티가 있는데 대부분 이 곳들에서 열립니다. 저 같은 경우엔 헬스장을 신청하여 다녔는데 학교 주변에 하나 있고, 기숙사 주변에 하나 있습니다. 저는 기숙사에서 걸어서 10분 정도 거리에 있는 nowfit이라는 헬스장에 다녔습니다. 런닝을 뛰면 앞에 통유리 창문으로 마을의 명물 요새와 저 멀리 알프스 산맥이 보입니다. 운동을 하고 싶으신 분들이라면 마치 자연속에서 운동할 수 있는 기분을 느낄 수 있어서 추천드립니다. 이외에도 티롤 주가 스키 관광으로 유명한 만큼 버스타고 2~30분만 나가면 유럽 전역에서 몰려드는 스키장이 많습니다. 교환학생 중에는 스키를 타기 위해서 이곳으로 온 학생이 있을 정도였습니다. 저도 soll이라는 곳으로 스키를 타러 갔었는데 겨울학기에 가시는 분들이라면 꼭 한번쯤은 가보시길 추천드립니다. 알프스 생눈에서 스키타는 경험을 하실 수 있을 것입니다. 또, 마을 안에 스케이트 장도 있어서 가볍게 스케이트 타고 싶을 때 쉽게 탈 수 있습니다.","거주 형태는 크게 기숙사에 살거나 시내에 플랫을 구해 사는 것인데, 저는 기숙사에서 살았습니다. 기숙사는 A동에서 D동까지 있는데 그 중, 교환학생이 살 수 있는 곳은 A~C동입니다. 세 동이 모두 연결되어 있지만 A, B동 보다는 C동이 약간 더 최신식인 것 같습니다. 1인실과 2인실이 있으며 2인실이라고 해도 방은 따로 쓰고 중간에 주방과 화장실을 공유하는 형태라 불편한 점은 크게 없습니다. 다만 A동과 B동의 1층 중간에 common room 있는데 각종 파티가 매주 여기서 열립니다. 따라서 A, B동 1층은 꽤나 시끄러울 수 있습니다.식사는 대부분 기숙사 근처 마트인 Lidl이나 Interspar에서 장을 봐서 직접 해먹는 경우가 대부분입니다. 식당은 대부분 비싸기 때문에 저도 근처 마트에서 사서 많이 해먹었습니다. 마트는 기숙사에서 걸어서 5분도 안되는 거리에 있기 때문에 굉장히 편리합니다.","1. Business of Event Management / Stura Claudia- 학기 첫 달만에 수업 일주일에 한 번씩 가고 끝나버린 개꿀 수업이었습니다. 수업 내용은 말 그대로 국제 컨벤션 행사 등 다양한 이벤트 개최에 관한 관리 및 의사결정에 대한 수업입니다. 기본적으로는 교수님이 강의식으로 수업을 진행하시지만 케이스 읽고 조끼리 정리해서 수업시간에 토론도 했습니다. 교수님도 그리 깐깐하지 않으시고 무난하십니다. 사실 교수님에 대해 이런 저런 평가할 새도 없이 수업이 끝나버렸다는 것이 이 수업의 가장 큰 장점이 아닐까 합니다.2~4. European Financial Markets and InstitutionsBanking & E-BankingInternational Economics: Trade & Finance / Zenevitch Vladmir- 알프스로 요양을 하기 위한 목적으로 교환학생을 오신 분들이라면 갓네비치 교수님의 강의는 3개 모두 필수로 들어야 합니다. 인자하고 편안하신 분위기의 마치 옆집 할아버지같은 제네비치 교수님은 너무 푸근한 나머지 학생들의 정신상태와 공부 열의까지 모두 무장해제 시키십니다. 시험은 학기말에 조별 보고서로 대체합니다. 대출이 횡행하고 아무도 수업을 듣지 않는 것 같아 보입니다. 학기 초엔 그런 분위기 속에서도 홀로 열심히 강의를 듣고자 했지만 교수님의 인자하신 눈빛과 마주친 순간, 아마 그 날 수업 내내 교수님은 당신만 보고 수업을 하실 것입니다. 저는 몇 번 그런 후부터 중간에 교수님의 눈빛을 저버리는 것이 두려워 수업시간엔 주로 여행계획을 짰습니다. 5. Case study in Innovation / Situm Mario- 제가 교환학생 와서 들은 수업 중 가장 수업 난이도나 내용 측면에서 뛰어난 수업이었습니다. 수업은 한마디로 말하자면 기업 연계 프로젝트 수업입니다. 지역의 실제 기업과 협업하여 기업이 주는 몇가지 주제(문제)를 택하여 실제 문제를 해결하고 학기 말에 기업 실무자들 앞에서 발표하는 수업입니다. 수업은 두 명의 교수님이 공동으로 수업하십니다. 두 분 교수님들의 영어가 가장 깔끔하여 알아듣기 쉬웠고 수업에서 많이 배워간다는 생각이 가장 많이 들었습니다. 학기 말 발표시에는 1등부터 3등까지 선정하여 상품과 상금을 줍니다. 저희 팀은 2등을 차지하여 텀블러와 상금 200유로를 받았습니다. 이 상금은 해당 기업에서 발행한 특별한 상품권 개념으로 쿠프슈타인 지역의 쇼핑몰이나 마트, 식당에서만 통용되는 코인이었습니다. 수업이 끝나고 조원들과 사이좋게 나눠가졌던 기억이 납니다. 생동감 있고 현실적인 프로젝트를 해보고 싶으신 분들이라면 추천드립니다.6. Austrian Culture and History / Rainer Thomas- 쿠프슈타인 주변 도시인 잘츠부르크와 인스부르크로 당일치기 견학을 가는 수업입니다. 첫 수업에서는 쿠프슈타인 시내를 돌며 마을 곳곳의 역사와 명소들을 소개해줍니다. 덕분에 쿠프슈타인이라는 도시에 대해 이해가 깊어지는 계기가 되었습니다. 또한, 저 같은 경우 따로 시간을 내어 오스트리아 내 소도시 여행을 갈 계획은 없었기 때문에 수업도 들을 겸 여행을 가면 좋겠다고 생각하여 수업을 수강하게 되었습니다. 교수님이 굉장히 친절하셔서 어딜 가든지 그 곳의 역사에 대해 잘 설명해 주십니다. 또한, 오전에 다같이 버스를 타고 출발하여 저녁에 다시 돌아오게 되는데 원한다면 개인적으로 해당 도시에 남아서 여행을 계속할 수도 있습니다. 7. Service Management / Burnner-Sperdin Alexandra- 쿠프슈타인 내 상점이나 회사들을 대상으로 미스터리 쇼핑을 하거나 소비자 조사(focus group discussion)등을 통하여 서비스 개선점을 도출하고 발표하는 수업입니다. 미스터리 쇼핑을 하는 경우, 해당 서비스를 이용하러 가기 전에 살펴봐야 할 부분들을 체크리스트로 만들어가 서비스를 직접 이용하면서 평가하는 것이 중요합니다. 또한, 소비자 조사를 하는 경우엔 10명 내외의 소비자들을 모아 직접 서비스 이용 경험을 들어보며 실제로 소비자가 어떤 부분에서 불만을 느끼고 있는지에 대해 찾아내는 것이 중요합니다. 둘 다의 과정을 시행하기 전에 해당 서비스의 블루프린트를 그려보는 것도 수업의 주요 내용 중 하나로 다뤄집니다. 교수님이 발표나 조사 과정에서의 가이드라인을 좀 애매하게 주는 부분이 있지만 질문하면 친절하게 대답해 주십니다. 8. Public Relations / Schneckenleitner Peter- 기업의 PR활동에 관해 배우고 학기 말에는 특정 기관 혹은 단체를 직접 선정하여 그 단체의 PR 프로젝트를 직접 만들어 발표합니다. 강의할때 배우는 양은 꽤나 많지만 마지막에 결과물을 보면 강의의 내용을 따라가진 못하는 경우가 많습니다. 처음에 강의를 들을때는 어떻게 해야 하나 감이 잘 안오는 경우가 많아 걱정이 많은데 어느 순간 모두가 같은 생각을 하고 있다는 생각이 안심이 되는 수업입니다. 개인적으로 딱히 수업에서 배운 것이 많이 남지는 않은 수업이었습니다.9. Finance & Control / Exler Markus W.- 그냥 관리회계 수업입니다. 연대에서도 관리회계 수업을 영어로 수강한 적이 있어서 용어 같은 것이 그리 어렵지는 않았지만 이런 베이스가 없는 분이시라면 수업을 따라가기 어려울 수도 있습니다. 교수님이 개념 정의나 질문에 관해 굉장히 불친절하십니다. 수업 초반에 강의 전체의 틀이나 개념에 대한 설명이 없이 무작정 진도를 나가기 때문에 많은 학생들이 수업 따라가기를 거의 중도 포기하고 재시험의 늪에 빠집니다. 10. Market Research / Horn Katrin- 시장조사론에 관한 수업입니다. 교수님이 굉장히 열정적이시고 강의력이 좋으십니다. 재밌게 들었고, 마지막에 조 발표 하나가 있지만 그리 어려운 것은 아닙니다. 질적 자료와 양적 자료, 1차 자료와 2차자료의 구분 등을 발표에 담아낼 수 있으면 어렵지 않게 들을 수 있었던 수업이었습니다. 하지만 다른 과목과 마찬가지로 강의 내용이 좋았던 것에 비해 마지막 발표의 결과물들이 힘이 많이 빠지는 느낌이 있습니다. 바꿔 말하면 발표에서 큰 부담을 느끼지 않으셔도 성적 받는 것은 크게 어렵지 않은 것 같습니다.",니콜 선생님이 교환학생 업무를 전담하고 계십니다. 꼭 교환학생 관련 문제가 아니더라도 무엇이든 궁금한게 생기면 편하게 물어볼 수 있어서 의지가 많이 됐습니다. 또 굉장히 친절합니다. 저 같은 경우 학교 근처 이용할 수 있는 헬스장을 물어봤을 때 몇 군데에 관해 상세하게 설명해줬습니다.,"동아리의 경우 교환학생으로서 참여할 수 있는 것은 거의 없어 보였고, 다른 교환학생들도 동아리 활동을 하진 않았습니다. 학교의 부대시설은 아니지만 근처에 사립 헬스장이라던가, 마을 한편에 있는 arena에서 각종 운동 경기를 관람하거나 겨울철에 스케이트 장을 이용할 때 학생증을 제시하면 할인을 받을 수 있습니다.","딱히 culture shock라 느낄 만한 것은 없었습니다. 모두 친절하게 대해주고 유럽에서 온 다른 교환학생 친구들도 편견없이 대해줍니다. 오히려 우리가 편견을 갖고 그들을 바라보는게 아닌지 생각이 많이 들었습니다. 더 적극적으로 친구들에게 다가가고 말도 많이 걸고 하다 보면 그냥 똑같은 사람들이구나 생각이 듭니다. 다만, 서양 교환학생 친구들의 경우 대부분 나이가 19살, 20살 근처의 어린 친구들이 많아서 그런지, 아니면 문화적 특성인지 몰라도 고등학생 같이 철없이 논다는 생각이 들 때가 종종 있습니다. 특히 기숙사에 사신다면 복도에서 소리를 지르며 뛰어다닌다던가 불장난을 한다던가 이런 경우가 종종 있지만 그것 빼고는 딱히 불편한 점은 없었습니다.",모든 유형의 문제는 니콜에게 문의하면 기꺼이 도와줄 것입니다.,"대도시보다는 자연을 느끼고 싶고, 사람 많은 복잡함 보다는 작은 마을의 여유를 느끼고 싶으신 분들에게 쿠프슈타인은 최고의 선택이 될 것입니다."
날씨는 항상 맑은 편입니다. 알프스 산자락이라 겨울에는 좀 춥지만 한국보다 많이 춥진 않아요. 오스트리아지만 독일 국경에 근접한 마을이기 때문에 뮌헨을 자주 가게 됩니다. 이탈리아와도 가까운 편으로 나름 철도 교통의 요충지입니다. 마을 크기에 비해서 기차 노선은 많은 곳으로 뻗어있어요.크기는 단과대 하나 정도의 규모고 건물 시설들은 꽤 최신식입니다.,산과 호수가 근처에 많고 정말 아름답습니다. 주변 가까운 곳에 다니는게 좋았어요. 눈 오기 전에 등산이나 소풍을 많이 갔었고 눈이 온 후에는 스키를 타러 갔습니다. 한국보다 훨씬 싼 가격에 가까운 곳에서 스키를 즐길 수 있어요. 학교 근처에 아이스 스케이팅장도 잘 되어있습니다. 작은 마을이지만 마트는 3ㅡ4개 이상 있어서 편리해요.,기숙사에 살았습니다. 플랫보다 좀 비싸다고 하는데 깨끗하고 넓어서 만족스러웠습니다. 1층엔 common room이 있어 좀 시끄럽긴 했어요.참고로 기숙사 보증금은 규정이 매우 엄격해 100% 돌려받기는 힘듭니다.식사는 식재료가 질이 좋고 싸서 요리를 많이 해먹었습니다. 외식도 학교 근처 식당에서 가끔했는데 친구들과 요리해먹는게 제일 좋았어요. 그리고 쿠프에는 아시안마트가 없기 때문에 한식재료 등을 처음에 좀 가져가는 것도 좋은것 같아요. 저는 아무것도 안 가져가서 첫여행때 프라하에서 김치와 고추장 등을 사왔었습니다.,"Service management, market research,  International economics, banking n e banking, change management, german language, strategic management, simulation modeling들었습니다. 경영수업 안 들어봤는데 전체적으로 평이하고 학구적이기보단 많이 이야기하고 발표하는 데 의의가 있는 수업들이었습니다.도서관은 작지만 쾌적하고 항상 빈자리가 있습니다.",니콜이라는 담당자가 있었는데 매우 친절하고 업무 외의 영역에서도 도움을 주려고 해서 고마웠습니다. 문제나 문의사항이 있으면 망설이지 말고 연락하세요!,학교에는 딱히 부대시설이 없지만 바로 옆 arena에서 스케이팅 축구 등 다양한 스포츠를 즐길 수 있습니다. 교환학생이 들만한 동아리는 딱히없엇던 것 같아요.,오스트리아는 유럽에서는 보수적인 편이라 딱히 그럴 일은 없었습니다.굳이 말하자면 24시간 영업하는 가게나 배달 문화가 없어서 우리나라가 좀 비정상적일 수도 있겠단 충격이 있었습니다.그리고 작은 마을이라 동양인이 거의 교환학생뿐이라 좀 이상한 기분이었어요 학기 초에는 주민 몇몇이 신기해하며 관심을 보이기도 했습니다.,니콜이 최고예요.. 모든 문제는 이쪽으로...기숙사 담당직원인 Hubmann의 경우 크게 도우려는 의욕이 없어요,수업 등 기타 문의는 메일로 연락주세요kh961205@naver.com
