gen_info,env_info,food_info,study_info,office_info,facil_info,mhct_info,help_info,etc_info
"대부분 오스트리아하면 수도인 ''빈''을 쉽게 떠올리게 됩니다. 제가 있었던 쿠프슈타인(Kufstein)은 오스트리아의 Tirol주에서 두번째로 큰 도시라고 할수 있습니다. 같은 주에서 가장 큰 도시 인스부르크와는 기차로 40분정도 밖에 안걸리는 거리에 있습니다. (인스부르크는 동계올림픽 개최지로 유명한 곳이기도 하고 2010년 6월 3일 한국 VS 스페인 평가전을 치웠던 곳이기도 합니다.) 이곳에 오는 가장 좋은 방법을 알려드리면 다음과 같습니다. 독일 뮌헨국제공항으로 들어옵니다. 다음 뮌헨공항에서 중앙역까지 가는 열차를 타고 (대략 30분정도 걸림 S1, S8 타시면 됩니다. S-bahn이라고 시외외곽지역으로 주로 다니는 열차입니다. 반대로 U-Bahn은 시내 중심지를 거쳐가는 라인이라고 보시면 됩니다.) 뮌헨 중앙역 도착한다음 중앙에 보면 인포가 있습니다. 거기에서는 티켓팅은 안되고 타임테이블만 뽑아줍니다. 발음을 잘 못알아듣는 경우가 있으니 종이에 Kufstein이라고 쓴다음 보여주면 잘 가르켜줄거에요. 뮌헨에서 직행은 1시간, 하지만 싸게 갈려면 로젠하임에서 갈아타니까 대략 1시간 반정도 걸리겠네요. 구글맵상으로도 찍어보면 아시겠지만 kufstein은 인 (Inn)강을 끼고 있습니다. 비안올때 보면 완전 최고의 풍경이라 할 수 있지요. 제가 갔던 2월말부터 3월까지는 눈도 가끔 오고 여전히 추웠던거 같아요. 봄학기 가시는 분들은 꼭 두꺼운 코트 한벌 가져가는게 좋을거에요. 그리고!! 눈이 무척이나 많이와서 여성분들은 겨울용 장화, 그리고 남성분들도 발목까지 올라오는 보온되는 신발하나씩 꼭 챙겨오세요. 4,5월에는 그다지 많이 춥지는 않았던거 같아요. (반팔입고 조깅하기 딱 좋은 그정도의 날씨입니다.) 6.7월에는 습기없는 더운날씨가 계속되요. 이때에는 꼭 야외수영장을 다니시라고 말씀드리고 싶군요. (학생은 12시 이후에 무조건 1유로 입니다!)

학교는 쉽게말하면 Business College라고 할수 있네요. International 학생이 100명정도 되었는데 오히려 Regular확연히 많다고 느끼지는 못습니다.
학교 바로 앞에 놀이터가 있는 그래서 오히려 그곳 주민들과 함께한다는 느낌을 받을정도로 학교는 아담합니다. (3층짜리 작은건물이 90도 방향으로 연결되어있음.) 티비나 영화속의 커다란 캠퍼스를 상상하셨다면 실망하실수도 있지만 오히려 작고 아담해서 편안함을 느끼게 해주기도 합니다.","미리 말씀드렸지만 Kufstein은 정말 작은 동네임을 실감하게 해줍니다.
상권의 규모는 ''신촌''과 비슷하다고 보시면 됩니다.  
제가 기억나고, 인상 깊었던건 헬스장, 스포츠 베팅샵, 스포츠용품점, 아주 작은 클럽 아라비아, 한번도 가지 않았던 영화관 등등이 있네요. 
시내방향으로(?) 나가면 바로 오른편에 인터센타라는 쇼핑몰이 있습니다. 여기에 마트도 들어있고 이층에는 서점및 전자제품 코너가 있습니다.  특히 1층1층에서 빵집에서 팔았던 2.5유로 짜리 샌드위치는 참 맛있었던 기억이 납니다. 인터센타 사거리에서 위로 쭉 올라가시면 헤르비스라는 스포츠 용품점이 나옵니다. 특히나 이곳은 쿠프슈타인의 유용한 교통수다인 ''자전거'' 수리 및 각종 용품을 사기에 괜찮은 곳입니다. 자전거 타이어 펑크 및 바람 넣기 등은 다 무료로 받았습니다. 또한 헬스장 같은 경우는 특별히 학생들에게 한달에 40유로만 받고 모든 시설을 제공해주기 때문에 적극 추천해 드리고 싶습니다. (운동을 좋아하시는 분이라면) 헬스장 바로 밑에는 카지노도 있기 때문에 흥미 있으시면 한번 쯤 가볼만은 한거 같아요. 특히나 올해는 월드컵 때문에 베팅샵에 자주 갔었습니다. 인터센타 맞은편으로 해서 골목 사이에 베팅샵이 있습니다. 최소 베팅은 5유로부터 시작했는데 베팅하고 나면 프리 드링크가 제공되기 때문에 맥주한잔 하면서 경기 시청했던 기억도 납니다. 
마지막으로 영화관은 헤르비스(스포츠 용품점)가는길 지나서 있는데 주로 독일어로 상영 합니다. 영어버전은 수요일 마지막타임에 상영했던걸로 알고 있습니다. 좀더 큰 영화관을 원하시면 꼭 여권들고 !!! 로젠하임가서 영화보고 오시는것도 괜찮아요. (사실 뮌헨이 더 크긴 하지만요)","다른분들이 언급하셨지만 거주형태에는 3가지가 있습니다. 
ISR (국제기숙사), FMZ(사설 기숙사),Flat 아파트같은 원룸 혼자 거주하기. 
경제적으로 따지면 ISR이 제일 저렴하고요 FMZ는 기본적으로 한달에 300유로이상 했던거 같습니다. Flat은 어떤곳을 잡느냐에 따라 달라지고요. 

개인적으로는 무조건 ISR을 추천합니다. 한국에서도 연세대 서문에 사는 사람과 동문에 사는 사람이 만날려면 은근 귀찮은게 사실입니다. ISR은FMZ와 정확히 5분거리에 떨어져 있고 대부분의 Flat들은 ISR에서 15분정도 떨어진 학교쪽과 가까운 곳에 있습니다. 학기초반에는 모든 친구들이 Common Room에서 파티를 하거나 모이기 때문에 일단 어디에 살던지를 막론하고 ISR로 모이게 됩니다. ISR 커먼룸은 11시정도면 사설경비원이 와서 문을 잠그기 때문에 일단 그 시간까지는 술 마시고 즐겁게 놀다가 다같이 클럽이나 2차로 술을 더 마시러 나갑니다. 제가 살았던 ISR을 기본적으로 설명드리겠습니다. 
A,B,C동을 기준으로 B동에 국제학생들이 많았던것을 제외하면 딱히 레귤러만 쓰거나 국제학생들만 쓰는 동은 없었던거 같아요. 방은 두가지로 싱글룸, 투룸이 있는데 정말 혼자사는게 편하다 싶은 사람 아니면 투룸써도 괜찮다고 봅니다. 투룸은 화장실과 부엌만 공용이고, 각자의 방은 따로 문을 열고 들어가야기 때문에 사생활에 큰 지장은 없습니다. 부엌에는 모든 시설은 다 있다고 봐도 되나 전자레인지, 오븐이 없습니다. 커먼룸에 있기때문에 더더욱 이곳에서 사람들이 많이 모일수 밖에 없습니다. 

식사는 당연히 무에서 유를 창조한다는 기분으로 처음부터 끝까지 하셔야 합니다. ISR 근처에는 새로생긴 Lidl과 원래 부터 있었던 인터스파, 엠프라이스 등등의 큰 마트들이 있기 때문에 그곳에서 재료같은거 미리 미리 사다놓으시고 끼니를 해결하면 될거 같습니다. 맥주가 당연히 물보다 싸기 때문에 항상 박스로 쌓아놓고 먹었던 기억도 납니다.  

참고로 인터스파, 유로스파, 빌라, 리들 등등의 모든 마트에서 중점적으로 싸게 파는 품목들이 있으니 잘 이용하세요 특히나 빌라의 아찌온으로나온 고기는 싸서 아주 잘 이용했답니다.","전 이번학기 총 10개의과목을 들었습니다. 
Doing Business in German Speaking World, Doing business in South Africa,
Analysis of financial Statement, Valuation on east european market,
M&A, Controlling, Consumer Marketing, Trends in international Finance, Trends in internal Marketing , Sales Management

수업의 수준보다는 활동적인 과목들을 들을걸 후회하고 있습니다. 
특히나 이곳은 Sport Management쪽으로 활성화가 많이 되어 있다고 합니다.
적극 추천할 수업은 Doing Business in German Speaking World입니다. 독일어권의 No.1 기업들을 직접 찾아가서 현장에서 보고 듣고 배우고 하는 수업입니다. 당연히 외국 친구들과 더 친해질수 있는 기회도 생깁니다. 그외에는 제가 파이낸스 전공이였던지라 추천해 줄 수 있는건 Valuation on East European Market 입니다. 첫시간 빼고는 마지막까지 엑셀시트를 가지고 벨류에이션을 배우는과정인데 무척이나 흥미롭고 재미가 있습니다. (가장 첼린징하면서도 좋았던 과목이 아닌가 생각됩니다.)

도서관은 2층의 좌측에 있는데 한국처럼 새벽부터 여는게 아니라. 오전 10시정도나 시작해서 오후 8시까지밖에 안하는 그리고 일요일은 개방하지 않는 그런 구조 입니다. 참고로 헬스장도 요일별로 오픈시간대가 다릅니다. 불평않고 적응하다 보면 이게 더 익숙해집니다. 도서관에 그다지 영어로 된 전공서적은 많지 않습니다. 혹시라도 들으시라는 과목에 꼭 필요한 책은 수업전날 미리 챙겨놓으세요. 

수업 시스템은 처럼 일주일에 같은시간에 시작하는게 아니라 4일 5일 이런식으로 한과목을 몰아서 끝내버립니다. ^^ 완전 달라서 당황스러웠습니다. 
(여행계획 짜실때 꼭 참고하세요 )","국제교육부는 따로 이용하지 않았던거 같네요. 
Elke라는분에게 이메일이나 직접 찾아가면 친절히 가르켜줍니다. 
단 업무시간 준수하시고요.","딱히 공식적으로 동아리가 있지는 않습니다. 
하지만 일주일에 요일별로 지정된 스포츠 활동은 누구나 참가할수 있어서 좋았습니다. 저는 월요일 오후 8시부터 학교 뒤 체육관에서 진행된 농구모임에서 가서 종종 운동을 하고 했습니다. (누구나 와서 할수 있음) 다른 요일에는 배드민턴,배구등등의 운동을 한다고 합니다.","자연스러운 볼인사. 
그리고 사우나는 남녀같이 씁니다.(누드에 대한 거리낌 없는 문화) 
언제 어디서든 자기술은 꼭 사가지고 챙겨가는 문화.
직접 경험해보는 것이 최고라고 생각됩니다.","쿠프슈타인에는  한국인 교환학생들 제외하고는 한인이 없습니다. 
추천해주고 싶은건 외국에 나갔으니 친구들 많이 사귀어서 필요한때에 적절히 활용하라 입니다. (반드시 독일인 친구나 오스트리아 친구가 있으면 좋은거겠죠? )","말씀 드렸다 시피 Kufstein은 독일에서 불과 차로 30분도 안되는 곳에 있습니다.  오스트리아가 아니라면 항상 언제 어디서든 무조건 여권은 잘 챙겨가지고 다니세요. 열차에서 사복경찰들이 여권검사 하는데 잘못걸리면...정말 독일경찰서 갑니다. 실제 그런 케이스 있어다고도 합니다. 

한국 들어오니 역시나 다시 가고 싶어지는군요. Kufstein을 평생 여러분의 기억에 남기세요."
"쿠프슈타인은 오스트리아와 독일의 국경지점에 위치한 곳으로, 기차로 1분 정도면 독일로 들어서고, 1시간 정도면 뮌헨에 발딛을 수 있습니다. 교통의 중심인 뮌헨과 가까이 위치한 덕분에 뮌헨 출발, 뮌헨 종점의 기차들이 많이 경유하여 인접한 국가로 여행하기 편하고, 쿠프를 직접 경유하지 않는 노선은 뮌헨에서 환승하여 대부분 닿을 수 있습니다. 저같은 경우는 여행 이외에도 씨티은행, 한인마트 등을 이용하러 뮌헨에 자주 갔었는데 이 때 친구들과 바이에른 티켓(28유로, 바이에른주 내에서 하루종일 5명까지 동시 이용가능)을 이용하면 싸게 다녀올 수 있습니다. 또 쿠프슈타인은 인접한 잘츠부르크나 인스부르크에 밀려 잘 알려지진 않았지만, 오스트리아의 전통적이고 평화로운 분위기와 알프스산맥의 자연을 즐길 수 있는 관광지이기도 한데요, 유럽내에서는 스키로 매우 유명합니다. 실제로 100개가 넘는 슬로프가 있는 스키장이 10~20분 정도 거리에 위치해있고, 겨울에는 스키장까지의 셔틀버스가 한시간에 1~2대 꼴로 운영됩니다. 장비는 포함되지 않지만 시즌권이 비싼편이 아니기 때문에 스키를 좋아하시는 분들에게 완전 추천드리고, 그렇지 않더라도 스키장 자체가 장관이기 때문에 한번쯤 가보시길 권합니다. 유럽애들은 스키타러 쿠프슈타인으로 교환 오는 경우가 꽤 많았습니다. 기후는 매우 추울거라 생각했었는데 한국보다 덜 추웠던것 같고 눈은 꽤 많이 오는데 덕분에 눈싸움도 할 수 있고, 맥주를 눈에 묻어놓을 수도 있고, 설경도 훌륭해 좋았습니다. 교환대학의 크기라고 하면, 3층 건물 한동으로 구성되어 있습니다. 하지만, 건물이 작은편이 아니고 학생수도 많지 않기 때문에 번잡하지도 않고 통유리로 둘러싸인 잘 지어진 현대식 건물이어서 굉장히 만족하며 지냈습니다.","알프스산맥에 둘러싸여있고 그 가운데에는 인강이 흐르고, 색색의 예쁜 건물이 늘어선 노년을 보내기 좋을 것 같은 조용한 마을입니다. 심심하게 느끼시겠지만 조금 살다보면 마음이 여유로워지고, 평안해져 고향같은 애착을 느끼게 됩니다. 한참을 여행하다가 지쳐서 돌아와 인강과 밤풍경을 보면 고향에 온 것같은 애뜻함과 감사함을 느낄 정도입니다. 그래도 쇼핑몰, 대형마트, 펍, 클럽, 스포츠 배팅이 가능한 바, 축구장, 아이스링크, 야외수영장, 헬스장 등 있을 건 다 있으니 걱정하지 않으셔도 됩니다. (실내수영장은 기차로 한 정거장 가야 있고, 헬스장 / 아이스링크는 유료로 이용가능합니다)","밑에도 있지만; 거주형태는 크게 ISR (학교연계 기숙사), FMZ (사설기숙사), 일반 Rent 로 구분할 수 있습니다. 저는 ISR에 살았는데 장점은 가장 비용이 싸고, 친구들을 자주 많이 볼 수 있다는 것, 파티 끝나고 그냥 방에 들어가서 자면 된다는 점, 시설이 깔끔하다는 점, 유료긴 하지만 세탁기 (1회 세탁, 건조 각 1유로씩) 가 있다는 것, 룸마다 스토브/냉장고/싱크대가 있다는 점, 2인실도 방은 나눠져 있다는 점, 인강 바로 옆에 위치했다는 점 입니다. 단점은 무선인터넷이 안되고, 방음이 잘 안된다는 점, 12시가 지나면 휴게실에서 파티를 못하게 한다는 점, 학교에서 15분 걸린다는 점, 같은 국적의 학생을 룸메로 해준다는 점 이었습니다. FMZ는 ISR에 비해 조금 넓고, 더 깨끗하나 월 100유로 정도 더 비쌉니다. 위치는 ISR에서 3분 정도 거리라서 큰 장단점은 없습니다. 그리고 일반 렌트는 복불복 경향이 좀 있습니다. 대부분 깔끔하고 쾌적하나 친구들이 주로 사는 FMZ/ISR이랑 정반대여서 곤란한 경우도 있고, 세탁기가 없어 친구네집가서 해야되는 경우도 있습니다. 하지만 20평가량의 커먼룸이 있어 자연스럼 모임장소가 되거나, 학교 1분거리에 위치하거나, 시도 쓸 수 있을 것 같은 전망을 즐길 수 있거나 하는 부러운 경우도 꽤 있습니다. (ISR에 사시기로 결정하셨다면, 교환학생 발표가 나자마자 신청하시는 것이 안전합니다. 티오가 한정되어 있어서 떨어졌다는 친구들이 꽤 있었습니다.) 식사는 학교 까페테리아에서 간단히 샐러드나 빵 혹은 학교 앞에서 조각피자나 케밥을 먹거나 대부분 해먹게 됩니다. 저도 요리라곤 해본 적도 없었는데, 장보는게 일과가 되고 다같이 해먹는 즐거움을 느끼고 돌아오게 되었습니다. 이외에 외식하고 싶은 날에는 올드스트리트 주변의 음식점들이나 맥도날드를 이용할 수 있습니다. 밤에는 특별히 펍에 가지 않아도, 마트에 즐비한 맛있는 맥주와 소세지를 쟁여놓고 친구들 몇명 불러 한잔씩 하는 재미가 매우 좋습니다.","교환학생만을 대상으로하는 인터네셔널 코스, 영어로 진행되는 레귤러 코스, 영어로 진행되는 마스터 코스 중 골라서 들으시면 됩니다. 수업들이 모두 단기코스이기 때문에 깊이있게 공부하기에는 한계가 있지만 두에나스 교수님의 전략쪽 수업과, 플로츠 교수님의 재무쪽 수업은 매우 좋았습니다. 두에나스 교수님은 5개 정도의 클래스를 맡으시는데 제가 들었던 Innovative Business Model과 Strategic Innovation 은 최신사례와 이론을 바탕으로한 수업으로 유용했고 재밌었습니다. 단지, 3~4번 정도의 팀 프로젝트의 압박이 있어 수업을 듣는 기간 동안은 좀 빡셉니다. 플로츠 교수님 수업은 수업시간에 열심히 필기하고, 시험기간에 공부 좀 하면 남는것도 있고 성적도 무난히 받을 수 있습니다. 모든 수업에 A를 받겠다고 생각하시는 분들은 작은학교라고 방심하시지 말고 한국에서처럼 열심히 공부하시길 권장합니다. 아, 두에나스 교수님 수업은 정원이 정해져 있기 때문에 출국 전 수업 수요조사 때 무조건 체크해 두시는게 좋습니다. 도착해서 뺄 수는 있지만 추가로 넣기는 힘듭니다. 도서관은 학교 2,3층에 있고 경영관련 서적들이 꽤 많지만 대부분 독어라서 활용하기는 힘듭니다. 나른한 오후에 통유리옆 책상에서 햇빛 받으며, 혹은 내리는 눈을보며 독서하거나 인터넷하기에는 매우 훌륭합니다.",Elke라는 분만 알면 됩니다. 태도는 불친절하지만 그렇다고 안해주는 건 없습니다. 특히 초반에 수강신청 및 변경할 때 많이 찾게 됩니다. 모두 Elke 혼자 처리하는 철저한 수동시스템이라서 자주 변경하면 짜증스러운 반응을 보이지만 그냥 웃어 넘기시면 알아서 잘 처리해 줍니다. 퇴근은 매우 일찍하는 것 같으니 되도록 오전에 방문하시길 권장합니다.,"학교내에 컴퓨터실이 있고, 학생증으로 몇장까지 무료로 출력할 수 있습니다. 이후에는 충전하셔서 쓰면되고, 스캔도 가능합니다. 교내 무선인터넷도 가능하며 팀플할 수 있는 작은 공간도 있습니다. 이외 특별한 동아리활동은 없지만, 스포츠 소모임이 운영됩니다. 축구, 농구, 클라이밍 등이 있고 특별한 가입절차 없이 주 1~2회 정도의 정해진 시간, 장소에 나가면 됩니다.","대부분의 유럽국가에 해당되는 얘기지만, 마트나 상점들이 7시쯤 되면 문을 닫고, 일요일에는 열지도 않는다는 것 정도입니다.",학교생활은 Elke를 통하면 대부분 해결할 수 있습니다. 자매결연을 맺은 한국대학이 꽤 많기때문에 필요한 한국물품들은 교환학생끼리 자체해결이 가능합니다. 한국음식이 그리울 때는 뮌헨의 한인마트를 이용하실 수 있습니다.,"저는 번잡한 곳 보다는 여유를 느낄 수 있는 곳, 그래도 많이 보고, 듣고, 느낄 수 있는 곳을 찾았기 때문에 쿠프슈타인을 리스트에 올렸습니다. 사실 들어보지 못한 작은 도시, 학교여서 덜컥 됐을때는 좀 불안했지만, 6개월이라는 짦은 시간동안 앞으로 계속 그리워할 추억과 친구들을 얻고 돌아왔습니다. 단순히 생각하면 교환학생은 자기가 간 곳이 최고가 아닐까 생각합니다. 어딜 가시든 다시는 없을지도 모르는 기회를 한껏 즐기시길 바랍니다."
