gen_info,env_info,food_info,study_info,office_info,facil_info,mhct_info,help_info,etc_info
교환학생 생활하면서 우산을 한번도 쓰지 않았을 정도로 거의 항상 맑습니다.9월엔 한국 가을보다도 따뜻하고 맑아서 날씨가 매우 좋은 편입니다.10월 말정도부터는 한달에 3~4일 정도의 빈도로 영하 20도 정도로 급격하게 추워지는 날이 있습니다. 그 때부터는 눈도 자주 오게 되는데 날씨가 춥다보니 눈이 잘 녹지 않아 눈덮인 풍경을 자주 보게 되었습니다.,"기본적으로 캘거리가 서울보다 면적이 조금 넓은 것에 비해 인구수는 10분의 1 수준이라 인구밀도가낮아서 서울과 상당히 다른 풍경이었습니다. 캠퍼스 안에 주점, 식당 등 대부분의 편의 시설이 다 있습니다만 캠퍼스 바로 바깥에는 주택가나 병원정도만 있습니다. 다운타운과 조금 떨어져 있어서 다운타운까지 학교 주변에서 버스를 타고 20~25분 정도 걸립니다.기숙사에서 바로 탈수 있는 버스로 10분 정도의 거리에 Safeway이라는 슈퍼마켓이 있고, 20분 정도의 거리에 Walmart westbrook과 한인마트 E-mart가 있는 곳에 도착할 수 있는데 저는 장을 볼 때 월마트가 더 싸고 한인마트도 근처에 있어서 조금 더 걸리더라도 westbrook 쪽으로 주로 갔습니다.다운타운에서 버스로 3~4시간 정도로 밴프 국립공원에 도착할 수 있는데 경관이 정말 멋져서 캘거리 시내보다도 밴프 국립공원에 더 자주간 것 같습니다. 9월까지는 싼 가격에 버스를 이용할 수 있는데 10월정도부터 가격이 많이 비싸져서 친구들과 렌트카를 타고 갔습니다.또한 제가 경험한 것과 현지 친구들의 말을 고려하면 다운타운이나 캠퍼스 치안은 상당히 좋은 것 같습니다.","저는 Olympus Hall이라는 기숙사에서 지냈습니다. 많은 친구들을 만날 수 있고 가격도 저렴해서 4인실에서 거주했는데 룸메들이 서로 잘 배려해줘서 큰 불편함 없이 잘 지낼 수 있던 것 같습니다. 기숙사 신청을 하면서 방을 고르게 되는데 방을 이미 고른 사람들의 프로필을 볼 수 있어서 참고하시면 도움이 많이 될 것 같습니다. 제 기억으로는 상대적으로 Aurora hall 같은 신축 건물들이 먼저 신청되어 이미 마감되었던 것으로 기억합니다. 식사로는 밀플랜은 한번도 먹지 않고 대신 대부분의 끼니는 직접 요리해서 먹거나 교내 학생회관의 식당가, 기숙사 주변의 도미노피자로 해결했던 것 같습니다. 저도 한번도 먹진 않았지만 밀플랜이 학생회관의 식당가랑 비교했을 때 가격 측면에서의 장점도 없고 그렇게 맛있지도 않다고 들어서 굳이 미리 여러개를 살 필요는 없는 것 같습니다. 기본적으로 밖에서 사먹을 때 음식의 가격이 만원부터 시작하여 비싼 편이기 때문에 파견 전 요리를 잘 하지 않았음에도 불구하고 주로 요리를 하여 끼니를 해결하였습니다","선수과목에 대해서 선수과목을 듣지 않으면 전산적으로 아예 수강신청을 하지 못하도록 막아서 선수과목인정을 받아야 하는데 학과에서 답변을 잘 해주지 않아서 수강을 할 수 없었던 과목도 있었고, 수강변경 마지막 날까지도 학과 사무실에 찾아가야 했습니다. 수강신청만큼은 미리 준비하면 좋을 것 같습니다. 절대평가기 때문에 본교와 비교했을 때 조금 더 쉽다고 생각하지만 과제가 많은 편이고 교환학생의 특성상 단순히 공부에만 매진하기엔 어렵기 때문에 좋은 성적을 받기가 쉽지만은 않다고 생각합니다. 현지 학생들을 보면 대부분 4과목 정도 수강하는 것으로 보이는데 저는 5과목을 들어서 과제나 시험준비에 꽤 많은 시간을 할애했습니다. 교재비는 최대한 pdf로 대체하거나 학교 서점에서 판매하는 중고책을 이용했습니다.Taylor Family Digital Library를 줄여 TFDL이라는 도서관이 있는데 많은 자리에 컴퓨터가 설치되어 있어서 좋았습니다.",학교 국제처에서 언어교환터 다운타운 투어나 밴프 투어등 다양한 프로그램을 제공하기 때문에 이메일 뉴스레터 구독을 통해 소식을 받아보시면 도움이 많이 될 것이라고 생각합니다.,"학교의 거의 모든 건물이 실내로 오다닐 수 있도록 연결되어 있고 교내에 수영장, 헬스장 등 체육 시설이 매우 잘 구비되어있고 학생은 무료로 이용가능한 것으로 알고 있습니다. 또한 필라테스나 수영 강의 등 프로그램도 잘 되어있고, 등산에 필요한 등산화와 스파이크와 같은 장비를 저렴한 가격에 대여할 수도 있어서 좋았습니다. 동아리는 개강 후 조금 뒤 학생회관에서 한인 동아리, 스키나 봉사활동 동아리 등 다양한 동아리들이 참여하는 박람회를 여므로 참고하셔서 결정하시면 좋을 것 같습니다.",기본적으로 다문화국가기 때문에 다양한 인종들이 있어서 인종차별 걱정은 안하셔도 될 것 같습니다.사람들이 잘 웃고 버스를 탈 때 감사인사를 드리는 등 서로 배려하는 모습이 눈에 띄었습니다.대마초가 합법이기 때문에 늦은 저녁 다운타운에 가끔 대마를 피는 모습을 볼 수 있었습니다,"교환학생 준비에 있어서 필요한 거의 모든 정보는 홈페이지에 있고, 국제처에 이메일을 통해서도 많은 도움을 받을 수 있었습니다.",서울같은 대도시에 비하면 확실히 캘거리는 작은 도시지만 사람들도 정말 친절하고레이크 루이스와 같은 멋진 자연도 볼 수 있었고 많은 경험을 할 수 있어서 좋았습니다.
거의 항상 맑아서 교환학생 생활하면서 우산을 한번도 안 썼을 정도입니다9월엔 한국 가을보다도 따뜻하고 날씨가 엄청 좋습니다만 10월 말정도부터는 한달에 3~4일 정도의 빈도로 영하 20도 정도로 급격하게 추워지는 날이 있습니다. 그 때부터는 눈도 자주 오게 되는데 날씨가 춥다보니 눈이 잘 녹지 않아 눈덮인 풍경을 자주 보게 되었습니다.,"기본적으로 캘거리가 서울보다 면적이 조금 넓은 것에 비해 인구수는 10분의 1 수준이라 인구밀도가낮아서 서울과 상당히 다른 풍경이었습니다. 캠퍼스 안에 주점, 식당 등 대부분의 편의 시설이 다 있습니다만 캠퍼스 바로 바깥에는 주택가나 병원정도만 있습니다. 다운타운과 조금 떨어져 있어서 다운타운까지 학교 주변에서 버스를 타고 20~25분 정도 걸립니다. 기숙사에서 바로 탈수 있는 버스로 10분 정도의 거리에 Safeway이라는 슈퍼마켓이 있고, 20분 정도의 거리에 Walmart westbrook과 한인마트 E-mart가 있는 곳에 도착할 수 있는데 저는 장을 볼 때 월마트가 더 싸고 한인마트도 근처에 있어서 조금 더 걸리더라도 westbrook 쪽으로 주로 갔습니다.다운타운에서 버스로 3~4시간 정도로 밴프 국립공원에 도착할 수 있는데 경관이 정말 멋져서 캘거리 시내보다도 밴프 국립공원에 더 자주간 것 같습니다. 9월까지는 싼 가격에 버스를 이용할 수 있는데 10월정도부터 가격이 많이 비싸져서 친구들과 렌트카를 타고 갔습니다.또한 제가 본 것과 현지 친구들의 말을 고려하면 다운타운이나 캠퍼스 치안은 상당히 좋은 것 같습니다.","저는 Olympus Hall이라는 기숙사에서 지냈습니다. 많은 친구들을 만날 수 있고 가격도 저렴해서 4인실에서 거주했는데 룸메들이 서로 잘 배려해줘서 큰 불편함 없이 잘 지낼 수 있던 것 같습니다. 기숙사 신청을 하면서 방을 고르게 되는데 방을 이미 고른 사람들의 프로필을 볼 수 있어서 참고하시면 도움이 많이 될 것 같습니다. 제 기억으로는 상대적으로 Aurora hall 같은 신축 건물들이 먼저 신청되어 이미 마감되었던 것으로 기억합니다. 식사로는 밀플랜은 한번도 먹지 않고 대신 대부분의 끼니는 직접 요리해서 먹거나 교내 학생회관의 식당가, 기숙사 주변의 도미노피자로 해결했던 것 같습니다. 저도 한번도 먹진 않았지만 밀플랜이 학생회관의 식당가랑 비교했을 때 가격 측면에서의 장점도 없고 그렇게 맛있지도 않다고 들어서 굳이 미리 여러개를 살 필요는 없는 것 같습니다. 기본적으로 밖에서 사먹을 때 음식의 가격이 만원부터 시작하여 비싼 편이기 때문에 파견 전 요리를 잘 하지 않았음에도 불구하고 주로 요리를 하여 끼니를 해결하였습니다","선수과목에 대해서 선수과목을 듣지 않으면 전산적으로 아예 수강신청을 하지 못하도록 막아서 선수과목인정을 받아야 하는데 학과에서 답변을 잘 해주지 않아서 수강을 할 수 없었던 과목도 있었고, 수강변경 마지막 날까지도 학과 사무실에 찾아가야 했습니다. 미리 준비하면 좋을 것 같습니다.",,날씨가 비교적 쌀쌀하다보니 학교의 실내 건물들이 모두 이어져 있습니다. 또한 체육 시설이 정말 잘,기본적으로 다문화국가기 때문에 다양한 인종들이 있어서 인종차별 걱정은 안하셔도 될 것 같습니다.사람들이 잘 웃고 버스를 탈 때 감사인사를 드리는 등 서로 배려하는 모습이 눈에 띄었습니다.,거의 모든 정보는 학교 홈페이지에 있으며국제처에 이메일로 문의해도 잘 답변해 주십니다,
가을학기에 가서 8월 말에 캘거리에 도착했는데 기온이 15도 정도 밖에 되지 않아 조금 쌀쌀한 날씨였습니다.  캐나다에서도 내륙지방이라서 여름에도 기온이 많이 높지 않구요 겨울에는 굉장히 춥습니다. 저는 1월 초에 캘거리를 떠났기 때문에 극심한 추위를 느끼지는 못했지만 1~2월에는 평균 영하 20도 정도로 매우 춥고 눈이 많이 온다고 합니다. 해도 짧구요. 눈도 많이오고 춥기 때문에 학교는 기숙사에서 강의실까지 실내로 이동할 수 있는 통로가 많이 있습니다. 그리고 실내는 한겨울에도 반팔을 입고 다닐 정도로 굉장히 따뜻합니다. 다른 캐나다의 대학과 비교해서는 매우 크진 않습니다. 제가 느끼기에는 연세대학교 신촌 캠퍼스 보다 작은 느낌이었습니다.,C train 을 타고 15분에서 20분 정도 가면 시내로 나갈 수 있습니다. 음식점도 있고 쇼핑몰도 모여있습니다. 그리고 기숙사에서 걸어서 20분 정도 거리에서 마트가 있어서 식료품은 그곳에서 주로 사게 됩니다. 대학 주변은 딱히 번화가 느낌이라기 보다는 교외 느낌이 강합니다. 공기가 매우 좋고 주택이나 아파트?같은 건물 몇채를 빼고는 아무것도 없다고 봐도 무방합니다ㅎㅎ,"저는 2인실을 사용해서 룸메이트 한명과 함께 생활했습니다. 방 2개, 화장실 2개, 거실과 주방은 공유하는 형태였습니다. 처음 2인실을 선택한 이유가 화장실이 2개라서 각각 쓸수 있겠단 생각으로 선택했는데 욕실과 변기가 각각 하나씩 있는 상태라서 둘다 쉐어 해야했습니다. 식사는 학교 식당에서 사먹기도 하고 직접 해먹기도 했는데 학교 식당 식사는 뷔페식으로 되어있고 아침은 9불, 점심 12불, 저녁 16불 정도로 한국 학식에 비하면 비싼 편입니다. 학교 식당은 한끼마다 돈을 내고 사먹어도 되고 매일매일 먹을 수 있는 것을 신청하거나 한꺼번에 120끼, 또는 200끼 정도를 사서 학생증으로 매번 먹을때마다 스와이프가 차감되는 형식도 있습니다. 예전 파견 보고서를 봤을때는 환불이 된다고 봐서 120끼 짜리를 사먹고 남으면 환불을 해야지 하는 생각이었는데 제가 갔을땐 환불이 안된다고 해서 마지막 까지 꾸역꾸역 먹었습니다. 4개월동안 120끼면 모자랄것 같았는데 생각보다 많이 안먹게 됩니다. 혹시 가시는 분들은 그냥 필요할때 그때 그때 사드시는게 나을 것 같아요.","저는 이대학을 선택한 이유가 저희 교수님이 이곳에서 공부를 하셨고 이 학교가 키네시올로지 학과로 유명한 학교였습니다. 저희 학교 체육계열은 스포츠응용산업학과와 체육교육학과 두 학과가 있는데 이 학교로 교환학생을 오시려면 스포츠응용산업학과보다는 체육교육학과에 유리할 것이라는 생각이 들었습니다. 선수과목으로 해부학이라든가 생리학 같은 수업을 들어야지 신청할 수 있는 수업이 많았는데 스포츠응용산업학과의 경우에는 이러한 수업이 개설되어있지 않아서 저는 수강신청을 할때 많은 어려움을 겪었습니다. 스포츠응용산업학과 학생들도 체육교육과 해부학, 생리학 같은 수업이 전공학점으로 인정이 되기때문에 운동역학쪽으로 관심있는 학생들은 이러한 선수과목을 미리 듣고 가시기를 추천합니다.도서관 같은 경우 연세대학교 중앙도서관 보다는 작지만 공부하기에는 매우 좋은 환경이라고 생각합니다. 우리 학교의 경우 미리 자리를 예약을 하고 정해진 시간 내에 이용하는것으로 되어있지만 캘거리 대학교의 경우는 예약을 따로 할 필요 없이 자리가 나면 이용하실 수 있습니다.",,운동 관련 동아리가 굉장히 많습니다. 또한 체육시설을 이용하기에도 좋구요. 기숙사에 생활한는 학생들을 위한 운동 프로그램이 매일매일 다르게 있을정도로 다양합니다. 그리고 학교에 국제학생들이 도움을 받을 수 있는 곳이 있는데 이곳에 가면 국제학생들을 위한 여행 프로그램이나 교류 프로그램등이 많이 있습니다. 메일을 통해서 소식을 받기도 하고 게시판을 이용하기도 합니다.,캐나다의 경우 2018년 10월 부터 대마가 합법화 되었습니다. 하지만 우리나라는 속인주의이고 마약에 관련된 법이 엄격하기 때문에 캐나다로 교환학생 가시는 분들은 모두 주의해야 하겠습니다. 그리고 학생들의 수업 참여도가 매우 높은 편입니다. 저는 댄스 수업과 정치 관련된 수업을 한번 들은 적이 있었는데 댄스 수업에서 수줍어 하는 학생들도 많았지만 다들 매우 적극적으로 참여했고 정치 관련 수업에서도 매우 열띤 분위기에서 서로 토론하는 수업을 들었을때 매우 놀랐습니다.,수강신청을 할때 선수과목을 듣지 않아서 들을 수 없는 수업들이 많아서 곤란함을 겪던 중 어드바이저를 찾아갔습니다. 과마다 있고 매우 친절하십니다. 저에게 들을 수 있는 수업이 무엇이 있는지 같이 찾아주셨고 선수과목을 들었는데 어떻게 인정을 받아야 하나 고민할때 어드바이저가 도아주어 수강신청을 할 수 있었습니다. 그리고 캐나다의 경우에는 외국인의 이민을 적극적으로 장려하는 국가인데 학교에서는 국제학생들을 위한 취업 프로그램이 많이 있습니다. 취업 상담부터 이민까지 매우 자세하게 설명해주시니 관심 있는 학생들은 찾아보는것도 좋겠습니다.,
