gen_info,env_info,food_info,study_info,office_info,facil_info,mhct_info,help_info,etc_info
"Mcgill 대학교를 가시는 여러분 ! 꼭 겨울이 아닐 때 가시기를 추천드립니다 저는 정말 얼어죽는 줄 알았어요.. 가을 단풍 캐나다 좋지 이러고 별생각 없이 지원했다가 허허 겨울에 캐나다로 갈줄 누가 알았겠어요. 제가 갔던 2020년에는 이상기후로 정말 추웠던 주는 1주일 정도 영하 20도 정도까지 내려갔는데 그때만 그런게 아니라 그냥 영하 10도면 감사하는 날씨의 연속이었어요. 하의는 래깅스 히트택 입고 바지입고 거기서 산 눈 부츠 신고 위에는 내의 히트택 니트 겉옷 패딩잠바 이렇게 입었고 목도리 필수에 장갑 필수에 귀 가릴 모자 필수에요... 이정도면 아시겠죠? 지리적 위치는 사실 좋은편인거 같아요. 몬트리올이 정말 작은 도시라 저는 거의 모든 곳을 걸어다닐 정도..? 물론 무제한 지하철권 끊어서 정말 신나게 돌아다녔죠 그래도 뭐 생활하기에는 지장 없이 모든게 가까이 있는 편이에요 Mcgill 자체의 크기는 조금 큰편 ? 인데 어차피 가는 건물들이 정해져있어서 자기 수업하는 건물들만 가게 될거에요 저는 경영관에서만 거의 박혀서 생활했던 것 같아요 학교 안에서는 ㅎㅎ,,,",대학교 주변에는 잘만 돌아다니면 ! 뭔가가 많긴 해요 숨어있고 잘 모르면 아무도 알려주지 않고 지하세계에 묻어있어서 여기를 사실 안가보면 정말 아무것도 없는 도시라고 생각할 정도로 ㅎㅎ... 저는 혼자 너무 많이 돌아다녀서 지하세계를 정말 뚫고 개척하고 다녔는데요 (혼자 시간이 너무 많아서 길치인데도 이렇게 되더라고요) 혼자 이렇게 탐험하는거 좋아하시는 분들이면 개척해내는 재미가 쏠쏠해요. 학교에서부터 거의 모든 곳들이 지하로 어찌어찌 mall들 여러개 끼고 연결은 돼있어요 다만 엄청 구불구불하고 백화점에 백화점에 백화점의 연속일 뿐이죠. 하지만 다르게 말하면 ! 정말 재미있게 눈호강하면서 맛있는거 구경도 하고 돌아다닐 곳은 많다는 거에요,저는 Evo Montreal 2인실에 살았어요 학교 기숙사보다는 비싸긴 한데 그래도 언제 이런곳에 살아볼까 싶어서 여기로 갔어요 호텔같은 시설이에요 외국인들이랑도 사교성이 좋다면 친구를 많이 만들 수 있어요. 각 층마다 공용 주방이 있어서 거기서 요리하다보면 왔다갔다 하는 그 층의 애들한테 말 붙여서 친해지기도 하고 그럴 수 있죠. 하지만 먼저 말걸지 않는 수줍한 한국 스타일이시라면 외국애들 사이에서 기죽기는 딱 좋은 환경이긴 해요. 그냥 좋은 와이파이에 호텔체험 할 수 있는 그런 곳이랄까. 밥은 그래서 저는 일주일에 한번씩 장을 봐서 주로 해먹기도 하고 일주일에 두세번 정도는 친구랑 사먹었어요. 아침은 과일류나 씨리얼으로 때우고 점심은 학교에 도시락 싸가서 같이 먹고 저녁은 집와서 요리해먹고 그러는 재미로 살았죠. 식재료가 그나마 싼 편이라 스테이크 많이 구워먹고 연어도 많이 먹었던거 같고 외국 음식들이 양이 진짜 많아요 밖에서 사먹으면 그래서 그거 배터지게 먹을 수 있고 좋아요,수업 저는 보통 경영학과 수업들을 들었어요 제가 조금 특이하게 수학이나 IT쪽에 관심이 있었어서 그런 분야를 많이 들었던거 같아요 simulation of management systems  - 통계가 섞인 경영과학 느낌 managing data and database ? 실습도 매일 할 수 있는 sql base 수업 technological entrepreneurship- 창업 관련 수업인데 팀플의 끝판왕이라 보면 돼요 systems analysis and modeling - IT업계와 경영의 연계를 배울 수 있는 과목 managing information technology ? IT업계의 트랜드를 배울 수 있는 수업 가서 보시면 아시겠지만 실제 과목에서 배우는 내용들 보다는 외국애들이 어떻게 수업을 임하고 어떤 자세로 참여를 하고 어떻게 생각하는지를 배우는게 더 중요해요. 그리고 실제로 그런걸 더 배우고 오게 될거에요. 그래도 본인의 취향에 맞는 수업을 들으면 더 재밌긴 하겠죠 ?,저는 처음에 수강신청 메일을 보냈을 때 선수과목들이 인정이 뭐가 잘못돼서 5과목 중에 한과목 신청된걸 개학 일주일 전에 알았어요. 그래서 부랴부랴 개학 3일 전에 국제 교육부에 찾아가서 상담을 받았는데 너무 친절하게 문제 없다고 그 자리에서 확인하고 넣어주시고 남자친구랑 같이 갔었는데 캐나다에 온걸 환영한다고 수다도 잠깐 떨고 반겨주셔서 긴장 풀 수 있었어요. 가서 3학점 듣고 올까봐 얼마나 마음 졸였는지 몰라요. 근데 학기 시작하고는 국제교육부가 수강 신청에 문제생긴 교환학생 애들로 미여터지니까 개학 하기 전에 꼭 가세요.,동아리 뭐 많긴 한데 지들끼리 노는 분위기라 딱히 하실건 없으실거에요. 저는 춤동 하고 싶긴 했는데 겨울이라 연습하러 가기도 귀찮을거같아서 알아만보고 안하긴 했는데 urban groove라는 동아리가 정말 잘하긴 해요. 걔네 빼고는 이상한 salsa 동아리 있었는데 동아리 박람회때 갑자기 저 잡고 같이 스텝 밟으라해서 당황하긴 했네요..,제일 컸던건 아마 개인주의? 이건 걔네의 모든 생활을 관통하는 사상이에요. 수업 시간에도 남들 눈치 안보고 지각해도 당당하게 웃으면서 인사하면서 들어오고 모르는거 있으면 손 번쩍들고 질문하고 남 눈치를 거의 안봐요. 한겨울에도 얼어죽을거같은데 레깅스에 크롭 입고 지들도 추웠는지 거기다 목도리에 캐나다 구스 입고 다녀요 정말 웃겨요 그리고 약간이 아니라 매우 인종끼리 다녀요. 중국인은 중국인끼리 아예 중국어만 하고 다니고요 하얀 애들은 보통 하얀 코높은 애들끼리 다니고요 동양인들은 보통 동양인들끼리 다녀요. 처음에는 내가 이러려고 갔나 싶기도 한데 어쩔 수 없는거긴 한거같아요. 그 안에서 최대한 많이 배우고 최대한 인맥을 넓혀보고 부딫혀보세요. 그러다보면 서양애들도 사귈 수 도 있고 그 벽있는 웃음을 접하시게 될거에요 하하,그냥 모르는거 있으면 구글링 해보시고 가기전에 궁금한거 있으시면 저한테 메일하세요 skyyaeji@naver.com 가셔서 모르시는거 생기시면 그냥 대놓고 물어보는게 제일 빠를거에요 혼자 고민하지 마세요,
몬트리올에 위치한 맥길대학교는 큰편이라서 수업을 어디서 듣는지 먼저 조사가 필요합니다. 그곳은 1월초에 개강을해서 매우 춥기는 하지만 개인적으로는 눈이 많이오는 곳이라서 경치가 매우 아름답습니다. 겨울에는 옷을 여러겹으로 입고 다녀야합니다.,대학교 5분거리에는 큰 mall과 작은 편의점 또한 마트들이 많이 있습니다. 근처 다양한 음식점들도 많이있고 옷가게등 필요로하는 모든 생활용품 등은 쉽게 구할 수가 있습니다. 또한 버스와 전철등 교통시설이 편리하게 잘되있어서 어디든지 쉽게 다닐 수 있습니다.,학교에서 교환학생들을 위한 기숙사에 거주했습니다. 맥길기숙사는 기숙사마다 건물들이 다 각각다른 형태입니다. 학교 사이트에 자세히 나옵니다. Pine Avenue 기숙사비는 적당하지만 기숙사는 언덕에 자리잡고 있습니다. 장점으로는 같은 교환학생들과 함께 있으므로 다양한 나라의 친구들을 만나기 쉬운편입니다. 주의할것은 학교에 근접한 기숙사도 있지만 학교에서 멀리 떨어진 곳도있습니다.그곳은 지하철로 통학해야합니다. 식사는 식품을 사서 만들어먹을 수 있도록 주방시설이 다 갖춰져있습니다. 또한 배달음식도 가능합니다.,수업은 개인에 따라 필요한 과목을 신청해서 수강하면 됩니다. 신청후 add/  period가 2-3주라서 자유롭게 수업에 참여해보고 계획표를 세울 수 있습니다. 강의 방식은 한국과 비슷한 편입니다.도서관은 크고 여러층으로 나누어져 있어서 팀과제 또는 개인적으로 공부하기에 좋습니다.,문의가있으면 이메일을 보내면 된다고 들었습니다.,"학기시작에 모든 동아리 모집 기간이므로 관심있으면 참석하면 됩니다. 총 3일동안 운동, 레크리에이션, 건강, 사업, 언어교육, 종교, 보드게임 등 여러가지를 광고하고 있으므로 자유롭게 가입 할 수 있습니다.",몬트리올 주는 언어가 영어와 불어를 쓰는데 학교에서 딱히 불어를 쓰는사람들은 적었니다만 campus 밖에 나간 순간 대부분 불어로 말합니다.,문의가 있으면 맥길사무처 또는 국제처에 이메일을 쓰면 대부분 알려줍니다. 정신상담도 교내에서 받을 수 있다고 합니다.,
"맥길 대학교는 도심에 위치하여 교통편이 편리하고, 캠퍼스가 큰 편에 속합니다. 제가 간 봄학기는 사실상 1월-4월이기에 날씨 자체는 겨울학기에 가까웠으며, 3월달까지는 눈도 많이 내리고 상당히 춥습니다. 4월부터는 날씨가 풀리기 시작하나 여전히 굉장히 쌀쌀했습니다.","대학 주변에는 맥길 게토라고 하여 학생들이 많이 거주하는 neighborhood, St.Catherine이라는 쇼핑몰, 음식점 등이 많은 거리, UQAM 및 Concordia University 등 타 대학교 등이 있습니다.",저는 McGill Off Campus Housing이라는 Facebook page에 가입해서 방을 구했습니다. 맥길 대학교 소속 학생들이 집 및 방을 내놓고 구하는 페이지이기 때문에 게시물들이 굉장히 많이 올라와서 이 페이지를 잘 활용하면 비싸지 않은 방세를 내고 쾌적한 집에서 살 수 있을 거예요. 저는 기숙사 생활을 너무 오래 하기도 했고 기숙사가 좀 답답한 듯해 다른 방을 구했으나 기숙사도 좋다고 알고 있습니다. 식사의 경우에는 따로 살았기에 많이 만들어서 먹었습니다. 근데 식당이 워낙 다양해 외식도 많이 했어요.,"수업은 좋았습니다. 저는 경영 대학에 다녔는데 발표형 수업, 참여형 수업이 아무래도 많았어요. 도서관도 크고 쾌적하고 좋았습니다.",국제교육부의 경우에는 가서 언제 어떤 주제로 상담받고 싶은지 데스크에 얘기하며 상담 날짜를 잡아줘서 그 날짜에 가면 상세한 상담 받을 수 있어 좋았습니다.,"사실 저는 extracurricular activity를 안 해서 동아리에 대해서는 잘 모르고요, 학기가 시작하면 activities night? 같은 게 있어서 체육관에 동아리 박람회 같은 걸 하니까 가보시면 좋을 거 같습니다.","일단 montreal이 속해있는 퀘벡 지역은 캐나다 전역과 다르게 프랑스어를 쓰는 비중이 압도적으로 높습니다. 가면 표지판, 가게 간판, 메뉴 등 모든 게 프랑스어로 적혀있고, 메뉴같은 경우는 영어로 작게 옆에 적혀있으나 표지판의 경우에는 영어가 없어 저는 조금 놀랐습니다. 또 사람들과 대화를 할 때 처음에는 무조건 프랑스어로 말을 걸기에 이런 점도 신기했어요. 하지만 다들 영어도 자유자재로 하니 의사소통은 크게 걱정 안 하셔도 됩니다. 물론 영어를 못하고 프랑스어만 할 줄 아는 분도 계시지만 그런 사람은 극히 드물어요","연세대학교 국제처, 맥길대학교 국제처 및 행정부? 에서 가장 많은 도움을 받았어요.",저는 desautels faculty of mgmt 에 다녔는데 혹시 문의하고 싶으신 점 있으면 heehyun.jeong@yonsei.ac.kr로 문의주세용
"크기는 연세대보다는 작지만 몽로얄 언덕에 자리 잡고 있어서, 강의실에 갈 때 오르막을 걸어야 하기는 합니다. 캠퍼스가 정말 다운타운에 위치해 있어서 장점이라면 다른 편의시설로 부터 가깝다는 것이고, 단점이라면 몬트리올 내의 다른 학교들이 있는 지역에 비해 방값이 비싸다는 것입니다. 저는 1학기에 갔는데 겨울은 정말 춥습니다. 1,2월에는 거의 항상 -20도 이하라고 생각하시면 되고, 3월부터 아주아주 천천히 따뜻해집니다. 4월까지도 겨울 외투를 계속 입었고, 5월까지도 니트와 스웨터 등을 입었습니다. 저는 겨울을 싫어하는 편이지만 어떻게 버텨지기는 합니다. 겨울에는 오후 4시에 해가 지고, 너무 추워서 야외 활동이 불가하다는 점이 힘들 수 있습니다. 눈도 정말 많이 오니까, 도착하시면 바로 겨울 부츠를 사세요. 한국 제품은 몬트리올의 눈을 막을만큼 강하지 않으니, 꼭 현지에 가셔서 사기를 추천드립니다. 눈도 많이 오고 눈이 녹으면 도심에 눈 녹은 물이 강처럼 흐르는데, 이 때 겨울 부츠 없으면 걸어다닐 수가 없을 거에요.","위에 말했듯 다운타운에 있어서 쇼핑몰 등 편의 시설에서 가까워요. 다만 신기하게도 맥길 주변에는 대학가임에도 불구하고 식당이 그리 많지 않습니다. (Concordia라고 지하철 역으로 두 칸 떨어진 학교가 있는데, 그 주변에 가야 식당이 많아요.) 그래서 학기중에는 점심 도시락을 집에서 싸가는 경우가 많았습니다. 맥길 주변에 Opiano라는 한식당이 있는데 제육덮밥이 먹을만해서 가끔 갔습니다.","저는 학교에서 걸어서 15-20분 정도 떨어진 곳에서 쉐어 하우스 형태로 살았습니다. 월세는 CAD 600이었는데, 돈을 조금 더 내더라도 방 컨디션이 좋은 곳에 머물기를 추천드려요. (보통 CAD 600-800 정도 내는 것 같습니다.) 방을 찾는 방법으로는 주로 학기 시작하기 1달 전 쯤에 페이스북에서 구할 수 있습니다. montreal apartment, mcgill off-campus housing 등의 페이스북 그룹에 세입자를 찾는 글이 많이 올라옵니다. 저는 처음에 구했던 방이 학교에서 너무 멀어서 (버스로 30분) 2월에 새로운 아파트로 이사했었어요. evo라는 사설 레지던스에 사는 경우도 종종 봤어요. 저는 개인적으로 방을 검색하고 찾고 하는 것은 귀찮지만, 1인실 가격을 비교했을 때 쉐어 하우스에 사는 것이 훨씬 저렴해서 이 쪽을 택했습니다. on-campus housing 그러니까 우리나라로 치면 기숙사 같은 곳에 사는 친구들도 많았습니다. 그러면 대략 한 달에 CAD 800-900 정도 내는듯 했습니다. 교환학생들이 on-campus housing에 많이 살기도 하고, 같은 건물에 10명 이상의 학생들이 살아서 친구 사귀기가 상대적으로 쉬어 보이기는 했습니다.","저는 4학년이라서 전공 수업 3개만 들었는데, 고학년 수업이라 그런지 정말 힘들었습니다. 이미 들으셨겠지만 패스 받기가 정말 힘들어요. 수업 3개만 듣는데도 한국에서 수업 6개 듣던 것 만큼 열심히 공부해야 했습니다. 수업을 맨 처음에 들을 때 따라가기가 어렵거나 진행 방식이 익숙치 않아 당황하실 수도 있습니다. 수업을 잘 따라가지 못하는 것 같으면 교수나 TA에게 꼭 도움을 청하세요. 저는 TA office hour에 찾아가서 질문을 많이 했는데, TA마다 개인차는 있겠지만 정말 차근차근 알려주기도 하고 과제에 대합 팁도 알려줘서 많은 도움을 받았습니다. 맥길이 학교가 큰 만큼 학생들이 도움을 받을 수 있는 시스템이 잘 되어 있습니다.",처음에 비자 관련 말고는 딱히 연락을 취한적이 없습니다. 그렇지만 문의를 했을 때 디테일하게 답변을 해주니 망설이지 말고 메일 등으로 연락을 취하세요.,"동아리 활동은 따로 하지 않았습니다.brown building에 학생 병원? 같은 것이 있습니다. 캐나다에서 외국인 신분으로 병원 가기는 비싸니까, 혹시 몸이 안 좋으면 여기를 잘 이용하세요. 학기마다 시스템이 다를 수 있지만, 갑자기 아파서 가는 경우에는 walk-in이라고 해서 아침 8시엔가 가서 번호표를 뽑고 대기해야 합니다. 1시간 정도 기다리면 접수를 할 수 있는데요, 번거롭기는 하지만 의무적으로 내게 되어있는 보험료로 인해 무료로 진료 받을 수 있습니다. 전문 의사와 얘기할 수 있고 필요하면 피 검사 등도 받을 수 있었습니다. 이 빌딩에 또 학생 상담센터가 있어요. 여기도 예약을 하지 않았다면 walk-in으로 아침 일찍부터 대기해야 하는데, 본인이 상담을 받고 싶다면 여기를 찾아가시기를 추천드려요.","문화 충격이라고 딱히 생각나는 것은 없지만, 도서관에서 시끄럽게 하는 사람들이 꽤 있다는 것 정도...? 연대만큼 도서관에서 완전 정숙을 하는 분위기는 아니라고 생각되었습니다.",,
