gen_info,env_info,food_info,study_info,office_info,facil_info,mhct_info,help_info,etc_info
"캐나다 앨버타 주에 위치한 University of Alberta 는 앨버타 주의 주도인 에드먼턴에 위치해 있습니다. 굉장히 길고 추운 겨울을 자랑하는 에드먼턴은 1, 2월에는 영하 2~30도의 기온은 기본이라고 생각할 수 있으며 시도 때도 없이 내리는 폭설에 겨울엔 건물 밖으로 나가는 것 조차 힘들어질 때도 있습니다. 심지어 5월에도 눈이 내리는 지역이기에 방심할 수 없게 만드는 곳이 에드먼턴이라 할 수 있습니다. 하지만 직접 가보신다면 건조한 기후와 그리 많이 불지 않는 바람으로 인해 눈에 보이는 수치로 경악한다 해도 그렇게까지 춥지는 않음을 알 수 있으실 겁니다. 하지만 가끔씩 영하 40도 정도까지 내려가는 날에는 체감기온은 더 떨어지기에 온몸이 얼어붙는 추위에 대비하실 필요는 있습니다. 캠퍼스는 굉장히 넓습니다. 연대 신촌캠과 비교했을 때 엇비슷한 크기라 생각하시면 됩니다. 하지만 어떤 수업을 듣느냐에 따라 수업을 듣는 건물이 굉장히 멀리 떨어져 있을 수도 있고 다 모여 있는 경우도 있습니다. 저는 디자인과의 수업을 들었기에 HUB과 바로 연결되어 있는 FAB 에서만 수업을 들었고 추운 겨울 수업을 듣기 위해 밖으로 나가는 일도 없었습니다. 또한 캠퍼스 내에 버스와 지하철이 모두 지나다니기 때문에 교통에 큰 불편함 없이 다닐 수 있습니다.","에드먼턴은 조용한 도시입니다. 학교에서 지하철이나 버스를 타면 10~20분내로 다운타운에 갈 수 있게 근접한 위치에 있지만 번화하지는 않았습니다. 게다가 이른 시간에 닫는 가게들이 많기 때문에 한국과 비슷한 대학가를 생각하신다면 당황하실 수도 있으리라 생각합니다. 놀기에는 부족한 곳이지만 공부하기에는 굉장히 적합한 곳이라 생각합니다. 서울과 비교했을 때, 또 캐나다의 다른 대도시인 토론토나 벤쿠버와 비교했을 때 에드먼턴은 굉장히 작은 도시지만 버스로 30분 정도 타고 나가면 북미대륙에서 가장 큰 규모의 쇼핑몰이라는 소문을 들은 West Edmonton mall 이 있습니다. 쇼핑몰 내에 워터파크와 놀이공원이 자리하고 있다 하면 그 크기를 대충이나마 짐작하실 수 있을 것입니다. 어지간한 브랜드는 다 이곳에 위치해 있어 간혹 심심할 때면 WEM에 가서 시간을 보내실 수 있을겁니다.","앨버타 대학교에는 HUB, Lister, International House, East Campus Village 등 여러 형태의 기숙사가 있습니다. 전 HUB에 살았고 다른 기숙사들에 대해 알고 있는 것은 다른 파견보고서와 학교 홈페이지에서 본 정보가 다이기에 별달리 특별하게 적을 수 있는 게 없어 HUB위주로 설명을 드리겠습니다. HUB는 4종류의 기숙사 중에 가장 교통이 편리합니다. 에드먼턴의 전철, LRT 역이 기숙사 건물과 바로 연결되어 있고 버스 정류장도 바로 기숙사 바로 앞에 위치해 있습니다. 또한 여러 단과대학 건물들과 연결통로가 이어져 있어 밖으로 나갈 필요 없이 다양한 곳에 갈 수 있습니다. HUB와 연결된 강의실의 수업을 선택한다면 1~2분 이내로 강의실에 갈 수 있다는 장점이 있습니다. 또한 건물 내에 각종 음식점이 있기에 방에서 직접 밥을 해먹기 귀찮을 때면 바로 사먹을 수 있기도 합니다. 하지만 그 때문에 아침부터 저녁까지 많은 학생들이 그 곳을 지나다녀 시끄럽다 느낄 수 있으며 몰 위층에 위치하고 있는 방에는 식당의 음식냄새가 날 수 있습니다. HUB는 studio와 1인실, 2인실, 그리고 4인실이 있습니다. Studio는 1인실보다는 조금 작은 형태로 furnished 와 unfurnished 두 형태가 있습니다. 저는 furnished studio 에서 지냈는데 책상과 침대가 있는 형태입니다. 앨버타 대학교의 대부분의 기숙사는 가구가 비치되어 있지 않기 때문에 입사 후 바로 가구를 마련해야 합니다. 대다수의 학생은 대중교통으로 40분 정도 가면 있는 IKEA를 이용합니다. 각 방에는 부엌이 딸려 있고 냉장고와 가스레인지, 오븐이 있습니다. 2인실 이상으로 가면 작은 거실과 부엌, 그리고 방이 두 개가 있어 각자의 방에서 생활할 수 있습니다.","수업 분위기는 우리학교에서 듣던 것보다 자유로운 편으로 느껴졌습니다. 전공수업 하나와 드라마 수업, 사학과 수업을 들었는데 전공수업에서는 학생들이 정말 자유롭게 토론하고 교수님과 얘기하고 의견을 교환하는 것을 보고 신선한 충격을 느꼈습니다. 서로간의 격이 없는 수업을 하고 있었습니다. 드라마 수업은 정말 간단한 드라마 기초 수업으로 중간고사와 기말고사를 드라마 연기를 통해 점수를 주는 실기 수업이었습니다. 매시간 친구들과 대화하고 앞에 나가서 즉흥적으로 연기를 해야 하는 형태의 수업이기에 수업 중에 많은 영어를 사용할 수 있는 점이 도움이 되기도 합니다. 또한 대부분의 대형강의는 출석체크를 전혀 하지 않습니다. 제가 들었던 사학과 수업의 경우 역시 출석체크 없이 수업만 하시곤 했습니다. 친구에게 물어보니 소형강의가 아닌 이상 출석체크는 하지 않는다고 했습니다. 대학교내에는 많은 도서관이 있는데 저는 HUB몰에서 연결된 러더포드 도서관과 5분거리에 있는 카메론 도서관을 주로 이용하였습니다.",HUB Mall 지하에 인터네셔널 센터가 있습니다. 학기가 시작하기 전부터 이곳에서 국제학생들을 위해 다양한 행사를 준비하고 생활하는데 있어 어려움이 없도록 도와줍니다. 처음 가면 안내책자 등을 주며 에드먼턴 생활의 다양한 팁을 알려줍니다. 또한 학기 중 계속해서 다양한 행사를 열어 국제학생들이 서로 교류할 수 있는 시간을 마련해주곤 합니다.,동아리 활동은 하지 않아 적을 수 있는 것이 많지 않습니다. 학교에서 이용할 수 있는 시설로는 버터돔이라는 체육관이 있습니다.,버스에서 정류장 안내를 해주지 않습니다. 이는 북미지역 대부분에 해당되는 얘기기도 한데 버스에서 정류장안내가 나오지 않아 어디서 내려야 하는지 몰라 잘못 내리는 경우가 허다합니다. 버스를 타는 경우에는 이에 유의하시기 바랍니다.,교환학생과 관련된 문제라면 인터네셔널 센터가 도움 받기에 좋습니다. 또한 저 같은 경우엔 교회에 다니기 때문에 한인교회를 다녔는데 교회사람들에게서도 생활과 학교 관련해서 도움을 받곤 했습니다.,"에드먼턴은 조용하고 공기 좋은 공부하기에 좋은 도시입니다. 앨버타 내에서는 대도시라 할 수도 있지만 그리 큰 규모가 아니기에 조용한 소도시 정도를 생각하시면 됩니다. 저는 에드먼턴에 지내는 동안 옐로나이프와 밴프, 재스퍼에 여행을 다녀왔습니다. 옐로나이프는 오로라로 유명한 곳이고 밴프, 재스퍼는 로키산맥의 자연경관과 호수들로 유명한 곳입니다. 밴프의 레이크 루이즈는 굉장히 유명한 관광지인데 4월 말에 가도 호수는 꽝꽝 얼어있기에 여행을 가고자 하신다면 여름에 가시는 것을 추천합니다."
"UofA는 캐나다의 알버타주 에드먼튼에 위치해 있습니다. 에드먼튼은 추운거 빼고는 얘기하기 힘든 도신데요, 겨울에는 영하 40-50도까지 내려간다고 합니다. 수치를 보면 경악하게 되지만, 사실상 못견디게 춥지는 않아요. 제가 추위의 절정인 1,2월이 되기 전에 돌아와서인지도 모르지만, 한국보다 크게 더 춥다고 느껴지지 않았습니다. 일단 매우 건조해서 한국의 그 습하고 찬 공기가 느껴지지 않고, 바람도 잘 안불어서 체감온도는 그리 낮지 않은 것 같습니다. 물론 기숙사에 살아서 다른 건물들과 연결되어 있어 밖에 나갈일이 많지 않기도 했고요. UofA는 에드먼튼의 중심부에 위치해 있고, 버스와 지하철이 다 학교 내에 있어 교통이 매우 편리합니다. 북미에서는 흔치 않게도 대중교통이 잘 발달되어 있는 곳이라고 하더라고요.","학교에서 버스를 타고 5분정도 나오면 Whyte Ave라는 상점과 술집들이 있는 거리가 나옵니다. 서쪽으로 40분정도 가면 West Edmonton Mall이 있는데, 몇년 전까지 북미 쇼핑몰 규모 1위라고 했던 것 같아요. 몰 안에 워터파크와 놀이공원이 있고, 상점도 왠만한 브랜드가 다 입점해 있습니다. 가격은 그리 싼편은 아니라 thanksgiving이나 black friday와 같은 세일을 잘 이용하시면 좋을 것 같아요. 에드먼튼이 원래 조용하고 놀거리가 많지 않은 도시라 이 몰에서 여가시간을 많이 보내시게 될 거에요, 특히 여성분들이라면 더. 마트 종류는 제가 정리해 놓았었는데, Sobeys(도보10분),Safeway(버스5분)는 시간이 많지 않으실 때 간단하게 식료품을 사오기에 좋습니다. 많이 사시거나 생활용품을 사시려면 Super Store와 Walmart가 좋은데, 앞의 소비스와 세이프웨이보다 훨씬 싸지만 조금 멀다는 단점이 있습니다. 슈퍼스토어는 LRT로 25분정도 가셔서 종점에서 내리셔야 하고, 월마트는 웨스트 에드먼튼 몰 가는 버스를 타고 가다가 4정거장인가 정도 전에 내리면 있습니다.","기숙사에 사시게 되는 분이 많으실 것 같아요. 기숙사는 대부분 HUB, Lister, International House, East Campus Village 중에서 하나를 선택하시게 될 거에요. 먼저 HUB는 교통이 가장 편리한 곳입니다. 지하철역과 기숙사가 바로 연결되어 있고, 버스정류장도 바로 앞에 위치해 있습니다. 공대가 아니시라면 강의실도 거의 연결되어 있거나 아주 가까울 거에요. 이건 겨울에 가장 중요한 부분입니다. 항상 눈이 두껍게 쌓여있는 겨울에는 밖에 나가는 것 자체가 힘들어지기 때문에 이 점이 정말 편리합니다. HUB에는 1인실, 2인실, 4인실이 있습니다. 몰 안에 기숙사가 들어와 있는 구조인데, 밥을 하기 귀찮거나 할 때 문을 나오면 바로 음식점들이 줄지어 있어 편리합니다. 음식냄새가 올라온다고 하는데, 전 지하에 살아 그런지 딱히 느끼지 못했고, 지저분하다고도 하는데 제가 살던 곳은 깨끗했습니다. 저는 HUB에 살았고 수강신청을 할때 강의실을 모두 제 방 근처에 모아놨더니 제 방에서 강의실까지 30초가 걸렸습니다. 다음, Lister 기숙사는 1학년들이 사는 클래식 리스터와 고학년이 주로 사는 셰이퍼 홀이 있는데, 셰이퍼 홀이 조금 더 비싸지만 최근에 지어져 깔끔하다고 들었습니다. 리스터의 가장 큰 장점은 같은 층 사람들과 교류가 많고 친구가 되기 쉽다는 것입니다. 단점은 학교의 주요 건물과 상당히 떨어져 있어 겨울에 다소 힘들수도 있고, 밀플랜을 신청해야 해서 많은 돈을 내고 밥을 사먹어야 한다는 점입니다(식당이 있는 것이 아니고, 돈을 내놓고 학교 안의 음식점들에서 사먹으면 차감되는 방식입니다). 인터네셔널 하우스는 위치도 괜찮고, 최근에 지어져 깔끔하고 1인실을 쓸 수 있는데다가 국제학생들을 일정 비율로 받아 다양한 친구들을 사귀기에 좋다고 합니다. 한번에 8개월을 신청해야 된다고 해서 한학기인 저는 포기했는데, 그곳에 사는 친구들은 다들 한학기인데 결국 받아주더라고 합니다. 이곳에 지원하실 분들은 한학기라도 끝까지 받아달라고해보고 기다려보시기 바랍니다. 여담이지만, 이곳의 시스템은 정해진 규칙이 없고 답답한 면이 있어 저와 제 친구는 기숙사를 청하면서 당황스러운 일을 겪었습니다. 처음에 안된다고 하더라도 곧이곧대로 믿지 마시고, 되게 해달라고 끈기있게 요청을 해보시는 게 좋습니다. 또한 하라는 대로 했다고 안심하지 마시고 일이 확실히 마무리될때까지 확인해보시는 것이 좋습니다. 다음 East Campus Village 역시 1인실, 2인실, 4인실이 있는데, 학교의 동쪽에 위치한 한적한 곳입니다. 고학년들이 많이 살아서 조용히 지내시기에 좋습니다. 정리하자면, 리스터를 제외하면 밥을 해서 드셔야 할 것이고, 이 편이 훨씬 경제적입니다. 학교 안의 음식점들에서 사먹을 수도 있지만, 가격은 비싼 편이고 그다지 맛있지도 않습니다.","수업은 우리학교에서 듣던 것과 비슷했습니다. 전공 과목을 3개 듣고 교양을 1개 들었는데, 전공은 조모임이 하나도 없었고 교양은 조모임이 하나 있었는데 많은 것을 요구하는 조모임은 아니었습니다. 다른 수업들은 모르겠는데, 제가 듣던 수업들은 출석체크를 한번도 하지 않았습니다. 사학과 전공 수업들은 대부분 조용히 앉아서 강의를 듣는 방식으로 이루어졌습니다. 교양으로 들었던 드라마 수업은(연기 수업이 아니고, 이론 수업이었습니다) 수업시간의 큰 부분이 조모임과의 대화하는 시간으로 할애되었습니다. 모든 수업에서 시험 문제는 대부분 교재와 올려주신 ppt에서 나와서 공부하기가 조금 더 수월했습니다. 교재는 학기 초에 구매하게 되는데, 서점에서 새 책을 제값주고 사시면 과하게 비쌀 거에요. 학기 시작하자마자 도서관에 가셔서 중고 책(있다면)을 선점하시고, 아마존도 뒤져보시면 중고 책이나 새책이라도 조금 더 저렴한 가격에 구하실 수 있을 거에요. 도서관은 제가 가본 곳은 카메론과 러더포드 두 곳인데, 허브몰에 사시면 러더포드과 연결되어 있어 편하게 가실 수 있습니다. 카메론은 24시로 운영되고 있습니다.","인터네셔널 센터가 허브몰의 지하에 위치하고 있습니다. 모르는 것이 있으면 이곳에 가서 물어보시면 친절하게 알려줍니다. 이런걸 물어봐도 되나 하더라도 가서 물어보시면 친절하게 답해주실 거에요. 캐나다에 처음 온 국제학생들들에게 도움을 주기 위한 센터니까 잘 이용하시기 바래요. 학기 초에는 무조건 한번 들르세요. 안내책자 같은 것도 주고, 유용한 정보도 많이 주실 겁니다. 학기 초에 이케아 trip이라는 것도 해서 다 같이 가구를 사고 공짜로 받아올 수도 있습니다.",운동을 좋아하시는 분은 버터돔이라는 큰 체육관이 학교 내에 있습니다. 동아리는 9월 초에 큰 광장에서 club fair이라는 것이 열리는데 가보시면 정보를 얻으실 수 있어요.,"우리나라보다 업무 처리가 느리고 규율이 제대로 정해지지 않은 편입니다. 이것은 어딜 가나 마찬가지였던 것 같아요. 사람들은 친절한데, 업무 처리는 화가 날 정도로 제대로 되지 않습니다. 일단 맡겨 두면 빠른 시간 안에 정확히 처리하고 결과를 알려주는 우리나라에서는 상상할 수 없는 일이에요. 말씀드리고 싶은 것은, 앞에서도 썼지만, 어떤 일이든 간에 확실하게 처리되기 전까지는 안심하지 마세요. 그렇게 해도 결국에는 내 잘못이 아닌 문제가 발생하고, 그 쪽에서는 절대 책임을 져주지 않습니다. 모든 일을 최대한 끝까지 신경써서 마무리하시는 것이 좋을 거에요!",인터네셔널 센터가 국제학생들이 도움을 청하기에 가장 편안하고 좋은 곳일 것 같습니다.,"UofA는 활기차고 신나는 도시는 아니지만, 지친 일상을 벗어나 휴식을 취하고 싶으신 분께는 적격인 도시입니다. 파견이 결정되셨다면, 마음 놓고 푹 쉬실 준비 하시고 오셔서 맑은 공기도 마시고 쉬시면 좋을 거에요. 주변의 유명한 여행지로는 밴프와 재스퍼가 있는데, 두 곳 다 자연경관이 정말 좋습니다. 가을에 오시면 9월, 늦어도 10월에 가시는 걸 추천드려요. 그 때는 날씨도 정말 좋고 경치도 설명할 수 없이 아름답습니다. 특히 밴프는 경치도 정말 아름답고 그 자체로 너무 예쁜 도시입니다. 교환학생으로 오신 기회를 잘 활용하셔서 여행도 많이 하고 오시길 바랍니다."
"University of Alberta가 위치해 있는 앨버타 주는 겨울이면 영하 30도까지 
내려가는 추운 지역입니다. 영하 30도라는 숫자가 처음에는 실감이 나지 
않았는데, 직접 경험해 보니 바람이 강하지 않을 때에는 견딜만 했습니다. 
제가 갔던 가을 학기에는 8월 ~ 9월은 늦은 여름, 초가을 날씨로, 더위가 
심하지 않고 날씨가 맑아 여행과 야외 활동헤 적합했습니다. 10월 역시 
여행하기 좋은 날씨였고, 11월 말부터 본격적인 추위가 시작되었습니다.  
여행이나 바깥활동을 좋아하시는 분들께는 물론 여름 학기가 더 적합하겠으나
겨울 학기 역시 11월 중순까지 활동이 가능하기 때문에 나쁘지 않았고,
눈에 덮힌 로키 산맥이나 혹한의 추위 역시 한국에서는 경험해볼 수 없는 
독특한 경험이었습니다.","대학이 위치해 있는 에드먼튼은 비교적 작은 도시입니다. 캠페스에서 버스로
3~4 정거장 정도 떨어진 곳에는 ""Whyte Ave""라는 번화가가 있습니다. 한국에 
비유하자면 신촌이나 홍대같은 번화가로, 다양한 술집과 레스토랑이 위치해
있습니다. 꽤 다양한 맛집이 위치해 있어서 찾아다니는 재미가 있으며, 술집
들이 요일마다 서로 다른 할인 행사를 하는 것도 하나의 재미입니다. 
또한 식료품 마트와 같은 생활 편의 시설들도 캠퍼스에서 가까운 곳에 위치해
있기 때문에 생활 하는데 특별히 불편한 점은 없었습니다. 

에드먼튼 내에서 가볼만 한 곳은 과거 도시를 재현해 놓은 ''Fort Edmonton
Park''나 왕립 앨버타 박물관 등 몇 곳이 되지 않습니다. 하지만 에드먼튼에서
3시간 반 ~ 4시간만 운전을 하면 캐네디안 로키의 주요 도시인 ''제스퍼''와
''밴프''를 방문할 수 있으며 큰 도시인 ''캘거리''에도 방문할 수 있습니다. 
저는 캐나다에 거주하던 4개월 동안 캐네디안 로키를 2번 방문 했으며 
그 때 만났던 웅장한 산 봉우리와 호수의 아름다움은 잊을 수가 없습니다.
4시간 거리라고 하면 땅이 넓은 캐나다에서는 매우 가까운 거리입니다.
캐네디안 로키는University of Alberta에 파견 되신다면 반드시 방문해야 할 
여행지라고 생각합니다. 방문 하실 때에는 자동차를 렌트하는 것을 추천해
드립니다. 재스퍼나 밴프에 방문했다고 하더라도 주요 호수나 산봉우리 및
숙소를 자유롭게 오가기 위해서는 자동차가 있는 것이 편하기 때문입니다. 
또, 교내 동아리 중 ''Outdoors Club''에 가입하여 동아리에서 주최하는 트립에
참여하는 것도 좋은 방법입니다.","저는 ''HUB''라는 기숙사에 살았습니다. HUB는 기숙사와 상가가 혼합되어 있는
형태의 건물로 상가가 있는 층에 가면 여러 음식점과 간단한 생필품을 구매할
수 있어 편리합니다. 이 외에도 HUB는 가장 이동이 편리한 곳에 위치하고 
있다는 장점이 있습니다. 바로 옆에 LRT(지하철) 역과 버스 정류장이 있었고
수업을 듣는 주요 건물들과도 연결되어 있어 추울 때에는 밖에 나가지 않고
이동할 수 있습니다. 식사는 따로 제공되지 않기 때문에 사 먹거나 요리를
해야 합니다. 저는 주로 요리를 해서 먹었고, 귀찮을 때에는 HUB 상가 층에서
간단히 식사를 해결 했습니다. 

HUB의 단점은 커뮤니티가 활성화되어 있지 않다는 점입니다. 정기적으로 
기숙사에서 하는 파티가 있는 ''리스터''와는 다르게 조용히 각자 생활하는
분위기 입니다. 그러나 수업, 팀프로젝트 등 여러 경로로 알게 된 친구들이
집에서 여는 작은 홈파티에 참여할 수 있었기에 크게 아쉽다는 생각은 들지
않았습니다.","저는 소비자행동론, Introduction to International Business의 두 개의 전공
수업을 들었고 역사 수업인 Modern World와 East Asian Study를 들어 총 
12학점을 이수했습니다. 전반적으로 학생들은 수업에 열심히 참여하는편이었
으며, 시험을 대비한 공부도 열심히 하는 분위기였습니다. 

경영 전공 수업들의 난이도는 평이했고, 팀 프로젝트는 수업 당 한 학기에
하나 내지 많으면 두개 정도였습니다. 특이한 점은 수업 시간 중 5분 정도로
짧게 혼자서 관련 주제에 대해 발표하는 시간이 있었다는 점입니다. 개인
발표를 포함 하여 한 학기 동안 발표를 한 횟수도 수업 당 2회 정도였습니다.

역사 수업인 Modern World는 전공자가 아닌 제가 따라가기에는 버거운 내용도
다소 있었으나 시험을 치는데 큰 무리는 없었습니다. 가장 재미 있었던 수업은
East Asia Study였는데, 수업의 주제가 동양 3국 (한국, 중국, 일본)의 역사와
문화였습니다. 서양인들의 시선으로 본 동양의 문화가 어떤지 배우는 것이
재미 있었고, 실제로 학생들 사이에서 K-POP등 한류 열풍이 얼마나 강한지
확인할 수 있었던 것 역시 흥미로웠습니다.","제가 살던 HUB 건물의 Ground Floor에 International Center가 있었습니다. 
학기 초에는 여러 봉사활동자들이 상주하고 있어 학교생활에 관한 팁부터 
휴대폰, 인터넷 설치, 식료품 쇼핑 등에 관한 상세하고 실질적인 조언을 얻을
수 있습니다. 또한 센터에서는 주기적으로 가까운 곳을 방문하는 Trip을 
열고 있는데 관심 있으시면 참여해 보는 것도 좋을 것 같습니다. (Trip의
퀄리티는 별로 좋지 않습니다.)","학기 초에 모든 동아리가 캠퍼스 내 광장과 체육관에 모여 홍보 활동을 벌이는
클럽 페어가 열립니다. 이 때 관심 있는 동아리에 참여해 보는 것도 좋을 것 
같습니다. 아웃도어나 스키, 스킨 스쿠버와 같은 활동적인 동아리도 있고 
동양인 학생 모임 같은 친목 동아리도 있습니다. 동아리 활동에 특별한 제한을
두고 있지 않기 때문에 적극적으로 참여한다면 좋은 기회가 될 수 있습니다. 

저는 Business 학생들을 대상으로 하는 경영 학회에 가입하여 활동했습니다. 
연세대학교 경영학회들과는 다르게 활동 학기 수에 제한을 두지 않아 한 
학기만 활동하고 귀국하였습니다. 저는 에드먼튼 시내에 있는 노숙자들을 
돕기 위한 프로젝트를 기획하는 단계에 참여 하였고, 외국 학생들과 함께
회의를 하고 일을 진행하며 캐나다의 비즈니스 분위기를 엿볼 수 있는 좋은
기회였습니다.","사람간의 위계가 강조되어 있는 한국 문화에 익숙해 있던 저에게는 교수님과도
편하게 말하고 심지어 친해진 후에는 교수님을 이름(First Name)으로 부르는
서양의 문화가 조금 충격적이었습니다. 한 두 살 차이 나는 것으로도 선배, 형
누나, 언니라고 부르며 예의를 지키는 한국 문화와 참 많이 다르다는 생각을
했습니다.","International Center에 가면 대부분의 필요한 도움을 받을 수 있습니다. 
저는 주로 인터넷 검색을 통해 정보를 얻었고, 더 알고 싶은 점은 센터에 문의
했습니다.",
