gen_info,env_info,food_info,study_info,office_info,facil_info,mhct_info,help_info,etc_info
"맥길대학은 캐나다 동쪽 끝자락 퀘백 지방의 몬트리올이라는 도시에 위치해 있습니다. 몬트리올은 비교적 고위도에 위치하고 있으면서 내륙지방이라 겨울은 특히 혹독히 춥고 (삼면이 바다인 한국에 비해) 건조하며, 눈이 (매우) 많이 내립니다. 저는 맥길에서 가을학기를 보냈기 때문에 1월 이후의 몬트리올 날씨를 체험하지는 못했습니다만, 제 기억이 틀리지 않았다면 12월 말 경 기온이 대략 -12도 정도를 기록했던 것 같습니다. 몬트리올(혹은 퀘백 전체)사람들이 몇 가지 독특하게 자랑스러워 하는 것이 있는데 바로 프랑스사람과는 약간 다른 억양과 단어를 쓰는 퀘백식 불어와 추운 날씨입니다. Quebecois 두 명과 함께 살았던 저도 그들에게 가끔씩 눈이 너무 많이와서, 날씨가 너무 추워서 생긴 무용담(?)같은 것들을 듣곤 했는데 정말 실실(?) 웃으면서 조금은 자랑스러워하는 표정으로 이야기 하곤 했습니다. 아울러 이 친구들에 따르면 제가 떠난 후, 지구온난화 때문에 요 몇년간 나름 온화해진(?) 겨울날씨 였음에도 불구하고, 오랜만에 사상 최악의 -40도 정도를 기록하는 날들을 보냈다고 합니다. 이 정도 되면 (조금 과장을 보태서) 고글을 쓰고 외출하지 않으면 눈에 항상 고여있는 액(?)이 순간적으로 얼어버릴 정도라고 하네요. 앞서 말씀드렸듯이, 요 근래 겨울날씨는 원래 몬트리올의 겨울날씨보다 따뜻한 것은 사실이나 맥길을 생각하고 계시는 분은, 어떤 학기에 가도 겨울날씨를 겪으셔야 하기 때문에 날씨관련사항을 염두에 두셔야 할 것입니다. 

맥길대학은 몬트리올 도시 한 가운데에 위치하고 있으며, 캠퍼스 크기는 연세대학교 정도 되는 것 같습니다. 본 캠퍼스가 있으면 그 주변 위 아래로 우리로 치면 단과대학들 및 병원, 실험실 같은 것들이 넓게 펼쳐져 있는 형태라고 생각하시면 됩니다. 앞서 몇몇분들이 지적해 주셨듯 정문을 통과하면 길게 뻗어있는 대로가 마치 백양로를 연상케 하는 구조로 되어있습니다. 이 대로 양 옆에는 여러분들이 ''''''''북미의 캠퍼스''''''''라고 하면 연상할 만 한 넓은 잔디밭이 펼쳐져 있는데, 날씨가 좋은 여름이나 가을에는 여기서 원반던지기를 하거나 운동을 하는 학생들, 누워서 책을 읽다가 낮잠이 든 학생들 등을 심심치 않게 보실 수 있습니다.","맥길은 몬트리올 도시 한 가운데에 위치하고 있으며, 버스 및 지하철 등 각종 대중교통으로의 접근이 용이한 곳에 있기 때문에 원하시는 곳은 어디든 갈 수 있는 장점이 있습니다. 또한 몬트리올은 그다지 큰 도시가 아니고 구조가 복잡하게 되어있지 않기때문에 조금만 길을 익히시면 어디든지 쉽게 찾아 갈 수 있습니다. 맥길 정문앞에서 길을 건너 조금 내려가면 st. catherine이라는 대로가 나오는데 이곳에 각종 쇼핑몰, 영화관, 까페, pubs, 서점 등이 모여있습니다. 아울러 맥길 주변에는 유명한 미술관들이 여럿있고, 여름과 가을 사이에 각종 festival들이 개최되기 때문에 즐거운 문화생활을 즐기실 수 있을 것입니다.","이 부분에 대해서 조금 강조를 해서 말씀드리고 싶습니다. 앞서 말씀하신 분들이 지적하셨듯이 교환학생으로 맥길에서 기숙사를 받기는 여타의 미국이나 유럽학교와 다르게 매우 어렵습니다. 저는 주거와 관련하여 매우 안좋은 사건들이 터져 맥길의 housing office에 서신을 보내고 찾아가 정식으로 항의(?)하기도 했었습니다. 보통 맥길은 신입생 및 2학년 그리고 대학원생에게 우선적으로 기숙사를 배정하는데, 다운타운에 위치한 특성 상 기숙사를 넉넉하게 짓지 못했고 이에 따라 만성적으로 기숙사가 부족하다는 것이 그 측의 설명입니다. (또한 맥길은 미국에서온 유학생(?)포함 int''''''''l students의 비율이 굉장히 높은 학교에 속하기 때문에 교환학생이라고 다 알아서 잘 해주겠지 라고 생각하신다면 큰 오산임을 알려드리고 싶습니다. 정말 그냥 regular student로 한 학기 내지는 두 학기 계시다 오시는 거라고 생각하시면 됩니다)아무튼 겨울학기에 가시면 그나마 어떻게든 얻어''''''''볼수도'''''''' 있지만 캐나다에서 새 학기인 9월 가을학기로 교환을 가시는 분은 거의 기숙사를 받지 못한다고 생각하시고 미리미리 일찍일찍 교외의 집을 알아보시는 것이 좋습니다. 여기서 중요한 것은 무조건 미리미리 연락해 보시고, 되도록이면 빨리 출국하시어 직접 발로 뛰면서 꼼꼼히 각종 사항을 체크하시고 집을 구하라는 점입니다. craig''''s list, 맥길 공식 홈페이지 www.mcgill.ca내에 offcampus housing을 주선하는 페이지와 http://www.mcgill.ca/classified/ 에 일찍부터 들어가셔서 꼼꼼히 체크하시고 글올린 사람과 이메일 같은 것으로 연락하시면서 집을 구하시길 권합니다. 

식사의 경우 따로 나가서 사시는 것을 가정했을때, 보통 만들어 먹거나 사먹게 되는데 맥길의 학생들은 거의 대부분 만들어 놓은 것을 가져와서 cafeteria에서 데워먹는 경우가 흔합니다. 그도 그럴것이 일단 학내 매점의 물가가 우리학교와는 비교자체가 안되도록 비싸며, 여기에 몬트리올 세금 13.5%가 가산되면 음식값이 정말 엄청 뛰기 때문에 보통 만들어 먹는 것이 대부분 입니다. 여기에 더해서 몬트리올 주변 음식상점들이 신촌과 같이 언제나 이용 가능하도록 영업을 하지 않는 다는 원인도 있습니다. 저는 집을 중간에 한 번 옮겼는데, 첫번째 집에서 혼자살때는 만들어 먹거나 거의 다 만들어진 음식을 사와서 데워먹었고 두번째 집에서는 룸메이트 중 한명이 요리를 즐겨하는 친구여서 그 친구에게 식료품비를 내고 요리를 일임했습니다.","맥길은 북미의 하버드라고 불릴만큼 명성있고 경쟁력있는 대학 중 하나이며, 전 세계 대학 20위권내에 꾸준히 랭킹되었던 교육기관 으로써 수업수준 및 학생들의 전반적인 수준, 교수진들의 연구 및 수업에 대한 열의와 그 외의 support가 굉장한 학교라고 해도 과언은 아니라고 생각합니다. 저는 faculty of arts의 dept of poli sci에 속하여 12학점을 이수했는데, 이왕 교환학생을 온 만큼 성적인정에 연연하기 보다는 여기서만 들을 수 있는 재미있는 수업을 들어보자는 생각으로 수강신청을 했었고 나름 좋은 선택이었다고 생각합니다. 제가 들었던 수업을 간단히 소개하자면 

1. The causes of Major War (Poli Sci)
2. Media and Empire (Communication)
3. Arab-Israeli Confict, War and Peace (Poli Sci)
4. Int''''ㅣ Business (Business)

입니다. 정외과 수업의 경우, 방식은 연세대학교와 크게 다르지 않지만 인상깊었던 점은 수업과 학생들의 리딩의 보조를 맞추기 위해서 주중에 conference라는, 총 인원수를 한 conference당 10명내외로 들어갈 수 있게 나눈 조교담당수업을 개설하여 학생들이 리딩을 바탕으로 자유롭게 토론하고 의견을 개진할 수 있었다는 점입니다. media and empire의 경우 제국주의와 그 확산에 있어서의 미디어의 역할에 관한 비판적 내용을 다룬 비교적 소규모의 수업이었는데, 거의 2주간격으로 내는 페이퍼와 엄청난 양의 리딩, 토론이 결코 쉬운 일은 아니었으나 일단 저의 관심분야이기도 했고, 끊임없이 challenge를 주는 수업이었기 때문에 가장 열심히 들었던 기억이 납니다. 

도서관은 보통 중앙도서관 개념의 McLennan & Redpath Library을 이용하시게 될 것입니다. 저는 가끔 공부를 할때 공대쪽의 Schulich Library를 가기도 했는데, 늦게까지 개방하고 다락방같이 생긴 열람실이 특히 집중이 잘 되기 때문에 가곤 했습니다. 이외에도 맥길은 단과대학 도서관이 잘 되어 있습니다. 그러나 한가지 유념하셔야 될 점은 시험이 매우 가까워 지지 않는 이상 24시간 도서관을 개방하지 않으며, 도서관 내에서 음식섭취가 엄격하게 금지된다는 점입니다. 도서관 내에는 security들이 항상 돌아다니는데, 이 분들은 음식 발각시 주의를 주시기도 하고 심지어 엎드려 자고있으면 깨우기도(!) 합니다. (참고로, 저도 이 색다른 경험을 당해(?)보았습니다. 정말 와서 흔들어 깨웁니다) 아무튼 제가 교환을 가기 전에는 신 중도가 다 지어지기 전이었지만, 현재로서는 단연코 도서관 만큼은 제 생각엔 우리학교가 매우 앞서는 것 같습니다.^^","맥길에도 ISS라고 하여 international student service가 있고, MISN(McGill Int''''''''l Student Network라고 하여 국제학생들을 대상으로 각종 행사를 기획하고 그들의 참여를 유도하는 기관이 있습니다. 그러나 기본적으로 앞서 말씀드렸듯 국제학생의 비율이 높은 학교이기 때문에, 교환학생 입장에서 적극적으로 정보를 알아보고 행사에 참여하지 않는 이상 다양한 체험을 하기 어려울 수도 있습니다. 맥길에 도착하시면 학생회관 개념의 SSMU(Students'''' Society of McGill Univ)빌딩 1층에 위치한 MISN 사무실에 가서 각종 여행 및 파티 정보도 가져가시고 친구들도 사귀시길 바랍니다.","각종 부대시설에 관한 사항은 맥길에 도착하셔서 본인이 필요한 것들을 중심으로 직접 알아보시는 것이 더욱 편할 것입니다. 제가 약간 해맸던 부분만 말씀드리면, McGill Bookstore는 학교 바로 옆 길인 3420 McTavish Street에 위치하고 있지만 어떤 책들은 맥길 정문 길 건너편 second cup이라는 까페 옆에 위치한 서점(이름이 잘 기억이 안납니다만...ㅠㅠ)에서 팔기도 하며, 그 경우 실라버스에 적혀 있습니다. 그리고 책값이 만만치 않은 만큼, coursepack까지 중고로 거래할 수 있으므로 classified ad를 학기시작 전후에 꼭 살펴보시길 바랍니다. 그리고 참고로 course pack은 교환 및 환불이 불가능하며, 우리학교와 달리 모든 전공의 모든 course pack을 학교서점에서 팔기때문에 학기초에는 무조건 긴 줄을 서서 책을 계산할 수 밖에 없습니다. 

아울러 동아리의 경우, 새 학기 시작(9월)이후 대략 1~2주가 지난 그 사이에 SSMU빌딩에서 대규모의 설명회 행사를 갖습니다. 각 동아리들의 각자의 booth를 만들고 홍보를 하는데 마치 우리학교의 동아리들이 학기 시작 초에 학관앞에서 홍보를 하는 것과 비슷한 상황으로 보시면 됩니다. 이 때, 이 행사에 참가하셔서 이메일주소는 contact info를 남기시면 정기적으로 그들의 행사와 관련한 연락이 오고 여기에 자유롭게 참여하시면 되겠습니다.","아주 쇼킹할 만큼의 문화적 충격은 없었습니다만, 미리 알고가시면 좋을 것들을 알려드리면 

1. 몬트리올에서 대마초 흡연은 거의 decriminalize 되어있고, 정서적으로도 굉장히 유연하고 관대하게 생각하기 때문에 그에 대한 거부감이 상대적으로, 매우 낮습니다.  

2. bed bug crisis: 아시는 분은 아실지도 모릅니다만, 실제로 몬트리올 몇몇몇 지역에서는 bed bug 문제가 있는 것이 사실입니다. second-hand furniture를 통해 맥길의 기숙사에서도 이 문제가 발생해서 큰 소란이 벌어졌었다는 실례가 존재합니다. 집을 구하실때 혹은 기숙사에 들어가 사실때 꼭 초반에 이런 문제가 있는지 없는 지 꼼꼼히 알아보셔야 합니다.","일단 교환학생이므로 ISS를 통해 도움을 요청하실 수 있습니다. 또한 저는 현지인 친구 혹은 학내 친구를 빨리 사귀는 것을 권장해 드립니다. 아울러 한인 교회 및 한인 성당도 있으므로 그곳에서 친구를 사귀고, 어려움이 있을때 도움을 요청하는 것도 한 가지 방법입니다. 중요한 점은 어떤 형태로든 어려운 상황이 벌어졌을때 너무 겁먹거나 당황하지 마시고, 차분하게 하지만 적극적으로 상황에 대처하셔야 한다는 점입니다.","Mazed in Montreal - 저는 맥길에서의 교환학생기간동안, 만약 이곳으로 오지않았다면, 더 나아가 교환학생을 결심하지 않았다면 절대로 겪을 수 없었을 신기하고도 놀라운 일들을 체험했고, 많은 생각을 하였으며 결과적으로는 내외적으로 성장한 제 자신을 마주할 수 있었습니다. 언젠가는 길을 잃어버리기도 했고, 너무 이상하고 이해할 수 없는 일들을 겪으면서 힘들어 하기도 했고, 이곳에 오기전까지는 겪어보지 못했던 신기하고도 재밌는 일들에 흥분하기도 했습니다. 하지만 결과적으로 몬트리올은 여러분들을 ''홀려''버릴만큼 매혹적인 도시임에는 틀림없습니다. 그리고 동시에 절대로 만만하거나 쉬운 상대가 아님을 알려드리고 싶습니다. 하지만 어찌되었든간에 종국에는 이 공간과 이곳에서의 시간들만이 줄 수 있는 값진 그 무언가를 가지고 이곳을 떠나게 되실 것입니다, 그리고 아주 가끔씩은 문득문득 그리워하게 될 것입니다. 마치 제가 그러하듯 말입니다."
"몬트리올은 북미 여행시 꼭 권장할만한 “북미의 유럽”이라고 불릴 정도로 프랑스의 매력, 그리고 북미의 개발정신이 공존하는 도시입니다. 몬트리올은 토론토/오타와/퀘벡시티와 가까이 있으면서 미국의 뉴욕/보스턴과도 멀지 않기 때문에 주말을 이용해 가벼운 여행을 다녀오기에도 좋은 위치에 있습니다.

McGill 대학은 메인 캠퍼스인 Downtown Campus, 그리고 시 외각에 위치하고 있는 MacDonald Campus, 두 가지의 캠퍼스를 갖고 있고 본교에 경우 도시 중심에 위치하기에 각종 편의시설, 그리고 대중교통을 이용하는데 불편한 점이 없습니다,

몬트리올의 겨울은 소문대로 춥고 깁니다. 겨울을 힘들어 하시는 분들은 1월에서 4월 사이를 피하시고 가을학기 때 다녀오시는 것이 좋을 것입니다. 하지만 의외로 겨울 문화와 스포츠, 그리고 축제가 자리 잡았기에 tubing, snowboarding, snow shoeing 등 다양한 겨울 스포츠를 즐기시는 분들은 가보실 만 합니다. 무엇보다 Vermont와 Mt. Tremblanc와 가까이 있어 비교적으로 저렴한 가격에 스키장을 이용하실 수 있습니다.","대학의 도시중심에 자리잡고 있기에 모든 시설을 편하게 접근할 수 있고, 또한 대규모 대학을 4개나 보유하고 있기에 대학생들이 필요하고 선호하는 모든 엔터테인먼트 시설을 모두 걷는 거리 내에서 즐기실 수 있습니다.","McGill에는 여러 형태의 기숙사가 있으나 전체 수요에 비해 부족한 편이고 캐내다 현지인이 아닌 국제 학생들이 절반이 넘을 정도로 국제화 되어 있는 학교입니다. 그러므로 교환학생에 대한 거주상의 특별한 배려는 없습니다. 연대 무악학사와 비슷하게 1학년 학생들에게 기숙사 우대권을 주기에 더더욱 교환학생으로서 입사하기 힘듭니다. 
그러나 몬트리올은 워낙 학생인구가 많은 도시이기에 찾으면 기숙사보다 저렴한 가격으로 학교에보다 가까운 위치에 숙소를 잡으실 수 있습니다. 9월에 House hunting경쟁이 가장 치열하기에 가을학기 때 가시는 분들은 8월 중순 이전에 몬트리올에 토착하셔서 집을 찾으시는 것이 현명하고, 겨울에는 비교적으로 수요가 적기에 보다 좋은 가격에 집을 구하실 수 있습니다. McGill학교 사이트에서 운영하는 Off-campus Housing사이트를 통해 룸메이트, 공동생활 집, subtlet등을 쉽게 찾으실 수 있습니다.
외식은 14%가 되는 GST, 그리고 기본인 10-15% 팁 문화로 인해 비교적으로 비쌉니다. 교내 식당에서도 $8 CAD 정도 생각하셔야 합니다. 하지만 대부분의 학생들은 집에서 요리해서 먹고, 룸메이트나 이웃, 혹은 친구들과 돌아가면서 요리해서 먹는 dinner party, 혹은 각자 한가지 요리를 맡는 pot-luck등이 일상적인 친목도모 방법이므로 이 기회에 요리시설이 있는 시설에서 거주하시는 것을 권장합니다.
문화의 도시인 몬트리올은 요리와 레스토랑도 세계 최상급 수준이기에 평소에는 허리띠를 졸라 매대 가끔 식은 맛집 탐험을 추천합니다. 특히 이민자들이 많이 사는 Plateau, Parc Extension (Little India, Little Italy), 그리고 프랑스적인 Vieux-Montreal/ Old-Port쪽의 식당들을 추천합니다. 개인적으로 가장 좋았던 레스토랑은 Au Pied de Cochon이라는 프랑스 음식점입니다.","저는 1년 동안 있었기에 1학기, 그리고 2학기로 이어지는 6학점 짜리 프랑스어 중급 수업을 들었습니다. FRSL수업은 미리 Placement Test를 보아야 하기에 이는 학기 시작 전에 인터넷으로 신청하셔야 합니다. 보다 인텐시브로 영어나 프랑스어 공부하실 수 있고, Bilingual한 도시, 그리고 세계적인 대학인 만큼 다양한 영어, 프랑스어 수업을 제공합니다.
맥길은 최근 타임즈지가 선정한 북미의 12대 대학인 만큼 정공과목은 많은 예습, 복습을 요구합니다. 보통 맥길대 학생들은 학기당 12학점, 즉 4과목을 수강합니다. 더군다나 언어 수업 (전 영어 ESL은 안들어 봤지만 프랑스어의 경우에는) 과제 량이 주 4시간 정도이기에 이를 염두 해서 수강신청을 하시기 바랍니다. 북미에서 손 꼽힐 정도로 강도 높은 수업 준비 상태를 요구하며 절대평가 시스템임에도 불구하고 연대 못지 않은 -혹은 연대보다 더 치열한- 학점경쟁을 유도하는 학교입니다.

McGill에는 캠퍼스 곳곳에 도서관과 독서실이 있어서 공부하기에는 매우 편합니다. 특히 메인 도서관인 McLennan & Redpath Library는 각종 컴퓨터 시설과 다양한 도서를 자랑하고 있으며 (CJK- Chinese Japanese Korean 도서 중 한국 베스트셀러 또한 있습니다) 그 외에도 조용히 공부하실 공간은 이공계 Schulich Library와 신학대학 Birks Reading Room, 음과대 도서관이 있습니다.","McGill은 캐나다 학생들보다 국제학생들이 더 많은 학교이기에 국제 학생들, 그리고 교환학생들에 대한 특별한 배려가 없는 점을 명심하셔야 됩니다. 그러나 외국인들을 위한 유용한 정보와 제도가 많기에 웬만한 정보는 International Students service website를 통해서 알아보실 수 있습니다. 교환학생들만을 위한 모임이 따로 없는 것이 조금 아쉽기는 하나 MISN이라는 큰 모임의 행사에 나가시면 많은 교환학생들을 만나실 수 있습니다. MISN이라 불리는 국제학생 동아리는 방학을 여러 가지 크고 작은 행사를 주선합니다. 저 또한 MISN을 통해 인근의 퀘벡시티에 눈 축제, 오타와의 과수원에서 하는 apple-picking 행사 등 다양한 활동을 할 수 있었으며 무엇보다도 여러 친구들을 사귈 수 있었습니다. 뿐만 아니라 MISN에서는 북미의 여로 도시로 가는 여행 상품을 제공하기에 여행하기에도 좋은 동아리입니다.","맥길 학생시절 가장 인상 깊었던 것은 유명 학자, 정치인 등을 초청해서 열리는 학술/ 취업 세미나였습니다.제 전공인 정치외교학과는 거의 매주 초청 강연을 했기에 유명한 인사들의 이야기를 자주 들을 수 있었습니다. 덕분에 캐나다 정부 인사들과 국제기구 고위관료들을 비롯해 전 미국 외교장관인 Madeleine Albrighte등의 분들을 만나볼 수 있었습니다.

또한 맥길의 career center 또한 뛰어나기에 이를 잘 이용하셔서 영어면접 특강, CV만들기, 인턴쉽 정보 등 많은 도움을 얻으실 수 있습니다. 특히 각종 워크샵들은 교환학생이라고 차별하지 않고 본교생들과 동등하게 신경써 주시는 직원들 모습에 간탄하였습니다.

매 학기 초에 동아리 설명회를 학관 (SSMU Building)에서 개최하는데 이때 가시면 여러 동아리 소개를 들으실 수 있고 관심분야가 같은 학생들을 만나실 수 있습니다. 저는 McGill Debating Union이라는 토론 동아리랑 국제엠네스티 동아리 활동을 조금씩 했는데 이것 또한 제 교환학생 시절에 참 좋은 추억으로 남았습니다.","돌아보면 몬트리올, 그리고 캐나다에서 받은 문화 충격의 대부분은 긍정적이었다고 생각합니다.
한국인으로써 몬트리올에서 가장 큰 문화충격은 개방적인 사고와 정책이었습니다. 개개인차원에서도 모든 의견과 선호를 포옹하는 태도, 그리고 정부차원에서도 개방적이고 앞서가는 정책 또한 눈에 뛰었다. 흔히 캐나다에 대해서 말하는 대마초에 대한 관대한 사회적 시각과 몬트리올 전체 인구에 1/3에 이르는 동성애자 인구 외에도 그들이 이민자들과 외국인들을 적극적으로 포옹하는 것이 좋게 보였다.","International Student Services, Exchange Students Office, 학교내의 한인학생회 (저는 개인적으로 한번도 안가봤지만 친절하게 도와주겠지요), 한인 교회 (5군대, 그리고 한인 성당도 있습니다).","몬트리올 생활은 정말 한번쯤은 해볼만한 경험이라고 생각합니다. 몬트리올이라는 도시는 프랑스어와 영어를 동시에 배우실 수 있는 환경이고 세계에 몇 개 안되는 진정한 bilingual한 도시인 만큼 색다른 경험을 할 수 있는 곳입니다.
더 궁금하신 점이 있으시면 somang.yang@yonsei.ac.kr로 연락 주시고 교환학생 준비를 성공적으로 하시기를 바랍니다."
