gen_info,env_info,food_info,study_info,office_info,facil_info,mhct_info,help_info,etc_info
"U of A는 우리나라에는 아직 잘 알려져 있지 않지만 캐나다 대학 중에서 상위권에 속하고 있으며(최근에 발표된 바에 의하면 상위 3~4위) 특히 의학 부분이 우수하다고 한다. 
학생 수는 약 3만 명이고 전체 캠퍼스 크기는 우리 학교의 서울 캠퍼스와 거의 비슷하지만 우리 학교와는 달리 평지로 이루어져 있어 전체적으로 공원 같은 느낌을 준다. 
실제로 학교 안에 다람쥐와 토끼들이 자유롭게 뛰어다니는 모습은 정말 인상적이었다. 

Edmonton은 유명한 관광 도시 Vancouver가 위치한 British Columbia주와 이웃하고 있는 Alberta주(일반인들에게 잘 알려진 Calgary가 있는 주)의 수도로 현재 약 90만 7천명 정도가 살고 있다. 
캐나다에서는 5번째로 큰 도시(면적 70만1520㎢)라고는 하나 인구밀도가 현저히 낮아 서울에서 살다간 나에게는 우리나라의 중소도시처럼 느껴질 뿐이었다. 
사실 첫 한 두 달은 시골처럼 한적하고 여유 있는 이 곳 분위기에 푹 빠져들었으나 시간이 갈수록 지루하다는 느낌을 지울 수 없었다. 

Edmonton의 최대 단점은 겨울의 혹독한 추위이다. 한국의 겨울도 잘 견디지 못하는 나에게 영하 30도까지 내려가는 이 곳의 추위는 정말 공포의 대상이었다. 
그러나 9월 한 달은 거의 여름과 맞먹는 따사로운 날씨가 계속 되었으며, 10월 22일에 첫 눈이 온 후에도 근 한 달간은 그다지 춥지 않았던 것으로 기억된다. 
11월 말부터 본격적으로 추워지기 시작했는데, 바람이 불지 않아 옷만 잘 입으면 충분히 견딜 수 있을뿐더러, 기름 값이 싼 만큼 실내 난방이 너무 잘 되고 
거의 모든 건물이 다 연결되어 있기 때문에 오히려 땀을 흘리면서 겨울을 보내는 경험을 할 수 있을 것이다.","Edmonton의 중심은 노스 사스케체완 강이 가르고, U of A는 강 바로 옆에 위치해 있다. 도시 중앙에 학교가 있고 대중 교통 수단이 발달되어 있기 때문에 교통에 큰 지장은 없다. 
Edmonton의 대중 교통 수단으로는 크게 버스와 지하철이 있으며, 모두 정해진 스케줄에 따라 운행되므로 이용하기 무척 편리하다. 
중요 지점에 대한 스케줄은 정류장 벽면에 붙어있는 스케줄 표를 이용하거나 ETS(Edmonton Transit System)에서 배부하는 스케줄 표를 이용하면 알 수 있고, 특정 정류장에 대한 스케줄은 간단히 전화를 통해서 알 수 있다. 
저녁 6시 이후나 주말에는 버스가 30분이나 1시간에 한 대 꼴로 운행되기 때문에 버스를 놓치면 정말 큰 낭패를 보기 십상이다. 
스케줄 표는 버스 안과 학교(CAB과 SUB, HUB등에 있다.) 안에서 쉽게 구할 수 있으므로 잊지 말고 잘 챙겨두자.

버스나 LRT 이용 요금은 원래 CN$1.75였는데 2002년 1월부터 CN$2.00으로 인상되었다. 그러나 표 10장 묶음을 CN$15.00에 구입할 수 있으므로 이것을 이용하는 것이 훨씬 이익일 것이다. 
캠퍼스 안에 사는 사람에게는 거의 필요가 없지만 하루에 버스를 최소 2번 이용하게 될 사람은 버스 패스를 사는 것이 더 이익이다. 
버스 패스는 학생일 경우 CN$50.00에 구입할 수 있고 한 달간 무제한 이용할 수 있다. 

버스를 탈 때는 버스 표를 10장 묶음 중에서 한 장 떼어내어 요금 내는 곳에 넣으면 된다. 
표 한 장으로 1시간 반 동안 계속 대중교통을 이용할 수 있기 때문에, 버스 기사가 주는 Transfer 종이를 꼭 간직하는 것이 좋다. 
LRT는 우리나라의 지하철과는 달리 표가 없어도 LRT 플랫폼으로 들어갈 수 있어서 마음만 먹으면 무임 승차도 가능한 시스템이다. 
입구에 있는 기계에 표를 넣으면 표에 날짜와 시간이 찍히고 표의 모서리 부분이 조금 잘려나가게 되는데, 표를 소지하고 있더라도 이런 식으로 표시가 된 표가 아니라면 무임 승차로 간주된다. 
가끔 경찰들이 LRT가 출발할 직전에 승차해서 표 검사를 실시하는데 이 때 걸리면 벌금(300배라고 들었다.)을 물어야 한다. 
오전 9시부터 오후 3시까지는 다운타운을 통과하는 5개의 역 사이에서 LRT 이용이 무료이다.

그리 자주는 아니지만 택시를 탈 기회도 생길 것이다. 택시는 택시 회사에 전화를 하면 간단히 이용할 수 있다.
내가 주로 이용했던 택시는 co-op이라는 회사인데 전화 번호가 쉬워서 한 번에 외워버렸다(425-2525). 
기본 요금은 CN$2.5이고 학교에서 다운타운에 가는데 약 CN$6~7정도가 든다.

공항과 시내는 Sky shuttle이라는 차가 연결해 주고 있다. 
Sky shuttle은 CN$15정도(정확하지 않음)면 이용할 수 있으며, 기사가 짐을 싣고 내려주기 때문에 택시 못지 않게 편안하다. 
공항에서 학교로 들어올 때는 공항 바로 앞에 대기하고 있는 차를 이용하면 되지만, 나중에 시내에서 공항에 갈 때에는 미리 스케줄을 확인하고 이용해야 할 것이다. 

여러 명이서 여행을 간다면 차를 렌트할 필요가 있을 것이다. 차는 등급별로 하루 렌트 가격이 달라지는데, 4명이라면 CN$50 정도에 빌릴 수 있었던 것 같다(한 사람 당 CN$13정도). 
25살 이하일 경우에는 CN$10정도의 가격이 추가로 들고, second driver를 지정하는 경우에도 CN$15정도가 필요하다. 
차를 빌리기 위해서는 신용 카드가 꼭 필요하며, 미리 예약을 해 놓는 것이 좋다. 정말 많은 렌트카 회사가 있는데, National이라는 회사가 가장 저렴했던 것 같다.","처음 2개월 간 나는 Home stay를 했었다. 다행히 아는 사람을 통해 소개받은 거라 생활하는데 불편함이 없었고, 오히려 너무 잘 자고 잘 먹어서 초반에 5kg이나 쪘다. 그러나 영리만을 목적으로 학생들을 상대하는 사람들이 꽤 많아서, 계약 기간 동안 고통스러워하는 학생들을 많이 보았다. 좋은 Host family를 만나는 것이 보장만 된다면, Home stay를 하는 것도 나쁘지는 않다. 기숙사에서 사는 것보다 영어를 써야할 기회가 더 많을 것이며 캐나다 가정을 몸소 체험할 수 있는 값진 경험이 할 수 있을 것이다. 그러나 보통 Home stay를 하는 집들이 U of A와 멀리 떨어져 있기 때문에, 통학하기가 불편하고 시간이 오래 걸린다는 단점이 있다. 

U of A에 있는 여러 형태의 기숙사 중에서 우리 같은 교환학생들이 이용할 수 있는 기숙사는 3개정도 일 것이다. Lister Hall과 Pembina Hall은 우리가 흔히 생각하는 기숙사와 같은 형태인데, Pembina Hall은 만 21세 이상만이 이용할 수 있다. 이 두 기숙사에서 살기 위해서는 Meal Card라는 것을 기숙사 신청 시에 미리 구입해야 하는데, 가장 싼 plan D를 구입하는 것이 좋을 것 같다. Meal Card로 이용할 수 있는 음식들이 그다지 맛있지 않기 때문에, 자주 이용하지 않게 될 것이며, 적립된 금액을 다 썼을 경우에는 새로 충전이 가능하지만, card에 남아 있는 돈은 환불이 안되기 때문이다. 

내가 3개월 동안 살았던 기숙사는 HUB mall인데, 쉽게 말하면 자취형 기숙사이다. 1 bedroom, 2 bedroom, 4 bedroom 이렇게 3 종류가 있는데, 4 bedroom의 경우는 하루에 CN$8.00(전화세만 뺀 모든 utility 비용 포함)로 매우 저렴하다. 한 Unit 당 부엌과 마루, 화장실은 공동 공간이며(4명이 하나의 화장실을 써야 한다는 것이 아침에 좀 불편하기도 했다.) 필요한 모든 가구(부엌 시설과 옷장 제외)와 생활 용품은 각자 마련해야 한다는 단점이 있다. 게다가 룸메이트와의 관계가 좋지 않아, 이사를 나가는 경우도 꽤 많이 보았다. 하지만 나 같은 경우에는 직접 자취라는 것을 해 봄으로써 배운 점도 굉장히 많았으며, 주말이나 방학 때 친구들을 초대해서 시간을 함께 보냈던 경험들은 참 값진 것이었다. HUB mall에는 HCA라고 해서 HUB mall에 사는 사람들만이 이용할 수 있는 공간이 있는데, 이 안에는 컴퓨터실, 작은 영화 상영관, 헬스장 등이 있으며, 커다란 TV와 소파, 탁구대와 당구대, 그리고 피아노도 있어서 여가를 즐기기에 좋다. 컴퓨터를 이용하려면 처음에 staff에게 자신만의 고유 ID를 신청해야 한다. 프린터도 할 수 있으며 24시간 개방이지만 컴퓨터의 상태는 정말 심각하다. 헬스장은 3개월 동안 살면서 딱 한번 가봤는데, 기계 상태는 깔끔하지만 종류가 그다지 많지 않고 정말 작다. 영화 상영관에서는 주말에 3~4편씩 무료로 개봉된 지 몇 달 지나지 않은 영화들을 상영해 주며, HCA 입구 근처에 있는 방에서는 비디오를 무료로 빌려주기도 한다.

교환 학생들은 보통 기숙사에서 생활하지만 학교 근처에 있는 아파트나 주택을 다른 학생들과 함께 Share해서 살거나, 혹은 혼자서 살기도 한다. 이런 집들은 개인적으로 구해야 하는데, 학교 곳곳에 룸메이트를 구한다는 포스터가 붙으며, 학생회에서 관리하는 웹페이지에도 이런 광고가 많이 올라와 있다. 

HUB에 살았던 나는 직접 취사를 해서 끼니를 해결했다. 1~2주일에 한 번씩 Superstore나 Safeway라는 커다란 수퍼에 가서 장을 봤는데, Superstore는 6번 버스를 타고 Southgate로 가거나 LRT를 타고 Claire View에서 내리면 되고, Safeway는 걸어갈 수 있는 거리에 있다. Safeway 회원 카드를 만들면 특정 품목에 대해서 할인 받을 수 있으니 잊지 말고 만들길 바란다. 캐나다는 거의 모든 곳에서 신용 카드를 사용할 수 있지만 Superstore는 MasterCard만을 취급하는 것도 알아두시길. 한국 식품점은 2군데가 있는데 '아리랑'은 Bonnie Doon에 가는 버스(4번, 106번)를 타면 쉽게 갈 수 있다(CN$50 이상인가를 구매하면 배달을 해준다고도 한다.). 나는 '어촌'이라는 곳 밖에 안 가봤는데, 이 곳은 멀어서 대중 교통보다는 자가용을 이용하는 것이 편하다. 

매주 토요일에는 Farmer's Market이라는 것이 열린다. 농부들이 직접 재배한 채소, 과일 등을 팔기 때문에 신선하고 좋으나 가격은 조금 비싸다. 한국 음식을 파는 곳도 있는데, 개인적으로 이 곳 김치가 제일 맛있는 것 같으며, 여기에서 파는 '데리야끼 김치 버거'는 외국인들에게까지도 정말 인기가 좋다. 아저씨께 '안녕하세요'하고 인사를 했더니 만두를 하나씩 주셨는데, 외국에서는 정말 이런 사소한 정에도 감동을 잘 받게 되는 것 같다.

학교 주변에 있는 음식점 중에는 Library bar(그릴 버거, 나초가 맛있다.), Avenue Pizza(피자, 치킨 윙, 라자냐가 맛있다.)가 갈 만 하다(항상 한국 사람들을 많이 볼 수 있다.). 그러나 보통 2시면 다 문을 닫는다. 조금만 더 걸어가면 Timholtons라는 곳이 있는 데, 우리나라의 던킨도너츠 정도로 생각하면 되고, 24시간 open이다. HUB mall 뒤쪽으로 가면 KIGAN이라는 레스토랑이 있는데 이 곳도 24시간 open이며, 이 곳의 팬케익은 정말 맛있다. 바로 옆에 있는 Kyoto의 점심 벤또나 White Ave에서 가까운 Osaka의 생선 초밥도 먹을 만 하다. Osaka 건너편에 Lee's house라는 한국 음식점이 있는데, 이 곳은 자장면과 짬뽕이 가장 맛있다. 한국 음식점 중에는 진생이라는 곳이 최고다. 너무 멀어서 갈 엄두도 못 내고 있다가, 기회가 돼서 한 번 가봤는데, 너무 맛있어서 다들 감동했던 기억이 난다.

Edmonton에는 정말 많은 종류의 음식점이 있다. 타이 음식점, 말레이시아 음식점, 베트남 음식점, 그리스 음식점, 멕시코 음식점 등을 찾아다니며 세계의 음식 문화를 체험하는 것도 좋을 것 같다.","① CLASS 102 - Greek and Roman Mythology

제목만 보고 재미있을 것 같아서 신청했다가 정말 고생 많이 한 과목이다. 이름에서 알 수 있듯이 그리스 로마 신화에 대한 수업이고, 인문학 계열을 전공하려는 1학년 학생들이 많이 듣는 수업이다. 9월에 10%짜리 퀴즈를, 10월에 15%짜리 중간 고사를 봤으며, 11월에는 25%짜리 essay를 제출했고 12월에 50%짜리 기말 고사를 봤다. 한 시간 내내 교수님의 강의로만 수업이 진행되어서 예습이 필수였던 과목이었는데, 교재가 1000페이지가 넘는 두께인데, 하루나 이틀만에 한 단원씩 진도가 나갔기 때문에 한 번도 제대로 예습한 기억이 없다. 중간 고사 때까지 혼자서 끙끙대며 앓다가, 결국 essay 과제가 부여된 날 교수님을 찾아갔는데, 의외로 교수님께서 너무 좋아하시면서 essay 쓰는 것도 도와주시고, 강의 전에는 e-mail로 다음에 나갈 부분에 대한 설명도 간략히 해주셔서 다행히 pass할 수 있었다. 

② SOC 210 - Social Statistics
사회학을 하는데 필요한 통계를 배우는 과목이다. 고등학교 수준의 통계 지식만 있으면 수업을 따라가는 데 문제가 없을 것으로 보인다. 그러나 시험은 개념을 묻는 문제도 많고, essay도 써야 해서 좀 어려웠다. LAB 시간에는 SPSS라는 프로그램을 다루는데, 수업만 빠지지 않고 나간다면 어렵지 않다. 중간 고사 37.5%, 기말 고사 37.5%, 그리고 LAB 참여도와 퀴즈 성적이 25% 반영된다. 

③ MATE 365 - Material Design Project I
전공 과목이다. 우리 학교에는 없는 내용이라 호기심으로 신청한 과목. 매주 숙제를 제출해야 돼서 힘들었으며 50%짜리 Final Project를 하느라 고생한 기억이 나지만, 그래도 호주에서 온 교환 학생 Ben과 함께 project에 매달린 마지막 한 달은 정말 값진 경험이었다. 공대 과목의 경우, 숙제는 시험의 연장선인 것 같았다. 제출하는 데 의의가 있는 우리네와는 달리, 풀어낸 모든 문제를 꼼꼼히 채점해서 돌려주고 풀이까지 해준다. 그래서 숙제를 베끼는 것은 있을 수 없는 일이다. 보통 숙제하다가 힘든 일이 있으면 서로 의논을 하거나, 아니면 교수님께 직접 물어 보며, 교수도 질문하러 온 학생들에게 매우 친절하고 자상하다. 

④ MATE 430 - Hydrometallugy and Pyrometallugy 
역시 전공 과목이다. 4학년 과목인 데다가 실험까지 있어서 조금 힘들었다. 교환 학생으로 외국에 나갈 기회가 있다면 외국어 수업이나 실험 수업은 꼭 한 번 듣는 것이 좋을 것 같다. 실험복은 물론이고 보안경까지 착용하면서, 실험에 열중하는 외국 친구들을 보고 정말 자극을 많이 받았다. 외국 학생들은 냉정하고 개인적일 줄 알았는데, 실험 보고서를 쓰면서 끙끙대고 있는 나에게 먼저 선뜻 자신의 실험보고서를 보여준 친구 때문에 감동 받은 기억이 난다.

⑤ 참고로 영어 때문에 미리 겁먹을 필요는 없다고 말하고 싶다. 인문 사회 쪽 과목이 아니라면 영어 듣기 능력 하나만으로 수업을 따라가야 할 필요가 없으며, 설사 영어 때문에 수업을 따라가기 힘들더라도, 교수나 조교들이 정말 친절하게 잘 도와주기 때문이다. SOC 210(사회 통계학) 첫 수업 시간, 오히려 교수님께서 나에게 ""일본인이냐?""고 먼저 말을 걸어주셨으며, 이 것이 인연이 되어 학기 마칠 때까지 교수님과 친하게 지내기도 했다. 수학 과목은 상대적으로 동양인들에게 유리하기 때문에, 학점이 많이 모자라는 사람은 수학 과목을 포함해서 수강하는 것도 좋을 것 같다. 친구가 소개해 준 Drama 과목은 사람들 앞에서 영어로 말하는 기회를 많이 부여해주기 때문에, 자신감과 영어 실력을 동시에 늘릴 수 있을 것 같다. 또한 U of A에는 여러 종류의 Activity에 관련된 과목들도 많으니 한국에서는 경험할 수 없는 것을 배워보는 것도 좋을 것 같다. 나는 Indoor wall climbing이나 카누 등을 해보고 싶었는데, 너무 빨리 수강 정원이 차버려서 아쉬웠다.","U of A에 도착하자마자 제일 먼저 찾아가 보아야 할 곳이 바로 국제 교육부이다. 국제 교육부는 HUB mall 중간정도의 지하에 자리잡고 있는데, 처음에 가면 여러 가지 안내 책자를 주고 앞으로의 생활에 대해 정말로 자세하게 설명을 해준다. 내가 아직 머무를 곳을 구하지 못하였다고 하자, 집을 계약할 때 꼭 알아두어야 할 사항까지도 자세하게 설명해 주셨다.

9월, 새로운 학기가 시작하기 전, 8월 말에 며칠 동안 오리엔테이션이 있었다고 하는데, 나는 사정상 참여하지 못했다. 그 오리엔테이션에 참여했던 친구들은 다른 나라에서 온 교환 학생들을 만나기도 했고, Peer Program이라는 프로그램(국제 학생들과 현지 학생들을 연결시켜주는 프로그램)의 혜택을 받아 캐나다 친구들과 미리 캐나다 생활을 익히기도 했다. 나는 학기가 시작하고 1주일 정도 후에 했던 오리엔테이션에 참여했는데, 그 때도 역시 많은 외국 학생들을 만날 수 있었고, 앞으로 해야 할 캐나다 생활을 미리 배울 수 있는 기회가 되었다.

학기 중에도 국제 학생들을 위한 여러 가지 event가 있다. 그 중에서도 한 달에 한 번, 매달 마지막 금요일 점심을 무료로 제공하는 T.G.I Friday라는 행사가 제일 좋았다. U of A에는 Visiting Student Program이라는 것이 있다. 그러나 연대에서 온 교환 학생들은 VSP에 속하지 않기 때문에 VSP 학생들을 위한 행사에는 초대받지 못한다. VSP 학생들은 이들을 위한 여러 행사 때문에 외국 학생들과도 많이 접촉할 수 있는 반면, 상대적으로 연대에서 온 교환 학생들은 자발적인 노력이 필요하다. 따라서 국제 교육부에서 하는 여러 행사는 외국 학생들을 만나고 사귈 수 있는 좋은 기회가 될 것이다. 사실 이 행사를 제쳐놓고 다른 재미난 일을 할 수 있을 만큼, Edmonton 생활이 재미있지 못하기도 하다.

국제 교육부에서는 여러 가지 봉사 활동 프로그램을 마련해 놓고 있다. 나는 Bridge Program이라는 것을 신청했는데, 이는 Edmonton에 있는 여러 교육 기관에 가서 자신의 국가에 대한 것을 소개하는 것이다. 이틀 간 진행된 Workshop때, Presentation을 잘 하는 법에 대해 배우고, 처음 만난 사람에게 자신의 의사를 분명하게 표현하는 법 등 여러 가지를 배웠는데, 아쉽게도 실제로 써먹지는 못하고 말았다. 만약 이 프로그램에 관심이 있다면, 미리 한국에 대한 자료를 준비해서 가져가는 것이 좋을 것이다. 어린 아이들은 시각과 청각에도 예민하지만, 먹을 것에 굉장히 관심을 보인다고 하는데, 한국에서 전통 과자나 엿 같은 것을 미리 사왔으면 좋았겠다 하는 생각을 했었다.","① 도서관과 컴퓨터실

U of A에는 여러 도서관이 있는데, 나는 주로 Cameron을 이용하였다. 
이 곳은 이학, 과학 쪽의 자료들을 소장하고 있으며 지하에 OneCard 사무실과, Knowledge common이라 불리는 컴퓨터실, 그리고 Study hall이 있다. 
OneCard는 우리 식으로 하면 학생증인데, OneCard 사무실에 가면 즉석에서 만들어준다. 
사진은 즉석에서 디지털 카메라로 찍기 때문에 따로 준비해갈 필요가 없으며 비용은 무료이다. 단 재발급을 위해서는 CN$15정도가 필요하다. 
Knowledge common에 있는 컴퓨터들은 누구나 이용할 수 있지만 인터넷에 연결하기 위해서는 CNS ID가 있어야 하는데, 교환 학생들은 자동적으로 교부받게 되므로 신경 쓸 필요가 없다. 
한 쪽에는 프린터기와 복사기가 있는데, 프린터나 복사를 하기 위해서는 미리 OneCard에 현금을 충전시켜야 한다. 
현금 충전기는 Cameron 도서관 1층에 있는 복사실에 있으며 지폐만 통용되기 때문에 CN$10 정도의 지폐를 미리 준비하는 것이 좋다(장당 10센트이므로 알아서 적당한 금액을 충전하시길). 
Knowledge common에서는 스캐너도 이용할 수 있는데, 이용하기 위해서는 스캐너 옆에 있는 장부에 자발적으로 자신의 이름과 학번 등을 기록하여 미리 예약하기만 하면 된다. 
한 사람이 한 번에 최대 1시간 반까지 이용 가능하지만 스캐너를 사용하는 학생들이 그다지 많지 않기 때문에 이용하는데 큰 불편은 없을 것이다. 
한 쪽에는 Laptop 사용자들을 위한 자리가 한 20석 정도 있으며 연결이 좀 느리기는 하지만 이 곳에서도 인터넷 연결이 가능하다. 
또한 4~5명이 조 활동을 할 수 있는 방이 두 개가 있으며 이 곳도 역시 자발적인 예약만이 필요할 뿐이다. 
이 방 안에는 작은 책상과 의자, 화이트보드, 그리고 컴퓨터가 구비되어 있고, 이 방을 사용하기 위해서는 최소한 3명 이상이 있어야 한다. 
Study hall은 우리 학교의 중앙 도서관과 같은 독서실 책상이 있는 곳으로 서양 학생들보다는 동양 학생들, 그 중에서도 특히 한국인들을 많이 볼 수 있는 곳이다. 
Study hall의 가장자리에도 컴퓨터가 설치되어 있는데, 이 컴퓨터에는 한글 폰트가 설치되어 있어, 별도의 작업 없이도 한글을 쉽게 이용할 수 있다. 

Rutherford 도서관에는 인문계열의 자료와 각종 소설 류가 소장되어 있다. Cameron 도서관은 1층 짜리 건물이지만 Rutherford 도서관은 5층이나 된다. 
2층에는 작은 컴퓨터실이 있고 이용 방법은 Cameron에 있는 컴퓨터실과 동일하다. 

좀 멀지만 대학 병원 안에 있는 의대 도서관은 깨끗하고 조용해서 한국 사람들에게 인기가 많다. 
기말 고사 기간에 이 곳에 있는 작은 Study room에서 친구 4명과 함께 공부했던 기억이 난다. 도서관 바로 앞에는 컴퓨터실이 있는데 컴퓨터가 한 25대 정도 있는 것 같다. 

Law library는 Hub mall과 연결되어 있는 Fine Art 건물에 있다는 이유로 몇 번 이용했었는데, 개별 스탠드가 달린 책상이 무척 인상적이었다.

Hub mall 중간쯤에 있는 램프로 올라가면 Chinese Library가 있다. 
왼쪽은 독서실 책상들이 놓여있고 24시간 개방이라 시험 기간에 꽤 많은 사람들이 밤을 새며 공부하는 것을 볼 수 있다. 
오른쪽에서는 정말 많은 종류의 중국 책을 볼 수 있다. 대출 업무는 오후에 잠깐 1~2시간 정도만 하는데(몇 시부터 몇 시까지였는지는 기억이 나지 않는다.) 
이 글을 읽는 사람들이 대출 할만한 책이 있을 지는 모르겠다. 아무튼 이 도서관 이름이 Chinese Library인 이유는 바로 이 것 때문이었다. 

각 단과대 건물마다 컴퓨터실이 다 갖추어져 있다. 그 중에서도 내가 공부했던 Chemical and Material Engineering 건물에 있는 컴퓨터실과 Business Building에 있는 컴퓨터실이 제일 좋은 것 같다
(사실 Computer Science 건물에 있는 컴퓨터들이 U of A에서 제일 좋다고 하는데, 이 컴퓨터를 쓰려면 따로 부여받은 ID와 Password가 있어야 한다.). 
Business Building에 있는 컴퓨터실은 주말에도 저녁 9시까지 개방해서 이용하기 편리했다.

② SUB(Student Union Building)

우리 식으로 하면 학생회관 정도로 말할 수 있을까? 온갖 편의 시설이 다 있는 곳이다. 
지하에 오락실(미니 볼링대와 DDR도 있다.), 서점, 우체국이 있으며 한 달에 CN$7.00만 내면 개인 Mail Box를 가질 수 있다.
개인 Mail Box가 없는 사람은 소포가 왔을 경우, 우체국으로부터 소포를 찾아가라는 편지를 받게 되고, 이 편지를 가지고 White Avenue(82 Ave.)에 있는 우체국으로 직접 찾아가서 소포를 받아야 한다. 
1층에는 여러 종류의 음식점, 편의점, 헌책방, U of A에 관련된 기념품과 학용품을 살 수 있는 곳이 있다. 2층에는 병원(이라고 하기보다는 보건소라고 하는 것이 더 좋겠다.), 
Academic Assistance Center(이름은 확실하지 않다. 이 곳에는 시험에 대비하는 요령, essay를 쓰는 요령 등 학업에 필요한 여러 가지 강좌가 개설되어 있다. Writing Class가 들을 만 하다던데, 일주일에 1번씩 하루 3시간 수업으로 6주에 CN$80이며, 한 번 이 수업을 들은 학생들은 나중에 essay를 쓴 후에 무료로 교정받을 수도 있다고 한다.) 등이 있다. 
4층부터는 작은 세미나실들이 있는데, 학생회에 예약 신청만 하면 무료로 사용할 수 있고 7층(혹은 8층)에는 RATT라는 Bar가 있다.

③ 체육관

SUB 맞은 편에 있는 노란색 건물로 Butter Dome이라고 불린다. One Card만 있으면 체육관의 모든 시설을 무료로 이용할 수 있다. 
나는 주로 수영장과 Fitness Center를 이용했는데, 모두 깨끗하고 좋다. 수영장은 East Pool과 West Pool, 이렇게 2개가 있으며 각각 사용할 수 있는 시간이 다르다. 
2층에 있는 사무실에 가서 미리 스케줄을 확인하는 것이 좋겠다. 
Fitness Center는 점심시간과 저녁시간 즈음에 매우 붐빈다. 10개정도 있는 러닝머신과 자전거가 모두 바쁘게 돌아가기 때문에, 이 시간대에는 이 기계들을 한 사람 앞에 20분씩 밖에 이용하지 못한다. 
그리고 기계를 이용하기 위해서는 벽에 있는 white board에 미리 이름을 적어 놓아야 한다.

④ 기타 오락 시설
SUB에 있는 RATT라는 bar 말고도 캠퍼스 내부에 Power Plant라는 bar가 있다. 옛날에 발전소였던 것을 개조해서 bar로 만들었다고 하는데, 한번도 가 본 적은 없지만 항상 사람들로 바글거리는 것 같다. 꽤 자주 part time worker를 구하는 걸로 봐서는 일이 상당히 고된 것 같기도 한데...

HUB에도 Chinese library 아래에 오락실이 있는데 내가 한국으로 귀국하기 한 일주일 전에 DDR이 생겼다. HoHo Chinese라는 가게에 음식을 주문해 놓고, 음식이 나올 때까지 바로 옆에 있는 이 오락실에서 게임을 했던 기억이 난다.","이제는 우리 사회도 서양 문화가 많이 침투하여 특별히 문화적 충격이라고 할 만한 것은 없었지만 영화나 책에서 본 장면이 내 옆에서 일어나고 있을 때 속으로 적잖이 놀랐던 경우가 많았다. 가장 기억에 남는 것은 수업 시간에 내 옆자리에 앉은 여학생이 피자헛에서 포장해 온 조각피자 상자를 열어 냄새를 풍기며 피자를 먹고 있는데 아무도 그 여학생에게 뭐라고 하지 않는 상황이었다. 아직도 우리나라에는 수업 시간에 음료수를 마시는 것도 싫어하시는 교수님이 많다는 것을 생각해보면 참 이해가 되지 않는 장면이다. 또 내가 들었던 수업 중에는, 교수님 보다도 나이가 많아 보이는 아저씨가 학생으로 참여한 것도 있었다. 그 아저씨는 매 수업시간마다 교수님과 토론과 농담을 하며 웃으셨고 교수님과는 마치 친구사이 같이 보였다. 통계학 강의를 하셨던 교수님은 연세가 60이 넘어 보였지만 항상 청바지에 화려한 색상의 스웨터를 입고 수업을 하셨다. 나이는 숫자에 불과하다는 것이 이 곳 캐나다에서는 너무도 당연히 받아들여지고 있는 것 같았다.",한국에서는 원래 교회에 다니지 않았지만 친구의 소개로 Christian on campus라는 모임을 이끌고 있는 현지 크리스찬 분들을 만나게 되었다. 매주 수요일과 금요일에 U of A 학생들을 집으로 초대하여 맛있는 식사와 함께 bible study 등 다양한 모임을 한다. 기숙사를 배정받지 못하여 처음 일주일 동안 집을 구하러 다닐 때에도 이분들의 도움으로 homestay를 할 수 있었다. 한인교회가 아니라 현지 교회이기 때문에 오히려 서양인들의 생활을 깊이 체험할 수 있고 영어를 쓸 기회도 많다는 등의 장점이 많아 모임에 적극적으로 참여했던 것 같다. 교환학생 기간 중 어려움이 있다면 점심 시간에 학생회관에 가서 christian on campus라고 쓰여진 테이블을 찾아보길 바란다. 한국에서 온 교환학생이라고 하면 굉장히 반갑게 맞아줄 것이다.,"도착하자 마자 할 일

1. ID 카드 발급받기
OneCard는 우리 식으로 하면 학생증인데, OneCard 사무실에 가면 즉석에서 만들어준다. 사진은 즉석에서 디지털 카메라로 찍기 때문에 따로 준비해갈 필요가 없으며 비용은 무료이다. 단 재발급을 위해서는 CN$15정도가 필요하다.
OneCard는 컴퓨터, 프린터 등을 이용할 때, 체육관 시설을 사용할 때도 필요하므로 꼭 발급받아야 한다. 그러나 Bar 같은 곳에 들어갈 때 미성년이 아님을 증명하는 신분증으로는 인정하지 않는다. 인정하는 것은 국제학생증이나 여권 뿐. 여권은 분실위험이 많으므로 한국에서 국제학생증(빨간색카드는인정안함!)을 발급받아 가는게 좋다.

2. 의료 보험
U of A에서 공부하려면 의료보험을 꼭 들어야 하는데(의료보험을 들지 않으면 등록이 취소된다.), 1년 미만으로 공부하려는 학생들은 학교에서 제공하는 의료보험(UAHIP)을, 1년 이상 공부하려는 학생들은 Alberta주에서 제공하는 의료보험(AHCIP)을 들어야 한다(AHCIP가 더 싸니 능력이 되시는 분들은 AHCIP를 드는 게 좋겠다.).
다래끼가 나려고 해서, SUB에 있는 보건소에 한 번 가 본 적이 있는데, 사람들이 모두 굉장히 친절하고 좋았다. 다래끼가 영어로 뭔지 미처 모르고 가서, 더듬더듬 상태를 설명하는 나에게 의사 선생님께서 친절히 stye라고 알려주시기까지 하셨다. 진찰료는 의료보험으로 공제가 되지만 약은 따로 사야한다. 일주일치 알약을 CN$8.00정도에 샀던 것 같다.

3. 은행 구좌 개설
Edmonton에는 CIBC, Royal Bank, Montreal Bank, TD Bank 등이 있는데, 캐나다의 이자율은 거의 0에 가까우므로, 자신이 생활하게 될 공간에서 가까운 은행을 선택하는 것이 좋겠다. 해외 송금 수수료가 상당히 비싸므로 송금은 자주 받는 것 보다 한번에 많이 받는 것이 유리하며, 한 달 평균잔액이 CN$1000을 넘지 않으면 얼마의 수수료가 나가는 것도 알아두시면 좋다. 은행 구좌를 개설하기 위해서는 여권(Student Authorization이 붙어있는)이 필요하며, U of A 학생이라고 하면 학생에게 적합한 plan을 소개해 준다.

여가생활

① 영화
조금은 따분한 Edmonton 생활에 활력을 불어 넣어준 것이 바로 영화였다. 보통 CN$12~14 정도면 영화를 볼 수 있으며 CN$3 정도면 개봉한 지 3달 정도가 지난 영화를 볼 수 있다(그렇다고는 해도 한국에서는 아직 개봉하지도 않은 영화다!). 화요일에는 모든 영화를 반값으로 볼 수 있어서 매주 화요일에는 거의 빠짐없이 영화를 봤던 것 같다. 

② West Edmonton Mall (앞으로는 WEM)
세계에서 제일 크다고 하기도 하고, North America에서 제일 크기도 하다는데, 아무튼 굉장히 큰 실내 쇼핑 몰이다. 실내에 스케이트장과 놀이 기구 시설이 있는 것은 우리나라의 롯데월드와 흡사하고, 실내에 마련된 수영장은 실내 캐리비안 베이를 연상시키는데, 사실 비교할 수는 없다(우리나라가 훨씬 낫다!). WEM에는 정말 많은 상점이 자리잡고 있어서 쇼핑하기 좋지만, Edmonton의 모든 가게가 그렇듯이 이 곳도 어김없이 저녁 6~7시면 문을 닫는 것이 아쉽다. 또한 WEM에는 총 3개의 영화관이 있고, Cinema 6라는 영화관은 싼 영화관이다.

③ 여행
가까운 곳으로는 로키산맥에 있는 국립 공원인 Banff나 Jasper가 좋으며(Banff는 차로 5시간 정도 Jasper는 4시간 정도 걸린다.), 여유가 있는 사람은 Vancouver, 혹은 동부 쪽으로도 여행하고 돌아오면 좋을 것 같다(여행하기에는 당연히 여름이 좋다.). 파견 기간 중에 겨울이 포함되어 있다면, 당연히 스키장에도 가 볼 것을 권한다. 2월 말이나 3월 초에는 국제 교육부에서 주최해서, 싸게 스키 여행을 할 수 있다고도 하니 잘 참고하시길. Calgary는 Edmonton에서 3시간 정도면 갈 수 있는데, 특별히 구경할 것은 없다. Banff를 가는 중간에 잠깐 들러서 둘러보는 것도 좋을 것 같다."
