gen_info,env_info,food_info,study_info,office_info,facil_info,mhct_info,help_info,etc_info
"가을학기에 알버타는 9월까지도 따뜻하다가 갑자기 추워졌던 기억이 난다. 캐나다인들은 그 추위에도 패딩 없이 다니는데 우리는 가을학기에 간다면 패딩은 필수이다. 지리적 위치가 여행다니기에 최적은 아니지만 밴프, 캘거리 정도는 가볍게 다녀올 수 있다.","학교 기숙사와 연결된 지하철이 있고, 학교 바로 앞에는 버스정류장이 있어 바교적 교통편이 좋은 것 같다. 그러나 캐나다 자체가 너무 넓어서 차가 있는 친구를 사귀면 조금 더 이동이 수월하다. 밤에는 지하철에 사람도 별로 없고 노숙자도 많아서 조금 무섭다. 따라서 밤에는 되도록 실내에 들어가 있는 것이 안전하다.","대부분의 기숙사들은 취사가 가능한 것으로 안다. 또한 헙 기숙사 1층에는 식당가가 쭉 줄지어있으니 먹을 걱정은 없다. 푸드코트마냥 식당가, 편의점 등이 쭉 줄지어 있다. 장을 봐와서 직접 해먹어도 되고, 우버이츠도 되는걸로 안다.","미리 전공 관련 교과목 수강을 승인받지 못하여 많은 학점을 이수하지는 못하였으나 들은 과목들 모두 즐겁게 들을 수 있었다. 도서관은 두 개가 있고, 나는 주로 학교 기숙사와 연결된 도서관을 이용하였다. 도서관이 꽤나 컸고 학생들 모두 열심헤 공부하는 분위기라 늦게까지도 열람실이 활성화되었다.",모르는게 있을 때 메일을 드리면 빠르게 답장이 왔던 기억이 있다. 감사하다.,"학교 내에 여러가지 아웃도어 프로그램들이 있다. 돈을 내고 수강신청을 하면 일주일에 한두번 가는 정기 운동프로그램도 있고, 사람들을 모아 주변 관광지, 체험프로그램에 참여하는 프로그램도 있다. 시간을 들여서 여행을 갈 정도의 유명지는 아니지만 주변에 가볼만한 곳들을 편리하고 쉽게 갈 수 있는 기회니까 한번씩은 참여해보았으면 좋겠다. 가서 쏟아질 것 같은 별들을 보았던 게 기억에 남는다.","딱히 컬쳐쇼크는 없었다. 전혀 인종차별을 받지 않았고, 친구들도 모두 친절했으며, 기억에 남을만한 유별난 점은 없었던 것 같다.","학교에 처음 가면 카테고리별로 도움을 받을 수 있는 곳들, 전화번호가 쭉 나와있는 책자를 준다. 학교 안에 거의 다 있고, 헙 기숙사 내에 있는 곳도 많다. 전화하면 친절하게 대답해준다.",
"캐나다 서부의 에드먼턴 알버타 주에 위치해 있습니다. 캐나다에서도 유독 추운 것으로 유명한데, 9월 중순부터 눈이 얕게 내려 굉장히 당황한 기억이 있는데 보통은 10월부터 눈이 온다고 하네요. 추위에 대비가 잘 되어 있어 주요 건물들은 bridge나 지하를 통해 연결이 되어 있습니다. 학교는 크게 North- South Campus로 나뉘어 있는데 보통 North campus에서 생활하게 되고, North에서 South로 가기까지 LRT 정거장을 몇 개를 거칠 만큼 넓습니다. 캠퍼스 하나를 통틀어 하나의 마을이라고 생각하면 편합니다.","알버타 주 자체가 대학을 중심으로 하고 있어서 번화해 있지는 않습니다만, 가라오케와 한국식 술집이 있긴 있습니다. 다만 차로 이동해야 하고, 외식비가 비싸 많이 가게 되지는 않습니다.Whyte avenue의 가게들은 수요일마다 wings day 로 닭봉과 닭날개를 싸게 팝니다. (술을 시켜야 이 할인이 적용됩니다.) Whyte avenue의 the pint 를 추천합니다! 학생들이 수요일마다 wings를 먹으러 모두 whyte ave으로 총출동하는 분위기입니다.버스를 타고 30분 정도 가면 한때 북미 최대 쇼핑몰이었고 현재로서는 두 번째로 큰 규모인 WEM(West Edmonton Mall)이 있습니다. 한 학기 동안 웸을 다 돌아보는 게 목표였는데 결국 그러지는 못했습니다. 쇼핑몰 안에 놀이공원, 워터파크, 스케이트장까지 있고 웬만한 브랜드는 다 있어서 홀린 듯이 돈을 쓰고 오곤 했습니다. 쇼핑몰 내 식당들도 아주 괜찮고요! 한국에서도 입을 만한 괜찮은 옷 등을 마련하려면 웸을 추천합니다. 학교 근처에 Red Ponnies (?) 라는 빈티지 샵도 있었던 것 같은데 가 보고 싶었는데 못 갔습니다..ㅠㅠ 구글맵에 치면 나올 테니 관심 있는 분들은 한 번 가 보세요!","저는 East Campus Village의 Pinecrest House에서 한 학기 동안 살았습니다. Pinecrest House는 보통 유럽-호주권 친구들이 살고 간혹 가다가 한국인, 일본인 친구들이 있는 정도입니다. 방은 확실히 HUB보다 넓고 깔끔한 편으로 한국에서 가져 봤던 제 방보다 훨씬 넓었습니다. 4인실이었는데 독일인, 영국인 룸메와 셋이 살았고, 나중에 둘이 싸우더니 영국인 친구가 나가서 두 명이서 살았습니다… 특별한 불만은 없었습니다. 식사는 일-이주에 한 번 장을 봐서 친구와 함께 요리해 먹었습니다. LRT를 30분 정도 타면 종점인Clairview 역에 Superstore 라는 커다란 마트가 있는데, 재료도 신선하고 가격도 가장 합리적입니다. 초기 정착하실 때 필요한 밥솥이나 그릇, 주방도구, 이불 등등도 해결할 수 있습니다. 또 superstore의 맞은편에 dollarlama와 walmart도 바로 있는데 세 곳만 들리면 웬만한 건 있을 겁니다! 수퍼스토어 베이커리 코너의 어니언 베이글 존맛입니다 꼭 드세요! 학교 근처에도 Safeway라는 마트가 있습니다만 가격대가 조금 있는 편입니다. 시간이 있으시다면 LRT 타고 수퍼스토어에 가는 것을 강력추천합니다!","수업 중에서 introductory sociology를 가장 무난하고 편안하게 들었는데, 우리로 따지면 고등학교 사회탐구 사회문화에 해당하는 수업이라서 쉽고 부담 없는 편입니다. Introduction of theatre art는 고대 그리스를 시작으로 전반적인 연극사부터, 오이디푸스, 셰익스피어부터 일본의 노, 중국의 경극 등 대표적인 희곡, 사이트 스페시픽 등 현대의 이론과 드라마트루기까지 다각도에서 공연예술의 기본기를 다룹니다. 학기 중 드라마 전공 학생들의 공연을 두 번 관람하게 되고 (한 번 의무, 한 번 선택- 선택 충족 시 보너스 포인트) 의무 공연을 본 뒤에는 레포트를 씁니다. 조별 활동을 통해 연기를 재현해보는 활동 등도 하고 가장 흥미롭게 들었던 수업입니다. 도서관은 HUB 옆의 Rutherford 도서관에 주로 갔는데 보통의 열람실 쯤이라고 생각하면 됩니다. 새벽 두 시까지 열어서 밤늦게 공부하기 편했습니다. 24시간 운영하는 Cameron 도 있습니다만 기숙사와 가까워서 주로 Rutherford를 갔습니다.","국제교육부에서 주관하는 오리엔테이션은 그렇게 흡족하지는 못했는데, 사람들을 많이 만나는 기회는 되지만 체계적이고 정돈되어 있지는 못하다고 느꼈습니다. 하지만 다양한 사람들을 만나고 얘기하는 기회 삼아서 한 번씩 나가 보시길 추천합니다.","동아리는 하지 않았습니다만 UofA 국제 학생들을 위한 주말 프로그램 참가를 종종 했습니다. 9월 말 경 에드먼튼의 옥수수 밭에서 하는 corn maze 행사, 11월 경 근처의 elk park에서 하는 하이킹과 별 관측 등에 참여했는데 star gazing이라는 이름의 별 관측 꼭 해 보시길 추천합니다. 그렇게 많은 별들이 눈에 다 쏟아지는 경험은 처음이었거든요.  또 한국어 TA 봉사도 추천합니다. 외국인 친구도 많이 사귀고, 한국어를 영어로 가르치는 경험도 꽤나 새로웠습니다. TA 봉사 신청은 관련 교수님을 찾아서 메일을 드리면 바로 신청서와 함께 답신을 주실 겁니다.","컬쳐쇼크는 크게 없었는데 자꾸 남자친구를 데려오는 룸메^^,, 아무도 이상하게 생각 안 하길래 저만 불편해하면서 스트레스 받다가 나중에는 적응해버렸습니다.또 팁 문화가 아무래도 적응하기 힘들었는데, 캐나다에서는 15퍼센트의 팁이 일반적이고 좀 괜찮은 레스토랑 등은 20퍼센트부터 시작하는 곳들도 있습니다. 테이블에 앉고, 테이블마다 서버가 붙는 식당은 무조건 팁이 붙는다고 보시면 됩니다. 팁 때문에 외식비가 참 비싸지더군요ㅠㅠ",Pinecrest House 뒤편에 International House (통칭 I house)에서 기숙사 관련 행정 업무를 담당합니다. 정말 친절한 분들이니 망설이지 말고 도움을 요청하세요! ??,"9월 초의 밴프 여행을 강조하고 싶습니다. 알버타대는 물론 캘거리대로 가시는 분들 밴프 여행은 선택이 아니라 의무입니다. 급하게 여행 전날 모든 준비를 해서 엄청 비싸게 갔다 왔는데, 다시 그 계절 그 순간의 밴프를 볼 수 있다면 똑같이 지불하고도 갈 것 같습니다. 개강하자마자 그 주 주말은 밴프 여행을 가세요 제발요… 밴프는 캘거리에서 차로 1-2시간 남짓으로 에드먼튼에서는 결코 가까운 거리가 아닙니다. 에드먼튼-캘거리가 비행기로 50분이니까요… 저는 전날 허겁지겁 예매하는 바람에 갈 때는 비행기, 올 때는 그레이하운드를 탔는데 룸메는 친구들과 착실히 준비해서 차를 렌트해서 갔습니다. 또 밴프에서 Hop on and Hop off 버스 투어를 구글링해서 신청하는 것을 추천합니다. 비용이나 일정이 부담스러우시다면 국제학생을 대상으로 하는 주말 프로그램에도 밴프 여행이 있으니 이를 이용해도 괜찮을 것 같습니다.그리고 10월에 Thanksgiving을 이용해서 몬트리올-퀘백을 갔는데 이 때 날씨가 정말 좋으니 기회가 된다면 꼭 가 보세요! 단풍도 예쁘게 들고 하늘도 투명하고 도시 분위기도 에드먼턴과 사뭇 다릅니다. 물론 캐나다 서부에서 동부로 이동하는 것이어서 비행기 타는 것이 굉장히 힘들었는데 그만큼 값진 경험이었습니다."
"알버타대학교는 굉장히 크다. 땅덩이 자체가 우리나라랑 비교도 안되게 큰 캐나다임을 언제나 실감 시켜주는 그곳은 아직 내가 모르는 건물의 이름이 더 많을 정도로 한학기에 친해지기에는 너무 큰 감이 없지 않아있었다. 또 알버타대학교가 있는 에드먼튼이라는 도시는 엄청난 추위로 유명한 곳이다. 그래서 데드먼튼이라고 불리기도 한다고,,ㅋㅋ 가을학기에 파견된 나는 그정도로 추위를 느끼지는 못했지만 겨울학기에 가시는 분들은 상상도 못할 추위를 경험하시고 올수 있을것 같다. 내가 간 2018년도에도 첫눈에 9월에 오는 것을 보고 기함을 했는데 그때 더 충격적이었던것은 첫눈이 오고 추우니까 같이 갔던 한국학생들은 다 롱패딩을 챙겨 입었는데 현지학생들은 아무렇지 않게 반팔이나 후드티를 입고 다녔다는것.. 오히려 그쪽에서 오래산 친구들은 엄청 두꺼운 패딩보다 모자나 장갑 목도리를 꼭하고 다니고 얇은 옷을 여러개 입는 것 같다. 온도자체는 영하로 꽤나 빨리 떨어진다. 그런데 한국의 겨울보다 춥게 느껴지지 않는 이유는 바람이 거의 불지 않기 때문이다. 그래서 그렇게 걱정은 안해도 된다. 전기장판까지는 필요없다고 생각한다. 따듯한 이불은 필요하다. 이케아에서 산 오리털 이불이 참 좋았다. 추천한다.","신촌에서 생활을 하다가 에드먼튼으로 가면 진짜 아무것도 없구나 이런 생각을 하게 된다. 나는 이런 점이 끌려서 알버타대학으로 지원을 하게 되었지만, 매일 파티생활을 하고 엄청 휘황찬란한 교환생활을 꿈꾸는 사람에겐 이대학이 맞지 않을 수도 있다는 것을 말해주고 싶다. 그러나 잠시 쉬어가는 시간을 갖거나 자신에 대해서 사색할 시간을 갖고 또 아름다운 자연 환경을 마음껏 볼수 있다는 것에서 충분한 의미를 찾을 수 있다면 이곳은 더도 없는 좋은 터가 되어줄 것이다. white avenue정도가 그나마 대학가 주변의 번화가라고 할수 있다. 술집도 있고, 여러 음식점도 있다. 수요일마다 윙스데이라고 치킨 윙을 엄청 싸게 파는 날이 있는데 Pints라는 곳을 추천하고 많이 가보길 추천한다. 좋다.",나는 허브 4인실에서 살았고 나빼고 3명모두 중국인이었는데 꽤 친절하고 좋았다. 학기말에 자기들끼리 엄청 싸워댄거 빼면 살만 했다. 식사는 허브안에 굉장히 많은 식당들이 있는데 사실 그음식들이 그 가격을 하는지 잘 모르겠다. 나는 연대에서 같이 간 친구와 거의 매주 장을 봐서 음식을 해먹었는데 요리를 어느정도만 할줄 알면 그냥 과일이랑 스테이크가 엄청 싸고 맛있으니까 대충이라도 요리를 해서  해먹는게 정신건강이나 모든 부분에서 좋을 것이다. 연어도 싸다고 하는데 손질하는게 어려워서 안해먹었다. 스테이크를 거의 매일 먹었다. 엄청 싸고 맛있다. 스테이크를 부위별로 다 먹고 오길 바란다. 마트중에서 제일 추천하는 곳은 clareview에 있는 superstore인데 왜냐면 일단 싸고 질좋은 식품들이 많다. 물론 lrt타고 40분 가야하는데 같이 갈 친구들이 있다면 일주일에 한번 장보기는 여기가 최고다. 가성비를 따졌을때..슈퍼스토어에서 추천하는 품목은 베이글이다.. 여기 베이글진짜진짜 맛있다. 아마 캐나다에서 살쪄온건 이거 때문이겠지 그렇지만 500원에 그렇게 맛있는 베이글이 있는 건 반칙이다.그리고 스테이크랑 복숭아 중에 겉에는 분홍색이고 흰색인 복숭아가 있는데 엄청엄청엄청 맛있다. 꼭먹어보길 추천 그리고 뭐 정급하면 학교에서 버스타고 한 10분 정도? 아니면 걸어서도 갈수있는 safeway 를 추천한다. 여기도 나쁘지 않은데 일단 superstore보다 비싸다. 그래도 정급하고 물같이 무거운것들은 가까운곳에서 사시길.,"중국어 101을 가장 추천한다. 나도 가기전에 여기 있는 글들을 많이 읽어보고 갔는데 공통적으로 추천하는 것이 언어수업이라서 평소에 관심이 있었던 중국어 수업을 들었는데, 한학기 동안 가장 만족한 수업이었다. 영어로 중국어를 배우기때문에 되게 신기하고 언어수업은 대개 소규모로 진행되기 때문에 친구를 사귀기도 쉽다. 실제로 한국와서 연락을 계속하고 있는 현지 친구는 중국어시간에 사귄 친구다. 제일 재밌었다. 중국어말고는 심리학104와 전공과목하나를 들었다. 심리학 104는 400명이상이 듣는 대형강의인데, 심리학개론에 맞게 수준은 쉽고 다만 영어로 돼있다는거 그게 다고 대신 대형강의이기때문에 출석이 자유롭고 영화나 드라마에서 보던 외국 대형강의 문화, 자유로운 토론과 질문이 오가는 그런 분위기를 느낄수 있어서 좋았다.",국제교육부에서 주관하는 프로그램에 따로 참여하거나 도움받은건 없어서 잘 모르겠다.,"butterdorm이라고 체육관이 있는데 정말 크고 시설도 짱이다. 운동을 좋아하는 분이라면 꼭 이용해보시길. 그리고 수영장이나 스쿼시장과 같이 많은 체육시설이 있으니까 좋아하는 운동프로그램에 등록해서 운동을 배우는 것도 좋은 것 같다. 동아리는 따로 안해서 잘 모르겠고, 한국어수업에 TA로 참여를 했었는데 꽤 좋은 경험을 했다. 외국인이 한국어를 배우는것을 도와주면서 되게 보람있었고 학생 대부분이 중국인이긴 했지만 한국 문화와 한국어에 관심을 가지는 사람들이 많구나하는 모습을 보고 뿌듯했다. 거기서 좋은 친구들을 많이 만날수 있다. TA에 지원하는 방법은 수강신청할때즈음에 알버타대학교 홈페이지에 들어가서 그 학기에 한국어 수업을 하시는 한국교수님 메일을 보고 거기로 지원을 하면된다.","캐나다를 갔다와서 나를 변화시킨, 거기서 내가 겪은 몇가지 문화충격들이 있는데, 첫째는 바로 뒷사람을 위해서 문을 잡아주는 문화이다. 이건 기본 매너로 자리잡은것 같다. 캐나다 사람의 라이프 템포는 확실히 한국사람들의 그것과 비교해서 확실히 느린것 같다. 그래서 가끔 업무처리를 해야하는 상황이나 긴급한 상황일때 일이 더디게 처리돼서 엄청 답답함을 느끼지만, 평소에 기본적으로 남을 좀더 배려하고 생각할수 있는 여유가 생기게 하는 기조가 된다. 두번째는 버스 기사님께 승하차시 꼭 감사의 인사를 한다는 것이다. 별것 아닌것 같지만 보기가 좋았다. 승객은 그들을 존중하고 존중받은 그들은 좀더 나은 서비스를 제공하기 위해 노력하기 때문이다.",interntional house에서 교환학생 전반 생활에 대한 것들을 도와주고 기숙사에서 불편한점은 RA를 통해서 해결하면 된다.,"밴프여행을 꼭!!!!!!!!!!!!!!!!!!!!!!!!!!!!!!!!!!!!!!갔으면 좋겠다. 알버타대학을 가놓고 9월초에(가능하다면 8월에도) 밴프여행을 안가는건 말이 안된다. 내가 가본 여행중에서 제일 좋았다. lake louise보다 moraine lake가 더 좋은데 moraine lake는 개방하는 달이 정해져있으니 알아보고 가야한다. 여튼 두번가고 싶을정도로 너무너무 좋았던 밴프여행이었다. 정말 꼭 갔으면 좋겠다. 사실 알버타대학교는 다른 나라, 다른 대학교보다 좀 조용하고 한적하지만 그래서 심심하고 우울하고 적막하지만 밴프여행이 모든것을 미화할수 있게 해주었다. 나에게는. 그정도로 충격적으로 좋았으니 꼭 가보시길! 날씨 좋을때! 물론 여행날씨는 운이지만 날이 안좋은 밴프도 좋아 마땅하니 ㅠ:)"
