gen_info,env_info,food_info,study_info,office_info,facil_info,mhct_info,help_info,etc_info
"Thompson Rivers University는 캐나다 서부 Vancouver에서 내륙으로 3시간정도 들어가면 나오는 Kamloops라는 소도시에 위치하고 있습니다. 벤쿠버에서 Grey Hound(고속버스)를 타거나 비행기를 타고 이동할 수 있습니다. 사막기후에 속하는 곳으로 날씨는 건조한 것을 제외하고는 연중 내내 한국과 별반 다르지 않습니다. 다만 겨울에 비해 여름에는 몹시 건조하기 때문에 한국처럼 푹 찌거나 하진 않습니다. 도시는 톰슨강을 따라 발달해 있고 학교 기숙사에서 내려다보면 도시 전체가 내려다 보입니다. 밤에는 멋진 야경이 연출되는데 친구들끼리 농담으로 캄룹스에는 사람보다 가로등이 더 많을꺼라고 말하곤 했습니다. 또한 기숙사에서 내려다보이는 West Thomson river와 East Thomson river가 합쳐지는 곳과 도시 외곽에 인디안 보호구역에 위치한 웅장한 산이 어우러져 멋진 광경을 연출하곤 합니다. 학교 부지 자체는 꽤 큰것 같으나 학생들이 이용하는 대부분의 건물(국제부, 도서관, 식당 등등..)은 옹기종기 모여있기 때문에 학교 내에서 이동하는데 불편함은 없습니다. 
캄룹스에서는 흑인을 보기는 매우 힙듭니다. 흑인 있다면 십중팔구 국제학생입니다. 대부분의 인구가 백인이며 약간의 인디언이 섞여있습니다. 톰슨리버 대학에는 엄청난 수의 국제학생들이 있습니다. 국제학생의 경우 전세계 각지에서 몰려옵니다. 유럽의 거의 대부분의 국가와 남미, 북중미, 오세아니아, 중국, 일본, 아랍, 아프리카 등등 모든인종과 모든 국가에서 온 학생들이 있습니다. 이중 한국학생들이 차지하는 비중은 극소수 입니다.(제가 한국 학생들과 전혀 어울리지 않았기 때문에 정확한 숫자는 모르겠으나 대략 눈치로 헤아려보면 5~10명인 듯 합니다.) 많은 수의 국제학생이 중국인, 아랍인이며 그 뒤로는 일본, 독일학생들이 많습니다. 대충 보시면 유럽 절반 중국 아랍 절반으로 보시면 됩니다. 한국인이 없다는게 큰 장점입니다.","톰슨리버 대학의 학생들에게는 버스비가 꽁짜입니다. 기숙사에서 5분거리 학교 내에 버스정거장이 위치하고 있기 때문에 버스를 타고 캄룹스 대부분의 지역에 자유롭게 이동이 가능합니다. 보통 시내에 있는 클럽에 가거나 영화를 보러 가거나 여름철엔 River Side Park에 갈때 이용했습니다. River Side Park는 처음 만난 외국인 친구들과 친해질 수 있었던 아주 좋은 기억이 있는 장소이고 강에서 수영도 하고 발리볼 축구 등등도 할 수 있습니다. 학교 주변 도보로 10~15분 거리 내에 월마트와 Super Store(한국의 홈플러스 같은 마트입니다.)가 위치하고 있어 생필품을 조달하는데 차가 없어도 전혀 불편함이 없습니다. 또한 Grey Haund Station과 각종 레스토랑 미용실 및 기타 편의시설도 Super Store 맞은편에 몰려있어서(Mall이라고 부르긴 작지만 옷가게 등등 꽤 많이 모여있습니다.) 종종 걸어서 외식을 하곤 했습니다. 월마트 뒤에는 Bear Foot(정확하지 않습니다) Trail 코스가 있습니다. 여름에 친구들과 두세번정도 갔던 기억이 있습니다. 3시간 이상의 코스입니다. 
학교의 Old Main과 구 도서관을 제외한 모든 건물이 새건물입니다. 기숙사, International Building, 신 도서관, Campus Activity Centre, Gym 등등 모든건물이 새건물!! 입니다. 학교 자체가 새롭게 마구마구 확장을 하고 있는 것 같습니다. 특히 체육관은 정말 좋은데, 수영장은 무료이고 헬스장 역시 30불 정도의 가격에 한달동안 이용할 수 있습니다. 공원이나 hiking에 다녀온 후에는 친구들과 수영장에 있는 사우나에 다니곤 했습니다. 캠퍼스 생활을 하기에는 최적의 환경입니다.
주변 환경은 100점 만점에 100점입니다.","말씀드렸듯이 기숙사가 새건물 입니다. 1,2,5,10층에 공동 주방이 있습니다. 주로 이곳에서 음식을 해먹습니다. 외국인 친구들과 매일 저녁 5층 주방에서 모여 음식을 해먹곤 했습니다. 저희 친구의 그룹을 Internationals라고 뭉뚱그려 불렀는데 매 저녁 5층 주방과 라운지를 전세내다시피 해서 사용했습니다. 식료품은 가까운 거리의 Super Store에서 사오면 됩니다. 처음 기숙사에 입주하면 지난 학기 학생들이 버리고간 후라이팬 등 식기를 무료로 나눠주는데 꼭 챙기시길 바랍니다. 또한 ISEP의 가장 큰 혜택중 하나로 처음 학교에 가면 1500불짜리 수표를 줍니다.(대박이죠..) 한학기 동안의 밥값인데 가난한 학생들 같은 경우는 이것만으로 학기 내내 먹고 사는 것 같습니다. 저의 경우도 궂이 아껴쓰지 않았음에도 1~2달간 ISEP에서 준 돈만으로 외식도 하고 놀러도 다녔습니다. 수표는 앞에 말씀드린 Mall에 가면 은행이 많이 있습니다. 원하시는데 가서 계좌 여시고 입금시키면 체크카드를 발급해서 쓸 수 있습니다. Campus Activity Centre에 위치한 학생식당에서 현금으로 밥을 사먹을 수도 있고 학생식당과 같은층에 위치한 Meal plan 사무소에서 Meal Plan Card를 구입하여 쓸 수도 있습니다. 저는 500불짜리를 구입하여 300불정도 사용하고 나머지는 돌려받았습니다.(한가지 재미있는 것은 500불짜리를 구입하면 50불정도를 추가로 적립시켜 주는데 환불받을때는 이 50불을 제외하지 않고 그대로 남은 잔액을 돌려줍니다. 앉아서 50불을 번 셈입니다.) 
기숙사는 매일 금요일 토요일 저녁이면 전형적인 북미의 대학스타일 파티가 펼쳐집니다. 층마다 위치하고 있는 lounge에서 술을 마시거나 친구들 방으로 이동해서 놉니다. 기숙사에는 2인실과 4인실이 있는데 친구들과 놀때는 주로 4인실에 몰려가서 Beer pong이라는 술게임을 하면서 놀곤 합니다. 술이 떨어지면 15분정도 걸어서 Liquor Store에 가서 사오곤 합니다. 북미 지역에서는 마트에서는 술을 파는게 금지되어 있고 따로 Liquor Store가 있습니다. 기숙사 내에서 Weed(마리화나)를 하는 학생들도 있습니다. 캐나다에서 Weed는 대수롭지 않게 생각하는 것 같습니다. 
기숙사 방 배정의 경우는 매우 세밀하게 조정해줍니다.(정말 좋은 제도인 것 같습니다.) 출발 전에 기숙사 설문지 같은것을 제출하게 되는데 그곳에 자신의 성향, 취미, 기타 등등의 정보를 적고 원하는 룸메이트의 특징도 적어서 내면 최대한 맞는 친구와 Matching을 시켜줍니다. 저의경우 그냥 활발하고 not Korean이면 된다고 했더니 정말 막장인 돼지 남자 캐나다인과 룸메이트가 되어.. 이친구는 수업도 안듣고 방에서 Call of duty인가 이런 게임만 한학기 내내 죽어라하고 방에서 Weed는 기본, 전자렌지와 변기 파손하고 매일 밤마다 친구들을 방에 모아놓고 노는 등등 최악의 룸메이트를 배정받았습니다. 나중에 기숙사 친구들과 이야기 해보니 정말 설문에서 요구한 비슷한 사람들과 매칭을 시켜준 것 같다는 느낌을 받았습니다. 잘 생각하셔서 설문에 응하시면 원하는 사람을 배정 받을 수 있을 것 같습니다. 개인적인 생각으로는 유럽쪽 친구들과 룸메이트를 시켜달라고 하시면 좋을 것 같습니다. 영어권 국가의 학생들보다 영어가 유창하지 않아서 서로 영어 연습하기가 좋고 Thompson Rivers Univ의 경우 유럽학생들이 정말정말 징그럽게 많이 오기때문에 이들과 섞여들기가 유리할 것 같네요.
또한 학기초에는 서로 친해지기 위해서 1층 테라스에 위치한 바베큐 공간에서 친구들과 바베큐 파티를 하기도 하는데요. 부끄럽다 빠지지 마시고 첨부터 적극적으로 이런데도 같이 가고 해야 친해집니다! ^^
기숙사 환경은 100점 만점에 200점 입니다.","수업의 경우에는 그닥 추천할 것이 없습니다. 미국에서 온 친구의 말로는 수업에 과제도 많고 내용도 많아서 힘들다고 하던데 연세대 학생들에게는 너무 쉬워서 이게 뭐하자는 건지 어리둥절할 정도입니다. 학기말에 교수님께서 저를 따로불러 제 답안지에 감동을 받으셨다며.. 반드시 대학원에 가라는 극찬을 들을 정도였습니다. 저의 경우 3~4학년용 환경경제학과 국제경제학을 들었는데 너무 쉬워서 공부할 의욕이 나지 않을 정도였습니다. 제 전공인 경제학과의 경우 학교의 규모가 그리 크지 않아서 수업이 많이 열리지 않기 때문에 돌아와서 학점 인정받을 만한 수업을 찾기가 힘드실 수도 있으리라 생각됩니다. 저의경우는 환경경제학, 국제경제학 딱 2가지 수업만이 전공인정이 가능하여 전공 수업 2개와 영어작문, 영어 말하기 수업을 들었습니다.
영어수업의 경우 외국인 학생을 위한 수업이 있는데 수업마다 난이도가 있습니다. 저의경우 가장 어려운 난이도의 수업을 들었음에도 너무 쉬워서 교수님께서 학생은 이걸 왜듣냐고 하실정도였습니다. 제가 외국 경험이 한번도 없었던 관계로 영어에 자신이 없어 선택하였는데 결과적으로는 그다지 필요하지 않은 수업이었습니다. 본인이 영어 실력에 많이 자신이 없다면 영어 작문수업 정도(level 5로 들으세요)만 들으시고 나머지는 일반 교양과목으로 들으시면 되겠습니다.
도서관은 구 도서관과 신 도서관이 있습니다. 두곳을 모두 합쳐 책 소장량은 개미 눈꼽만큼입니다. 규모는 두개합쳐 연세대학교 구중도의 4/3정도 될 듯 합니다. 열람실 환경은 쾌적한 편이나 이곳 학생들은 도서관에서 자유롭게 토론도 하고 장난도 치고 하기 때문에 다소 산만합니다. 환경에 영향을 많이 받는다면 집중하시기 힘들 수 도 있습니다. 그렇지만 수업이 쉽기 때문에 별로 집중해서 공부할 것도 없습니다.
수업은 100점 만점에 60점. 도서관은 100점 만점에 90점입니다.","국제부는 학기초 빼고는 이용한 적이 없습니다. 국제부에서는 초반 오리엔테이션때 학생들과 어울릴 수 있는 자리를 만들어 줍니다. 이때가 정말정말 중요합니다. 대부분의 학생들이 당연히 친구도 없고 세계 각지에서 따로따로 왔기 때문에 적극적으로 먼저 다가가셔서 International 그룹의 중심이 되시길 바랍니다. 이때 그룹에 섞여들지 못하면 나중에 섞여들기는 매우매우 어렵게 됩니다. 오리엔테이션 3일쯤 지나면 대충 그룹 윤곽이 나오기 시작합니다. 그전에 섞여들어가세요! 오리엔테이션에 가시면 동아대 혹은 이대에서 온 한국 학생들이 있을 겁니다. 정말 유익한 교환학생을 다녀오시고 싶다면 그친구들은 무시하시고 떠듬떠듬 영어로 말하고 있는 유럽친구들에게 데쉬하세요. 오리엔테이션 기간에 친구들과 섞여 드는게 중요합니다. 100번 강조해도 모자라지 않네요^^ 톰슨리버 대학은 ISEP이 매우 활성화 되어있어 대부분의 교환학생이 ISEP입니다. 때문에 ISEP오리엔테이션에 반드시 참석하여 친구를 만드세요. 초반에 같이 hiking도 가고 river side park도 가고 바베큐도 해먹고 하면서 친해지시면 됩니다. 
오리엔테이션때 몰려다니던 한국학생 4~5명 정도는 끝날때까지 그러고 다녔습니다.
International building의 1층에는 ISAP desk(ISEP아닙니다.)가 있습니다. International Student Activity Program인가 그럴겁니다. ISAP에서는 학생들을 대상으로 매주 혹은 격주로 여행 혹은 행사를 기획합니다. 매우매우 저렴한 가격에(혼자하는 여행과 비교불가) 알찬 여행을 할 수 있습니다. 학사일정과도 겹치지 않게 기획하기때문에 반드시 매주 확인하시고 좋은 프로그램이 나오면 친구들 데리고 가서 등록하시면 됩니다. 기억에 남았던 여행은 Winery투어, River floating(톰슨강을 따라 개인땅콩보트 타고 둥둥 내려옵니다. 배에서 샌드위치도 먹고 썬텐도 하고 그랬네요 ^^) 할로윈 파티(이때는 제가 기획에 참가하여 준비했습니다.)등등 정말 괜찮습니다. ISAP은 사실 학교와는 별개로 Kate와 남편(이름을 잊었네요) 두분이 학생들을 상대로 하는 여행사 비슷한 것입니다. 하지만 저 두분 모두 정말 좋은분이고 준 교직원 급입니다. 가격또한 의심하지 마시고! 친구들이랑 따로 가려면 훨씬 더 많이듭니다. 정말 저렴하게 모집하니 놓치지 마시고 참여하세요.(꼭 여행사 홍보같네요 ^^;) 특히나 학기 초에는 친구들과 어울릴 수 있는 좋은 기회입니다.
국제교육부는 이용하지 않아 점수매기기가 힘드네요
ISAP은 100점 만점에 100점입니다.","학기초에 동아리를 모집한다고 하여 가보니 한 10개 정도 동아리가 나와서 모집했던 것 같습니다. hiking 동아리 스쿼시 동아리 등등이 할만한데 저를 비롯한 International 학생들은 우리끼리 노느라 바빠서 아무도 안했던 것 같습니다. 
학교 부대시설로 앞서 말씀드린 새 체육관에는 꼭 가보시길 바랍니다. 저렴한 가격에 헬스클럽에 가입할 수도 있고 수영장 및 사우나는 꽁짜입니다.","제가 워낙에 준비된 열린마음으로 출발해서 그런지 큰 쇼크는 없었습니다. 한가지 꼽자면 캐나다 인들이 너무나 지나치게 친절하다는 정도 입니다. 무엇을 물어보든 친절하게 대답해주고 인종차별도 단한번도 느낀적이 없었습니다. 전공 수업중에 친해진 50대 캐나다인 아저씨는 2번씩이나 집으로 초대하기도 하였습니다. 전공수업중에 수학적인 부분을 이해를 못해서 도서관에서 스터디를 하며 도와주었더니 저와 독일인 이탈리아인 친구를 집에 초대해서 같이 저녁도 먹고 술도 먹고 했습니다. 
친절한 캐나다인 말고는 컬쳐쇼크는 없었습니다.","한국인이 없기때문에 한국말로 도움받을 수 있는 곳은 없습니다. ISEP coordinator인 Lolina가 가장 큰 도움이 될 것 같습니다.
다만 특이했던점이 Eric Kim이라는 한국인이 ISEP 국제부에 계셨는데 하필 제가 갔던 기간동안 다른곳에 잠시 파견을 가셨던가 하여 만나뵙지는 못했습니다. 학기중에 한국말로 통화하면서 스쳐지나갔던 남자분이 있었는데 그분 이었던 듯 합니다. 조만간에 돌아온다고 들었으니 다음학생이 갈때쯤에는 계실지도 모르겠습니다.
문의사항 있으시면 hyunism1020@hanmail.net로 연락주세요^^",
