gen_info,env_info,food_info,study_info,office_info,facil_info,mhct_info,help_info,etc_info
"캠퍼스 : UNIL은 5-6개정도의 건물들로 이루어져고, 건물들 사이의 거리가 생각보다 멀어 전체적인 캠퍼스의 크기는 꽤 큰 편입니다. 건물들은 주로 학과들에 따라 나뉘어져있어 주로 수업을 들으실 1-2개정도의 건물만을 이용하게됩니다. 자연의 나라 스위스 답게 캠퍼스 또한 아름다운 숲과 냇가를 포함하고 있고 가끔은 건물 앞 잔디밭에 양들을 풀어놓기도 합니다.지리적 위치: 로잔은 지하철이 M1.M2 두선밖에 없을 정도로 생각보다 굉장히 작은 도시입니다.모든 곳을 대중교통으로 20-30분 내로 이동이 가능합니다. 캠퍼스의 여러 건물들이 띄엄띄엄 위치하여 있는 만큼 위치는 건물들마다 지하철로 짧은 한두정거장 차이가 있지만, 모든 건물들은 로잔 내 가장 시내라고 할 수 있는 Lausanne-Flon 이라는 역과 지하철로 약 20분정도에 위치하여 있습니다. 기후 : 저는 가을학기(9월-3월)동안 생활했었는데, 날씨는 좋은 날도 많았지만 1,2월에는 비가 자주 왔던 걸로 기억합니다. 9-12월까지는 우리나라의 겨울보다는 확실히 덜 춥지만, 12-2월까지는 비가 오는 날에는 바람이 많이 불어 꽤 추웠던 것 같습니다.","학교 근처에는 로잔공대인 ""EPFL""이 있습니다. 건물들이 지하철로 1,2정거장 차이로 굉장히 가깝고 도서관의 경우 로잔공대의 유명한 도서관,""롤렉스""는 로잔대학 학생들도 함께 쓸 수 있습니다. 로잔의 가장 큰 시내라고 할 수 있는 ""Lausanne Flon""이라는 역에는 각종 음식점과, 마트, 백화점, 옷가게 등이 위치하여 있습니다. 학생들에게 숙소를 제공하는 FMEL에서 운영하는 거의 모든 숙소들이  이 역과 그리 멀지 않은 거리에 위치하여 있습니다. 저도 이곳에서 자주 장을 보거나 필요한 물건들을   샀습니다. 아쉽게도 한인마트는 없지만, 작은 아시안마트가 하나 있습니다. 각종 행정업무도 주로 이곳에 위치한 행정기관을 가게 됩니다.  또한, 이 역에서 가까운 Lausanne-Gare 역은 로잔에서 기차를 탈 수 있는 기차역으로 이곳에도 큰 마트와 영화관 등이 위치하여있습니다. 여행을 자주하다보니 기차를 타러 자주 가게 되는 곳이고, 이곳 또한 대중교통으로 30분내 이동이 가능합니다. 이 외에도 학교에서 버스를 타고 30-40분정도 떨어진 ""모르쥬""라는 곳에는 큰 아시안 마트가 하나 있는데, 굉장히 다양한 한국재료들을 살 수 있습니다. 로잔은 기차로 30분-1시간 내로 갈 수 있는 작은 소도시들이 많은데, 가는 곳마다 소소한 볼거리들이 많으니 수업이 없거나 주말을 이용해 놀러다니기 정말 좋습니다. 스위스 기차 이용권을 사서 스위스 곳곳을 꼭 둘러보세요 !","숙소는 주로 로잔대학교와 협약을 맺고 있는 FMEL이라는 일종의 단체에서 학생들을 위해 비교적 저렴한 가격에 숙소를 제공해 줍니다. Rhodanie,Bourdonette 등 다양한 숙소가 있습니다. 일인실, 쉐어하우스 등 다양한 종류가 있고 따로 집을 구하는 것보다 비교적 월세가 저렴한 편입니다. 저는 Rhodanie 라는 숙소에서 묵었는데, 화장실이 있는 1인실이었고, 한층에 20명정도의 학생들이 공동주방을 같이 쓰는 숙소였습니다. 주방도 생각보다 넓고 방도 혼자쓰기 적당해서 저는 정말 만족스러웠습니다. 거의 모든 숙소가 캠퍼스하고는 그리 멀지 않은 거리에 있는 것 같습니다. Rhodanie 같은 경우 가까운 지하철 역이 없어서 버스를 주로 타야하고,  24번 버스를 타면 15분정도 걸렸습니다. 참고로, 친구가 살았던 Bourdonette은 학교와 엄청 가까워서 지하철로 1-2정거장거리였습니다.하지만.Rhodanie의 경우 호수가 5분 거리에 있어서 로잔의 레만호수를 정말 제대로 즐길 수 있는 것 장점이 있어요. 호수는 정말 바다만큼 크고 뒤에 산맥과 어우러져 정말 아름답습니다. 여름에 가면 수영이며 바베큐며 더 다양하게 즐길 수 있을 것 같아요. 스위스는 역시나 높은 물가 때문에 외식은 사실 거의 못한다고 보시면 돼요. 대략 햄버거 세트가 2만원   정도이니 많이 부담이 됩니다. 그래서 장을 봐서 직접 해먹어야 하는데, 스위스에는 큰 마트 몇개가 있습니다. Coop. Migros, Denner 등이 있는데 써져있는 순서대로 가격이 비쌉니다. 식재료 뿐만 아니라 그곳에서 파는 빵이나 간단한 음식들은 우리나라 마트보다 훨씬 맛있으니 꼭 드셔보세요. 제 숙소 Rhodanie 에서는 걸어서 10분거리에 Denner 마트가 있었고, 제 친구는 Bourdonette 이었는데 걸어서 갈만한 마트는 없었습니다. 그래서 보통 학교가 끝나고 학교 바로 근처에 있는 Migro나 Denner에서 장을 봤습니다. 사실, 스위스는 외식이 비싸기도하지만 그 가격을 주고 딱히 먹을만한 음식도 없는 것 같아요. 처음에야 매일 해먹는게 조금 힘들게 느껴지지만, 익숙해지면 나름 재밌고 더 잘 챙겨먹게 됩니다. 저 같은 경우 장을 보는게 하루 일과 중 가장 중요한 일과였어요.","저는 불어불문학과라서 프랑스어를 배우러 로잔대학교에 갔습니다. 로잔대학교에는 Ecole francais langue etrangere (EFLE), 라는 외국인에게 불어를 가르치는 것을 목적으로 하는 학부가 있는데, 나름 niveau도 나뉘어져 있고 수업도 다양하게 있습니다. 저는 모든 수업을 이 학부에서 들었는데, 아쉽게도 우리학과에서 인정받을 수 있는 수업이 많지는 않은 것 같습니다. 하지만 수업의 질은 좋다고 느꼈습니다. 교수님들도 정말 친절하시고, 수업 준비도 정말 열심히 해오십니다. 조금 더 수업을 잘 활용하시고 싶으시다면,   한국에서 불어를 조금 더 공부하시다 오시면 좋을 것 같습니다. 수업이 다 불어로 진행되기 때문에, 불어를 조금 더 잘하신다면 수업 선택의 폭이 더 넓어질 수 있기 때문입니다. 주의할 점은 처음 개강한 후 2주간은 수강신청 없이 수업을 자유롭게 들어가서 청강해볼 수 있고, 이후  맘에 드는 수업들을 신청하시면 됩니다. 처음부터 수강신청을 하지 않는 점과, 수강신청 기간을 꼼꼼히 확인하세요!도서관의 경우 캠퍼스내 4개정도의 도서관이 있는데, 많이들 이용하는 도서관은 Unitheque 도서관 입니다. 가장 크기도 하고, 혹시 인문학과 관련된 도서를 찾으시면 거의 다 여기 있다고 보시면 됩니다. 무엇보다 좋은 점은 2층의 창문은 통유리로 되어 있는데, 창문을 바라보고 앉는 좌석에서는 호수와 알프스 산맥의 경관을 바라보며 공부하실 수 있습니다. 생각보다 더 아름다우니 꼭 가보세요. 또 하나 유명한 도서관으로는 로잔공대의 도서관인 ""롤렉스""가 있습니다. 저는 가보지 않아서 잘 모르겠지만 로잔에서 유명한 건물 중 하나이니 한번 가보시는 것도 좋을 것 같아요. 참고로 위에서 건물을 내려다 보면 마치 구멍 뚫린 치즈같이 생겼답니다. 학교의 편의시설은 우리학교와 비슷한 것 같습니다. 복도에 중간중간 공용 컴퓨터가 있고, 교환학생들은 무료로 공용프린터를 통해 인쇄도 가능합니다. 건물마다 학식당이 있고, 카페등도 있습니다. 가격이 다소 비싸니 여유가 되신다면 집에서 챙겨오시는걸 권해드립니다.","교환을 신청하시고 나면 가장 먼저 연락을 주고받게 되는 분이 바로 Oliver 선생님 이십니다. 다른 모든 분들이 써주신 것처럼 정말 친절하시고 교환과 관련하여 어려움이 있으시면 무엇이든 도움을 요청해 보세요. 교환을 준비하면서 그리고 처음 도착해서 중요한 행정처리를 할때는 많이 접하지만, 저는 이후 생활하면서는 딱히 교류할 일을 없었던 것 같습니다.","ESN 이라는 교환학생들을 위한 동아리 존재합니다. 다양한 프로그램을 만들어서 다른 교환학생들 뿐만아니라 현지친구들도 만날 수 있는 기회를 마련해줍니다. 또한 스위스 문화를 체험할 수 있는 ""퐁듀파티"",""하이킹""등 재미있는 프로그램도 많이 있으니 꼭 한번은 참여해 보길 바래요. 꼭 추천드리는 것은 ""버디 프로그램""인데요. 교환을 준비하실때 받게 되실 메일 중 하나가 버디 프로그램신청 메일입니다. 현지에 있는 로잔대학 또는 로잔공대 친구를 한명이 짝꿍처럼 스위스에서의 적응을 도와주도록 하는 프로그램입니다. 저는 처음에 적응하랴 행정처리하랴 정신없고 잘 모르겠을 때 현지친구가 많은 도움이 되었어요.","스위는 다양한 국적의 사람들이 사는 곳인 만큼 인종차별이나 문화적 충격은 다른 나라에 비해 없었어요. 특히 로잔의 경우 사람들이 정말 친절하고 정말 여유롭습니다. 저는 공동주방을 쓰다보니 한 주방에 정말 다양한 국적의 친구들을 만났는데, 한국 요리를 할때 다른 친구들이 신기한 눈으로 바라보곤 했습니다. 신기했던 점은 수업에서 출석이 매우 자유롭다는 점입니다. 현지 친구말로는 ""학습의 자유""라고 했던 것 같네요. 한학기동안 한번도 수업이 가지 않아도 시험만 보면 된다고 합니다.","저는 처음 행정업무는 Oliver 선생님과, Buddy 친구에게 많은 도움을 받았고, 이후에는 친해진 현지 친구들과 기숙사 친구들에게도 가끔 도움을 받았습니다.","교환을 갔다오기 전 저에게 스위스는 그다지 친근하지 않은 나라였지만, 로잔대학교에서의 한학기는 스위스, 나라 자체에 애정이 생기게 할만큼 정말 행복했습니다. 로잔의 아름다운 풍경과, 좋은 공기, 좋은 사람들은 되돌아 보니 정말 소중한 경험이었던 것 같습니다. 스위스만 돌아다녀도 정말 만족스러운 유럽 여행을 할 수 있을 만큼 아름다운 곳들이 많지만, 중립국인 만큼 다른 나라로의 이동도 용이해 여행을 교환의 큰 목적으로 두시는 분들에게는 더할 나위없이 좋을 것 같습니다. 다소 아쉬운 점은, 스위스는 EU에 가입되어 있지 않기 때문에 각종 할인에서 제외되는 경우가 많습니다.그리고 아무래도 스위스 사람들이 기본적으로 영어를 할 수 있기 때문에 외국인이 우리가 불어를 더듬으며 말할 경우 바로 영어로 말해주기도 하고, 저 또한 불편한 불어보다는 영어를 자주 쓰게 되어 저처럼 불어를 배우는 것을 큰 목적으로 하신다면 다소 어려운점이 있을 수 있습니다. 저는 정말 행복했고, 또 교환을 간다면 다시 가고 싶을 만큼 좋았습니다. 평화롭고 자유로운 교환학생을 보내시고 싶은 분에게는 로잔대학교를 꼭 추천하고 싶네요."
"크기- 로잔대는 안에 지하철역 3개가 있을 정도로 꽤 큰 캠퍼스를 가지고 있습니다. 걸어서 돌려면 꽤 걸릴거예요. 제가 많이 안다녀봐서 그렇게 느끼는지는 모르겠지만 길도 조금 복잡한 편이구요. 건물과 건물 사이가 되게 넓고, 사이사이의 들판에서 양을 키웁니다. 잔디를 친환경적으로 관리하기 위해 키운대요. 다행히 역이 많은 만큼 지하철에서 건물까지는 꽤 가까워서 수업 들으러 가기는 편합니다. 지리적 위치- 바로 옆에 레만 호수가 있습니다. 오티에서 학과장님이 언급하실 정도로 대표적인 랜드마크예요. 여름엔 수영도 하고 바비큐도 한다는데 저는 겨울이고 기숙사도 좀 거리가 있어서 많이는 안 가봤지만, 정말 넓고 예뻐요. 안개 낀 호수도 예쁘고 요트가 떠있는 것도 볼거리입니다. 다만 여름에는 호숫가에 초파리가 좀 많아요. 제네바에서 기차를 타면 Lausanne-gare 나 Renen역으로 오게 되는데, 약 한시간쯤 걸립니다. 제네바 반대 방향으로는 Vevey,Sion, Montreux 등등 작은 도시들이 많은데, 지역 축제도 많고 나름 소소한 볼거리가 있으니까 방문해보는 것도 추천합니다. 기차값도 스위스 기준 얼마 안해요. 기후- 저는 9월부터 12월까지 4달 꽉채워서 있었는데, 여름에는 맑고 조금 더운 편이고, 겨울에는 날이 흐리고 비도 자주 내리고 정말 안좋은 반면 그렇게 춥지는 않습니다. 영하로 떨어지는 일이 거의 없고 눈도 한두번 올까말까 합니다. 겨울엔 숏패딩 정도로 충분히 따뜻하게 지내실 것 같습니다.개인적으로는 여름에 날씨 좋을 때 수업 빠지고 스위스 여기저기 당일치기하는 것을 추천합니다. 겨울에는 날 좋은 날이 손에 꼽아요.","바로 주변에는 호수, EPFL 정도가 있습니다. 그 외에는 기차타고 나가지 않는 이상 딱히 없습니다. EPFL은 로잔대 형제 느낌인 공대인데, 볼건 딱히 없지만 롤렉스에서 지은 도서관이 특이합니다. 한번쯤 가볼만한 것 같아요. 그 외에는 EPFL역에 내리자마자 슈퍼마켓 migros와 denner, 학생할인을 많이 해주는 통신사, 수제버거집 정도가 있습니다.교통은 상당히 편리하다고 생각합니다, 크게 메트로, 기차, 버스 이렇게 세 가지가 있는데, 큰 도시는 아니다보니 웬만한 곳은 다 가는 것 같아요. 메트로는 t1이라는 앱을 깔면 시간표를 볼 수 있고, 기차는 SBB 어플을 깔면 표 구입은 굉장히 편리합니다. 기차표는 미리 살수록 쌉니다. lausanne gare 기차역에 sbb 오피스에 가면 7시이후 무료탑승 정기권과 반값 정기권을 살 수 있는데, 반값정기권은 기차뿐만 아니라 메트로에도 적용이 되어서 사두면 이득이니 구입하시는걸 추천드리고, 7시 이후 정기권은 얼마나 여행다닐지를 고려해서 사면 좋을 것 같습니다. 메트로 정기권도 있는데, lausanne역에서 나오면 바로 있는 메트로 오피스에서 살 수 있습니다. 구입은 버디 프로그램을 신청하면 버디가 많이 도와주니까 걱정 안해도 될 것 같습니다. 메트로는 표 검사를 거의 안하긴 하는데(저는 검사받은 적이 없고, 주말에는 메트로가 평소것보다 짧은데 그 때 한번 받았다고 해요), 걸리면 100프랑의 벌금이 있던 것 같습니다. 기차는 큼직한 도시만 멈추는 기차가 있고 자잘하게 다 멈추는 기차가 있는데 전자는 꼭 검사를 하고 후자는 저는 한번도 안 검사했습니다. 참고하세요ㅎ 메트로 정기권은 버스도 포함입니다. 정기권을 안 사고 단일 표로 매번 사면 탈때마다 표를 찍어야 하고 내릴때는 그냥 내리면 됩니다. 정기권이 있으면 카드가 지급되는데 그러면 그냥 탔다 내리면 됩니다. 검사할 때만 보여주면 돼요. 참고도 버스는 한번도 표 검사했다는 얘기를 들은 적이 없습니다. 마트는 크게 coop. migros, denner, aldi, lidl 이 정도입니다. 쓴 순서대로 더 싸지구요, coop은 비싸지만 웬만한 재료들이 다 있는 편이고, aldi는 싼데 품질이 좋다고 스위스 친구가 얘기해줬습니다. 학교 근처에는 epfl에 migros와 denner, chamberrone 기숙사에서 걸어서 10분 거리에 aldi, 버스타고 10분 거리에 lidl,  malley 역에 coop, migros, aldi, renen와 lausanne역쪽은 중심지라 백화점까지 다 있고, 호숫가를 따라 migros가 있습니다. 그 외에도 많은데 이 정도가 제가 다녔던 곳입니다.","거주 형태- 한 학기마다 예약이 열리는 날짜가 있어서 선착순으로 마감합니다. 미리 가고싶은 기숙사, 층 등을 고르고 신청하셔야 원하는 곳에 갈 수 있습니다. 신청 날짜에 까먹고 못해도 두번째 기회는 줍니다. 신청 과정에서 계약서를 다운받을 수 있는데 이후 스위스에 와서 입국신고에 필요하니까 저장해두는 것이 좋습니다. 저는 플랫셰어를 했고 기숙사는 chamberone이었습니다. 0층부터 시작하고, 한 집에 4,5명이 한 방 씩 차치하고 지내는 형태였습니다. 제일 싼 곳이었는데, 렌트는 1달에 관리비 포함 510프랑이었습니다. 화장실은 한 플랫에 두개가 있고 2,3명이 쉐어합니다. 같은 기숙사에도 플랫마다 방 구조가 조금씩 다르지만, 제 방은 웬만한 거실만큼이나 꽤 넓직했고 화장실은 최소한의 공간만 있습니다. 기숙사 형태가 여러가지 있는데, 싸지만 굉장히 좁은 1인실도 있고, 좀 비싼 곳이면 1인실 안에 주방까지 다 있는 곳도 있다고 합니다. 기본적으로 제공되는 매트리스, 휴지통, 탁자 전등 정도가 부가적으로 있습니다. 참고로 스위스는 모든게 상상 이상으로 비싸니 웬만한 공산품은 사가거나 배송받는 것을 추천드립니다. chamberone 기숙사는 나름 추천하는데, 학교와도 한 정거장 거리고 버스도 은근 있습니다. renen이나 lausanne까지도 나름 가깝구요.식사- 스위스는 괜히 물가로 악명 높은게 아니라서 사먹는건 학생 입장에서 패스트푸드 정도가 끝입니다. 외식을 하려면 인당 20프랑정도는 생각하셔야 합니다. 그나마도 맥도날드도 버거킹도 kfc도 값은 비싸고 양은 적고 맛은 없습니다. 그나마 epfl 앞에도 있는 수제버거집이 양이 많고 감튀가 맛있고 학생할인세트도 있습니다. 참고로 lausanne의 버거킹에서 파는 밀크아이스크림은 1프랑인데 진하고 맛있습니다. 로잔은 한인마트가 없고 아시안마트가 두어개 있는데 그나마도 음식이 많이 없습니다. 제육볶음 소스나 냉동만두는 있는데 고추장이 없는 곳도 있었어요. 값도 비싸서 김치나 당면 등이 필요하시면 다른 나라 여행갔을 때 사오는 것을 추천합니다. 저는 식사는 크게 빵, 면, 밥 이렇게 했는데 (쓰고보니 당연한 얘기네요) 빵은 어느 마트를 가든 그날 구운 빵을 팝니다. 크로와상이랑 뺑오쇼콜라가 맛있습니다. 면은 파스타 종류가 다양하니까 골라서 사시면 될 것 같습니다. 밥은 쌀 중에서 보라색 포장 쌀을 보면 한국 쌀이랑 비슷합니다. 저는 맛의 차이는 별로 못 느꼈어요. 스위스는 유럽인만큼 유제품이나 과일이 싸니까 한국에서 못 먹는 것들을 많이 사드시면 좋을 것 같습니다. 모카맛 요거트같은 것도 팔아요. 치즈는 조금 조심하셔야 하는게, 워낙 종류가 다양하고 보편적이다보니 여러 종류 치즈를 섞어서 간 것을 싸게 파는 상품들이 많은데 열면 똥 냄새가 납니다. 미리 알아보고 구입하시는 게 좋을 것 같아요. 스위스도 와인이 유명한 만큼 값도 싸고, 300미리까지 와인도 많이 파니까 평소에 관심 없던 분이라도 이것저것 시도해보면 좋을 것 같습니다. 초콜릿도 정말 종류가 많은데, 비싸고 더 맛있는 초콜릿도 있지만 그냥 2프랑짜리 마트 초코쿠키도 맛있습니다.","로잔대에는 banane이라고 불리는 도서관이 있는데, 거의 학술적인 도서만 다뤄서 문학을 읽으려면 lausanne 근처에 있는 도서관을 가야 합니다. 한번 빌리려고 갔었는데 뭔가 시스템이 복잡해서 결국 책을 한번도 빌린 적은 없어요. 도서관을 비롯한 학교의 모든 컴퓨터가 맥과 사파리를 써서 사용하실 때 조금 헷갈릴 수도 있습니다. 수업은 기본적으로 어떤 수업이든 30크레딧을 넘지만 않으면 들을 수 있습니다. 스위스의 교육은 굉장히 프리한 편이라서, 교육법상 출석체크를 하지 않으므로 걱정 없이 약 한달간 자유롭게 여러 수업을 수강해본 이후 수강신청을 하시면 됩니다. 친구 얘기를 들어보니 같은 시간에 편성된 두 수업을 한주씩 번갈아가며 들은 적도 있다고 합니다. 저는 외국인을 위한 학부에서 프랑스어 수업만 수강했는데, UNIL-Chamberone 역에서 내리면 바로 보이는 anthropole 건물에서 전부 수강했습니다. 오티에 가면 레벨별로 수업이 나눠져있는 안내문을 받을 수 있고 그에 따라 선택하면 됩니다. 생각했던 것보다 수업이 그렇게 많지는 않고, 별로 우리 학교 전공으로 인정받을 수 있는 불어 수업은 없는 것 같긴 합니다. 1교시는 8시 45분에 시작하고, 아마 한 교시가 1시간 45분, 쉬는 시간이 30분이었던 것 같습니다. A1 수업은 불어와 영어를 병행하는데, A2부터만 해도 전부 불어로 진행합니다. 문법이나 불어 자체를 학습하는 수업은 A2까지인 것 같고, B1 수업은 거의 토론이나 시사 등 이미 불어를 조금 할 줄 안다는 것을 전제로 하고 조금 높은 레벨로 진행되니 미리 프랑스어 공부를 열심히 해가는 것이 더 많은 것을 얻어올 수 있는 방법인 것 같습니다.  체육 수업은 학생 스포츠카드만 만들면 싼 값에, 또는 공짜로 수강할 수 있는데 스포츠센터가 좀 멀어요. 하지만 폴댄스, 근력트레이님, 컬링 등 접하기 힘든 스포츠를 수강할 수 있다는 점은 좋은 것 같습니다.","연대에서 교환을 가면 Olivier라는 분이 담당해서 도와주시게 되는데, 굉장히 친절하시고 잘 알려주십니다. 스위스 가기 전에 궁금한 사항들을 몇가지 메일로 여쭤봤는데 하나도 대답해주시지 않아서 의문이었는데, 네이버메일은 스팸처리되는지 못받으신다고 합니다. 구글메일로 보내는 게 좋을 것 같아요. 직접 뵈니 친절하게 이것저것 설명해주셨습니다.","동아리는 얼마 없는데, 그나마도 학술 동아리가 대부분이라고 합니다. 교환학생을 대상으로 프로그램을 진행하는 esn이라는 동아리가 있는데, 이런저런 행사를 자주 진행하니 참가해보면 좋을 것 같습니다. 저는 등산을 갔던 기억이 추억으로 남아있습니다. 학생 카드를 등록하면 기본적으로 500장의 프린트를 무료로 할 수 있습니다.anthropole, geopolis 등에 학생식당이 있는데, 가격도 맛도 딱 스위스 학식 정도입니다. geopolis의 학식은 약 10프랑정도에 나름 맛있는 밥을 먹을 수 있습니다. 식당의 아주머니들은 거의 영어를 못하시므로 미리 할말을 준비해서 가는 것이 좋을 것 같습니다.","문화충격이 많지는 않았지만, 플랫셰어에서 남녀가 한 플랫에 같이 배정된다는 것에 조금 놀랐고, 그리고 외국인 친구와 처음 만났을 때 저에게 비주를 하려고 해서 머리로는 알았지만 조금 당황했던 기억이 있습니다.","SASME의 olivier 씨가 굉장히 친절하시고, 연대 국제처의 유럽 담당 분도 많이 도움을 주셨습니다. 의문사항이 있으면 이쪽으로 질문하시면 될 것 같습니다.교환학생으로 가게 되면 버디 프로그램을 신청할 수 있는데, 꼭 신청하는 것을 추천합니다. 공항에서 로잔으로 가는 것부터 입국신고, 교통권 구입, 기숙사 입사 등 처음에 아무것도 모를 때 도움을 정말 많이 받았습니다.","로잔은 조용하고 평화로운 소도시라 이런 여유를 좋아하시는 분은 잘 맞을 것 같습니다. 혼자 계속 다니면 너무 할게 없으니 스위스 친구든 교환학생 친구든 다가가서 친해지면 학기를 재미있게 보내는 데에 도움이 될 것 같습니다. 참고로 저는 교환 신청할 때에 로잔대에서 개인정보를 쓰는 신청서와 함께 교수님의 추천서와 study plan, motivation letter 등을 제출하라는 메일을 받았는데, 1차 신청서만 내고 다른 건 안냈는데 이미 신청이 전부 완료됐다고 해서 당황했습니다. 들어보니 같이 온 연대 친구도 그랬다고 하네요. 정확히 어떻게 된 건지는 모르겠습니다만 혹시 같은 일이 있으시면 참고하시면 좋을 것 같아요.조금이라도 도움이 될까 싶어 이것저것 생각나는대로 써보았습니다. 즐거운 교환생활 되세요!"
