gen_info,env_info,food_info,study_info,office_info,facil_info,mhct_info,help_info,etc_info
"절강대학교 옥천캠퍼스는 시끌벅적한 중심가에서 벗어나 외곽에 위치하고 있다. 절강대학교는 몇개의 캠퍼스로 나뉘어져 있는데, 내가 1학기동안 생활했던 옥천캠퍼스는 다른 캠퍼스보다는 조금 작은 편이었다. 그래서 그런지 강의실과 식당과 기숙사의 이동성이 편리했다. 항저우의 기후 특성상 비가 자주 내리며, 맑은 하늘을 보기가 힘들어서 우산을 항시 준비하고 다녀야 했다. 아무리 한국보다 남쪽이지만, 3월 날씨는 한국과 비슷하다. 거기에 비도 더 자주 내리니, 조금 더 추운 느낌도 들었다. 교환준비를 할 때 더 따뜻하다고 생각해서 두꺼운 외투를 준비하지 않았기에 초반에 어쩔 수 없이 패딩을 하나 더 사입었었다.","학교 주변에는 지하철역이 없어서 쇼핑하러 가거나, 놀러나갈때는 항상 버스를 이용했다. 버스비는 1~3위안으로 매우 쌌다. 가끔 놀러가서 지하철역을 발견하면 창구에서 교통카드를 만들고 돈을 예치해놓으면 편리할 것이다. 80위안을 예치해놓고 한 학기를 넉넉히 사용했던 것 같다. 학교 주변에는 공상은행이 가장 가까웠기에 여기서 카드를 만들면 입금하기에 편리할 것이다. 그리고 은행마다 외국인에게는 통장을 개설해 주지 않는 경우가 있기도 하다. 나는 우체국은행에서 카드를 만들었고 그 곳 직원이 친절하게 웨이신과 쯔부바오와 연동해주어 편리하게 이용했었다. 학교내에는 과일가게, 매점, 패밀리마트 등이 있고, 10분 정도 걸어나가면 한국의 홈플러스 같은 월마트도 있으니 처음 생활용품을 구매할 때 이곳에서 구매했다. 필기구나 노트도 학교매점보다 품목이 다양해서 월마트를 자주 이용했었다. 학교 내뿐만 아니라 중국의 곳곳에는 공용자전거가 매우 많이 비치되어있어서 쯔부바오로 매달 정기권을 구매해서 월마트나 정류장까지 갈 때는 항상 자전거를 이용했다. 자전거를 타고 서호도 갈만 하다. 서호는 항저우에서 꼭 가봐야하는 명소 중 하나인데, 주중 주말 모두 사람이 북적대긴 한다. 그래도 서호를 한 바퀴 돌면서 산책했던 것이 가장 인상깊었던 기억이다. 그 앞에 스타벅스도 있어서 경치를 보면서 공부를 할 수 있었다. 학교 주변에 지하철이 없어서 아쉬웠지만 내가 학교를 다녔을 때 지하철 공사를 시작했으니, 후년 뒤에는 지하철도 생길 것 같다.","내가 살았던 기숙사는 2인실이었는데, 1인실보다 오히려 좋았다고 생각한다. 1인실은 한국인 유학생들이 단체로 예약을 해서 한국인들이 매우 많았던 반면 2인실은 한국인들이 거의 없었기에, 세계각지에서 온 외국인들과 중국어나 영어로 소통할 수 있었다. 1인실을 나중에서야 놀러가봤는데, 1인용 침대가 두개정도 들어가면 꽉 찰 정도로 정말 좁았다. 2인실은 그나마 주방시설과 화장실이 같이 있는 공간과 각각 침대와 책상 옷장이 있는 공간으로 나뉘어져 넓어보이긴 했다. 내 룸메이트는 르완다에서 온 여자아이인데 중국어를 하나도 할 줄 몰라서 영어로 의사소통을 해야했다. 처음엔 중국어를 사용하지 못한다는 생각에 아쉬웠지만, 같이 생활하고 놀면서 영어회화실력이 향상된 것 같아서 좋았다. 식사는 주로 학생식당을 이용하는데, 절강대 학생식당은 저렴하고 맛있었다. 어딜가나 맛이 좋아서 중국식 집밥을 맛있고 저렴하게 체험해볼 수 있었다. 그 외에는 와이마이(배달)를 자주 이용했는데, 중국은 한국보다 배달서비스가 잘 되어있어서 1~2원의 배달비용에 편의점을 포함해서 모든 식당이 배달을 해주었다. 음식 외에도 위생용품이나 생활용품도 배달되어서 늦은 밤에는 배달서비스를 편리하게 이용했었다.","도서관은 기숙사에서 멀리 떨어져 있어서 1~2번정도 이용하고 그 외에 공부할 때는 교내 까페를 이용했다. 어학당 수업은 북문에서 바로 왼쪽의 낡은 건물이었다. 내가 배정된 4반 수업은 듣기가 제외된 독해,회화,문법,쓰기 수업이었는데, 쓰기 수업은 처음엔 과제 내주고 선생님께서 수정해주는 식으로 진행되었는데, 점점 배우는 게 없을 정도로 수업시간을 그냥 떠들다 보내거나 영화감상하면서 보내서 별로였다. 그 외에 문법이나 독해, 회화 수업은 매우 좋았다. 특히 회화수업은 선생님과 반 친구들과 사회이슈에 대해 토론하는 시간을 가졌는데, 선생님께서 주제를 선정해주고 그것을 준비해서 토론하는 식이었다. 중국 친구들을 사귀기가 힘들었는데, 이런식으로라도 중국어로 이야기할 수 있어서 실력향상에 도움이 되었다.","우리 반에는 한국인이 나 포함 4명, 일본인 2명, 유럽, 쿠바, 독일, 예멘 등 외국인들이 많았다. 외국인들과 중국어로 소통할 수 있어서 매우 재미있었고, 수업 끝나고 같이 공부하고 숙제하고 밥 먹는 생활을 하다보니 자연스레 실력이 향상되는 것을 느낄 수 있었다. 특히 화교친구들도 중국어 실력을 기르기 위해 공부하러 왔었는데, 회화는 정말 잘하지만 쓰는 것과 읽는 실력은 나와 비슷했다. 화교친구들은 중국인들이 쓰는 표현을 쓰기 때문에 실제 중국인과 소통하는 것 같았다.","어학당을 다닐 경우에도 다양한 체험을 할 수 있다. 매주 수요일이나 금요일마다 선택수업이 있는데, 들어도되고 안들어도 되는 것이다. 과목은 중국전통공예품 만들기, 쿵푸, 춤, 서예 등 다양한 체험활동이 마련되어있다.","휴대용 배터리가 까페나 식당 곳곳에 설치 되어있어서, 보증금을 내고 언제든지 빌리고 충전하고 반납할 수 있었다. 중국의 교통예절문제는 여전했던 것 같았다. 신호등에 초록불이 켜져도 오토바이나 일부 자동차는 그냥 지나가는 게 대다수이고, 빨간 불이 켜져도 일부 사람들은 그냥 지나가는 게 대다수여서 위험한 광경을 많이 목격했다.","비싼 물건을 잃어버렸을 때는 일단 어학당일 경우 배정된 담임선생님이 있기에 그분 께 연락드리면 되고, 아니면 학교내에 보위관을 찾아가면 사무실에서 친절하게 도와준다.",
"절강대학교는 7개의 캠퍼스로 이루어져 있으며, 본 캠퍼스는 즈진강 캠퍼스로 규모가 상당히 큽니다. 교환프로그램 신청 시 본과 수업 과정과 어학당 수업 과정 중에 한 가지를 선택해야 하는데, 전자를 선택할 시 즈진강 캠퍼스에 배정받게 되고, 후자를 선택할 시 옥천 캠퍼스에 배정받아 수업을 듣게 됩니다. 캠퍼스 간 이동을 할 때 학교 셔틀버스를 이용할 수 있으며, 즈진강 캠퍼스와 옥천 캠퍼스는 버스로 약 20~30분 정도 소요됩니다. 저는 복수전공인 경제학과로 본과 과정을 신청하여 즈진강 캠퍼스에서 모든 수업을 들었기에, 즈진강 캠퍼스를 중심으로 말씀드리겠습니다.   즈진강 캠퍼스에는 이공계 학부/대학원 건물이 각각 있고, 그 이외에는 크게 ??와 西?로 나뉘어 강의실이 있습니다. 제가 거주한 유학생 신기숙사는 남서쪽에 위치하여, 西? 강의실까지는 걸어서 30분 자전거로 10분 정도, ??강의실까지는 걸어서 40분, 자전거로 15분 정도 걸립니다. 모바이크, 헬로바이크 등의 공유 자전거가 학교, 기숙사 곳곳에 있기 때문에 캠퍼스 내 이동 시 공유자전거를 이용하면 매우 편리합니다.즈진강 캠퍼스는 항저우의 북서쪽에 위치하고 있으며, 항저우 공항에서 학교까지는 택시로 50분~1시간 정도 소요되고, 공항버스와 대중교통을 이용할 수도 있습니다. 학교에서 항저우의 대표적인 서호 관광지까지는 대중교통으로 1시간 정도 소요됩니다. 학교 근처 지하철역에서 20~30분 정도면 서호와 서호 주변 시내로 이동할 수 있지만, 기숙사에서 가까운 지하철역(三?，文新)까지 도보로 이동하기는 조금 멀어 택시나 자전거를 이용하길 추천합니다. 항저우 기차역(杭州?站，杭州站）까지는 택시로 30~40분, 대중교통으로는 한 시간 조금 넘게 소요되며, 중국 고속열차(高?）로 상해까지 50분~1시간이면 이동할 수 있다는 장점이 있습니다.항저우의 기후는 매우 습하고, 남쪽에 위치하여 기온은 비교적 높습니다. 제가 갔을 때(9월~1월)는 비가 자주 내려 맑은 하늘을 보기가 쉽지 않았습니다. 겨울에는 기온이 영하로 잘 떨어지지는 않지만, 습도가 높아 '습하고 시린 추위(?冷)'로 인해 두꺼운 옷이 많이 필요합니다. 중국 친구에 말에 의하면 오히려 건조한 북쪽 지방의 추위보다 항저우의 추위가 체감상 더 춥다고도 합니다.","대학 주변은 신촌과는 다르게 술집이나 놀거리가 많지는 않지만, 학교 북쪽에는 24시간 카페들도 있는 카페거리(北街)가 있고, 동문(정문) 옆에는 과일가게, 먹거리(小吃)를 파는 상점, 작은 식당들이 있는 거리(?落街)가 있고, 북문에서 조금 더 나가면 한국식당들이 있는 ??公社，五洲??가 있습니다. 즈진강 캠퍼스 유학생 신기숙사에서 자전거를 타고 10~20분 정도 이동하면 시시 인타이청이라는 큰 복합쇼핑몰이 있고, 조금 더 나가면 월마트나 청시 인타이도 있어 물건 구입이나 유명한 중국 프랜차이즈 식당에 밥 먹으러 가기 편리합니다. 대중교통으로 한 시간 정도 걸리지만, 서호가 지리적으로 가까운 편입니다. 서호가 넓기 때문에 여러 번 가보는 것도 좋으며, 서호의 야경 또한 굉장히 매력적입니다. 학교 근처에 AAAAA급 생태관광지로, 중국 유일의 국가습지공원인 “시시 국가습지공원”이 있습니다. 시시 습지공원은 별 기대 없이 갔다가, 한적하면서도 아름다운 시시습지의 매력에 푹 빠져 중국에서 갔던 곳 중 가장 기억에 남는 곳 중 하나가 되었습니다. 유학생 신기숙사에서 시시습지공원 북문이 가까우므로, 교환학생 기간 동안 한번쯤은 꼭 가길 추천합니다. 공원이 매우 넓기에 하루 동안 다 돌아다니기 어렵고, 공원 안에서 나룻배를 타고 곳곳을 둘러보는 것도 매우 좋습니다.","저는 18년도 2학기에 막 증축된 즈진강 캠퍼스 유학생 신기숙사(西?宿舍)에 살았습니다. 1인실과 2인실로 두 종류의 방이 있는데, 2인실이 만실이어서 1인실을 선택해 살았습니다. 그러나 기숙사 배정에 있어서 애로사항이 많았습니다. 사전에 기숙사가 배정된 것으로 공지 받았지만, 기숙사에 도착하니 기숙사 배정이 안 되어있는 상태였고, 1인실 밖에 남아있지 않은 상황에서 어쩔 수 없이 1인실을 현장에서 배정받게 되었습니다. 입사 전에 파견교 담당자와 기숙사 배정에 대한 부분을 명확히 문의하여 확인하면 좋을 것 같습니다. 결제방식에 있어서도, 당시 현장결제를 해야 하는 상황에서 결제 시스템이 원활하지 않아 주변 은행에 급하게 가 현금으로 기숙사비(한화 약 120만원)를 준비하는 등 힘든 경험을 했습니다. 새로 지어진 기숙사라 시설은 깔끔했지만, 제 방의 경우 습기가 특히 많이 차 벽면에서 페인트가 많이 떨어져 불편했습니다. 또한 바퀴벌레도 초반에는 자주 등장하여 근처 마트에서 바퀴벌레 약을 사고, 한국 친구에게 한국에서 사온 약을 빌리기도 했습니다. 기숙사 거주 시, 한국에서 강력한 바퀴벌레 약과 물먹는 하마 등 제습제를 준비해오면 좋을 것 같습니다. 식사는 기숙사 바로 옆에 있는 유학생 식당에서 자주 하곤 했습니다. 기숙사와 함께 새로 지어진 식당이라 시설이 깔끔하며, 1층은 푸드코트 형식으로 양식, 일식, 중식 등 비교적 다양한 종류의 음식이 있고, 2층은 반찬을 골라담아 먹는 일반적인 중국 학식당의 형태이고, 3층은 외부인도 많이 오는 일반음식점 형태입니다. 이 외에도, 대식당, 서쪽 강의실 근처에 있는 식당, 의학원 식당이 있으며, 학식 가격은 보통 5위안~20위안으로 저렴합니다. 뿐만 아니라 중국은 “美?”，“?了?” 등 어플리케이션을 이용하는 “와이마이(外?)”의 배달음식 문화가 잘 발달되어 있습니다. 2000원이어도 배달이 될 만큼 저렴한 가격으로도 음식을 시켜 먹을 수 있기에 혼자 식사를 해결하기 아주 편리합니다.","수업 수강에서 가장 중요한 것은 全外文 (영어)혹은 ?? (영어, 중국어 혼용) 수업인지를 먼저 확인해보는 것입니다. 중국어로 수업을 다 듣는 것이 굉장히 벅차기에 저의 경우 이러한 수업들을 최대한 찾아 들으려고 노력했습니다. ?? 수업은 보통 강의 자료와 교재는 영문, 강의 진행은 중문인 수업이고, 영어 수업은 말 그대로 교재부터 강의까지 전부 영어로 진행되는 수업도 있는 반면 몇몇 수업은 ?? 수업처럼 강의는 중국어로 진행되기도 합니다. 이러한 강의들의 이점은 비록 강의가 중문으로 진행되어도 과제나 시험이 영어로 제시되어 영어를 사용할 수 있다는 것입니다. 중국어로 전부 진행되는 수업은 생각보다 언어적 어려움이 컸습니다. 교양 수업의 경우 첫 수업부터 강의 내용의 70퍼센트 이상을 알아들을 수 있어 안도했지만, 전공 수업(경제학)의 경우 10퍼센트도 알아듣지 못하는 것이 대부분이었습니다. 몇몇 교수님은 보통화를 쓰시지 않고, 방언이 심하셔 더더욱 알아듣기 힘든 경우도 있었습니다. 매 수업을 한 차례 한 차례 거치면서 이해도가 조금씩 증가하긴 했지만 중국어 수업을 온전히 다 따라가기에는 많이 벅찼습니다. 만약 영문 교재가 있다면 예습을 조금씩 하고 해당 용어들을 중국어로 미리 알아간다면 수업을 따라가기에 조금 더 수월할 것으로 생각합니다. 특히 전공 수업의 경우 한국에서 미리 챙겨간 한국어 자료나 교재들을 참고하여 이해가 가지 않는 부분들을 보완하는 것이 좋을 것 같습니다. 제가 수강했던 수업의 경우 팀 프로젝트와 중간고사 시험이 없기 때문에, 과제와 기말고사 한번의 시험으로 성적이 대부분 결정됐습니다. 문제풀이 과제의 경우, 답안의 정확성 여부보다는 과제 제출 여부를 더 중요시하기에, 많이 어렵더라도 교재와 배운 내용을 참고하여 최대한 과제를 수행하고 제출하기만 한다면 과제 점수는 대부분 잘 받을 수 있습니다. 또한 수업들마다 대부분 Wechat 이나 QQ 단톡방이 있기 때문에 모르는 것이나 궁금한 것들을 단톡방을 활용해 물어봐도 좋습니다.도서관은 제가 거의 가본적이 없지만, 학생 수에 비하면 그렇게 규모가 크지는 않습니다. 시험기간에는 도서관 개관 30분전부터 엄청 긴 대기 행렬을 이룬다고 합니다.","??에 있는 유학생 사무실은 학생증, 학교 등록 서류 제출, 비자 문제 등을 제외하고는 거의 방문한 적이 없습니다. 비자는 한 학기의 경우 X2 단수비자로 발급받지만, 교환학생 기간 동안 해외여행 등 입출국을 해야 할 시, 유학생 사무실에서 단수비자에서 거류증으로 전환할 수 있는 서류를 발급받고 공안국에 가야 하므로, 이 점은 유학생 사무실의 도움이 꼭 필요합니다. 학교생활과 관련된 직접적 정보는 절강대 한국인 유학생회를 통해 주로 얻었습니다. 절강대 한국인 신입생 위챗 단톡방에 들어가 있지 않았더라면, 학교생활을 어떻게 했을까 할 정도로 중요하고 유용한 정보들은 모두 그 곳을 통해 얻었으니 잘 활용하면 좋을 것 같습니다.","교환학생 기간 동안 동아리 활동을 꼭 해보고 싶어, 동아리 박람회(백단대전)을 통해 여러 동아리들을 알아보았습니다. 가장 열심히 참여했던 동아리 활동 중 하나는 FLA (Foreign Language Association)라는 외국어 공부 동아리 활동입니다. 동아리 정식 부원으로 지원했다 떨어졌지만, 정식 부원이 아니어도 FLA 동아리 활동인 English Corner와 Mandarin Corner에 자유롭게 참가할 수 있습니다. English Corner은 매주 두 번, 약 한시간 반 정도 중국인 친구들과 소그룹을 이루어 세 가지의 정해진 주제 하에 영어로 자유롭게 대화를 하는 시간을 가지는 활동입니다. 중국인과 영어로 대화하는 게 조금 이상하고 어색한 느낌이 들 수 있지만, 영어 말하기 연습도 하면서 중국인 친구들을 사귈 수 있는 좋은 활동입니다. 그러나 무엇보다 가장 추천하고 싶은 프로그램은 Mandarin Corner입니다. 매주 금요일, 두 시간 동안 중국인 친구들과 거의 1대 1로 대화를 하는 시간을 가집니다. FLA 동아리 정식 부원들과 중국인 학생 자원봉사자들이 Mandarin Corner에 오는 외국인들을 대상으로 중국어를 가르쳐주는 프로그램으로 볼 수 있습니다. 두 시간 동안 거의 과외와 같이 중국인 친구들과 중국어로 대화하는 시간을 가질 수 있기에 한 학기 동안 열정을 가지고 최대한 많이 참여하려 노력했던 유의미한 활동이었습니다. 또 하나로, “无我茶社”라는 차 동아리도 정식 부원은 아니지만 회비를 내고 참여하는 일반회원으로 참가하여 활동할 수 있었습니다. 활동 공지가 매달 1~2회 정도 올라오고 참여 신청을 해 선발이 되면, 차 예술(茶?) 체험, 차 및 차와 곁들이기 좋은 중국 음식 만들기 체험 등 다양한 활동에 있습니다.마지막으로, 동아리 활동은 아니지만 절강대 ISU(국제 학생 연합)에서 주관하는 “Language Buddy Program”에도 참여하였는데, 운이 좋게도 잘 맞는 중국인 친구를 사귀어 학기 내내 언어교환을 의미 있게 할 수 있었습니다. 이 활동 역시 FLA도 같이 협동 주관하는 프로그램이므로, 절강대학교에 오게 된다면 FLA, ISU에서 주최하는 활동들을 눈 여겨 보면 좋을 것 같습니다.","항저우는 알리바바 본사가 위치한 도시다보니, 알리페이가 특히 더 많은 곳에서 사용되고 있는 것 같습니다. 오히려 현금을 가지고 다니면 더 불편할 정도로, 모든 곳에서 알리페이가 다 쓰입니다. 알리페이나 위챗페이를 사용하기 위해서는 꼭 중국 현지에서 발급한 카드가 필요하므로, 꼭 중국 현지은행 방문이 필요합니다. 그러나 단기 유학생 비자(X2)로 왔기 때문에 카드 발급에 제약이 많아 10군데 이상의 은행을 돌아다니며 힘들게 발급받았던 것으로 기억합니다.절강대 학생들은 한국 대학생 느낌 보다는 고등학생에 더 가까운 느낌입니다. 화장을 하는 친구들을 거의 본 적이 없으며, 학교 주변에 놀거리도 거의 없기에 학년 불문하고 학교 내에서 다들 공부에 전념하는 분위기입니다(시험기간에 앰뷸런스를 두 번 보았습니다). 중국인 친구들에게 “내가 생각했던 것보다 학업량이 많고 학업에 대한 의지가 굉장히 높은 것 같다”라고 이야기하면, “먼저 중국 3위권 대학이라 그렇고, 평균 25학점 정도를 듣기에 공부/과제량이 절대적으로 많으며, 대학원 학위 취득이 취업에 갈수록 중요해져 학점에 대한 압박이 심하다”라는 대답을 주로 해주었습니다. 이 때문인지, 동아리 활동이나 단체모임에서도 활동 이후의 술자리나 사교 활동이 거의 없는 문화입니다.","먼저 절강대 한국인 유학생회(주로 위챗 신입생 톡방)에서 교환학생 기간 동안 가장 많은 도움을 얻을 수 있었습니다. 교내 유학생 사무실에서도 한국인 선생님 한 분, 교환학생 담당 선생님이 계시니 필요 시 도움을 얻을 수 있습니다.",궁금한 점이 있으시면 hyjs9700@naver.com으로 연락 편하게 주셔도 됩니다^^
