gen_info,env_info,food_info,study_info,office_info,facil_info,mhct_info,help_info,etc_info
"훔볼트 대학교는 독일의 수도인 베를린 중심에 위치하고 있습니다. 베를린에는 훔볼트 대학교 말고도 베를린 자유 대학교, TU 등 다른 학교들도 자리하고 있는데요, 서남쪽에 자리한 자유대와 달리 훔볼트 대학교는 중심에 위치하여 학교 수업이 끝난 뒤 친구들과 쇼핑을 하거나 주위 구경을 하기에 좋았습니다. 우리나라 대학의 캠퍼스와 달리 독일의 대학은 도시 곳곳에 대학이 위치해있는데요, 제가 수업을 주로 들었던 건물은 독문과 건물과 문화학 건물은 중앙역에서 가까운 Friedrich Strasse역에 위치하고 있었습니다. 저는 가을학기에 교환학생을 간 지라 기후가 그렇게 좋은 편은 아니었습니다. 특히나 기숙사가 동쪽에 위치한 지라 동독 특유의 약간 암울한 분위기와 쌀쌀한 날씨가 겹쳐 어떻게 보면 음울한(?) 분위기였던 것도 같습니다. 유럽에는 봄학기에 가는 게 좋다는 말을 몸소 체험했던 한 학기였습니다. 그렇다고해서 안좋은 날씨만 있던 것은 아닙니다. 전체적으로는 한국의 겨울보다 따듯하고 가을이나 여름의 끝자락에도 선선한 날씨를 즐길 수 있었습니다.","훔볼트 대학은 워낙 중심지에 위치한지라 대학 주변에 웬만한 것들은 다 있었습니다. 큰 쇼핑센터도 학교 근처에 자리하고 있었고 중앙역도 s반으로 한 정거장거리였구요, 다양한 먹거리나 볼거리들, 베를린의 명소는 거의 걸어갈 만한 거리에 있었습니다. 그래서 다른 도시나 한국에서 친구들이 놀러왔을 때도 거의 항상 대학교에서 출발하여 주변의 Brandenburger Tor와 Alexander Platz, Berliner Dorm 등을 관광했었습니다. 그리고 기숙사 근처에는 마트들이 다들 작았는데 학교 옆에 있는 식료품 마트는 크기도 크고 종류도 많아 수업이 끝난 후 장을 봐서 들어가기에도 좋았습니다.","거주 형태는 학교를 통해 기숙사를 구할 수도 있고, 한국인 집에 홈스테이를 하거나 WG(Wohngemeinschaft)에 살 수도 있습니다. 저같은 경우는 학교를 통해 기숙사 방을 미리 한국에서 구하고 갔는데 이렇게하면 접근성은 조금 떨어지는 곳에 방을 얻을 수도 있지만 가격이 저렴하여 좋았습니다. 1인 아파트에 살려면 한달에 400유로 정도가 들지만 Studentenwerk Berlin을 통해 구하면 200유로 전후로 살 수 있었습니다. 연세대를 통해 훔볼트를 갈 경우 기숙사는 거의 Allee der Kosmonauten에 구해지는 것 같은데요, 학교까지는 걷고 지하철과 트램 타는것 모두 합해서 40분-1시간정도 걸립니다. 방은 2명이나 3명이서 한 wohnung을 쓰게됩니다. 저는 2명이서 썼었는데 방은 각자 쓰고 화장실과 주방은 나눠쓰는 형태입니다. 식사는 각자 주방에서 해먹구요, 매일 밖에서 식사를 사먹으면 식비가 많이들지만 집에서 해먹을 경우 한국과 비슷하거나 조금 더 저렴합니다. 아 방세랑 방 크기는 전부 다른데요 저는 큰방을 썼었지만 (엘레베이터 없는) 5. Stock에 살았었기 때문에 방세가 다른 친구들에 비해 조금 쌌었습니다.","수업은 보통 교환학생용 모듈을 듣게됩니다. 독일은 우리나라와 달리 module시스템이 존재하는데요, 3가지 정도의 수업을 하나의 모듈로 묶어서 학점을 받는 시스템입니다. 시험을 몇번보고 과제를 얼만큼 하느냐에 따라 받을 수 있는 학점이 다르니 이것을 수업듣기 전 미리미리 체크해 보시는게 좋을 것 같아요. 저는 독어학 모듈 한 개와 독일어학 코스 2개 그리고 교환학생용 수업인 berlin perspective 수업을 들었었습니다. 훔볼트 대학의 교환학생 수업이 berlin perspective인데요 주로 베를린의 역사나 문화에 대한 수업으로 영어 (또는 독일어)로 진행됩니다. 독일어로 진행되는 수업은 누구나 들어가면 말 그대로 ''멘붕''을 겪게되고 내가 과연 여기서 학점이나 받을 수 있을까...란 생각이 들지만 본인만 그런것이 아니라 모든 학생이 그러니 염려말고 조금만 공부하면 금방 따라잡을 수 있을거에요. 저도 처음 수업을 듣고는 정말 아무것도 하기 싫었는데요 하다보면 그래도 들리고 말도하게되고 적응이 되더라고요.. 학교 도서관은 연세대학교처럼 중앙도서관 (Grimm Zentrum)이 있구요 단과대별로 도서관이 한개씩 있습니다. 저는 문과대 도서관은 가끔가고 중앙도서관을 자주갔었는데요 중앙도서관1층에는 카페테리아가 있어서 책보면서 커피도 마시고 밥도먹고 좋았습니다. 우리학교 학식이랑 다르게 훔볼트학식은 11시부터 2시정도까지만 먹을 수 있어서 학생이 엄청나게 몰려듭니다. 그와 다르게 도서관 카페테리아는 하루종일 열어서 조금 넉넉하게 밥도 먹을 수 있구요.",독일에 가게 되면 점원들이나 공무원들의 쌀쌀맞은 태도에 좀 상처를 받을 수도 있을거에요. 하지만 국제처에 계신 분들은 모두 친절하고 독일어로 의사소통이 잘 안될 때 영어로도 말할 수 있기 때문에 큰 도움이 될 것이라 생각합니다. 모르는 거나 궁금한 게 있을 때 학교 중앙 건물에 있는 international office에 가거나 단과대 국제처에 가면 친절하게 도움을 받을 수 있습니다. 나중에 성적표를 받을 때나 사무처리를 해야할 때도 모두 이 곳에 가서 하면 됩니다.,저는 동아리는 하지 않았었지만 kustos라고 외국인 학생들을 위한 프로그램도 있고 종종 stamm tisch를 열어서 서로 만날 수 있는 기회도 많이 있습니다. 외국인 친구를 많이 사귀고 싶다면 멘토링 프로그램이나 위에 말한 프로그램들에 꾸준히 참여하면 될 것 같아요. 하지만 상대도 외국인이고 나도 외국인이라 독일어로 의사소통이 쉽지않다는.. 단점이 있습니다. 하지만 하다보면 독일어 실력도 늘고 외국에 대한 이해도 늘게되어 좋다고 생각합니다. 아 그리고 운동코스를 신청하고 싶다면 미리미리 알아놓는게 좋을 것 같습니다. 운동수업같은 경우에는 교환학생이 아닌 훔볼트 대학생들도 관심이 많기 때문에 학기 시작 전에 모두 차버리는 경우가 많기 때문에...,문화적 충격이랄것까지는 없지만 한국 학생들이 독일에 가서 가장 힘들어하는 것 중에 한 가지는 Sprechstunde가 정해져있고 Termin을 잡아야하는 문화같습니다. 독일은 우리나라처럼 아무때나 사무실(또는 병원도)을 방문할 수 있는 것이 아니라 약속을 잡고 맞는 시간대에 가야 일처리를 할 수 있습니다. 학교라고 해서 예외는 아니기 때문에 약속을 잡지 않고 갈 시에 허탕을 칠 가능성이 매우 높습니다. 하지만 적응되면 이것도 충분히 별 문제가 되지 않을 것이라고 생각해요.,위에 말씀드린 대로 학교관련 문제나 무엇이든 국제처를 통하면 쉽게 해결될 것이라 생각해요. 아니면 학교에서 지정해준 멘토에게 실생활 관련된 문제를 물을 수도 있을 것 같습니다. 멘토는 학기 시작 전 신청을 통해 받습니다.,또 다른 궁금한 게 있으시면 chareety@yonsei.ac.kr로 물어봐주세요!
"훔볼트 대학은 베를린의 중심이라고 할 수 있는 Friedrich str.에 위치해 있습니다. 캠퍼스가 따로 조성되어 있는 것이 아니기 때문에 건물들이 흩어져 있습니다. 대부분의 건물들은 Friedrich str.주변에 위치해있고 상경대와 신학대가 한 정거장 떨어진 Hackescher Markt에 있으며 이외에 몇몇 단과대들이 다른 곳에 자리 잡고 있습니다. 저는 상경대에서 수업을 주로 들었기 때문에 Hackescher Markt에 왔다가 중앙도서관이 있는 Friedrich str.로 이동했는데, 한정거장 정도 거리이기 때문에  걸어서 15분남짓이라 그다지 멀다고 느끼지는 않았습니다. 여러 단과대의 수업을 듣더라도 이정도 이상의 이동은 없을 것입니다. 
제가 베를린에 3월말에 도착했는데도 너무나도 추웠습니다. 눈도 매주 왔고 한국의 한 겨울처럼 추웠던 것 같습니다. 무엇보다도 해가 뜨지 않고 바람이 차가워서 고생을 많이 한 것 같습니다. 1월과 2월을 모두 합쳐 일조시간이 43시간이라고 뉴스에 나오는 것을 보았습니다. 1월과 2월에 이상한파가 지속된 여파라고 하였지만, 겨울날씨가 4월 초 중순까지는 이어진 것 같습니다. 길고 매서운 겨울이 힘들었지만, 여름은 한국과 비교해 쾌적한 날씨였습니다. 햇살은 한국보다 더 뜨거운 느낌이기는 했지만, 해가 지면 선선해져서 반팔만 입고는 오히려 쌀쌀해질 때도 많았습니다. 비도 많이 오지 않았고, 습도도 높지 않아서 그늘에 있으면 어느 정도 더위를 식힐 수 있었습니다. 겨울에 베를린에 지내신다면 정말 단단히 준비해서 가셔야 할 것 같고, 여름학기에 간다고 하셔도 어느 정도 긴팔 옷도 챙기셔야 할 것 같습니다.","베를린 전역에서 관광객들을 찾아 볼 수 있지만, 훔볼트대학 건물 대부분이 위치한 Frierich str.주변은 특히 관광객이 많은데, 그만큼 볼거리가 많습니다. 먼저 훔볼트대학 본관 건물부터 늘 사람들이 북적이는 곳이며, 바로 앞 Unter den Linden이라는 큰 길 건너에는 국립극장이있습니다. Unter den Linden은 박물관이 모여있는 박물관섬부터 브란덴부르크 문까지 이어지는 중심도로입니다. 박물관 섬에 가면 다양한 박물관들이 모여 있어 한번에 둘러보기 좋습니다. 이러한 박물관을 모두 포함해 공립박물관을 모두 입장할 수 있는 연간회원권 학생요금이 20유로 남짓이었어서 저는 이 티켓을 사서 공강시간에 종종 들르곤 했습니다. 박물관섬에는 또한 베를린 성당이 있는데 전쟁의 상처가 남아있어 검게 그을렸지만, 바로 앞의 Spree강과 함께 어우러져 나름의 분위기를 뽐내고 있습니다. Spree강을 따라서 산책을 하기도 하고, 날씨가 따뜻해지면 강가 잔디밭에서 휴식을 취했습니다. 강에 관광용 유람선도 많이 다니고, 강을 따라 카페나 식당도 많아서 날씨만 좋으면 무작정 밖으로 나와 경치를 즐겼던 것 같습니다. Friedrich str.를 따라 남쪽으로 내려가면 프랑스거리가 나오는데 이곳을 따라 백화점과 고급 쇼핑가가 형성되어 볼거리가 많습니다.
또한 상경대가 있는 Hackescher Markt는 Friedrich str.에서 한정거장 거리에 위치해있는데, 본관 주변에 비해서 가까운거리에 괜찮은 레스토랑, 카페, 바 등이 많았습니다. 그렇지만 상경대 내에는 매점정도 수준의 Mensa만 위치해 있어서 저렴하게 끼니를 해결하기가 쉽지는 않았습니다. 물론 Tram을 타고 10분 정도만 가면 Mensa 중에 가장 시설면에서 크고 메뉴도 잘 나오는 Nord Mensa에 갈 수 있습니다. 또 이곳 북쪽에서부터 Alexander Platz북쪽 부근에 옷가게들이 밀집해있었는데, 유럽에서만 찾아볼 수 있는 특이한 것들도 많아서 구경만으로도 재미있었습니다. 학교에서는 베를린 서쪽의 중심인 Zoologischer Garten이나 Potsdamer Platz에 가기에도 편해서 수업이 끝나고 마음만 먹으면 어디든 갈 수 있어서 좋았던 것 같았습니다. 
베를린에는 문화생활을 즐길 수 있는 곳이 많고, 특히 학생들에게 주는 혜택이 생각보다 커서 마음만 먹으면 언제든 멋진 공연을 볼 수 있습니다. 유명한 베를린 필하모니 공연장을 비롯해 이외에도 Deutsche Oper, Staatsoper, Komische Oper 등 극장이 많습니다. 이러한 극장들이 모두 학교에서 멀지 않은 곳에 있어 수업이 끝나고 공연을 보러갈 수 있습니다. 클래식한 오페라나 발레도 공연하지만, 클래식 작품을 현대에 재해석한 공연을 많이 선보여서 인상깊었습니다. 학생들을 위한 티켓도 판매하며, 일년에 15유로정도 내면 Classic card(학생들을 위한 클래식공연 종합우대권)를 살수 있는데 자리가 여유가 있을 때 10유로 남짓으로 제일 좋은 자리에 앉아서 볼 수도 있습니다. 또한 시내에서 40분 정도 나가면 교외지역으로 나갈 수 있는데, 큰 호수에서 우리나라 해수욕장처럼 피서를 즐길 수도 있고 숲에서 자전거를 타거나 바비큐를 해먹을 수도 있어서 좋았습니다.","저는 Studentwerk에서 운영하는 기숙사에서 살았습니다. Studentwerk는 베를린 내에 있는 대학 학생들을 위해 거주지를 제공하고 식당, 매점 등을 운영합니다. Studentwerk가 운영하는 기숙사는 베를린 시내에 고루 퍼져있는데, 상대적으로 학생이 다니는 학교에 가까운 곳으로 배정해 주는 듯 합니다. 저는 베를린의 동쪽 거주중심의 지역인 Lichtenberg에 있는 Tierpark(U5)역에서 10분정도 떨어진 Sewanstrasse라는 곳에 위치한 기숙사에 살았습니다. 3명이서 주방과 화장실을 함께 사용하고, 각자 방을 사용합니다. 한달 방세가 225유로였는데 한 달 방세*1.5도 보증금으로 내고 나갈 때 받습니다. 저처럼 기숙사에 살면 방값을 절약할 수 있고, 학교 친구들이 같은 기숙사에 사는 경우가 있어서 같이 어울려 지낼 수 있다는 장점이 있습니다. 또 방을 개인적으로 찾는 다면 보통 WG(독일에서 통용되는 거주 개념으로 ‘거주 공동체’쯤으로 말을 옮길 수 있는데, 아파트 등을 여러 사람이 함께 사는 것입니다. 일반적으로 방을 하나씩 사용하고 주방,화장실을 공용으로 사용하게 됩니다.)를 찾아야 하는데, 이 경우 방을 찾는 일에 시간도 많이 필요하고 거주가능 기간이 잘 맞지 않아서 학기 중에 옮겨 다녀야 하는 경우도 생깁니다. 그러나 기숙사 같은 경우에는 이런 걱정 없이 안정적으로 교환학생 기간 동안 거주 할 수 있다는 장점이 있습니다. 하지만 방에는 침대와 매트리스, 책상, 책꽂이, 옷장만 있고, 주방에도 공용 냉장고, 인덕션, 오븐 등을 제외하고 제 몫으로 할당 된 개인물품은 없습니다. 따라서 옷걸이, 침구류, 휴지통 등을 모두 구매해야합니다. 또한 기숙사가 시내 가까운 곳에 위치해 있지는 않기 때문에(방이 많지는 않지만 비교적 더 가까운 곳에 기숙사들도 있지만 자리가 잘 나지 않습니다.) 통학시간을 적어도 30-40분 정도로 잡아야 합니다. WG 같은 경우 조금 더 비쌀 수 있지만 가격대에 맞추어 원하는 곳에 살 수 있고, 이미 살던 사람이 쓰던 비품들이 충분하게 있어 추가로 살림살이를 구매하지 않아도 되는 장점이 있습니다. 독일은 외식물가가 비쌉니다. 따라서 집 주변에 있는 Kaiser''s나 Netto 등 슈퍼마켓에서 장을 봐와서 요리를 해먹었습니다. 의외로 원재료 물가는 한국보다 비싸지 않으며, 대부분 한국보다 저렴하다고 느껴졌습니다. 제가 있던 베를린은 해산물을 찾아보기 힘들어서 Real과 같은 큰 마트나 백화점 식품매장에 가야 구할 수 있었습니다. 물론 훈제 생선이나 냉동생선은 마트마다 있습니다. 학교식당도 앞서 말씀드린 Studentwerk에서 운영하는데 음료,샐러드,주식,후식,요거트,과일 등이 있고 그중에서 원하는 것을 골라서 품목별로 값을 지불하는 방식으로 운영됩니다. 음료하나와 주식하나를 먹으면 5유로 내외로 나왔습니다.","수업은 크게 강의(Vorlesung)과 세미나(Seminar) 두 가지로 나뉩니다. 강의와 세미나가 결합되어 강의시간 이후 세미나에서 토론 및 질의를 하는 경우도 있고, 필요한 경우에는 해당 수업에 연습(Uebung)이나 튜토리얼(Tutorium)강의가 함께 열려서 보충하기도 합니다. 연습이나 튜토리얼은 필수적으로 참여할 필요가 없는 경우가 있지만, 대부분 본 수업과 함께 들어야 합니다. 연습이나 튜토리얼 수업도 참여가 필수인 경우에는 수업시간만큼 학점을 제공하기 때문에 추가적인 참여가 부담스럽지는 않았습니다. 
위에서 말한 것은 일반적으로 구분되는 수업방식입니다. 그런데 훔볼트대학은 단과대별로 상당히 독립적으로 업무를 수행하기 때문에 수업의 형태나 평가방식도 달라질 수 있고, 성적표도 따로 발급합니다.  저는 주로 상경대학에서 수업을 들었기 때문에 이 이후에 말씀드리는 수업상의 특징은 다른 단과대에 해당되지 않을 수 있음을 유의하여 주시면 좋겠습니다.
저는 주로 강의에 연습이 딸린 수업을 들었습니다. 이 경우에 ECTS학점이 6이 되어서 본교수업의 학점과 잘 맞았기 때문입니다. 수강신청은 일부 세미나 강의를 제외하면 없습니다. 강의(Vorlesung)는 본교의 일반적인 수업과 일치한다고 보시면 됩니다. 피피티나 칠판을 이용해서 내용을 강의하십니다. 연습강의에서는 강의수업과 관련된 중요하지만 어려워서 따라가기 힘들 수 있는 내용을 복습하거나 연습문제를 풀었습니다. 평가는 100% 기말고사입니다. 따라서 출석확인이나 과제확인은 없습니다.(연습강의를 따라가려면 미리 올려주는 연습문제를 풀면 좋겠지만, 풀어오라고 하거나 검사하는 경우는 없습니다.) 수업성취도를 평가하는 유일한 척도인 기말고사 방식도 처음에 낯설었습니다. 4월에 학기가 시작하여 수업은 7월 초중순에 끝나는데, 이후에 두 번의 시험기회가 주어집니다. 대략적으로 8월과 9월에 각각 1차,2차 시험기간이 있습니다. 1차,2차 둘 중에서 원하는 시기에 신청해서 볼 수 있고, 1차시험에서 낙제할 경우 재시험을 신청해서 2차시험을 치를 수도 있습니다. 저 같은 경우 9월까지 베를린에 있을 수 없어서 1차시험으로 모두 치렀지만, 현지학생들이나 1년 이상 머무는 친구들 같은 경우에 1차와 2차 시기에 나눠서 시험을 치르는 것도 보았습니다. 학교 측에서도 여러번 강조했듯이, 훔볼트대학 상경대학 같은 경우수학을 활용해서 직접 계산하는 방식을 수업에서 빈번히 사용하였고 시험에서도 같은 방식으로 출제되었습니다. 시험마다 계산기를 사용해야 했고 시험시간도 부족했으나, A4한장에 본인이 원하는 내용을 써서 가지고가서 시험을 볼 수 있게 한 것이 특이했습니다. 내용을 써서 가지고 들어갈 수 있으니 암기사항은 거의 출제되지 않습니다.
상경대에는 도서관이 없었습니다. 그러나 앞서 말했듯이 단과대별로 굉장히 독립적으로 이루어져 있어서 각 단과대나 테마별로 도서관이 존재합니다. 가까운 신학대 도서관이 있는데 저는 주로 이곳에서 시험공부를 하였습니다. 물론 중앙도서관 역할을 하는 Jakob-Grimm Zentrum이 있습니다. 상경대와 신학대가 위치한 Hackescher Markt에서 한 정거장에 위치해 있어서 멀지 않고, 내부가 정말 마음에 들어서 종종가서 공부했습니다.","훔볼트대학의 International office는 앞서 말씀드린 본관에 위치해있습니다. 훔볼트대학으로 배정을 받은 후 이곳으로부터 안내를 받고 기숙사도 신청했으며, 도착한 직후에도 상당한 도움을 받았습니다. 도착해서 오리엔테이션을 통해 여러 가지 설명을 해주었고, 산하에 Orbis라는 곳이 있는데 교환학생들의 서류처리를 도와줍니다. 이곳을 통해서 학교등록과 비자발급서비스를 받았습니다. 또 교환학생들이 참여하여 즐길 수 있는 행사를 격주에 한 번꼴로 열어서 학생들의 참여를 유도합니다. 베를린 역사탐방에서부터 공연관람, 주변도시 여행가지 다양한 프로그램이 준비되어 있던 것으로 기억합니다. 상경대에도 국제처가 따로 위치해있는데, 개강이후에는 실질적으로 이곳에서 저를 맡아서 도움을 주었습니다. 질문이 있을 때 빠르게 답변을 주었고, 교환학생들의 친목도모와 현지학생들과의 교우를 위해 정기적으로 모임을 주최하고 함께 여행도 다녀왔습니다.","학교가 도심해 위치해있어서 교내에 체육관은 없지만, Studentwerk와 같이 Hochschulsport라는 기관이 있고 그곳에서 다양한 체육활동을 제공합니다. (궁금하시면 Hochschulsport HU Berlin이라고 검색해보시면 사이트를 찾으실 수 있으니 참고하시면좋겠습니다.)요트,카누,승마,복싱,태권도 등등 웬만한 구기 종목, 무술, 레포츠를 선택해서 즐길 수 있습니다. 보통 일주일에 한 번 반을 운영하는데 시간만 잘 맞으면 원하는 만큼 할 수 있고, 가격도 한학기에 20유로 정도로 비싸지 않아서 추천 할 만합니다.","자전거를 중시하는 문화가 인상 깊었습니다. 정말로 많은 사람들이 자전거를 교통수단으로 이용하며, 그만큼 자전거를 위한 시설적/문화적 배려가 잘 되어있었습니다. 자전거 도로가 정말 잘 되어있고, 복잡한 도로에서는 자전거를 위한 신호등도 있습니다. 당연히 자전거 거치대도 많고, 버스를 제외한 지하철과 Tram에 자전거를 가지고 탈 수 있습니다. 차량 운전자들도 자전거가 앞에 달린다고 해서 경적을 울린다거나 짜증내지 않고 기다리거나 우회해서 갑니다. 저도 중고 자전거를 구입해서 타고 다녔는데, 통학시간도 줄어들고 운동도 되고 좋았던 것 같습니다. 
직장에서의 근무문화가 놀라웠습니다. 직장내부의 속사정은 모르지만, 근무시간이 정말 짧고 그것도 매일 근무하지 않는 경우도 많습니다. 따라서 처리해야 하는 것이 있다면 넉넉하게 일찍부터 시작하여야 합니다. 독일에 처음 갔을 때와 나가기 직전에 학교,은행,거주 관련 서류작업을 해야되는데 이러한 독일식 근무문화를 모르는 상태에서 짧은 시간에 일을 모두 처리하려고 하다가 낭패를 보기 십상입니다. 근무시간을 미리 확인하고 대부분 미리 약속시간을 잡은 후에 만나야합니다. 또한 고객에게 친절하지 않습니다. 다른 나라나 지역에 비해서 고객을 상대하는 직원이 불친절하다고 느껴질 수 있습니다. 독일사람들의 표정이 다양하지 않고 필요한 말만 할 때가 많으며, 자신의 책임범위에 엄격해서 규칙대로 하려는 경향이 있는 것 같았습니다. 물론 제가 독일어를 잘 못해서 사람들이 그렇게 대했을 수도 있지만요.^^;처음에 이러한 것이 당황스러울 수 있지만 지내다 보면 곧 적응이 될 것입니다.","베를린리포트라는 재독한인동포 포털이있습니다. 베를린리포트라고 검색하시면 찾으실 수 있습니다. 문제가 생겼을 때 질문을 올리면 다른 분들이 답변을 달아서 문제해결에 도움을 주십니다. 또 중고물품을 사고팔기도하는데, 베를린의 경우에 한국인 분들이 꽤 계셔서 거래가 활발한 편인 것 같습니다.
교내에서는 해당 단과대학 국제처가 가장 빠르고 친절하게 필요한 정보를 제공해 줄 수 있을 것이라고 생각합니다.",이외에 질문이 있으시면 ryush972@gmail.com으로 연락주세요.
