gen_info,env_info,food_info,study_info,office_info,facil_info,mhct_info,help_info,etc_info
"- 일단 대학 자체의 크기는 큽니다. U반 역 2개에 걸쳐 있습니다. 그리고, 건물 자체가 많이 떨어져 있으니 시간표를 짜신다면 다른 건물로 이동하는 시간을 고려하시는게 좋습니다. 저는 경영 수업을 들었는데, 다른 교환학생 수업이 있는 메인 건물과는 약 10분정도 걸렸습니다.- 자유대는 아주 서독의 한적한 곳에 있어요. 학교 주변이 심심할 수도 있지만 그래도 동독쪽 보다는 안전하니 맘놓고 다닐 수 있을거예요- 겨울엔 춥습니다! 롱패딩 꼭 챙기세요. 그리고 날씨가 아주아주 우중충하고 해가 3시부터 져서 한겨울에는 4시에 깜깜해요. 비타민D 같은걸 챙겨가는 것도 좋을듯해요. 그리고 건조하니 예민하신 분들은 이것도 참고하면 좋을거예요.","말씀드렸듯 학교 주변에는 특별히 놀거리, 먹을거리가 거의 없습니다. 그래도 조금(많이)걸으면 베를린 Botanisher Garten이 있습니다. 사실 가을학기에는 큰 메리트가 없겠지만 봄에는 아주 예쁘다고 하니 꼭 가보세요!그리고 버스도 꽤 많은 노선이 있으니 수업 후에 다른 곳으로 가기도 좋은듯 합니다!","저는 다른 친구들과 같이 Schlachtensee에 9월부터 2월까지 살았습니다. 제가 기숙사를 신청할 2019년 1학기까지는 자유대에 다녀온 학생들 모두 Schlachtensee를 강력추천했지만, 이번학기에는 조금 다르게 느껴지는 부분이 있었으니 다른 기숙사와의 장단점 비교는 다른 친구들의 보고서를 참고하시는걸 추천드려요. Schlachtensee 중에서도 어떤 하우스, 플랫에 배정되는지에 따라 방 컨디션 등이 굉장히 달라지는데, 특히 저는 방과 화장실 모두 혼자 사용했습니다. 부엌은 함께 사용했는데, 이부분도 플랫에 따라서 컨디션이 아주 다릅니다만, 조리기구들이나 냉장고가 아주 깨끗한 편은 아니었습니다.식사의 경우에는 외식 비용이 비싼 편이고, 기숙사 주변에 마땅한 외식 장소가 없었기 때문에 주로 직접 요리해 먹었습니다. 한식같은 경우에는 한국에서 챙겨간 블럭국이나 김, 액상으로 된 소스들에 마트에서 산 재료를 추가해 먹었고, 버스와 S반을 타고 3~40분 정도 나가면 큰 아시안 마트가 있으니 쉽게 구입할 수 있습니다. 여기에서 라면, 장/소스류 등 거의 모든 한식 재료들을 살 수 있으니 한국에서 챙겨갈 때에는 한국에서만 살 수 있는 것들만을 사가시는 것을 추천드려요.독일은 장보기 물가가 아주 저렴하고 냉동식품이나 레토르트들이 아주 잘 되어있는 편입니다. 기숙사 부엌에 오븐이 거의 있는 편이니 냉동식품을 활용하는 것도 좋은 방법이에요. 찾아보면 아주 괜찮은 제품도 많습니다!(피자, 감튀는 물론이고 빠에아나 나시고랭 등도 볶기만 하면 되는 제품이 나와있어요. 케익, 아이스크림 등의 디저트류도 꽤 괜찮습니다.)가장 간단하게 해 먹을 수 있는 메뉴는 파스타였는데, 면, 소스, 채소 모두 저렴하니 질릴때까지 파스타를 드시고 올 수 있습니다. 또한 유제품도 아주 저렴해서 요거트, 우유, 치즈 등 다양한 종류를 먹어보기를 추천해요!","저는 경영학과 수업 1개, 교환학생 수업 4개를 들었습니다. 교환학생 수업이 자유대의 특장점이라고 생각합니다. 잘 선택하면 아주 힘들지 않게 학점을 가져갈 수 있습니다. 독일어로 진행되는 수업의 경우네는 최소 B1이나 B2정도의 독일어 실력이 요구된다고 적혀있는데, 사실 수업에서 다루어지는 주제들에 익숙하지 않으면 언어적인 측면에서 좀 더 힘들다고 느낄 수 있을거예요. 반면에 영어로 진행되는 교환학생 수업의 경우에는 언어적인 측면은 좀 더 편하지만 요구되는 과제나 프로젝트등이 좀 더 무겁게 느껴지기도 했습니다. 하지만 저의 경우에는 독일어로 진행되는 수업의 경우에는 시험도 독일어로 쳐야하는데, 독일의 시험은 객관식/주관식이 아니라 에세이를 시험시간 내에 써야하다보니 영어 수업이 좀 더 편했습니다.경영학과 수업의 경우에는 한 학기 동안 4번 젇도 학교에서 수업하고, 나머지는 온라인으로 진행되었는데, 색다른 수업방식 덕분에 시간표를 예쁘게 만들 수 있어 아주 좋았습니다. 또한 한국에서는 비슷한 비즈니스 케이스만을 다룬다면, 자유대 수업에서는 아주 다양한 기업들을 다루고, 다른 문화권에 있는 학생들과 의견을 나눌 수 있어서 다양한 인사이트를 얻을 수 있었습니다. 마지막으로, 자유대 커리큘럼이 잘 되어 있는 편이라 독어독문학과 학생이 아니어도 본인의 전공 수업을 들으실 수 있습니다. 하지만, 거의 모든 전공수업이 독일어로 진행되니 실라버스를 잘 확인하셔야 할거예요!","독일의 행정처리는 아주 느립니다... 그치만 abroad 부서와 메일로 커뮤니케이션하는 것은 큰 무리가 없었습니다. 그리고 학기 시작 전 자유대에 등록할 때에, 학교 자체적으로 1:1 또는 1:2로 학교에 대해서, 그리고 앞으로의 절차에 대해서 자세하게 설명해 주니 걱정하지 않아도 됩니다.","동아리 활동을 하지 않아서 잘 모르지만, 탄뎀제도가 있습니다. 하지만 저는 굳이 하고싶지 않아서 탄뎀 활동도 안 했어요...학식(멘자)는 좋지도, 나쁘지도 않습니다. 매일 달라지는 메뉴도 있고, 고정메뉴도 있습니다. 메뉴를 선택할 때 실패할 확률이 높으니 안정적인 메뉴(파스타, 커리부어스트)를 선택하는 것을 추천드립니다. 펜넬같은 향신료에 익숙하지 않으시다면 반접시도 못먹는 경우가 생깁니다.. 제가 가장 자주 먹었던 것은 샐러드인데, 원하는 채소를 담아서 먹을 수 있어서 다른 메뉴가 실패할 때 대비용 사이드 디쉬으로 아주 좋습니다. 그리고 디저트가 다양하게 있는데, 브라우니가 있는 날에는 꼭 드시길 추천드립니다. 자유대 커피도 아주 맛있어요!!! 쓴맛 신맛 없고 좋았습니다.","행정처리가 아주 느립니다... 안멜둥, 비자, 압멜둥 등의 행정처리를 할 때에도 최소 한달 전에 테어민을 잡아야 합니다. 저같은 경우에는 안멜둥과 비자 테어민을 한국에서 7월에 잡았습니다. 네이버 블로그 등에 어떻게 테어민을 잡는지 잘 설명되어 있으니 참고해보세요.택배같은 경우에도 한국과 굉장히 다릅니다. 택배 배달원분이 집에 왔을 때 수신인이 집에 없다면 다시 돌아가고, 두번 정도 방문 후에도 부재중이라면 근처 파켓샵에 맡겨놓습니다. 저는 한국에서 택배 주문을 아주 많이 하는 편이었는데, 이 프로세스가 굉장히 귀찮아서 그냥 시내나가서 쇼핑하고, 좀 더 비싸더라도 필요한 것은 슈퍼에서 구매했습니다.그리고 기숙사 창문에 방충망이 없어요. 저는 가을학기에 가서 좀 덜하긴 했지만, 9월과 10월같은 경우에는 창문을 열기만 하면 벌레가 들어오는게 스트레스여서 방충망을 사서 달았습니다. 그런데도, 플랫메이트가 복도쪽 창문을 열어놨을 때 방문으로 들어오는 벌레들도 정말 싫었습니다.....",연세대 국제처분들꼐 가장 빠르고 효율적으로 도움을 받을 수 있을거예요. 현지의 이슈에 대해서는 페이스북의 독일 유학생 네트워크가 가장 도움이 되었습니다.,"위의 다른 문항에서는 장점과 단점 위주로 설명했지만, 자유대에서 한 학기를 보내는 것은 강추합니다! 대부분의 강의들이 워크로드가 무겁지 않고, 베를린 위치 자체가 여행하기에 나쁘지 않기 때문에 한국에서는 할 수 없는 경험들을 다양하게 해볼 수 있을거예요.그리고 술이 쌉니다... 다양하게 마셔볼 수 있어요... 혹시 지금 교환학기를 갈지 말지/자유대를 갈지 말지에 대해서 고민하고 계시다면, 자유대에서의 한 학기가 호회 없을 것이라고 확신합니다!!!"
"Freie Universitat Berlin(이하 자유대)는 베를린 남서쪽에 위치해 있습니다. (U-Bahnhof Dahlem Dorf, Freie Universitat 근처) 다른 교환 대학인 Humboldt Universitat에 비하면 굉장히 외곽 지역에 있다고 말할 수 있습니다. 캠퍼스의 특이한 점은 모든 건물이 함께 자리해 있지 않다는 것입니다. 교환학생 전용 수업을 들으시면 보통 메인 건물 안에서만 움직이겠지만, 법학 수업, 경영/경제 수업, 예술사학 수업 등 전공에 따라 강의실이 다른 건물, 다른 위치에 있기도 합니다. 친구들의 이야기를 참고해보면 걸어서 5-15분 정도 걸리는 것 같습니다. 참고로 자유대는 시내 중심가에서는 멀지만 자유대 기숙사들에서는 그리 멀지 않습니다.많은 사람들이 알고 있는 것처럼 유럽, 베를린의 겨울 날씨는 그리 좋지 않습니다. 하늘이 흐린 것은 다반사이고 비도 자주 내립니다. 그리고 개인적으로 신기했던 건 하루에 날씨가 몇번씩 바뀌기도 합니다. 아침엔 날씨가 엄청나게 좋았다가 오후나 저녁에는 흐리고 바람불고 비내리는 날도 경험할 수 있습니다. 또 겨울에는 해가 짧기 때문에 겨울학기에 베를린에 오시는 분들은 처음 베를린에 도착했을 때 많이 돌아다니고 관광하시는 것을 추천합니다. 가장 심할 때는 4시에 해가 집니다.","딱히 뭐가 있지는 않습니다. 앞서 언급한 것처럼 시내에서 멀기 때문에 주변에 놀거리라든지.. 식당이라든지.... 별로 없습니다. 학교 안에 피자, 파스타를 파는 레스토랑이 하나 있는데, 나름 괜찮아서 추천합니다. 버스나 지하철, 지상철을 타서 조금 나가면 Steglitz 지역이나 Zehlendorf 지역에 갈 수 있습니다. Steglitz에는 쇼핑센터, 백화점 및 아시아 식료품 마트가 있고 Zehlendorf에는 Burgeramt(Anmeldung 및 Abmeldung 하는 곳)와 은행 정도가 있습니다. 근데 이런 곳들을 학교 끝나고 놀러 간 적은 극히 드뭅니다. 해가 빨리 지기 때문에… 수업이 일찍 끝난다면 많이 놀러갈 수 있겠죠? 아무튼 학교 ‘주변’에는 별 게 없습니다.","거주 형태는 할 말이 많아서 식사 먼저 말씀을 드리겠습니다. 저는 베를린에 오기 전에 요리를 정말 안 하는 사람이었는데 여기에서는 하게 되더라고요. 기숙사 주변에 식당이 거의 없고 외식물가가 저렴하지 않아 요리를 많이 해 먹게 됩니다. 백주부님 레시피 따라하면 실패하기 힘듭니다. 요리하면 돈도 아낄 수 있어서 좋아요. 또 베를린에서 교환학생을 하게 된다면 아시아 식료품, 한국 식료품 걱정은 하지 않아도 됩니다. 식료품점 되게 많아요. 물론 안 파는 것들이 있긴 하지만 보통 생각하는 것보다 훨씬 다양한 한국 식재료들이 있기 때문에 굳이 한국에서 사 올 필요는 없습니다. 굳이 얘기하자면 닭강정 소스…? 베를린에서 파는 걸 못 봤고, 한국에서 가져오면 활용도가 높습니다. 다른 한국 친구들과 혹은 외국인 친구들과 요리해 먹어도 재밌습니다. 서로 국가 음식 만들어서 같이 먹기도 했습니다.학교에서는 학식당인 MENSA에 갑니다. 근데 저는 9월에 Vorkurs 들으면서 너무 많이 가고 음식도 질려서 학기 개강 후로는 도시락 싸 다녔습니다. 아까 언급한 교내 피자 파스타 식당도 괜찮았습니다. 추가로 베를린에는 한식당도 많아요. 한두개정도 가보는 것도 추천합니다.거주 형태는 보통 기숙사입니다. WG라고 부엌과 화장실을 공유하는 형태입니다. 만약 본인이 원하고 경제적 여유가 있다면 따로 집을 구해서 살 수도 있겠지만 집을 구하는 게 보통 일이 아니고 몇 년 전부터 베를린의 집값 상승 속도가 어마어마하기 때문에 추천하지는 않습니다. 기숙사 신청에 떨어져서 따로 한인 WG나 사설 WG에서 사는 친구들은 있었지만 자취하는 친구는 없었습니다.자유대의 기숙사는 크게 3개입니다. 하나하나 설명드리겠습니다.1. Schlachtensee (19/20 기준 한달 429유로)제가 지냈던 기숙사입니다. 3개의 기숙사 중 가장 좋은 시설을 가지고 있습니다. 근데 저는 여기 엄청 싫어합니다. 일단 시설(주방 상태나 화장실을 쓰는 인원)이 가장 좋은 건 사실입니다. 주방이 넓고 기숙사 동과 층, 플랫에 따라 다르긴 하지만 주방용품이 이미 구비되어 있는 경우도 있습니다. 그러나 상대적으로 좋은 것이지 절대적으로 좋은 것은 아니었습니다. 함정은 방이 3개 기숙사 중에 가장 작습니다. 살기에는 나쁘지 않지만 예를 들어 방에서 건조대에 빨래를 널 때, 캐리어 짐을 쌀 때, 택배 보내려고 택배 상자 들여놨을 때 조금 불편하긴 합니다. 그래서 친구들이 베를린에 놀러 왔을 때 친구를 재우는 것이 힘들 수 있습니다. 그래도 놀러 온 친구를 재우는 경우를 보긴 했네요. 제 생각에 가장 치명적인 단점은 가격입니다. 이 기숙사에 생활하는 데에 429유로는 비싸고 가성비가 너무 떨어지는 가격입니다. 만약 여행을 많이 다니실 예정이라면 Schlachtensee는 더더욱 비추천입니다. 저는 다른 파견보고서에서 다른 2개의 기숙사는 살기에 너무 안 좋다고 해서 제일 비싸도 Schlachtensee를 골랐던 것인데, 시간을 되돌린다면 다른 기숙사들을 선택할 것입니다. 추가로 Schlachtensee에서 어딘가를 가려면 무조건 타야 하는 버스가 있는데, 그것이 바로 118번입니다. 배차간격 너무 짜증나고 스트레스 받습니다 진짜…2. Goerzallee (19/20 기준 한달 289유로)가격이 확실하지 않지만 280-290유로 정도였던 걸로 기억합니다. 이곳은 교환학생들이 가장 많이 거주하는 기숙사입니다. 주방 작습니다. 주방용품 없습니다. 화장실 5-7명이서 2개 써야하는 걸로 기억합니다. 확실히 좋은 기숙사는 아닙니다. 장점이라 하면 교환학생 친구들을 자주 만날 수 있다는 것입니다. Schlachtensee의 경우 박사나 석사를 하는 사람들 혹은 사적으로 알아보고 들어온 사람들이 많기 때문에 친목 분위기가 잘 형성되어 있지는 않습니다. 반면 Goerzallee는 주방과 화장실을 공유하는 친구들이 모두 교환학생이라 안면이 있는 경우가 많고, 파티를 자주 해서 사람들과 친해지기에 좋습니다. 하지만 물론 그로부터 파생되는 단점들도 있겠죠. 사생활이 보장이 안 될 수도 있다는 것, 파티를 하는 날에 파티를 가지 않는다면 소음 때문에 스트레스 받을 수 있다는 것 등이 있겠네요. 사실 개인적으로는 주방 작아도 꾸역꾸역 거기서 파티 할 거 다 하고 주방용품이야 월세가 싸니 사고 나중에 중고로 팔 수 있다고 생각해서 Goerzallee 살 만한 기숙사라고 생각합니다. 근데 Goerzallee 사는 친구들은 Schlachtensee를 부러워하긴 했어요. 시설이 더 좋다고…3. Halbauerweg (19/20 기준 한달 250유로)전 시간을 되돌린다면 여기에 살고 싶습니다. 월세가 가장 싼 것도 있지만 시설도 딱 적당합니다. 일단 방은 Goerzalllee와 Halbauerweg이 비슷한 것 같긴 한데 Halbauerweg이 조금 더 큽니다. 화장실은 둘이서 씁니다. 근데 보통 같은 나라 사람, 같은 성별과 같이 쓸 수 있도록 배정해 줍니다. Schlachtensee의 경우 저는 같이 화장실 쓰는 사람이 남자이고 다른 나라인 사람이어서 엄청 스트레스 많이 받았습니다. 주방은 엄청 좋진 않지만, Goerzallee만큼 작지는 않습니다. 아 참고로 Goerzallee와 Halbauerweg의 주방에는 냉동고가 없습니다. 놀라셨죠? 하지만 저는 그냥 Schlachtensee에서 비싼 월세 내고 살 바에는 싸게 월세 내고 남은 돈으로 냉동고를 친구랑 같이 사서 나눠 쓸 것 같습니다.4. 정리소음공해: Goerzallee > Halbauerweg = Schlachtensee사생활 보장: Schlachtensee > Halbauerweg > Goerzallee월세 저렴함: Halbauerweg > Goerzallee > Schlachtensee주방 시설: Schlachtensee >>> Halbauerweg > Goerzallee화장실: Schlachtensee > Halbauerweg > Goerzallee이상 저의 주관성이 잔뜩 담긴 기숙사 후기였습니다. 각자 성격과 경제적 여유에 따라 잘 선택하셨으면 좋겠습니다!","도서관은 별로 할 말이 없습니다. 본관에 중앙도서관과 인문학도서관이 있습니다. 둘 다 가 봤는데 공부하기에 괜찮습니다. 근데 중앙도서관도 한국인 기준으로는 굉장히 일찍 닫습니다. 기억상 한 10시? 11시? 쯤 닫았던 것 같아요.수업에 관련해서 얘기하자면, 일단 9월부터 10월 초까지 Vorkurs라는 어학 수업을 들을 수 있습니다. 출석 잘 하고 시험 보면 5ECTS(한국학점 기준 2.5)를 줍니다. 매일매일 아침에 일어나서 학교 가는 게 고통스럽긴 하지만 외국인 친구들도 사귈 수 있고 학기 시작 전에 독일어 공부할 수 있어서 좋았습니다. Vorkurs를 듣지 않는 경우에는 그 시기에 여행을 다니거나, 아예 학기 시작에 맞춰 독일에 오기도 합니다.10월 말부터 2월 중순까지가 정규학기입니다. 제가 수강한 수업들은 모두 교환학생용이었습니다. Sprecherziehung, So tickt Deutschland, Weimar Cinema, Musikstadt, Sprachkurs 5개 들었고 하나당 5ECTS 해서 총 25ECTS입니다. Vorkurs까지 합치면 총 30ECTS네요. 한국에서는 15학점입니다. 수업에 대한 자세한 설명을 듣고 싶다면 끝에 적어 놓은 메일 주소로 메일 주세요. 복수전공하는 친구들은 경영 수업을 듣기도 했습니다. 수업은 독일어 혹은 영어로만 진행되고 제가 들은 수업 중에서는 Weimar Cinema만 영어수업이었습니다. 다 들을 만했고 교수님들 중에서는 교환학생을 배려하여 느리게 말씀해 주시거나 단어 설명을 해주시는 분들도 계십니다.보통 시험은 기말고사 한번 보고, 그 전에는 보고서나 발표를 하나쯤은 하게 되는 것 같습니다. 제가 들은 수업들이 모두 참여형 수업인 Seminar여서 그랬을 수도 있습니다. Vorlesung이라는 강의형 수업은 발표 없다고 들었습니다. 하여튼 발표나 보고서는 그렇게 빡세지 않아서 적당한 독일어 혹은 영어가 가능하다면 큰 스트레스 없이 준비할 수 있습니다.어학 수업의 경우에는 학기 중에도 Vorkurs와 동일하게 반 배정 테스트를 보고 레벨이 결정됩니다. 선생님마다 수업 방식이 굉장히 다릅니다. 보통 학기 중간중간 시험을 2~4개정도 보고, 기말고사는 시험 보는 경우가 많으나 보고서로 대체하는 반도 있었습니다. 기말고사는 평소에 일주일에 한번 복습과 예습을 꾸준히 했다면 따로 준비가 필요 없을 정도의 난이도입니다. 그러나 평소에 복습과 예습을 하지 않기 때문에 저를 포함한 거의 모든 교환학생이 벼락치기를 했습니다. 근데 벼락치기 해도 Fail 안 받을 수 있습니다. 그냥 교환학기 재미있게 보내세요.",,"학교에 카페가 여러 개 있습니다. 저는 카페를 잘 가지 않았지만 카페마다 각각의 특색이 조금씩 있으니 한번씩 가보세요.동아리 없습니다. 제가 가장 실망한 부분입니다. 탄뎀 친구에게 동아리가 있는지 물어봤는데 대학 체육 수업인 Unisport를 얘기해 주더라고요. 그래서 저는 동아리 대신에 Unisport에서 현대무용과 아크로바틱을 신청해서 들었습니다. 재밌었어요. 하지만 동아리의 성격은 아닙니다. 일주일에 한번 한 학기 해서 일반적으로 50유로대였습니다. 물론 스키나 승마 이런 건 엄청 비쌉니다… 가성비 있게 관심있는 것 배울 수 있어서 좋았습니다. Unisport를 신청할 때 주의할 점은 요일과 시간을 잘 선택해야 한다는 점입니다. 주말이나 학교가는 날이 아닐 경우 귀찮음 혹은 여행으로 안 가게 될 확률이 높아집니다. 저는 나름 꾸준히 갔는데 친구들 중에서는 안 가는 사람들 많았습니다.자유대에는 한국학과가 있습니다. 그래서 Tandem(언어교환 파트너)를 다른 지역 혹은 대학보다 쉽게 구할 수 있습니다. 인터넷으로 신청할 수도 있고 한국학과에서 주최하는 Tandem Party에 가서 직접 찾을 수도 있습니다. Tandem Party는 가는 것 추천합니다. 재밌었어요. 새내기 시절의 오티, 새터를 방불케하는 테이블 회전속도를 자랑합니다.","딱히 Culture Shock 기억 나는 건 없는데, 생각보다 독일이 punktlich 하지 않으며 사바사가 심합니다. 대중교통 연착 자주 되고요. 사바사가 굉장히 심하다고 느낀 건 비자 발급 비용 (저는 안 냈는데 다른 과 사람들은 낸 사람도 있습니다), 은행 계좌 발급 (같은 은행임에도 불구하고 지점에 따라 발급해주는 곳이 있고 안 해주는 곳이 있었습니다) 등에서였습니다. 독일 사람들은 친절하진 않지만 베를린만큼 다국적인 도시는 찾기 힘든 것 같습니다. 그래서 인종차별이 많이 없습니다.","베를린 도착 전에는 자유대에서 먼저 이메일이 올 것입니다. 안내 따라서 잘 하시면 되고, 문의도 그쪽으로 하면 됩니다. (incoming 어쩌구 메일이었습니다) 베를린에 살고 나서는 친구도 사귀고 어느 정도 지내면서 혼자서 헤쳐나갈 수 있는 자립심과 짬이 생기기 때문에 큰 도움을 청해본 적은 없는 것 같습니다.페이스북 그룹 독일 유학생 네트워크, 독일 유학생 벼룩시장 등에 가입해서 본인에게 유용한 정보들을 잘 가져가시기 바랍니다.","교환학기가 상상했던 것만큼 드라마틱하게 행복하고 항상 즐거웠던 것은 아니지만, 꼭 한번은 경험하면 좋겠다는 생각을 했습니다. 앞으로 교환학생 가시는 분들 여행도 많이 다니고, 외국인 친구도 많이 사귀고, 다양한 경험 많이 했으면 좋겠습니다. 이메일을 남기니 궁금한 점이 있으면 메일 주세요.klesha@yonsei.ac.kr"
