gen_info,env_info,food_info,study_info,office_info,facil_info,mhct_info,help_info,etc_info
"훔볼트 대학교는 과거 베를린 대학교로 불리던 곳으로, 베를린이 분단되어 자유대학교가 생기기 전까지 베를린을 대표하는 학교였다고 해요. 그래서 이 학교 출신의 저명한 학자들도 정말 많습니다. 거기에 대한 자부심도 있고요. 대학 규모도 따라서 상당히 큰 편인데요, 우리나라의 성균관대학교처럼 문/이과 캠퍼스가 이원화되어있습니다. 문과 관련 단과대학은 베를린의 중앙인 Mitte지구에 위치하며, 이과 관련 단과대학은 Adlershof라는 외곽 지역에 새로 지어졌습니다.베를린의 위치만 보면 독일의 동북쪽에 위치해있어서 서유럽과의 접근성이 떨어진다고 생각하기 쉽습니다. 하지만 베를린에는 2개의 공항이 있는데요, 모두 김포 공항처럼 작은 규모의 공항이라서 유럽 곳곳을 연결하는 '저가항공'이 정말 많이 취항합니다. 아시아나 북미 등으로 향하는 국제선이 적어서 멀리 가기 위해서는 환승을 해야한다는 단점이 있지만, 베를린으로 교환학생 가서 어디 다른 데 여행 갈 일은 거의 없겠죠? 그래서 뮌헨 등 서유럽이랑 가까운 지역보다 항공편이 많기 때문에 오히려 더 빠르게 도착할 수 있어요. 또 폴란드나 체코 등 동유럽 국가들은 버스로도 충분히 다닐만 합니다. 베를린 버스 터미널(ZOB)에서 출발하는 버스 노선 역시 유럽 각지로 많아서 돈은 없고 시간은 많을 때는 버스를 이용하실 수도 있어요.기후는 시기별로 편차가 큽니다. 여름학기신가요? 축하드립니다. 베를린의 여름은 정말 좋았습니다. 한국처럼 더운 날은 며칠 되지 않았고, 습도가 높지 않아 견딜만한 더위라고 느꼈습니다. 아, 여기도 가끔 정말 더운 날이 있긴 있는데 에어컨이 없어서 며칠은 정말 고생하기는 해요. 그래도 겨울학기보다는 여전히 추천드립니다. 겨울 날씨는 좋아하는 사람이 있을지 의문인데요, 저의 경우도 조금 우울해지는 느낌을 받을 정도로 해가 자주 뜨지 않습니다. 2주에 2-3일 정도 몰아서 해가 쨍쨍하고 나머지는 회색 날씨였던 걸로 기억해요. 날씨에 영향을 크게 받는 성향이시면 겨울 학기는 별로 추천드리지 않습니다.","훔볼트 대학교의 건물은 베를린 시내에 고루 분포되어 있습니다. 캠퍼스가 익숙한 우리 학교 학생들에게는 처음에 낯설 수도 있어요. 하지만 정말로 시내에 학교가 있어서 하교 후에 다른 일정을 소화하기 정말 편리합니다. 많은 사람들이 베를린에 관광오면 빼놓지 않고 들르는 Mitte 지구에 위치해있기 때문에 베를린의 주요 스팟들이 일상이 됩니다. 서울보다 베를린이 훨씬 작은 도시이기 때문에 직접 비교는 어렵지만, Mitte가 서울로 치면 중구 정도 되기 때문에 은행이나 통신사, 관공서 등 각종 행정업무를 처리하기에도 좋았어요.","저는 한 학기는 기숙사에서, 한 학기는 셰어하우스에서 거주했습니다. 기숙사는 Adlershof보다 Alle der Kosmonauten이나 Aristotelessteig를 추천드려요. 가격도 더 저렴하고 시내에 조금 더 가까이에 있습니다. Adlershof는 이과 캠퍼스를 방문하실 일이 정말 많지 않다면 메리트가 별로 없는 것 같아요. 제가 살았던 Aristotelessteig는 다른 기숙사와 다르게 작은 원룸 형태였습니다. 룸메이트가 없는 거죠. 이게 가끔은 외롭기도 하지만, 집에서 온전히 혼자서 휴식을 취하는 기쁨이 더 컸습니다. 가격도 월 30만원 정도로 저렴한 편이었고요. 다만 학교까지 1시간 가까이 걸리는 점, 그리고 Kreuzberg를 비롯한 다른 구역과의 교통 연계가 그렇게 좋지 않은 점 때문에 저는 따로 셰어하우스(독일어로 WG, Wohngemeinschaft)로 이사를 했네요.*WGgesucht라는 어플리케이션을 설치하면 WG를 보다 수월하게 찾을 수 있습니다. 하지만 셰어하우스이니 만큼 인터뷰는 항상 필요했던 것 같아요.","수업은 괜찮은 편이었습니다. 아주 만족스러운 정도는 아니었는데, 독일어로 진행되는 수업은 제 독일어 실력이 부족해서 적극적으로 참여하는 게 힘들었고 영어로 진행되는 수업은 숫자가 그렇게 많지 않았어요. 그래도 잘만 찾으면 영어로 진행되는 좋은 수업도 꽤 있습니다! 독일어 수업도 교환학생들만 듣는 독문과 모듈(3개 정도의 수업을 묶어서 한 번에 수강하는 시스템)에선 교수님들이 독일어를 좀 못해도 많이 배려해주시고요. 독일어를 잘 못해도, 열심히 배우려는 의지만 있다면 훔볼트 어학당(Sprachenzentrum) 수업과 병행 시 독일어 실력이 빠르게 늘 거에요:)중앙도서관은 Jakob und Wilhelm Grim Zentrum이라고 불립니다. 독어학에 중요한 역할을 했고, 동화집으로 유명한 그림 형제를 기리는 이름이에요. 엘리베이터를 이용할 수 없고, 투명한 가방과 텀블러만 가지고 들어갈 수 있다는 점을 제외한다면 쾌적하고 좋은 도서관입니다. 자물쇠를 가져가야 라커에 가방과 짐을 두고 입장할 수 있으니 자물쇠는 항상 필수에요. 여기 말고도 저는 문과대학 건물 1층에 있는 단과대 도서관, 그리고 Mensa Nord 옆에 있는 도서관을 자주 이용했는데요, 중앙 도서관보다 사람이 적어서 자리를 찾는 게 더 쉬웠어요. 시험기간에는 중앙도서관보다 이 곳들을 추천합니다.","훔볼트의 국제처 Orbis 직원 분들은 상당히 친절하십니다. 학생들이 많이 근무하고 있어서 편하기도 하고, 학생 식당이 있는 본관에 위치해있어서 접근성도 나쁘지 않습니다. 물론 영어도 다들 잘 하십니다. 가장 좋았던 건 비자 서비스였습니다. 베를린을 포함해서 독일에서 비자 받기가 상당히 어려운 것으로 알고 있습니다. 외국인청에 새벽부터 줄을 서거나, 한참 전부터 인터넷으로 예약을 해야된다고 들었어요. 하지만 훔볼트 대학은 Orbis에서 비자 서비스를 운영하고 있어서, 여기에 여권과 서류를 작성해서 맡기면 2-3주 정도면 비자를 발급받아서 전달해줍니다. (비자를 빨리 받고 싶으시다면 여권을 맡길 때 2주 안에 외국 여행이 잡혀있고 이미 버스표를 샀다고 말하면 가장 빠른 순번으로 진행해줍니다. 저는 진짜로 여행이 있어서 그렇게 했는데, 생각해보니 버스표는 취소/환불이 가능하더라고요... 혹시 비자를 꼭 빠르게 발급받으셔야 하는 분이 계시면 써먹을 수 있는 팁일 것 같아서 적어봅니다.)","동아리는 잘 없는 것 같습니다. 학교가 끝나면 다들 각자 할 일을 하러 가는 것 같아요. 다들 학기 중 인턴을 상당히 많이 해서 그런지 수업 중 교환학생 친구를 사귀는 게 아니면 훔볼트 정규 학생 친구는 만들기가 꽤 어려웠어요.하지만 매 학기 초반에 신청하는 스포츠 수업에 참가하시면, 대부분 베를린 소재 대학 재학생들이라서 독일인 친구를 만들기 좋은 환경입니다. 또 가격도 상당히 저렴해서 평소에 배우지 못했던 스포츠에 도전해보는 것도 좋을 것 같네요.","베를린은 가장 진보적인 동네라고 생각합니다. 온갖 억압을 벗어 던진듯한 힙스터 Berliner들을 보면, 가끔은 부담스럽기도 했습니다. 물론 그게 베를린의 매력이라고 생각하기 때문에 한국에 돌아온 지금은 그런 점들이 그립기까지 하지만요. 아무데서나 맥주를 마시며 담배를 피고, 진보적인 생각이 상식으로 받아들여지는 문화라서 만약 보수적인 성향이시라면 조금 안 맞는다고 느끼실 수도 있을 것 같아요. 베를린은 수도임에도 불구하고 재정상황이 좋지 못해서 거리가 조금 더럽고, 가로등이 밝지 않은 골목도 많습니다. 그라피티도 정말 많고요. 그래서 첫 인상은 별로 좋지 않을 수도 있지만, 지내다보면 그런 분위기에 정이 또 들더라고요. 미운 정이 제일 무섭다나요...","독일유학생네트워크라는 페이스북 그룹에서 독일 생활과 관련한 각종 조언을 구할 수 있습니다. 커뮤니티 내에 베를린에 거주 중인 한인 분들도 많이 계셔서 중고 거래 등도 많이 이뤄지고요. 아무래도 한국말로 소통하는 게 가장 편하니까요, 독일로 가시면 이 그룹에 가입하는 걸 꼭 추천드리고 싶네요.",
"훔볼트 대학교는 우리나라의 일반적인 대학교처럼 한곳에 몰려있지 않고 시내 곳곳에 퍼져 있습니다. 저는 한 건물 안에서만 수업을 들었지만 건물간에 이동을 해야될 수도 있습니다. 수업은 보통 45분에 끝나고 다음 수업이 15분에 시작하기 때문에 트램이나 버스, 지하철(S-bahn, U-bahn)을 통해서 이동하시면 됩니다.베를린은 타 지역으로 여행하기가 굉장히 좋습니다. 웬만한 유럽 도시는 비행기를 타고 2~3시간 안에 갈 수 있으며 Ryan air를 이용하시면 가격도 왕복 5만원 내외였던 것 같습니다. 저는 Flixbus도 자주 이용했는데 프라하까지는 4시간, 뮌헨까지는 9시간 정도 소요되는 것으로 기억합니다.저는 베를린에 9월에 도착해서 2월에 귀국했습니다. 초반 2주간은 날씨가 좋았으나 그 이후로는 가을 겨울 내내 우중충한 날씨가 이어졌습니다. 만약 2학기에 베를린을 가게 된다면 좋은 날씨는 기대하지 마세요!",제가 속해있었던 School of Business and Economics는 S-bahn Hackeschermarkt 역 바로 앞에 있습니다. Hackeschermarkt는 베를린의 홍대? 정도로 생각하시면 됩니다. 여러 편집샵이나 상점들이 있습니다. 또한 베를린 랜드마크인 Alexanderplatz까지 2정거장 거리이며 다양한 박물관이 있는 Mitte 지역과도 굉장히 가깝습니다. 교통비는 학생증을 지니고 있으면 무료입니다. 학생증이 없을 경우에는 티켓을 사셔야됩니다. 우리나라처럼 찍고 들어가는 시스템은 아니지만 검표를 하는 사람들이 돌아다닙니다. 걸릴경우에 어마어마한 벌금을 물어야 되니 학생증이 없는 경우 웬만하면 표를 사시는걸 추천드립니다.아웃렛은 거리도 멀고 별거 없으니 가지 마세요!,"저는 학교에서 40분 거리인 Lichitenberg 지역에 거주했습니다. 소위 flat이라고 해서 화장실이랑 부엌은 공유하고 각자의 방에서 생활하는 구조입니다. 굉장히 조용한 지역이어서 살기는 편했지만 주변에 편의시설이 없어서 필요한 물건을 구비하려면 트램을 타고 나가야 됩니다. (그래서 주로 하교길에 장을 봤습니다.)베를린의 음식은 솔직히 맛이 없고 비쌉니다. 식당에서 음식을 먹으면 돈주고 먹기 아까운 수준입니다. 하지만 생활물가는 굉장히 싸기 때문에 과일, 육류, 유제품 등을 굉장히 싸게 살 수 있습니다. 종종 삼겹살을 파는 마트가 있으니 잘 찾아보세요.(제 기억에는 Landsberger Allee 쪽 Rewe에서 팔았습니다.) 그리고 곳곳에 아시안마트가 있는데 신라면, 짜파게티, 불닭볶음면 등이 있습니다. 고추 같은 것도 아시안마트에서 사시면 됩니다.",다른 과들은 Module이라는 시스템을 통해서 수업을 하던데 경영학과나 경제학과는 그냥 우리나라 수업이랑 똑같습니다. 2시간은 교수가 강의를 하고 1시간은 조교가 문제풀이를 하는 방식이었습니다. 수업의 난이도는 그렇게 높지 않지만 영어수업이 거의 없습니다.도서관은 굉장히 좋습니다. 사진으로 못보여드리는게 아쉬울 정도입니다. 입장할 때는 비닐가방과 자물쇠를 구매하셔야 됩니다. 시험기간에는 대부분의 학생들이 입장시간에 맞춰서 오기 때문에 조금이라도 늦었다가는 도서관에서 공부하실 수 없습니다. 진짜로 문이 열리자마자 다들 우르르 달려가서 착석합니다.,다양한 이벤트들이 있으나 저는 국제교육부에서 주관하는 행사에 참여하는 것보다 다른 나라를 여행하는 것을 선호했습니다. 비자 발급 등의 경우에 문의를 하면 친절하게 답장받을 수 있습니다.,mensa나 cafeteria에서 끼니를 해결할 수 있는데 제 입맛에는 맞지 않았습니다.생활체육의 국가답게 여러 스포츠를 한학기에 20유로 정도만 내면 즐길 수 있습니다. 저는 축구랑 필라테스를 신청했는데 매우 만족스러웠습니다. 수업은 1주일에 한번씩 진행되었는데 수업이 진행되는 곳이랑 거주하시는 곳이랑 거리를 꼭 확인하시고 신청하세요.,"지하철에 개와 함께 탑승이 가능합니다. 베를린의 개들은 우리나라처럼 작고 귀엽지 않습니다.행정처리, 통장개설 등 모든 업무는 예약을 통해 할 수 있습니다. 통장개설은 복불복인데 저 같은 경우는 은행 3곳을 돌아다녔습니다. ex) 비자를 발급받기 위해서 통장을 개설하려는 것이었는데 비자가 없어서 거절당했습니다.",국제처에서 비자 관련하여 많은 도움을 받았습니다. 베를린은 비자를 받으려면 예약을 해야되는데 한 3년 뒤까지 예약이 꽉 차있습니다. 긴급한 사람들을 위해 하루에 일정 인원을 상대로 발급해주는데 이를 통해서 비자를 발급받으려면 새벽 4~5시에는 도착해서 줄을 서야됩니다. 국제처를 통해 비자를 발급받으면 3주안에 해결되지만 이 기간 동안에는 여권을 제출해서 다른 나라로 여행할 수 없습니다.,
"훔볼트 대학교의 문과 캠퍼스는 독일 베를린의 가장 중심부인 미테 지역에 위치합니다. 단일 캠퍼스로 되어있는 우리나라 대학들과 달리 훔볼트 대학교는 이과 캠퍼스와 문과 캠퍼스로 두 지역에 위치해있습니다. 이과 캠퍼스는 건물들이 몰려있는 반면 문과 캠퍼스는 건물들이 다 따로 떨어져있어 수업 간 이동 시간이 오래 걸리는 경우도 있습니다. 또 보통 독일이라고 하면 춥고 건조하고 비가 많이 오는 날씨를 떠올리는데, 막상 베를린에 가보면 한국과 비교했을 때 크게 춥지도, 건조하지도, 비가 많이 오지도 않습니다. 가끔 예상치 못하게 가랑비가 내리긴 하지만 또 금방 그칩니다. 미세 먼지도 심하지 않고 하늘도 항상 맑습니다. 물론 겨울은 상당히 추웠습니다. 바람도 많이 불어서 학교에 갈 때면 항상 롱패딩을 입곤 했습니다. 여름 베를린은 날씨가 정말 좋다고 하는데, 그 시기를 경험하지 못 해서 아쉬울 따름입니다.","훔볼트 대학교 문과 캠퍼스가 위치한 미테 지역은 베를린의 가장 중심부인만큼 관광 명소가 많습니다. 메인 빌딩 바로 길 건너에는 베를린 오페라 하우스가 있고, 도보로 10-20분 거리에 유대인 박물관, 알랙산더 광장, 라파예트 백화점, 베를린 돔, 박물관 섬, 국회의사당, 브란덴부르크 문 등 여러 볼거리가 위치합니다. 그래서 수업을 듣고 항상 기숙사에 바로 돌아가기보단 관광객 모드로 여러 곳을 돌아다니곤 했습니다. 그리고 학교 근처에 예쁜 카페, 술집, 편집샵 등 친구들과 함께 즐길 곳도 많습니다. 반면 이과 캠퍼스는 아들러스호프에 위치하는데, 근처에 학생 기숙사 빼고는 아무것도 없는 심심한 동네입니다. 제가 살던 기숙사도 아들러스호프에 있었습니다.","훔볼트에 지원하면 아들러스호프에 있는 학생 기숙사나 티어파크에 있는 학생 기숙사를 선택하거나 아예 스스로 방을 구할 수 있습니다. 저는 아들러스호프 기숙사를 선택했습니다. 비교적 새 건물이라 깨끗하고, 플랫메이트도 13명 있어 친구 사귀기에도 좋았습니다. 그리고 방에 개인 화장실도 있어 특히 좋았습니다. 거실과 주방은 플랫메이트들과 공유하는 형태입니다. 식사는 알아서 해결해야 하는데, 기숙사 근처에 카우프란트라는 대형 마트가 있어 식재료를 편하게 구할 수 있었습니다. 저녁 먹을 시간이 되면 플랫메이트들이 한 두명씩 주방에 나와 요리를 하기 때문에 저녁에 요리를 하고 같이 밥을 먹으면서 플랫메이트들과 친해질 수 있었습니다.","저는 영어권으로 지원했기 때문에 영어로 진행하는 강의만 수강할 수 있었습니다. 제가 수강하던 수업의 교수님들은 공교롭게도 모두 독일인이 아닌 외국인이셨습니다. 그래서 특유의 억양 때문에 가끔 발음을 알아듣기 힘들 때도 있었습니다. 훔불트 대학교의 수업은 여러 종류가 있습니다. 교수님의 일방적인 강의로 이루어진 렉처, 토론 위주로 이루어지는 세미나, 렉처나 세미나에서 배운 내용을 연습하는 위붕. 훔볼트 재학생들은 각자 단과대에서 정해준 모듈대로 렉처, 세미나, 위붕을 묶어서 수강하지만 교환학생들은 상대적으로 수업 선택이 자유롭습니다. 그래서 저는 렉처와 세미나 수업들만 수강했습니다. 그런데 제가 들었던 세미나들은 생각보다 토론이 많이 요구되지는 않았고 렉처와 큰 차이가 없었습니다. 또 훔볼트는 문과대학에 도서관이 두 개 있고, 이과대학에도 도서관이 하나 있습니다. 세 도서관 모두 내부가 깔끔한 편이지만, 열람실 좌석이 적어 시험 기간에는 도서관에서 공부하기가 하늘의 별따기 수준입니다. 그리고 도서관에 들어가려면 가방을 사물함에 보관하고 책만 가지고 들어가거나, pvc로 된 투명 가방을 가져가야 한다는 점이 특이합니다.","훔볼트 대학교에는 국제처가 꽤나 크게 있습니다. 항상 상주하고 있는 직원 분들도 계시고 메일 답장도 유럽 치고는 신속한 편입니다. 하지만 문제가 발생했을 때, 다른 행정부나 교수님에게 문의하라며 제대로 된 답을 주지 않는 경우가 많아 답답하긴 했습니다. 그래서 급한 문제가 있을 때는 메일로 문의하기보다 직접 사무실에 찾아가는 게 훨씬 낫습니다.","훔볼트 대학교에는 따로 동아리가 없습니다. 그래서 본교 학생들과는 친해지기가 힘든 건 사실입니다. 그리고 멘자라는 학생 식당이 문과 캠퍼스에 두 개, 이과 캠퍼스에 한 개 있는데 가격이 정말 저렴합니다. 보통 파스타, 쌀, 감자, 소스, 튀김, 샐러드 등이 있는데 이 중에서 원하는 것을 담으면 담은 만큼 계산하게 됩니다. 적게는 2유로에서 많게는 6유로까지 내고 먹었던 것 같습니다. 또 커피, 케이크, 쿠키도 파는데 커피가 특히 싸서 자주 이용했습니다.","베를린에서는 독일어를 전혀 하지 못해도 생활하는데 아무 문제가 없습니다. 심지어 마트 직원분들조차 영어를 너무 잘하셔서 놀랐던 기억이 있습니다. 그리고 베를린에 외국인들이 정말 많이 살고 있어서인지 사람들도 상당히 개방적인 편입니다. 가장 놀랐던 점은 얼굴에 피어싱을 한 사람이 정말 많았다는 것입니다. 길을 걷다보면 10명 중 1명은 코나 눈썹에 피어싱을 하고 있습니다. 그리고 베를린 사람들은 다른 사람들의 외모에 전혀 신경을 쓰지 않습니다. 어떤 옷을 입던, 어떤 머리를 하던 쳐다보는 사람도 없고 친구들도 전혀 평가하지 않습니다. 또 베를린에서 놀란 점은 비건과 베지테리안이 정말 많다는 점입니다. 저희 플랫에서만 해도 고기를 먹지 않는 사람이 절반 이상이었습니다. 베를린에는 비건 식당과 카페도 한국에 비해 정말 많고 모든 식당에 비건 메뉴가 한 가지씩은 꼭 있습니다.",외국인 학생이 도움을 받을 수 있는 곳은 Orbis라는 국제처입니다. 훔볼트 대학교 메인 빌딩 1층에 오피스가 있어서 직접 찾아가도 되고 메일로 문의를 해도 됩니다.,"독일 비자는 한국에서 받아가는 게 아닙니다. 슈페어콘토(blocked account)를 개설할 준비를 하고 독일에 가서 발급받으면 됩니다. 슈페어콘토는 체류 기간의 생활비 전체를 넣어놓은 통장입니다. 이 통장 서류를 가지고 가야 비자를 발급받을 수 있고, 비자를 받은 후에 슈페어콘토에서 매달 정해진 생활비가 입금됩니다. 그리고 비자를 발급해주는 관공서에 항상 사람이 많기 때문에 한국에서 미리 테어민(예약)을 잡아가시길 추천드립니다. 개인적으로 저는 테어민을 잡지 못했기 때문에 새벽 2시에 관공서에 도착해서 기다리다가 오후 2시가 되어서야 비자를 발급받을 수 있었습니다."
