gen_info,env_info,food_info,study_info,office_info,facil_info,mhct_info,help_info,etc_info
"베를린 자유대학교는 베를린 남서쪽, 즉 도심과는 먼 곳에 떨어져 있습니다. 지하철 U3를 타고 Dahlem Dorf 역 혹은 Thielplatz역에서 내리거나 버스 X83, M11을 이용하는 다양한 방법이 있습니다. 베를린이 서울보다 큰 도시이긴 하지만 대중교통이 매우 잘 되어있어 1시간 내에 도심에서 학교로 갈 수 있습니다. 참고로 저는 기숙사에서 지냈는데 기숙사에서는 버스를 1번 갈아타고 가서 30분이면 도착하는 위치에 있었습니다. 학교 건물은 대체적으로 높지 않지만 학교 캠퍼스가 매우 큰 편이라 걸어서 다니기엔 다소 힘들 수도 있습니다. 그러나 교환학생을 위한 수업을 중심으로 듣는다면 거의 한 건물 내에서 이루어지기 때문에 큰 무리는 없으리라 봅니다.
베를린은 독일에서 동북부에 위치해 있기 때문에 일교차가 타 도시보다 심한 편입니다. 그래도 한국의 겨울날씨와 여름날씨와는 큰 차이가 없으므로 크게 걱정하지 않으셔도 됩니다. 겨울이 우리나라보다 다소 긴 편이지만 온도는 우리나라보다 따뜻할 때가 많아 옷만 잘 챙겨가신다면 크게 지내는 데 무리는 없을 것 같습니다. 여름엔 건조하고 해가 길어 좋지만 냉방 시설이 좋은 편이 아니라 강의실에 따라서 다소 덥게 느껴질 수 있습니다.","자유대학교는 도시 외곽에 있어 면학분위기에는 아주 좋은 편입니다. 지역 자체가 베를린에서 가장 부유한 지역이고 은퇴한 노인분들이 많이 사시는 곳이라 밤에는 인적 하나 없는데 흠이긴 하지만 전반적으로 아주 예쁜 독일 마을 풍경을 보실 수 있습니다. 캠퍼스는 중심 건물이 되는 Silberlaube 건물을 찾으시면 그 주변으로 찾아다니면 편한데요. 만약 교환학생을 위한 수업만 들으시면 그 건물 외에는 따로 갈 필요가 없습니다. 이 건물은 Dahlem Dorf 역에서 내려 5분 가량 걸으면 나오는데요. 그 주변으로 이과 계열 건물이 있고 주택가처럼 보이지만 각종 소수학과 건물들이 있습니다. Thielplatz역에서 내리시면 사회과학 건물들이 있는데요. 저는 경제학 수업을 주로 그 근처에서 들었습니다. 역과 역 사이에서 엄청 크게 느껴지실 수 있지만 걸으면 10분 정도밖에 안 걸려서 날씨가 좋을 땐 산책하기에도 좋습니다.
 학교는 캠퍼스가 잘 구성되어 있지만 주변에 식당이나 카페는 거의 없는 편입니다. 학생들은 주로 학교 내에 있는 멘자에서 식사를 하는데 멘자가 점심시간 (2시 반)정도가 지나면 거의 운영을 하지 않는 편이라 저녁을 해결하기엔 사실상 어려운 부분이 많습니다. 학교 도서관도 주중에 밤 10시까지 하는 게 가장 긴 편이라 학교에서 오래 공부하시려면 도시락을 싸 가지고 다녀야 합니다. 다만 Dahlem Dorf역 근처에 슈퍼마켓이 하나 있고 작은 식당이나 카페가 1~2개씩 있어 정말 배고플 때 이용하면 도움이 될 겁니다.","저는 학교에서 제공하는 기숙사에서 지냈습니다. 기숙사는 우리나라와는 달리 캠퍼스 안에 위치해있지 않고 학교 밖에 위치해있는데 이는 학교에서 기숙사를 관리하는 것이 아니라 베를린 시에서 관리하기 때문이라고 합니다. 기숙사 신청은 교환학생을 신청하고 나서 3달 정도 후에 신청할 수 있는데 신청기간에 학교에서 따로 이메일을 주어서 자유대학교 홈페이지를 통해 기숙사를 신청했습니다. 저는 기숙사에서 11개월 가량을 살았는데요. 일단 기숙사 월세가 매우 싼 편이라 이 점이 마음에 들었습니다. 베를린은 상대적으로 WG를 구하기 쉬운 편이나 최근 Miete가 급격히 올라가기도 했고 이사 다니는게 귀찮기도 해서 그냥 기숙사에서 머물렀습니다.
 제가 살았던 기숙사는 Goerzallee Strasse에 위치해 있고 이 건물은 6인 WG로 구성되어 있습니다. 화장실과 부엌을 공유하는 형태였는데 화장실과 부엌은 기숙사에서 주 1회 청소를 직접 해주셔서 아주 편했습니다. 다만 불편한 점이 있다면 처음 들어갔을 때 경우에 따라 식기류나 청소기구가 하나도 없는 경우가 있는데요. 이런 경우엔 ikea 같은 곳에서 모두 새로 구입해야 해서 비용이 만만치 않게 듭니다. 저는 운 좋게도 거기 살던 친구들이 모든 식기구를 갖춰두고 있어 저는 제가 쓸 수저나 그릇 몇 가지만 새로 사서 편했습니다. 
기숙사를 살면서 좋은 점은 다들 교환학생 친구들이라 서로 시간대도 잘 맞고 마음 맞는 친구를 잘 사귈 수 있는 데 장점인데요. 다만 독일인이 거의 없기 때문에 외국인이라는 점에서 방에 따라 영어만 쓰는 경우도 있고, 독일어를 쓰는 경우가 있습니다. 저는 방에 있는 친구들이 다 독일어를 잘 하는 편이라 독일어로만 대화를 했는데요. 저는 개인적으로 독일어를 많이 연습할 수 있어 그 점이 좋았습니다. 
 식사는 부엌이 따로 있기 때문에 알아서 밥을 해먹어야 합니다. 이 점은 어떻게 보면 저한테는 더 좋았는데요. 1년 동안 요리 실력도 많이 늘기도 하고 한국음식도 맘먹으면 쉽게 해먹을 수 있어 그 점이 좋았습니다.(참고로 베를린엔 한인이 많이 사는 편이라 아시아 마켓이나 한인마켓이 흔합니다.)그리고 친구들을 초대해서 밥을 해먹거나 같은 WG 친구들에게 식사를 대접할 수도 있어 그 점이 좋았습니다. 다만 제가 살았던 WG는 부엌이 작은 편이라 여러 명이 함께 조리할 때 불편하다는 게 단점이었습니다.","수업은 저는 주로 교환학생을 위한 수업을 들었습니다. 복수전공을 경제학으로 해서 경제학 수업을 듣기도 했으나 수업 난이도가 교수님에 따라서 차이가 많이 나고 시험을 준비하는 과정이 다소 힘들어 시험을 포기한 수업도 있었습니다. 자유대에선 수업을 듣고 시험을 포기해도 수업 이수를 포기하면 서류에 남지 않기 때문에 청강 수준으로 들어도 크게 무리가 없습니다. 자유대에 교환학생으로 오게 되면 굳이 시험을 치르지 않더라도 듣고 싶은 수업을 청강해보는 것도 좋은 기회인 것 같습니다.
 교환학생을 위한 수업은 주로 Silberlaube 건물에서 이루어지며 수업은 2시간 동안 이루어지는데 Akademische Viertel, 즉 15분 가량 정시보다 늦게 수업을 시작하고 15분 가량 수업을 일찍 끝내주시는 편이라 사실상 수업은 1시간 30분 정도밖에 되지 않아 부담이 별로 없습니다. 다만 수업은 모두 독일어로 진행되기 때문에 최소한 B1 이상은 되어야 수업을 따라가실 수 있습니다. 교환학생을 위한 수업은 독어독문학에서 준비하는 수업이라 사실상 독어독문학 수업이 많습니다. 그래서 독어독문과 학생은 수업을 연결시킬 수 있는 부분이 많습니다. 다만 교환학생을 위한 수업도 똑같이 독일 소설을 읽거나 텍스트를 읽어야 하고 매 시간마다 토론을 하는 경우가 많으므로 수업 준비를 잘 해가셔야 버벅거리지 않고 잘 들을 수 있습니다. 
 제가 마음에 들었던 수업은 어학수업이었는데요. 학기 시작 전에 6주간 진행한 intensive course와 학기 중에 진행하는 수업이 있는데요. 각자 수준에 맞춰 레벨테스트를 하고 수업을 진행합니다. 6주간 진행되는 수업은 매일 9시부터 1시까지, 학기 중에 진행되는 수업은 1학기 내내 매우 1회, 4시간씩 이루어지는데요. 어학수업에서는 친구들을 사귀기도 좋고 어학을 늘리는 데도 많은 도움이 됩니다. 특히 B2부터는 테마에 따라 어학수업을 선택해 들을 수 있는데요. 저는 1학기는 영화, 한 학기는 언론 수업을 들었습니다. 영화 수업에서는 베를린이 영화제로 유명한 만큼 영화박물관 견학을 가기도 하고 영화에 대해서 토론을 하기도 하고, 매주 영화를 보기도 했는데 어학에도 도움이 많이 되고 실제로 재밌게 수업을 하기도 했습니다. 언론 수업에서는 인터뷰를 하기도 하고 한 학기 동안 신문을 만들기도 했는데 글쓰기를 많이 연습할 수 있어서 개인적으로 실력을 늘리는 데 많은 도움이 되었습니다. 어학 수업 중에는 DSH 준비반도 있고 다양한 주제에 따라 수업이 나뉘어 있어서 개인적으로 선택해서 들으면 도움이 많이 될 것 같습니다.
 도서관은 주로 Silberlaube에 있는 뇌도서관에서 주로 수업을 했습니다. 개인적으로 인터넷을 통해 뇌 도서관을 봐온 지라 기대가 컸는데 생각보다 별로인 점도 많았습니다. 학생들이 조용하고 책도 많아 좋았지만 비나 눈이 오면 천장에서 물이 새서 다소 당황스럽기도 했고, 밤 10시까지밖에 운영하지 않기 때문에 시험기간엔 이 점도 불편하기도 했습니다. 특히 독일 도서관에선 책과 노트북 등 필기구를 제외하곤 외투와 가방을 들고 들어갈 수 없습니다. 그래서 입구 양 옆에 있는 사물함에 넣어두어야 하는데 동전 1유로가 없어 사물함을 이용하지 못했던 적도 있고 시험기간엔 학생들이 너무 많아 사물함 앞에서 30분 동안 기다리기도 했는데 이런 점들이 불편하기도 했습니다.
자유대에선 뇌도서관와 Universitaet Bibliothek 이 가장 큰 편이고 그 외에 학과마다 도서관이 따로 있습니다. 저는 학생이 많을 땐 경제학과 건물에 있는 도서관을 이용하기도 했는데 학교에서 쓰는 교재를 거기서 무료로 빌려 쓸 수 있어 책을 따로 사지 않고 볼 수 있는 점이 좋았습니다. 혹시 학교에서 먼 곳에 사는 경우엔 베를린 중심가에 위치한 훔볼트 도서관(Friedrich Strasse 역에 위치)이나 Tiergarten 근처에 위치한 TU 도서관을 이용하는 것도 좋습니다.","교환학생 등록을 하거나 등록 해지, 혹은 등록금을 낼 때 주로 이용하는 곳이 international office 인데요. Thielplatz역에서 내려 Silberlaube 가는 방향으로 가다 보면 작은 가정집 같은 건물이 있는데요. 거기 건물에서 Direkt Austauschstudenten들이 이용하는 쪽에서 문의사항이 생기면 문의하면 됩니다. 화요일과 목요일에만 운영해서 불편했는데 직원 분들이 매우 친절하셔서 저는 도움을 많이 받았습니다.","학교에는 멘자 외에서 Cafe가 몇 군데 있는데요. Silberlaube 2층 꼭대기에 올라가면 있는 Picafe는 분위기가 좋아서 수업시간에 거기서 커피를 마시면서 수업을 하기도 할 정도로 경치가 매우 좋습니다. 그 외에도 2층에 위치한 sport cafe도 있고 멘자 식당 옆에 위치한 작은 Cafe가 또 있는데 거기서는 간단한 간식거리도 사먹을 수 있습니다. 특히 멘자는 식당 칸이 매우 큰 편이라 거기 소파에서 잠자는 학생들도 있고 그룹 스터디를 하거나 노트북을 이용해 공부하는 학생들도 많습니다. 공부해야 하는데 도서관이 불편하거나 카페에 학생들이 가득 차면 그곳을 이용하면 편하게 쓰실 수 있습니다.
 학교에는 따로 동아리가 없고 학생들은 학교 수업이 끝나면 다들 바로 집에 돌아가는 경우가 많아 일반 독일 학생들과 사귀기가 사실상 힘듭니다. 다만 좋은 점이 있다면 자유대에서는 한국학과가 있기 때문에 거기서는 한국어를 배우고자 하는 독일 친구를 찾아 Tandem 활동을 하기도 하고요, 그들과 같이 어울려 놀 수 있는 기회가 많습니다. 저도 거기서 만난 친구의 도움을 많이 받기도 했고 많이 친해지기도 했습니다. 독일 학생들도 과에 따라서 작은 소모임이 있기도 하고 그들끼리 작은 동아리를 만들기도 한데요. 멘자 옆 게시판을 통해 찾아서 신청하면 모임에 참여하실 수 있긴 합니다. 
학교에서는 체육수업도 제공하는데요. 한국 학교에선 다른 과목처럼 체육과목을 선택해서 들을 수 있지만 여기서는 따로 돈을 내고 신청해서 들어야 합니다. 그러나 비용이 크지 않은 편이고 다양한 과목이 있어서 선택해서 매주 1회 들을 수 있습니다. 저는 요가, 재즈댄스 등을 들었는데요. 자유대에서 제공하는 강의는 조금 비싼 편이라 집이 가까우면 TU나 훔볼트 대학에서 제공하는 과목을 신청해 듣는 것도 좋습니다.",문화충격을 받을 정도의 기억은 별로 없지만 대중교통이 잘 되어있고 밤새도록 운영이 되어서 돌아다니는 데 매우 편했던 점이 좋았습니다. 그리고 베를린의 치안이 별로 좋지 않다고 들었지만 생각보다 안전하고 밤에 돌아다녀도 별로 위협을 느낀 적이 없어서 개인적으로는 한국에 있을 때보다 편하게 다녔습니다. 그리고 독일 사람들이 표정은 굉장히 차갑지만 도움을 요청하면 정말 잘 도와주시고 친절하셔서 그 점도 기대와 달라 조금 놀라기도 했습니다.,"사실 생각보다 행정적인 면을 제외하곤 학교에 도움을 받을 일은 거의 없습니다. 거의 스스로 해결해야 하는 일들이 많았는데요. 저는 문제가 생기면 주변 사람들을 통해서 가장 많은 도움을 받았고요, 기숙사에서 문제가 생기면 기숙사 건물 근처에 있는 Hausmeister에게 부탁해 도움을 받거나 같은 WG에 사는 친구들에게 부탁해 도움을 받았습니다.","베를린에서 지내면서 다른 독일의 도시들과 다르게 재밌었던 점은 주변에 즐길 만한 문화시설이 굉장히 많았던 점에 있습니다. 베를린 영화제 동안에 영화도 보기도 했고, 각종 음악축제 때 무료 공연을 보러 돌아다니기도 했고, 주변의 박물관을 구경하기도 했습니다. 특히 저는 교환학생을 위한 수업에서 각 수업마다 2~3번씩 Exkulsion으로 각종 박물관을 무료로 다니고 선생님이 그와 관련한 설명도 많이 해주셨습니다. 그래서 연극을 볼 기회도 많았고 박물관도 많이 다니고 베를린 역사와 관련한 지역도 많이 다니기도 했습니다. 개인적으로 관광하듯이 그런 시설을 볼 수 있지만 수업시간을 이용해 다닌다면 돈도 들이지 않고 선생님의 설명도 같이 듣고 같은 교환학생친구들과 같이 다닐 수 있다는 점에서 많은 도움이 되었습니다. 그런 기회를 놓치지 않고 베를린에서 지내면서 많이 즐길 수 있으면 좋겠습니다. 

이것 이외에서 필요한 정보가 있으시면 아래 주소로 연락주세요. 제가 아는 한에선 다 알려드릴게요.
rdw0608@naver.com"
