gen_info,env_info,food_info,study_info,office_info,facil_info,mhct_info,help_info,etc_info
"제가 한 학기동안 머물렀던 베를린 자유대의 교육학,인문학,어문학 건물인 Silberlaube는 Dahlem Dorf에 위치하고 있습니다. Silberlaube로 가는 길에는 사과나무가 가득해서 참 한적하고 예쁘다라는 느낌을 많이 들게 합니다. 위치는 베를린의 남부쪽에 있고, 전철과 버스 잘 연결되어 있습니다. 
베를린의 기후는 생각했던 것과 많이 달랐는데, 한 마디로 변화무쌍하다고 보면 됩니다. 6월까지도 기온이 10도 정도 되고 흐린 날이 많았습니다. 하지만 날씨가 갑자기 더워지는 경우가 있어 당황했던 경우도 있습니다( 학교에는 에어콘이 전혀 없거든요^^)","대학 주변 환경은 조용한 주택가이고, 조금 가다 보면 우체국, 영화관, 슈퍼마켓이 있습니다. 루이제라는 맛있는 피잣집과 학교 식당인 멘자 옆에 이태리 레스토랑이 있습니다. 멘자가 문을 비교적 일찍 닫아 몇 번 갔던 기억이 남니다.","Erasmus가 아닌 Direktaustauschstudenten, 즉 유럽 외 교환학생들은 대부분 Celsiusstrasse에 배정받게 됩니다. 처음에 너무 조용해서 당황했던 것이 기억나는데, 서로간의 교류도 뜸한 편입니다. 이 곳은 원룸이라 TV, 냉장고와 기본적인 식기가 다 갖추어져서 편하지만, 베를린 시내랑 무척 떨어져있습니다. 그래서 1년으로 온 교환학생들은 대부분 1학기만 그곳에서 생활하고 WG로 이사가는 것을 많이 보았습니다. 매우 안전한 동네이긴 하지만, 밤 10시만 되어도 길거리에 사람이 하나도 없고 어두침침해서 약간 무서웠던 적이 많습니다. Celsiusstrasse에서 살면 자신이 정말 적극적으로 사람들을 초대하면서 만날 기회를 많이 만들어야합니다. 자신만의 쉴 공간이 있는 것은 좋지만, 저는 다시 간다면 WG를 선택하겠습니다. 참, 지하에 있는 세탁기도 한 번에 이용할 때 3유로씩 하니 친구 여러명이 사는 WG를 구해서 들어가는 것이 훨씬 재미있을 것 같습니다.

저는 한식이 먹고 싶을 때에는 Friedrichstr.에 있는 ISHIN에 가서 Ceyro 를 즐겨먹었고,(일본식 비빔밥이지만 저렴하고 맛있음) 로타리라는 한식집도 자주 갔습니다.","어렸을 때 독일에서 살다 왔기 때문에 수업을 따라가는데 큰 어려움이 없었지만, 나중에 레포트를 낼 때 고생을 했습니다. 또한 저는 교육학 학점이 급한지라 교육학 수업만을 들었는데, 지금 생각해보면 교환학생으로 가서 한국에서 들을 수 없는 수업을 듣는 것도 좋을 것 같습니다. 영어수업은 우리 학교보다 적게 개설되어있지만 잘 찾아보면 있습니다.. 참, 독일은 학제가 우리 나라와 매우 다르다는 점을 꼭 명심하세요. 독일학생들은 몇몇 수업에서만 성적을 딸 필요가 없기 때문에 그냥 출석만 하는 경우(Teilnahmeschein)가 많습니다. 하지만 교환학생들은 benotete Scheine가 필요하기 때문에 시험도 봐야하고, 우리 나라의 레포트보다 더 학문적이고 자신만의 Theorie가 담긴 글을 제출해야 합니다. 경우에 따라서는 꼭 발표도 해야하구요. 우리 나라에서는 2학점으로 치는 수업이 예상보다 많이 빡빡하고 할 것이 많습니다. 저는 한 학기 동안 6개의 benotete Scheine를 만들었지만, 이는 독일대학생들사이에서도 한 학기 치고 매우 많은 분량이라고 들었습니다. 베를린은 역사적으로, 문화적으로 정말 배울 것과 볼 게 많은 최고의 도시이니, 수업과 적절하게 병행하는 것이 좋을 것 같아요~^^
참, 모든 수업은 3번 이상 이유없이 결석하면 무조건 F입니다. 이것도 교수님에 따라 다르긴 하지만, 우리 나라와 달라 당황스러운 점이었습니다. 
저의 경우에는 Vorlesung 하나와 세미나 5개를 들었는데 Vorlesung의 경우
교실이 꽉 차고 바닥에 앉아서 수업을 들어야할 때도 있어 토론을 많이 할 수 있는 세미나가 더 좋았습니다.
그리고 HU나 FU에서 개설하는 영어,스페인어,일본어 특별강좌 등이 있는데 학기초에 빨리 마감되기 때문에 일찍 신청하는 것이 좋습니다. 참, Hochschulsport의 배드민턴도 추천합니다.","국제교육부의 문 여는 시각을 반드시 잘 알아두셔야 합니다. 직원 수가 적다보니 다소 어수선한 느낌을 주기도 하지만, 문제나 질문이 있으면 주저하지 말고 무조건 적극적으로 문의하는 게 좋습니다. 셰프카 씨와 타마라 시불스키 씨가 친절하게 도와줍니다.","Internationaler Club이라는 교환학생을 위한 동아리가 있는데, 각종 재미있는 행사를 많이 해서 좋았던 기억이 납니다. 이 곳에서 열린 오티 때 사귄 친구들과 한 학기 내내 베를린 내의 카페와 맛집,벼룩시장,박물관 등을 함께 돌아다녔습니다. 그리고 부활절, Pfingsten 등과 주말 때를 이용해 저가항공을 타고 덴마크, 스페인, 영국, 이태리 등을 돌아다니며 신나는 여행도 할 수 있어 좋은 추억을 많이 만들 수 있었습니다. 
누차 말하지만 베를린은 독일사람들의 말대로 multi-kulti한 곳이라 다양한 문화체험을 할 수 있어 좋습니다. 특히 좋은 음악회와 이벤트,행사가 열려 늘 눈과 귀가 즐겁습니다. 저는 아기자기한 가게가 많고 활기찬 Hackescher Markt와 Zoo 역 등을 자주 갔습니다. 그리고 Friedrichstr.에 있는 Dussmann이라는 책방은 자정까지 문을 열기 때문에 책보기에 좋습니다. 일요일에는 거의 모든 상점들이 문을 닫지만 Hauptbahnhof는 늘 열려있어 쇼핑할 수 있습니다.",특별히 충격이라고 할 만한 것은 없었지만 수업 시간 중 대부분 쉬는 시간이 없어 학생들이 자유롭게 들락날락거리는 것이 신경이 많이 쓰였습니다. 그리고 자유대도 사이버강의실이 보편화되어 있어 수업자료를 늘 프린트해가야하는데 학교 컴퓨터실인 Zedat의 경우 심하면 프린트물이 한 시간 있다가 출력되기 때문에 덜 붐빌 때 출력하는 것이 좋습니다. 그리고 학교 도서관을 쓰려면 늘 사물함을 이용해야하기 때문에 1유로를 늘 가지고 다니는 것이 좋습니다. 답답하고 이해가 안갈 상황이 발생할 수도 있지만 여유를 가지고 한 발짝 물러서서 인내심을 가지고 적극적으로 행동하는 것이 좋습니다.^^,자유대에는 우리 나라 교수님들과 유학생 분들 여럿 계시기 때문에 모르거나 어려운 일이 생기면 도움을 청하세요^^,"한 학기면 모두가 짧다고 하지만, 사실 길면 길다고도 할 수 있습니다. 한 학기뿐이라고 마음을 급하게 먹을 것이 아니고, 여유를 가지고 힘들더라도 즐기려는 자세가 중요합니다. 베를린은 독일 내에서도 물가가 싼 편이기 때문에, 한국에서는 먹어볼 수 없는 여러 나라의 음식과 각종 멋진 뮤지컬, 전시회를 마음껏 구경할 수 있습니다. 타지에 있으면 아무래도 외로움에 잘 빠질 수 있지만, 그런 때 일수록 긍정적으로 생각하고 집밖으로 나가 베를린의 매력이 넘치는 거리를 느끼라고 말하고 싶습니다. 유럽과 전 세계에서 수많은 교환학생들이 오기 때문에 자기가 먼저 적극적으로 나서는 자세도 필수이구요."
"이미 앞에 분들이 설명해 주셨듯이 대학 건물은 시내 곳곳에 흩어져있습니다. 베를린 시내에는 크게 자유대학(FU), 훔볼트 대학(HU), 공과대학(TU) 등의 대학이 있고, 자유대학의 경우 캠퍼스가 베를린 시내 남서부에 흩어져 위치하고 있습니다. 자유대학이 아닌 베를린 시내의 다른 대학에서 수강하는 것도 가능합니다. 
저는 겨울 학기 동안에만 독일에서 생활하였는데, 이상고온으로 날씨가 매우 온화했습니다. 일반적으로 독일의 겨울은 습도가 높고 춥다는 평가를 받습니다. 가을에는 부슬비가 매우 자주 왔습니다.","베를린 시의 크기는 꽤 큰 편이고 300만 명 정도의 인구가 살고 있습니다. 대도시이며 수도이지만 시내 어느 곳에서도 사람들과 차로 크게 붐비는 곳은 없습니다. 매우 한적하고 여유로운 느낌을 줍니다. 도시 내 여러 곳에 숲과 위치하고 있어 쉼터를 제공합니다. 학교 근처에는 Schlachtensee와 Wannsee 등이 위치하고 있습니다.  
자유대학이 위치한 Dahlemdorf는 매우 한적하며 주택가가 주를 이루고 있습니다. 시내 중심가까지는 U-Bahn을 타고 어렵지 않게 갈 수 있습니다.","연세대학교와 자유대학교 사이에 체결된 교환협정을 통해 개인 아파트가 무료로 제공됩니다. 아파트 내에는 부엌(식기구 포함), 욕실이 모두 구비되어 있습니다. 별도로 밥통과 젓가락만 구하시면 됩니다. 학교에서 30분 정도 거리에 위치하고 있으며, 집에서 학교로 가기 위해서는 S-Bahn을 탄 후 버스로 갈아타야 합니다. 학기 초에 Semesterticket을 구입한 후, 베를린 내 시내 교통을 자유롭게 이용할 수 있습니다. 
  점심식사는 대체로 중심 건물인 Silberlaube 내에 위치한 학생식당(Mensa)에서 해결했습니다. 보통 2.5-3유로 정도의 가격에 해결할 수 있었습니다. 저녁의 경우 집에서 교환학생 친구들과 함께 자주 만들어 먹었습니다. 슈퍼마켓에서 판매하는 식료품들의 경우 대체로 한국보다 조금 싼 편입니다. 외식비는 대체로 한국보다 조금 비싸다는 느낌을 주나, 그리 비싸진 않습니다. 베를린 시내에 한국 상점과 식당들이 여러 군데 있습니다.","수업은 Vorlesung과 Seminar로 크게 나뉩니다. 개설되는 수업의 주제는 매우 다양하고 질도 매우 높습니다. Vorlesung의 경우 한 차례의 학기말 시험을 통해 학점이 부여되며, 대체로 일주일에 2시간 수업합니다. Seminar의 경우 수업시간이 보다 다양합니다. 수업 분위기는 한국보다 훨씬 화기애애합니다. 절대 평가 제도이기 때문에 가능하다는 생각이 듭니다. 교수님들도 매우 인격적이란 느낌을 받았습니다. 제가 경험한 바로는 교수님들이 학생의 어려움과 상황을 잘 배려해주며 학생과 함께 과제를 해결해나가고자 했습니다.  
학교 내에는 여러 도서관이 있습니다. Silberlaube 내에 위치한 Philologische Bibliothek은 근래에 건립되었고 매우 쾌적한 환경을 제공합니다. 다만, 주말에만 대여가 가능합니다. 책을 빌리기 위해서는 Uni. Bibliothek을 방문해야 합니다. 시내에 위치한 여타 도서관에서도 대여가 가능합니다.",매우 친절하게 교환학생의 모든 복지 상황을 책임져줍니다. 어려움이 있을 경우 도움을 청하는 것을 주저하지 마십시오. 학기 초에 학교 생활에 대한 정보를 제공해주는 행사를 하는 데 가급적 꼭 참석할 것을 권하고 싶습니다. 이 때 연대에서 교환학생을 했던 학생과 연결해주는 시간도 갖습니다. 저는 그 행사에서 한국어-독일어 언어 교환 친구를 사귈 수 있었습니다.,정기적으로 운동을 하고 싶다면 Hochschulsport를 수강는 것이 좋습니다. 그 외의 방법으로 여타 운동 시설을 이용하는 것은 불편한 것 같습니다. Hochschulsport의 경우 매학기가 시작할 때 별도의 수강편람이 배부됩니다. 멘자 옆을 비롯한 학교 내 곳곳의 게시판에서 수시로 다양한 정보를 구하실 수 있습니다. 여러 활동에 대한 다양한 정보들을 게시판에서 구할 수 있습니다.,특별한 문화충격을 없었습니다. 동성애자인 학생들을 종종 만날 수 있습니다. 크게 충격을 주는 상황은 아니었습니다.,"내에 한인들이 많이 살고 있습니다. 한인 교회들이 곳곳에 위치해 있고, 매달 한인 회보가 나올 정도로 한인 사회가 잘 발달해 있습니다. 학교 내의 도서관 문 앞에 항상 모여서 대화를 나누는 한국 유학생 분들과 쉽게 마주칠 수도 있을 것입니다.",
"우리나라의 캠퍼스 대학들과는 달리 시내의 곳곳에도 대학건물들이 있습니다.지하철역과 버스등이 바로 대학건물 앞에서 정차하기 때문에 정거장에서 내려 학교 건물까지 걸어들어가는 시간이 상당히 짧습니다. 위치적으로 편할 뿐 아니라 넓은 복도, 시원스레 큰 강의실 등이 대학의 크기를 말해주듯 시설적인 면에서도 좋습니다. 
독일도 우리나라처럼 사계절이 있기에 기후면에서 적응하기에는 전혀 어려움이 없을 것 같습니다.",앞서 얘기했듯이 학교 옆에는 이동에 편리한 교통시설이 가까이 있습니다. 그러나 베를린이 상당히 크기 때문에 학교가 위치한 북서 베를린에서 시내 중심까지의 거리는 지하철로 15~20분 정도 소요됩니다. 그래도 학교 주변에는 간단히 필요한 모든 것을 쉽게 구매하실 수 있습니다.,"FU 대학으로 가시는 분들은 이미 숙식비를 제공 받습니다. 
제공받는 기숙사는 일반 대학생들이 머무는 공동 부엌,화장실 이용인 기숙사처럼 이웃과의 소통이 바로 직면하는 곳이 아닌 개인 부엌, 화장실 이용이기 때문에 깨끗이 편리하게 이용하실 수 있습니다. 저같은 경우는 한학기는 기숙사에서 살았고 나머지 다른 학기는 독일가족의 집에서 살았습니다. 그랬더니 약 300유로 가까이 하는 그 기숙사 월세(?)에서 175유로 정도되는 돈을 또 따로이 제공해 주기도 했습니다. 
식사는 당연 자신이 직접 해야 합니다. 그래도 그 그 기숙사에서 이미 부엌살림은 갖춰져있기에 따로이 뭔가를 들고가실 필요는 없을 듯 합니다.
그래도 경험 상 몇가지 추천하고 싶은 것은...
밥솥(밥은 자주 해 드신다면), 젓가락(이건 없습니다), 그리고 잘 썰리는 칼 정도 되겠습니다.","수업은 자신이 직접 짤 수 있습니다. 매 학기마다 인터넷과 서점에 전 학과에 따라 개설된 학기시간표가 나옵니다. 그것을 보고 자신에 맞는 수업을 들으시면 되겠습니다. 
도서관은 (독어독문학과인 경우) 문과대 건물 중앙에 (학교 식당 바로 근처)에 위치에 있어 편리합니다. 그리고 들어가실 땐 사물함에 입고 계시던 외투와 가방은 넣고 들어가야 합니다.","위치한 곳은 학교 건물과 그리 멀지 않습니다.
그러나 주의하실 점은 월~금요일 상담시간이 달라 유의하시고 방문하셔야 합니다","매 학기 스포츠 수업이 굉장히 다양하고 체계적으로 구성되어 있습니다.
가격도 학생인 경우 매우 저렴하기에 추천하고 싶습니다","교환학생을 가기 전 이미 한번 독일에 거주한 경험이 있었기에 그리 큰 문화충격을 받진 못했습니다.
딱히 말하라고 하면... 같은 교환학생으로 온 친구들 중에 게이라던가 레즈비언 친구들이 종종 있었는데 처음엔 처음 보는 사람들이기에 놀라움이 적지 않았습니다. 그러나 친구가 되고 보니 이해를 하게 되었다고 할까? 그정도 입니다","한인이 굉장히 많습니다. 
지나가면서도 한국말을 쉽게 들을 수 있을 정도니까요.
도움이 필요하실 땐 학교 '한국학과'(Koreanistik)를 가셔서 그곳에서 근무하시는 분들께 도움을 요청하시는 것도 한 방법이라고 생각됩니다.",
