gen_info,env_info,food_info,study_info,office_info,facil_info,mhct_info,help_info,etc_info
"University of Copenhagen (KU) 는 덴마크 수도 코펜하겐에 위치하고 있어요. 캠퍼스는 시내에 4개로 나누어져 있습니다 (City Campus, Amager campus, Frederiksberg campus, Norre campus). 관련된 전공에 따라 캠퍼스가 정해집니다. 네개의 캠퍼스 다 시설이 잘 갖추어져있지만, 전반적으로 아이들이 새로지은 Amager 캠퍼스를 더욱 선호했습니다. 저는 City 캠퍼스에서 공부했는데 시내 중심지에 자리해있어 장소는 가장 좋은것 같아요. 하지만 코펜하겐 자체가 그리 크지 않기 때문에 시내 중심지에 있지않아도 이동시간이 길지 않아요. Amager 캠퍼스는 유리로 도배된 모던한 건물이라면 City Campus 는 예전 병원이었던 곳을 개조한 곳이라 오래된 건물에 건물안에서 길이 복잡하여 가끔 길을 잃기도 합니다 ㅠㅋ 그리고 대학교 안의 화장실은 모두 남녀 공용입니다. 성평등을 위해서 그렇게 한것이라고 하네요. 
교환 프로그램으로 연결된 유럽나라들중 영어가 1번인 네덜란드 노르웨이 스웨덴 인 나라들과 비교했을때 덴마크의 장점은, 네덜란드도 평지에 자전거의 나라로 유명하지만 네덜란드에는 자전거가 너무너무 많고 덴마크 자전거 질서가 더 좋다고 하네요. 또 덴마크의 장점은 안전하다는거. 그리고 노르웨이와 비교했을때 그나마 북유럽에서 싼 물가? 노르웨이는 덴마크의 거의 두배라고 합니다. 스웨덴이 북유럽에선 그래도 물가가 쌉니다. 스웨덴은 좋지만 여행다닐때 조금 불편한 면이 있습니다. 여행을 많이 다니시고 싶으시다면 덴마크를 조금더 추천합니다 :) 
기후는 겨울에 그렇게 생각만큼 춥지않고 딱 한국만큼 추운것 같습니다. 여름에도 몇일 조금 더운날 빼고는 대부분 봄, 가을 날씨로 아주 좋습니다. 하지만 바람이 정말 많이 불기 때문에 가끔 걷기 힘든만큼 바람이 붑니다. 
그리고 겨울에는 해가 10시쯤 뜨고 3시쯤 집니다. 하지만 여름에는 3시에 떠서 11시반까지 떠있을 때도 있어요. 하루가 이렇게 길었나 하는 경험을 하실수 있습니다.",시내 캠퍼스 주위경우 시내중심지에 있기 때문에 신촌 같은 곳입니다. Norreport 역은 거의 만남의 장소가 되구요 식당이나 쇼핑 바 같은곳도 대부분 여기에 위치하여 있습니다. 코펜하겐은 많이 크지 않기때문에 자전거가 있다면 구석구석 돌아다니면서 도시와 자연을 한꺼번에 즐길수 있습니다. 가끔 자전거를 타고 돌아다니다보면 숨은 베스트 장소들도 찾을 수 있어요 :),"저는 Signalhuset 이라고 시내에서 자전거타고 20-30분, 전철타고 15분정도 거리에서 살았어요. Signalhuset은 학생아파트입니다. 여기선 Kollegium 이라고 하는데 모두 다른 학교의 학생들이 모여서 사는 학생들만 사는 아파트입니다. 코펜하겐에는 이런 학생아파트가 많습니다. 
Signalhuset은 한 아파트에 4명이서 한집을 나누어 쓰는 형식이고 각자 개인방이있고 화장실이 두개이기 때문에 2명당 하나씩 나누어 씁니다. 아파트가 남녀로 구분되지않고 한집에 남녀 섞일수 있습니다. 화장실 같은경우는 플랫메이트들과 상의해서 만약 남자 2명 여자 2명이면 화장실을 성별로 나누어 쓰실수도 있어요. 하지만 대부분 그냥 상관안하고 섞어서 씁니다. 하지만 지저분한 플랫메이트와 걸리면 조금 힘들때도있어요. 거실과 주방은 공용입니다. 집분위기는 플랫메이트들에 따라 다른것 같아요. 저희 룸메이트들은 서로 자유분방한 분위기로 거실에서 같이 활동도 많이하고 같이 밥도 해서 먹고 같이 영화도보고 놀기도 하고 파티도 하고 그랬어요. 서로간의 교류가 많았는데 덴마크인들 같은경우는 조금 낮을 가린다고 해야하는지 서로간의 교류가 적은 집도 있습니다. 또 거실에서 시끄럽게해도 방문을 닫으면 방음이 잘되어있기때문에 문제가 없어요. 저는 처음에 왔을때 베개도 없고 이불도 없고 있는게 없어서 준비가 될때까지 조금 힘들었어요. 하지만 다행이 앞에 Fields 라는 북유럽에서 가장 크다는 백화점이있고 거기에 이마트처럼 대형마트인 Bilka 가 있어 거기서 다 해결했습니다. Ikea 같은경우는 멀기도하고 물건이 크거나 무거우면 가지고 오기 불편합니다. 또 학생기숙사인만큼 Signalhuset 에서는 같이 교환으로 온 친구들이 많이 살았는데 친구집에 놀러가기도하고 친구를 초대하기도하고 재밌는 일들이 많습니다. 안좋은 점이라면 시내에서 조금 멀다고 할수있는데 저는 불편함을 겪지는 못했어요. 또 근처에 전철역과 기차역이 둘다 있기때문에 공항도 10분안에 갈수있고 전철은 24시간이기 때문에 교통에는 전혀 문제가 없는것 같습니다. 또 새로 개발하는 곳이기때문에 건물들이 대부분 모던합니다. 시내와는 다른분위기이고 Amager 섬쪽은 바람이 많이 부는 지역이기때문에 바람도 많이 붑니다. 또 동쪽으로는 Amager 바다가있어서 바다도 가기 좋습니다. Vest Amager 쪽에는 큰 공원이 있어 그쪽에서 자전거 타고 돌아다니면 아주 좋습니다. 특히 해지는 노을에 추천드려요 :) 

식사는 대부분 집에서 요리를 해먹는 위주입니다. 한국에 비해 친구들과 함게 놀수있는 것이 바나 클럽같은것 이외에는 잘 없기때문에 대부분 친목활동들이 집에 초대해 같이 요리하고 밥먹는 것입니다. 그리고 그다음에 놀러나가요. 요리를 해먹으면 식비는 그렇게 비싸지않은것 같아요. 가끔은 한국보다 더 싸요. 또 한인 식당이 있기때문에 한국음식을 먹고싶을때 가끔 가셔도 되지만 비싸기때문에 조금 부담이 됩니다 ㅠ 
잘찾아보면 시내에 월요일 50% 할인되는 식당도있고 가격대비 양이많은 좋은 식당들도 많아요.","수업은 Pre-Danish Course, Psychological Testing, Danish Culture Course, 그리고 East meets West 수업을 들었습니다. 
Pre-Danish Course 를 저는 추천합니다. 학기 시작전에 여러 다른과 친구들과 함께 모여 다같이 처음으로 덴마크어를 접하며 공부하기때문에 서로 나중에 많은 도움도 되고 또 학기 시작전이라 다들 바쁘지 않아서 같이 적응하고 놀러다니기 때문에 가장 친해지는 친구들이기도 한것 같습니다. 
Danish Culture Course 는 P/NP 수업이고 시험이 없어 많은 친구들이 신청합니다. 그리고 중간중간에 야외수업들도있는데 그것들은 덴마크 성이나 영화보기 등 이 있습니다. 대부분 주말마다 이루어지는데 참가하지않으면 결석이 됩니다. 스트레스 받지않고 코펜하겐에서 갈 수 있는 중요 장소들을 친구들과 공짜로 갈 수 있다는 장점이 있어 이 수업을 추천합니다. 
나머지 전공 수업들은 정말 덴마크 사람들이 얼마나 자율적인 공부를 하는지 느낄 수 있을 정도로 자유롭습니다. 출석체크는 대부분 하지않고, 중간 시험도 보지않았고 에세이를 10~15장 써내는 형식이에요. 
각 캠퍼스 마다 도서관이있고 또 시내에 가장 큰 유명한 블랙다이아몬드 도서관이 있습니다. 덴마크 주민등록증? (CPR) 카드와 학생증이있다면 책을 빌려보거나 들어가기 쉽습니다. 블랙다이아몬드는 꼭 한번 가보세요. 그리고 교재같은 것들을 교수님들께서 복사본을 주신다거나 하지않고 커리큘럼에 적혀있는 리딩들을 다 찾아서 알아서 복사해오는.. 식도 있습니다 ㅠ 관련된 책이 도서관에 있다면 학과 도서실 가면 과목별로 모아논 곳이 있는데 거기에서 책을빌려 한시간내에 필요 분량을 직접 복사해서 반납하면 됩니다. 조금 복잡하고 귀찮기는 하지만 한국처럼 복사해주는곳이 없기때문에 직접 다 복사하셔야한다는 단점이있습니다. ㅠ",국제처는 처음에 학생증을 받으러 갈때와 덴마크 문화수업 신청을 하러 간것 외에는 별로 없습니다. 하지만 여러가지 도움이 필요하다면 친절히 도와줍니다. 하지만 주의하실것은 3시쯤 문을 닫습니다.,"제일먼저 가시면 immigration center를 가셔서 여권에 stamp를 받으시고 (스탬프는 줄안스셔도되니까 관련된 부스에가셔서 그냥 기다리시면되요) 그리고 Kobenhavn Kommune 가셔서 CPR 번호를 받으시고 학생증은 국제처에서 받아 학교 컴터실가서 학교 컴터사용 아이디와 비밀번호를 받아 개통하시고 본인 아이디에 돈을 입금하여 복사하실수 있어요. 입금은 학교컴퓨터에서 가서 개통하신 덴마크 카드로 바로 입금가능합니다. 그리고 복사할때 넣어야하는 학생증 비밀번호는 처음에 받으신 4자리수 숫자에요.  
동아리들이 있기는 하지만 찾기도 힘들도 정보가 잘 없습니다. 멘토가 있으시다면 하시고싶은 활동에대해 말을 하고 혹시 할곳이있는지 물어보는것이 가장 빠를것 같아요. 아니면 페이스북에서 과그룹에 올려두시면 사람들이 정보를 댓글로 달아드립니다. 저는 기숙사 근처 fitness.dk 헬스장에가서 회원등록을 하고 수영이나 헬스등 운동을 했어요.",사람들이 서로를 믿는 사회가 정말 있고 실현가능하다는것에 놀랐고 또 외국 친구들과 같이 생활하면서 사소한 다른점들에 많이 놀라기도 했습니다. 하지만 큰 문화충격이라고 할것은 없었습니다. 알고는 있지만 실제로 그렇다는것에 놀라는 정도? 하지만 정말 일처리가 느리고 특히 한국에서 택배를 받았는데 배달 서비스도 없어서 짐을 들고오는데 고생했던 기억이 있어요. 한국처럼 편리한 서비스가 있지는 않습니다. 또 해가뜨면 이사람들이 다 어디에있었나 할 정도로 공원이나 바닷가 길거리에 부쩍 사람이 많아집니다. 또 정말 여러가지 이벤트가 많기 때문에 친구들과 함께 참여할 곳이 많습니다. 또 자유롭고 평등한 나라인만큼 파티나 행사에 덴마크사람들의 아이디어나 재치에 놀랄때도 있습니다. 또 아이러니하게도 세계에서 가장 행복한 나라중 하나인 반면 자살률이 높은 나라이기도 합니다.,"같은 시기에 시작한 교환학생들이나 미리 가있었던 교환학생들도 도움이 많이되고 같은 룸메이트나 플랫메이트도 도움이 많이 됩니다. 교환학생들은 같이 같은 문제를 해결해나가며 여러가지 정보를 받고 미리 가있었던 교환학생친구들이 가끔 또 자신이 먼저 겪었던 만큼 더 적극적으로 도와줍니다. 그리고 저 같은경우에는 플랫메이트가 덴마크인이어서 덴마크어 관련된 문제가 있으면 부탁할수있었고 여러가지 도움이 많이 되었어요. 
그리고 한인모임도 많은 도움이 되었습니다. 매 학기초에 한인모임이 있는데 거기서 만난 한국인들과 가끔씩 만나 한국음식도 먹고 또 가끔 문화적 차이나 말이 필요없이 도움이 필요할때 많은 도움이 되는것 같습니다. 또 돌아와서 덴마크에서 만났던 사람들을 만날때 신기하고 좋은것 같아요. 또 같이 가는 연대교환학생들이 많이 도움이 되는것 같습니다. 덴마크 가기전 부터 갔다 오고 난 후까지 같이 준비할것도 많아서 서로 도움이 많이 되는것 같습니다.","제 대학생활중 잊을 수 없는 순간이 있다면 덴마크 교환학생 경험이 아닐 까 싶어요. 꼭 좋은일들 만 있는 것이 아니지만 그 만큼 많은 경험도 하고 많은 사람들을 만나고 많이 배워오는것 같아요. 아주 소중한 경험이 된것 같습니다. 자전거를 못타시더라도 같이 못타는 친구들도 있고 친구들이 잘 가르쳐주기때문에 같이 배워서 중고 자전거 400-700 크로나 사이에서도 좋은거 사실 수 있으니까 꼭 사셔서 친구들이랑 도시 구석구석 여행도 다녀보세요. 
혹시 더 궁금한 사항이 있으면 꼭 연락주세요! (oksk1230@gmail.com)"
"코펜하겐 대학교는 덴마크 내에서 알아주는 학교입니다. 제가 알기로는 경제학과 등의 경우에는 스칸디나비아에서 1위, 유럽에서도 10위 내에 듭니다. 
또 코펜하겐이라는 도시는 덴마크의 수도로서 문화적으로 다양한 경험을 할 수 있고, 국제적인 행사도 많이 펼쳐지는 곳입니다. 유럽의 북쪽에 위치하므로 우리나라에 비해 날씨는 많이 춥습니다. 겨울에 한 세 달 동안은 눈도 많이 오구요(눈발을 가르며 자전거를 타고 가는 초인적 경험을 하시게 될 것입니다ㅋㅋ). 겨울철에는 해도 3~4시 쯤에 집니다. 반대로 여름철의 경우는 해가 길고 밤 늦게 까지 돌아다니셔도 거리에서 활기찬 기운을 느끼실 수 있을 것입니다.","코펜하겐 대학교는 크게 4군데로 이루어져 있는데, 저의 경우는 Amager 캠퍼스와 시내 캠퍼스에서 수업을 들었습니다. Amager 캠퍼스의 경우는 Amager (섬) 지역에 있는 것인데, 상대적으로 새로운 지역이므로 주로 주거 지역이 많고, 문화 공간보다는 새롭고 모던한 건물들이 많습니다. 시내 캠퍼스는 말 그대로 시내에 있기 때문에 시내의 모든 문화 공간, 쇼핑 공간 등에 도달하기 쉽습니다. 저는 개인적으로 자전거로 학교에 가서 수업 후 친구들이랑 여러 지역에 놀러다니는 것이 너무 좋았던 것 같습니다.","저는 대학교에서 연결해준 집에서 지냈습니다. 30살 덴마크 여성과 같이 1년동안 집을 share했습니다. 그 분 집에서 방 하나를 빌려쓰는 형태인데요, 부엌과 화장실 등을 같이 쓰고 청소도 번갈아 가면서 같이 했습니다. (이것을 Private Housing이라고 부릅니다) Dormitory 에 사는 친구들이 가끔 파티하고 그런 것이 좋아보이기도 했지만 저의 집 주인이 너무 좋았기 때문에 1년동안 아무 탈없이 재밌게 잘 지냈던 것 같습니다. 둘이 살기 때문에 어떤 사항들에 대해서 서로 배려하면서 조정할 수 있기 때문에 프라이버시도 있고 좋은 것 같습니다. 어떤 친구들의 경우 저처럼 Private Housing을 했는데 안 좋은 경우도 많았기 때문에 혹시 그런 경우 빨리 다른 집을 구하시는 게 좋을 것 같습니다. 
식사의 경우 외식이 많이 비싸기 때문에 주로 집에서 해먹는 게 편합니다. 식재료의 경우 많이 비싸지 않고, 외국 친구들과 요리를 해먹으면서 친해질 수 있는 게 좋았습니다. 유럽인들의 경우(특히 학생의 경우) 점심 식사를 집에서 샌드위치를 간단히 준비해 외출하는 경우가 많은 것도 참고하시면 좋을 것 같습니다.","수업은 많이 길지 않습니다. 보통 일주일에 3시간 정도 (한 번) 수업하고 7.5 ECTS 학점을 취득합니다. 학생들이 수업시간에 많이 집중해서 듣는 편이고, 한편으로는 수업에 빠지는 학생도 많습니다. 덴마크 학생들은 일과 학업을 병행하는 경우가 많아 일하는 시간이 겹치는 경우 보통 수업을 잘 빠집니다. 그래도 개인적으로 공부를 해서 시험은 다들 치는 경우가 많습니다. 시험은 종류가 크게 Written 과 Oral 이 있는 데 과목 신청을 할 때 보통 언급이 되기 때문에 그것도 미리 확인하시면 좋을 것 같습니다.
도서관은 보통 faculty 마다 하나 씩 잘 되어있고, 왕립 도서관도 시내 곳곳에 자리하고 있으니 집에서 가까운 곳을 이용하시면 좋습니다.","제 경우 국제처는 처음에 student ID-card를 수령할 때에 밖에 가지 않았습니다. 하지만 도움이 필요하시면, 많은 도움을 받으실 수 있을 것 같습니다. 오후3시까지 여는 것만 잘 기억하시고 가시면 좋습니다. 아니면 다른 교환학생 친구들에게나 (같은 문제를 가진 경우도 많으므로) 주위 사람들한테 도움을 청하세요. 다들 기꺼이 도와줄 것입니다.","경제학과의 경우 IMECO 라는 멘토-멘티 프로그램이있었습니다. 덴마크 영화를 같이 보고, 저녁 파티도 하는 등 행사를 열어주었습니다. 다른 과의 경우는 잘 모르겠습니다.","복지 시설이 참 잘 되어있는 것이 부럽기도 하고 문화충격이기도 했던 것 같습니다. 의료서비스 무료 뿐만이 아니라, 덴마크인들은 대학생활을 하는 데 있어서 국가 보조가 월 백만원이상 지원이 됩니다. 서로에 대한, 또 사회에 대한 신뢰가 바탕이 되기 때문에 복지가 잘 되고, 그만큼 여유있고 배려심이 넘치는 사회입니다. 유럽의 모든 다른 국가들을 다 가보았으나 덴마크만큼 행복한 나라를 찾기 힘들었습니다.",같은 교환학생들끼리 서로 도움을 주고 받는 것이 가장 도움도 많이 되고 좋은 것 같습니다.,"일 년동안 정말 행복한 시간을 보냈습니다. 여러분도 다녀오시게 되면 저와 같은 느낌과 같은 표현을 쓰실 것이라 생각합니다. 더 많은 말이 불필요 한 것 같습니다. 직접 느껴보세요 :)

언제든지 연락 주시면 더 많은 얘기를 해드릴게요 shlee5362@hanmail.net (이메일,페이스북)"
