gen_info,env_info,food_info,study_info,office_info,facil_info,mhct_info,help_info,etc_info
"코펜하겐 대학교는 자연과학캠퍼스, 인문캠퍼스 등 코펜하겐 시내 곳곳에 흩어져 있습니다. 저는 조경건축 수업을 듣기 위해 Frederiksberg 에 위치한 자연과학 캠퍼스도 다니고, 덴마크어 수업과  미디어커뮤니케이션학과 수업을 위해 Amager 에 위치한 캠퍼스에도 다녔습니다. 지하철을 타거나 자전거를 타면 캠퍼스끼리의 거리도 30분 이내라서 돌아다니기 정말 좋았어요. 그리고 캠퍼스 내부 디자인이 정말 깔끔하고 좋았고, 이렇게 멋진 곳이라면 저절로 학교를 다니고 공부하고 싶을 것 같았습니다. 코펜하겐 시내 자체는 그렇게 크지 않아서 자전거를 타거나 걸어다녀도 모든 게 범위 안에 있어서 좋았습니다. 일단 건물들이 6층 이하로 낮아서 탁 트인 하늘이 보이고, 개인적인 취향일 수는 있지만 오래된 건물도 철거하지 않고 조금씩 고쳐서 모습을 간직하고 있는 것이 인상깊었습니다. 그리고 다른 유럽 나라들을 여행할 때도 굉장히 편리했어요. 유럽의 많은 나라와 직항 저가항공이 있고 시간도 1~2시간 이내여서 저는 틈날 때마다 여행을 다녔습니다. 다만 기차로 연결된 육로는 편리하지는 않습니다. 가격과 시간절약 가성비를 따지면 비행기를 추천합니다.북유럽이라고 하지만 날씨도 겨울에 그렇게 춥지 않았고 롱패딩 가져갔는데 한번도 안 입었습니다.  비가 많이 오고, 겨울엔 해가 3시 반이면 져서, 어느 정도 어둡고 고독의 시간을 좋아하지 않으면 조금 힘드실 수도 있어요. 그래도 겨울에는 덴마크의 '휘게'를 느끼실 수 있습니다. 바깥 날씨는 계속 비바람이 불지만 실내에서 아늑하고 따뜻하게 즐기는 것도 정말 좋은 경험이에요. 여름에는 시원하고 날씨가 정말 좋습니다. 해도 거의 밤 10시에 져서 아직 밖이 밝은데 시계를 보면 9~10시일 때가 많았습니다. 비도 안 오고 햇빛도 쨍쨍해서 매일 친구들이랑 운하에 가서 수영하고 놀았습니다. 다만 사계절을 막론하고 바람이 정말 세게 붑니다... 여기저기 자전거가 쓰러져 있는 걸 목격하실 겁니다. 자전거가 앞으로 나가지 못할 정도로 바람이 셀 때도 있습니다. 우산도 몇 개나 망가져서 결국 나중에는 우비 입고 자전거를 타면서 다녔습니다.","앞서 말씀드린 것처럼 시내 곳곳에 캠퍼스가 흩어져 있어서, '학교 건물'이라는 게 딱히 없습니다. 그냥 이 도시에 자연스럽게 흡수되어 있는 느낌이에요. Amager 에 있는 캠퍼스는 가장 최근에 지은 곳이라 학교가 컴팩트하게 있고 그 바로 옆에 Tietgen 이라는 유명한 기숙사, Koncerthuset 콘서트장, 그리고 엄청 맛있는 젤라또 가게 Ismageriet 이 있습니다. Frederiksberg 의 자연과학 캠퍼스는 그 옆에 자연 산책로가 있고, 시내 중심가에서 약간 떨어져 있습니다. 조금 더 북쪽으로 가면 Nørre campus 도 있구요, 학교 안에 정원도 있습니다.","각 캠퍼스마다 학생 식당이 있는데 약간 뷔페식으로, 자기가 원하는 만큼 담고 무게로 계산합니다. 아니면 그냥 근처에서 샌드위치 사도 되는데 물가가 좀 비싸긴 합니다. 저는 요리하는 게 귀찮아서 점심에 식당에서 많이 담아서 남은 것은 집에 싸가서 저녁에 먹고 그랬습니다. 사실 마트에서 파는 식료품 자체는 완전 저렴했습니다. 파스타 5인분에 2유로 정도(참고로 화폐는 유로가 아니라 덴마크 크로네입니다) 외식 줄이고 직접 요리해서 먹으면 식비도 엄청 저렴하게 잘 지낼 수 있어요. 기숙사마다 조금씩 다르겠지만 아마 대부분 공동주방이 있을 겁니다. Tietgen 기숙사가 제일 유명한데, 세계에서 가장 아름다운 기숙사로 선정된 적도 있고 최근에 지은 건물이라 시설도 깨끗합니다. 다만 월세가 거의 100만원이였던 걸로 기억합니다.. 저는 Øresundskollegiet 이라는 곳에서 살았는데, 좀 오래된 건물이였지만 북유럽에서 가장 큰 기숙사 단지였습니다. 월세는 40만원 이하였고 Amagerbro 지하철역도 있고 자전거를 타고 10분 내로 시내에 갈 수 있는 좋은 위치였습니다. 근데 여기는 교환학생보다는 코펜하겐 밖 지역에서 온 덴마크 학생들이나 학생 부부, 학생 가족이 훨씬 많았습니다. 제가 사는 층에서 저만 외국인이였습니다. 정리하자면 도심에 King's garden 바로 앞에 Basecamp 기숙사, KU Amager 옆에 Bikuben 과 Tietgen, 조금 떨어져셔 Øresundskollegiet, Amager에서도 외곽지역에 Signalhuset 등이 있습니다. Signalhuset 규모가 커서 그런지 교환학생분들이 많이 가고 덴마크 사람들은 적은 것 같았습니다. 그 바로 옆에 Fields 라는 대규모 쇼핑몰이 있어서 편리하다고 들었습니다.","수업방식은 한국이랑 전혀 다릅니다. 우선 매 수업마다 읽어갈 자료들이 있습니다. 그걸 미리 읽고 가야 수업에서 얻는 게 있습니다. 읽어간 자료에 대한 교수님의 정리 또는 학생 발표, 토론이 주를 이루고, 교수님이 칠판에 적으면서 강의하는 방식은 아닙니다. 듣는 수업에 따라 다르겠지만 한국처럼 중간중간 과제가 많은 것도 아닙니다. 학기 말 시험 또는 보고서로 성적이 매겨집니다. 시험은 예상 문제/ 주제를 미리 알려주고, 학생이 각자 준비를 해서 시험 당일 교수님과 10분정도 면담하듯이 진행하는 oral exam이 있고, 아예 긴 보고서를 작성하는 written exam 이 있고, 이 둘을 섞은 oral + written exam 이 있습니다. 한국처럼 답이 정해진 암기 시험이 전혀 아니고,  학생이 얼만큼 이해했는지, 어떤 점을 중점적으로 공부했는지 어느 정도의 자율성도 주어지고, 특히 oral exam 에서는 학생 본인이 정리한 내용을 현장에 들고 가서 얘기해도 됩니다.  한국과 가장 큰 차이점은, 덴마크에서는 출석 체크를 하지 않습니다. 출석과 결석은 학생의 자율에 맡기고, ‘본인이 공부할 의지가 있으면 하겠지’ 라고 학생을 믿는? 마인드인 것 같습니다. 교수님들은 결석에 크게 신경쓰지 않습니다. 대신 수업을 빠진 만큼 본인이 알아서 공부하고 보충자료 읽는 등의 노력을 해야겠죠.Amager 캠퍼스는 아무래도 인문학 캠퍼스라 그런지 도서관에 한국 소설책을 비롯한 아시아 책들도 있었습니다. 그리고 도서관이 예뻤어요. 기숙사 밖으로 나오고 싶을 때는 무작정 캠퍼스에 와서 도서관도 가고 여기저기 배치되어 있는 테이블에 앉아 시간을 보내기도 했습니다.",궁금한 점이나 문제가 생겼을 때 문의하면 늦어도 3~4일 내에는 답장이 옵니다. 일처리랑 피드백이 빨라서 좋았습니다. 다른 학과의 전공수업을 듣고싶을 때 이곳에 연락해서 수강신청을 하기도 했습니다.,"저는 성격이 소극적인 편이라 동아리나 다른 활동을 적극적으로 참여하지는 않았습니다. 금요일마다 열리는 학생 술집(bar)이 있고 거기서 일하는 학생들은 자원봉사 형태로 일하니까 관심이 있으신 분들은 거기서 일하는 것도 추천드려요.저는 소속이 science department 였고 다른 단과대는 잘 모르지만, 여름학기 시작 전 오리엔테이션에서 유심칩, 텀블러, 필기도구, 에코백, 안내문 등 생활에 필요한 물건들을 선물로 줬습니다. 총 2박 3일정도로 긴 오리엔테이션이였는데, 캠퍼스 투어도 시켜주고, 밥도 주고, 여러 동아리/단체 소개, 수강신청, 휴가 등등 필요한 정보를 많이 알려줘서 도움이 많이 되었습니다.그리고 교환학생들을 위해서 개강 직전에 당일치기 견학 프로그램도 마련해 주었습니다. 참가비는 무료이고 점심만 준비해 오면 되는 것이였고, 관광버스를 빌려서 Mons Klint 라는 곳으로 데려갔습니다. 정말 자연이 아름다운 곳이였고 힐링하고 와서 정말 좋은 추억을 만들었습니다. science department 라면 이 견학 프로그램 꼭 참여하시길 바랍니다.","캠퍼스에 있는 화장실이 항상 남녀 구분이 되어있지는 않았습니다. 어차피 양변기이고 칸 구분이 되어 있으니까 크게 문제될 것은 없었는데, 같은 수업을 듣는 남학생이랑 같이 손을 씻고 나가는 경험도 있었습니다. 처음에는 조금 어색했는데, 작은 일상 속에서도 남녀를 구분짓지 않는 것이, 그동안의 저의 선입견을 깨는 데도 도움이 되었습니다.","덴마크는 페이스북 그룹, 페이지가 활성화되어 있으니까 페이스북에서 교환학생 그룹을 찾아보는 것을 추천드립니다. 그리고 덴마크 한인 그룹, 워킹홀리데이 그룹에 가입하면 물건 나눔, 교환도 편리하고, 궁금한 점을 물어보면 친절하게 답변해주시기도 하고 문제 해결을 도와주시는 분들도 있으셨어요. 가끔 한인 이벤트도 있어서 도움이 될 것 같습니다.","저는 덴마크에서의 생활이 너무 만족스러워서, 추후에 다시 와서 공부를 하거나 직장을 다니고 싶어서 덴마크어 공식 시험을 준비했습니다. 학교에서 기본 덴마크어를 배우고 그 뒤에는 혼자 공부해서 B2~C1 레벨까지 시험을 통과했는데 혹시 덴마크어 공부나 시험에 관심이 있으시면, 또는 다른 궁금한 점이 있으시면 suhe919@hotmail.com 으로 연락주세요~  즐거운 교환학생 생활 하시기 바랍니다."
"한국의 일반적인 대학들과 달리 코펜하겐 대학교는 도시 곳곳에 소규모로 캠퍼스가 여러 군데 있어요. 저는 1학기에는 주로 사회과학대 수업이 열리는 City Campus (CSS)에서 수업을 들었고, 2학기에는 주로 인문대 수업이 열리는 South Campus (KUA)에서 수업을 들었습니다. CSS는 도심에 있는 교통 요충지 Nørreport역 근처에 있고, KUA는 최근에 개발된 Amager 지역의 Islands Brygge 역 근처에 있어요. 그리고 코펜하겐 도시 자체가 굉장히 작기 때문에 왠만한 데는 대중교통이나 자전거로 30-40분 내에 갈 수 있는 거 같아요. 공항도 Nørreport역에서 20분 걸리기 때문에 여행다니기에도 좋습니다.	기후는… 악명이 높다시피 춥고 비가 많이 내립니다 ㅠㅠ 사실 겨울에도 한국에 비하면 기온이 그리 낮은 편은 아닌데 (1년 동안 영하로 내려가는 걸 거의 못 봤어요) 여름이 지나면 해를 거의 못 보고 비도 많이 내려서 진짜 추워요. 바람도 장난 아니게 불어요. 전기요 같은 거 가지고 가시거나 가서 사시는 걸 추천합니다. 대신 여름에는 해도 거의 안 지고 날씨가 정말 좋아요. 그래서 덴마크 사람들은 여름에 바닷가나 도심 곳곳에 있는 운하들에서 거의 살다시피 하더라고요. 겨울을 지내보니까 왜 그렇게 여름에 열광하는 지 좀 이해하게 되었습니다. 이 때 덴마크 탐험하시는 걸 추천합니다. 개인적으로는 바다랑 예술작품을 함께 감상할 수 있는 Louisiana 박물관이랑 연극 햄릿의 배경인 Kronborg 성이 제일 좋았습니다. 둘 다 기차타고 30분 정도밖에 안 걸려요!","캠퍼스에 따라 주변 환경은 다 다르겠지만, 제가 다닌 곳들 위주로 설명을 해볼께요. CSS는 완전 시내 중심부라서 교통도 편리하고 수업 끝나고 어디 놀러가기도 좋아요. 특히 학교 뒷문으로 나가면 바로 호수가 나오는데, 개인적으로 정말 좋아하는 곳입니다. 날씨 좋을 때는 공강 시간에 자주 나와있었어요 ㅎㅎ. 그리고 건물이 오래된 벽돌건물이라 정말 고풍스럽습니다. 안에 꽤 큰 규모의 잔디밭도 두 개나 있어요. 학생들이 다 점심을 정원에 먹는 모습이 인상깊었어요. 단점은 교실 찾기가 정말 힘듭니다… 제가 수업 들은 교실 외에는 캠퍼스를 잘 모를 정도로 좀 미로 같아요.	반면에 KUA는 한참 나중에 지어진 캠퍼스입니다. 아까 말씀드렸듯이 최근에 개발된 Amager 지역에 있고, 무슨 공상과학에 나오는 대학처럼 디자인이 특이해요. 특히 서점이 있는 메인 건물이 웅장하고 멋있었어요. CSS에 비해서 좀 삭막하다고 느끼실 수도 있는데, 시설이 더 깔끔하고 편리한 게 장점인 것 같아요. 교실 찾기도 훨씬 편합니다. 이 캠퍼스에서는 좀만 걸어가면 도시의 메인 운하가 나와요. 그리고 Tietgen 기숙사, DR 방송사 건물, 콘서트홀 등 근방에 있는 건물들이 다 최근에 지은 거라서 고풍스러운 맛은 없지만 구경하는 재미가 쏠쏠해요.","저와 같은 교환학생들은 대부분 대학이랑 협연을 맺은 Housing Foundation이라는 곳을 통해서 기숙사를 구해요. 원래는 Tietgen이라는 원룸 기숙사를 쓰고 싶었는데, 제가 예약 시스템에 들어갔을 때는 이미 자리가 없어서 Signalhuset이라는 기숙사에 살게 되었어요. 이 기숙사는 네 명이서 한 아파트에 사는 구조인데, 각자 방 하나씩 있고 주방이랑 화장실 두 개를 같이 사용하는 형태예요. 분위기는 방마다 다른 것 같아요. 룸메들끼리 맨날 놀러다니는 방도 있는 반면, 제 경우에는 마주치면 잠깐 대화하고, 몇 번 같이 저녁 해 먹은 게 다에요. 집에 있을 때는 주로 혼자만의 시간을 갖고 싶어하는 사람들이 모인 분위기였어요. 기숙사비로 매달 한 70만원을 냈던 거 같은데, 다른 기숙사들에 비해 (특히 원룸 기숙사) 비교적 저렴한 편에 속한다고 하네요.	식사는 주로 기숙사에서 해먹었어요. 밖에서 먹는 건 너무 비싼데, 장보는 물가는 한국보다 오히려 좀 더 싼 감이 있었던 거 같아요. 기숙사 근처에 Wanlong이라는 아시안 마켓이 있어서 한식도 쉽게 해먹을 수 있어요. 정말 귀찮을 때는 케밥을 사먹거나, 학교 캔틴을 이용했습니다.","저는 봄학기 때 정치외교 수업 2개와 덴마크 문화 수업 (Danish Culture Course)를 들었고, 가을학기 때는 커뮤니케이션 수업 2개를 들었습니다. 첫 학기는 27.5 ECTS, 두번째 학기는 30 ECTS를 들었어요 (최대 이수가능 학점은 30 ECTS입니다). 연대에서도 계속 영어로 수업을 들어서 수업 때문에 힘들었던 점은 딱히 없었던 것 같아요. 오히려 수업이 정말 널널해서 놀랐습니다. 중간 시험이 없고, 대부분 기말에 에세이를 내거나 교수님 앞에서 짧게 발표를 하는 식 (Oral Exam)으로 시험을 봤어요. 수업 출석체크도 거의 안 해서 출석율이 많이 낮았습니다. 또 인상깊었던 점은 교수님과 학생 사이의 관계가 격식이 없다는 점입니다. 학생들이 기본적으로 그냥 교수님 이름을 부르고, 수업에서 개선해야 한다고 생각하는 점은 가감없이 말한다고 느꼈습니다. 학기 중간 즘에는 교수님들이 아예 수업 시간을 좀 할애해서 수업에 대한 피드백을 수렴하셨습니다.	캠퍼스 안팎에 사용할 수 있는 도서관들이 정말 많아요. 캠퍼스 내에 있는 것들 중에서는 South Campus 중앙도서관이 넓고 쾌적해서 자주 이용했어요. CSS에는 큰 도서관은 없고 작은 리딩룸(?)이 많았던 걸로 기억해요. 그리고 행정구역(?) 별로 공립도서관들이 잘 되어있습니다. 거주증만 있으면 어느 공립도서관에서나 책을 빌리고 반납할 수 있어요. 그 중에서 Black Diamond라고 불리우는 왕립 도서관이 있는데, 운하 바로 앞에 있어서 너무 이쁘고 공부할 수 있는 공간도 넓습니다.","교환을 준비하면서 궁금한 점을 물어보려고 연락했지만, 코펜하겐에 있을 때는 연락을 해본 적이 없습니다.","동아리는 안 들었지만, 학교 내에서 크게 두 개의 활동을 했어요. 첫번째로는 인문대 멘토프로그램인 QA 프로그램에서 멘토로 활동했습니다. 멘토란 본교에서 공부하는 학생들이 교환학생들 몇 명을 담당해서 공항 픽업도 해주고, 자체적으로 오리엔테이션도 진행하고, 학기 중 같이 덴마크를 체험해볼 수 있는 여러 활동들을 기획하는 봉사활동이예요. 저는 봄학기 때 제 멘토한테 도움을 많이 받았어서 가을학기 때는 직접 멘토를 해보는 것도 뿌듯하겠다 싶어서 지원했습니다. 멘토들 중 덴마크인이 아닌 외국인은 거의 저 뿐이어서 좀 어색하기도 했지만, 덴마크 사람들이랑 (생각보다 덴마크 사람들을 만날 기회가 많지 않더라고요 ㅠㅠ) 그리고 전 세계에서 온 멘티들이랑 먹고 놀고 수다 떨 수 있어서 행복했습니다.	그리고 Studenterhuset이라는 바 겸 카페에서 일했습니다. 이 카페는 캠퍼스 밖 시내에 있지만, 학교에서 지원을 받고 학생들이 자체적으로 운영하는 곳이에요. 매니저들을 제외하고는 저 같은 교환학생, 외국인학생들이 주로 봉사자로 일합니다. 다양한 사람들을 만날 수 있어서 좋았고, 무엇보다 커피 만드는 법을 배울 수 있어서 좋았습니다. 손님들도 대부분 학생이고 봉사자들이 일한다는 걸 알아서 음료 퀄리티가 좀 떨어져도 뭐라 하는 사람이 없었어요. 돈은 못 받지만 한 시간 일할 때마다 카페에서 사용할 수 있는 바우쳐를 줘서 친구들이랑 자주 왔습니다. 봉사 안 하셔도 이 카페 애용하시는 거 추천해요! 기본적으로 가격도 싸고 (학생증 보여주면 10% 할인!) 파티나 공연 같은 것도 자주 열려요.","우선 성과 성별에 대한 인식이 확실히 다르다는 걸 느꼈습니다. 특히 기숙사가 남녀 구분이 없다는 게 좀 문화충격이었어요. 다른 기숙사는 모르겠지만, Signalhuset은 남녀 구분이 없습니다. 근데 각자 방이 있다보니까 별다른 불편함은 없었고 금방 적응됐어요. 그리고 화장실도 남녀 구분 없는 (변기만 있고 소변기가 없어요) 곳이 많아서 신기했어요.	코펜하게너의 자전거 사랑도 신기했습니다. 기본적으로 도로변, 역, 학교 어딜 가든 자전거 무리가 눈에 띕니다. 자전거 도로도 정말 잘 되어있어서 중간에 거의 안 끊기고, 도로 폭도 최소 우리나라의 2-3배는 되는 것 같습니다. 그리고 정말 비가 오든, 눈이 오든, 바람이 불든 자전거를 탑니다. 우비 입고 부츠 신고… 이렇게 자전거를 많이 타고 다니기 때문에 더 편하고 실용적인 옷을 입고 다니고, 특히 대부분의 여성이 화장을 거의 안 하고 다니는데, 이 문화가 부러웠습니다.","단과대나 과별로 실시하는 멘토프로그램에 참여하시는 걸 추천해요. 페이스북 그룹을 통해서 유용한 정보도 많이 알려주고, 학생들을 모아서 파티를 가거나 어디를 같이 놀러가거나 하는 이벤트도 자주 열거든요. 그리고 궁금한 게 있거나 도움이 필요할 때 멘토들한테 연락하면 안내를 잘 해줄 겁니다.	페이스북에서 한인 워킹홀리데이 그룹이랑 세상 살이(?) 그룹에도 유용한 정보가 많이 올라왔어요. 필요한 것도 좀 사고, 교환학생 생활 마무리할 때는 제 자전거도 이 그룹에서 팔았습니다.","코펜하겐은 여러모로 교환학생으로 선택하기에 좋은 도시 같습니다. 환경 문제, 성평등, 복지제도 등에 대한 인식이 우리나라랑 완전 딴판이라서 배울 점도 많고, 사람들이 영어를 잘해서 덴마크어를 몰라도 생활하는 데 전혀 불편함이 없습니다. 1년동안 살면서 코펜하겐 사람들처럼 좀 여유를 갖고 사는 법을 배울 수 있었습니다.아 그리고 좀 뜬금없긴 하지만, 비자 신청하실 때 한국에서 신청하지 마시고 코펜하겐 가서 신청하면 훨씬 더 싸다고 해요. 저는 1년 비자 거의 100만원 가까이 들었는데, 코펜하겐에서 만난 다른 한국 학생이 말해주더라고요.코펜하겐에서 색다르고 행복한 교환학생 생활 즐기시길 바랄께요 ㅎㅎ 궁금한 게 있으시거나 도움이 필요하시면 jinnykim0701@naver.com으로 연락주세요!"
