gen_info,env_info,food_info,study_info,office_info,facil_info,mhct_info,help_info,etc_info
"이름에는 바르셀로나가 들어가 있지만 정작 바르셀로나 시에서 40분 가량 거리에 있는 대학입니다. 공항에서 택시를 타면 55~60유로 가까이 나올 정도로 시 외곽에 자리 잡고 있습니다.  까딸루냐 광장에서 FGC S2 라인이나 S6 라인을 타고 Universitat Autonoma de Barcelona역에서 내리면 바로 대학 중심으로 들어갈 수 있습니다. 학교자체가 굉장히 넓고 학부 별로 건물이 따로 있기 때문에 먼저 가서 자신이 수업을 듣는 곳을 확인하는 것을 추천합니다. 자신이 속한 학부 별로 교환학생 담당 사무실 또한 따로 있기 때문에 그것도 미리 확인해 두셔야 첫 주에 등록하러 갈 때 늦지 않고 갈 수 있습니다. 교실 외에도 도서관들, 체육 시설, International Student Services, 프린트 할 수 있는 곳, 약국 등이 다 뿔뿔이 흩어져 있기 때문에 꼭 미리 확인하셔야 처음에 허둥지둥하지 않을 것 같습니다.저는 19년도 2학기에 다녀왔기 때문에 바르셀로나의 늦여름, 가을, 겨울을 모두 경험할 수 있었는데요. 일단 9월중순까지 늦여름 날씨가 계속 되어 20도 후반, 더운 날은 30도 초반까지 올라갑니다. 다만 우리 나라와 달리 습도가 적어 그늘에만 들어가도 시원하기 때문에 크게 불편하지는 않았습니다.그 후 10월부터 12 월 중순까지는 18도 정도의 아주 선선한 날씨가 계속 되었고12월부터 1월말까지는 이른 아침에는 3~5도까지 떨어지고 낮에는 12~13도의 쌀쌀한 날씨를 경험했습니다. 그러다가 2월부터는 다시 낮에 20도가 넘어가는 따뜻한 날씨로 바뀌었으니 봄학기에 좀 일찍 가시는 분들은 참고하시면 좋을 것 같습니다.","연세대 학생들은 신촌에서 대학생활을 하기 때문에 대학 주변에 많은 놀거리, 먹거리 등 시설들이 자리잡고 있는 걸 당연하게 생각할 수도 있는데요. 저 또한 학교 주위에 까페, 영화관, 쇼핑 시설 등은 당연히 있을 줄 알았습니다.UAB는 저의 생각과 달리 도시 외곽에 있어서 주위에 정말 아무 것도 없었습니다.  스x벅스는 커녕 학교 안에 있는 까페들 외에는 커피 마실 곳도 없고 학교 기숙사에서 15분 정도 거리에 있는 Bellaterra역에나 가야 약국, 마트, 까페/빵집 등을 찾을 수 있었습니다. 30분 정도 걸어가면 이케아와 여러 가지 식당, 까페들이 나오기는 합니다만 가는 게 불편해서 6개월 내내 두 번 밖에 안 갔습니다.하지만 대학에서 FGC를 타고 몇 정거장만 가면 맛집, 까페, 장 볼 곳 등이 다 있긴 합니다. 예를 들자면 Sant Cugat역에는 장을 볼 수 있는 Mercadona와 정말 많은 식당 및 까페들이 자리 잡고 있고, Sant Quirze 역에는 대형마트인 Alcampo가 있어서 저도 이 두 곳은 매주 갔습니다.보통 백화점에 가려면 교환학생들이 까딸루냐 광장으로 대부분 가는데요. 저는 종종 까딸루냐 광장 반대편인 Sabadell 역에 있는 백화점을 갔습니다. 까딸루냐 광장까지 40분 정도 걸리는 반면 Sabadell까지는 15분 정도면 가기 때문에 시간도 많이 아낄 수 있어서 좋습니다.","저는 UAB의 기숙사인 Vila Universitaria에서 2인실에 살았습니다. 대부분의 교환학생들이 H동에 살았던 반면 저의 경우 C동에서 현지 학생들과 살았는데요. 저처럼 교환학생동이 아닌 다른 동에 살았던 다른 친구들을 생각해보면 2인실의 경우 현지 학생들과 사는 경우가 가끔 생기는 것 같았습니다. 사실 말이 기숙사지 여기는 학교에서 운영하는 아파트나 다름 없기 때문에 한국 기숙사에서 흔히 볼 수 있는 사감 선생님이나 통금 같은 개념이 아예 존재하지를 않습니다. 남자는 남자끼리, 여자는 여자끼리 룸메이트를 해주는 것이 원칙이지만 사전에 신청하면 남녀가 같이 살 수도 있는 등 굉장히 자유로운 분위기 입니다.시설은 그럭저럭 쓸만합니다. 제가 지냈던 2인실의 경우 침대, 책상, 옷장이 각각 두 개씩 들어가 있는 침실, 주방 및 거실로 구성되었습니다. 거실에는 책장, 식탁, 커피 테이블, 소파가 있고 주방에는 전기스토브, 싱크대, 냉장고 등이 있습니다.식기도구와 이불은 매달 12.1 유로를 내면 빌릴 수 있습니다.사실 이렇게 보면 있을 건 다 있는 것 같지만 엄청 좋은 품질의 제품들이 아니기 때문에 쓰다가 뭔가 부족한 듯한 느낌을 많이 받았는데요. 특히 난방의 경우 우리와 달리 그냥 히터가 방 별로 하나씩 설치 되어 있어서 아무리 틀어놔도 방이 따뜻해지지 않는 경우가 많았습니다.저처럼 크게 신경 안 쓰고 사시는 분이라면 그냥 가셔도 좋겠지만 다른 교환학생들은 밥솥부터 시작해서 전기장판까지 갖고 오는 분들도 있었습니다.식사의 경우 저는 현지 음식이 입에 잘 맞기도 하고, 요리하는 것도 좋아해서 현지에서 구하기 쉬운 재료로 요리를 거의 매일 해먹었습니다. 특히 삼겹살 같은 고기가 한국에 비해 굉장히 싼 편이기 때문에 집에서 자주 요리를 하게 되었습니다. 다른 한국인 교환학생들의 경우 시내에 있는 중국 식품점에서 파는 한국 제품을 사다가 한국음식을 주로 해먹는 것 같았습니다.사실 이렇게 다들 요리를 해먹는 이유는 학식이 굉장히 비싼 편에 속하기 때문입니다. 학식을 한 끼만 먹어도 보통 1만원 정도가 나오기 때문에 현지 학생들도 가능하면 보통 요리를 해먹었습니다.","저는 UAB의 인문대 소속 교환학생이었기 때문에 인문대 도서관을 주로 갔습니다. 책은 보통 까딸란, 스페인어, 그리고 영어로 되어있고 한번에 10권까지 빌릴 수 있습니다. 온라인으로 연장도 가능하기 때문에 생각했던 것보다 자주 책을 빌려보게 되었습니다.수업은 대부분이 까딸란, 스페인어로 진행되고 영어로 진행되는 수업들도 적지는 않은 편인데요. 문제는 교환학생들 대부분이 영어로 진행되는 수업을 들으려 하다보니 자리가 그리 많지는 않은 거 같았습니다.수업의 질은 대체로 만족스러웠습니다. 제가 들었던 수업들 중 몇 가지는 솔직히 연세대에서 경험했던 수업들보다 훨씬 좋았던 경우도 많았지만 반대로 한 수업은 정말 실망스러웠습니다. 첫 주에 들어보고 마음에 들지 않는다 싶으면 바로 학부 국제처에 가서 수업 바꾸고 싶다고 신청하시면 더 만족스러운 교환 생활을 하실 수 있을 것 같습니다.수업의 강도는 한국에 비해 굉장히 널널합니다. 제 경험상 대부분의 교환학생들이 수업을 잘 나오지 않거나, 나와도 아무런 노력을 하지 않는데요. 아무리 수업이 쉽게 진행된다고 해도 그 정도면 패스를 시켜주지 않습니다. 하지만 수업만 잘 나가고 벼락치기만 해도 성적이 상위권에 포함되는 놀라운 경험하실 수 있을 겁니다. 그 이유는 밑에 Culture Shock 부분에 쓰겠습니다.","이 부분은 아마 UAB의 국제처(?)를 평가하는 부분인 것 같은데요. 사실 교환 생활을 하며 첫 주를 빼놓고는 국제처를 상대할 일이 단 한번도 없었습니다. 그럼에도 불구하고 좋은 기억을 갖고 온 것이 학교 등록, 수업 등록 및 변경 등 제가 해야 할 일들을 국제처에서 굉장히 효율적으로 처리해주었기 때문입니다. 스페인 비자 신청이나 기타 행정업무 진행하는 걸 보면 상당히 답답할 때가 많은데 UAB 국제교육부는 전혀 그렇지 않았습니다. 다만 저는 UAB의 인문학부 소속 국제교육부만 상대해봤기 때문에 다른 학부는 어떤지 정확히 말씀 드리기가 어렵습니다.","매 학기마다 UAB에서는 International Welcome Week라는 것을 진행합니다. 이때 교환학생들은 자신들의 조장들과 함께 캠퍼스 투어도 하고 Plaza Civica에서 진행되는 동아리 박람회도 찾아가볼 수 있습니다. 제 개인적인 생각으로는 교환학생이 할 만한 동아리가 있는 지는 잘 모르겠습니다만 한번쯤 찾아가 볼만한 것 같긴 합니다. 한국 문화를 배우는 동아리도 있는데 아주 잘 짜여있는 동아리 같지는 않았습니다.부대시설은 교내에 약국, 은행, 미용실 프린트 할 수 있는 곳, 서점, 안경점, 소극장, 체육시설, 실내수영장, 탁구장, 식당 등이 있고 기숙사에 실외 수영장, 축구장, 배구장, 문구점, 매점, 술집이 있습니다.","저는 어린 시절을 바르셀로나에서 6년 정도 보냈기 때문에 사실 크게 문화 충격이 없을 줄 알았는데 생각보다 놀라운 것들이 많았습니다.우선 UAB라는 대학은 굉장히 “래디컬”한 축에 속합니다. 바르셀로나 자체가 굉장히 개방적이기도 하지만 이 학교는 스페인 내에서도 알아주는 곳이라 교수나 학생들 모두 성 평등, 동성애, 정치 등 문제에 매우 민감한 편입니다. 제가 교환학생을 갔던 19학년도 가을에도 까딸루냐 내 정치적인 문제로 학생들이 시위를 나가서 2주가량 수업을 못 했던 적이 있을 정도였습니다. 이런 학생들이 정치에 관심이 없는 학생들을 교실에서 쫓아내려고 건물에 폭죽을 터뜨리고, 수업을 강행한 교실에 악기를 들고 가서 소란을 피우는 등 상당히 놀라운 모습을 보였습니다. 그 외에도 대한민국 국민으로서는 보기 힘든 공산주의 심볼이 학교 곳곳에 매우 크게 그려져 있고 동성애도 매우 쉽게 접할 수 있습니다. 이런 것들을 자주 접해볼 기회가 없는 한국인 학생들은 처음에는 당황스러울 수도 있을 것 같습니다.그 외에도 기숙사 생활에서도 우리와는 매우 다른 점들을 찾을 수 있었습니다. 우선 UAB의 기숙사는 무늬만 기숙사지 사실상 아파트와 다를 바 없습니다. 한국 기숙사는 남녀 구분이 철저하고, 음식을 방에서 먹는 다는지 여러 행동에 제제가 걸리는데 UAB 기숙사에는 그런 것이 전혀 없습니다. 따라서 룸메이트마다 다르겠지만 저의 경우 저희 방에 남자 여자 할 것 없이 룸메이트 친구들이 종종 놀러오곤 했습니다.마지막으로는 마약이 생각보다 주위에 너무 많아 꽤 놀랐습니다. 캠퍼스를 돌아다니거나 기숙사 주변을 돌아다니면 매일 빠짐없이 마리화나 냄새를 맡을 수 있는데요. 저의 경우 1층에 살았는데 간혹 옆 방이나 윗층에서 마리화나를 피워대서 저희 거실까지 그 냄새가 나는 경우도 있었습니다. 제가 알기로는 까딸루냐 법은 마리화나를 사고 파는 것은 불법이지만 집에서 길러서 피우는 것은 합법입니다. 그래서인지 마리화나를 여러 번 권유 받았습니다. 이뿐만 아니라 도시에 나가면 사람이 많은 까딸루냐 광장 같은 곳에서 꼭 잡상인들이 와서 코카인, 헤로인, 엑스터시 등을 팔려고 합니다. 참고로 그 사람들이 “커피 샵?”이라고 묻기도 하는데 알고보니 그게 까페를 뜻하는 게 아니고 마리화나를 뜻한다고 합니다. 가면 현지 학생들이나 교환 학생들이 많이들 마약을 하기도 하고 권유하기도 할 텐데요. 알아서 잘 거절하시면 될 것 같습니다.",사실 솔직히 말해서 UAB가 학교 자체에서 학생이 필요로 할 수 있는 정보를 전부 다 챙겨주는 스타일은 아닙니다.  심지어 어떨 때는 학교 차원에서 이메일을 보내도 까딸란으로만 보내서 곤란한 경우가 생기기도 했습니다. 그러다 보니 가서 생활하다 보면 아무리 찾아도 필요한 정보를 못 찾는 경우가 있는데요.그럴 때 교환학생이 도움을 받을 수 있는 가장 좋은 방법은 각자 학부의 국제처에 연락하는 것 같습니다. 굳이 직접 찾아갈 필요는 없고 이메일만 보내도 생각보다 빨리 도와줍니다. 그 외에도 학교에서 사전에 신청한 학생들에 한해 조를 짜서 조장을 배정해주는데요. 물론 조장에 따라 다르겠지만 학교 생활을 하며 필요한 게 있으면 조장에게 물어봐도 좋습니다.마지막으로 기숙사 관련 문제 같은 경우 기숙사 사무실에 가서 직접 문의를 하면 24시간 내로 보통 해결해줍니다.  간혹 집을 수리하러 와 달라고 부탁해도 안 오는 경우가 있는데 그럴 때는 그냥 다시 한번 가서 말하면 곧바로 직원을 보내주기 때문에 걱정하지 않으셔도 됩니다.,"사람마다 교환학생 경험을 통해 얻으려는 것도 다르고 목적도 다르기 때문에 딱히 조언의 말씀을 드리기는 어렵지만 그래도 꼭 당부드리고 싶은 건, 뭐든지 진짜 빨리 하는 게 중요한 것 같습니다. 비자 신청, 기숙사 신청, 수강 신청 전부 다 최대한 빨리 하셔야 문제 안 생깁니다.스페인은 비자 신청 할 때 cita (appointment)를 미리 신청해두어야 하는데요. 워낙 스페인에 가는 사람이 많아서 이게 몇 달 전에 꽉 차버립니다. 저 같은 경우에도 ‘9월에 가니까 6월 중순 쯤에 예약하면 되겠지’라고 생각해서 6월중순에 신청하러 싸이트에 들어갔더니 이미 6,7,8월 cita가 꽉 차서 비자 신청을 못 할 뻔 했습니다. 따라서 9월에 간다고 해서 여름에 신청하려고 하지 말고 교환 가는 게 확정이 나는대로 최대한 빨리 비자 신청을 하시면 좋습니다.기숙사 신청 및 수강 신청도 같습니다. 기숙사는 선착순이기 때문에 당연히 먼저 할 수록 자신이 원하는 종류의 방을 얻을 확률이 높습니다. 수강 신청은 빨리 하면 좋은 이유가 영어 강의의 수가 제한적이라 늦게 하면 자리가 없어서 스페인어로 진행되는 수업을 수강하셔야 할 수도 있기 때문입니다.스페인 교환 후기 같은 걸 읽어보면 대부분이 비자 신청이 너무 어려웠다, x가 너무 어려웠다고 하는 걸 많이 볼 수 있습니다. 물론 개인마다 다르겠지만 제 생각에는 그냥 시키는 대로만 하면 쉽게 됩니다. 다만 스페인 대사관이나 학교 측에서 시키는 대로 안 하고 조금만 어긋나도 거부 당할 수 있기 때문에 관련 가이드 라인을 꼼꼼히 읽어 보시고 일 처리하면 문제 생길 일이 거의 없는 것 같습니다.마지막으로는 수강 신청을 했을 때 각 수업 교수님께 연락 드려서 실제로 수업이 언제 끝나는지 확인하는 것도 좋은 방법입니다. 저 같은 경우 9월부터 2월 7일까지 공식 교환 학생 기간이었는데 막상 가보니 수업 및 시험이 1월 17일날 전부 마무리 되어서 1달 가량을 거기서 놀다 왔습니다. 물론 유럽에서 좀 더 놀고 오고 싶으신 분들은 전혀 상관 없겠지만 1달 먼저 오면 월세도 아끼고 한국에 와서 다른 일을 할 수 있기 때문에 교환 학생 초청서에 적인 공식 종료 날짜까지 있을 필요는 없는 것 같습니다."
"시내에서 30~40분 떨어져있는 학교고 산과 가깝다보니, 시내에 비해서 겨울은 더 춥고 여름은 더 더운 편입니다. 겨울에는 얇은 전기정판 꼭 챙겨오시는 걸 추천합니다.","학교 기숙사 기준으로 두 정거장 떨어진 Volpelleres역에서는 Mercadona라는 슈퍼마켓, 그리고 Sant Quirze역에서는 Al Campo라는 마트가 있습니다. 음식을 사오기에는 Mercadona 야채/과일/고기가 신선해서 더욱 적절하지만, 청소도구 등 음식이 아닌 물건을 사기에는 Al Campo가 더 크고 물건도 많기 때문에 적절할 것 같습니다. 기숙사 내에 편의점이 있고, 기숙사랑 가장 가까운 역인 Bellaterra역 옆에도 Condis라는 작은 슈퍼마켓이 있지만, 가격이 마트보단 비싸기 때문에 급할 때만 이용했습니다. 기숙사 근처에 Sant Cugat, 그리고 Sabadell같은 지역에서도 맛집/카페/쇼핑거리가 다양하기 때문에 시내에 나가기 귀찮을 때 Sant Cugat나 Sabadell로 나가시는 것을 추천해드립니다.","보통 숙소에서 요리하거나, 학교내 식당에서 먹거나, 시내에 나가서 외식을 하는 편이었습니다. 바르셀로나는 유럽의 다른 도시들보다 비교적 물가가 싼 편이어서, 과일이나 고기가 저렴하고 신선했습니다. 학식당에서는 간단한 피자/케밥/보까디요/빵을 저렴한 가격으로 팔기 때문에 수업 끝나고 많이 사먹기도 했었습니다.기숙사는 2인실에서 5인실까지 다양했는데, 보통 부엌 + 화장실 + 거실 + 방 1~3개 식의 구조였습니다. 도시생활을 경험해보고 싶은 학생들은 시내에서 쉐어하우스를 하고 통학하는 경우도 많았습니다.","제가 속해있었던 경제경영대에서는 거의 모든 수업이 팀플+중간+기말+과제가 있었습니다. 보통 10점만점에 5점을 넘으면 pass이지만, 한국보다는 fail을 주는 경우가 많았습니다 (실제 제가 들었던 어느 수업에서는 50명중 30명이 fail을 했습니다). 하지만, 시험 자습기간이 매우 길고 (1달) retake 기회도 있으니 적당히 교환생활을 즐기시면서 공부하시는 것을 추천합니다. 시험기간이나 조모임을 할때에는 단과대 도서관 + 기숙사 스터디룸을 이용했습니다.",학기 초반 orientation week중 국제교육부에서 학교투어와 registration 안내를 해준 후 멘토별로 그룹이 나뉘었습니다. 보통 같은 과 학생들과 멘토끼리 모여있어서 이때 수업방식이나 교수님에 관한 질문을 할 수 있었습니다. 국제교육부에서 주최하는Tandem 이라는 언어교환 프로그램을 통해 다른과 학생들과 많이 친해질 수 있는 기회가 있으니 처음에는 꼭 참여해보시는 것을 추천합니다.,"학교내에 헬스장, 수영장, 축구장 등 다양한 운동시설을 이용하는 학생들이 많았습니다. 학교중앙에 위치한 plaza civica주변에는 Santander 은행, 간단한 편의점, 학식당, 큰 문구점, 인쇄소등이 있어서 필요한 것은 어려움없이 구할 수 있지만, 일찍 문닫는 편이기 때문에 주의하시길 바랍니다.","소매치기는 항상 주의하시고, 길거리에서 인종차별이나 캣콜링을 당할 수도 있다는 점을 염두해두어야 합니다. 스페인 대학생들은 매우 개방적이고 오픈된 분위기이기 때문에, 숙소에서 파티를 열거나 이성친구를 초대하는 경우도 많이 볼 수 있을 것입니다.","수업 관련 질문이 생기시면, 교수님의 오피스아워에 찾아가거나 이메일로 질문하면 잘 받아주시는 편입니다. 수업외에 있는 질문은 communications library옆에 있는 국제사무실로 찾아가서 질문하시거나, 교환학생 톡방에 물어보시면 멘토들이 바로 대답해주실 것입니다.",
