gen_info,env_info,food_info,study_info,office_info,facil_info,mhct_info,help_info,etc_info
"우리나라의 많은 대학들이 단과대학이 여러 개 모인 종합대학의 성격을 띄는것과 달리 프랑스의 대학들은 대부분 단과대학의 형식을 하고 있어서 규모가 매우 작은 편이다. 캠퍼스 개념이 없이 한 건물로 되어있는 경우도 많다고 한다. 하지만 릴 3대학은 그와는 달리 캠퍼스도 넓은 편이고 인문, 예술의 분야의 많은 학과들이 모여있어서 비교적 큰 축에 속한다.
릴은 6각형 모양으로 생긴 프랑스 국토 중 제일 위 꼭지점의 거의 끝부분에 위치해있다. 차로 몇분만 달리면 바로 벨기에 국경이다. 브뤼셀까지는 TGV로 30분이 채 안걸린다. 또한 영국해협과도 매우 가깝고 브뤼셀 발 런던 착 유로스타가 정차했다가 가는 여행하기에 매우 편리한 위치에 있다. 네덜란드 암스테르담에도 버스로 6시간 걸리는 가까운 거리이다. 파리와도 가까워서 TGV로 1시간 걸리는데, 유스 할인에 미리 예약까지 하면 꽤 싼 가격이어서 주말에는 파리에 2-3주에 한번씩 다녀오곤 했다.
기온은 우리나라(서울)보다는 훨씬 높지만, 비가 자주 와서 습하다. 바람도 많이 불고 비까지 내려서 체감온도는 상당히 낮은 편이다. 눈이 오는것은 못 봤지만 때로는 영하로도 내려가곤 했다. 프랑스 국내에서는 가장 추운 편에 속한다. (많이 내려가봐야 영하 2-3도 임에도 불구하고) 프랑스 전체적으로 우리나라만큼 난방을 20도 이상으로 따뜻하게 해주는 편이 아니므로 겨울에 방문한다면 두꺼운 옷, 담요를 잘 챙겨가는 것이 좋다. 다른 곳은 모르겠으나 지냈던 기숙사에서는 11월 초까지 난방을 해주지 않아서 방 안에서 입김이 나올 정도였다. 혹시나 해서 가져간 작은 전기담요가 큰 도움이 되었다.","학교 주변은 동네가 썩 좋은 편은 아니다. 하지만 도보로 2-30분 정도나 버스를 타고 조금 움직이면 깔끔한 주택가가 나온다. 릴 단일도시는 매우 작지만 릴 메트로폴이라는 여러 개의 군소도시들이 모인 도시군을 이루고 있는데, 학교는 이중에서 빌뇌브다스끄 라는 도시에 속한다. 교환학생을 떠나기 전 학교로부터 받은 서류에 주소가 Lille이 아닌 Villeneuve d'Ascq 라고 적혀있어서 의아했었다. 이들 도시군은 크게 Lille, Roubaix, Tourcoing 세 개의 근접한 큰 도시들을 중심으로 지하철 2개 노선과 트람 2개 노선(지상 전차) 많은 버스노선으로 연결되어있다. 릴 3대학의 일부 학과의 수업은 위의 루베, 투르쿠앙에서 열리므로 (언어 일부와 조형예술) 확인할 필요가 있다. 버스노선의 경우 빠른 지하철, 트람이 다니지 않는 부분을 연결한다는 성격이 강해서 많이 돌아가고 느린 편이다. 하지만 지하철, 트람 연계 환승이 가능하고 기숙사에서 지하철역까지 거리가 꽤 됐기 때문에 자주 타는 편이었다.","ISEP 교환으로 한 학생들을 많이 챙겨주는 편이라 릴의 기숙사 중 가장 시설이 좋은 편인 Robespierre 기숙사로 배정받게 된다. 처음에 기숙사 명단에서 내가 빠진 줄 알고 깜짝 놀라서 확인 전화를 하고 겁을 먹었었는데, 걱정할 필요는 전혀 없다. 원한다면 무조건 기숙사로 들어가는 것이 가능하고, 만약 들어가지 않을 생각이라도 학교에서 학생을 위한 싼 집을 많이 알선해준다. ISEP 담당 직원과 교수님이 매우 친절하므로 상담을 겁내지 말것.
앞서 말한대로 기숙사는 싸고 좋은 편이다. 릴의 집세가 (다른 곳은 모르겠으나 파리와 비교해서. 파리는 집을 구하는것이 매우 고생스럽고 집세도 턱없이 비싸다고 들었다) 싼 편임에도 일반적인 집세의 3분의 1 수준이다. 샤워실과 화장실은 공동이지만 방안에 세면대와 부엌, 냉장고까지 갖추고 있다. 부엌과 냉장고가 없는 많은 기숙사들에 비해 매우 편리하다. 걸어서 15분 거리인 마트 (Leclerc, Cora 두 개가 큰데 Cora가 더 크고 물건이 많다) 에서 자주 장을 봐와서 밥은 거의 해먹는 편이었다. 학교 식당도 물론 매우 싼 편이다.","나는 주거환경학과와 제일 비슷한 arts plastiques, 즉 조형예술과로 들어갔는데, 이 과의 수업을 듣기 위해서는 위해서 언급한 투르쿠앙으로 지하철을 20-30분 정도 타고 가야한다. 처음에는 건축 비슷한 수업이라도 들어가 볼 생각으로 몇 번 캠퍼스에 왔다갔다 하면서 커리큘럼과 시간표를 확인하러 다녔는데, 실기 스튜디오 중심이고 시간표도 복잡하게 되어있었다. 알고보니 꽤 유명한 미술학교인것 같지만, 내 전공분야와는 매우 판이한것 같아서 포기하고 일반 교양 삼아 다른 수업들을 들었다. 
교환학생들은 필수적으로 첫 학기에 불어 레벨테스트를 보고 반을 배정받아 불어 수업을 듣게된다. 내 경우엔 꽤 도움이 되었고 여러 나라의 친구들을 사귈 수 있어서 좋았다. 릴의 어학원이 유명한 편이라 교환학생 외에도 많은 나라에서 어학연수를 온다. 어학원은 대학과 시스템을 달리하고 있지만 교환학생을 위한 어학 수업 역시 어학원에서 진행된다.
릴 전체에 흩어져있는 많은 도서관에 들러보았는데 역시 대학 도서관의 자료가 많은 편이다. 학생증을 가지고 있으면 다른 대학 도서관의 자료도 이용할 수 있다고 들었는데 써보진 않았다. 도서관 내의 컴퓨터실은 가끔 시간을 때우거나 급히 인터넷 쓸일이 있을때 편리하다. 자료를 대출하기 위해서는 도서관 카드를 따로 만들어야하는데 사진이 필요하다. (프랑스에서는 어딜가나 뭔가 등록하기 위해서는 사진과 여권이 필요한 경우가 많으므로 증명사진 몇개와 여권 사본은 항상 가지고 다니는 것이 좋다.)
음악을 좋아해서 여러 mediatheque (도서관과 비슷한 개념이나 영화, 음반 자료들을 더 갖추고 있다)에 가봤는데 Tourcoing에 있는 것이 가장 자료가 많은 듯 하다. 특히 jazz, rock 등 다양한 장르의 음반들을 갖추고 있고 1년 회비를 내고 등록하면 한번에 5장씩 대출이 가능하다. 인터넷으로 자료를 검색할수 있으니 찾고자 하는 자료가 있을때 찾아보면 좋다.","학교 전체적으로 교환학생이 굉장히 많은데, 대부분은 유럽권 국가들 내의 교환학생들을 지칭하는 에라스무스이다. ISEP 교환학생은 특별히 신경을 많이 써주는 편이다. 담당 교수님은 항상 친절하게 상담과 문의메일에 응해주신다. 국제교육부 직원들은 워낙 많은 ISEP을 포함한 교환학생들이 들락날락 하는 통에 과중한 업무로 정신이 없어서 가끔 신경질을 내곤 하지만 평소에는 매우 친절하고 신경써준다. 초반 수강신청을 할때 쯤엔 특히 국제교육부 사무실을 매일같이 드나들게된다. 사무실 바로 옆의 컴퓨터실은 이름 자체도 'Salle de reunion'으로 만남의 장소 역할을 한다.
국제교육부에서 은행계좌 개설과 체류증 신청도 편리하게 함께 신청할 수 있다. 체류증이 나오면 집세 보조도 받을 수 있지만 나의 경우는 6개월 비자로 갔기 때문에 (체류증 불필요라고 명시된) 체류증은 신청하지 않았다.","수강신청할때 스트레스를 좀 많이 받는 편인데 건물들이 복잡하게 복도가 이어지고 지하층과 연결되어있어서 강의 듣는 건물의 위치를 절대적으로 확인해야 한다. 학기 초에는 헤매는 학생들을 정말 많이 볼 수 있다. 수강편람은 국제교육부에 일부 들어오긴 하지만 늦는 경우가 많고, 인터넷으로 대부분 볼 수 있다.(편람을 스캔한 것이지만) 시간표는 각 학과 사무실 게시판에서만 확인할 수 있으므로 디카를 들고다니면서 찍으면 편리하다. 10월 중으로 수강 확정을 짓기 때문에 계속 돌아다니면서 이 수업 저 수업 들어봐야 한다. 출석은 성적에 들어가지 않지만 노트를 빌리거나 수업에 들어가는 것이 시험에 절대적이다. (불어 수업은 출석이 중요하다)
체육 수업을 다양하게 잘 갖추고 있어서 좋다고 들었지만 운동에 전혀 관심이 없는 편이라 그쪽을 자세히 살펴보진 않았다. 하지만 학교 오는 길의 체육관이나 테니스 코트에서 항상 운동을 하고 있는 모습을 보니 (체육관에서는 요가나 댄스 같은것) 관심있다면 들어보는 것이 좋을것 같다.","이전의 경험 보고서에서 기숙사 근처에 아랍 사람들이 많아서 괜히 집적거리곤 한다는 것을 보고 뭐 그리 심하겠나 인종적인 편견 아닌가하고 갔지만 아랍인(모로코)들의 동양 여자에 대한 관심은 기대 이상이었다. 겪어보지 않으면 알 수 없다. 짜증도 많이 났고 심하게 데인 적도 꽤 있었다. 하지만 나중에 모로코에 여행을 다녀와 보고 큰 악의는 없다는 것을 알았다. 무시해도 해코지를 하는 것은 아니므로 신경 쓰지 않는 것이 제일. 아무리 악의는 없다고 해도 해가 지고 나서 기숙사 주변 동네를 돌아다니는 것은 좋지 않다. 한국에서는 귀가시간이 예사로 11시를 넘기고 부모님과 마찰도 있었지만 이곳에 살다보면 자진해서 해가 떨어지면 집에 들어가게 된다. 물론 친구들과 여럿이서 시내에 나가 술을 마시는 것은 괜찮지만 혼자서 밤거리를 돌아다니는 것은 절대 금물이다. 유럽 전체적으로 우리나라처럼 밤거리를 환하게 밝히고 사람들이 많이 돌아다니는 모습은 보기 힘들다. 예외라면 관광이 발달한 도시의 일부지역 정도이다.

위의 것은 쇼크라기보단 그렇구나, 정도지만 가장 쇼킹한 것은 역시 파업문화였다. 프랑스가 워낙 파업으로 유명한 나라이긴 하지만 내가 간 학기에는 특히나 사르코지의 정책변화에 따라 대규모로 파업이 진행됐다. 다행히 릴은 대중교통이 사유화 되어 영향이 없었지만 파리에 방문했을때 지하철 파업으로 몇 개 노선은 운행이 중단되고 일부는 운행 수를 10분의 1로 줄였다. 신기한 것은 사람들의 표정이 그다지 짜증스럽지 않다는 것이었다. 우리나라라면 시민들의 발목을 담보로 자신들의 이익을 취하려 한다고 난리가 나겠지만 프랑스인들의 파업에 대한 시선은 그럴만한 이유가 있어서 하겠지, 하는 느낌이었다. 철도도, 지하철도 보통은 며칠 하다 말지만 이때는 거의 한달이 넘게 강도높은 파업이 진행되었다. 가장 충격적인것은 수업 중단이었다. 일부 학생들이 총노조와 뜻을 함께 하며 학교를 점거하여 한달이 넘게 수업이 중단되었다. 아무것도 모르고 처음 학교에 간 날 건물 입구에 의자와 책상들로 온통 바리케이트가 쳐져있어서 어찌나 황당했던지. 아무도 언제 수업이 재개될지 모른다고 했다. 결국 수업이 재개되지 못한채 방학이 시작되었고 개학 후 바로 시험기간으로 들어갔다. 대부분의 강의는 한달 조금 넘는 수업만으로 시험을 봐야했다. 수업의 무기한 연기는 다음 주면 시작될거다, 하는 것을 몇주째 반복했기때문에 맘놓고 여행가기도 어려웠고 수업이 없어서 좋은것보다 짜증이 더 났다. 돌이켜보면 프랑스인의 특성을 확실히 알게된 기회였던것 같다.

마지막으로 프랑스는 인터넷 인프라가 잘 갖춰져있는 편이라는데도 불구하고 한국에 비하면 놀라울 정도로 아날로그적이다. 불과 몇년전까지도 전화모뎀을 많이 썼다고 한다. 한국은 인터넷을 활용할 수 있는 모든 곳에 쓰지만 프랑스는 딱 필요한 곳에만 쓴다는 느낌이다. 모든것은 직접 방문 혹은 우편의 서류제출이다. 행정도 매우 느려서 학생증이 나오는데는 1-2주, 교통 정기권을 받는데도 2주 정도. 이 느려터짐에 프랑스인들 자신들도 불평은 하면서도 다들 그러려니 하기때문에 별로 달라질 기색은 보이지 않는다.",국제교육부의 도움이 절대적인 편이다. 나의 경우는 먼저 한학기를 지낸 윤미(아래 경험보고서)의 도움을 많이 받았다. 먼저 와서 정착한 지인이 있다면 좋겠지만 그렇지 않다면 http://cafe.naver.com/ohlalaparis.cafe 네이버의 프랑스 생활정보 카페에 가입하는 것도 도움이 된다.,"짧아서 아쉬웠던 한 학기였지만 한국이 그립지 않을 정도에 좋은 추억을 만들고 갈 수 있는 적당한 시간인것 같기도 하다. 6개월이 짧은 것 같지만 충분히 많은 경험을 하고 갈 수 있다. 나는 틈나는 대로 여행을 정말 많이 했는데, 월화수목만 수업을 넣고 목요일 오후에 출발해서 일요일에 돌아오는 여행도 많이 다녔다. 전공 수업을 들을 수 없었던 것은 조금 아쉽지만, 수업보다 중요한 많은 것을 배웠다."
"릴3대학은 예술, 인문 단과 대학이 모인, 그다지 규모가 크지 않은 대학입니다. 하지만 프랑스 북부에 있는 인문대학으로는 가장 크지요. 릴은 프랑스 북쪽에서 가장 큰 대학 도시입니다. 릴에 오면 모두들 놀라는 점이 바로 젊은이가 정말 많다는 것입니다. (인구 고령화 현상이 심각한 유럽에서 이것은 큰 매력이라고 할 수 있습니다. ^^ ) 또한 릴에 교환학생을 오는 미국 학생들은 릴의 위치가 여행하기 좋기 때문에 온다고도 합니다. 왜냐하면 벨기에가 바로 옆에 있고, (차나 지하철로 10-20분 거리입니다.) 영국과 네덜란드도 3시간이면 기차로 갈 수 있는 교통의 요지(!) 이기 때문입니다. 벨기에를 거쳐서 독일로 여행하는 것도 가깝습니다. 날씨는 전형적인 영국 날씨와 같아서 비가 자주 오는 편입니다. 하지만 우산을 쓰고 다니는 일은 별로 없습니다. ^^;; 겨울은 한국보다 조금 따뜻하고, 여름은 매우 서늘한 편입니다. 하지만 여름에는 사람들이 다들 남부로 바캉스를 가기 때문에 도시가 텅빈 느낌이 듭니다.","대학은 릴 시내에 위치한 것이 아니라 릴 시내에서 지하철로 10-15분 정도 거리에 있습니다. 학교 주변에는 학생들이 사는 기숙사들과 아파트, 주택단지가 있습니다. 그리고 학교 바로 옆에는 크고 멋진 잔디밭이 있어서 산책하거나 책 읽기에도 좋습니다. 학교에서 5-10분 거리에는 Chateau라는 지명을 가진 마을이 있는데 멋진 성은 아니지만 아담한 플랑드르 식 옛날 귀족의 집과 멋진 호수, 주택단지가 있어서 수업끝나고 거닐기에도 아주 좋습니다.","ISEP으로 가면 Robespierre라는 기숙사에 방을 배정받게 됩니다. ISEP은 숙소를 따로 구하지 않아도 된다는 장점을 가진 교환 프로그램인데요. 저는 첫 학기에는 기숙사에 있었고 두 번째 학기에는 시내에서 집을 구해서 여러 국적의 학생들과 같이 살았습니다. 우선, 첫 학기에는 기숙사에 사는 것이 친구들을 사귀는데 좋았고 기숙사비가 정말 저렴해서 (보통 집세의 반이나 3분의 1가격입니다.) 생활비를 아끼고 여행을 다닐 수 있다는 장점이 있었습니다. 그런데 기숙사 맞은편에 모스크가 있고, 기숙사 주변 동네가 좀 무서웠기 때문에 저는 릴 시내에서  살고 싶어서 여름 방학 전에 집을 따로 구해서 나오게 되었습니다. 집은 다른 학생들과 한 집에서 같이 사는 Colocation형태이고 서로 부엌과 화장실 (샤워실), 거실 등을 같이 쓰고 각자 방은 따로 하나씩 사용했습니다. 3층으로 된 집이었고 남자 4명, 여자 3명이 함께 생활했는데, (한명은 지하실에서..) 국적은 프랑스 3명과 독일 1명, 스페인 1명, 이스라엘 1명, 그리고 한국인인 제가 있어서 약간 워크캠프 분위기가 나기도 합니다. ^^  기숙사보다는 Colocation으로 생활하는 것이 프랑스 문화를 이해하고, 언어도 배우는데 좋기 때문에 강추입니다. 물론 여러가지 문화충격이 생기기도 합니다. : )","수업은 일주일에 1시간 반이나 2시간 짜리 수업이 많습니다. 그래서 시간표를 짜실 때 전공인정을 받으시려는 경우는 수업 두개를 묶어서 받으셔야 합니다. 생각보다 골치가 아픈 일입니다. 그리고 교수님들마다 수업방식도 다르시고, 교수님들의 불어도 정말 다르기 때문에 첫 주에 수업을 가능한한 여러개 들어가보고 그 중에서 자신의 레벨에 맞는 수업을 고르는 것이 중요합니다. 도서관 사용은 학교 국제 교육부에서 처음에 설명을 해줍니다. 그리고 책 빌리고 난 뒤에는 인터넷으로 연장이 가능합니다. 불문과의 경우에는 중앙도서관보다는 전공서적이 많은 문대 도서관을 더 많이 이용하게 됩니다.","Nadia와 Lucie라는 대학원생들이 국제 교육부에서 학생들을 담당하는데 매우 친절합니다. 하지만 교환학생이 정말 많기 때문에 항상 바쁘고 정신이 없습니다. 국제교육부 사무실 옆에는 교환학생들을 위한 컴퓨터실이 있는데, 한 7-8대 정도의 컴퓨터가 있습니다. 이 곳은 일종의 교환학생들을 위한 만남의 장소 역할을 하는 곳입니다.",학교에는 Kino라는 작은 영화관이 있습니다. 티켓 값이 반값 정도로 저렴하기 때문에 학생들이 자주 이용합니다. 저는 1년간 학교 근처에 있는 Melies라는 예술영화관에서 자원봉사를 하면서 친구들과 영화를 공짜로 보기도 했습니다. 또 SUAPS에서는 다양한 스포츠 수업을 들을 수 있습니다. 프랑스 친구들을 사귀는 좋은 기회라고 다들 합니다. 그리고 우리와 같이 동아리의 개념은 없지만 잘 찾아보면 방과후 합창 수업이나 연극 수업과 같은 일종의 동아리처럼 친목도모를 하고 취미생활을 즐길 수 있습니다.,"문화 충격이 처음엔 정말 많았지만 두번째 학기 때는 점점 익숙해졌습니다. 가장 큰 문화 충격은 모든 행정 절차가 느리다는 것, 그리고 어딜가나 항상 문을 몇시에 여는지 시간을 꼭 확인해야 한다는 것이었습니다. 별일 아닌 것 같지만 처음에 이 것때문에 많은 우여곡절을 겪었습니다. 하지만 점점 시간이 지나면서 내린 결론은 사람 사는게 결국은 다 비슷비슷하다는 것입니다..",그곳에서 사귄 프랑스 친구들로부터 많은 도움을 받았습니다.,"제가 학부 생활을 하면서 가장 기억에 남고 보람된 일 중 하나는 바로 교환학생 경험이라고 생각합니다. 특히  여러 친구들과 Colocation을 하면서 서로 크게 싸우기도 하고, 다른 때에는 그림자처럼 붙어다니면서 지내는 등 정말 여러가지 사건들이 있었습니다. 교환학생 첫 학기 때는 기숙사에서 다른 교환학생들과 함께 지내면서 학교 수업에 대한 스트레스를 받았는데, (심지어 한 루마니아 친구는 수업에 대한 스트레스 때문에 한달이 지나고 본국으로 돌아가버렸습니다. 물론 저랑 같이 들은 수업이 프랑스 학생들도 어려워 하는 롤랑 바르트에 대한 것이긴 했어요..;; ) 두번째 학기 때는 첫 학기 때와 달리 정말 편하게 수업을 들을 수 있어서 좋았습니다. 또한 프랑스 학생들도 우리 학생들과 마찬가지로 매우 소심하므로 외국인 교환학생들에게 먼저 말을 걸거나 하기가 쉽지 않습니다. 가장 좋은 방법은 교환학생으로 프랑스에 간 우리가 오픈 마인드를 가지고 다른 이들과 소통하려고 노력하는 것입니다. 
(아래 사진은 제가 살던 집입니다. ^^)"
