gen_info,env_info,food_info,study_info,office_info,facil_info,mhct_info,help_info,etc_info
"릴은 빠리에서 북쪽으로 220km정도 떨어진 곳에 위치하였으며. 자동차로3시간, TGV로 1시간 거리이다. 벨기에와 국경을 두고 있는 도시라, 기차타고 45분정도만 가면, 브뤼셀에 도착한다.그리고 벨기에 국경의 작은 마을까지는 릴에서 버스를 타고도 갈 수 있다고 한다.

릴3대학은 시내에서 지하철로 10분-20분정도 떨어진, 조용한 동네에 위치하고 있다.학교는 크게 A,B동과 서너개의 작은 건물, 그리고 도서관이 있는데, 강의실들이 미로처럼 분포되어 있어서 첫시간 들어가기 전에 강의실을 미리 확인하고 가는 것이 좋다. 학생들에게 물어보아도, 모른다고 하는 경우가 대부분이라, 학기 초에는 건물 로비에 안내데스크가 있어서 도움을 받을 수 있다.
전에 알고 있기로는, 프랑스의 대학은 캠퍼스 개념이 없고, 그냥 건물만 덩그러니 있다고 들었었는데, 릴3대학은 생각외로 컸었다. 

날씨는, 겨울에는 우중충한 날들이 많아서, 항상 우산을 들고 다녀야 했다. 그리고 봄이 되어도 쌀쌀한 날씨 덕에 4월까지도 겨울옷을 가끔씩 꺼내입었었다. 하지만 날씨가 본격적으로 따뜻해지기 시작하면, 맑고 화창한 날들이 이어진다.","pont de bois 지하철역이 있고, 그 지하철역에는 버스 노선도 여러 개가 있어서, 아침이면 학교쪽으로 우르르 걸어가는 학생들을 볼 수 있다.
학교 주변에는 작은 카페테리아들이 있고, 한 10분정도 걸어가면 시청이 나오는데, 시청 바로 앞의 쇼핑몰에 대형 마켓과 음식점들이 많이 있어서, 가끔씩 점심을 해결하거나, 수업 후 장을 봐서 기숙사 들어가기 편리했다.
학교 주변은 모두 주택가여서 조용했고, 학교 뒷편에 자리한 체육관과 작은 공원 덕에 개를 데리고 산책나온 주민들도 많이 볼 수 있었고, 나 역시도 그길을 걸으면서 산책하기도 했다.","ISEP으로 릴3대학에 오면, Robespierre 기숙사에 살게 된다. 프랑스의 대학 기숙사는 CROUS라는 곳을 통해서 운영되는데 릴에 있는 CROUS 기숙사 중에서 Robespierre가 시설이 제일 좋은 곳이었다. 그리고 국제 기숙사로 외국 학생들이 많이 살고 있으며, 유학 온 한국 사람들도 만날 수 있었다.

방은 혼자 이용하는데, 9m2의 넓이에, 침대 책상 책장 옷장 세면대 작은 부엌에 냉장고까지 있었다. 처음에는 방이 좁아 보이지만, 가구를 이동시켜 구조를 바꾸면 충분이 넓게 사용할 수 있다. 
기숙사 안에는 탁구장,TV실, 자율학습실. 도서실, 헬스장, 세탁실이 있어서 사무실에 키를 맡기고 자유롭게 사용할 수 있다. 세탁실은 일주일에 한번식 예약제로 운영되어 서두르지 않으면 방에서 빨래를 하거나, 기숙사보다 세배 비싼 가격에 (기숙사는 1유로. 사설 빨래방 3유로)에 밖에서 빨래를 해와야한다. 화장실과 샤워실은 공동으로 이용했다. 아주 깨끗하지도 않았지만, 아주 더럽지도 않아서 이용하는데 불편한 것이 없었다. 하지만, 샤워부스가 작은 편이라 처음에는 불편할지도 모르겠지만, 나중에는 익숙해진다. 

식사는 대부분 기숙사에서 해먹었고, 점심때에만 학교 식당을 이용했다. 식당이 세 곳 있고, 샌드위치만 따로 파는 곳도 있어서, 학교에서 점심을 해결하는 것은 문제가 없었다.
ISEP교환학생은 한국에서 식비를 포함한 기숙사비를 내고 오는데, 이 곳에서는 따로 기숙사 없기 때문에 식비조로 한 학기에 1200유로씩 수표를 받았다. 
혼자 방을 쓰고, 또 남 하는 일에 간섭하지 않는 프랑스학생들이라 자칫하면 방에 박혀 외로움을 탈 수도 있겠지만, 직접 요리하고 친구들을 불러서 같이 먹고, 파티도 하면서 사람들을 사귈 수 있는 기회를 만든다면, 요리하는 일이 귀찮게만 느껴지지는 않을 것이다.","프랑스 대학의 수업은 한국과는 상당히 달랐다. 우선, 학생들은 과목의 선택 폭이 작았다. 이미 시간표가 다 짜여진 상태로, 그 시간표를 그대로 가지고 수업을 들었으며, 옵션을 두어, 그 항목에서만 자율적으로 수업을 선택해서 들을 수 있었다.
따라서 수강신청이라는 개념이 따로 없고, 첫 시간에 가면 선생님이 종이를 나눠주고 이름과 학생카드 번호, 생년월일 등등을 적도록 한다. 수강신청은 당연히 인터넷, 컴퓨터로 하겠지 하고 생각했던 나는 상당히 당황스러웠다. 그리고 심지어는, 시간표 조차도 인터넷으로 검색할 수 없었다. 시간표는 단과대 게시판에 쭉 붙어 있어서, 그것을 일일히 확인하고 시간표를 짜야해서, 개강하고 나서도 일주일이 넘도록 머리를 싸맸던 기억이 있다. 그리고 릴3대학은 12주 과정에 대부분 수업들이 일주일에 한번밖에 없어서, 우리학교에서 학점인정을 받기 위해서는 여러과목들을 묶어서 3학점짜리 전공과목을 만들어야 했다. 이것 역시 상당한 골칫거리였다. 

수업은 크게 두 종류로 나누어진다. 계단식 강의실에서 하는 것과, 일반 강의실에서 하는 것.
계단식 강의실에서 하는 수업은 몇백명의 학생들이 앉아있고, 앞에서는 교수님이 강의를 하는데, 불러주는 내용을 받아적는 분위기이다. 불어가 완벽하지 않은 상태에서 이런식의 수업에 적응하기가 힘들었다. 그래서 친구들 노트를 빌리고, 참고서적을 가지고 따로 공부하는 시간을 많이 들여야 했다. 참, 프랑스아이들이 필기하는 것을 보면 약자와 기호를 상당히 많이 쓰는데, 미리 공부를 하고 간다면 도움이 될 것이다. 
발표와 토론은 일반 작은 강의실에서 20명 30명씩 하는 수업에서 이루어지지만, 발표와 토론 보다는 일방적으로 말하고, 받아적는 수업분위기가 대부분이다. 불문학수업의 경우는 가끔 발표와 토론이 이루어지기도 했었다. 

도서관은 각 과별로 작은 도서관들이 있고, 중앙도서관은 3층짜리 건물이 따로 있었다. 책이 많은 것은 좋았지만, 이상하게 도서관에서 떠드는 사람들이 많았다. 사서가 주의를 주기는 하지만 그것이 오래 지속되지는 않았다. 그리고 공립이다보니 일반 주민들도 이용할 수 있었고,우리학교처럼 24시간 개방은 상상할 수 없다. 보통 오전 8시 반에 열어서, 오후 7시, 8시 쯤에 닫는다.","louise와 virgini 두 사람이 외국으로부터 오는 교환학생을 맡아서 담당하고 있다. 
하지만 한학기에 오는 학생들의 수가 100여명이 넘고, 일은 두사람이 처리하는 탓에, 일처리 속도가 느리고, 항상 갈 때마다 줄을 서있어야 했지만,사람들은 친절했다. 
싼 가격에 당일 치기로 갔다올 수 있는 여행이나 여러 파티들의 정보를 얻고 싶다면, 또 다른 나라에서 온 교환학생들을 만나고 싶다면 자주 들리시길.","동아리 활동은 따로 하기 힘들었다. 여러 클럽들은 있었지만, 언어문제로 인해 또 수업에 따라가기 힘들기때문에, 사실상 마음적인 여유가 생기지를 않았다. 하지만, 학교 안에 있는 KINO(영화관)에서 학생할인에 싸고 좋은 영화를 많이 보았고, 도서관에서 CD, DVD를 빌려서 보기도 했었다.
alphabet이라는 동아리가 있었는데, 그곳을 통해서 연극표도 싸게 구해서 봤고, 그 동아리에서 주최하는 파티에 자주 참여한다면, 친구들을 사귈 기회를 더 많이 가지게 될 것이다.
그리고 릴 3대학에는 체육수업이 다양하게 있다. 나는 테니스를 들었는데, 실내코트와 실외코트 두군데를 이용해서 두학기 동안 재밌게 수업을 들었다. 건강도 건강이지만, 운동하면서 프랑스인 친구들을 더 쉽게 사귈 수 있었다.","특별히 culture shock라고 할만한 사항은 없는데,
기숙사가 있는 동네에 아랍사람들이 많았다. 기숙사 바로 앞에는 이슬람 사원도 있고. 그리고 간혹가다 이상한 사람을 만나면, 동양인이라고 놀리거나 괜히 장난치기도 하는데, 신경쓰지 않고 지나쳐버리는 것이 나을 것이다. 

개방적인 나라라고 알려져 있는 만큼, 그런 모습들을 많이 보았다. 하지만, 놀라서 어리둥절하기 보다는, 받아들이고 알아가려고 노력했었다. 덕분에 큰 문화적 충격이나 충돌없이 무사히 1년을 보낼 수 있었다.","수업들으면서 문제가 생긴다면, 주저하지말고 교수님과 이야기 해 보길.의사소통이 잘 되지 않더라도, 이야기를 하고 도움을 청한다면 수업받기가 훨씬 수월해 질 것이다.
간간히 무섭고 엄격한 교수님들도 계시지만, 워낙에 교환학생들이 많은 학교라, 대부분의 경우는 조언도 해주시고, 도움도 많이 주시는 편이다. (운 좋게도 나는 그런 사람들을 몇분 만날 수 있었다.)

그리고 릴에는 예상외로 한국 사람들이 많았다. 초반에 학교 안에 있는 어학당에 어학연수 온, 또는 유학준비중인 한국 학생들의 도움을 많이 받았다. 특히 은행 계좌와 체류증에 관련된.
그리고 기숙사에도 한국 사람들이 있어서, 오가면서 서로 도움을 주고 받을 수 있었다.","외국에 나가서 생활 한다는 것이, 그렇게 낭만적인 것 만은 아니라는 것을 이번기회에 확실히 깨달았다. 
처음에 가서 적응하고 수업듣느라 이런저런 고생을 했던 생각을 하면, 아직도 식은땀이 나지만, 그 시간이 있어서 더 알차게 보낼 수 있었던 것 같다. 고생하면서 첫학기를 보내고나서, 다음학기에 새로온 친구들을 도와주며 더 많이 친해질 수 있었고, 수업 듣는데에만 집중하던 시선을 다른곳으로 잠시 돌릴 여유도 가지게 되었다. 

새로운 곳에 정착하고 새로운 것을 보고 배우는 일은 설레는 일이기도 하지만, 고생스러운 일이기도 하다. 하지만, 힘들었던 만큼 더 많은 것을 얻어 올 수 있는 것 같다. 
2월에 가서 2월에 돌아오는 꽉 찬 1년을 보내면서, 힘들어서 울던 날도 있었지만, 즐거운 일들이 훨씬 더 많았고, 여러 사람들을 만나고, 여러 삶의 모습들을 보면서 많은 것을 느낄 수 있었던 한 해였다. 
3학년 2학기, 4학년 1학기. 대학생활의 후반부. 어찌보면, 취업준비하면서 도서관에 틀여박혀 보내는게 더 나았을지도, 하는 생각을 하는 사람도 있을 것이다. 그래도 교환학생시절을 보내지 않았다면, 졸업하면서 더 많은 후회를 했을 것 같다."
"릴 3대학은 인문계 학과들만 모여 있기 때문에 규모는 우리 학교에 비해 자그마하다. 학교에서 릴 시내까지는 지하철로 5-10분 정도 걸리는 거리였고 내가 살던 기숙사에서 학교까지는 버스든 지하철이든 걸어서든 20분 정도 걸리는 거리였다. 릴의 날씨는 여느 유럽처럼 날씨가 변덕스럽다. 그래서 우산은 상비하고 다녀야 한다. 나는 봄학기에 파견되어 한학기를 보냈는데 3월말 4월초 까지도 두꺼운 옷을 입어야 했고 5월에는 또 갑자기 여름 날씨가 되어 반팔 티, 나시 티를 입고 다녀야 했다.",학교에서 시내도 가깝고 시청 부근의 쇼핑몰도 가까운 편이다. 학교 근처는 주택가이기 때문에 몹시 조용하다.,"릴에는 대학 기숙사가 4,5개 되는 것으로 알고 있는데 내가 묵었던 기숙사는 robespierre 라는 곳이었다. 교환 학생들이 묵는 기숙사 중에서는 시설이 가장 좋은 곳이었다. 방 안에 부엌이 딸려 있기 때문에 밥을 해먹기도 좋고 다른 기숙사들에 비해 깨끗하다. 기숙사 안에 탁구장, 독서실, 헬스장, 텔레비전실이 있어서 종종 이용하면 좋다. 세탁실이 있긴 한데 예약제라 빨리 가는 사람만이 세탁을 할 수 있기 때문에 나는 늘 방 안에서 손빨래를 했다. (프랑스 세제는 독해서 담가두기만 해도 때가 다 빠진다.) 아침과 점심은 방에서 해 먹었고 점심은 학교에 있는 학생 식당에서 해결했다. 학생 식당이 메뉴에 따라 3 곳으로 나뉘고 샌드위치를 파는 곳도 따로 있기 때문에 점심 때문에 고생할 일은 없을 것이다. 기숙사 주변에 큰 슈퍼마켓이 두 곳 정도 있으니 장은 거기서 보는 것이 좋다. 또 시내쪽으로 나가면 중국 시장이 있으므로 혹 한국 음식이나 재료가 필요할 때는 이 곳을 이용하는 것도 좋다.","릴 3대학은 우리와는 학사 시스템이 많이 다르다. 우리처럼 교양, 전공을 자유롭게 선택하는 분위기가 아니고 정해진 전공의 수업들만 짜여진 시간표 대로 수강하는 방식이다. 그래서 수강신청 할 때 고생을 꽤나 했던 기억이 난다. 게다가 인터넷으로 수강신청 하는 건 꿈도 꿀 수 없고 직접 각 단과대학 건물 마다 돌아다니며 개설 과목을 확인하고 알아서 학년과 관심에 맞는 수업을 골라야 한다. 우리와 학점 계산 체계도 달라서 수강 신청할 때 꼼꼼히 시간수를 따져보고 부족한 시간 수 만큼 비슷한 과목을 채워야 한다. 참고로 나는 15학점을 인정 받기 위해 15개의 수업을 들어야만 했다. 릴 3대학에는 교환 학생들을 위해 일주일에 두시간씩 불어 수업을 진행한다. 이 수업은 크게 불어 향상에는 도움이 되지 않았지만 다른 교환 학생들과 만나서 얘기하고 정보도 교환할 수 있는 기회 작용을 한 것 같다.  프랑스에는 토론식의 수업이 많을 것이라고 예상했는데 이 예상은 빗나갔다. 릴 3대학에서는 대부분의 수업이 교수님이 불러주고 아이들은 받아 적는 식이다. 그래서 교수님의 발음이 불분명하거나 소리가 울리는 강의실에서 진행된 수업은 수업 따라가는데 애를 먹었다. 시험 기간에는 다른 아이들의 노트 필기를 빌리기도 하고 강의 교재에 의존해서 공부를 해야만 했다. 꼭 당부하고 싶은 것은 수시로 각 대학 게시판을 확인하라는 것이다. 대학 게시판이 알림이 역할을 하기 때문에 수업과 관련된 모든 사항들은 게시판에 공고가 된다. 휴강이라든지 시험기간이라든지 과제 제출에 관련된 것들도. 나는 처음에 이것에 적응되지 않아서 휴강이 된 줄도 모르고 30분씩 혼자 교수님을 기다리던 적도 몇 번 있었다. 도서관은 우리와 마찬가지로 중앙 도서관이 있고 각 단과대학 별로 도서관이 있다. 열람실이라는 개념은 따로 없고 우리 학교 중도 2,3층과 같은 형태로 되어있다. 중앙 도서관은 우리 학교 도서관 정도의 규모이다. 난 이용한 적이 없지만 도서관 1층에는 비디오나 dvd를 빌려주는 곳도 있으니 이용하면 좋을 듯. 참고로 프랑스 학생들은 예의 개념이 부족해서인지 도서관 안에서도 그다지 조용하지 않다.-_-; 사서들이 종종 주의를 주긴 하지만 별로 도움은 안 되는 듯. 그냥 적응해서 공부하는 수 밖에.",학기 시작할때는 뻔질나게 드나들었는데 막상 수업 시작하고나서부터는 딱히 갈일이 없었던 것 같다. 국제 교육부 사람들은 친절한 편이다. 그 중 루이자라는 사람은 한국인 친구도 있어서 한국 사람들에게 남다른 관심을 갖는 편임.,대학 안에 kino 라는 극장 겸 공연장이 있다. 여기서 하는 영화들은 학생일 경우 할인을 받을 수 있다. 축제 기간이나 특별한 페스티벌 기간에는 이 곳에서 다양한 공연들도 하니 평소에 포스터나 팜플렛을 꼼꼼히 읽어두었다가 한번쯤 가보는 것도 좋을 것이다. 학교 뒤에는 테니스장도 있으니 주말에 이용하는 것도 좋을 것이고 학교 뒤에 있는 넓은 잔디밭은 휴식을 취하기에 안성 맞춤이다. 개똥이 많다는 얘기를 들은 뒤론 마음껏 드러눕지는 못했지만 주변을 산책하기도 좋고 조깅하는 것도 좋다. 릴 3대학에도 동아리나 서클활동이 있다. 하지만 안타깝게도 말이 서툴고 시간이 부족했던 난 감히 동아리 활동은 하지 못했다. 하지만 용기 있는 사람은 교환기간 동안 동아리 활동을 하기를 권한다. 의외로 프랑스 학생을 만날 기회가 평소에는 많지 않기 때문에 이런 활동을 통하면 프랑스 학생들과 접할 수 있을 것이다.,"기숙사 부근에 아랍 사람들이 많아서 처음에 적응이 잘 안 되었다. 기숙사 바로 맞은편에 이슬람 사원 같은 건물도 있고. 그들이 유난히 동양 사람을 '밝혀서' 괜히 지나가면 말을 걸기도 하고 놀리기도 하지만 그럴 때일수록 더욱 당당하게 다니는 용기가 필요한 것 같다. 
보수적인 우리나라와는 다르게 한없이 자유롭고 개방적인 나라이다보니 간혹 본의 아니게 실수를 할 때도 있었고 무슨 말인지 몰라서 어리둥절할 때도 있었다. 그래도 새로운 문화와 사고를 접할 수 있었다는 데에 의의를 두고 싶다.",,새로운 사회를 보고자 교환학생을 신청했고 비록 한학기였지만 많은 것을 느끼고 돌아왔다. 어디서든 마찬가지지만 자기 하기 나름이라고 생각한다. 나는 교환학생 파견되기 전에 파리에서 어학연수를 4개월 정도 했고 교환학기 까지 합쳐 1년 정도의 시간을 프랑스에서 보냈다. 짧지만 긴 1년 동안 주어진 기회를 최대한 이용하고자 여행도 많이 다니고 새로운 것도 많이 접해 보았다. 가만히 앉아 있으면 주어지는 것은 아무 것도 없다. 자신이 먼저 다가가고 나서서 찾아봐야 돌아오는 것이 있다. 나는 프랑스에서의 지난 1년이 대학 생활 동안 가장 값진 1년으로 기억된다. 그리고 기회가 있으면 또 한번 가고 싶다.
