gen_info,env_info,food_info,study_info,office_info,facil_info,mhct_info,help_info,etc_info
"대학교 캠퍼스는 한국의 캠퍼스의 모습과 굉장히 비슷합니다. 캠퍼스는 굉장히 큰 편이며 학교 캠퍼스 내에 규모가 큰 피트니스 시설이 있습니다. 학교 주변에 큰 시설은 많이 없고, 주거 단지와 학교가 거의 다입니다. 캠퍼스는 다운타운과는 거리가 있는 곳에 위치하고 있어 다운타운으로 가려면 버스를 타고 15분 정도 이동해야 하는 곳에 위치하고 있으며, 시내는 런던 다음으로 큰 도시인만큼 꽤 발달해 있고 번화합니다.런던으로 이동할 수 있는 기차를 탈 수 있는 곳이 이 시내이며, 이 곳에서부터 대략 2시간정도 기차를 타면 런던 시내에 도착할 수 있습니다. 날씨로 악명 높은 영국이다 보니, 지내는 내내 흐린 날씨가 많았습니다. 특히 11월 정도부터는 일몰이 급격하게 짧아져 3시 40분 정도면 해가 지기 시작하고 4시 30분정도면 아예 일몰이 다 되는 정도였습니다. 날씨가 괜찮은 날에도 3시가 넘어가면서 흐려지기 시작하거나 비가 오기 시작하는 날들이 많았습니다. 그래서 날씨가 좋은 날에는 일부러 산책을 많이 하고 해를 많이 보려고 했습니다. 체감하기에는 런던보다 버밍엄의 날씨가 조금 더 안 좋은 것 같았습니다. 일몰이 빠르고 주위에 시설이 많은 편은 아니라 늦은 오후에는 크게 할 것이 없습니다.","대학 주변에 크게 놀거리는 없습니다. 학교 근처에 Selly Oak 구역에 주거지가 있고, 술을 파는 가게나 음식점, 그리고 마트가 있습니다. 여기 한인마트도 있는데, 한국과 가격차이가 많이 나지 않으니 한국에서 굳이 한국 식재료 사오지 않아도 괜찮을 것 같습니다. 시내에는 영화관, 쇼핑센터들의 시설이 있고 옷이나 화장품을 사려면 시내에 가는 것이 좋습니다.","Vale Village라는 기숙사에 배정이 되어서 계약서 조항 상 밀플랜이 있었습니다. 밀플랜은 미리 일정한 금액을 기숙사비에 포함해서 납부하면, 개학 후 1주일마다 한번씩 학생증으로 학내 식당이나 카페에서 쓸 수 있는 금액이 입금됩니다. 밀플랜을 사용하면 구내 식당들을 10프로 할인 된 금액에 이용할 수 있습니다. 학교 내 카페 Costa에서도 이용할 수 있으나, 기숙사 1층에 있는 식료품점에서는 사용할 수 없습니다. 요리를 하고싶지 않은 분이라면 밀플랜을 신청하는 것도 괜찮을 것 같습니다.다만, 영국은 식료품 물가에 비해서 외식 물가가 비싸다 보니, 할인을 받아도 한끼에 9000원정도는 들고 음식이 맛이 있는 편은 아닙니다. 그리고 식당별로 여는 시간이 정해져 있고, 저녁에 여는 식당들은 한정적이니 참고하시면 좋을 것 같습니다.저는 Vale Village의 Shackleton 기숙사에 거주했습니다. 학교 측에 신청한 제 우선순위에 없는, 가고 싶지 않은 기숙사였습니다. Vale Village는 학교 외부 기숙사를 제외하고는 학교에서 가장 먼 기숙사입니다. 앞에 호수를 끼고 있어 산책을 하기에는 좋았으나, 학교까지 도보로 20분은 걸려서 왔다 갔다 하기는 좀 불편합니다. Shackleton의 경우 앞서 말한 것 처럼 밀플랜이 의무로 신청되는 기숙사 입니다. 때문에 요리를 해 먹고 싶거나, 한식을 자주 먹을 것 같은 학생들에게는 추천하지 않습니다. 그리고 Shackleton은 Shared로, 기숙사 하나에 여러 개의 Flat (집,아파트)가 있고, 그 Flat 안에 여러 명이 같이 거주하면서 화장실과 부엌, 거실을 공유하는 형태입니다. 각자 침대와 옷장, 책상이 있는 개별 방에서 거주하며, 개별 방은 잠그고 생활할 수 있습니다. 다만, Shackleton의 경우 밀플랜이 강제되는 기숙사여서 다른 기숙사에 비해 주방이 굉장히 협소합니다. 또한, Shackleton 1층에는 바가 있어서 12시정도 까지는 음악소리가 어느정도 들리고 시끄러운 편입니다. 수요일이 Sports Night이어서 이때 한국 대학교 응원가 같은 것을 바 바로 밖에서 부르기도 하는데, 굉장히 시끄럽습니다. 고층 분들은 좀 덜 시끄러울 수도 있겠으나 저는 바 바로 위 2층에 거주해서 소음 때문에 스트레스를 많이 받았습니다. 소음에 민감하신 분은 주의해주세요. 기숙사 신청 시 어느정도 선착순의 영향을 받는 부분이 있으므로, 오래 고민하지 마시고 최대한 빨리 신청하는 게 좋습니다.","한번 수업을 신청하게 되면, 수강 변경을 하는 것이 한국에 비해서 조금 복잡하고 일처리가 굉장히 느립니다. 때문에 수업을 신청할 때, 한학기 이수 학점과 과목 실라버스를 참고해 신중히 선택하시길 바랍니다. 수업에서 리딩 과제가 있는 경우가 많은데 굳이 해오라고 강조하지 않고 와이섹에 해당하는 학습 지원 페이지에 올려 놓는 경우도 많으니 알아서 잘 확인해야 합니다. 도서관은 한국 대학교 도서관과 달리, 수업에 필요한 전공 교재들이나 수업 지정 도서들만 있는 정도입니다. 한국 도서관처럼 다양한 교양 서적이나 소설 등이 구비되어 있지는 않습니다. 도서관은 메인 캠퍼스에 있으며, 학생증으로 출입하고 자리는 별도 예약 없이 사용하시면 됩니다.","저는 여러 상황으로 조기 귀국하게 되었는데, 연세대학교 측 담당자분들이 많은 도움을 주셨습니다. 현지의 담당자 분들은 메일을 5번은 보내야 한번 정도 답변을 해주시며, 큰 도움이 되는 편은 아닙니다.","학교에서 동아리활동 하는 것이 굉장히 자유롭고 편한 편입니다. 동아리 회비도 2-5파운드 사이로 저렴하고, 참여도 강제적이지 않습니다. 소수의 공연동아리나 스포츠 동아리를 제외하고는 특별이 지원서나 면접을 보지 않습니다. 보통 개강 첫째 주나 둘째 주에 동아리 박람회에 메일을 적으면, 동아리 활동에 대한 메일이 오고 그때 참석해서 분위기를 보고 활동 여부를 결정하면 됩니다. 동아리를 3개 하는 학생들도 있을 만큼 부담이 크지 않습니다.학교에 중국인 학생들이 정말 많습니다. 특히 경영학과의 경우 영국 학생들의 선호도는 높지 않은 편이고, 중국 학생들의 선호도가 높아서 전공 수업에서는 반 이상이 중국인 학생들일 정도로 중국인이 많습니다. 처음에는 중국인 학생들이 무작정 중국어로 말을 걸어서 조금 당황스러웠는데 학교에서 지내다 보면 내가 중국인이라고 생각할 만도 하구나 라는 생각이 들만큼 중국인이 많고, 다른 아시아권 학생들은 그렇게 많지 않습니다.","영국 기숙사에서는 한 flat이 혼성인 경우도 많고, 기숙사에 이성을 데리고 오는 것을 대수롭지 않게 생각합니다. 저녁 늦게까지 공용 주방에서 이성을 불러 술을 마시는 경우도 많습니다. 이런 것을 특별히 미리 허락을 구하는 분위기도 아닙니다.그리고 클럽이 영국의 노는 문화의 큰 부분인데, 클럽을 가기 전 보통 한 사람의 집이나 기숙사에 모여서 술을 마시고 클럽에 갑니다. 그런데 이때 집이나 기숙사에 초대를 받았다고 해도 그 사람이 술이나 먹을 것을 따로 준비해 주는 것이 아니라 각자의 술을 알아서 준비해 가는 것이니 혹시 그럴 일이 있다면 참고하시면 좋을 것 같습니다.","사실 교내외로 도움을 받을 수 있는 곳은 많이 없습니다. 우리나라에 비해서 학교 시스템이 체계적이지 않고, 느리고, 문제 한가지를 해결하려면 발품을 팔아 두세가지 단계를 거쳐야 합니다. 다만 저는 이미 있는 학생들에게 도움을 많이 받았습니다. 이미 학교에 다니고 있는 다양한 한국 학생들을 만나고 싶다면, 학기 초에 이메일로 안내해주는 여러 아이스브레이킹 이벤트에 참여해보길 추천합니다.",
"UOB는 런던 다음으로 큰 도시인 Brimingham에 위치해 있습니다. 2시간 30분이면 런던에 갈 수 있기 때문에 언제든지 빅벤과 런던 아이를 볼 수 있다는 장점이 있습니다. 기차표는 Trainline, London Northwestern Railway, (Cross Country)Train Tickets 등의 앱을 이용하시면 쉽게 끊으실 수 있습니다.가시기 전에 16-25 Railcard 발급을 추천드려요! Rail Card 소지시 학생 할인을 받을 수 있습니다. 그리고 카드로 받을 건지 앱으로 받을 건지 물어보는데, 꼭 앱으로 받으세요! 기차 탈 때마다 Rail Card를 보여드려야 하는데, 카드는 분실 소지도 있고 깜빡하고 안 들고 탈 가능성이 많으니, 간편하게 앱으로 받으시는 것이 더 좋습니다. 학교 캠퍼스는 자체 크기가 굉장히 큰 편은 아니지만, 기숙사까지 합치면 상당히 큰 면적을 차지하고 있습니다. 저는 학교에서 가깝게 위치해 있는 기숙사에서 지냈는데, 강의동까지 걸어서 대략 25분 정도 걸렸던 걸로 기억합니다. 영국은 하루에 최소 2-3번은 비가 오다 안오다 하기 때문에 우산을 항상 지니고 다녀야 합니다. 저는 바람 때문에 우산이 부러져서 그냥 비를 맞고 다녔는데요, 파견된 기간 동안 내내 감기를 달고 살았다고 해도 과언이 아닙니다. 여러분 부디 오시기 전에 감기약을 종류별로 구비해서 오시길 바랍니다. 저는 영국에서 산 약이 듣지를 않아서 한국에서 택배로 부쳤답니다...혹시 아프시면 GP에 방문해서 무료로 간단한 진찰을 받으실 수 있습니다. GP에 방문하실 때는 꼭 신분증을 지참해 주세요! 하지만 최소 2시간은 대기할 각오를 하고 가셔야 하기 때문에 안아프고 건강하게 생활하는 것이 가장 중요합니다!","Selly Oak주변에는 식당, 마트, 펍 등 편의 시설이 잘 갖춰져 있습니다. 학교에서 가장 가깝기 때문에 시장을 보시거나 외식을 하시려면 Selly로 가세요!  City Centre에 가시면 영화관, 쇼핑몰, 카페, 기차역 등 모든 것들이 다 갖춰져 있습니다. 옷이나 화장품, 신발 등 필요한 것이 있으면 이 곳을 방문하시면 됩니다. 영국에서 가장 유명한 것 중 하나인 Primark도 이 곳에 위치해 있습니다. 걸어서 갈 수 있는 Selly Oak와는 달리 City Centre는 학교에서 조금 떨어진 곳에 위치하고 있어 X22, X21등의 버스나 우버를 타야 갈 수 있습니다. 버스를 탈 때는 거스름돈을 환불 해 주지 않기 때문에 잔돈을 항상 맞춰서 지니고 다녀야 합니다. 학생증을 발급 받으셔서 기사님께 보여드리면 1파운드라는 할인된 가격에 타실 수 있으니 잊지마세요! 혹시 동전을 들고 다니는 것이 불편하시다면, City Centre Travel Centre에서  Swift card를 발급 받으셔셔 '버스카드'처럼 사용하실 수 있습니다. 충전식이기 때문에 발급 받으실 때 충전도 같이 하시길 바랍니다.","저는 The Vale Village에 위치한 Mason Halls에서 지냈습니다. 1인 1실 총 6인이 한 집에 살게 되며, 부엌과 거실을 공동으로 사용하는 구조였습니다. Mason은 밀 플랜이 포함되어 있지 않기 때문에 직접 요리를 해 먹었습니다. Flat mate들과 함께 요리도 해먹고, 영화도 보면서 정말 즐겁게 지냈습니다. Mason의 가장 큰 장점은 외관과 주변 환경이 정말 예쁘다는 것 입니다. 호수와 공원으로 둘러싸여 있고, 창문이 크게 나있기 때문에 방이나 거실에서도 아름다운 바깥 경치를 언제든지 감상할 수 있습니다. 단점으로는 빨래방이 건물 내에 위치하고 있지 않아 Tennis court나 Shackleton에 가서 빨래를 해야 한다는 점입니다. 또한, 마트가 Selly 쪽에 위치하고 있는데 Valed은 Selly와 정 반대에 있기 때문에 장을 보는 것이 조금 힘들다는 단점이 있습니다. (하지만 저는 다시 돌아간다고 해도 Mason에 거주할 것 같습니다.)","수업은 2시간 Lecture, 1시간 Seminar로 이루어져 있습니다. 강의 중심인 한국 교육 시스템과는 달리 Seminar을 더 중요하게 생각하여 상당히 다른 교육 방식을 갖고 있습니다. 각 Seminar 시간동안 발표와 토론등을 진행하고, 심리학 수업 같은 경우에는 간단한 실험을 진행하기도 하였습니다. 사전에 주어진 리딩 자료나 전 수업 내용을 토대로 진행되기 때문에 꼭 숙지하고 가시는 것을 권장합니다. UOB 도서관은 굉장히 넓고 쾌적한 환경을 제공하고 있습니다. 수업에 필요한 자료를 대출할 수 있고, 다양한 형태의 학습 공간에서 공부를 하실 수도 있습니다. 의자 높이와 책상 높이, 칸막이 유무 등 다양한 학습 공간이 있기 때문에 자신에게 맞는 자리를 찾아 공부하는 재미도 쏠쏠합니다. 또한, 1층에는 카페가 있는데 모카 커피가 가장 맛있습니다. 혹시 공부하다가 배고프면 이 곳에서 케익이나 샌드위치 등을 사 먹을 수 있습니다.","국제 교육부에서는 교환학생들을 위해 다양한 행사를 기획하고 잘 지내고 있는지 설문 조사 등을 진행하고 있습니다. 국제 교육부에서 주관한 Ice Breaking행사에 참여하였는데, 다양한 인종의 친구들을 만날 수 있어서 매우 즐거웠던 기억이 있습니다. 또한 신입생 파티도 있는데 티켓 가격이 70파운드가 넘어서 많이 고민 되실 거라고 생각합니다. 하지만 학교에서 주관하는 신입생 파티 뿐만 아니라 학교 주변 펍과 기숙사 등에서 크고 작은 파티가 많이 열리기 때문에 너무 걱정 마시고 다른 파티에 참여 하셔도 된다는 말씀 드리고 싶습니다.","학기 초에 동아리 박람회가 열리기 때문에 학교에 어떤 동아리가 있는지 자세히 알 수 있고, 그 자리에서 등록할 수도 있습니다. 스포츠 동아리 같은 경우에는 회비를 내야 하는 경우가 대부분인데, 학기 초에는 무료로 Trial을 몇 번 할 수 있으니 이것 저것 시도 해 보시고 자신에게 가장 잘 맞는 활동을 골라서 하시면 될 것 같습니다. UOB에 가시면 동아리를 하나쯤 꼭 들어가시는걸 추천드립니다. 동아리 활동을 하며 다양한 친구들을 만날 수 있고, 파티도 하며 현지의 삶을 더욱 잘 느껴볼 수 있기 때문입니다. 또한, 학교에서 주최하는 큰 행사인 Society's Night이 있는데, 이는 동아리 부원 자격을 갖춘 사람들만 참가할 수 있기 때문에 동아리 활동을 꼭 하셨으면 합니다! 저는 Kcover이라는 동아리에서 한 학기동안 활동 하였는데, 정말 좋은 친구들을 만나서 아직까지도 연락하며 지내고 있답니다! 혹시 동아리 들어가시게 된다면 Kcover soc을 추천드려요 : )","저는 인종차별을 당한 경험이 있습니다. 학교에서 Seminar을 들으며 토론을 하던 도중, 한 학생이 의도적으로 저를 소외시키고 말을 무시했습니다. 이에 대해 건의하자, 학교 측에서 상담 선생님을 붙여주고 이 문제에 대해 심각하게 받아들여 최선을 다해 해결해 주려고 노력하였습니다. 아이러니하지만 이 이후에 무시당하지 않기 위해 학교 생활을 더욱 열심히 했으며, 문제를 받아들이고 해결하는 학교 측의 태도에 감동 받아 애교심을 갖고 한 학기를 잘 마무리 할 수 있었습니다.","학교는 언제든지 학생들을 위해 열려있다고 생각합니다. 몸이 힘들거나 정신적으로 지칠 때는 언제든지 Welfare Team에게 연락하여 상담을 받아볼 수 있습니다. 또한, 각자 지정된 행정 선생님들이 계시기 때문에 이메일로 연락 드리면 수업이나 성적에 관해 도움을 받을 수 있습니다. 간혹 이메일 답장이 느리다는 친구들이 있었는데, 제가 소속되어 있던  Social Science 단과대는 오피스 방문 시 바로 일처리를 도와주셨습니다.","교환학생을 준비하던 것이 엊그제 같은데, 벌써 경험 보고서를 작성하고 있네요!한 가지 꼭 말씀 드리고 싶은 점이 있다면, 디저트의 강국인 영국을 택한 만큼 Sainsbury's와 Tesco에 있는 쿠키, 젤리, 초콜렛은 모두 드시고 오시길 바랍니다.그러지 못하고 돌아와서 정말 후회돼요...혹시 더 궁금한 점이 있거나, 제가 미처 설명 드리지 못한 부분이 있다면 언제든지 아래 이메일로 연락 주세요!sseohha@gmail.com"
"제가 있었을 떄는 4월 5월까지도 날씨가 꽤 쌀쌀했습니다. 생각보다 여름에 반팔, 반바지를 입을 일이 없고 비바람이 마니 부니 긴옷 위주로 챙겨가는 것이 좋습니다. 처음에는 에어컨이 기숙사에 없어서 좀 당황스러웠는데 에어컨이 필요없을 정도로 여름에도 시원합니다. 저는 오히려 밤에는 좀 추워서 두꺼운 옷을 입고 잔적도 많습니다. 언제 비가 올지 몰라 저는 항상 우산을 챙겨다녔습니다. 버밍엄은 런던까지 기차로 1시간 반~ 2시간 반이 걸리기 때문에 당일치기도 가능합니다. 기차표는 일찍 끊을수록 좋으니 미리 표를 구해놓으시길 바랍니다. Trainline앱을 이용하면 실시간으로 기차 연착 상태를 확인할 수 있고 표도 앱을 통해서 살 수 있으니 꼭 다운받아 가시길 바랍니다. 그리고 저는 개인적으로 6개월 교환학생들도 Railcard를 구매하는 걸 꼭 추천드리는게 레일카드가 있으면 어느 기차든 요금의 1/3을 감면해주기 때문에 확실히 3개월~6개월만 기차를 타도 여행을 많이 다니는 교환학생 특성 상 이득인 것 같습니다. 버밍엄 시내까지는 X20,X21,X22를 타면 빠르면 15분, 막히면 30분 정도로 도착할 수 있습니다. 미리 swift card라는 우리나라의 tmoney같은 교통카드를 만들어 놓고 버스 탈때 학생증을 제시하면 0.9파운드로 시내에 도착할 수 있으니 불편없이 다녔던 것 같습니다. 버밍엄 대학 자체는 나름 큰 편입니다. 중간에 도서관이 있어 좋지만 시험기간이 되면 도서관이 사람이 다 차서 자리가 항상 없습니다. 도서관 말고 공부할 곳이 마땅치 않아 아침부터 도서관에 자리를 잡는 경우가 많기 때문에 저는 기숙사에서 보통 공부를 했습니다.",대학 남쪽에 Selly Oak라는 동네에 학생들이 자취를 많이 합니다. 대학 북쪽은 Vale Village라는 버밍엄대학에서 제일 큰 기숙사 동네가 있습니다. Selly Oak에는 Seoul Plaza라는 한인 마트도 있고 Aldi나 Sainsbury등 다양한 식료품가게가 있어서 자주 이용했습니다. 서울 플라자는 웬만한 한국 식료품이 다 있기 때문에 힘들게 한국에서 다 가져오지 않아도 될 것 같습니다. Selly Oak는 밤에는 치안이 좋지 않아 혼자서는 절대 밤에 셀리오크 거리를 다니지 마시고 친구들과 함께 걸으면 좀 나은 것 같습니다.,"저는 Pritchatts House, Elgar Court, Tennis Court 세 기숙사를 살아봤는데 가성비 면에서는 Pritchatt House가 제일 좋았던 것 같습니다. 프리챗하우스는 방이 정말 넓고 방안에 미니냉장고와 세면대가 있어서 10명정도가 함꼐 사는 플랫이라도 막상 플랫메이트들을 만날일이 별로 없습니다. 화장실과 주방이 썩 좋은 편은 아니지만 저는 가격이 싸고 방이 굉장히 넓다는 점에서 만족했습니다. Elgar Court는 en-suite이기 때문에 불편한점 없이 잘 살았습니다. 방은 프리챗에 비해서 좁았지만 개인 화장실이고 주방도 더 깨끗하다는 점에서 비싼만큼 좋은 기숙사라고 생각합니다. 전 여름에 여길 살았는데 학기중에 살았다면 학교다니는게 너무 멀어서 힘들었을 것 같습니다. 영화관은 걸어갈 수 있는 거리에 있고 시내도 훨씬 가까워 위치는 장단점이 있는 것 같습니다. Tennis Court같은 경우는 방이 너무 좁아서 저는 가격대비 별로 추천드리지는 않습니다. 1년 살면서 마지막에 살았던 기숙사인지라 짐이 많았는데 공간이 턱없이 부족해서 좀 힘들었습니다. 그리고 모든 기숙사들 특징이 방음이 잘 안됩니다. 그래서 저는 그나마 방음이 잘되는 방이 넓은 기숙사들을 추천 드립니다.식사는 아무래도 가격대가 좀 있기 때문에 요리를 많이 해먹었습니다. 한국 음식이 생각날 때 Selly Oak의 Kimchi를 자주 갔는데 저는 영국에서 먹을 수 있는 한국 음식 치고는 굉장히 만족했습니다.","경제학과 수업은 다 10학점짜리 수업이라서 저는 매학기 6개의 과목을 들었습니다. 전공 6개를 듣는게 조금 버겁기는 한데 특히 1학기에 가시는 분들은 5월에 시험을 치기 때문에 어쩔 수 없이 열심히 들어야 할 것 같습니다. 보통 세미나 1시간 (세미나 없는 수업도 있습니다), 렉처 2시간으로 이루어져 있는데 렉처는 Panopto라고 녹음 영상 파일로 올려주시는 교수님도 계셔서 이런분들 수업은 나중에 복습하기 편했습니다. 세미나는 소규모 토론 또는 문제 풀이 수업이라 시험 준비할 때 많이 도움이 되었습니다.",International Student Office에서 학기초에 교환학생들 상대로 아이스브레이킹 세션을 엽니다. 여기서 저는 다양한 친구들을 만났고 이 뿐만이 아니라 global cafe등 교환학생을 만날 수 있는 이벤트가 많으니 참석하면  많은 외국인 친구들을 사귈 수 있습니다.,동아리가 정말 다양하게 있고 동아리 박람회도 매년 10월에 열리니 꼭 가보시는 걸 추천드립니다. 저는 동아리를 딱히 하지는 않고 Korean Society 이벤트를 많이 참여했습니다. Korean Society를 통해서도 다양한 친구들을 사귈 수 있으니 한번쯤은 치맥 파티 등 이벤트를 참여해보는 것 추천해드립니다.,특히 경제학과나 비즈니스 스쿨은 중국인 유학생들이 정말 많습니다. 수업의 반이상이 중국인이었던 수업도 많았습니다.,저는 비즈니스 스쿨에서 교환학생을 따로 관리하는 이메일이 있어서 그걸 통해 항상 연락했습니다.,1년 사는 사람은 학교에 Barclays은행이 있어 Barclays은행 계좌를 개설하는게 제일 좋아보입니다. 한 학기 교환학생들의 경우 Monzo카드가 있으면 확실히 편하다고 생각합니다.
