gen_info,env_info,food_info,study_info,office_info,facil_info,mhct_info,help_info,etc_info
"조그맣고도 큰 언덕이 많은 지역인 바스의 바스대학교는 밑에서부터 시작되는 넓고 큰 언덕의 위에 위치해 있습니다. 하지만 보통 학교 정문까지는 대부분 시내에서부터 버스를 타고 올라오기 때문에 굳이 걷고 싶은 것이 아니라면 언덕을 타야할 일은 드물 것입니다. (자주는 못하더라도 한 두번 쯤은 언덕을 걸으며 바스의 전경을 구경하는 것도 좋습니다.) 정문에 내리는 순간 캠퍼스 자체는 일직선의 양쪽에 건물들이 서있는 구조라 어느 건물에서 수업을 듣던 가는 길은 다 평지입니다. 그리고 정문에서 바라봤을 때 들었던 생각과는 다르게 캠퍼스가 작았습니다. 기숙사 건물들과 체육관 등을 제외한 강의 건물들만 고려했을 때 정문부터 일직선의 끝까지 10-12분 정도의 거리입니다. 캠퍼스 내에 측면의 계단을 통해 내려가면 넓은 잔디밭과 오리들이 걸어다니는 호수도 있습니다. 제가 있을 땐 날씨가 별로 좋지 않아 많이 시간을 보내보진 못했지만 화창한 날엔 친구들과 잔디밭에 앉아 여유로운 시간을 보내기에 좋을 것 같습니다. 바스 지역 자체는 남쪽에 위치해 런던까지 기차로는 1시간 40분, 버스로는 3시간의 거리입니다.보통 버스보다는 기차를 이용했는데 당일치기로도 갔다와봤지만 생각보다 시간적으로 여유롭지는 않았습니다. 기차와 버스 모두 할인된 학생가격으로 이용하실 수 있으니까 참고하시면 좋을 것 같습니다.기후에 있어서는 아무래도 제가 각오를 하고 가긴 했지만 그 각오로는 부족했다는 생각이 들었습니다. 특히 제가 지냈던 9-12월까지는 화창한 날을 보기 힘들고 대부분 흐린 하늘에 비가 왔기 때문에 밖에 나가는 것이 꺼려졌던 경우가 많았습니다. 비가 끊임없이 왔다 그쳤다가 반복되기 때문에 항상 우산을 가지고 다녔습니다. 매일같이 흐린 날을 보는 것이 좀 스트레스였습니다. 하지만 기온 자체는 많이 떨어지지 않아 지내는 내내 너무 춥다는 생각은 못해봤습니다. 크고 두꺼운 외투보다는 얇고 겹겹이 입는 것이 활동하는데 더 좋은 것 같습니다.","대학이 위치해 있는 큰 언덕에서 버스를 타고 15-20분을 내려오면 바스 시내가 있습니다. 딱 여유로이 거닐며 구경하고 쇼핑하기 좋다고 생각했습니다. 옷 가게, 작은 백화점, 마켓 등등 왠만한 것들은 다 있습니다. 그리고 시내 자체가 깨끗한 편인데다가 대표적인 다리(풀트니 브릿지)와 로만 바스 (로마 목욕탕) 등과 같은 유적지도 함께 끼고 있어 모던하면서도 역사적인 분위기가 공존하는 곳이라고 할 수 있습니다. 전체적으로 걸어다니며 시간 보내기 좋은 곳입니다.","이번 학기에는 교환학생들이 선택할 수 있는 기숙사는 pulteney court 또는 thornbank garden이였습니다. 두 기숙사 다 학교 캠퍼스 밖, 시내 쪽에 위치해 있습니다. thornbank의 경우 pulteney와 달리 방 안에 개인 화장실이 달려 있는 구조였기 때문에 좀 더 비싸긴 했지만 저는 thornbank를 사용했습니다. 학교에 더 가까이 위치한 pulteney는 버스로 15-20분, thornbank에서 학교까지는 버스로 25-30분 걸린다고 보시면 됩니다. 기숙사 자체는 지어진지 조금 오래된 건물이라 예쁘거나 깨끗한 걸 기대하면 안됩니다. 홈페이지의 사진 속에는 되게 깨끗하고 새것처럼 나와있지만 저는 처음 방에 도착했을 때 먼지가 많이 쌓여있고 창문 쪽에는 거미줄이 쳐져있어 경악했었습니다. 직접 깨끗이 치우고 적응하는 수밖에 없습니다. pulteney에 살았던 친구네 방에 갔던 적이 있는데 거기도 벌레가 많고 깨끗하지 않아 친구가 힘들어했습니다. 아침 일찍에는 쥐 같은 것이 움직이는 소리에 깼던 적도 있다고 했습니다. 그리고 맘에 들지 않았던 건 학교 측에서 매번 갖가지 ""수리""를 해야한다는 이유로 자주 방에 들이닥쳤습니다. 제가 방에 없을 경우 마스터키를 이용해 들어와 ""점검""을 하고 나갔습니다. 이런 일이 너무 자주 있어서 스트레스였습니다. 방과 방사이에는 방음이 잘 되지 않고 복도에서 누군가 떠들 경우 방에 다 들리기 때문에 소음문제도 은근히 있었습니다. 가끔 외국인 친구들이 복도에서 너무 길게 크게 떠들어 직접 조용히 해달라고 부탁한 적도 있었습니다. 주방은 한 층에 사는 친구들과 공유했는데 보통 여러 중국인 학생들이 정복했습니다. 중국 음식 냄새가 강하기도 하고 뒷정리를 제대로 하고 나가지 않아 주방이 자주 더러워졌었습니다. 기숙사 관리팀 측에서 일주일에 한 번씩 와서 청소해줬습니다. 영국 음식이 딱히 맛있지도 않고 비싸기 때문에 저도 주로 마트에서 장을 봐와서 주방에서 직접 해먹었습니다.","수업은 교환학생들을 상대로 열리는 modern british society와 전공 수업인 economics of banking, public choice, health economics, analytical development economics로 총 다섯개를 들었습니다. 첫 주 수업을 듣고 난 후에는 다섯 개 수업 내용이 너무 많고 벅찰 것 같아 걱정하고, 또 경제학부 내에서 국제학생들을 담당하는 것 같았던 분 또한 제게 4개만 듣는 것을 추천하셨습니다. 그래도 학점인정이 중요해 5개를 결국 다 들었지만 생각했던 것 만큼 벅차지 않았습니다. 강의 영상은 모두 사이트에 수업이 끝난 후 올라오기 때문에 혹시나 놓친 부분은 다시 공부할 수도 있었습니다. 영국의 경제학과에서는 한국과 달리 계산하고 문제풀이를 하는 것보다는 해석하고 뜻을 이해하는 것에 큰 중점을 둔다는 것을 크게 느꼈습니다. 특히 banking과 같은 수업에서는 실제로 수업시간에 매우 많은 식과 계산을 보았지만 결국 교수님이 더 중요시하셨던 건 식에 담긴 의미와 왜 식이 이렇게 쓰여져야 하는지, 직관적으로 보는 것을 더 중요히 생각하셨습니다. 기말시험에도 계산을 해야 하는 문제는 없었고 모두 서술 형식이였습니다. 그만큼 내 머릿 속에 내용의 개념이 잘 들어가 있는 것이 중요했습니다. 그래서인지 저는 이번 기회를 통해 경제학 자체에 좀 더 흥미를 느낄 수 있었습니다.  도서관은 5층건물인데 생각보다 작습니다. 예약하고 퇴실하는 기능이 없어 좀 불편했습니다. 특히 시험기간에는 자리가 전체적으로 꽉 차서 자리 찾기가 매우 힘들었습니다. 그리고 영국 학생들은 도서관 내에서 조용히 하는 것에 대해 한국 사람들과 다르게 느끼는 것 같았습니다. 도서관인데도 옆에서 여럿이 수근수근 떠들어서 많이 방해됐던 적이 빈번했습니다. 아예 특별하게 조용한 곳을 찾아가야 그나마 조용하게 공부할 수 있는 것 같습니다.",국제교육부에서는 학기 초에 신입생/교환학생들을 위해 welcome week라고 해서 많은 프로그램들을 열어줍니다. 일주일 내내 프로그램이 열리는데 원하는 것만 골라서 가면 됩니다. 다른 나라의 교환학생들을 사귈 수 있는 좋은 기회이니 다는 아니더라도 몇 개는 참여하시는 것을 추천드립니다.,"학교 내에 음식을 사먹을 곳이 몇 곳 있는데 맛은 없습니다. 저는 끼니를 채운다는 생각으로만 먹었습니다. 슈퍼마켓도 있는데 한국 음식, 식재료를 은근히 많이 팔아서 저는 그곳에서 자주 구입했습니다. 학교에서 밥을 먹어야 한다면 도시락을 챙기거나 큰 기대없이 학교 음식을 먹어야 할 것 같습니다.동아리는 여러 개 있습니다. 스포츠부터 춤, 음악, 학술적인 동아리까지 여러 종류가 있습니다. 제 주변에는 크게 동아리를 열심히 하는 친구가 없었어서 자세히는 모르겠습니다. 저도 초반에는 동아리를 들었다가 점점 시간이 지날수록 동아리 자체에 참여하는 인원도 줄고 시간대도 너무 애매해서 결국 끝까지는 못나갔습니다. 한국처럼 동아리 내에 동아리원들 간의 끈끈함은 없는 것 같았습니다. 서로 모르는 사이인 경우가 대부분이었습니다.","제가 가장 크게 느꼈던 점은 영국 학생들이 생각보다 개방적이지 않다는 것입니다. 캠퍼스에서 보면 영국 학생들은 영국 학생들끼리 다니고 동양인 학생들은 동양인 학생들끼리, 타 유럽 국가 학생들은 그 나라 학생들끼리 뭉쳐다니는 것 같았습니다. 제가 영국 학생들에게 다가가도 크게 친해질 수 있다는 생각은 못들었을 만큼 타국가에 대한 관심이나 개방성이 크게 없다고 느껴졌습니다. 그래서 영국 학생들이랑 친해지는 것이 어려웠습니다. 또한 미국식 영어에 길들여져 있는 제게 영국식 어휘는 조금 충격적이였습니다. 미국에 살며 일상생활에서 익숙하게 쓰던 영어 단어를 영국에서 썼을 때 어색하게 받아들여지는 경우에 조금 놀랐습니다. 그래도 영국 분들이 완전히 못 알아 듣는 경우는 아니니 생활하며 천천히 받아들이시면 제일 좋을 것 같습니다.",교내 외에서 도움을 받을 수 있는 곳은 딱히 없었던 것 같습니다. 크게 도움을 받을 일이 생긴 적도 다행히 없었고 사소한 문제들은 학교 내의 SU (Student Union)에 도움을 청하면 될 것 같습니다.,바스는 작고 예쁜 곳입니다. 잘 보존된 역사 속의 예쁜 마을을 보는 것 같습니다. 시내를 둘러싸는 크고 높은 주변의 언덕과 산들이 마치 바쓰를 감싸안고 있는 느낌입니다. 하지만 개인적으로 느끼기엔 학교 캠퍼스도 작고 학교 외에 할 수 있는 활동도 다소 제한적인데다가 영국 학생들과의 직접적인 교류를 하는 것도 어려웠습니다. 크고 바쁜 도시를 좋아하고 활동적이신 분이라면 바스 외의 다른 곳을 생각해보는 것도 좋을 것 같습니다.
"바스는 역사도 길고 영국에서 유명한 관광도시이지만 3시간이면 관광을 끝낼 정도로 작고 아담한 도시입니다. 하지만 규모가 작기 때문에 더 정이 가는 도시였습니다. 학교가는 경우 외에는 버스를 탈 필요가 없어서 예쁜 풍경과 아름다운 건물들을 거닐며 걸어다니기 좋습니다. 친구들과 놀 때도 다들 근처에 살아서 만나기도 편했습니다. 영국에서 가본 모든 도시 중에서 저는 바스가 제일 예뻤습니다. 건물들은 모두 밝은 꿀색이고 도시 주변을 초록색 언덕들이 둘러싸고 있어서 자연과 문명이 아울러진 너무나도 예쁜 도시입니다. 영국이기 때문에 비록 비도 자주 오고, 영국에서 손꼽히는 부자동네이기 때문에 물가가 런던만큼 비싸지만 그만큼 새벽 4시에 돌아다녀도 위험하지 않을만큼 안전하고 인종차별은 존재하지 않는 매너있는 도시입니다. 매일 같은 거리를 걸으면서도 너무 예뻐서 발걸음을 멈추고 같은 풍경을 몇 백장씩 사진찍게 만드는 곳입니다. 바스대학교는 생긴 지 60년밖에 되지않은 신설 학교인 만큼 규모가 매우 작고 미국 고등학교 건물을 생각나게 합니다. 학교는 시내에서 도보 40분, 버스로 15분 거리인 언덕 위에 소외되어있어 수업이 없는 날은 굳이 올라가지 않습니다.","바스대학교는 언덕 위에 있어서 대학 주변에는 자연과 주택들 밖에 없습니다. 다만 시내에는 모든 게 다 갖추어져 있습니다. tesco, sainsbury와 같은 영국 마트들은 기본이고,  관광도시이기 때문에 온갖 명품브랜드가 즐비해 있어서 쇼핑하다가 하루가 다 갈 정도입니다. IKEA랑 ZARA빼고 다 있다고 보시면 됩니다. 살기 완전 편했어요.","하지만 물가가 너무너무 비쌉니다. 영국에서 물가가 제일 비싸다는 런던보다도 비싸다고 느껴졌어요. 식당은 가면 기본 10파운드(한화 15000원 정도)가 넘습니다. 하지만 장바구니 물가는 한국보다 훨씬 싸서 그 돈으로 장보면 과일, 고기 다 사고 4일은 충분히 먹습니다. 그래서 친구들이랑 놀 때는 어쩔 수 없이 식당가서 먹었지만 그 외에는 혼자서 요리해먹었습니다. 한인마트는 없지만 중국인마트가 4개나 있어서 거기 안에 한국음식 다 팝니다. 비싼게 단점이긴 하지만 한국음식은 김치만 있으면 되니까요.","수업은 교환학생을 대상으로만 열리는 British Studies Courses 3개(Shakespeare, Writers of Bath and West Country, British History)와 POLIS학부에서 열리는 수업 2개(Culture and National Identity, European Film)를 들었습니다. 교환학생끼리만 듣는 수업만 들으면 영국현지 학생들과 교류가 없을까봐 2개 수업을 신청한 건데 솔직히 말하면 영국인 학생들 특유의 무뚝뚝함과 교환학생과는 친해질 생각없는 현지학생들 특징이 합쳐져서 절대 현지 학생들과 수업 하나 같이 듣는다고 못친해집니다. 솔직히 수업들도 연대에서 듣는 진행방식과 차이가 없다고 느껴졌습니다. 오히려 British Studies Courses가 너무나도 좋았던게 일단 교환학생을 위한 수업이기 때문에 소규모라서 교수님들이 학생들한테 관심이 엄청 많으시고 수업에 대한 열정도 뛰어나십니다. 그리고 교환학생 자체가 새로운 문화에 대해 열린 태도를 가지고 온 친구들이기 때문에 친해지기도 쉽고 따로 만나서 놀 정도로 친해지지 않는 친구들도 수업 시작전에는 같이 담소나누고 종강했을 때 눈시울 붉히며 포옹도 하고 헤어질 정도로 가깝게 지냅니다. 도서관은 학교에 있는 도서관과 시내에 Virgil Building에 있는 도서관 2개가 있는데, 학교에 있는 도서관은 24시간이지만 virgil building에 있는 시내 도서관(시내에 있을뿐 바스대학도서관입니다)은 저녁8시면 문을 닫습니다. 하지만 학교까지 올라가기 귀찮아서 항상 virgil버질 도서관에 가서 과제를 했습니다. 그리고 개인적으로 아쉬웠던 점은 바스대학교는 공대중심 학교이기 때문에 도서관에 문학서적이 거의 없습니다. 독서를 좋아하는 저는 그래서 시내에 있는 waitrose라는 마트 안에 있는 바스 시티 도서관을 무료로 등록해서 책을 빌려 읽었습니다. 제인에어, 셜록홈즈를 비롯한 영국대표소설은 물론이고 좋은 책들도 많고 평화로운 동네 도서관이라 자주 애용했습니다.",국제교육부에서 프로그램을 엄청 많이 열어줍니다. 왠만하면 학기초에 있는 행사들은 다 가세요. 저는 첫주에 거기서 만난 외국인 친구들이랑 친해져서 한학기내내 무리지어 같이 놀았습니다. 이메일보내면 바로 답장 오는 것같고 문의사항있으면 언제든지 친절하게 도와줬던 것 같습니다.,영국 현지 친구들과 친해질 수 있는 방법은 솔직히 말해서 동아리 뿐입니다. 하지만 동아리가 한학기만 등록이 안되고 무조건 1년 단위라서 1년 회비인 50파운드인가를 내야합니다. 동아리 종류가 정말 다양하고 친목동아리인 연대동아리와는 다르게 정말 등산동아리면 매주 브리스톨로 등산하러가고 승마동아리면 정말 승마 자주하러 가는 그런 빡센 동아리입니다. Boxing 동아리 신청한 친구가 있었는데 매주있는 훈련이 너무 빡세서 근육통으로 고생을 할 정도였습니다.저는 한학기만 있을거라 돈아깝다 생각해서 신청안했는데 정말 현지 친구들 사귀고싶고 해당 동아리가 너무 마음에 들면 추천합니다. 다만 시간도 많이 뺏겨서 저는 차라리 그 시간에 다른 교환학생 친구들이랑 놀았습니다.,어렸을 때 외국에서 살았던 경험이 있어서인지 컬쳐쇼크는 없었습니다. 다만 한국사람들 안에서도 서로 다양한 취미와 성격을 가지고 있듯이 외국애들도 마찬가지로 성향이 다 다릅니다. 외국인 교환 친구들 사이에서도 저랑 성향이 맞는 친구들과 다니니까 문화충돌도 없고 재밌었습니다. 동양인 교환학생이 매우 적고 대부분 유럽에서 왔지만 진짜 소수를 제외하고는 제가 다가갔을 때 싫어하는 기색이 없었습니다. 다양한 나라의 문화를 경험해보고 싶어서 한국문화에 우호적인 친구들도 엄청 많아서 친구 사귀기 정말 쉬웠습니다.,"오티기간에 학교에서 도움받을 수 있는 곳 연락처랑 이메일 다 줍니다. 그리고 타지에서 한국인만큼 의지되고 도움받을 수 있는 사람이 없는데, 바스대학교의 장점이자 단점이 한국에서 파견나온 한국교환학생은 연세대학교에서 온 교환학생 2명 뿐이라는 것입니다. 그래서 외국인 친구를 사귀기 쉽긴 하지만 의지할 사람이 서로밖에 없기도 합니다. 그래서 저는 바스대학교를 다니는 한국인 유학생들의 모임인 한인회랑 친하게 지냈습니다. 다들 엄청 잘챙겨줍니다. 한식먹고 싶을 때 자주 놀러갔습니다. 한인회는 Bath University Korea Society 페이스북 페이지로 연락하면 됩니다.",공대중심이라서 바스대학교에는 영문학과가 없습니다. 그래서 영문학과시라면 British Studies Courses에서 열리는 영문학 수업뿐으로 최대 9학점밖에 못채워가시는 점 알고 신청하시길 바랍니다. 저는 신청하고서야 영문학과가 없는 걸 알아서 조금 당황하긴 했습니다. 그래도 바스라는 도시 자체가 너무 예쁘고 바스대학교에서 열어주는 British Studies Courses때문에 소중한 친구들도 많이 사귈 수 있었습니다. 물가가 비싸고 비가 많이 내리는 점을 제외하면 완벽한 너무나도 행복한 교환생활이었습니다. 바스에 대해 궁금하신 점 있으시면 fliana.limestone@gmail.com
