gen_info,env_info,food_info,study_info,office_info,facil_info,mhct_info,help_info,etc_info
"다른 선배님들이 이전에 작성하여 주신 것과 마찬가지로, 도시샤 대학은 크게는 두 개, 세부적으로는 3+a 개의 캠퍼스로 나누어져있습니다. 가장 주된 구분은 교토 시 중심부에 있는 이마데가와(今出川) 캠퍼스, 그리고 교토 부 남쪽 - 나라 현에 인접한 교타나베 시에 있는 교타나베(京田&#36794;）캠퍼스로 이루어집니다. 이마데가와 캠퍼스는 다시 메인 캠퍼스인 이마데가와, 사회+정책학부와 학생회관, 체육관 등이 위치한 신마치(新町), 다목적 건물이 위치한 무로마치(室町）, 그리고 올해 2013년부터 새롭게 문을 여는 카라스마(烏丸) 캠퍼스로 나누어집니다. 일반적으로 모든 교환학생들은 일본어-일본문화센터(통칭 일문센터)에 소속되며, 이 기관이 이마데가와 캠퍼스에 위치하기 때문에 대부분 이마데가와 캠퍼스에서 시간을 보내게 됩니다. 이마데가와 캠퍼스의 크기는 건물 7~8개 정도가 아기자기하게 모여있는 정도로, 걸어서 10분이면 모든 캠퍼스를 순회하여 돌아볼 수 있을 정도로 매우 작습니다. 길 건너편에 있는 신마치 캠퍼스 역시 건물 3~4개 정도로 이루어진 매우 작은 캠퍼스이고, 카라스마 캠퍼스와 무로마치 캠퍼스는 캠퍼스라고 불러도 될까 싶을 정도의, 건물 하나로 이루어져 있습니다. 반대로 교타나베 캠퍼스는 매우 큰 면적을 자랑합니다. 우리 학교의 신촌 캠퍼스와 거의 비슷할 정도의 크기입니다. 한편, 교토의 기후는 우선 기온 상으로 한국보다 크게 덥거나 춥지는 않습니다. 평년 기온을 봐도 여름에 32도 이상 올라가거나 겨울에 영하 -5도 이하로 떨어지는 일은 얼마 없습니다. 그러나 실제로 생활하다보면 기온의 절대치보다는 느낌상으로 매우 춥다 또는 매우 덥다, 그리고 불쾌지수가 높다고 느낄 일이 많은데, 이는 아래쪽의 거주 형태에서 설명하겠습니다. 또한 맑다가도 갑자기 흐려지고, 비가 생각보다 자주 오는 등 생활하기에 그다지 우호적인 날씨는 아니며 특히 장마 기간에는 밖에 나가기 곤란할 정도로 비바람이 퍼붓는 날이 4~5일 정도 있었습니다.","대학 주변 환경 및 교통의 경우, 이마데가와 쪽은 교토 시영 지하철 이마데가와 역이 바로 캠퍼스와 이어져있기 때문에 쉽게 다닐 수 있습니다. 버스도 캠퍼스 앞에 정류장이 있어 자주 다니는 편이지만, 바로 앞에 교토 고쇼(황궁)이 있어 길이 좁아 생각보다 차가 빨리 이동하지 못하는 편이며 결정적으로 교토역까지 한번에 이동하는 버스가 없다는 것이 단점입니다. 다만 시죠카와라마치나 오미야 등 번화가까지 가는 버스, 그리고 금각사나 은각사 같은 관광지로 향하는 버스는 쉽게 찾을 수 있기 때문에, 이 때는 버스를 많이 이용하게 됩니다. 이마데가와가 역시 도시 중심부에 위치해있긴 하지만, 엄밀히 말하면 중심부에서 위로 좀 치우친 곳이고 앞에 교토 고쇼도 있고 해서 상대적으로 조용한 분위기입니다. 상점가나 마트 등 생활에 필요한 것들을 사기에는 부족함이 없지만, 그 이상, 예를 들어 옷을 산다거나 쇼핑을 하고 싶거나 한다면 최소한 카라스마오이케까지는 나가야 즐길 수 있습니다. 다만 역시 시내이니 자전거로 웬만한 이동이 가능하여, 교통비 부담은 크게 들지 않습니다. 교타나베 쪽은 JR 카타마치선(도자이선과 직통운행) 도시샤마에 역이나 킨테츠 나라선 고도 역을 주로 이용하여, 도보 10~15분 정도 되는 거리를 걸어 학교까지 통학합니다. 학교에서 주로 배정하는 기숙사를 이용한다면 대부분 교토 시에 가까운 곳일테니, 대부분 킨테츠를 이용하고 JR을 타는 경우는 거의 없습니다. (더군다나 학생 정기권의 경우 킨테츠가 파격적으로 저렴합니다) 혹시 오사카에서 통학하는 경우 정도 JR을 이용하게 됩니다. 교타나베 캠퍼스 근처는 정말 허허벌판 시골이라, 교토까지 올라와서 놀거나 그나마 신타나베 근처까지 와야 어느 정도 상업 시설이 있다는 단점이 있습니다. 교타나베로 다닐 경우 교통비가 어느 정도 든다는 점을 감안하셔야 하겠습니다.","거주형태의 경우, 1년 기준으로 첫 학기는 무조건 기숙사에 있는 것을 학교 측에서 ‘권장’합니다. 물론 마음에 안들면 언제든지 계약을 해지하고 나갈 수 있지만, 처음부터 안 들어갈 수는 없습니다. 기숙사의 형태는 해마다 많이 바뀌는 모양입니다. 저도 지난 경험보고서를 참고하면서 어디를 들어갈까 많이 고민했지만, 정작 학교측에서 선택지로 받은 곳은 이전에는 전혀 보지 못한 곳들이 많았습니다. 제가 2번째 우선순위로 선택하고 결국 배정받은 곳은(자기가 고른다고 해서 무조건 들어갈 수 있는 것이 아닙니다) 도시샤 돔 카모가와라는, 작년에 새로 짓고 이마데가와 캠퍼스에서 도보 10분 자전거 5분 거리의 매우 가까운 남자 전용 기숙사였습니다. 결론적으로 생활하는 데 불편함은 거의 없었습니다. 집값이 한달 27000엔 + 광열비 등 잡비용 포함 7000엔 해서 모두 34000엔에 깔끔하게 끝난다는 것이 큰 메리트였으며, 새로 지은 곳이라 시설 역시 매우 깔끔했고 관리인의 터치도 거의 없었습니다. 근처 데마치야나기 상점가도 자전거 5분 거리로 매우 가깝다는 것도 장점이었습니다. 단점은 역시 새로 지은 곳이라 관리 등에 있어서 미숙한 점이 있었다는 것(이는 시간이 지나면서 점점 나아질 것이라 생각합니다), 주방과 욕실, 화장실이 공용이였다는 점, 그리고 외국인 남자 전용이라는 것이 어찌보면 다양한 사람들을 사귈 수 있다는 장점이기도 하면서 반대로 일본인들과의 접촉 기회가 줄어든다는 것은 단점으로 볼 수 있겠습니다. 그러나 전체적으로는 매우 만족스러웠으며, 남자분들이 혹시 이 곳에 갈 수 있다면 선택하시는 것을 추천드립니다. 무엇보다 학교에서 가깝다는 것이 큰 메리트로, 공강 시간이나 동아리 활동에 있어 선택의 자유가 매우 넓어집니다. 다른 기숙사의 경우, 다른 분들이 작성해주신 부분을 참고해주세요. 식사는 저는 돈을 아끼기 위해 대부분 스스로 지어먹었습니다. 기숙사 안에 큰 주방이 있어서 가능하고, 점심도 기숙사와 학교가 가까워 와서 만들어먹거나 하는 것이 가능했습니다. 다만 그렇지 않을 경우 학식을 많이 이용할텐데, 어느 캠퍼스에나 학생식당은 존재하고 스스로 원하는 밥과 반찬을 집어들어 카운터에서 계산하는 카페테리아 식입니다(물론 단품요리도 존재합니다). 가격은 한 끼당 대략 300엔~400엔 정도로 잡으면 만족스럽게 먹을 수 있습니다. 맛도 나쁘지 않지만, 그래도 스스로 만들어먹는 것과 비교하면 돈 차이가 좀 납니다. 그 외에도 편의점이나 도시락 등에 의존할 수도 있지만, 어쩌다 한 번이면 모를까 매일같이 먹는다면 쉽게 물리고 무엇보다 몸이 안 좋아지는 것이 확 느껴집니다. 제가 돌아가기 한 달 전 밥 짓는 것이 너무 귀찮아 결국 도시락만 사먹었는데, 그것을 매우 후회하고 있습니다.","수업의 경우, 위에서 설명한 대로 모든 교환학생들은 일본어-일본문화센터(통칭 일문센터)에 소속됩니다. 이에 앞서 이 센터에 소속된 외국인 학생들은 별과생(우리의 어학당 같은 개념으로, 1년 어학과정을 끝내고 추천입학 등을 노리는 학생들) 및 일문생(일반 교환학생들)로 나누어집니다. 별과생들은 대부분 일본어를 가르치는 수업만 들어야 한다는 페널티? 반드시 수료해야 하는 과목이 있어 원하는 과목을 제대로 들을 수 없는 과정의 제한이 있지만, 교환학생들은 그런 페널티가 전혀 없고 원하는 수업을 들을 수 있습니다. 다만 학부 수업의 경우, 학기 시작 하기 전 보는 레벨 테스트에서 레벨 5 이상을 받아야 합니다. 5도 체육 수업 등 말이 별로 필요없는 수업이 가능한 정도이며, 실제적으로 모든 제한 없이 일반 학부생과 같은 수업을 들으려면 레벨 7 이상을 권장합니다(가장 높은 레벨은 9입니다. 다만 레벨 9는 현재 학부생으로 입학했거나 혹은 별과생들 중에서 정말 진학을 생각하는 - 다시 말해 무조건 잘한다고 나오는 건 아닙니다). 다만 이를 위해 특별히 공부할 필요는 없고, JLPT N2 이상 가지고 있다면 레벨 7은 나오는 것 같습니다. 지금도 일본어가 서툰, JLPT도 없이 제가 첫 학기에 레벨 8이 나왔고, 다음 학기는 괜히 레벨 올라가면 귀찮아질 것 같아서 같은 레벨 유지할 정도로만 문제를 풀었습니다. 교환학생을 위해 JLPT를 공부하셨다면 정말로 특별히 공부할 필요는 없습니다. 들을 수 있는 과목은 크게 일어수업 / 학부수업으로 나누어집니다. 일어수업은 상당히 체계적으로 구성되어 있어 일어 실력을 늘리는 데 큰 도움이 되지만, 현실적으로 돌아와서 학점으로 인정받기 힘드므로 듣느냐 마느냐 하는 딜레마에 빠지게 됩니다. 1년 기준으로 처음에는 모두 일어수업으로 채워넣고 다음 학기에 학부 수업을 듣는 것을 학교측에서 권장하는데, 개인적으로는 다른 선배님들이 추천해주신 종합 수업만 듣거나 혹은 개별 수업으로 어휘 / 구두표현 A 이 두 개 수업을 듣는 것을 추천합니다. 다른 과목도 일어 능력 향상에 도움이 많이 되지만 저 두 개는 일상생활은 물론이고 바로바로 써먹기 좋고 외국인들이 취약한 부분을 많이 보완할 수 있는 과목입니다. 학부수업은 원래 전공과 가장 비슷한 부분이 있는 수업을 찾아 듣게 됩니다. 저는 제 전공과 일치하는 전공이 이 학교에 없어 가장 비슷한 사회학과 수업을 주로 들었고, 시험을 제외하면(시험볼 때 전자사전 지참 가능/불가능이 의외로 시험 결과에 큰 영향을 미칩니다) 크게 어려운 부분은 없었습니다. 조금 만용을 부려서 4학년이 듣는 사회조사실습 및 졸업논문 비슷한 과목을 듣기도 했는데, 무척 힘들었지만 그래도 어떻게 버틸 수 있었으니 다른 수업은 훨씬 수월할 것이라 생각합니다. 주의할 점은 1. 우리 학점/단위 기준과 이쪽 기준이 다릅니다. 일주일 기준 1시간 30분 수업에 2단위가 우리의 1학점이라 보시면 됩니다. 보통 수업은 저 수업이 두 번 있고 4단위 = 3학점 정도로 보면 됩니다. 2. 작년 2012년 가을부터 학교측에서 일문생의 경우 이전까지는 학점 제한 없이 수업을 들을 수 있게 하여 이론상으로는 한 학기 30~40단위를 채우는 것도 가능했는데(본인 의지만 있다면), 그것이 1년 기준 26단위까지만 가능한 것으로 바뀌었습니다. 따라서 생각보다 수업 선택에 제한이 많을 수도 있다는 점에 주의하세요. 3. 역시 올해부터 학교측의 의지로, 기존에는 신마치에 위치한 사회학부 및 정책학부(우리의 행정학과 비슷한)를 제외한 모든 1,2학년 수업은 교타나베에서, 문과 3,4학년 수업은 이마데가와에서 듣는 체제였지만 그것이 바뀌어 모든 문과쪽 수업이 이마데가와에서, 모든 이과쪽 수업은 교타나베에서 듣는 체제로 바뀌었습니다. 수업 동선이 심각하게 꼬이는 경우가 있으니 이 점도 주의하세요.","국제교육부는 일단 두 개로 나뉘어져 있습니다. 우리가 소속되어 있는, 수업에 관한 부분을 담당하는 일문센터(弘風館 5층) 및 모든 유학생들의 생활적 부분(아르바이트 허가, 보험, 기숙사 관리 등)을 담당하는 유학생과(扶桑館 1층)입니다. 어느 쪽이든 얼굴을 안 보고 살 수는 없고(...) 대체적으로는 친절한 편이지만, 제가 그다지 도움을 받지 않았던 것도 있고 필요한 부분에 대해서만 친절하다는 느낌을 받았습니다. 주로 찾아갔던 일은 기숙사비 영수증 제출하러 갔던 정도네요. 그래도 역시 유학생 담당인 만큼 친해져서 나쁠 것이 없는 사람들이니, 자주 가서 얼굴 도장 찍어놓고 하면 저쪽에서 먼저 도움을 주고 하는 모양입니다. 각 센터 근처에 유학생들이 참가할 수 있는 홈스테이나 행사, 아르바이트 정보 등의 전단지를 많이 붙여놓는데, 이건 정말로 하는 사람이 임자입니다. 적극적으로 신청하세요. 혜택(?)이 좋아서 무조건 하는 것이 이득입니다.","제가 여기서 1년간 생활하면서 기억에 남는 것이 동아리밖에 없을 정도로, 동아리에 목을 매고 열심히 활동했습니다. 동아리는 학기 초(주로 봄에 교타나베에서 크게 설명회 비슷한 행사를 개최합니다. 물론 이마데가와에서도 열리지만 규모가 작습니다)에 다들 많이 가입합니다. 가을에 가입해도 전혀 상관없지만 홍보활동을 많이 하지 않아 정보를 얻기 힘드니 가을에 가시는 분들은 스스로 찾아다녀야 한다는 불편함이 있습니다. 교타나베에서 활동하는 동아리와 신마치에서 활동하는 동아리(학생회관 및 동아리실이 이쪽에 모두 몰려있습니다) 로 나뉘는데, 현실적으로 타나베까지 왔다갔다하며 동아리활동을 하긴 어렵고 신마치쪽 동아리에 손을 뻗는 일이 많습니다. 저는 ‘연극집단 Q''라는 공식 극단에서 1년간 활동했습니다. 배우로도 무대에 여러 번 서고, 무대 뒤에서 일도 밤을 새며 하면서 많은 것을 배울 수 있었습니다. 그 외에도 우리 학교에 못지않을 정도로 많은 종류의 동아리가 있으며, 그 활동에 쏟는 정열에는 지금 생각해도 감탄사가 나올 정도로 다들 열심히 활동하기 때문에 들어간 보람을 충분히 느낄 수 있습니다. 워낙 무대 일만 하느라 여행도 제대로 못 다녔지만, 그래도 후회하지 않을 정도로 잘 들어갔다고 생각합니다. 첫 학기에는 보드게임 동호회에도 들어가 여러 가지 보드게임도 즐겼습니다. 초반에 신입생 환영회라고 신입생을 끌어들이기 위해 먹을 것을 사주는(?) 것도 생각보다 쏠쏠한 재미이니, 두려워하지 마시고 자신있게 관심있는 곳에 손을 내밀어보세요. 제 경험상 거절한 곳은 단 한 곳도 없었습니다.","문화 충격은 거의 없었습니다. 거기나 여기나 똑같지 뭘... 하는 생각으로 매일매일 지냈기도 하고, 많이들 이야기가 나오는 일본인은 겉과 속이 다르다 식의 이야기도 제 경우는 별로 느끼지 못했습니다. 다만 역시 한국과 다르구나 하고 억지로 이야기를 꺼낸다면 어떤 행정적 처리이든 짜증이 샘솟을 정도로 일처리가 답답하다는 점(구청, 학교, 병원 등 모든 곳이 그랬습니다. 마음의 여유 및 시간의 여분을 충분히 가져야 할 필요가 있습니다), 연락의 빠르고 늦음에 담담해야 한다는 정도였습니다. 인간관계에 대한 부분을 많이 지적하시는데 이 부분은 개인차에 따라 다르기 떄문에 여기서는 내용을 줄이겠습니다.","도움 받을 수 있는 곳은 역시 학교의 유학생과, 일문센터가 주된 곳이며, 처음 올 때 자원봉사자라고 해서 이것저것 수속이나 적응을 도와주는 도시샤 학생을 한 명씩 붙여줍니다. 이 학생과 친하게 지내놓으면 여러 가지로 도움이 많이 됩니다. 단 ‘도움을 받는 입장’ 이라고 반대쪽에서 먼저 뭐 해줄까 하고 다가오는 일은 많이 없으니, 먼저 힘들다고 도와달라고 말하는 것이 중요합니다. 이외에도 교토시 국제제단(KCIF) 등의 사이트에서 건강보험 보조 및 기숙사, 외부 행사 등의 이벤트 정보를 많이 얻을 수 있습니다. 중요한 것은 스스로 찾아봐야 한다는 것으로, 먼저 이런게 있으니까 한번 해봐 식의 제안이 들어오는 일이 드뭅니다. 아르바이트나 동아리 등을 통해 일본 학생들을 사귀어놓는 것도 도움이 많이 됩니다.","와닿지 않는 구구절절 떠들기보다는 개개인에게 맞게 설명드리는 것이 더욱 도움이 되지 않을까 싶어, 

fiorine@live.co.kr

상기의 메일 주소로 연락을 주시면 어떤 부분이든지 도울 수 있는 부분은 도와드리도록 하겠습니다. 제가 쉬이 남들이 선택하지 않는 일본으로의 교환학생 생활을 후회하지 않았던 만큼 이후에 가시는 분들 역시 저와 같기를 바랍니다."
