gen_info,env_info,food_info,study_info,office_info,facil_info,mhct_info,help_info,etc_info
"도시샤 대학교의 지리적 위치는 교토 시내의 중심부에 위치하고 있으며, 바로 근처에는 과거 천황이 살던 황궁 ‘고쇼’가 자리잡고 있습니다. 
 캠퍼스는 세 개로 유학생들과 3-4학년이 주로 수업을 듣는 ‘이마데가와’ 캠퍼스와 횡단보도를 사이에 두고 약 5분 거리에 떨어져 있는 ‘신마치’ 캠퍼스, 1-2학년이 수업을 듣는 ‘쿄타나베’ 캠퍼스로 나뉘어져 있습니다. 쿄타나베 캠퍼스는 중심이 되는 이마데가와 캠퍼스에서 버스로 약 40분 거리로 시내 중심부로부터 떨어져 있는 한적한 곳에 위치하고 있습니다.  캠퍼스의 크기는 이마데가와, 신마치가 작고 아담한 반면, 쿄타나베는 여타 두 캠퍼스에 비해 확연히 큰 크기를 자랑하고 있습니다. 
 저의 경우, 3-4학년 전공 수업과 전공 외의 유학생 수업이 이마데가와에서 이루어졌으며, 쿄타나베의 지리적, 교통 편의 불편으로 주로 이마데가와 신마치를 오고 가며 생활했습니다. 국제교육부 또한 이곳에 위치하고 있으니 다음에 파견되실 분들도 주로 이곳에서 생활하게 되실 거라 생각합니다. (단, 공학부 수업은 모두 쿄타나베에서 이루어집니다.)
 쿄토의 경우, 분지지형이라 여름에는 매우 습하고 더우며, 겨울에는 뼈 속까지 사무치는 추위로 유명합니다. 그러나 제가 파견되어 있던 시기의 쿄토의 겨울은 한국에 비해 그다지 춥지 않았으며, 오히려 따뜻한 날들이 많았습니다.","앞의 분들이 말씀하셨듯이, 도시샤 대학교의 주변은 신촌과 같은 대학가, 번화가와 사뭇 다른 환경입니다. (신촌과 같은 번화가는 학교에서 제법 가까운 ‘산조’나 ‘시조’라는 곳이 있습니다. 유명 백화점,쇼핑몰, 이자카야, 클럽 등등 여느 번화가와 다르지 않습니다. 저는 주로 이곳에서 쇼핑을 하거나, 친구들을 만나곤 했습니다. 시티 은행도 시조 근처에 있습니다. ) 이마데가와 캠퍼스 정문을 나와 카모가와 방면 혹은 데마치야나기 역 방향으로 내려오시면 상점가와 은행, 미스터 도넛, 핸드폰 가게(au, 소프트 뱅크) 등이 있습니다. 상점가 안에는 100엔 샵, 대형 마트 등이 있어 생활 용품이나 식료품 등을 싸게 살 수 있습니다. 상점가 근처에 매일 줄이 길게 늘어 서 있는 ‘후타바’라는 유명한 떡집이 있습니다. 떡을 좋아하시는 분이라면, 이곳의 ‘마메모찌’라는 떡을 드셔보라고 권해 드리고 싶습니다. 
 이마데가와와 신마치 캠퍼스 사이에도 모스 버거, 카레집, 규동집, 책이나 DVD를 렌탈할 수 있는 츠타야 등등이 있습니다. 학교 식당 밥이 싫증이 날 때엔 가끔 이 근처에서 점심을 해결하는 것도 괜찮습니다.
 그리고 쿄토에서 생활하시게 된다면 자전거가 필수라 생각됩니다. 이마데가와 캠퍼스에서 자전거로 은각사나 철학의 길, 쿄토 대학 등도 2-30분 이내에 갈 수 있습니다. 저는 같은 시기에 쿄토 대학으로 파견된 친구가 있어서 주로 쿄토 대학까지 가곤 했는데, 그 주변도 숨겨 져 있는 유명 맛 집이나 볼거리들이 정말 많습니다. 제 유학생활의 절반은 맛집 탐방에 있었다고 할 정도였으니까요.^^","도시샤에서는 하와이 하우스, 리차드 하우스, 마츠미 코퍼, 무카이지마 학생센터, 총 네 개의 기숙사를 제공했었습니다. 그러나 제가 파견된 학기부터는 도시샤 측과 마츠미 코퍼 간의 계약이 끝나 새롭게 계약을 맺은 메종 히요시가오카라는 곳에 배정받았습니다. 기숙사는 본인이 직접 선택할 수 있는 것이 아니라 배정을 받게 되는 형태입니다. 
 전체적인 주거 시설은 기존의 하와이, 리차드, 마츠미 코퍼에 비하면 훌륭하다거나 쾌적하다고는 말할 수 없습니다. 작은 책상, 침대, 전자 레인지, 냉장고, 에어컨 등 기본적 가구들은 갖추어져 있으며, 키친과 화장실도 딸려 있습니다. 몇 가지 불편한 점이 있다면, 공부를 하기엔 조금 작은 듯한 책상과 이층 침대 등이 있습니다. (저 같은 경우는 책상 의자가 딱딱한 플라스틱이라 리사이클 샵에서 의자를 따로 구매하였고, 이층 침대도 불편하여 매트리스를 아래로 내려 생활했습니다.) 방 안에 설치되어 있는 에어컨은 여름에는 쿨러, 겨울에는 히터로 사용할 수 있습니다. 일본은 온돌 시스템 자체가 없기 때문에 겨울에 히터를 틀어도 추워서 고생했던 기억이 있습니다.
 그리고 제가 배정받았을 당시의 기숙사 내의 행정이나 관리 자체는 정말 무방비였습니다. 그러한 부분 때문에 기숙사를 나와 따로 이사를 하는 친구들도 많았습니다.(기숙사는 본인이 직접 선택할 수 있는 것이 아니라 배정을 받게 되는 형태이기 때문에, 어떠한 경우에도 기숙사는 변경이 되지 않는다고 합니다.) 1년이 지나 제가 귀국할 당시엔 여러 면에서 꽤 개선이 되었으니, 그리 크게 걱정하지 않으셔도 될 겁니다. 
 교통편은 케이한 시치죠라는 역에서 도보 15-20분 반경 내입니다. 주변에 국립 박물관, 산주 산겐도라는 절, 하얏트 호텔 등등이 있어 관광지로서의 느낌이 강합니다. 기숙사 주변에는 상점가가 있어 그 근처에서 장을 보거나 했습니다. 한가지 주의하실 점은 관광지로서의 느낌이 강한 쿄토 대부분의 지역이 그렇듯이, 일찍 문을 닫는 다는 것입니다. 대부분의 가게들이 8시면 문을 닫으니 이점 주의하세요.
 식사의 경우는, 집에서 간단히 조리해서 먹거나, 학교 식당에서 해결하는 형식이었습니다. 제가 배정받은 기숙사의 경우는 공동 키친이나 공동 룸이 없는, 철저히 개인적인 구조였기 때문에 기숙사 친구들과 함께 요리를 만든다거나, 친목을 다지는 데에는 어려움이 있었습니다.","봄학기에는 일본어 센터에서 진행되는 거의 모든 수업을 수강하였으며, 학부 수업은 3개정도 들었습니다. 도시샤의 경우, 학기 시작 전에 일본어 센터에서 실시하는 레벨 테스트를 통해 학부 수업의 수강 가능 여부가 정해집니다. 8레벨이 가장 높은 반이며, 저는 7레벨에 속해 있었습니다. 7레벨 이상부터 학부 수업을 자유로이 수강할 수 있습니다. 봄 학기에는 보다 유창한 일본어 실력을 쌓기 위해 일본어 센터에서 진행되는 거의 모든 수업을 수강하였습니다. 가을학기에는 학부 위주로 수업을 들었구요. 
 도시샤 일본어 센터에서 진행되는 일본어 수업은 대단히 체계적이며, 상당히 실력 있으신 선생님들로 구성되어 있는 것으로 유명합니다. 실제로 교환 유학이 아닌 어학 공부를 목적으로 한 유학생이 도시샤 일본어 센터에 상당수 소속되어 있습니다. 일본어 능력 시험 대비반도 있으며, 문학, 신문 기사쓰기, 구두 표현 등의 일본어 실력을 분야 별로 두루두루 높일 수 있는 좋은 수업들이 많습니다.일본 현지에서 상당한 실력을 가지고 계시는 일본인 선생님께 고급 일본어를 배운다는 것은 분명 국내에서 듣는 일본어 수업과 다르기 때문에 도시샤로 오시는 분들이라면 꼭 수강하셨으면 하는 바램입니다. 또한 일본어 수업을 통해 많은 유학생, 교환 학생들과도 친분을 쌓을 수가 있습니다. 
 가을 학기에는 본격적으로 문학부의 수업과 미디어 학부의 수업을 들었습니다. 봄 학기에 어느 정도 일본어 실력을 쌓은 다음에, 학부 수업을 수강해서 그런지 특별히 큰 어려움은 없었습니다. 오히려 한국의 대학과 비교하여 치열하지 않은 분위기의 널널한 시스템 때문인지 훨씬 여유롭게 수업을 들을 수 있었습니다. 수업 단위는 연세대와 달리 주 1회 90분씩 행해집니다. 
 도서관은 이마데가와와 교타나베 캠퍼스에 있는데 주로 사용하게 되실 이마데가와의 도서관은 연대의 그것보다 훨씬 작은 규모입니다. 때문에 그곳에 없는 책은 바로 옆에 있는 도시샤 여자 대학이나 교타나베 캠퍼스와 연계되어 그곳에서 책을 배달 받을 수 있습니다. 저는 처음에 연대보다 작은 규모와 적은 장서율에 적잖이 실망했지만, 서가에 배열되어 있는 책 이외의 상당수의 책들이나 자료들이 서고에 저장되어 있습니다. 데스크에 신청을 하면 서고에 저장되어 있는 고서나 쉽게 구할 수 없는 자료들도 대출이 가능합니다. 고서에서부터 쉽사리 구할 수 없는 자료까지 저장되어 있기 때문에, 질적인 면에서 연대보다 떨어지지 않는다고 생각합니다.","파견되기 이곳에서 파견 계획서를 읽고 도시샤의 국제 교육부가 일본의 여느 다른 대학보다 굉장히 친절하다는 인상을 받았는데요. 기대와 달리 국제 교육부 직원들의 굉장히 사무적인 느낌에 조금은 위압감이 들었습니다. (제가 파견되었던 학기부터 국제 교육부가 대대적으로 개편되어 직원들이 바뀌었다는 소리를 들었습니다.) 그래도 매일 출석 체크가 행해지고, 개개인의 메일 박스 함에는 공지사항이 들어 있어 체계적으로 유학생들을 관리하고 있다는 느낌이 들었습니다. 
 저는 별다른 어려움이 없었기 때문에 국제 교육부에서 큰 도움은 받지 않았지만, 유학 생활의 전반적인 도움이나 상담 같은 것들을 요청하면, 친절히 알려 주리라 생각됩니다.","일본도 한국 못지않게 서클 활동이 활성화되어 있습니다. 이마데가와 캠퍼스 가까이에 있는 신마치 캠퍼스에 동아리만 보여 있는 학생 회관 건물이 있습니다. 저는 봄 학기에 직접 옷을 만들고, 패션쇼를 하는 동아리에 가입했습니다. 한국과 같이 밴드, 연극, 볼링 등 다양한 동아리가 있으니 관심 있으신 분들은 4월초에 가입을 권유하는 동아리 데스크에서 가입 신청을 하시거나, 직접 서클 룸에 찾아가 신청하시면 됩니다. 서클 활동 또한 한국과는 다른 동아리 체험 그리고 현지의 또래 일본인 친구들을 사귈 수 있는 값진 경험이라 생각합니다. 저는 서클에서 친해진 친구들과 동아리 방에서 나베 파티나 술 파티를 한다든지, 함께 수업을 듣는다든지 여느 일본인 학생들과 다를 것 없는 경험을 할 수 있어 굉장히 즐거웠습니다.","특별히 문화적 충격이라고 할만한 것은 없었습니다. 다만, 일본은 형식과 절차를 중시하기 때문인지 관공서의 일 처리 속도가 한국과 비교하여 굉장히 느렸다는 점입니다. 또한, 한국과 달리 일본에서의 아르바이트 시급이 굉장히 높기 때문에 아르바이트로도 용돈 외에도 어느 정도의 생활비까지 충당할 수 있다는 점이 놀라웠습니다.
 또한, 많은 일본 친구들이 의외로 역사에 관해, 한국이란 나라에 대해 잘 알고 있지 못 하거나, 선입견을 가지고 있다는 점이 놀라웠습니다. 저는 한국인으로서 화가 나거나 답답한 부분이 많았었는데요. 이는 대화하면서 풀어나갈 수 있는 것이며, 오히려 잘못 된 선입견을 좋게 바꿔줄 수도 있었습니다. 앞으로 파견나가시는 분들도 한국에 대한 이미지, 자랑할 수 있는, 내세울 수 있는 좋은 것들을 많이 많이 알려 주고 오세요. ^^","저는 주로 어려움이 있을 때 일본에서 알게 된 지인들에게서 도움을 받았었는데요. 학교 내에 있는 국제 교육부에서도 유학 생활의 전반적인 도움이나 상담 같은 것들을 요청하면, 친절히 알려 주리라 생각됩니다","짧다면 짧고 길다면 길었던 1년 동안의 교환 유학이었습니다. 지금의 제 모습과1년 전의 제 모습을 비교 해보면, 정말 많은 것을 얻고, 깨닫고, 좀 더 성숙해졌다고 생각합니다. 유학이라는 것을 막연히 동경하던 시기가 있었는데요. 아무리 잘 알고 있던 나라라도 그곳은 어쩔 수 없는 외국이라는 점, 때로는 혼자서 해결해야 하는 힘을 길러야 한다는 것 등등 어려운 점도 많다는 걸 깨달았습니다.  반대로 한국이란 나라가 내 곁에 있어주었던 사람들이 얼마나 소중한 존재였는가 하는 것도 깨닫게 되었습니다.
 하지만 1년 동안 외국에서 교환 학생의 신분으로 지낼 수 있다는 점은 정말 값진 경험이지요. 언제나 열과 성을 다하여 가르쳐 주셨던 일본어센터의 선생님들, 함께 웃고 떠들며 외로운 유학 생활에 힘이 되어준 유학생 친구들, 일본인은 차갑다는 말을 무색케 정도로 정말 따뜻한 마음을 가진 일본인 친구들이 너무나 보고 싶네요. 
 또한, 지인의 소개로 국제 교류 회관에서 우연히 알게 된 많은 일본분들과 
한국어 과외와 교류회도 했었는데요. 제 유학생활의 절반이 그 분들과의 추억으로 가득 메워져 있었기 때문에, 헤어질 때 굉장히 아쉬웠습니다.앞으로 도시샤로 파견나가시게 될 분들 중에 혹시 관심있으신 분들은 메일로 연락주세요.^^ 
 마지막으로 쿄토는 구석구석 영화의 한 장면처럼 낭만적이고, 아름다운 곳이 정말 많습니다. 봄, 여름, 가을, 겨울 사계절의 경치 모두 아름답구요. 봄에는 고쇼와 마루야마 공원에서 벚꽃을 바라보며 풍경과 사랑에 빠졌던 기억이, 여름에는 쿄토를 가로지르는 카모가와 강둑에 앉아 친구와 함께 흐르는 물에 자두를 씻어먹던 기억이, 가을에는 아라시야마에서 청명한 가을 하늘과 오색 단풍을 즐겼던 기억이, 겨울에는 쿄토 북부 아마노타테하시에서 바다 위에 마치 은하수같이 소복소복 쌓인 눈을 바라보며 감탄했던 기억이 새록새록 떠오르네요.
 첨부 사진은 노을 녘 야사카 진자에서 찍은 벚꽃입니다. 쿄토는 일본의 다른 어느 지역보다도 벚꽃진 풍경이 가장 아름다운 곳으로 유명하답니다."
"도시샤대학은 세 개의 캠퍼스로 이루어져 있습니다. 교환유학생들을 주로 다니게 되는 캠퍼스는, 이마데가와 근처에 있는 이마데가와 캠퍼스와 신마치캠퍼스 입니다. 각 캠퍼스와의 거리는 어느 기숙사를 배정받느냐에 따라 달라지는데, 제가 파견을 나갔던, 2008년의 경우는, 종전과는 달리 로빈스히요시가오카라는, 학교와는 좀 떨어져있는 곳이였기에, 전체 통학시간이 50분 남짓 이었습니다. 이마데가와 캠퍼스라고 해도 학교 크기는 크지 않습니다. 신마치는 더욱 작구요, 교타나베는 연대와 비슷한 정도라고 할 수 있을까요.
교토는 분지이기 때문에, 여름에는 찌는 듯이 덥고, 겨울에는 한국만큼 추운 기후입니다. 특히 온돌이 구비되어있는 한국형 집에 익숙해진 한국사람은 일본집의 추위에 매우 적응하기 힘듭니다. 저도 4-5월까지 매우 추워하던 기억이 납니다. 기숙사에 따라 다르겠지만 대체로 사쿠라가 피는 계절에도, 밤이되면 집이 매우 추웠던 것으로 기억합니다.","대학주변은 신촌과는 매우 다릅니다. 연대 주변같은 경우는 그 대학교를 다니는 학우들을 위한 상점들이나 시설들이 즐비한 반면, 도시샤대학은 그렇지 않습니다. 주변이라고 해도, 그 주변에 사는 주민들을 위한 상점과 시설 정도 입니다. 그래서 그런지, 연대에서처럼, 학우들이 방과후 술을 마시러 간다거나, 단위별로 모여있거나 하는 모습을 본 적이 없습니다. 
주변은 평범한 찾길과, 고쇼 정도 입니다.","저는 이전까지 도시샤의 파견 유학생이 배정받은 적이 없던, 로빈스히요시가오카라는 곳에 배정을 받았습니다. 로빈스는 시설이 매우 낙후하고, 좀 어둡고 외진 곳에 위치한 반면 가격도 싼 편은 아니였기 때문에, 사무실에 찾아가, 하와이하우스 혹은 리처즈하우스에 빈 방이 생기면 옮겨달라고 몇 번이나 요청하였으나, 그곳에 빈방이 있다는 소문에도 불구하고, 가을에 오는 학생들을 위한 것이라며, 이사를 시켜주지 않았습니다. 그리고 이사를 가려면 알아서 부동산에서 알아보라고 하여, 혼자서 쩔쩔 매던 중, 다행이 친하게 지내던 일본인 친구가 맨션을 알아봐주어서, 학교 근처의 맨션으로 이사하게 되었습니다. 보통의 맨션이라고 해도, 잘 만 알아본다면, 학교의 기숙사보다 싸고 좋은 곳을 구할 수 있는 것 같습니다. 식사는 친구들과 집에서 만들어먹거나, 학교식당에서 해결하였습니다.","저는 봄학기에는 일본어 수업을 전부 수강하며, 학부수업을 6개 들었습니다. 일본어 수업은 학기 시작전에 placement test를 통해 레벨을 배정받습니다. 저는 7레벨 이었는데, 가장 높은 반은 8레벨 이라고 들었습니다. 8레벨은 같은 선생님이 거의 매일 들어오신다고 들었는데, 7레벨은 매일 다른 선생님이 들어오시고, 좀 더 활용적인 일본어를 가르쳐주는 것 같습니다. 좋은 반에 배정이 되면 클래스메이트들하고도 엄청 친하게 지낼 수 있구요. 저도 봄학기에 만났던 여러나라의 친구들과 아직도 연락을 하며 지내고 있습니다. 가을 학기에는 일본어 수업 중에 문학과 구두표현 수업만을 듣고 전부 학부수업을 들었습니다. 저는 제 전공말고도 여러가지 학부수업을 듣고, 청강생으로도 몇 개의 제미(세미나식 수업)에 참가하였는데, 물론 매우매우 바빴지만, 그만큼 즐거웠고, 좋은 선생님들과 친구들을 사귈 수 있었습니다. 
도서관은 이마데가와 캠퍼스에 있는데, 연대보다는 규모가 작고, 그곳에 없는 책은 도시샤 여자대학이나 교타나베 캠퍼스에서 배달해줍니다.
외관상으로는 연대도서관보다 규모가 작지만, 구비되어 있는 자료들의 질은 연대못지 않거나 그 이상이라고 생각될 만큼 훌륭하다고 생각합니다.","제가 있던 때의 사무실 스텝들은 전반적으로 불친절했습니다. 친절하신 분이 한 두분 계셨는데, 그 밖에는, 대부분 무슨 부탁이나 질문을 하러가기가 무서웠기 때문에, 유학생들 모두 사무실에 가는 것을 좋아하지 않았습니다. 저도 그러했기 때문에, 사무실에 갈 일이 있거나 전화를 할 때는, 일본인 친구와 함께 가거나 그러했습니다. 어느 나라나 어느 학교나 국제과는 매우 바쁠 것이라고 생각하지만, 항상 화가 나 있는 것 같았달까요.
특히 기숙사 문제로 힘들어 할 때, 그곳에 배정받은 친구들 중 많은 친구들이 그 기숙사에서 나가거나, 컴플레인을 했는데도 불구하고, 알아서 하라는 식으로 수수방관했던 것이 저에게는 좀 충격이었습니다.","저는 봄학기에 밴드와 연극 동아리에 들어 활동하였습니다. 일본대학의 대학생들은 단체활동에 익숙하지 않기 때문에, 동아리 활동을 해도 한국대학에서의 동아리활동처럼 유대감있고 끈끈한 관계로 발전하지는 않는 것 같습니다. 
하지만 그만큼 할 때는 철저하게 하는 면이 있기는 있습니다만, 조금 사무적이라는 느낌도 받기는 받았습니다. 저는 가을학기에 동아리에서 친해진 친구들과 따로 밴드를 하거나 하면서 지냈습니다. 그 밖에는 제미의 친구들이나, 유학생들, 또 교수님들과 많은 유대의 시간을 가질 수 있었습니다. 
그리고 처음에 도시샤에 도착하면 보란티어라고하는 도우미 친구를 한명 씩 짝지어 주는데, 저는 그 친구와, 그 친구의 친구들과 일년내내 친하게 지냈습니다. 나중에 들어보니, 일본에서는 그런 방식으로 친구를 만나고, 인맥을 넓혀가는게 일반적이라고 생각하는 것 같았습니다.","특별히 충격적인 것은 없었으나, 관공서의 일처리가 한국보다 너무 느리다는 것과, 일본인은 서류를 너무 좋아한다는 것 정도가 놀라웠습니다.","저는 어려울 때마다 항상 일본인 친구들로부터 도움을 받았기 때문에 
교내외에서 도움을 받을 수 있는 곳이 있는지 잘 모르겠습니다.
학교내의 생활협동조합정도라고 생각합니다.","일본에서의 일년은 길지도 짧지도 않은 적절한 기간이었다고 생각합니다. 
많은 사람들과 스치고, 만나고, 문제가 생기고, 문제를 해결하면서, 일본이라는 나라를, 그리고 자신이라는 사람을 조금 더 알게 되었다고 생각합니다.
여러분들이, 교환학생을 가게 된다면, 어느 나라의 어떤 대학에서라도, 유학이 아니면 느낄 수 없던 것들을 느낄 수 있으리라 생각합니다. 그리고 제가 이야기 드릴 수 있는 것은, 그곳이 만약 도시샤라면, 항상 교토 한 가운데를 흐르고 있는 카모가와, 울창한 고쇼, 마루야마공원의 사쿠라, 아라시야마의 단풍들, 언제나 열심이신 일본어센터의 선생님들, 그리고 좋은 친구들을 덤으로 얻을 수 있을 거라는 것 입니다."
