gen_info,env_info,food_info,study_info,office_info,facil_info,mhct_info,help_info,etc_info
"도시샤 대학교는 교토의 시내 중심부에 위치하고 있다. 교토시의 큰 줄기를 이루는 카라스마 도오리와 이마데가와 도오리의 교차점에 교환학생을 갔던 캠퍼스가 있었다. 
도시샤는 크게 3개의 캠퍼스로 구분되어 있는데, 교타나베 캠퍼스, 이마데가와 캠퍼스, 신마치 캠퍼스가 있다. 칸바이칸이라는 건물이 무로마치 캠퍼스로 구분되어 있기는 하지만, 이마데가와 캠퍼스와 가깝기도 하고, 수업이 이루어 지고 있지 않기 때문에 별도의 구분은 하지 않는다.
이마데가와 캠퍼스는 크지는 않지만 아담하고 전통이 있는 캠퍼스다. 춘추에서 일본으로 취재를 왔을때, 함께 학교 관계자 분에게 설명을 들었었는데, 윤동주가 학교를 다녔을때의 건물도 고스란히 남아 있다.
교토는 간사이지방으로 오사카와 나라, 고베와 가깝다. 도쿄를 중심으로 하는 관동지방과는 사뭇 다른 분위기가 있다. 언니와 언니 친구도 놀러왔었는데, 관동지방보다 더 일본의 느낌이 든다고 말했던 기억이 난다.
내가 살던 교토는 일본 중세의 중심이었던 곳으로 다행이 전후피해가 적어 유명한 절과 사찰이 많다. 때문에 주말과 축제가 있는 주간은 외국인 관광객들로 가득차던 곳이었다.
기후는 다른 어느곳 보다 열악하다고 말할수 있을 것 같다. 교토는 분지이기 때문에 겨울은 춥고, 여름은 덥기도 유명하다. 내가 지냈던 2005년의 겨울은 예년보다도 훨씬 추웠던 해였다. 돈을 아끼려고, 히터를 쓰지 않았던 나는 아침에 일어나면 얼어버린 코끝을 비비던 것이 일과였다. 올해 여름은 예년에 비해 덥지 않다고는 하지만 한국식 더위에 익숙해져 있던 나에게 교토 특유의 습도 높은 더위는 정말 견디기 힘들었다는 생각이 든다. 하지만, 봄과 가을 꽃구경과 단풍의 절경을 곁에서 볼 수 있고, 일본 전국 각지에서도 교토의 아름다운 풍경을 보려고 일부러 찾아오는 것을 보면 이 곳에 산다는 자체가 굉장히 뿌듯했다는 생각이 든다.","주로 수업이 있던 이마데가와 캠퍼스의 주변은 비교적 교통이 편리한 편이었다. 지하철 카라스마선이 다니고 있어 시조라고 하는 유명한 쇼핑가에도 10분만에 갈수 있었고, 교토역에도 비교적 쉽게 갈 수 있었다.
학교앞에는 고쇼라고 하는 천황궁이 바로 앞에 있어서, 봄 가을 특별공개에 맞추어 벚꽃구경과 단풍구경을 했었던 기억이 난다.
교토는 작지만 어디든지 절과 신사가 많아서 마음만 먹으면 자전거를 타고 구경을 할 수 있다. 주변에 있고 익숙하여 그리 유명한 곳이라고 인식하지 못했던 곳들도, 실제는 일본 교과서에 나올 정도로 굉장히 유명하고 중요한 곳들이었다.","나는 마츠미 코퍼라고 하는 맨션에 살았다. 경험보고서를 차근차근 읽고 갔었는데, 내가 배정받은 곳에는 살았던 선배들이 없었다. 새로 만들어진 건물일것이라 생각했었지만, 새로 학교에서 배정해주는 곳이었지, 신축건물은 아닌 것 같았다. 하지만 깨끗하고 관리가 잘 되고 있는 곳이었다.
무카이지마에 비하면 10000엔정도 비싼 곳으로 매달 35000엔의 집세가 들어갔지만, 교토부 중심에서 그 정도 가격에 그 정도 넓은 곳에 살기는 실제로 어려우리라는 생각이 든다. 아무래도 학교의 보조금으로 조금 싸게 들어갈 수 있는 모양이었다.
크게 방 하나가 있고, 부엌, 그리고 창고가 일자형으로 늘어져 있다. 다른것보다 내가 살았던 기숙사가 좋았던 점은 학교에서 가까웠다는 것이었던 것 같다. 도보로는 15분정도 걸리지만, 운 좋게 선배에게 자전거를 받았던 나는 5분 정도의 시간에 통학할 수가 있었다. 게다가 내가 살았던 집은 구라마구치라는 역이 바로 앞에 있어서, 장거리 여행을 떠날때나, 식구들이 놀러왔을때 찾아오기가 편리했다.
집에는 부엌에 있어서 요리하기가 편했고, 비브레나 쿠라라 같은 쇼핑센터도 가까이에 있어서 다른 곳보다 싼 가격에 장보기도 좋았다. 뒤쪽으로 나가보면 공원도 있어서 가끔 줄넘기도 하고, 뛰기도 하곤 했다.
처음 도착해서의 반년은 도시락을 싸고 다니면서 학교에 다녔었는데, 나머지 반년은 아르바이트와 학교 수업에 쫓겨서 전혀 해먹지 못했었다. 일본은 도시락도 편의점에서 판매하고 있고, 이것이 대중화 되어 간단히 식사를 해결할 수 있다. 나도 나머지 반년은 그러한 방법으로 식사를 해결하는 것이 많았다.","수업은 모두 90분으로 이루어 진다. 오전에는 90분짜리 일본어 수업을 2개 들어야 하고, 오후에는 자율적으로 희망자에 한해 문화와 능력시험 준비반이 개설되어 있다. 50분 수업을 하는 연대에 비하여 거의 두 배 이상 증가한 수업시간은 처음에는 매우 힘들었지만, 서서히 익숙해졌던 것 같다.
첫학기에는 도착하자마자 일상용어가 잘 안들리는 것이 상당한 부담이 되어 유학생 별과에서 마련한 일본어 수업을 전부 들었었다. 그리고 학부 수업으로 동양미술사를 들었다. 
유학생 별과 선생님들은 상당한 열정을 가지고 수업을 하고 계신다. 실제로 도착해서 하루밖에 안 된 시점에서 내 이름을 외우셨던 선생님들이 계셔서 놀랐던 기억이 있다. 이외에도 매일매일 학생들이 제출하는 작문카드를 수정해서 나누어 주시기도 한다. 학생수는 많지만, 그렇다고 해서 결코 지도를 소홀히 하거나 하는 것을 본 적이 없다.
학부 수업은 실제 굉장히 따라가기가 힘들다. 물론 가장 큰 원인은 어학능력에 있다. 필기와 일본어로 써있는 전공서적을 읽는 것에 굉장히 시간이 걸렸다. 수업자체는 굉장히 간단해서 90분 강의가 2학점 강의가 되고 일주일에 한번만 들어가면 된다. 학생들은 일부 학생을 제외하면 연대의 학생들에 비하여 전체적으로 열의가 떨어진다. 대학 성적까지 입사를 좌우하는 한국사회에 비해, 취업을 사람 자체와 그 사람의 사고방식과 생활방식에서 결정하는 사회 분위기에 의해 수업분위기 차이가 생기는 것이 아닐까 생각한다. 수업분위기가 다른 가장 큰 원인은 수업이 절대평가로 이루어진다는 것에도 있다. 수업의 성적에 대하여 신경쓰고 열심히 하는 학생도 많지만, 성적보다는 단위를 획득하는 것에 의미를 두고 적당히 공부하는 학생들이 더 많았던 것 같다. 
수업에서 가장 어려웠던 것 모국어가 아닌 이상 수업을 100%이해하는 것도 어렵지만, 아웃풋과정이 더 힘들었던 기억이 있다. 모국어가 아닌 언어로 레포트를 쓴다는 것은 정말 굉장한 스트레스였다. 그렇지만, 그러한 과정에서 얻는 것도 더 많기도 했다. 
두 번째 학기에는 유학생별과 수업도 들으면서 오후에는 학부수업을 들었다. 국제기구, 요미우리 특파원의 특강, 일본학생을 대상으로 하는 일본어 수업(소위 국어 수업), 동양미술사, 경제학, 불교미술의 제미 수업을 들었다.
전공수업을 듣는 것도 즐거운 일이었지만, 전공 이외의 생소한 분야에서 다양한 용어와 일본사회를 배울 수 있었던 것 역시 좋은 시간이었다. 국제기구와 요미우리 특파원이 와서 강연한 수업은 외국에 와서 우리나라를 바라볼 수 있는 정말 귀중한 수업이었다.
한국에는 없는 수업 형식으로 제미라는 수업이 있다. 도시샤의 문학부는 졸업할때 졸업논문의 필수요건으로 마련되어 있기 때문에, 3학년 2학기부터 4학년 1학기에 걸쳐서 토론형식의 수업을 하게 되어있다. 유학생이 왜 재미까지 듣냐는 문학부 분의 회의적인 질문도 받았었지만, 실제 참가해 좋은 인연도 맺고 직접 나의 테마도 발표하면서 조금이나마 불교 미술이라는 것에 발을 디딜 수 있게 되어 좋은 시간이 되었다. 수업에서 만난 친구들은 마지막까지 도움도 받고 나중에는 집에도 초대해주어 이런저런 일본문화를 접할 수 있는 기회도 마련해 주었다. 교수님도 굉장한 관심도 보여주시고 마지막은 환송회까지도 열어 주셨다.","도시샤의 국제교육부는 둘로 나누어져 있는데, 하나는 유학생 수업과 유학생을 생활을 안내하는 유학생별과 사무실과, 유학생들과 일본학생들과의 만남을 만들고 교류회를 주최하는 국제과로 나누어져 있다.
유학생별과 사무실은 수업이 이루어지는 건물의 5층에 있다. 유학생별과 수업을 듣는 학생들은 매일 이 사무실에 가서 출석체크도 하고 건강보험과 이사 등 여러가지 사항에 대하여 도움을 받는다. 실제로 곤란한 일이 있거나, 캠프에 관한 건, 일본어 능력시험들 여러가지 사항에 대하여 문의하면 친절하게 대답하여 주고 관심을 가져주신다. 행사가 있을 때는 사진도 찍어서 나누어 주시기도 한다.
국제과에서는 주로 교류회를 열거나, 거주지의 편의 등을 돕는다. 집에 에어컨이 고장났을때 연락했을때도 지체하지않고 바로 와서 고쳐주어 크게 도움이 되었다.","도시샤는 교토라는 살아있는 문화 도시에 자리잡고 있고, 깨끗한 환경과 편리한 컴퓨터 시설 등 나무랄 것이 없는 환경이지만 단 하나 지적하자면 동아리 활동이 불편했다는 기억이 있다. 
도시샤는 버스로 한시간 거리의 교타나베 캠퍼스에서 1학년 2학년의 필수 수업이 개설되고, 교환학생들이 생활하는 이마데가와 캠퍼스에서는 주로 3, 4학년이 생활하고 있다.
3,4학년은 대학생활을 마무리 하는 시기로 미래를 결정하는 시기이고, 특히나 4학년은 취업활동과 졸업사정으로 학생들이 눈코뜰 새 없이 바쁘다. 따라서 동아리 활동은 1,2학년 중심으로 이루어지며 자연스럽게 동아리 중심은 교타나베 쪽이 된다. 하지만, 교타나베 캠퍼스는 교환학생들이 생활하는 곳과는 떨어져 있고, 굉장히 거리가 멀어서 동아리 활동을 하기가 쉽지 않았다. 자연스럽게 교류회나 학부수업과 같은 장소에서 일본인과의 만남을 가져보려 하지만, 이 또한 쉽지 않았던 기억이 있다.","혹시 일본에 가서 아르바이트라는 경험을 하게 되면, 일본의 철저한 상업철학과 재빠른 행동양식을 몸으로 체험하게 된다. 나는 아르바이트를 하면서, 생활비를 벌면서 일본사회에 뛰어드는 좋은 경험을 하게 되었다. 다른 곳의 교환학생보다 일본의 교환학생이 좋은 점은 바로 이 점을 꼽고 싶다. 부지런하고, 의욕만 있다면, 누구나 일본사회의 일원이 될 기회가 있다. 일본은 상업이 상당히 발달한 나라로 적당히 때운다는 생각은 절대 금물이다. 작은 이자카야와 평범한 편의점에서도 그들의 상업철학이 느껴진다. 
또 문화 충격이랄까 하는 점은 은행은 3시에, 상점 등은 8시에 대개 문을 닫기 때문에 저녁 늦게 까지는 번화가여도 이 시간 이후는 쇼핑을 할 수 없다.","교내에서는 곤란한 것이 있으면 국제과와 유학생 별과의 도움을 받았다. 유학생별과는 문제가 생기면 언제나 도와주셨고, 국제과의 선생님들 역시 도와주신다. 이 밖에도 수업을 듣는 별과 선생님과 모든 선생님께서 학생들의 편의를 위해 관심을 갖고 상담에 응해주시기 때문에 어디에서나 도움을 받을 수 있다.","1년여간 정말 귀중한 시간이었지만, 유학이라는 것이 쉬운 것만은 아니라는 것을 느꼈던 1년이기도 했다. 특히 항상 들리는 것이 일본어이기 때문에 일본어가 쉽게 향상될 것이라고 생각하는 학생이 많을 것으로 생각된다. 실제로 일본어가 향상되는 것은 사실이지만, 그 과정에서 엄청난 스트레스를 유발한다. 자신이 하고 싶은 것을 제대로 표현하지 못할 때의 괴로움이란 생각보다 컸던 것 같다. 이 밖에도 언어라는 것은 인간과 인간을 연결하는 매개이기 때문에 상대적으로 언어가 우수한 학생이 생활에 적응하고 일본사회에 뛰어들 기회가 빨리 찾아오게 될 것이라 생각한다. 교환학생이라는 한정되어 있는 시간에 많은 것을 느끼고자 하는 학생이라면, 언어를 착실히 준비해 갈 것을 권장하고 싶다."
"처음에 도시샤 대학을 선택했을때 다들 거기가 어디냐고 물었습니다. 저도 처음 들어본 학교였기에 단지 윤동주가 다닌 학교라고만 말했지요. 하지만 일본내에서는 상당한 인지도를 가지고 있는 학교였습니다. 간사이의 6대 명문에 도시샤가 들어가니까요. 한 일본아주머니께 자기딸도 도시샤에 보내고 싶었지만 공부를 못해서 못갔다는 말을 들은 적도 있어요. 학생들도 상당한 자부심을 가지고 다니고 있었습니다. 
기후는 3월달에는 조금 쌀쌀했지만 얇은 점퍼 하나로 버틸 수 있는 추위였구요. 곧 따뜻한 봄날씨가 되서 반팔 하나만 입고 다녔습니다. 분지인 교토의 여름은 정말 더워서 기숙사에 들어가면 밤낮으로 에어콘을 틀어놓고 생활했습니다. 하지만 생각보다 한국의 여름과 그렇게 차이가 나지는 않으니 미리 겁을 먹으실 필요는 없다고 생각합니다. 어디서건 마음먹기에 따라 잘 적응해 나갈 수 있는 것 같아요.","다른 분들이 설명해 주신것들을 제외하고 실생활에 필요한 것 중심으로 설명드릴게요. 일단 처음에 교토에 오시면 티비나 밥솥등 전자제품이 필요하시잖아요. 저는 처음에 유학생에게 얻거나 중고를 살 생각으로 갔는데 둘 다 여의치 않아서 결국 1만엔 주고 티비를 샀습니다. 중고가게가 너무 멀다고 해서 눈물머금고 지출했었는데요. 알고보니 매우 가까운 거리에 중고가게가 있더군요. 이마데가와 캠퍼스에서 3분거리에 위치한 도시샤 대학교 로스쿨이 있는 칸바이칸이란 건물 뒤편으로 좀만 걸어가면 전자제품 중고가게가 있습니다. 저도 올 때는 이곳에 팔고 왔습니다. 아저씨가 값을 짜게 매기는게 불만이긴 했지만 그래도 필요하신 분들은 찾아가 보시면 물건 구하실 수 있을거에요. 또 지하철 이마데가와 역에서 한정거장 거리인 마루타마치 역 주변에도 중고가게가 있다고 했으니 관리인 분에게 물어보시면 알려주실거에요. 또 학교 주변에 패미리 마트등 편의점과 모스버거, 비디오 대여점과 마쓰야 같은 간단히 식사를 할 수 있는 음식점등이 있어요. 전체적으로 신촌과 비교해서는 한산한 분위기이지만 익숙해지면 나름대로 조용해서 운치가 있답니다.","저는 이마데가와 캠퍼스에서 걸어서 10분 거리에 있는 하와이 하우스에 살았습니다. 하와이 하우스는 총 3층 건물로 1층에 남자 5명 2층에 여자 5명이 살고 3층에는 세탁실과 라운지가 있습니다. 관리인 2분이 매일 청소해 주시기 때문에 시설은 깔끔합니다. 또 다른 기숙사에 비해 방도 비교적 넓은 편이에요. 다만 화장실과 샤워실이 공용인데 5명이 화장실 2칸과 샤워실 2칸을 나눠쓰기 때문에 그다지 불편하지 않아요. 이곳 역시 관리인이 청소해주시기 때문에 아주 깨끗합니다. 자기 방에 달려있으면 자기가 청소해야 하니 어떤 면에서는 공용이 편하더라구요. 현재 하와이 하우스 앞마당에 도시샤 대학측에서 5층짜리 여자 기숙사를 짓고 있는데요. 내년 2월에 완공된다고 하니 그 이후에 가시는 분들은 혜택을 받으실 수 있을 것 같습니다. 다만 채광은 좀 안 좋을 것 같습니다. 두 건물이 너무 바짝 붙어있거든요. 

식사는 편의점에서 도시락을 사다 먹거나 직접 만들어서 먹거나 했습니다. 혼자 먹기 심심할 때는 옆방 친구들이랑 같이 파티를 하기도 했구요. 그런데 파티 몇 번 하면 그 달 생활비에 구멍이 막 뚫리지요. 생활비는 한달에 총 100만원정도 썼습니다. 일단 기숙사 비가 3만 7천엔 이구요. 생활비가 5만엔 간간이 책과 음반을 구입하다보니 10만엔 정도 썼지만 결코 낭비한 적은 없었어요. 먹고 싶은 것도 두 번 생각해서 사먹고는 했거든요. 전체적으로 물가가 비싸다보니 생각보다 생활비가 많이 들게 된 것 같습니다. 

하와이 하우스에서 5분거리에 상점가가 있어요. 이곳에 슈퍼가 2곳 있는데 일본 친구도 다른 곳보다 싸다고 놀라더라구요. 무카이지마 학생센터에 사는 친구도 이곳이 싸다고 장을 봐서 그 먼 곳까지 들고가곤  했답니다. 그러니 하와이 하우스 학생들은 혜택받은 학생들이지요. 상점가에는 이외에도 약국,베이커리,서점,100엔숍 등이 있어 왠만한 것들은 다 구할 수 있습니다. 또 상점가에서 돌아오는 길에는 여러분이 계좌를 구설하게 될 교토중앙신용금고와 미쯔비시 은행이 있구요. 맥도널드와 미스터 도넛같은 패스트 푸드점도 있습니다. 또 후타바라는 유명한 떡집도 있는데 늘 줄이 길게 늘어서 있으니 아마 알아채기 쉬우실 거에요. 저도 사람들이 추천을 하길래 가봤는데 대만족이었습니다. 이곳의 마메모찌는 유명하니 한번쯤 맛보셔도 좋을 것 같습니다.","도시샤에 파견되는 교환학생들은 유학생 별과에 소속되게 됩니다. 오리엔테이션 기간에 치러지는 시험의 결과로 클래스를 배정받게 되구요 상급 클래스에 배정을 받으면 학부수업을 들으실 수 있습니다. 2005년 봄학기 같은 경우는 4월 1일에 오리엔테이션을 하고 시험을 봤습니다. 간단한 일본어 작문에서부터 일본어 능력시험 1급 2급의 문법 문제까지 총 3장에 다양한 문제가 나와있구요. 시험보러 가기전에 문법 정도는 살펴보고 가시면 아마 어렵지 않게 풀으실 수 있을 거에요. 반은 1레벨부터 8레벨까지 있습니다. 대부분의 유학생들은 오전에는 별과수업을 듣고 오후에는 학부수업이라던지 자기가 듣고 싶은 수업을 듣습니다. 저같이 학부수업이 오전의 별과수업과 겹치는 경우 따로 허락을 받아 수업을 듣는 학생들도 있었습니다. 
저는 총 18학점을 들었구요. 학부수업은 광고론,매스미디어의 현장,국제기구론 3개를 들었습니다. 3과목 모두 기말고사 혹은 기말 레포트 하나로 평가를 해서 여유있게 공부 할 수 있었습니다. 저는 도시샤에 미디어 학부가 있어서 기대를 하고 갔는데 의외로 우리학교 신방과와 비슷한 수업은 찾기 어려웠습니다. 예를 들어 대중문화론이란 수업은 만화에 관한 수업으로 똑같은 이름이라도 연대 커리큘럼과는 전혀 다릅니다. 만약 신방과 후배가 도시샤를 선택하게 된다면 이점 유의하셔야 할 것 같습니다. 또 도시샤 대학에 가시면 꼭 들어볼 것이 하나 있어요. 바로 제미 라는 것인데요. 제미란 1년간 교수와 학생들이 프로젝트를 수행해 나가는 일종의 세미나 과목 같은 것입니다. 예컨대 신방과의 제미는 언론 통제라든지 언론에 관한 주제로 관련 단체나 언론사, 시민들과 토론회, 인터뷰, 조사 등을 통해 논문을 작성하는 것입니다. 저는 한학기라 신청하지 못했지만 궁금해서 친구를 따라 제미에 참석해 본 적이 있습니다. 일반 강의에서는 찾아볼 수 없었던 교수님과 학생들의 진지한 열기에 놀랐었습니다. 한국의 미디어에 관해 질문공세를 던지는 바람에 진땀을 빼긴 했지만 흥미로운 경험이었습니다. 그러니 꼭 한번 제미를 들어보세요.",도시샤에 발을 디딘 첫날 오리엔테이션부터 학기 마지막날 열린 종강파티까지 유학생들의 사소한 것까지 챙겨주시던 별과의 직원분들. 매일매일 쉬는 시간마다 유학생 별과에 출석체크를 하기 위해 올라가면 항상 웃는 얼굴로 인사를 건네며 뭐 불편한건 없나고 챙겨주시는 게 생각나네요. 유학생들을 위한 수업이 있는 코후관 5층에 있는 유학생 별과 게시판에는 아르바이트 정보며 홈스테이. 국제과에서 주관하는 유학생 파티등 각종 정보가 가득하니 주의깊게 보시구요. 또 교환학생을 가면 여행도 많이 하게 되잖아요. 차표 구입 할 때 유학생 별과에서 학생할인증을 만들어주니 이것도 놓치지 마세요.,처음에 교환학생을 왔을때 아르바이트와 동아리 활동을 꼭 하고 싶다고 생각했습니다. 하지만 1학기 파견이었던 저로서는 도저히 무리였지요. 그래서 고민하다가 동아리 활동을 선택했습니다. 저는 일본의 보란티아 활동에 관심이 있었기 때문에 봉사활동 동아리에서 잠시 활동했습니다. 제가 활동한 동아리는 교토에 있는 대학들의 연합이었기 때문에 다른 학교 학생들과도 교류할 수 있어서 좋았습니다. 이 글을 읽으실 여러분께 말해 주고 싶은 것은 일본에 오면 꼭 동아리를 해보라는 것입니다. 국제센터나 유학생 별과에서 마련해 주는 유학생 파티나 행사에서 만날 수 있는 일본인 친구의 유형은 한정돼 있습니다. 처음 교토역에서 여러분을 맞아줄 보란티어도 마찬가지구요. 영어권 학생만을 선호하는 일본인 사이에서 비영어권 학생으로서 때로 상처를 받기도 하거든요. 그렇기에 폭넓은 교류를 위해서 동아리 활동을 해보라고 말씀드리는 거에요. 일본에 간다면 좀더 일본사회에 한발짝 가까이 가보는게 좋다고 생각합니다. 그만큼 남는 것도 많구요.,우리나라와 비슷한 문화다보니 아무래도 컬쳐쇼크라고 할만한 것은 없었습니다. 처음에는 생각보다 일본인 친구 사귀기도 힘들고 일본이라는 사회에 가까이 가기가 어려워서 좌절하기도 했었지만 나중에 좋은 사람들을 많이 만나면서 일본이라는 나라도 일본인들도 하나로 묶기에는 너무나 다양한 스펙트럼을 가지고 있다는 생각을 했습니다. 그렇기에 선입견은 금물이라는 것이지요. 이곳 일본으로 오셔서 직접 부딪쳐 나가면서 일본이라는 나라를 알아가시길 바랍니다.,,제가 말씀드리고 싶은 것은 딱 두가지에요. 첫 번째 4학년 1학기의 파견은 왠만하면 피하시는게 좋다는 것입니다. 저는 졸업을 앞두고 파견된 부담이 너무 커서 교환학생 생활을 즐기지 못했거든요. 물론 남들 놀때 저 혼자 공부하고 이런 것은 아니지만 마음이 편치 않으니 아무래도 부담이 가더군요. 그리고 반학기 보다는 1년 오시기를 적극 권장합니다. 한학기는 엄밀히 말하면 4개월이에요. 이번 봄학기의 경우 1달 적응하고 나니 골든위크가 지나가고 그러고 나니 기말고사가 닥치고 여름방학을 맞게 되더군요. 8월달 초에 귀국하고 나니 정말 일본에서의 시간이 꿈만 같더라구요. “시간이 없어” 이렇게 말씀하실지도 모르나 교환학생 생활에서 남는 것은 어떤 기회비용을 치루더라도 그 기회비용 이상이라고 생각합니다. 그러니 왠만하면 1년으로 오셔서 많은 추억들 만들어 가시길 바랄께요.
