gen_info,env_info,food_info,study_info,office_info,facil_info,mhct_info,help_info,etc_info
"전국 일주가 2시간만에 가능하다는 장난섞인 노래가사가 있을정도인 네덜란드에서 엔스케데는 수도인 암스텔담에서 기차를 타면 극동쪽으로 1시간 30분가량 떨어져있는 도시입니다. 암스텔담하면 떠오르는 멋진 운하와 수로는 커녕 물을 찾아보기가 엔스케데는 네덜란드보다는 독일과 닮아있다는 생각이 드는 곳입니다. 실제로 독일 베스트팔렌주와 매우 인접해있으며, 주변에 있는 도시로는 한번쯤 들어봤을법한 뮌스터나 뒤셀도르프가 있습니다. 모두가 상상하는 북유럽의 날씨가 흔히 그렇듯, 네덜란드 엔스케데에서도 흔히 ''지구가 멸망할것만 같은'' 흐린 날씨가 계속됩니다. 비가 잦지만 양이 적고 금방 그치기 때문에 우산을 가져가도 쓰는일은 거의 없습니다. 한국지리 시간에 서안해양성기후, 지중해성기후의 특징으로 배운 온화한 겨울은 사실이 아니며 한국의 겨울만큼 춥고 혹독합니다. 다른 분들의 경험보고서에 쓰신대로 여름에도 반팔이나 민소매옷이 필요없다는 말은 거짓말이 아니며, 7월 말에도 밤에 외출하기 위해서는 가죽자켓을 입어야 합니다. 다만 제가 파견을 나갔던 2011년 봄은 유난히도 여름이 기승을 부렸습니다. 2월 말에서 대략 5월에 이르기까지 날씨는 계속 맑았고, 비는 적게 내렸으며, 대략 2~3일 정도는 35도를 넘는 더위가 찾아오기도 했습니다. 하지만 현지인들에 듣기에는 이는 기록적인 이상고온이었다고 하며, 여느해와 비교해봤을 때 강수량 또한 매우 적었다고 합니다.  
굳이 Saxion HS ''Enschede''라고 부르는데서 알 수 있듯이 Saxion은 엔스케데뿐만 아니라 Deventer에도 분교를 가지고 있습니다. 제가 파견을 나간 해에는  데벤터에 한국인 교환학생을 받지 않았으며 모두 엔스케데에서 공부했습니다. 3~4층 높이에 대략 연세대학교의 중앙도서관만한 메인빌딩을 중심으로, 주변에는 새로지은 건물 2~3개가 있지만, 대부분의 수업은 메인빌딩에서 이루어집니다. 네덜란드에는 산이 없습니다. Saxion도 평지위에 지어져있기 때문에 정문에서 상대에 이르는 고난의 언덕도 찾아 볼 수 없습니다.","Saxion으로 파견을 나가는 학생으로부터 ''기숙사에 살면 여행다닐 때 교통편이 어렵지 않나요?''라는 문의를 받은적이 있습니다. 서울이라는 도시에서는 강북보다는 아무래도 강남쪽에 사는 것이 교통이 편리할 수 있을 것입니다. 그러나 Saxion이 위치한 엔스케데라는 도시는 사실은 도시보다는 ''마을''에 더 가까운 개념입니다. 따라서 어디에 살던 이동하는데 시간이 크게 차이 나지는 않습니다. 이 작은 엔스케데라는 마을도시의 중심은 센트럼으로, 마을의 모든 상권이 모여있는 곳입니다. 다양한 종류의 마트, 아시안마트, 옷가게, 백화점, 잡화점, 클럽, 카페, 도서관, 영화관, 당구장등 있을 것은 모두 다 있고(규모를 서울에 있는 그것들과 비교할 수는 없지만) 화요일과 토요일에는 오픈마켓이 열려 신선한 식료품을 주로 하는 여러가지 것들을 싼가격에 구매할 수 있습니다. 스스로 기숙사에서 생활을 꾸려가게 되면 아무래도 가장 많이 가는 곳이 센트럼이 될 것입니다. 각종 행사가 열리는 곳도 이곳이라 저는 퀸즈데이와 네덜란드 축구 리그 챔피언십 관람도 센트럼에서 했습니다. 엔스케데 외곽으로 나가게 되면 매우 큰 규모의 영화관과 볼링장이 있고, 자동차나 대중교통을 이용하면 독일에도 어렵지 않게 다녀올 수 있습니다.","기숙사는 4층으로된 아파트가 두 동 붙어있는 구조입니다. 한 층을 두가구가 공유하고, 한 집은 세명이서 공유하게 됩니다. 집의 구조는 작은 부엌과 욕실과 화장실, 협소한 복도, 거실과 방 3개입니다. 구체적으로 말씀드리자면, 거실은 집에서 가장 넓은 공간으로 매우 커다란 창이 있습니다. 3개의 방은 조금 이상하게도 크기가 모두 다른데, 1번방은 베란다와 큰 창이 있는 대신 크기는 중간입니다. 3번방은 크기가 가장 크고, 창도 넓지만 화장실 옆에 붙어 있습니다. 2번방은 가장 작고, 창도 없느니만 못한 크기 입니다. 3방 중 어느방에 배정될 것인가는 도착한 순서대로, 그리고 매니저의 안내에 따라 무작위로 결정됩니다. 기숙사는 학교에서 지은 것이 아니며, 사설업체로부터 렌트받은 것이기 때문에 학생들을 위한 편의시설은 없으며 따라서 밀플랜도 제공되지 않습니다. 모든 식사는 스스로 만들어서 먹어야 합니다. 위에 언급한대로 센트럼에서 장을 봐서 만들어 먹으면 됩니다. 특히 많은 사람들이 걱정하는 한국음식을 만들 식재료는 몇몇의 것들은 한국에서 가져가는 것이 좋지만, 거의 대부분의 것들을 현지에서 구할 수 있다고 보는 것이 맞습니다. 우선 센트럼에 입구에 토코라는 커다란 아시안마트가 있고, JUMBO라는 마트 앞에 작은 아시안 마트가, HEMA 건너편에 엔스케데 최대규모의 아시안마트가 있습니다. 밀플랜이 없다는 사실에 어떤 학생들은 당황할 수도 있겠고, 어떻게 살지 막막하기도 할테지만 막상 적응해서 살다보면 이는 아무것도 아닙니다. 같이 파견나간 다른 학생들이나 외국인들과 거의 대부분 함께 밥을 만들어 먹으며 친해집니다. 걱정할 필요가 없습니다.","수업은 Saxion에 재직중인 네덜란드 교수님이 진행합니다. 영어교수님이나 스페인어 교수님도 예외없이 네덜란드인입니다. 한분정도가 미국분이시라고 들었습니다. 하지만 ''Marketing and International Management''라는 소속이 부끄럽지 않게 수업은 모두 영어로 진행되고, 실제로 수업을 하는 교수님도 함께 수업을 듣는 학생들도 영어를 매우 유창하게 합니다. 다만 그 수업의 질이라는 것이 모교인 연세대학교와 비교할 수는 없을 것입니다. 그 이유를 찾아보자면, 쿼터제이기 때문에 한학기가 2번으로 나뉘어져 있어 한 쿼터에만 열리는 수업은 고작 2개월정도 수학할 수 있기 때문에 일단 시간상의 한계가 있습니다. 따라서 조금 난이도가 있는 과목들은 두쿼터에 연속하여 수업이 열립니다. 두번째로는 Retake라는 제도로, 이는 한국으로 따지면 재수강없이 시험을 다시 치르는 제도로 다소 공부하려는 의지를 느슨하게 합니다. 세번째로는 교수님들의 태도로, 이것은 학생의 입장에서 평가할 것은 아니지만 그들은 무엇을 가르치기 보다는 공부할 자료는 건네주는 전달자에 불과할때가 많습니다. 하지만 이런 단점들에도 불구하고 자신에게 맞는 수업을 잘 골라서 열심히 공부한다면, 분명 얻을 수 있는 것이 많을 것입니다. 
도서관은 에스컬레이터를 타고 한층을 올라가고도 계단으로 한층을 더 올라가야 찾아갈 수 있습니다. 규모는 매우 협소하고, 갖춰진 책들도 대부분은 실용서가 많으며 특히 네덜란드어로 된 자료가 많습니다. 컴퓨터도 물론 이용할 수 있지만, 컴퓨터실은 우리학교 중앙도서관의 멀티미디어실과는 비교할 수 없고, 구중도에 컴퓨터실을 생각하시면 될 것 같습니다.","국제교육부는 우선 학교생활 전반에 관련된 문제는 메인빌딩인 한스트라의 한쪽 사무실에서 Monique Perik 선생님이 담당하고 계십니다. 문제가 생겼을 때 언제든 주저없이 찾아가면 친절하게 도와주십니다. 하지만 주의 할 것은, 업무가 분명히 나누어져 있기 때문에 아무 문제나 마구 들고 찾아가서는 안됩니다. 모니크 선생님도 도와주고 싶지만 그녀의 업무밖에 일은 도와줄 수가 없고, 그렇게 되면 일이 지연되기 마련입니다. 여기서 중요한것은 네덜란드의 행정처리가 빠르지 않기 때문에, 일이 지연되다보면 한없이 지연된다는 것입니다. 최선의 방법은 사무를 담당하는 곳을 정확하게 알고 문제가 생겼을 때 정확하게 찾아가는 것입니다. 학교생활이 아닌 예치금 문제, 거주증 문제, 보험문제는 역시 같은 메인빌딩의 인터내셔널 오피스로 찾아가야 합니다. 특히 이 곳은 쉬는 날이 많고, 담당자가 자리를 비울때도 많아 문제를 급박하게 처리하려고 하면 낭패를 보기 쉽상입니다. 이곳에서 일처리를 해야한다면 항상 여유있게 시간을 두고 가는 것이 현명합니다.  Housing에 관한 문제는 Karen씨의 담당입니다. 열쇠를 안가지고 문을 닫았다던지, 세탁기가 고장이 난다던지 하는 문제는 John이라는 분의 담당입니다. 학교 아이디와 비밀번호 문제, 인터넷, 와이파이 관련 문제는 메인빌딩 1층 안내카운터 뒷편으로 찾아가야 합니다. 은행과 ATM은 도서관 옆쪽에 위치하고 있습니다. 역에도 학교와 같은 은행이 있지만 가끔씩 이 둘이 처리할 수 있는 문제가 나뉘어져 있기 때문에 해결하려는 문제에 따라 구분해서 찾아가야 합니다.","학기가 시작되면 국제교육부에서 Chipnip 카드를 나누어주고, 여기에는 10유로가 미리 예치되어있습니다. 이 카드는 복사나 프린트, 그리고 카페테리아에서 음식을 사 먹을 때 이용됩니다. 10유로를 다 사용하게 되면 이 카드 대신에 ABN AMRO은행에서 발급한 카드를 학교에 설치된 기계들에서 카드에 예치된 금액내에서 원하는 만큼 충전하여 사용하게 됩니다. 그러나 이 카드가 발급될 때까지 대략 1~2달 정도의 시간이 소요되므로 생각없이 미리 충전된 카드를 카페테리아에서 모두 써버렸다가는 중요한 순간에 프린트를 하게 되었을 때 낭패를 보게 됩니다. 기숙사에는 프린터기가 없기 때문에 학교에서 충전하지 못하면 자전거를 타고  센트럼에 있는 Copy Shop까지 가야하기 때문입니다. 
학교내에는 동아리가 없고 학생들이 정기적으로 모여 스포츠를 즐기거나, 회비를 내고 가입하여 체육관을 이용할 수 있습니다.","네덜란드하면 떠오르는 것이 합법화된 마리화나(대마초)와 매춘일 것입니다. 매춘에 관한한 그러한 홍등가는 엔스케데같은 작은 마을에는 존재하지 않습니다. 그러나 마리화나를 파는 Coffee Shop은 엔스케데 곳곳에 존재하며, 시간이 지남에 따라 마리화나를 흡연하는 사람을 보는 것은 더이상 대수롭지 않게 됩니다. 사실 집밖에서의 마리화나 흡연은 불법이지만 클럽에서 춤을 추거나 센트럼에서 축구 중계등의 큰 행사가 있을 때, 쉽게 마리화나 냄새를 맡을 수 있습니다. 사실 이 것보다 제게 더 큰 충격으로 다가왔던 것은 동성애 문제입니다. ''보이시한 헤어스타일의 나이든 중년여자는 모두 레즈비언이다.''라는 친구의 장난섞인 농담과 게이 전용극장등 이 나라의 동성애에 대한 관용은 참으로 존경스러울만큼 개방적이었습니다. 그러나 굳이 동성애가 아니라 하더라도 네덜란드와 유럽자체가 성과 이성관계에 대단히 개방적인 국가였습니다. 최초에는 충격적이지만 이것 또한 시간이 지나면 자연스럽게 이해할 수 있으며, 열린마음과 관용에 대해서 조금은 배울 수 있는 계기인 것 같습니다.
마지막으로 하나 덧붙이자면, 네덜란드에서는 우리가 익숙했던 모든것이 정말 놀라우리만큼 느리고 허술합니다. 특히 은행에 관한한 악명이 높습니다. 한 친구는 환전을하러 은행에 갔는데, ''은행은 환전을 해주는 곳이 아니다.''라고 말해 모두를 놀라게 했습니다. 뿐만 아니라 대부분의 가게는 6시를 전후해 문을 닫고 주말에는 쉽니다. 인터넷은 생각했던것만큼은 아니었지만 여전히 느립니다. 네덜란드의 문제라기보다는 한국의 서비스와 시설들이 워낙 잘 갖추어져있기 때문에 특히 여기에 익숙한 한국인들이 적응하기에는 다소 힘든점이 있었던 것이라 생각됩니다.","학기가 시작할 때 host family를 신청자에 한해 배정받게 됩니다. MIM소속이라는 것은 거꾸로 말해 교환학생이 공부하는 학과로 좀처럼 네덜란드인들을 만나기가 쉽지 않습니다. 하지만 살다보면 결정적인 순간에 네덜란드인들의 도움이 필요할 때가 있습니다. 예를들면, 전화를 개통하여 사용한다고 하여도 모든 안내는 네덜란드어로 이루어집니다. 네덜란드가 아무리 맛있는 음식이 없다고 해도 네덜란드 음식을 맛보고 싶기도 하고 특히 상반기에는 네덜란드 국경일이 많은데 의미도 모르고 지나칠때도 있습니다. 이런 점들에 관해 호스트패밀리들은 작고 섬세한, 그리고 유용한 도움을 많이 주십니다.","유럽까지 가는 항공편으로는 미주에 비해 짐을 많이 붙일 수가 없습니다. 따라서 항공용 캐리어에는 짐을 가볍게 넣으시고 기내용 캐리어에 무거운 물건들을 최대한 많이 넣는 것이 오버차지를 피하는 길입니다. 특히 이런저런 걱정에 식재료들을 많이 가져가다보면 짐이 커지게 되는데, 쌀도 밥솥도, 대부분의 식재료를 현지에서 구할 수 있으니 걱정하지 마시길 바랍니다. 그래도 유용했던건 언제 넣어도 음식을 맛있게 만들어주던 조미료와 불고기 양념, 보관이 편한 김과 고춧가루였습니다. 
여행을 많이 다녔던 기억이 납니다. 휴일이 있을 때마다 여행을 다녀 돈도 많이 들고 몸도 힘들었습니다. 특히 엔스케데에는 공항이 없고 공항을 찾아 나가는 교통편으로도 돈이 많이 들었기 때문에 매번 투정을 부렸던 기억이 납니다. 그러나 사람들을 사귀고, 견문을 넓히고, 추억을 만드는 데 가장 좋았던 것은 역시 여행이었던 것 같습니다. 여행에 대하여 조언을 한다면 몇시간도 모자랄것입니다. 하지만 다른 모든 것이 그렇듯 여행도 다니다보면 기술이 생깁니다. 스스로 부딪혀가며 배워보시기를 바랍니다. 
교환학생을 가기전 경험보고서의 말미는 항상 ''지금 이 경험보고서를 보고 교환학생을 준비하고 있을 당신이 부럽다.''였습니다. 엔스케데에 제일 처음 도착하고나서, 조그마한 센트럼의 크기에, 기숙사에 넘치는 한국인들에, 한끼를 해먹으면 생기는 다음 끼니 걱정 때문에 ''내가 여기에 왜 왔지?''라는 생각을 하며 경험보고서의 말미따위는 모두 거짓말이라고 생각하기도 했습니다. 그러나 마음을 바로잡고, 스스로의 중심을 잃지 않으며 살아가도록 노력했기 때문에 작은 시골 마을엔스케데는 전원생활을 위한 최적의 장소가 되었으며, 한국인들과는 ''가족''이 되었고, 끼니 준비는 늘 즐거운 이벤트가 되었습니다. 미국에 다녀온 친구들보다 외국인 친구들을 많이 사귀지도 못했고, 영어가 일취월장 한것은 아니었지만 외국인 친구도 ''친구''이기에 중요한 것은 사귄 사람의 ''수''가 아니며, 유창하게 의사소통했던 것보다 생각만 해도 웃음이 나는 그들과의 추억이 제게 남았습니다. 
2011년 1월 29일부터 8월 1일까지, 저는 제 생에 다시 없는 소중한 날들을 얻고 돌아왔습니다. 6개월이란 짧은 시간이지만 이 시기가 있기 전의 나와, 그 이후의 나는 결코 같은 사람일 수 없을 것입니다. 너무도 소중한 시간들이었기에 저 역시도 지금 이 글을 읽으시며 Saxion으로의 교환학생을 준비하시는 여러분들이 부럽기만 합니다. 제 글이 조금이나마 도움이 되어서 저 보다 더 많은 것을 얻고 돌아오셨으면 좋겠습니다."
