gen_info,env_info,food_info,study_info,office_info,facil_info,mhct_info,help_info,etc_info
"Saxion University에 배정받기로 결정되고 나면, Deventer에 있는 Saxion으로 갈 것인지, Enschede로 갈 것인지 선택을 하게 됩니다. 대부분은 Enschede로 가는 걸로 알고있구요, 저 역시 Enschede로 선택했습니다. Enschede는 작고 조용한 도시로 느껴지나, 네덜란드에서 꽤 큰 도시에 속합니다. 열 손가락 안에 들어갔던 걸로 기억하는데 정확히는 기억이 나지 않습니다. 시내에 쇼핑몰, 상점, 식당도 구석구석 다양하게 있고, 매주 토요일마다 매우 큰 시장이 열립니다. 유럽여행을 다니면서 곳곳의 유명하다는 시장을 다녀봤는데, Enschede의 시장만큼 큰 시장은 몇 개 보지 못했던 걸로 기억합니다. 이 도시는 독일 국경과 매우 가까히 위치하기 때문에, 토요일 시장에서 독일인도 많이 볼 수 있고, 기차로 가까운 독일 도시로 가는 시간이 Amsterdam에 가는 시간보다 적게 걸리기도 합니다. 기후는 저는 8월부터 2월까지 있었는데, 8~9월은 날씨가 매우 좋았고, 10월쯤부터 그 유명한 네덜란드의 비가 내리기 시작했던 것 같습니다. 폭우처럼 쏟아지지는 않으나, 시시때때로 보슬비가 내립니다. 자전거를 타고 달리다 보면 얼굴에 미스트를 뿌리면서 달리는 느낌을 받으실 겁니다. 처음에는 비 맞기 싫어서 우비도 장만했었지만, 나중에는 그냥 맞고 달립니다. 겨울에는 눈이 꽤 왔었는데, 자전거 타는데 정말 많이 불편했습니다. 그나마 큰길은 눈을 금방 치워서 낫지만, 숙소 롤로프 근처의 길들은 눈을 치우지 않아서 쌓이고, 업니다. 자전거에 최악의 조건이 되는거지요. 그리고 네덜란드는 기차가 자주 이용되는 교통수단중 하나인데, 눈이 오면 기차 시간이 매우 자주 바뀝니다. 유의하셔야 합니다… 연착도 자주 되고 있던 기차가 사라지기도 합니다. &#61514; 경험해보시면 알거에요. 그래도 한국이 영하 십도이하로 내려갈 때 네덜란드는 0도 근처에서 맴돌았던 걸로 기억합니다. 단지 해가 자주 나오는 편이 아니라서 겨울엔 조금 우울하긴 합니다. 도시가 매일매일 회색빛이라서 가끔 해가 나오면 광합성을 해야겠다는 의무감으로 뛰쳐나갔었습니다.","Saxion University는 시내에서 자전거로 5분 정도 거리에 위치해있습니다. 학생이 이용할 수 있는 GYM이 있다고 하는데, 저는 이용하지 않았고, 친구들도 학교 Gym시설이 그렇게 좋은 편이 아니라 주변에 새로 오픈해서 세일하는 Fitness center 쪽으로 다녔습니다.  학교 근처에 큰 Second hand shop도 있습니다. 숙소는 가장 기본적인 가구만을 갖춰놨기 때문에, 잠시 교환학생으로 지내시는 분들이 필요한 가구나 가전제품을 개인적으로 장만해야할 수도있습니다. 플랫메이트들과 함께 1/3 등분 해서 구매하시면 매우 저렴하게 필요한 제품을 장만 하실 수 있을겁니다. 이름은 생각나지 않지만, 교환학생 담당 Manager인 모니크에게 물어보면 위치를 알려줄 겁니다. 그리고 숙소와 학교 중간에 큰 공원이 있습니다. Volks Park라고 하는데, 낮에는 매우 예쁘지만, 밤에는 조명이 그렇게 많지 않아서 여자혼자서는 조금 무섭습니다. 그래도 낮에 소풍가기 참 좋아요 &#61514;","Saxion은 교환학생들을 위해 작은 건물을 통째로 빌려서 렌트를 해주고 있습니다. 두 건물에 교환학생들만 거주하고 있으니 조모임할 때 정말 편했던 것 같습니다. Roelof Street에 위치하는데, 학교에서 자전거로 10~15분정도 떨어져있습니다. 바로 1분거리에 EMTE라는 슈퍼마켓이 있고 5분정도 학교 반대쪽으로 자전거를 타고가면, Albert Hijn이라는 큰 슈퍼마켓과, 한국에 엽서나 소포를 부칠 수 있는 상점이 있습니다.
식사는 취향대로 하실 수 있으실텐데요. 시내에 큰 HEMA 뒷편에 가장 큰 아시아 마켓이 있고, 그 외에도 간간히 작은 아시아 마켓들이 있습니다. 학기 초에는 아시아 마켓에 한국 음식은 그렇게 많지 않았었는데, 시간이 지나면서 고추장, 된장, 쌈장까지 들어오더라구요. 아무래도 한국 사람이 자주 온다는 것을 깨달은 주인아저씨의 친절이 아닐까 싶습니다. 떡도 팔아서 떡볶이를 자주 해먹으며 한국음식에 대한 그리움을 달랬습니다. 그 외에 네덜란드는 감자, 버섯류의 식료품이 매우 저렴한데, 마트에서 산 채소 및 식재료 들은 일반적으로 조금 비싸지만 오래가는 편이고, 시장의 식료품은 조금 저렴하고 복불복입니다. 과일 같은 경우 잘 사면 정말 달고 맛있는 과일을 싸게 먹을 수 있지만, 잘못 사면 썩은 귤들이 섞여있기도 합니다… 전  개인적으로 매주 시장에 가서 과일을 잔뜩 사다놓고 일주일 내내 집어먹는 게 좋아서 여행가는 주가 아니라면 매주 시장에 출근했습니다.","수업은 연세대학교의 수업과 비교했을 때, 질이 상대적으로 떨어지는 편입니다. 참여식 교육보다는 일방적인 강의로 이루어지는 경우가 대부분이었습니다. 저는 처음에 32Ects를 신청했고, 최종적으로 26Ects를 Pass했습니다. 5.5점을 넘으면 pass인데, 아무래도 유럽 교환학생의 묘미는 여행이다보니, 정신없이 여행 다니다 보면 5.5점의 벽도 낮지는 않더라구요. 제가 수강한 과목은
Analysis of international company. 
Sales marketing
Service marketing.
Human Resource Management
Strategic Management
Cultural Management
Marketing communication
Business Marketing 이었습니다.

개인적으로 Cultural management 강의가 가장 재미있었고, 나머지는 오십보백보였던 걸로 기억합니다.
그러나 Human Resource Management의 경우, 전공인정을 받을까 하여 신청해서 들었긴 했는데, 교수가 초임교수라 수업에 불만이 많았었습니다. 앞으로 교수가 바뀔지 아니면 계속 할지 잘 모르곘네요.
도서관은 학교내에 있는데, 우리나라 중앙도서관 생각하시면 안됩니다. 훨~씬 작아요. 인쇄나 복사를 학교에서 사용하는 Chip-knip 카드를 사용해서 도서관에서 하게 되고, 그 외에는 잘 가지 않았던 것 같습니다.","다른 교환학생 수기에도 나와있듯이, 제일 적극적으로 교환학생 편이 되어주시는 분은 Monique 단 한 분 뿐입니다. 사고가 발생했을 때는 가장먼저 Monique를 찾아가세요. 하우징 오피스도, 스튜던트 데스크도 융통성 없습니다. 친절하기는 매우 친절하지만, 예외사항이 일어났을 때의 대응이 매우 답답합니다. 일 처리 속도가 느린건 유럽 전반적인 특징인 것 같구요. 예를 들어 친구가 레지던스 퍼밋관련해 문제가 생겼는데, 모른다로만 일관하고, 책임자와 연결해달라고 해도 모른다고만 반복하더군요. 결국 모니크가 중재해줬습니다. 모니크가 짱입니다!!!
그렇지만, 일반적인 문제들에 관해서는 다른 분들도 매우 친절하게 도와주시니 겁먹지는 마세요","동아리는 잘 모르겠지만, Saxion에서 교환학생을 위해서 종종 프로그램을 마련합니다. 영화표를 저렴하게 제공하기도하고, 다같이 현장학습처럼 크리스마스마켓이나 근처 도시를 가기도 합니다. (이런 프로그램이 있으면 무조건 참여하시길 추천합니다. 저렴하게 새로운 것을 많이 경험하실 수 있게 됩니다.) 이 중에 가장 마음에 들었던 것은 Host Family라는 프로그램이었습니다. Enschede의 Dutch Family와 교환학생을 연결해서 Dutch문화를 접할 수 있게 하는 프로그램인데, 꼭 지원하시길 바랍니다. 저는 정말 좋은 Host Family를 만나서, 비행기 일정 착오로 일주일정도 지낼 곳이 없었는데, 귀국하기 전 일주일 동안 호스트패밀리 집에서 지내면서 너무 좋은 시간을 보냈습니다. 물론 어떤 Host를 만나냐에 따라 다르겠지만, 자기와 성격과 취향이 맞는 host를 만난다면 이보다 좋은 Dutch Culture에 대한 경험은 없을 것 같습니다.","미리 어느정도 네덜란드의 문화에 대해 듣고 가서 큰 놀람은 없었지만, 은행업무의 느리디 느린 업무속도는 정말 쇼크였습니다. 6개월 거주하면서, 1달이 넘는 기간을 계좌를 만드는데 소요했으니 말 다했죠. 보안상의 이유라고 하더라구요. 마약 같은 경우는 dutch들은 담배정도로 가볍게 여기면서 기분전환용도로 사용하는 것 같아서 신기했습니다. 제가 신기하다고 했더니, 금지하면 금지할수록 약물에 대한 신비감이 높아져서 더 남용하게 되는거라고 하더군요. 어느정도 맞는 말인 것 같기도 했습니다. 또다른 문화충격은 굉장히 직설적으로 말한다는 점이었습니다. 처음에는 교수님이 저한테 화가나신줄 알았습니다. 그런데 단지 해야할 것을 돌려말하지 않았을 뿐이었다고 말씀하시더라구요. 나중에는 돌려말하지 않으니 오해할 일도 없어서 오히려 편하다라는 생각이 들었습니다.","무조건 가장우선순위연락처는 모니크입니다. 페이스북에 항상 상주하고있으니, 늦은 경우나 모니크가 vacation인 경우는 페이스북 메시지를 보내시면 오래지나지 않아 답장이 올 것입니다. 일반적으로는 메일로 교환하시면 되고요 &#61514;","과목자체의 난이도는 그리 어려운 편은 아니지만, 한학기가 2개로 나눠져있다보니, 해야할 분량이 꽤 많은 편입니다. 과목수가 그만큼 많아지니까요. 너무 얕보지 마시고 공부와 여행 두마리 토끼를 모두 잡으시길 빕니다.
그리고 보통 유럽에 교환학생을 가시는 이유가 유럽전역을 둘러보기 위해서인데, 다른 나라를 여행하느라 네덜란드를 못 보고 오는 실수는 저지르지 마시라고 꼭 말씀드리고 싶습니다. 엄청나고 장엄한 관광명소가 있는 것은 아니지만 네덜란드만의 매력이 넘치는 도시들과 문화가 많습니다. 우리나라에는 네덜란드의 매력이 그렇게 많이 소개되있지 않은데, dutch 친구를 만드셔서 많은 얘기를 들으시고 네덜란드 내의 많은 곳도 꼭 보고 오시길 추천합니다. 겨울에 네덜란드 북부에는 스케이트로 유명한 도시도 있고(이름이 생각이 나지 않네요…) harlem이라는 도시도 매력적이랍니다. 로테르담의 킨더다이크는 상상속의 풍차마을이 존재하는 곳입니다. 이 외에도 제가 알지 못하는 장소도 매우 많을 테니, 꼭 네덜란드만의 매력도 놓치지 마시기 바래요."
"Saxion University는 Deventer와 Enshcede 두 곳에 각각 위치해 있습니다. 하지만 연세대학교 분들은 거의 예외 없이 Enshcede에 있는 분교로 갈 것으로 예상합니다. 개인적으로 Deventer에 있는 학교가 궁금하여 혼자 방문해서 둘러본 적이 있었는데 Enshcede 보다 학교도 더 크고 좀 더 번화가에 위치해 있어 갈 수 있다면 이곳에서 학기를 보내는 것도 나쁘지 않을 것 같습니다. 
 Enshcede의 Saxion에 대한 이야기를 하자면 학교는 크지 않고 몇 개의 건물이 튤립 모양의 건물을 중심으로 근처에 위치해 있습니다. 그리고 학교에서 지원해주는 기숙사와 대학교가 거리상 상당히 떨어져 있다는(도보30분, 자전거 10분) 점도 유의해야 할 부분입니다. 
 지도를 펼쳐보시면 아시겠지만 지리적으로는 네덜란드와 독일의 국경근처에 위치해 있기 때문에 독일에 가는 것이 오히려 수도인 암스테르담에 가는 것보다 적게 걸립니다. 암스테르담과의 거리는 대략 기차로 2시간 반정도 걸리며 여행을 할 때마다 자주 타야 하기 때문에 여행을 많이 하겠다고 계획하고 오신 분들은 유레일 패스나 현지에서 구입할 수 있는 할인 카드를 사시면 편하게 기차를 이용할 수 있습니다. 
 경험했던 1월부터 8월까지의 전반적인 기후에 대해서 설명하자면 우선 겨울인 1월에서 2월은 상당히 지내기 불편했습니다. 해도 늦게 뜰 뿐더러 오후 4시만 되면 해가 다 떨어져서 사방이 깜깜하기 때문에 활동에 제약이 많았고 온도 자체는 그렇게 낮지 않았지만 바람이 심하게 불어 돌아다니기 불편할 정도였습니다. 3~5월 봄 기간은 네덜란드에서 가장 기후가 좋은 시기라고 하는데 그렇게 춥지도 않고 날씨도 생각보다 화창하여 지내기 편했습니다. 개인적으로는 여름도 나쁘지 않았는데 한국처럼 찌는 듯이 덥지도 않고 밤에는 기온이 17~4도 까지 떨어져 오히려 춥기도 했습니다. 다만 이 기간에는 해가 떠 있는 시간이 조금 길어 (새벽 5시부터 뜨기 시작하여 저녁 11시가 넘어야 해가 지는) 적응하는데 불편하기도 했습니다.","Enschede역에서 내려서 역 입구에 섰을 때 도시의 번화가가 시작하는 지점에 와있다고 생각하시면 됩니다. 역에서 조금 걸어가면 시티센터가 있는데 이 센터를 중심으로 원형을 이루며 대부분의 가게들이 자리를 잡고 있습니다. 쇼핑센터, 마트, 전자상가, 클럽, 음식점, 생필품점, 이발소, 패스트푸드점도 등등 대부분의 시설이 있고 학교도 이곳에서 도보로 5분정도 떨어진 곳에 위치해 있기 때문에 대부분의 활동이 이 근방에서 이루어진다고 생각하면 될 것 같습니다. 또한 주말마다 중앙 광장에서 장이 열리거나 다양한 행사가 준비되어 있기 때문에 경험해 보고 싶으신 분들은 자전거를 타고 다녀오시면 됩니다.
사실 Enschede가 크고 번화한 도시와는 거리가 상당히 멀기 때문에 화려하고 번잡한 도시의 모습을 생각하고 가시면 많이 실망을 할 수도 있습니다. 그런 생활은 암스테르담이나 다른 곳에 가면 충분히 구경할 수 있고 이곳에서는 아기자기하고 조용한 전원생활을 즐기실 수 있을 것입니다
그 외에도 기숙사 근처에 그리고 자전거를 타고 좀 더 나가면 몇 개 등 여러 개의 공원이 있어 주말에 소풍을 가거나 산책을 가는 등 여가생활을 즐길 수 있습니다. 가끔 날씨가 좋으면 음식을 싸가지고 나가서 파티를 하기도 합니다. 그 외에도 근처에 자전거를 타고 20 ~ 30분 나가면 Twente 전용 축구장이 있습니다. 지역 축구팀으로 상위권의 팀인 것 같은데 축구 또는 네덜란드 리그에 관심이 있으신 분들은 표를 구해서 관람을 하면 재미있을 듯 합니다.","학교측에서 교환학생들에게 각각 기숙사에서 지낼 것인지 여부를 물어보는 이메일을 보냅니다. 대부분의 학생들에게 한국에서 네덜란드에 있는 집을 알아보고 가거나 미리 가서 집을 구하는 것은 어렵기 때문에 기숙사를 신청하게 되고 저 또한 그랬습니다. 기숙사는 위에서 이야기 한 것처럼 역과 학교에서 자전거로 20분 거리에 있고 Flat을 3명이서 같이 쓰는 방식입니다. 이 방에 들어가는 것은 선착순으로 정하며 따라서 먼저 가서 이 방을 쓰겠다고 하면 그 방을 쓰게 해줍니다.
우리나라 아파트 같은 구조로 거실과 베란다, 화장실과 세면장, 주방이 구비되어 있고 방이 3개가 있어 각 방마다 한 명씩 사는 구조입니다. 모든 Flat은 동일한 구조로 되어있고 차이점이 있다면 층마다 일조량이 차이가 난다는 점 정도입니다. 그리고 Flat의 3개의 방은 각각 특징이 있는데 주로 1번방은 베란다에 접해 있어 일조량과 탁 트인 전망이 좋다는 장점이 있습니다. 2번째 방은 가장 넓은 방으로 넓은 공간을 자유롭게 사용할 수 있다는 점이 좋지만 기숙사에 먼저 들어와 있는 학생들이 주로 사용하고 있으므로 사용하기가 쉽지 않습니다. 마지막 3번째 방은 크기도 작고 창도 작아 좁고 답답한 느낌이 들지만 가장 안쪽에 있어 방해 받지 않는 혼자만의 생활을 영유할 수 있다는 장점이 있습니다.
식사 같은 경우 밖에서 나가 사먹는 것은 비싸기 때문에 주로 주변 마트에서 재료를 사와 직접 만들어 먹었습니다. 마트에서 손질된 재료를 많이 팔기 때문에 번거로움 없이 쉽게 음식을 해 먹을 수 있으며 밥솥을 빼고는 기숙사 주방에 이미 구비되어 있기 때문에 특별한 조리도구를 필요로 하지 않는 이상 취사가 가능합니다. 그리고 중앙 광장에 아시안 마켓이 있고 중앙광장에서 자전거를 타고 10분 정도 더 나가면 조금 더 큰 마트가 있어서 한국 식재료를 팔기 때문에 (종류가 많진 않지만) 제한적으로나마 한국 음식을 해 먹을 수 있지만 한국 식재료만을 취급하는 마트는 암스테르담이나 대도시로 나가야 하기 때문에 귀하기가 쉽지 않습니다.","수업 같은 경우 교환학생들끼리 반을 따로 만들어서 영어로 진행하였습니다. 그곳에서 가르치시는 교수님들 대부분이 영어문화권에서 오신 분들이 아니기 때문에 유창하지 않으신 분들도 있지만 수업진행과 질의응답에는 문제가 없었습니다. 학생들도 세계 각국에서 오기 때문에 영어를 잘하는 학생도 있고 못하는 학생도 있어서 수준이 어떻다라고 말하기엔 무리가 있는 것 같습니다. 
학점의 경우 대부분의 수업이 3ECTS이고 4또는 5 그리고 6 ECTS짜리 수업도 있습니다. 그리고 학점이 같더라도 한 쿼터만 진행하는 수업이 있고 두 쿼터 진행하는 수업이 있기 때문에 이러한 점을 살펴보고 적절한 수업을 선택해야 합니다. 또한 이곳 Saxion의 수업 중 특이한 점은 시간표가 고정이 아니라는 점입니다. 매주 시간표가 바뀌기 때문에 홈페이지에서 시간표를 보고 수업과 강의실 그리고 시간을 확인해야 합니다. 확인하지 않는다면 학교에 도착한 뒤, 강의실을 찾느라 고생하는 경우도 생기게 됩니다. 수업 난이도 같은 경우는 영어라는 점을 제외하면 어렵지 않으며 시험 난이도도 마찬가지이고 따라서 Pass를 위해 많은 학습량을 요구하진 않습니다.
도서관 같은 경우 우리나라랑은 다르게 정숙한 분위기가 아니며 오히려 서로 이야기하고 토론하는 분위기입니다. 또 도서관 운영 시간도 달라 월수금 7시, 화목 5시면 문을 닫습니다. 시끄럽고 일찍 닫기 때문에 저 같은 경우는 도서관 보다는 기숙사방에서 공부하는 경우가 더 많았습니다. 도서관의 도서도 네덜란드어로 되어 있는 것이 많고 양도 그렇게 많았던 걸로 기억합니다.","International Office는 학교 건물 2층에 위치해 있습니다. 이곳에서 교환학생과 관련된 행정업무를 수행하기는 하지만 접촉할 일이 별로 없습니다. 학기 초반에 한국에서 가져온 증명서를 제출할 때, 비자를 발급받을 때 등과 교환학생이 끝날 때 몇 가지 서류작업을 할 때를 제외하고는 평소 학기 중에 방문할 일이 적습니다. 이런 점에 있어서 International Office 보다는 교환학생 오기 전 이메일로 연락을 주셨던 Monique 라는 여성 교직원이 교환학생들의 의문점들이나 어려운 점들을 잘 도와주셨습니다. 행정적인 문제로 의논을 하더라도 먼저 이분과 상의하면 좀 더 원활한 해결책을 찾는데 도움을 주실 것입니다.","교내에 학생들이 사용할 수 있는 여러 시설들이 있습니다. 교내식당, 탁구장, 피트니스 센터, 농구장, 서점 등등. 자판기나 서점 등을 제외하고 교내에서 돈을 지불하고 사용해야 하는 것들은 체크 카드처럼 chiknip이라는 카드를 발급받아 돈을 충전해서 사용해야 합니다. 하지만 교내 매점이라고 특별히 싸거나 많은 물건이 있지 않고 쓸 수 있는 곳이 교내뿐이기 때문에 이 카드를 사용하는 사람은 거의 없었습니다. 서점은 대학교 서점처럼 규모가 어느 정도 있는 서점이 아니라 노트나 필기구를 파는 자그마한 가게라고 보는게 더 적절할 것 같습니다. 교재는 가격이 상당해서 사서 공부하는 학생들이 없기 때문에 (현지 학생들도 대부분 복사해서 사용) 학기 초 노트를 사러 방문하는 것 외에 용도는 별로 없습니다. 교재 같은 경우 역 옆에 위치한 복사하는 곳에서 복사를 해서 사용하였습니다. 탁구장 같은 경우는 학교 1층에 위치해 있는데 탁구채와 공을 사무실에서 빌려주기 때문에 자유로이 제한 없이 즐길 수 있습니다. 피트니스 센터 같은 경우 사용을 하려면 사무실을 방문하여 회원권 같은걸 구매해야 사용 할 수 있는데 한 학기 단위로 판매를 했던 것 같습니다. 가격은 매우 저렴한 편이고 시설도 깔끔하고 나쁘지 않았습니다. 
 동아리 같은 경우는 어떻게 운영되는지 잘 모르겠지만 교환학생들을 위한 학교측에서 준비한 행사가 있습니다. 동네 구경을 시켜주기도 했고 튤립축제를 하는 기간에는 학생들을 모아서 가기도 했습니다. 이러한 행사가 있을 경우 이메일로 사전 공지를 하니 메일을 잘 확인해 보시면 그때그때 아실 수 있을 거라 생각합니다.","들어서 알고 있긴 하였지만 직접 보고 가장 놀라웠던 사실은 우리나라에서 금지된 마약과 매춘이 합법이라는 점입니다. 네덜란드 어느 도시를 가더라도 널려있는 Coffee Shop 이라는 간판이 있는 가게는 대마초를 파는 가게인데 많은 사람들이 이용하는 것을 보고 놀랐습니다. 처음에 도착하고 스타벅스나 할리스 같은 커피를 파는 곳인 줄 알고 들어갔었는데 그 특유의 냄새에 처음 놀라고 대마를 파는 가게라고 해서 두 번 놀랐던 기억이 납니다. 네덜란드 현지인 보다는 주변 국가에서 온 사람들이 더 많이 애용한다고 합니다.
 또 예전에 먼나라 이웃나라에서 읽었던 대로 수많은 운하가 뚫려 있는 운치 있는 경관과 집안을 고스란히 다 보여주는 큰 창문은 우리나라와 문화적으로 차이가 많이 있구나 하는 사실을 다시 한번 깨닫게 해주었습니다.
 그 외에도 이곳 사람들은 여유가 넘치는 것 같았습니다. 주 5일 근무에 6시면 전부 닫는 상가들, 월요일의 늦은 출근 등 국민소득에 비해 여유로운 이들의 삶이 조금은 부러웠습니다. 이래서 그런지 몰라도 행정적인 처리에 있어서 그 진행속도가 너무 느려 답답함을 느끼기도 합니다.",International Office에서 행정적인 도움을 받으시면 되고 그 외의 문제 들에 대해서 Monique Perik이라는 교직원분에게 문의하신다면 잘 알려주실 것입니다. 물론 그 외의 곤란한 상황이 생긴다면 한국 대사관에 문의를……,"stonenara@hanmail.net
개인적으로 유럽이 다른 곳보다 보고 배울점이 더 많다고 생각합니다. 특히 여행을 좋아하시는 분이라면 정말 강력히 추천합니다."
