gen_info,env_info,food_info,study_info,office_info,facil_info,mhct_info,help_info,etc_info
"삭시온 대학은 전문대학으로 연세대학교 캠퍼스에 비교하면 매우 작습니다. 그러나 건물이 매우 신식이고 자유롭게 앉아 공부하거나 조모임 할 장소가 많아 시설적인 부분에서는 만족했습니다. 작지만 프린트숍, 도서관, 식당, 매점 등 필요한 건 다 있습니다.삭시온 대학이 있는 엔스크데는 네덜란드의 동쪽에 있습니다. 서울에서 살다 간 사람의 입장에서는 매우 작은 도시이지만 동부에서 가장 큰 도시라는 자부심이 있는 듯 했습니다. 독일과 매우 인접해 있어서 기차를 타면 10분 내에 독일에 도착하고, 엔스크데 메인 역에는 독일 기차인 DB와 네덜란드 기차인 NS가 함께 있는 모습을 볼 수 있습니다. 저는 룸메와 함께 자전거를 타고 독일과 네덜란드 국경을 넘는 경험을 하기도 했는데 만약 엔스크데로 파견가신다면 매우 추천드립니다. 1시간도 채 걸리지 않았던 것 같습니다. 공항은 가까운 편은 아니지만, 암스테르담 공항, 아인트호벤 공항, 베체공항, 쾰른 공항 등 다양한 선택지가 있습니다. 아인트호벤 공항이 가장 저렵하고 가기도 편해서 많이 이용했습니다.2월에는 한국의 겨울처럼 매우 추웠고 눈도 자주왔습니다. 한국보다 훨씬 건조하고 칼바람이 부니 장갑이나 방한용품을 잘 챙겨가시면 좋을 것 같습니다. 롱패딩은 한달 정도밖에 입지 못하지만 개인적으로 필수라고 생각합니다. 그 후로는 비가 자주 오는 날씨가 이어지다가 5월부터 날이 굉장히 좋아지고 해도 길어지기 시작합니다. 5월~6월까지가 네덜란드 최상의 날씨인 것 같습니다. 7월부터는 너무 더워지는데 네덜란드 집 특성상 에어컨이 잘 없고 채광이 좋아서 정말 덥습니다. 선풍기도 금방 sold out되니 미리 사두시는게 좋습니다.","삭시온 대학은 엔스크데 중앙역 바로 옆에 있습니다. 여행을 갈 때 학교 주차장에 주차하고 걸어서 기차를 타곤 했습니다. 중앙역 근처가 시티센터인데 학교와도 매우 가깝습니다. 시티센터에는 Jumbo, Albert Hein, Action 등의 큰 슈퍼가 있고, 펍과 까페, 음식점들이 있습니다. 개인적으로 시티센터에 많이 가보지는 못했지만 Blue Sakura(초밥 무한리필), Hao Hao(버블티와 쌀국수), Coffee Fellow(공부하기 좋은 까페), Molly(아이리쉬펍), Van der poel(젤라또) 추천드립니다. 매주 토요일에는 시내 광장에서 마켓이 열립니다. 생선튀김(키블링) 정말 맛있습니다. 싱싱한 과일도 싼 가격에 판매했습니다.Enschede 페이스북 페이지 팔로잉 하면 시티센터에서 하는 행사들을 받아 볼 수 있습니다. 여름 기간에 정말 다양한 행사와 축제가 이루어지니 많이많이 참여하고 오세요.Roelof 기숙사에서 자전거로 20분 거리에 영화관(kermis)도 있습니다. 사람도 별로 없고 학생이면 할인 해줍니다. 저는 가보지 못했지만 영화관 근처에 서바이벌 게임장도 있다고 하네요. 영화관에서 조금만 더 가면 트벤테 대학입니다. 여기에 엔스크데의 유일한 스타벅스가 있습니다. 그리고 킹스데이와 독립기념일에 큰 축제를 하는데 정말.. 더치인들이 얼마나 잘 노는지 알 수 있습니다. 꼭 가세요!기숙사와 학교 사이에는 Volskpark라는 공원이 있는데 참 좋습니다. 일년에 두번 이동식 놀이공원이 개장하기도 하고 무료 오케스트라를 하기도 합니다. 여기서도 축제 많이 하고요. 날이 좋아지면 주민들이 나와서 썬텐하는 곳입니다.전반적으로 엔스크데라는 도시는 평생 살고 싶을 정도로 만족했습니다. 물가도 저렴하고 왠만한 편의시설도 충분했구요.","Roelof기숙사라고 하는데요, 낡은 아파트 전체를 학교가 렌트해서 기숙사처럼 운영하고 있습니다. 방 크기가 정말 랜덤입니다. 가장 큰 방은 가장 작은 방의 두배보다 커요. 완전히 랜덤으로 배정됩니다. 저는 운이 좋게도 좋은 방에 걸렸지만 가장 작은 방에서 생활한 친구들 말을 들어보면 상당히 불만족스러웠다고 합니다. 방은 혼자쓰고 부엌과 화장실, 샤워실은 공유합니다. 부엌에 기본적인 식기와 조리기구, 그리고 방에 침구류가 있어서 짐을 줄일 수 있어 좋았습니다.전반적으로 시설면에서는 만족했으나, 학기 중 거의 한달간이나 동의없이 부엌 공사를 해 부엌과 빨래를 아예 이용할 수가 없었고, 매일같이 인부들이 방을 왔다갔다해서 프라이버시가 없다시피 했습니다. 삭시온 측에 항의한 결과 3만원가량의 보상금을 받았는데 충분치 않았다고 생각합니다. 또한 사전에 말도 없이 갑자기 여자방에 남자를 배정해 믹스룸을 만드는 등, 전반적으로 학교 측으로부터 존중받지 못한다고 느꼈습니다. 불편사항에 대해 메일을 보내도 거의 답장을 하지 않습니다.식사는 거의 요리를 해먹습니다. 근처에 알버트 하인과 Lidl에서 장을 봐서 요리해먹었습니다. 아시안 마트는 알버트 하인 옆에 작은 게 있고, 시티센터에 더 큰 것이 있습니다. 정말 다 있으니 아무것도 챙겨오시지 않아도 되지만, 고추참치와 스팸, 레트로식품, 햇반은 좀 챙겨오면 좋을 것 같습니다. 장바구니 물가는 한국보다 싼 편입니다! 맥주도 싸고 맛있습니다. 또 빈 병을 마트에 가져가면 다시 돈으로 돌려주는데 꽤 쏠쏠합니다.네덜란드 배달앱을 이용해 도미노피자를 배달시켜 먹기도 했습니다.","높은 퀄리티의 수업을 기대하시면 Saxion과 맞지 않을 수 있습니다. 방법론적인, 얕은 수업 내용으로 진행되고 시험도 매우 쉽습니다. 한국과 다른 점이라면 프로젝트형 수업에 교수가 거의 관여하지 않고 상담만 하는 식으로 진행됩니다. 확실이 학생이 말할 기회가 많기도 합니다.도서관은 작지만 공부하는 사람이 별로 없어 항상 자리는 충분했습니다. 공부나 과제를 하고 싶으면 도서관보다는 IBS공간을 추천합니다.",문제나 물어볼 것이 생기면 Monique에게 메일을 보내거나 페이스북 메세지를 하는 것이 가장 빠릅니다. 다른 국제처나 기숙사측에 메일을 보내면 거의 2주만에 답장이 오거나 답장이 오지 않습니다.저는 네덜란드 학교 기준에서 두번째 학기에 파견되어서 그런지 딱히 국제처 행사가 있지는 않았습니다. 오티도 그냥 모여서 설명을 듣고 대부분 메일로 정보가 제공됩니다.,학교 프린트샵보다 기차역 옆에 있는 프린트샵이 더 싸니까 그곳을 이용하세요. 동아리는 제가 알기로 교환학생이 들어갈 수 있는 것은 없습니다. 제 룸메는 근처 교회를 다니며 밴드활동을 했습니다.,대마초가 합법이기 때문에 어디에서나 특유의 냄새를 맡을 수 있습니다. 엔스크데에 동양인의 비율이 많이 않아서 그런지 가끔 인종차별을 당하기도 합니다. 자전거 도로가 따로있고 신호도 따로있으니 주의해야 합니다.,Monique에게 연락을 하는게 가장 빠릅니다.,
"Saxion 대학교는 독일과 근접한 네덜란드의 작은 도시 Enschede에 위치하고 있습니다. 캠퍼스가 세 도시에 나눠져 있기 때문에 Enschede 캠퍼스 자체의 규모는 작은 편입니다. 가을학기는 8월 말부터 1월 말까지인데, 9월까지는 최고의 날씨를 만끽할 수 있습니다. 습하지 않은 한국의 초여름 날씨로 생각하면 될 것 같습니다. 하지만 10월부터는 비가 많이 오고 항상 흐려서 맑은 날을 보기 힘듭니다. 9월까지 Enschede 근교 도시와 네덜란드 여러 곳을 돌아보시면 좋을 것 같습니다.","Saxion 대학교 캠퍼스에서 자전거로 1,2분 거리에 기차역이 위치해 있고, 바로 옆에 시내가 있습니다. 옷가게나 음식점들이 모여있고 화요일과 토요일에는 마켓이 섭니다. 수업 마치고 구경해보면 좋을 것 같습니다. 기숙사에서도 그리 멀지 않기 때문에 여행 다닐 때나 쇼핑할 때 기차역과 시내가 가까이 위치해 있어서 편했습니다.","교환학생들이 생활하는 여러 기숙사들이 있고 자취를 하는 교환학생도 있지만 한국인들은 Roloef 기숙사에 살게 됩니다. 롤로프 기숙사는 4층짜리 빌라라고 보시면 되는데 한 집에 네 개의 방이 있고 네 명의 학생들이 한 집에 살게 됩니다. 삭시온에는 한국인 교환학생이 매우 많은 편이라 보통 한국인 두명, 외국인 두명이 룸메이트로 배정받습니다. 방이 모두 같은 크기가 아니고 랜덤으로 배정 받습니다. 가장 넓은 방은 가장 좁은 방의 두배 정도이기 때문에 운이 좋아야 합니다.네덜란드에서는 주요 교통수단이 자전거인 만큼 자전거 구매는 필수입니다. 학교나 시내 등이 걸어가기에는 기숙사에서 멀기 때문에 자전거가 꼭 필요합니다. 학기가 시작하기 전에 교환학생 담당자인 Monique를 통해 미리 전학기 학생이 사용하던 자전거를 구매할 수도 있고 Enschede에 도착해서 새 자전거나 중고 자전거를 구매할 수도 있습니다. 자전거가 도난당하는 경우가 많기 때문에 비싼 새 자전거를 구매할 필요는 없습니다. 타고 다녔던 자전거는 귀국할 때 되팔면 됩니다.롤로프 기숙사 주변에는 시내만큼 할 것이 많지는 않습니다. 장을 볼 마트는 엠떼, 알버트하인, 리들이 있는데 엠떼가 자전거로 1,2분 거리에 위치해 있어 가장 자주 가게 됩니다. 좀 더 멀리 떨어져 있는 알버트하인과 리들은 엠떼보다 저렴하고 리들의 시나몬 빵은 정말 맛있습니다. 강추합니다. 아시안마트는 시내에 하나, 알버트하인 근처에 하나가 있습니다. 식사는 요리를 해먹거나 사먹는데, 외식비가 비싼 편이기 때문에 거의 기숙사에서 요리를 해먹게 됩니다. 장을 봐와서 밥을 해먹는게 하루 일과의 큰 부분을 차지합니다.","Saxion에서의 수업은 대부분 교환학생들끼리 듣게 됩니다. 마케팅이나 매니지먼트 수업이 많고 수업 내용이 어렵지 않기 때문에 상경계열 전공자라면 쉽게 pass를 받을 수 있을 것입니다. 법, 경제, 재무 등의 수업도 들을 수 있습니다.네덜란드는 한국과 달리 학기 사이에 방학이 있습니다. 1쿼터와 2쿼터에 보통 다른 수업을 듣지만 1,2쿼터에 걸쳐 이어지는 수업도 있습니다. 쿼터 마지막에 시험을 보게 되는데 성적은 1~10점으로 받게 됩니다. 5.5점 이상이면 pass를 받고 이하는 fail이지만 세번까지 retake 시험을 칠 수 있기 때문에 포기하지 않는 이상 fail을 받을 일은 거의 없습니다.Saxion의 캠퍼스 시설은 매우 좋습니다. 외관과 내부 모두 깔끔하고 아기자기하게 꾸며져 있으며 도서관 등 부대시설 또한 잘 마련되어 있습니다.","Saxion에서 교환학생 담당자는 Monique입니다. 모든 교환학생들을 담당하는데, 일처리가 매우 빠르고 잘 케어해주기 때문에 도움이 필요한 경우 이메일이나 페메로 모니크에게 연락하시면 됩니다.",교환학생도 동아리 활동을 할 수 있는 것으로 알고 있지만 활동하는 교환학생은 보지 못했습니다. 웰컴 행사인 HOI나 뒷풀이에서 홍보를 많이 하기 때문에 그때 물어보시면 될 것 같습니다.,"네덜란드는 마약이 합법인 나라이기 때문에 길거리, 기숙사, 음식점 곳곳에서 대마 냄새를 맡을 수 있습니다.",도움이 필요한 경우 Monique에게 연락하는 것이 가장 빠릅니다.,
Saxion 대학교는 University가 아닌 University of applied sciences로 큰 학교는 아닙니다. 제가 지원했을 때는 Deventer와 Enschede 중 Enschede만 지원 가능했었는데  Enschede도 네덜란드의 작은 도시로 여유롭고 평화로운 생활을 즐기실 수 있습니다. 저는 8월부터 1월까지 Enschede에 있었으며 9월까지는 정말 좋은 날씨였습니다. 햇빛이 뜨거웠지만 습하지 않았고 아침 저녁으로는 시원한 날씨였습니다. 또한 네덜란드의 겨울이 많이 춥다고 들어서 걱정을 많이 했는데 추워지기 시작한 이후에도 의외로 한국보다 춥지 않은 날씨를 보였습니다.,"Saxion 대학교는 기차역에서 굉장히 가까운 곳에 위치해 있습니다. 교환학생에 오셔서 여행을 다니실 때 기차를 많이 타게 될텐데 기숙사에서 자전거로 15-20분 거리에 기차역이 있어 쉽게 이동하실 수 있습니다. 기차역에서 조금 더 가면 시내가 있습니다. 시내에는 여러 옷 가게, 음식점 등이 있어 구경다니시거나 쇼핑하기 좋습니다. 날씨가 좋을 때에는 Enschede에 있는 공원에 소풍을 가셔서 추억을 쌓는 걸 추천합니다.",Enschede 캠퍼스로 오시면 한국인들은 Roelof의 기숙사에 배정됩니다. 두 개의 건물이 기숙사로 사용되고 4명이 한 플랫을 공유하게 됩니다. 대부분 한국인과 외국인이 섞여서 한 플랫에 거주하였습니다. 식사는 기숙사에서 요리를 해먹거나 외식을 합니다. 외식을 하는 것보다 요리를 하는 것이 훨씬 저렴하기 때문에 대체로 요리를 하게 됩니다. 기숙사와 굉장히 가까운 곳에 슈퍼가 한 개 있으며 좀 더 걸어야 하는 곳에 여러 마트가 있습니다. 한인마트도 3군데 정도 있기 때문에 한국 음식을 자주 만들어 먹을 수 있었습니다.,"Saxion에 지원하실 때에는 수업에 대한 큰 기대를 하시지 않는 게 좋을 것 같습니다. Enschede 캠퍼스에서의 수업은 대부분이 교환학생끼리 한 클래스를 이루었고 활발한 토론과 외국인 친구들과의 열띤 지적 교류는 적습니다. 그러나 교수님들은 적극적인 참여를 원하시기 때문에 열심히 참여하신다면 만족스러운 결과를 얻으실 수 있을 것입니다. Marketing & international management이기 때문에 marketing 수업이 주를 이루고 재무, 경제 수업도 있습니다. 마케팅이나 재무, 경제의 기본적인 부분을 연세대에서 들으신 분들은 수업을 쉽게 따라갈 수 있을 것입니다. 또한 시험에 Fail하더라도 이후 두 번의 Retake 기회가 주어지기 때문에 학점을 딸 마음을 먹는다면 충분히 가져가실 수 있습니다. 학교 내의 도서관에서는 팀프로젝트를 할 수도 있고 공부를 할 수도 있습니다. 그러나 저는 처음에 신기해서 도서관을 찾아간 것 외에 다른 기숙사에 사는 외국인과 팀프로젝트를 할 때에만 도서관을 방문했습니다. 연세대학교에 비하면 작은 도서관이었습니다.",Enschede에서 저희를 담당하시는 분은 Monique이십니다. Saxion에 파견이 확정되는 순간부터 모든 일정이 끝날 때까지 저희를 케어해주시며 학교 생활에서 궁금한 점이 있다면 Monique에게 여쭤보면 됩니다. 메일을 이용한 상담이 주를 이루며 직접 찾아가도 되고 페이스북 메시지 등을 이용해도 됩니다. 일처리를 굉장히 잘하시며 교환학생 담당이기 때문에 저희를 잘 이해해 주십니다. Enschede에서 보내는 한 학기 동안 가장 의지하는 학교 분이 될 것입니다.,처음 들어가면 학회 가입을 홍보하기도 하지만 Saxion에서 교환학생들이 활동하는 동아리나 학회는 없는 것으로 알고 있습니다.,네덜란드의 대학교에 교환을 신청하신 학생들은 대부분 아시겠지만 네덜란드는 대마가 합법인 나라입니다. 여러 곳에서 대마를 피는 사람들을 볼 수 있고 나중에는 대마 냄새를 구별하실 수도 있을 것입니다.,거의 모든 도움은 Monique를 통해 이루어집니다. 기숙사 시설 관련된 문의는 Care taker에게 하면 되는데 처음 기숙사에 들어가시면 Care taker의 연락처를 받게 됩니다. 연락처가 없더라도 기숙사에서 자주 Care taker를 마주칠 수 있으니 그 때 요구사항을 말하면 됩니다. Housing 메일을 통해 기숙사 건의사항을 전달할 수도 있는 것 같습니다. 다치거나 아플 때에는 School doctor를 찾아가면 됩니다.,복잡하고 화려한 도시 생활을 누리실 순 없으나 대학 생활에 지쳐 편안한 생활을 즐기고 싶으신 분들은 Saxion 대학교를 선택하시면 후회 없으실 것입니다. 앞에서 말씀드렸듯이 수업이 힘들지 않고 오히려 널럴한 편입니다. 뛰어난 수업을 기대하시면 실망하실 수 있으나 Saxion 가을학기 때에는 학기 중 방학도 꽤나 길었기 때문에 교환학생 기간 동안 많은 유럽 국가를 여행하고 싶으시다면 오히려 장점이 될 수 있다고 생각합니다. 그리고 Enschede 캠퍼스에는 한국인 교환학생들이 굉장히 많습니다. 외국인들과의 친목만을 계획했다가도 시간이 지났을 때 한국인을 그리워하는 다른 친구들을 많이 보았는데 Saxion 대학교에 오신다면 서로 의지할 수 있는 많을 친구들을 만날 수 있을 것입니다!앞으로 다신 없을 여유롭고 평화로운 유럽 생활을 꿈꾸신다면 Saxion 대학교에 지원하시면 좋을 것 같습니다 :)
"Saxion University의 교환학생으로 선발되었을 때, Enschede 캠퍼스와 Deventer 캠퍼스 중에서 선택할 수 있었다. 네덜란드에 대한 정보가 많이 없었기에 어느 캠퍼스를 선택해야 할지 많은 고민을 했었다. 우선 캠퍼스의 크기는 Enschede 캠퍼스가 더 크고 여행을 하다보면 자주 가게 될 암스테르담 공항과의 접근성은 Deventer 캠퍼스가 조금 더 낫다. Enschede에서 암스테르담 까지는 기차로 약 2시간 정도, Deventer는 그보다 약 3~40분 덜 소요된다. 기후는 네덜란드 전체가 크게 비슷하다고 볼 수 있는데, 우리나라와 비교했을 때 여름은 덜 덥고 겨울은 덜 춥다. 기온상으로는 그렇지만 바람이 강하고 흐린 날과 비오는 날이 많아서 체감은 더 춥게 느껴지는 날이 많아서 우리나라는 한창 더울 시기에도 외투를 입어야 하는 날도 있다.","내가 선택했던 Enschede는 연세대학교 신촌캠퍼스가 있는 서울과 비교하면 작고 조용한 도시이다. 네덜란드의 동쪽 독일과의 국경에 가까운 곳에 위치한 도시로 자전거로 1시간 정도면 독일에도 갈 수 있다. 학교는 city center 근처에 위치해 있으며 내가 살던 학교 기숙사에서 자전거로 15분 정도의 거리였다. 학교에서 city center까지는 걸어서도 5분정도밖에 안될 정도로 가까우며 큰 광장을 중심으로 각종 식당, 옷가게, 술집, 슈퍼마켓 등이 주변에 위치하고 있다. 특히 매주 화, 토요일에는 각종 농, 수산물을 파는 상인들이 몰려와서 큰 시장이 열린다. 잘 비교하고 사면 일반 마트에서보다 더 저렴한 가격으로 고기나 과일, 채소 등을 살 수 있을 뿐만 아니라 다양한 길거리 음식도 사먹을 수 있어서 자주 방문했다.","학교 기숙사는 기본적으로 3명이서 주방과 거실, 욕실, 화장실을 공유하는 셰어하우스 형태의 아파트였다. 시설에 비해서 월세가 싼 편은 아니었지만 교환학생 시기 동안 지내는 거처로서 가장 중요한 장점인 친구들과 함께 산다는 점을 갖추고 있었기에 만족스러웠다. 우선 두 명의 플랫메이트와 함께 살기 때문에 쉽게 친해질 수 있으며, 또한 플랫메이트가 아니더라도 대부분의 교환학생들이 같은 건물에 살고 있으므로 매일 함께 어울리며 친하게 지낼 수 있었다.",수업은 기본적으로 영어로 진행된다는 점을 제외하면 우리나라의 수업과 크게 다른 느낌을 받지는 않았다. 다만 교수와 학생과의 관계가 조금 더 비격식적이고 학생들의 참여가 활발한 수업이 많았다. 우리나라 수업에 비해 이론 교육보다는 조별 프로젝트와 발표 등을 통해 직접 수업 내용을 적용해 보는 것에 보다 초점을 맞추는 것 같았다. 도서관에서 필요한 책을 찾아서 열람할 수 있으며 시설도 좋은 편이다. 다만 책을 대여하는 데에는 제약이 많으며 신판 책들은 대체로 열람만 가능하고 대여는 불가한 경우가 많았다.,,"내가 동아리 활동에 크게 관심을 두고 찾아보지 않아서이기도 하지만, 주변에서도 학교 내 동아리 활동에 참여하는 학생들을 보지 못했던 것을 보면, 학교 내에 동아리 활동이 활발한 것 같지는 않았다. 아무래도 대학교로서는 그렇게 큰 규모가 아니기 때문이라 짐작된다. 하지만 enschede 캠퍼스의 경우 근처에 정말 큰 대학교인 University of Twente가 있고 sns 내의 지역별 그룹 페이지가 활성화 되어 있기 때문에 관심과 열정이 있는 활동을 함께할 학생들을 쉽게 찾을 수 있다. 부대 시설 또한 마찬가지로 학교 내에는 작은 규모 때문에 특별히 다양한 부대시설을 갖추고 있지는 않다. 다만 체육관, 운동장 등의 부대시설은 그리 멀지 않은 곳에 위치한 University of Twente의 시설을 이용하면 된다.","문화가 많이 다르기는 하지만, 많이 다를 것이라는 것을 미리 예상하고 가서인지, 아니면 다른 문화도 열린 마음으로 받아들일 준비를 하고 갔기 때문인지 그렇게 심한 culture shock을 느낀 적은 없었다. 다만 대화의 방식이나 어울려 노는 문화가 우리나라에서와는 많이 다르기에 언어 장벽과 더불어 외국 친구들과 어울리는 것을 방해하는 요인으로 작용할 수 있다. 중요한 것은 새로운 문화에 적응하는 데에도 많은 노력이 필요하며 저절로 되지 않는다는 점이다. 개인적으로 외국 친구들과 교류하는 경험이 교환학생 생활의 가장 큰 장점 중 하나라고 생각하기 때문에 다른 문화에 적응하는 것은 매우 중요하다.","전혀 다른 외국에서 생활을 시작하다 보면 궁금한 점이나 어려운 점이 생길 수 있다. 경험상 이런 경우에는 교환학생 담당자에게 물어보면 대부분의 경우 명쾌한 답변을 얻을 수 있었다. 이메일이나 메신저, 전화, 방문 다양한 방법으로 질문을 한 경험이 있다. 집과 관련된 상황에서는 처음에 입주할 때 알려주는 하우스키퍼의 전화번호로 전화를 걸어 도움을 청할 수 있으며, 우리나라에서와 마찬가지로 비상상황을 대비해서 경찰, 구급대 등의 비상전화번호를 알아두는 것이 좋다.",
