gen_info,env_info,food_info,study_info,office_info,facil_info,mhct_info,help_info,etc_info
"대학이 위치한 Enschede라는 도시는 네덜란드 동부에 있고 암스테르담으로부터 기차로 2시간정도 걸립니다.(ns.nl 참고) 자전거로 독일 국경에 갈 수 있을 만큼 독일과 매우 가깝습니다. 가장 가까우면서 큰 규모의 독일 도시는 뮌스터이고 자동차로 1시간 걸립니다. 
  Enschede는 조용한 소도시 분위기이며 대체로 한적하지만 중심부는 꽤 번화한 편입니다. 중심부를 도는 도로를 따라 자전거를 타면 40분쯤 걸려 한바퀴 돕니다. 저는 자전거를 타고 여기저기 구경하는 것을 매우 좋아했었는데 조금만 타고 나가도 대형 매장에 가거나 풀을 뜯는 소들을 볼 수 있었습니다. 
  10월 중순 즈음부터 비가 자주 왔는데 비가 하루종일 내리는 날의 빈도는 우리나라와 비슷했고 보통은 소나기가 잠시 내렸다가 그치는 것이 반복되었습니다. 8월 말 경에는 초가을 날씨였고 9월이 가장 날씨가 좋았으며 선선한 가을 날씨가 11월 정도까지 계속되다가 12월부터 겨울날씨였는데 며칠을 빼고는  굉장히 춥거나 하지는 않아 1월 말에 귀국할 때까지 눈을 보지 못했습니다.","대학교 건물은 기숙사에서 자전거로 10분 떨어져 있는 곳에 위치합니다. 건물은 하나이지만 종종 도보 5분 내외에 있는 다른 건물에서도 수업이 진행됩니다. 현재 중심부 쪽에 건물을 짓고 있는데 곧 완공될 것 같았습니다. 
 학교 건물 주변에는 큰 공원과 기차역이 있고 10분 걸어가면 시내 중심부로 갈 수 있습니다. 중심부에는 광장 같은 것이 있고 화요일, 토요일마다 시장이 열려 과일이나 채소 등을 싸게 살 수 있고 맛있는 생선튀김도 먹을 수 있습니다. Albert Heijn과 Jumbo라는 큰 마트들도 있습니다.
 음식 말고도 화장품이나 인테리어 용품들을 Hema, Kruidvat, Blokker, Action 등에서 많이 팝니다. 그래도 화장품은 색조를 제외하고는 본인이 쓰시던 것들 가져오시는 것이 좋을 것 같습니다. 옷은 H&M과 Zara에서 많이 사는데 다른 가게도 많이 있습니다. 중심부에는 영화관도 2개 있습니다. 한국보다 빨리 개봉해서 좋은데 스크린이 크지는 않습니다. 저는 Enschede에서는 딱 한번 ‘블루 재스민’을 봤고 제일 먼저 봤다고 SNS에 자랑도 하고 좋았습니다.
대학교 건물은 기숙사에서 자전거로 10분 떨어져 있는 곳에 위치합니다. 건물은 하나이지만 종종 도보 5분 내외에 있는 다른 건물에서도 수업이 진행됩니다. 현재 중심부 쪽에 건물을 짓고 있는데 곧 완공될 것 같았습니다. 
 학교 건물 주변에는 큰 공원과 기차역이 있고 10분 걸어가면 시내 중심부로 갈 수 있습니다. 중심부에는 광장 같은 것이 있고 화요일, 토요일마다 시장이 열려 과일이나 채소 등을 싸게 살 수 있고 맛있는 생선튀김도 먹을 수 있습니다. Albert Heijn, Jumbo등 큰 마트도 있습니다. 
 음식 말고도 화장품이나 인테리어 용품들을 Hema, Kruidvat, Blokker, Action 등에서 많이 팝니다. 그래도 화장품은 색조를 제외하고는 본인이 쓰시던 것들 가져오시는 것이 좋을 것 같습니다. 옷은 H&M과 Zara에서 많이 사는데 다른 가게도 많이 있습니다. 중심부에는 영화관도 2개 있습니다. 한국보다 빨리 개봉해서 좋은데 스크린이 크지는 않습니다. 저는 Enschede에서는 딱 한번 ‘블루 재스민’을 봤고 제일 먼저 봤다고 SNS에 자랑도 하고 좋았습니다.
 물가에 대해서는 살인적인 물가라고 들어서 저도 네덜란드에 가기 전에는 걱정을 했었는데 Enschede는 크지 않은 도시라 그런지 우리나라와 비슷했습니다. 특히 기숙사 바로 뒤에 Emte라는 큰 마트가 있는데 저렴한 편입니다. 저는 생활비로만 따지면 한 달에 20만원에서 30만원 정도 쓴 것 같습니다.","거의 대부분의 교환학생은 Roelof van Schevenstraat에 위치하는 아파트형 기숙사에 거주합니다. 주택가라 거의 아파트와 주택밖에 없고 조용합니다. 밤늦게 시끄럽게 파티하면 신고가 들어옵니다. 4층까지 있고 1층엔 1가구, 나머지 층엔 2가구가 있습니다. 1층에는 자전거 주차공간이 있습니다. 내부에는 방이 3개, 욕실, 화장실, 거실, 부엌, 발코니가 있습니다. 방은 3번방이 1번과 2번방을 합친 수준으로 크고 1번과 2번방은 5평정도 되는 것 같습니다. 선택은 할 수 없고 도착한 순서대로 배정이 되는 듯합니다. 방에는 책상, 의자, 침대, 스탠드, 옷장이 있습니다. 베개와 시트가 제공됩니다. 부엌에는 가스레인지, 드럼세탁기, 냉동실 없는 냉장고, 싱크대가 있고 냄비, 프라이팬, 컵, 접시, 행주 등이 제공됩니다. 거실에는 탁자, 의자, 소파, 텔레비전, 건조대, 진공청소기가 있습니다. 변기와 욕조가 따로 있었고 욕실에는 욕조, 세면대, 선반이 있습니다. 바닥은 신발 신는, 신을 수밖에 없는 바닥인데 저도 퇴실할 때나 알았지만 신발로 바닥을 힘껏 긁어야 머리카락을 떼어낼 수 있습니다. 방과 방 사이, 집과 집 사이 방음이 상당히 잘 안 됩니다. 신나서 노래를 부르다가 놀림을 받을 수 있으니 주의하는 것이 좋습니다. 흡연은 방과 발코니 어디에서도 금지되어 있습니다. 
 파티를 할 때에는 마트의 문이 일찍 닫기 때문에 충분한 음료를 먼저 구비해놓길 추천해 드립니다. 파티에 참여하지 않는 사람들을 위해 양해를 구해주시고 건물 밖에서의 음주는 불법이라는 점을 알아 두셔야 합니다.
 음식은 물론 해서 드셔야 합니다. 스파게티가 가장 간단한 요리라고 할 수 있습니다. 재료들은 기숙사 바로 뒤에 Emte라는 마트에서 구할 수 있습니다. 영업시간은 구글에서 찾으면 나옵니다. 10분 걸어가면 Albert Heijn이라는 약간 더 고급스러운 마트가 있습니다.
 한국음식재료를 비롯한 아시안 음식재료를 파는 곳이 중심부에 Peter Hu와 Toko, 기숙사 근처에 Ana Market이 있습니다. 한국보다는 비싼 편이지만 터무니없을 정도는 아닙니다. 
 신라면, 안성탕면, 짜파게티, 오징어짬뽕 등 라면 종류도 많고 된장, 고추장, 고춧가루, 쌈장, 물엿, 간장, 불고기 소스 등 기본적인 조미료와 김치, 떡국 떡 등 먹을 것들 충분히 있습니다. 저는 갈 때 고추장, 고춧가루, 된장 등등 싸들고 갔는데 괜한 일 했다고 생각이 듭니다. 밥솥도 1-3인분용을 2만원에 쉽게 사실 수 있습니다. 쌀은 여러 번 시도해봤는데 기숙사 근처의 아시안 마트에서 빨간 장미가 그려진 것이 한국 쌀과 가장 비슷하고 2kg에 7000원 정도로 저렴합니다. 시내의 아시안 마트에서 한국 쌀도 팔기는 합니다. 종종 외국인 학생들을 초대하여 한국 음식을 대접하고 외국인 친구들이 해주는 음식을 먹으면 좋습니다.","한 학기 파견이 된다면 두 쿼터를 다니게 됩니다. 한 쿼터는 7주 수업에 1주 시험으로 이루어집니다. 한 쿼터짜리 수업이 있고, 두 쿼터짜리 수업이 있습니다. 조직관리, 마케팅, 회계, 재무, 경제, 교양 등과 관련된 수업이 있습니다. 저는 한 쿼터짜리 수업 5과목과 두 쿼터짜리 수업 2과목을 수강하여 28 ECTS를 획득했습니다. 그 중 2과목이 프로젝트 과목이었는데, 수업은 거의 하지 않고 그룹별로 모듈에 맞추어 보고서를 작성하고 오랄 테스트를 보는 과목입니다.
 수업 방식은 우리 학교와 거의 같습니다. PPT를 이용해 강의를 하고 간단한 질문과 대답이 이루어졌습니다. 과제, 퀴즈나 발표가 있는 수업도 있고 없는 수업도 있지만 있어도 대단히 힘들진 않습니다. 한 과목당 일주일에 2-3시간 정도 수업을 하고 학기 시작 전에 시간표가 나옵니다. 요일과 시간이 매주 일정하지는 않습니다. 힘든 점이 있다면 교수님의 영어 발음을 알아듣기 조금 힘들 때가 있습니다. 
 시험 방식은 대체로 서술형이었습니다. 10점이 만점이며 5.5점 이상을 받아야 통과할 수 있습니다. 출석 점수가 있는 수업은 없었습니다. 시험 난이도를 우리 학교와 비교해 보자면 B를 받을 정도로는 공부해야 넉넉히 좋은 점수를 받을 수 있는 것 같습니다. 통과를 못하면 다시 한 번 시험을 치룰 수 있는데 난이도가 더 쉬워지진 않으니 한 번에 통과하겠다는 마음가짐이 좋습니다.
 학교도서관은 일요일에는 열지 않고 요일별로 다르지만 오전 9시부터 오후 6시정도 까지 이용할 수 있습니다. 자유로운 대화가 가능해서 오후부터는 시끄러운 편입니다. 공부보다는 주로 인쇄하러 갑니다. 시내에도 도서관이 있는데 여는 시간은 비슷합니다.",교환학생들은 Marketing International Management (MIM)에 소속되어 있습니다. Haanstra라는 건물에 MIM 사무실이 있는데 갈 일은 없습니다. 주로 Monique Perik이라는 매우 좋으신 분이 불편한 점을 들어주시고 해결해주십니다. 에스컬레이터를 타고 올라오면 바로 보이는 Student Ballie에서 학생증을 받거나 서류를 처리합니다.,"학교 시설로는 무선 인터넷, 식당, 카페, 서점, 체육관, 도서관, 컴퓨터, 자판기, 자전거 거치대가 있습니다. 동아리는 아는 바가 없지만 문의하면 안내 받을 수 있을 것으로 생각됩니다. 한국 교환학생 중에 동아리를 하는 사람은 없었고 호스트 패밀리를 방문하곤 했는데 Saxion Cultural International Office에 메일을 보내 지원하면 됩니다.","일요일엔 여는 상점이 거의 없다는 것, 마약을 할 수 있는 것, 그럼에도 길에서 술을 마시는 행위는 불법인 것, 비가 내려도 우산을 거의 쓰지 않는 것, 폭죽 터지는 소리가 매우 자주 들린다는 것, 상점에 들어가도 먼저 물어보지 않는 이상 점원이 설명해주지 않는 것, 마주치면 ‘니하오!’라고 외치며 지나가는 사람들이 종종 있다는 것, 꼬마들은 ‘F****** Chinese!’라고 외친다는 것",Monique Perik이란 분에게 메일로 도움을 요청하시는 것이 가장 빠릅니다. 기숙사 관련 사항은 House Keeper에게 전화해야 합니다.,이번에 우리학교에서 파견된 학생은 없는 것으로 알지만 나중에 또 파견이 된다면 언제든 yuri5467@naver.com으로 문의해주세요
"saxion은 네덜란드에서도 동쪽 끝에 위치해 있는데요, 그래서 수도인 암스테르담보다도 독일이 훨씬 가까운 작은 도시입니다. 자전거 타고 20분만 가면 독일이 나오니 정말 가깝죠. ㅎㅎ 
제가 파견되었던 가을학기에 날씨는 비교적 온화한 편이었습니다. 처음 도착했을 때 8월말부터 9월초까지는 정말 여름날씨였고 따뜻했고 10월부터 슬슬 쌀쌀해지면서 흐린날이 많아집니다. 그래서 맑은 날이면 감사할 정도로.. 보통은 흐리고 갑자기 비도 오고 오락가락 하는 편인데 별로 춥지는 않았습니다. 물론 자전거를 타고 다니기 때문에 장갑이랑 목도리는 필수지만! 기온 자체는 별로 안낮아 서울보다 훨씬 따뜻해 눈도 한번도 못 봤던 기억이 납니다. ( 그런데 전에 있었던 친구에게 물어보니 재작년은 폭설이 내렸다고, 날씨가 매년마다 다른 편인듯 해요.)","학교 앞에 자전거로는 3분, 걸어서는 10분 정도 거리에 시티센터가 있습니다. 시티센터에는 영화관, 식당, 마트, 옷가게, 술집 등이 있구요. 작아서 금방 다 돌아보긴 하지만 있을 건 다 있습니다.
그리고 아마 OT 기간에 가시게 될 복스파크라는 공원이 학교 근처에 하나 있습니다. 공원이 꽤나 크고 호수도 있고 나무도 많고 푸르러 피크닉가기 좋은 곳입니다. 추울 때는 힘들지만 봄이나 여름에는 가면 좋습니다.","처음에 파견되시게 되면 아마 Roelof라는 기숙사에서 생활하시게 될 겁니다. 이 기숙사는 학교에서 자전거로 15분 정도되는 거리에 위치해 있구요, 기숙사라기 보단 그냥 집에 가까운 형태이고 주변에도 학생들이 아니라 네덜란드 주민들이 사는 조용한 주거지역입니다. 한 집에 부엌 1개, 거실 1개, 방 3개가 있어 3명의 플랫메이트들이 함께 생활하구요. 부엌과 화장실 거실등이 비교적 깨끗하여 쾌적합니다.
식사는 밖에서 사먹으면 비싸기 때문에 아마 거의 해드시게 될텐데, 장보실 때에는 크게 아마 이 세 곳을 이용하시게 될 거에요. 마트 (엠떼, 알버트하인), 아시안 마트 (토코, 피터후, 아나마켓), 시내 오픈마켓.
1. 마트
엠떼는 기숙사에서 엄청 가까운 곳에 위치해 있구요. 걸어서 3분?이면 가기 때문에 많이 이용하시게 될 거에요. 매주마다 할인하는 품목이 달라지는데 할인하는 걸 잘 이용하시면 돈을 아끼실 수 있을거에요.
알버트하인은 기숙사 근처에도 있고, 시내에도 있는데 바로 옆에 엠떼가 있다 보니 저는 잘 가지 않았습니다. 알버트하인의 장점은 카드를 만들면 환급할인을 해준다는 건데 장을 많이 보지 않는 이상 엄청 많이 할인이 되지 않아서 이용을 덜하게 되더라구요.
2. 아시안 마트
토코는 시내에 있고 각종 식재료를 판매합니다.
토코보다는 피터후를 추천하는데 훨씬 크고 이곳이 더 싸요. 라면이나 부침가루, 김치, 된장, 고추장 웬만한 건 다 있습니다. 교환학생까지 와서 한식을 해먹냐고 할 수도 있겠지만 맨날 먹는 파스타가 질리거나 외국인 친구에게 한식을 해먹을 때는 꼭 필요합니다. 위치는 오티기간에 시내구경을 하는데 그 때 알 수 있습니다.
아나마켓은 시내 말고, 기숙사에서 자전거로 5분정도 거리에 작게 상점들이 몰려있는 곳이 있는데 그 곳에 있습니다. 아나마켓에서는 딱히 한식을 많이 파는 건 아니지만 쌀이 다른 곳보다 훨씬 싸고 괜찮습니다. 브랜드 명은 정확히 기억안나는데 파란색과 노란색 무늬가 있는게 토코나 피터후보다 싸고 질도 좋았어요. (쌀을 잘못사면 날림쌀을 먹게 됩니다..ㅠㅠ)
3. 오픈마켓
오픈마켓은 매주 화요일, 토요일에 시내 광장에서 열리는데 야채, 고기, 과일을 마트보다 훨씬 싸게 팝니다. 대신 킬로 단위로 사야하긴 하지만 진짜 좋아요. 저는 여기서 주로 과일이나 파프리카를 사먹곤 했었습니다. 또 그것뿐만 아니라 생선튀김, 춘권, 감자튀김, 츄러스나 빵을 파는 트럭도 오는 데 장보러 갔다가 먹는 재미가 쏠쏠합니다. ㅎㅎ

저는 주로 해먹는데 위에서 말한 아나마켓에서 쌀을 사서 볶음밥도 해먹고, 고기 사서 제육볶음도 해먹고(피터후에서 소갈비양념사면 좋아요) 파스타도 해먹고 그랬습니다. 

맛있는 것 추천 : 요거트- 마시는 요거트가 싸고 맛있어요!
yumyum라면 - 거의 돌아올 때쯤 알게된 라면인데 한국라면보단 싸고 꽤 먹을만합니다. 라면을 먹고싶지만 마트가 너무 멀 때 그냥 마트에서도 팔기 때문에 좋아요. 
피자 - 싸고 후라이팬이나 오븐에 구워먹으면 맛있어요.","수업은 모두 영어로 진행되구요, 어떤 수업을 듣느냐도 교환학생 생활에서 꽤 중요한 비중을 차지합니다. 

저는 English 1, Cultural management, Management skill, Market Research Project, Anaylysis of International company, Introduction to Netherlands, Human Resource Management 이렇게 들었습니다.

저는 경영학과지만 재무 쪽에는 큰 관심이 없어서 그 수업들은 빼고 들었지만 관련 수업들도 많이 있습니다. (하지만 개인적으로 제 친구들을 관찰해본 결과 그런 수업들은 공부를 더 열심히 해야 했던 것으로 기억합니다.)

English 1 - 문법과 발음을 주로 다룹니다. 널널하고 교수님이 재밌으시지만 영어실력의 큰 향상은 기대하기 힘듭니다.

Cultural management - 나라별 문화적 차이를 배우고 문화란 무엇인가, 등을 배우는데 수업내용이 흥미롭고 재미있습니다. 교환학생을 온 만큼 나라들 간의 차이에 대해서 생각해보게 되는데 이 수업을 배우며 문화적 차이의 배경을 알 수 있어 좋았습니다.
조발표 1번, 퀴즈 2번, 시험 1번이 있는데 수업 내용이 재미있어 크게 힘들진 않습니다.

 Management skill - 리더가 되려면 어떤 능력이 필요한가 등을 배우는 수업인데 저는 수업보다는 발표를 했던 기억이 남습니다. 개인당 3번 정도의 프레젠테이션은 의무이고 마지막 프레젠테이션이 최종 평가로 들어갑니다. 그리고 마지막 프레젠테이션은 보고서와 함께 제출해야 하구요. 저같은 경우는 자원해서 한 쿼터 동안에 총 4번에 발표를 하게 되었는데, 거의 매주 발표를 해야 해서 힘들었지만 발표를 하며 배우는 것도 많았고 평가에 들어가지 않는 발표도 열심히 하면서 스스로 실력이 느는 것을 느꼈습니다. 시험이 없고 발표가 많은 수업을 좋아하시는 분께 추천드립니다.

Market Research Project - 이 수업은 수업은 약 3번 정도만 있고, 철저한 프로젝트로 진행되는 수업인데요. 수업이 없다는 것이 장점이지만 각 기한에 맞춰 보고서 등을 내야하는게 꽤나 압박으로 느껴집니다. 널널해 보여서 대강 했다간 retake의 위험이 있습니다. 보고서 제출과 구술 시험이 있습니다.

Anaylysis of International company - 이것도 수업은 거의 없는 프로젝트입니다. 보고서 제출과 구술 시험이 있는데 구술 시험이 평가에서 꽤 큰 비중을 차지합니다. 보고서를 나눠 써서 어떤 내용은 잘 모른다하더라도 구술 시험에는 물어볼 수 있기 때문에 재무 전반적인 지식과 보고서 내용은 잘 알아야 합니다. Introduction to Netherlands - 네덜란드에 대해 전반적인 내용을 알려주는 수업입니다. 말투가 독특하신 교수님과 후반부로 갈수록 정치,사회구조 가 수업 내용이어서 지루해하는 친구들도 있었지만 저는 재밌었습니다. 파이널 테스트로 성적이 결정되는데 수업내용 세세한 것들도 꽤 많이 나와서 수업을 열심히 듣고 필기한 내용으로 공부를 하는 것이 중요합니다.

Human Resource Management - 인적자원관리 수업인데요. 1쿼터에 걸쳐 진행되기 때문에 깊이 있는 내용은 다루지 못하지만 전반적인 내용은 알 수 있습니다. 보고서 1개, 발표 1번, 파이널 테스트 를 다 보기 때문에 힘들게 느껴질 수도 있겠지만 생각보단 할만합니다. 

도서관은 평일에만 열고 엄청 조용하다기보단 조모임도 열리고 하는 분위기입니다. 그래서 저는 주로 집에서 공부했습니다..",저는 특별히 불만이 없었지만 간혹 제 친구들을 보면 업무처리가 늦어 불편을 호소하는 친구들도 있었습니다.,운동에 관심이 많으신 분들은 학교내에 운동 시설이 있어 카드를 끊으면 학교내 운동시설과 뿐만 아니라 도시내 다른 수영장 등도 이용할 수 있는 것으로 알고 있습니다. 동아리는 저도 궁금해서 미리 메일을 보내 문의했었는데 교환학생들끼리 따로 동아리를 조직하면 모를까 네덜란드어를 할 줄 모르는 교환학생이 함께 참여할 수 있는 동아리는 없는 듯 합니다.,"딱히 큰 문화충격은 없었습니다. 네덜란드가 마약과 매춘이 합법적인 나라이긴 하지만 보통 거리는 매우 안전하고, 나라가 깨끗하다는 인상을 받았습니다.","많은 분들이 모니크를 추천해서, 물론 official한 일에는 모니크의 도움이 최고이지만 사소한 것들, 맛집 같은 것은 Buddy에게 물어보는 것도 좋습니다. OT기간 때 2명~3명 정도 버디가 있을 텐데 아마 친절하게 잘 도와줄 것입니다.","saxion universtiy는 처음 1학기는 기숙사가 의무입니다. 제가 갈 때까지는 그랬는데 다음에 가시는 분들은 어떤지 모르겠네요. 그래서 1학기만 가시는 분들은 당연히 기숙사에 살아야하고 1년 가시는 분들은 한 학기는 기숙사에 살고 한 학기는 나가서 살거나, 계속 살기도 합니다. 이 이야기를 하는 이유는, 기숙사비가 상당히 비싸기 때문입니다. 얼마나 비용이 드는지도 꽤 중요하니까 저도 가기 직전에 이것 저것 찾아봤었는데 기숙사 비용에 대해서는 나와있지 않았습니다. 하지만 이곳은 기숙사비가 약 400만원 정도 하고, 보증금과 보험 그리고 거주허가증 비용을 포함해 학교에 들어가기 전에 약 580만원 정도를 입금했던 기억이 납니다. 보증금과 보험비 거주허가증 비용은 당연히 필요한 것이지만 기숙사비가 생각보다 너무 비싸 깜짝 놀랐었습니다. 밖에서 나와 살거나 하면 한달에 30만원이면 좋은 플랫을 구할 수 있다던데 기숙사가 강제이니 그 곳에서 살 수밖에 없는데 너무 비싸 입금할 때 망설여졌던 기억이 납니다. 
그 외 생활비는 그렇게 많이 들지 않습니다. 여행 등 특별한 일을 제외하면 거의 식비만 드는데 위에서 말했다시피 식료품은 비교적 싼 편이고 생필품 등 생활 물가는 싼 편입니다.
또한 saxion university는 건국대, 동국대, 서울시립대 등 한국의 여러 학교와 협정을 맺고 있는데요. 그말인 즉슨 학교에 파견되는 한국인이 많다는 것을 의미합니다. 게다가 모두 첫학기는 기숙사가 의무이니 다같이 모여살게 되겠지요. 물론 한국인이 많아 적응하기 편하고 정서적으로 안정되고, 한국에 돌아와서도 볼 수 있는 소중한 친구들을 사귀는 건 좋지만 상대적으로 덜 국제적인 교환학생 생활을 하게 되는 것 같습니다. 수업도 외국인들과 같이 듣고, 조모임도 같이 하지만 아무래도 룸메이트들이 한국인이면 영어 실력이 느는 것을 기대하는 건 힘들겠죠. 외국인 친구들 사귀는 건 자기 하기 나름이지만 아무래도 환경이 한국인들이 많다보니 생각보단 어려워요. 평화롭고 널널한 교환학생 생활을 기대하시는 분에게는 좋지만 국제적이고 영어실력이 늘기를 바라는 분들에게는 안 맞을 수도 있을 것 같습니다."
