gen_info,env_info,food_info,study_info,office_info,facil_info,mhct_info,help_info,etc_info
"캔터버리 대학교가 위치하고 있는 크라이스트처치는 뉴질랜드 남섬 동해안 캔터버리 지방에 위치하고 있으며 크기는 약 1400km2 정도로 서울특별시의 2배가 조금 넘습니다. 그러나 인구가 비교적 적어 도시 가장 한복판도 한국의 도시에 비교하면 한적한 편이고 건물도 3~4층을 넘어가는 경우는 드문 편입니다. 학교는 시내 중심과는 버스로 30분정도 떨어진 거리에 위치하고 있어 근처 쇼핑몰과 기숙사 정도를 제외하면 단층 건물이 대다수입니다. 해안에 위치하는 해안도시답게 낮과 밤을 가리지 않고 바람이 많이 부는 경향이 있으며 예상할 수 없는 소나기도 잦은 편입니다. 그렇기에 사람들은 우산을 쓰기보다는 방수가 되는 외투를 입거나 비가 와도 고개를 숙이거나 머리를 가리지 않고 그냥 다니는 경우가 많습니다. 여름 평균 기온은 약 20~25도, 겨울 평균 기온은 약 0도 가량으로 한국보다 연교차가 적고 평온한 기후이지만 일교차가 상당히 커 최고기온 30도가 넘는 날이나 기온이 영하로 더욱 떨어지는 날이 꽤 있습니다. 특히 소나기가 잦고 비가 많은 기후답게 비가 오면 여름이라도 기온이 상당히 떨어집니다. 뉴질랜드는 남반구에 위치하여 북반구와 반대로 12~2월이 여름, 6~8월이 겨울입니다. 뉴질랜드의 봄~여름에 해당하는 10~3월까지는 남극 상공의 오존홀이 뉴질랜드까지 확장이동하여 자외선이 특별히 강하니 평소에 선크림을 자주 사용하지 않는 분이라도 꼭 사용하시기를 권해 드립니다. 도시 내에서 관광할 만한 곳은 시내 중심가의 그래피티, Hagley 공원, Canterbury Museum, 크라이스트처치 대성당 등이 있습니다. 2010년과 2011년에 걸친 뉴질랜드 크라이스트처치 대지진으로 인하여 도시가 상당히 파괴되었고 현재까지도 복구 작업이 진행중인 관계로 아직 수리되지 않은 건물들을 종종 볼 수 있습니다. 크라이스트처치 대성당도 아직 복구되지 않아 기존의 크라이스트처치 대성당은 현재 볼 수 없고 도보로 10분가량 떨어진 위치의 다른 대성당을 관람하실 수 있습니다. 지진 복구 작업의 일환인지는 확신할 수 없으나 도로 공사가 잦은 편입니다. 이로 인해 버스정류장이 임시폐쇄되고 임시정류장이 생기는 등 변경이 잦으니 중요한 일정에 버스를 이용해 이동하실 경우 Christchurch Metro 홈페이지에서 확인하시길 권해드립니다. 도시 근처의 관광지로는 Hanmer Springs, Lake Tekapo 등이 있으나 전체적으로 대중교통으로 이동하기가 상당히 힘들고 비용이 많이 듭니다. 주로 친구들끼리 승합차를 렌트해 이동하거나 단기적으로 사용할 중고차를 구매해 이동하는 편입니다. 여행을 좋아하시는 분은 미리 국제운전면허증을 신청해 가세요. 자연의 아름다움이나 캠핑, 하이킹, 사이클링을 즐기기에 최적인 나라입니다. 남반구에 위치하며 남극과 지리적으로 인접해 있어 남극과 관련된 활동을 하기에도 적합한 곳입니다. 학교에는 교양과 전공으로 남극학 수업이 개설되어 있으며 국제 남극 센터(International Antarctic Center)도 공항 버스(Purple Line)로 접근이 가능합니다. 실제로 남극학 수업을 들어 보았는데 남극의 기후, 남극 탐험 역사, 지질학, 대기과학, 빙하, 기후변화 등을 총체적으로 다루는 방대한 수업이었습니다. 수업에 따라 남극의 식생을 중심으로 다루는 강의도 있었습니다. 남극학이 크라이스트처치의 특징이라면 뉴질랜드 전체적으로는 마오리 문화를 접하고 배우기에 좋은 곳입니다. 사회과학 쪽으로는 마오리와 태평양, 호주의 원주민과 관련된 주제가 잦으며 마오리어 수업과 마오리학의 전공, 교양들이 개설되어 있습니다. 일정 문제로 아쉽게 직접 수강하지는 못했지만 마오리 주민들의 거주지에 직접 2주가량 머무는 필드워크 활동을 포함하는 수업도 있습니다. 상당히 다양한 종류의 수업들이 개설되어 있고 한국에서 쉽게 찾아보지 못하는 수업들이 많으니 새로운 경험을 원하시면 추천드립니다.","캠퍼스가 시내 중심부와 떨어져 있어 교외 활동은 대부분 버스를 타고 나가게 됩니다. 캠퍼스와 기숙사 사이의 Ilam Road에서는 Purple line을 탈 수 있고 기숙사 바깥의 Warimari road에서는 orbiter을 탈 수 있습니다. 둘 다 성인 기준 현금가 4.2달러이고 버스카드를 구매하시면 2.65달러로 줄어듭니다. 버스카드에 돈이 없어도 잔돈이 조금 남아 있다면 한 번은 외상으로 찍히고 다음에 충전할 때 선지불됩니다. 버스카드 충전은 학교 서점, metromart에서 가능하고 버스 탈 때 기사에게도 요청할 수 있습니다. 인터넷으로 충전할 수도 있는데 카드 등록번호가 필요하니 처음에 카드 구매할 때 받아 두시거나 고객센터에 전화해서 받아야 합니다. 때로는 시스템 문제로 인터넷충전과 실제 카드 잔액 반영 사이에 시간이 걸리기도 하는 모양이니 인터넷충전은 미리미리 해 두시는 게 좋습니다. 버스를 타고 Westfield riccarton, 혹은 riccarton mall(동일한 곳입니다)로 가면 2층짜리 쇼핑 센터와 간단한 기념품점, 환전소, 카페, 은행, 식당, 영화관 등등이 있습니다. 단기 학생비자로 가셔서 현지 계좌를 만드실 생각이라면 ANZ를 이용하시게 될 텐데요 리카튼 몰의 ANZ는 주말에도 영업을 하니 참고하십시오. 리카튼 몰 안에는 Kmart와 Park'n save라는 큰 상점이 있는데 한국으로 비유하자면 홈플러스의 가전/생활용품/잡화 코너와 식재료 코너를 분리해 놓은 것과 같습니다. 웬만한 가전제품과 잡화들은 Kmart에서 사실 수 있고 가격도 다른 곳에 비해 저렴합니다. 또 Farmers는 가전제춤/잡화/식기 등을 파는데 Kmart보다 전체적으로 질이 좋고 비쌉니다. 할인 시기 맞춰서 오시면 저렴하게 구매가 가능합니다. 다른 식재료 상점으로는 방금 말씀드린 Park'n save 외에도 기숙사에서 와리마리 로드 쪽으로 길을 건너 직진하면 있는 New World와 와리마리 로드에서 좌회전을 해 10분가량 걸어가면 대각선 우측에 나오는 Countdown이 있습니다. 가격은 평균적으로 park'n save < countdown < New World 이나 세일이나 회원카드 보유 여부에 따라 다릅니다. 특히 new world는 회원 멤버십을 가입하지 않으면 거의 대부분의 할인품목을 할인가로 이용할 수 없습니다. countdown과 new world에서 물건을 많이 사면 매장 카트를 밖으로 끌고 나와 기숙사까지 사용한 후 기숙사 주차장 쪽의 카트 주차장에 놓으면 매장 측에서 카트를 회수해 간다고 합니다. 가끔 무거운 짐을 옮길 때 카트주차장에서 하나 빌려다 쓰고 돌려놓아도 되니 편하게 이용하시면 될 것 같습니다. 식재료 상점 외로는 와리마리 로드를 따라 countdown으로 가는 길에 버스정류장 좌측에 있는 Bush inn center이 있고, countdown 맞은편의 차이나타운이 있습니다. 차이나타운에 있는 중국 마트의 채소가 일반 마트보다 싼 경우가 종종 있으니 채소를 좋아하시면 고려해 볼 만합니다. 채소 가격은 계절마다 널을 뛰어 3배까지 차이가 날 때도 있습니다. 버스를 타고 앞에서 말씀드린 riccarton mall보다 멀리 나가면 bus interchange 부근이 시내 중심가입니다. 큰 병원과 공원, 백화점, 기타 식당, 영화관 등등 시내에서 할 만한 것은 다 이곳에 있습니다. Purple kine을 타고 종점 부근인 Sumner에 가면 해변이 있고 서핑이나 일광욕, 물놀이 등이 가능합니다. Student Volunteer Army(SVA)에서 활동을 하게 되면 버스를 대절해 교외의 습지나 강가에서 환경보전을 위한 활동을 하는 경우도 많습니다.","학생들은 대부분 flat에 삽니다 학교 근처에 쉐어하우스 형태로 사는 경우와 학교 기숙사에 사는 경우가 많은데 가끔 한국 원룸처럼 studio가 있으나 주당 200NZD이상으로 가격이 높은 편입니다. 일반 플랫의 경우 주당 150NZD가 보통인 듯 하고 학교 기숙사는 그보다 비쌉니다. 반 년에 5500NZD, 1년 계약에 10000NZD정도 생각하시면 됩니다. 가격 정보는 학교 홈페이지에서 accommodation을 확인하시면 기숙사 유형별로 찾으실 수 있습니다. 유학생들은 학교 기숙사 중 Ilam Apartment에 많이 삽니다. 만약 교환학생 준비 도중에 학교에서 안내받은대로 기숙사 신청을 진행한다면 이 쪽으로 배정을 받으실 겁니다. 아일람 아파트먼트에는 크게 세 가지 형태의 건물이 있는데 각각 Hinau, Hayashi, Manuka입니다. Hinau의 경우 플랫 내에 세탁실이 없어 아파트단지 내의 공용 세탁실을 이용해야 하고 비용은 세탁/건조 각 2NZD입니다. 단, 세탁기가 있는 방의 세탁기는 용량이 상당히 작습니다. 이불을 방 세탁기에 돌렸다가 찢어진 경우도 보았습니다. 처음에 기숙사를 신청할 때 이불(Linen pack)을 구입할 수 있는데 디자인은 기숙사 마크 디자인이지만 질이 괜찮습니다. 이불을 기숙사에서 사지 않고 Kmart나 Warehouse에서 따로 구매가 가능합니다. 가격은 따로 구매하는 편이 2~3만원 정도 저렴한 것 같습니다. 보통 플랫에서는 3~5명이 같이 살고 주방, 화장실, 거실 등을 공유합니다. 각 방마다 구비되어 있는 주방용품들은 랜덤인 편입니다. 보통은 칼, 냄비, 커피포트, 토스터, 그릇 몇 개 정도는 기본으로 있고 그 외의 것들은 대부분 전 입주자가 남겨놓고 간 것들입니다. 2주마다 한 번씩 공용공간을 청소하는 분이 오시는데 어떤 청소부 분이 오시냐에 따라서 평이 많이 갈립니다. 저의 경우에는 1학기때는 청소 서비스에 만족했으나 2학기때는 두 달째 화장실청소를 안 하고 가셔서 불만이었습니다. 처음에 기숙사 신청하는 포탈에서 불만사항이나 수리요청 등을 넣으시면 며칠 내로 담당자가 처리합니다. 기숙사가 아닌 일반 플랫에 사시는 분들은 집주인과 협의하시면 됩니다. 아무래도 공동생활이다 보니 플랫메이트들을 어떤 사람을 만나느냐에 따라서 생활의 경험이 바뀝니다. 플랫메이트들과 갈등이 있으실 때는 기숙사 오피스를 통해 중재가 가능하고 정 해결이 안 되시면 다른 방으로 이동도 가능합니다. 기숙사와 학교에는 경비원분들이 항상 돌아다니고 계시는데요, 밤에 옆집이 너무 시끄럽게 파티를 할 경우에는 그 쪽으로 연락해서 해결이 가능합니다. 기본적으로 10시부터는 조용히 하는 것이 규정이기는 하나 거의 안 지키고 목/금/토요일은 거의 항상 새벽 2시까지는 파티 소리가 들립니다. 기숙사를 신청하실 때 여성/남성만 거주하는 방을 원하는지 선택할 수 있는데 신청한 대로 100% 보장해주지는 않는 것 같습니다. 기숙사 배정 이후 기숙사 포탈에서 플랫메이트들의 나이와 성별을 확인할 수 있으니 단일성별 기숙사를 원하시는 분은 배정 확인 이후 원하지 않은 결과일 경우 기숙사 사무실과 연락하시면 됩니다. 메일 답장이 상당히 느리니 빠른 처리를 원하시면 전화연결을 권해드립니다. 식사는 직접 해 먹을 수 있고 기숙사에서 제공하는 catering을 신청할 수도 있는데 catering을 신청하는 사람은 별로 없습니다. 외식의 경우는 어딜 가더라도 한 끼에 최소 15~20NZD는 생각해야 합니다. 가장 싼 식당은 기숙사 내에 입점해 있는 Sherley's Kitchen인데 10달러정도로 한 끼를 해결할 수 있지만 식사공간 위생이 썩 좋진 않은 것 같습니다. 포장을 추천합니다. 학기 중 점심에는 학교 도서관 1층 Undercroft에서 버거, 수블라키, 볶음밥 등을 판매하고 푸드트럭도 날마다 다르게 옵니다. 대부분 10달러 선에서 해결이 가능합니다. 식재료 자체는 한국보다 싼 편이고 한국 음식도 Kosco라는 한국 슈퍼마켓에서 구매가 가능합니다. 차이나타운의 아시안 마켓에서도 라면과 양념, 과자 정도는 판매하고 있습니다.","수강 신청은 홈페이지에서 할 수 있지만 시간표 충돌을 전혀 고려하지 않고 승인이 납니다. 그렇기 때문에 시간표끼리 겹치지 않는지 꼭 확인하고 수강신청을 하셔야 합니다. 수업은 대부분 일주일에 세 시간 정도고 2시간은 강의, 1시간은 튜토리얼로 진행되는데 튜토리얼은 여러 세션이 있어 그 중 하나를 고르게 되어 있습니다. 이 때문에 초기에 시간표 짜기가 조금 헷갈릴 수 있으니 유의하세요. 대부분의 수업은 강의 영상 녹화를 제공합니다. 수업에 강의 영상이 제공되는지 확인하는 방법은 등록 이후 UcLearn 사이트에서 강의 섹션으로 이동하신 뒤 우상단의 course block을 눌러 eco 360을 제공하는지 확인하시면 됩니다. 대부분의 수업의 경우 출석을 확인하지 않고 출석점수가 평가에 아예 들어가지 않는 경우도 많습니다. 수업 분위기는 한국보다 활발한 편이고 질문도 잦습니다. 정말 사소해 보이는 질문이라도 잘 받아주고 또 질문을 통해서 수업을 이끌어나가는 경우도 많습니다. 과제는 학기 초에 모두 공지해주며 먼저 질문이 들어오지 않는다면 그 외에 따로 안내가 없는 편입니다. 과제 질문과 피드백은 조교나 교수에게 메일로 보내 받을 수 있고 과제 최종제출 이전에 먼저 피드백을 받고 고치는 경우도 왕왕 있습니다. 전체적으로 자율적인 분위기인 만큼 스스로 주도적으로 공부하지 않으면 어떻게 해야 할지 방향을 잃기 쉽습니다. 그러나 수업의 난도 자체는 300단위 수업이 아닌 이상 그렇게 높지 않아 배경지식과 자료조사를 잘 활용하면 문제없이 따라가실 수 있을 것입니다. 인문사회 전공의 경우 뉴질랜드 역사와 호주와의 관계, 마오리 문화에 대해 미리 공부해 가시는 것을 추천드립니다. 간단한 마오리어 역시 도움이 됩니다. 도서관은 총 두 개로 캠퍼스 중앙에 있는 중앙도서관과 주변부에 있는 Macmillan Brown 도서관이 있는데 원하는 자료가 있는 곳을 이용하시면 됩니다. 열람실과 미팅룸은 중앙도서관에 훨씬 많습니다. 열람실은 silent열람실과 아닌 곳이 구분되어 있는데 silent도 한국만큼 조용하지는 않습니다. 전체적으로 한국 도서관 분위기와는 다르게 활기찹니다. 꼭 미팅룸을 잡지 않고 그냥 도서관 열람실에서 조모임을 하는 경우도 있습니다. Ilam Apartment에 거주하실 경우 세탁실 옆에 study room이 마련되어 있으니 그쪽을 이용하실 수도 있습니다. 프린트는 도서관 2층 로비에서 우측으로 가면 나오는 computer zone에서 학교 아이디를 이용하셔서 프린트가 가능합니다. 송도학사 프린트와 유사한 시스템입니다. 대신 그때그때 가격을 결제하지 않고 학생증인 Canterbury Card에 금액을 미리 충전해서 사용합니다. 그 외 몇몇 건물에도 프린터기가 배치되어 있어 사용하실 수 있습니다. 도서관 1층에는 약국, 카페, 식당, 우체국, ATM, 여행사 등 편의시설이 있어 상황에 맞게 이용할 수 있고 UCSA V PLATE 앱을 이용해서 학생할인을 받을 수 있습니다. 급하게 생리용품이 필요할 때 학생회에서 제공하는 서비스도 있으니 확인하셔서 이용하세요.",부서 자체에는 방문해 본 적이 없지만 Academic Support Centre에서 영어가 모국어가 아닌 외국인 학생들을 위한 영어 강의를 제공합니다. 학기 시작과 함께 신청할 수도 있고 학기 중간에 들어갈 수도 있습니다. 그 외에도 각종 도움이 되는 강의들과 에세이 첨삭 등을 신청할 수 있습니다.,"학기가 시작하기 약 1주일쯤 전에 International Welcome이라는 오리엔테이션 강의를 하는데 기본적인 마오리어나 학교 시스템에 대한 정보를 주니 참석하시는 것이 도움이 많이 됩니다. 학기가 시작하고 몇 주 내로 동아리 박람회가 있는데 학교에서 나누어주는 안내 책자에 있는 공식 동아리 외에도 많은 동아리들이 참가하니 동아리 활동을 좋아하시면 추천드립니다. 동아리 활동과 회비는 동아리마다 천차만별이고 기본회비가 없고 활동에 따라 납부하는 경우가 많습니다. 저는 차 마시는 것을 좋아하여 teasoc에서 활동을 하였는데 한국 동아리보다 활동 참가 여부가 자유로워 2~3개 이상 활동을 해도 괜찮을 것 같다는 생각을 했습니다. 학교에 있는 부대시설은 도서관에 있는 시설들과 대학서점 등입니다. Riccarton mall에 있는 서점과 비교해도 대학서점의 책 종류가 그리 적지 않으며 문구점도 겸하고 있습니다. Health Centre 에서는 기본적인 진료를 받을 수 있으나 증상이 심하지 않은 이상 며칠 전에 예약을 하고 의사를 만나게 됩니다. Health Centre에서 진료를 받으면 등록할 때 구매하게 되는 보험사로 진료비를 바로 청구해 주어서 치과치료, 음주숙취, 임신과 같은 경우가 아니면 대부분 무료로 진료를 받을 수 있습니다. RecCentre는 학교 헬스센터인데 gym 이용은 회원가입 이후 무료이고, 트레이너와 함께 하는 프로그램은 현장에서 5$정도의 가격으로 1회를 구매하고 이용하거나 복싱과 같은 장기프로그램은 세션 기간이 시작하기 전에 등록할 수 있습니다. 학교 캠퍼스가 두 개이고 거리가 도보로 2~30분 가량 떨어져 있어 수강신청할 때 수업 건물이 같은 캠퍼스에 속하는지 확인하시는 것을 추천드립니다. 같은 캠퍼스 내라면 대부분의 건물이 쉬는시간 안에 이동하기에 무리가 없습니다.","기숙사가 혼성이고 때때로 플랫메이트들이 연인을 플랫에 데려오는 경우가 있어서 처음에는 그것이 충격이었습니다. 하지만 많은 플랫이 혼성이고 자연스럽게 어울려 놀다 보니 점차로 익숙해졌습니다. 플랫메이트들이 연인이나 친구를 플랫에 데려오는 것은 기숙사 규칙상으로는 일주일가량까지는 문제가 없다고 합니다. 그럼에도 많이 불편한 경우 대화나 기숙사 사무실의 중재를 통해 해결하실 수 있을 것입니다. 그 외에는 일반적인 대화를 하다가도 성적인 뉘앙스를 가진 농담들이 자주 나온다거나 주제 자체가 성생활이나 성으로 흐르는 경우가 꽤 많았습니다. 생활적인 부분으로는 자동차가 좌측통행인 것과 횡단보도의 부족들이 있었습니다. 특히 학교와 기숙사 사이의 아일람 로드, 기숙사와 new world사이의 와리마리 로드는 자주 이용하는 도로임에도 횡단보도가 없어 항상 주의해야 했습니다. 횡단보도 신호등은 버튼을 눌러야 켜집니다. 인종차별은 거의 없고 생활하는 두 학기 동안 직접적으로 인종차별을 당한 적은 한 번도 없습니다. 생활하는 동안 인종차별 테러가 일어나서 인종차별이 없다고 말하기가 정말 힘든데 그래도 생활하는 도중에 직접적으로 당한 적은 없습니다. 관련 얘기는 밑에서 계속할게요. 기본적으로 자신과 관련이 없는 다른 사람에 대해 관심을 보이지 않는 분위기라 치파오를 입고 슈퍼마켓에 가도 아무도 안 쳐다봅니다. 기본적으로 이민자 인구가 많은 도시라서 외국인을 많이 볼 수 있고 유학생들도 많아 여러 문화를 접할 수 있고 학교나 단체 차원에서도 다양한 문화를 접할 수 있는 행사를 많이 개최합니다. 직접적인 성차별 역시 거의 없었습니다.",기본적으로 웬만한 문제는 학교 혹은 기숙사 사무실과 연락하여 해결할 수 있습니다. 안전 문제가 생길 경우 기숙사 시큐리티에 연락할 수 있고 그로도 해결이 되지 않는 문제는 경찰이나 대사관/영사관과 연락해 해결이 가능합니다. 가끔 교내에서 무료 생활법률상담 등 도움이 되는 서비스를 제공하므로 기숙사에 거주하지 않으시는 경우 집주인과의 문제 등을 해결하는 데 도움이 될 수 있을 것 같습니다. 학업과 관련된 문제는 해당 수업 교수/조교 혹은 Academic Support Centre의 도움을 받을 수 있습니다.,"처음에 교환학생을 가기 전에 걱정을 많이 했는데 그런 걱정이 무색할 만큼 정말 만족스럽고 즐거웠습니다. 한국에서 경험하지 못하는 다양한 활동들이나 문화적 교류 등이 정말로 풍부하고 생활 역시 즐거웠습니다. 막연하게 대학에 오면 외국에서 공부 한 번 해 보고 싶다고 생각하고 영어도 잘 못 하는 채로 현지에 도착했지만 학업 면에서나 교류 면에서나 여행 면에서나 생각 이상으로 너무나 좋았습니다. 한국처럼 입학하면 학과단위로 자연스레 함께 행동하게 되는 것이 전혀 없어서 처음에는 어떻게 친구들을 사귀고 활동을 해야 하는지 조금 어색하고 힘들기도 했지만 오히려 적극적으로 활동하고 사람들을 만나면서 스스로를 변화시킬 수 있었던 것 같습니다. 도착한지 한 달쯤 지나고 인종차별 테러가 발생해서 처음에는 상당히 놀랐고 또 무서웠기도 했어요. 해당 위치가 학교와 멀리 떨어지지 않아서 며칠 후까지도 밖으로 나가서 백인 남성만 보면 위협을 느끼기도 했고요. 그럼에도 학교와 뉴질랜드 정부, 경찰 측에서 해결과 회복을 위해 많이 신경쓰고 있다는 것을 느낄 수 있었습니다. 사실 제 주변 사람들 중에 제가 가장 걱정을 덜 한 편이긴 했어요. 주변에는 아이들을 데리러 이민하러 오신 분들도 계시고 졸업 후 이곳에 취업하고 싶어서 뉴질랜드로 진학을 한 친구들도 있었는데 확실히 고려할 게 더 많으니까 걱정을 많이 하시더라고요. 뉴질랜드는 총기 허용 국가고 총기 허가가 쉬운 편이라 실제로 총기강도 사건도 많고 외국인을 대상으로도 총기 허용이 어렵지 않아서 시스템적으로 테러의 발생을 방지하기 위해 허술했던 게 사실이기도 합니다. 그 당시 수강하던 수업의 조교가 무슬림이어서 테러가 일어난 이후 수업에서 조교분의 말을 들었는데 눈물을 참을 수가 없더라고요. 학교 측에서 희생자분들에 대한 추모와 학생 전체를 대상으로 한 정신건강 상담을 제공하기도 했지만 한번 일어난 일을 되돌릴 수는 없는 일이니까요. 그럼에도 전체적으로 보았을 때 뉴질랜드에서 교환학생을 다닌 건 좋은 경험이었습니다. 최소한 정부와 사회에서 인간으로서 지지받는다고 느낄 수 있었어요."
