gen_info,env_info,food_info,study_info,office_info,facil_info,mhct_info,help_info,etc_info
"오타고 대학교는 뉴질랜드의 남섬, 남섬에서도 거의 최남단인 더니든에 위치해 있다. 내가 뉴질랜드에 있던 2월에서 6월은 우리나라의 계절과 반대인 늦여름~초겨울에 해당하는 계절이다. 오존층에 구멍이 뚫린 지역과 가깝기 때문에 자외선이 우리나라의 7배에 달한다고 한다. 여름에 뉴질랜드로 가게 된다면 자외선 차단제나 선글라스는 필수이다. 가을에는 비가 굉장히 빈번하게 온다. 날씨에 민감한 사람이라면 우울증이 우려될 정도. 겨울은 우리나라의 겨울보다 춥진 않지만, 0도 에서 영하 10도 까지는 떨어졌던 것으로 기억한다.
기본적으로 대기가 불안정하여 어느 계절을 막론하고 비가 자주오는 편이다. 하지만 금방 그치는 것이 특징. 덕분에 뉴질랜드 사람(이하 키위)들은 우산을 좀처럼 쓰지 않는다.
오타고 대학교는 건물이 여기저기 흩어져 있는편이다. 따라서 부지가 굉장히 크게 느껴진다. 하지만 의대, 치대를 제외한 대부분의 학과건물은 메인캠퍼스 내에 존재하거나 그리 멀지않은 곳에 위치해 있으므로 통학거리가 멀게느껴지진 않는다.","더니든은 대학도시로 알려져 있다. 이 도시에 생활하는 사람들이 대부분 오타고 대학교의 재학생이라 한다. 그렇다고 해서 우리나라의 대학가 앞을 상상해선 안된다. 오히려 평범한 도시의 번화가 느낌이 난다고 하는게 어울릴 듯 하다. 적당한 수의 레스토랑과 적당한 수의 바, 몇군데의 대형마트 그리고 쇼핑센터 등 딱히 특징지을 것 없는 일반적인 도시와 마찬가지의 모습이다. 다만 학교 주변에는 다른 도시에서 혹은 다른 국가에서 유학온 학생들을 위한 플랫(주택)으로 이루어져 있다. 여느 국가가 그렇듯, 여름에는 다양한 축제가 많은데 그 때마다 이 플랫들 군데군데에서 파티가 열린다. 그리고 대부분 학생들이 20대 초반이기 때문에 축제때마다 거리에서 술취한 친구들을 쉽게 만날 수 있다. 거리에서 술에 취해 크게 소리치거나 술병을 깨뜨려 난장판을 만들거나 심하면 소파를 불에 태우는 광경까지 볼 수 있다. 나름 문화충격이라 할 수 있겠다.","학교에서 제공하는 거주형태가 몇가지 있는것으로 알고 있는데, 나는 플랫에서 살았다. 한학기만 수학하는 학생들은 플랫에서 살아야 한다. 콜리지라고 해서 일반적인 기숙사 형태의 거주지도 있는데, 이곳은 오타고대학교의 1학년 학생들이 사는 곳이라 한다. 아무튼 난 한학기만 수학했기 때문에 플랫에서 거주했는데, 플랫은 일반 주택에 적게는 3명 많게는 6명이 함께 거주한다. 각자의 방을 소유하고 화장실이나 거실 주방등만 공유하는 형태이다. 가격은 한 학기에 3400불(뉴질랜드달러) 정도였다. 실 거주 기간과 상관없이 한학기로 비용을 지불하는게 좀 융통성 없는 부분이다. 플랫은 자취와 똑같다고 생각하면 된다. 모든 생활을 자신이 컨트롤 해야한다. 이미 자취경험이 있거나 자립심이 강한 사람이라면 전혀 문제될 것이 없다. 플랫메이트에 대해 우려하는 사람이 있을텐데, 따로 걱정할 부분은 아니라고 생각한다. 미국에서 교환학생이 상당히 많이 오기 때문에, 높은 확률로 미국 학생들이 플랫메이트가 된다. 나의 경우는 2명의 미국 친구들과 함께 생활했는데, 그들의 생활 방식에 크게 불편을 느낀 경험은 없다. 오히려 그 친구들이 연주하는 기타 소리를 즐기고 그들이 듣는 음악을 함께 들으며 문화 공유의 계기가 자연스럽게 형성되었던 것 같다. 하나의 치명적인 단점이 있다면 집이 너무 춥다는 것이다. 날씨가 따뜻하면 상관이 없지만 가을 겨울에는 정말 견디기 힘들다. 벽에 단열재가 포함되어있지 않아 바깥공기가 차가워지면 집은 두배로 추웠다. 그래서 거실에 히터를 틀고 늘 거실에 상주했다. 전기세가 상당히 비싸기 때문에 전기장판을 깔고 침대에 있는다거나 히터를 틀고 방안에 박혀있는것은 상당히 이기적인 마인드고 비효율적이다. 초반에 플랫메이트들과 전기세를 아낄 방안을 고안하는게 좋을 것이다. 
식사 역시 자신이 해결해야한다. 대부분의 식기는 플랫에 구비되어있다. 다만 젓가락과 밥솥이 없어 따로 구매했던 기억이 있다. 밥솥은 시내에 위치한 payless라는 상점에서 3만원 정도로 저렴하게 구매해 한학기동안 알차게 잘 사용했고, 젓가락은 happy coin 이라는 한국인이 운영하는 1달러샵에서 500원 가량에 구매하여 사용했다. 식료품점은 크게 new world 와 countdown 두군데가 있는데, 뉴월드가 학교에서 조금 더 가까운편이고 카운트다운이 조금 더 저렴한 편이다. 두군데다 세일을 자주하기 때문에 가격이 크게 부담되진 않을 것이다. 세일중임을 알리는 전단지가 플랫의 우편함에 빈번하게 날아오기 때문에 전단지를 확인하고 필요한 재료를 구매하러 가는것도 하나의 노하우다. 참고로 나는 플랫메이트들과 저녁당번을 정해 돌아가며 요리했는데, 파견기간중 했던 일 중 가장 잘한 일이었던것 같다. 자연스레 대화할 기회가 생기고, 우리 음식도 알려주는 등 여러가지 장점이 많다. 특히 미국 친구들은 대학입학과 동시에 자립하기 때문에 요리를 굉장히 잘하는 특징이있다. 또하나 덧붙이자면 나와 같이 살던 친구들은 김을 정말 좋아했다. 한국에서 김을 좀 챙겨가면 도움이 될 것이다. 
한국 식료품 가게도 멀지않은 곳에 위치해있다. 학교 근교에 식물원이 있는데, 식물원 근처에 위치한 유니마트 라는 곳에서 대부분의 한국 식품을 구매할 수 있다. 하지만 값이 비싼 편이므로, 부피가 크지않고, 무겁지 않은 식품은 어느정도 한국에서 챙겨가는 것이 바람직하다. 쌀은 유니마트에서 구매하는 것보다 뉴월드나 카운트다운에서 ''sun rise'' 라는 브랜드의 빨간 비닐포장의 쌀을 구매하는 것을 추천한다.","외국의 대학들은 자유로운 토론형태의 수업으로 진행되는 것을 영화를 통해 한번쯤은 접했을 것이다. 나 역시도 수업이 토론형태로 진행되는 것에 대한 기대반 걱정반의 마음을 안고 첫 수업에 들어갔다. 하지만 모든 수업이 그런 것은 아니었다. 특히 인원이 많은 수업은 전혀 그렇지 않고 우리 대학의 수업방식과 마찬가지로 원웨이 커뮤니케이션이 이루어진다. 하지만 학년이 올라가고 적은 수의 인원이 수강하는 수업일 수록 토론 형태에 가깝게 수업이 진행된다. 고학년이고 3,4천단위의 수업을 수강할 계획이라면 어느정도 이러한 수업방식에 대비하여 파견을 준비하는 것이 도움이 될 것 같다. 교환학생들은 대부분 한학기에 3개의 수업을 듣는다. 국제 교육부에서도 3개의 강의를 수강하는것을 추천한다 그 이상은 아마 버겁게 느껴질 수도 있을 것이다. 오타고 대학교는 D부터 fail로 기록된다. 학점 인정을 받기 위해서는 100점 만점을 기준으로 50점은 넘어야 fail을 면할 수 있다. 하지만 전혀 어려운 일이 아니다. 학교 서버내에 시험 족보가 저장되어있기 때문에 족보를 중심으로 시험기간에 벼락치기만 해도 50점은 받을 수 있다. 따라서 학점에 너무 연연하지 않아도 된다. 도서관은 학교 캠퍼스 곳곳에 3~4개 정도가 있는것으로 알고 있다. 하지만 도서관에서 공부하는 것은 그닥 추천하고 싶지않다. 학생들이 어려서 철이 안든건진 모르겠지만, 도서관이 너무 시끄럽다. 음식을 싸와서 먹는 친구가 있는가 하면 주변사람 개의치 않고 친구랑 떠드는 사람이 너무 많다. 학기 초에 과제를 하려고 도서관에 몇 번 갔다가 도무지 집중을 할 수가 없어 그 뒤론 도서관에 가지 않았다. 차라리 집에서 플랫메이트들에게 양해를 구하고 공부하는 편이 훨씬 효율적이다.","학교에서 가장 유명하고 멋진 건물인 clock tower 옆에 international office가 있다. 혹시 학교 생활중에 힘든일이 있다거나 의문점이 생기면 이곳을 찾아가면된다. 교환학생 상담을 담당하시는 분이 두분 계신다. 굉장히 친절하고, 혹시 자신이 영어가 부족하더라도 여유를 갖고 천천히 다 들어주시기 때문에 거리낌 없이 찾아가 고충을 얘기하길 추천한다. 학교 초반에는 의문점이 많이 생기기 때문에 종종 찾아갈 일이 생기지만 학교생활에 익숙해지고 나면 크게 찾아갈 일은 없다.","학생증을 발급받고 나면 학교에서 운영하는 체육관인 unipol에 출입할 수 있다. 출입시 학생증을 제시하면 6시 부터 23시 까지 언제든지 출입이 가능하다. 헬스장 시설이 굉장히 잘 갖춰져 있다. 거의 모든 기구가 비치되어있고, 유산소 운동기구도 그 수가 굉장히 많은 편이다. 다만 많은 학생들이 저녁시간에 체육관을 이용하기 때문에, 저녁시간대는 피하는 것이 좋다. 나는 아침수업이 없었기 때문에 아침시간대를 주로 이용했다. 06시에서 12시 까지가 사람이 가장 적은 시간대이다. 락커룸과 샤워시설도 잘 갖춰져있다. 집에서 사용하는 따뜻한 물도 전기세에 포함되기 때문에, 플랫메이트들과 나는 일부러 체육관에 가서 운동을 하고 샤워를 하고왔다. 전기세를 큰폭으로 줄일 수 있는 하나의 방법이다.","크게 문화차이를 느낄만한 사건은 없었다. 아까 잠깐 언급한 소파를 불태우는 정도랄까. 키위들은 월요일 목요일에 주로 술을 많이 마신다고 한다.(우리가 불타는 금요일을 보내듯) 하지만 술마시러 주점에 가기보단 마트에서 맥주 등을사와 집에서 친구들과 많이 어울리는 편이다.
또 평탄한 길이 많아 스케이트 보드를 타고 다니는 학생들을 쉽사리 목격할 수 있다. 이외에는 크게 언급할 만한 차이점은 없는 것 같다.",교내의 international office에서 대부분의 도움을 받을 수 있다. 혹시 수업과 관련된 도움이 필요하면 교수님을 직접 찾아가는 것도 나쁘지 않은 방법이다. 나의 경우 시험공부를 하다 생기는 의문점은 주저하지 않고 교수님을 직접 찾아가 질문했다. 대부분의 교수님들께서 다른 나라에서 다른 언어로 공부하는 것을 기특하게 여기시기 때문에 따로 걱정할 필요는 없다.,e-mail : corean.j.h.park@gmail.com
