gen_info,env_info,food_info,study_info,office_info,facil_info,mhct_info,help_info,etc_info
"University of Otago는 뉴질랜드에서 가장 오래된 대학으로서, 남섬에 있는 Dunedin에 위치해있습니다. 더니든은 남섬에서도 아래쪽에 있는데, 날씨가 정말 변덕스러운 것이 특징입니다. 하루에도 비가 오고, 해가 떴다가, 우박이 오고, 다시 해가 뜨는 등 날씨가 수시로 변하기 때문에 외투를 자주 입고 벗게 됩니다. 또, 마치 영국과 같이 비가 빈번하게 내려서 로컬 친구들은 대부분 우산을 쓰지 않고 비를 맞고 다닙니다. (이슬비 정도 수준의 비가 수시로 내려서 나중에는 결국 저도 그냥 맞고 다녔습니다..) 제가 도착했을 당시(7월 초)에는 한 겨울 이었는데, 한국과 같은 혹한은 아니었으나 뉴질랜드의 건물이 기본적으로 단열이 상당히 부실하기 때문에 정말정말 추웠습니다. (방안에서도 패딩을 입고 있었습니다.ㅠㅠ) 또, 햇빛이 상당히 강하기 때문에 선크림 및 선글라스는 필수로 챙겨오시길 바랍니다. 남섬과 북섬을 대비했을 때 남섬은 주로 빙하 지형, 북섬은 화산 지형 위주인데 남섬의 Queenstown, Milford sound, Lake Tekapo, Mount cook 등은 꼭 가보시길 바랍니다. 세상에 둘도 없을 자연을 마주하실 수 있습니다!!","더니든은 대학 도시이기 때문에 흔히 생각하시는 도시와는 거리가 매우 멉니다. 캠퍼스 크기로만 보면 연세대학교와 비슷한 수준이지만 도시 곳곳에 산재해 있으며 마주치는 사람들은 대부분 뉴질랜드 전역에서 공부를 위해 이사 온 학생들입니다. 또, 건물들도 모두 낮고, 상점들도 모두 오후6시쯤에는 닫아서 그 이후로는 길거리가 정말이지 한적합니다. 보통 학교가 위치한 North Dunedin 근처에서 생활하시게 되는데, 주로 학생들이 생활하는 Flat이나 College 등의 건물만 있습니다. 유일한 번화가는 메인 스트릿인 George Street과 시내 중심인 Octagon 근처로 볼 수 있습니다. (하지만 딱, 연세로 보다 작거나 비슷한 수준입니다) 따라서, 주로 도보로 이동하는 경우가 많고 대중교통을 이용하는 일은 드뭅니다.  North Dunedin(주로 생활하시는 곳)의 특징으로는 학교를 주변으로 학생들이 생활하는 집들이 있고 피크닉 가면 정말 좋은 Botanic Garden이 있으며 그 근처에 New World라는 마트가 있습니다. 또, 더 위쪽으로는 가장 가파른 언덕으로 기네스에 오른 Baldwin Street이 있습니다. (한번 꼭 가보시길 바랍니다)  시내(Octagon) 주변부로는 스코틀랜드 양식의 멋진 건물들이 있으며 New World 및 Count Down 등 마트가 있고 뉴월드 맞은편에 Uni Mart 라는 아시안 식료품점이 있어 자주 가게 될 것입니다. 한편, South Dunedin 에는 St.Clair beach가 있는데요, 한번 쯤 버스를 타고 가서 여유를 즐기기에 정말 좋습니다. 또, 차로 15분 정도 거리에 있는 Otago Peninsula에 나가면 정말 아름다운 언덕과 해변을 보실 수 있습니다.","1학기 교환학생으로 오는 학생들은 College에 지원할 수 없기 때문에, Flat에서 생활하거나 Studio에서 생활하게 됩니다. 저는 Flat에 지원했는데, 이는 학교에서 정책적으로 지원하는 공동자취 정도로 보시면 됩니다. 1명의 kiwi host와 여러 교환학생들이 거실, 주방 및 화장실 등을 공유하며 함께 생활하는데 한국에서는 해보지 못한 색다른 경험입니다. 물론 이에는 장,단점이 있습니다. 어떠한 친구들과 함께 사느냐에 따라 생활양식이 정말 달라지게 됩니다. 저같은 경우에는 플랫메이트들이 주로 나가서 놀고 밤늦게 귀가하는 친구들이었기 때문에 오히려 옆집 친구들과 더욱 친하게 지냈던 것 같습니다. 하지만, 경우에 따라 같이 요리를 해먹는 경우도 많고 난방비 등을 절약하기 위해 방보다는 거실에 모여 있는 경우가 많아 자연스럽게 이야기하게 되는 환경이 조성됩니다. 플랫은 다른 주거형태에 비해 가격적으로 유리한데, 보통 6개월 계약에 NZD 3300 정도 하는 것 같습니다. (플랫마다 약간 다릅니다.) Studio는 흔히 아시는 자취의 형태인데, 더 비싸고, 공동생활이 아닌 개인생활이라는 특징이 있습니다. 하지만 교환학생은 대부분 flat에 거주하는 걸로 알고 있습니다. 결론적으로, 플랫에 사는 것을 추천합니다. 비록 플랫메이트들과 갈등도 생길 수 있지만 여러 나라에서 온 친구들과 서로 다른 생각을 나누어 보고 생활에서 직접 부딪혀 보는 것이 매우 귀한 경험이 되기 때문입니다.  식사의 경우, 외식을 하면 지출이 정말 많기 때문에 주로 뉴월드나 카운트 다운 등의 마트에서 장을 보고 직접 만들어 먹는 경우가 많습니다. 학생식당의 경우도 가격에 비해 퀄리티가 상당히 낮기 때문에 기대하지 않는 것이 좋습니다. 한국에 있을 때 요리를 한 번도 해보지 않았는데, (먹고 살기 위해) 요리를 해보니 나름 재미도 있었습니다. 학생들은 주로 샌드위치 등을 만들어와서 끼니를 해결하는 경우가 많으며 귀찮을 경우 제가 살았던 Great King Street에 위치한 여러 패스트푸드 음식점들 (KFC, McDonald, Domino)을 이용하셔도 됩니다. (때문에 로컬친구들에게 Great King Street은 Fatty Line 이라고 불립니다.)교환학생의 또 다른 장점은 여유 있는 생활 및 새로운 경험, 독립적 생활양식에 대해 느껴보는 것 같습니다.","저는 정치학 1개, 지리학 1개, 영어 수업 1개를 수강했습니다. 보통의 경우, 학생들은 3개의 수업을 수강하고 있으며 공부에 열의가 있거나 더 듣고 싶을 경우 4개도 가능하지만 5개를 수강하는 친구는 거의 없었습니다. 저는 나름 중,대형 수업을 수강해서 인지, 수업의 진행 방식은 한국과 유사했습니다. 다만 Tutorial 시간이 있는 것이 특징적이었는데, 이 때 상호토론 및 발표를 하는 경우가 많아 부족한 영어실력에 애를 먹기도 했습니다. 하지만, 유창함과 별개로 자신의 생각을 이야기하려고 노력하면 친구들이 경청해주기 때문에 자신감을 가져도 좋습니다. 평가에 있어서는 수업마다 차이가 있지만, 여러 중간 과제물 등과 기말고사로 성적을 매깁니다. 평가는 외국대학답게 엄격하지만 성실하게만 하신다면 괜찮은 성적을 받으실 수 있습니다. 특징적인 것은 학기 중간에 1주일동안 Mid break가 있다는 것인데, 이 때 부족한 공부를 해야 하지만 통상적으로 여행을 많이 다닙니다. 학기초부터 이때를 미리 계획하셔서 알차게 보내시면 좋겠습니다. 도서관은 센트라고 불리는 Central Library와 여러 도서관이 있습니다. 저는 주로 센트를 이용했는데, 1층엔 컴퓨터를 이용할 수 있는 공간과 팩북 등을 구입할 인쇄소가 있습니다. 2~4 층은 열람실이나 한국과 정말 다릅니다. 좌석배정도 없고, 친구들과 자유롭게 얘기하며 심지어 음식물을 가져와 먹는 경우도 많습니다. 시설 자체는 쾌적하지만 한국의 도서관과 비교할 경우 처음에 상당히 신선했습니다. 또, 중앙도서관은 학생회관 등과 연결이 되어있고 둘 사이의 Link는 학생들이 주로 휴식을 취하는 곳입니다.","국제처 사무실은 캠퍼스 중앙, Clock tower 근처에 위치해 있으며, 처음 학교에 도착하면 이곳에 들러 도착신고 및 OT안내 등을 진행하게 됩니다. 생활에 어려움이 있을 때 찾아가 조언을 구할 수 있으나 저는 이용해 본적이 없었습니다. 행사 혹은 각종 소식을 이메일로 주기적으로 보내주며 교환학생들을 위한 프로그램을 종종 개최하는데, 주로 피자파티 등의 형식으로 여러 학생을 만날 수 있는 자리를 마련해줍니다. 이 때 꼬박꼬박 참석하면 다양한 교환학생 친구들을 만나보실 수 있습니다. 또, 언어교환이나 멘토-멘티 등의 프로그램도 있는데 지원하시면 로컬 학생에게 큰 도움을 얻을 수 있습니다.","기본적으로 OUSA라는 학생회가 있고, OUSA 건물에서 여러 동아리 등이 활동을 합니다. 학기초 동아리 박람회가 열리니 꼭 방문해 보시길 바랍니다. 또한 OUSA에서 요리, 외국어, 레져 등 여러 프로그램을 비교적 저렴한 가격에 마련하니 이를 잘 이용하시면 즐거운 한 학기를 보내실 수 있습니다. 뿐만 아니라, 스타디움 근처의 Unipol이라는 헬스센터를 무료로 이용할 수 있습니다. 많은 학생들이 방과후 이곳에서 운동을 즐기며 시간을 보냅니다. 또, 이곳에서도 여러 스포츠 프로그램을 진행하는데 저의 경우 Tracking, Horse Riding 등을 등록하여 학기 중에 신선한 여가 활동을 즐겼습니다. 이처럼 이곳에서 즐길 수 있는 여러 프로그램은 한국에서 대학생활 할 때와는 또 다른 재미를 주는데, 이를 적극 활용하시길 바랍니다.   뿐만 아니라 근처에 의료센터, 커리어센터 등이 있으니 필요한 경우에 방문하시면 됩니다.","외국에 나가기 전 사실상 큰 고민이 되는 부분일 것 같습니다. 하지만, 대부분의 뉴질랜드 학생들이 정말 착하고 길에서 눈을 마주치면 반갑게 인사를 해줍니다. 다만, 밤에는 혼자서 밖에 돌아다니지 않는 것을 추천합니다. 주로 Castle Street에서는 매일 파티가 열리며, 또 술에 잔뜩 취한 학생들은 간혹 행인에게 시비를 걸기 때문에 필요한 경우가 아니면 외출을 삼가시는 것이 좋습니다. 하지만 보통의 키위들도 통상 이러한 취객을 극도로 싫어하며 그러한 행위가 나쁜 것이라고 생각하기 때문에 큰 걱정은 안하셔도 됩니다.한편, 혼성플랫에 사실 경우에 다소 개방적인 부분도 있는 것 같습니다. 저는 그다지 불편하지 않았지만 이러한 생활에 민감하시다면 플랫 신청 시에 따로 동성 플랫 등을 요구를 하시길 바랍니다.","처음 도착하면 모르는 점도 많을텐데, 키위 호스트에게 문의하는 것이 가장 효과적입니다. 장을 보러 어디로 가야할 지 등등 사소한 문제도 모두 친절하게 답해줍니다. 국제처에서도 물론 도움을 주며 거주 관련된 사항은 flat office에 찾아가시면 됩니다. 한국인의 경우 외국 다른 도시에 비해 상당히 적고, 주로 한인교회(Know Church) 등을 통해 교류가 이루어지기 때문에 고향이 그립거나 도움이 필요한 경우에 찾아가셔도 좋을 것 같습니다.","혼자 파견을 나가기 전에, 파견보고서를 꼼꼼히 읽으며 준비했던 것이 기억이 납니다. 두렵기도 하고 기대도 많이 될 것인데, 무엇을 상상해도 한국에서 대학을 다닌 것과는 전혀 다른 경험을 해볼수 있습니다. 사진과 그림,여행을 좋아하는 저는 아름다운 자연 속 뉴질랜드에서 공부하며 받은 영감과 신선한 자극이 정말 좋았습니다. 궁금한 점이 생기시면 언제든 yjr816@gmail.com 으로 편하게 연락주시길 바랍니다.^^"
"University of Otago는 우리나라가 있는 북반구와는 계절이 반대인 남반구, 그것도 자연의 이미지가 먼저 툭 떠오르는 뉴질랜드에 위치하고 있습니다. 뉴질랜드 남섬에서도 가장 맨 아래에 있는 Otago대학은 각 단과대학 별로 띄엄띄엄 위치해 있기 때문에, 큰 그림으로 아우른다면 우리 연세대학교보다는 조금 더 큰 편이라고 볼 수 있습니다. (하지만 개별 단과대학의 크기는 연세대학이 조금 더 큰 듯 합니다.) 제가 파견나갔던 2013년 2학기, 그러니까 우리나라로 따지면 여름이 끝나가는 시점에 뉴질랜드에 도착하게 되었습니다. 그 당시 제가 도착했던 그 곳, 더니든은 단순히 쌀쌀한 겨울일 거라고 예상했던 저를 당황스럽게 할만큼 칼바람이 불고 있었습니다. 미리 인터넷으로 예약해둔 셔틀을 타고 더니든 공항에서 집으로 도착하기 까지는 최소한 40분 가량 걸렸던 것으로 기억합니다. 뉴질랜드에 위치해있는 대학들 중에 Otago대학이 가장 남쪽에 위치하기 때문에 남극에 가장 가깝습니다. 2학기(우리 학기 기준)에 파견나가시게 되신다면 두툼한 외투는 기본이요, 수면양말은 꼭 챙겨가시기 바랍니다. 날씨가 아주아주 춥습니다.","Otago 대학 더니든 캠퍼스 내부를 살펴본다면, 정말 말도 안되게 아무것도 없습니다. (만약 제가 뉴질랜드의 고시생이었다면 최적의 환경이었을지도 모르겠군요.) 캠퍼스 내부에는 도서관을 비롯한 여러 단과대학들이 몰려있고, 조금만 밖으로 나가면 한적한 뜰(?)이 끝없이 펼쳐진 것을 볼 수 있습니다. 물론 더니든 자체가 전형적인 대학을 중심으로 형성된 대학도시이기 때문에 관광지와 같은 놀잇거리들을 기대하는 것은 어불성설입니다만, 우리가 흔히 생각하는 ''놀거리들''은 생각보다 많지 않습니다. 하지만 긍정적으로 더니든을 바라본다면 색다르게 발견할 수 있는 것들이 많습니다. 예를 들어, 학교의 북쪽 방향으로 한참을 걸어가다보면 Botanic Garden이라는 희귀 새와 각종 나무들이 있는 정원을 둘러볼 수 있습니다. 제가 갔을 당시에는 겨울이라 볼 것이 많지 않았지만, 봄이나 여름에 가시는 분들은 사진찍기 정말 최적의 장소라고 할 수 있을 것입니다. 그 곳에서는 시대별, 나라별 나무, 꽃, 풀 등을 기르고 있고, 정원 가운데에는 오리들이 유유히 떠다니는 모습을 볼 수 있습니다. 
시야를 돌려 나름의 도시 중심부를 보자면, Otago 대학과는 사뭇 다른 일반 도시의 모습을 어렴풋이 볼 수 있습니다. 넓게 펼쳐진 사무실들을 비롯하여 Museum, Pub, Various Shops들이 시계탑(이라고 부르는 곳)에 옹기종기 모여있습니다. 만약 운전면허증이 있거나, 버스 타는 것을 좋아하시는 분이라면 더니든 시내뿐 아니라 더니든 외곽에 있는 여러 바닷가들(정말 아름답습니다!)을 가보실 수 있습니다. 
대학 ''주변''환경 이라기에는 조금 거리가 있지만, 개인적으로 다음번 파견학생분에게 추천드리고 싶은 곳은 옆동네인 퀸스타운이나 윗동네인 웰링턴, 오클랜드 뿐만 아니라 Lake Tekopo나 Milford Sound를 방문해보셨으면 합니다. 정말 세상에 다시없을 풍경을 보시게되리라 생각합니다.","개인적으로 제가 살았던 거주지는 학교 캠퍼스 주변에 위치하고 있는 Flat에서 살았습니다. Flat은 여러 교환학생들을 비롯한 뉴질랜드 키위와 함께 한 집에서 사는 거주형태인데, 개인 방을 가지고 있고, 화장실과 주방만 공유하는 형태입니다. 플랫에서는 기본적으로 오븐, 냉장고, 식기세척기, 전자레인지, 냄비, 수저, 포크, 및 가스레인지 등을 제공하고 있으며, 제가 살았던 곳에서는 키위친구가 개인적으로 토스터기와 밥솥을 가져와서 함께 사용했습니다. 화장실과 샤워실을 함께 쓴다고 해도 한 번에 한 명 이상 들어갈 수 없는 비교적 좁은 구조이기 때문에 ''공용''이라는 것에 불편함을 느끼실 필요는 없다는 게 개인적인 견해입니다만, 주방에서는 언제든 다른 교환학생 친구들과 이야기를 나눌 수 있습니다. (본인이 피하지 않는다면) 제 경우, 미국인 2명, 뉴질랜드 키위 1명(호스트라고합니다), 홍콩 1명, 일본 1명 이렇게 같이 살았는데, 초반에 키위친구의 발음을 잘 알아듣지 못하다보니 미국인 친구들이나 다른 아시아 친구들과 많이 놀았던 것 같습니다. (귀국 전 쯤에야 키위친구의 발음을 정확히 이해할 수 있었다는 슬픈 소식이ㅠㅠ) 
식사는 플랫티들과 함께하는 경우도 있고, 보통은 각자의 방에서 해결합니다.(집에서 먹는경우.) 하지만 친구들을 사귀게 되면 밖으로 나가서 먹는 경우가 많은데 더니든의 경우 식당이 아주 잘 발달된 곳이 아니라서 메뉴가 참..한정됩니다. 그렇기 때문에 보통은 market에서 쇼핑을 한 후에 친구네 집에서 요리해먹는 경우가 흔합니다. 플랫티들끼리 비용을 공유하면서 한 번씩 돌아가면서 요리하는 케이스도 있구요, 저같은 경우에는 각자 먹고싶은 것을 사서 각자 해먹는 케이스였습니다. 개인적으로 저는 손이 크기 때문에 많이많이해서 모두에게 나눠줬지만요..(비용이 만만치않게 깨졌습니다ㅏㅏㅏ....) 
하지만 나름 장,단점이 있으니 플랫티들과 비용을 공유하고, 요리도 공유하는 것도 나쁘지 않을 것 같네요.","저는 처음에 4과목을 신청했었는데, 신청기간에 한 과목을 drop했습니다. 결과적으로는 3과목을 들었는데, 경제학 전공 1과목, 재무 과목 1과목, 영문학과 과목 1과목이었습니다. 경제학 교수님과 영문학 교수님은 뉴질랜드 토박이로 자라시고 호주에서 석박을 마치시고 돌아오셔서 그러신지 발음이 아주 fantastic합니다. (제가 들은 과목뿐 아니라 아마 다른 과목들도 뉴질랜드 출신 교수님들이 많을 것으로 예상되니, 혹시 가시는 분들은 미리 듣기공부 빡세게 하고 가시길 추천합니다...) 
초반에는 수업을 따라가는 것이 문제가 되지 않았습니다. 기본적으로 피피티는 제공해주고, 책과 거의 비슷하게 나가시거든요. 정말 중요한 문제는 교수님이 하시는 말씀을 종종 놓친다는 것이었습니다. 하지만 각 과목마다 tutorial이 제공되므로 적은 인원으로 대학원 조교분들과 복습할 수 있는 좋은 기회가 제공되었습니다. 수업 자체가 어렵진 않았으나, 성적을 보니 호주, 뉴질랜드 그 명성에 걸맞게 성적이 아주 높게 나오진 않았더군요. 혹시라도 고득점을 원하시는 분들이라면 매 퀴즈뿐 아니라 시험, 튜토리얼 모든걸 완벽하게 하셔야 합니다.

도서관은 1층은 컴퓨터를 사용할 수 있게 되어있고, 2층부터는 열람실 형태로 구성되어 있습니다. 2층에서 잡지와 뉴스를 읽을 수 있고 여러 분야의 책이 구비되어 있으며, 조모임을 할 수 있도록 공간이 마련되어 있습니다. 하지만 개인적으로 마음에 들지 않았던 것은 도서관 내에서 굉장히 자유롭게 떠들 수 있다는 점과 음식을 마음대로 먹을 수 있다는 점이었습니다. 공부하는데 갑자기 강한 향의 커리향기가 폴폴 풍기는 바람에 좌석을 다른 곳으로 옮겨야했던 불편함도 있었지요... 
책은 5권 정도를 맥스로 빌릴 수 있었던 것 같습니다. (저는 보통 2~3권정도만 빌려서..;;) 2층 맨 오른쪽에 ''당일 대출''이라는 곳이 있는데, 그곳에서 책을 빌리면 다음날 오전 9시까지 반납해야합니다. 만약 늦게 반납한다면, 1시간당 우리나라돈으로 5,000원 정도(정확히는 기억 안나지만 요금폭탄이 정말 후덜덜합니다)를 지불하셔야 합니다. 반납기한이 2번이상 늦으면 도서관 최고사서님과 개인면담까지 해야한다는 ..ㄷㄷ....(블랙리스트에 올라가기 때문에, 책을 왜 빌리려고 하는지까지 말해야합니다)
전반적으로 조용한 분위기이고 바닥에 기본적으로 카펫이 깔려있기 때문에 아무데서나 편하게 앉아서 공부할 수 있습니다. 또한 우리학교처럼 시스템으로 좌석을 배정받는 형태가 아니기 때문에 그냥 아무자리에나 앉을 수 있습니다. (지나가던 사람에게 발을 밟힐 가능성도 감안하다면 일반 좌석을 추천드립니다)","제가 국제교육부를 들렀던 경우는 딱 두번뿐이었지만, 두 경우 모두 친절했습니다. 처음에는 교환학생들을 위한 기차여행에 대한 정보를 얻고 등록하기 위해서였고, 두번째는 비자문제에 관한 것이었습니다. 기차여행은 학기를 등록하시면 교환학생들끼리 모아서 어디론가(위치는 기억이안납니다ㅜ) 기차를 타고 떠납니다. 좌석은 임의로 앉고싶은 곳에 앉기 때문에 옆 자리 친구들과 수다를 자유롭게 떨 수 있습니다. 
비자문제 때문에 방문했던 것은, 당시 제가 준비하던 국제시험의 시험 장소를 뉴질랜드로 지정했다가 비자가 시험 이틀 전에 만료된다는 사실을 듣고 조언을 구하기 위함이었습니다. 학생 비자를 담당하시는 할머니(;;)께서는 매우친절하게 느릿느릿 영어를 말씀해주시고, 저에게는 비자 연장을 추천해주셨었습니다. 개인적으로는 국제교육부에 계신 모든 분들이 교환학생들에게 친절하시고, 이야기를 끝까지 들으려 노력하십니다. 국제교육부는 제가 개인적으로 많이 이용한 곳이 아니어서 할 말이 많진 않지만, Homesick이 있는 경우에도 여러가지 대처방안이나 도움을 많이 주는 것으로 알고 있습니다.","Otago 대학에는 OUSA라는 학생연합이 있습니다. 여기에서는 학생들을 위한 다양한 활동들(재즈힙합, 요리, 검도 등)을 제공하고 있으며, 각 활동별로 소정의 활동료가 붙습니다. 제가 자주 이용했던 곳은 Gym이었는데, 학생들에게는 무료입니다. 농구나 탁구 등의 활동을 위해서 공간을 대여하는 데에는 비용이 일정이상 들지만 기본 헬스장을 이용하는 데에는 아무런 비용도 들지 않습니다. 개인적으로 운동을 좋아하는 지라 Gym을 하루에 2시간씩 매일 이용했던 기억이 납니다.","제가 살고 있던 곳이 교환학생들을 위한 플랫이면서 동시에 대학원생들이 함께 거주하는 플랫이어서 그런가 평소에는 굉장히 조용한 분위기였습니다만, 목요일 밤만되면 술에 취해 미친듯이 소리를 지르며 차를 타고다니는 젊은이들이 많았습니다. 밤에 지나다니다보면, (잘 듣진 못하지만) 간혹 인종차별적 발언을 하는 경우가 있다고는 합니다. 
문화 충격이랄 것까지는 딱히 없고, 가끔 지붕위에서 뭔가를 불태우는 장면을 목격하긴 했습니다만 크게 신경쓰지 않고 지나갔습니다. 다만 다들 잠든 엄청 조용한 플랫에서 밤에 음악을 엄청 크게 틀어놓고 새벽 세시까지 술 마시면서 노는 모습은 다소 충격적이었습니다.","개인적으로는 국제교육부가 도움을 받기에는 최적의 장소라고 생각합니다. 더듬거리더라도 다 들어주고 보통 교환학생들이 겪는 어려움에 대해 알고 있기 때문입니다. 하지만 뉴질랜드 사람들이 보통은 다 친절하기 때문에 길가다 지나가는 사람에게도 도움을 받을 수 있습니다. (친구가 있다면 친구에게 도움받는게 최고이지만요.) 교외로 나가서는 도움을 받을 곳이 마땅치는 않습니다. 국제교육부의 전화번호는 늘 숙지하고 계시고, 친구들과도 자주 연락하는 것이 최선의 방법입니다.",
