gen_info,env_info,food_info,study_info,office_info,facil_info,mhct_info,help_info,etc_info
"오타고대학교가 위치한 더니든은 말 그대로 대학도시다. 도시 자체도 굉장히 아담하고 오타고 대학교 자체의 크기가 더니든의 거의 전부라고 보면 된다. 모든 가게나, 음식점, 카페도 학교 주변에 있고 학교의 중심 캠퍼스 및 의치약학과 캠퍼스가 도시 블록마다 있기 때문에 대학생들끼리의 생활을 느낄 수 있었다. 그런데 더니든 자체가 큰 도시는 아니기 때문에 사는 곳과 캠퍼스 간의 거리나, 캠퍼스 내에서의 건물 간의 거리가 모두 도보로 가능하다. 자전거가 꼭 필요할 정도는 아니다. 지리적 위치는 남섬에 위치하고 있는데 그래도 꽤나 안정적인 지역인 것 같다. 내가 있을 때는 같은 남섬의 크라이스트처치에서 큰 지진이 났었는데, 더니든에는 아무런 피해도 없었다. 더니든이 작은 시골 지역이어도 다른 지역으로 연결되는 공항이나 버스는 많기 때문에 여행에도 전혀 불편함이 없었다. 다만 기후는 내가 갔던 1학기에는 굉장히 추웠다. 뉴질랜드는 우리나라와 계절이 반대이고, 특히 남섬이 북섬보다 기온도 낮고 그 중에서도 더니든은 추위로 정말 정말 유명하기 때문에 사실 추위와의 싸움이 힘들었다. 비도 정말 많이 오고, 날씨가 화창하고 해가 쨍쨍해도 굉장히 춥다. 바람도 많이 부는 편이다. 뉴질랜드 플랫 자체도 중앙난방이 따로 되지 않기 때문에 전기장판, hot water bottle, 이불 등등 챙기는 것이 중요하다. 더니든의 여름 (우리나라로는 2학기) 은 그래도 굉장히 화창하고 좋다고 하니까 가을학기에 간다면 크게 걱정하지 않아도 될 것 같다.","대학 주변 환경은 앞서 말했던 것처럼, 더니든 자체가 오타고 대학교의 확장판이라고 보면 된다. 다시 한번 말하지만 더니든은 교육 도시이기도 하기 때문에 놀기도 좋고, 공부하기도 좋은, 대학생으로서 살기 편한 지역이다. 캠퍼스에서 10분~20분 정도 걸으면 옥타곤이라는 시티 중심으로 나갈 수 있다. 옥타곤에는 카페, 음식점, 갤러리, 영화관 등등 없는 게 없다. 옥타곤으로 이어지는 main street인 George St는 캠퍼스와 대학생들 기숙사 및 플랫에서도 굉장히 접근성이 높다. 그리고 대부분의 친목 모임, 사적인 쇼핑, 장보는 것 등이 다 George street에서 이뤄진다. 온갖 종류의 음식점이 다 있기 때문에 친구들끼리도 수업 들은 후 바로 밥 먹고 커피 마시고 다시 수업을 들으러 와도 충분했던 것 같다. 그리고 시티뿐만 아니라 자연환경과도 굉장히 가깝다. 더니든은 캠퍼스, 시티 그리고 자연까지도 모두 어우르는 곳이기 때문에 학교 주변에서 버스를 타고 한 20분 정도만 가면 다양한 종류의 해변가, 오타고 반도까지 나갈 수 있는 것이 너무너무 좋았다. 사실 서울에 살면서는 적어도 2시간은 버스로 가야 바닷가를 보는데, 더니든에서는 20분만 버스를 타면 바닷가를 훨씬 가까이서 자유롭게 볼 수 있기 때문에 그 자연에의 감동은 잊을 수가 없다. 특히 오타고 반도에는 다양한 동물들이 사는데, 시티에 위치한 i-centre에 가서 관광 패키지를 끊으면 정말 가까이서 사진도 찍을 수 있다. 이렇게 본인이 적극적으로 알아본다면 다양한 경험을 할 수 있는 좋은 곳이 더니든이다.","오타고 대학생들은 크게 3가지의 종류로 거주한다. 첫 번째는 기숙사인데, 기숙사는 대부분 캠퍼스 내에 있고 캠퍼스 안이 아니더라도 거의 걸어서 5분 거리에 위치하고 있다. 기숙사에서는 식사가 제공되고 기숙사별로 이벤트가 굉장히 많은 것 같다. 기숙사끼리 스포츠 게임도 하고 파티도 하는 것 같다. 기숙사는 대부분 1학년 신입생들에게 기회가 많은 것 같고, 내가 갔던 2011년 1학기에는 교환학생들은 기숙사를 선택할 수 없었다. 기숙사는 학교 홈페이지 accommodation에서 신청할 수 있다. 3지망까지 쓸 수 있고, 몇몇 기숙사는 성적순으로 뽑을 정도로 기숙사에 공들이는 것 같다. 두 번째는 스튜디오인데, 자취의 형태이다. 이 또한 학교에서도, 나도 교환학생들에게는 가장 추천하지 않는다. 우선 교환학생들이 처음 타지에 나가서 혼자 살 집을 마련하는 것도 어렵고 스튜디오는 비용도 너무 비싸다. 그리고 혼자 자취하는 것이기 때문에 다른 나라 친구들과 어울릴 수 있는 기회가 거의 없다. 
마지막은 플랫인데, 한 집에 4-6명이 함께 사는 형태이다. 내가 파견되었을 때는 학교에서 교환학생들은 무조건 플랫에서 지내도록 권장했다. 뉴질랜드에 가기 전에 플랫을 신청하고 deposit을 내면 플랫 주소와 같이 사는 다른 교환학생 친구들을 배정받았다. 대부분 플랫들은 street별로 5-6채가 모여 있어서 한 블록을 이루고 있는 학생들끼리 파티도 자주 하고 서로 도움도 받을 수 있다. 나는 개인적으로 플랫 생활을 적극 추천한다. 플랫에서 지내면 키위호스트(뉴질랜드 학생) 1명과 4-5명의 다른 나라 교환학생들과 함께 살 수 있는데, 영어도 많이 늘고 사교력도 정말 많이 늘어난다. 방은 독방이고 부엌, 다이닝 룸, 거실, 세탁실은 하나씩 있으며, 화장실은 3명이 하나씩으로 2개가 있다. 나는 플랫 친구들과 일주일에 한번씩 돌아가면서 flat dinner를 하면서 대화도 많이 나눌 수 있었고 같이 여행도 다니고 과제 도움도 많이 받았다. 다른 나라 친구들과 같이 살 기회가 많지 않기 때문에 정말 소중한 경험을 많이 할 수 있었던 가장 큰 이유가 플랫이었다. 한 가지 단점이 있다면, 플랫티를 잘 만나느냐에 따라서 많이 좌우된다는 점이다. 나도 처음에는 독일 플래티와 갈등이 있어서 초반에는 힘들었던 기억이 있지만, 문화 차이는 모두 대화로 해결할 수 있으니 너무 걱정하지 않아도 될 것 같다.","수업은 우선 뉴질랜드에 가기 전부터 홈페이지에서 수강 편람을 통해서 신청할 수 있다. 그런데 홈페이지에서만 보고 신청하기에는 무리가 있기 때문에 뉴질랜드 도착 후 바꿀 수 있는 기간이 있다. 그 기간 동안 international office에서 교환학생들을 위해 과목 설명이 되어 있는 책자를 다 나눠주고, 교환학생들에게 추천하는 수업들도 많기 때문에 본인이 알아서 고르면 된다. 우리 학교와 다른 점은 수강 신청이 온라인으로 되는 것이 아니라 직접 교수들에게 싸인을 받은 후에 최종 신청지를 제출하는 형식이라서 조금 복잡하긴 하다. 
보통은 교환학생들에게 3개 수업을 들을 것을 학교에서도 권장한다. 3개 수업이면 18point씩 총 54point인데 18point가 우리학교 학점으로 환산하면 3학점으로 계산된다. 나는 영문과 수업, 교양, 신방과 전공 하나로 총 3개를 들었는데 200단위와 100단위였다. 오타고에서의 100단위는 우리학교 1000단위와 같다. 수업은 대부분 따라갈 만 했다. PPT로 수업하는 것을 우리 학교와 똑같았고 수업 자체도 초반 적응기간 외에는 못 알아들을 정도는 아니었다. 오타고에서는 일주일에 3시간 수업 중에 2시간은 교수 수업, 1시간은 tutorial로 진행되는데, tutorial은 토론 수업이다. 일주일 동안 배운 것을 학생들끼리 분반되어 토론하고 조교와 정리하는 것인데 오히려 토론이기 때문에 좀 힘들었던 기억이 있다. 그래도 교수님과 조교가 많이 상황도 봐주고 도와주는 편이다. 영어 실력을 늘리고 싶은게 목적이라면 international office에서 추천하는 교환학생들을 위한 영문과 수업을 듣는 것을 굉장히 추천한다. 오타고는 한 학기에 시험이 final로 한 번만 있다. 중간에 레포트나 에세이 같은 과제는 꾸준히 나오는 편이고, 한 학기 배운 것을 마지막에 한 번에 논술형태로 보기 때문에 평소에 공부를 미리 해놓고 정리해 놓는 것이 스트레스를 안 받을 수 있다.
도서관은 우리학교와 거의 비슷하다. 중앙도서관이 캠퍼스 가운데에 있는데 학생들이 굉장히 애용하는 편이다. 책도 많이 찾아볼 수 있고 자리도 많고 탁 트여있다. 시험기간 일주일 전부터는 도서관 여는 시간 전부터 도서관 앞에 학생들이 줄을 서있다. 그만큼 학구열도 높은 것 같다. 쾌적하고 매점도 많고 (매점에는 육개장 같은 한국 컵라면도 있다!!) 공부하기도 좋아서 나도 도서관을 꼭 공부가 목적이 아니더라도 자주 갔던 것 같다.","International office는 굉장히 도움이 많이 된다. 나 같은 경우에는 오타고 국제처와 사실 다른 학생들보다 교류가 좀 더 많았던 것 같다. 연세대학교를 소개해 달라는 부탁을 받아서 교환학교 박람회에서 연대 홍보 발표를 했었다. 혹시나 이런 부탁을 받는다면 영어 때문에 거절하지 말고 적극적으로 홍보했으면 좋겠다. 우선 처음에 뉴질랜드에 도착해서부터 국제처에서 다양한 정보를 제공한다. 학기 시작 전에 모든 교환학생들을 데리고 기차여행을 가는데 친구들도 많이 사귈 수 있고 적응도 빨리 할 수 있었다. 학기 중에도 규칙적으로 행사를 많이 개최했고 참여하는 사람들도 많았다. 모두 이메일로 파티나 강연, 설명회 같은 것을 공지하기 때문에 자기가 가고 싶은 것을 골라 갈 수 있도록 선택의 기회를 많이 제공한다. 
그리고 내가 파견되었을 때는 오타고 국제처에서 Prepare For Otago라는 프로그램을 진행했었다. 학기 시작인 2월 말보다 2주 전인 2월 초부터 신청한 교환학생들을 대상으로 2주 동안 오타고와 더니든에 적응할 수 있도록 미리 생활하는 프로그램이었다. 나는 PFO를 신청해서 2월 초에 도착했는데 정말 너무 많은 것을 얻을 수 있었다. 학교 캠퍼스 탐방, 더니든 투어, 에세이 레포트 첨삭까지 도움을 많이 받았고, 그 때 만난 유럽 친구들과 학기 마지막까지 같이 다녔다. 미리 가서 적응도 먼저 하고, 친구들도 많이 사귀어놓으니 학기가 훨씬 편하고 재밌었던 것 같다. PFO가 아직도 있다면 꼭 먼저 가서 오타고를 더 재밌게 즐기길 권장한다.","우선 부대시설은 많은 편이다. 그런데 캠퍼스 안에 있는 것만 아니라 곳곳에 있기 때문에 일부러 찾아가지 않으면 많이 이용하게 되진 않는 것 같다. 수영장, 체육관, 도서관, 식당 등등 있을 건 다 있다. 교환학생들에게 중요한 부대시설이라면 flat office와 Club OUSA 정도로 축약할 수 있다. Flat office는 말 그대로 플랫 생활에서 불편한 점이나 도움 받고 싶을 때 언제든지 찾아갈 수 있고 캠퍼스 안에 있다. 너무 춥다고 하면 난로도 주고 인터넷 느려졌다고 하면 용량 확인해주고 A to Z 다 관리하는 곳이라서 알아두면 좋은 곳이다. 
Club OUSA는 우리학교로 따지면 학생회관인데, 동아리나 클럽 활동이 대부분 여기서 이뤄진다. 동아리는 학생들끼리 모이는 친목 활동이고, 클럽은 외부 강사를 초빙해서 1-2달 동안 문화적으로 배우는 것으로 약간 차이가 있는데 나는 클럽 활동을 했다. 이 것 또한 굉장히 추천한다. 2달 동안 European cooking을 했는데 하면서 요리도 배우고 친구들도 사귀고 일석이조였다. 돈을 내고 하는 클럽도 있고 무료 클럽도 있다. 요리나 언어 같은 경우는 유료 클럽이고 요가, 필라테스 같은 운동은 무료 클럽이다. 클럽이나 동아리도 어떤 종류가 있는지 학기 시작 전에 국제처에서 템플릿을 다 나눠주기 때문에 쉽게 알 수 있다. 사실 학교만 다니면 시간이 남으니까 이런 클럽 활동을 많이 하면서 배우는 것이 굉장히 도움도 많이 되고 역동적이다. 특히 쿠킹 클래스가 인기가 많은 편이었다.","그렇게까지 큰 문화 충격은 없었던 것 같다. 뉴질랜드 자체가 워낙 인종이 다양하고, 특히나 유학생들이나 각 지역에서 온 대학생들이 많기 때문에 다양성을 존중하는 분위기이다. 가끔 느꼈던 문화충격으로는 파티의 규모나 빈도 때문이 컸다. 대학생들끼리 모여 살아서 그런지 파티가 street마다 시도 때도 없이 많고 정말 한 번 시작하면 끝날 줄 모른다. 그리고 street에서 밤늦게 소리지르고 뛰어다니는 애들도 많다. 한 번은 학교에서 주최한 굉장히 큰 축제가 있었는데 street를 몇 백명의 학생들이 꽉 채워서 길가에 경찰차와 앰불런스가 대기하고 있었던 적도 있었다. 물론 위험한 일이 벌어지진 않았는데 우리나라의 축제 문화와도 약간 차이가 있었다.","전반적인 교환학생 생활이나 학교 수업에 관한 문의는 international office에서 다 받아주고 도움도 받을 수 있다. 학교 생활하면서 잘 모르겠는 것들은 국제처에서 친절하게 설명해주고 메일로 문의해도 답장도 굉장히 빠르다. 그런데 향수병이나 영어 때문에 스트레스가 생기거나 울적한 감정적인 부분들까진 도움을 주지 못한다. 캠퍼스 가까이에 student health center라는 대학생 병원이 있어서 언제든지 건강 상의 문제를 도움 받을 수 있다. 
한인 학생들도 많이 만날 수 있는데, 학교 내에도 한인 동아리가 있고 캠퍼스와 한 블록 차이나는 곳에 한인 교회가 있다. 외국 생활에서 외롭고 힘들 때 도움을 많이 받을 수 있고, 오타고가 교환학생 수가 많지 않은 만큼(본인은 혼자 파견되었었다.) 한인 친구들과도 많이 친해질 수 있었고 좋았다.",오타고대학교나 더니든 생활에 관해서 기타 궁금한 점들은 passme0@naver.com로 메일하시면 답변 드릴게요^^
