gen_info,env_info,food_info,study_info,office_info,facil_info,mhct_info,help_info,etc_info
"교환대학의 크기: 꽤 크고, 과/수업마다 빌딩이 다릅니다. Clock tower을 중심으로 캠퍼스가 이뤄져있습니다. 위치: 뉴질랜드의 남섬중에서도 동쪽의 더니든에 위치. 기후: 한국과 반대이며 2-등 6월은 여름에서 가을정도의 계절. 가을이 될 수록 비가 많이 오지만 다들 거의 다 맞고 다닙니다. 낮과 밤의 온도차가 심해서 낮에는 나시/티를 입다가 밤에는 패딩을 입기도 합니다. 목도리/장갑 까지는 필요 없고 코트나 패딩 하나 정도는 챙겨오시길 추천합니다.","타운 내 갈곳: Botanic garden, Railway, Baldwin st, Otago museum, Public art gallery, Opshops(빈티지 샵들)타운 내 카페: 카페들은 다 2-4시쯤 닫아서 일찍 가는 것이 좋고 커피나 디저트나 음식은 거의 다 팔아요. 추천할 곳들은 morning magpie, the perc care, wolf at the door, vogel st kitchen, heritage coffee, precinct food, vanguard 이고 저녁으로 버거 먹기 좋은 곳은 goodgood이라고 있습니다.차타고 드라이브 갈 곳: 풍경이라면 tunnel beach, signal hill 그리고 (larnach castle, allen beach, sandymount, sandfly bay)입니다. 괄호 친 곳은 서로 가까이 있습니다.","거주 형태: - 1월초부터 6월중순까지 Uniflat에 거주하였고, 총 월세가 약 5000불정도 였습니다. 하지만, 날짜 변경은 안 되니 늦게 들어가더라도 같은 비용을 내야합니다. 저는 3월달쯤에 들어가서 2달어치를 버릴 수 밖에 없었으니 잘 비교해보고 고르세요. - 저와 키위 호스트 포함 6명이서 살았고, 화장실2개와 부엌을 셰어하며 각 방을 사용했습니다. 각 방 자체는 꽤 크고 천장도 높아 괜찮았습니다. 플랫자체는 보통 굉장히 오래되었으나 리모델링해서 나쁘지 않고, 남섬은 특히 바퀴벌레가 없어서 벌레 걱정은 없었습니다. 식사:- 외식은 보통 $25불은 드니, 직접 요리하시길 추천합니다. - Countdown/ Newworld/ Farmer’s Market(토요일만)에서 싸고 좋은 재료들을 살 수 있습니다.","수업: 출석체크는 하지 않고, 시험/과제로 성적을 매깁니다.도서관: 센트롤 도서관이 가장 크고 많이 활용하나, 다른 작은 도서관/열람실들이 타운에 퍼져있으니 확인하고 잘 이용하세요.",국제교육부:저는 딱 두번밖에 갈 일이 없었으나 매번 갈때마다 친절하게 알려주셨습니다.,동아리나 워크샵은 다양하게 있으니 취미에 맞춰 들어가시면 되겠습니다.Tramping club이 가장 활동적이라고 알고 있습니다.,"자연친환경적  - 어떠한 샵이던 비닐봉투 안 쓰고, 종이봉투를 따로 사거나 직접 가방을 들고 가야한다  - 화장실에서는 일회용 핸드타월이 아닌 빨아서 쓰는 롤링타워를 사용한다.  - 자연을 보존하기 위해서 멀리 돌아가는 길이 많다. (드라이브를 하면 느낄 수 있다.) 사람들- 굉장히 친절하고 나서서 도와주려고 한다.- 성평등이 잘 이뤄져 있어서 여자들이 높은 지위에 있는 경우도 많고 남자들도 육아/장보기를 많이 하는 모습을 목격할 수 있다. LGBT에 대해서 완전 오픈하고, 젠더리스 화장실도 있다.캐슬스트리트: -거의 매주말 파티를 하기 때문에 시끄럽고, 술 병을 던지는 사람들도 있다.오픈/클로징 시간:-샵들과 카페는 보통 6-7시에 열고 2-3시에 닫는다.자연:-매일봐도 아름다운 하늘-큰 나무와 참 많은 공원들(누워서 책보기 좋아요)-깨끗한 공기",국제처에 이메일하면 보통 다 해결됩니다.,"혹시나 뉴질랜드의 살 도시를 결정을 하지 못 했다면 오클랜드보다는 더니든을 추천합니다,오클랜드는 한인도 너무 많고, 도시도 시골도 아닌 이도저도 아닌 도시이기 때문에 좀 더 불편하더라도 색다른 더니든을 추천합니다. 더니든 외의 곳들을 여행할 계획이라면 Mt cook, Milford sound, queenstown, Lake Pukaki, Rotorua에 볼 것이 많습니다."
"I went to the University of Otago's main campus located in Dunedin, which is a student town on the South Island of New Zealand. Otago holds the first university ever established in New Zealand. I studied there for the second semester of 2017. Since the seasons are switched around in the lower hemisphere, I experienced the cold icy winter between July and September. The weather gets quite cold on the South Island as it is nearer to the South Pole. The houses in New Zealand do not have a central heating, which was a culture shock to me as it gets very cold. However, there are manual heaters that you could put in your room to bear the cold. The campus in Dunedin is quite beautiful. There are old Scottish buildings and there are modern buildings as well. The campus is quite lively. There are many dormitories, UniFlats, and student houses around the campus. With Spring it got slightly warmer but the temperature can change very quickly throughout the day. Summer was the best as it does not get too hot or cold. If you come here with New Zealand winter, prepare plenty of warm clothing!","Dunedin is quite a small city. It's mostly a student town. Most of the people that live there are students that come from other cities in New Zealand, and the other part are international students that have come here to study. The town has plenty of cafes, restaurants, supermarkets. There are plenty of study places and libraries. There are student activities. A centre where you can attend sports and side hobbies. It feels quite safe.","I was staying in the campus' so-called 'UniFlats.' These are individual houses with 5-6 rooms for exchange students. Usually you live together with other exchange students and 1 or 2 'kiwi-hosts'. I had 2 kiwi hosts, which are people from New Zealand who also study at the university and live with you. Everyone had a private room. You share bathrooms and the kitchens with the housemates.","The libraries are quite amazing, very large, and a large collection as it's the oldest university of New Zealand.",-,"There is a Student Association/Club which hosts many clubs and activities that you can join each semester. Some are about sports, or traveling, or hiking. Some are related to countries, in order to find new friends. Some are free to join, but for most of them you have to pay a small fee. I joined a hiking club and went on a 2 nights trip to the mountains and spent a night in a hut in the beautiful nature of New Zealand. It was very worth it. The Student Association has a building where people can hang out and eat at their cheap cantine.","Some New Zealand people walk barefoot on the streets. I could never do that, and probably will never do that. They even do it in winter! A good culture shock: New Zealand people are the most friendly people I've ever met! They are very welcoming and will always have a conversation with you. It is incredibly safe too. I really liked this atmosphere. I think I can't easily find their kindness elsewhere in the world. A cute culture shock: there are more sheep than humans in New Zealand, you will grow fond of them wherever you go and drive around the country! I also travelled to the North Island. However, I find the people on the South Island a bit more friendly as the North has the bigger cities where more people live their busy lifes together. The South Island is very peaceful, I really enjoyed it.","Like I said, Kiwi people (New Zealand people) are very friendly. They are very keen in helping you, especially if they see you are a newcomer. I could always visit the office or email or call them if I had any questions. Their reply was quick. They really care about you and want to make sure you have a good time over there. To be honest, I find them so much more helpful than Yonsei University at times, and this is just my honest experience with both universities.",-
"University of Otago는 뉴질랜드 최초의 대학으로 남섬 그 중에서도 아래쪽인 Dunedin에 위치해 있습니다. 우리나라와 계절이 반대이며 제가 갔다온 시기는 우리나라는 봄에서 여름으로, 뉴질랜드는 여름~가을~겨울로 변해가는 시기였습니다. 2월에 도착하여 여름임에도 불구하고 저녁에는 파카나 잠바를 입고 다니는 사람을 드물지 않게 볼 수 있을 정도로 날씨가 낮과 밤이 많이 다릅니다. 여름이라고 해도 낮에는 높아야 26도 정도까지 밖에 올라가지 않으며 바람이 많이 불고 밤에는 기온은 그리 낮지 않다고 해도 상당히 춥습니다. 가을, 겨울에는 비가 꽤 많이 오는데 바람이 많이 불어 우산을 쓰기가 쉽지 않습니다. 3단 우산은 바람 때문에 쓰는 것을 추천하지 않고, 우산을 쓰시려면 장우산을 구입하시거나 우비를 입고 다니는 것을 추천합니다. 더니든은 하루에 사계절을 모두 경험할 수 있는 도시라는 말도 있어 여름에 가신다고 해도 두꺼운 패딩과 같은 겨울 옷을 꼭 준비하시기 바랍니다. 오타고 대학교의 크기는 상당히 크지만 과별로 여기저기 건물이 흩어져 있는 것이 특징입니다. 고층 건물로 된 곳도 있고 일반 주택같이 생긴 과사무실, 강의실도 많습니다.","오타고 대학교 주변은 학생들이 살고 있는 Flat이나 기숙사, 그리고 10분 정도 걸어가면 나오는 타운센터로 이루어져 있습니다. 더니든은 서울에 비하면 상당히 작은 대학도시이기 때문에 타운센터는 한 곳입니다. 대학 주변에는 총 3곳의 대형 슈퍼마켓이 있고 비교적 걸을 수 있는 거리에 모두 위치해 있습니다. 더니든 대부분의 가게나 카페 등은 5-6시 이전에 문을 닫기 때문에 우리나라에 익숙해져있는 사람들에게는 조금 불편할지도 모르겠습니다. 하지만 슈퍼마켓은 밤 9시에서 11시까지 여는 곳도 있기 때문에 먹을 것을 사거나 하는 데는 큰 불편이 없을거라 생각합니다. North Dunedin쪽으로 가다보면 Botanic Garden이 있는데 매우 아름답고 산책하기 좋은 곳입니다. 그리고 대학에서 남쪽으로 가면 Dunedin Railway Station과 Octagon, 시청 건물 등등이 나오는데 건물들이 정말 예쁘게 생겼습니다.","1학기 교환학생을 가게 되면 Uniflat Office에서 배정해주는 Uniflat에 다른 나라에서 온 교환학생들, 그리고 1명의 키위호스트와 살게 됩니다. 저는 미국에서 온 4명의 친구들과 1명의 키위호스트, 총 6명이서 한 집에 살았고 우리나라에서 흔히 말하는 쉐어하우스 형태와 가장 유사합니다. 각자 개인방이 있고 부엌, 거실, 화장실 등은 공용으로 사용합니다. 플랫 친구들과 성향이 잘 맞다면 같이 사는 것에 큰 문제가 없겠지만 제 주변 친구들 중에서는 성향이 너무 달라 자주 문제가 생기는 친구들도 보았습니다. 따라서 플랫메이트들을 처음 만났을 때 다같이 모여서 규칙도 정하고 서로에 대해 이야기도 많이 나눠보시길 바랍니다. 저는 화장실 청소, 거실 청소, 주방 청소, 쓰레기 버리기 등등 총 6개로 나누어 6명이서 일주일마다 돌아가며 하였고, 비누, 주방세제, 세제 등과 같은 공용 물품들은 일주일에 얼마씩 돈을 걷어 그 돈으로 구매하였습니다.식사는 대부분 슈퍼마켓에서 사온 재료들로 직접 만들어 먹었습니다. 플랫메이트들의 생일에는 다같이 모여서 요리도 하고 케이크도 만들고 파티를 하기도 하였지만 다른 시간에는 시간이 맞으면 같이 먹고 아니면 각자 만들어 먹었습니다. 학교 주변에 맥도날드, KFC, 도미노피자, 피자헛 등 패스트푸드 점도 있어 편리하게 이용할 수 있고, 학교 건물 내에도 식당이 있어 사먹을 수도 있습니다.","이 곳 학생들은 한 학기에 대부분 3과목, 많으면 4과목을 듣습니다. 저는 3과목을 들었는데 전공 1과목과 고급일본어, 그리고 기초 프랑스어를 수강했습니다. 오타고 대학교는 한 학기당 수강 과목이 적은 대신 과목별로 매주 요구하는 것이 많습니다. 과제가 우리학교에 비해 상당히 많고 언어 수업 같은 경우에는 시험도 자주 봅니다. 우리학교와 가장 크게 다른 점은 수업마다 튜토리얼 시간이 1시간씩 있다는 것인데 튜토리얼 시간에는 수업 때 부족했던 부분이나 몰랐던 부분을 튜터에게 질문하기도 하고, 읽기자료들을 읽어가 토론하고 토론한 것을 보고서로 써내기도 하였습니다. 튜터는 강의교수가 직접 하는 수업도 있고 담당 튜터가 따로 정해져있는 수업도 있었습니다. 평가는 절대평가로 개인의 성취도에 따라서 학점이 정해집니다. 따라서 좋은 성적을 받으려는 분들에게는 매 과제, 퀴즈, 시험 등을 열심히 준비하셔야할 것 같습니다. 학교에서 정해진 시험은 기말고사 1번입니다. 2월 말에 학기가 시작하여 4월 중순에 1주일 정도 방학이 있었고 6월 초에 종강을 합니다. 종강후 3주 정도 기말고사 시험 기간이 따로 정해져 있고 학교에서 시험 시간과 장소는 5월 중으로 알려줍니다. 오타고 대학교에 도서관은 중앙도서관, 과학도서관, 법학도서관 등등 여러개가 있습니다. 가장 큰 중앙 도서관은 공부할 수 있는 공간도 많고, 우리학교와는 다르게 열람실 내에서도 꽤 자유로운 분위기입니다. 음식을 가져와서 먹는 사람들도 있고 조용히 수다를 떠는 학생들도 꽤 많습니다. 도서관 내엔 인쇄실과 ID카드 오피스, 인포메이션 등 도움을 받을 수 있는 공간이 많이 있습니다.","오타고 대학교 국제처 사무실은 Clock Tower 옆에 위치해 있습니다. 여기서는 교환학생들을 위한 오리엔테이션, 학교 투어 등등을 진행하는데 오리엔테이션에서는 여권과 비자 확인, 학교 생활에 대한 전반적인 안내를 들을 수 있습니다. 큰 문제가 생기지 않는 이상 국제처에 들를 일은 별로 없었지만 모두 친절하고 교환학생에 대해 배려를 많이 해주셨습니다.","학교에는 OUSA라는 우리나라의 학생회와 비슷한 건물이 있고 그 건물 안에서는 각종 활동을 할 수 있습니다. 저렴한 비용으로 음악, 운동, 미술 등등을 신청하여 배울 수도 있고, 춤 연습실, 음악실 등이 여러개 있어 사용하고 싶을 때 예약하여 사용할 수 있습니다. 평일 점심에는 2달러 런치를 하기도 하는데 싼 가격으로 점심을 해결할 수 있지만 맛은 그렇게 있는 편은 아닙니다.럭비스타디움 앞에는 Unipol이라는 체육관과 Otago Foundation Center가 있습니다. 유니폴에는 헬스장을 무료로 이용할 수 있고, 돈을 내고 등록을 하면 그룹피트니스 수업에도 참여할 수 있는데 저렴하게 운동을 배울 수 있어 좋은 것 같습니다. 그룹 피트니스에는 스피닝, 복싱, 코어운동, 스텝핏, 요가 등 다양한 수업이 있으니 참고하시면 좋을 것 같습니다. Otago Foundation Center에는 영어를 배우러 온 외국학생들이 많습니다. 처음 도착했을 때 비영어권 국가에서 온 교환학생들을 위한 Prepare for Otago 코스를 2주 정도 들었는데 여기서 유럽, 일본, 중국 등등 각지에서 온 좋은 친구들을 많이 사귈 수 있었습니다. 또한 여기서는 가끔 밀포드 사운드, 퀸즈타운 등 1박2일로 여행을 데리고 가주기도 합니다. 이곳 센터 학생들을 대상으로 한 여행이지만 가끔 자리가 남으면 유니플랫 페이지에 올라오기도 하니 잘 참고하시면 혼자 가는 것보다 저렴하게 여행을 다녀올 수 있습니다.학기 시작 첫주엔 오리엔테이션 위크라고 해서 동아리 박람회 등 학교에서 행사를 많이 하니 여기서 잘 찾아보시고 동아리를 들어가셔도 좋을 것 같습니다.",1학기를 살면서 큰 컬쳐쇼크는 없었지만 목요일 밤부터 일요일까지는 파티를 여는 플랫들이 많아 음악을 크게 틀고 술을 마시며 소리지르는 사람들이 꽤 있어 시끄럽고 불편한 적이 조금 있습니다. Castle Street는 파티 스트리트라는 별명이 붙어 그 곳은 거의 매일 파티가 열리는 것 같습니다.,"저는 같이 살았던 키위호스트 친구에게 가장 많은 도움을 받았습니다. 모르는 것이 있으면 키위 호스트에게 물어보면 대부분 잘 알려주고 해결이 되는 것 같습니다. 플랫에 문제가 있다면 Uniflat Office에서도 도움을 받을 수 있고, 국제처에서도 도움을 받을 수 있습니다. 밤늦게 도서관에서 공부하고 귀가하는 것이 조금 걱정된다면 campus Watch 분들이 집에 데려다 주시기도 하니 번호를 저장해놓고 있으시면 도움이 될 것 같습니다.","저는 이곳에 살면서 하늘 바라보는 것이 가장 좋았습니다. 새벽에 창문을 열면 해가 뜨기 전 분홍색과 하늘색이 어우러진 하늘이 보이고, 낮에는 정말 높고 푸르른, 하얀 구름이 있는 하늘이 보이고, 밤에는 서울에서는 볼 수 없는 별이 쏟아지는 밤하늘을 볼 수 있습니다. 복잡한 도시를 떠나 여유가 가득한 아름다운 자연 속에서 한 학기를 보내보시는 것을 꼭 추천합니다."
