gen_info,env_info,food_info,study_info,office_info,facil_info,mhct_info,help_info,etc_info
제가 다녀왔던 캔터버리 대학은 뉴질랜드 남섬의 최대 도시인 크라이스트 처치에 있습니다. 저는 2월에 이 학교로 교환학생을 오게 되었는데 날씨는 더웠지만 한국의 여름처럼 숨막히는 더위는 아닙니다. 여름에서 겨울로 넘어가는 계절에 학교를 다니는 것이어서 짧은 옷보다는 긴 팔 옷을 어느 정도 준비해가는 것이 좋을 것 같습니다. 가벼운 패딩 하나 정도 챙겨갔는데 학기가 끝날 때쯤 유용하게 잘 입었습니다. 볕에 있을 때는 덥게 느껴질 수 있지만 볕이 들지 않는 곳은 서늘하다고 느낄 정도 입니다. 뉴질랜드는 정말 비가 자주 와서 마른 하늘에도 비오는 경우도 있습니다. 하지만 대부분 흩날리는 비?여서 우산을 써도 소용이 잘 없습니다. 대부분의 사람들은 그냥 비를 맞고 다닙니다. 캠퍼스의 크기는 연세대와 비슷하거나 조금 작습니다. 캠퍼스 안에 잔디밭이 많아서 삼삼오오 학생끼리 모여 앉아 이야기를 나누는데 굉장히 여유롭고 평화로운 분위기를 자아냅니다.,"학교 주변은 대부분 기숙사나 주택가로 이루어져 있습니다. 그 지역에서 가장 높은 건물이 대학교 도서관 건물일 정도로 학교 도서관 맨 윗층에서 주변을 돌아보면 주택과 나무들뿐입니다. 주변에 번화한 지역은 리카튼이라는 곳에 많은 상점들이 모여있습니다. 그 곳에는 웨스트필드라는 대형쇼핑몰이 있어서 그 안에 영화관, 옷가게, 커피샵 등이 즐비해있습니다. 그 쇼핑몰 주변으로 한국 식품점(코스코), 음식점, 한국인이 운영하는 미용실도 있어서 생활하는데 크게 불편은 없습니다. 기숙사에서 걸어서는 30분 정도 버스타고는 10분 안에 갈 수 있습니다. 사실 저는 이 곳은 너무 멀어서 한국음식 살 때만 2주일에 한 번정도 갔습니다. 대신 기숙사 근처에 우리나라로 치면 이마트 같은 곳이 있어서 그곳을 많이 이용했습니다. 기숙사에서 나와 큰 길을 건너면 있는 뉴월드라는 곳과 큰 길을 따라 쭉 내려가다 보면 있는 대형 몰 안에 카운트 다운이라는 마켓이 있습니다. 뉴월드는 상대적으로 가격이 비싼 편이라 저는 주로 카운트 다운을 이용했습니다. 그 몰 안에는 카운트 다운 뿐 아니라 음식점과 우체국 등 다양한 편의시설이 있습니다. 재미있는 것은 카운트 다운에서 장을 보고 그 카트를 그대로 기숙사까지 끌고 오는 사람들과 기숙사 곳곳에 카트가 그대로 방치되어 있는 것을 볼 수 있습니다. 아침에 카운트다운 직원이 와서 그 카트들을 수거해가곤 하기 때문에 장을 많이 봐서 무겁다면 카트 그대로 끌고 와도 상관없습니다.","저는 아일람이라는 기숙사에서 생활했습니다. 대략 한 학기에 400만원정도 낸 것 같습니다. 이 기숙사는 밀 플랜이 포함되어 있지 않은 기숙사이기 때문에 급식을 먹고 싶다면 신청할 수는 있지만 다른 기숙사에 있는 식당에서 먹어야 하는 번거로움이 있습니다. 저는 그냥 제가 직접 요리해서 음식을 먹었기 때문에 이 부분은 정확히 잘 모르겠습니다. 전자레인지, 가스렌지, 식기도구 다 구비되어있었습니다. 그리고 밥을 해먹는 경우에는 전기밥솥이 마트 같은 곳에 가면 30불정도로 싸게 살 수 있어서 밥도 쉽게 해먹을 수 있었습니다. 이 곳은 기숙사기는 하지만 일반 아파트 같은 형태라고 생각하시면 됩니다. 저 같은 경우 집에 거실과 부엌은 공유하고 방은 다섯 개가 있어서 다섯 명이서 각 방을 쓰며 생활했습니다. 저는 참고로 스웨덴, 미국, 중국 친구와 함께 생활하였습니다.일단 외국인 친구들과 같이 살기 때문에 아무래도 외국어를 하면서 친해질 기회가 많습니다. 저는 룸메이트들보다는 한국어를 배우는 프랑스 친구를 만나 한국어를 영어로 가르쳐주면서 많이 친해졌던 것 같습니다.  매 주 청소부가 와서 거실이나 화장실을 청소해줍니다. 그래서 비교적 깔끔하게 유지가 되는 편입니다. 방도 넓고 깔끔해서 사용하는 데 나쁘지 않았습니다. 룸메이트에 따라 그 집 분분위기 다른 것 같습니다. 어느 집은 매주 파티를 열어서 정말 시끄럽기도 한 반면에 어느 집은 서로 교류도 없이 각자 방에서만 지내기도 합니다. 빨래방은 다른 건물 1층에 있어서 2달러씩 내고 세탁기와 건조기를 이용할 수 있습니다. 아일람 오피스라는 곳은 처음 기숙사에 갔을 때 키를 받거나 또는 다양한 문제들이 발생했을 때 찾아가서 해결할 수 있는 곳입니다. 모든 우편물은 그곳에서 수령할 수 있습니다. 이 오피스에서 다양한 행사들을 아일람 기숙사를 사용하는 학생들을 위해 제공합니다. 럭비경기를 반값에 판매하기도 하고 시험 때는 무료로 파이를 나눠주기도 합니다. 다양한 행사들에 참여하면 더욱 많은 친구들을 사귈 수 있는 것 같습니다.",일반적으로 수업을 4개 정도 듣는 것 같습니다. 우리나라처럼 6개를 듣는 학생은 잘 없는 것 같습니다. 일단 수강신청은 자기가 듣고 싶은 수업을 인터넷을 제출한 후 그 서류를 가지고서 등록하는 날에 등록절차에 따라 하면 학생증과 함께 받을 수 있습니다. 한국과 같은 수강신청 전쟁은 없습니다. 특이한 점은 수업시간이 겹치는 것이 있더라도 둘 다 수강신청을 할 수 있습니다. 수업은 일단 주에 두 시간 수업과 한 시간 튜터링으로 되어있는데 튜터링은 수업듣는 인원을 나누어 이전 수업시간에 배웠던 내용을 토론하거나 질문을 받는 시간입니다. 소규모이기 때문에 아무래도 영어로 자기의견을 말해야 하는 때가 자주 생깁니다. 참고로 모든 수업에서 출석체크는 하지 않기 때문에 수업에 빠져도 크게 상관은 없습니다. 또한 모든 강의는 동영상 또는 음성파일로 와이섹 같은 곳에 업로드 해주기 때문에 걱정하지 않아도 됩니다. 뉴질랜드는 우리나라에 비하면 정말 널럴한 수업체계를 가졌습니다. 출석체크 하는 교수님들도 없어서 학기말이 되면 절반정도만 출석합니다. 대부분 강의가 동영상으로 녹화되어 와이섹과 같은 사이트에 업로드 해줍니다. 모든 수업은 절대평가 입니다. 저 같은 경우 경제학과 수업을 2개 들었는데 시험시간이 무려 3시간이었습니다. 천천히 생각하면서 시험을 볼 수 있는 시스템은 꽤 인상적이었습니다. 중앙도서관의 경우에는 24시간 운영하지 않고 평일에는 거의 10시까지만 열립니다. 밤샘공부를 하고 싶다면 24시간 개방되어 있는 공대건물로 가서 공부할 수 있습니다.,교환학생생활을 하면서 이용해 본 적이 없습니다.,"체육관에 학생증을 들고가서 등록을 하게 되면 무료로 이용할 수 있습니다. 저는 그냥 웨이트 트레이닝만 했지만 체육관에는 학생들이 이용할 수 있는 다양한 프로그램이 있어서 여학생들이 요가나 에어로빅 같은 프로그램을 많이 이용한 것 같습니다. 동아리 같은 경우 저는 우연히 알게 된 한국인 유학생을 통해 한인 동아리에 들어갔습니다. 열심히 활동하지는 않고 이 동아리를 통해 알게 된 친구들로부터 이 지역 정보들을 많이 얻었습니다. 
보험 같은 경우 저는 가기 전에 여행자 보험을 신청하고 갔었는데 소용이 없었습니다. 어차피 학교에 가면 수강 등록하는 날에 보험 여부도 확인하는데 보험이 보상하는 범위가 달라서 결국 학교 의료 보험을 다시 신청했습니다. 따라서 보험은 그냥 학교에서 등록하는 것을 추천합니다. 비용은 400달러정도 했던 것으로 기억합니다.","참고로 뉴질랜드 인터넷 이용요금이 비쌉니다. 몇 기가바이트를 사서 그 용량 안에서 인터넷을 사용하는 시스템인데 30기가에 80달러씩이나 했던 것 같습니다. 그 사용기간도 구입한지 2달 이내로 제한되어 있습니다. 학교에서 쓰는 인터넷도 돈을 지불하고 쓰는 건데 매달 2기가를 무료로 주고 그 이상을 쓸 때는 학생증에 돈을 충전한 뒤 사용해야 합니다.
버스를 타고 내릴 때 대부분 버스 기사에게 고맙다는 인사를 하면서 내립니다. 사람들이 대부분 여유가 있고 친절합니다. 늦은 시각 집에 혼자 걸어가고 있었는데 시내버스가 제 옆으로 서더니 제 집 앞까지 데려다 준 적도 있습니다. 
가끔 사람들을 보면 맨발로 돌아다니곤 합니다. 처음에는 이상하지만 나중에는 적응이 됩니다. 길거리가 굉장히 깨끗하고 쓰레기도 없어서 맨발로 돌아다녀도 안전할 것 같다는 생각이 들었습니다.
취미를 가지고 있지 않으면 사실 굉장히 심심합니다. 8시 이후에는 밖에 돌아다니는 사람을 보기도 힘든 것 같습니다. 그래서 그런지 모든 가게들도 일찍 문을 닫아 주말을 제외하고는 밤에 야식을 먹으러 간다거나 술을 마시러 가는 것은 거의 불가능합니다.",넷질랜드 사이트나 온라인 커뮤니티 또는 한인 성당도 있어서 한국인들을 만나서 도움을 요청하는 것이 좋을 것 같습니다. 한국인 유학생들도 있기 때문에 혹시 알 수 있는 기회가 있다면 친해지는 것도 적응하는 데 유용합니다.,"저는 학기가 끝나고 뉴질랜드에 남아 워킹홀리데이를 하였습니다. 혹시 뉴질랜드에 더 남아 있고 싶은 생각이 있다면 워홀은 하나의 좋은 방법이 될 수 있습니다. 워킹홀리데이는 4월 중순에 신청하기 때문에 이 때에 맞춰서 서류를 준비해야 합니다. 한국도 아닌데 혼자 준비를 할 수 있을까 걱정을 많이 했지만 결국 혼자 모든 준비를 다 할 수 있었습니다. 워홀에 필요한 가장 중요한 서류로는 신체검사자료가 필요한데 리카튼몰 근처 병원에 가서 신체검사 받으러 왔다고 하면 알아서 설명해주고 예약을 잡아줍니다. 그 신체검사자료를 받아 우편으로 뉴질랜드 이민성에 보내면 됩니다. 신체검사비용은 400달러 정도 였던 것 같습니다. 한국보다는 아무래도 비쌉니다. 워홀하면서 여행도 많이 다니고 친구들도 많이 사귀었습니다. 스시집에서도 일해보고 또 운이 좋게도 뉴질랜드 엘지전자에서 인턴생활도 할 수 있었습니다. 교환학생보다 더 많은 것을 보고 배울 수 있는 좋은 기회니까 관심갖고 한번쯤 도전해보시기를 바랍니다.

salfredo@naver.com 으로 궁금한 것 있으면 연락주세요"
"뉴질랜드는 북섬과 남섬으로 나눠지는데, 제가 다녀왔던 Christchurch는 남쪽에 위치하고 있습니다. 우리나라와 남북의 성질과 계절이 반대여서, 한국의 봄학기에 파견을 갔던 저는 반대로 여름에서 겨울로 가는 시점에 파견을 떠났습니다. 뉴질랜드 하면 따뜻한 나라라고 생각하기 쉬운데 크라이스트처치는 겨울에 생각보다 많이 추웠습니다. 파견가실 때 곡 겨울옷들도 챙겨가시기 바랍니다.
뉴질랜드는 정말 비가 자주 옵니다. 툭~ 하면 비오고, 툭~ 하면 엄청난 바람이 불고 하늘은 맑지만 참 변덕스러운 기후를 가진 나라입니다. 그러므로 파견 가실 때 우산이나 우비 같은 것 챙겨가시면 많은 도움이 되실겁니다.
교환대학의 크기는 연세대와 비슷합니다. 학교가 평지에 위치해서 스케이트보드나 자전거로 이동하는 사람들이 많이 있습니다. 종합관이나 상대에 올라가는 고통을 여기서는 느끼실 필요가 없습니다^^ 날씨가 좋은 날에는 잔디밭에 사람들이 모여 앉아서 일광욕도 하고 이런저런 얘기를 하기도 합니다. 우리나라에 비해 많이 여유로운 게 사실입니다.
아마 뉴질랜드 지원하시는 분들은 대자연을 느끼고 스카이다이빙이나 번지점프 등 익사이팅 스포츠를 즐기며 리프레시를 하고 싶으셔서 지원하시는 경우가 많을텐데, 생각대로 그런 활동을 하기에는 최적의 장소입니다.","크라이스트처치는 뉴질랜드에서 3번째로 큰, 그리고 남섬에서 가장 큰 도시입니다. 뉴질랜드 영토가 우리나라의 2배정도 되는 반면 인구는 500만명밖에 되지 않기 때문에 3번째로 큰 도시라고 해도 인구가 30만명 정도밖에 되지 않습니다^^;;; 뉴질랜드의 가장 큰 도시인 북섬의 오클랜드도 150만명밖에 안되니까요. 크라이스트는 크게 City와 그 주변의 지역들로 구분돼있는데, City가 지진으로 인해 많이 망가져서 최근에는 UC(University of Canterbury)가 있는 리카튼 근처에서 많이들 놉니다. 주변에 Church Corner나 리카튼 몰, 혹은 City에 나가면 작은 식당들이 많이 있습니다.
뉴질랜드는 적극적으로 이민오는 것을 장려하고 있어서 다양한 인종이 뉴질랜드에 모여 삽니다. 특히 중국인이 정말 많습니다. 학교에서 중국인들이 주로 재무나 회계 수업을 듣는데, 재무나 회계 시험 전날에 도서관에 있으면 여기가 중국인지 뉴질랜드인지 헷갈릴 정도입니다. 그 외에 다른 아시아계 학생들도 많이 있습니다.
대부분의 물품은 학교 기숙사인 아일람에서 학교 반대쪽 방향에 위치한 New World라는 대형 마트에서 구매하실 수 있습니다. 물품이 없거나 크기가 작다면 버스를 타고 5분정도, 혹은 걸어서 30분 정도 가셔서 리카튼 몰에 방문하시면 됩니다. 우리나라 백화점보다는 작지만 그래도 나름 왠만한 가게들이 모두 모여있습니다. 리카튼 몰에 Pak n Save라는 대형마트가 있는데, 왠만한 물품은 여기가 가장 쌉니다. 혹은 Church Corner에 있는 Countdown 이라는 대형마트를 가셔도 됩니다.
그 외에 Google Maps에 검색해보시면 Kosco(철자가 정확한지 모르겠습니다)가 있는데, 대표적인 한인 마트입니다. 한국보다는 조금 비싸지만, 그래도 왠만한 한국 식품이나 공산품을 모두 구하실 수 있습니다. 리카튼 몰 맞은 편, Ilam 뒤쪽에 있었던 걸로 기억합니다.","UC의 기숙사비가 너무 비싸서(4500불 정도 됐던 것으로 기억합니다. 나중에 300불을 돌려주기는 합니다) 저는 Netzealand.com이라는 사이트의 벼룩시장을 이용해 Flat을 구해 생활했습니다. 플랫은 우리나라 하숙집 개념으로, 큰 집에 방 하나를 빌려 생활하고 주방과 화장실 등을 공유합니다. 제 교환학생 예산이 비행기값 포함 700만원 정도로 정말 타이트했기 때문에 플랫에서 생활했습니다. 저와 같은 분들을 위해 플랫 생활에 몇가지 팁을 말씀드리겠습니다.

1. 한국인 주인이 운영하셔도 외국인들이 함께 사는 플랫이 많습니다. 이러한 플랫에 들어가시면 외국인 Flat mate들과 이야기하며 영어공부에도 도움이 되고, 혹여나 문제상황이 발생했을 때 주인 아주머니께 여쭤보기도 편합니다. Netzeland에서 잘 알아보시면 괜찮은 곳 찾으실 수 있으실 겁니다. 제가 플랫에 살면서 가장 걱정했던 점도 기숙사에 살며 외국인 친구들을 못만나게 되는 것이었는데, 옆방에 영국인-한국인 커플이 살아서 그 커플하고 매일 술먹고 럭비보고 놀러다니며 재밌게 잘 보냈습니다. 외국인 친구를 만나 영어실력을 쌓는 것은 다 자기 하기 나름인 것 같습니다^^

2. 플랫은 되도록 학교 근처에 얻는 것이 좋습니다. 저는 애매한 거리에 플랫을 얻어서 가끔 버스를 탔는데, 버스 요금이 카드로 2.3불이라 하루 거의 5불씩을 교통비로 날렸습니다. Ilam 근처에 정말 하숙집이 많으니 그 근처로 얻으시면 될 것 같습니다. 참고로, 버스는 하루에 2.3불씩 2번을 내면(즉 하루에 4.6불을 쓰면) 그날은 하루종일 공짜로 버스를 탈 수 있고, 1주일에 10번을 타면 주말에는 공짜로 버스를 탈 수 있습니다.

3. 플랫 가격과 계약조건을 잘 보셔야 합니다. 보통 플랫이 130~150불인데, 150불도 정말 비싼 축이고 잘 찾으면 110불짜리 구한 친구도 봤습니다. 이보다 높은 가격 부르는 플랫은 정말 시설이 좋지 않은 이상 피하는 편이 낫습니다. 계약할 때 잘 살펴보아야 하는 부분은 1) Bond비(계약금, 나중에 돌려줍니다) 2) 지불주기(1주 혹은 2주 입니다) 3) 수도비 및 전기비 입니다. Bond비의 경우 법으로 2주치의 Flat비로 책정되어 있다고 알고 있습니다. 플랫에서 나가실 때 물품 훼손이 없으면 그대로 돌려받고, 아니면 수리비를 제하고 돌려받습니다. 혹시 2주치 이상을 요구하는 분들 중에 가끔 본드비만 받고 다른 지역으로 가시는 분들도 있다고 들었으니 유의하시기 발바니다. 일부 주인 분들은 한달 치 수도비와 전기비를 1/n하기도 하고, 어떤 분들은 Bond비 안에 포함하기도 하는데 웬만한 한국 분들은 bond비 안에 포함하니 참고 하시기 바랍니다. 뉴질랜드는 인터넷이 우리나라처럼 무한으로 쓸 수 있는게 아니라서 어느정도 용량 제한이 있는데, 기숙사의 경우 돈을 주고 용량을 사야 합니다. 한국인 분들께서 하는 플랫은 대부분 800기가 정도 여유로운 용량을 제공하는데, 이것도 플랫의 장점중 하나입니다^^

밥을 제공해주시는 하숙집도 있는데, 돈을 아끼고 싶다면 본인이 직접 하시는 게 나으실 겁니다. 저는 영국인이 샌드위치 만드는 재료랑 소스를 알려줘서 점심을 열심히 싸다녔습니다. 학교에 가도 대부분 학생들이 점심을 싸와서 옹기종기 모여 먹기도 합니다. 가끔 심심할 때에는 한국인 친구들 기숙사에 놀러가서 같이 밥을 해먹기도 했습니다.","뉴질랜드는 우리나라에 비하면 정말 널럴한 수업체계를 가졌습니다. 출석체크 하는 교수님들도 없어서 학기말이 되면 절반정도만 출석합니다. 대부분 강의가 동영상으로 녹화되어 우리나라의 와이섹과 비슷한 learn.canterbury.ac.nz에 올라오기 때문에 이를 보고 공부하는 학생들이 많습니다.
수업은 절대평가지만 F맞기가 정말 쉽습니다 ^.^ 교환학생 학점 인정제도가 바뀌었다고 들었는데, 제가 갈 때 까지만 해도 F는 인정을 받지 못했기 때문에 정말 열심히 공부를 했습니다. 수업에 옆자리에 앉아있던 외국인 친구에게 먼저 말을 걸어서 같이 과제도 하고 공부하며 친구가 됐는데, 이 친구덕에 무사히 코스를 끝낼 수 있었습니다.
뉴질래&#45719; 수업은 특이하게 튜터링이 정말 많습니다. 컴퓨터 실습이나 과제를 하기 위한 조교분들의 지원이 대부분인데, 사실 안가셔도 크게 상관이 있지는 않습니다. 하지만 수업을 잘 따라가고 친구들 사귀는 데에는 튜터링 가시는 것도 나쁘지 않습니다.
도서관은 시험기간이 돼도 절대 다 차지 않습니다. 우리나라처럼 자리를 맡아야 하는 걱정은 안하셔도 됩니다. Canterbury 지역에서 가장 높은 건물이 UC의 도서관입니다. 10층에 올라가셔서 전망을 한번 보시는 것도 괜찮습니다.","UC는 솔직히 국제교육부 역할이 매우 제한적입니다. 교환학생 생활을 하면서 그닥 도움을 받은 기억이 없습니다. 대신 한국인 동아리가 있는데, 여기에 가시면 생활에 필요한 도움을 많이 받으실 수 있으실 겁니다.","우리나라의 학생회관이 특이하게 중앙도서관 1층과 지하1층에 모두 있습니다. 여기에 식당, 우체국, 약국, 복사실 등이 모두 위치합니다. 도서관 바로 옆에 Book store가 있는데 여기에서 필기류와 책을 구입하실 수 있습니다. 뉴질랜드 교과서는 한권 기본 100달러(우리나라 돈으로 9만원)으로 매우 비싸서 저는 책을 사지는 않았습니다. 대신 도서관에서 3시간이나 1일, 3일 단위로 교과서를 빌릴 수 있습니다. 학교 복사기가 스캐너 역할도 하는데, 저는 교과서를 필요한 만큼씩만 복사해서 컴퓨터로 보며 공부했습니다. 30페이지 (15장) 스캔하는데 보통 5분정도밖에 걸리지 않습니다. 참고로, 저작권 문제로 15번까지만 스캔이 가능합니다. 이보다 많이 스캔하시면 메일로 전송이 되지 않습니다.","뉴질랜드는 영국연방의 일원으로 스스로를 유로피안이라고 생각하는 경향이 강합니다. 럭비가 가장 유명한 스포츠이고, 길가다 눈이 마주치면 누구나 Hi, 혹은 Hey~ 인사할 정도로 다른 사람들에게 친절하고 개방적인 나라입니다. 뉴질랜드인들을 Kiwi라고 부르는데, 뉴질랜드를 상징하는 새가 Kiwi이기 때문입니다. 인종차별을 경험한 적도 없고, 문화적으로 개방돼 있어 매우 좋았습니다.
다만, 전통 거주민인 마오리족 중에 노숙자 분들이 좀 있는데, 이 분들이 오히려 아시아 인들을 많이 무시한다는 이야기를 들은 적이 있습니다. 이런 분들을 보시면 잽싸게 도망가시면 됩니다^.^
뉴질랜드는 7시만 돼도 다들 집에 들어가는 분위기라 거리가 정말 썰렁합니다. 기숙사나 플랫에서 또래 친구들을 만든다면 방과후 생활을 좀 더 재밌게 하실 수 있으실 것입니다.",학교에서 기본적으로 제공하는 서비스 외에 한국인 동아리에 들어가신다면 많은 도움을 받으실 수 있으실 겁니다.,제 메일주소는 Oh.JongR@gmail.com 입니다. 도움이 필요하신 분은 언제든 메일 주십시오.
