gen_info,env_info,food_info,study_info,office_info,facil_info,mhct_info,help_info,etc_info
"싱가포르는 지리적으로 동남아시아의 중심에 위치하고 있으며, SMU는 싱가포르의 가장 핵심적인 위치에 위치하고 있습니다. 값비싼 곳에 캠퍼스가 위치하고 있기 때문에, NUS나 NTU같이 외곽에 위치한 학교처럼 넓은 캠퍼스를 갖진 않았습니다. 그러나 최신식 설비와 시설로 학교 생활에 필요한 모든 설비를 다 갖추고 있으며 싱가포르의 주변 중심지로의 접근성이 매우 수월합니다. 싱가포르의 기후는 적도부근에 위치하여 항상 더운 나라이지만, 한국의 여름처럼 습하지는 않아서 상대적으로 덜 짜증나는 기후입니다. 비가 자주오는 스콜성 기후이지만, 건물들이 전반적으로 지하철과 지하시설을 통해 비를 맞지 않고도 이동할 수 있게 되어있어서 매우 편리합니다.","위에서 말한 것과 같이 중심지에 위치하고 있기 때문에, 싱가포르의 어떤 유명지를 가더라도 15분 이내에 이동이 가능합니다. 해가 지고 나서는 도보로도 싱가포르의 유명한 관광지인 마리나베이샌드까지도 이동이 가능합니다.","SMU는 학교에서 지은 기숙사는 없고 학교근처에 호스텔을 임대하여 관리하는 프린셉 호스텔과, 서쪽 커먼웰스역에 위치한 교환학생들을 위한 커먼웰스 호스텔이 있습니다. 저는 가기전 학교에서 소개하거나 제공해주는 이 두 기숙사가 모두 평이 좋지않다고 들어서, 한국촌홈페이지에서 미리 방을 구하여 룸렌트를 하였습니다. 식사는 학기중 캠퍼스 주변과 지하식당에서 사먹거나, 집에서는 주변 슈퍼마켓에서 장을 봐서 요리해먹기도 하였습니다만, 저렴한 식당들에서 파는 음식들은 매우 저렴하기 때문에 보통은 사먹는것이 더욱 편리합니다.","SMU는 실용적인 교육을 매우 중시하고 가르치는 학교이다 보니, 한국에서 들을 수 없는 좋은 수업들이 많이 열려있습니다. 저는 그런수업들을 수강해보기 위해 이곳을 왔습니다. 2개학기중 첫학기에는 금융관련 과목인 Investment Banking, Hedge Funds, International Finance, Analysis of Equity Investment을 수강하였고 두번째 학기에는 M&A, Maritime Economics and Shipping Finance, Trade Finance와 같은 과목들을 수강하면서, SMU에 잘갖춰져 있는 국제무역프로그램(International Trading Institute)관련 비학점 과목들을 수강하였습니다. 투자은행,인수합병,헤지펀드와 같은 과목들은 실제 Industry에서 경험이 있는 펀드매니저, 투자은행가 출신 사람들이 가르치기 때문에 실제 industry에 대한 insight를 갖출 수 있는 좋은 경험이라고 생각합니다. 또한 제가 참여하였던 국제무역프로그램은 싱가포르가 국제적인 무역허브인점을 감안하여 학교에서 적극적으로 추진하고 있는 프로그램으로, 원자재상품과 관련된 무역,트레이딩 관련 교육을 실시하고 있기 때문에 이런쪽으로 관련있으신 분은 더더욱 값진 경험이 될 것 같습니다.","나름대로 학교측에서 교환학생을 위해 많은 행사를 준비하나, 특별한 도움이 필요해서 방문한적이 없기 때문에 잘모르겠습니다. 모르는 점이 있어서 찾아가면 친절히 도와주는 것 같아보였습니다.","저는 사용하지 않았지만, 학교의 스포츠센터가 매우 잘갖추어져 있다고 합니다. 교환학생들도 모두 무료로 이용할 수 있기 때문에, 좋은 시설을 잘 활용할 수 있으면 좋을 것 같습니다.","같은 아시아권 국가에 비슷한 피부색을 가진 사람들이라, 특별한 차이점은 존재하지 않았습니다. 상식적인 수준에서 행동한다면 전혀 문제 없다고 생각합니다.","교내에서는 교환학생및 국제업무를 담당하는 곳이나, 그렇지 않더라도 SMU교환학생이면 SMU학교 관계자들 모두에게 도움을 청하면 도움을 받으실 수 있을 것이라고 생각합니다. 교외로는 싱가포르 연세대학교 동문회가 있습니다. 저도 기회가 맞아 같이 지내던 친구들과 참석하였는데, 모두들 훌륭하신 분들이고 도움을 주실 수 있는 분들이십니다. 기회가 되시면 꼭 참석하셔서 도움도 받고 궁금한점도 많이 물어보시면 좋을 것 같습니다.","한국이 아닌 해외에서 자신의 꿈을 이루고 싶으신 적극적인 분들은 싱가포르가 아주 좋은 나라이고, SMU가 좋은 발판이 되는 좋은 경험이 될 것이라고 생각합니다. 모든 것은 본인이 찾아서 하기 나름인 것 같습니다. 더 궁금한점은 kira6409@naver.com 으로 문의 주시면 자세히 알려드리도록 하겠습니다."
"도심 한복판에 위치하고 있는 SMU는 총 5-6개의 건물이 녹지와 함께 옹기종기 모여있습니다. 캠퍼스 규모로 보면 종합대학이라기 보다는 college라 볼 수 있습니다. Administration building을 제외하고는 모두 concourse로 연결이 되어 있어 강의실 이동시에는 매우 편리합니다. 또한 오차드나 클락키 등 주요 관광지를 모두 도보로 다닐 수 있을 정도로 뛰어난 지리적 이점을 가지고 있습니다. 
싱가폴은 적도부근에 위치하고 있기에 1년 내내 여름날씨를 유지하고 있습니다. 우기와 건기로 나뉘며 10-12월 즈음이 우기라서 이때는 정말 천둥번개를 동반한 폭우가 쏟아지기도 합니다. 하지만 열대기후이다 보니 1-2시간정도로 짧게 소나기가 내리기 때문에 우천시에는 잠시 비를 피한다면 그리 불편하지는 않을 것입니다.  smu는 지하철역과 바로 연결이 되어 있기 때문에 비가 오는 날이면 circle line bras basah역으로 가시는 것을 추천합니다. 
싱가폴은 덥고 습한 날씨로 smu건물을 비롯하여 쇼핑몰 등 실내에서 냉방을 매우 세게 가동을 합니다. Smu로 파견을 나가시는 분들께서는 가디건이나 후드티 등을 꼭 가지고 다니시기를 추천합니다.","SMU 주변에는 지하철 역이 총 4개 Bugis, City Hall, Dhoby Ghaut, Bras basah 역이 존재하고 있어 교통이 매우 편리합니다. 학교 주변에 Singapore National Museum과 Singapore Art Museum은 smu학생증을 보여주면 무료로 입장을 할 수 있어서 실제로 제가 교환학생으로 있는 동안 오르세전을 관람할 수 있었습니다. 
School of Economics and Social Science 건물건너편에는 싱가포르의 다양한 로컬음식을 맛볼 수 있는 코피티암이라는 푸드코트가 있는데, 학기 초에 학생증을 제시하면 코피티암 카드를 발급 받을 수 있습니다.  그 카드로 20% 할인 혜택을 받을 수 있으니 꼭 학기 초에 가셔서 발급받으시길 추천합니다.","저는 첫학기에는 commonwealth hostel에 거주하고, 방학동안은 학교 앞 international students를 위한 기숙사인 prinsep hostel에 운 좋게 살수 있었고, 두번째 학기때는 싱가폴 친구네 집에서 homestay 식으로 거주했었습니다. 우여곡절도 많았고 운도 따랐던 것 같습니다. Commonwealth hostel은 학교에서 지하철로 15분정도 떨어진 곳에 위치한 smu 사설 기숙사입니다. 많은 교환학생들이 그곳에서 거주하기 때문에 친구들을 많이 사귈 수 있는 장점이 있습니다. 저도 물론 가장 친한 룸메이트, 교환학생 친구들을 사귈 수 있었습니다. 하지만 정기적으로 방역을 하는 싱가폴의 다른 지역과 달리 commonwealth쪽은 시행을 자주 하지 않는 것 같아 벌레들도 자주 출몰을 하고 시설도 열악하여 학기가 끝나고 다른 곳으로 옮기게 되었습니다. 기숙사에 사는 경우는 룸메이트나 플랫메이트를 잘 만나는 운도 있어야 한다고 생각합니다. 저는 카자흐스탄 친구와 룸메이트였는데 같이 방콕도 여행가고 타지에서 외로울 때 서로 의지할 수 있었던 친구였습니다. 
여름방학에는 우연한 기회로 prinsep hostel에 거주할 수 있었습니다. 그때 만난 일본인 룸메이트와 외롭지 않은 방학을 보낼 수 있었습니다. 도심 한복판에 위치한 덕분에 저녁에 룸메랑 esplanade, raffles place merlion까지 조깅을 가기도 하고, Clarke quay로 놀러 갈 수도 있었습니다. Commonwealth hostel에 비해서 경비도 좀더 철저하고, 책상도 넓고 청결하고 어둡지도 않아서 매우 좋았습니다. 
두번째 학기에는 prinsep hostel에서 신입생들에게 숙소를 제공해야 했기에 다른 곳으로 이사를 알아보던 중 정말 우연한 기회로 친구네 집에서 homestay를 할 수 있었습니다. 싱가포르 가정집을 직접 경험할 수도 있었고 친구네 가족 분들이 너무나 제가 불편함 없이 편히 지낼 수 있게 해주셔서 좋았습니다.","1년동안 저는 한학기에 4과목씩 총 8과목을 수강하였습니다. 경제과목들은 수업시간에 참여를 많이 유도하지는 않지만 일반적으로 smu수업들이 workloads도 많고 와튼스쿨을 벤치마킹을 했다는 smu의 수업들이 결코 만만하지는 않았습니다. 
Intermediate Microeconomics 이탈리안 massi교수님 수업을 들었는데, smu학생들 내에서도 정말 잘 가르치시지만 어렵고 수학적으로 많이 다뤄서 full-time학생들도 꺼려하는 교수님이라는 것을 수강을 하면서 알게되었습니다. 패션의 종주국 이탈리아답게 매 수업시간 교수님의 패션에 같이 수업듣는 친구들끼리 많은 관심을 가졌던 기억이 있습니다. 지각을 절대로 용납하지 않으시기로 유명한 매우 엄격한 교수님이시지만 수업시간에 joke도 많이 던지시고, 90분 수업시간이 어둡고 암울한 분위기는 아닙니다. 다른 중국인 교수님이 수업도 쉽고, 시험도 매우 평이하다고 하니 미시경제학을 들으실분들은 참고하셨으면 좋겠습니다. 
Economic development in Asia 인도교수님이셨는데, 학기말에 그룹을 나눠서 한 논문에 대해서 분석하고 발표하는 프로젝트도 있었습니다. 이 수업이 제게는 약간 버거웠었는데, 처음으로 듣는 인도 억양이라서 교수님의 강의를 이해하는데 어려움이 매우 컸었습니다. 
Madarin 어학수업답게 수업시간 내내 매우 화기애애 했습니다. 교수님께서 수업시간에 배운 내용들을 계속 반복적으로 언급을 하셔서 수업내용을 따라가는데는 전혀 무리가 없었습니다. 같은 조끼리 활동을 많이 하기 때문에 fulltime친구들과도 정말 많이 친해질 수 있는 기회였습니다. 이때 만났던 친구들 덕분에 1년간 제 교환학생 생활이 좀 더 다채로웠던 것 같습니다. 
Financial accounting  1학년 학생들과 듣는 회계원리수업이었습니다. 경영학과 학생이 아닌 저는 한국에서 매번 듣고싶었는데 치열한 수강신청 문턱을 넘지 못해서 smu와서 이 수업을 수강을 했었습니다. 교수님이 한국인교수님이셔서 수업 시간에 이해가 되지 않았던 부분들을 여쭤보면 친절하게 설명해주셔서 더 좋았습니다. 
Marketing Research  두번째 학기때 들었던 수업중에서 가장 많은 시간을 투자하고 가장 힘들었었지만 또한 가장 많은 것을 얻을 수 있었던 수업이었습니다. CASE STUDY 발표 한번과, 장기 프로젝트 발표와 보고서 작성을 조별활동으로 했었습니다. SPSS라는 통계 프로그램에 대해 배우고 이것을 실제로 프로젝트 준비에 적용해 볼 수 있어서 좋았습니다. 매주 2번씩 조모임을 하다보니 조원 친구들과도 정말 많이 돈독해질 수 있는 기회였고요, 싱가폴을 떠나기 전까지 저에게 많은 추억을 선사해주고 한국에 돌아와서도 종종 연락을 하는 친구들로 남았습니다. 시장조사론 수업을 통해서 얻을 수 있었던 지식 뿐만 아니라 좋은 친구들을 많이 얻어갈 수 있어서 더 좋았던 수업이었습니다. 
International Economics 제가 수강했던 Augustin Tan 교수님과 달리 다른 교수님들은 workloads가 정말 많다고 들었습니다. 조별활동으로는 교수님께서 지정해 주신 8개의 주제를 8개의 조가 각각 한 개씩 맡아서 이에 대해 프레젠테이션을 했었습니다. 제가 들었던 교수님께서는 인자하시고 교환학생들을 정말 많이 배려해주시는 교수님이셨습니다.
Leadership CEO Seminars 일주일에 한번 3시간씩 진행된 수업이었는데, 첫번째 시간에는 그룹발표를 하고, 두번째 시간에는 CEO분께서 오셔서 강연을 해주셨습니다. 와인회사, Capital Land 등 매 수업시간 매우 유익하고 좋은 말씀을 많이 들을 수 있었던 수업이었습니다. 
마지막으로 도서관은 연세대학교 도서관과 달리 많은 서적을 보유하고 있지는 않습니다. 또한 도서관 내에서 원래는 음식물 섭취가 금지가 되어있지만 아무도 제재를 하지 않아서 식사를 하는 학생들도 몇번 보았습니다. 또한 그룹미팅을 도서관에서도 종종 하기 때문에 조용한 곳에서 공부를 원하시는 분들은 quite zone으로 가시는 것이 좋을 것 같습니다. 마지막으로 도서관에 오래있다보면 에어컨 때문에 너무 추울수도 있으니 꼭 두꺼운 외투를 챙겨가시기 바랍니다.","교환학생으로 와 있는 동안 기숙사나, 비자 관련문제로 국제교육팀의 도움을 많이 받았습니다","교내 기타 부대시설로는 Fitness club과 수영장, 그리고 농구코트 등이 있습니다. 교환학생들에게 무료로 개방이 되기 때문에 자주 이용하시기를 추천합니다. 
제가 1년동안 싱가포르에 교환학생으로 있으면서 SMUCC (SMU Chamber Choir)라는 동아리에서 활동을 했습니다. 덕분에 로컬친구들과 많이 친해질 수 있었고, 방학중에는 싱가폴에서 문화, 예술공연들이 행해지는 Esplanade Concert Hall에서 공연을 할 수 있는 기회도 얻을 수 있었습니다. SMU는 음악, 체육활동 CCA가 많이 활성화 되어있습니다. 혹시 관심있는 분들은 학기초 동아리 홍보기간에 가입하셔서 workshop도 나가보시고 다양한 활동을 체험해보시면 좋을 것 같습니다.","싱가포르 친구들이 한국 드라마, 버라이어티쇼, K-Pop등 한국에 대한 관심이 정말 많습니다. 덕분에 한국에서 왔다는 사실만으로도 많은 도움을 받았던 것 같습니다.",Administration Building에 위치해 있는 국제교육부를 통해서 많은 도움을 받을 수 있었습니다.,"싱가포르에서의 1년 교환학생 생활을 하면서 때로는 지루함을 느낄 수도 있습니다. Recess week 등 시간을 잘 활용하여 주변 나라들을 많이 여행 다니실 것을 추천합니다. 저가항공사 시스템이 잘 마련되어 있기 때문에 시기를 잘 맞추면 정말 저렴한 비용으로 말레이시아, 인도네시아, 베트남, 호주까지도 여행을 가실 수 있습니다. 교환학생 생활을 충실하게 보내시는 것도 좋지만 여행과 동아리 활동 등으로 많은 추억을 남기시길 바랍니다."
"다른 두개의 로컬 대학교 NUS와 NTU와는 구분되게 싱가폴의 시내 한 가운데에 위치하여 놀라울 정도의 입지를 자랑합니다. 금융 및 비지니스 중심지인 래플즈 플레이스와, 아름다운 야경을 지닌마리나베이, 클럽과 바들이 모여있는 클락키, 아랍스트리트와 쇼핑의 중심지인 소머셋, 오차드 등지를 버스로 10분이내, 걸어서도 20분 정도면 갈 수 있습니다. 특히 마리나베이나 클락키는 밤에 적적할때 종종 맥주한캔 사들고 가서 야경보기에 운치있습니다. 
캠퍼스 크기는 대여섯개의 건물들이 시내와 경계 없이 운집해있는 형태로 그다지 넓지않아 개인적으로 이동하기가 편리했으며 지하 통로로 모두 연결되어 있어서 비오는 날도 편리하게 이용 할 수 있었습니다. 
날씨는 적도지방의 열대기후로써 우리나라 한여름정도의 기후라고 볼 수 있습니다. 12월부터는 우기가 시작되어 매일같이 한 두시간씩 비가와서 나가기에 불편합니다. 가을학기에 가시는 분은 학기초나 학기중에 많이 돌아다니시는 편이 좋을듯 합니다. 바깥날씨와 다르게 대부분의 건물들 특히 학교, 쇼핑몰은 에어컨이 매우 강하게 운용되어 조금은 춥다고 느낄 정도 입니다. 간절기 옷(가디건, 후디 등)을 준비해 가시는게 좋을 듯 합니다.","상단에서 언급한 것처럼 학교 주변에 래플즈플레이스, 마리나베이, 클락키, 아랍스트리트, 오차드 등 싱가폴 관광 책자를 살펴보신다면 빠짐없이 포함되어 있는 지역들이 포진해있습니다. 저는 학교에서 교환학생들에게 소개해준 커먼웰스 호스텔에서 지냈는데 워낙 변두리지역이고 시설도 좋지 않아 수업이 없는 날에도 주로 학교에서 지냈습니다. 대부분의 로컬친구들과 만나거나 행사등 이 있을 때 학교주변에서 보는 일이 많았기 때문입니다.","저는 학교에서 교환학생들에게 소개시켜준 커먼웰스 호스텔에서 지냈습니다. 외국친구들과 교류할 기회가 많을 듯 하여 신청했는데 시설이 매우 열악했고 학교까지 MRT(싱가폴 지하철)로 사십분여가 소요되었습니다. 비용도 시설이나 입지에 비해 너무 비쌌다고 생각되며. 이번 커먼웰스 거주자들은 서명을 모아 학교에 호스텔에 대한 항의를 보내기도 했습니다. 아마 다음학기부터는 호스텔이 바뀌거나 숙박비용이 인하될 것으로 예상합니다. 
그리고 저는 학교주변에서 ‘공차’라는 밀크티 전문점을 자주 이용했습니다. 개인적으로 밀크티를 매우 좋아해서 매일 한잔 이상씩 마셨는데, 한국에 온 지금도 자주 생각이 납니다. Cityhall역 래플즈시티 지하와 School of Economics 건물 옆에 위치만 Cathay건물 4층에 위치해있으며 Cathay 지점에서는 smu 학생증을 제시하면 5% 할인혜택이 있습니다.","다른 친구들이 들은 경영학과의 같은 경우에는 확연히 프레젠테이션이나 수업 참여의 비중이 높았으나 제가 수강한 경제학, 통계학 강의들의 경우에는 수업의 특성상 그런것이 별로 없고 한국과 비슷한 방식으로 진행되었습니다. 제가 수강한 과목들은 아래와 같습니다.
LABOR ECONOMICS  1회 발표가 있었으며 별로 특이사항은 없었던 것 같습니다. 싱가폴의 현재 노동시장 구조에 대한 실제 데이터들을 많이 사용, 적용한 수업이였습니다.
REAL ANALYSIS 통계전공으로 들은 수업입니다. QF(Quantitative Finance)과목중에 하나인데 수학적 기초가 있으면 매우 유익한 과목들이 많아보였습니다.
PROBABLITY THEOREM AND APPLICATION 통계쪽 기초를 쌓고 싶은 분이라면 추천드립니다. 홍콩 출신 교수님이였는데, 강의 전달력이 좋으시고 특히 수업 자체가 미국계리사 시험(SOA)를 커버할 수 있는 커리큘럼이라 혹시 계리사시험을 준비 중이시거나 관심을 가지고 계시다면 더 유익한 수업이 될 것 같습니다..
MANDARIN 예전 파견보고서에서 로컬친구들과 소통할 기회가 많은 과목이라고 추천하셔서 수강하게되었는데 교수님이 바뀌면서 그룹프로젝트가 사라져서 그런 이점이 없어졌습니다. 또한 난이도가 너무 쉬워서 부담은 없었지만 남은건 별로 없는 것 같습니다. 
 도서관은 우리나라와는 상당히 다른 모습을 가지고 있습니다. 자리마다 칸막이가 있고 소음은 용납이 되지 않는 열람실이 대부분으로 구성된 우리나라와 다르게 그룹 스터디룸이 많고 대부분 의 자리에서 시끄럽지 않게 대화하는 모습을 볼 수 있습니다. 별도로 Queit room으로 지정된 장소에서 소음 없이 공부 하실 수 있습니다.",오리엔테이션 이후로 방문한 적이 없어서 잘 모르겠습니다.,가장 좋은 시설들이라고 한다면 단연 피트니스 센터와 수영장을 꼽을 수 있을 것 같습니다. 특히 피트니스 센터는 운동기구도 다양하게 구비되어있고 시설도 깨끗하며 이용하는 학생들의 헬스트레이닝 수준도 높아서 여러가지로 운동욕구를 향상시킵니다. 수영장은 administration building에 위치하여 있으며 수영장은 넓지 않아도 시설이 좋고 경치가 좋습니다.,다른 사항들은 다른 보고서에 적혀있는 내용들과 대동소이합니다. 사소한 것이지만 제가 개인적으로 가장 신기하게 느꼈던 것은 한국인 외에는 학교에서 도서관에서 양치질 하는 사람이 없는 것이었습니다. 저나 다른 한국 친구들 같은 경우는 식사 후에 양치질을 하는 경우가 많았습니다. 그러나 한국인 외에는 한 번도 학교 내에서 양치질 하는 사람을 보지 못했습니다.,"생활에 필요한 물건이나 도움등은 싱가폴 재 한국교민사이트인 한국촌을 이용해보는것도 나쁘지 않은 것 같습니다. 한번은 핸드폰을 분실한 적이 있는데, 한국촌 사이트에서 매물로 올라온 핸드폰을 비교적 싼 값에 구할 수 있었습니다.","싱가폴에서는 다른 동남아시아권 나라와 마찬가지도 한류의 영향이 무척이나 강합니다. 우리보다 런닝맨 같은 예능프로그램을 더 꾸준히 챙겨보고(학교 내에서 밤새도록 자체적으로 학생들끼리 런닝맨을 하는것도 보았습니다.), K-pop에 대해서도 잘 압니다. 기본적으로 한국에 대한 호기심과 호의를 가지는 친구들이 많아 가까워지기 쉬운 것 같습니다."
