gen_info,env_info,food_info,study_info,office_info,facil_info,mhct_info,help_info,etc_info
"작년 말에 한국을 떠날 때 날씨가 영하 12도였습니다. 이미 익히 들어서 알고 있었지만 도착한 날의 싱가폴은 27도였고, 너무나 후덥지근했습니다. 처음에는 내가 과연 기후 때문에 적도의 나라에서 잘 적응할 수 있을까 생각이 들 정도였습니다. 하지만 제 스스로 이런 우려를 비웃듯이 금새 적응한 것을 보면 신기할 따름입니다. 사실 11월부터 4월까지의 싱가폴은 우기이기 때문에 그나마 온도가 낮은 편이라고 말할 수 있습니다. 이 곳에 오래 사신 분들은 ‘혹한기’ 라고 우스갯소리로 얘기합니다. 평소 낮 기온은 30-34도 정도로 한국의 여름과 비슷합니다. 하지만 거의 모든 실내에선 강력하게 에어컨을 틀어놓고 있기 때문에 걱정하실 필요는 없습니다. 33도의 날씨에 땀을 흘리며 바깥을 돌아다니다 보면, 싱가폴의 패셔니스타들이 바바리코트를 입고 돌아다니는 진풍경도 보실 수 있으실 겁니다. 제가 있는 동안에는 비가 참 많이 내렸는데요, 오면 천둥번개가 무섭게 치고, 강력한 소나기가 내립니다. 그러나 저는 한 학기 동안 우산을 딱 한번 펼쳐보았습니다. 그 만큼 비를 피할 수 있는 지붕들이 많고, 지하공간 문화가 발달이 되어있어서 항상 불편함 없이 외출하실 수 있습니다. 
많은 경험보고서가 이야기 해주듯, SMU는 싱가폴의 중심지에 위치하고 있습니다. 크기는 제 느낌에는 연세대의 1/3 정도란 생각이 듭니다. 또한 SMU를 횡단하는 데에 10여분이 걸립니다. 경영학 특성학교답게 세부 단과대로 6개가 있습니다. 올해가 개교 10주년이었는데요, 덕분에 다양한 행사들을 경험할 수 있었습니다. 나름 신생학교이지만 졸업생들이 굉장히 활약하고 있는 것으로 알고 있고, 실제로 친구들이 취직하는 면면을 살펴보면 화려하다고 볼 수 있습니다.","SMU는 싱가폴 지하철(MRT)의 빨간색 라인인 Dhoby Ghaut역과 City Hall역의 중간에 위치하고 있습니다. 올 4월에 개통한 노란색 라인의 Bras Basah역이 SMU Library와 직접 연결되어 있어서 매우 편리합니다. 제가 떠날 때쯤 완공 되어서 많이 이용하지 못해 아쉬웠습니다. 많이 타보진 않았지만, 버스노선도 다양하게 구성되어 있는 것으로 알고 있습니다. 다음 학기에 오시게 될 분들은 이러한 장점을 충분히 누릴 수 있으리라 생각합니다. 
사실 떠오르고 있는 SMU의 선호도는 지리적인 위치가 굉장히 큰 몫을 차지하고 있습니다. 위치를 굳이 비유하자면 명동이나 강남 한복판에 학교가 있다고 볼 수 있습니다. Orchard &#8211; Somerset &#8211; Dhoby Ghaut &#8211; City Hall &#8211; Raffles City로 이어지는 City Area는 SMU에서 지하철에서 5분, 버스로 10분 이내에 주파 가능합니다. 이곳에서 지낸 모든 교환학생들이 공감하는 SMU위치의 강점은, 싱가폴에 와보시면 절실히 공감하시리라 생각합니다. 멋진 클럽, 바, 다이닝 스폿, 까페, 쇼핑몰, 박물관, 미술관, 국립도서관 등 모든 곳이 10분 이내에 위치해 있다고 해도 과언이 아닙니다. 화려한 도시의 삶을 즐기고 싶다면, 여러분의 의지에 따라 SMU는 최고의 선택이 될 것입니다. 비교를 하자면, NUS와 NTU는 싱가폴의 서쪽 끝에 위치해 있습니다. 택시를 타고 30분이면 시내에 올 수 있지만, SMU학생들이 마실 나가듯 쇼핑하고 클럽에 가는 데에 비해 두 학교의 학생들은 한 달에 한 번 큰 맘을 먹고 시내 외출을 해야 한다는 단점이 있습니다. 친구가 우스갯소리로 위 두 학교는 정글에 있다고 말했는데 실제로 가보니 정말 그리하여서 놀랐던 기억이 있습니다. 그래서 두 학교 학생들이 공부에 전념케 되는지도 모르겠습니다. 물론 SMU학생들 역시 열심히 공부하고, 잘 놀기도 합니다. 흡사 연세대학교와 비슷한 학풍을 지니고 있다고 할 수 있겠습니다. 교환학생으로 보낼 싱가폴의 시간을 충분히 즐길 여러분의 권리는 SMU가 충분히 제공해 줄 것이며, 개인의 의지에 달려있다고 볼 수 있습니다.","SMU교환학생들의 거주형태는 크게 Hostel, HDB, Condo의 3가지로 나뉘는 것 같습니다. 

1. Hostel
: 호스텔은 한국의 기숙사 개념이라고 생각하시면 될 것 같습니다. 이번 학기에 교환학생의 대부분들은 호스텔에서 묵었습니다. SMU는 자체적인 기숙사를 제공하지 않기 때문에 임대의 형식으로 호스텔을 교환학생들에게 제공합니다. Havelock과 Prinsep의 두 종류가 있는데 대부분은 Havelock에 거주하게 됩니다. 가격은 2인실 기준 450-550SGD정도 입니다. 저는 Prinsep에 거주하였습니다. 위치는 Havelock의 경우 학교에서 버스로 15분, MRT로 10분정도에 위치해 있습니다. Prinsep은 학교에서 걸어서 10분거리에 위치합니다. 시설과 위치면에서 Prinsep이 조금 더 깨끗하고 좋습니다만 일정 자격요건이 있습니다. 세부사항이 관심 있으신 분들께선 메일을 보내주시면 답변해 드리겠습니다. 한 학기 살기에 불편함없이 지내실 수 있으리라 생각합니다.

2. HDB
: 싱가폴 정부에선 모든 싱가폴 국민들을 위해서 HDB를 임대 제공하는 것으로 알고 있습니다. 덕분에 집값이 들지 않아 이 나라의 국민들은 양질의 삶을 충분히 누리고 있다고 생각합니다. 이는 우리나라의 복도식 아파트를 생각하면 이해가 빠를 것입니다. 싱가폴 각지에 HDB가 많이 있습니다. 기숙사가 불편한 몇몇 교환학생들은 방을 쉐어하여 렌트해서 지내곤 했습니다. 대략적으로 가격은 위치에 따라 달라지겠지만 한 달 기준 500~800SGD 사이에서 구하면 합리적일 것이라고 생각합니다. 

3. Condo
: 저는 기숙사로 집을 옮기기 전에 콘도에서 2주가량 살았습니다. 사실 콘도미니엄은 근래에 싱가폴에 많이 확산되는 거주유형이라고 볼 수 있습니다. 한국의 좋은 주상복합을 떠올리시면 되는데, 콘도별로 자체적으로 Pool등 다양한 부대시설을 구비하고 있습니다. 깨끗하고, 조용하며, 최신 부대시설을 구비하기 때문에 많은 분들이 선호하고 있습니다만 가격은 조금 센 편입니다. 주로 학교에 인접한 Condo의 경우 스튜디오 렌트의 개념으로 2500-3000SGD를 지불하게 되는데 대부분 이런 경우에 2명정도의 룸메이트를 구해 쉐어하게 됩니다. 한국에서 이주하신 많은 분들이 콘도에 살고 있기 때문에 장기 렌트로서 집을 구하는 것은 어렵지 않을 것이라고 생각합니다. 

싱가폴은 melting pot이라는 말이 굉장히 잘 어울리는 곳입니다. 그만큼 다양한 인종들이 조화롭게 살아가고 있으며, 따라서 수많은 음식들을 경험할 수 있습니다. 이 점이 저에게는 교환학생 라이프의 또 다른 즐거움이었습니다. 동남아의 음식은 특유의 향신료가 들어가기 때문에 거부감이 있으신 분들도 더러 있으시겠지만, 나름대로 외국인들의 입맛에 맞게 현지화 되었기 때문에 식사에 큰 어려움은 없습니다. 실상 중국화교가 이 나라 인구의 70%를 차지하고 있기 때문에 중국음식이 굉장히 많이 발달해 있습니다. 물론 최근 열풍처럼 싱가폴에 불고 있는 한류로 인해, 한국음식점도 많이 있습니다만 그다지 맛은 없습니다. 다양한 음식들을 즐기기에도 시간은 부족하다고 생각합니다. 더군다나 과일이 굉장히 저렴한 편이라서 다양하고 싱싱한 열대과일을 많이 먹을 수 있어서 좋았습니다.
 대체로 SMU학생들은 끼니를 KOFU(학생식당)나 KOPITIAM(School of Information건너편)에서 해결합니다. 이 두 곳은 푸드코트인데 종류도 다양하게 선택할 수 있고, 가격대도 3-5불이면 충분합니다. 실상 물가는 한국과 그다지 차이가 나지 않는 것 같지만, 식비가 그렇게 많이 들지 않아서 부담이 조금 덜해집니다. 그 밖에 다양한 맛집들이 곳곳에 숨어있으니 맛의 즐거움을 많이 발견하시길 바랍니다.","SMU의 수업은 유펜의 와튼스쿨을 그대로 표방하고 있습니다. 실제로 유펜에서 오신 교수분들도 많고, 실력있는 교수진들로 구성되어 있습니다. 거의 모든 수업은 렉쳐식이 아닌, 강도높은 토론식 수업으로 진행합니다. 거의 모든 강의실이 U-shape로 이루어져 있고, GSR이라고 하여 그룹스터디 룸이 굉장히 많습니다. 모든 학생들은 랩탑을 지니고 있고, 실제로 모든 수업에 랩탑을 많이 사용합니다. 학생들이 어떤 랩탑을 들고 다니는지 살펴보는 것만으로도 흥미로울 만큼 다양한 브랜드를 보실 수 있으실 겁니다. 그 만큼 수업시간에 웹서핑, 게임 등 딴짓하는 학생들도 많습니다. 하지만 대부분 학생들이 학점에 굉장히 집착하고, 이를 드러내기 때문에 열심히 하는 분위기입니다. 저로서는 처음에 이 곳에 도착하여 싱글리쉬에 적응하는 것에 힘들었는데다가, 모든 수업이 참여를 많이 요구하여 쉽지 않았습니다. 대체로 교환학생들은 5개의 과목까지 신청할 수 있는데 대부분 3~4개를 듣는 것 같습니다. 저는 5과목을 들었는데, 많이 힘들었지만 지금에 와서는 즐거웠던 시간들이었습니다. 저의 포지션은 공부보다도 많은 친구들을 사귀기에 초점이 맞춰졌기 때문에 모든 수업시간에 저에겐 새롭고 즐거웠던 기억이 납니다. 다만 수없이 반복되는 조모임과 프레젠테이션은 제가 유일하게 싱가폴에 와서 힘든 부분입니다.
 도서관은 연대와 다르게 규모가 작은 편입니다. 학생 수가 많지 않은 것도 그 이유겠지만, 학생들이 도서관 뿐만 아니라 이곳 저곳에서 앉아서 공부합니다. 그리고 Quiet zone이 아닌 다른 곳에서는 마치 까페에서 공부하듯이 어느 정도 잡담을 하면서 공부를 하는데, 한국과 굉장히 다른 분위기 입니다. 도서관은 CCTV가 곳곳에 설치되어 있어서 사실 짐을 많이 놓고 다녔습니다만, 종종 분실사고가 있는 모양이니 주의하시길 바랍니다.","국제처는 Victoria St. 에 있는 Administration빌딩에 가시면 있습니다. 매 학기 전세계적으로 200명 가까운 교환학생을 받기 때문인지, 행사가 다채롭게 잘 꾸며져 있고, 교환학생들을 위해서 최대한의 노력을 다하려는 느낌을 받았습니다. 국제처의 직원들은 전화 한 통, 메일 한 통에도 굉장히 친절하며 특히 교환학생 담당자인 Rehju나 Ketty를 통해서 애로사항 및 생활에 있어 필요하신 부분을 도움 받으실 수 있으실 것입니다.","앞에도 언급했다시피 SMU는 지어 진지 얼마 되지 않은 학교이기 때문에 시설이 최신식입니다. 특히 강의실에서 이 점을 많이 느끼실 수 있으실 것입니다. 그러나 위치가 도심에 있고, 캠퍼스가 넓지는 않은 관계로 운동장은 없습니다. 사실 바깥에서 활동하기엔 날씨는 너무 덥기 때문에 지하의 Concourse라는 곳에서 많은 활동이 이루어집니다. 이 곳에는 매점, 까페, 서점, 문구점, 보드게임과 포켓볼까페, 댄스교습소, 사진스튜디오, GYM 등 다양한 부대시설이 있으며, 실제로 많은 학생들이 지하생활을 즐기고 있습니다. 그리고 모든 지상으로 이어지는 통로는 에스컬레이터가 설치되어 있으며, 심지어 모든 단과대마다 에스컬레이터가 있습니다. 전혀 땀을 흘리지 않고서 이동할 수 있는 편리한 수단이었지만 오히려 운동부족이 걱정되기도 하였습니다.
 이곳에는 동아리(CCA)들이 굉장히 많은데, 실제로 활발하게 운영되고 있는 것으로 보입니다. 수업시간에 만나는 친구들에게 물어보면, 수업시간에 조모임을 통해서 알게 되는 친구들의 경우 한 학기가 끝나면 그들의 이해관계가 정리가 되지만, 진짜 친구관계가 주로 CCA를 통해서 형성된다는 이야기를 들었습니다. 그만큼 이들이 정성을 기울이고, 스트레스로 가득한 학기 중엔 이들에게 어느 정도 해소를 하게 해주는 통로가 되어 주는 것 같습니다. 교환학생 역시 다양한 CCA에 가입할 수 있으며, 주로 week2에 모집을 많이 합니다. 저는 어디에도 가입하지는 않았지만, 몇몇 한국에서 온 교환친구들은 무에타이 동아리에서 활동하기도 했습니다.","이 곳 또한 아시아이기에 겉으로 느껴지는 이질감은 거의 없었습니다. 다만 이 곳이 동남아시아라는 것을 상기시켜주는 것은 말레이계와 인도계가 굉장히 많이 보인다는 사실입니다. 이들에겐 그들만이 공유하는 문화가 있기 때문에 어떤 면에서는 약간의 차이점을 느꼈지만 그것이 컬쳐쇼크까지 이어지진 않았습니다. 다만 싱가폴에서 느꼈던 차이점이 있다면, 남자들이 화장실을 이용함에 있어 변기커버를 올리지 않고 일을 보는 습관들이 많은 것 같습니다. 급한 용무시에 굉장히 불편했던 기억이 여러 번 있습니다. 싱가폴에는 재산의 여부, 혹은 피부색에 따라 계층적인 차이도 존재하는 것을 느끼게 됩니다. 저는 이들이 백인 및 일본, 한국인에게 있어 몹시 우호적인 모습을 자주 목격하였습니다. 조금 다른 이야기 이지만 아마 이 곳에 있는 동안 다양한 동남아시아 국가로 여행을 많이 가시게 되실텐데요, 저는 그 때마다 느끼는 다양한 컬쳐쇼크로 인해 싱가폴은 몹시 무난하다는 것을 깨달았습니다. 싱가폴은 외국인들이 살기에 몹시 편한 곳이라고 할 수 있습니다.","혼자서 외국에 나와계시면 아무래도 이런저런 불편함이 생기기 마련입니다. 이럴 때 한국인들의 끈끈한 정은 오랜 타지생활에서 느끼게 되는 안식처와 같은 느낌을 받게 됩니다. SMU에 파견되는 8개의 한국학교 교환학생들은 그 학기의 분위기에 따라서 커뮤니티를 형성하고 있습니다. 또한 Full-time 한국학생들도 더러 있기 때문에 서로 도움을 받으실 수 있습니다. 싱가폴에 거주하는 한국교민수는 굉장히 많은 것으로 알고 있고, 웹사이트 한국촌이라는 곳을 참고하시면 어려움이 있으실 때 도움이 되시리라 생각합니다.","후회나 아쉬움없이 제대로 즐기고, 한 학기 동안 잊을 수 없는 추억과 이야기들을 만들어 준 SMU였습니다. 이 지면에 담기에는 너무나 벅찬 큰 감동과 행복했던 꿈을 꾸게 해주었던 SMU에서 여러분의 소중한 교환학생을 누리시길 바랍니다."
