gen_info,env_info,food_info,study_info,office_info,facil_info,mhct_info,help_info,etc_info
"SMU는 싱가폴에서 NUS, NTU의 뒤를 이어 3번째로 정부의 지원을 받는 최초의 사립대학입니다. 싱가폴의 도심부 중에서도 가운데에 위치하고 있어 울타리가 쳐진 캠퍼스가 따로 있지 않고, 여러 빌딩들과 어우러져 있습니다. 그래서 유명한 관광지나 박물관, 유명 레스토랑, night spot 등이 대부분 걸어갈 수 있는 위치에 놓여있어 도심에서의 생활을 원하시는 분이라면 안성맞춤입니다! 동서남북으로 각종 관광지와 놀거리가 있으며, 3개의 지하철 노선이 모두 통과하는 아주 좋은 위치입니다. 그래서인지 타대학과는 다르게 담으로 둘러싸인 대학이 아니라 각종 관공서와 기업들과 함께 몇 개의 건물이 늘어서 있는 형태입니다. 캠퍼스라고 부르기에는 뭣하지만 굉장한 현대식 건물들과 함께 늘어서 있어 연세와는 또다른 매력이 있습니다. 1개의 도서관 건물, 1개의 admin건물을 포함하여 총 6개의 건물로 이루어져 있기 때문에 규모가 큰 편은 아니지만 꼭 필요한 것은 다 있는 구조입니다. SMU는 경영대학으로 경영학, 회계학, 정보시스템, 경제학, 사회과학, 법학 총 여섯 과로 이루어져 있습니다. 규모는 6,000명 정도로 그렇게 큰 학교는 아닙니다. 

기후는 동남아시아에 위치한 것으로 알수 있듯이 1년 내내 더운 날씨가 계속 됩니다. 물론 그 중에서도 약간 더 쌀쌀한 때도 있지만 한국인들에게는 모두 더운 날씨입니다. 하지만 싱가폴은 건물마다 에어컨이 잘 작동하며, 지하통로가 굉장히 발달하였기 때문에 저는 항상 가디건을 가지고 다녔습니다.","SMU의 가장 좋은 점 중의 하나가 위치입니다. 조금 멀수도 있지만 걸어다닐만한 위치에, 최고금융가인 Raffles place와 싱가폴의 중심지 City hall, 밤문화가 발달한 Clarke quay, Boat quay, 유명 관광지인 Little india, China town, 예술의 전당 격인 Esplanade, 싱가폴의 상징 Melion park와 마리나베이가 모두 위치하여 있습니다. 좁은 나라인만큼 중요한 건물이나 사적이 모두 한곳에 모여있는데 그곳의 중간에 SMU가 위치한다고 보면 됩니다.","보통 교환학생들은 3가지 선택권이 있습니다. 학교에서 제공하는 호스텔, 일반가정집의 방 한칸을 렌트하는 형태, 또는 다른 학생들과 함께 집 하나 전체를 쉐어하는 형태입니다. 싱가폴은 한국과는 달리 원룸형태의 집은 없습니다. 
먼저 호스텔은 가격은 저렴하지만 시설이 낙후되고 방이 많지 않아서 일부의 학생들만이 이곳에 살게 됩니다. 선착순형태이기 때문에 호스텔을 생각하신다면 이메일을 수시로 확인하셔야 합니다. 가정집의 방하나를 렌트하는 경우는 한국촌홈페이지나 구글링을 하면 싱가폴에서 룸렌트로 유명한 사이트들이 몇 개 있는데 여기서 구하시면 됩니다. 학생들과 함께 whole rent를 하는 경우는 미리 페이스북으로 연락하여 같이 살 친구들을 구해놓는 것이 좋습니다. 
저 같은 경우는 싱가폴 가정에 방 하나를 렌트하는 식으로 살았었으나, 운이 좋게도 한 싱가폴 친구와 굉장히 친해져서 그 친구네 집에 들어가서 가족들과 함께 살았습니다. 전형적인 싱가폴가정을 체험할 수 있는 좋은 기회였습니다. 
식사에 관해서는, 싱가폴은 아침부터 외식을 하는 문화입니다. 아침에 토스트나 국수 또는 간단한 도시락을 먹습니다. 싱가폴에는 크게 푸드코트라고 할 수 있는 호커센터와 일반식당인 레스토랑이 있습니다. 호커센터에서 세끼를 모두 해결할 수 있으며 각각 5달러 이내로 보통해결합니다. 레스토랑같은 경우는 왠만하면 1인 1끼에 적어도 15달러 정도 들기 때문에 저녁이나 특별한 때에 갔습니다. 호커센터도 맛있는 음식을 많이 팔기 때문에 걱정하지 않으셔도 됩니다.","1. Dance: East and West
우선 이 수업은 교양으로 하나 넣은 것이었는데 저에게는 최고의 행운을 가져다 준 수업이었습니다.
수업의 이름이 댄스라고 수업시간 내내 춤을 추는 것은 아니었어요. 실제로 춤을 배우는 시간은 단 세번, 총 9시간뿐이었는데요. 그 외의 시간에는 댄스를 감상하는 법이나, 춤의 역사, 하나의 주제를 놓고 쭉 이론을 펼치기도 하구요. 
교환학생인지라 학점의 부담이 없는 관계로 따분할 것 같은 이론수업 역시 정말 재미있게 들었습니다! 게다가 교수님께서 교환학생들을 굉장히 배려하여주셔서 수업에도 금방 적응할 수 있었구요.
시험이 없이 진행되며, 거의 모든것은 조모임 중심으로 진행이 되요. 저는 첫날 자리를 잘잡은 덕분에 정말 좋은 친구들을 많이 만났어요. 결국에는 그곳에서 만난 친구네 집에서 같이 살게 되었구요..ㅎㅎ (SMU는 기숙사가 거의 없다고 보시면 되기 때문에, 집을 따로 빌려 살아야해요-) 아무래도 교양이다보니 다른 전공과목의 조모임과는 다르게, 아이들도 잘 대해주고 편하게 진행하는 것 같았어요. 저는 다른 과목 조모임에서 쌓인 스트레스를 이 친구들과 이야기하며 풀기도 하고, 다같이 맛있는 음식을 먹으러 다니기도 하고 저에게는 휴식처와 같은 수업이었답니다. 

2. Marketing Research
저는 Hannah Chang교수님의 수업을 수강하였습니다. 이 교수님은 대만분이시지만, 미국에서 주로 성장하셔서 굉장히 아메리칸 스타일(?) 이셨어요. 수업을 정말 소중히 여기시고, 한국교환학생들을 예뻐하셨죠:) 비록 학교 내에서는 이 과목이 시험도 어렵고, 팀프로젝트도 힘들게 시키는 것으로 유명하지만, 저는 오히려 이 과목을 체계적으로 공부할 수 있었고, 시험 일정이나 팀프로젝트 일정 등 모든 것이 학습을 최대로 효율적으로 만드려는 교수님의 도움이 진심으로 마음 깊이 와닿는 수업이었습니다. 그래서 교환학생임에도 불구하고 학습의 의욕을 낼 수 있었구요, 그 결과 뜻하지 않게 학점도 잘 나왔다는 ...^^ 아 오히려, 시험과 팀프로젝트만을 성적 기준으로 사용하시기 때문에, 퀴즈를 자주 보거나 참여점수가 엄청난 영향을 미치는 수업보다는 차라리 마음이 편했던 것같네요.
전반적으로 이 수업은 시장조사를 하는 5단계를 자세히 탐구하는 수업이에요. 마케팅 전공자 뿐만 아니라, 파이낸스나 매니지먼트쪽을 공부하는 사람들도 정말 도움이 많이 될 것 같아요. 

3. Advertising

이 수업은 SMU내에서 가장 인기가 많은 과목 중의 하나에요. 주로 졸업을 앞둔 4학년 학생들이 많이 듣고, 실제로도 학교가 아닌 실제 기업처럼 수업을 진행하죠. 이 수업 역시 시험이 없고, 5분짜리 짧은 개인발표와, 한 학기 내내 이어지는 엄청난 팀프로젝트로 성적을 매겨요. 솔직히 개인발표는 다들 비슷하게 하고, 팀프로젝트 하나로 평가한다고봐도 과언이 아니에요. 이 팀프로젝트는 실제로 의뢰를 받은 회사의 광고프로젝트를 전담하는 것이에요. 비록 학생들이 하는 것이지만, 싱가폴 내에서 SMU학생들의 실력을 인정해주고 있기 때문에 학생들 역시 진심으로 최선을 다해서 프로젝트를 진행해요. 개인적으로 돈도 가장 많이 들었고, 일주일에 몇번씩 시간날때마다 만날 정도로 열심히 했던 수업이에요. 만약 진정한 조모임이 어떤 것인지 체험해보고 싶은 분이라면 추천이지만, 혼자서 공부하시는 것을 좋아하시고 이론적인 부분을 좋아하신다면 비추에요. 이 수업에서는 거의 이론적인 부분은 배우지 않는다고 보시면 되거든요.. 수업시간에도 프로젝트의 진행상황에 맞추어 프로젝트를 더 좋게 만들기 위해서 수업내용을 나가거든요.. 그래도 저는 싱가폴학생들의 열정과 진짜 팀프로젝트의 의미를 알게 된 소중한 시간을 가졌다고 생각합니다.

4. Strategy 
이 수업은 경영학과 분들이라면 거의 필수로 들어야하는 수업이라고 알고 있어요 저 역시 그런 이유로 이 수업을 수강하였구요. 저는 ILLYA 교수님의 수업을 들었습니다. 이 분은 정말 1분 1초를 아껴서 수업을 하는 분이신만큼 수업준비가 철저하시고, 그만큼 학생들도 준비해오기를 원하시구요. 또 실제로 학생들이 그만큼 매주 준비를 해옵니다. 정말 놀라지 않을 수가 없었죠. 매 수업시간이 3시간인데, 1시간 반은 이론을 아주 철저하게 나가시구요, 1시간 반은 학생들이 미리 준비해온 케이스 스터디를 합니다. 이 때 발표점수가 성적에 상당한 영향을 미치는 것으로 알고 있어요. 이 수업이야말로 참여점수+개인과제2+기말고사+팀프로젝트로 이루어져 저를 힘들게 한 수업이었죠. 하지만 이 수업에 앉아있는 것 만으로도 지금까지 이 수업 저 수업에서 여기저기 들어왔던 이론들을 체계적으로 정리할 수 있는 기회가 되었어요. 또한 매주 케이스를 분석하여 각자의 노트북에 엑셀파일까지 만들어 준비해오는 학생들을 보고 많은 것을 느끼기도 했구요. 

+ 전반적으로 제가 들었던 수업들은 다 좋았던 것 같아요. 쉬워서 좋았던 것도 있고, 당시에는 힘들었지만 남는 것이 많아서 좋았던 수업도 있네요. 체감적으로 저를 많이 힘들게 만들었던 수업은 Dance
교환학생이라고 가서 놀다올 수만은 없었던 것 같아요. 여러분들도 모든 것을 균형에 잘 맞추어 다녀오셨으면 좋겠네요.",이곳에 계신 선생님들은 모두 굉장히 친절하십니다. 아무 때나 찾아가거가 이메일을 보내고 쉽게 도움을 받을 수 있어요. 하지만 저는 여기보다 로컬친구들 도움을 많이 받았습니다.,"학교의 부대시설은 굉장히 좋은 편입니다. Admin 빌딩에 가시면 6층에 야외수영장이 있어요! 낮에 가도, 해가 진 후에 가도 굉장히 아름다운 정취를 느끼실 수 있습니다. 또한 학교에서 제공하는 gym은 한국의 웬만한 헬스클럽보다 좋은 것 같아요, SMU학생이라면 누구나 무료로 이용할 수 있고요, 샤워실과 lady’s area까지 따로 구비되어있어 운동을 하고 싶은 욕구가 막 생긴답니다.
교환학생을 위해서 학교와 교환학생커뮤니티에서 제공하는 프로그램은 굉장히 많아요. 매주 파티가 있으며, culture tour를 하기도 하고, 다같이 근처 섬에 놀러가기도 하고요. 너무 많아서 이벤트만 다 참여하는 것도 쉽지 않아요^^


SMU를 한마디로 표현하자면 ‘Group Meeting’이라는 단어가 떠오르는데요, 제 싱가폴 친구들은 제가 불평할 때마다 그러게 왜 ‘Meeting school’을 선택했냐고 말하곤 했어요. SMU는 이론보다도 실제 적용을 굉장히 중시하거든요. 물론 연세대학교에도 과의 특성상 조모임이 굉장히 많았지만, 이곳에서는 시험을 term project로 대체하는 수업이 더 많을 정도로 팀플레이를 중시한답니다. 그래서 단순한 case study 같은 것이 아니라, 실제로 기업과 연계하여 프로젝트를 진행하는 것이 대부분이에요. 물론 덕분에 여러모로 배우는 점도 많았지만, 문화와 여가도 즐겨야 하는(?) 교환학생들에게는 부담으로 다가오기도 한답니다. 
또한, 수업시간마다 발표를 굉장히 많이 해요. 아예 모든 교실이 U자형으로 생겨서 교수님과 학생들이 서로서로 마주보며 커뮤니케이션을 많이 해요. 교수님께서 말씀하실 때 끼어들기도 하고, 종종 학생들 사이에 의견다툼이 벌어지기도 하고요. 한국과 굉장히 다른 모습에 처음에는 적응이 안되었지만, 지금은 저도 가끔 교수님과 의견다툼을 벌이기도 했습니다^^","아시아지역이라서 많은 차이는 없었지만, 한가지 있었습니다. 수업시간에 엄청 냄새나는 음식들을 싸들고 와서 아무렇지 않게 먹는 것입니다. 여기 대학생들은 굉장히 공부를 많이 해야해서 바쁘기 때문에 밥을 먹을 시간이 많지 않다고 합니다. 그래서 포장/도시락 문화가 발달해 있는데, 심지어는 curry를 먹는 학생도 보았습니다. 밥을 한숟갈 떠먹고 손을들고 발표를 하기도 하는데 저에게는 큰 충격이었습니다. 하지만 이것도 잠시 저도 어느새 수업시간에 무언가를 먹고있더군요^^",,"참고로 말씀드리면, 지금 싱가폴의 환율이 굉장히 빠른 속도로 오르고 있기 때문에, 동남아시아 지역이라고 해서 한국보다 저렴하다고 생각하시면 절대 안돼요! 집값이 서울 웬만한 곳보다 훨씬 비쌀뿐더러(SMU는 기숙사가 없으므로), 싱가폴은 tax 제도가 한국과 달라서 의외로 지출이 커요. 그리고 물론 싼 음식(푸드코트-3~5천원)도 있지만, 푸드코트를 벗어나면 대부분 10달러를 훌쩍 넘기 때문에, 식비도 만만치 않구요. 만약 싱가폴로 오실 의향이 있으시다면 이점도 고려하시면 좋겠어요!

아래 사진은 제가 가장 좋아하여 시간날때마다 찾아가서 넋놓고 바라보았던 마리나베이입니다^^"
"싱가포르의 기온은 대체로 온난한 편이며, 우리나라의 여름날씨가 지속된다고 보면 될 것입니다. 그러나 SMU를 비롯한 대부분의 식당, 버스, 지하철, 영화관, 쇼핑몰 등에서 에어컨을 풀가동하기 때문에 가디건 등을 들고 다니지 않으시면 감기에 걸리실 수도 있습니다. 싱가포르는 도시 국가로 East side에서 West side로 2시간 정도면 지하철을 타고 주파 가능하며, 서울시 정도의 크기라고 보면 될 것 같습니다. 따라서 웬만한 곳은 대중교통을 타고 이동 가능하며 편의시설 및 관광 명소에의 접근성이 뛰어납니다.
 영어권 국가이기 때문에 많은 사람들이 영어를 사용하지만, 나이가 많으신 분들은 간혹 영어를 구사하지 못하시는 분들도 계십니다.(중국어 사용)","SMU는 싱가포르에서도 가장 번화한 도심에 위치해 있습니다. City hall stn과 가까우며 5분 정도 걸어가면 영화관, 쇼핑몰, 국립도서관 등에 갈 수 있습니다. 또한 Bar와 Club이 몰려있는 클락키에도 10~15분 정도면 닿을 수 있어 학교에서 공부를 하다가 휴식이 필요하면 언제든지 주변으로 쉽게 놀러갈 수 있습니다. 
 SMU는 우리나라의 캠퍼스 형태가 아닌, 담장의 경계 없이 6~7개 정도의 큰 건물이 도심을 중심으로 퍼져있어 언뜻보기에는 대학 캠퍼스의 느낌이 들지 않습니다. 그러나 건물 주변에 녹지가 조성되어 있고, SMU학생 만을 위한 벤치나 공간들이 많이 마련되어 있기 때문에 쉽게 찾으실 수 있을 것입니다. 
 또한 SMU는 싱가포르의 건물 특성상 지하통로를 통해 각 건물이 연결되어 있어 비가 오는 날이면 굳이 우산을 펴지 않고도 이동 가능합니다.","싱가포르에서 선택할 수 있는 거주형태는 총 3가지가 있습니다. 첫째는 SMU가 대여해서 사용하는 기숙사인 Commmon Wealth라는 건물이 있습니다. 우리나라 뿐만 아니라 다른 나라에서 온 많은 학생들이 이 곳으로 신청해서 생활하기 때문에 많은 친구들을 사귈 수 있다는 장점이 있고, 비교적 저렴한 축에 속합니다.(450 S dollar / month) 그러나 선착순으로 신청을 받기 때문에 선정이 안될 가능성도 있습니다. (학기 시작 전에 메일로 신청을 받습니다)
 그리고 두번째로는 한국인 온라인 커뮤니티(한국촌)에서 한국인 룸메이트를 구해서 살거나 한국인 주인에게 방을 렌트해서 사는 것입니다. 싱가폴 현지인에게 방을 구하는 것보다 의사소통이 편하기 때문에 비교적 쉽게 방을 구할 수 있고, 타지에서 생활하면서 한국인 가족으로부터 위로와 안정감을 얻을 수 있는 장점이 있습니다. 가격은 위치(도심에서의 거리), 독방 or 공용 이냐에 따라서 천차만별로 달라집니다.
 그리고 마지막으로 세번째는 다른 나라에서 오는 교환학생들과 콘도 혹은 HDB(싱가포르 임대 아파트)를 렌트해서 사는 것입니다. 저는 지난 학기에 6명의 유러피언(독일, 스위스, 리투아니아 등)들과 함께 콘도를 렌트해서 살았습니다. 이러한 주거 형태를 원할 경우, 학기가 시작하기 전에 페이스 북이나 학교 주변 호스텔에서 머무르면서 마음 맞는 친구들과 만나 함께 방 hunting을 하러 다닐 수 있습니다. 대부분 중개업자와 함께 돌아다니며 방을 구하게 되며, 중개업자의 연락처는 학교에서 미리 메일로 발송해 줍니다. 
 저는 사실 별다른 준비를 하지 못하고 싱가포르로 떠나게 되어 초반에 집을 구하면서 고생을 많이 했는데, 그래도 페이스북에서 좋은 친구들을 만나 색다른 환경에서 살 수 있었습니다. 지난학기 SMU에는 약 500여명의 교환학생이 왔었는데 그중 80~90%가 유럽인이고, 이들과 함께 거주지를 구하면 또 집에서는 유럽에서 생활하는 것처럼 느낄 수 있는 장점이 있습니다. 콘도에서 거주할 경우, 수영장, 테니스장, 스쿼시장, 헬스장, 바베큐장 등등이 기본으로 갖춰져 있어 룸메이트나 학교 친구들과 함께 좋은 추억을 만들 수 있습니다. 가격 역시 case by case로 저의 경우 월 650~700 S dollar(Pub 및 가구,기타 시설 포함)를 냈던 것 같습니다.","SMU는 조발표 위주로 강의를 진행하기 때문에 조모임이 상당히 많고 커리큘럼도 빡셉니다. 싱가포르에는 다양한 국적과 종교를 가진 사람들이 살아가기 때문에, 이들의 종교의식, 축제등으로 인한 공휴일이 상당히 많은데, 공휴일 때무에 수업을 못할 경우 꼭 Make-up class를 진행합니다. 
 또한 싱가포르에는 국립대학이 3개 밖에 존재하지 않기때문에 SMU에 다니는 싱가포르인들의 자부심이 굉장히 높으며 학구열도 대단합니다. 초반에 조모임을 할 때에는 학생들의 말이 너무 빠르고 억양이 좀 달라서, 제대로 못 알아 듣는 적도 많았지만 1~2달 정도 지나면 어느 정도 적응이 됩니다. 
 수업 강의실이 U자형으로 지어져있어 토론을 하기에 용이하며, 실제로 대부분의 교수님들이 일방적으로 강의를 하기보다는 토론식 강의를 유도합니다. 학생들도 강의 중간중간 스스럼없이 손을 들고 질문을 하는 식이고, Guest Speaker를 초대해서 관련 분야에 대한 현장 경험을 나누고 연계 프로젝트를 진행하는 수업도 많습니다.","국제 교육부에서는 학생들을 위해 Welcome Party, goodbye party, international festival 등 교환학생들을 위한 여러가지 행사를 주관했습니다. 이뿐만 아니라 Night Safari나 City Tour등 교환학생들이 싱가포르의 관광명소를 좀 더 잘 알 수 있도록 여러 곳에 데려가고 할인된 가격으로 이용할 수 있게 해주었습니다. 국제 교육부의 직원들은 친절한 편이지만, 따로 국제 교육부를 찾아간 일은 없었습니다.
 학기가 끝나고 여행을 잠시 다녀오게 되면 짐을 맡아주는 역할을 하기도 합니다.","SMU에는 굉장히 많은, 다양한 동아리들이 있습니다. 저는 SMU의 여자농구팀과 싸이클링(SMUX)에 가입해 활동을 했는데, 취미가 아닌 거의 전문적인 수준과 능력을 가진 학생들을 보고 놀랐습니다. 싱가포르의 학생들은 대부분 운동을 굉장히 열심히 하는 편이며, 동아리 활동 시에도 다른 강사를 초빙하여 일정정도의 돈을 지불하고 전문적인 교육을 받기도합니다. 
 교환학생이 아닌, 싱가포르의 학생들은 대부분 술 마시는 것을 그다지 좋아하지 않기 때문에(국가 차원에서도 술에 엄청난 세금을 부과합니다) 건전한 취미활동을 즐기는 것을 쉽게 목격할 수 있습니다.","저는 6명의 유럽인들과 함께 방 3개짜리의 콘도 한 층을 렌트해서 살았는데, 그동안 살아온 문화가 전혀 다른 만큼, 몇 번의 culture shock을 경험했습니다. 저를 포함해서 4명의 남자와 3명의 여자가 함께 살았는데, 룸메이트들이 아무렇지 않게 수영복만 입고 집을 돌아다녀서 초반에는 좀 놀랐었습니다.
 또한 싱가포르에는 굉장히 많은 푸드 코트와 쇼핑몰(거의 지하철 역마다 있습니다)가 존재하는데, 정부차원에서 여성이 집안 일이 아닌, 경제활동에 참여하게하기 위해 푸드 코트 조성하는 등의 분위기와 성적 소수자 역시 그 자체로 인정하는 분위기 등이 좋았던 것 같습니다.",저는 ''한국촌''이라는 한국인 온라인 커뮤니티라는 곳에서 여러가지 정보를 많이 얻었습니다. 그곳에서 한국인 초등학생을 대상으로하는 과외와 한국식 뷔페 서빙 알바를 구해서  일하기도 했습니다.(의외로 한국인 과외 선생님에 대한 수요가 많은 것을 느낄 수 있을 것입니다),"지금 한 학기 동안의 교환학생을 돌이켜 보면, 가장 기억에 남고 잘했다고 생각하는 부분은 주변 국가로 여행을 많이 한 것 입니다. 싱가포르로 떠나기 전, 다른 분들의 경험보고서를 읽으면서 사실 ''내가 저렇게 여행을 많이 다닐 수 있을까?''라는 생각을 했었는데, 막상 가서 보니 study week나 기타 공휴일에 저가항공을 이용해서 주변 국가로 여행할 수 있는 기회가 정말 많았습니다. 흔히 해외여행하면 오직 비행기를 타고 나가는 것을 생각하는 경우가 많은데, 싱가포르는 접근성이 좋기 때문에 말레이시아는 버스나 기차를 타고도 이동할 수 있고, 인도네시아 역시 배를 타고도 갈 수 있습니다. 이러한 모든 가능한 수단을 동원해서 저는 한학기 동안 태국,말레이시아,인도네시아,라오스,캄보디아,홍콩 등 총 6개국을 여행했습니다. 우리나라 학생들 뿐 아니라 외국인 친구들과 함께 여행하는 것도 좋은 경험이 될 수 있고, 다양한 나라에서 여러가지 것들을 보고 들음으로써 세상을 보는 안목이 조금은 더 넓어진 것 같습니다. 또한 동남아시아를 여행하거나 싱가포르에서 외국인으로 살아가면서 ''한국''에 대해서도 객관적으로 생각해보고, 자신에 대해서도 좀 더 잘 아갈 수 있는 좋은 기회가 된다고 생각합니다. 
 오직 ''영어능력 향상''을 목적으로 한다면 미국으로 가는 것이 좋을 수도 있지만, 이외의 여행이나 다양한 인종들과 어울려 지내고 싶다면 싱가포르로 교환학생을 가는 것을 추천합니다.(물론 본인의 노력 여하에 따라 영어 능력도 향상될 수 있습니다.) 

이외에 문의할 것이 있다면 blue_ks@!naver.com으로 메일보내주시면, 성실하게 답변해드리겠습니다.^^"
