gen_info,env_info,food_info,study_info,office_info,facil_info,mhct_info,help_info,etc_info
"SMU는 3개의 싱가포르 대학 중 크기가 제일 작고 역사가 제일 짧습니다. 역사적으로 2020년이 딱 개교 20년이 된 신생학교이며 경영, 경제, 사회, 법, 회계 등을 중심으로 가르치는 인문 사회 위주의 대학교입니다. 수업 참여도가 강조되는 세미나 형태의 수업을 진행하며 와튼 스쿨을 모태로 세워졌다고 합니다. 우리나라로 치면 '명동' '을지로' '삼성동' 과 비슷한 중앙 비즈니스 지역(CBD)에 위치하여 싱가포르내에서 가고 싶은 곳 어디나 쉽게 갈 수 있는 점이 가장 큰 장점입니다. 학교내에는 Bencoolen 과 Bras Basah 2개 역이 관통하며 위치적으로는 우리나라의 왕십리와 비슷한 Dhoby Ghaut, 건대와 비슷한 Bugis 지역과 매우 인접합니다. 학교 뒤편으로는 Fort Canning 이라는 커다란 공원이 있고 학교 건물에서 길을 걸으면 National Museum of Singapore 이 바로 나오는 위치에 있습니다.","대학 주변 환경은 앞서 적은바와 같이 '도심 오브 도심'이라고 생각하시면 됩니다. 학교 주변에는 국립 박물관, 도서관, 미술관, 시청 등의 주요 관공서가 10-15분 거리에 있으며 (몹시 비싼 식사와 크레이지 리치 아시안의 배경이 되는 곳에서 사진을 찍기 위해 가는) Chijmes와 Raffles City 몰, The Cathay, Plaza Singapura, 전자기기를 위주로 파는 최첨단 Funana 몰과 같은 상업 시설도 위치해있습니다. 싱가포르에 관광을 가시면 싱가포르 슬링을 마시러가는 Raffles Hotel 또한 Raffles City 몰 건너편에 있으니 한번 가보시길 추천합니다.","거주형태는 다양합니다만 저는 학교와 협력 관계인 Dwell Student Living 이라는 호스텔에서 살았습니다. 비교적 시내에서 벗어난 다른 학교들과 달리 SMU는 시내에 위치하여 기숙사비는 사악합니다. 방마다 3인실, 더 큰 3인실, 2인실, 화장실 있는 2인실 이렇게 있었는데 저는 숙소에서는 돈을 최대한 아끼고 싶어서 3인실에 거주했고 한 달 렌트비는 S$758 정도했습니다. Dwell의 경우는 제가 거주한 가장 저렴했던 방부터 비싼 방은 S$1,500 정도 했습니다. Dwell은 다른 협력 기숙사인 Yoha에 비해 시설이나 위치적으로 훨씬 나은편이라고 Yoha에 거주한 친구에게 들었습니다만 송도와 같은 럭셔리 방은 절대 기대하고 오지마시기바랍니다. 3인실 기준으로 그래도 저는 방이 생각보다 넓고 침대가 푹신해서 만족스러웠습니다. 기숙사비용은 펍비가 포함이며 각 방에는 에어컨이 있습니다. 화장실은 공용이고 샤워실도 공용입니다. SMU학생은 8-9층에서 살게되며 다른 층에는 주변 사립학교에 다니는 유학생 친구들이 거주하고 있습니다. 기숙사에 처음 입주하게 되면 옆방 친구들이랑 인사하게 될 수도 있는데 그때 같이 Mustafa Centre같은 곳에 생필품 사러 가는 재미도 꽤 있습니다. 7층에는 공용공간이며 전자렌지, 냉장고, 가스렌지, 세탁기, 건조기, 탁구장, 자습실이 있지만 개인적으로 부엌 공간은 위생적으로 마음에 들지 않아 거의 사용하지 않았습니다. 세탁기와 건조기는 각각 S$2 씩 내고 사용하며 세제는 따로 구매하셔야합니다. 지금도 있는지는 모르겠지만 제가 거주할 당시에는 중국계 싱가포르 직원인 David 씨가 이것저것 주변에 대한 추천이나 짐 운반 등을 많이 도와주셨습니다. Dwell에서 종종 중간고사용 간식행사나 파티등도 주최하니 가시게 되면 재밌는 시간보내시길 바랍니다. 건너편에는 Prinsep Student Residences이라는 SMU 1학년 유학생의 RC 프로그램용 기숙사가 있습니다. 교환학생을 위한 시설이 아닌 호스텔이라 Dwell이나 Yoha보다 시설이 좋은 편입니다만 제가 파견되었을때는 Prinsep 거주를 위한 프로그램이 개설되지 않아 자격요건이 되지 못했습니다. 혹시 파견가실때 해당 프로그램에 적용이 될 수 있는지 한번 확인해보셔도 좋을듯합니다. 다만 주로 1학년이 거주하는 기숙사의 특징상 Dwell에 비해 소음이 심한 편이라고 합니다. 만약 기숙사에서 거주를 하기가 꺼려지신다면 아파트를 구하는 방법이 있습니다. 가을학기 기준으로 8월에 생성되는 SMU 국제처 교환학생 페이스북 그룹을 통해 5-6명이 플랫셰어를 하는 경우도 많습니다. 제가 파견된 학기에는 80%의 학생이 유럽에서 온 학생들이라 아파트에서 같이 사는 것을 선호하기도 했는데 아파트에 거주할 경우 주로 1인당 한달에 S$800-S$1,200정도 펍비 불포함으로 거주한다고 들었습니다. 주로 학교와 가까운 Sophia rd나 Sunshine Plaza에 위치한 방이 인기가 많았던것으로 기억합니다. 그외에도 Property guru나 한국촌을 통해 따로 개인 방이나 콘도를 구해 거주하는 친구들도 보았는데 장소에 따라 가격이 많이 달라집니다.시내 중심가에 위치하다보니 식사할 곳은 정말 많습니다! 학교 내부에 있는 식당은 모두 한번쯤 가실 것 같아서 주변에 있는 맛집 몇 곳만 나열을 하면 다음과 같습니다. 이외에도 맛집은 미식의 나라 싱가포르답게 정말 정말 많은데 모두 적었다가는 맛집 이야기만 할것 같아서 교환 가시는 분들이 아마 많이 찾으실 것 같습니다. 대신 SMU 학생이면 필수적으로 사용하게 되는 텔레그램 단체방의 링크를 몇개 공유하겠습니다. (@kiasu_bot, @sgfoodies, @smubuffetclearers) 종종 1+1 스타벅스 프로모션과 같은 할인행사가 많이 올라오니 구독해보시면 도움이 되실겁니다! -Thai Gold Food (SMU 학생들 사이에서 유명한 태국식당이며 현금만 받습니다. 태국인 가족분들이 운영하시는 식당입니다)-Meatsmith (리틀 인디아에 위치한 식당으로 BBQ로 유명합니다. Telok Ayer 역 옆에도 있습니다)-Kin Tub Thai Restaurant (Dwell과 인접한 24시간 하커 센터 0.5층에 위치한 태국식 무카타집입니다)-9 Fresh Jelly (체인점인데 Plaza Singapura에 있습니다. 버블티에 들어가는 젤리만 따로 파는 가게라고 생각하시면 됩니다)-Kooks Creamery (The Cathay 에 위치한 디저트 가게로 현지인들 사이에 인기가 많습니다)-Waterloo Street Food Centre (저렴한 가격으로 6개의 문화가 공존하는 waterloo street에서 다양한 나라의 요리를 먹어볼 수 있습니다)","SMU에서 제가 수강한 수업은 4가지입니다. 기본적으로 교환학생이 수강가능한 수업은 4개 (연대 기준 12학점)이며 전공인정으로 반드시 필요한 증빙을 할 수 있는 경우 5과목 (15학점)까지 수강이 가능합니다. SMU 수강신청이 저는 교환생활 중에 제일 복병 중에 하나였는데 연세토토보다 더 어려운 센트단위까지 베팅 시스템을 가지고 있고 수업 증원은 거의 불가능에 가깝습니다. 저도 교환학생을 워낙 늦은 4학년에 가서 호언장담하게 성공할것이라고 생각했지만 전필로 인정되어야하는 과목이 자꾸 실패해서 정말 고생한 기억이 납니다. 교환학생끼리 경쟁하는 1C round 에서 되도록 과목에 대한 수강신청을 성공하시길 바랍니다. 연대와 달리 SMU는 수강 리뷰에 대한 평가가 적은 편이지만 https://reviewmyprof.com/이라는 곳에 가시면 제한적으로나마 강의평을 보실 수 있습니다. 또한 필수 이수 과목을 듣지 않고 수업을 듣게 되면 안 봐주시는 교수님도 많다고 들었으니 꼭 이 점 유의하셔서 수강신청을 하시길 바랍니다. 제가 수강한 과목은 다음과 같습니다:The Design of Business: SMU-X (Prof Vivian Koh) '내가 공부에 뜻이 있고 팀플을 정말 좋아해서 새로운 경험을 하고 싶은 분'들께 추천하는 수업입니다. SMU-X 수업은 SMU의 산학협력 수업으로 제가 수강한 수업은 캡스톤 수업과 비슷합니다. 저는 개인적으로 프로젝트 위주의 수업을 좋아해서 수강을 했는데 제가 기존에 연대에서 수강했던 강의들과 다르게 클라이언트의 요구를 거의 100프로 수렴하는 수업이었습니다. 그만큼 클라이언트의 니즈를 이해하고 시장조사가 필요한 수업이었습니다. 매학기마다 또 교수님마다 다르지만 제가 수강했을때는 버블티 브랜드 공차 싱가포르의 비즈니스 모델 다각화가 주제였습니다. 제가 알기로는 어떤 교수님은 싱가포르 동물원과 협력하는 프로젝트를 하기도 하고 가구회사와 사업구상을 한다고도 합니다. Vivian 교수님은 구글출신의 겸임 교수님이셨는데 나중에 알고보니 학생들 사이에서 까다롭기로 유명하셨던 교수님이셨고 그만큼 저희에게 요구하시는 사항도 많아서 조원들끼리 주말 반납도 꽤 했었습니다. 옆 섬나라로 스노클링이나 사원 방문 등의 여행 자주 가시고 싶으신 분들은 SMU-X 수업이 조모임이 상당히 많은 편이라는 점을 유의하시면 좋을 듯합니다. 이 수업 외에도 SMU-X수업에 관한 사항은 SMU-X 홈페이지에 자세히 기록이 되어 있으니 관심 있으신 분들은 찾아보셔도 좋을 것 같습니다. Managing Customer Relationships with Analytics (Prof Rafael Barros)저는 전공이 기술경영이라 LCKSB로 파견이 됐어도 Information Systems의 수업을 들어보고 싶어서 수강한 수업입니다. 콜롬비아 교수님이셨는데 항상 에너지가 엄청나게 많으신 분이었습니다. IS 고학번 친구들과 듣는 수업이었고 교환학생은 저를 포함해 반에서 2명만 있을 정도로 수강신청 베팅 비용이 비싼 과목이었습니다. Salesforce를 이용한 CRM 시스템을 실습하며 문화적 차이에 대해 다루는 여러 사회적 모델을 배울 수 있습니다. SMU내에서 공대와 같은 IS 학생들이 듣는 수업인만큼 경영 수업과는 분위기가 많이 다릅니다. Accounting for Entrepreneurs (Prof Yuanto Kusnadi)회계원리(1)과 비슷한 수업으로 SMU-X와 SMU-X가 아닌 버전이 있습니다. 저는 이미 다른 SMU-X과목을 수강하고 있어서 이 과목은 SMU-X가 아닌 과목을 선택했고 로컬 SME의 비즈니스모델을 회계의 관점으로 분석하는 미니 팀플 외에는 수업참여와 시험으로 평가가 되는 방식입니다. 이 수업을 진행하시는 Yuanto 교수님은 인도네시아 분으로 굉장히 SMU에 대한 자부심이 많으신 분입니다. 엄청난 에너지를 보여주시는 교수님답게 워크로드도 많고 3시간 동안 짧은 15분 휴식을 빼고 빠르게 진도를 나가셔서 다소 어려운 수업이었습니다. 회계 수업을 한국에서 이미 수강하신 분은 수월하게 하실 수 있을것 같습니다. 강의 후반으로 가서는 싱가포르의 세금 구조에 대해서도 간단하게 배우실 수 있습니다.  Leadership Seminar with CEOs (Prof Tan Wee Liang)로드가 많은 수업을 들은 편이라 널널한 과목을 하나 듣기 위해 이 과목을 수강했습니다. 거의 모든 수업이 30명 내외로 진행되는 SMU에서 손에 꼽히는 70명 대형 '꿀강'입니다. 매주 CEO 분들이 방문하셔서 토크를 진행하시고 나머지 시간동안은 14~15개의 조가 매주 2-3팀씩 나뉘어서 발표를 합니다. 보고서 1번, 단체 발표 2번, 수업참석율로 평가가 되는 수업이며 조원들과 친하게 되실 가능성이 높습니다. 교환학생들이 많이 수강하는 수업이고 교수님께서는 별로 열성적이시지 않습니다.   SMU는 앞서 언급한대로 수업 참여도가 많이 들어가는 학교입니다! 하지만 로컬 친구들도 부끄럼이 많아서 너무 걱정하시지는 않아도 될듯합니다. 콜로세움 형태의 강의실 (경영대 1층 강의실 구조)이 많아서 강의자가 학생들을 모두 볼 수 있으며 그 자리에서 발표도 진행이 됩니다. SMU학생들은 4년동안 발표 수업을 워낙 많이해서 그런지 고학년의 경우 대본없이 정말 발표를 잘하고 발표날에는 풀정장을 입고 학교에 올만큼 열심히하는 학생들이 많습니다. 발표 수업이 많은 구조상 모든 학생들은 이름표를 만들어서 자신이 앉은 자리 앞에 두어야 합니다. (학기초에 동아리에서 신청을 하면 여러 디자인의 예쁜 이름표를 제작할 수 있습니다)도서관은 학교내에 2곳, 우리학교의 중도와 같은 도서관과 법 도서관이 있습니다. 공부를 열심히 하는 싱가포르 학생들답게 도서관은 항상 가득 차 있습니다. 좌석 예약제를 하는 연대와 다르게 SMU는 일반좌석은 예약을 하지 않아도 되서 짐만 두고 주인이 없는 경우도 자주 있으니 유의하시길 바랍니다. 법 도서관은 Fort Canning 옆에 위치하고 채광이 좋아서 현지 친구들이 많이 선호합니다.","SMU는 국제교육부가 정말 '열일'을 합니다! 비록 국제처에서 첫 메일이 다른 학교들에 비해 늦게 오긴하지만 교환학생이 많은 만큼 다양한 교류 행사를 주최합니다. 저는 행사 다니는 것을 워낙 좋아해서 싱가포르 시내 관광 투어, 총장과의 식사, International Day, 버디 프로그램, 호스트 프로그램, 볼링 프로그램, 월병 만들기 프로그램 등 국제처 관련 행사만 15가지가 넘게 참석했었습니다. 그 중 규모가 상당히 컸던 International Day 'DiverCity' 행사의 경우, 원하는 교환학생들이 코스튬을 입고 퍼레이드를 하거나 여러 나라들의 문화를 체험할 수 있는 대형 부스를 설치하여 '한국 찜질방 체험하기', '싱가포르 슬링체험하기', '인도 물감체험' 등을 경험해보실 수 있습니다. 메일로 정말 많은 프로그램 신청이 가능하니 SMU에서 오는 메일이 스팸으로 가지 않도록 주의하시면 도움이 될것입니다. 또한 교환학생들을 위한 welfare drive와 같은 무료 배포 행사도 종종 진행하니 참석하셔서 무료로 음료수나 티셔츠 등을 얻으시길 바랍니다.","부대시설로는 학교내에 작은 체육관이 있고 학생증이 있다면 무료로 샤워실까지 이용이 가능합니다. 교내 시설의 경우 학생증을 지참시 할인 되는 곳이 많으니 꼭 학생증 카드를 들고 다니시길 바랍니다. 교내에서 아프게 될 경우, 교내에 작은 의료 무료 클리닉이 있습니다만은 항상 줄도 길고 (30-40분 정도 대기) 마감 20분 전부터는 환자를 받지 않은 까다로운 클리닉이니 유의하시길 바랍니다. 제가 간 학기 이후에 SMU Labs라는 24시간 협업 공간이자 수업 공간이 생겨서 그곳에서 프로젝트 진행이 많이 이루어지는 듯합니다. 저는 총 6가지의 동아리에 가입했었는데 매 학기초에 개최되는 동아리 박람회에 가시면 관련 자료나 설명을 부스별로 들으실 수 있습니다. 다만 한 학기만을 이수하는 교환학생의 경우 받아주지 않는 동아리도 있으니 이 점을 잘 유의하시면 좋을듯합니다.SMU 동아리들은 현지 기업 탐방을 절말 자주합니다. 예를 들어 제가 소속해 있던 SMarketing의 경우 페이스북 APAC HQ, Twitter, Carousell, Love Bonito등의 여러 기업들을 방문했었고 그외에도 SEO관련 강연도 수강할 수 있었습니다. Fintech 동아리의 경우는 제가 직접적으로 소속되어 있던 것은 아니라 Paypal 견학에만 따라 갔었는데 인상적이었던 기억이납니다. 그외에도 Business Intelligence and Analytics와 같은 동아리에서는 tableau나 sql과 같은 툴 실습 세미나나 BIA 소속 회원들을 위한 리쿠르팅 세미나 등이 열렸었습니다. 연대 동아리들과 마찬가지로 싱가포르 동아리 또한 기본 회비와 행사 참여를 위한 보증금을 받습니다. 동아리마다 다르겠지만 현금을 안 받는 동아리도 있어서 되도록이면 현지 계좌 (학교내에 위치한 OCBC 은행에 1)한국 거주지 등본 2) 교환학생증 3)교환학생 인증 메일을 가져가면 만들 수 있습니다.) 를 꼭 만드시길 바랍니다.",전에 싱가포르에서 3개월 살았던 경험이 있어서 크게 문화 충격은 없었습니다. 그러나 처음 가시는 분들은 싱글리시의 억양이 워낙 강해서 이해하는데 좀 어려워하시는 분이 꽤 계십니다. 아시아권 국가라 한국과 비슷한 점도 많은 것 같습니다.,"학교에 중앙에 위치한 Student Services Hub에 가서 자원봉사를 하는 학생들에게 문제 사항을 이야기하면 문자로 digital queue 를 뽑아줘서 바로 상담이 가능합니다. 학교 연동 기숙사 문제, 수강신청 빌넣 등 다양한 문제를 여기를 통해 해결했습니다. 학부생 4명 중 1명이 교환학생인 SMU답게 교환학생을 전용으로 도와주는 CCA, ICON이라는 단체가 있습니다. 매학기 초에 열리는 학교 동아리 박람회에 가서 가입해보시고 ICON telegram chat에 가입해서 운영진들에게 이런저런 질문을 하면 많은 도움을 받을 수 있습니다. NUS나 NTU와 다르게 텔레그램챗을 정말 많이 사용하는 SMU에는 정말 다양한 채팅방이 있어서 질문을 하거나 도움을 받기 편했습니다. 매학기 SMU 국제처에서 페이스북 그룹을 만들어서 교환학생 초대 메일로 발송해줍니다. 교환학생들끼리 여행을 가거나 행사, 문제가 생겼을때 도움 요청 등이 가능하니 가입하시면 많은 도움이 될듯합니다. 교외적으로는 연세대학교-싱가포르 동문회가 있는데 잘 활성화가 되어 있는 동문회라 매학기마다 교환학생을 대상으로 선배님들께서 네트워킹 행사를 진행해주십니다. 2학기에는 연싱 연고전 (골프대회)가 진행되며 그 외에도 '연세인의 밤'과 같은 송년회 행사도 열렸었습니다. SMU로 파견된 연세대 학생뿐만 아니라 NUS나 NTU 연고대생들을 만들 수 있는 소중한 기회였습니다.","에어컨을 강하게 트는 것이 익숙하지 않은 한국인들이 모두 학기 초중반에 아프기 시작하는 것을 볼 수 있었습니다.날씨가 밖은 덥지만 실내에서는 에어컨을 20도 정도로 유지하는 편이니 꼭 긴팔을 챙겨가세요!SMU는 학교내 커리어 관련 행사가 정말 많은 편입니다. 리쿠르팅 시즌이 본격화되는 9월~11월초까지 2주에 한번 정도의 비율로 P&G, Accenture등의 기업 관계자들이 학교를 찾아 대형 부스를 설치하고 기업 설명회를 합니다. 기회가 되신다면 수업 전후로 방문해보셔도 좋을 것 같습니다.앞서 언급했듯이 현지 은행계좌를 만드는 것이 생각보다 어렵지 않은 편인데 많은 교환학생들이 만들지 않습니다. 생각보다 현지에 ATM이 별로 없고 기숙사 비용이나 보증금 등 큰 돈을 가지고 다닐 일이 많아 현지 계좌를 만드시는 것을 정말 추천해드립니다. 또한 한국 카드로 그랩을 연결하게 될 경우 수수료가 추가적으로 많이 발생하게 되어 경제적으로도 현지 카드를 만드시는 것이 유리합니다. 만약 계좌를 만드시지 않으신다면 국내 은행 중에는 카카오뱅크 환전이 수수료가 가장 저렴한 것으로 알고 있습니다. 현지에서 만약 환전을 급하게 하실 경우 Raffles 역에 있는 The Arcade가 가장 한화-싱달러 환율이 좋은 것으로 알고 있습니다. 이외에도 싱가포르나 SMU 교환학생 생활에 대해 궁금하신 점이 있으시다면 serenekim01@gmail.com으로 연락주시면 알려드리겠습니다. 저는 이 교환학생 프로그램을 통해 너무나도 배운 점이 많고 얻어간 점도 많아서 싱가포르, 그리고 그 중에서도 연대에서는 볼 수 없는 SMU만의 독특한 특색을알 수 있어서 정말 행복한 시간을 보냈습니다. 후배님들도 꼭 즐거운 시간을 보내시고 오시면 좋겠습니다!"
