gen_info,env_info,food_info,study_info,office_info,facil_info,mhct_info,help_info,etc_info
미네소타대학은 미네소타 주의 최대 도시인 Minneapolis와 St Paul에 위치하고 있습니다. 날씨는 정말 춥습니다. 약 11월부터 본격적인 겨울이 시작하여 4월 까지 눈이왔습니다. 바람도 매우 많이 불어 단단히 입고 다니시는 게 좋습니다. 눈이 너무 많이와 한번 휴교를 한 적 도 있었습니다. 하지만 실내는 난방이 잘 되어 있어 크게 걱정 하지 않으셔도 됩니다. 또 건물들이 지하통로로 연결이 되어있어 매우 추운날에는 통로로 지나다니고 했습니다. East와 West를 건너다닐 때에는 connector버스를 타고 다녀 매우 편리했습니다.,"미네소타대학은 가까운 곳에 쇼핑몰, 다운타운, 등이 위치해 있어 매우 편리합니다. 우선 미국에서 가장 큰 쇼핑몰인 Mall of America는 버스를 타고 레일을 갈아타면 30-40분 내에 갈 수 있습니다. 미네소타주는 옷에 세금이 붙지지 않아 옷을 꽤 싼 가격에 살 수 있습니다. 몰 내에 4개의 백화점이 각 모퉁이에 있으며 그 중간에 많은 상점과 놀이시설이 위치해 있습니다. 영화관도 몰 안에 있는데 가격은 한국에 비해서는 꽤 비싼 편입니다. 그리고 트윈스의 홈구장 메트로돔이 학교에서 버스로 5분거리에 있어 야구경기를 꼭 한번은 보시길 추천합니다. 남녀노소를 불문하고 스포츠를 사랑하는 열기를 느낄 수 있습니다. 그리고 큰 할인점인 타겟,컵푸드 등이 업타운 방향으로 버스로 20분 거리에 있습니다. 도착해서 이것저것 살 것이 많았는데 가까운곳에 있어 편리했습니다. 꽤 큰 도시임을 느낄 수 있는 다운타운에도 타겟할인점이 있으며, 타겟센터에서는 농구경기가 열린다고 들었습니다. 레스토랑, 바, 영화관 및 연극 관람을 할 수 있는 곳도 있습니다. 버스로 다운타운에서 조금더 가다보면 Sculpture Garden 이라는 곳을 갈 수 있는데 여기에는 유명한 조각인 Cherry spoon 등 이 있으며 유명한 박물관도 있어 전시회관람에 관심이 많으신 분은 가보기를 추천합니다. 10000개의 호수가 이 주의 상징인 만큼 많은 호수도 볼 수 있습니다. 이 Sculpture Garden에 도착해 조금만 걸어가면 매우 아름다운 호숫가를 볼 수 있습니다.","저는 Centennial Hall 에 머물렀습니다. 이 기숙사는 주로 freshmen이나 교환학생들이 많이 살고 있습니다. 제가 들었던 수업들이 다 이 기숙사에서 멀지 않았으며, westbank에 있는 수업이라 하더라도 shuttle bus 정류장에서 가까워서 불편함이 전혀 없었습니다.
이 기숙사는 Single room이 거의 70%가 된다고 알고 있습니다. 저는 2학기 모두 Double room에서 지냈습니다. 룸메이트는 1학기는 한국인, 2학기는 현지 freshmen 였고, 다 사이좋게 잘 지내서 룸메이트에 대한 불만은 딱히 없었습니다. 룸메이트를 바꾸고 싶으면 기숙사 manager에게 연락을 취하여 합당한 이유를 제시하여 바꿀 수 있습니다(그러나 학기시작하기 바로 전 혹은 직후에 하는 것이 가장 좋습니다). 가끔 외국인 룸메이트에게 문화적 충격?을 느껴 방을 single room으로 바꾸려는 친구들도 있었습니다. 제가 살았던 층은 그다지 시끄럽지 않았으나 다른 층은 좀 시끄러워 불평을 하는 친구들도 볼 수 있었습니다. 
식사는 이 기숙사 지하에 있는 UDS(university dining services)에서 하였고 14meals/week + 100Flexdine 을 선택했습니다. Meal plan은 교내 어느 UDS식당에서도 사용이 가능합니다(Saint Paul campus내 Bailey Hall 에서도 가능합니다). 처음에는 굉장히 맛있다고 매우 많이 먹었지만 서서히 질려서 14meals이 남을 때도 많았습니다. 주위에 비싸지 않은 식당도 많으므로 더 적은 meal plan을 선택하는 것도 나쁘지 않을 것 같습니다. Flexdine 은 교내에 있는 cafeteria에서 쓸 수 있는 plan인데 꽤 유용하게 쓴 것 같습니다.","도서관은 West Bank에 있는 Wilson library, 법대 도서관, 등 을 비롯하여 East Bank의 Walter Library, Biomedical건물안에 있는 도서관 등 이 있습니다. Biomedical 도서관이 기숙사에서도 가까워 주로 학생들이 그 도서관을 많이 이용합니다. 시설은 깨끗하고 편리하고 꽤 조용한 편입니다.
저는 수업은 전공보다는 교양을 많이 들었습니다. 기억이 남는 수업은 첫 학기에 들었던 Acting class입니다. 우리 학교의 연극의 이해 정도로 생각했었던 것과는 매우 달랐습니다. 우선 수업은 연극배우들이 사용하는 연극무대와 똑같이 생긴 곳에서 합니다. 마임, 감정표현, 또 학생들이 상황을 덧붙여 하나의 연극을 만드는것, 또 상황을 연기하는것 등 여러가지를 배웠습니다. 이론이 아니라 그때그때의 실습이므로 예습도 불가능하여 영어로부터오는 스트레스가 매우 컸으나 교수님과 다른 학생들이 많이 도와주어 그래도 재밌게 수업을 들을 수 있었습니다. 평가는 보고서 3개, solo performance 2, group performance 1, 수업 attendence(제일 중요한듯합니다...)로 이루어졌습니다.
또 하나 기억에 남는 수업은 Writing수업입니다. Non-native수업임에도 불구하고 매우 과제도 많고 배운 것도 많고 힘들었지만 남는게 남는 수업이었습니다. 매주 web에 올리는 숙제와 교재 숙제 및 paper가 동시에 나와 제일 시간을 많이 투자했던 것 같습니다. 또 하나 재미있었던 수업은 Piano입니다. 강사와 시간을 정해 매주 약 40분씩 수업을 받고 학기 내 3곡을 배우고 Final때 연주를 하고 평가를 받습니다.
이 외의 다른 수업들은 (전공 Electrical and Magnetic properties of Materials, 미시원론, 거시원론, Pronunciation(ESL), Badminton)한국의 수업과 크게 다르지 않아 생략하겠습니다.",West Bank에 국제교육부인 ISSS가 위치해 있습니다. 처음에 도착했을때 Hold가 걸려있는 것을 풀고 오리엔테이션을 열어 많은 도움을 받았습니다. 그 후에는 ISSS에 갈 일이 많지는 않았습니다. 학기동안에는 격주로 Coffee Hour라고 국제학생들 모임을 열어 주기도 했습니다.,"코프만이라고 불리는 학생회관에 가 보면 많은 동아리들이 있습니다. 저는 가입하지 않았었지만 꽤 재밌어 보이는 많은 동아리들이 있습니다. Tandem이라는 프로그램이 있는데 이 프로그램은 각 외국어를 배우고 싶어하는 학생끼리 연결을 시켜 줍니다. 저는 한국어를 배우고 싶어하는 한 외국학생과 partner가 되었었는데 잘 이용하면 꽤 유용할 것입니다. 
EastBank에 매우 큰 Recreation Center가 있는데 매우 많은 학생들이 매일 운동을 열심히 합니다. 저는 웨이트 트레이너를 신청을 하여 같이 운동을 했었는데 트레이너가 매우 재밌고 친절하여 좋은 추억을 만들기도 했습니다. 꼭 이 좋은 시설을 이용하시길 추천합니다.","저는 룸메이트가 sorority에 있었음에도 불구하고 다른 미국학생들과는 다르게 매우 보수적이었던 편이라 특별히 Culture shock을 느끼지는 못했습니다. 그러나 제 주위에 친구들은 룸메이트가 남학생을 방에 데리고 오는 등 어려움을 겪는 것을 많이 보았습니다. 
수업시간에 학생들이 교수님과 활발한 토론을 벌이고 때로는 반박도 하며 교수님이 학생과 동등한 위치에 있는듯한 느낌을 받았는데 나름 신선한 충격이었고 부러웠습니다. 또, 많은 미국학생들이 제가 생각했었던 것보다 주중에 공부를 매우 열심히 하는 것을 보고 많은 것을 배웠던 것 같습니다.","KISO라는 한인학생회, 한인교회에서 도움을 받으실 수 있습니다.","1년이라는 짧지 않는 시간. 미국의 선진 교육시스템에서 공부도 열심히, 최고의 시설을 갖춘 Recreation center에서 운동도 열심히, 기회가 되신다면 교내에서 아르바이트의 경험도 가져보고, 이 주 말고 다른 미국 주로의 여행, 또 어느 주보다 친절한 이 주의 사람들과 좋은 친구가 되기위해 열정적으로 시간을 보내신다면 정말 귀중한 추억이 되지 않을까 싶습니다."
"미네소타는 미국 중부에 위치한 곳으로 북쪽으로 캐나다, 남쪽으로 아이오와주, 동쪽으로 위스콘신주, 서쪽으로 사우스다코타주•노스다코타주와 접합니다. University of Minnesota(이하 U of M) twincity는 미네소타 주의 최대 도시인 Minneapolis와 St Paul에 위치하고 있습니다. 
날씨는 매우 추운 곳입니다. 그곳에 살고 있는 친구가 말하길 미국 50개주 중에서 알래스카 다음으로 추운 곳이라고 합니다. 제가 그곳에서 느꼈던 최하 체감온도는 -40℉입니다. 믿기 어렵겠지만 섭씨로도 같은 -40℃입니다. 날씨가 춥고 눈이 자주오기 때문에 4월까지는 눈이 쌓여 있을 정도 입니다. 
 하지만 겨울에 워낙 춥고 기후가 열악한 만큼 실내 시설이 완벽하게 구비되어 있습니다. 학교 뿐만 아니라 도심의 건물들 사이에, 연결 통로가 되는 skyway와 지하 통로가 있어 바깥을 나가지 않고도 건물을 이동할 수 있습니다. 그리고 난방시설이 완벽하기 때문에 실내에서는 많은 학생들이 반팔을 입고 있습니다. 또한 제설작업도 매우 빠르고 수시로 이루어지기 때문에 눈에 미끌어질 일은 거의 없습니다. 따라서 안타깝지만 눈이 엄청 많이 온다거나 영하 40℃까지 내려간다고 해서 휴강을 하는 일은 절대 없습니다.

캠퍼스는 우리나라처럼 경계가 뚜렷하지 않기 때문에 크게 보면 연세대학교 캠퍼스의 2배 작으면 1.5배정도 됩니다. 캠퍼스크기, 학생수 면에서 미국에서도 손꼽힐 정도라니 예상할 수 있을 것입니다. 넓은 만큼 이동의 어려움도 있지만 캠퍼스 내 무료 셔틀버스가 자주 운행하기 때문에 큰 불편은 없습니다. 오히려 학교가 크고 학생수가 많아서 좋은 점은 그만큼 시설이 많다는 것입니다. 학교 내에 볼링장, 소규모 실내 축구장, 건설중인 풋볼 경기장, 다이빙 시설까지 두루 갖춘 수영장 등의 대부분의 스포츠 시설을 가지고 있으며, 미술관 박물관, 6개의 기숙사, 호텔, 주차장 등 없는 것이 없습니다.","학교가 거의 도시 한가운데 있기 때문에 버스를 타고 10분만 가면 빌딩숲 도심에 갈 수 있습니다. 그곳에는 macy's, mashalls, saks fifth avenue, nieman marcus 등의 백화점이 있으며 대형 마트 Target도 있어서 그곳에서 필요한 것들을 샀습니다. 주말이면 발 디딜 틈 없는 클럽, 바, 레스토랑 영화관등이 있고, NBA에 속한 미네소타 팀버울브스의 홈구장인 타깃센터, 메이저리그의 미네소타 트윈스와 NFL의 미네소타 바이킹스의 홈구장인 메트로돔이 있어서 경기시즌이면 수많은 인파가 몰려 미국의 열기를 직접 체험 할 수 있습니다. 또한 미니아폴리스가 예술로 유명한 곳이라서 곳곳에 박물관, 미술관 등이 있으며 연극 공연도 많습니다.

 미네소타 주는 의류가 면세 상품이므로 쇼핑하기 최적의 장소라고 생각합니다. 게다가 학교에서 차로 30분 떨어진 거리에 미국 최대의 쇼핑몰 Mall of America (이하 MOA)가 있어 쇼핑을 좋아하는 사람에게 천국이나 다름없습니다. MOA는 3층으로 되어있고 쇼핑몰 가운데의 실내 놀이공원을 백여 개의 브랜드 매장이 둘러싸고 있으며, 쇼핑몰 네 귀퉁이로 blooming dales, Sears, Nordstrom, Macy's백화점이 위치하고 있습니다. 그리고 MOA 길 건너편에는 대규모의 IKEA매장이 있으며 물놀이 시설인 waterpark가 있습니다.

Minneapolis의 twin city 인 St. Paul에는 아기자기한 상점들과 다양한 종류의 바, 레스토랑들이 있어 주말에 친구들과 다녀오곤 했습니다. 

미네소타는 수많은 크고 작은 호수로 유명하기 때문에 날씨가 좀 풀리기 시작하면 호수로 산책온 사람이 많습니다. 또 차를 타고 멀리 외곽으로 캠핑을 하기도 하고 미시시피강에서 카누를 즐기기도 합니다. 미시시피강이 바로 캠퍼스를 가로지르기 때문에 여름에는 갖가지의 수상스포츠를 즐긴다고 합니다.","제가 살았던 곳은 middlebrook hall입니다. 캠퍼스가 미시시피강을 끼고 west bank와 east bank로 나뉘어 지는데, middlebrook hall은 west bank의 유일한 기숙사로 식사를 할 수 있는 dining center를 지니고 있습니다. semi private room형태라서 공중화장실(샤워실)이라기 보다는 two room당 one bathroom을 이용하도록 되어있습니다. 방안에는 소규모 붙박이장, 화장대, 책상, 침대가 있으며 룸메이트가 있었기 때문에 모든 것이 두 개씩 있었습니다. 각방마다 온도 조절 가능한 냉난방시설이 있고 창문이 있습니다. 

식사는 Meal plan을 신청해서 일주일에 14끼를 기숙사 식당에서 먹었습니다. meal plan을 이용할 수 있는 기숙사 식당이 5~6개 되는데 어느 곳에서나 식사할 수 있습니다. 제가 머물렀던 middlebrook의 요리가 맛있기로 소문난 곳이라 음식에 대한 불만은 없었습니다. 항상 씨리얼과 샐러드바, 스프, 과일, 쿠키, 아이스크림 등이 준비되어 있고 모든 것이 부페 형식으로 원하는 만큼 먹을 수 있습니다. 주 요리는 햄버거, 피자, 파스타, 샌드위치, 메인 고기요리, 감자튀김 등으로 즉석에서 요리를 해주기도 합니다. 

기숙사 식당 외에도 직접 사먹을 수 있는 식당 등도 많습니다. 맥도날드, 버거킹 등의 패스트푸드점과 중국요리, 베트남 요리, 피자배달, 멕시칸 요리가 있으며 한국 식당도 하나 있어서 한국 친구들과 자주 가곤 했습니다. 하지만 기숙사 식당에 비해 조금 비싼 편이라 저는 주로 기숙사 식당을 이용했습니다.","학교가 큰고 학생수가 많은 만큼 시설도 갖춰지고 전공도 다양해서 지금까지 생각해봤던 모든 수업은 다 있다고 해도 과언이 아닙니다. 저는 경영 전공 과목 두 개와 나머지는 평소에 듣고 싶었던 과목을 수강했습니다. 저는 볼링, 스쿼시, 그림 그리기, 도자기 수업을 들었고 모두 학교 내 시설에서 이루어졌습니다.

도서관은 우리 학교처럼 중앙 도서관이 크게 자리잡고 있는 형태가 아니라 몇몇 학부 별로 연세 대학교의 중도만큼 큰 도서관이 있기 때문에 소장 도서도 매우 많고 사용 가능한 pc도 많으며, 공부 할 수 있는 공간도 많습니다. 하지만 우리학교와는 달리 24시 운영하는 곳이 없기 때문에 주로 study room을 이용하거나 24시간 개방하는 학교 건물의 빈 강의실을 이용하곤 했습니다.","미네소타는 타지역에 비해 외국인이 적습니다. 제가 들었던 전공 수업에서는 30여명 중에서 흑인은 없었고 동양인은 저와 다른 교환학생 친구 한 명이었습니다. 또한 교환학생 제도가 활발히 진행되고 있지 않은 건지는 잘은 모르겠지만 교환학생 수가 매우 적었습니다. 따라서 학교에서 외국의 많은 학생들을 유치하려고 노력하고 더욱 친절하게 대해 주려 합니다. 국제 학생들을 위한 ISSS 센터가 west bank에 위치하고 있으며, 국제학생으로서 비자 문제가 발생하거나 어려움이 있을 때 도움을 받을 수 있습니다. 그리고 격주로 금요일에는 한 나라를 테마로 정하여 small coffee hour world를 열어 전통 음식을 제공하고, 다른 국가에서 온 국제학생들 간의 만남의 자리를 제공합니다.","west bank에서 east bank로 이동할 때 다리를 건너게 되는데 그곳에서 포스터 및 그림을 통해 많은 동아리 정보를 얻을 수 있습니다. 학생수가 많은 만큼 온갖 종류의 동아리가 있고 가입 할 수 있습니다. 한국인들을 위한 학생회도 있으며 그곳에서도 다양한 활동을 합니다. 

ISSS에 신청을 하면 언어 교류를 위한 파트너도 지정해주곤 하여 한국말을 배우고 싶어하는 친구들을 만나 한국어를 가르치기도 하고 또 그들로부터 영어를 배울 수도 있습니다. 

제가 학기동안 가장 많이 이용하였던 곳은 Recreation Center입니다. 이곳은 스포츠 센터로 헬스, 농구, 수영, 축구, 스쿼시, 배드민턴, 라켓볼 핸드볼 등 모든 스포츠를 즐길 수 있습니다. 시설을 이용하려면 학기당 $50정도를 지불하고 추가로 $50 정도를 내면 수영, 에어로빅, 요가, 필라테스 프로그램 등을 마음대로 수강할 수 있습니다. 

도시에 있는 학교라서 밤에 혼자 돌아다니기엔 위험할 수 있습니다. 특히 겨울엔 해가 일찍 저물기 때문에 수업 끝나고 돌아갈 때에도 깜깜한 밤이 되기도 합니다. 따라서 학교에서는 캠퍼스 내 사건, 사고를 방지하고 학생들의 안전을 위해서 무료로 에스코트 서비스를 제공합니다. 서비스 센터에 전화를 걸어 자신이 지금 있는 장소를 말하면 훈련된 학생들이 와서 목적지까지 함께 걸어가주는 서비스 입니다. 저도 늦게까지 친구 기숙사에서 놀다가 제 기숙사로 돌아가려는데 이용해본 적이 있는데, 미국이란 곳이 인적이 드문 시간엔 무척이나 위험하기 때문에 이용하면 좋을 것 같습니다.","룸메이트가 있다면 기숙사에 남자친구를 데리고 오는 일이 있다고 말로만 들었지 저에게 발생할 줄은 몰랐습니다. 그래도 제 룸메이트가 워낙 착하고 다른 미국 학생들에 비해 순진한 편이라서 대수롭게 여기진 않았습니다. 
그리고 우리나라와는 달리 기숙사가 남녀구분이 명확하지 않아서 밤에 종종 남자 애들이 여자애들 방으로 놀러오곤 했는데 옆방에서 남자목소리가 들리면 처음엔 놀라곤 했습니다. 또한 여학생이 사용하는 화장실인데 아침에 남학생이 수건만 두르고 나오는 장면도 목격되기도 해서 당황하곤 했습니다.  

미국이란 곳이 워낙 빈부격차가 심한 곳이라서 강도가 많습니다. 네비게이션을 훔치기 위해 차 유리창을 깨는 위험을 감수하기도 하고, 새벽에 지나가는 행인을 총으로 위협하면서 해가면서 훔쳐가는 것이라곤 고작 핸드폰과 MP3입니다. 그들에겐 작은 것이라도 훔쳐서 팔아도 이익이기 때문에 인적이 드문 곳이나 어두운 시간에는 스스로를 조심하는 것이 좋다고 생각됩니다.

또한 미국은 21세 이상이 되어야 술을 마실 수 있어 대학생들의 절반 이상이 술을 마실 수 없습니다. 하지만 그들은 술 없이도 즐겁게 노는 방법을 알고 있습니다. 취해야만 춤추는 것이 아니고 밤에만 놀 수 있는 것이 아닙니다. 그들은 레모네이드만 마시고도 취한사람처럼 신나게 춤추고 햇빛이 쨍쨍한 낮에도 넓은 잔디밭에서 남녀할 것 없이 프리즈비를 던지며 즐거워 합니다. 이런 점은 매우 본받고 싶었습니다.

그리고 아침에 일찍 일어나서 꽃 단장을 하고 오는 우리 학교와는 달리 대다수의 학생들이 Minnesota라고 크게 적혀있는 후드티를 즐겨 입고 가방은 남녀할 것 없이 큰 배낭을 매고 다닙니다. 화장기 없는 얼굴이 대부분이고 구두를 신는 사람은 거의 찾아보기 힘듭니다. 그러한 모습을 전혀 부끄러워하지 않고 내면의 모습으로 평가하는 문화가 신기하기도 하면서 부러웠습니다.","앞서 말했듯이 국제 학생을 위한 ISSS센터에서 도움을 받을 수 있습니다. 저도 처음에 전산상의 오류 및 비자 문제로 학생카드도 만들지 못하고 수강신청조차 하지 못해서 고생을 많이 했는데 이곳에서 많은 도움을 받았습니다. 
각 학부마다 사무실이 있어서 수업에 관하여 레벨 등의 상담을 받을 수 있으며, 수강 허가를 받기도 합니다. 
캠퍼스 중앙에 위치한 Coffman Union(학관)에서 Information Center를 이용하여 교통정보, 수강편람 등의 정보를 얻을 수 있고, 또한 지하에서 U-card를 만드는 곳에서 학생증을 만들고 TCF 은행 계좌를 열었습니다.


그리고 저는 크리스쳔이라서 한국 교회에서 정신적으로 많은 도움을 받았습니다. 한국 학생회(KISO) OT를 가면 다양한 한국 친구들을 만나고 학교에 관한 정보를 얻을 수 있습니다.","교환학생을 미네소타로 왔다고 해서 그곳에만 머무르라는 것이 아닙니다. 기왕 미국을 온김에 최대한 미국을 경험하는 것이 좋다고 생각합니다. 공부도 중요하지만 제가 우선시 하던 것은 경험이기 때문에 저는 여행을 많이 했습니다. 미국 내 비행기는 미리 예약을 하거나 수시로 찾아보면 왕복 비행기가 무척이나 저렴합니다. 게다가 비행기 예약 절차가 복잡하거나 어려운 것이 아니라 인터넷으로 비용을 지불하고 e-ticket을 출력해서 공항으로 가기만 하면 됩니다. 
미네소타는 시카고와 차로 6시간 비행기로 1시간 정도의 거리에 있어서 미네소타에 가면 한번쯤 들를만한 곳입니다. 저는 봄방학과 학기가 끝난후의 틈을 통해 서부지역을 여행 했습니다. 특히 외국친구들과 2주간 시애틀에서 샌프란시스코까지 미국 국립공원에서 캠핑을 했는데, 그 경험은 절대 잊을 수가 없습니다. 

결심이 굳고 부지런하기만 하다면 이곳 U of M에서도 미국의 모든 것을 체험할 수 있을 것입니다. 특히나 이곳에는 외국인이 다른 대도시보다 드물기 때문에 우리에 대한 관심도 많고 더 알고 싶어합니다. 그들이 미국인이고 모두 개방적이고 적극적이라고 생각하겠지만, 결국 그들은 미네소타 각 지역에서 모인 부끄럼 많은 시골 학생들 대부분 입니다. 따라서 우리가 조금만 용기를 내어 먼저 다가간다면 더욱 많은 친구를 사귈 수 있고 소중한 추억이 만들 수 있을 것입니다."
