gen_info,env_info,food_info,study_info,office_info,facil_info,mhct_info,help_info,etc_info
"제목에 썼듯, 크기는 많이 다르지 않습니다. 강의동 간의 거리가 크게 멀지 않아 캠퍼스 안에서는 걸어다니기에 큰 무리가 없습니다. 다만 사는 곳에서 캠퍼스까지의 거리가 꽤 있는 경우가 대부분이라 자전거를 타고 다니는 경우가 많습니다. 
일단 Fullerton이라는 지역은 LA와 매우 가깝습니다. 미국은 땅덩어리가 넓기 때문에 자동차로 20-30분 내외에 있는 지역이면 ''매우 가까운 거리''라고 볼 수 있는데, LA는 교통정체가 없는 경우, 30분이내에 갈 수 있습니다. 따라서 이 곳은 한인들이 살기에 매우 좋습니다. 물론 걸어갈 수 있는 거리에는 한인 식당이 없지만, 차를 타고 가면 한인마트나 한인식당 등이 널려있습니다. 버스를 타고 20분 내외로 갈 수 있는 쇼핑몰도 있습니다.
제가 갔던 때는 봄학기였지만 2월 말에 수업이 시작했는데 생각했던 것보단 쌀쌀했습니다. 저는 캘리포니아라고 해서 매우 따사로운 햇살이 있을거라고 생각했지만 혹시나 해서 가져갔던 긴팔 외투(가을용)를 학기 내내 입고다닐 정도였습니다. 그곳 주민들도 요새 날씨가 이상하게 추워졌다고 말하곤 했습니다. (이상기후가 전세계적으로 퍼지고 있나봅니다 ㅜ_ㅜ) 비도 많이 왔습니다. 우리 나라 장대비는 아니더라도 흩뿌리는 비가 계속 내렸답니다. 그러나 보통 캘리포니아 기후는 아닙니다.","주변에는 캠퍼스 밖에 위치한 기숙사, 아파트 등의 주거시설들이 있습니다. 그리고 식당들이 조금 있습니다. 그러나 걸어다닐 생각하시지 마시고 자전거 타고 다니세요. (혹시 자전거 못타시면 배우시는 편이 나을겁니다ㅋ)
위에 말씀드렸다시피, 버스타고 20분 내외에 Brea mall이라고 웬만한 거 다 있는 쇼핑몰 하나 있습니다. 또한 CSUF하면 ''디즈니랜드''학교로 유명한데요, 디즈니랜드가 버스타고 30분 내외에 있습니다. 저도 버스나 차를 타고 종종 다운타운 디즈니에 다녀왔습니다. 다운타운 디즈니에 가면 무료로 매일 저녁 8-9시쯤 터지는 폭죽놀이를 관람하실 수 있습니다. :)","저는 기숙사를 신청해서 out of campus dorm에 살았습니다. 제가 묵었던 기숙사의 정식명칭은 ''University Village''에 살았습니다. 선배들이 기숙사 들어가기 어렵다고 써놨지만, 이메일로 그 학교 adviser에게 물어봐서 기숙사에 TO가 있다는 이야기를 듣고 신청하게 되었습니다. 캠퍼스 안에도 기숙사가 있는데, 정원이 많지 않아 될 가능성은 낮을 것 같지만 밑져야 본전이므로 물어보세요. :)
University Village 에 카페테리아가 있습니다. 식사는 이 곳에서 주로 하려고 노력했지요. 기숙사비에 식비까지 포함된 것이기 때문입니다. 그러나 아침/점심을 10시30분부터 주는 관계로 조금 불편합니다.(하루에 두끼 제공합니다. 아점 한번, 저녁 한번 2시간 정도씩 열어놓구요. meal card제공하지만 시기 지나면 자연 소멸됩니다. 즉 놓치면 없음.입니다. 공강이 없어서 밥 먹으로 기숙사로 올 수 없는 학생들을 위해 미리 샌드위치를 신청해놓으면 아침에 카페테리아에서 받아갈 수 있습니다.) 수업이 9시에 시작하면, 아침 못먹고 캠퍼스 나가야 하고, 공강이 있으면 다행히 다시 들어와서 점심을 먹더라도 오후 수업 하러 다시 캠퍼스로 나가야하거든요. 그런데 이게 은근히 귀찮답니다 :P 기숙사라고 해도 캠퍼스에서 자전거타고 10분정도 걸리거든요. (가는 길에 신호등도 있답니다.)
캠퍼스 안에 식당이 있긴 합니다. 그러나 저는 개인적으로 우리학교가 나은 것 같습니다. 강의동마다 식당이 있는 우리학교와는 달리, 그곳은 학생회관 안에 있는 4개정도 코너가 다입니다.(가격도 매우 비쌉니다.)
캠퍼스 주변에 식당이 있습니다. 그러나 거리가 꽤나 애매합니다. 차타고 가기는 멀고 자전거 타고 가면 좀 귀찮을 정도의 거리. 걸어가면 꽤나 먼. (공강 시간 활용해서 밥 먹으러 다녀오긴 불가능한)
친구들과 함께 차를 타고 밥을 먹으러 나갈 수도 있습니다. 역시 비쌉니다. 세금과 팁 포함하면 1인당 10불이 훌쩍 넘습니다.
캠퍼스 내에 기숙사 용 카페테리아를 공사하던데, 언제 완공될 지는 모르나 이 곳에 대체적으로 적당한 학생용 식당이 될 가능성은 있군요. (그러나 미지수)","수업은 우리학교 영어로 강의하는 수업 들어보셨으면, 전혀 무리 없이 들으실 수 있습니다. 똑같거나 어쩌면 오히려 수준은 낮습니다. 
도서관은 일층과 지하에 컴퓨터가 있고, 3층에 조용히 공부하는 공간이랑 조모임 공간 있습니다. 도서관이 시끄러워서 공부하러 가본적은 거의 없습니다. 컴퓨터는 꽤 많아서 사용하기에 어려움은 없습니다.
도서관에 Writing center이용하시면 좋습니다. 문법 교정 봐줍니다. 1층 구석에 하나 있고 2층인가 3층에 또하나 있는데, 두개가 약간 다른 시스템인데 둘다 이용해보세요. :)",저는 개인적으로는 많이 찾아가보진 않았습니다. ㅜ.ㅜ; 문제 있으면 달려가기엔 아주 좋은 곳입니다. 저는 다행히 친절한 Adviser이었습니다.,"KCCC 들어가시면 좋은 친구들 많이 사귈 수 있으실 거에요 :) Crystal 이라고 하시면 다 알겁니다.ㅋㅋ
학기 초에 여러 동아리들이 홍보하는 테이블 많이 놓일텐데 그 중에 관심있는 동아리 찾아가시면 될겁니다.
전 KCCC 오픈채플에 가서 친구들 많이 사귀고 계속 그 친구들과 재밌는 시간 보냈어요. 공부만 하시지 말고 꼭 동아리 들어가세요! 어차피 영어는 최소 토플 80 넘으시면, 더 늘고 오긴 힘듭니다.ㅋㅋ 의사소통 다 되기 때문에 안늘어요~~ (그래도 난 영어를 늘어야겠다 하시는 분은 Writing class들으세요) 전 KCCC로 만난 친구들 덕분에 기대했던 것보다 더 많은 걸 얻어올 수 있었다고 생각합니다.","어떤 분이 그러시던데 사람사는 곳 다 똑같다고.. 저도 동의합니다.
사실 저는 미국에 처음에 가봤는데, 특히 ''대학''이라는 공간은 한국과 매우 유사하더군요. Shock까진 없었고 동아리 활동하며 만난 친구들의 생활양식들을 보면서 배운 점들은 있습니다. 
참! 여기는 서부라서 매우 여유로워요. :) 한국에서 복닥복닥 거리고 살던 것과는 좀 비교됩니다.ㅋㅋ",저는 주로 KCCC친구들에게 도움을 많이 받았습니다. 물론 Adviser에게도 많이 도움 받았죠.,"저는 일부러 교환학생 없다길래 이 학교를 선택했는데, 그것도 이제 옛날 일인가 봅니다. 제가 갔을 때 한국의 한 학교에서 무려 80여명(60명인가?)의 학생을 파견했습니다. 한 학교입니다. 이 외에도 다른 학교에서 많이 와서 교환학생에서 차지 하는 한국인의 비율이 가장 높았습니다. ㅜ_ㅜ 어딜가나 한국말이 들리고 한국어만 사용해도 무리 없이 살 수 있는 곳. 바로 이곳이었습니다. 영어 배우고 싶으신 분들 중에 이미 CSUF됐다 하신 분들. 교환학생으로 온 한국인 친구들이랑만 어울려 다니지 마세요. 그러면 큰 무리 없으십니다. :) 어울리지 말란 소리가 아니라, 끼리끼리만 다니지 말라는 이야기입니다. :) 다들 잘 하실거라 믿어 의심치 않습니다! 
멋진 경험 하고 돌아오시길 바라겠습니다! :D"
"CSUF의 크기는 그리 크지 않습니다. 연세대학교가 비교적 큰 학교여서 그런지 작고 아담한 크기의 학교가 꽤나 마음에 들었습니다, 그렇다고 그리 작은 크기는 아니고 적당한 크기의 캠퍼스라 다니기에 편했습니다. 위치는 풀러튼 시내에서 차로 10분 정도 거리에 떨어져 있습니다. 주변에 마트나 기본적인 생활에 필요한 시설은 다 갖추어져 있어서 생활에 불편함을 크게 느끼지 않았습니다. 제가 처음 도착한 8월에 캘리포니아의 기후는 덥지만 불쾌하지 않은 날씨였습니다. 낮에는 37도까지 올라가는 더운 날씨이지만 습하지 않아 그늘에만 가면 시원해지고 밤에는 가벼운 재킷을 걸쳐야 할 정도로 쌀쌀합니다. 딱히 겨울이라고 일컬을 만한 시간이 없었지만 12월 중에 약 일주일 정도 비가 왔을 때는 꽤 추워서 두꺼운 옷을 입고 다닌 기억이 있습니다. 옷을 가볍게 들고 가고싶으시다면 두꺼운 옷은 가서 한두벌 정도 구매하시는 것을 추천합니다.",대학주변에 각종 편의 시설이 있어서 생활은 불편하지 않았습니다. 하지만 술과 유흥을 즐기시는 분이라면 조금 멀리 떨어져 있는 다운타운을 가야하기 때문에 불편하실지도 모르&#44248;습니다. 한인마트가 차로 15분 정도에 떨어져 있어서 차가 있으시면 한인마트에서 한국음식이나 필요한 것들을 구매하는 것도 나쁘지 않습니다.,"거주 형태는 매우 다양합니다. 저는 처음에는 미국 문화를 알고, 미국인 가정에서 살아보고 싶은 마음에 홈스테이를 했습니다. 홈스테이를 원하시면 학교의 홈스테이 담당 부서 메일을 보내서 신청하시면 됩니다. 저는 굉장하 좋은 영국계 미국인 부부의 집에서 일본인 친구와 함께 홈스테이를 하였습니다. 휴일이나 명절마다 함께 소풍도 가고 외식도 하고 해서 굉장히 즐거웠습니다. 하지만 복불복이다 보니 안좋은 집으로 가게 되면 맨날 냉동음식만 먹고, 각종 제약과 스트레스에 시달리는 경우도 봤습니다. 홈스테이를 한 학기 한 후에는 방을 구해서 이사를 갔습니다. 앞서 살았던 한국인 친구가 살던 곳에 그대로 들어가게 되었습니다. 함께 사는 친구들은 미국인 쌍둥이들이었는데, 무척 착해서, 한인마트까지 차로 태워주고 같이 음식도 해먹는 등의 즐거운 생활을 보냈습니다. 다만 유의할 점은 처음에 계약을 할 때 6개월 혹은 12개월과 같이 계약을 하기 때문에 집을 나갈 기간을 잘 조절해서 이사를 들어가시라는 겁니다. 제가 그것때문에 한국으로 돌아오기 전에 조금 고생을 했습니다. 다른 친구들의 경우, UV(University Village)라고 해서 기숙사 형태의 집에 살았습니다. UV는 가격이 꽤 비싸지만 식당이 따로 있고 외국인 친구들과도 교류할 수 있습니다.","수업은 거의 신문방송학과 전공 수업을 들었습니다. 생각보다 수업이 어렵지 않고, 쉬운 내용을 토론 위주로 배우다 보니 굉장히 재미있었습니다.
도서관을 자주 이용했는데, 책을 빌리기 보다는 주로 조용하게 공부할 곳을 찾기 위해서였습니다. 또한 수업 중에 영화 수업이 있어서 영화를 보기 위해서도 많이 이용했습니다.",국제 학생들을 위한 부서가 있는데 전반적으로 사람들이 친절합니다. 특히나 한국에서 교환학생으로 가는 사람들이 몇명 없어서 해당 부서의 Jean Hotta라는 분이 굉장히 많이 신경을 써주었습니다. 매주 화수요일에 있는 Coffee Break에 가시면 많은 외국인 친구들도 사귈 수 있어서 좋은 기회로 이용하시기를 추천합니다.,"외국인 학생들을 위한 클럽이 있습니다. 가입비는 그리 비싸지 않습니다. 가입을 하시면 함께 하는 행사에 참여하실 수 있습니다. 저는 첫 학기에는 이 행사에 많이 참여를 해서 외국인 친구들과 교류를 할 수 있었습니다.두번째학기에는 외국친구들이 많이 생겨서 따로 클럽에는 가지 않았지만, 개인적으로 좋은 클럽이라고 생각합니다.","한국과 미국의 문화 사이에 생각보다는 괴리가 없었습니다. 다만 미국인 친구들의 말을 빗대면, 좀 더 적극적으로 자신의 의사를 표현하는 것이 좋을 것 같습니다.","처음에 가장 큰 도움을 받은 것은 홈스테이 가족들이었습니다. 홈스테이를 하시게 된다면 많은 도움이 될 것입니다. 학교 내에서는 국제학생들을 위한 부서에서 많은 도움을 받을 수 있을 것입니다. 모르는 것이 있을 때, 언제든지 메일이나, 방문을 통해 도움을 받으실 수 있습니다. 가서 현지인 친구를 사귀게 된다면 굉장히 큰 도움을 받으실 것은 말할 나위가 없습니다.","캘리포니아라는 곳은 특히 다른 여타의 미국 지역 중에서도 매력이 있는 곳입니다. 한국인이 많다는 것이 어떻게 생각하면 외국생활의 걸림돌이 될 수도 있지만 한편으로는 심리적으로 많은 도움이 되는 것도 사실이기 때문에 이 점을 괘념치 않으셨으면 합니다. 캘리포니아의 푸른 하늘과 시원한 바람, 좋은 친구들을 다른 분들도 꼭 느껴보셨으면 합니다."
"교환대학의 크기는 연세대학교와 비슷한 크기이지만, 언덕이 없고 평탄하여 그다지 크게 느껴지지는 않았습니다. Fullerton은 LA 북동쪽에 위치해 있으며, 남쪽으로 차로 10분이면 디즈니랜드가 있는 Anaheim, 20분이면 캘리포니아 바다에 다다를 수 있는 곳에 위치해 있습니다. 사막기후이기 때문에 낮에는 덥지만 습하지 않아 기분나쁜 폭염이 아니라 건물안이나 그늘안에 있으면 그냥 더운정도 였고, 겨울에는 낮엔 반팔을 입고 저녁때는 우리나라 초겨울날씨와 같이 추워 파카를 입습니다.","대학가이고 기숙사가 모자라는 학교이므로 주변은 학생들이 자취할 수 있는 아파트가 둘러싸고 있습니다. 학교근처에는 걸어서 갈 수 있는 거리에 은행, 핸드폰센터 verizon과 멕시칸음식점, 햄버거 패스트푸드점, 데니스, 식료품점, Target 등이 위치해 있습니다.","거주형태는 무지 다양합니다. 기숙사는 들어가기 희박하다고 보시면 됩니다. 기숙사가 모자라기 때문에 학교뒷편에 학생들을 기숙사처럼 관리하는 University Village 라는 아파트도 있습니다(이건 식사제공). 저는 Website인 Craigslist의 게시판 글을 통해 주인과 연락을 주고 받은 후 거주지를 구하였고, 일년 동안 두번 이사를 했는데, 학교 근처 family house에서 방하나를 렌트해서 그 집에 잇는 가족들과 하숙형태로 살았고 식사는 직접해서 먹었습니다. 하숙형태이므로 자유롭지는 못하지만 깨끗하고 넓은 집을 공유할 수 있다는 장점이 있습니다. 두번째 이사한 family house는 쌍둥이 아들이 있어서 친구가 되었고, 아주머니도 음식해주시는 것을 좋아해서 이때는 그냥 얻어먹었었습니다. 또 하나는 학교 근처 걸을 수 있는 거리에서 미국친구 세명과 방2개짜리 아파트를 공유하였습니다. 방하나는 제방이었고 화장실과 부엌을 공유하는 형태였는데 조금더 자유롭긴 하지만 설겆이과 청소들을 자주 미뤄서 깨끗하지 못했지만, 룸메이트들과 친해질 수 있었습니다.","수업은 교양과목을 듣는 것을 추천합니다. 특히 CSUF는 생물학과에 사막생태학과 해양학 등 Field Camp를 갈 수 있는 수업이 열리기 때문에 추천합니다. 저는 사막생태학을 들었는데, 3박4일 사막에 현장학습을 가서, 들쥐 덫을 놓아 들쥐잡고, 평광등을 비춰 밤에 전갈을 잡기도 했는데, 함께 현장학습동안 먹고자며 좋은 추억을 많이 만들었고 평생 보지못할 수 잇었던 경이로운 생물체와 풍경들을 볼 수 있었습니다. 또하나 추천할 과목은 연극수업입니다. 연극이라 어려운 구어체가 나오기도 하지만 미국친구들과 연극을하면서 친해질 수 있었고 영어스피킹에 도움이 많이 &#46124;습니다. 마지막으로 Japanese 수업에는 일본과 한국에 모두 관심이 많은 학생들이 모여있기 때문에 수업도 쉽고 친구와 친해지기 수월합니다. 도서관에는 영어튜터링 신청을해서 일대일로 과외를 받을 수 있으니 적극 이용하세요",학기 초기엔 Coffee Break에 참석해서 친구를 사귀는 프로그램이 국제교육부에서 제공하는 전부라고 봅니다. 나머지는 모두 알아서 해야합니다. 국제학생이 워낙많은 학교이기 때문에 국제교육부에서 따로 교환학생을 배려해주지 않습니다.  국제학생동아리인 ISA 에 들어가면 오히려 도움이 많이 됩니다.,"학교 Titan 건물 지하에 볼링장 당구장이 있으며, 일층 카운터에서는 디즈니랜드나 넛츠베리팜과 같은 놀이동산 티켓을 싸게 구매할 수 있습니다. 또한 연극학과와 댄스학과가 유명하기 때문에 tiCKET bOX에서 그때그때 하는 공연을 $10이하로 관람할 수 있습니다. 비싸지 않지만 볼만했습니다. Gym에는 실외수영장, 트랙, 암벽타기 등을 연세 교환학생이면 무료도 등록해 이용할 수 있었지만 전 운동은 안좋아해서 딱한번 암벽타기만 해보고 말았는데, 제 친구는 맨날 운동하면서 잘 활용했던것 같습니다.","Sorry, Thanks라고 말하는 것에 무지 익숙하고, Private Space를 존중합니다. 하지만 친구끼리 만나면 포옹을 하는 등, 친구끼리 신체접촉이 우리나라보다 더 자유롭습니다. 나이없이 친해질 수 있다는 점, 교수와 거리낌없는 사이가 될 수 있는 점이 Culture Shock까지는 아니어도 문화차이라고 느껴졌습니다.","처음 도착해서는 국제처에 나를 담당하고 계신 Jean 교수님 (담당교수님)이 제일 도움을 많이 주시고, 나머지는 친해진 친구들이 도움을 줍니다. 수업을 따라가기 힘들다면 도서관 3층(아마 맞을꺼에요)에서 영어튜터링을 신청하거나, 그 과목 튜터링을 신청하면 튜터에게 도움을 받을 수 있습니다.",좋은 추억 만들고 오세요
캠퍼스는 그렇게 크지도 작지도 않고 경사가 거의 없기 때문에 걷거나 자전거를 이용하기 편합니다. Fullerton은 매우 안전한 도시이므로 변을 당할 위험은 적은 편입니다. 캘리포니아는 사막 기후로 낮에는 무척 덥습니다만 밤에는 또 꽤나 서늘하므로 반팔만 챙겨갔다간 낭패를 보기 쉽습니다. 하지만 주변에 저렴하고 알뜰하게 쇼핑할 수 있는 공간도 있으므로 짐가방을 가볍게 하고 싶다면 굳이 바리바리 싸들고 갈 필요는 없을 겁니다.,"Fullerton은 시골입니다. 대학 주변은 학생들의 주거지역과 상권으로 이루어져있고, 캘리포니아라는 곳 자체가 워낙에 뭐든지 다 떨어져있기 때문에 차를 소유하고 있지 않으면 창살없는 감옥에 갇혀있는거나 다름없습니다. 그러므로 차 있는 친구를 많이 사겨둬야 합니다.",저는 한국에서 craiglist를 통해 현지인 하우스에 방 하나를 렌트하였습니다. 하지만 영어를 못하는 칠레 노부부의 집에 들어가 곤란한 점이 많았습니다. 혹시나 craiglist를 통해 방을 구하시려고 한다면 생각을 달리 해보시기 바랍니다. 학교 남쪽 길건너편에 College Park라는 건물이 있고 그 뒤로 주차장이 펼쳐져있습니다. 그 주차장을 지나면 Pointe라는 이름의 갈색으로 된 아파트 단지가 나오는데 그곳에서 친구와 둘이 생활하면 저렴하고 편리하게 학교생활을 만끽할 수 있을 것입니다. 같이 살 친구가 없다면 현지 국제처에 의하며 그곳에서 룸메이트를 구하는 학생들이 없나 알아보십시오. 최고의 선택입니다.,"수업은 그다지 어렵지 않습니다. 전 한학기 동안 광고론, 대인관계커뮤니케이션, 비즈니스중국어, 초급일본어, 펜싱 수업을 들었습니다. 광고론은 미국독립 이후 가장 쉬운 대학강의라고 자신할 수 있습니다. 그 수업에 총 3시간을 투자하여 A+을 받지 못하였다면 제가 귀국 후 신촌에서 밥을 사드리겠습니다. 물론 교수님을 잘선택하여야합니다. 아마 Coal이나 그 비슷한 이름의 여교수님인데 수업도 재미있게 하시고 무척이나 관대하신 분입니다. 대인관계커뮤니케이션은 수업은 재미있으나 시키는게 많아서 나머지 4개과목을 합친것보다 더 저를 짜증나게 했던 수업입니다. 나머지 수업은 그냥 친구 많이 사귀려고 들었습니다. 펜싱 추천합니다.","전 별로 찾아가본 기억이 없어서 잘 모르겠습니다. 국제교육부 산하의 국제학생동아리 ISA에서 활동하여 친구들을 좀 만났는데, 다들 착하고 재미있는 친구들입니다. 입학 후 첫 교내활동이 될 것이라고 생각합니다.","CSUF는 속칭 commuter school이라고 하여, 학생들이 수업 끝나고 바로 차타고 집으로 가버리는 야속한 학교입니다. 물론 본인이 외국경험이 있어 미국문화를 잘 알고 영어도 네이티브급으로 구사할 수 있으시다면 식당에서 햄버거 먹다가도 옆테이블 앉은 사람과 친구 먹을 수 있겠지만, 그게 아니라면 새로운 친구 사귀기가 꽤나 힘듭니다. 제가 추천해드리는 방법은 동아리 활동에 많이 참여하는 것입니다. 저같은 경우는 위에서 말한 국제학생동아리와 더불어, ACS (중국학생회), KCCC (한국기독교학생모임) 등의 동아리에 참여하여 많은 친구들을 만났습니다. 그곳에서 만난 친구들을 통해 다른 동아리나 Fraternity같은 사교모임에 초대되어 또 다른 친구들을 만날 수 있으므로 처음 네트워크 형성이 중요하다고 생각합니다. 특히 ACS는 이름만 중국학생회일뿐 범아시아학생회나 다름없습니다. CSUF에서 가장 큰 동아리 중 하나이구요. 정말 착하고 좋은 친구들이 많습니다. 무조건 가입하시구요. 방학이나 연휴기간동안에는 저렴한 단체여행도 기획하므로 여행에 대한 부담도 줄일 수 있습니다. 가서 Jae의 친구라고 하시면 그 순간부터 VIP 리스트에 오르실 수 있습니다. 물론 수업도 친구들을 사귈 수 있는 또 하나의 통로입니다. 대형강의보다는 소규모 강의라던지, 운동이나 외국어 수업같은 취미형 교양강의가 더 효과적이겠죠. 하지만 가장 중요한건 역시 본인의 열린마음입니다. 항상 그 자리에 안주하기 보다는 다양한 배경의 사람과 교류하며 더 넓은 세상을 체험해보시길 바랍니다.",사람이 사는건 다 똑같습니다.,역시나 우선적으로 생각되는 곳은 국제교육부 사람들이구요. 그 밖에 한인교회나 한인 커뮤니티에서도 도움을 받으실 수 있을 것입니다.,Yorba Linda와 Placentia가 만나는 교차로 북동쪽에 Albertson이라는 대형마트가 있습니다. 그 왼편으로 세탁소가 하나 있는데 주인아저씨가 저희 선배님이십니다. 인사드리면 반겨주실겁니다. 빨래는 그곳에 맡기시길.
