gen_info,env_info,food_info,study_info,office_info,facil_info,mhct_info,help_info,etc_info
"Hendrix College는 미국 남부 Arkansas주에 있는 작은 사립대학교입니다. 제가 파견 될 당시 학생 수 증원을 하고자 학교에서 계획하고 있는 모습을 보았고 매년 10~20%정도 학생 수를 늘리고 있는 것 같기는 하지만 전체 학생 수가 1100여명인, 종합대학으로는 매우 작은 규모입니다. 캠퍼스는 아담하고 예쁜 빨간 벽돌 건물들이며 학교 안에 다람쥐가 뛰노는 그야말로 평화로운 환경입니다. 제가 처음 파견 되었던 8월에는 습도가 높고 많이 더운 편이었지만 겨울에는 한 해에 한 번 눈을 볼까한, 서울에 비해 비교적 따뜻한 기후입니다. 가기 전에 조사해 본 결과로는 매 계절 평균 온도가 한국보다 섭씨 5도 정도 높았습니다. 주도인 Little Rock에서 자동차로 30분 정도 북서쪽에 위치하고 있으며 주로 이곳에 있는 공항을 이용하게 됩니다. 처음 교환학생을 파견 나갈 때에는 학교에서 픽업을 해 주며 학기 중, 돌아올 때는 친구들에게 부탁하고 gas fee $10~20 정도 사례해 주는 것이 관례화 되어 있습니다. 공항에서 학교까지 택시는 $60 정도 하는 것으로 알고 있습니다.",이곳의 한가지 단점이라면 대중교통수단이 전무하다는 것입니다. 그렇지만 이곳 학생들의 대부분이 차를 가지고 있기 때문에 대인관계에 따라 큰 문제가 되지 않을 수 있습니다. 개인적으로 여기저기 돌아다니기 좋아하는 성격이라서 매우 답답하지 않을까 염려했었는데 실제 생활하는 동안 차 때문에 크게 고민했던 적 없이 여러 친구들의 도움을 많이 받았습니다. 친구들 자체가 차가 없으면 얼마나 불편할 지 잘 알고 있기에 쇼핑가거나 놀러 갈 때에 먼저 같이 가지 않겠냐고 물어보며 자신이 볼 일이 없을 때에도 흔쾌히 라이드를 해 주는 모습이 인상적이었습니다. 걸어갈 수 있는 곳으로 월마트가 있으며 차를 타고 조금만 나가면 음식점들과 아울렛 매장들(대도시의 어마어마한 크기의 아울렛 매장은 아닙니다) 여러 종류의 상점들이 있습니다. 또한 지역은행?(미국에는 특정 주나 지방에만 있는 은행들이 많습니다.)이 여러 종류 있는데 개인적으로는 이런 지역적인 은행 보다는 Bank of America같은 큰 은행을 이용하는 편이 다른 곳으로 여행을 할 때에나 여러 모로 유리한 것 같았습니다. 또한 우리은행과도 연관이 있어(벌써 일년 전 일이라 잘 기억은 안 나지만 우리은행의 해외은행?이던가 하는 연관 관계가 있습니다) 송금을 하실 때에도 특정 수수료가 면제 되는 등 다른 곳보다 이점이 있었습니다.,"현재 여학생 기숙사 3개, 남학생 기숙사 2개, houses(2층으로 방이 몇 개 있고 주방, 화장실등을 공용으로 씁니다), apartments(학교 캠퍼스 내,외로 여러 동이 있으며 주로 고학년들이 쓰게 됩니다. 현재 여러 동을 더 짓고 있습니다.) 이 중 교환학생은 기본적으로 기숙사에 거주하게 되며 한 학기 1~2명 정도 house로 배정을 받았습니다. 이것은 지원 사항이 아니라 기숙사 부족으로 어쩔 수 없이 배정한 것 같습니다. 
 사실 처음 해 보게 되는 기숙사 생활이었기에 두려움 반, 설레임 반이었는데 미국학생들과 같이 살고 행사도 같이 하면서 한 해동안 많이 정이 들었습니다. 물론 취침시간, guest policy등에 대해 룸메이트와 맞지 않을 경우 힘들어질 수도 있지만 이 경우 residents hall담당인 Connie에게 연락하면 결원이 나는 대로 방을 바꿀 수 있습니다. 여자 기숙사인 Veasey, Galloway, Raney 중 앞의 두 곳에서 생활 해 봤는데 Veasey는 1학년들, party girl들이 많이 살기로 유명합니다. 1학년들과 함께 오리엔테이션을 받고 같이 여행도 가기 때문에 이 때에 친해진 친구들과 같이 생활하게 될 가능성이 많다는 것도 장점인 것 같습니다. 방은 밝고 가구들도 새것입니다. Galloway는 주로 2학년 이상(2학년이 대다수이긴 하지만)이 거주하고 있으며 오래된 편에 나무 바닥이라서 삐그덕 거리는 소리가 거슬리기는 했습니다. 또한 가구들도 낡은 편에 속합니다. 그렇지만 나름대로의 아늑함이 있습니다. Galloway 중앙의 parlor에는 다른 기숙사의 로비들과 다르게 거의 항상 학생들이 같이 늦게까지 공부하는 분위기 입니다. Raney는 방은 veasey느낌에 가깝지만 한 번도 시끄러운 것을 본 적은 없습니다. 종교적인 색채가 강한 아이들이 많이 배정이 된다고 하던데 사실인지는 잘 모르겠습니다. 
 남자 기숙사인 Martin과 Hardin에 대해서는 많이 알진 못하지만 Martin에서는 매주 수,금,토요일에 1층에서 파티가 열리고 음악을 크게 틀어놓기 때문에 파티를 싫어하고 조용한 분위기에서 공부하기를 원하는 남학생이라면 Martin은 피하거나 3층 이상의 높이에 배정받을 수 있기를 적극!! 권장합니다. 3층 이상은 음악소리나 소음에 대한 영향이 많지 않다고 거기 사는 친구에게 들었습니다.  
 ISEP을 통한 교환학생은 의무적으로 카페테리아를 이용하게 되어 있습니다. 학교에 한 개밖에 없는 카페테리아이기에 친분을 쌓을 수 있는 좋은 기회로 활용할 수 있다고 생각합니다. 앞에 다녀오신 여러 분들이 언급하셨듯 이 카페테리아는 Arkansas주에서 제일 좋다고 합니다. 그래서인지 주말에 오시는 부모님들이 자녀분들을 데리고 나가 외식을 하는 것이 아니라 이 카페테리아에서 식사를 하시는 모습을 많이 봤습니다. 부페식이며 항상 5가지 정도의 메인 메뉴(베지테리안 식사 포함), 샐러드바, 패스트푸드 종류가 있는 익스프레스 바(음식도 만들어 먹을 수 있습니다), 아이스크림 및 쿠키(5종류 이상), 디저트(이것도 항상 몇 가지 종류) 등 하나하나 나열하기 힘들 정도입니다. 살이 잘 안 쪄서 고민하시는 분은 1년 후에 살이 포동포동하게 오른 자신을 발견 하실 수 있을 것입니다. 토요일 저녁은 운영하지 않으나 burrow라는 곳에서 피자, 베이글, 감자튀김, 스타벅스커피, 음료, 아이스크림 등을 팔며 학생증에 한 학기 당 $100씩 충전되어 있기에 이 돈을 이용해 저녁을 해결 하거나 군것질을 할 수 있습니다.","수업은 정규학생이나 교환학생에 관련 없이 4개 들을 수 있습니다.(체육 관련 과목 제외) 200만원정도 더 내면 한 과목을 더 들을 수는 있으나 정규학생중에서도 5과목을 듣는 학생은 1년 있는 동안 딱 한 명 있었습니다. 이 학교는 pre-med를 양성하는데에 유명해 이과생의 절반 이상이 이 과정을 밟고 있었고 관련된 과학쪽 수업 과목도 비교적 여러개인 것으로 알고 있습니다. 또한 문과쪽은 철학, 종교로 유명하여 이 관련 수업도 꽤 있는 것으로 압니다. 그렇지만 상경계열은 들을 수 있는 과목의 수가 별로 없고 그나마 본교에서 이수했던 것들이 대부분이라 고를 수 있는 여지가 없었습니다. 첫 학기에는 investment, international marketing, econometrics, spanish1, belly dance를, 두 번째 학기에는 business law, money banking and credit, financial management, spanish2, ballroom dance를 들었습니다.
 도서관도 역시 2층짜리 건물 하나에 우리처럼 칸막이로 되어 있는 것이 아니라 동네에 있는 도서관 느낌이어서 시험때면 자리전쟁이 나지 않을까 고민했었는데 그런 적은 한 번도 없었습니다. 보통 12시에 닫으며 컴퓨터실, 혼자 또는 둘이 공부할 수 있는 carrel은 24시간 열려있습니다.","국제처에서는 30여명의 교환학생들의 친분, 고민 해결을 위해 언제나 열려있습니다. 여러 행사를 주관하고 큰 행사가 없을 때에도 international club 을 통해 정기적으로 모임을 가지게 됩니다. 적극적으로 참여만 한다면 다른 교환학생들과 친해질 수 있는 충분한 역할을 하고 있다고 생각 됩니다.","학교 내에 수영장, 헬스장, 암벽등반, 조깅트랙, 농구코트, 축구장, 테니스코트 등이 있으며 학생이라면 언제나 이용 가능합니다. WAC이라고 불리는 이 곳은 오픈 한 지 얼마 안 되어 시설이 새것이며 여기에서 여러가지 체육행사를 개최합니다. choir 활동을 했었는데 학교 내 아마추어 오페라 공연이 아닌, 진짜 오페라 공연에서 노래를 부른 것과 연례 공연(dance팀과 함께 뮤지컬 형식으로), 졸업식 단상에서 노래 한 것 등 정말 많은 추억을 만들어 준 뜻깊은 활동이었다고 생각합니다. 그 밖에도 Model UN, 투자동아리 등이 있습니다.","돌이켜 생각해보면 문화충격이라고 특별히 생각 되었던 점은 별로 없는 것 같습니다. 한가지, 학기가 시작되며 참여했던 shirttail이라는 행사는 학교에서 주최를 하는 행사에서도 성적 표현에 자유로울 수 있구나 라는 생각을 하긴 했습니다. 또한 문화충격은 아니지만 흑인 교회예배에 가 본 적이 있었는데 우리와는 분위기가 사뭇 다르다는 것을 느꼈습니다. 좀 더 분위기가 자유롭고 활기찼습니다. 이 예배에 동양인, 아니 비흑인은 저와 제 친구 둘밖에 없었기에 이 때 처음 사람들이 신기한 듯 저희를 쳐다보는 것을 느꼈습니다. (학교 안은 여러 인종이 뒤섞여 있지만 학교 밖에는 주로 백인, 소수의 흑인이라 볼 수 있습니다.)","국제처의 Kesha, 카페테리아의 미미이모, 아라언니와 Annie, 아영이에게서 도움을 많이 받았습니다. 또한 가구 등이 망가지만 physical plant에 도움을 요청할 수 있습니다.","처음에는 어디에 있는지도 잘 모르는 시골에서 미국인들도 놀린다는 남부의 강한 억양을 배워 올까 걱정이 앞섰던 것이 사실입니다. 그렇지만 1년을 지내면서 저 자신에 대해 생각할 수 있고, 삶에 여유를 가지게 되고 정이 많은 친구들과 좋은 추억을 많이 만들게 된 소중한 곳이 되었습니다. 다양한 행사를 참여하는 데에 소극적인 교환학생에게는 지루할 수 있는 곳이지만, 파티와 공부를 둘다 즐기고 싶은 학생이라면 강력히 추천합니다."
내가 2006년 1년간 교환학생으로 파견되었던 학교는 Hendrix College는 미국 중남부에 위치한 Arkansas주의 작은 도시 Conway에 위치해있다. 날씨는 우리나라와 거의 비슷해 4계절을 갖고 있지만 여름은 한국보다 습하고 무더운 편이며 겨울은 한국보다 조금 따듯한 편이다. 한 여름에는 밖에 돌아다닐 수 없을 정도로 햇볕이 따갑고 무덥다. 날씨 변덕이 심한 편이라 겨울에 전날은 반팔을 입다가도 오늘 갑자기 추워져 두꺼운 재킷을 꺼내 입는 것을 반복했던 것 같다. Hendrix College는 Liberal Art College로 재학생 수가 1000명을 조금 넘는 작은 규모의 학교이다. 하지만 내가 파견되어 있던 해부터 신입생을 이전보다 1.5배 정도 더 뽑기 시작해 학생 수는 조금 더 늘어날 수도 있다.,"Hendrix College는 주도 Little Rock에서 30~40분 가량 떨어져 있는 Conway라는 작은 도시에 위치하고 있다. 학교 주위에는 대부분 집들이 있고 15분 정도 걸어가면 월마트에서 장을 볼 수 있다. 교환학생으로 있으면서 가장 어려웠던 점은 차가 없으면 생활하기 불편하다는 것이었다. Conway에는 대중교통수단도 없어서 학교 밖으로 나가길 원한다면 친구들에게 ride를 부탁해야 한다. 현지 학생들 거의 대부분은 차를 갖고 있고 교환학생들이나 차가 없는 학생들은 차가 있는 친구들에게 ride를 부탁해 장을 보거나 같이 쇼핑을 가곤 한다. 차로 10분쯤 가면 Oak street에 Kohl's, TJ-max, Belk, Old Navy, Target 등이 있어 주말이면 친구들과 쇼핑을 하러 가곤했다. 또한 주말 늦은 시간이나 식당 메뉴가 마음에 들지 않을 때면 친구들과 주변에 있는 레스토랑에 가서 식사를 하곤 했다. 주변에 IHOP, Waffle House, Dixie Cafe, Chili's, 각종 fast food restaurant들이 있고 중국음식점으로는 New China, China town 등이 있다.","Hendrix College는 대부분의 학생들이 기숙사 생활을 한다. 여자 기숙사로는 Galloway, Raney, Veasey 가 있고 남자 기숙사로는 Martin, Hardin이 있으며 Couch라는 남녀공동기숙사가 있다. Galloway는 2층으로 되어 있는 기숙사로 가구와 바닥 등이 다른 기숙사에 비해 낡은 편이지만 방이 가장 크고 거실 등이 예뻐서 많은 학생들에게 인기가 있다. 샤워시설도 조금 오래되어서 샤워하는 중간에 갑자기 뜨거운 물이 나오는 경우가 있어 불편할 수 있다. Raney와 Veasey는 3층으로 되어 있는 기숙사로 방은 Galloway에 비해 작지만 가구는 새것으로 되어 있다. 샤워시설로 인한 불편함은 없었던 것 같다. 여자 기숙사에는 방마다 세면대가 있고 샤워시설과 화장실은 공용이다. 하지만 한 번도 사람들이 많아 이용하는 데 기다리거나 해서 불편했던 적은 없었고 항상 청결한 상태에서 이용할 수 있었다. 기숙사마다 부엌이 있어 가끔 음식을 만들어 먹을 수도 있고 냉장고도 하나씩 있다. 냉장고에 음식을 넣어둘 때는 자기 방 번호와 이름을 써서 넣어두어야 한다. 기숙사마다 세탁기와 건조기가 있는데 무료는 아니고 각각 75센트와 50센트에 사용할 수 있다. 샤워시설과 다르게 세탁기와 건조기를 사용할 때는 이용하는 사람이 많아 기다려야했던 적도 몇 번 있었다.   
학교 기숙사에 사는 이상 학교 cafeteria를 이용해야 한다. 20 meals와 15 meals 중 선택할 수 있는데 연대에서 가는 경우 이미 연대에 식비를 내고 가기 때문에 20 meals(unlimited)를 이용할 수 있다. 뷔페식이라 먹고 싶은 것을 골라서 먹을 수 있다. 식당은 깨끗하고 음식도 잘 나오는 편이다. 메뉴는 일주일 단위로 바뀌는 것 같고 주 메뉴외에도 샐러드, fast food, 과일, 샌드위치, 시리얼, 아이스크림, 케익, 쿠키 등을 먹을 수 있다. 식당 한켠에 음식을 만들어 먹을 수 있는 곳이 있어 stir fries를 만들어 먹을 수 있다. 20 meals를 신청한 학생들에게는 한 학기에 $100씩의 dining dollar 가 학생카드에 들어와서 Burrow라는 학교 작은 매점에서 이용할 수 있다. 1년 동안 미국 음식만을 먹고 생활하다보니 한국음식이 그리울 수도 있다. 주도 Little Rock에 가면 동양가게가 있는데 이 곳에서 몇몇 한국음식 재료를 구할 수 있고 가끔 한국 사람들과 모여 한국 음식을 해먹었던 기억이 난다.","Hendrix College 에는 경제학 과목들이 많이 없었다. 그리고 최소 45학점을 3000~4000단위의 과목들로 채워야 하는 연대 규정으로 인해 원하는 과목보다는 이 요건에 맞는 과목을 들어야 했다. 연대와는 달리 한 학기에 4과목을 신청할 수 있지만 나중에 교환학생의 경우 5과목까지 신청할 수 있다는 얘기를 들었었다.  
첫 번째 학기에는 Financial Management, Management Science, Intermediate Macro economics를 들었고 두 번째 학기에는 CalculusII, Investments, International Marketing, Econometrics를 들었다. Hendrix에서 들을 수 있는 과목들을 학교 홈페이지(http://www2.hendrix.edu/courseschedule/)에서 확인할 수 있다.   
도서관은 작은 규모이고 다양하고 많은 책을 갖추고 있지 않은 것 같았다. 특히 내가 공부하면서 참고하고 싶었던 경제학서적들이 많지 않았던 게 아쉬웠다.",교환학생을 담당하시는 교수님으로 Dr. Oudekerk 교수님이 계신다. 교환학생 서류들이나 수강신청을 할 때 많은 도움을 주실 것이다. 또한 교환학생들을 위한 각종 행사를 주관하는 Multicultural and International Student Services 부서가 있다.,"헨드릭스 학생들이라면 무료로 사용할 수 있는 체육관과 수영장이 있다. 헨드릭스 길 건너편에 크고 멋진 체육관을 짓고 있어 2007년 여름 이후에 파견되는 학생들은 그 시설도 이용할 수 있을 것이다. 
학교 내에 여러 동아리들이 있다. 학기가 시작한 이후 8월 말 쯤 동아리를 소개하는 행사를 한다. 그곳에서 동아리에 대해서 자세한 정보들을 들을 수 있을 것이고 학교 홈페이지에서 구체적으로 어떤 동아리들이 있는지 확인할 수 있다.  
나는 봄학기에 StuMo라는 기독교 모임과 Model UN에서 활동했었고 가을 학기에는 Hendrix Choir에서 활동했었는데 모두 내게 잊을 수 없는 소중한 추억들을 남겨 주었다.",,"국제교육부에서 일하시는 분들이 다 친절하셔서 도움이 필요하다면 그들에게 요청할 수 있을 것이다. 식당에 한국 아주머니 한 분이 계서 여러 가지 학교나 그 지역에 대해서 모르는 것이 있을 때 여쭤보면 친절히 답해주실 것이다. 또 Little Rock에 한인교회가 있는데 한국 사람도 별로 없고, 한국 음식도 쉽게 구할 수 없는 어찌보면 쓸쓸한 Conway라는 작은 도시에서 교회 분들은 나에게 너무나 큰 힘이 되어 주셨다.",
