gen_info,env_info,food_info,study_info,office_info,facil_info,mhct_info,help_info,etc_info
"Hobart and William Smith Colleges는 미국 북동부 외딴 지역에 위치한 학교로, 학생수와 캠퍼스 규모가 연대와 비슷하거나 그에 조금 못미칩니다. 이 학교는 독특한 특성을 띄고 있는데, 일단 학비가 비싸기 때문에 대체로 경제적으로 넉넉한 환경에서 자란 아이들이 들어와 기숙사 생활을 합니다. 그런데 학교가 위치한 제네바라는 동네는 포도밭이 끝없이 펼쳐져 있는, 미국인들도 잘 모르는 시골입니다. 따라서 4년 동안 학생들이 거의 학교 내부에서만 공부하고 서로 교류하게 됩니다. 

이 학교 학생들은 거의 백인들인데 비해, 많지 않은 동네 주민들은 대부분 노인이나 히스패닉입니다. 그 원인 중 하나가 날씨인데, 이곳은 눈,비,우박이 끊임없이 내리는 곳으로 여름을 제외하고는 햇빛을 볼 날이 별로 없기 때문입니다. 또한 호수가 옆에 위치하여 안개도 종종 낍니다. 이러한 날씨 때문인지 이 학교 자체도 Liberal Art 와 Art 쪽 학문이 발달하였고, 우울증을 호소하는 학생들도 있습니다. 

저는 개인적으로 날씨가 이 학교의 최대 단점이라 생각했는데, 가을학기에 갔던 저는 8월에 기숙사에 입실했는데도 반팔만 가져온 것을 후회했습니다. 또한 11월부터는 시베리아처럼 눈보라가 몰아치는 통에 기숙사 방에 처박혀 있곤 했습니다. 이때는 교환학생 생활의 이점을 제대로 살리지 못하는 느낌이 들었습니다. 

이곳은 대중교통이 서울같지 않기 때문에, 한번 나가려면 차가 없이는 힘이 듭니다. 따라서 학교 옆 Plaza나 Payless Shoestore 등에서 옷과 신발을 살 생각이 아니라면 집에서 즐겨입던 따뜻한 옷이나 부츠 정도는 챙겨 오는 것이 좋다고 생각합니다.","학교 주변 마을은 매우 얌전한 시골 동네로, 주민들과 교류할 일은 거의 없다고 보면 됩니다. Hobart에서 21살이 넘은 학생들(주로 Senior)은 다운타운에 있는 술집에 합법적으로 갈 수 있습니다. 학생들은 일주일동안 열심히 공부하다가 금요일이나 토요일 저녁에만 나가는데, 워낙 시골이다 보니 2-3개의 술집에서 아는 얼굴들이 다 모이는 것을 볼 수 있습니다. 술집에서 친구를 사귀기란 쉬운 일이 아니지만, 적극적으로 노력하면 평소보다는 기회가 있다고 볼 수 있습니다. 그러나 하룻밤 모두가 Best Friend처럼 행동하더라도, 다음날 서로 모른척 할 수도 있다는 사실을 주의해야 합니다.

그 외에는 학교 바로 옆에 붙어 있는 Seneca Lake이라는 호수가 특징적입니다. 저는 세일링 수업을 듣느라 이곳에 자주 갔었는데, 다른 아이들도 수영이나 Kayaking을 할때 이곳을 유용하게 이용했습니다.

이 학교가 뉴욕주에 위치했다고 뉴욕시티에 자유로이 드나들 수 있을 거라는 생각은 금물입니다. 동네에 위치한 Greyhound Bus Station을 이용하여 고속버스를 타고다닐 수 있지만, 동네가 시골이라 이곳저곳 경유하는데다, 버스가 딜레이 되는 경우가 많으니, 긴 휴일기간이 아닌 이상에는 여행을 생각하기 어렵습니다. 대신에 긴 휴일에는 학교에서 버스를 대절하여 학생들을 뉴욕시티로 실어 나르기도 합니다.","이 학교는 거의 전교생이 기숙사에서 거주합니다. 기숙사는 Caird Hall, DeCordova Hall 등의 건물식, Odell''s 같은 주택식, German house같은 Theme House식으로 나눠집니다. 기숙사는 랜덤식으로 배정되나, 학년과 Meal Plan형태에 영향을 받습니다. 저는 Basic Meal Plan(일주일에 약 15번 식사)으로 신청했더니, Caird Hall에 배정되어 음식을 해먹기 쉽지 않은 곳이었습니다. 같이 교환학생으로 온 지혜언니는 Partial Plan으로 좀더 저렴한 식사권을 구입했더니, Odell''s 에 배정받아서, 조리해먹기가 좀더 쉬웠습니다. 교환학생의 기숙사 배정은 나이와 해외거주경험 등등에 의해 결정됩니다. 그러나 선택권이 주어지는 경우도 있으니 신중하게 미리 알아보길 권합니다. 자신이 영어실력을 늘리고 싶다면 하우스메이트나 룸메이트가 있는 것이 좋을 것입니다. 한국인과 룸메이트를 할 확률은 거의 없기 때문입니다. 그러나 싱글룸에서 편히 쉬고 싶은 사람은 그에 맞게 선택하면 될 것입니다.

이곳 학생들에게 가장 인기있는 거주 형태는 Odell''s 나 Theme House였습니다. Theme House는 같은 관심사를 가진 학생들끼리 함께 신청해서 사는 주택 형식이었습니다. 이를테면 Asian Theme House는 중국인이나 아시아에 대해 공부하는 학생들이 많았습니다. 수업듣는 건물과의 접근성과 하우스메이트들의 성향도 잘 생각하길 바랍니다.

식사는 Saga라는 부페식 식당에서 하는 경우가 많고, Cafe나 Pub에서 먹기도 하며, 피자나 중식을 시켜먹거나, Wegmans라는 근처 대형마트에서 재료를 사와 조리해먹기도 합니다. 음식이 입에 맞지 않을 것을 감안해 자신이 좋아하는 한국음식을 어느정도는 싸오는 것도 좋다고 생각합니다.","이 학교는 Liberal Art와 Art 가 잘되어 있다고 하니, 평소에 관심이 있었다면 들어보는 것도 괜찮을 것입니다. 

학교 규모가 작아 교수 일인당 학생수 비중이 작고 교수들은 학생들을 한명 한명 세세히 챙겨주는 편입니다. 교수들은 대체로 권위적이지 않고 편안합니다. 수업은 토론식이 많으며, Class Participation을 점수에 반영합니다. 학생들의 자유롭고 자연스러운 발표 모습을 볼 수 있습니다. .
저는 학점대체를 위해 영문과의 Intro.to Literary Studies와 Shakesphere Comedies를 들었습니다. 두 수업 모두 많은 Reading과 Paper를 요구했습니다. 또한 벼락치기가 통하지 않게 자주 과제를 내주어 쉴 틈이 없습니다. 따라서 학생들은 주중에 도서관에 많이 모여있고, 주말에만 신나게 놀곤 합니다.

그 외에는 Economics of Caring을 들었는데, 사회봉사를 하며 봉사에 대해 경제학적으로 분석하는 과목이었습니다. 그 일환으로 30시간을 제네바의 초등학교에서 학생들에게 책 읽어주는 일을 했습니다. 영어가 부족했지만 믿고 저에게 일을 맡겨준 instructor에게 감사했습니다. 덕분에 한국과는 다른, 미국 초등학교의 교육 환경을 볼 수 있었습니다. 

그 외에는 Sailing수업을 들었는데, 일주일에 두번 Seneca lake에서 요트를 타는 것이었습니다. 그때는 두려웠지만, 앞으로 다시 타기 힘들 거라고 생각하니 그 수업을 듣기 잘했다는 생각이 듭니다.","교환학생들의 Advisor로 Amy Teel이 많은 도움을 줍니다. 오리엔테이션부터 함께하게 되는데, 매우 Friendly하므로, 필요한 것이나 모르는 것이 있다면 언제든 메일이나 전화로 문의하기 바랍니다. 
제가 갔던 학기에는 International Student중에 중국인이 크게 늘어 40명 가량이었습니다. 그러나 이들은 거의 다 1학년 입학생이고, Exchange Student는 20명 정도였습니다. 독일, 홍콩, 호주, 네덜란드, 한국 등에서 온 학생들이었습니다. 학교 전체적으로는, 교포를 제외한 한국인이 저희 교환학생을 빼고 1명 정도였으니, 영어를 배우기에는 최상의 조건이었다고 할 수 있습니다.","학비가 비싼 만큼 학교 시설은 우수합니다. 도서관과 Gym이 특히 잘 되어 있는데, 본인이 얼마나 부지런하냐에 따라 활용정도가 달라집니다. 도서관은 Mac컴퓨터가 많고 24시간 이용할 수 있는 컴퓨터실이 있으며, DVD를 수시로 빌려볼 수 있는 방도 있습니다. 또한 2층에 위치한 CTL(Center for Teaching and Learning)에서 튜터링을 받으면 좋은데, 저는 1주일에 한 번 정도는 이용했습니다. 어려운 수업에 대해 질문하거나, paper를 쓰고 나서 1대1로 교정을 받을 수 있습니다.

Gym에서는 여러 G.X를 합니다. 필라테스, 요가, 줌바댄스, 태권도 등등이 있으니 재미있게 운동할 수 있습니다.

또한 학교에서는 자주 동아리들이 여는 이벤트 포스터가 붙으니, 잘 살펴보고 여기저기 참여해보는 것도 재미있는 경험이 될 것입니다.
저는 Herald라는 신문사에서 기사를 취재했습니다. 기사를 쓰기까지는 우여곡절이 많았지만, 나중에 신문을 받아보니 뿌듯했습니다. 국제학생이라고 해서 안 받아 주는 것도 아니고, 오히려 동아리의 다양성 강화(?) 측면에서 환영할 수도 있으니, 평소에 해보지 못했던 것이 있다면 도전하길 바랍니다.

그 외에는 학교의 교목 정도인 Chaplin의 집에서 하는 여러 소모임이 있습니다. Pasta Night은 수요일 저녁에 다같이 파스타를 만들어 먹는 것이고, Knitting Club은 목요일에 뜨개질을 하며, 가끔 과수원에 가서 Apple Picking한 뒤 사과파이를 만들어 먹기도 했습니다. 이곳은 매우 따뜻한 분위기라 여러 국제학생들이 모이는 것을 볼 수 있었습니다.

저는 교회에 다니기 때문에 Intervarsity Christianity Club에도 참여했었는데, 이 학교는 성공회 주축으로 세워진 학교임에도 크리스찬이 거의 없기 때문이었습니다. 동아리 회원은 20명 가량 되었는데, 일요일에 Carpool로 큰 교회에도 함께 가고, 일요일에 bible study도 했습니다.","이곳은 미국에서도 가장 미국적인 학생들이 다니는 곳입니다. 학생들은 미 동부에서만 자라 Asian에게 익숙치 않은 경우도 많고, 이로인해 오해가 있을 수도 있습니다. 
한국에서만 쭉 살았던 학생이라면 미국인들의 개방적인 사고와 활달한 성격에 당황할 수도 있습니다. 하지만 현명하게 처신하고 잘 견뎌낸다면 정말 값진 경험과 배움을 얻어올 수 있을 것입니다.","이곳에 한국인 교수님이 두 분 계십니다. 스페인어를 가르치는 교수님과, Studio Art를 가르치는 교수님입니다. 또한 학교 근처 교회에 한국인 목사님 부부가 계셨습니다. 학교에 도착한 뒤 일찍 연락을 취한다면 가끔 도움을 주실 것입니다.","이 학교는, 간단히 말하자면 교환학생 생활을 마냥 편안하게 흘러가도록 하는 곳은 아닙니다. 공부량도 많고, 영어를 24시간 써야 하는 환경에, 캠퍼스 안에만 갇혀 있어야 하기 때문입니다. 하지만 지나고나면, 분명 이곳에서 교환학생 생활을 했다는 것을 후회하지 않도록 만드는 곳입니다.

기타 문의할 내용은 언제든지 ireanyang@naver.com으로 연락주세요 ^^"
"HWS는 학생수가 약 2000명 정도인 곳으로 미국의 다른 종합대학보다는 현저하게 크기가 작은 곳입니다. 캠퍼스도 처음엔 넓은 것처럼 느껴지지만 다니다보면 익숙해져서 그다지 크게 느껴지지 않습니다. 본인이 듣는 수업, 사는 곳에 따른 행동반경에 의한 개인차가 클 것으로 생각됩니다. 지리적으로는 뉴욕 북동부에 위치해있고 바람이 많이 불고 비, 눈도 많이 옵니다. 가을 학기에 갔던 저는 그 곳에 가서 장화와 바람막이를 사야 했을 정도입니다. 처음엔 학생들의 등산객 같은 옷차림에 의아하게 생각했었는데 나중에는 그들과 똑같은 차림으로 다니는 저를 발견할 수 있었습니다. 뉴욕주에 있지만 뉴욕씨티와는 버스를 타고 6시간을 가야 하는 상당히 먼 거리에 있기 때문에 학교에서 따로 주어지는 휴일 기간이 아니고는 뉴욕씨티에 갈 엄두도 내지 못하였습니다.","대학 주변은 크게 ''플라자''와 ''다운타운''으로 나눌수 있겠는데, 플라자에는 영화관, 신발가게, 옷가게, 리쿼 스토어와 가르시아라는 멕시코 음식점, staples, radioshack 등이 있습니다. 이 플라자 건너편에는 앞에 경험보고서에도 항상 나오는 wegmans가 있구요. 초반에 이것저것 생활에 필요한 용품들을 사기 위해서 플라자와 웨그먼스에 자주 갔습니다. 중간중간 생활하면서도 필요한 물건들은 이 곳에 가서 샀구요. 이불 등의 약간 특이(?) 용품은 웨그먼스엔 없고 월마트에만 있는데 월마트는 차를 타고 가면 5분 정도 걸렸던 걸로 기억합니다. 그리고 1달러를 내고 가면 되는 셔틀(이름은 잊어버렸는데 표범이 그려져 있습니다)이 있기 때문에 친구들에게 항상 부탁하지 않아도 됩니다. 그리고 웨그먼스 가기 전에 학교 건너편에 있는 Dana''s 라는 곳도 음식 가격이 무난하고 맛있습니다.

두번째 구역으로 ''다운타운''을 들 수 있겠는데요, 이 곳은 미국 학생들이 금,토에 주로 가는 곳으로 Mark''s pizzaria(피자가 정말 맛있어요), 이름을 잊은 까페, Red dove''s(미국 음식 아닌 음식점), 중국 음식점, Side show, Eddie o''brians, Parkers 등의 bar가 있습니다. 나중에 학교 음식이 질리게 되면 이 곳에 가서 외식을 하는 것도 나쁘지 않습니다. 다운타운은 걸어서 가면 한 15분 정도 걸리고, 저녁 7시부터 새벽 1시까지 학교에서 트롤리를 운영합니다. 각 정류장마다 표지판에 시간이 나와있으므로 참고하시면 되고, 주말에는 새벽 2시까지도 다닙니다.

차를 타고 약 15분 정도 거리에 아울렛도 한개 있습니다.","저는 주로 3,4학년생 학생들이 많이 사는 Odell''s에 배정을 받아서 그 곳에서 3명의 룸메이트들과 함께 살았습니다. 저는 다른 기숙사는 잘 모르기 때문에 오델즈를 위주로 설명해드릴께요. 오델즈는 Odell''s unit이라고 해서 여러 하우스들이 뭉쳐져 있는 본건물들이 있는 캠퍼스와는 5분 정도 떨어진 곳에 위치해 있습니다. 앞에는 Odell''s pond가 있고 가까운 곳에 Gym도 있습니다. Wegmans와도 가깝고, 세탁실도 다 따로 여러개 위치해 있습니다.

집 내부에 대해서 설명해드리자면 2층으로 되어있습니다. 1층은 방 1개와 화장실 1개, 거실, 부엌으로 이루어져있고, 2층은 방 3개와 화장실 1개로 이루어져있습니다. 이 집에 사는 학생들은 각자 싱글룸을 쓰게 되고 나머지 공간들은 공동으로 사용하게 됩니다. 

이미 구비되어있는 물품이 별로 없고 전부 다 사야하기 때문에 이 부분에 있어서는 룸메들과 조율이 필요합니다. 저는 출국하기 전에 룸메들에게 이메일로 주방용품에 관한 것들에 대해서 물어봤었는데 본인들이 다 집에서 가져왔다고 내가 특별히 써야할것만 가져오고 나머지는 다 함께 써도 된다고 해주어서 아주 호화로운 주방생활(?)을 할 수 있었습니다.

식사는 저는 115번(정확한 숫자는 기억이 잘 나지 않아요) 학생식당인 SAGA에서 식사를 할 수 있는 partial plan을 신청했었고 마지막 한 1주 정도 부족했습니다. 식사 한번당 약 6.5달러인데 cafe나 pub에서도 이 식사권을 사용할 수 있습니다. 예를 들면 7달러치를 샀다면 식사 1번+스낵 머니 0.5달러 이렇게 쓸 수 있습니다. 저는 스낵머니가 처음에 150달러 들어있었습니다. 계산은 학생증으로 하기 때문에 항상 학생증을 소지하고 다녀야 합니다.

또한 저는 오델즈에 살았기 때문에 밥을 해먹을 수 있었습니다. 그러나 생활이 바쁘다보니 자주 해먹진 못했고 가끔 미국 음식에 너무 질리면 한국에서 가져온 음식들을 먹으며 소소한 행복을 느끼곤 했습니다.","수업은 보통 4개를 듣습니다. 저는 Political Economy, Human geography & Global Economy, Renaissance to Modern, French beg.와 basic sailing을 수강하였습니다. 수업은 제 자신의 흥미에 따라서 선택하였습니다. 왜냐하면 이 학교는 경영학과가 없기 때문입니다. 연세대학교에서는 들을 수 없었고 예전부터 관심이 있던 분야들을 신청해서 한학기 동안 수강했는데, 정말 많이 힘들었습니다. 보통 중간, 기말만 보는 연세대학교와는 달리 매주 있는 퀴즈, 수많은 리딩과제, 보고서, 시험 등등을 4개월동안 끊임없이 했던 것 같습니다.

그 중 political economy가 300단위로 절 가장 많이 속썩였는데 그래도 돌아보니 가장 도움이 된 수업이었던 것 같습니다. 한학기 동안 5장짜리 보고서 4번과 10장짜리 보고서 1번, 조발표 5번을 했습니다. 많은 부담을 가졌던 조모임은 생각보다 학생들이 성의없이 준비하는 것을 보고 많이 실망하기도 했습니다. 이 수업은 Amy Teel의 추천을 받아 선택한것이었는데 Christopher Gunn 교수님이 정말 좋습니다. 영화에서 보던 백발에 키 크고 늘씬하신 멋있는 교수님으로 모든 학생들이 좋아했습니다.

도서관은 주로 1층에 컴퓨터를 많이 이용하였습니다. 프린트를 하고 리딩 자료 복사할 때 많이 갔었고 레포트를 쓸 때도 집에서는 자꾸 딴 짓을 하게 되서 도서관에 가서 많이 쓰곤 했습니다. 한창 시험기간일 때는 자리가 모자르고, 이상하게 이 학교 학생들은 조용히 하라는 표지판이 있는데도 불구하고 전화가 오면 그냥 받고 자기들끼리 큰 소리로 얘기하고 그래서 불편했던 적이 많았습니다.

대신 연세대학교와는 다르게 아무것이나 도서관 안에서 다 먹을 수 있어서 급할때 간단한 것을 사 가지고 들어와서 먹기도 하였습니다. 그래도 다들 조심하는지 깨끗합니다.","국제교육부에는 한 4번 정도 간 것 같습니다. 이 곳에 Amy Teel이 있는데 저는 공항까지 가는 차 편 문의할 때 갔었고, 수업시간표 짤 때, 교환학생들 따로 교육할 때, 글로벌 버디 프로그램 할 때 갔었습니다. 아주 사소한일부터 중대한 일까지 무슨 일이 있든지 항상 Amy Teel한테 물어보면 됩니다.","학교의 부대시설은 아주 좋은 편에 속합니다. 운동부가 굉장히 많기 때문인지 모든 운동을 다 할 수 있는 시설을 갖추고 있습니다. 스쿼시장, 테니스장, 수영장, 트랙, 축구장, 필드하키장, 세일링 등등 모든 것을 할 수 있습니다. 저는 gym이 가장 좋았습니다. gym에서는 매일매일 운동프로그램이 있는데 이것들을 잘 이용하시면 건강한 교환학생 생활을 할 수 있을것이라 생각됩니다. 필라테스, 태권도, 요가, 줌바, 복근 만들기 등의 수업이 있습니다. 여학생들이 굉장히 많이 오고 zumba 같은 경우는 인기 강좌 중에 하나로 고정적으로 학생들이 50명 정도는 왔던 것 같습니다.

동아리 활동은 제가 하지 않아서 잘 모르겠는데 연세대학교보다는 활동들이 덜 공식적이고 훨씬 자유로워보였습니다. 제 룸메들은 4학년인엠도 불구하고 본인들이 마음 맞는 친구들과 glee club이라는 동아리를 자유롭게 만드는 것을 보면서 많이 다르다는 것을 느꼈습니다.","저는 어렸을 때 미국에서 살았기 때문에 컬쳐 쇼크가 별로 없을 것이라 생각했는데 생각보다 있어서 깜짝 놀랐습니다. 좋은 쪽으로도 있었고 나쁜 쪽으로도 있었는데 나쁜 쪽의 영향이 더 컸던 것 같아 안타깝습니다. 

일례로 인종 문제가 가장 크게 느껴졌습니다. 흑인은 흑인끼리, 히스패닉은 히스패닉끼리, 아시안은 아시안끼리, 심지어 백인들 사이에서도 소위 말하는 금발은 금발끼리 다니는 현상을 보고 좀 많이 놀랐습니다. 학교 사이즈가 작아서 고등학교 같은가 보다라는 생각을 같이 교환학생 간 친구와 종종 하곤 했습니다.

아직 다들 나이가 어리고 하기 때문에 자신들이 편한 사람들과 어울리게 되는 것 같은데 아시안과 어울리지 말라는 것이 아니라, 미국까지 가서 내가 한국에서 쉽게 어울릴수 없는 사람들과 어울리기 위해서는 적어도 이 학교에서는 상당한 노력이 필요할 것 같습니다.

이 학교 학생들이 아무래도 new england 지역에서 많이 오다 보니 아시안에 대해서 익숙하지 않은 것 같은데, 유럽과 호주에서 온 교환학생들과 이야기 해보니 심지어 그들도 잘 어울리지 못하고 있었습니다. 나중에 이런 얘기를 Amy Teel과 마지막으로 이야기 하는 자리에서 모두 나눠봤는데 미국 학생들이 미국 외에 다른 나라에 대해서는 잘 모르기 때문에 혹시나 자신의 무지함이 탄로나진 않을까 하는 마음에서 외국인들과 대화를 잘 하지 않는 것이라고 합니다. 안 그런 경우도 있겠지만 그 말도 일리가 있는 것 같아서 마지막에 ''내가 좀 더 노력할껄''란 후회를 약간 했습니다.","교내에서는 Amy Teel, 스페인어를 가르치시는 최은경 교수님, 드로잉을 가르치시는 한국인 교수님께 도움을 받을 수 있습니다.

교외에서는 저랑 같이 갔던 현지도 마지막에야 겨우 만났는데 학교 주변 미국 교회에 계신 목사님 내외가 계십니다. 그분들도 한국 학생이 있는 지 모르고 그 동안 안 오셨는데 앞으로도 웬만하면 계속 연세대학교에서 학생들이 온다고 말씀드려놨으니, 학교에서 만나게 된다면 도움을 주실 것이라고 생각합니다.","미국에서 대학생활을 간절하게 해보고 싶어서 가게 된 교환학생으로 인해 미국의 많다면 많은 적다면 적은 면들을 보고 돌아왔습니다. 이제 돌아온지 1달 조금 넘었는데 다른 곳으로 교환학생 갔던 친구들 이야기하고는 좀 달라서 여전히 내 교환학생 생활은 왜 그랬을까 의문이 남기도 합니다. 교환학생을 온 목적을 다시 한번 상기시키면서 잘 오지 않을 미국의 학부 생활을 경험하는 기회를 잘 살리시길 바랍니다. 제가 위에 쓴 이야기들은 지극이 개인적인 것임을 다시한번 알려드리고요, 혹시 물어보시고 싶으신 점 있으시면 luvmei4udare@naver.com으로 연락 주세요. 아, 영어 배우기엔 정말 안성맞춤인 곳입니다. 저 갔을 땐 한국인 유학생 한 친구 포함해서 학교에 한국인이 총 3명 있었습니다. 저는 같이 갔던 현지를 만나지 않는 날에는 한국말 쓸 일이 없어서 며칠만에 현지랑 만나면 둘이서 그동안 못 다했던 한국말을 3,4시간씩 쓰곤 했습니다 ^^;; 예전에 어떤 분이 남기셨던 경험보고서에 나오는 것처럼 술주정도 영어로 해야만 합니다. 영어늘리기와 연대에서는 들을 수 없는 색다를 수업들을 듣고 싶으신 분이라면 괜찮은 학교인 것 같습니다.

첨부하는 사진은 마지막에 크리스마스 파티 겸 제 송별회 한다고 룸메 중 한명이 꾸민 저희 집입니다."
