gen_info,env_info,food_info,study_info,office_info,facil_info,mhct_info,help_info,etc_info
"hendrix college는 nature state라는 별명을 가진 arkansas의 인구 5만의 소도시 conway에 위치해 있습니다. 내륙 지방이라 기후는 우리나라보다 건조하고 4계절이 뚜렷한 편으로서, 여름은 우리나라만큼 덥고 겨울은 그다지 춥지 않습니다 (영하 10도 이하로는 절대 내려가지 않음) 일년 가시는 것이든 한학기만 가는 것이든 4계절 옷을 다 가지고 가시는 것이 좋을 것 같습니다. hendrix college는 1000여명이 기숙사 생활을 하는 작은 학교입니다","conway라는 도시는 전형적인 교육도시로서, 50000여명밖에 안되는 인구에 대학교가 5개 정도 있는 도시 입니다. 그만큼 공부하기에는 좋은 환경이라고 할 수 있는 것이, 주변에 학생들을 산만하게 하는(혹은 주말을 즐겁게 보낼만한) 시설이 거의 없다는 것이지요. 차를 가지고 있다면 4~50분정도 떨어져 있는 arkansas의 주도 little rock에 가서 주말을 보내면 되겠지만, 교환학생같은 경우는 차를 가지고 있는 경우가 드물고 해서 ride를 얻지 않는 한 대부분의 시간을 conway에서 보내게 되지요. conway는 어찌 보면 참 조용하고 사람 살기 좋은 한적한 동네라 마음에 쏙 들지만, 어찌 보면 너무 조용하고 지루해서 사람 살 동네가 못된다는 생각되 듭니다. 다 자기 생각하기 나름이겠지요.분명한 건 이 동네는 남부의 christian belt의 buckle이라고 일컬어 질 정도로 종교색이 좀 강한 동네라, 일단 dry county로서 술을 팔지 않고, 교회나 성당이 많은 동네입니다.(hendrix자체도 감리교와 관련이 되어 있지요) 신촌과 같은 분위기를 기대하시면 절대, 절대, 절대 안됩니다.
학교에서 15분 정도 걸어가면 월마트가 있습니다. 정말 모든 것이 거기에 다 있습니다. 1년동안 정말 많이도 다녔는데요, 가격도 싸고 살 만한 것도 많아서 좋았습니다. 한국에서 왠만한건 안가지고 가셔도 거기에 다 있으니 사시는게 오히려 짐도 적어지고 나을 수도 있습니다.","거의 대부분의 학생이 기숙사에 거주합니다. 기숙사에는 남녀 공용 기숙사인 couch, 남자 기숙사인 martin, hardin, 여자 기숙사인 galloway, raney, veasey가 있지요. 각 dorm마다 특색이 조금씩 있다고는 하는데 저는 couch에만 살아서 잘은 모르겠습니다. martin과 veasey는 party dorm, galloway는 조용한 기숙사, raney는 종교적인 애들이 많이 산다는 이야기가 있습니다. 식사는 meal plan에 따라 다른데요, 아마 교환학생들은 모두 20 meal plan을 하게 되어 있던 것 같습니다. 즉 일주일에 토요일 저녁 한끼를 제외하고서는 모드 학교 식당에서 먹는 것이지요. 학교 식당은 처음에 가면 정말 맛있고 따라서 살도 찌지만, 나중에 가면 갈수록 메뉴가 뻔히 보이고 반복이 되는 것 같아 지겨울 수도 있지요. 토요일 저녁은 매 학기 시작할때마다 50달러씩 충전되는 학생 카드를 가지고 burrow라는 매점에 가서 샌드위치, 샐러드, 피자 같은 것들을 사먹을 수 있고, 학교 주변에(걸어서 30분 이내)에 중국집이나 웬디스, 써브웨이, 아이홉등 각종 식당이 있으니 거기서 해결할 수 있습니다.각 기숙사에 요리를 할 수 있는 가스 레인지와 전자 레인지, 냉장고가 있으니 요리를 해 먹을 수도 있고, 요리를 저장해 놓을 수도 있습니다(음식을 보관할 때 자기 이름을 써놓는 것이 좋습니다).","한학기에 4과목을 수강하는 것을 기본으로 합니다. 현지 학생들은 수강신청을 그 전 학기 끝날때쯤 모두 마치지만 교환학생들은 현지에 도착해서 학기 시작할 때쯤 1학년들과 같이 하게 됩니다. 수강신청은 advisor교수님(모든 교환학생의 advisor는 Dr.Oudekerk입니다)과 상의하여 하게 됩니다. 수업은 전공에 따라 차이는 조금씩 있지만 10명 안팎의 소규모 강의로 이루어 집니다. 교수님들은 굉장히 친절하시고 도움을 요청하면 성심성의껏 가르쳐 주십니다. 각 교수님마다 office hour가 일주일에 몇시간씩 꼭 있고 그 외의 시간에도 사무실에 계실때가 많아, 대부분의 교수님은 ""(자기 사무실)문이 열려있으면 언제나 환영""이라고들 하십니다. 그래서 혹시 좀 어려운 과목을 수강하더라도 교수님께 도움을 요청하면 같이 해결책을 찾으려고 해주십니다. 그래도 혹시 어떤 과목을 철회하고 싶으면 Fausset Hall에 있는 registrar's office에 가셔서 add/drop form을 가져다가 advisor와 담당과목 선생님께 싸인을 맡으면 됩니다.
4과목이면 우리 학교에 비해 2과목이나 적지만 각 과목에서 내주는 숙제나 시험이 양이 많기 때문에 결코 무시 못할 수준입니다. 그렇다고 하루 종일 공부해야 하는 것은 아니고 또 그렇게 되지 않도록 advisor가 적절하게 조언을 해 줍니다.
작은 학교 치고는 다양한 전공이 있지만 특히 전공과목을 들어서 우리 학교에서 인정을 받아야 하는 경우에는 hendrix로 오는 것이 좋은 선택이 아닐 수도 있습니다. 물론 수업 말고도 교환학생을 오는 이유는 많지만 특정 학번의 경우 졸업하기 위해 전공을 많이 들어야 한다면 hendrix에서는 그게 조금 힘들 수 있습니다. 본인이 가는 학기에 들을 수 있는 과목을 확인하려면
http://www.hendrix.edu/courseschedule/에 들어가면 됩니다.
수업 이외에도 다양한 physical activity 수업이 제공됩니다. 저 같은 경우에는 1학기때에는 골프를, 2학기때에는 swing/ballroom/latin dance를 수강하였는데 특히 dance 수업의 경우는 잊을 수 없는 추억들을 많이 얻을 수 있었습니다. 특히 그런 수업들은 성적과는 관련이 없이 pass/non pass이기 때문에 부담없이 즐길 수 있습니다.
도서관은 bailey library라고 있는데 아담하고 매우 쾌적합니다. 책이 그렇게 많은 것은 아니지만 근처 학교들과 협정을 맺고 있어서 다른 학교 도서관에서도 책을 빌릴 수 있습니다. 도서관에서 노트북을 사용할 수 있습니다. 노트북을 안가지고 가실 분들은 도서관에 컴퓨터 실이 있으므로 그 곳에서 사용할 수 있습니다. 복사 역시 도서관에서 할 수 있고(몇십쎈트를 내야 함), 출력은 무료입니다!!!",국제 교육부는 Dr.Oudekerk(Oudekerk@hendrix.edu)라는 분이 맡고 계십니다. 정말 친절하신 분입니다. 고민이나 어려운 점이 있을 때 찾아가 도움을 요청할 수 있습니다. 또한 Bulher hall 에 있는 Ms.Carmen Hardin이란 분도 국제 학생들과 관련된 사무를 보고 계시니까 그 분에게도 도움을 요청할 수 있습니다. 그리고 무엇보다 중요한 것은 헨드릭스에 있는 모든 분들이 모두 정말 친절하므로 아무나 붙잡고 도움을 요청해도 별 상관 없을 정도 입니다.,"위에서도 언급하였듯이 conway는 교육도시이고 퍽 종교적인 도시라 신촌에 익숙한 우리학교 학생들은 자칫 지루해 질 수 있습니다. 적극적으로 친구를 사귀고 열심히 social life를 일구라고 말해 주고 싶습니다. 동아리는 다양하게 있습니다. 합창단, 현악단, 모의 UN 등등,,,학기 초에 동아리 박람회를 하니까 그때 가서 들고 싶은 동아리를 선택할 수 있습니다. 하지만 우리학교의 동아리들 보다 사교적인 기능은 조금 덜합니다. 일반화 시킬 수는 없지만 제가 한학기 동안 합창부를 하였는데 한학기 동안 열심히 준비한 공연을 마치고는 뒷풀이 같은게 있을 줄 알았는데 그냥 각자 집으로 돌아가더라구요.
체육시설은 Mabee Center와 Grove Gym이 있는데 시설이 훌륭하고 거의 대부분의 시간에 개방되어 있습니다. 특히 농구 좋아하시는 분들은 우리 학교 체육관 같은데서 마음대로 농구를 할 수 있으니까 좋아하실 겁니다. hendrix에 농구팀도 있어서 season이 시작되면 매주에 한두번씩 경기를 하는데 정말 재미있습니다.
학교에서 학생들 지루하지 말라고 자주 이벤트를 열어줍니다. 앞에 경험보고서에 다 언급이 되었지만서도 foam party, shirttail, Miss hendrix 등등은 
정말 가볼만 합니다. burrow에서 영화도 자주 보여주고, 각 기숙사 별로 이벤트도 열어주니까 잘 참여하기만 하면 그리 심심하지는 않습니다. 물론 처음에는 언어 장벽이라든가 익숙하지 않은 문화들 때문에 조금 어리둥절할 수도 있지만 시간이 지나면 익숙해지리라고 생각합니다(미국에 사신 경험이 있어서 문화에 익숙하신 분들이라면 또 모르지만..)","shock이라고 하면 꼭 부정적인 것을 써야 할 것만 같은데 그런 것은 거의 없었고 미국 대학문화는 영화에서 보는 것과 거의 흡사하였습니다. 다만 좋았던 것은 사람들이 어딜 가나 모르는 사람이던 아는 사람이던 미소지으면서 인사하는 것이었습니다. 이는 남부 사람들의 특징이라고 하는데 신선한 충격이었습니다.(특히 학교 식당에 가면 아줌마들과 할머니들이 너무 친절하셔서 정말 좋습니다.)
그리고 가기전에 아칸소주에 관한 정보가 거의 없었고 단지 알고 있었던 것은 빌클린턴이 주지사 했다는 것과 nature state라고 불릴 정도로 자연 경관이 아름답다는 점, 또 KKK의 발상지라는 것 정도였습니다. 앞으로 가실 분들도 한국에서 Arkansas에 대한 구체적인 정보를 얻기는 힘들 것이라고 생각합니다. 그렇다고 겁먹거나 걱정하실 필요는 없고요, hendrix와 conway는 정말 살기 좋은 동네로서 한번 와볼만한 곳이라고 생각합니다.","일단 처음 와서 식당에 가면 한국인 아주머니가 카운터에 딱 앉아 계셔서 얼마나 좋은지 모릅니다. 미미 아줌마라고 불리시는 이분은 교환학생 생활에 참 많은 의지가 되었습니다. 또 지금 hendrix에서 2학년(2006년)에 재학중인 김아라라는 학생이 있는데 그 친구 역시 처음 가서 약간의 도움을 줄 수 있을 겁니다. 또 수학과에 차교수님이라는 분이 계신데 추석때 그분 집에 초대받아서 고향 음식을 얻어먹은 적이 있었지요. 이렇게 세분 정도가 헨드릭스에 있는 한국 사람이고, 또 가까운 리틀락에 한국인 교회가 있으니까 거기에서 한국 사람들을 만날 수 있습니다.
또한 언급했듯이 다들 친절하므로 왠만큼 친해지면 도움을 요청할 수 있습니다. Dr.Oudekerk나 Ms.Hardin, 또 bulher hall의 Ms.Hankins 같은 분들도 학생들의 편의를 위해 힘쓰시는 분들이므로 그분들을 찾아가면 도움을 받을 수 있습니다.","처음 헨드릭스에 도착하면 갓 입학한 1학년들과 함께 OT를 가게 되는데 이를 통해 친구들을 많이 사귈 수 있습니다. OT에는 많은 프로그램들이 있는데 예를 들면 코끼리 타러 가기, 온천 가기, 다이아몬드 캐러 가기, 집없는 사람들을 위해 집지어주기 등등이 있습니다. 좋은 경험이 될 수 있습니다.
제가 헨드릭스를 선택한 이유는 colleges that change lives라는 책에서 hendrix를 높이 평가했기 때문인데요, 혹시 가게 되는 분들은 그 책을 구해서 읽어보시는 것도 도움이 될지 모릅니다. 정말 그책이 제목이 말해주듯이, 적어도 저는, 헨드릭스에 1년간 있으면서 무엇과도 바꿀 수 없는 경험들을 하고 많은 생각을 하였습니다. 다시 교환학생을 갈 수 있게 되어 학교를 선택한다 해도 이 곳을 택하고 싶은 마음이 들 정도입니다. 이 학교에 오실 여러분들도 좋은 경험해서 많은 것을 얻어가시길 바랍니다."
