gen_info,env_info,food_info,study_info,office_info,facil_info,mhct_info,help_info,etc_info
SCSU는 미네소타에 위치한 st. cloud라는 작은 도시에 있는 학교입니다. 미네소타는 겨울에 정말 너무나 추워서 밖에 나가면 콧속과 속눈썹에 가끔 얼음이 얼기도 합니다. 제가 듣기론 3월 마지막날까지도 눈이 왔다고 하더군요. 그러나 제가 여름에 처음 도착했을 당시에는 햇빛도 강렬하고 한국보다는 조금 건조한 날씨였습니다. 겨울이 오기 전까지는 파랗고 높은 하늘과 따뜻한 햇살을 경험할 수 있습니다. 미네소타에서 가장 큰 도시인 미네아폴리스까지는 그레이하운드 버스를 타면 갈 수 있으며 시카고까지는 차로 7시간이 걸려서 로드트립을 많이 가곤 합니다.,다운타운까지는 버스를 타면 금방 갈 수 있고 걸어서도 갈 수 있는 정도입니다. 버스는 학생증이 있으면 무료로 탈 수 있어서 자주 애용했습니다. 다운타운에는 작은 바와 클럽들이 있긴하지만 작은 시골 마을의 술집 정도로 생각하면 됩니다. 학교 바로 옆에 미시시피 강이 있어서 저는 날씨 좋은 날에 그곳을 종종 산책하곤 했었습니다. 다리를 통해 강을 건너가면 조용하고 예쁜 가든도 있습니다. 쇼핑을 하고 싶으면 버스를 타고 crossroad mall이란 곳으로 가시면 되는데 사실 매장이 많이 없기 때문에 미네아폴리스에 있는 Mall of America를 추천합니다. 세일 기간에 가면 싸고 또 미네소타는 의류에 tax가 붙지 않기 때문에 좋습니다. 식료품을 살 경우에는 버스를 타고 walmart나 cubfood를 이용하면 됩니다.,"저는 기숙사에 살았습니다. 대부분의 교환학생들은 기숙사에 사는데 그것이 친구를 사귀는 데 있어서도, 학교 생활 하는 데 있어서도 편한 것 같습니다. 제가 살았던 기숙사는 shoemaker였는데 gym과 가깝고 강 바로 옆에 있어서 좋았습니다. 그렇지만 다른 기숙사들과는 좀 동떨어져 있는 것이 불편합니다. 특히나 추운 겨울에는 밥먹으러 가거나 도서관에 갈 때, 그리고 다른 기숙사에 사는 친구들이랑 모일 때 등은 좀 귀찮고 힘들었습니다. 하지만 다른 기숙사들보다 상대적으로 먼 것이지 캠퍼스가 작기 때문에 5~10분 정도면 다른 곳에 다 닿을 수 있습니다. 저는 개인적으로 이곳의 생활이 좋았습니다. 밥은 밀플랜을 이용하여 garvey common에서 먹을 수 있고, munch money를 통해 학교 내에 다른 곳에서도 먹을 수 있습니다. 처음에는 garvey의 음식이 다양하고 맛있다고 생각했는데 점점 지겨워지기 시작하여 munch money를 이용해 subway나 wow라는 곳에서 많이 사먹었습니다.","수업은 무난합니다. 저는 처음에 겁먹고 갔었는데 교수님들이 발음도 또박또박 해 주시고 교환학생이라고 말씀드리니 배려도 많이 해주셨습니다. 또한 한국 교수님들과 다르게 타이트하지 않으시고 상황에 따라 유연하게 학생들을 배려해주십니다. 시험은 그렇게 어렵지 않고 공부만하면 좋은 성적을 받을 수 있는 정도이며 멀티플초이스로도 많이 나옵니다. 저는 전공인 politics 수업을 두 과목과 이중전공인 경영학 수업을 두 과목, 그리고 힙합 수업을 들었는데 수업시간에 요구하는 것만 착실히 하면 좋은 성적을 받을 수 있으며, 교수님들께서도 학생들이 점수를 더 얻을 수 있는 기회나 만회할 수 있는 기회를 많이 주려고 노력하십니다. 도서관은 깔끔하고 조용하며 자유로운 분위기 입니다. 그러나 미국 친구들은 공부할 때 한국 학생들처럼 도서관을 많이 이용하지는 않는 것 같습니다.",국제교육부는 미국으로 가기 전에 이런저런 궁금한 사항들을 메일로 문의하고 도움을 많이 받았는데 정말 친절하게 잘 해결해 줍니다. 처음에 한국인 룸메이트가 지정되어서 바꿔달라고 요청하였더니 제가 원하는 조건의 학생으로 성의껏 찾아주었습니다. 그리고 모든 행정이 학생들을 최대한 배려해 준다는 느낌을 받았습니다. 사실 저는 이곳에서 한학기를 마치고 미국 다른 학교에서 한학기를 보내었는데 그곳에 비해 정말 비교도 안될 정도로 친절합니다.,gym은 한학기에 30불 정도를 내면 모든 시설을 자유롭게 이용할 수 있으니 마음껏 이용하시기 바랍니다. 동아리는 학기가 시작하면 날짜를 지정해 동아리 홍보를 하는데 그 기간을 이용해 정보를 많이 얻으시기 바랍니다. 저는 춤동아리에 잠깐 들어갔었는데 연습시간이 잘 맞지 않아 몇번 간 이후로 잘 가지 않았지만 친구들도 굉장히 친절하고 좋았습니다.,그렇게 큰 문화충격은 없었는데 처음에 적응이 잘 안되었던 것은 옷을 한국과 다르게 편하게 입고 다닌다는 것입니다. 후드 티에 츄리닝 바지 정도로 입고 다니기 때문에 한국에서 가져온 옷들은 거의 입지 못했습니다. 지금은 그곳에서 편하게 입고 다닐 수 있었던 때가 종종 그립기도 합니다.,근처에 한인교회가 있다고 들었는데 그곳에서 도움을 많이 받으실 수 있다고 합니다.,
세인트 클라우드 시는 미국 중부 미네소타주의 두번 째 도시로 미네소타 주가 그렇듯 추운 날씨이긴 하나 제가 있었던 가을 겨울 한학기 동안은 그런데로 견딜만 했습니다. 학교의 크기는 대체적으로 크다고 할 수 있겠네요,주변에 놀거리는 그리 많지 않습니다. 다운타운으로 나가면 술집과 레스토랑등이 있습니다. 월마트 컵푸드 크로스 몰등에 가면 쇼핑을 할 수있으며 맘만 먹으면 미니에 폴리스에 가서 놀수 있습니다,기숙사를 대학와서 처음 여기서 이용했는데 그러데로 살만 했습니다 방도 그리 좁지 않고 학교 내에 있어서 수업을 듣거나 식사를 한 후 바로 들어갈 수 있는 가까운 위치에 있습니다.,수업은 전반적으로 시험이 많아 쉴틈이 없었습니다. 난이도는 그리 어렵지 않지만 3 천 단위의 유기화학 수업은 약간 버거웠습니다. 대체로 교양은 엄청 쉬운것 같고 시험도 객관식으로 쉽습니다.,곤란한 일이 생겼을 때 언제든지 찾아 갈 수 있어서 편리했습니다.,동아리는 하나 정도 해보았는데 저로서는 아주 좋은 경험을 많이 했습니다.,컬쳐 쇼크라고 하기 보다 우리와는 다른 여러가지 사고 방식을 느낀 것 같네요 ^^,국제 학생센터로 가시면 됩니다.,"합창 수업을 들었는데 친구를 사귀기에 좋았던 것 같습니다 
궁금한  사항이 있으시면 cindy0205@hanmail.net으로 연락주세요"
"St.Cloud State University는 미국 중북부에 위치한 미네소타의 주립대학입니다. 교환학생을 가기 전 읽었던 경험보고서나, 또 주변 사람들을 통해서 미네소타가 엄청 추운 곳이라는 것은 이미 잘 알고 있었습니다. 제가 처음 학교에 도착하였을때는 8월이었는데, 고온건조한 햇볕이 아주 쨍쨍한 여름이었습니다. 그러다 9월쯤 되니 날씨가 꽤 선선해지기 시작하고, 그러다 10월이 되니 우리나라의 한 겨울 정도의 날씨가 되었습니다. 미네소타에서 10월에 눈이 오는 것을 보고 깜짝 놀라던 기억이 나네요. 섭씨 영하 20도에 육박하는 추운 날씨와 하루에도 몇 번씩 캠퍼스내에 제설차가 돌만큼 많이 내리는 눈. 이렇게 최악이라면 최악(?)이라고 볼 수 있는 기후를 가진 미네소타이지만, 친구들과 무릎만큼 쌓인 눈 위에서 뛰어놀며 눈싸움도 하고, 시간이 지나고 보니 나름대로 낭만적인 날씨로 기억됩니다. 물론, 그 당시에는 그렇지 않았지만요! 그리고 여기에 파견되실 분이라면, 가을 옷 보다는 겨울 옷 위주로 챙겨가세요. 미네소타의 가을은 매우 짧습니다.
학교 캠퍼스는 연대에 비교하여 조금 작은 편입니다. 그렇지만, 꽤 큰 체육관도 있고, 도서관, 강의실 등등 기타 교내 시설들은 학생들을 수용하기에 불편함이 없을 정도로 넉넉합니다. 캠퍼스의 절대적인 크기는 작지만, 학생수를 비교했을때의 상대적인 크기는 연대보다 큰 듯 합니다. 한 번도 캠퍼스가 작아서 불만을 느끼거나 한 적은 없었으니까요. St.Cloud가 흔히들 생각하는 City는 아니어서 신촌과 같은 번잡함과 편리함은 좀 덜합니다. 한 번쯤 city생활에서 벗어나 한적하고 여유롭게 생활해 보는 것에 흥미를 느끼신다면 St.cloud를 추천합니다.","대학 변에는 대부분 학생들이 렌트해서 사는 집들이 있습니다. 10분 정도 걸어나가면 downtown이 있는데, 이 곳에 몇 개의 바와 레스토랑이 있습니다. 그리고 학교에서 무료로 이용할 수 있는 시내버스를 타고 나가면 crossroad mall 이 있는데, 여기는 백화점과 대형 마트가 함께 있어서 필요한 것들은 대부분 여기서 구입합니다. 학교 근처에서 갈 수 있는 곳은 대충 이 곳들 정도이고, 더 큰 쇼핑몰이나 볼거리를 찾으신다면 기차나 버스를 타고 1시간 정도 나가서 Minneapolis에 가셔야 합니다. (미니아폴리스는 미네소타의 중심 도시입니다.)","저는 Hill-Case라는 기숙사에서 살았습니다. 처음 기숙사에 도착하였을 때, 오래된 가구들과 아무것도 없는 텅 빈 방에 정말 어떻게 해야할지몰라 갑갑해했었는데, 거기에 살림살이도 꾸리고 또 한 학기동안 살다보니까 정말 떠나기가 아쉬울 정도로 편한 내 집처럼 느껴졌습니다. 저는 African American인 룸메이트와 살았는데, 이건 사설이지만 간혹 그 친구가 청소를 잘 하지않아 트러블이 생기기도 했지만, 어느 새 정이 들어서 헤어지는 날에는 펑펑 울기도 했답니다. 아, 학교에서 간혹 처음에 한국 사람들은 한국 사람들끼리 룸메이트를 지정해주기도 하는데, 이런 경우에는 파견 학교 측에 룸메이트를 네이티브로 바꿔줄 수 없겠냐고 요청하면 대부분의 경우는 다 바꾸어주는 것 같습니다. 저 역시도 처음 같이 파견되었던 친구와 룸메이트가 되어서 룸메이트를 바꿔줄 것을 요청했었구요. 
식사는 meal plan을 신청하면 학교내에 있는 식당에 가서 해결할 수 있습니다. 뷔페식으로, 피자, 샌드위치, 샐러드, 파스타 등등 여러 요리를 마음대로 먹을 수 있고, 음식도 꽤 맛있습니다.","저는 12학점을 수강하였는데, 수업은 본인의 영어수준 그리고 수업내용에 따라 다르겠습니다만, 본인이 열심히 한다면 그렇게 어렵지는 않다고 생각됩니다. 교수님들도 결과만큼 과정도 중요하게 생각하시니 본인이 어떻게 하느냐에 따라 달려있는 것 같습니다. 도서관은 한국의 도서관가는 조금 다르지만, 꽤 깨끗하고 공부하기에도 괜찮습니다. 도서관 내에 컴퓨터도 많이 보유하고 있어서 편리하게 사용할 수 있고, 보통 2시까지 문을 엽니다. (연대처럼 24시간 열람실은 없는 것으로 알고 있습니다.)",,"학교가 시골에 위치해 있어서 주변에 오락시설이 드물다보니, 학교내에서 자체적으로 파티나 행사를 많이 엽니다. 매주 금요일 점심마다 Culture cafe라고 해서 그 나라를 대표하는 학생들이 자신들의 나라를 알릴 수 있는 기회가 제공됩니다. 또 이것보다 조금 더 큰 행사로서 culture night이라 해서 매주 토요일 밤마다 다양한 공연과 함께 파티가 있구요. 이 밖에도 할로윈파티, 홈커밍위크 등 기타 크고 작은 행사들을 많이 제공하고 있습니다.","외국에서 살아본 경험없이 처음 5개월을 미국에서 보냈던 저로서는 갖가지 것들이 모두 culture shock으로 느껴졌습니다. 뭐 아주 사소한 것들이어서 일일히 언급하기엔 무리가 있습니다만, 아무튼 제가 느꼈던 점은 ''로마에선 로마 법을 따르라''는 겁니다. 그 나라에서 그 나라 문화를 존중하고 있는 그대로 받아들이고 즐긴다면, 그 culture shock도 그저 재미있는 경험 중의 하나일 뿐인것 같습니다. 본인이 스스로 컨트롤 하고 책임진다면 말입니다^^",,
"SCSU가 위치한 St.Cloud는 미국 중북부 Minnesota주에 위치한 도시입니다. 미네소타에서는 작지 않은 도시지만, 미국의 대도시에만 익숙하시다면 도시보다는 시골에 가깝다고 생각하셔도 될 것 같습니다. 미국 중북부에 위치해서인지 겨울이 무척 춥고 눈이 정말 많이 옵니다. 겨울에는 영하 2-30도는 보통이고 영하 10도 정도면 따뜻한 편이라고 보는 것 같습니다. 아무리 한국에서 목도리, 장갑 없이 겨울을 잘 보내왔다고 해도 여기서는 필요할 듯 싶습니다.눈이 자주 오고 일단 오면 녹을 일이 없어서 계속 쌓여 있기 때문에 눈도 질리도록 보실 수 있습니다. 저는 8월부터 12월까지 있어서 경험하진 못했지만 1년 이상 있었던 사람들에 따르면 5월까지도 눈을 볼 수 있을 정도로
춥다고 합니다. 어느 학기에 오시든지 이곳 겨울에 대한 준비는 하고 오시는 게 좋을 것 같습니다. 전기 장판이 필요하다고 하는 데 그건 기숙사의 난방 정도나 본인이 추위에 얼마나 약한지에 달린 문제인것 같습니다. 난방이 잘되는 방은 전기장판까지는 필요하지 않습니다. 대체적으로 건물 난방은 아주 잘되는 편이라서 어디든지 실내에만 들어서면 따뜻합니다. 제가 경험한 8월의 여름은 꽤 더웠습니다. 햇볕이 강해서 한국과 비슷하게 덥지만 한국 여름처럼 습도는 높지 않은 것 같습니다. 학교는 연대 캠퍼스에 비하면 훨씬 작습니다. 다만 건물이 띄엄띄엄 있고 별다른 경계가 없어서 실제 크기보다는 넓게 느끼게 되는 것 같습니다.","캠퍼스는 다운타운과 아주 가까운 곳에 위치하고 있습니다. 걸어갈수도 있지만, 날씨가 추워지면 걸어가기는 괴롭고 버스가 잘 되어있으니 버스를 이용하시는게 좋을 듯 합니다. 다운타운에는 식당과 술집 등이 있어서 가끔 기분전환겸 나가기에 좋지만 너무 큰 기대는 하지 않는 것이 좋겠습니다. 사실 다운타운보다는 먹을 것이나 필요한 물품을 사러 마트에 갈 일이 훨씬 많습니다.이런 곳들은 다운타운보다 멀지만 이 역시 버스를 이용하면 생각보다 쉽게 다녀올 수 있습니다. 버스가 꽤 잘 되어 있어서 도시내에 웬만한 곳은 다 갈 수 있다고 보시면 됩니다. 교내에서 ""university"" 버스를 타면 다운타운내에 transit station 으로 가게 되는 데 그 곳에서 원하는 곳으로 가는 버스로 갈아타면 됩니다. 또한 학교 학생은 학생증만 있으면 항상 무료로 승차 할 수 있습니다. 이렇게 생각보다 편리한 교통 덕분에 차가 없이도 큰 어려움은 없었지만 정해져 있는 버스 시간에 맞추다보면 일정을 맞추다보면 불편하게 느껴질 때도 종종 있었습니다. 버스 시간과 운행 노선표는 학교에서도 구할 수 있고 버스 안이나 transit station에도 항시 비치되어 있습니다. 도시 밖으로는 미네소타에서 가장 큰도시인 minneapolis(st. paul 과 함께 twin city라고 불리움)가 차로 1시간 반 조금 안되게 떨어져 있습니다. transit station에서 출발하는 greyhound 버스를 타고 가거나 amtrak station에서 amtrak을 이용할 수 있습니다. 큰 도시인만큼 할 수 있는 것도 상대적으로 많고(한인마켓도 있습니다) 가깝기 때문에 시간 나는 주말에 다녀오기 좋습니다. 그 외에도 캠퍼스는 미시시피강 바로 옆에 위치해 있어서 날씨만 좋으면 강주변에 산책하기 좋은 곳도 많습니다.","off campus가 기숙사보다 싸다는 장점이 있긴 하지만 교환학생이라는 신분으로는 기숙사 생활이 학교에 적응하기도 좋고 여러모로 좋을 것 같습니다. 실제로 교환학생들은 거의 다 기숙사 생활을 합니다. 저는 shoemaker hall 에서 생활했는데 gym 빼고는 다 멀어서 추워진 뒤에 좀 힘들었습니다. 공대생이 아니라면(공대 건물이 가깝습니다) shoemaker hall 은 별로 추천해
드리고 싶지 않습니다. 좋은 점으로는 난방이 잘되고 방이 넓은 편이고(세개의 윙중 한 윙만) gym이 가깝다는 점 정도가 있습니다. 많은 international 학생들이 lawrence hall에 사는 데 개인적으로는 이곳을 추천해드리고 싶습니다. 일단 시설이나 위치도 좋고 hall 자체가 국제학생들을 위한 곳이다 보니 이곳에 있는 미국 학생들도 다른 기숙사생들에 비해서 외국인들에게 마음도 열려있고 친철한 것 같습니다. 이외에도 기숙사 건물은 여럿 더 있습니다. 각기 장단점이 있고 다른 hall에 머물렀던 분들도 만족스러웠다는 분들도 많으니 잘 알아보시고 결정하시는 것이 좋겠습니다. 도착한 후에 변경도 가능하지만 여러모로 번거로우니 처음 신청하실 때 잘 생각해서 신청하시는게 가장 좋습니다. 다만 lawrence hall을 생각하신다면 경쟁이 치열하므로 최대한 일찍 신청하시라고 말씀드리고 싶습니다. 식사는 학교 식당(Garvey)에서 meal plan을 신청해서 먹는 방법이 일반적이지만 필수는 아니므로 신청하지 않고 알아서 해먹으셔도 됩니다. 식당은 meal plan 없이도 그때 그때 돈을 내고 이용할 수도 있습니다. 음식은 사람에 따라 다르겠지만 보통인 편입니다. meal plan은 보통 14 meal plan 을 많이 신청하는 편이지만 하루 세끼를 챙겨먹고 요리를 스스로 해먹지 않는다면 any time이 더 좋을 것 같습니다. any time이 14보다 많이 비싸지도 않은데다 하루에도 몇번이고 식당을 이용할 수 있기 때문에 커피나 음료수만 마시러 가기도 좋아서 괜찮은 것 같았습니다. garvey 외에도 atwood 지하에 다른 먹을거리도 있는데 meal plan을 신청하면 나오는 munch money로 이용할 수도 있습니다. meal plan 은 도착 후에도 변경기간 내에 변경할 수 있으니 가서 며칠 생활해보시고 결정하셔도 됩니다.","저는 한학기 동안 심리학 전공 네과목과 교양 한과목을 수강했습니다. 저는 졸업때문에 조금 무리한 감이 있었는데 특별한 사정이 없으시다면 전공 위주보다는 예체능 쪽이나 듣고 싶은 교양, 사람들과 교류가 많은 수업을 적당히 들으면서 여러가지를 경험하고 오는 것이 훨씬 현명하다고 생각됩니다. 대부분의 수업은 (몇몇 깐깐한 교수님들을 제외하면) 처음에는 어렵고 힘들어보여도 영어라는 언어장벽의 문제에도 불구하고 생각보다 쉽게 좋은 점수를 받을 수 있습니다. 중간중간에 나오는 숙제나 퀴즈의 성적이 좋지 않다고 해도
최종 성적은 생각보다 후하며 계속 성실한 모습을 보이는 것도 상당 부분 감안이 되는 것 같습니다. 이 곳 교수님들은 학생들에게 어떻게든 점수를 더 주기 위해 노력합니다. 제가 들었던 수업의 교수님들은 모두 학생들에게 적지 않은 배점의 extra point 과제를 제공했는데 이런 것들만 놓치지 않아도 중간 성적은 얼마든지 만회할 수 있습니다. 그리고 교환학생이라는 신분과 언어장벽의 문제들을 이해해 주시는 교수님들이 많기 때문에 힘들거나 어려운 점이 있을때 교수님께 찾아가면 많은 도움을 받을 수 있습니다. 도서관은 시설은 좋지만 그리 크진 않습니다. 하지만 컴퓨터실을 제외하고는 그다지 북적대는 편이 아니어서 이용하기에 불편하지 않습니다. 시청각 자료를 이용할 수 있는 방도 여럿 있어서 1층 데스크에서 키를 받아서 제한된 시간내에 이용할 
수 있으며 리모콘이나 키보드도 등도 대여할 수 있습니다.","CIS 가 lawrence hall 1층에 위치하고 있으며 각종 행사들을 주관합니다. 도움이 필요하거나 궁금한 사항이 있을때
찾아가시면 됩니다.",Gym 시설이 잘 되어있습니다. 한 학기 동안 일정금액을 내면 무제한으로 이용할 수 있습니다. 동아리는 학기 초에 딱 하루동안 홍보를 하니 그 날 잘 알아보시고 흥미있는 동아리에 신청하시면 될 것 같습니다.,미국 문물은 여러 매체를 통해 많이 접해서 그런지 특별한 culture shock 는 없었습니다. 처음에 좀 어색한 것들도 생활하다보면 익숙해지는 것 같습니다.,교내에는 CIS가 있고 수업에 관련된 문제는 앞에서 말했듯이 교수님께 직접 찾아가는 것이 좋습니다. 기타 생활에 관련된 도움은 생활하면서 친해진 친구들에게서 도움을 받는 것이 좋은 것 같습니다.,그 밖에 궁금하신 사항은 메일 주세요. monodrama01@hotmail.com
