gen_info,env_info,food_info,study_info,office_info,facil_info,mhct_info,help_info,etc_info
"루이지애나는 미국 남동쪽에 위치해 있는데요, 미국 남동쪽의 기후라고 한다면 아열대 기후라고 말할 수 있겠습니다. 아열대라고는 해도 겨울이 되면 엄청 추워지기도 합니다. 홈페이지에 써진 '가을 같은 겨울' 이란 말을 철썩같이 믿고 간 저는 루이지애나의 1월에 혹독하게 당했습니다. 가을옷만 잔뜩 챙겨갔더니 필요한 건 패딩이더군요. 짧으면 1개월 길면 2개월 정도로 짧은 겨울이긴 하지만, 겨울은 겨울이랍니다. 겨울 옷 꼭 챙겨가세요. 그렇지만 크리스마스까지는 그렇게 춥지 않은 날들이 계속될겁니다. 그러다가 갑자기 1월이되면 추워지지요. 그리고 2월 말쯤 되면 완연한 봄날씨가 될겁니다. 적어도 제가 보낸 1년은 그랬어요. 여름도 빨리옵니다. 5월 6월 정도만 되도 에어컨을 틀기 시작해서 9월까지 가지요. 신기한 점은 이 주는 가을이 되도 모기가 활발하다는 것입니다. 미시시피강이 멕시코 만으로 흘러드는 하구가 바로 루이지애나 주라 주변에 늪이 많거든요. 여름은 정말 고온다습입니다. 하지만 건물들은 에어컨이 정말 빵빵하니 걱정하지 마세요. 대학크기는 정말 넓습니다. 연세대의 1.5배~2배 정도 되는 것 같은데 평지에 지어진데다 호수까지 품고 있기 때문에 체감 크기는 더 큽니다. 캠퍼스에 처음 입성할 때 본 그 호수가 아직도 기억에 생생합니다. 정말 아름다운 호수였습니다. 크고, 잔잔하고 그 위에는 펠리칸이 떠다니는데 빛이 물에 반사되어 반짝이는 모습은 정말 아름답지요. 제 favorite place in campus가 되었죠.제 favorite 두번째는 아름드리 나무들인데, 큰 나무들이 캠퍼스 곳곳을 채우고 있어요. 때문에 여름이어도 그늘을 잘 만들어주어 캠퍼스 안을 돌아다니기엔 그렇게 덥지 않아요. 나무타기가 로망이었던 분들. 할 수 있습니다. 이곳 학생들은 주로 해먹을 가져와 누워서 자거나, 책 읽거나 공부를 하거나 합니다.  건물들의 느낌은 약간 스페인 느낌이라고 표현하고 싶네요. 황토빛 벽돌에 주황색 지붕.","루이지애나 주립대가 위치해 있는 곳은 Baton Rouge라고 하는 Louisiana의 capital city 입니다. 보통 루이지애나 하면 New Orleans가 많이 알려져 있죠. 배톤루지는 뉴올리언즈에서 차로 1시간 정도 떨어져있습니다. 사실 학교 주변에는 정말 뭐가 없습니다. 우리나라 대학가를 상상하시면 큰코 다치십니다.  대부분의 학생들이 차를 가지고 있기 때문에 차로 갈 수 있는 거리에 뿔뿔이 흩어져있지, 걸어서 갈 수 있는 거리에 위치한 편의시설은 많이 없다고 보시면 됩니다. neighborhood walmart가 버스타고 10분 거리에 위치해 있는데요, 이것은 작은 월마트로 대부분의 grocery는 여기서 쇼핑하시면 되는데요, 혹시나 옷을 사려고 하시거나 가전제품, 냄비, 그릇 등등을 구입하시려면 큰 월마트에 가야하는데, 버스로는 정말 가기 어렵습니다. 가기는 가지만 1시간 정도 버스를 타야하구요, 버스가 1시간에 한대 정도 있는 실정이라서요. 버스 값은 학생증 보여주면 공짜긴 하지만, 차가 없으면 정말 불편한 건 사실입니다. 그것 감안하시고 오시면 될 것 같아요. 근처에 CVS는 걸어서 5-10분 거리에 있는데요, 야채나 과일은 팔지 않지요. 간단한 물품들은 여기서 구매하셔도 됩니다.주변에 한인교회도 하나 있습니다. neighborhood walmart 근처에 oriental market이라고 한인마트도 하나 있구요. 버스는 시내버스와 학교버스가 있는데요 둘다 공짜지만 학교버스는 토,일, 공휴일에 운행을 안하니 참고하세요. 학교버스도 노선이 많고 여기저기 가는게 많으니 잘 알아보세요. 작은 월마트까지 가는 버스도 있어요. 레스토랑, 디저트 카페, 아이스크림 집, 피자 집, 클럽, 펍... 다 있긴 한데요, 차가 있어야 갈 수 있는 거리에 있답니다. 저는 자전거를 이용했는데요, 여건이 그렇게 쉽지는 않아요. 사실 그래서 riding 부탁을 좀 많이 했죠.","거주는 크게 on-campus와 off-campus로 나눠지는데요, on-campus는 기숙사로 여러가지 house/ apartment가 있어서 정할 수 있어요. house 선택은 송도 생각하시면 될 것 같네요. 외국에서 들여온 제도라더니 정말 그렇더라구요. on campus houses도 나쁘지 않지만 화장실을 공유인원이 천차만별이고 많은 곳은 8명이서 화장실 하나를 쓰는 곳도 있어서 잘 선택하셔야 할 거에요. 그리고 룸메이트가 있구요. on campus apartments는 east, west 두개가 있는데 이게 훨씬 주거 환경이 좋아요. 방을 혼자쓰고 거실, 주방, 욕실을 공용으로 쓰는데, 욕실은 2명이서 같이 쓰구요, 한 아파트에 4명이서 사니까, 살기 좋지요. 하지만 가격이 제일 비싸요. 이 학교는 on campus 보다 off campus가 훨씬 싸답니다.저는 1학기에 on campus apartment에 살고 meal plan 신청해서 먹고 했거든요, 그랬더니 한 학기 400만원정도 연세대에 내면 루이지애나주립대에서 주는 stipend라고 주거비, 식비가 있는데, 그거 다 썻어요. 그리고 2학기에는 off campus에서 제가 요리해먹었더니 200을 남겼어요, 그래서 그걸로 여행했답니다. meal plan은 학교 식당에서 먹는 건데요, 뷔페식에다가 샐러드 종류도 많고 피자는 항상있고, 아이스크림, 디저트 다있구요, 메인요리도 서너가지 되구요, 사이드도 몇가지 되구요. 정말 가격대비 짱이긴 해요. 그래서 1학기 때 제가 살이 엄청 쪘죠.","거주는 크게 on-campus와 off-campus로 나눠지는데요, on-campus는 기숙사로 여러가지 house/ apartment가 있어서 정할 수 있어요. house 선택은 송도 생각하시면 될 것 같네요. 외국에서 들여온 제도라더니 정말 그렇더라구요. on campus houses도 나쁘지 않지만 화장실을 공유인원이 천차만별이고 많은 곳은 8명이서 화장실 하나를 쓰는 곳도 있어서 잘 선택하셔야 할 거에요. 그리고 룸메이트가 있구요. on campus apartments는 east, west 두개가 있는데 이게 훨씬 주거 환경이 좋아요. 방을 혼자쓰고 거실, 주방, 욕실을 공용으로 쓰는데, 욕실은 2명이서 같이 쓰구요, 한 아파트에 4명이서 사니까, 살기 좋지요. 하지만 가격이 제일 비싸요. 이 학교는 on campus 보다 off campus가 훨씬 싸답니다.저는 1학기에 on campus apartment에 살고 meal plan 신청해서 먹고 했거든요, 그랬더니 한 학기 400만원정도 연세대에 내면 루이지애나주립대에서 주는 stipend라고 주거비, 식비가 있는데, 그거 다 썻어요. 그리고 2학기에는 off campus에서 제가 요리해먹었더니 200을 남겼어요, 그래서 그걸로 여행했답니다. meal plan은 학교 식당에서 먹는 건데요, 뷔페식에다가 샐러드 종류도 많고 피자는 항상있고, 아이스크림, 디저트 다있구요, 메인요리도 서너가지 되구요, 사이드도 몇가지 되구요. 정말 가격대비 짱이긴 해요. 그래서 1학기 때 제가 살이 엄청 쪘죠.",,"매 학기 초에 동아리 박람회가 있긴한데 언제, 어디서 하는지는 ICC라던지 학교 학생에게 물어봐야해요. 어디 공고를 하긴 하는데, 게시판이 한두개도 아니고, 게시판 찾기가 더 힘들거든요. 학생회가 있는데, 여기다 물어보셔도 되구요. 학교 홈페이지에 가면 ICC라던지 학생회에 대한 정보가 있습니다. 그리고 fraternity, sorority같은 greek society가 있는데요, 사실 거의 백인들 위주라고 보시면 되요. 얼굴도 좀 보구요. 여기는 들어가고 싶다고 들어가는게 아니라 거기서 괜찮은 학생들 한테만 광고종이를 줘요. 그다음에 신청을 하고 면접을 본다음 채택되는 거라서요. 저도 종이를 받긴 했는데, 어차피 안될 것 같아서 안했어요. 혼혈이 멤버인 경우는 봤어도, 흑인이나 아시안이 멤버인 경우는 못 봤네요.","딱히 컬쳐쇼크를 받지는 않았던 것 같네요. 다만 제가 생각하고 있던 것과 다른 점들을 알아차렸죠. 저는 거의 외국인들은 오픈마인드고, 성에 열려있을 줄 알았는데, 의외로 보수적인 사람들도 있어요. 그냥 성격차이인 듯 해요. 물론 오픈마인드인 사람들이 우리나라보다 훨씬 많다는 것은 맞지만요. 미국은 합리적으로 결정되는 사회, 나라인 줄 알았는데, 인맥 중요성이 우리나라보다 더 한 나라더군요. 미국 학생들도 우리나라 학생들과 비슷하게 미래가 엄청 막연하다는 것을 느꼈어요. 역시 똑같은 사람이더군요. 매너는 정말 훨씬 좋답니다. 앞사람이 문열고 들어가다 뒤에 사람이 있으면 문을 꼭 잡아줘요.컴퓨터나 값나가 보이는 물건을 차 안에 보이는 곳에 놓고 가지 말라고 엄청 주의를 받았어요. 제가 가방도 그냥 뒷자석이나 차안에 놓아두고 가면, 꼭 한마디씩 하더군요 안보이는데 넣으라고. 그렇게 두면 누가 창문을 깨고 가져간다네요. 이건 좀 쇼크였어요. 시민의식이 우리나라보다 덜 한 사회란 걸 알았죠.","ICC가 International cultural center인데요, 여기에 외국인들을 위한 프로그램도 많고, 다른 교환학생들을 만날 수 있는 기회도 있으니까 잘 이용하시면 좋을 거에요. 그것 말고는 ISEP 매니저한테 물으시면 친절하게 도와주니까 도움 받을 만한 곳에 대해서는 걱정안하셔도 될 거에요.","Mardi Gras는 루이지애나만 하는 축제에요. Easter 3주전(?) 화요일을 축하하는 것으로 퍼레이드 차량이 지나가면서 구슬을 던지는 게 관례인데요, 이날 뉴올리언즈를 가시면 거리마다 구슬을 던지고 먹을 것도 던져주고요, 술판이 벌어진답니다. 모든 사람들이 거하게 취하는 날이고 즐기는 날이죠. 한번 가보시길 추천할게요. 저는 너무 캠퍼스에만 있지 마시고 놀러다니는 걸 추천할게요. 휴스턴도 놀러가볼만 하구요, 뉴올리언즈는 꼭 한번은 가보시구요. 두번 세번은 필요없더라도요. 학교에 MIKE라고 호랑이가 살아요. 벌써 5대 MIKE인가 그럴거에요. 개교때부터 쭉 있어왔대요. 학교 마스코트라고 정말 살아있는 호랑이를 캠퍼스에 키우더라고요. 구경해보세요.LSU는 미식축구가 유명한 학교에요. 봄학기에가시면 못보실거구요, 가을학기에 가시면 보실 수 있어요. 엄청 큰 풋볼경기장에서 응원가를 부르고 하는 멋진 경험을 하실 수 있을 거에요. 퍼플, 골드 가 LSU 색이니까요, 그런 옷들 이나 소품 있으시면 챙겨가시면 좋을거에요. 가서 하나 사셔도 되구요. 기념품점이 학교내에 있거든요.제 이메일은 miniminiala@gmail.com 이니까요, 혹시 궁금한점 있으시거나 이야기 듣고 싶거나 하시면 언제든 메일 주세요."
"루이지애나 주립대학은 루이지애나 주의 주도인 Baton Rouge에 있으며 다운타운에서 남쪽으로 차로 10분정도 거리에 위치해 있다. 동으로는 미시시피 강에 접해 있고 서로는 큰 호수와 맞닿아 있어 산책과 조깅을 하기에 좋다. 가까운 대도시로는 재즈의 고향 뉴올리언즈가 있으며 차로 1시간 정도 떨어진 곳에 있다. 
학교의 모든 건물과 주차장을 포함한 크기는 매우 넓으나 지리특성상 언덕이 전혀 없고 주요 건물들이 모여있어 활동반경을 고려하면 연세대학교와 비슷하다. 따라서 어느곳으든 20분 정도면 걸어서 갈 수 있다.
기후는 아열대성 기후로 여름은 길고 매우 습하며 덥다. 하지만 냉방시설이 매우 잘 되있어 건물안에선 더위와 습도를 느끼지 못한다. 봄, 가을은 비록 여름에 비해 짧지만 날씨가 아주 좋아 활동하기 좋다. 겨울은 상대적으로 짧고 기온이 영하로 떨어지는 일이 거의 없다. 한겨울에도 우리나라의 초겨울 정도의 날씨다. 눈도 거의 오지 않는다. 제작년에는 10년만에 눈이 내렸다. 또 8-9월은 허리케인 시즌으로 허레케인이 종종 내습하기도 하나 학교에는 거의 피해를 주지 않는다. 05년 카트리나 당시에는 전혀 피해가 없었고 08년 구스타프 때에도 학교 레크레이션 센터에 지붕 일부만 파손된 정도이다.","Baton Rouge가 루이지애나주의 주도이긴 하지만 큰도시가 아니기 때문에 학교 주변은 전체적으로 한적하다. 하지만 학교 양쪽으로 미시시피 강과 큰 호수가 있으며 한국에서는 잘 볼 수 없는 거대한 oak나무들이 곧곧에 심어져 있고 빨간 지붕의 독특한 건물들이 있어. 캠퍼스가 매우 아름답다. 또 학교 서쪽에는 학교의 마스코트인 호랑이를 기르는 우리가 있다 한국과 달리 매우 가까이서 호랑이를 볼 수가 있으니 반드시 가보길 바란다. 주말엔 주변에서 가족들이 호랑이를 보러 오기도 한다. 또 그옆으로는 데스벨리라 불리는 9만명 수용이 가능한 거대한 풋볼 경기장이 있다.학교를 바로 밖에는 작은 음식점, 술집들이 조금 있으며 차를 타고 5분정도 나가면 작은 월마트가 있어 식료품을 싸게 살 수 있고, 15분정도 나가면 영화관, 큰 서점, 쇼핑몰, 각종 술집들이 있고 큰 월마트도 있다. 또한 다운 타운 쪽 미시시피 강변에는 아름다운 철교와 카지도 호텔, 큰 퇴역 군함. 박물관 공원 등이 있어 한번쯤은 가봄직 하다.
 교통편으로는 학교에서 운행하는 셔틀버스와 BATON ROUGE 시내 버스가 있다. 학교 셔틀버스는 여러 개의 노선이 있는데 학교 내부와 학교 주변, 다운타운을 운행한다. 운행시간을 잘 맞추지 않으면 30분정도 기다려야하는 단점이 있지만 차가 없다면 이용해 볼 만하다. 시내버스역시 배차간격이 한국에 비해길고 노선이 불편한점이 있지만 학교 근처 식료품 월마트나 큰 쇼핑몰(Mall of Louisiana)에 갈 때 편리하게 이용할수 있다. 요금은 학생증이 있다면 무료. 또 밤 5시 30분이후에는 학교에서 운영하는 무료 셔틀버스를 콜택시 처럼 전화로 불러서 이용할 수 있다. 밤에 학교 내부를 다닐 때 편리하게 이용할 수 있다. 
 미국 자체가 밤에는 치안이 불안한 곳이지만 이곳은 기본적으로 밤에는 혼자서 다지니 않는 편이 안전하다. 특히 북문넘어 학생 아파트 단지를 지나 그이상은 밤에 절대로 혼자서 가면 안되는 곳이다. 사실 가봐야 별것도 없다.","약 10개 정도의 기숙사가 커뮤티티를 형성하여 있고 주로 학교 동쪽과 서쪽 2군데에 나눠져 분포해 있다. 기숙사의 시설은 대부분 비슷하며 2인 혹은 3인이 방을 같이 쓰고 2개 혹은 그 이상의 방이 한 개의 화장실을 공유하는 형태이다. 부엌도 공동으로 사용한다. 방에는 침대와 작은 책상 옷장이 간단하게 구비되어 있고, 인터넷은 무선과 케이블을 모두 사용할 수 있으며 무료이다. 전화와 티비는 따로 있지는 않지만 본인의 것을 가져와 돈을 내고 신청을 하면 이용이 가능하다. 기숙사가 대부분 오래되어 시설도 좋지 않고(시설은 오래되었으나 항상 청결을 유지한다)기숙사 특성상 룸메이트와 방을 같이 쓰기 때문에 프라이버시가 보장되지 않고 다소 답답하게 느껴질 수 도 있지만 외국인 친구와 친하게 지내게되는 좋은 기회이기 때문에 개인적으로 추천한다. 본인도 미국인 룸메이트와 살면서 같이 클럽도 가고  좁은 방에서 부대끼면서 파티도 하고 술도 마시면서 좋은 시간을 보냈다. 
 기속사 외의 거주 시설로는 ECA 와 WCA 가 있으며 4개의 방과 1개의 거실, 화장실, 주방으로 이뤄어진 콘도형 아파트이다. 대부분이 최근에 지어진 것이어서 시실이 좋고 편리하지만 다른 기숙사에 비해 1학기에 1000불 정도 비싼 편이다. 4명의 룸메이트가 함께 생활한다. 또 대학원생들을 위한 아파트(니콜슨 아파트, 에드워드 게일 아파트)도 있는데 기본적으로 ECA나 WCA와 비슷한 개념이나 건물이 매우 오래되었고 그리 깨끗하지는 않은편이다. 하지만 가격이 매우 저렴하고 기숙사에 비해 프라이버시가 보장된다. 또한 거실과 욕실 주방이 따로 있다.
 식사는 연대와 같이 학교 유니언에 맥도날드와 같은 패스트푸드나 즉성에서 만들어주는 파스타 등을 해준는 카페테리아가 있어 간단하게 한끼를 해결 할 수 있다. 또 3군데의 부페식 카페테리아도 있어 가격은 조금 비싸지만 (9-10불정도) 마음껏 배부르게 먹을수 있다. 음식도 매우 다양하고 맛있다. 또 학교 군데군데 스무디킹, 타코벨, 파파존스, 까페, 미니마트가 있다.
 WCA, ECA또는 니콜슨 같은 아파트에 산다면 직접 주방에서 밥을 요리해 먹을 수 있지만 기숙사에 사는경우 위와 같은 곳에서 사먹거나 학교 주변 식당에서 사먹을 수 밖에 없다. 또 기숙사에 살면 MEAL PLAN을 하여 먹을수 있으나 한국에서 오는 교환학생의 경우 주로 MEAL PLAN을 신청하지 않고 직접 해결하는 사람이 많다. MEAL PLAN이 밖에서 사먹는 것 보다 상대적으로 비싸고 돈을 낭비할 가능성이 크다. 하지만 이것은 어디까지나 개인의 선택이다. 
 밥을 직접 요리해 먹는 사람들은 근처 차타고 5분 거리의 작은 월마트나 그 옆에 동양마켓( 한국분이 운영하는 동양 식료품점)에서 식재료를 사면 된다. 차가 없어도 시내 버스(46번, 47번)을 타면 손쉽게 갈 수 있어 다소 편하게 이용할 수 있다.","수업은 첫학기에 전공(경제학) 4개와 영어 1과목, 조깅수업  두번째 학기에 전공 4개와 테니스 수업을 들었다. 기본적으로 수업은 크게 어렵지 않고 다소 어렵더라도 따라갈 수 있을 정도이다. 영어 수엽의 경우 교환학생이나 유학생, international graduate의 경우 eng1004를 듣는데 간단한 문법이나 표현을 가르쳐 주고 시험과 과제로 essay를 쓴다. 체육수업은 kinesiology과목에서 선택하는데 골프, 테니스, 조깅 등이 있다. 이수업으 instructor는 모두 한국에서 오신 대학원생 분들로 한국사람이 들을 경우 비공식적인 advantage가 있어 부담없이 들을 수 있다.",ISEP 담당자인 Rachal Daroca씨가 모든것을 해결해 준다. 궁금한 점이나 애로사항을 메일로 보내면 빠르고 친절하게 대답을 잘 해주기 때문에 크게 도움이 된다. 또한 ICC(International Cultural Center)에서 국제학생들을 위한 파티나 이벤트 등을 자주 주선해 여러 국제학생들과 교류 할 수 있는 기회가 된다.,"LSU에는 교내에 International 학생들을 위한 Loan Closet이라는 벼룩시장 개념의 상점이 있는데 매주 목요일 1시부터 4시 반까지 open한다. 이곳에서는 필요한 생활용품, 가전제품, 각종 식기류, 가재도구 등을 싸게 살 수 있고 특히 원하는 기간동안 사용후 반납하면 전액을 다시 환불 받을 수 있기 때문에 매우 경제적이다. 뿐만 아니라 학용품이나 기타 소비성상품들도 시중가격보다 훨씬 싼 가격에 구입할 수 있으므로 매우 유용하다. 또한 10월경에 학교에서 중고자전거를 모아서 경매를 하는데 매우싼 가격에 자전거를 구매할 수 있는 기회가 된다. 그리고 이곳은 연세대학교와 달리 학교 체육시설이 잘 마련되어 있는데 1학기 12학점 이상수강하면 무료로 이용할수 있다. 시설로는 indoor track과 gym 라켓볼, 테니스, 농구장, 배구장, 탁구장, 스쿼시, 인공암벽등반, 수영장등이 있고 각종 라켓과 공도 무료로 대여할수 있어 학생들이 수업후에 자주 찾는 장소이다.","특별히 충격으로 받아들일 만한 것은 없다. 인종차별도 거의 격어보지 않았고 또한 soutern hospitality라 불리는 남부사람 특유의 친절함 때문에 즐겁게 생활 할 수 있었다. 다만 수업 분위기가 매우 자유로와서 처음에는 다소 놀랐으며, 다양한 사고바식의 사람들이 있어 가끔 마찰을 일으킬 때도 있었다. 개인적으로 느낀 한국과 다른점 한가지는 미국의 학생들은 돈에 관하여 매우 철저하다는 것이다. 예를 들어 라면 한개를 빌려가도 라면값을 주려고 하였다. 매번 거절했지만 매번 빌려갈때 마다 돈을 주려 하였다.",학교에 관한 일이라면 ISEP 담당자인 레이첼을 통하는 것이 가장 쉽고 빠르며 ICC 역시 많은 도움을 준다. 또한 근처 3곳의 한인 교회를 통하면 미국생활을 적응하는 데에 큰 도움이 된다. 교회를 통하지 않아도 한인학생회의 도움을 받을수 있다. 또한 LSU에 다니고 있는 학부생들과 대학원생들로 부터도 도움을 받을 수 있다.,"무엇보다 학교의 자랑은 스포츠이고 그중에서도 풋볼이다. LSU는 수백개의 미국 대학중10위권 내에 드는 강력한 풋볼팀을 가지고 있다. 최근 2003년 2007년에 대학풋볼에서 우승도 하였다. 9월부터 1월까지가 풋볼 시즌인데 홈 구장에서 하는 경기 하나 하나가 연고전을 연상케 할 정도로 엄청난 이벤트이다. 홈경기가 있을 때마다 학생들은 물론 루이지애나주 곳곳에 살고 있는 LSU졸업생들과 팬들이 학교로 모여 각자 천막을 치고 모여서 술과 음식을 먹으며 응원을 한다. 이것을 tailgate라 하는데 웨건이나 suv차랑의 뒷문을 열고 그곳에 tv를 설치하고 음식을 차려 먹는 것에서 이 단어가 유래하였다. 이날은 모두가 학교 전역이 학교의 상징 color인 purple and gold로 넘쳐난다.  특히 라이벌 전이나 중요한 big match 때에는 deaath valley에 9만석이 꽉참은 물론 경기장 주변에도 수만명이 모여 tailgate를 즐긴다. 그 장관은 직접 보지 않고는 상상 할 수 없으며 풋볼을 좋아하지 않더라도 충분히 즐길수 있는 거대한 축제이다. 따라서 교환학생으로 갈 경우 풋볼 시즌이 있는 가을학기를 끼고 올것을 강력히 추천한다. 또한 봄시즌에는 대학야구를 하며 야구 역시 요 근래에 5번이나 우승할정도로 강팀이다. 그리고 그왜에도 농구, 여자축구, 체조, 배구등 각종 대학스포츠를 구경하다보면 1년이 금방 지나간다. 학교내에 모드 경기장이 다 있으며 학생증이 있으면 입장료 또한 무료이다.
 만약 봄학기에 간다면 마디그라 축제를 꼭 참가하길 바란다. 마디그라는 루이지애나가 프랑스 식민지였을때 전해진 축제로 현제 루이지애나주에만 남아있는 전통 축제이다. 마디그라 축제는 반 !드! 시! new orleans에서 맞기를 추천한다. 물론 baton rouge 시내에서도 퍼래이드를 하는등 축제를 즐길수 있다 하지만 마디그라 때에 미전역에서 축제를 즐기기 위해new orleans로 모이기 때문에 그곳이서 축제를 즐기는 것이 훨씬 재미 있다. new orleans 중에서도 burbon street는 마디그라 축제를 가장 잘 즐길수 있는 곳이다.

LSU, 이곳을 가기전에는 잘 알지도 못하고, 한국에 잘 알려진 유명한 대학교가 아니라 걱정도 했지만 이곳에서의 1년은 나에게 정말 잊지못할 경험이었다. 이곳에서의 생활에 도움을 준 모든 분들에게 감사하고, 나 역시 이곳으로 교환을 가는 사람에게 도움이 되고 싶다 csg722@gmail.com"
