gen_info,env_info,food_info,study_info,office_info,facil_info,mhct_info,help_info,etc_info
"유타대학교는 유타주의 솔트레이크에 위치해 있으며 미국 중서부에 위치해 있다보니 기후가 꽤 건조한 편입니다. 그래서 여름에는 햇빛은 무척 강렬하지만 그늘에 있으면 시원하고 땀이 잘 나지 않습니다. 겨울에는 한국 겨울보다는 훨씬 춥지 않지만, 눈이 많이 옵니다. 하지만 눈이 많이 오는 지역이기 때문에 눈이와도 그 다음날이면 사람이 다니는 길은 항상 깨끗합니다. 그리고 유타는 지대가 높기 때문에 처음에 도착하면 쉽게 피곤할 수 있습니다. 주변에는 아이다호, 와이오밍, 네바다, 콜로라도 주가 둘러싸고 있고 라스베가스에서 차로 7시간 정도 걸리는 거리입니다. 
유타대학교는 기숙사까지 포함하여 학교 전체 부지가 서울대학교의 6배정도 된다고 합니다. 학교가 무척 넓어서 처음에는 수업듣는 건물 찾기도 쉽지 않습니다. 학교 중심에 Union과 Marriot 도서관이 있고 단과대별로 건물이 나누어져 있습니다. 부지가 넓기 때문에 건물들이 높지 않고 캠퍼스가 예쁩니다.
또 솔렉은 주소를 보면 위치를 찾기가 매우 쉽습니다. 구역별로 잘 나눠져 있어서 몇번 south 몇번 east 이렇게 말하면 위치를 어느정도 파악할 수 있습니다.","솔렉안에는 TRAX, 버스 이렇게 두 종류의 대중교통이 다니는데 U of U 학생증이 있으면 교통비는 다 무료입니다. 학교 Union에서 교통카드 activation을 신청하면 그 때 부터는 한국에서 사용하는 교통카드처럼 버스탈 때는 찍으면 되고, trax는 가끔씩 검사할 때만 보여주면 됩니다. Trax는 3개 라인으로 이루어져 있는데 salt lake line, sandy line, university line 입니다. 학교로 들어오려면 무조건 유니버시티 라인을 타면 되고, 다운타운으로 갈 때에는 솔렉라인, 샌디쪽으로 가려면 샌디라인을 타시면 됩니다. 
또 도착해서 장을 보시려면 학교 주변에 trolley square라는 곳이 있습니다. 학교에서 TRAX를 타고가면 3정거장 정도면 도착하는 곳인데, 그 곳에 가면 KFC, Jimmy johns, deltaco, tacobell, 베스킨라빈스, 베이커리 등 음식점도 몇 개 있고 Smith라는 마켓이 있어서 장 보기가 좋습니다. Smith는 한국의 이마트나 홈플러스 정도 규모의 마켓이라고 보면 됩니다. 이 곳도 저렴하지만 식기구나 이불, 옷걸이 등 처음에 도착해서 필요한 물건들을 사시려면 월마트에 가시는 것도 좋습니다. 하지만 월마트는 트랙스를 타고 꽤 많이 가야하기 때문에 무거운 것을 사면 들고오기가 어렵습니다. 
또 트랙스를 타고 다운타운 방향으로 가면 gateway라는 mall이 있는데 그곳에서는 쇼핑을 할 수 있습니다. 혹은 주말에 친구들과 함께 영화를 보러가거나 가서 산책을 하기에도 좋습니다. 
또 솔렉 안에서 어디를 가고싶을 때 길을 찾으려면 UTA라는 utah transit authority 사이트를 이용하면 아주 편리합니다. 이 곳에 들어가면 Trip planner라는 기능이 있어서 출발지와 목적지를 선택하면 버스노선, 시간 등 자세한 정보를 얻을 수 있습니다.
또 동계올림픽이 열린 도시답게 스키리조트가 많아서 겨울에는 스키를 타러 가기도 좋고, 여름에는 캠핑이나 하이킹을 하면 좋습니다. 주변에 국립공원도 많고 캠핑을 할 수 있는 곳도 많기 때문입니다. 솔렉이 엄청 번화한 도시가 아니기 때문에 자연 속에서 즐길 수 있는 것들을 많이 하면 좋을 것 같습니다.","기숙사는 크게 두 종류로 나뉩니다. dorm형태와 apartment형태가 있습니다. dorm형태에는 sage point, gateway height, chapelglen이 있고 아파트형태에는 benchmark와 shoreline이 있습니다. 벤치마크에는 학부생들이 조금 더 많은 편이고 shoreline에는 대학원생이 많습니다. 아파트형 기숙사에 살 경우에는 밀플랜을 구매할 필요가 없지만 dorm 형태에 살 경우에는 밀플랜 구매가 필수입니다. 대부분이 일주일에 12개 먹는 밀플랜을 이용합니다. 저는 아파트형 기숙사에 살았는데 5개짜리 밀플랜을 신청했습니다. 그래서 집에서 밥 해먹을 일도 별로 없었고 밀플랜이 너무 많이 남지도 않았습니다. 밀플랜이 남을 경우에 유니언에서 점심이나 저녁에 transfer를 해서 먹을 수도 있고, 혹은 기숙사식당 1층에 있는 매점에서 sack meal로 가져갈 수도 있습니다. 밀플랜은 매주 목요일에 갱신되고 남은 밀플랜은 소멸됩니다. 
아파트 형태에 사는 사람들은 smith에서 장을 봐서 음식을 해먹는데, 주방기기도 다 사야하기 때문에 번거로운 점이 있습니다.
또 학기중에는 union이라는 학교의 중심에 있는 빌딩에서 점심을 주로 먹습니다. union 지하에 cafeteria가 있는데, 중식, 피자, 샐러드, pho, 쿠키 등 여러가지 음식을 골라서 먹을 수 있습니다. 또한 jamba juice라고 한국의 스무디킹과 비슷한 체인점이 있어서 아침에 간단히 스무디로 해결하기도 합니다. union말고도 bennion빌딩, business빌딩에서도 식사를 할 수 있는 곳이 있습니다.","저는 전공수업 2개와 ESL 수업, 라틴아메리카댄스, 테니스, 골프, 볼링을 들었습니다. 교환학생의 경우 12학점 정도를 들으면 학비가 채워집니다. 처음에 교환학생들에게 학비 limit을 주는데 그 안에서 해결하면 추가로 학비를 낼 필요가 없고, 학점을 더 들어서 limit을 넘어가게 되면 넘어간 만큼만 학비를 지불하면 됩니다. 그래서 저는 non-credit으로 골프와 테니스를 들어서 남은 학비를 꽉 채워서 들었습니다. 
전공수업 같은 경우에는 Concrete Design과 Transportation planning이라는 수업을 들었습니다. 콘크리트 수업은 백인 교수님이었고 교통공학 수업은 중국인 교수님 이셨습니다. 처음에는 듣기 어려웠지만, 미리 예습도 하고 저는 공대라서 문제를 풀거나 하는 경우가 많았기 때문에 시간이 갈 수록 따라가기가 쉬웠습니다. 이해되지 않는 부분이 있거나 숙제를 하다가 모르는 문제가 있으면 수업끝나고 교수님께 질문하거나 교수님 오피스에 자주 찾아 가서 물어봤습니다. 언제나 친절하게 알려주시고 학생들을 가르치는 것이 자기가 여기 있는 이유라고 하시면서 언제든 질문하러 올 때마다 반겨주셨습니다. 콘크리트는 한 학기동안 시험을 3번, 교통공학은 2번봤는데 두 과목 모두 두 번째 시험에서 일등을 했습니다. 특히 백인 교수님과 많이 가까워졌었는데 처음에는 영어로 말하는 것도 어색해 하더니 시험에서 1등을 했다면서 수업시간에 모든 학생들 앞에서 칭찬해주시면서 다른 학생들에게 저와 친하게 지내라고 우스갯 소리도 하셨습니다. 수업시간에 저 혼자만 아시안이고 50명 전체 학생중에 여학생이 3명밖에 안되었기 때문에 발표를 하거나 적극적으로 나서기가 주춤해 질 때가 많았는데, 그 이후로 친구들도 많이 사귀고 같이 디자인 프로젝트를 한 조원들과는 시험기간엔 공부도 같이 했습니다. 
교통공학 수업 같은 경우에는 매주매주 내는 과제가 있었는데, 수업시간에 친한 친구 두명을 사겨서 매주 월요일마다 만나서 숙제를 같이 했습니다. 학생들이 상대평가가 아니고 절대평가 이기 때문에 다 같이 공부해서 다 점수를 잘 받자는 마인드 입니다. 제가 잘 이해한 것은 친구에게 설명해주고, 또 제가 잘 모르겠는 부분은 친구에게 설명을 들으면서 영어도 늘고, 친구도 사귀고, 공부도 하고 1석3조의 효과를 냈습니다. 
또한 수업시간에 질문하고 토론하는 분위기가 아주 자연스럽기 때문에 같이 수업듣는 학생들이 하는 질문과 대답속에서도 많을 것을 배울 수 있습니다. 
ESL 수업같은 경우에는 Cross culture language라는 수업이었는데, 영어를 배운다기 보다는 미국의 역사도 배우고 각 나라에서 온 외국인 친구들과 생각을 교류하면서 토론하는 위주의 수업입니다. 매 수업시간마다 작은 소그룹을 만들어서 그날의 주제에 대해 매일 토론합니다. 주제는 미국의 역사 중 미국이 잘못한 것에 대한 것이 많습니다. 예를들어 노예, 중국인, 일본인 학대, 성적소수자에 대한 차별 등 여러가지가 있었습니다. 그 수업에서 아랍, 일본, 중국 등 여러나라에서 온 친구들을 만나고 그들의 문화를 배울 수 있어서 굉장히 재밌었습니다. 특히 아랍같은 경우는 저희와 문화가 정말 많이 다르고 제가 모르고 있던 점이 아주 많아서 신선한 충격이었습니다.
도서관은 marriot 그룹에서 지어준 정말 큰 규모의 도서관이 있습니다. 컴퓨터실과 열람실이 매우 많고 항상 자리가 있습니다. 학생이 아무리 많아도 자리가 많기 때문에 자리가 없어서 공부를 못 할 일은 거의 없고, 한국과 다르게 열람실 자리발권 시스템이 없습니다.","국제교육부는 Union 3층에 위치해있습니다.
처음에 도착하면 국제교육부에서 오리엔테이션을 주최하는데 그 때 많은 정보를 나눠줍니다. language exchange program이나 friendship family 등 오리엔테이션에서 신청하는 프로그램이 아주 많습니다. 또한 cross culture club이나 매주 금요일 international cafe도 운영하는데 그 곳에도 참여하면 세계 여러나라에서 온 친구들도 만날 수 있고 좋습니다.
또한 여학생들 같은 경우에는 international women association이라는 단체가 있는데 주기적으로 모여서 활동을 합니다. 함께 운동경기를 보러가거나 같이 저녁을 먹으면서 이야기를 나누기도 합니다.
국제처에 계시는 선생님들은 다들 친절하십니다. 저는 한국어 수업에 TA로 참여했었는데 거기서 만난 친구가 국제처에서 조교로 활동해서 그 친구에게 도움도 많이 받았습니다. 또 한학기 교환학생 과정이 끝나고 J-1 인턴쉽 비자로 바꿔서 여름학기 동안 인턴쉽을 할 때도 국제처에 계시는 직원분들께서 새로 비자 서류를 받는 것도 많이 도움을 주셨습니다.","학교안에 필드하우스라는 곳이 있는데 학생증이 있으면 들어가서 운동을 할 수 있습니다. 규모가 꽤 커서 가면 자리가 없어서 운동을 못 하는 적은 없습니다. 또한 그 안에 테니스코트, 농구코트도 있습니다. 그리고 huntsman 센터에 가면 수영장이 있는데 큰 풀이 2개나 있고 사람이 별로 많지 않아서 자유롭게 운동할 수 있습니다. 
또 학교안에 ORP(Outdoor Recreation Program)라는 부서가 있는데 이 곳에 가면 스키, 보드, 고글 혹은 캠핑장비를 싼 가격에 대여해 줍니다. 겨울에 가시게 되는 분들은 스키나 보드 수업을 들을 수도 있는데, 이럴 때 여기서 한학기 동안 대여해서 타면 됩니다. 가서 스키나 보드는 살 수는 없으니까요. 스키는 한학기 대여하는데 60불정도 입니다. 
또한 유타대학교에 한인학생회가 있는데 한인학생회 사이트의 벼룩시장에서 물건을 사고 팔기도 합니다. 필요한데 새로 구입하기에 부담스러운 물건들은 벼룩시장 게시판을 찾아보시면 유용합니다. 저 같은 경우에는 처음에 이 사이트를 몰라서 물건을 다 새로 샀는데, 한국으로 오면서 주방용품, 체중계, 옷걸이 등 한국으로 가져오기 힘든 것들은 팔고 왔습니다.
또 Cross culture club 이라고 국제처에 소속된 단체가 있는데 학교 정문 바로 앞에 위치해 있습니다. 저렴한 가격에 영어회화, 쓰기 수업을 하기도 하고 매주금요일마다 행사를 합니다. 
또 학교 정문 바로 맞은편에 bucks4books라는 곳이 있는데 이 곳은 중고책을 사고 파는 곳입니다. 교과서가 매우 비싸기 때문에 학생들이 자주 이용합니다. 혹은 학교 캠퍼스 스토어에서도 책을 되사주고, 학기초에는 중고책을 팝니다. 저는 중간에 교과서를 한 번 잃어버려서 bucks4books에 가서 헌 책을 샀는데 제 값보다 훨씬 싼 값에 책을 구매할 수 있습니다.","크게 기억나는 culture shock은 없습니다. 소소한 것들로는 한국과 다르게 기숙사 층에 남녀 구분이 없습니다. 저는 아파트형 기숙사였는데 바로 옆에 4명이 사는 방이 남자방이기도 하고, 또 기숙사 안에 사감이 없기 때문에 남자친구나 친구를 항상 데려오는 룸메도 있습니다. 1학기 때 미국인 룸메 한명은 항상 남자친구를 데리고 왔는데, 방에만 있고 같이 쓰는 공간은 돌아다니지 않았기 때문에 크게 불편하지는 않았습니다. 하지만 혹시 불편을 느끼신다면 층 마다 있는 RA에게 도움을 청하면 됩니다. RA는 각 층에 한명씩 정해져 있는데 학생이고 기숙사 관리를 합니다. 
또 학교가 dry 캠퍼스라서 학교에서는 술을 마실 수 없습니다. 술을 가지고 다니다가 RA에게 걸릴 경우에는 그 자리에서 모든 술을 다 열어서 버리게 합니다. 그 후에는 학교에서 하는 온라인 교육도 받아야 합니다. 자세한 설명은 오리엔테이션에서 들을 수 있습니다. 
그리고 수업시간에 학생들이 책상위에 다리를 올리고 있다거나 한국에서라면 매우 예의없는 행동을 하는 학생들이 있습니다. 물론 뒤쪽에 앉은 학생이긴 했지만 처음에 보았을 때는 좀 충격을 받았습니다. 또 수업시간에 샐러드나 간단한 샌드위치 등 식사를 해결하면서 수업을 듣기도 합니다. 하지만 교수님이 절대 그런것에 대해서 지적하지 않습니다.
저는 연세대학교에서 유타대학교로 혼자 파견되었기 때문에 한국에서 유타까지 처음 가는 길에 걱정이 많았습니다. 미국에 가는 것도 처음인데, 타지에서 혼자 몇 개월동안 지내야했기 때문입니다. 하지만 미국 안에서도 유타는 사람들이 정말 친절하고 길을 지나가다가도 눈을 마주치면 모르는 사람 끼리도 인사를 합니다. 처음 공항에서 학교에 갈 때, 오리엔테이션 때문에 기숙사에서 유니언 까지 갈 때, 길을 몰라서 지도를 보고 있으면 지나가는 행인이 와서 도움이 필요하냐면서 친절하게 도움을 줬습니다. 
또 학교안에 튜터링 센터가 있는데 저는 영어공부를 위해서 튜터링 센터에서 ESL(English Second Language) 튜터링을 받았습니다. 튜터링을 신청하면 튜터 명단을 주고 그 중에서 원하는 튜터에게 연락을 하고 서로 시간을 정해 튜터링을 시작합니다. 개인튜터링은 한 시간에 6불짜리 타임카드를 사야하고, 2명이상인 그룹튜터링은 한 시간에 3불짜리 타임카드를 구입하면 됩니다. 타임카드는 튜터링센터에 가서 구매하고 튜터와 튜터링을 한 뒤에 타임카드를 튜터에게 줍니다. 튜터들은 유타대학교 학생인데 ESL이라고 해서 꼭 영문과가 아니라 다양한 학과 학생들이 튜터링을 합니다. 미국문화에 대해서도 배우고 저는 튜터가 솔렉 출신이라서, 솔렉에 대해서 많이 얘기했습니다.","위에서 말한 한인학생회나 국제처, 혹은 수업을 듣는 교수님께 상담을 요청할 수도 있습니다. 저는 전공수업 교수님 한 분이 엄청 친절하게 대해주셔서 어려운 일이 있으면 물어보러도 가고 그 교수님 연구실에서 여름학기 동안 인턴쉽도 했습니다.","교환학생은 정말 자기 하기 나름이라는 생각이 들었습니다. 어떤 학생은 공부를 엄청 열심히 할 수도 있고, 어떤 학생들은 와서 친한 친구들과만 어울리다 가는 경우도 있고, 어떤 학생은 여행만 엄청 열심히 다니기도 합니다. 어떤 것이 나쁘다 좋다고 말할 수는 없습니다. 자기가 교환학생으로 미국에 와서 하고자 하는 목표를 이루면 그걸로 충분하다고 생각합니다. 저는 미국에서 보낸 7개월 동안, 정말 즐거운 시간을 보냈고 미국친구 뿐만 아니라 여러나라에서 온 친구들도 많이 만났습니다. 처음에는 외국인과 친구가 될 수 있을까 생각했지만, 나중에는 정말 친해져서 헤어지기가 어려울 정도 였습니다. 이번겨울에 한국에 놀러오기로 한 친구들도 생겼습니다. 친구 뿐만 아니라 한국에서는 해 볼 수 없는 여러가지 경험도 많이 했고 여행도 많이 했습니다. 
미국에서 혼자 생활하다보면 자기관리가 잘 안되서 흐트러지고 늘어질 때가 있습니다. 누구나 다 그럴 수 있다고 생각합니다. 하지만 그 때 다시 마음을 다 잡고 처음 왔을 때의 다짐을 되새기면서 내가 교환학생을 통해 얻고자 하는 것, 배우고자 하는 것을 꼭 다 이루셨으면 좋겠습니다. 그렇다고 너무 스트레스를 받을 필요는 없습니다. 영어 때문에 스트레스를 받는 사람도 많지만 교환학생의 목적이 영어 하나만은 아닙니다. 미국대학에서 대학생활을 해보고 친구도 사귀고 미국문화도 느끼는 것도 교환학생의 또 다른 목적이라고 생각합니다. 공부도 해야겠지만 거기서 즐길 수 있는 것들을 스스로 찾아서 하셨으면 좋겠습니다.

이렇게 파견보고서를 쓰다보니 저도 느끼는 것이 많습니다. 저는 그 곳에서 보낸 시간이 제 인생에서 잊지 못할 소중한 시간이 될 것 같습니다. 좋은 사람들도 너무 많이 만났고 좋은 추억들도 많이 만들었기 때문입니다. 

여러분들도 유타에서 보낸 시간이 인생에서 잊지 못할 소중한 추억이 되셨으면 좋겠습니다."
"유타주는 미국 중서부, 캘리포니아주 바로 옆에 위치하고 있습니다. 전형적인 사막기후로 일년내내 아주 건조합니다. 그렇지만 보습력 좋은 크림, 로션 바르시면 괜찮습니다. (혹시 눈이 아프시면 안구가 건조해져서 그렇답니다. 저는 한국에 도착해서야 알았어요.) 
여름엔 기온이 높아지지만 건조해서 오히려 한국의 여름보다 견딜만합니다. 겨울엔 시도때도 없이 폭설이 내리지만 제설이 아주 잘되어서 불편하지 않았습니다.","유타대는 유타주의 주도 솔트레이크시티에 위치하고 있습니다. 한적하고 조용한 도시이긴 하지만, 나름대로 유타주 내에서는 큰 도시라, 생활에 불편한 점은 전혀 없었습니다. 
도시를 관통하는 TRAX라는 전차가 캠퍼스까지 들어왔는데, 배차간격도 15분으로 짧아 학교밖을 나갈때 아주 유용하게 이용했습니다. 유타대 학생증이 있으면 TRAX와 버스 모든 대중교통을 무료로 이용할 수 있습니다.","기숙사시설이 아주 좋은 편입니다. 지은지 얼마되지 않아 넓고 깔끔하면서도 저렴합니다. 대부분의 교환학생들은 Sage Point라는 기숙사로 배정이 되는데, 부엌이 없는 기숙사입니다. 방의 형태가 여러가지인데 저는 싱글딜럭스에 살았습니다. 싱글딜럭스는 방은 각자 쓰고 화장실과 거실을 같이 쓰는 형태입니다. 저는 혼자만의 공간이 중요해서 이 형태의 방이 만족스러웠는데, 방을 같이 쓰는 더블은 조금 더 저렴하고, 룸메이트와 친해질수 있다는 장점이 있습니다.
식사는 Meal Plan을 구입해야했습니다. 매주 Meal이 충전되는 제도인데, 12/week, 15/week, 19/week 중에 선택할 수 있습니다. 저같은 경우는 12/week을 구입했는데, 밖에서 나가 먹게되는 경우가 자주 생겨 모자라는 경우가 별로 없었습니다. 식사는 기숙사근처 Heritage Center라는 곳에서 주로 하게 되는데, 부페입니다. 주로 서양식이지만 아시아음식을 먹을 수 있는 철판요리 코너도 있고, 멕시코요리도 자주 나오는 편입니다. 샐러드, 과일, 케익, 아이스크림, 요거트 코너가 있어서 매 식사시간이 즐거웠습니다. (질려하는 학생들도 있었지만 저는 아주 만족했습니다.) 수업중간에 식사를 하는 경우 수업받는 건물 근처에 있는 학생회관 Union 지하에서 Meal을 Transfer해서 음식을 사 먹을 수 있습니다. 그곳의 메뉴들도 제법 훌륭합니다.
음식을 직접 해먹고싶은 학생들이 부엌이 있는 Benchmark나 Shoreline으로 기숙사를 옮기기도합니다. 이럴 경우 TRAX를 타고갈수있는 대형마트 Smith와 한국마트 오리엔탈마켓에서 장을 봅니다.","저는 두학기동안 전공인 경제수업 5개와 불어수업, 기타수업을 들었습니다. 학생들이 그렇게 공부를 열심히 하는 편이 아니라서, 연대에서 공부하듯하면 무리없이 좋은 성적 받으실 수 있습니다. 특히 다른 외국어수업과 기타수업을 권하고 싶습니다. 미국아이들도 다른외국어에는 서툴기 때문에 같은 입장에서 공부하면서 친해질 수 있는 수업입니다. 기타수업 같은 경우 기타를 잡는법부터 가르쳐주는 Beginner 수업이 교양수업으로 있습니다. 교수님이 너무 좋으셔서 참 즐거웠습니다.
도서관은 2009년에 새로 지은 중앙도서관 Mariott Library가 있습니다. 새로지어서 시설이 좋고, 시험기간에도 늘 자리가 많습니다.",처음 도착하자마자 오리엔테이션을 받았던것 이외에는 특별히 방문한 일이 없습니다. 그렇지만 직원들 모두 친절해서 무슨 일이 생기시면 주저하지 말고 찾아가시길 바랍니다.,"국제학생들을 위한 Cross Culture Club이 있습니다. 매달 국제학생들을 위한 행사를 개최하는데 이곳에서 국제학생 친구들을 만났습니다. 그리고 저는 한국에서 활동하던 기독교동아리가 미국에도 있어 적극적으로 참여했습니다. 한국에서는 CCC로 알려져있고 미국에서는 CRU라는 이름으로 활동합니다. 저는 이곳에서 너무 좋은 친구들을 만날 수 있었는데, 혹시 관심있으신 분은 저한테 물어보세요.","솔트레이크시티는 몰몬교의 성지입니다. 그래서 학교학생들의 반정도가 몰몬교도입니다. 몰몬교의 영향으로 어린 나이에 결혼한 친구들이 많아, 제 또래 학생들이 결혼을 했고, 아이가 있다는 것이 처음에는 굉장히 놀라웠습니다. 그 외에는 몰몬교의 영향으로 도시전체가 보수적인 분위기라 딱히 Culture Shock라고 느낀 것은 없는 것 같습니다.","생활하다보면 자연스럽게 현지친구들이 생기고, 그 친구들에게 도움을 받을 때가 많습니다. 저는 교환학생생활동안 출석했던 유타한인장로교회에서 도움을 많이 받았습니다.","두학기동안 참 많은 일들이 있었습니다. 지금까지의 환경과 완전히 다른 곳에 들어가 내 자리를 잡고, 그곳에서 아는 사람을 만들어가는 일이 쉽지 않고 외롭기도 했지만 그것이야말로 교환학생에서 얻을 수 있는 가장 귀중한 경험이라고 생각합니다. 내가 누구인지에 대해 더욱 알게되었고, 내가 가진것들이 얼마나 소중했는지에 대해 알았기 때문입니다. 다른 사람과 비교하지 마시고, 영어가 늘지 않는다고 너무 스트레스 받지 마시고, 모르는 사이 체화되는 것들과 성장하는 자신을 믿으시고 진취적으로, 즐기시면서 생활하시면 될것 같습니다."
