gen_info,env_info,food_info,study_info,office_info,facil_info,mhct_info,help_info,etc_info
면적은 적당하였으나 연대보다 조금 작은 느낌이 든다. 평지가 많아 보드를 탈줄 아시는 분이라면 이동하시기 편할 것 같다.위치는 애너하임 위쪽 LA서 동쪽에 위치하고 fullerton 다운타운에는 그다지 볼 것이 없었다. 기후가 한국보다는 덥지만 비가 거의 오지 않는 건조한 기후로 한국 여름보다는 적응하기 쉬울 수도 있을 것 이다.,그리 다운타운도 아니지만 그렇게 시골도 아니다. 학교밖 숙소도 어렵지 않게 구할 수 있으며 마켓 또한 그리 멀지않다. 그러나 신촌과 같은 유흥가 느낌도 아니니 한적하게 시간을 보내기에 좋은 곳 이다.,본인은 기숙사 1년계약을 하고 들어갔으며 밀플랜 역시 신청하였다.(선택사항이 아니라 기숙사 신청시 밀플랜 필수) 기숙사 반년 거주 후 외부 아파트로 이사하고 싶었으나 계약시 1년 계약이라 실패하였다. 기숙사와 밀플랜이 그닥 저렴하지는 않으나 학식 자체에는 만족하였다. (학기당 6000불) 미리 고국서 숙소를 알아보고 기숙사에 살지 않던 교환학생도 봤다. 위에 언급한바와 같이 마켓이 멀지않은 거리에 있으므로 도보로도 쇼핑이 충분히 가능하다. 다만 한인마트를 원할경우 차가 필수일듯 하다.,수업은 정말 쉽다. 본인은 공대생이라 1학기 15학점 2학기 12학점을 들었고 전부 전공으로 신청하였다. 다만 첫학기에대학원생과 같이듣는 수업을 신청하였는데 이 경우 난이도가 꽤나 높았다. 학점도 15학점을 넘길수 없으므로 본교와 비교하면 여유롭게 학교생활을 할 수 있다. 도서관은 2동이 있는데 한쪽 동이 지진의 여파로 폐쇄되어 있었다. 1년 머무를동안 보수 시작도 하지 않았다...이 영향으로 책 자체도 그리 많지 않았으며 신간이 그리 많지 않았다. 공부할수있는자리는 생각보다 많지 않았으나 시험기간을 제외하고는 항상 자리가 있다.,처음 입국시를 제외하고 그닥 방문한적이 없어 잘 모르겠다. 일처리가 느린 느낌을 받았다. 2학기 수강신청시 이 부서를 통해 수강신청을 하다 12학점밖에 신청을 못하여서 그닥 기억 평가는 가지고있지 않다.,체육관이 잘 갖추어져 있다. 교환학생이라면 무료로 이용 가능하다.,다양한 인종이 많았다. 특히 인도쪽과 히스페닉.,한인 교회가 있다 들었지만 가보지않아 잘 모르겠다.,한가로이 1년을 보내다 온 곳이다. 영어를 좀 더 공부해 가지못한것에 아쉬웠고 즐거운 시간이였다.
대학의 크기는 생각보다 큽니다. 면적이요. 그러나 전반적인 건물의 수나 사이즈는 연세대학교보다는 좀 작은거 같네요. 위치는 LA에서 약 남동쪽으로 50분 거리에 있고 바다와는 약 40분거리에 위치합니다. southern california 특성상 확실히 건조하고 많이 더워요.(정말 덥습니다. 40도 가까이 올라가는...),미국에 가시는 분들 중 주변환경에 민감하신 분들이 많을 텐데요.(총기사건 등등) 그러나 확실히 말씀 드릴 수 있는것은 풀러튼 주변은 굉장히 안전한 지역이라고 말씀드릴 수 있어요. 대부분이 주택가이고 orange county 특성상 범죄와는 거리가 먼 동네에요. 근데 문제는 먼가 큰 도시를 생각하고 가시면 살짝 실망 할 수 있다는점? 제목에서 말한바와 같이 여유로운 분위기입니다. 그렇다고 시골은 아니에요~,보통 CSUF가는 학생들이 가장 실수를 많이 하는 부분이 이 부분인데 CSUF에서 안내해주는 주거 형태가 기숙사와 하숙집 밖에 없어서 많은 학생들이 이 둘을 선택했다가 많은 돈을 잃기도 하고 원하는 생활을 못하는 경우도 많이 있습니다. 제가 추천하는 것은 룸메이틀과 아파트를 같이 쓰는것 입니다. 돈도 아낄 수 있고 룸메이트들과 많이 친해 질 수도 있기 때문입니다. 단점은 식사 해결이 힘들다는점? 미국에서 사먹으려면 팁도 줘야하고 세금도 가격에 포함이 안돼어있기 때문에 생각보다 많이 비싸다는점! 한끼 밖에서 먹으려면 한국돈으로 못해도 8000~9000원정도 써야 하기 때문에 저는 룸메이트의 코스트코 카드를 써서 한번에 재료를 대량구매하여 밥을 매끼 해먹었습니다.,수업은 절대평가이고 교수님들 대부분이 친절하시기 때문에 크게 문제는 없었습니다. 미국 학생들도 친절한 경우가 많아서 말하면 잘 도와주고 절대평가 특성상 같이 윈윈하자는 분위기 여서 어려움을 격어도 수업 친구들에게 도와달라면 잘 도와줄 것입니다. 도서관은 연대와 같이 2개의 건물이 있으나 제가 있는 동안에 한 건물이 공사 중이여서 사용하지 못했습니다. 우리나라와는 다르게 도서관 분위기가 자유로워 음식도 먹을 수 있고 크게 떠들수도 있어서 많은 학생들이 쉼터로도 자주 사용합니다. 그러나 공부를 조용한 곳에서 하고 싶은 학생들을 위하여 한층 전체가 조용한 구역도 있기 때문에 진짜 공부만 하고 싶은 학생들도 이러한 분위기에 문제를 제기하지는 않습니다.,California 특성상 많은 인종들이 함께 생활하기 때문에 국제처 분들도 다양한 문화에 대해 어느 정도 이해를 하시는거 같고 다들 친절하십니다. 문제가 있으면 찾아가서 편하게 이야기 할 수 있는 분위기 입니다.,우리나라와 같이 많은 동아리가 있으나 우리나라와는 다른점이 진짜로 미국의 동아리는 동아리 활동을 하기 위해서 존재한다는점? 먼가 친목도모만을 위해 존재하는 동아리는 극히 소수고 운동 동아리면 진짜 운동만 딱 하고 집가고 봉사동아리면 봉사만 하고 집가는? 친목도모를 하고 싶으면 개인적인 노력이 필요하다는 점이 다른것 같습니다.,은근히 정말 친한 친구 사귀기가 힘듭니다. 수업시간의 친구는 수업친구고 동아리 친구는 동아리 친구고...그외에서 만나서 친분을 다지고 싶으시면 전적으로 개인의 노력이 필요합니다. 인스턴트식 친구들은 많이 사귈 수 있으나 정말 인생친구를 사귀고 싶으시면 개인적인 노력이 많이 필요합니다. 저는 룸메이트와 많이 친해져서 아파트에서 사는것을 추천하는 이유도 이것과 관계가 깊습니다. 같이 살다보면 자연스럽게 많이 친해질 수 있기 때문에? 또 다른 컬처쇼크는 진짜 상상이상으로 자동차의 필요성입니다. 동부의 뉴욕같은 대도시는 그나마 대중교통이 잘 발달이 되어서 자전거만 있어도 살만 하다는 소리를 들었는데 만약 자신이 큰 대도시에 살지 않으면 미국에서 차가 없다는 소리는 한국에서 다리가 없다는 소리와 비슷합니다. 어딜가나 차가 필요할 정도;;; 전 다행이 룸메이트 2명이 차가 있어서 빌려 타기도 하고 애들이 라이드를 재공해 주기도 해서 그나마 돈을 아꼈지만 우버비로만 많을 돈을 쓰는 교환학생들을 한 두명 본게 아닙니다.,풀러튼 주변에 진짜 한인들이 많이 삽니다. 교회를 나가시면 많은 도움이 될 것입니다.,"풀러튼 좋은 곳입니다. 날씨도 환상적이고 안전하고... 엄청나게 익사이팅한 교환학생 생활이 아니라 먼가 좀 쉬고 싶다, 힐링하고 싶다 하시는 분들에게 추천합니다."
"CSUF has the largest number of students in CSU system and compared to any university in California: it has over 38,000 students. The school is located in Fullerton, California where the climate is sunny and dry around the year.","The university has a very diverse student body with people having different race/ethnicity. Also the school has a big exchange program, therefore, there are many people from all over the world attend the school as well.","The host university wasnt great at arranging accommodation for exchange students as I and many of my friends (who are also exchange students) had difficult time finding a place to live. There was no room left in the university's dormitories so I had to find an apartment outside of the school, which was a challenge considering I was not in the states or knew anyone who could help me in the states.Living expenses were certainly higher than Seoul, especially Fullerton because the area is mostly for college students and wealthy people.","The library system in CSUF was different. Usually the libraries I've been to, people should keep quiet. However, the library in CSUF is open for discussions so most of the floors arent quiet. Moreover, the library isnt 24/7.Due to a big earthquake previously, half of the library closed off for renovation during my time at CSUF.",The variety of courses are impressive. There are a lot of courses about other countries or foreign-related. I took The Vietnam Wars and it was a comprehensive class.,"There are many clubs and activities at school. Usually you pay a small fee and youll be provided with lessons and equipments at the club. Sorority and fraternity are big.Sometimes there are big school events. My favorite was Under the Stars concert, it is an annual outdoor concert.","The portion of the food is big, you can always bring food home, you need a car to go anywhere, everything is far from each other, OCTA is pretty bad so dont rely on public system in Fullerton, etc. To sum up, I didnt experience any big culture shock that made it difficult to cope with, just a lot of small interesting things that make up the whole culture of California","International Office at CSUF is okay. The help isnt too extensive (considering how they couldnt help with accommodation) but whenever I have questions, I can go to their office and they always helped me as much as they could",There are ducks everywhere. It is strange in a very amusing way
"- California State University Fullerton(이하 CSUF)는 총 22개의 CSU계열 캠퍼스 중에서 2번째로 큰 곳이고, 총 학생 수는 3만 5천명 정도되는 정말 거대한 학교이다. 교내는 우리 연세대와 대조적으로 언덕이 전혀 없는 평평하고 드넓은 초원같은 느낌이다. 초록 잔디와 큰 나무들이 넓게 펼쳐져있다. 캠퍼스는 정말 예쁘고 여기에 캘리포니아 날씨까지 더해져서 정말 최고다.- 천상의 날씨를 자랑하는 캘리포니아의 오렌지 카운티 Fullerton에 위치하고 있고, Fullerton은 정말 도로나 주변 환경, 거주지 등이 정말 깔끔하고 좋다. 1년에 비는 한 두번 올까말까하고 그 외에는 95% 이상이 전혀 습하지 않으면서 30-35도에 쨍쨍한 날씨이다. 겨울에도 20도 정도되는 따뜻한 날씨이다.","- 주변에는 걸어서 갈 만한 거리에 크고 작은 음식점들과 편의 시설들이 위치해 있다. - 바로 횡단보도를 건너서는 Hope International University라는 정말 조그만 크리스천 대학과 기숙사가 있는데 주의! 이 곳에는 매년 부산 동서대에서 100명의 학생이 자매학교 프로그램으로 1년동안 살다 간다. 문제는 CSUF의 교내 기숙사 일처리를 담당하는 분이 unresponsive하고 일처리도 정말 느리기로 악명높기 때문에, 첫 학기는 운이 정말 좋은 것 아니면 많은 학생들이 CSUF의 기숙사 입사에 반강제적으로(?)실패한다. 이 다음 문제는, CSUF에서 이 Hope Univ 기숙사에 살도록 그 루트를 추천해준다. 그 다음은... 100명의 부산 학생들과 반년, 1년을 정말 그 작은 기숙사에서 같이 생활하며 지낸다. 영어 절대 안늘고 부산 사투리가 늘 수 있으므로..(이 부산학생들은 영어를 거의 못하는 학생들) CSUF의 단 하나의 엄청나게 큰 단점은 아이러니하게도 이 Hope Univ에 살 수 있을거라는 점이다. 부디 기숙사 신청에 촉각을 세우고 신속하게 신청하며, 그렇게 한다 해도 안받아 줄 수 있으니 이 점 유의!- 풀러턴은 자신을 entertain할 수 있는 시설이 정말 많은 곳이다. 모든 시간 기준은 자가용을 이용했을 때, 10분 거리에 Downtown Fullerton이 있다. Downtown Fullerton은 재즈바, 클럽바, 카페 등이 밀집해 있으며 매우 깔끔하고 분위기가 좋다. 반대쪽 10분 거리에는 Brea가 있어서 역시 Downtown Brea역시 조그맣지만 매우 깔끔하고 분위기가 좋고 Brea mall은 학생들이 정말 많이 애용하는 백화점 몰이다. 20분 거리에 Disneyland와 Knott's berry farm, 40분 내외 거리에 Six flags 등의 놀이공원이 위치해 있다.","-위에서 말한 Hope에서 살 수 있다. 1년 교환 프로그램이라면 2번째 학기에는 방학동안 미리 신청해서 반드시 CSUF 기숙사로 변경할 것.-CSUF 기숙사는 정말 10점만점에 9.5점 정도로 식당과 기숙사학생을 위한 편의 시설과 각종 activity들이 다채롭다.-이 외에 UH라고 해서 apartment형식의 빌라에서 살 수도 있다. 이 곳 역시 전세계에서 온 국제 학생들이 많이 거주하고 있으며 CSUF나 Hope와 가장 큰 다른 점은 아무래도 Private apartment이기 때문에 술, 파티 등에 자유롭다. Hope는 크리스천 대학이기때문에 술, 마약, 파티 등이 철저히 금지되어 있고 CSUF도 그만큼은 아니지만 UH만 하지는 못한다. UH는 House party의 천국!","- 수업은 물론 교수님과 수업마다 다르겠지만, 일단 학교 규모에 알맞게 정말 다양한 과목들이 개설되어 있다. 와이섹처럼 Titanium이라는 온라인 시스템이 있으며, 성적의 기준은 굉~장히 높다. 절대 평가로 100점 만점에 60점이 넘지 못하면 자비 없이 F가 뜨게 된다. 자기의 절대적 점수에 맞게 A부터 F까지 정말 다 준다.- 도서관은 연대만큼 모던하지는 않지만 자료들의 양이나 전문성은 손색이 없다. 도서관이 매우 crowded하다. 도서관 안에 위치한 writing center는 교내 학생이라면 누구나 무료로 글쓰기를 첨삭받을 수 있다.","국제처에서 운영하는 국제 학생을 위한 프로그램이 굉장히 많다. 매주 수요일 오후에 국제학생들의 티타임 등부터 시작해서, 각종 연사를 초청해서 강연하는 등 다양하고 유익한 프로그램이 많다. 메일로 많은 정보들을 항상 제공해주기 때문에 메일을 열심히 체크하고 그런 프로그램에 적극적으로 참여하면 더욱 뿌듯한 대학생활을 만들 수 있을거다.","- 체육관 정말 최고다. 운동욕구를 마구 마구 솟게 할 만큼 시설 정말 좋다. 특히 교환학생으로 가면 이 체육관을 무료로! 이용할 수 있으니 가자마자 등록하도록! (원래는 한 학기에 120불 정도)- 동아리의 수는 셀 수 없이 많고, 학기 초에 학교 광장 같은 곳에서 3일에 걸쳐 매일 다른 동아리들이 약 100개 정도 소개 되는 부스가 설치된다. 이 행사는 Discover fest라고 하고 반드시 참석해서 동아리를 드는 것 추천!-ASI라고 해서 Associate Student Union, 그러니까 중앙 학생회? 라는 엄청난 규모의 학생회가 있다. 학교 돈의 3분의 1을 차지한다고 해도 과언이 아닐만큼 어마어마한 집단. 여기서 주최하는 프로그램에 적극 참여해서 알찬 대학생활 하기를!","- 만약 운전을 하게 된다면, 미국 운전자들의 매너들에 감탄하게 될 것이다.( 이것은 캘리포니아 지역만 해당될 수도, 뉴욕은..서울보다 미친듯이 운전하는 사람이 많다) 양보가 최우선이고 운전 매너가 정말 감동스럽다. 교차로에서 신호등이 다 고장나도 전혀 문제 없이 양보해서 지나다닌 경험이 한 두번이 아니다.- 미국 내에서도 거의 독립 국가와도 같은 CALIFORNIA..새롭고 재밌는 캘리포니아 생활을 fully 즐기시고 오기를! 개인적으로 캘리포니아는 행복하게 살기 좋은 곳으로 세계 최고라고 생각.","- 앞서 언급한 것들 종합해서국제처, ASI, 기숙사 내 각종 액티비티 프로그램, 도서관 내 Writing center","제목에서 처럼 캘리포니아는 천상의 매력적인 환경을 가지고 있지만, 교환학생의 입장에서는 ""한국인이 정말 많다""는 큰 약점이 있다. 영어를 배우고 캘리포니아에서의 대학생활을 제대로 즐기고 배우고 싶다면, 그만큼 끊임없는 노력이 필요하다. 자기 자신을 comfort zone에서 벗어나게 하고 항상 새로운 문화, 배움을 향해서 적극적으로 탐험하는 자세가 필요하다! 그럴 자신이 있다면 캘리포니아로 당장 떠나라! 당신의 인생에 엄청난 선물과 배움을 줄 것이다."
"CSUF는 한적하고 부유한 동네인 Orange County의 Fullerton 남쪽에 위치하고 있습니다. 학교 크기는 별로 크지 않으며, 언덕이 없어 편합니다. 하지만 수업이 연달아 있는 경우 쉬는시간 십분내에 다른 건물로 이동하는 것이 빡빡할 수도 있습니다. Fullerton은 LA에서 차로 40분 정도 떨어져 있으며 기차를 타면 30분내로 엘에이에 도착할 수 있습니다. 기차역은 다운타운 풀러턴에 있으며 차로는 십분, 버스로는 십오분 안에 도착할 수 있습니다. 대중교통이 한국만큼 잘 되어 있지 않아 차가 없으면 놀러다니기에 불편합니다. 하지만 위치적으로는 엘에이와 가깝고 샌디에고와도 기차로 2시간 정도로 가까워서 여행하기에 좋습니다. 오렌지 카운티엔 한국인이 많이 거주 하고 있어 근처 Garden Grove나 Buena Park에 가면 한국음식점, 마트, 미용실 등 korea district가 있습니다. 유명한 비치들(헌팅턴, 뉴포트 등)이 차로 30분정도 거리에 있으며 버스로는 왕복 3시간 정도 걸립니다. 날씨는 캘리포니아 답게 사계절 내내 햇빛이 강하며 비는 굉장히 드뭅니다. 지진을 가끔 겪을 수 있으며 겨울이 전혀 춥지 않았습니다. 하지만 낮의 뜨거운 날씨와는 다르게 밤은 약간 쌀쌀합니다.","학교주변은 거주지역이라 놀만한 곳이 많이 없습니다. 다운타운으로 나가면 술집과 음식점, 구제샵들이 많습니다. 쇼핑을 갈 때는 옆 도시인 brea mall이 가기 편하며 버스를 타고 15분정도면 갈 수 있습니다. 또한 캘리포니아에서 제일 크며, 미국에서 세번째로 큰 쇼핑몰인 south coast plaza엔 버스로 약 1시간, 차로는 30분 정도로 갈 수 있습니다. 근처 로렌하이츠에는 중국인들이 많이 살아 중국 음식점들이 많고, 한국인들은 부에나팍, 가든그로브에 많습니다.","첫번째로, 온캠퍼스 기숙사가 있습니다. 학교 안에 기숙사가 있으며 방을 쉐어하는 형태이고 화장실은 공용으로 씁니다. 애초에 이곳을 알아보지 않아서 잘 모르지만, 주로 현지학생들이 많이 이용해서 현지 외국인 친구를 사귈 수 있다는 장점이 있지만, 방을 쉐어하므로 룸메이트와 마음이 맞지 않으면 고생할 수 있다는 단점이 있습니다. 온캠퍼스 기숙사에 살면 기숙사 바로 앞에 있는 게스트로놈이라 불리는 식당을 이용할 수 있는데 이 때 밀 플랜을 선택 할수 있습니다. 두번째로 오프캠퍼스 기숙사인 UV가 있습니다. 저는 여기에 살았는데 학교와 걸어서 20분 정도 떨어져 있으며 아파트 처럼 한 집 안에 방이 두개 혹은 세개가 있어 방은 혼자 쓰고 거실과 부엌을 쉐어하는 형태입니다. 화장실은 쉐어 혹은 자기 방 안에 있는 것을 고를 수 있으며, 기숙사 비에 밀플랜이 포함되어 기숙사 안에 있는 카페테리아를 평일동안 하루 2번 이용할 수 있습니다. 온캠퍼스 기숙사는 파티에 단속을 많이 해서 파티가 많이 없다는 얘기를 들었는데 오프캠퍼스 기숙사인 유비는 자유로워서 주말에는 항상 하우스 파티가 열립니다. 제 룸메는 일주일 내내 평일에도 파티를 했습니다. 세번째로 학교 앞에 새로생긴 UH가 있는데 여기는 최소 1년씩으로 계약을 할 수 있습니다. 유브이 처럼 방을 혼자 쓰고 거실과 부엌을 쉐어할 수 있고 온캠퍼스 기숙사 처럼 방도 쉐어하고 거실과 부엌도 다른 방에 사는 룸메와 쉐어하는 형식이 있습니다. 새로 지어진 만큼 시설도 좋고 방 안에 세탁기, 세탁물 드라이기, 전자레인지, 음식물 분쇄기, 티비 등 시설이 잘 구비되어 있습니다. 레크레이션 룸에는 엑스박스도 있어서 게임을 할 수 있고, 컴퓨터 룸도 있습니다. 카페테리아가 없다는 단점이 있지만 개인적으로 uh를 추천하는 바입니다.","저는 통계학과 전공인데, 학교에 학부로 통계학 전공이 따로 없고, 수학과 전공에 통계학 수업이 몇개 없어서 부전공인 경영학 수업을 들었습니다. 첫학기엔 엔터테인먼트 비즈니스, 영어학, 연극, 볼링, 파이낸스 수업, 총 15 학점을 들었습니다. 연극과 볼링은 친구 사기귀에 좋을 것 같아서 들었습니다. 연극수업은 요구하는게 많고 영어를 많이 써야해서 힘든점도 있었지만 정말 재밌고 좋은 경험이 되었습니다. 추천하는 바입니다. 전공수업이었던 엔터테인먼트 비즈니스와 파이낸스는 어려웠지만,한국에서 들을 수 없었던 수업이었습니다. 영어학 전공 수업은 라이팅을 향상시키기 위해 들었고, 락 뮤직에 대해 배웠습니다. 두번째 학기엔 댄스, 필름뮤직, 다른 영어전공 수업, 마케팅을 들었습니다. 댄스 또한 친구 사기귀에 좋은 수업이며, 파이널로 그룹프로젝트로 조를 짜서 댄스시험을 봅니다. 필름뮤직은 학점 따기에 좋고, 영어전공 수업으로 structure에 대해 배우는 수업을 들었는데 중국인 교수님이 좋았습니다. 마케팅은 과제로 20페이지 에세이가 있어서 힘들었지만, 시험은 무난했습니다. 솔직히 미국 생활을 즐기느라 공부를 거의 하지 않았지만, 한국과 비교해 시험은 쉬운편입니다. 객관식 시험도 많고, 교수님들이 따로 스터디 가이드를 주셔서 공부하기에 수월했습니다. 공부할 때는 도서관을 이용했는데 도서관엔 학생들을 위한 컴퓨터 들이 많으며 자유로운 분위기입니다.","국제교육부를 교환학생 파견 초와 파견말에 이용하게 되는데 개인적으로 일처리는 좀 답답합니다. 실수도 잦고 일처리가 느려서 마음고생을 했지만 문제가 있거나 상담할때 이용하면 좋을 것 같습니다. 따로 이용한 적이 없어서 국제교욱부에 대해 잘 모르지만, 교환학생들을 위한 프로그램들을 실시하니 참여하면 새로운 친구들을 만날 수 있을것 같습니다.","학교에 레크레이션룸이라고 해서 큰 헬스장이 있는데 무료로 이용할 수 있습니다. 무료프로그램도 많고, 수영장이 있으며 돈을 내고 신청하면 락 클라이밍도 할 수 있습니다. 저는 어드벤쳐 클럽과 코리안 아메리칸 클럽을 가입했었는데 어드벤쳐 클럽은 말그대로 어드벤쳐, 즉 하이킹, 캠핑 등을 가며 액티브한 활동을 합니다. 코리안 아메리칸 클럽에는 한국에 관심이 많은 외국인들이 많아서 쉽게 친구를 사귈 수 있습니다.",개인적으로 심한 문화충격을 받은 건 없었습니다.,교내에 국제교육부를 찾아가면 도움을 받을 수 있습니다. 또한 기숙사를 살면 ra들에게 도움을 요청할 수도 있습니다.,
