gen_info,env_info,food_info,study_info,office_info,facil_info,mhct_info,help_info,etc_info
"미국 북중부 미네소타의 가장 큰 도시인 미니애폴리스 중심부에 위치하고 있는 University of Minnesota는 주를 대표하는 대학답게 엄청나게 큰 규모의 캠퍼스를 가지고 있습니다. 학교 안으로 미국 최대인 미시시피강이 캠퍼스를 가로지르며 흐르고 있고, 학교 안으로 캠퍼스 셔틀 뿐만 아니라 많은 대중교통 버스가 다닙니다. 그만큼 미국의 다른 도시에 비해서 교통시설이 편리하며 다른 곳으로의 접근성 역시 뛰어납니다. 미네소타 하면 딱 떠오르는 것이 엄청 추운 겨울인데요, 제가 도착했던 겨울이 몇십년만에 최악의 추위였다고 했는데 정말 추울때는 밖에 나갈 엄두가 나지 않을 정도로 눈도 많이 오고 기온도 영하 20~30도 까지 떨어지는 곳입니다. 하지만 3월만 되어도 봄의 기운을 느낄 수 있고 기말고사가 있는 5월이 되면 한국의 봄 날씨만큼 아름다운 곳이 이 곳 미네소타입니다. 미네소타 주는 위로는 캐나다와 접해있으며 호수가 많은 곳으로 유명한 곳입니다. 의류에 세금이 없어서 쇼핑하기에 엄청 좋은 곳으로 유명한 곳입니다. 가까운 유명한 도시로는 시카고를 들 수 있으며 차로 약 7시간 거리에 위치하고 있습니다.","미네소타 주의 중심에 미니애폴리스 도시가 위치하고 있고 그 미니애폴리스 도시 중심에 미네소타 주립대학이 위치하고 있습니다. light rail과 대중교통 버스가 엄청 체계적이고 잘 되어있어서 미니애폴리스 다운 타운 나가거나 미네소타 주도인 세인트폴에 가는데 어려움 없이 이동할 수 있습니다. 학기 초에 84불을 내고 U-Pass를 구매하시게 되면 학생증에 붙일 수 있는 스티커를 배부받게 되고 미니애폴리스에서 운영하는 모든 대중 교통을 무료로 이용할 수 있습니다. 직접 요리를 해서 생활하실 분은 장을 보러 많이 가실텐데 이 U-Pass를 가지고 계신 것이 경제적으로 훨씬 더 이득이 되실 겁니다. (교통비는 편도에 2불이며 트랜스퍼를 받으면 3시간 동안 환승하실 수 있습니다.) 큰 도시안에 있다보니 크고 작은 쇼핑몰이 많이 있습니다. Light rail의 종점에 Mall of America라는 미국에서 몇 손가락 안에 꼽히는 큰 쇼핑몰이 있으며 다운타운에도 Nicollet mall street이 있습니다. grocery store는 세인트폴 쪽으로 가시다보면 학교에서 약 15분 거리에 wall mart와 rainbow 라는 큰 두개의 대형 상점이 있습니다. 그리고 한국 grocery store도 rainbow와 크게 멀지 않은 곳에 위치하고 있으니 이 3군데를 모두 들러 먹거리를 장봐오시면 될 것 같습니다.
학교는 크게 미시시피 강을 기준으로 west bank와 east bank로 나뉘어져 있습니다. 가장 눈에 띄는 점은 학교 캠퍼스 내의 대부분의 건물이 지하 통로인 gopher way 또는 2,3 층의 sky way 로 연결되어 있다는 것입니다. 추운 겨울날 굳이 밖에서 (정말 추울때는 밖에 나갈 수도 없죠) 이동하실 필요 없이 안으로 다니시면 될 것 같습니다. 캠퍼스 지도를 통해서 이 건물 저 건물 찾아다니는 연습을 하시게 될 거에요. (국제학생 OT 때 캠퍼스 맵을 받으실 수 있고 coffman이라는 학생회관 같은 성격의 건물 information desk에서 지도를 구하실 수 있을겁니다.)
west bank에서 5분 거리에 metro dome 이라는 야구장이 있고 미국 메이저리그 minnesota twins 팀이 홈으로 사용하는 경기장입니다. 상당히 특이한 점은 우리나라에서 볼 수없는 돔구장이라는 것입니다. 수요일에는 student''s day라고 해서 외야석 티켓을 4불에 구할 수있습니다. 한국과는 상당히 다른 관전 문화를 느끼실 수 있을것입니다. east bank 캠퍼스안에는 TCF Stadium이라는 풋볼 스타디움이 있습니다. 전 시즌이 아니라서 경기를 볼 수 없었지만 가을에 파견가시는 분은 TCF 경기장에서 열리는 minnesota bikings의 경기를 관람하실 수 있을겁니다. NFL MLB 같은 대중 스포츠 외에 미네소타 대학교 자체의 스포츠 팀이 많이 있는데 캠퍼스 내의 경기장에서 경기가 열리기도 합니다. 알아보셔서 스케줄 체크하시고 구경가시면 좋은 경험이 되실 것 같습니다( 전 가보지 못했지만 미네소타와 위스콘신의 농구 경기는 연고전 처럼 엄청난 라이벌전이라고 들었습니다)
대학 주변 환경에서 하나 주의하셔야 할 점이 있다면 west bank와 metro dome사이에 소말리아 사람들이 모여서 사는 동네가 있습니다. east bank는 큰 상점들이 많이 있고 목, 금, 토요일 밤 늦게까지는 사람이 많지만 그와 반대로 west bank는 해가지면 사람이 많이 없고 썰렁합니다. west bank 내에서 여러 크고 작은 사건들이 빈번이 일어나고 있으니 밤 늦게는 혼자서 west bank 쪽으로 안가시는 게 안전하실거라 생각합니다.","학교 내에 크고 작은 기숙사들이 엄청나게 많이 있습니다. 학교 housing department에서 관리하는 아파트도 두개가 있고, 학교와는 별개의 여러 크고 작은 아파트들이 캠퍼스 내에 있습니다. 우선적으로 SAF를 통해서 파견가게 되신다면 크게 centennial hall과 middlebrook hall 로 배정을 많이 받게 될 것입니다. 위의 두개의 기숙사는 국제학생들이 많이 모여사는 곳입니다. 학교에서는 1학년들은 1학년 들만 살 수 있는 기숙사에 우선 배정하고 국제학생들은 centennial hall과 middlebrook hall에 많이 모여살게 배정하고 있다는 느낌을 받았습니다. 두 기숙사 모두 밀플랜을 사용할 수 있는 다이닝홀을 가지고 있습니다.
저는 University village ( UV )라는 학교 housing department에서 관리하는 아파트에 배정받아서 한학기 생활을 하였습니다. SAF 지원 시 기숙사 선호도 조사를 하실텐데요.. 저는 기숙사에 살고 싶어서 아예 아파트는 지원하지도 않고 위에서 말한 센트니얼과 미들브룩만 1순위 2순위로 지원하였는데 배정은 UV로 받았습니다. 배정 받은 후에 기숙사 변경지원을 온라인 상에서 할 수 있는데 센트니얼과 미들브룩은 한번 배정을 받지 못하면 그곳으로 변경신청이 받아들여질 가능성이 거의 없다고 보시면 될 겁니다 (실제로 저도 변경을 못하였구요). SAF 미국 본사에 왜 아파트에 배정받았는지 직접 물어볼 수 있는 기회가 생겨서 물어보았는데 기숙사 배정은 전적으로 SAF가 아닌 미네소타 주립대 housing department에서 하고 있어서 SAF에서도 관여를 하는 부분이 아니라고 들었고 아파트에 배정받은 이유는 상대적으로 다른 국제학생에 비해 나이가 많아서이기 때문이라는 답변을 받았습니다. (학교측에서는 너무 어린 학생들과 같이 어울리지 못할까봐라는 배려의 측면에서 신경써서 아파트로 배정된 것이라고 하더군요.) 따라서 미네소타에 파견가시는 분 중 나이가 좀 있으신 분들은 아파트에 배정을 받게 될 가능성이 큽니다. 실제로 저랑 같이 파견갔던 친구들중에 제일 연장자 두 사람이 아파트에 배정받았습니다.
센트니얼과 미들브룩은 흔히 영화에서 볼 수 있는 평범한 기숙사입니다. 다른 학생들의 파견보고서를 참고하시면 될 것 같고요, 제가 한학기 생활했던 University Village는 아파트 형태입니다.
크게 장점으로 뽑을 수 있는 것은 아파트라는 측면에서 기숙사보다는 생활하기 편리합니다. 화장실도 방마다 집마다 있으며 요리를 해 먹을수 있는 부엌이 있습니다. 따라서 기숙사에 살게 된다면 의무적으로 신청해야하는 밀플랜을 신청하지 않고 직접 요리를 해먹을 수 있습니다. 전 3명이 두개의 방을 쓰는 구조의 아파트 였는데(돈을 조금 더 내면 1인 독실을 쓸 수 있습니다. 전 더블룸으로 배정을 받았구요) 학기 말까지 룸메이트가 오지 않아서 넓은 더블룸을 혼자서 썼습니다. 1인실을 썼던 인도네시아 대학원 친구와는 크게 친하지 않았지만 그 친구가 이미 그 곳에서 3년 넘게 생활한 친구라 없는 것 없이 편하게 지낼 수있었습니다. (TV, 게임기 등) UV 안에는 간단히 휘트니스 센터가 있어서 운동을 할 수 있으며 컴퓨터 랩실, 스터디 라운지 등이 건물안에 있습니다.
단점은 일단 학교 캠퍼스 east bank의 외곽쪽에 위치하고 있어서 다른 기숙사와 아파트에 비해서 학교 내로의 접근성이 떨어집니다. 저는 경영학과여서 수업이 대부분 west bank에 있었는데 아침 1교시 (8시 15분) 수업 같은 경우에는 정말 서둘러 준비해서 나와야 했습니다. 사실 west bank도 따지고 보면 연대 정문에서 연대 상대보다는 가까운 거리이지만 살인적인 미네소타의 겨울 추위를 고려해 본다면 체감상으로는 거리가 멉니다. 여러 그 밖의 작은 단점들이 있었지만 전 개인적으로는 아파트에 살았던 것에 대해서 완전 만족하고 있습니다. 외국인 친구를 불러서 한국 요리도 해주고 여러 친구들 집으로 불러서 파티도 하곤 했는데 잊지 못할 추억이 될 것 같습니다.","수업은 4과목을 수강하였습니다. 먼저 경영학과 전공 과목인 International Business Communication (BA 3900) 수업을 들었습니다. 연세대학교 비즈니스커뮤니케이션 으로 대체하고자 수업을 들었는데 우리학교 수업과는 약간 다른 수업 컨탠츠 입니다. 이 수업은 레쥬메 PT 등에 초점이 맞춰져 있기 보다는 여러가지 case 분석을 통해서 어떻게 하면 효과적으로 다른 나라 비지니스 사람들과 소통할 수 있는 지 배웁니다. 딱딱한 판서의 수업이 아닌 교수님의 오픈된 강의 스타일입니다. 토론과 수업 시간 안에서 해야하는 여러가지 활동 등이 모두 성적의 대부분을 차지합니다.
경제학과 수업을 두 과목 들었는데 바로 미시경제학과 화폐금융론입니다. 두 과목 모두 연세대학교 경제학과 수업들과 비슷한 형태로 진행되며 2~3주에 걸쳐서 숙제가 나오면 풀어서 제출하고 중간고사 기말고사를 보는 형태로 진행되었습니다.
마지막으로 ESL 수업 중 writing 수업을 들었습니다. 거의 매시간 라이팅 숙제가 있었지만 많이 도움이 되었던 수업 같습니다. 특히 일본 중국 친구들과 수업 후에 배드민턴도 치고 같이 밥도 먹고 하면서 많이 친해지고 집으로 초대해서 파티도 하고 같이 쇼핑도 가고 했습니다.
도서관은 각 단과대학 건물마다 크고 작은 도서관이 있습니다. 가장 큰 도서관은 west bank의 Wilson과 east bank의 Walter 입니다. 주로 저는 Walter에서 공부를 하였는데 현대식 인테리어가 아닌 고풍스러운 느낌의 도서관이었습니다.","국제교육부는 West Bank의 Humpley 건물에 위치하고 있습니다. 그 곳에 이희성이라는 분이 월, 수요일 근무하셨는데 많은 도움을 받았습니다. 국제처에서는 크고 작은 여러 행사를 기획하고 국제학생들끼리 잘 어울릴 수 있도록 기회를 마련해주었습니다. Group Discussion을 할 수 있도록 국제처에서 조를 만들어 주었고 매 주 만나면서 다른 수많은 나라에서 온 친구들과 어울릴 수있는 기회가 되었습니다.","학교느 recreation center 라는 큰 체육관이 있습니다. 하지만 제가 갔었던 2009년 봄학기 SAF 교환학생들은 student fee를 내지 않아서 공짜로 사용할 수 없었습니다. 미네소타로 파견 가시게 된다면 student fee 지불 여부를 미리 확인해 보시고 가시는게 좋을 것 같습니다. 학교 내에 많은 동아리가 있고 봉사활동, job pair 같은 곳에서 학교 내 여러 정보를 얻을 수 있습니다.",별다른 문화 충격은 없었지만 제가 미네소타 공항에 도착했던 2009년 1월 12일의 그 날 밤의 추위는 평생 잊지 못할 것 같습니다.,국제처를 통해서 도움을 받을 수 있습니다. 그리고 KISO라는 한국 학생회가 있는데 저는 가보지 않아서 잘은 모르겠지만 도움을 청하고 받을 수 있을 것 같습니다.,주변에 유명한 도시가 시카고 밖에 없어서 서운하시다고요? 미니애폴리스와 세인트폴 역시 미국에서 엄청 유명한 도시이며 많은 볼거리를 가지고 있는 매력적인 도시라고 생각합니다. 그리고 오히려 미국 북중부에 있기 때문에 미국 동부도 가보고 서부도 가 볼 수 있는 것 같습니다. 전 교환학생으로 있었던 정말 동부 서부 중부 남부 가리지 않고 많은 도시들을 여행하고 왔습니다. 하나하나가 잊지 못할만큼 벅차고 짜릿한 추억입니다. 많이 보고 많이 웃고 많이 느끼는 교환학생 생활을 하시길 후배님들에게 바라겠습니다. 혹시 더 추가적인 질문이 있으시다면 언제든 sonman84@naver.com 으로 메일주시기 바랍니다.
"미네소타 트윈시티 캠퍼스는 버스를 타고 캠퍼스를 돌아다녀도 꽤 시간이 걸릴 정도로 큰 규모입니다. 또한 트윈시티 캠퍼스는 버스를 타고 근처의 모든 곳을 갈 수 있는 교통이 편리한 곳입니다. 제가 미네소타에 파견된 시기는 1월부터 5월이었는데, 미네소타에서의 겨울은 눈썹이 얼 정도로 정말 추웠습니다. 하지만 캠퍼스내에는 미네소타의 상징의 이름을 딴 ''gopher way''라는 지하통로가 건물과 건물간을 이어주고 있어서 추위를 피해다닐 수 있었어요.","우선 캠퍼스 내에는 다양한 식당과 카페들이 있습니다. 언제든지 편리하게 이용할 수 있어요. 그 중에는 그저 그런 정도로 맛있는 한국 식당과 서비스는 주지 않는 까칠한 주인 아저씨가 운영하시는 한국 노래방도 있습니다. 참고로 홍콩누들이나 베트남 쌀국수 집, 멕시칸 요리점은 정말 맛있어요. 
  그리고 앞에서 말했듯이, 트윈시티 캠퍼스는 교통이 잘 갖추어져 있어서 대중교통으로 쉽게 캠퍼스를 벗어나 월마트나 한인마트, mall of america 등 거의 모든 곳을 쉽게 갈 수 있어요. 특히 mall of america는 tax가 붙지 않는 미네소타에서 쇼핑 겸 구경을 위해 자주 찾게되는 인기있는 장소입니다. 그 곳에 가면 놀이기구도 이용할 수 있어요. 그리고 미네소타에는 아름다운 공원들도 많이 있습니다. 날씨 좋은 날 버스를 타고 친구와 함께 공원에 호수를 보러 가면 행복한 추억을 만드실 수 있으실 거에요.","저는 centennial hall이라는 기숙사에서 생활했어요. 말레이지아 룸메이트와 함께 double room을 썼구요. 문화가 다른 타국 학생과 한 방에서 생활하는 것은 확실히 불편하긴 했지만, 외국인과 4 달정도 함께 지낸 것은 제게 굉장히 색다른 경험이었어요.  
  식사는 기숙사 내에서 meal plan을 이용할 수 있어서 부페식으로 편리한 식사를 즐길 수 있었습니다. centennial hall은 야식도 제공되는 기숙사여서 저는 개인적으로 너무 행복했어요. meal plan을 이용하면 요일별로 다양한 식단이 제공됩니다.",규모가 큰 대학인만큼 과목 선택의 폭이 굉장히 넓어요. 어드바이져에게 수업 선택시 친절한 상담을 받으실 수 있습니다. 도서관은 정말 시설이 잘 되어 있어요. 시험기간에는 공부하는 학생들을 위해 24시간 개방을 하기도 합니다. 학교 곳곳에 공부할 수 있는 공간이 많이 있어서 도서관 외에도 여기 저기에서 공부를 할 수 있어요.,"국제처에 가면 많은 도움을 받으실 수 있어요. 모두들 친절하고 성의 있는 답변을 해줍니다. 특히 그곳에서는 국제학생들을 위한 다양한 프로그램을 찾을 수 있어요. tandem같은 1:1 buddy 프로그램도 잘 되어 있구요, 영어로 다양한 문화권의 학생들이 토론을 하는 토론클럽 프로그램도 있습니다. 제가 갔을 때는 한국 대학원생분이 거기서 아르바이트를 하고 있어서 친절하게 챙겨주시기도 했었어요.  비자와 관련된 사항도 친절하게 상담 받으실 수 있어요.","캠퍼스 내에 교회도 있고, 스포츠를 즐길 수 있는 경기장도 있고, 병원도 있어요. 거의 모든 부대시설이 캠퍼스 내에 다 갖춰져 있다고 할 수 있습니다. 캠퍼스 내 경기장에서 미시간 주립대학교 농구팀과 시합하는 걸 구경갔었는데, 라이벌 전이라 정말 재밌게 경기를 응원했던 기억이 있어요. 
  동아리 역시 너무나 많은 종류가 있어요. 사교 춤 동아리에서부터 각 나라의 무예, 토론클럽 등.. 학교 사이트에 들어가시면 모든 동아리 정보가 다 안내됩니다. 거기서 고르시면 될 거에요. 저는 탱고를 배우러 한번 갔었는데, 정말 재밌더라구요.","외국 친구가 파티에 초대했을 때, 룸메이트와의 생활에서 등 생활 속 인간관계나 대처법에 대한 사소한 것들이 문화적 충격이었어요. 하지만 정말  이해할 수 없을 정도로 다른 부분은 없었던 것 같습니다.",제가 직접 연락해보지는 않았지만 한인 학생회 사람들에게 도움을 받을 수 있어요. 특히 방학 때 잠시 묵을 집을 빌리거나 하는 경우에는 이런 사이트에서 큰 도움을 얻을 수 있어요.,
