gen_info,env_info,food_info,study_info,office_info,facil_info,mhct_info,help_info,etc_info
"미네소타 주의 주도인 세인트폴과 차로 한 시간 반 정도 떨어져 있는 세인트 클라우드는 매우 작고 조용한 곳입니다. SCSU를 중심으로 모든 생활이 돌아간다고 해도 과언이 아니며 학교 규모가 연대와 비슷하다고는 하지만 훨씬 더 작은 느낌을 줍니다. 주변에 유명한 관광지는 없지만 미네소타 사람들이 주로 놀러가는 휴양지, 호수, 미시시피강 등은 얼마든지 갈 수 있습니다. 제가 있던 가을학기는 그다지 춥지 않았고, 1월부터 시작된다고 하는 본격적인 겨울 전에 귀국하여 잘 모르겠으나 1월에는 정말 다리가 터질 것같은 추위가 계속된다고 합니다. 제가 있을 때도 한국에서는 한파라고 부를 정도의 날씨에 칼바람이 부는 날도 꽤나 있었고, 무엇보다 기온과 관계없이 눈은 정말 많이 내립니다. 눈이 한 번 오면 많이 오고 그치지 않는데다가 잘 녹지 않아서 캠퍼스 곳곳에 치운 눈들이 쌓여 있는 모습을 볼 수 있습니다. 메트로돔 천장이 눈때문에 무너졌다는 뉴스를 본 적도 있었습니다.","대학교 외에는 작은 다운타운 밖에는 특징적인 것이 없습니다. 미시시피강을 접하고 있는 학교에는 은행, 식당, 문구점 등 다양한 시설이 있으나 연대와 같은 복합적인 편의시설을 기대할 수는 없습니다. 오티기간에 버스 타는 법을 안내해주는데 익숙해지면 매우 편리한데다가 학생증으로는 무료여서 캐시앤와이즈, 코본(김치를 팔고 있습니다.), 월마트는 물론 크로스로드 몰이라는 곳으로 쇼핑을 하러 갈 수도 있습니다. 크로스로드 몰 외에는 딱히 쇼핑을 할 만한 곳이 없기는 하지만 몰 안에 백화점도 두개 있고 그럭저럭 몇몇 브랜드가 입점해 있어서 그곳에서 지내면서 입고 쓸 만한 물건들은 큰 불편없이 살 수 있었습니다. 몰 주변 거리들을 잘 보면 아울렛이나 보세매장도 꽤 있고, 차를 타고 간다면 알버트빌 이라는 코치, 캘빈클라인 정도의 브랜드 아울렛거리도 있어서 큰 세일기간에 가는 친구들도 있었습니다. 
 학교에서 걸어서 10분이면 도착하는 다운타운은 정말 작고 술집이나 클럽도 몇 개 없습니다. 주 법에 따라 새벽 2시면 모든 술집이 문을 닫고 들어갈 때 미성년자인지 확인도 매우 철저합니다. 그래도 친구들과 어울려 놀다보면 매우 즐겁게 놀 수 있고 싸왓디, 퍼킨스, 드래곤 부페 같은 식당들에 익숙해지면 그럭저럭 잘 지낼 수 있습니다. 다만 24시간 편의점 같은 곳은 없기때문에 밤 11시~1시정도면 닫는 가스 스테이션에서 미리 이것저것 사다 놓아야 합니다. 
 다운타운은 매우 작지만 버스나 택시를 타고 시 곳곳에 위치한 인도 음식점, 베트남 음식점 등등에 갈 수 있고 일본 음식점도 두 곳이나 있어서 외식을 하거나 친구들과 놀 때에는 큰 불편 없이 놀 수 있습니다.","저는 Sherburne hall 4층에 살았습니다. 처음 갈 때 로렌스에 신청했는데 떨어지고 2지망이었던 셔번에 살게 되었는데 듣던 말과는 달리 생활에 불편은 없었습니다. 시설이 낡았다고 하지만 그다지 불편하지 않았고 다른 기숙사에 비해 무선 인터넷이 조금 느리기는 하지만 생활에 지장은 없었습니다. 
 샤워실이나 휴게실 등의 시설은 괜찮고 세탁실이나 부엌도 넓고 쾌적합니다. 무엇보다도 학생식당인 가비와 연결되어 있어서 추운 날에도 쉽게 이동할 수 있다는 것과 13층건물이라는 이점때문에 많은 외국인 친구들과 쉽게 만날 수 있다는 점이 좋았습니다. 물론 국제학생기숙사인 로렌스처럼 기숙사 자체적으로 행사가 많다거나 국제학생 오티때 만난 친구들을 계속해서 볼 수 있는 곳은 아니지만, 미국인들을 만나기에는 좋은 곳이라고 생각합니다. 
 제 룸메이트는 하루종일 영화와 드라마를 챙겨보는 미국인이었는데 사이는 좋았습니다. 몇몇 룸메이트와 문제가 생기는 경우도 보았는데 기숙사 사무실에 얘기하면 방을 쉽게 바꿔주고, 각 층 CA가 문제를 해결해주기도 하니 참지 말고 말하는 것이 좋습니다.
 식사는 밀플랜 Anytime 을 신청했었는데 매우 편리했습니다. 언제든지 가서 음료나 과일 등을 집어올 수 있다는 것외에도, 제각기 시간표가 다른 친구들을 가비에서는 적어도 하루에 한번씩 다같이 모여서 얼굴 보고 인사할 수 있기 때문에 식사보다는 만남의 장소로 더 좋았던 것같습니다. 다만 학기 말부터는 캠퍼스 밖에 사는 친구들을 많이 만나면서 그들 집에서 함께 요리를 해 먹기도 하고, h mart 등에서 주문한 재료로 우리끼리 음식을 해 먹기도 하곤 했습니다.
 그 외에도 학교 안에는 버거킹, 피자헛, 서브웨이, 와우 등의 식당이 있는데 가격이나 맛도 괜찮고 가끔씩 가비에 질렸을때 갈 만합니다. 다만 학교 안에 있는 모든 시설이 대부분 일찍 문을 닫기 때문에 시간을 미리미리 숙지하시는 것이 좋습니다.","도서관은 작고 책도 별로 없지만, 컴퓨터를 쓰거나 자리를 잡는데 어려움은 전혀 없습니다.
 저는 총 5과목의 수업을 들었습니다.
1. Women in Politics
정치학 전공 300단위(연대의 3000단위 개념)로 보고서 3번으로 중간 기말대체가 되는 수업이었습니다. 교재가 3권정도 있지만 자율적으로 읽어와서 매 수업때는 그 때 그 때 교수님이나 학생들이 생각한 주제로 각자의 의견을 말하는 토론식 수업이었습니다. 교수님이 국제학생을 굉장히 배려해주시고, 고학년 전공수업이다보니 저밖에 아시아인이 없어서 제가 말할 때면 반 전체가 제 얼굴을 보면서 집중하며 듣는 쑥스러운 일도 있었습니다. 보고서는 각각 10페이지정도로 쓰면 되지만 영어가 미숙함에도 불구하고 내용만 참신하고 주제에 맞으면 점수를 굉장히 잘 받을 수 있습니다. 한국의 여성문제, 군대, 출산율 등의 이야기를 하면 모두들 신기해하면서 듣습니다.

2. Introduction to African Studies
아프리카 스터디 전공과목으로 200단위수업입니다. 입문이라는 수업명에 걸맞게 정말 개괄적인 모든 내용을 다루는게 인류의 기원부터 남아공월드컵까지 전 범위를 공부해야 합니다. 교수님은 우간다출신 흑인으로 굉장히 재밌고 유쾌하신 분이지만 성적에서는 깐깐하고 무엇보다 영어발음이 알아듣기 어려워서 수업 초반에는 고생을 좀 했습니다. 교수님 본인이 말을 헷갈리게 하실 때가 많아 언제 퀴즈를 보는지, 뭘 해오라는 건지 미국 학생들도 여러번 물을 때가 많은 수업이었습니다. 또 과목이 그렇다보니 아프리카 출신 흑인들이 수업에 굉장히 많아서 역시 아시아인은 저 혼자였습니다. 학기에 퀴즈는 4번이고 각각 재시험을 보게 해주므로 총 8번의 퀴즈를 보게 되지만 수업과 교재만 잘 읽으면 무리없이 풀 수 있습니다. 수업에서 나눠주는 프린트가 매우 중요합니다. 수업은 강의형식이고 가끔 비디오를 보기도 합니다. 매우 분위기가 자유로운 수업이었습니다.
3. French 102
프랑스어 수업으로 초중급과정입니다. 주어진 교재의 중간부터 끝까지 배우는 수업으로 수준은 과거시제부터 반과거, 단순미래, 대명동사, 진간접 목적어의 어순, Y 와 en, 명령법 정도입니다. 연대의 교양프랑스어에 비하면 매우 진도가 느리고 제가 들었던 미콜착 교수님은 휴강도 잦고 매우 느긋하신 분이라 수업이 매우 쉽다고 느껴졌습니다. 첫시간에 지금까지 불어를 얼만큼 배웠는지 얘기하는데 그 때 듣고 학생들에게 맞춰서 수업을 하시기 때문에 어려움은 없습니다. 숙제는 그다지 많지 않지만 교재에 맞는 인터넷 사이트에 들어가서 문제를 풀어야했는데 그 양이 꽤나 많아서 숙제 제출일 즈음에는 열심히 해야했습니다. 하지만 수업은 매우 재미있고 불어를 조금만 할 줄 안다면 공부를 하지 않아도 될 정도로 천천히 이해하기 쉽게 가르쳐주십니다. 학생 한명한명 매 시간 새로 배운 말로 교수님과 문답을 해야하고 시험은 3번정도 묻는 말에 대답을 쓰기 정도의 수준으로 큰 어려움 없이 어학실력을 향상시킬 수 있는 좋은 수업이었습니다.
4. ESL 
교환학생일 경우 어학시험 자체가 면제되기 때문에 오티 기간중에 placement test를 볼 필요가 없습니다. 하지만 ESL 수업을 들으려면 시험을 봐야하는데 그 시험이 매우 쉽기 때문에 ESL 면제라는 결과가 나왔습니다. 그럼에도 불구하고 영어 공부를 할 수 있겠다는 생각에 국제처에 말해서 일부러 ESL을 들었는데 제가 가장 후회한 일입니다. 가장 높은 반이었지만 한국에서는 중학생들이 들을 정도의 단어를 외웠고 마치 한국의 영어 writing초급반에서 다룰 법한 에세이 쓰기를 가르쳤습니다. 무엇보다 정규 수업시간외에 주당 한번씩 조교와 만나 따로 면답과 프로젝트를 진행해야하고, 자잘하게 단어장을 만들거아 지정한 곳을 견학하거나 독후감을 쓰라는 등 숙제가 매우 많았습니다. 교사들은 대학원생으로 대부분 깐깐하고 1분의 지각도 봐주지 않는 등 엄격한 사람이 많았습니다. 영어공부를 하고 싶으신 분은 전공과목에서 영어토론이나 보고서가 많은 수업을 택해서 노력하거나 차라리 영문학 전공과목을 듣는 편이 좋다고 생각합니다.
5. Piano Private lesson
1학점짜리 과목으로 피아노 개인레슨 수업입니다. 원래 학교에는 피아노 1, 2수업이 있지만 1은 말 그대로 악보를 볼 정도의 초보, 2는 두 손으로 칠 수 있는 사람을 위한 수업입니다. 만일 악보를 보고 두 손으로 칠 수 있는 사람중에 곡을 칠 능력이 있는 사람은 모두 피아노 1, 2와 관계없이 개인레슨 수업을 들을 수 있습니다. 학기초가 되면 음대사무실에서 오디션을 신청할 수 있는데 그 오디션을 보고나야 수강신청을 할 수 있습니다. 오디션에서는 자신이 준비한 곡 하나와 시험장에서 제시된 곡의 초견을 시험하게 되는데 교수님 두 분이 앉아서 수준을 평가합니다. 악보는 도서관에서 빌릴 수 있지만 악보가 별로 없으므로 미리 준비해가는 것도 좋습니다. 우리나라에서 소곡집정도만 칠 수 있으면 수준은 전혀 문제 없습니다. 다만 음대전공자가 우선순위이므로 수준에 따라 공석이 없으면 들을 수 없게 될 수도 있습니다. 수업은 주당 1번 30분인데 수업시간은 학기초에 교수와 정할 수 있으며 곡도 클래식위주이기는 하나 어떤 곡을 할지 정할 수 있고 본인이 연습한 곡도 자유롭게 교수님과 수업에서 다룰 수 있습니다. 다만 코드 스케일은 반드시 배워야 하고 진도를 나가는 것이 목적이 아니라 배우는 곡을 완벽히 마스터하는게 목적이라, 피아노 실력을 늘린다기 보다는 이번 학기에 곡 한 두개 정도는 완벽히 소화한다는 생각으로 듣는게 좋습니다. 기말 시험때는 교수님 세분 앞에서 제시되는 코드 스케일을 치고, 암기한 곡 하나, 악보를 보고 한 곡을 치게 됩니다. 피아노는 각 기숙사마다 있고 학생회관인 ATwood나 performing arts center에도 충분히 있기 때문에 어려움이 없었습니다. 피아노 외에 다른 악기도 대여하여 수업이 가능합니다.",로렌스 1층에 있고 매우 친절합니다.,"체육관이 매우 잘 되어 있고 매주 열리는 풋볼경기와 학내 팀들이 경쟁하는 축구 경기는 빼놓지 않고 보러갔습니다. 학기 초 동아리 소개하는 날 퀴디치, 라크로스 동아리 등에 들어 몇 번 갔었고 체육관의 유도클래스도 등록하여 2달정도 배웠습니다. 체육관에는 마사지 센터도 있어서 유용했고 매우 다양한 프로그램이 많아서 배우고 싶거나 하고 싶은 운동은 거의 모두 할 수 있다고 해도 과언이 아니니 꼭 살펴보시기 바랍니다. 
 학교 측에서 다양한 행사를 많이 해서 콘서트, 연주회, 연극, 강연회 등에 부지런히 참석하면 재미있는 것들이 많고 매달 한 번씩 하는 Atwood after Dark는 학생회관이 새벽까지 연장해서 개방되어 여러가지 행사를 하는데 매달 테마도 다르고 게임도 다양하여 매우 즐거웠습니다. 각 국가별 컬쳐 나잇이라든지 때때로 학교 앞에 설치되는 놀이기구 등등 친구들과 학교 안에서 추억을 쌓기 좋고 대부분의 행사나 시설들이 예상보다 질이 좋아서 깜짝 놀랐습니다. 봄학기에는 한인학생회에서 행사를 준비중이니 열심히 참여하면 좋을 것같습니다.
 또한 기독교 동아리인 CRU에서 캠프도 가고 집에도 초대받는 등 좋은 사람들을 많이 만났습니다. 각 나라 학생회에서 무료로 어학강좌를 열어 아랍어, 프랑스어, 스페인어, 중국어 등을 접할 수 있습니다.",특별히 없었습니다.,"한국인 학생이 40명도 안 되고 기숙사에 사는 사람들이 아니면 얼굴을 거의 보기 어렵기 때문에 정말 적은 한국인들밖에 없습니다. 그래서 더욱 서로서로 친해져서 유학생 언니, 오빠들에게 많은 도움을 받을 수 있었습니다. 
 3번가에 있는 한인교회에서는 오후 4시 예배 후 한국 음식을 먹을 수 있습니다.",매우 국제학생들에 대한 배려가 많고 각 학생회나 동아리가 활성화되어 있는 곳이라 지내기 편합니다. 더 궁금하신 내용은 hjhyl@naver.com 으로 메일 주시면 답변해드리겠습니다.
"미네소타의 중심지인 Minneapolis에서 차로 2시간 이상 떨어진 외딴 곳입니다. Minneapolis에 나가는 버스인 Jefferson line은 하루에 1, 2대 밖에 없고 executive express는 매우 비쌉니다. 교환학생 기간 중, 주말에 여행을 많이 다니시고 싶은 분은 비추입니다. 기온은 겨울에 영하 40도까지 내려간다고 하는데 제가 갔던 때에는 영하 20도 내외까지 내려갔던 것 같고, 한 번 폭설로 인해 휴강도 했습니다. 학교 크기는 연대보다 작고 10분 정도면 캠퍼스 끝에서 끝까지 갈 수 있습니다.","정말 아무것도 없습니다. 걸어서 갈 수 있는 다운타운은 시골 읍내보다 못합니다. 버스비는 공짜짜이지만 transit center가서 또 갈아타야 하므로 귀찮습니다. 버스를 타고가면, 기본적인 식료품이나 생필품을 살 수 있는 target, 월마트, cash wise가 있습니다. 가장 큰 쇼핑몰인 cross road에서는 hollister나 Victoria’s secret정도 밖에 없고 영화관도 버스 타고 한참 갑니다. 그러나 미네소타주는 옷에 붙는 tax가 없기 때문에 shipping free만 잘 찾으면 인터넷 쇼핑의 천국입니다. 참고로 한인마트나 음식점도 전혀 없으므로 미리 챙겨오거나 h-mart로 온라인 주문 하셔야 합니다.","Hill-Case에 살았는데 hill은 여자가 살고 case는 남자가 삽니다. 위치는 식당인 garvey와 도서관 사이에 있어서 최적입니다. 신입생보다는 3, 4학년 학생이 살고 조용한 분위기여서 심지어 옆 방에 누가 사는지도 모를 수 있습니다. 왁자지껄한 분위기를 원하시면 다른 기숙사에 가셔야 할 것 같습니다.  
식사는 Anytime을 신청했는데 아침은 귀찮아서 안 챙겨먹어서 주14나 비슷했지만 가격차이가 얼마 안 나기 때문에 언제든지 사용할 수 있는 anytime을 추천합니다. Munch money는 아침에 아인슈타인 베이글 먹는 것과 편의점 이용에 거의 다 썼습니다.","수업분위기는 한 클래스에 대학원생 포함 10명 내외여서 최고입니다. 저는 전공4과목, 교양1과목으로 15학점 들었습니다.
STAT332 Survey sampling (표본조사론) 
로빈슨 교수님 수업으로 실무 위주로 가르치십니다. 자잘한 과제와 퀴즈가 많지만 매우 쉽고 널널합니다. 
STAT430 Multivariate (다변량)
중국인 교수님 발음을 알아듣기 어려웠던 점 빼고는 괜찮았습니다. 시험 때 side paper를 만들어 갈 수 있어서 부담스럽지 않으나 과제 제출 시, SAS사용을 요구하기 때문에 SAS를 모른다면 과제에서 약간 힘들 수 도 있습니다. 그러나 시험이 쉽습니다. 
ECON485 Econometircs (계량경제학1)
여자 교수님이신데 깐깐하시며 스페인 억양이 강하십니다. 수업 내용은 쉬운 것 같은데 과제가 너무 많고 시험이 저에게는 어려웠습니다.
ECON470 Business Forecasting (경기변동론)
강응민 교수님이 수업하시며 E-views를 사용합니다. 중간 전까지는 통방과 회귀분석 정도 수준으로 쉽지만 중간 이후부터 프로그램 사용하면서 약간 어려워집니다. 가장 좋았던 점은 교수님께서 수업 이외에도 한국학생들을 따로 많이 챙겨주시는 것 입니다. 가끔 집에도 초대해주시고, 한국음식도 해주시고 여러 방면으로 챙겨 주십니다.
THEA148 Acting for Everyone (연극)
Role-play부터 긴 연극까지 점차 진행하는데 대본을 외우는 부담 빼고는 재미있었습니다.","로렌스홀 1층에 있는데 거의 이용하지 않았습니다. 종종 메일로 이벤트 소식이나 culture cafe 안내가 옵니다.
헬스센터는 매우 쌌던걸로 기억하고 시설은 나쁘지 않습니다. 기숙사와 너무 멀리 있어서 자주 이용하지는 않았습니다. 프로그램 중에서 요가는 그저 그렇고 필라테스는 최악입니다.",AIESEC에 가입했었는데 그다지 재미있지 않았습니다. 동아리 가입시에 지원서 제출하고 회장과 인터뷰 했던 것 같습니다.,겨울에 해가 너무 일찍져서 심심한 것 빼고는 없었습니다.,한인교회가 있다고 들었습니다.,솔직히 심심했지만 지금 생각해보면 다 하나의 잊지못할 기억으로 남았습니다. 미국에서의 생활은 나의 마음가짐에 달려있는 것 같습니다. 좋은 추억 만들어 오시기 바랍니다.
"SCSU가 위치한 St.cloud는 주도시인 미니에폴리스에서 차로 약 1시간 30분 거리에 있습니다. 물론 한국에서는 꽤 먼 거리지만, 드넓은 미국에서는 상대적으로 가까운 거리입니다. 버스나 도시로 놀러가는 친구들의 차를 이용한다면 어렵지 않게 갈 수 있는 거리입니다. 학교의 크기는 우리학교처럼 정문이 시작되어 엄마품에 포근히 감싼 듯 한 형태와는 달리 주변 인가들과의 이렇다 할 경계가 없기 때문에 정확한 가늠의 방법은 없는 듯 합니다. 그렇지만 모든 곳이 평지로 되어 있고, 대략의 학교 활동 반경은 넓지 않으므로 하이힐을 신고 상대 언덕을 오르며 홍삼액 복용에 대한 소망을 하던 일은 잠시 쉴 수 있습니다. 기후 또한 제가 파견 된 8월부터는 한국의 무더위와는 다르게 햇볕이 뽀송뽀송하여 쾌적한 활동을 할 수 있습니다. 물론 위도적 위치상, 9월후반즈음 부터 겨울이 찾아오기 시작하는데, 한 겨울이 되면 눈도 무척 많이 오고 가끔 매서운 추위가 찾아옵니다. 눈이 어찌나 많이 내리는지, 매일 밤 눈차가 눈을 치우고 나면 캠퍼스 안에서 눈산도 볼 수 있답니다. 전 행복하게도 날씨는 추웠어도 마음이 따뜻해서 춥지 않았던 것 같습니다. :)","학교에서 도보로 이동 가능 한 다운타운에는 bar,레스토랑, 중국식 식당,극장 등 여러가지 문화생활을 즐길 수 있는 곳들이 다양하게 있습니다. 가끔 학교의 식당식단이 지칠 때 쯤 나가서 사 먹기도 하고, 친구들과의 친목도모를 위해 bar에 가서 즐길 수도 있습니다. 버스를 타고 가면 target등 대형마트에도 갈 수 있으니 생활의 편의성은 높은 편 입니다. 학교 안에도 caribou coffee, 버거킹, 피자헛, 편의점 등이 있으므로 급한 용무는 그 곳에서 해결할 수도 있겠지요. 이 외에도 학교에서 걷다보면 미시시피 강에 이를 수 있는데, 날씨가 화창한 8얼 9월 햇살을 받으며 산책을 하는 것은 하루의 피로를 씻을 수 있는 고마운 활력소가 아닌가 합니다.","학교 안에는 기숙사 들이 있습니다. 아파트 형식의 Benton은 복도를 중심으로 주욱 늘어선 방 하나의 기숙사와는 다른, 하나의 아파트에 방 2개와 거실한개를 공유하는 형태입니다. 거실과 욕실이 방 2개의 4명만이 같이 쓰면 되므로 개인공간의 확보가 된다는 점은 매우 좋지만, 그곳에서 생활해 본 결과 방이 너무 좁아서 오랫동안 살기는 힘들 것 같습니다. 앞의 경험보고서들에 보면 국제학사인 Lawrence등을 필두로 다양한 기숙사들이 있는데요, 저는 Hill-Case hall에서 지냈습니다. 처음에  신청하지 않았던 Shoemaker hall에 배정받게 되어 학교에 도착하기 전 연락을 취해 새로 배정 받은 곳이 Hill hall이었습니다. 우리 기숙사는 4층으로 남학생과 여학생의 기숙사가 하나의 로비를 기준으로 별개의 건물로 나뉘며, 방의 크기는 다른 곳과 비슷합니다. 샤워실을 각층마다 공유하는 형태이고요, Hill-Case는 1층에 커다란 로비가 있기 때문에 여러 social 도 열리고 외국인 친구들과의 접촉도 용이 한 곳입니다. 식사의 경우는 meal plan 을 구입했는데, anytime을 신청해서 가고 싶을 때 마다 들러 이것 저것 조금씩 먹을 수 있어서 편리했습니다. 사실 밥을 직접 해 먹는 것은 가능할 수도 있지만 음식하는 시간, 그 외에 따라 드는 부수적 시간은 자칫 즐거운 미국에서의 생활을 주방에 머무는 시간이 길어질 수도 있으니 잘 생각 해 보고 결정하세요. 참, hill hall 같은 경우는 음식을 해 먹을 수 있는 activity room 에 전자렌지, 플리타 등이 구비되어 있기는 하지만 많은 친구들이 팝콘, 냉동피자를 데우는 등의 간식조리에 사용하기 때문에 거하게 음식을 하기에는 편하지 않습니다. 버마에서 온 친구들은 매일 요리를 해 먹긴 했지만, 그친구들은 주부9단이었어요.","수업은 경영대수업 3 과목과 노문과 수업 1과목을 들었습니다. 경영대 필수과목인 재무관리, 회계원리 (2) 그리고 소비자행동론을 들었습니다. 회계의 경우에는 교수님이 중간에 2번이 바뀌긴 했지만, 동양인 특유의 산술적 영리함을 저에게 기대하셔서 조마조마했던 과목이었습니다. 소비자 행동론의경우는 우리학교 경영대수업과 비슷하게 조모임도 하고 그 결과를 pt도 하면서 좋은 기회를 가질 수 있었습니다. 러시아어의 경우는 교수님이 너무 친절하고 좋으셔서 엄마처럼 세세히 챙겨주셨습니다.","국제교육부는 Lawrence기숙사 1층에 위치하고 있는데 , 학기 초에 수강신청관련해서 예약 후 찾아갔던 적이 있습니다.","학교에서 이용할 수 있는 유용한 부대시설 중에는 gym이 있는데, 비록 학교에서 꽤 먼 거리에있어서 거기까지 가기만 해도 하루의 운동을 다 한 것이긴 했지만 package로 가입하게 되면 학교에서 제공하는 요가,댄스 등의 수업도 들을 수있고, 운동기구도 이용할 수있습니다. 그치만 마음이 결연하신 분들만 잘 생각해서 신청하세요. 회원권끊어놓고 이용 안하는 기부천사도 많답니다.","문화적 충격이라기 보단, 개인의 활동을 매우 중시할 것 서구권 문화의 친구들이 오히려 동양인보다도 더 공동생활 하기를 좋아하고, 무엇이든 함께하자고 하는 것을 보고 어디를 가도 모든 사람의 마음은 하나로 통한다는 것을 느꼈습니다. 그런 일련의 과정들을 통해 우리는 더 깊은 사이가 되고, 서로를 이해하며 잠자리에 누웠다가도 깜깜한 방 안에서 여고생들처럼 다시 일어나 밤새도록 이야기하던 기억이 생생합니다.",학교 안의 모든이들은 친절하기 때문에 모두에게 내가 손을 내민다면 도움받을 수 있을 거에요.,"맑고 화창한 날씨, 스스럼 없이 자신의 모든 것을 베푸어 주던 사람들 , 친절한 사람들, 새로움의 설렘 이 모든 길을 걷다보면 더 커지고, 더 깊어지고, 더 앞서 있는 자기를 만날 수 있을 거에요, SCSU에서!"
