gen_info,env_info,food_info,study_info,office_info,facil_info,mhct_info,help_info,etc_info
"University of Minnesota는 미국 중부에 위치해 있으며, 시카고에서 버스로 8시간 거리에 떨어져 있습니다. 저는 봄학기를 다녔고 학기 종료 후 미네소타의 여름을 보내고 왔습니다. 제가 경험했던 미네소타의 추위는 그곳에서도 유래없는 추위였는데, 북극보다 추웠습니다. 그때의 남극보다도 낮은 온도였다고 하네요. 4월 말쯤엔 봄이 왔는데 5월까지도 12-17도 사이를 오갔던 것 같습니다. 여름이 되면 아주 극단적으로 더워지니, 여름을 보낼 것이 아니면 겨울 옷만 챙겨가도 될 것 같습니다.University of Minnesota는 트윈시티즈캠퍼스와 덜루스, 크룩스톤, 모리스, 로체스터 캠퍼스로 이루워진 규모가 큰 대학교입니다.","학교가 위치한 Minneapolis는 서울과 비교하기는 어렵겠지만 꽤 도시입니다. 학교 주변에 campus connetor와(이거 무료여서 너무 좋았어요!) light rail(학교 근처인 Stadium village, east station, west station만 요금이 무료예요. 무료라도 zone pass를 소지해야합니다.)이 다녀서 자가용이 없어도 학교 다니고 놀러다니는데 지장이 크게 없습니다. 그래도 나중에 차를 가진 다른 국제 학생 친구나 미국인 친구를 만나게 되면 미니하하 폭포 등 미네소타 관광지를 보다 편하게 갈 수 있습니다. Stone Arch Bridge라는 곳이 있는데 예쁜 카페와 bar도 많고 봄여름엔 그쪽에서 여러 행사와 축제가 있어서 들러보기 좋습니다. 버스로는 안가보았지만, 캠퍼스에서 자전거를 대여(30분에 2달러인가 해요, 저는 6달러인 Daily pass를 구입해서 다녔어요)해서도 15분에서 20분이면 충분히 갈 수 있답니다.전철로 15분정도 거리에 Downtwon과 Uptown이 있는데 전자엔 주로 클럽이랑 회사, 분위기 좋은 식당들이 있고, 후자엔 보트나 카누를 탈 수 있는 호수와 옷가게 카페 등이 많습니다. 참고로 Uptown은 구글맵을 잘 활용할 수만 있다면, westbank에서 걸어서 30분이면 갈 수 있습니다.","학기 중에는 학교와 연결된 아파트인 University Village에서 생활했는데, 한 플랫을 4명의 학생이 2개의 방과 욕실을 나누어 사용하는 형태였습니다. 물론 1인실이 지원되는 플랫도 있습니다. 일단 다른 아파트에 비해 UV는 거실, 부엌, 방, 욕실 모두 아주 넓직해서 좋았습니다. 냉장고와 세탁기 건조기도 따로 렌트할 필요없이 방에 다 있어서 굉장히 편했습니다. 다만, 저는 SAF 프로그램으로 지원하다보니 개인적으로 계약할 때보다 조금 더 금액을 많이 냈던 것으로 기억합니다. 학교 근처에도 아파트가 많고, 서브리스나 테이크오버 형태로 계약하는 학생들도 많습니다. 페이스북 페이지에 이것과 관련된 정보가 아주 많습니다.식사는 meal plan이 있는데 겨울엔 dining hall가기 번거로울 수 있고, 개인적으로 미국에서 사먹는 음식은 다 비싸다고 생각하기 때문에 캠퍼스 근처 식료품 가게에서 음식을 사서 요리해 먹었습니다. 식료품 가게로는 Fresh Thyme Farmers' market이라고 Prospect park station 근처에 있는 곳이 좋았습니다. 하지만 가격이 가장 저렴하다고는 할 수 없습니다. 차가 있는 친구가 있다면 그 친구가 장보러 갈 때 따라가서 Walmart에 가서 사오는 것이 가장 저렴합니다. 아마존에서도 쌀이나 라면을 살 수 있답니다.dining hall 음식도 친구가 사줘서 먹어봤는데 stir-fried rice나 생선요리 같은 아시아 음식부터 햄버거, 피자, 시리얼, 등이 있는 뷔페였습니다. 하루 이틀 정도는 맛있게 먹을 수 있을 것 같습니다.","저는 복수전공으로 언론홍보영상학을 하고 있었기 때문에 Umn에서는 Communication Studies에서 2과목, Journalism에서 2과목을 들었습니다. 제 의견으로는, 저널리즘 과목이 커뮤니케이션보다 훨씬 어려웠습니다.Communication Studies에서는 커뮤니케이션 전략을 배우는 수업부터 스튜디오 촬영을 배우는 수업까지 다양한 과목이 있어서 좋았습니다. 저는 intro to small group communication과 intro to electronic media production을 들었습니다. small group comm에서는 주로 small group을 구성하여 직접 그룹 프로잭트를 진행하며 평가하는 과정에서 겪는 상황들과 그것과 관련된 이론들을 배웠습니다. 제가 수강했을 떄는 국제학생보다는 in-state 학생들이 훨씬 많아서 처음엔 긴장을 많이 했는데 글쓰기 첨삭이나 발표 준비를 도와달라고 하면 같은 조원들이 흔쾌히 도와줘서 도움을 많이 받았습니다. 조별 평가가 성적의 큰 비중을 차지하니, 정말 열심히 해야하는 수업이었습니다.intro to electronic media production은 12명이 수강해서 함께 프로덕션을 준비하면서 카페에서 놀고, 과제 영상을 끝내고는 post-production party를 하기도 했습니다. 스튜디오 장비 사용법도 익히고 유명한 TV프로그램이나 영화의 한 장면을 재현해볼 수 있어서 유익하고 즐거웠습니다.도서관은 east bank에 Walter library, biomedical library가 유명합니다. 월터 도서관은 인테리어가 아름다운 곳이라 공부하면서 많은 보람을 느낄 수 있습니다. 바이오 메디컬 도서관은 한국학생들이 많이 찾는 곳으로, 근처에 스타벅스, caribou cofee가 있어서 커피 마시며 공부하기 좋아하는 학생들이 많이 찾습니다. 그리고 새벽 3시까지 개방하는 곳이라 시험기간에 좋습니다. west bank에는 Wilson Library가 있는데 이곳에는 한국을 비롯한 아시아 국가의 DVD와 서적이 있어서 한국 옛날 영화 보러가기 좋습니다.","ISSS라는 곳에서 비자문제, 캠퍼스내 아르바이트 등 유학생이 흔히 가질 수 있는 고민들을 상답해주고 지원해줍니다. cultural discussion group이라는 국제학생들의 모임이 있는데, 처음 친구 사귀기에 정말 좋은 기회들을 추천해주기도 합니다.","ballroom dance,수영, 각 종 국제학생 단체 등 여러 동아리가 있습니다. 학기 초에 동아리 소개하는 세션이 있는데 참여해서 둘러보는 것도 좋습니다.!UMN Kreoan Student! 페이스북 그룹이나 Student Unions & Activities-University of Minnesota라는 페이스북 페이지에서 각종 이벤트나 학교생활에 관한 정보들이 업데이트 되니 참고하는 게 매우 매우 좋습니다.","아파서 학교 건강센터에 갔었는데, 얼마나 자주 술을 먹느냐에 관한 간단한 설문을 한적이 있었습니다. 한국에서 술을 많이 마시는 편이 아니었는데 의사선생님이 알콜 의존도가 높지 않냐고 걱정을 해주셔서 놀랐습니다. 학교 근처에 중동음식점이 많아서 신기했습니다. 풍문으로 들어서 짐작을 했지만, 친한 미국인 친구가 정말로 신발을 신고 제 침대에 누워서 당황스러웠습니다. 그리고 카펫트 생활을 할 때 저는 바닥이 너무 더럽게 느껴져서 처음엔 절대 앉지도 않았는데 이곳 생활이 적응된 친구들은 카펫에 앉고 눕고가 너무 자연스러웠습니다.잔디에서 눕고 뒹굴거리는 사람이 매우 많습니다. 나중에는 저도 잔디에 돗자리 없이 앉아서 놀게 되었습니다. 제 미국인 룸메는 매일 피자를 먹었는데, 그것도 정말 충격이었습니다. 다른 친구들도 피넛 버터와 피자를 정말 많이 먹더라구요.","위에서 언급했던 ISSS에서 유학생들이 가진 고민들을 들어주고 도와줍니다. 또한 Coffman에서 학생증, zone pass 등을 만들 수 있습니다.","교통에 관해서 한가지 유의할 점은, 학기별로 100달러 정도인가 돈을 내고 버스와 레일을 무제한으로 이용할 수 있는 카드를 구매할 수 있다는 것입니다. 저는 구매를 하지 않아도 생활하는데 큰 지장이 없었습니다. 의외로 우버를 친구들과 타는 일이 많아서 굳이 구매할 필요가 없었습니다."
"아래분들이 많이들 써주셨기에 자세히는 적지는 않겠습니다. 간단히 정리하면, West Bank 와 East Bank 로 이루어진 캠퍼스는 연세대의 1.5배정도 되고, West Bank에서 East Bank까지 20분정도 걸립니다. 중부에 있기에 대륙성 기후가 강합니다. 겨울에는 춥고, 여름은 경험하지는 않았지만 더운편이라고 합니다. 겨울에 영하 40도까지 떨어진다고 들었는데, 제가 갔을 때는 영하 20도가 최하로 생각보다 춥지 않은 (!) 날씨였습니다. 이상하리만큼 따뜻..했다고 하네요. 그래도 춥기는 추운데, 견디지 못할정도는 아닙니다. 난방시설이 잘 되어있기는 하지만 따뜻한 겨울을 위해 Target이라는 월마트와 비슷한 마트에는 전기담요를  사기를 추천드립니다. 다만 겨울이 긴편으로 4월에도 눈이 오기도 합니다. 4월부터는 많이 따뜻해져서 화창한 날에는 매우 쾌적한 편입니다.","제가 머물렀던 West Bank는 식당이나 다른 시설이 풍부한 편이 아니지만 약간 갈만한 곳이 있기도 합니다. (Republic, Pizza Luce 등) East Bank에는 식당이나 편의점, 레크레이션 센터(Gym) 등이 다양하게 들어와 있어 수업이 없어도 자주 가고는 했습니다. 또 Dinky Town 이라는 곳도 가볼만합니다. 미네아폴리스에는 다양한 미술관이 들어와 있다고 하는데, 그곳도 가볼만하다고 들었습니다.","저는 West Bank의 Middlebrook Hall이라는 곳에 머물렀습니다. Honor 신입생과 글로벌 학생들이 주로 머무는 곳입니다. 3,4층은 international floor으로 다른 층보다 다양한 문화권의 친구들과 다문화에 관심있어하는 미국인들이함께하는 곳입니다. 저는  다른 교환학생들과 함께 이 층에 배정되었었습니다. 조금은 개인주의적인 현지 미국인보다 좀더 적응하기에 쉬운 장점이 있습니다. Middlebrook Hall은 뷔페식의 식단을 제공합니다. 학기말쯤가면 질릴 수도 있지만 디저트까지 제공되는 맛있는 식사를 할 수 있습니다. 밖에서 사먹을 경우가 많이 생기니 11meal을 추천합니다. 현지 친구들 사이에서는 17th hall이 맛있기로 유명한데 저는 Middlebrook Hall이 더 좋았던 것같습니다.저는 아시안 음식을 좋아해서 East Bank에 있는 Chinese restaurant (Little sichuan), Vietnamese restaurant (Bona) , West Bank 의 Lucky Dragon 등을 많이 갔었던 것같습니다. 또 Dinky Town에도 맛있는 음식점들이 많습니다.","저는 중국어 수업    CHN 4042 (001)Advanced Reading in Chinese II     재무관리       FINA 3001(001)Finance Fundamentals     MIS            IDSC 3001 (002)IS Bus Proc, Mgmt인터네셔날 비즈니스  MGMT 4500 (001)Sr Seminar in Int'l Business를 들었습니다. MGMT 4500 수업의 경우에는 2학점이기는 하지만 매니지먼트 과목에서 명강의로 뽑히는 수업이라고 하니 들어보는 것을 추천합니다. 3개의 조모임과 토론식 수업으로 이루어져있어 현지 학생들과 학업적으로 교류할 수 있는 기회가 되고, 또 대부분이 해외경험이 있는 학생들이기 때문에 다양한 국가의 친구들의 다양한 견해를 들어볼 수 있는 기회가 됩니다.저는 또 중국어 수업을 들었는데, 역시 아시아에 관심이 많은 학생들이기에 더욱 친해지기 편리합니다.\","ISSS라는 국제교류처가 있어 학기시작하기전 비자 관련으로 방문하게 됩니다. 그 이후에는 가본 적 없고, 다른 업무는 Onestop이라는 전반적인 행정업무를 담당하는 부서에 등록금 건 등으로 많이 방문하게 됩니다.","미네소타 대학에는 다양한 동아리가 있고, 작은 규모로 이루어진 동아리도 있기에 참여해볼만 합니다. 친구들 중에는 UN동아리에 들어가 모의 유엔 회담을 연다던가, 여러가지 이벤트를 열기도 하고, ASU라는 아시안 아메리칸 동아리에 들어가 영어실력을 늘리는 기회를 삼기도 했습니다. 학교의 가장 최고의 시설은 일명 Rec Center라고 불리는 Gym이 아닐까 싶습니다. 미국에서 순위권 안에 든다는 이 운동센터는 긴 런닝트렉, 올림픽 수영장, 여러가지 신기한 운동기구와 쾌적한 실내구조를 자랑합니다. 친구들과 함께 이 운동센터에 가 쉽게 살이 찌기 쉬운 미국 생활에서 신체를 단련하고 요가 등여러가지 무료 강습에 참여하기도 했습니다. 밸리댄스나 트레이닝 등 여러 재미있는 프로그램이 많으니 참여하시길 바랍니다.","사소한 습관의 차이가 컬쳐쇼크라고 할만 한 것같습니다. 타인을 배려하는 매너가 상당히 눈에 띠고, 또 합리적인 원칙을 만들고 그것을 철저하게 지키는 모습이 인상적이었습니다. 가장 컬쳐쇼크였던 것은, 너무 쿨하게  환불해주는 상점들이 아니었나 싶습니다. 물론 환불이 까다로운 경우도 있지만, 어떤 경우는 이미 사용한 제품이었는데도 전액 환불해주거나 핸드폰 수리 서비스를 받은 후에도  폰이 고쳐지지 않자 핸드폰의 부품비를 환불해주는 몇번의 사례가 조금은 충격으로 다가왔습니다.","CA나, 칼슨스쿨과 ISSS의 버디 등 가까운 지인들을 추천합니다.",교환학생 경험은 한국을 벗어나 세계적 관점의 시야를 갖게 해준 귀중한 기회라고 생각합니다. 단지 학점이수나 영어공부 등이 아니라 넓은 안목과 다양한 의견의 탐색을 경험하고 여러 문화권의 좋은 친구들을 사귈 수 있는 경험을 할 수 있기에 꼭 추천드립니다.
"미네소타 대학교는 미네소타 주에서 가장 큰 대학교입니다. 크기는 미국에서 3번째로 크다고 알려져 있습니다. 학교 가운데는 미시시피 강이 흐르고 넓고 아름다운 캠퍼스는 모든 이들이 가고 싶을 만큼 매력적입니다. 특히 미네소타 대학교의 건물들은 오래된 양식을 자랑하는 건물들과 모더니즘의 영향을 받은듯 한 세련된 건물들이 잘 조화를 이루고 있습니다. 보통 사람들은 수업을 들으러갈때 캠퍼스 커넥터를 타고 다니며, 이 커넥터는 서쪽과 동쪽을 돌아다니며 학생들의 수업을 원하는 시간에 참가 할 수 있도록 돕고 있습니다. 
미네소타의 날씨는 미국에서 춥기로 두번째라면 서러울 정도로 막강한 추위를 자랑하고 있습니다. 겨울에는 -20도까지 내려간다고 하지만 이를 대비해 대학교에는 지하터널이 준비되어 있어서 겨울에는 많은 학생들이 터널을 통해 건물 사이를 이동하고 있습니다. 반면 여름은 조금은 서늘할 정도로 시원하고 가끔은 우리나라의 가을을 연상시킵니다. 미네소타 대학교에 가신다면 미국의 전통적인 캠퍼스를 느끼실 수 있을거라 생각합니다",미네소타대학교는 트윈시티와 가깝습니다. 대부분 대학들이 도심에서 많이 떨어진거와는 대조적으로 미네소타 대학교에서 도심까지는 버스로 10분 거리 입니다. 따라서 이동하는 수단은 대단이 용이하며 라이트레일을 이용하면 원하는 어디든 갈 수 있습니다. 하지만 서쪽캠퍼스에 소말리아유니온이 있기때문에 밤에는 조심하셔야 합니다. 가끔은 총기 사고로 인해서 사람들이 다치는 사고도 발생할 수 있습니다.,기숙사는 여라가지가 존재합니다. 제가 머물던 곳은 미들부륵이라는 기숙사와 센테니얼입니다. 미들부륵은 서쪽에 있고 서쪽수업이 있다면 동선이 유리할 수 있습니다. 하지만 어른 학생들이 많이 살고 있으며 대부분이 장학생이므로 사람들과의 교류는 조금은 덜 한 편입니다. 반면 센테니얼은 동쪽 중심에 위치하므로 어디든 이동이 용이하며 레크레이션센터와도 가까워 언제든 운동을 즐길 수 있습니다. 식사는 다이닝을 이용해야 하는데 미국음식을 좋아하시는 분이라면 즐기실 수 있을 듯 싶습니다.,미네소타의 도서관은 그야말로 꿈에 그리던 멋진 도서관입니다. 그중에서 월터도서관은 좋은 불빛과 높은 천장 그리고 많은 학생들로 미네소타 대학교중에서 가장 매력적인 도서관입니다. 그 이외에 서쪽에 윌슨 도서관 동쪽에 메디컬 도서관 등등 많은 학생들이 시험기간에 도서관을 이용해 공부를 합니다. 수업은 토론형식이 많으며 특히 한국보다 숙제가 많은 것이 특징이라고 할 수 있습니다.,국제교육부는 여러가지 것들은 제공합니다. 영어공부를 하고 싶은 학생에게 파트너를 제공하여 교류를 할 수 있게 해주고 레포트도 수정해 줌으로서 외국말이 서툰 학생들에게 편의를 제공합니다. ISSS 라고 불리는 이곳은 학기가 시작하면 외국학생들을 불러모아 서로를 알게 해주면 여러가지 행사가 학기 중 자주 생깁니다. 그중에서도 커피아워 라는 모임은 여러 학생들의 만남의 장이 되며 여러 외국 친구들을 사귈 수 있는 기회를 제공합니다.,학교에는 여러가지 동아리가 있습니다. 동쪽과 서쪽을 이어주는 다리에 벽화로 자신들의 동아리에 대하여 학생들은 기록을 합니다. 그중에서도 프레터니티와 소로리티가 미국인들이 가장 선호하는 동아리라고 생각합니다. 기회가 된다면 미국의 여러 동아리에 가입하여 그들의 문화를 배우는 것이 좋을 것이라 생각됩니다.,문화적 충격은 많이 없었지만 미네소타 대학교에는 소말리아 사람들이 많았습니다. 이들은 그들의 문화를 가지고 있는데 제게는 도서관을 시끄럽게 만들었던 일이 가장 기억에 남습니다. 특히 미국의 도서관은 한국처럼 조용하지 않아서 공부할때 가끔 불편을 겪기도 하였습니다.,교내 도움을 받을 수 있는 곳은 여러곳이 있습니다. 하지만 저는 그중에서도 같은 기숙사층에 있는 CA 를 추천합니다. CA 는 층마다 있는 방장 같은 것을 말하는 데 이들은 각 층에 있는 사람들에게 친절하게 안내를 해주며 여러가지 정보들도 제공해주고 학생이므로 학생들을 더욱 잘 이해한다고 생각합니다,미네소타 대학교는 춥지만 여러 추억을 쌓을 수 있는 곳입니다. 특히 학생들과 즐기는 파티는 미국생활의 꽃이라고 생각합니다. 아무리 학과 공부에 힘들더라고 미국인이 되어 미국사람들과 맥주한잔 나누며 여러 이야기를 나누고 그들의 문화를 즐기는 것은 중요한 일이라고 생각합니다.
"우선적으로 미네소타 대학이 있는 미네소타 주는 미국 중북부에 있는 곳으로, 캐나다와 접해 있는 곳입니다. 제가 있던 트윈시티 캠퍼스는 꽤 커서, 저희 학교와 같은 campus connector가 있었습니다. 학교는 미시시피 강을 기준으로 East bank와 West bank로 나뉘는데, 제가 살던 곳은 웨스트 뱅크이고, 수업은 모두 이스트 뱅크여서, 매일매일 강을 걸어서 건넜던 기억이 납니다. 또한 트윈시티 캠퍼스는 버스를 타고 근처의 모든 곳을 갈 수 있는 교통이 편리한 곳입니다. 제가 미네소타에 파견된 시기는 9월부터 12월이었는데, 10월부터 눈이 내릴 정도로 엄청나게 추웠습니다. 하지만 캠퍼스 내에는 지하통로와 건물과 건물 사이를 이어주는 다리가 있기 때문에 잘 이용만 하면 추위를 피할 수 있습니다.","미네소타는 옷과 신발에 세금이 안 붙기로 유명한데, Mall of America 라는 큰 대형 몰이 있습니다. 학교 근처에서 light rail을 타고 가면 40분 정도 갔었는데, 쇼핑을 좋아하는 사람은 매 주말마다 갔던 것 같습니다. 제가 갔을 때 풋볼 경기장이 새로 생겼는데, 저는 한번도 안 가봤지만, 홈 경기가 있을 때마다, 학교 학생들이 모두들 그 경기장으로 가서 응원하는 모습을 보고 연고전이 생각이 나기도 했습니다. 또한 다운타운도 버스를 타면 10분 정도 걸려서 갈 수 있게 되는데, 친구들과 가끔 나가서 구경도 하고 재즈바 같은 곳에서 잠시 쉬어 가기도 했습니다.","저는 West bank의 Middlebrook hall의 Single room에서 생활하였는데, 가장 최근에 생긴 기숙사여서 그런지, 교내 타 기숙사에 비해 깨끗했습니다. 식사는 Meal Plan을 들어서 일주일에 14끼를 먹는 것을 신청했는데, 식당이 있는 기숙사마다 특징이 달라서 자기가 먹고 싶은데로 가서 먹으면 괜찮은 것 같습니다. 제가 있던 곳은, 원하는 대로 샐러드나 샌드위치를 만들어주는데, 이것 때문에 다른 데에서도 저희 기숙사로 밥을 먹으러 오는 학생들이 있었습니다. 음식이 가끔 질리면, 근처에 한국 식당이 두~세 개 정도 있으니, 친구들과 함께 나가서 먹는 것도 괜찮은 것 같습니다.","수업은 전공 4개와 교양 수업 하나를 들었습니다.
Heat Transfer : 열전달 수업. 교수님께서 연세가 많으심에도 불구하고, 열정적으로 가르쳐 주셔서 많이 배웠고, 조교도 항상 질문에 대답을 해줘서 배운 게 가장 많았던 수업이였습니다.
Basic Mechanical Measurement Laboratory(W) : W는 writing intensive 수업을 뜻하는 것인데, 매주 기계공학 전공과 관련된 실험을 하여서, 정해진 양식에 레포트를 쓰는 수업이었습니다. 
System Dynamics and Control : 제어 수업. 중국인 교수님이였는데, 열정적으로 강의 해주셔서 좋았습니다.
Bioengineering Freshman Seminar : 미네소타 대학 병원이 유명한데, 6번 정도는 병원이나 실험실과 연구실을 투어를 하였고, 교수님이나 회사 사람을 초청해서 세미나를 들었는데, 좋은 경험이 되었습니다. 가장 기억에 남는 것은, 직접 죽은 돼지의 배를 꼬맸던 것이었습니다.
Modern Dance 3 : 외국인 친구를 가장 쉽게 사귈 수 있었던 수업이었습니다. 일주일에 네 번씩 수업 하는데, 제가 춤도 좋아하고, 기숙사와도 수업 듣는 곳이 가까워서 부담 없이 청강을 할 수 있었던 수업이었습니다.
제가 주로 갔던 곳은 공학 도서관이었던 Walter Library 였는데, 영화에서만 보던 전형적인 미국 도서관의 느낌을 받을 수 있어서, 왠지 모르게 공부가 잘 되었던 곳이었습니다. 이외에도 도서관은 8개 정도 있었던 것 같습니다.",West bank에 위치한 국제교육부는 무엇이든 물어보면 친절하게 다 답변 해 주었습니다.,"Coffman Union이라는 곳은 저희 학교 학관 같은 곳인데, 매주 무료로 영화도 틀어주고, 지상에는 식당, 지하에는 book store, 볼링장이나 오락 시설 등 학교 생활의 중심지가 되었던 곳입니다. 동아리들도 다 이 곳에 있었던 것 같은데, 저는 우연히 한국인 유학생을 만나서 같이 축구 동아리를 하였습니다.","제가 받았던 문화 충격은, 딱히 없었는데, 아무데나 지저분해도 털썩 앉는다는 것입니다.","한인 학생회가 있으니, 그 곳에서 도움을 받을 수 있을 겁니다.",
