gen_info,env_info,food_info,study_info,office_info,facil_info,mhct_info,help_info,etc_info
"루이지애나 주립 대, 다들 LSU라고 부르는 이 학교는 美 남부 루이지애나주의 동남쪽에 있는 주도인 Baton Rouge시에 있다. 주도라고는 하지만 남북전쟁 직전에 기존의 주도이던 New Orleans의 향락문화에 절은 분위기를 쇄신하고자 새로운 주도로서 만들어진 터라 Baton Rouge는 흔히 말하는 college town 같은 면을 더 많이 볼 수 있다. 조용하고 깔끔하며 다소 지루하게 느껴질 정도로 안정된 곳이라고 하겠다.

  기후는 올해(2005년) 불어온 허리케인 카트리나 덕에 허리케인이 출몰하는 지역으로 많이 유명해진(?) New Orleans가 Baton Rouge로부터 차로 한 시간 정도 거리에 있으며, 예상할 수 있는 대로 날씨는 주로 덥고 습한 아열대 기후라고 보면 된다. 내가 갔던 첫 주의 어느 날에는 한 시간 만에 온 세상이 다 젖어있어 깜짝 놀란 적이 있었는데 스콜 때문이었다. 그러나 생각만큼 비가 자주 오는 것은 아니며, 오히려 한국의 장마철이 더 지루하지 않나 싶다. 햇볕이 강하고 또 한국에서 생활과는 달리 야외에 나가는 시간이 자연스레 길어지면서 (적어도 지하철 탈 일은 없지 않은가.) 피부가 금세 탄다 던 지 짧은 옷만 입게 된다 던 지 하는-남부라면 당연히 예상할 만한 그런 날씨이다. 습하고 덥다. 나는 겨울방학 내내(약 5주정도로 겨울방학은 매우 짧다) 동부로 여행을 간 탓에 한 겨울이 얼마나 따뜻한지 실감한 것은 아니지만, 영하로 내려가는 일은 극히 드문 정도이며 눈은 지난 크리스마스 때 20년 만에 처음 왔다고 친구들에게 들었다. 물론 1센티정도 내리고 말았다곤 하지만. 평소 파카 같은 옷은 필요하지 않을 정도지만 아예 안 가져 가는 것은 너무 안이한 생각이라고 본다. 교환학생을 떠날 때엔 그래도 사계절용 옷이 다 필요하다고 알아두는 것이 좋겠다. 역으로, 너무 더운 날씨 탓에 미국인들은 에어컨이 없으면 살 수 없는 사람이 되어버렸는데, 12월 임에도 불구하고 힘차게 나오고있는 도서관 에어컨 바람을 맞으면서 기말고사를 준비하는 것은 정말 어이없었다. 우리가 감기 걸린 아이는 흔히 찬바람 맞은 때문이라고 짐작하듯이, 이들은 어려 서부터 에어컨을 틀지않아 집안의 습기와 곰팡이때문에 잔병치레를 한다고 교육한다고 룸메이트에게 들었다. 아무튼 절대냉각을 추구하는 에어컨과 뜨거운 햇볕 사이를 오가는 것만 잘 적응한다면 이곳의 맑은 날씨와 좋은 공기는 하나의 즐거움이라 하겠다. 아마 서울의 공해 때문이겠지만 루이지애나에선 그야말로 작열하는 태양을 피부로 느낄 수 있을 것이다.

  가기 전에 LSU의 지도를 출력해보고 연대와 비슷한 크기가 아닐까 하는 추측을 하고 떠났었다. 아마도 절대 평지라 할 수 있는 탓이겠지만 체감하는 학교의 크기는 연대보다 조금 작은 편이다. 가로질러 걷는다면 20분 안에 어디든지 걸어갈 수 있다고 보면 된다. 고민 끝에 나는 자전거를 사지 않고 걸어 다녔는데, 교내 기숙사에 사는 경우엔 자전거를 사지 않을 것을 더 권하고 싶다. 이곳은 치안이 썩 좋은 곳이 아니어서 일년에 수 차례 큰 트럭이 새벽 3시쯤 나타나 자전거를 쓸어가는 경우가 종종 있으며, 그 외에도 상습절도의 위험은 언제나 여러분과 함께한다(!). 수업 간의 이동은 10분내에 어디든 가능하다. 아담하고 어디든 녹화되어있는 캠퍼스는 미국 내에서도 알아주는 아름다운 캠퍼스라고 한다. 3~40년 된 커다란 oak tree로(보기엔 100년쯤 되어보인다) 가득찬 캠퍼스는 어디로 카메라렌즈를 향하더라도 예쁜 사진으로 거듭난다. 특히 학교 주변 넓은 호숫가는 정말로 아름답다. 한 시간이면 걸어서도 돌아볼 수 있으니 꼭 다 둘러볼 것을 권하고 싶다. 주변 주택가와 어우러져 이 곳 만의 아름다움을 잊지 못하게 할 것이다.","Baton Rouge시는 대중교통이 미비하며 다운타운도 그다지 발달하지 않은 곳이다. 영화관이나 백화점 이런 것 들이 도저히 걸어 다닐 수 없는 위치에 듬성듬성 있다. Mall of Louisiana, Cortana Mall이 각각 캠퍼스에서 20분쯤 떨어진 시내에 있으며, 많이 이용하는 Mall of Louisiana엔 3개의 백화점이 붙어 있으므로 한번 가면 쉽게 이곳 저곳을 둘러볼 수가 있다. 그러나 역시 생활의 중심은 Wal-Mart에 있다. 장보러 한번 가는 일이 얼마나 “별일” 인지는 직접 겪어봐야만 알 수 있을 정도로 차있는 친구들의 도움은 절대적이다. 학교에서 가까운 Wal-Mart 근처에는 잘 알려진 중식 부페인 Great Wall과 루이지애나에서 빼놓을 수 없는 명물인 Beignet와 까페오레가 유명한 Coffee Call이란 커피숍이 있다. 

  학교 주변을 보자면 우선 Southgate 바깥쪽과 Northgate바깥쪽으로 나누어 생각할 수 있는데, Northgate 바깥 쪽엔 유명한 Chimes St.을 중심으로 식당이 여러 개 있으며 음식은 남부답게 풍성하고 미국 물가에 비해 비싼 편은 아니다. 그래도 팁과 기름진 식사에 익숙하지 않은 이상은 이곳에서의 식생활이 고달플 수 밖에. 학교 주변 식당 수를 다 합하더라도 30개가 안될 것이라고 확신하며(!!) 아주 조용한 시골 같은 생활에 익숙해질 필요가 있을 것이다. 학생들이 애용하는 식당으로는 우선 교문을 지나자 마자 나타나는 Chimes, Serrano's, 공연이 있는 클럽인 Varsity, 좀더 아래쪽에 24시간 영업하는 캐주얼 레스토랑인 Louis와 그 옆의 Subway, 길 건너쪽엔 베트남 음식점이 하나 있는데 별로 권하고 싶지 않다.(이름도 기억이 안 난다)  장담컨대 이 시를 통 털어도 한국 음식점은 없으며(!!...내가 만난 몇 안 되는 유학생들도 정말 열심히 찾아봤다고 들었다.) 한국사람이 운영하는 슈퍼마켓은 Southgate를 지나 Lee Dr.에 하나 있다. 규모는 매우 작고, 많은 물건이 있지는 않지만 그래도 눈물 나게 한국 음식이 그리울 때는 이 동양마켓(oriental market)에서 만난 과자 하나가 반가울 것이다. 
Southgate 바깥 쪽은 주택가가 있고 조금 더 걸어나가면 조그마한 가게들 몇 개가 나란히 있는데 작은 문구점 하나와 샌드위치가게, 새로 생긴 멕시코음식점 등이 있는데 이 곳 역시 그저 작다.

  너무 식당에 치중해서 적은 것 같은데 (한 맺힌 것 같다) 사실 내가 식당간 수를 다 합하더라도 Highland coffee 한 곳을 방문한 수를 못 따라 잡을 것이다. 학교 바깥의 유일 하다시피 한 커피숍이고 주로 학생들이 책 한 두 권을 들고 커피 한 잔을 놓은 채 열심히 책을 읽다 가는 곳으로, 도서관의 광풍에어컨에 질려서, 혹은 혼자 책보기 졸리고 지루해서라도 자주 찾게 되는데 무언가 특유의 아늑함이 있는 가게였다. Highland Rd와 Chimes를 교차하는, 음대 뒤쪽에 있다.

  또 하나, 건축과의 특성상 재료 사러 갈 일이 종종 있는데(..사실 많다) 교내 학관엔 갖추어져 있는 게 많지 않기 때문에 약 20분 정도 걸어서 Co-op까지 갔다.  이곳엔 정말 웬만한 미술용품이 다 있고 서점도 같이 운영하며 학교 기념품도 많이 취급하고있다. 옆엔 Hello sushi, CC coffee 등이 있는데 모두 소소하다.  

  결국 공부하기엔 어쩔 수 없이 참으로 좋은 환경이기만 한 곳이 LSU이지만, 신촌의 복잡함에 질린 사람이라면 반가운 일이 아닐까. 차 없으면 갈만한 곳이라곤 학교 호수나 캠퍼스가 전부지만 그 자체로도 충분히 아름답다.","루이지애나는 물가가 싸기 때문에 기숙사에 살지 않아도 싼값에(1인 당 한 달에 $300-400, 심하게는 $190에 학교 근처 아파트를 임대해 사는 경우도 보았다) 주변에 아파트를 구해 살 수도 있다. 교환학생의 경우에도 기숙사 입사는 의무가 아니다. 대신 학교배정을 받은 직후 coordinator 와 연락할 때에 미리 집을 구해놓았다는 이야기를 해두는 것이 좋을 것이다. 독일에서 온 교환학생 들은 모두 인터넷으로 미리 방을 구하고 왔었다. 룸메이트/집주인 만 잘 구한다면 저렴한 방법이긴 하다. Meal plan 역시 의무가 아니어서 역대 이 곳 교환학생 중에 신청한 사람은 아무도 없는 것으로 알고 있다. 따로 사먹을 수도 있으므로 절대 권하고 싶지 않다. 하지만 기숙사에서 친구들을 사귄 다던지, 차 없는 생활을 하면서 치안이나 불편함을 생각하더라도 기숙사에 사는 것을 권하고 싶다. (특히 건축과처럼 학교에서 늦게 끝나는 일이 허다한 경우라면.) 해가 지면 기본적으로 밖에 걸어 다니는 것은 위험한 일이며 교내라 하더라도 안전하지 못하다. 서울서 평생 자랐고 여의도와 신촌의 밤거리에 익숙해 져있던 나로서는 5분 거리에 있는 교회에 라이드를 해주겠다고 자청하는 친구들을 처음엔 이해할 수 없었지만 시간이 지나면서 이해하게 되었다. 학교 안에서도 해가 진 후 시뻘건 눈을 하고 힘없이 누워있는 거지들을 종종 만날 수 있으며 이들이 힘없이 누워있지 않다면 그 것 또한 더욱 위험할 수 있다. 내가 간 첫 학기에 주차장에서 총기사고가 한 번 있었는데, 피해자는 없었지만 일년에 한 두건씩 강도, 강간사고가 있다고 하니. 나한테 별일이야 있겠어 하는 생각을 가지고 갔던 사람이라도(내가 그랬다) 약 맞은 사람 두 번만 보고 나면 알아서 조심하게 될 것이다. (너무 겁줬나?)

  기숙사는 학교 홈페이지의 Residential Life에서 정확한 자료를 알아볼 수 있지만(가격면에서) 우선 meal plan없는 생활을 고려한다면 임대 아파트 형식인 East campus apartment / West campus apartment를 강력 추천하고 싶다. 옵션에 따라 방의 수는 다른 것으로 알고 있지만 개인 방을 쓰며 공동으로 쓰는 거실, 화장실, 부엌이 있고 새로 지은 터라 시설도 좋다. 나는 두 학기 내내 West Laville에서 살았지만 시설이 좋지 않았다.(곧 리모델링 한다고 들었다) 아마 착한 룸메이트를 만나지 않았더라면 미련 없이 옮겼을 것이다. 이런 면에서 나는 정말 운이 좋았다. 1학기 땐 두 명의 룸메이트 모두 쿨하고 조용한 아이들이었고, 2학기 들어서는 옆방에 살던, 이란 인이지만 영어만 할 줄 아는 아이가 건너와서 많은 도움을 받으며 잘 지냈다. 아침에 눈뜨면 인사할 사람이 많다는 것 자체가 우습게 들릴지 모르지만 외로운 교환학생 생활에서는 큰 위로가 된다. 기숙사는 어디든 비슷하게 주로 1학년들이 살고 있으며 (1학년의 경우 기숙사는 의무적이다) 적어도 층별로 남녀가 구분되어있고 ID로 체크하고 들어가기 때문에 안전상의 문제는 없다. 친구들을 사귀는 데에 있어 Laville은 우선적으로 장학생들에게 배정되고, 기숙사에서 자잘한 행사 거리가 많아서 좋다. 여학생이라면 Evangeline 과 Annie Boyd 정도를 추천하고 싶다. 그러나 이 곳 역시 모두 부엌이 없으므로 개인 냉장고를 사야 하며 그 외의 불편함은 상상에 맡기고 싶다. 룸메이트와의 문제 역시 개인차가 크겠지만 심심한 위로를 전하고 싶은 경우를 많이 보았다. 한방에 두 세 사람 같이 사는 일이 그리 말처럼 쉽지는 않다. 기숙사마다 스터디 룸이 있으므로 12시면 칼같이 닫히는 도서관과 TV보는 룸메이트를 피해 유용하게 이용할 수 있다. ISEP으로서 받는 혜택에 관한 질문을 많이 받았는데 따로 도움을 받는다고 할 수는 없지만 overcharge되는 경우라도 ISEP비 낸 것 이상으론 내지 않는 것이라고 알고 있다. 나 같은 경우엔 West Laville 기숙사비 (한 학기$1670)에 비해 ISEP비(한국에서 미리 내고 가는 일정 비용으로 결국 자신에게 수표로 돌아오게 된다) 가 몇 백 달러 더 많아 남는 부분을 돌려 받았었다. 대학원생의 경우에는 Edward Gay 혹은 Nicholson Apartments에 살 수도 있는데, 방이 두 개 여서 룸메이트와 나눠서 쓸 경우 저렴한 것으로 알고 있으며(월 $200남짓) 실제 내가 알던 유학생들은 여기에 대부분 살고 있었다. ISEP으로서 받는 혜택으론 오리엔테이션 기간에 Interim housing charge를 내지 않는 것이 내가 아는 전부다. 어차피 이곳 물가가 다른 지역에 비해 많이 싼 편이기 때문에 ISEP으로서의 경제적 혜택은 meal plan과 기숙사비를 합쳐서 overcharge될, 물가 비싼 대도시에서 가능하다고 본다.

  Meal plan 을 추천하지 않은 이유는 한 끼 당 $5.75로 계산하는 meal plan을  신청 할 경우 학기 말에 고민하면서 다 써버려야 하는 상황을 자주 보았고, 정말 귀찮은 날은 동일한 뷔페 식당을 $7~8(저녁이 더 비싸다)에 이용할 수도 있기 때문이다. 학관에는 Tiger Lair, Pizza Hut, Subway, McDonald, Salad bar등이 있고 이곳을 이용하는 것이 더 저렴하다. 한국 입 맛에 길들여진 나로서는 식생활이 정말 고달팠다고 솔직하게 이야기 하고 싶다.","교환학생을 떠나기 이전부터 나는 조경 학에 관심이 많았다. 수업이 시작되기 전 주에 무작정 조경학과 사무실을 찾아가 프로그램을 물어보고 2학년 프로그램에 그대로 따라가기로 결정했기 때문에 건축과 수업은 하나도 듣지 않았었다. (3학년 이하 수업은 포트폴리오를 보여주지 않아도 수업을 들을 수 있다.) 4년 제인 공대 건축과와는 달리 5년 제인 design school이라는 것 자체부터 다르고, 건축과 조경의 관계에 대해서도 다시 생각해 보는 계기가 되었다. 
  교양 과목에 있어서 LSU는 주립 대라 학교의 규모는 크지만 작은 과들이 여러 개가 있는 편이므로 수강편람을 꼼꼼히 살펴본다면 본인이 흥미 있어 하는 교양 과목들을 찾을 수 있을 것이다. 학기 초에 3학년인 친구들더러 많이 물어본다면 쉽고 알찬 과목을 여러 개 추천 받을 수 있다. 특히 southern hospitality로 유명한 남부 지방답게 낯선 이의 부탁을 친절하게 도와주는 이 곳 아이들에게서 느끼는 것도, 받는 것도 참 많았다. 대부분의 과목은 객관식으로 OMR카드(여기선 Scranton이라고 한다)를 이용해 시험 보는 경우가 많기 때문에 이런 과목은 상대적으로 쉽게 공부 할 수 있다. 내가 듣던 과목들은 paper work이 거의 없었다.

1학기> Landscape architecture> 

LA1181,1182 Landscape architecture Graphics- Freehand + Mechanical

기초 드로잉 수업이다. 교수인 Van Cox는 할아버지 교수님이지만 우리 모두가 Van이라고 부르며 친하게 지냈다. 첫 날은 줄긋기부터 마지막엔 18’*24’ 드로잉까지 스케치와 기본적인 표현기법에 관해서 자세히 배울 수 있는 수업이다. 미술학원 다니는 기분이고, 스튜디오 수업답게 많은 친구들을 사귀는데 도움이 되었다. 숙제는 매일 나온다고 보아야 한다.


LA2112 Ecology in Landscape architecture

환경 학으로, 조경학과 2학년 필수 과목이어서 신청하게 되었다. 수업은 주로 할아버지 교수님 Fryling. C의 강의와 수업자료 핸드아웃, 그리고 30여 가지의 식물에 관해 그야말로 두리뭉실하게 배우는 것이었다. 필수인 field trip 2회는 총 6번의 기회가 있는데 마음에 들고 시간대 맞는 것을 가면 된다. 마지막에 조경 식재의 라틴어 학명 적는 문제에서 완전히 무너져(라틴어 스펠링 외우는 건 암기에 약한 나로선 너무 어려웠다.) 학점도 그다지 좋지 않았지만, 어지간한 교양 과목만 못했다는 생각이 든다. 환경 학에 대한 아주 기초적인 개념을 다룬다.


LA2141 Landscape architecture of Ancient World 

조경학과의 역사과목 첫번째 수업, 필수 과목이다. 슬라이드로 이루어진 지루한 강의였고 따로 나오는 교과서나 정리된 핸드아웃이 없어 정말 애를 먹었던 과목이다. 특히 중국, 일본의 정원이나 남미문화를 다룰 때는 영어가 아닌 것을 다루는 지라 친구들에게서 빌리는 노트마다 철자가 죄다 달라서 결국 4권의 노트와 3권의 참고서적을 앞에 두고 밤새서 공부해야 했다. 보람도 없이 그저 적당한 학점이 나왔다고 낙담했는데, 나중에 보니 B맞은 아이들도 드물어서 어이 없었다. 그래도 고생한 만큼 공부한 것이 많이 남는다. 서양건축사와 겹치는 부분이 상당히 있다.


1학기> 교양과목>

MGT3200 Principle of Management

경영학 개론 수업으로, 재치 있는 Sauley K. 교수의 수업 스타일 덕분에 인기 있던(Gym Auditorium 900명 강의실이 꽉 찬다) 강의라고 생각된다. 3차에 걸친 50문제의 시험이 있으며 시험 직전엔 Review를 해주기 때문에 공부에 어려움은 전혀 없었다. 특히 기말고사는 6일간 매일 시험이 있어서 아무 때나 골라서 볼 수 있고, 보너스 문제도 있다. 교재로 쓰는 복사책과 수업시간에 보는 슬라이드를 잘 따라가기만 하더라도 따로 공부할 필요가 없을 정도다. 마치 학원가 인기강사만큼 명쾌한 수업방식이 누구에게나 만족스러울 것이라고 생각된다. 


ART1441 History of Survey of Arts

서양미술사 수업이다. 특히 이탈리아 회화에 조예가 깊은 뉴욕 출신 Zucker. M교수는 나이 많은 할아버지 교수님이시다. 말을 우물우물 거리는 편이어서 수업 시작 후 한 몇 시간은 두통에 시달릴 정도였다. 고민 끝에 교수님께 찾아가서 수업 시간에 듣는 게 어렵다고 말씀 드렸더니 몇 년 전에 당신의 제자 중에 열심히 공부한 한국인이 있었다고 반가워 하셨다. 교재가 따로 있지 않아 어려울 테니 장애인들 노트필기를 도와주는 volunteer학생을 소개해 주시면서(이 제도는 웬만한 대형 강의에는 다 있다) 메일로 노트를 받아서 공부하도록 해주셨다. 역시 과제는 없고 시험은 50문제 객관식이며, 교재는 따로 없지만 핸드아웃에 있는 소수의 작품만을 다루므로 어렵지 않다. 대강당 수업이라 거대한 슬라이드를 보며 수업하는 덕에 정말 미술에 관해 자세히 관찰하는 시간이었고, 학기가 끝난 후 미술품을 관찰하는 새로운 안목을 느낄 수 있다. 


2학기>  Landscape Architecture>

LA1151 Introduction to Landscape Architecture
조경 학에 관한 개론이다. 교수는 사람 좋기로 소문난 Max Conrad였는데 조경 학과에서 가장 인기 있는 교수님이다. 거의 매 시간 다른 연사를 초빙해 이야기를 듣는데 조경 학에 대한 전반적인 설명이기 때문에 필기를 해야 할 필요가 있고, 이 과목 역시 note taker의 도움을 받았었다. 참고자료 읽고 푸는 과제와 프로젝트 과제가 있긴 한데 이게 오히려 학점을 거저 받는 요소이다. 읽을 거리를 미리 인터넷 게시판에 올려놓는데 다 합하면 책 한 권 분량이므로 내용은 꽤나 도움이 되었다. 시험은 수업 시간에 잠만 자지 않아도 풀 수 있을 정도로 나오지만 너무 무시하면 의외로 까다롭고, 80문제 객관식 시험이므로 빨리 시험 볼 수 있어야 한다. 그래도 결론적으로는 거의 A를 무차별 살포하는 과목이라고 해도 과언이 아니다.


LA2152 Landscape Design Theory

본격적인 스튜디오 수업이다. 젊고 섬세한 프랑스유학파 Kevin Risk교수의 수업이었다. 크게 3개의 프로젝트를 다루었는데 처음엔 기존에 있는 조경학적 대작들을 고찰하는 단계로 작업하고, 그 요소들을 urban plaza에 넣어 자신의 프로젝트를 만드는 것으로 중간 마감을 했다. 다음엔 학교 내부의 Indian mound와 호숫가 주변을 관찰한 후 자신의 프로젝트로 만들어 보았고, 기말 마감 작품은 학교에 있는 Exxon Quadrangle을 설계하는 프로젝트였다. 연계한 history 과목과 더불어 정말 많은 것을 배울 수 있는 수업이었다. 마지막 프로젝트는 조경과 모든 교수님이 참관하는 가운데 프리젠테이션을 하는데, 1인 당 15분씩 8인 1조로 진행되었다. 처음 겪어보는 진행 방식, 정장하고 영어 프리젠테이션이라는 압박감이 강하기도 했지만 그만큼 성취감도 크고 친구들과의 유대는 남다르게 강해질 수 있는 수업이었다.


LA2142 Landscape of Western Civilization

LA2141의 연장으로 서양 조경사2 라고 보면 된다. 2학기에 제일 힘들었던 두 수업 모두 Kevin이 가르치던 과목이었다. 특히 이 과목은 월, 수요일은 슬라이드로 강의식 수업을 하고 금요일은 일정 분량의 책을 읽어온 후 메일로 전달된 주제에 관해 대학원생 그룹리더를 두고(학부 생과 대학원 생의 수업을 합쳐버렸다.) 토론수업을 하는 식으로 진행되었는데, 보통 100쪽 정도의 분량을 읽고(글씨 크기는 내가 태어나 읽은 텍스트 중 가장 작고 4단 편집되어 있었다.) 준비해야 했다. 13세기 이후 조경사를 다루는 만큼, 양이 무척 많아 프린트가 최대 사이즈의 바인더 2개를 가득 메울 정도 였다. 하지만 이 때 본 많은 아름다운 슬라이드와 critical review등 읽을 거리를 통해 알찬 수업이 되었고, 남는 것도 많았다고 생각된다.


2학기> 교양과목>

MUS2000 History of Jazz

New Orleans를 언젠가는 가봐야지 생각 했던 게 내가 중학교 1학년 때부터 였으니, 이 과목의 존재를 알고도 그냥 넘어갈 수는 없었다. (이런 과목이 있을 줄 알고 수강편람을 눈 빠지게 뒤졌다.) 재즈의 본고장인 이곳에서 듣는 재즈 수업은 예상대로 만족스러웠다. 처음엔 2000레벨이어서 걱정스럽지만 비전공자들을 위해 배려해주며, 수업시간에 보이는 self-indulgent한 모습보다(본인의 표현이다) 개인적으로 이야기 나눌 때는 다정다감한 Grimes교수도 점점 좋아질 것이다. 교재는 없으나 semester book에 올라와있는 자료를 출력해 텍스트로 사용하며, 수업 시간은 주로 듣고 느끼도록 유도하는 방식이다. 이 수업은 영어가 되고 안 되고를 떠나서 녹음을 하면서 다시 들으면 좋은 것 같다. 시험 때도 물론 유용하지만 유명하지 않은 다양한 음악을 들어보는 기회가 될 수 있기 때문이다. 이 곳에서만 들을 수 있는 교양 과목이라 추천하고싶다.


ISDS1100 Introduction to Management Information Systems

누가 보아도 쉬울 수 밖에 없는 컴퓨터 과목이다. MS Office에 관해 배우며 Sam이라는 교육용 소프트 웨어를 통해 정해진 기간에 숙제하고, 2주에 한번 정해진 시간에 시험만 보면 된다. 시험 날 외에는 수업에 갈 필요도 없다. 이 과목이야말로 A폭격기라고 할 수 있겠다. 분반이 19개에 달할 정도로 인기 많은 과목이다.


  도서관은 첫째로 매서운 에어컨 바람이 떠오르지만, 디자인 대학에 따로 있는 도서관의 아늑함도 빼놓을 수 없다. 책의 대여 기간은 매우 길지만 연체료가 있음을 잊지 말도록 하자. 대출 권 수엔 제한이 없는 것으로 알고 있다. 도서관 개방 시간은 시험 기간을 제외하고는 오전 7시부터 밤 12시, 금요일과 주말은 그것보다 많이 짧아 불편할 수도 있지만 기숙사에 있는 스터디 룸을 이용한다면 공부하는데 불편함은 없을 것이다.","국제교육부의 Jane Chandler라는 분이 교환학생 담당이다. 친절한 것 같지만 자기 중심적이고 좀 게으른 면이 있어서 큰 기대는 하지 말도록 하길 바란다. 급한 일이 있다면 그만큼 자주 가서 부탁해야 한다. 그러나 종종 e-mail로 ICC(International Culture Center)라는 곳에서 행사가 열릴때마다 연락해주며, 매주 저녁 영화보는 모임도 있다. 무엇보다도 학기 초의 오리엔테이션이 워낙 꼼꼼히 준비되어 있어 자주 찾을 일은 없을 것이다.","기본적으로 sorority/fraternity는 백인들의 유대관계의 기본 집단으로 알려져 있고 사실인 것 같다. 그러나 보통 저학년 때만 활동하는 경우가 많으므로 동아리 활동 같은 것은 한국에 비해 매우 부족하다. 

  교내 시설로는 운동하러 가는 곳인 Rec Center가 기숙사들 뒤쪽에 있는데 시설이 좋은 편이다. (곧 크게 확장 한다.) 이 곳엔 $70을 내고 각종 요가/필라테스/댄스/사이클 등의 수업을 들을 수 있는 클래스가 있는데 20회 이용 시 $35, 1회 $5 등 옵션이 다양하므로 관심 있다면 꼭 알아보길 바란다. Leisure Class라고 열리는 것도 있지만 운동하는 것으론 Rec Center가 훨씬 저렴하다. 

   Go Tigers!! 우리의 연세 독수리같은 존재가 바로 Mike, the Tiger. 가을학기에는 홈 경기가 있는 Football대회 날은 어김없이 Rec Center문을 닫아 교내에 남아있는 학생으로선 안타깝기 그지없었다. 그래도 우리의 연고전에 버금가는 이 지역 축제일인 Football 경기는 꼭 가보라고 권하겠다. 온 동네 사람들이 바비큐그릴을 들고 교내로 들어와 벤치를 놓고 여유롭게 티비로 관전하는 풍경을 보면 미국에서의 football이 우리나라 축구 열풍보다 더하다는 것을 실감할 것이다.

  이곳에는 START라고 하는 컴퓨터 교육 기관이 있다. 배우고 싶은 소프트웨어가 있다면 알아보고 수업을 받으러 가는 것도 좋겠다. 당연히 무료이며 원하는 시간에 개인 레슨도 가능한 것으로 알고있다. 나는 학기 다 끝나 갈 무렵 플래시 기초수업을 들었었는데 진작에 알았더라면 좋았겠다는 생각이 들었다.","우리도 많이 미국화 된 나라라는 것을 지레 짐작으로 알면서도 미국에 직접 가서야 새삼스레 느낄 기회가 많았다. 미국적인 게 이런 거구나 따로 느낄 일이 별로 없을 정도로 우리는 이미 미국 문화에 대해 많이 알고 있다. 오히려 우리 문화를 그들에게 설명할 때가 참 어려웠던 기억이 난다. Southern hospitality로 유명한 이 지역이기에 사람들은 대부분 느긋하고 친절하며 시간 아까운 줄 모른다는 느낌을 받을 정도였다. 남부라면 흔히 예상할 수 있는 인종 차별보다는 -요즘 많이 회자되듯이- 인종 분리랄까 그런 것을 많이 느꼈다. 과 친구들이나 교회 친구들 모두 백인이었기에 (심지어 이곳은 동아시아 사람들도 무척 적은 편이다. 인도인은 많지만 결국 그들 만의 세계에 산다.) 내 시각이 편향되었을지도 모르지만, 결국 섞일 수 없는 무언가가 있어 보인다. 흑인과 백인이 절반 씩 이고 아시아인은 겨우 2%수준이라지만 이곳은 bi-racial이 거의 없을 정도니까. 아시아 사람이 드문 지역이어서 본인의 노력이 조금만 더해진다면 친구들 사귀는 데는 오히려 쉽지 않을까 싶다. 나를 유심히 관찰해 주니까. 처음에 한국에서 혼자 왔다고 했을 때 아이들이 멀리 용감하게도 오는구나 진심으로 부러워하는 걸 보고 깜짝 놀랐다. 설계 수업 덕에 밤새서 작업하며 친구들과 속 깊은 대화 할 기회가 많았는데 이곳 아이들의 순수함이 가장 우리와 다른 점이라고 할까. 이것저것 재고 계산할 줄을 잘 모르는 사람들 덕에 괜히 부끄러웠다. 그 외엔 대체로 비슷하겠지만 재채기소리가 무지 작다든지 하는 사소한 문화적 차이가 기억 난다. 이런 것들은 friends등의 시트콤을 열심히 보면 금방 이해하게 될 것이다. 별것 아니라고 생각하는 부분이지만 에티켓이 의외로 철저하다는 점을 잊지 말자. 미국은 생각보다 경박한 나라가 아니었다.","잊을 수 없는 친구 중에 교환학생을 지난학기에 다녀와서 mentor로 자원한 아이가 있었다. 이 친구를 따라 갔던 Methodist Church와 같은 재단의 대학생들 모임인 Wesley Foundation의 수요일 저녁 모임에 가면서 많은 친구들을 만날 수 있었다. 좀 피상적인 모임의 형태이긴 하지만 많은 사람들을 알고 지내는 것 자체가 경험이고 공부라고 생각해서 억지로라도 챙겨 나갔다. 그러나 내겐 과분할 정도로 좋은 친구들과 목사님 Shawn Anglim을 만났고, 내 생활의 또 다른 축이 되어 주었다. 사실 불교 집안에서 쭉 자라온 나였지만 기독교문화를 이해하고(난 내 생각보다도 더 무지했다.) 미국문화를 이해하는데 큰 도움이 되었다.
짧은 기간만 지내는 교환학생 생활이니 한국 사람들과 연락 할 필요가 없다고 생각해서 한국 학생회엔 나가지 않았지만 사실 이곳의 학생회는 유학생들의 향락 문화 같은 것과는 거리가 매우매우매우 멀다. 1년에 두 번 체육회를 통해서 서로 얼굴이나 한번 보는 게 전부고 유학생들끼리의 교류도 활발치 않다고 들었다. (면학 분위기는 가히 최고.) 그러나 어려울 때 연락하면 분명 여러모로 도움을 주실 것이다. LSU 한인 학생회 홈페이지가 있으니 필요 시 도움을 청하면 좋겠다. 나는 핸드폰을 구입할 때 유학생이 쓰지 않겠다고 하는 것을 받아다 요긴하게 사용했다. (미국에서는 유학생의 신분보증이 까다로워 핸드폰 사는데 거주인의 도움이 필요하다)  또 한국 사람들을 만날 수 있는 통로로서 두 개의 한인 교회가 있는데 어디나 그렇듯 교포 사회의 중심에는 교회가 있다. Baton Rouge엔 중앙교회와 침례교회 두 군데가 캠퍼스 근처에 있다. 두 교회가 은근히 경쟁관계인 것으로 알고 있었는데 이번 카트리나 사태에 협력하여 동포애를 보여주는 모습을 멀리서 보면서 감동 받았다(뉴스에 줄곧 나오는 재해대책본부가 그곳이다). 정말 좋은 사람들이다.","LSU에서의 1년은 내가 노력한 것 이상으로 많은 것을 얻을 수 있었던 시간이었다. 나의 내성적인 성격에도 불구하고 천성적으로 착한 이 곳 사람들에 의해 마음의 문을 열고, 한국말 들을 일 없는 나날이 계속되었어도 외로운 줄 모르면서 잘 지낸 것 같다. 조경학과 수업도 더 이상 말이 필요 없을 정도로 학문적으로도 인간적으로도 너무나 완벽했던 좋은 기억이다 (조경학과 교수님들도, 친구들도 평생 잊을 수 없는 사람들이다.). 존댓말 없는 세상이라 그 만큼을 사랑으로 바꾸어 공평하게 나눠가진 기분이랄까. 

  건축 공부를 하고 있어도 점점 알 수가 없고 무료해지던 학교 생활에 변화를 주고 싶어 떠난 미국 행이었다. 지금까지 내가 만든 편견 속에 얼마나 갇혀 있었던 가를, 모든 게 새로웠던 (그리고 나도 그들에게 새로운 사람일) 그 곳에서야 알게 되었고, 당연하게 받아오던 것들이 원래 내 것이 아니었다는 것을 깨달았다. 처음 하는 객지 생활이어서 어려움도 많았고, 짧은 영어 때문에 오해 사는 게 싫어 농담 한 마디를 못하고 지내는 답답함이 차곡차곡 쌓여 점점 힘들기도 했지만, 그래도 내 인생에서 가장 알찬 한 해였다. 

  겨울방학과 학기 끝난 후를 이용해 미국 전역을 꼼꼼히 둘러본 여행도 잊을 수 없는 추억이다. (혼자 하는 긴 겨울 여행은 사실 많이 힘들다-경고하고 싶다.) 가까운 New Orleans (Mardi Gras축제에 관해서는 꼭 미리 알아두기 바란다.)부터, New York, Boston, Washington D.C., Philadelphia, Washington D.C, Chicago, Orlando, San Francisco & Berkeley, Los Angeles, San Diego, Tijuana (Mexico) 를 배낭여행으로 둘러보았고, 하나하나 다 기억에 남는다. 시간과 경제적 여유가 된다면 방학과 학기 후를 이용해 꼭 여행할 것을 권하겠다. 교환학생의 신분은 여행객보다 안정적이므로 여행하는데도 여러모로 수월한 시기이기 때문이다.

  마지막으로 이런 기회를 가지게 해주신 학교 측과, 가족들-특히 이 프로그램을 강력히 추천해준 언니에게 고맙다고 말하고 싶다."
