gen_info,env_info,food_info,study_info,office_info,facil_info,mhct_info,help_info,etc_info
"Hendrix college는 미국 남부에 위치해있습니다. 따라서 날씨가 대체적으로 따듯할 것이라고 예상했지만, 생각보다 춥고 쌀쌀하였습니다. 저는 2학기에 갔기 때문에 날씨가 전반적으로 추웠겠지만 4월 5월 날씨는 춥고 덥기를 반복했습니다. 이른 오전까지는 굉장히 따뜻하고 덥다가 오후가 되갈수록 쌀쌀해졌습니다. 그리고 비가 많이 오고 또 자주 옵니다. 우산이나 우비 또는 장화를 꼭 챙기셨으면 좋겠습니다.","대학교 주변에는 간단한 스시, 샌드위치 등 간단한 레스토랑과 빵집, 카페가 있습니다. 그리고 좀 걸어나가면 아담한 규모의(?) 다운타운도 있습니다. 다운타운에는 펍, 옷가게, 식당, 작은 공원 같은 곳 등이 있습니다. 하지만 근처에 버스나 지하철이 없기 때문에 더 큰 다운타운이 있는 LITTLE ROCK에 가려면 우버나 차를 타야 합니다. 차로 30분 정도 걸리는데 극장, 아이스크림가게, 몰, 그리고 공항 등이 있습니다. 학교에서 걸어서 한 15분 정도 가면 WALMART라는 큰 마트가 있어서 간식이나 음식 등을 사놓고 싶을 때 또는 필요한 물품이 있을때는 대부분 다 이곳에서 삽니다. 저는 큰 불만 없이 만족하면서 1년동안 잘 다녔습니다. 마트, 식당들은 걸어서 갈 거리에 다 있고 은행, 극장, 더 큰 레스토랑 등은 친구들이랑 같이 차 타고 가면 되어서 큰 불편함은 없었습니다.","아파트와 기숙사로 나누어 지는데 보통 갤러웨이, 레이니,그리고 비지(기숙사 이름) 중 한 곳을 배정 될 것입니다. 더 좋은 기숙사들은 보통 고학년이나 쭉 다니는 학생들에게 돌아가기 때문에 교환학생들은 보통 제일 기본적인 기숙사로 배정됩니다. 저는 레이니에 살았는데 바퀴벌레가 많습니다.. 오래 된 건물이라 바퀴벌레를 생각보다 자주 보게 될 수도 있습니다. 그리고 가자마자 당황스러웠던 게 침대가 높이 달렸습니다. 이러다 천장이랑 뽀뽀하겠다 싶을 정도로 높게 달렸고 침대 아래 책상 의자 옷 놓는 서랍장이 다 있습니다. 나중에 침대는 친구들 도움 받아서 내리는데 저는 너무 많이 내릴 수도 없는 구조라 매일 어드벤쳐 찍는 기분으로 잤습니다...되도록 레이니는 안 오셨으면 합니다. 세 곳 중 제일 안 좋습니다. 친구들 방 가보니까 비지나 갤러웨이 방 중에는 더 넒고 침대도 낮아서 침대 옆에 책상이 있고 이런 방들이 많았는데 왜 유독 제 방만 그랬는지... 오게 된다면 레이니 316호는 안 쓰게 되길 바랍니다. 그래도 기숙사도 크게 불편한 점은 없습니다. 기숙사 별로 세탁기 공통 샤워실 공동 화장실이 다 딸려 있습니다. 샤워실과 화장실은 각 층마다 두개씩 있어서 생각보다 사용하는데에 불편함이 없습니다. 세탁기랑 건조기는 1층에 있습니다. 1층에서 티비도 볼 수 있고 앉아있을 쇼파도 있습니다. 부엌도 기숙사 마다 아마 하나씩 있을 것 입니다. 부엌에 공동 냉장고가 있는데 이름 붙여놔야하고 일정 기간 되면 냉장도 청소하면서 다 버리기 때문에 기숙사 일정 잘 확인하시는 곳이 좋습니다. 저는 룸메 냉장고 빌려 썼습니다. 가기 전에 룸메가 누군지와 룸메 이메일을 학교에서 알려줍니다. 가기전에 연락하면 서로 뭐 챙겨갈지도 말고 말도 해보고 할 수 있어서 좋습니다. 꼭 연락하세요!","2학기가 시작되기 전 일정 기간동안 학교 수강신청 홈페이지가 열려있고 수강신청을 받습니다. 보통 3개정도 하는데 정말 더 듣고싶다고 하면 4개 정도 듣는 것을 추천합니다. Hendrix college는 거기 학생들도 다 말할 정도로 과제도 많고 수업이 만만치 않아서 사실 영어가 모국어가 아닌 저희에게는 3개도 힘들 것이라고 생각합니다. 그리고 학교 자체에 행사도 많고 애들끼리 많이 놀러다녀서 수업 4개를 듣게 되면 그 사이를 조율하는게 굉장히 굉장히 힘이 듭니다. 제가 4개 들었다가 매일 매일 밤을 새고 다크써클이 어깨까지 내려왔습니다….3개만 들어도 충분히 힘듭니다. 하지만 Hendrix college 수업 대부분이 다 질이 높고 교수님들도 친절하시기 때문에 4개를 들어도 나쁠 건 없습니다. 학생과 교수진 비율이 1:2로 교수님들과 면담을 하고 싶으면 연락을 하여 언제든 할 수 있습니다. 또한 엄청 친절하게 다 대답해주시고 도와주시기 때문에 과제할때나 또는 그냥 공부하면서 힘든 것이 있으면 찾아가시면 도움이 많이 됩니다. 그리고 1년을 있을 예정이라면 처음 수강신청을 할 때 1년치 시간표를 다 짜놓는 것이 좋습니다. 오리엔테이션 기간에 그룹을 나누고 그 그룹별로 담당 교수님이 정해지는데 그 교수님이 최종적으로 시간표를 확인하고 그 다음학기 수강신청까지 해주십니다. Hendrix는 워낙 오리엔테이션을 잘 해주고 자세하게 해주기 때문에 사실 그곳에 가서 들어도 충분합니다. 도서관은 연대도서관만큼 크지는 않지만 있을 것은 다 있습니다. 컴퓨터와 프린터를 쓸 있고 24시간 공부를 할 수 있는 열람실이 있습니다. 프린트비는 따로 없고 칼라 프린트는 돈을 내야 합니다. 책을 빌리고 공부할 수 있는 공간은 보통 11시에 닫습니다. 열람실은 이야기 할 수 있어서 시끄러운 때도 많습니다. 조용히 공부하고 싶다면 다른 곳이나 도서관 내부에 책 빌리고 공부할 수 있는 곳을 이용하는 것이 좋습니다. 또한 도서관에는 writing center 가 있습니다. 과제가 글을 써가며 첨삭해주고 writing 도움을 받을 수 있는 곳입니다. writing center 담당 교수님을 통해 이메일로 약속을 잡을 수도 있고 직접 가서 잡을 수도 있습니다. 월부터 금과 주말은 시간이 다르니 문 앞에 붙어있는 시간표를 확인하시는 것이 좋습니다. 담당 교수님께 지도를 받고 싶으면 보통 이메일을 통해 약속을 잡으면 됩니다. 직접 찾아가서 잡아도 상관 없습니다. writing center는 무료이고 사용 제한도 없으니 최대한 많이 가서 도움을 얻을 수 있는 만큼 얻었으면 좋겠습니다. 아, 그리고 제가 요가 수업 7시에 시작하는 것을 했었는데 본인이 아침에 일찍 일어날 수 없는 상황이라면 최대한 아침 수업은 피하시는 것이 좋습니다. 제가 자신감이 넘쳐서 아침 수업했다가 체육은 저녁으로 미루거나 다른 것들은 교수님과 상담하고 아주 힘들었습니다. 그리고 hendrix college 는 과제와 출석을 중요시하기 때문에 최대한 출석을 챙기는 게 좋습니다. 또한 절대평가이기 때문에 정말 본인이 들이는 노력과 시간에 따라 a도 받을 수 있고 b도 받을 수 있습니다. 가기 전에 writing을 집중적으로 공부해가면 과제를 하는데 도움이 많이 될 것 같습니다.",오리엔테이션 때 인솔하고 담당해주시는 분들이 교환학생에 관련 된 일들을 하시는 분들입니다. 교환학생들한테 공지메일도 그 분들이 다 돌리고 관련 된 행정 처리도 그 분들이 하십니다. 무슨 일이 있거나 문제가 생기면 그분들한테 가서 상담하면 됩니다. 엄청 엄청 친절하십니다.,"크고 작은 동아리들이 엄청 많고, 동아리 외에도 파티나 행사들이 많습니다. 저는 학생회를 했는데 주로 행사가 있으면 무대 설치하고 입장 도와주는 일을 하였습니다. 하지만 그 외에도 일본어나 프랑스어 동아리, 배드민턴 등 다양하고 꼭 하나만 들지 않아도 됩니다. 또한 강제성이 있는 것도 있고 없는 것도 있습니다. 학기 초반에 동아리 박람회 같은 것을 해서 무슨 동아리들이 있는 지 둘러보고 정보를 얻고 가입하는 기간이 있습니다. 저는 그때 가서 거의 모든 동아리에 이메일 주소 남기고 정보를 왕창 받았었습니다. 그 중에 배드민턴 동아리를 엄청 열심히 나갔었는데 운동도 되고 친구도 사귀고 좋았습니다. 체육관 또한 자유롭게 이용할 수 있습니다. 수영장, 배드민턴, 헬스, 런님 등 다양한 운동을 할 수 있고 요가 수업도 여기서 합니다. 본인 아이디 카드 찍고 갈 수 있고 샌들이나 슬리퍼는 신고 가면 안 됩니다. 운동하고 바로 샤워할 수 있는 곳도 있습니다. 저도 2학기 들어서 많이 이용했고 정말 많은 학생들이 이용합니다. 정말 정말 좋습니다. 그리고 수영장은 아예 아 일찍 하는 것이 좋습니다. 뒤로 갈수록 단체로 아이들이 와서 쓴다거나 수영팀들이 쓰는 경우가 많기 때문에 여유롭게 수영을 하고 싶다면 아침 6시에 가는 것이 제일 좋습니다.","저는 크게 느낀 문화충격은 없었습니다. 몰랐던 면이 있다고 해도 ‘충격’으로 다가오지는 않았기 때문에 어떤 이유로 크게 이질감을 느낀다거나 이런 순간들은 없었습니다. 미국아이들이 확실히 공동체보다는 개인에 중점을 두는 문화에 컸기 때문에 이기적이게 보일 수 있는 말들과 행동이 있었지만 나중에 보면 또 다른 면이 보이기도 했습니다. 또한 미국친구들은 말이 엄청 많습니다. 상대방을 제대로 듣기 보다는 자기 말은 엄청 열심히 하는 모습을 많이 봤는데, 덕분에 Listening 실력이 느는 것 같아 좋았습니다. 하하. 자기 의견을 강하고 확실하게 표현하는 대신에 상대방의 상황을 알아서 고려하는 친구들이 드물게 때문에 무슨 일을 하거나 말을 할 때 자기 표현을 확실하게 하는 것이 좋다고 생각합니다.","Hendrix college 안에 모든 곳이 도움을 받을 수 있는 곳입니다. 교수님들, 식당 직원들..모든 사람들이 대부분 친절하기 때문에 심적으로 우울하고 힘들면 이분들 중 어느분께 이야기를 해도 되고 공부하는데에 있어서 어려움이 있으면 교환 담당 교수님이나 다른 교수님들을 찾아가도 좋습니다. 저는 Gwen교수님한테 도움을 많이 받았습니다.",더 궁금한게 있으면 fn****6@hanmail.net 으로 연락주세요. hendrix를 떠날 때 정말 일주일 내내 울었습니다. 그만큼 떠나기 싫고 그만큼 너무 재밌고 소중한 시간과 추억을 만들 수 있는 학교였기 때문입니다. 가면 정말 후회하지 않을 거라고 생각합니다!!너무 너무 좋은 곳이예요!!
