gen_info,env_info,food_info,study_info,office_info,facil_info,mhct_info,help_info,etc_info
"학교의 크기는 우리대학교보다 조금 작은 수준입니다. 대부분 걸어서 이동할 수 있고 대학교로서 기대할 수 있는 각종 편의시설이 기대 이상으로 매우 잘 갖추어져 있습니다. 각 단과대학, 도서관과 같은 기본적인 시설 뿐만 아니라 체육관, 아이스링크, 인조잔디 운동장, 주차장이 있습니다. 위치는 Central Minnesota에 위치해 있으며 미네소타 내에서 Twin cities 다음 가는 크기의 도시로 알고 있습니다. 겨울에는 눈이 매우 많이 오며 여름에는 비도 자주 오고 덥습니다. 봄, 가을은 날씨가 대체로 화창하며 야외활동하기에 매우 좋습니다.","주변에 다수의 호수가 있으며 캠퍼스 옆으로 미시시피 강이 흐릅니다. 캠퍼스 밖으로 다운타운이 위치해 있으며 관공서, Pub, 각종 음식점들이 즐비합니다. 외곽지역으로는 주로 주거지가 발달해 있습니다. 또한 다운타운에 Metro Transit Center, 버스 환승역이 있으며 버스를 이용하면 세인크클라우드 주변지역 어디든 쉽게 찾아갈 수 있습니다. 학생들은 버스 요금이 무료입니다.","저는 2학기 내내 Lawrence에서 살았습니다. Lawrence 이외에 Shoemaker, Benton, Sherburne, Hill&Case, Michael 등등 많은 기숙사가 있습니다. 저는 개인적으로 위치면 시설 면에서 Lawrence가 최고라고 생각합니다. 그 다음이 Shoemaker입니다. 구글 맵으로 확인해 보시면 아시겠지만 Lawrence는 새로 신축된 건물인 동시에 캠퍼스 각종 시설과 가깝습니다. 가격 면에서 다른 곳보다 조금 비싸다고 하지만 큰 차이는 없습니다. 기숙사 쓰실 때, 무조건 Lawrence 1순위로 쓰시고 Shoemaker 2순위로 쓰세요. 밥은 주로 Garvey Commons라고 학생식당에서 먹었습니다. 뷔페식이고 버거, 피자, 샐러드, 국수, 샌드위치, 베지테리안 음식, 과일, 음료수 각종 다 있습니다. Meal plan으로는 여러가지 있는데 남자 분이시라면 그냥 Unlimited 드세요. 다들 살 많이 찐다고 걱정들 하셨는데 전 하나도 안 쪘습니다. 매번 횟수 세어가면서 밥 먹으려면 스트레스 받습니다. 그 외로 Unlimited의 경우 Munch money라고 학내 편의점 및 커피점에서 원하는 걸 사먹을 수 있는 돈이 들어옵니다. $200 정도 입니다. 저는 학생회관, Atwood 지하에서 샌드위치 사먹고 닭 사먹는데 다 사먹었습니다. 여자  분들 중에 커피 좋아하시면 카리부에서 사 드시면 좋습니다.","ECON205-거시경제원론-저는 한국 교수님 수업 들었습니다. 가시면 경제학과에 Dr.Kang, 강응민 교수님이 계십니다. 처음에 다른 네팔 교수님 수업 들어갔다가 도저히 발음을 못 알아들어서 빼고 나왔습니다. 강의가 매우 명쾌하시고 순조롭습니다. 미국 학생들 사이에서도 깔끔한 강의로 소문 나 있습니다. 주로 슬라이드로 강의를 진행하시며 판서도 많이 하십니다. 제 기억으로는 매 챕터당 온, 오프라인 퀴즈가 있었습니다. 온라인 퀴즈는 우리대학교 와이섹과 비슷한 시스템인 D2L에서 문제를 열심히 푸시면 됩니다. 오프라인 퀴즈는 조금 어렵습니다만 마지막에 옆자리 친구들과 토의해서 답을 고쳐 최종답안을 냅니다. 좀 이상했지만 그랬습니다. 시험은 중간, 기말고사 50문제 가량 객관식이며 온라인 퀴즈와 유사한 문제가 나왔던 것 같습니다. 슬라이드 내용, 교과서, 퀴즈 오답 잘 검토하시고 내용 이해하시면 큰 문제 없습니다.
ECON206-미시경제원론-모니카 제니퍼 로페즈? 라틴계 선생님 수업 들었습니다. 이 선생님은 수업시간에 폰 울리는 것을 매우 싫어하셔서 벨소리가 들린다거나 문자메시지를 확인하면 강의실 밖으로 내 &#51922;으셨습니다. 학생들이 잘 이해하는지 따라오고 있는지 매우 신경을 많이 쓰시며 질문도 많이 던지십니다. 슬라이드로만 수업하십니다. ECON 205와 유사한 온라인 퀴즈 있었으며 시험은 중간, 기말 두 번 보았습니다. 35문제 정도 객관식으로 출제되었고 문제 방식이 온라인 퀴즈와 매우 다릅니다. 선생님이 매 번 직접 시험문제를 만드시고 출제하시는 것 같았습니다. 따로 기출도 제공되지 않고 뾰족이 공부할 수 있는 방법이 없습니다. 내용 이해를 중점적으로 하시고 실제에 적용하는 방식으로 시험문제가 출제됩니다. 개인적으로 시험 준비를 하는데 있어 애를 먹었습니다.
STAT321, STAT421-회기분석-Dr.Robinson 교수의 수업입니다. 이 학교에서는 회기분석을 1, 2 두 학기에 나누어 수업합니다. 저는 1, 2학기에 걸쳐 1, 2 둘 다 들었습니다. 전형적인 미네소타 백인 선생님으로 강의 경험도 풍부하고 설명도 매우 깔끔합니다. 강의는 OHP위에 종이를 올려놓고 써주시는 방식으로 진행됩니다. 우리대학교에서는 이미 알고 있다고 가정하는 세세한 내용까지 하나하나 다 커버해서 때로는 강의가 늘어지는 느낌도 들 수 있습니다. 매주 오프라인 퀴즈를 보는데 지난 한 주간 커버한 내용으로 문제가 출제됩니다. 수업에서의 필기 중심으로 공부하시고 교과서 연습문제 몇 개만 풀어보시면 어렵지 않습니다. 중간고사는 없고 매주 보는 퀴즈와 기말고사 한 번으로 성적을 주십니다. 기말고사 준비는 매주 보아 온 퀴즈를 복습하는 것 그리고 교과서 연습문제로 충분합니다. 기말시험 전에 어떤 챕터의 어떤 문제를 풀어보라고 notice를 주십니다. 계산기로 계산하실 때 조심하셔야 합니다. 숫자 하나라도 틀리면 1점 감점합니다.
STAT304-SAS프로그래밍-저는 우리대학교에서 이미 컴퓨터 자료처리를 수강했었습니다. 하지만, R이외에 SAS프로그래밍의 필요성이 느껴져서 수강했습니다. 나이지리아 출신의 Dr.Onyiah 교수님 수업입니다. SAS의 기본적인 데이터 컨트롤 코드를 주로 다룹니다. 교수님의 알아듣기 힘든 발음과 준비성 결여 덕분에 현지 학생들 사이에서도 매우 비인기 과목입니다. 하지만, 졸업을 위한 필수 과목임과 동시에 다른 상위과목들의 선수과목이기 때문에 모두들 듣습니다. 과제물이 수시로 주어지며 주로 SAS 라이센스 문제로 학교 컴퓨터실에서 해결해야 합니다. 모두 어떠한 상황이 주어지고 그것에 대한 코드를 짜서 코드와 결과물을 함께 제출해야 합니다. 시험은 4차에 걸쳐서 과제물의 길어진 형태로 출제됩니다. 제가 수업 들을 때에는 교수님이 학생들의 질문에 제대로 답하지 않으시려고 해서 학생들과 갈등이 생긴 적도 있었습니다.
ENGL191-ESL대신에 저는 이 과목을 수강했습니다. 우리대학교의 1학년 때 듣는 글쓰기 과목과 비슷한 성격입니다.  Megan Dickson이라는 대학원 조교 선생님이 운영하는 강좌였습니다. 주로 특정 material을 보거나 읽고 토론을 하는 방식이었습니다. 일 주일에 두 번 수업을 갔으며 매 시간마다 1페이지 분량의 페이퍼를 제출했습니다. 그리고 매 2주마다 긴 에세이를 써내야 하며 매 번 길이가 길어집니다. 에세이 제출 전 날에는 학생들끼리 리뷰를 해서 서로의 에세이에 대해 평가도 해야 합니다. 시험은 이 에세이들로 대체됩니다. 한 학기 총 6편의 페이퍼를 써야하며 마지막 Research Paper에서는 페이퍼를 쓰기 전에 자신의 주제에 대해 다른 학생들 앞에서 발표를 해야 합니다. 하지만 다른 학생들 모두 발표 준비를 많이 열심히 하는 것 같지는 않았습니다. 미국 학생들과 토론 및 영어 글쓰기 능력을 키우고 싶으신 분들은 추천합니다.
STAT433-비모수통계학-Dr Xue라는 중국 교수님 수업입니다. 중국발음이 매우 강하시며 명확하지 않아서 알아듣기에 조금 힘듭니다. 직접 만들어 오신 PDF파일로 강의하십니다. 한 학기 수업동안 비모수적 방법론에 관해 대부분 커버하며 다수의 과제, 시험 4회 있습니다. 수업자료만 잘 커버하신다면 시험 및 과제를 하시는데 큰 문제는 없습니다. 특히 과제할 때 R이나 SAS프로그래밍으로 손으로 여러 번 해야 하는 작업을 대체하시면 시간과 체력을 매우 아낄 수 있습니다. 성격이 매우 Generous하시지만 눈이 아무리 많이 와도 휴강은 안하십니다.
ACCT291-회계원리1-미국 회계사 Strong이라는 선생님 수업이었습니다. 전형적인 백인 선생님이시만 말이 매우 빠르십니다. 수업은 슬라이드 및 교과서로 이루어지며 따로 만든 수업자료가 있습니다. 모두 D2L에 올라옵니다. 온, 오프라인 퀴즈 있습니다. 온라인 퀴즈는 약간 까다롭지만 계산기 가지고 열심히 푸시면 됩니다. 매 챕터가 끝날 때마다 오프라인 퀴즈가 주어집니다. 모든 문제가 교과서 연습문제에서 똑같이 출제됩니다. 챕터 끝에 나오는 1~10번까지 문제들 다 외워 가시면 됩니다. 4차 시험 있으며 시험은 객관식으로 1~3차는 50문제, 기말은 70문제 나온 것으로 기억합니다. 시간이 가끔 부족할 수도 있으니 조절 잘하셔야 합니다.

도서관은 새벽 두시까지 개방하며 우리대학교같이 자리표를 뽑을 필요 없이 사용하시면 됩니다. 시설이 매우 깨끗하고 쾌적합니다.",International studies는 Lawrence 1층에 있습니다. 교환학생으로서 겪을 수 있는 각종 어려움을 해결해 줍니다. 매우 친절하며 주말에 아웃렛 몰 혹은 스테이트 페어와 같은 재미있는 곳에 갈 수 있게끔 티켓도 저렴한 값에 팝니다.,"앞에서 말씀 드린 것 같이 학교에 체육시설과 같은 부대시설은 매우 뛰어납니다. 저 같은 경우 수영을 좋아해서 수영장을 매우 자주 갔었습니다. 수영장 외에도 야외 잔디구장, 실내 농구장, 헬스장, 탁구, 벽타기, 아이스링크, 트랙, 별게 다 있습니다. 학생증을 제시하면 원하는 운동기구 및 운동에 필요한 모든 것을 Check out 해줍니다. 동아리는 한 학기 한번 Main street라고 해서 모집합니다. 저는 AIESEC이라는 곳을 지원했었는데 떨어졌습니다.","처음에 갔을 때에는 너무 신나서 Culture shock이 느껴지지도 않았습니다. 매일 친구들이랑 노느라 정신이 없었기 때문입니다. 대신 다른 관점, 생활방식, 사고방식에 놀랐던 적은 있습니다. 하지만 놀라고 웃고 넘어가는 정도였지 shock이라고 할 만큼 제게 크지 않았습니다.","역시 한인 침례 교회가 있습니다. 가시면 인자하신 목사님과 사모님, 권사님, 집사님들이 계십니다. 매주 일요일이면 많은 한국 학생들이 모여들며 예배 후에는 한국음식을 나누어 먹으며 친목시간을 가집니다. 그리고 교내에서는 International Studies와 심리학과에서 운영하는 상담기관도 본 적 있습니다.",1년 동안 미네소타에서 생활하면서 너무 신나고 좋았습니다. 고민하고 계시다면 가시는 것을 꼭 추천합니다. kekemook@hotmail.com 메일입니다. 필요하시면 연락주세요.
"세인트클라우드 대학교는 미네소타내에서 두번째로 큰 대학교 입니다. 대학교가 위치에 있는 세인트클라우드 또한 미네소타에서 두번째로 큰 도시입니다. 크기는 연세대와 비슷하지만 체감으로 느끼는 크기는 훨씩 작습니다. 건물들이 모여있어서 2,3분걸으면 어느 강의실이던지 갈 수 있습니다.미네소타는 춥고 긴 겨울로 유명합니다. 12월부터 4월까지 굉장한 추위가 계속된다고 생각하시면 됩니다. 하지만 추운도시답게 거의 모든 건물들이 스카이패스로 연결되어있어 한 학기동안 생활하는데 큰 문제는 없었습니다.","신촌과같은 대학 주변 환경을 생각하고 오신다면 실망하실수도 있습니다. 학교 밖 다운타운에는 클럽이나 술집등이 있지만 몇 군데 없는걸로 알고 있습니다. 제가 직접 가보지않아서 어떤지는 잘 모르겠지만 여기 학생들처럼 주중이고 주말이고 밤에 잘 안노는 학생들도 없다고 들었습니다.  버스를 타고 15분정도 나가면 크로스로드몰이 있습니다. 그 안에 타겟, 메이시스에서 생활에 필요한 모든 물품을 구입하실 수 있습니다.학교 바로 옆으로 미시시피강이 흐릅니다. 가끔은 룸메이트들과 강으로 내려가 강가에서 놀기도 했고 캠핑도하면서 정말 즐겁게 보냈습니다.","벤튼 - 제가 한학기동안 지낸 기숙사입니다. 기숙사의 구조는 방 2개와 작은거실 그리고 화장실로 구성되어있습니다. 그렇기에 4명이서 같이 생활한다고 생각하시면 편하실겁니다. 하지만 화장실은 건너방 4명의 친구들과 같이 써야해서 총 8명이 하나의 화장실을 사용합니다. 시설은 슈메이커사우스보다는 낫습니다. 바닥이 나무바닥이아니라 카페트라 환기를 자주해야 했습니다. 장점으로는 여러명이 살다보니 그만큼 재밌는 일도 자주 생깁니다. 제 룸메이트는 독일에서 온 교환학생이었고 옆방 두명의 룸메으트중 한명은 에니메이션을 즐겨보며 2NE1과 노라조 노래를 즐겨듣는 소위말하는 덕후기질이 충만한 친구였습니다. 가끔 제가 케이팝을 들려주면 신기해하면 좋아라하던 룸메였습니다. 또 한명의 룸메이트는 전형적인 미네소타 학생입니다. 아웃도어활동을 좋아해서 겨울에는 스노우보드를 즐기고 날이 좀 풀리면 낚시나 캠핑을 자주 했습니다. 덕분에 저도 룸메이트들과 함께 캠핑도하고 낚시도 하며 소중한 추억을 많이 가지고 돌아올 수 있었습니다. 벤튼홀을 따로 체크인이나 체크아웃을 할 필요가 없이 자유롭게 드나들수 있습니다. 그리고 거주하는 학생 대부분이 고학년이라 기숙사도 조용합니다. 슈메이커 - 슈메이커는 노스와 사우스로 나누어집니다. 노스는 새로 리노베이션을 해서 시설이 가장 좋습니다. 방도 깨끗하고 화장실이며 모든 시설이 최신입니다. 그에 반해 사우스는 로렌스보다 는 안좋습니다. 방도 어둡고 방음도 잘 안됩니다. 학교 체육관하고 제일 가까워 겨울에도 체육시설을 이용하기 편하기 때문에 슈메이커에 사는 학생중 많은 비율이 운동부학생이거나 운동을 좋아하는 학생들이 많이 삽니다. 그래서 그런지 혈기왕성한 친구들이 많다보니 새벽 2시까지도 시끌시끌한 편입니다. 운동을 좋아하시면 슈메이커에서 사시는게 제일 좋다고 생각합니다.교환학생 대부분이 식사는 주로 Garvey에서 먹습니다. 가비는 뷔페형식이라 원하는 만큼 가져다 드실수 있고, 8개정도의 코너에서 다양한 메뉴를 제공합니다. 저는 일주일 사용 횟수가 무제한인 unlimited를 신청해서 한학기동안 정말 잘 먹었습니다. 하루에 3번은 기본이고 많으면 5번까지도 가비를 이용했습니다. 식사뿐만아니라 샌드위치나 과일등을 가지고 나오기도했습니다. 제가 워낙 가리지않고 잘 먹는 편이라 한학기동안 가비음식에 질리지않고 먹었습니다. meal plan을 이용하시면 munch money $200가 포함되어 있는데  이 돈을 가지고 Atwood에있는 카리부, 퀵존, 피자헛, 서브웨이, 패스트푸드, 롤등을 사드실 수 있습니다.","ECON 205 05 Prin Macroeconomics(Moghaddam MWF)우리학교에서 거시원론입니다. 수업난이도는 낮은편이며, 교제를 꼭 사야만 매주 온라인 퀴즈를 볼 수있습니다. 또 따로 수업시간에 총 4번의  퀴즈를 보았고 퀴즈는 자신의 필기를 보고 풀어도 괜찮습니다. 모든 학생들이 그렇게 합니다.  그러므로 필기가 가장 중요합니다. 따로 프린트물이나 ppt파일을 제공해주지 않으시기에 필기만 열심히 하시면 좋은 성적 받으실 수 있습니다. 시험은 총 4번입니다. 성적은 절대평가입니다.FIRE 371 05 Managerial Finance (Yu MWF)재무관리 수업입니다. 재무관련 수업이라 학생뿐만아니라 직장을 다니면서 수업을 들으러 오시는 어른분들도 많습니다. 덕분에 수업분위기가 굉장히 좋습니다. 8번의 온라인 퀴즈와 4번의 시험이있고 페이퍼가 하나있습니다. 페이퍼 주제는 자신이 원하는 기업의 재무 분석입니다. 교수님께서 ppt파일을 올려주시고 시험시간에는 공식이 적힌 종이를 나눠주십니다. MKTG 321 02 Buyer Behavior (Bristow TT)제가 여기서 수강했던 과목들중 가장 재밌던 수업입니다. 교수님도 웃기시고 배우는 내용이 실생활과 관련된 내용이라 정말 재밌게 들었던 수업입니다. 매시간 퀴즈가 있지만 자기 생각이나 선호를 적는 퀴즈라던지 앞으로 배우게 될 내용을 예상해서 작성하는 퀴즈등 가볍게 볼 수 있는 퀴즈였습니다. ppt파일을 제공해주시 않으시므로 수업시간에 교수님이 보여주시는 ppt파일을 열심히 적었습니다. 시험은 총 4번이며 두개의 페이퍼가 있습니다. 분량은 절대 2장을 초과하면 안되는 페이퍼입니다. IS 340 02 Management Info Systems (Phan MWF) 경영정보시스템 수업입니다. 교수님이 ppt를 올려주시고 퀴즈가 3번 있습니다. 시험도 3번입니다. 수업과는 전혀 다른 생뚱맞은 과제로 홈페이지 만들기가 있습니다.MGMT 352 01 Survey Human Resourc Mgmt (Davis TT) 소비자행동론입니다. 한학기동안 제일 힘들었던 수업입니다. 아침8시 수업이고 직업경험이 없으면 참여하기 힘든 수업입니다. 수업은 일주일에 두번이며 한번은 교수님이 수업을 진행하시고 한번은 토론발표가 이루어집니다. 토론발표는 3명이 한조가 되어서 찬반논쟁을 펼칩니다.",국제교육부 국제학사인 로렌스 1층에 CIS (Center for International Students)가 있다고 들었습니다. 한학기동안 이용할 일이 한번도 없어서 가보진 못했습니다.,"기타 학교에 관한 정보(부대시설, 동아리 등) 세인트클라우드 대학교는 건강한 학생이 공부도 잘 할 수 있다고 믿고있습니다. 그렇기 때문에 체육시설은 어느 사설 시설 못지않게 최신식으로 구성되어있습니다. 실내트랙뿐 아니라 암벽등반 마사지샵까지 정말 다양한 운동시설과 기반시설을 갖춘 학교입니다. 동아리 활동도 활발하며 한학기에 2-3번정도 야외 클럽이나, 학교안 놀이공원등 다양한 학교행사가 있습니다.",특별한 문화충격은 없었습니다.,"한인교회가 있습니다. 한인교회를 가보시면 세인트클라우드에 다니는 거의 모든 한인학생분들을 만날 수 있습니다. 학생들 뿐아니라 목사님 성도님들이 자연스레 여러가지 도움을 주시고, 예배가 끝나면 다같이 식사시간을 가지며 친목활동을 합니다.",세인트클라우드는 미내소타내에서 화이트클라우드라고 불리기도 합니다. 이름에서 알 수있듯이 백인비율이 굉장히 높습니다. 또한 미내소타 사람들이 정말 착합니다. 실례로 제가 버스를 기다리면서 팔짱을 끼고 있으니 어느 아주머니께서 손시려울테니 장갑끼고 가라며 선뜻 남는 장갑을 챙겨주시는 따뜻한 곳입니다. 모든사람들이 도움을 요청하면 친절하게 다가오는 곳입니다. 학교내에서도 백인친구들과 만날기회도 많고 영어또한 친절하게 가르쳐줍니다. 정말 개인적으로 강추하는 대학교입니다.
