gen_info,env_info,food_info,study_info,office_info,facil_info,mhct_info,help_info,etc_info
"작은 규모로 송도캠퍼스랑 비슷하거나 더 작습니다. 모두가 모두를 서로 아는 분위기입니다. 사람 수에 비해 건물이나 시설이 부족한 편은 아닙니다.뉴욕주 북부 핑커레이크 지역에 위치해 겨울이 매우 춥고 길고 눈도 많이옵니다. 이번 겨울은 특히 추워서 1월에 -18도까지 내려가 시베리아에서 온 친구가 더 춥다고 했던 기억이 납니다. 4월 말까지 눈이 많이왔습니다.6~7월은 비교적 온건한 날씨로 많이 덥지도 않은 따듯한 날씨며 해가 진 후는 쌀쌀합니다. 9월이 되면 30도 정도로 더워지며 숙소 건물에는 에어컨이 없어서 고생했습니다.교통편은 불편한 편입니다. 그레이하운드와 RTS버스가 있는데 RTS는 노선 상 한번도 사용하지 않았고 그레이하운드로 뉴욕시티까지 6~7시간 정도 소요됩니다. 공항이 있는 로체스터, 시라큐스까지도 버스가 있으나 하루에 네 대 정도로 제한적입니다. 공항까지 우버로는 65불 정도입니다.","Middle of nowhere. 대학이 있는 작은 시골마을입니다. 30분이면 모든 골목을 걸어서 다 돌 수 있을만큼 작은 다운타운에 음식점, 펍, 카페가 몇 개 있습니다. 외식을 거의 안하는 편이어서 밤에 놀러갈 때 빼고는 잘 가지 않았습니다. Ichiro라는 일식집이 괜찮은 편이고 밤에는 Beef&brew, FLX live를 주로 갑니다.학교 바로 뒤에 Tops가 있던(지금은 없어졌습니다) 플라자에 영화관, 문구점, 맥도날드, 주류판매점이 있습니다. 그 위쪽에는 AT&T, 침구점, Walgreens가 있는데 이 상가에 있는 Bubble tea cafe가 정말 맛있습니다. 기회가 될 때마다 셔틀을 타고, 자전거를 타고 자주 갔습니다. 역대급 인생 버블티를 찾은 곳. fruity/clear 베이스의 구아바+리치+피치 조합을 추천합니다. 너무 좋아서 기념으로 티셔츠도 사왔습니다.장은 셔틀을 타고 Wegmans, 자가용으로는 Wallmart에서 보면 됩니다.바로 옆에 큰 세네카 호수가 있어 배나 패들보드를 탈 수 있고 여름엔 수영하기도 좋습니다. 와인으로 유명한 지역 답게 호수 주변으로 와이너리들이 몰려있습니다.","크게 기숙사/하우스(테마가 있기도 없기도 함)/다운타운으로 나뉘어지는데 저는 봄 여름 가을 전부 하우스에 살았습니다. 기숙사나 다운타운에 사는 친구집도 여러번 가봤는데 기숙사는 blackwell, odell, decordova가 시설이 좋은 편이고 1학년 기숙사들은 정말 그냥 기숙사인데 그렇게 쾌적한편은 아닙니다. 다운타운에 있는 숙소도 같은 가격으로 구할 수 있는데 개인 주방과 욕조까지 있는 화장실이 딸려서 매우 쾌적하지만 학교까지 거리가 꽤 된다는 게 단점입니다.1년 동안 호수를 끼고있는 South main st에서 살았는데, 봄에는 730 Active house라는 테마하우스였고 여름과 가을에는 이름도 테마도 없는 737에서 살았습니다. 싱글에 주방과 욕실을 셰어하는 형태인데 그리 좋지도 나쁘지도 않았습니다. 737은 바로 뒤가 나무와 호수여서 그런지 여름에 벌레가 참 많았습니다.학교식당은 특히 학기 초에 맛이 없는 편입니다. 뷔페식이지만 밀플랜을 따져보면 한끼에 $15 가량이므로 장을봐서 직접 해먹는 편이 비용도 맛도 나았습니다.","도서관은 3층으로 소음 정도가 나뉘어 있으며 무료로 2,3층 락커를 이용가능합니다. 이용할 수 있는 윈도우,맥 데스크탑이 많으며 IT service에서 노트북과 전자기기 충전기 등을 빌려줍니다. 프린터기도 이곳에 있습니다.수업은 대체로 난이도가 높지 않고, 최대 인원수가 30명보다 적으며 읽기와 과제의 양이 많습니다. 전공수업은 논문이나 뉴스등을 읽고 토의하는 일이 많았았습니다. 그러나 학점을 받기에 드는 노력이나 부담감은 체감상 연세대보다 훨씬 적었던 것 같습니다.다음은 간단한 강의평가 입니다.18학기 봄Intro. to drawing, Yi한국인 교수님의 드로잉 수업입니다. 기준이 엄격하다고 다들 힘들어 했는데 시간이 많이 들어서 그렇지 그렇게 힘들지 않습니다. 중간, 기말 큰 그림을 그릴 때는 40시간 이상이 소요되는데 결과물을 보면 충분히 가치있습니다. 주 이틀 6시간 수업이 있고 화요일에 저녁 세션이, 주말에는 숙제가 있어 주에 4~5번을 스튜디오에서 살다시피 하며 원없이 그림 그렸습니다. 교수님이 살가우시고 잘 챙겨주셔서 저녁도 두번 대접해주시고, 김치도 종종 챙겨주셨습니다.International Trade,Judith Mckinney200단위 경제 전공. 미시 내용에 약간 심화된 모델을 다룹니다. 읽기, 저널쓰기 과제가 있고 시험은 세 번. 경제 뉴스를 읽고 그룹 토론을 많이 했습니다.Labor market issue, Houseworth300단위 경제 전공. 역시 미시 모델을 기반으로 심화 모델을 다루나 많이 어려운 수준은 아니었습니다. 다만 논문을 매수업 2~3개 읽어야해 시간이 많이 들었고 시험 1개, 발표 두번, take home exam이 한 번 이었습니다.Linear algebra, Hao계량경제에 도움이 될까 싶어 들은 선형대수 였는데 실상 경제수학에서 배우는 진도와 상당부분 겹쳤습니다. 그래도 증명에 대한 새로운 시각을 얻어서 좋았습니다.18년 가을Econometrics,Scott Mckinney300단위 전공 계량경제. 생각보다 어렵지 않았고, 2번의 시험과 한 개의 큰 개인 연구 프로젝트가 있습니다. SASS 프로그램을 사용했습니다.Money and Financial Market, Damar300단위 전공. 가장 모델들을 많이 사용한 전공 수업이었고, 자잘한 숙제와 3번의 시험으로 이루어져 가장 연대 수업과 비슷하다고 느껴졌습니다.Game Theory, Grayson400단위 유일한 세미나 수업이었는데 모델은 미시수준에서 더 나아가지 않았습니다. 발표 한 번 후에는 본인 연구 보고서를 쓰고 그것으로만 성적이 평가됩니다. 중후반 부터는 혼자 보고서를 쓰고 개인적인 피드백을 받는 일이 많았습니다.Color & Composition, Bogin 1학점 6시간아크릴을 사용하는 페인팅 수업. 기술적으로 배우는 게 많지는 않지만 그림을 그리고 다른이들과 감상할 수 있는 기회여서 좋았습니다.Percussion Ensemble, Anthony 반학점 주 2시간학기 말에 작은 공연을 하는 타악기 수업. 변변치않은 실력에도 오랜만에 편하게 음악을 다시 할 수 있어서 즐거웠습니다.Scuba diving 반학점, 주 2시간400달러 추가비용으로 open water dive 자격증을 딸 수 있는 수업입니다. 일주일에 한번 이론수업과 더불어 저녁시간에 학교 수영장에서 연습을 하고 학기 중반에 근처 호수에서 자격증 시험을 봅니다. 고생도 많이 했지만 재밌고 새로운 경험이어서 좋았습니다.","듣던대로 Amy가 항상 친절하게 맞아주었지만 학기중에는 생각보다 바빠 이메일로는 연락이 잘 되지 않는 경우가 많았습니다.창고에서 여러가지 비품들을 빌릴 수 있습니다. 문구류, 침구부터 선풍기, 드라이기, 식기류까지 다양한 품목들이 있습니다. 저도 따로 구입했던 책상등, 커피포트, 고데기 등을 다 두고 왔습니다.학기당 세번 정도의 필드트립이 있는데 적은 비용으로 재밌게 잘 다녀왔던 것 같습니다. Niagara Fall, Cornell glass museum, Rochester Christmas market 등에 갑니다.","수영장, 헬스장을 모두 무료로 이용할 수 있습니다.운동을 좋아하시면 Bristol Gym의 Group Fitness, 혹은 크로스핏 동아리에 가입하시는 걸 추천합니다.가을학기마다 Koshare라는 댄스 동아리에서 학생들이 직접 안무를 짜고 팀을 꾸려 연말에 큰 공연을 합니다. 오디션에 참가하면 무조건 공연할 수 있습니다. 친구 말로는 캠퍼스에서 볼 수 있는 가장 큰 에너지라고 합니다.",굉장히 개방적이고 정조개념이 우리나라와 상당히 다릅니다. 한국이었으면 문제가 되었을 만한 언행에도 관대한 편.집 밖의 공공 화장실에서 양치를 하지 않습니다. 위생관념이 다른듯.,보통 국제처의 Amy를 통해서 문제를 해결하게 됩니다. 바쁠 때는 직접 찾아가는 것이 제일입니다.,"페이스북 그룹 HWS rideshare 에서 방학 전후나 주말에 택시를 나누거나 자가용을 얻어 탈 수 있습니다.학교에 Zip car가 있다고 하는데 카드 발급 과정이 복잡해 근처에 Enterprise에서 렌트카를 이용했습니다. 학교 학생임을 증명하면 Debit card로도 렌트가 가능합니다.쉽게 캠퍼스 카페나 식당에서 일자리를 구할 수 있습니다. 학교 식당과 주방이 제일 시급이 높은 것으로 알고 19년 기준 12달러 정도로 오른다고 들었습니다.아마존에 @hws.edu 이메일을 등록하면 프라임 학생 할인을 6개월 무료로 받을 수 있습니다(빠른 무료 배송)봄에 일주일 봄방학, 4개월가량의 여름방학, 가을에 4일의 가을방학과 일주일 Thanksgiving 방학이 있으니 계획을 미리 생각해두면 좋겠습니다.ert474@naver.com으로 언제나 편하게 질문 주세요."
