gen_info,env_info,food_info,study_info,office_info,facil_info,mhct_info,help_info,etc_info
"University of Utah는 솔트레이크시티에 위치한 학교입니다. 저는 1월에 도착했는데, 1월~2월은 눈이 정말 많이 옵니다. 눈을 되게 좋아했었는데 유타에서 눈을 하도 많이 봐서 이제는 좀 질릴 정도입니다. 눈폭풍이 와서 하루 수업이 취소되기도 합니다. 학교가 고지대에 위치해있어 오르막길을 많이 오르다보면 숨이 차기도 합니다.유타에서 했던 가장 진귀한 경험은 5.7규모의 지진을(...) 겪은 것입니다. 코로나로 귀국이 결정되고 그 사이에 지진을 겪어서 멘탈이 나간 기억이 있습니다. 흔한 일은 아니라고 하니 걱정하실 필요는 없을 것 같습니다.","트랙스를 타고 Trolley역을 가는게 아마 여러분들이 가장 많이 가실 루트가 될 것 같습니다. Trolley 역에는 Smith's, 트레이더스 조, Whole Food 마켓 등, 장을 볼 수 있는 곳들이 많이 있습니다. 저는 이중에서 가장 저렴한 Smith's를 이용했습니다. 어플을 다운받아서 멤버쉽을 가입하면 적립/할인 받으실 수 있으니 꼭 하시는 것을 추천드립니다. 또, 홀푸드 마켓 옆 트롤리 스퀘어에는 데저트 엣지라는 맥주집이 있는데 맥주 맛이 나쁘지 않습니다. 교환학생 첫 술을 여기서 먹었던 것 같네요.조금 더 나가시면 City Creek, Gateway 등이 있습니다. 저는 여기서 Gateway쪽에 있는 Mr.Shabu라는 샤브샤브집을 많이 갔습니다. 가격이 사실 꽤 비싼편이라 런치에 가는 것을 추천드립니다. 저는 샤브샤브를 너무 좋아해서 많이 갔었습니다. 유타 재즈의 홈구장도 이 주변에 있습니다. 저는 코로나 덕분에 가지 못했으나, 한번쯤을 가보시는 것을 추천드립니다.또 여기서 더 멀리가면 아시안 마켓들을 가실 수 있습니다. 차이나타운 마켓과 서울마켓을 주로 이용했는데, 차이나타운 마켓은 한국 식자재에는 국한되지 않고 정~말 규모가 큰 아시안 마켓이라 웬만하면 이곳을 많이 이용했고, 서울마켓은 비교적 규모는 더 작고 접근성도 조금 불편한 편이라 적게 갔지만 수육용 삼겹살이나 돼지불고기 등을 팔고 차이나타운마켓에 없는 물품도 팔아서 갔었습니다.한인 미용실로 미다듬이라는 곳이 있는데, 여기가 유타에서 그나마 머리를 제일 한국 미용실답게 자르신다고 합니다. 저는 개인적으로 만족스럽지 않았으나, 다른곳이 여기보다 좋지 않다는게 무서워 여기만 갔었습니다.","저는 Shoreline Ridge 기숙사 2인실에서 살았습니다. 아파트고 방이 두개라고 생각하시면 좋을 것 같습니다. 원래는 벤치마크 3인실을 신청했는데 튕긴 것 같아요..식사는 저는 밀플랜을 신청하지 않았고, 밀플랜 신청하지 않는걸 추천드립니다. 밀플랜을 이용하시면 PHC의 식당을 이용해야 하는데, 많은 경험보고서 분들이 말하는 것처럼 메뉴 순환이 잘 안됩니다. 다만 맛은 생각보다 좋습니다. 특히 런치에 가면 나오는 누들과 런치, 디너에 모두 나오는 버거는 정말 맛있습니다. 버거는 저는 개인적으로 인앤아웃보다도 맛있었습니다.저는 미국 와서 거의 처음으로 요리를 해봤는데 생각보다 재밌고 잘 맞아서 돈을 많이 아낄 수 있었습니다. 저는 Smith's와 차이나타운 슈퍼마켓(아시안 마켓이고 물건들을 가장 다양하게 팝니다.), 그리고 서울마켓이라는 한인마켓에서 식재료를 보통 사서 요리를 해먹었습니다. 요즘은 유튜브에 워낙 요리하는 영상들이 많아서 초보자도 쉽게 요리하실 수 있을 겁니다. 저는 친구들에게 마라샹궈를 해줬던 기억이 있네요.","저는 컴퓨터과학과 수업을 4개 들었습니다.수업에 대해 말씀드리기 전에 수강신청과 관련하여, CS수업은 거의 Permission Code를 받아야 등록이 가능했습니다. 이건 CS 학과 홈페이지에 들어가면 Permission Code Request Form이 있는데, 여기에 본인이 연세대학교에서 들은 선수과목들을 적으면 메일로 퍼미션 코드가 옵니다. 수강신청 시작 전에 미리 작성해서 permission code를 받아놔야 합니다.CS3810 - Computer Organization(4학점)컴퓨터 아키텍처에 해당하는 과목입니다. 전반적으로 교수님 설명도 좋고 특히 유튜브에 교수님이 미리 올려두신 영상이 있는데 이것만 봐도 수업 따라가는데 큰 지장이 없습니다. 과제 10번과 시험 2번이 있는데 처음에는 과제 10번이 많아보였지만, 생각보다 과제 부담이 그렇게 크지는 않았습니다. 몇몇 어려운 과제들이 있는데 가장 낮은 점수 하나를 빼주셔서 더더욱 부담이 없었습니다. 알찬 과목이라고 생각되고 추천드립니다.CS4300 - Artificial Intelligence(3학점)인공지능에 해당하는 수업입니다. 연대의 인공지능과 같이 버클리의 AI 강의를 많이 차용해서 수업합니다. 교수님이 유머감각이 넘치시고 질문도 잘 받아주십니다. 다만 이 교수님이 임시로 맡은 과목이라 다음에는 어떤 분이 맡으실 지는 모르겠습니다.CS5140 - Data Mining(3학점)연세대학교에는 해당하는 과목이 없습니다. 데이터 마이닝으로 인정받아보려 했으나 담당 교수님께서 과목 유사성을 인정해주시지 않았습니다. 단순 전공선택으로 인정받을 예정입니다. 비지도학습 알고리즘들에 대한 시간복잡도와 Error Bound등을 같이 배웁니다. 교수님께서 수업이 매끄러우신 편은 아니나 열정이 넘치시고 친절하십니다. 과제는 알고리즘 구현하는 것들이 주로 나오고 시험은 거의 퀴즈수준이라 부담이 없습니다. 프로젝트도 걱정했었는데 생각보다 결과가 괜찮게 나왔습니다. 추천드립니다.CS5530 - Database System(3학점)C#을 쓴다는 점 외에는 딱히 단점이 보이지 않는 과목입니다. 전체적으로 교수님 설명도 잘하시고 과제 퀄도 들은 과목들 중에 가장 신경을 써야될만큼 잘나왔습니다. 프로젝트도 있고 알찬 과목입니다.도서관을 개강한지 한달이 지나서야 갔는데, 시설 좋고 쾌적합니다. 도서관을 많이 이용하시는 것을 추천드립니다. 3층에 있는 Quiet Zone에서 공부를 하면서 설산으로 지는 노을을 보면 행복감을 느끼실 수 있을 것입니다.","ISSS에서는 학기 시작전 국제학생 전체를 대상으로 한 오티를 진행하고, Learning Abroad에서는 교환학생만을 대상으로 한 오티를 진행했습니다. 두 부서에 계신 분들 모두 친절하고 메일 등으로 문의하거나 직접 찾아가도 친절하게 상담해주십니다.","Student Life Center에서 헬스장 및 여러 운동시설을 무료로 이용할 수 있습니다. 시설이 매우 좋기 때문에 코로나 이후에 가신다면 자주 이용하시는 것을 추천드립니다. 또한 Student Life Center에서는 Outdoor Adventure라고 각종 트래킹, 산악스키, 백패킹 등의 프로그램을 진행합니다. 저도 신청했었는데 코로나와 겹쳐서.. 급히 귀국하여 환불을 받았었습니다. 또한 해당 부서에서 스키복장, 스키, 스키장 티켓, 캠핑 용품등을 대여/판매합니다. 이것도 잘 이용하시면 좋을 것 같습니다.저는 한인학생회 행사를 한번 참여했었는데 나름 괜찮았던 것 같습니다. 풋살동호회, 볼링동호회도 운영하니 관심있으면 한인학생회 환영회를 참여해보시면 좋을 것 같네요. 개인적으로 어느정도 한국 사람들과 거리를 두는 편도 좋으나 그래도 감정을 우리말로 교류할 수 있는 사람 몇명이 있어서 좀 더 정서적으로 안정되는 부분도 있어서 이 부분은 신중하게 고민해보셔도 좋을 것 같습니다.",따로 컬쳐쇼크를 느낄만한 부분은 없었습니다.,"수강신청과 관련된 부분은 SoC Department의 어드바이저에게 물어봤었고, 기타 다른 부분들을 Learning Abroad와 ISSS에 물어봤습니다. 두 부서 모두 매우 친절하십니다. 한인 학생회에서 픽업등의 도움을 받을 수 있다고 들었습니다.","처음에는 트랙스를 타고 웬만한 곳을 가려 30분 넘게 걸리고, 한블럭 걸어가는데 거의 10분이 걸리고 이렇게 스케일이 넓은 곳이 있나 싶어 당황스러웠는데, 익숙해지면 트렉스 타고 1시간도 금방이고 한 30분 걷는 것은 일도 아닐정도로 스케일이 커진 자신을 볼 수 있습니다.가서 스키는 한번 타보시는 것을 추천드립니다. 저는 스키를 잘 타지 못함에도 불구하고 친구가 강력 추천해서 갔었는데, 정말 말도 안되는 절경을 볼 수 있습니다. 저는 Brighton 스키장으로 갔었는데 정말 코스 꼭대기 꼭대기마다 미친 절경을 볼 수 있었습니다.또 유타 주변에 5개의 국립공원이 있습니다. 자이언, 아처스, 브라이스, 캐피톨리프, 캐년랜드 이렇게 5개로 알고 있는데 저는 자이언과 브라이스를 가봤고, 개인적으로 브라이스가 매우 좋았어서 여유가 되신다면 국립공원 방문도 매우 추천드립니다. 또한 서부로 향하는 비행기 가격이 싼데, 날짜가 임박할수록 가격이 매우 비싸지므로 여행 계획을 미리미리 세우셔서 가시는 것을 추천드립니다. 라스베가스 같은 경우 7시간인가 넘게 flix버스를 타고 가는 방법도 있었는데, 사실 추천드리기에는 힘드나(생각보다 7시간은 매우 깁니다, 비행기 타면 1시간 만에 가는데..ㅜㅜ) 가는동안 경치가 꽤 멋져서 비용을 아끼시려면 나쁜 선택은 아닐 수 있습니다. 다만 라스베가스는 왕복항공도 그렇게 비싸지는 않습니다.유타는 간 첫날부터 주변 경관에 감탄을 할 수 밖에 없었습니다. 동서남북에 다 설산이 보였는데, 기숙사에서 내려다보이는 설산이 너무 이뻤고, 특히 아침에 해뜰때, 노을질때는 정말 비현실적인 풍경이 펼쳐집니다. 의외로, 유타는 야경도 이쁩니다. 학교 병원쪽에 가시면 야경스팟이 있는데, 여기서 시내를 보면 별을 흩뿌려놓은것과 같은 풍경을 보실 수 있습니다.유타는 자연을 좋아하시는 분들이 가시면 좋을 것 같아요. 저는 그런 부분에서는 상당히 힐링을 하고 왔던 것 같습니다. 수업의 질도 괜찮고, 교수님들도 열정과 자부심이 넘치십니다. 다만 술먹기에는 약간 불편하고 주법 자체가 보수적이다 보니 이런 부분은 조금 아쉬운 점이 있었습니다. 감안하시고 자연과 함께 요양하시고 싶으신 분들에게는 강력 추천드립니다.코로나로 일찍 귀국을 하게 됐는데, UofU는 이런 부분에서의 대처가 매우 신속했던 것 같습니다. 확진자가 그 큰 주에 한명밖에 안나왔음에도 불구하고 주지사는 비상사태를 선포하고 학교는 전면 온라인 수업으로 전환했습니다. 이후 학교에서도 확진자가 나오자, 바로 기숙사비 환불을 가능하게 해주고 퇴사를 권장할 정도로 빠르게 대처를 잘한편이었습니다. 교수님들도 온라인 전환 이후에도 모범적이고 학생들을 생각해주는 강의 운영을 하셔서 감사했습니다."
"University of Utah는 Salt Lake City, Utah에 위치한 학교입니다. 동계 올림픽이나 몰몬교로 잘 알려져 있습니다. 어느 정도 편의 시설은 잘 갖추고 있으며 산과 호수에 인접한 매우 평화로운 도시입니다. 학생들의 취미도 여름에는 캠핑과 하이킹, 겨울에는 스키가 대다수입니다.제가 도착한 8월에는 온도는 높으나 건조해서 불쾌하지 않았습니다. 대체로 날씨는 맑았는데, 가끔 비가 옵니다. 보통 우산은 거의 쓰지 않더군요. 10월쯤에 첫 눈이 왔고 돌아올 때까지 눈을 실컷 보고 왔습니다. 2-3월까지도 눈이 늘 길에 쌓일 정도로 온다고 합니다.학교가 넓습니다. 학교 끝에 있는 기숙사(Shoreline)부터 OT 등 많은 행사가 열리는 Union까지 걸어 다녀와도 가볍게 1만 보를 채울 수 있습니다. 기숙사에 사는 학생들은 대부분 Orange, Red, Blue line의 셔틀을 타고 다니게 됩니다. Live-tracker(?) 등의 앱을 사용하면 언제 도착하는 지 알 수 있습니다.","유타대의 학생은 학생증으로 모든 대중교통을 무료로 이용할 수 있습니다. 보통 Red line trax를 많이 타게 되는데, 이 라인은 학생들이 많이 이용해 카드 검사를 잘 하지 않지만 다른 line을 탈 때는 학생증을 꼭 찍도록 합시다. 공항도 trax를 이용하여 갈 수 있습니다! 기억에 남는 곳 위주로 정리해보겠습니다.<마트>Smith’s: 가장 자주 가는 마트. 기본적인 생활용품, 공업품, 식료품 등 어지간한 것은 여기서 구매 가능합니다. 캠핑 갈 때 rain jacket을 여기서 저렴하게 구매했습니다.Trader Joe’s: Whole Food 저렴이 버전 느낌. 건강한 느낌의 식료품점입니다. 과자와 냉동식품류가 맛있는 것이 많습니다. 오렌지 치킨이나 LA갈비 등이 유명하고, 개인적으로는 냉동 티라미수 추천Winco: 약간 더 떨어져 있지만, bulky food라고 해서 조미료, 파스타면, 시리얼 등을 작은 단위로 살 수 있어서 좋습니다. 소금, 설탕, 후추, 시나몬 따위의 재료를 아주 조금씩 살 때 유용합니다. 가격도 smith’s보다 더 저렴. Credit card 안되고 debit과 현금은 가능했습니다.Costco: 저는 영양제 살 때 한 번 밖에 못 갔지만, 미국에서 가장 큰 코스트코라고 합니다. 카드가 있는 친구가 있다면 한 번쯤?China town market: 대부분의 아시안 음식을 살 수 있습니다. 서울마켓: china town 옆에 있는 작은 한국 식품점입니다. 사장님이 친절하시고 반찬류를 팝니다.Oriental market (closed): 학교 근처에 있었으나 닫았다고 들었습니다.<몰/아울렛>City creek: 깔끔하고 예쁩니다. 디즈니 스토어, 치즈케이크팩토리, 백화점 등이 있습니다.Fashion place: 약간 떨어져 있지만 크릭에 없는 매장들이 있어서 갔습니다.Park city outlet: 차 타고 가야함. 블랙 프라이데이에 이 곳을 갔습니다! 고가의 브랜드는 없지만 제법 다양한 브랜드가 있습니다.The Gateway: 영화관이 있습니다. 시티크릭이 생긴 이후 망해가는 것 같다고 합니다. 영화관에 따라 가격이 매우 다른데, Cinemark에서는 매주 화요일에 저렴하게 보는 프로모션이 있습니다!<식당>Ruby river: 다운타운에 있는 스테이크하우스로, 합리적인 가격에 괜찮은 스테이크를 먹을 수 있습니다. 영수증을 가져가면 다음에 에피타이저 메뉴를 주는데, 양이 늘 많아서 먹어보지는 못했습니다. 맛있습니다.Gourmandise Bakery: 작고 예쁜 디저트류를 파는 카페입니다. 가격은 조금 높은 편.Pho33: 정말정말 맛있는 쌀국수 가게입니다.Cafe zupas: 제 최애 프랜차이즈 가게입니다. 샌드위치, 스프, 샐러드 등 브런치 메뉴를 판매합니다. 후식으로 초코디핑 딸기를 줍니다.Tea bar: 슈거하우스에 있는 버블티 가게. 쿵푸티보다 조금 더 비싸고 맛있습니다.<가볼만한 곳>Capitol Building: 낮에도 밤에도 예쁩니다. 안에 들어갈 수 있습니다. 다만 올라가는 길이 상당히가파릅니다.Temple Square: 몰몬교의 성지. 주말에는 예배가 열리면 파이프 오르간? 연주를 한다고 합니다.Red Butte Garden: 학교 뒤에 있는 정원으로 학생에게는 무료 개방입니다. 제법 예쁘고 가끔 공연을 해서 시끄럽습니다.National History Museum of Utah, UMFA, The Leonardo Museum: 가볼만한 미술관입니다. Leonardo를 제외하고는 학생에게 무료입니다.The living room trail, Donut fall trail, Ensign trail, silver lake trail: 제가 가봤거나 추천받은 하이킹 트레일로 매우 쉬운 코스라고 합니다. Sugar house: 예쁜 서점이 있고, 거리가 깔끔하고 예쁩니다. 매우 큰 공원이 있습니다. 좋아했던 동네입니다.Park city: 스키 리조트가 많아서 예쁘고 비싼 레스토랑이 많습니다. 거리도 예뻐서 구경갈 만 합니다. 동계올림픽때 사용했던 경기장에서 여러 액티비티를 즐길 수 있다고도 들었습니다.Indoor shooting place: 진짜 저격소총으로 사격을 해볼 수 있는 곳들이 여럿 있습니다! 총 하나를 2인이 50발 쏘는 것으로 기억하는데 대략 7-80불의 가격이었습니다. 사격 종이를 기념으로 가져갈 수 있습니다. 재밌는 경험이었습니다. 개인 총을 들고 와서 사격연습을 하는 사람들이 있어 신기했습니다.","저는 Shoreline Ridge 3인 1실로 배정되었습니다. 부엌과 거실, 화장실을 쉐어하고 개인 방이 있는 형태입니다. 세탁실은 각 층에 있고, 세제와 섬유유연제는 개인이 구비합니다. 저는 부엌이 있어서 meal plan을 신청하지 않았습니다. 요리를 하신다면 생각보다 fire alarm sensor가 매우 예민하니 환기에 신경을 쓰시기를 바랍니다. 굉장히 요란합니다.밀플랜을 신청하신다면 뷔페 형태로 Heritage center에서 제공됩니다. Heritage Center에서 우체물을 찾을 수 있고, 청소기 대여가 가능합니다. 피아노실 안무실도 대여 가능하다고 들었습니다. 방 열쇠나 학생증을 두고 나왔을 때도 찾아가면 됩니다. 열쇠를 사용해서 개인적으로 불편했습니다.","저는 경제학 전공 2개와 듣고싶었던 수업 하나, 운동 강의 두개와 캠핑 수업을 들었습니다. 경제학과 건물이 신식이라 매우 좋았고, 운동 강의도 다양하게 열립니다.Labor Economics (3) 온라인 강의 형태였습니다. 퀴즈가 매우 많아서 귀찮았지만 강제로라도 성실하게 공부할 수 있었습니다.Poverty & Inequality (3) 중간 전까지는 피케티의 21세기 자본을 읽고, 중간 이후로는 논문들을 사용합니다. 교재를 사지 않아도 되서 신청을 했었는데, 개인적으로 읽을 텍스트가 너무 많아서 힘들었습니다. Intro to animation (4) 수업시간에는 개인 태블릿이 제공되고, 수업 시간 이외에는 도서관에서 빌릴 수 있습니다. 다만 24시간 대여 가능이라 상당히 번거롭습니다. 수업시간에는 어도비 애니메이터, 포토샵, 프리미어, 애프터이펙트를 아주 겉핥기식으로 빠르게 배웁니다. 과제량이 많지만 재밌었습니다. 컴퓨터 드로잉이나 툴이 익숙하신 분이면 편하지만, intro 과목이라 다들 못해서 괜찮습니다. 다들 잘 도와줍니다.Camping & Cooking (2) 한 학기에 오리엔테이션 한 번과 2박3일 캠핑을 다녀오면 2학점을 줍니다! 발표를 한 번 하지만 쉬운 수준입니다. (제 발표 주제는 캠핑에서 곰을 만났을 때 였습니다.) Antelope Island에 가서 Great Salt lake를 보고 별도 보고 바이슨도 보는 특별한 경험을 했지만, 날씨 탓에 다소 고생스러웠습니다. 캠핑 수업 중 화장실도 있고 하이킹도 짧은 가장 가벼운 수업이라고 하니 잘 생각해보고 수강을 결정하시면 좋을 것 같습니다.Zumba (2), Self defense (1) 가벼운 운동 수업입니다. 태블릿을 24시간마다 연장해야 해서 도서관에 꽤 자주 가야 했습니다. 도서관에서는 충전기, 노트북, 태블릿, 카메라, 삼각대 등 다양한 것을 대여해주고, 시설도 나쁘지 않습니다. 음식 반입이 매우 자유롭고 대화하는 분위기이니 조용한 공부공간을 원하시는 분들은 quiet zone을 따로 찾아가시는 것이 좋습니다.","학기 시작 전 OT를 진행하고, 학기 중 여러 번 교환학생들끼리 만날 수 있는 행사를 주최합니다. 자주 찾아가진 않았지만 문의사항이 있으면 친절하게 답변을 해주려 합니다.","Student life center에서 다양한 운동 프로그램을 저렴한 가격에 할 수 있습니다. 강사들이 학생이라 전문성을 기대하기는 어렵지만, 저는 Barre 수업을 수강했고 만족스러웠습니다. 이외에도무료 실내 암벽등반 클래스나 캠핑, 하이킹 등의 클래스를 진행합니다.운동 경기: 학교에서 다양한 운동 경기를 합니다! 시즌마다 다른 경기를 하니 일정을 잘 확인해 보시고 많이 구경 가시길 바랍니다. 모든 경기의 표는 학생에게는 무료이고, 풋볼이 아닌 종목의 경우 선착순으로 티셔츠를 주는 등의 이벤트를 자주 합니다. Uofu student ticket 페이지에서 신청 후 → Fast seat 어플로 표를 보여주면 됩니다.학교 공연: 학교에서 학생들이 하는 다양한 공연을 무료로 볼 수 있습니다. 저는 Ballet공연과 Musical을 봤는데, 학생들이 하는 공연이라 생각하니 신기했습니다. 동아리: 유타대에서는 동아리가 활발하지 않은 편입니다. 동아리 검색 페이지가 있으나, 활동중이지 않은 동아리가 많으니 잘 찾아서 연락해보시길 바랍니다. (https://utah.campuslabs.com/engage/)저는 매주 월요일 international끼리 저녁을 먹고 성경공부를 하는 기독교 모임에 참여했는데, 여기서 다양한 친구들과 친해질 수 있었습니다. 같이 하이킹을 가고 놀러도 다녔습니다. 몰몬교가 아니고 기독교 모임이니 관심있으신 분은 연락해보시길 바랍니다. 영어 회화/문화 수업도 진행하는 것으로 알고 있습니다. (인스타 @ismuofu)Lassonde studio: 특별한 기숙사 건물입니다. 1층에 학생들을 위한 공간이 있는데, 거주자가 아니어도 프린트와 커피를 무료로 받을 수 있습니다. 여기 푸드트럭에서 파는 아사이볼이 맛있어서 저는 이곳에서 자주 공부했습니다.Bennion Center: 봉사활동을 주관하는 센터입니다. 인기 봉사활동은 빨리 마감이 된다고 합니다.이 외에도 다양한 학생들 대상의 무료 나눔 행사가 많습니다! 대부분 인스타그램을 통해 홍보하는 편이니, 여러 계정들을 팔로우해 소식을 받아보시길 바랍니다. 인상깊었던 행사로는 다같이 영화관을 빌려서 Frozen2를 본 일과, 어린이 병동에 편지를 쓰면서 피자를 먹는 행사 등이 있었습니다. Pie pizzeria의 vegetarian pizza가 그립네요.",특별히 없었습니다. 오히려 생각보다 보수적이고 순수해서 놀랐습니다.,"대부분 문제가 생기면 국제처에 연락을 했습니다. 교내 한인회가 있으나, 교류를 한 일은 없었습니다.",인턴을 하면서 한 학기 더 체류하는(학기인정X 학점인정O) AT 프로그램이 있습니다. 저는 여러 고민 끝에 하지 않기로 결정했습니다만 생각이 있으시다면 상담을 친절하게 해주니 연락을 해 보길 바랍니다. 	공항도 가깝고 버스도 생각보다 탈 만 하니 학기중에도 학기 후에도 여행 많이 다니시고 즐거운 교환생활 되길 바라겠습니다.
