gen_info,env_info,food_info,study_info,office_info,facil_info,mhct_info,help_info,etc_info
"Hobart and William Smith College는 뉴욕주 제네바시에 위치한 작은 규모의 학교입니다. Geneva에 위치하고 있다고 하면 다들 스위스의 Geneva와 착각을 하시는 경우가 많은데요, Geneva는 New York State 안에 있는 작은 시입니다. New York City와는 차로 6시간 정도 거리라고 들었구요, Canada의 Toronto와도 인접해있는 곳입니다. 마음만 먹으면 Toronto와 NYC를 동시에 여행하고 올 수 있는 아주 좋은 지역이지요. 교환을 떠나기 전에 Geneva가 눈이 많이 오는 지역이라고 들어서 상당히 겁을 먹고 갔습니다. 게다가 학교 근처에 호수가 크게 자리잡고 있는지라 더욱더 걱정이 되었죠. 하지만, 제가 다녀온 가을학기 동안은 너무 춥지도 않고 너무 덥지도 않은 아주 평온한 날씨 속에서 아무탈 없이 잘 지내다가 왔습니다. 다만, 도중에 태풍 샌디가 크게 등장하는 바람에 몇일간 조금 고생을 한 적이 있었긴 했죠. 그러나 큰 피해는 없었습니다. 한 2~3시간정도 정전이 일어나는 것 외에3는 생활에 지장이 없었습니다.

간단하게 기후에 대해서 설명을 해드리자면, 8월 한달간은 따뜻합니다. 한국에서 처럼 찜통 더위는 없었습니다. 에어컨 시설이 잘 구비되어 있는지라 더위 때문에 힘들어했던 기억이 전혀 없습니다. 밤이 되면 약간 싸늘해지는지라 얇은 가디건 같은 것도 항상 챙겨 입어야 했습니다. 9월에서 10월까지도 따뜻한 날씨였던것 같습니다. 반팔에 가디건을 걸치고 다니면 딱 좋은 가을 날씨였습니다. 10월 중순부터 해서 슬슬 날이 싸늘해지기 시작하고 11월이 되자 눈이 살살 내리기 시작했습니다. 눈이 쌓일 정도로 심각하게 온 적은 없었습니다. 한국처럼 강추위도 없었구요. 저같은 경우 옷은 여름옷과 겨울옷만 챙겨가고 겉옷은 하나도 챙겨가지 않았습니다. 학교에서 운전해서 2시간정도 거리에 떨어진 Eastview Mall에 가서 70%세일한 가격으로 아주 좋은 겨울 자켓을 하나 샀습니다. 니트에 그 자켓 하나면 추위는 물러가라였죠. 겨울옷과 겉옷까지 챙겨가면 두께로 인해 짐이 많아지고 무거워지니깐 되도록이면 미국에서 겉옷을 사세요:) 아무튼, 가을학기에 다녀오실 것이면 날씨 걱정을 크게 안하셔도 될 것 같습니다.

Hobart and William Smith College 이야기로 다시 돌아가자면, 이름에서 예측하실 수 있다시피 두 개의 학교가 하나로 합쳐진 College입니다. 남학생들은 Hobart College에 소속되어있고, 여학생들은 William Smith College에 소속되어있습니다. 소속만 그렇게 되어 있을 뿐이지, 수업이나 행사같은 것은 다 같이 활동을 합니다. 몇몇 전통 행사 같은 것들은 Hobart와 William Smith가 나뉘어서 활동을 하기도 하구요. 가을학기에 파견을 나가면 좋은 점이, 한국과는 달리 미국은 한 해의 시작이 가을학기인지라 다양하나 행사들을 접할 수 있다는 것입니다. 특히나, 새로 입학하는 신입생들과 어울릴 수 있는 행사에도 참여할 수 있고 (예를 들어 신입생 오리엔테이션), international student orientation에서 교환학생 친구들 뿐 만 아니라 갓 입학한 국제학생들과도 교류를 할 수 있어서 정말로 좋습니다. 저는 international student orientation에서 사귄 친구들과 정말 한 학기 동안 좋은 추억을 많이 만들었습니다. 한 학기를 지내면서 가을학기를 택하길 정말 잘했다고 생각이 들더군요. 
학생들은 백인 학생들이 상당히 많습니다. 다양한 인종의 학생들이 있구요. 그 중 아시아 학생들도 있는데, 그렇게 많이 있는 것은 아닙니다. 한국인 학생들도 몇 있지만, 손에 꼽힐 정도 입니다. 이러한 점이 제가 HWS College를 선택한 이유이기도 합니다. 한 학기라는 짧은 기간에 정말 새로운 환경에서 새로운 도전을 해보고 싶고 영어 또한 최대한 많이 사용하고 미국 문화도 배워보고 싶은 마음에 택했는데, 정말 딱이었습니다. 한 학기 동안 한국말은 가족과 통화할 때 외에는 사용할 일이 없습니다. 같이 다니는 친구도 한국인이 아니었기에 영어를 사용할 수 밖에 없구요. 하우스메이트들 또한 모두 미국인이었기 때문에 4달동안 영어만 신나게 사용하고 왔습니다. 

짧은 시간에 정말 다양하고 새로운 경험을 하시고 싶으신 분이라면 Hobart and William Smith College를 망설임 없이 추천하고 싶습니다!","HWS College의 환경은 연세대와 정 반대라고 생각을 하시면 됩니다. 한적한 시골마을에 위치한 작은 학교라고 보시면 됩니다. 그래서 아침에 일어나면 상쾌한 공기를 마실 수 있고, 밤이 되면 별로 가득찬 밤하늘을 볼 수도 있습니다. 한 학기 HWS College에서 생활을 하다 보시면 몸이 Healing이 되는 느낌을 받으실 것입니다. 게다가 야생동물들도 때론 (아주 가끔) 학교로 출몰을 하기 때문에 잊지 못할 추억을 만드실 수도 있습니다. 정확한 이름은 모르지만 갈매기를 닮은 새들이 항상 떼를 지어 운동장에서 여유를 즐기고 있구요, 다람쥐들이 캠퍼스 안에서 정말 이곳 저곳 있습니다. 짧은 에피소드가 있다면, 아침에 등교를 하다가 귀여운 다람쥐들이 너무 신기해서 폰으로 촬영을 하다 게단에서 굴러 떨어지는 바람에 무릎이 다 까져버렸다는... 여러분들 조심하세요... 하하^^

학교에서 한 10분정도 걸어가면 Downtown이 나옵니다. 시내라고 하기엔 조금 민망한 시내에요.. 규모도 작고 가게도 그렇게 많지 않은 아주 아담한 시내입니다. 참, 저같은 경우 교환을 가기 전에 치안 때문에 상당히 걱정을 했었는데요 (여자인지라..) 그렇게 걱정은 안하셔도 될 것 같습니다. 혼자 걸어다녀도 괜찮구요, 다만 저녁이후에는 꼭 동행인과 함께 다니셔야 한다는 점만 조심하면 될 것 같습니다.  Downtown에서 기억에 남는 가게들을 몇 가지 소개를 해드리자면, ""Opus""라는 카페가 있는데 다양한 디저트류, 식사류(브리또, 샌드위치, 토스트 등), 커피류, 스무디 등을 파는 곳입니다. 여기 커피가 저렴하고 맛있어요! 또, ""Finger Lakes Gift Lounge""라는 곳인데 이 곳은 Gift Shop과 카페를 동시에 하는 곳입니다. 간단한 식사와 음료를 살 수 있는 곳입니다. 친구들과 10월 즈음에 가서 행사하고 있는 세트메뉴를 시켰는데, 7달러를 지불하고서 샌드위치(엄청 큰...! 미국은 다 엄청 크고 많고 그렇더라구요..!)와 커피와 아이스크림을 먹었습니다. 아직도 잊을 수 없네요. Pumpkin Spice Icecream! 또, 식당들도 여럿 있는데, 중식당 ""Main Moon""과 ""Wing Tai""가 있습니다. Wing Tai에서는 버블티도 팔아요. 그런데 비싸기만 하고 맛이 없으므로 비추..입니다.. 둘다 음식맛은 그럭저럭한데, 중식이 그립다면 저렴한 가격에 그냥 사먹어 볼 수 있는 (사실...먹어줄 수 있는...) 그런 음식점들입니다. 피자집들도 엄청 많습니다. Mark''s Pizzeria나 Cam''s Pizzeria 등.. 물론 배달 가능합니다! 제가 정말 맛있게 먹었던 식당들은, 하우스 메이트들과 함께 간 Eddie O'' Brien''s와 Parker''s Grill & Tap House입니다. 햄버거, 스테이크, 샌드위치, 샐러드 등 양식을 파는 곳인데요, 여기서 사이드 메뉴로 나오는 고구마 튀김 (Sweet Potato Fries)이 정말로 맛있습니다! 감자튀김은 한국에서 흔히 드실 수 있으니, 꼭 고구마 튀김을 드셔보시길 바래요! 그리고 마지막으로 학교에서 유일했던 한국인 선생님 Professor Lee 께서 맛있는 저녁을 사주셨던 ""The Beef & Brew"" 강추입니다. 가격이 좀 비싸다는게 흠이지만 한 번 쯤은 가보실 만한 곳입니다. 하우스메이트가 미국에 왔으면 꼭 먹어봐야 한다는 음식인 Chicken Alfredo를 여기서 먹었거든요:) 정말 맛있습니다! 어쩌다 보니 식당들만 주구장창 소개를 해드렸네요;; 예쁜 가게들 두 개만 더 알려드리자면, 수제 초콜릿 가게 ""Whisper Chocolate""과 수제 화장품 가게 ""Zotos""를 꼭 한 번 방문해보시라고 말씀드리고 싶네요:) 저는 귀국하기 전에 Geneva의 추억을 가족에게 선물하기 위해 이 두 가게에서 선물을 사가지고 왔습니다. 

Downtown외에도 학교의 뒤쪽으로 나가시면 (Odell''s Village 쪽) 5분 정도 거리에 큰 대형마트 ""Wegmans""가 자리잡고 있습니다. 요리를 하시거나 간식거리를 사실 경우 이 곳에서 장을 보시면 됩니다. 저는 Odell''s Village에 살아서 Wegmans가 참 가까웠습니다. 장보기도 편했구요. 아침 6시에서 밤 12시까지 영업이었던 것 같습니다. 가격대는 적당하다고 생각을 했는데, 주변 친구들에게 물어보니 좀 비싼 편이라고 하더라구요. 그래도 과일이나 채소, 고기 등이 좋아보이고 신선해보여서 믿고 구매를 할 수 있었던 것 같습니다. 참! Wegmans Card를 만드시면 할인을 받으실 수 있으니깐, 꼭 만드시구요. 전 나중에 알아서 거의 돌아오기 전에 할인 혜택 몇 번 받았습니다.. 슬프게도.. 한국에서는 비싼 애플망고가 Wegmans에서는 3개에 5달러밖에 안합니다. 전 그래서 신나게 매주 사먹었지요.. 12월경에 Wegmans 건너편에 새로 마트가 생겼는데, 이름은 잘 기억이 안나지만.. 제가 한 번 이용해 봤거든요.. 가격은 조금 더 저렴한 것 같은데 물건들의 품질 면에서는 Wegmans가 훨씬 신선하고 좋은 것 같습니다. Wegmans가 더 가깝기도 하구요! Wegmans 근처에 식당들도 여럿 있습니다. Joe''s Hot이라는 핫도그를 파는 가게가 있는데 아주 저렴하고 학생들 사이에서 인기도 많습니다! 그 옆에 Leaf Kitchen이라는 식당도 있는데 가보지는 않았지만 꽤나 맛있다고 소문을 들었습니다. Pub도 그 옆에 있는데 가보지 못했습니다. Wegmans 건너편에는 쭉~ 작은 mall이 형성되어 있는데요, 이 곳에는 Payless Shoe Store라는 신발가게가 있습니다. 아주 저렴한 가격에 신발을 살 수가 있어요! 저는 이곳에서 운동화랑 털신발을 사서 신었습니다. 한 6달러에서 8달라정도 지불하면 편한 신발 사서 신을 수 있어요^^ Payless Shoe Store 옆에는 네일샵도 있고 (가보진 않았지만... 우리나라 네일샵이 훨씬 산 것 같더라구요) 영화관도 있습니다! 영화 한편에 5달러밖에 안해요! 근데 시설은 그냥.. 우리나라의 CGV를 생각하시면 절대 아니됩니다. 그래도 싼 가격에 영화 한 편 편하게 보기엔 아주 좋은 곳이지요! Mexican Restaurant 도 하나 있는데, 가보진 못했지만, 상당히 맛있다고 들었습니다. 그리고 Peebles라는 큰 매장이 있는데, 옷이랑 화장품을 파는 곳입니다! Estee Lauder랑 Clinique등이 입점해 있어요. 옷은 꽤나 저렴해요^^ 하지만 미국인 체형이 한국인 체형과 워낙 다른지라 원하는 옷 스타일은 없는 것 같더라구요. 그래도 한번쯤은 Window Shopping 해 볼 만한 곳이랍니다! 마지막으로 Staples라는 대형 문구점을 소개해드릴께요! 대부분 학교 내의 College Store에서 학용품 구매가 가능한데, 이 Staples가 행사하는 문구류도 많고 제품 종류도 다양해서 이 곳에서 구매를 하시라고 추천을 해드리고 싶네요. 구경하는 재미도 쏠쏠하구요! 

걸어가기엔 다소 먼 거리지만, 차로 5분정도 운전해서 쭉 나가다보면 24시간 영업하는 Walmart가 있습니다. 처음에 학교에 도착 했을 때 장은 Walmart에서 봤습니다. 학교에서 셔틀을 제공해 주어서 갔구요. 평소에는 차가 있는 친구들에게 기름값을 내주겠다면서 운전해달라고 하면 흔쾌히 드라이브를 허락해줍니다! 그런데 저는 다른 사람에게 부탁을 하는 것을 잘 못하는지라.. 제가 운전을 했습니다! Zipcar로요!
*Zipcar: 시간당 7~8불정도를 지불하고 학교 주차장에 주차되어 있는 Zipcar를 이용하는 것입니다. 이 차를 이용하는 방법은 ""운전면허증사본(국제운전면허증 굳이 없어도 됩니다!), 영문운전경력서(이건 경찰서에 가서 떼달라고 하면 됩니다! 저같은 경우, 미국에 도착하고 나서 Zipcar발급 법을 아는 바람에 어머니께서 저를 대신해서 경력서를 떼다가 이메일로 스캔본을 보내주셨습니다^^ 출국 전 미리 구비해가세요!)"" 이렇게 두 서류를 Zipcar 회사에 제출을 하시면 몇 일 뒤 Mailbox로 Zipcard를 보내줍니다! 그걸로 찍고 운전하고 다시 돌아와서 찍으면 자동으로 결제가 됩니다! 입력한 신용카드로요! 
Walgreens랑 Dollar Tree라는 가게들도 있는데, 음.... 화장품을 좋아하는 분들이라면 Walgreens는 가보시라고 추천해드리고 싶네요!! 

운전해서 1~2시간 나가시면 더욱 다양한 곳을 돌아다니실 수가 있어요! 저는 Zipcar 하루 빌려서 친구들이랑 같이 Rochester 근처에 있는 Eastview Mall을 다녀왔습니다! 아주 큰 Mall인데 다양한 가게가 있어서 쇼핑하기가 아주아주아주아주 좋습니다! 

Zipcar가 다소 비싼 감이 없진 않지만, 그래도 학교 주변을 제대로 다녀보시려면 이용하시라고 추천을 해드리고 싶습니다! 아님, 차가 있는 친구를 아주아주 친한 친구를 삼으셔야되용! :) 저와 같이 다녔던 친구들은 모두 차가 없어가지고.. 애를 먹었지요^^;;","Hobart and Williams College는 (특별한 사정이 없을 시) 전원 기숙사 생활을 해야만 합니다. 기숙사비가 좀 부담이 된다는 단점이 있긴 하지만, 처음으로 하는 기숙사 생활이었는데 아주 황홀한 기숙사 생활을 했습니다! 저는 가장 경쟁률이 높고 가장 많은 학생들이 살고 싶어하는 Odell''s Village에 거주를 했습니다. Odell''s Village는 Odell''s Pond에 작은 집들이 여럿 둘러 쌓여있는 아주아주 작은 마을이라고 보시면 됩니다. 기숙사의 개념하고는 약간 달라요. 3,4학년들만 거주를 할 수 있구요. 한 집에 (주택이라고 보시면 되요) 4명이 거주를 하는 형태입니다. 몇 집은 6명도 산다고 하더라구요. 같은 성별끼리 살기도 하고 남녀 섞여서 사는 경우도 있습니다. 제가 살았던 집은 17호구요:) 저를 포함해서 총 4명 살았습니다. 각자 방이 있구요 (이 점이 정말 너무너무너무너무 좋았습니다!). 집이 2층으로 되어있는데, 1층에 거실, 부엌, 화장실, 방 하나 (이 방이 제 방이었습니다!). 2층에 방 세개, 화장실. 정확하진 않지만, 이상하게 교환학생들은 전부 1층 방을 배정받았더라구요. 화장실을 독점할 수 있다는 이점이 있기는 하지만, 파티문화를 즐기는 하우스메이트를 둔 탓에 새벽 2시까지 엄청난 소음을 감당해야 했다는 점이 다소 힘들기는 했습니다. 그래도, Fitness Center가 있는 Bristol Field house가 집이랑 아주 가까이 있다는 점과 Wegmans가 걸어서 5분거리라는 점을 생각하면 여러모로 참 좋았던 것 같습니다. 세탁시설도 Odell''s는 잘 구비되어 있어서 세탁기를 사용해야되서 기다리고 불편하고 이런 점은 전혀 없었습니다. 집 5개마다 Laundry 1개가 있었던 것 같습니다. Laundry는 세탁기랑 건조기가 있구요, 세탁기 1회 1.25불, 건조기 1회 1.25불 즉, 1회 세탁하는데 총 2.5불을 사용해야 합니다. 세제는 본인 것 쓰셔야하구요. 

Odell''s 방을 조금 더 설명드리자면, Wardrobe 하나랑 책걸상, 침대 이렇게 있습니다. 침대시트와 이불은 국제처에서 빌려주므로 안 가져가셔도 됩니다. 다만, 10월 중순 이후로는 날씨가 추워지므로, 국제처에 이불은 하나 더 얻어서 덮으셔야 할 것 입니다. 사실 이불이라고 하기도 뭐한데요, 그냥 겨울 담요라고 생각하시면 됩니다. 히터는 집에서 조절이 가능하구요, 1층에 있는 온도조절기로 조절을 하시면 됩니다. 에어컨은 없어요! 근데 안 더워요~ 다른 하우스메이트들은 더운지 다들 Fan을 하나씩 방에 설치를 했더라구요. 한국의 더위에 비하면 아무것도 아닌데.. 

Odell''s에는 부엌이 있다는 점이 또다른 장점입니다. 언제든지 요리가 가능하다는 것이지요. 식기구는 하우스메이트들이 거의 구비를 해줬습니다. 저는 후라이팬 하나랑 칼, 통 등 소량만 구매를 했구요. 하우스메이트들이 다 배려를 해주더라구요, 교환학생이니깐:) 착한 하우스메이트들 덕분에 정말 편히 생활하다가 왔습니다. 가스렌지가 아니고 전기렌지(?)가 있습니다. 전기오븐도 있구요. 하우스메이트들이 가져와서 전자렌지, 토스트기, 그릴 등 모든 것이 있었습니다. 냉장고는 당연히 구비되어 있구요! 여기서 중요한게 어떤 Meal Plan을 선택하느냐인데, 저는 Basic Meal Plan을 택했습니다. 
*Meal Plan: Gold, Silver, Basic, 100, 45 이렇게 있습니다. 
제가 택한 Basic은 일주일에 15번 SAGA(학교 식당 이름)에서 식사를 할 수 있는 식사권과 100달러 Snack Money(학교 매점들에서 사용할 수 있는 Money! 다 사용하시면 충전도 가능합니다! 전 커피를 즐겨 사마셔서 충전을 3번이나 더 했지요... 학교 커피 정말 맛있어요!!!)와 3번의 Guest Pass(저는 Guest가 당연히 있을리가 없죠. 그래서 식사권 다 떨어진 친구를 위해서 썼었지요^^)가 있습니다. Odells에서 차는 친구들을 보면 대체로 45나 100 Meal Plan을 하던데, 저는 일일이 요리 해먹기가 귀찮아서 Basic으로 했습니다. Basic이면 충분합니다! 특히나 전 SAGA 아침 메뉴를 정말 좋아했는데, 스크램블 에그랑 슬라이스 감자가 너무너무 맛있더라구요. 매일 똑같아도 매일 맛있었어요^^ 참, 미국에서 생활하시면서 살이 쪄서 한국으로 돌아올까봐 많이들 걱정을 하실텐데 (저 또한 이 걱정 엄청 했구요), 먹는 것 관리하고 많이 걷고 (캠퍼스 전체 걸어다니다 보면 은근 운동되요!) Bristol Field House 틈틈이 다니면서 운동하고 하면 적어도 살이 찌지는 않습니다! SAGA의 다양한 코너 중 저는 채식주의자를 위한 코너를 주로 이용했습니다. 사실 이 곳도 고기만 없을 뿐이지 모든 음식이 기름지고 치즈 범벅인지라.. 그래도 SAGA 음식들 먹을만 해요! Cellar Pub라는 작은 Pub도 교내에 위치하고 있는데, 이 곳에서 Snack Money로 음식을 살 수 있어요! Starbucks도 학교 안에 있구요^^ 
참! 고추장 하나 쯤은 챙겨가세요! 왠만한 식재료는 Wegmans에서 구매를 할 수 있으니, 고추장만 있으면 이것 저것 한국요리 하실 수 있을 거에요^^ 저는 제육볶음, 떡볶이, 고추장수제비, 고추장볶음밥, 불고기 (불고기 소스 팔아요! 단 한국에서 흔한 불고기용 고기가 없는게 문제지만요... ㅠ_ㅠ 삼겹살도 없어용...) 해먹었어요!","저는 4개의 수업과 1개 청강 그리고 1개 체육수업 이렇게 총 6과목을 들었어요! 제가 들었던 수업은 전부 소규모라서 연세대에서 들었던 강의와는 전혀다른 방식의 수업을 들을 수 있어서 정말 뜻깊은 경험이었어요. 특히나, 교수님과 수업시간 동안 활발하게 교류를 할 수 있어서 정말 좋았구요! 제가 들었던 과목들 간단하게 소개를 해드릴께요^^

1. English Second Language (1000단위 수업) : Professor Alexander Janney
흔하게들 ESL로 알고 계신 수업입니다. 영어영문학과 전공 수업으론 영어글쓰기(1) 정도에 해당이 되겠네요. 이 수업은 국제학생들만 들을 수 있습니다. 제가 들었을 땐 15명정도 규모에 반은 중국인, 한국인 2명, 대만인 2명, 독일인 1명, 스위스인 1명 이었습니다. 주로 중국인 친구들이 많이 수강하는 것 같습니다. ""글쓰기"" 수업이다시피 글을 끊임없이 씁니다. 매일 매일 과제가 있구요. 그런데 글 주제들도 재미있고 다양해서 부담없이 쓸 수 있는 에세이들이었습니다. 학술적인 에세이들을 다루는 것이 아니라서 과제량이 많아도 스트레스를 받으면서 과제를 했던 기억은 전혀 없습니다. 예를 들어, 학교 운동 경기를 보고서 그것에 관한 에세이를 쓴다든지 Geneva에 있는 레스토랑을 방문하고서 Restaurant Review를 쓴다든지 모두 흥미로운 주제들만 있었습니다. 다양한 국적의 학생들로 구성된 수업인지라 다양한 의견, 다양한 시각을 들을 수 있다는 이점이 있죠. 특히나 Professor Janney는 국제학생들의 마음을 진심으로 생각해주시고 그리고 모든 에세이를 아주 자세히 코멘트해주시고 언제든지 발벗고 도와주시려고 하는 정말 친절하고 존경스러운 교수님이십니다. 난이도가 높지 않은 수업을 듣고 싶고 좋은 교수님과 인연을 맺고 싶어하신다면 이 수업 정말 강추입니다.

2. Talk & Text (1): Discourse Analysis (2000단위 수업) : Professor Neeta Bashin
영어영문학과 전공 수업입니다! 우리 학교 전공 과목 중 ""영어담화분석"" 일 것입니다. 교수님은 인도분이신데, 그래서 인도 악센트가 상당히 강하십니다. 때론 그 인도 악센트가 약간 수업에 방해가 되기도 한데, 교수님의 말씀을 알아듣지 못하는 경우는 전혀 없었습니다. 이 교수님은 장점과 단점이 분명하게 갈리는 분이라고 생각이 듭니다. 교수님께서 정말 열성적으로 수업을 이끌어 나가시고, 학생들의 참여도 이끌려고 엄청 적극적으로 모든 학생들을 케어해주십니다. 특히나 저와 같은 교환학생에겐 특별한 케어를 해주십니다. 따로 면담을 갔을 때 매번 수업 이해도는 어떻냐 과제는 어떻냐 매번 관심을 기울여주시고 챙겨주십니다. 반면, 너무 지나치게 열성적이신 탓에 수업 도중 싸~~해지는 분위기가 생길 때도 있습니다. 학생들의 반응이 너무 없는 날에는 교수님께서 너무 열을 받으셔서 왜 참여를 안하느냐고 열변을 토하시는 경우도 있는데... 무튼 이런 단점만 빼면 정말 불타오르는 (?) 수업을 들을 수 있는 기회를 제공해주시는 열정이 넘치시는 교수님이십니다! 아참, 과제량이 정말 많습니다. 한 학기당 4개의 에세이를 작성해야하는데 한 에세이를 한 번 작성하고 끝나는게 아니라 끊임없이 수정을 해야하기 때문에 거의 10편 넘는 에세이를 쓰는 기분입니다. 이 수업 덕분에 에세이 쓰는 실력은 정말 많이 는 것 같습니다.

3. American Sign Language (1000단위 수업) : Professor Samuel Cappiello
연세대학교에는 수화 수업이 교양으로 있지만, HWS College에선 수화 수업이 영어영문학과 전공 과목입니다. 수화 또한 국가별로 다르다는 점이 참 흥미로워 ASL 수업을 수강하게 되었습니다. 제2외국어를 배우는 것이랑 다를 바가 없습니다. ASL alphabet부터 시작하여 단어 그리고 문장 순으로 차곡차곡 ASL 어휘량을 배워나갑니다. Samuel 교수님이 수업도 흥미있게 진행해주시고, 특히나 혼자 아시아인이었던 저를 많이 챙겨주시고 배려해주셔서 아무 걱정없이 수업에 참여를 할 수 있었습니다. 특히나 ASL 수업은 다양한 영상자료도 병행해가면서 수업이 진행됩니다. 수업 중에 감상했던 Deaf People과 관련된 영화 2편이 아직도 잊혀지지 않네요. 그리고 Deaf culture에 관해서도 많이 배우게 되는데, Deaf people 중에서도 ASL을 이용하여 노래를 부르고 뮤직비디오를 찍는다는 점이 정말 놀라웠습니다. 수업은 그렇게 타이트한 편은 아니지만, 그날 그날 배운 수화를 제때 외우지 않으면 수업을 따라가기 힘듭니다. 사전에 예고 없이 퀴즈를 보는 경우도 있습니다. 중간고사와 기말고사가 있고, 과제도 몇번 제출하게 됩니다. 수업시간에 본 영상물에 대한 감상문을 몇 번 제출하고, 교수님께서 제시해 준 문장을 수화로 하는 영상을 찍어서 유튜브에 올리는 과제도 있습니다. 수화를 하는 제 모습을 스스로 피드백 할 수 있어서 좋았습니다. 기말고사 기간에는 교수님과 일대일 인터뷰 면담이 있습니다. 수화로 간단한 대화를 나누는 것이었지요. 강추하고 싶은 수업입니다!

4. Adolescent Literature (3000단위 수업) : Professor Benjamin Ristow
제가 수강한 수업 중에서 가장 힘들었던 수업이었습니다. 과제량도 많고 매 수업시간마다 읽어 가야하는 독서량도 많아서 처음에 따라가기 상당히 버거웠습니다. 게다가 고급과목이어서 classmate들이 3,4학년들 위주인지라, 수업의 난이도가 자연스레 올라갈 수 밖에 없더군요.  청소년 문학 10권 정도로 수업을 진행하는데, 일주일에 1~2권 정도 분량 진도를 나갑니다. 충분히 읽고 생각을 하고 수업을 준비해가고 싶은데, 책을 읽는 속도가 느린지라 책을 다 읽는데만 해도 시간이 모자라서 수업 준비 시간이 부족했었습니다. 이 수업을 따라갈 수 있을까 걱정을 많이 했었는데, 교수님과의 일대일 면담 이후에 자신감도 좀 붙고 교수님께서 격려도 많이 해주셔서 끝까지 수업을 수강할 수 있었습니다. 처음 몇 주가 고비였던 것 같아요. 몇 주가 지나니깐 수업의 흐름도 파악이 되고, 어떻게 수업 준비를 해야되는지 감이 오더라구요. 참, 청소년 문학이라고 해서 책의 난이도가 낮을 거라고 생각을 하신다면 그건 착각입니다. 저도 당연히 해리포터나 트와일라잇류의 흥미로운 서적 위주로 수업을 진행할 줄 알고 신청을 한 것이었거든요. 그러나, 모든 책들이 심오한 주제를 청소년 혹은 아동의 시각에서 풀어나간 것들이더군요. 그래도 이 수업 덕분에 짧은 기간에 아주 다양한 책들을 많이 접할 수 있어서 좋았습니다. 기억에 남는 과제가 있다면, 창작소설을 지어오는 것입니다. 2편 가량의 소설을 지었는데, 다른 classmate과 공유를 하고 서로 피드백도 해주고 토론을 했었습니다. 제 소설에는 아무래도 한국 정서가 많이 반영이 될텐데 미국 친구들이 이해를 할 수 있을까 걱정을 많이 했었습니다. 우려했던 바와 달리 classmate들이 다들 좋은 반응을 보여주고 인상깊게 읽어주었더라구요. 수업이 끝나갈 즈음 교수님께서 많이 늘었다고 칭찬을 해주셔서 정말 너무 기뻤습니다! 참! 이 수업은 야외 활동도 진행이 됩니다. 놀이터를 짓는 봉사활동도 했고, 대형 어린이 박물관도 관람을 했습니다. 시간을 많이 투자해야 되는 수업이지만, 돌이켜보면 가장 challenging한 수업이었던 동시에 가장 많은 것을 얻었던 수업인 것 같습니다.

5. Beginner Chinese (1000단위 수업) : Professor Zhou
이 수업은 청강했던 수업입니다. 원래 청강할 생각은 없었는데, 이 수업의 teaching assistant였던 Tina와 매우 친해지는 바람에, 그녀의 꼬득임(??)에 넘어가서 수강을 하게 되었습니다. 중국어에 대한 흥미도 전혀 없고 오히려 중국어에 대한 반감을 많이 가졌었는데, 이 수업을 수강하고 나서는 중국어를 사랑하게(??) 되어 지금까지도 계속 공부를 하고 있습니다! 일단은 영어로 중국어를 배우는 것 자체가 상당히 흥미롭고, 미국인 친구들의 입에서 중국어가 술술 나오는 모습을 보면 너무 신기하고 재미있었습니다! 혼자 아시아인이어서 뭔가 아시아인의 명예를 더럽히면 안되겠다!라는 생각도 들고 해서 청강 수업임에도 불구하고 수업에 엄청 성실히 참여했었습니다. 더불어, 연세대의 제2외국어 수업 방식과 HWS College의 제2외국어 수업 방식을 비교할 수 있어서 좋았습니다. 본 수업의 장점은 10명 안팎의 소규모 인원, 실생활 언어에 초점을 맞춘 수업, 끊임없는 연습, 교수님의 밀착 강의, teaching assistant와 함께 speaking 연습을 하는 LAB시간 등이 있습니다. 매일 중국어를 하다보니 중국어 실력이 늘 수 밖에 없습니다. 만약 교환학생으로 1학기 더 HWS College에 있을 수 있었다면 계속 이 수업을 수강했었을 것입니다. Professor Zhou께서 다소 수업 진행을 좀 지루하게...하는 면이 없지 않아 있지만, 천천히 수업을 진행하셔서 이해가 어렵거나 진도가 너무 빠르다던가 이런 어려움에 부딪힐 일은 전혀 없습니다! 

6. Basic Sailing (Non-credit) 
Sailing 수업은 학교 앞에 있는 큰 호수에서 진행이 됩니다. Sailing은 날씨에 영향을 많이 받는지라 바람이 많이 불거나 비가 많이 오면 수업이 취소됩니다. 수업은 대략 한 달 동안 진행이 되는데, 기후 상황이 안 좋아서 자주 수업이 취소 된 걸 감안 한다면 수업 횟수는 몇 번 안 되었던 것 같습니다. 수업 진행은 HWS의 Sailing팀의 코치님이 직접 해주십니다. 두 분이서 가르쳐주시는데, 차근차근 잘 가르쳐 주십니다. 저는 암기력이 매우 딸려서 boat를 설치하는 순서를 외우는데 처음에 애를 많이 먹었습니다. Sailing은 한 배에 두 명이서 타서 합니다. 파트너를 잘 만나야 편하게 Sailing을 할 수 있습니다:)","국제처는 Global Education Center라고 Trinity Hall 3층에 위치하고 있습니다. 여기서 일하는 교직원 중 Amy Teel이라는 분이 교환학생들을 담당하시는 분입니다. 도움이 필요하거나 궁금한 점이 있으면 Amy를 찾아가시면 됩니다. 아니면 국제 학생 담당을 총괄하시는 David Gage를 찾아가도 됩니다. 그런데 사실 학교에 갓 도착할 때만 빼고는 그다지 Amy Teel의 도움이 필요했던 적은 없었던 것 같습니다. 다른 도움이 필요한 점은 Housemate나 친구들에게 물어서 스스로 해결했던 것 같습니다. 날씨가 추워져서 담요가 더 필요하여 국제처에 얻으러 간 것 빼고는 따로 국제처를 방문했던 적은 없었습니다. 국제처보다는 Intercultural Affairs House라는 곳을 더 많이 방문했던 것 같습니다. 이곳은 국제학생들의 안식처라고 생각을 하시면 됩니다. 다양한 국제 행사들도 이곳에서 주관을 하고, 제가 속해있었던 Asian Society Union이라는 클럽도 이곳에서 모임을 진행했습니다. 간식이나 음료도 항상 구비되어있구요! 저는 이곳을 통해서 Field Trip도 자주 다녔습니다. 박물관 관람과 나이아가라 폭포 관람, New York States Fair등 다양한 행사에 참여를 했었습니다. 그리고 월요일, 수요일 마다 열리는 Writing Table도 자주 이용을 했습니다. 제가 수강했던 수업의 교수님이었던 Professor Janney께서 진행을 하시는 것이라 더 편하게 이용했습니다.","동아리의 종류는 참 다양합니다. 저는 가을학기에 다녀와서 동아리 recruiting관련 행사가 크게 있어서 학교에 어떤 동아리들이 있는지 한번 쭉 훑어볼 수 있는 기회가 있었습니다. 원래는 춤 동아리나 노래 동아리를 들고 싶었는데, 제가 생각했던 장르를 다루는 동아리가 없는지라 포기를 하고 Asian Society Union이라는 동아리를 들었습니다. 동아리의 이름 그대로 아시아 문화를 사랑하는 학생들의 모임이라고 보시면 됩니다. Kpop을 사랑하는 친구들도 많고 한국 음식을 좋아하는 친구들도 많아서 매우 반가웠습니다. 이 동아리를 통해서도 많은 친구들을 사귈 수 있었습니다. 제가 교환학생을 다녀온 시기가 미국에서 한창 강남스타일 붐이 불 때 인지라 더욱 한류에 대한 관심도가 높았었습니다. ASU를 통해서 크게 두 가지 행사를 제가 주최했었는데, 하나는 강남스타일 Dance tutorial이었고 다른 하나는 떡볶이 파티였습니다. 강남스타일 춤을 배우고 싶어하는 친구들이 꽤나 있는 것 같아서 혼자 열심히 방에서 춤을 따서 연습을 하고 Gym에서 강남스타일 Dance tutorial을 열었습니다. 많이 떨리기도 하고 긴장이 되기도 했지만, 많은 친구들이 참여를 해주고 열심히 배워줘서 매우 뜻깊고 보람찼습니다. 수업을 마치고 난 다음에 오는 전율은 아직도 잊을 수가 없군요. 이 Dance tutorial 덕분에 더 많은 미국 친구들과 친해질 수 있었고 자신감도 많이 찾을 수 있었습니다. 다만, 부작용이 있었다면... 어느 곳을 가든지 강남스타일 춤을 춰달라고...ㅠ_ㅠ;;; 참... 하하^^ 그래도 뭔가 한국 문화를 알린다는 사명감을 가지고 빼지 않고 언제든지 오빤 강남스타일!을 해주었지요. 지금 생각해도 입에서 저절로 미소가 떠오릅니다. 떡볶이 파티는 뭔가 한국 요리를 한 번쯤은 친구들을 위해서 크게 해주고 싶었는데, ASU에서 재료비 지원을 해준다는 소리를 듣고서 바로 실천을 했습니다! 근처에 한인마트가 없어서 떡을 구할 수가 없었다는게 큰 장애물이었지요. 그래서.. 떡을 제가 직접 만들었습니다.. 모양은 이상했지만, 쌀가루하고 찹쌀가루를 적절한 비율로 섞으니 제법 떡 비슷하게 만들어지더군요. 결국 못생긴 떡볶이를 대접하게 되었지만, 친구들의 반응이 다들 좋아서 성공적인 떡볶이 파티를 치룰 수 있었습니다! 친구들이 매워할까봐 매운 거 조절하느라고 신경을 많이 썼지요. 고추장이랑 라면은 한국에서 부쳐달라고 했습니다! 교환학생 가셔서 한국 요리를 하실거라면 고추장정도는 꼭 챙겨가셔야 될 것 같습니다:)","비교적 미국문화에 익숙했던지라 특별한 culture shock은 느끼지 못했습니다. 미국드라마나 영화를 통해서 보던 미국인의 생활 모습을 현실에서 직접 체험을 한다는 느낌이어서 그런지 오히려 재미있었습니다. 음... 굳이 하나를 꼽자면, 남녀혼용 기숙사가 있다는 점..? 신기했었습니다. 조금 불편했던 점이 있다면, 제가 살던 Odells에서 시도때도없이 남성 백인분들이 거실에 죽치고 있었다는 점..? 아침에 부시시한 폐인 모습으로 문을 열고 나왔는데, 남학생이 떡하니 쇼파에서 자고 있을 때는 깜짝 놀라곤 했지요. 처음에 몇번 불편했다가 나중엔 아무렇지 않더군요. Housemate가 남자친구랑 같이 자는 것도 거의 매일 있었던 일이고.. 다만... 집이 방음이 너무 안되서... 듣고 싶지 않은 소음...?을 많이 들었다는 점이 좀 슬프네요..하하;; 열린 마음으로 교환학생을 가신다면 그렇게 충격적인 culture shock은 경험할 일이 없을 것이라고 생각이 됩니다. 뭔가 우리 문화와 너무 다르다는 생각이 들면 그러한 점을 미국인 친구들에게 설명을 해주세요. 매우 흥미로워 합니다^^ 미국인 친구들이 개방적인 반면 다른 나라 문화에 대해선 많이 무지하거든요;;","도움을 받을 수 있는 곳은 꽤나 많습니다.
앞에서 언급해드린 국제처가 가장 대표적이겠구요, 언제든지 Amy Teel에게 이메일을 하시면 됩니다.
수강하는 수업의 교수님들께도 도움을 요청해도 되구요^^ HWS College의 교수님들은 정말 따뜻하시고 친절하십니다. 학생들에게 상당히 오픈되어있는 분들이라서 언제든지 도움을 요청하면 기뻐하시면서 도와주실 것이에요! 참, 한국인 교수님도 두분 정도 계시는데, 저는 그 중 이주연교수님과 가깝게 지냈었습니다. Political Science를 가르치십니다^^ 뭔가 힘들거나 집이 그리울때 교수님을 찾아가서 담소를 나누며 많은 힘을 얻곤 했어요! 교수님께서 나중에 귀국 전에 크게 저녁 식사도 사주셨구요^^ 그때 먹었던 Chicken Alfredo의 맛이 아직도 잊혀지지 않네요 ㅠㅠ","연세대학교와는 상당히 다른 점이 많은 HWS College입니다. 그 다른 점들을 통해서 많은 것을 경험하고 배울 수가 있습니다. 새로운 것에 도전하고 새로운 것을 경험하기를 즐기시는 분이라면 HWS College를 꼭 다녀오세요^^

궁금하신 사항은 언제든지 이메일을 주세요^^
jeong.jiyoon90@gmail.com 

사진은 할로윈 행사로 있었던 호박 꾸미기 대회에서 3등 먹은 저의 Psy Pumpkin입니당:)"
