gen_info,env_info,food_info,study_info,office_info,facil_info,mhct_info,help_info,etc_info
"LSU는 미국의 동남쪽 끝에 위치한 루이지애나 주의 수도 Baton rouge에 자리하고 있다. 
루이지애나 주의 면적은 12만 3592㎢, 인구는 446만 8976명(2000)이다. 멕시코만 북안, 미시시피강 유역에 전개된 범람원과 삼각주의 저지가 3/5을 차지한다. 도착해서 가장 먼저 눈에 띄는 것은 캠퍼스의 거대하고 아름다운 나무들과 그것을 온통 뒤덮고 있는 이끼일 것이다. 루이지애나는 전체적으로 소나무•떡갈나무 등의 삼림이 풍부하게 펼쳐져 있다.
기후는 온난습윤한 아열대성 기후로 연강수량이 다른 주들에 비해 월등히 높고, 1월 평균기온 13℃, 8월 평균기온 28℃의 전형적인 남부 기후로 눈•서리가 거의 없으나, 허리케인이 내습한다.  작년 크리스마스에 몇십년만에 눈이 왔었다고 하는데 이곳 친구들은 생전 처음 보는 눈이었다고 했다. 
주내에는 루이지애나주립대학•로욜라대학 등 9개의 대학이 있고, 루이지애나주립도서관•오페라협회 등이 있다. 미국의 신대륙 개척 시절 에스파냐와 프랑스 시대의 통치를 받았었던 곳인 관계로 언어와 음악, 건축 등 아직도 예전의 문화 사적이 남아 영향을 끼치고 있으며, 다수의 프랑스계 주민과 그 문화는 미시시피강의 경관 및 특산물과 더불어 주의 두드러진 특색이다. 로마가톨릭 교회와 침례교회가 사회•문화를 지배해 왔으며, 음악•미술•문학에서도 다른 주에 많은 영향을 미쳤다. 특히 루이지애나의 남쪽 끝에 있는 뉴올리언즈는 재즈의 본산지로 유명하다. 
루이지애나 주립대학은 지난 몇년간 미국 전국적으로 캠퍼스가 아름다운 학교들 중 5위 안에 꼽힐 정도로 넓고 아름다운 캠퍼스를 가지고 있다. 내가 도착했던 1월 초에는 반팔과 가디건으로 생활에 지장이 없는 완벽한 날씨를 즐길 수 있었는데, 여름이 가까워져오면 하루에 두세번 샤워를 해야 할 정도로 덥고 습한 날씨로 돌입한다. 남부의 햇살은 그 각도와 색깔이 다른지, 맑은 날은 하루 종일 그림같이 아름답다. 이곳의 날씨와 햇살, 나무들과 색깔을 즐기고자 하는 마음이 준비된다면 다른 어떤 곳과 다른 루이지애나만의 여유로운 생활을 마음껏 누리게 될 것이다.","루이지애나 주립대학(LSU)이 위치하고 있는 Baton Rouge는 전형적인 college town이다. LSU를 중심으로 도시가 이루어져 있는 것이나 다름 없는 것이다. 하지만 전혀 대도시가 아니기 때문에 지하철은 물론 약 30분에 한대 오는 버스를 제외하고는 대중교통수단은 기대할 수 없다. 건축 스튜디오에서 함께 생활하던 친구들은 16세때부터 보통 운전을 시작하기 때문에 벌써 운전 경력 6, 7년차의 배테랑 운전수들이었다. 배튼루지의 일상생활에 필요한 모든 것들은 한곳에 모여 있지 않고, 넓고 평평한 범람지 전체에 흩뿌려져 있다. 따라서 차 없는 생활은 불가능하게 보이며, 나또한 그곳에 있던 약 5개월동안 시리얼 한통을 사기 위해 주변의 배테랑 운전수들에게 ride를 부탁하며 살았다. 
하지만 일주일에 한번 장을 보러 가는 것 빼고 보통 필요한 소소한 것들은 걸어갈 수 있는 거리에 있다. 작은 케이준 음식점들, 패스트푸드 식당들 그리고 아이스크림 가게 정도는 걸어갈만했다. 처음 그곳에 도착했을 때 모두들 범죄가 많고 위험한 지역이라고 해서 건축과 건물에서 내가 살던 기숙사까지의 그 짧은 거리도 모두들 나서서 자동차로 데려다주곤 했는데, 학기가 마지막을 향할수록 그다지 무서운것도 위험한 것도 굳이 찾아 나서지 않는다면 많지 않다는 것을 느끼게 되었다. 
다운타운은 영화 세트장을 떠올리게 할 정도로 아무도 없고 아무것도 없다. 주로 관공서들과 큰 회사건물이 모여있고 큰 공연장 하나와 올해 봄 오픈한 SHAW CENTER가 두드러진다. 나는 한번 공연장에 클래식 연주를 보러 갔었는데 충분히 흥미로웠다. 밤에는 미시시피 주변에 큰 페리들이 불을 밝히고, 아무도 모르는 수많은 벌레들이 Baton rouge에 자신들도 있다고 주장하기 시작한다. 
물론 뉴욕, 시카고를 기대한다면 처음부터 절망감에 빠지겠지만 다른 대부분의 미국 주립대학들이 그러하듯이 이곳의 여유로움에 한번 즐거움을 느끼게 되면 서울에서 사는 피곤함을 어느순간 깨닫게 되는 묘한 순간이 찾아온다. 나도 섹스앤더시티에 공감하며 스타벅스 없이는 사는것같지않은 도시인간이지만 설명하기 힘든 이유로 남부는 매력적이다.","기숙사는 Acadian hall, Annie boyd hall, beauregard hall, Blake hall, Broussard hall, East campus apartments, East laville hall, Evangeline hall, Louise Garig hall, Herget hall, Highland hall, Jackson hall, Kirby-smith hall, LeJeune hall, Mcvoy hall, Miller hall, Taylor Hall, West Laville Hall, West campus apartments 이렇게 엄청나게 많은 옵션들이 있는데 내가 처음 살았던 곳은 Highland hall로, 한 방에 두명이 함께 쓰고 두 방 사이에 화장실이 끼어있어서 네명이 화장실을 공유하는 suite 형식이다. 나는 전공이 건축이다보니 스튜디오에서 새벽 늦게 돌아오는 경우가 허다했는데 그때마다 네명이 화장실을 공유하다보니 밤늦게 샤워하면서 룸메이트들을 깨우기가 미안해져서 기숙사 변경기간에 East campus apartment로 옮겼다. 이스트 캠퍼스 아파트먼트는 새로 지은 3층형 아파트 단지로 이루어져있는데 다른 기숙사들에 비해 정말 예쁘고 편리하고 좋다. 4명이 한 아파트 호실을 같이 쓰는데 방은 각자 따로 쓰며 아파트 안에 화장실2개, 부엌,세탁기 건조기가 전부 갖춰져 있어서 정말 내집같이 편하게 살았다. 다른 홀보다 약간 비싼데도 불구하고 전혀 아깝다는 생각이 들지 않았다. 부엌이 있기 때문에 같이 요리를 해서 다른 친구들을 불러서 파티도 하고 좋았다. 부지런히 생활한다면 부엌에서 요리해서 직접 만들어 먹을수도 있고, union(학생회관)카페테리아에서 사먹을 수도 있다. 또 조금만 걸어나가면 베트남, 케이준, 서브웨이, 잭인더박스 등 작은 음식점들이 있다. 가장 인기있는 식당은 캠퍼스 가장자리 끝에 있는 chimes이다. 루이지애나는 음식 맛있기로 미국 전체에서 유명한 곳이다. 케이준 푸드가 대표적인데, 해산물, 검보, 악어고기,craw fish 등 한국음식이 전혀 그리워지지 않는 지나치게 맛있는 음식이 넘쳐난다.","캠퍼스는 넓고 건물은 많다. 분수대와 잔디밭이 있는 court yard는 중앙 도서관과 강의건물로 둘러싸여있는 사각형 중정으로 union과 가깝고 많은 전공 건물들이 주위에 있어서 캠퍼스의 중심 쯤 된다.union에 가서 캠퍼스 지도를 받으면 처음에는 차가 없다는 사실이 굉장히 서글프게 느껴지겠지만 사실상 학부생들이 교양과 전공 수업을 듣는 과정에서 탐험하게 되는 바닥은 좁다.
도서관은 앞서 언급한 중앙도서관과 디자인빌딩에 있는 디자인도서관이 있다. 대학원생들을 위한 도서관이나 각 전공생들을 위한 소규모 도서관들이 있다고 들은 것 같은데 나로서는 건축, 디자인 전공 도서들이 있는 디자인도서관과 중앙도서관까지 탐험하고 나니 한학기가 끝났다. 
수업은 놀라울정도로 연대 수업과 비슷한데, 그룹 토론과 프레젠테이션이 많다는 점이 두드러진다. 그러나 말을 많이 해야하는 수업때문에 패닉하기에는 남부 사람들이 너무 친절하고 다정하다. 먼저 도와달라는 이야기를 꺼내면 10명 중 9명은 나중에 부담스러워질 정도로 친절하고 정성스럽게 도와준다. 그곳 아이들은 아마 교환학생으로 파견되는 우리들이 생전 처음보는 동양인일 가능성이 높고, 우리가 매우 이국적으로 느껴지는 것 같아 보인다. 걱정했던 것보다 학기말 학점은 너그럽게 나온다. 수업에 부지런히 참여하고 모르는 것은 교수에게 열심히 물어보다보면 점점 강의실에서 편해지는 자신을 발견할 수 있다. LSU 수강편람을 살펴보면 갖가지 강의가 엄청나게 많다. 잘 살펴보고 연대에서는 들어보지 못했던 관심있는 강의에 도전해보자. 1학점짜리 춤과 음악, 체육 등 재미있는 수업도 많다. 일반 교양이나 전공 과목은 한국과 마찬가지로 파워포인트와 교재를 가지고 진행되는 수업이 많고, 그룹활동이 주를 이루기도 한다.",국제교육부는 Hatcher hall에 있는데 현재 교환학생제도를 담당하고 대부분의 일을 처리하는 Jane Chandler도 이곳에 사무실이 있다. 특정한 직원을 만나서 상의하고 싶으면 미리 전화를 해서 상담시간을 잡으면 좋다. 그 외 질문이 있거나 하면 찾아가서 데스크에 있는 여자에게 물어보면 그리 친절하지는 않지만 가르쳐준다. 뭔가 궁금한 것이 있거나 필요한 것이 있으면 Jane에게 찾아가서 부탁하면 대체로 해결된다. 하지만 아주 중요한 문제가 있거나 급한 경우에는 자기가 스스로 알아봐서 Jane이외에 직접적으로 문제를 처리해 줄 수 있는 사람과 상의하는 자세가 필요하다. 제인은 대개 학생의 요구사항을 듣고 다른 사람에게 연계해 주는 경우가 많기 때문이다. 그리고 수많은 학생들이 찾아와서 이야기하기 때문에 잊어버리는 경우도 종종 생기고 우리들 개개인의 문제의 심각성을 잘 파악하지 못하고 기한을 넘겨버리는 경우는 생기기 때문이다. 스스로 대처하는 자세와 적극성만 갖춘다면 국제교육부의 도움이 훨씬 효율적으로 쓰일 것이다.,"시설 좋은 GYM(체육관)과 캠퍼스 바로 옆에 눈부신 호수까지 LSU는 운동하기에 완벽한 조건을 갖추고 있다. 러닝머신, 수영장, 트랙, 웨이트, 라켓볼, 탁구 등 원하는 실내 체육 시설은 거의 다 있다고 보아도 좋다. 아이디카드만 있으면 모두 무료이고 밤 12시까지 운영된다. 얼마의 돈을 내면 강좌에 등록할 수도 있다. 한학기 내내 마음대로 들을 수 있는 프로그램은 70달러정도이고 여러가지 다른 요금 옵션이 있었던 것 같다. 힙합, 필라테스, 공운동, 복싱 등 듣고싶은 강좌를 듣고싶은 시간 아무때나 가서 들으면 된다.
동아리활동은 그다지 활발한 편은 아니다. 눈에 띄는 동아리는 종교, 봉사활동, 체육 동아리정도였다. 유니온 옆에는 학교 극장이 있는데 거의 매주 금요일에 음악회가 열린다. 학교 안에서 문화생활을 즐길 수 있는-게다가 싼 가격에- 거의 유일한 수단이다. 연극, 음악, 무용 등 다양한 프로그램이 매주 준비된다.","한국이 정이 많은 나라라고 스스로 생각하고 있지만 미국 남부의 루이지애나는 서울 사람을 부끄럽게 만드는 그 어떤 면이 있다. 학기 중반이 지나고 가만히 앉아서 생각해보니 루이지애나 사람들은 동양사람들보다 더욱 동양적이다.가족간에 서로 아끼는 모습이나 서로 사심없이 도와주는 행동들, 인사하는 얼굴들..전부 소위 동양적이라고 생각하던 유형적 양식들은 이제 신촌보다 루이지애나에 더 어울리는 이미지라는 생각이 들었다. 
미국 전체에 이제는 흔한 냉소주의나 무관심은 아직 남부와는 거리가 멀었다. 이제껏 개인주의와 이기주의를 구분하지 못했던 서울에서 정신없이 빠져 살았던것인지, 루이지애나에서의 얼마의 시간이 지나자 내가 미국화된다기 보다는 본래의 사람냄새나는 말하자면 동양화되어간다는 느낌을 받았다. 내가 소위말하는 차가운 서양인이고 그곳 친구들이 동양인같았다. 상대방에게 아무것도 바라지 않고 잘해주는게 무엇인지, 약지 않은 친절이 무엇인지, 정말로 웃게하는 따뜻한 농담이 무엇인지 다시 생각하게 하는 다섯달이 순식간에 흘렀다.","Jane Chandler,국제교육부: jchandler@lsu.edu
international student service: isograd@lsu.edu
학교 홈페이지: www.lsu.edu",학생들이 가장 열광하는 LSU 최대의 이벤트는 풋볼이다. LSU tigers는 작년 미국 전 대학 대회에서 우승한 팀인데 그때 루이지애나 배튼루지 도시 전체가 풋볼 열광으로 들썩거릴 정도로 난리가 났었다. 대회는 매년 9월인데 이야기를 들어보니 연고전과 거의 흡사했다. 일찍 자고 일찍 일어나는 루이지애나 대학생들이 대회기간 일주일 동안 트레일러를 몰고 주차장에 가득 모여서 술도 마시고 응원도 하면서 파티를 즐긴다. 나는 봄학기 파견이라 9월 풋볼시즌을 경험해보지 못해서 아쉬웠다.
