gen_info,env_info,food_info,study_info,office_info,facil_info,mhct_info,help_info,etc_info
"세인트 클라우드 주립대학은 지리적으로 미국 중서부에 속한 미네소타의 세인트 클라우드라는 시에 위치하고 있습니다. 기후는 사계절이 아닌 여름과 겨울만으로 양분됩니다. 다른 분들께서는 겨울의 날씨가 너무 추워서 힘드시다고 하셨는데, 개인적으로 그렇게까지 춥지는 않았습니다. 물론 눈은 많이 내립니다. 학기가 시작하는 1월부터 끝나는 5월까지 2~3주를 뺴면 거의 눈이 왔었습니다.",세인트 클라우드라는 주가 미네소타 내에서 주요 도시가 아니기 때문에 대학 주변에 번화가가 존재하지 않습니다. 음식점과 생활용품 구입 및 소규모 쇼핑을 하기 위해서는 메트로 버스-세인트 클라우드 내에 운영하는 버스로 세인트 클라우드 주립대의 학생증을 지참하면 무료로 타실 수 있습니다-를 타고 나가시면 됩니다.  도시가 대학교를 기반으로 만들어졌다는 느낌을 강하게 받은 작은 도시였습니다.,"학교에 많은 기숙사가 있지만 저는 Case_Hill 이란 곳에서 살았습니다. 주로 현지 미국인 학생들이 살면서 2인실로 되어 있었습니다. 시설물들은 매우 쾌적했고, 사용하기 편리했습니다. 도서관과 기숙사 식당 사이에 있어 지리적으로도 매우 편했습니다.","저는 한학기 동안 마케팅, 교육평가, 특수교육, 약물 이렇게 4개, 총 12학점을 들었습니다. 교수님들이 교환학생인 저를 위해서 많이 배려해 주셔서 큰 어려움은 없었습니다. 점수 또한 조금만 공부하면 쉽게 얻을 수 있었던 것 같습니다.도서관은 매우 작고 아담했습니다.",궁금하신 것이 있으면 꼭 찾아가서 여쭤보는 것이 좋습니다. 직원분들 모두 친절하시도 더 도와줄 것이 없나 찾아보시기까지 합니다.,학기 시작할 때 ATWOOD(학관)에서 동아리 홍보 행사를 합니다. 행사가 일찍 끝나기 때문에 미리 알아보고 아침부터 가는게 좋을 듯 합니다.,"큰 문화적 충격은 없었던 것 같습니다. 단지, 외국인 친구와 친해지기 위해서 그 친구의 문화를 이해하는데에 노력을 많이 했었던 것 같습니다. 눈에 띄는 인종차별은 없지만, 미국에서도 어느정도의 차별은 항상 존재하고 있단걸 명심해야겠습니다.","대부분 문제가 생긴다면 국제교육부를 가는 것이 좋습니다.문제가 생겼을 때 바로 가서 해결하지 않으면, 나중에 처치곤란한 상황에 처하기도 합니다.",
"저는 봄학기에 다녀왔는데 5월초에도 눈을 봤습니다. 춥긴 엄청 추웠지만 기숙사에 살면서 수업가고 그 외에는 교통수단을 사용하니까 외투 잘입고 다니면 다닐만 했습니다. 크기는 연세대보다는 작긴 하지만 단과대별 수업이 건물별로 잘 나눠져 있고 기숙사, 헬스장 모두 이용가능해요.",미시시피 강이 흘러서 5월에 날씨 풀리니까 산책하거나 자전거 타기에 좋았어요. 그리고 근처에 자전거 타기 정말 좋은 숲이 있는데 외국인 친구들한테 물어봐서 꼭 가보시면 좋겠어요.,저는 기숙사 중 Benton에서 살아봤어요. 가격도 저렴한 것도 좋지만 기숙사 느낌이 아니라 가정집에 대여섯명 여자아이들끼리 모여사는 걸 경험해보고 싶었는데 저한테는 최고의 선택이었던 것 같아요. 벤튼은 2인이나 1인실이 있는데 저는 2인실 했지만 룸메이트가 중간에 원래 집으로 들어가서 혼자 살았어요. 다른 기숙사에 비해 청소는 직접해야한다는 점이 저는 더 좋았어요. 그냥 정말 집에 사는 느낌으로 돌아가며 청소도 하고 요리기구가 많은 친구 방에 모여서 음식도 만들어먹고 재밌었어요. 기숙사학생들 모두 쓸 수 있는 요리기구나 세탁실 또 공용 TV는 당구대는 옆 건물 지하에 있어서 겨울에 슬리퍼 신고 달려가서 빨래 넣고 오던 기억이 나네요. 빨래는 학생증카드에 일주일마다 돈을 넣어줘서 기계에 입력하고 사용했어요.식사는 Garvey라는 뷔페식 학내식당에서 Meal Plan 이용했는데 Unlimited말고 그 다음 가격대의 Plan 사용했는데 전혀 부족하지 않았어요. 피자 햄버거 야채볶음밥 다양한 샐러드 등등 메뉴가 다양했어요. 한 학기 지낸 친구들은 대부분 Meal Plan 이용해서 거의 모든 국제학생들은 이곳에서 자연스럽게 만나서 같이 밥 먹고 그랬던 것 같아요. 간간히 학교 밖으로 15-20분 걸어나가면 나오는 음식점들에서 식사하거나 친구들이랑 장 봐와서 만들어서 먹거나 Meal Plan에 포함된 Munch Money로 피자 서브웨이 중식 일식 등 사먹는 정도로 한 학기 식사했네요.,"Mass Communication 언론학개론과 같은 수업인 것 같아요. 현재 언론의 다양한 방식 그 영향에 대해 다뤘고, 매주 한 단원 읽어서 쪽지시험 보고 레포트도 있었어요. 학생들 의견을 많이 들으려고 발표점수도 주셔서 발표가 많았던 수업이었습니다.Spanish 영어로 스페인어를 배워보는 건 어떨까 하는 마음에 신청했는데 한국어로 배우는 것보다는 쉽지 않았지만 수업방식이 실제로 말 한마디라도 더해보는 기회를 많이 살리려고 하셨고 달달 외우는 방식과는 다르게 하시려고 스펠링에서 조금 틀리는 건 이해해주셨어요.Culture 미국인 반, 국제학생들 반으로 된 토론이 많았던 수업이에요. 매시간 읽기자료 읽고 수업게시판에 내 생각 쓰고 다른 학생들 생각에 댓글 달고 하느라 시간은 많이 쓰였지만 영어를 의견 말하는 경험을 많이 해봐서 좋았고 수업분위기도 좋았습니다.Film Making 러시아에서 온 영화 만드시는 교수님의 영화 만드는 수업인데 정말 재밌었던 것 같아요. 물론 제 영어가 좀 더 나았으면 얻어오는 게 훨씬 많았을 거에요. 영어 때문에 힘들긴 했어요. 짧은 영상도 만들고, 음성으로만 감정을 표현하는 실습도 해봤는데 이론수업이랑 실습이 잘 어우러진 수업이었던 것 같아요. 다들 영화 전공인 친구들이 아니어서 저만 유독 못 한건 아니었으니 부담감 없이 들어보시면 재밌을 거에요. (저는 프리미어 툴은 다룰 줄 알았어서 영어에서 좀 부족해서 못알아들은 부분이 커버되긴 했어요..) 영화 전공하던 친구들이 아니라서 틀에 박힌 영상만 결과물로 나오지 않아서 교수님 피드백 듣는 시간도 흥미로운 부분이었습니다. 그리고 도서관은 크고 (우리학교 구중도 신중도 합친것보다는 작지만) 컴퓨터, 복사기, 스캐너, 책 대여, DVD 대여 등 시설과 서비스는 편리했어요.",,"동아리는 하진 않았지만 모임 가본적은 있었는데, 우리나라처럼 동아리끼리 활동을 매주 다같이 하는 건 많이 없는것 같고 자유로운 분위기인 것 같아요. 알아보면 동아리 종류는 많아요!",,국제처나 한인교회도 있지만 실질적인 도움은 한국인 정규학생들한테 많이 받았어요.,"수업 시작하는 주에, 아니면 그보다 더 전 주에 서점에서 수업에서 쓰는 중고책을 모아서 판매하니까 일찍 가보시면 싸게 살 수 있을 거에요. 아니면 아마존에서 책을 최대한 빨리 주문하는 게 좋아요. 기숙사 어디로 받아야 하는지 주소 쓰시는 건 학교 측에 확인하거나 공지로 받을 수 있을 거에요.백인이 주로 있는 곳이긴 하지만 위험하거나 하진 않아요. 술먹고 밤늦게 혼자돌아다니지만 않는다면요. 국제학생들이 많은 편인 학교라서 친구를 많이 사귈 수 있을 거에요."
첫 번째로 크기는 연세대학교 정도라고 생각하시면 됩니다. 하지만 높은 건물이 없고 길도 상당히 넓기 때문에 실제로 학생들이 사용하는 면적은 연세대학교보다 작다고 할 수 있습니다.두 번째 지리적 위치로는 미국의 중부 지방에 캐나다와 국경을 마주하고 있는 주이기 때문에 춥습니다. 여기 와서 들은 말이 미국에서 알래스카 다음으로 추운 주라고 들었습니다. 하지만 제가 도착했던 8월에는 반팔을 입고 다녔고 9월부터 긴팔을 입었으나 못 참을 정도의 추위는 아니었습니다. 추운 날씨가 빨리 온다는 말에 자전거를 살까 고민하다가 춥고 눈이 오면 못 탈 것 같아서 사지 않았는데 제가 있던 8월부터 12월까지는 눈도 몇 번 오지 않았고 그리 생각보다 춥지 않아서 후회했던 기억이 있습니다. 하지만 한국보다 광활한데 바람을 막아 줄 건물도 없고 길도 넓고 하기 때문에 체감적으로 같은 기온이어도 춥게 느껴질 수 있습니다.,"대학 주변에는 몇 몇채의 집들만이 있을 뿐 아무 것도 없습니다. 대학에서 제일 가까운 상업시설을 가고자 한다면 다운타운으로 가야하는데 걸어서 20분, 학교 도서관 앞에서 버스를 타면 5분안에 갈 수 있습니다. 다운타운에는 St.cloud 도시를 다니는 모든 버스들이 모이는 종착점인 transit center가 있고 바, 펍, 편의점, 음식점, 옷가게, 은행(wells fargo), 시청 등이 있습니다. Transit center에서 버스를 타면 cross road center라는 곳에 갈 수 있는데(버스로 15분) 그 곳은 타겟이라는 큰 마트가 있고 여러 다양한 상점과 음식점들이 모여있는 쇼핑센터라고 할 수 있습니다. 조금 넓은 편입니다. 1층 건물이기 때문에(부분 2층), 길이 넓기 때문에 넓게 느껴지지만 사실 크게 볼 것은 없는 쇼핑몰입니다. 저는 그 안에 있는 Macy’s, Jc Penny(백화점들), scheels(운동용품,의류 전문점) 등에서 운동복을 주로 구입했습니다. 또한 크로스로드 뒷편으로 나와서 걸어가면 Vietnam ingredient store가 있는 데 그곳에서 한국 라면, 과자, 식재료를 살 수 있습니다!(중요!!) 트랜짓 센터에서 또한 버스를 타면 영화관을 갈 수 있는데 화요일, 목요일에는 5달러로 영화를 볼 수 있어서 자주 영화를 봤습니다. 하지만 팝콘이 매우 비쌉니다. 팝콘 하나에 콜라 두개세트에 17달러 정도 였습니다. 그러나 역시 미국이라는 특성 상 엄청 큽니다..","우선 첫 학기는 기숙사에 살 수 밖에 없는 방문학생의 특성 상 기숙사를 신청해서 살았습니다. 기숙사는 Lawrence, Sherburne, Case hill, Benton, coborn plaza, shoemaker가 있습니다. 특징을 하나씩 알려드리자면 제가 살았던 Lawrence hall은 국제학생들을 위한 기숙사입니다. 위치는 좋습니다. 식당(garvey)과 학관(atwood center)이 가깝습니다. 방은 국제학생들을 미국인 학생들과 한 명씩 같이 짜줍니다. 그래서 제 룸메이트도 미국인이었으나 여자친구 아파트에 가서 살았기 때문에 하루도 제방에서 같이 잔 적이 없었습니다. 하지만 다른 친구들을 보면 기본적으로 외국에 대한 관심이 많은 미국인들이었습니다. 따라서 좋은 친구들을 사귄다면 영어회화에 큰 도움을 줄 것으로 생각합니다. 하지만 굉장히 이상한 친구들도 많습니다.. 경우에 따라 다릅니다만 로렌스에 오는 미국인들은 다른 곳에 사는 미국인들과 조금 다른 느낌이 있습니다. 그리고 시설이 오래되어서 화장실과 지하1층 부엌, 공용 라운지 쇼파 등이 더러운 편입니다.Sherburne은 식당과 붙어있는 학교에 있는 가장 높은 건물인 기숙사 입니다. 하지만 좁고 답답하다는 친구의 말을 들었습니다. 가보진 않았습니다. 위치는 좋은 편입니다. Benton은 몇몇이 같이 거실과 화장실을 공유하는 아파트 구조라 들었는데 화장실 청소를 학생이 직접 해야 해서 번거롭다는 말이 있었습니다. 하지만 가격이 저렴한 이점이 있습니다. Shoemaker는 신축건물이라 매우 깨끗하고 지하1층에는 스터디룸이 있습니다. 또한 모든 기숙사에는 포켓볼과 foosball이라는 것이 있는데 새 물품이 있어서 굉장히 좋습니다. 쇼파와 티비등도 깨끗해서 좋습니다. 하지만 위치가 식당과 학관이 멀다는 단점이 있습니다. 그렇지만 이과인 학생들은 공대건물과 가깝고 체육관이 가까워서 운동하기에 매우 좋습니다. Case hill도 슈메이커와 같은 신축건물입니다. 깨끗해서 좋습니다. 식당 옆에 헬스케어센터와 붙어있습니다. 도서관도 가깝고 하여 위치가 좋은 편입니다. 지하 1층엔 피아노도 있습니다. Coborn plaza는 다운타운 쪽에 있는 아파트입니다. 학교완 거리가 있습니다. 또한 가격이 기숙사의 대략 1.5배이지만 시설이 매우 좋다고 들었습니다. 아파트 형식의 각자의 방이 주어지는 데 각자의 방마다 화장실이 있고 냉장고와 티비등 필요한 가구와 전자기기가 빌트인되어 있다 들었습니다. 제 경험으로 Case hill을 추천합니다. 도서관, 식당, 학관이 다 가까운 기숙사 중에 시설이 제일 좋습니다.식사는 전 한 학기동안 anytime을 신청했습니다. 하지만 마지막엔 피자와 햄버거가 너무 질려서 많이 가질 못했습니다. 매우 기름지고 짜기 때문에 계속 먹을 경우에 금방 질립니다. 자주 다른 것을 먹어가고 하면서 해야 지속해서 사용할 수 있습니다.(혹은 가비 안에서 메뉴를 바꿔가면서) 저는 가비를 자주들러서 커피를 텀블러에 떠간다든지 샐러드를 가볍게 먹고 쿠키만 몇 개 집어온다든지 등에 사용했습니다. 실제 제대로 된 식사로 사용은 200번 내외로 사용했습니다. 하지만 며칠 안 먹으면 또 그립습니다.그리고 Munch money라고 학생카드에 300달러가 들어왔는데 학교 안에서만 쓸 수 있는 돈입니다. 학관안에 있는 편의점인 quick zone, subway, caribou coffee, starbucks에 대부분을 사용했습니다. 부과세없는 가격으로 결제합니다. Wing이나 sushi 파는 곳도 맛있습니다. 모두 학관에 있습니다. 스타벅스만 도서관 건물에 있습니다.","수업은 생각했던 것보다 굉장히 쉽습니다. 제가 기초 수업을 들어서 그런 것인지는 몰라도 언어가 힘들었지 수업 개념은 굉장히 쉬워서 실망한 부분이 많습니다.저는 경영학과를 이중전공하고 있어서 Marketing(3학점), Operation management(3학점) 수업을 듣고 EAP수업(영어 실력을 향상시키기 위한 국제학생을 위한 수업)으로 Listening&speaking(4학점) 수업과 piano(1학점), basketball(1학점)을 들었습니다. 방문학생의 특성상 학점이 올라갈수록 1학점당 약 200달러가 추가되었던 것으로 기억합니다. 따라서 최소학점인 12학점만 수강하였습니다.Marketing 수업은 미국인 교수였습니다. 수업을 몇 번안했지만 그 기간 동안 매우 기본적인 개념들을 설명해서 복습해보면 굉장히 쉬웠습니다. 하지만 중간에 하는 부연설명과 예시, 수업과 관련없는 이야기가 영어가 들리지 않아 답답했습니다. 학기 중간에는 온라인 수업으로 대체되어서 출석도 하지 않고 온라인으로 시험을 봐서 성적을 받았습니다. 그 이유가 수업이 저녁시간 수업이었는데 교수가 overpayment를 받지 못해서 수업을 할 수 없단 것이었습니다. 그렇게 수업이 취소된 경우는 보지 못했기 때문에 굉장히 어이없었고 실망스러웠습니다. 그렇게 10월 이후로 수업을 나가지 않고 온라인으로 시험을 봐서 성적을 받았습니다.Operation management는 인도 교수님이었는데 영어를 또박또박 말해주셔서 듣기에 매우 편했습니다. 조 발표 1번, 시험 3번을 보았는데 시험은 omr형식으로 봤고 조 발표는 case를 주고 배운 개념을 이용해서 푸는 식으로 발표하는 것이었습니다. 한국인은 저 포함 2명밖에 없는 수업에서 발표를 외국인들 앞에서 해보는 것은 굉장히 떨리지만 신나는 경험이었습니다. Piano 수업과 basketball 수업은 그 수업 시간에만 충실히 하면 되는 수업들이었습니다.Listening&speaking 수업은 국제학생들로만 이루어져 있는데 주로 중동계열 외국인이 많았습니다. 수업은 정해진 틀이 없고 여러 가지를 했던 것 같습니다. 하지만 학기 마지막에 10분짜리 발표를 혼자 해야 되는 과제가 있었습니다. 그 외에 책 진도를 나가면서 듣기와 요약하는 것을 하거나 단어 시험을 보거나 기사를 읽고 자기가 발표할 것을 정하고 출처 쓰는 법 등을 배웠습니다. 중간, 기말고사는 두 개의 표를 보고 10분 안에 그 표를 정리, 요약해서 말하는 것이었습니다.도서관은 한국과 다르게 24시간이 아닙니다. 늦으면 밤 12시, 이르면(주말, 공휴일 전날) 밤8시에 닫습니다. 게다가 공휴일에는 열지 않습니다(가을방학 포함).. 따라서 옆에 있는 스타벅스에서 공부를 해야 하는 데 자리가 많지 않고 도서관과는 다르게 분위기가 조금 흐트러집니다. 그렇다면 밤엔 공부할 곳이 까페가 따로 있는 것도 아니고 기숙사 방밖에 없습니다. 또한 제가 미국에 있으면서 굉장히 눈이 나빠졌는데 도서관이나 모든 곳에서의 조명이 노란색입니다. 한국처럼 형광등 하얀색 빛이 아니라 건물 조명도 노란색 도서관 책상 램프도 노란색 전구이기 때문에 밝게 비춰지지가 않고 오래 있으면 굉장히 눈이 침침해지는 느낌이 납니다. 게다가 도서관을 일찍 닫기 때문에 학교에서 공부를 하지 않게 하려는 의도가 있는 지까지 의심이 들었습니다.",국제교육부(CIS)는 기숙사인 로렌스 홀 1층에 위치합니다. 그곳에서 주관하는 행사에 참여하고 싶을 때 물어보러 가거나 어떤 다른 행정적 문의사항이 있을 때 가시면 됩니다.,"동아리는 백양로에 모든 동아리가 나와서 홍보하는 그런 것처럼 홍보하는 그런 날이 있습니다. 하지만 저는 뭔가 부담스러워 보여서 참여하지 않았는데 자신이 관심있는 분야가 있다면 도전해보는 것이 남는 것이라 생각합니다. 저는 연세대 총장배처럼 학교에서 열리는 리그 경기(Intramurals)에 축구, 농구를 참여했습니다. 축구는 한국팀으로 농구는 흑인 친구들과 팀을 짜서 참가했는데 매주 스포츠 경기를 하고 그것을 준비하는 연습, 웨이트 트레이닝을 하면서 친구들과 친해지고 재미있는 시간을 보냈던 것 같습니다. 체육관이 한국과는 다르게 매우 큽니다. 농구장만 해도 실내에 4개가 풀코트로 붙어있고 아무때나 학생들이 쓸 수 있습니다.(선수들 경기장을 또 따로 있습니다.) 한국에 와보니 농구장이 없어진 것을 보면서 매우 대조가 되어서 씁쓸했습니다.. 또한 축구장(겨울엔 두꺼운 비닐소재를 덮어 돔으로 만듦), 헬스장, 수영장, 암벽등반장, 스쿼시장, 테니스장 등이 있어서 자신이 좋아하는 스포츠를 언제나 마음껏 사용할 수 있다는 장점이 있습니다. 단지 추울 때는 가는 길이 꽤나 멀게 느껴집니다..그리고 저는 농구를 좋아해서 NBA경기를 보러 미니애폴리스에 종종 갔었는데 교통편이 매우 불편합니다. Northstar link라고 미니애폴리스까지 대중교통을 타고 가려면 버스+기차를 타야하는데 Big lake라는 지역까지는 버스를 타고 그곳에서 미니애폴리스(타겟 필드-야구장)까지는 기차를 타게 됩니다. 야구장에서 걸어서 갈 정도거리에 농구장이 있습니다(타겟 센터). 타겟이라는 브랜드가 미네소타에서 런칭을 해서 타겟이 후원을 많이 해주는 것 같습니다. NBA경기는 평일엔 모든 경기가 저녁6시 이후에 이루어지기 때문에 갈 때는 교통편이 있지만 경기가 끝나면 돌아오는 버스와 기차가 모두 끊겨서 Uber택시를 타야하는데 거의 100달러 가까이 나옵니다… 따라서 4명이서 가거나 미니애폴리스를 여행가는 때 혹은 평일 낮 경기만 보곤 했습니다. 그렇지만 야구는 좀 다릅니다. 야구와 풋볼경기 있는 날은 이 회사(Northstar link)에서 경기 끝나고 나서 기차와 버스를 운행해 줍니다. 제가 갔을 때 야구가 막바지 시즌이어서 한 경기밖에 보지 못했는데 그 때는 경기가 끝나고 기차와 버스를 타고 돌아왔던 기억이 있습니다. 요번 년도에 박병호 선수가 트윈스에 왔는데 정말 아쉽습니다.. 학관에 가면 버스 시간표(팜플렛)를 모아두는 곳이 있으니 거기서 얻어서 시간계획을 짜면 될 것입니다.","여러 가지 다른 점을 느낀 것을 말씀 드리겠습니다. 우선 한국인들에 비해 잘 씻지 않습니다. 사람마다 물론 다르겠지만 평균적으로 잘 씻지 않습니다. 제가 있는 층 오른쪽 복도에 10개가 넘는 방이 있고 공용 화장실 겸 샤워실이 하나 있었습니다. 그곳에는 변기가 두 개, 샤워실이 두 개가 있었는데 제가 아침,저녁에 씻을 때 가면 항상 비어 있고 물기도 말라 있을 뿐만 아니라 씻는 사람을 많이 보질 못했습니다. 또한 같이 운동하는 흑인 친구들도 보면 언제 씻는 지 모르게 저만 씻고 옵니다… 물론 저는 룸메가 없어서 경험해보지는 못했지만 룸메가 씻지 않아 냄새로 고생하는 한국인을 많이 목격했습니다. 도서관이 일찍 닫는 다는 것입니다. 큰 공휴일엔 도서관, 식당뿐만 아니라 학교 밖 식당까지 문을 닫고 먹을 것이 없어서 당황스러웠습니다. 일정을 잘 확인해보고 식량 준비, 먹을 계획을 짜 놓아야 합니다. 바,펍 클럽마저 새벽2시,3시에 문을 닫습니다.조모임을 하면서 파워포인트 전체 슬라이드를 할 줄 모르는 3학년생을 만나고 절대값을 물어보고 쓸데없는 질문을 하는 학생들을 보면서 매우 답답했습니다. 하지만 반대로 생각해보면 사소한 것이라도 자기가 못 듣거나 모르는 것이 있으면 수업진행 같은 것은 신경쓰지않고 물어보고 한다는 것에 대해 자유로움, 이질감(?)을 느꼈습니다. 교수님을 보고도 친구처럼 대하는 게 신기했습니다.무엇인가 학문적으로 큰 것을 배워온다는 생각이 아니라 자연 속에서 운동을 많이 하고 영어를 많이 놀면서 쓰고 익숙해져서 온다는 생각을 하고 간다면 재미있게 시간을 보내다 올 것 같습니다.","도움 받을 것을 직접 찾아보면 됩니다. 친구 들에게 물어봐도 잘 모릅니다. 그 관련된 기관에 가서 물어보든지, 자신이 검색해서 찾으면 금방 나옵니다. 자신이 처음에 찾는 것을 시도할 수 없을 정도의 새로운 정보는 친구들이 알면 알려줍니다.",picachu2007@naver.com 물어보고 싶은 거 있으시면 물어보세요~
