gen_info,env_info,food_info,study_info,office_info,facil_info,mhct_info,help_info,etc_info
LSU는 미국 중남부에 위치한 Lousiana주의 주도인 Baton Rouge에 위치해 있다. Baton Rouge는 그리 큰 도시는 아니지만 차로 한시간 남짓 떨어진 곳에 재즈의 도시로 잘 알려진 New Orleans가 있다. 개인적으로 여행하기에 참 좋았다. 캠퍼스 크기는 연세대학교보다 조금 큰것 같다. 하지만 주로 평지이고 높은 건물이 그다지 많지 않아서 캠퍼스가 커서 힘든점은 별로 없다. Baton Rouge는 여름에 덥고 습한 기간이 3월부터 10월까지 지속되며 2008년 여름에는 허리케인 구스타프로 인해 피해가 컸다. 기숙사내에서 머물면서는 큰 피해가 없었고 전기가 몇시간 나가는 정도였다. 하지만 집밖으로는 거의 일주일동안 나갈 수 없었고 학교도 일주일간 휴강했다. 이곳은 겨울에도 기온이 높아 눈을 보기 힘든 곳인데 2008년 겨울에는 거의 10년 만에 이례적으로 함박눈이 왔다. 운이 좋으면 루이지애나의 눈덮인 겨울을 볼 수 있을 것이다.,학교는 경치가 매우 아름답다. 학교를 감싸고 있는 두개의 인공호수는 산책하기에도 좋아 인기가 많다. 또한 학교에서 학교의 상징인 호랑이를 직접 기르는 우리가 있고 엄청난 규모의 Football 경기장이 있다. 학교 주변을 밤에 돌아다니는 것은 조금 위험하지만 위험지역이 어디인지 사전에 잘 알고 피해서 다니면 큰 문제는 없다. 학교 주변에 월마트 등 식료품을 구할 수 있는 곳이 걸어갈만한 거리에 있지 않아서 차가 없이 다니기는 조금 불편하다. 하지만 학교 내에 운행하는 버스도 있고 친구를 통해서 라이드를 얻으면 그리 큰 어려움은 없고 downtown쪽으로 가면 몰이나 기타 상점에서 필요한 것들을 살 수 있다. Baton Rouge는 매우 한적한 도시이기 때문에 큰 도시의 화려한 매력을 느낄 수는 없다. 대신 평화롭고 여유로운 생활을 영위하기에는 매우 좋은 곳이다.,"캠퍼스 내에 여러 기숙사가 있는데 그중에서 아파트형 기숙사를 추천한다. 내가 살았던 East Campus Apartment는 각 강의실과 도서관으로부터도 가깝고 시설도 좋아서 굉장히 살기 편했다. 아파트 한 세대에 4개의 private room과 2개의 화장실이 있으며 부엌과 거실을 공용으로 사용한다. 전화비나 인터넷, 티비케이블이 Housing cost에 포함되어 있으며 세탁기와 건조기도 집안에 있으서 매우 편리하다. 물론 일반 기숙사보다 비싼 것을 감안해야 한다. 밀플랜도 여러 종류가 있어서 자신에게 맞는 것으로 선택하면 된다. 나의 경우는 밀플랜을 따로 신청하지 않고 주로 집에서 밥을 해먹고 밖에서 먹고 싶을 때만 학생 식당을 이용하거나 아니면 학교 주변 식당을 이용했다. ISEP은 기숙사비와 식비를 교환하기 때문에 꼭 학교 내에서 숙식을 해결해야 된다고 생각할 수도 있는데 그렇지 않다. 받은 기숙사비와 식비를 굳이 학교에서 사용하지 않고 개인적으로 환불 받아서 학교 밖에서 살거나 개인적인 식비로 사용해도 된다.","수업은 첫학기에 전공으로 3과목(Business Finance, Consumer Analysis&Behavior, International Marketing)과 English Composition 1004수업을 들었고 두번째 학기에도 전공 3과목(Financial Markets&Institutions, Advanced Corporate Finance, Investments)과 English Composition 1005, Chinese Biginner 수업을 들었다. 수업 내용은 특별히 따라가기 힘들거나 어렵지는 않고 주로 중간고사와 기말고사가 객관식으로 시험을 보기 때문에 수월하다. 다만 수업 내용이 아닌 수업 형식 때문에 어려움을 겪을 수는 있는데 International Marketing이나 Advanced Corporate Finance 같은 경영학과 수업은 특히 보고서나 Group Project, 발표수업 등이 부담이 많이 된다. 하지만 어려운 점이 있을 때마다 교수님들께 도움을 청하면 즉시 도와주시기 때문에 크게 걱정할 일은 아니다. Englsh Composition 1004, 1005는 둘다 영어를 Second Language로 하로 학부생과 대학원생을 위한 수업으로 다양한 형식의 영어 Essay를 배우고 써볼 기회가 많고 수업시간 외에 써서 제출하는 essay등과 학기중, 학기말에 주어진 시간 내에 실시하는 In-class essay로 평가를 하기 때문에 조금 힘들게 느껴질 수는 있지만 영어 writing 실력을 향상하는데 큰 도움이 된다. Chinese biginner 수업은 영어로 중국어를 배우는게 어렵다고 생각할 수 있지만 오히려 훨씬 쉽고 미국학생들이 중국인 교수를 통해서 중국어를 배우는 모습을 보면서 함께 공부를 하는 것이 재미있다. 
도서관은 주로 학교 중앙에 위치한 Middleton Library를 사용하게 될텐데 이 건물은 4층 건물로 1층엔 PC가 많고 group meeting을 하거나 자유로운 분위기에서 공부하기 좋다. 2층에도 PC가 많은데 2층부터 4층은 조용하게 공부할 수 있는 장소가 마련되어 있다. 도서관은 1, 2층은 조금 복잡한 편이고 3, 4층은 사람이 많이 없어서 조용히 공부하기 좋다. 각층마다 엄청난 량의 도서와 각종 자료들이 구비되어 있으므로 수업에 필요할 때마다 빌려보면 매우 유용하다.","Hatcher Hall에 가면 ISEP담당자인 Rachal Daroca씨가 있는데 그분을 통해서 여러 가지 도움을 받을 수 있다. 미국으로 가기 전부터 그분과 이메일을 주고받으면서 수강신청 문제와 Housing, Mealplan, 공항 Pick-up 등에 대해 많은 정보와 도움을 받을 수 있었다. 나는 봄학기와 가을학기 사이에 타주에 있는 대학에 가서 ESL Program에 참여하고 싶었는데 그와 관련된 서류 문제에 관해서도 도움을 많이 받았고 Rachal이 직접 상대교의 담당자와 이메일을 주고 받으면서 내가 그 program에 참여할 수 있도록 많은 도움을 줬다. 또한 International Cultural Center(ICC)가 있는데 이곳은 International 학생들을 위해 마련된 공간으로 다양한 프로그램과 체험기회를 마련하고 있다. 이곳에서 주최하는 각종 행사나 trip을 통해서 재밌는 경험을 많이 할 수 있다.","LSU에는 교내에 International 학생들을 위한 Loan Closet이라는 벼룩시장 개념의 상점이 있는데 매주 목요일 1시부터 4시 반까지 open한다. 이곳에서는 필요한 생활용품, 가전제품, 각종 식기류, 가재도구 등을 싸게 살 수 있고 특히 원하는 기간동안 사용후 반납하면 전액을 다시 환불 받을 수 있기 때문에 매우 경제적이다. 뿐만 아니라 학용품이나 기타 소비성상품들도 시중가격보다 훨씬 싼 가격에 구입할 수 있으므로 매우 유용하다. 동아리는 여러 종류가 있고 학기초마다 모집을 하기 때문에 관심이 있다면 참여할 수 있고 한인학생회에는 별도의 가입 없이도 자동으로 가입되기 때문에 한인학생회에서 주최하는 각종 행사에 참여해서 지역사회 한인들과 친목을 다질 수도 있다.",생각보다 큰 문화 충격은 없다. 다만 이 지역 사람들은 매우 친절하고 착하지만 지극히 개인적인 측면도 있어서 관계의 어려움도 있을 수 있다. 또한 언어적 장벽이 있기 때문에 현지 친구들과 가까워지기 위해서는 많은 노력이 필요하다. 또 한가지 문화적 충격이라면 수업분위기가 굉장히 다르다는 점이다. 수업에서 학생들이 중간중간 질문과 농담을 교수님에게 던지기도 하고 교수님과 매우 격의 없이 지내기 때문에 수업 분위기가 매우 자유롭다. 그밖에 개인차에 따라 문화충격을 받는 범위는 상당히 다를 수 있다.,주로 학교에 있는 ISEP담당자와 ICC를 통해서 도움을 받을 수 있고 한인의 도움을 받고자 한다면 한인교회를 통해서 받을 수 있다. (www. kccbr.com),"만약 봄학기에 LSU에 가게 된다면 Mardi Gras축제에 꼭 참여해보기를 추천한다. Mardi Gras는 Louisiana 지역이 프랑스 식민지로 있을 때 프랑스에서 건너온 축제로 오히려 프랑스에서는 사라졌지만 이지역에 남아있는 큰 축제이다. 캠퍼스내, Baton Rouge Spanish Town, 또는 New Orleans에서 Parade가 펼쳐지고 여러 가지 재밌는 행사들이 많다. 
끝으로 교환학생 기간은 나에게 잊을 수 없는 특별한 시간이었다. 교환학생 기간동안 힘들때마다 어려움을 극복할 수 있도록 도움을 주신 많으 분들께 감사하고 나도 이곳에 가게 될 다른 교환학생이 있다면 도움을 주고 싶다.(ysjloveyk@hotmail.com)"
"LSU는 Louisiana주의 Baton Rouge라는 도시에 있다. Baton Rouge는 주도에 해당되는 곳이며, 작년 카트리나의 피해를 입었던 New Orleans로 부터 차로 1시간 남짓하게 떨어진 곳에 위치하고 있다. New Orleans와 무척 가까운 거리에 놓여 있지만, 카트리나 피해 당시 Baton Rouge는 거의 피해가 없었다. 그러므로 허리케인에 대한 피해에 대해서는 걱정할 필요가 없을 듯 하다.
LSU의 캠퍼스 크기는 연세대학교보다는 조금 작은 편이지만, 그래도 미국 내에서는 매우 큰 캠퍼스에 속한다. 그래도 언덕이 없는 평지로 이어지는 곳이라 걸어다니기에는 연세대학교만큼 힘들지는 않다. 또한 한국과 마찬가지로 전공관련 수업은 한 곳에 모여 있는 경우가 많으므로, 캠퍼스가 크다고 해서 불편함을 느끼는 경우는 그다지 없을 것이다. 내 경우에도 한학기 동안 있으면서 캠퍼스 내에서 가보지 않은 곳이 상당히 많이 남아 있었다.
LSU가 위치한 Louisiana주는 한국의 여름날씨보다도 더욱 습하고 더운 날씨가 오랫동안 지속된다. 일년 내내 습한 날씨가 지속되며, 기온은 3-4월부터 조금씩 더워지기 시작하여, 10월까지 지속된다고 한다. 특히 7,8,9월은 더위가 가장 심하며, 이 기간 동안에는 가끔 견디기 힘든 더위와 습도가 지속된다고도 한다. 그러나 그런 날씨때문에 어느 건물에서든지 에어컨이 가동되므로, 건물 밖으로 나가지만 않는다면 더위로 인해 고생할 일은 없을 것이다. 나의 경우에도 도서관에서 주로 생활했기 때문에 더위로 크게 고생한 기억은 없다. 또한 겨울에도 이러한 기후의 영향으로 그리 춥지 않다. 날씨가 많이 추운 겨울도 한국의 쌀쌀한 가을날씨 정도로 예상하면 될 듯 싶다.","대학 주변에는 이렇다 할 것들이 없다. 그나마 패스트푸드점이나 술집 등이 학교 동북문쪽에 모여 있으나 그리 많지는 않다. 그래도 주말이면 학교 북문에 위치한 Chimes라는 술집에는 학교 학생들로 발디딜틈 없이 붐비게 된다. Chimes는 주중에는 술집으로, 주말에는 술집과 클럽으로 운영되는 곳으로 학교 근처의 거의 유일한 술집으로 생각되는 곳이다. 그러므로 주말이면 학생들로 붐비는 것이 당연하다. 그 외에도 2-3개의 술집들이 북문쪽에 모여 있지만 그다지 인기가 좋지 않으며, 크기도 작다. 학생들은 보통 집에 모여서 파티를 하거나 술을 마시는 경우가 많다. 대부분의 상점들은 학교 동북문쪽에 모여 있다고 생각하면 된다. 이곳에 카페, 서점, 술집, 패스트푸드 점등 몇몇 여가생활(?)을 즐길 수 있는 것들이 모여 있다.
서점이나 학용품점 등 필요한 대부분의 것들은 학교 내의 Student Union이라는 곳에 모여 있다. 이곳은 일종의 학생회관과 비슷하다고 할 수 있으며, 여기에는 서점, 식당, 콘서트 홀, 우체국, 은행 등 대부분의 서비스 업종들이 모여 있다. 또한 학교 서쪽으로는 미시시피 강이 흐르고 있으며, 자전거를 타고 간다면 쉽게 가볼 수 있으나 걸어가기에는 다소 먼 거리 일 수도 있다. 미시시피 강에 가면 산책을 하는 사람들을 쉽게 찾아 볼 수 있다.
학교 서북문 쪽은 값싼 아파트 들이 모여 있는데, 혹시 아파트를 렌트해서 살 계획이 있는 사람이 있다면 이곳은 절대 추천하고 싶지 않다. 흑인들이 많이 사는 곳이여서 집값은 다른 곳에 비해 다소 싼 편이지만, 치안이 좋지 않아 큰 봉변을 당할 수도 있다.","학교에는 10가지가 넘는 기숙사가 있으나 모두 오래된 기숙사들로 큰 차이는 없다. 대부분이 2인 1실이고, 화장실은 층별로 공동 화장실을 쓰거나 2방이 하나의 화장실을 사용하여 4명이 함께 사용하는 경우가 많다. 룸메이트를 정해 줄때는 아시아 사람에게는 미국인 백인을 붙여주는 경우는 거의 없다고 한다. 보통은 남미나 흑인을 붙여주는 경우가 많다. 기숙사에서는 방마다 TV케이블선과 랜선이 있으므로 TV와 컴퓨터만 있다면 모두 무료로 사용할 수 있고, 방마다 전화선은 하나씩 쓸 수 있다. 물론 전화기도 직접 사야한다. 그리고 층마다 주방이 있어서, 심하게 냄새나는 음식은 해먹기 어려우나 라면 정도는 끓여 먹어도 괜찮을 듯 싶다.
그 외에는 학교 아파트가 몇 개 있는데, 혼자 쓰는 아파트의 경우에는 석사 이상에게만 제공되는 곳으로, 니콜슨 아파트와 에드워드게이 아파트가 있다. 만약 이곳에 들어가고 싶다면 룸메이트로 들어갈 수 있다. 종종 이곳에 혼자사는 학생들이 룸메이트를 구한다는 광고를 학교 신문 등이나 유니온 광고판에 내기도 한다. 방값은 한달에 450~500불정도 하므로 둘이 함께 부담하면 저렴하게 지낼 수는 있지만, 벌레가 많은 단점이 있다. 특히 바퀴벌레가 많아 여름에 매우 고생한다고 한다.
내가 지냈던 곳은 4 bedroom으로 된 East Campus Apartments 였다. 이렇게 4 bedroom으로 된 학교 아파트는 ECA(East Campus Apartments)와 WCA(West Campus Apartments) 두군데가 있으며 ECA가 지은지 좀 더 오래 되었다고 한다. 그러나 두 아파트 모두 지은지 몇 년 되지 않아 매우 깔끔하고, 벌레도 없다. 루이지애나는 남부지역이며, 더운 지방이라 여름이면 벌레가 아주 큰 문제거리이다. 그러나 나는 이곳에 살면서 벌레 때문에 걱정한 일은 없다. 이 두 곳 아파트는 각자 쓰는 방이 4개가 있고, 화장실은 2개가 있으며 주방과 거실은 하나씩 있다. 그러므로 프라이버시가 어느정도 보장되고, 화장실 등을 편하게 쓸수 있으며 깨끗한 환경에서 지낼 수는 있으나, 값이 비싸고 4명이 함께 주방등을 사용하므로 시간대를 잘 맞춰서 사용해야 한다. 또한 방이 다소 좁다는 단점이 있다. 방값은 한학기(4개월)에 2600~2800불 정도 한다.
학교의 대부분의 학생들은 따로 집을 얻어서 사는 경우가 많다. 학교 동북문쪽이나 남문쪽으로 집을 싸게 잘 구한다면 한달에 400불 이내로 구할 수 있을것이다. 이러면 학교로 걸어다닐 수 있으므로, 차를 사지 않아도 되며, 또는 학교에서 자주 운행하는 버스가 있는데, 그 버스 노선에 있는 집을 구한다면 또한 버스를 통해 통학할 수 있다. 뉴욕 등의 집값이 한달에 1000불이 넘는 다는 것을 감안하면, 400불로 원베드룸 아파트를 구할 수 있다는 것은 매우 싼값이다. 학교 학생들은 대부분 학교 근처에 집을 구하고, 자가용을 타고 통학한다. 이곳에서는 차 없이 다니는 것이 힘들기 때문에 학생 대부분이 자가용을 소유하고 있다.
식사는 학교에서는 학교 식당을 이용할 수 있다. 학교 식당은 뷔페식으로 운영되는 곳이 2군데 있고, 학생회관이라 할 수 있는 Union에서는 햄버거나 피자 등 몇몇가지 음식을 판매한다. 아니면, 학교 동북문쪽의 패스트푸드점 등을 이용할 수도 있다.","학교 수업은 한국과 큰 차이가 없다. 1000, 2000, 3000, 4000 단위 등으로 수업이 이루어지며, 1000단위 수업은 1학년 2000단위 수업은 2학년 등으로 생각하면 된다. 이곳도 한국과 마찬가지로 1학년때에는 전공이 없으며 교양 수업을 듣게 된다. 2학년때 전공이 정해지면, 그때부터 전공수업을 듣는다. 전공수업의 경우 한국과 다른점은 선수과목이 엄격하게 지켜진다는 것이다. 예를 들어서 C라는 수업을 듣기 위해 A와 B 수업이 선수과목으로 정해져 있다면, 반드시 A와 B 수업을 수강해야만 C 수업을 들을 수 있다. 만약 듣지 않았다면 수강신청이 아예 되지 않거나, 되더라도 교수가 나가라고 한다. 교환학생의 경우에는 반드시 우리학교 성적표를 지참하여 교수가 선수과목을 요구할 경우 성적표를 보여주고, 선수과목과 비슷한 과목의 수업을 들었음을 설명하면 수업을 듣도록 허락해준다. 또한 전공의 경우에는 C학점 이상을 받아야 다음 단계의 수업을 들을 수 있다. D를 받았다면 패스로는 인정되나 선수과목을 이수한 것으로는 인정되지 않으므로 다음단계 수업을 들을 수 없다. 수업은 퀴즈나 숙제가 많으며, 이들은 모두 철저하게 학점에 반영된다. 또한 팀프로젝트의 경우에는 팀원 서로가 서로를 평가하여 제출하기도 하므로, 항상 준비를 철저히 해야한다. 교양과목은 따로 교양과목으로 나뉘어져 있지는 않다. 단지 다른 전공의 1000단위 수업등을 들으면 그것이 교양으로 인정되는 경우가 많다.
학교 도서관은 연세대학교의 도서관보다 그 크기가 휠씬 작다. 그러나 시험기간에도 항상 비는 자리가 있으며 평소에는 사람이 그리 많지 않다. 학생들은 한국 학생들처럼 밤샘공부를 하거나 벼락치기 공부를 하는 경우가 그리 많지 않다. 보통은 자기 집에서 소규모로 모여서 공부하거나 아니면 커피숍 등에서 쉬엄쉬엄 공부한다. 밤샘 공부를 하는 학생들은 대부분 아시안 계통이나 남미계통이다. 평소에 잘 보기 힘든 한국 학생들은 시험기간에 도서관에 가면 쉽게 볼 수 있다.","Jane Chandler라는 ISEP 학생 담당자가 여러모로 도움을 줄 것이다. 학기 초에는 많은 도움을 받을 수 있지만, 학기가 조금 지나면 다음학기에 올 학생들에 대한 준비로 바쁘기 때문에 다소 적극적인 도움을 받기는 어려울 수 있다.","2월말에서 3월초순경에는 Mardi Gras 축제에 참여할 수 있을 것이다. 이는 미국에서도 매우 큰 행사이며, 이 기간중에는 학교도 3일정도 휴강을 한다. 이 기간에 뉴올리언즈에 가면 미국의 전형적인 퍼레이드 행사를 볼 수 있다. 또한 3월경부터는 Crawfish라는 민물가재가 제철을 맞이한다. Crawfish는 루이지애나의 특산물이라고 할 수 있을만큼 매우 유명한 음식이다. 3월부터 5월정도가 제철이며, 값도 비싸지 않으므로 1인당 15불에서 20불정도면 충분한 양의 Crawfish를 맛볼 수 있을것이다.
학교에서는 가을시즌이 되면 Football로 인해 온통 난리가 난다. LSU의 Football팀은 미국 대학 순위에서 거의 1-2를 다툴만큼 강력하다. 학교의 스타디움에서 경기가 있는 날이면 도로를 다 막아야 할 정도로 큰 행사가 치뤄진다. 가을학기에 교환학생을 가게 된다면, 이 큰 행사를 직접 볼 수 있게 될 것이다.","특별한 Culture Shock는 없으나, 분명한 것은 한국과는 다소 다른 문화를 지니고 있다는 것이다. 다른 문화를 그냥 있는 그대로 다른 문화로 받아들인다면, 별다른 Culture Shock는 느낄 수 없을 것이다.","교내에서는 Jane Chandler를 통해 학교관련 사항에 대해 도움을 받을 수 있을 것이다. 또한 그 외에 학교 수업이나 성적관련 문의는 학교의 T. Boyd Hall을 찾아가면 Undergraduate 학생관련 사무실들이 모여 있으므로, 문의하여 도움을 받을 수 있다.
그 외에는 한인교회나 한인학생회를 통해 도움을 받을 수 있는데, 모두가 친절하고 적극적으로 도움을 주므로 어려울 때 연락하면 큰 힘이 되어줄 것이다. 학생들중에는 학부생들도 여럿 되므로 또래의 친구들을 만날 수 있는 기회도 될 수 있다. 나 역시도 처음 한동안 기숙사에 들어가기 전까지 2주정도 집을 구하지 못해 신세를 졌으며, 그 외에도 차 라이드 등 정말 많은 도움을 받을 수 있었다. 한인학생회 홈페이지는 www.lsu.edu/student_organizations/ksa 이며, 한인교회 홈페이지는 www.kccbr.com 이다. 또한 싸이월드 주소는 club.cyworld.com/lsubr 이다.","한학기동안 정말 좋은 경험이었다고 생각한다. 다른 교환학생들은 정말 힘들고 어려운 시간이었다고 말하는 사람들도 있으나, 난 지내는 동안 단 한번도 힘들다고 느낀적은 없는 듯 하다. 좋은 사람들을 만나고 친구들을 만나, 마냥 즐겁고 좋은 시간들이었던 듯하다. 또한 내가 처음 적응하는데, 많은 도움을 준 한국분들께 너무나도 감사하며, 나 역시 누군가에게 그런 도움이 되길 바란다. 도움이 필요하다면 언제든 연락하기 바란다.(gimgibong@gmail.com)"
