gen_info,env_info,food_info,study_info,office_info,facil_info,mhct_info,help_info,etc_info
Nebraska 주는 북미 내륙 한가운데에 위치하고 있습니다. Nebraska Wesleyan University(이하 NWU)는 네브레스카의 주요 도시 중 하나인 lincoln에 있는 작은 사립대학교 입니다. 연세대학교에 비하면 건물도 별로 없는 편이고 대학 부지 자체도 그리 큰 편은 아니고 학교 끝에서 끝까지 15분이면 걸어다닐 수 있는 정도입니다. 기후는 한국과 크게 다르지 않지만 겨울철에는 많이 건조한 편이고 12월~1월에는 눈이 정말 많이 내리며 기온도 많이 내려갑니다.,"Lincoln이 Nebraska 주에서 도시에 속하긴 하지만 전형적인 시골 타운의 모습을 하고 있습니다. 학교 밖으로 나가서 볼일을 보기 위해선 무조건 자가용을 타지 않으면 가기 힘든 거리입니다. 대중교통수단으로서 버스가 있긴 하지만 배차 간격이 너무 길고 목적지까지 돌고 돌아가기 때문에 웬만하면 타지 않는 것을 추천합니다. 시내에 Gateway mall이라는 쇼핑센터가 있는데 NWU에 도착한 첫 주말, 친구와 버스를 타고 2시간에 걸쳐 다녀오는 모험을 했습니다. 얼마 후 현지 친구의 자가용을 타고 그곳을 15분만에 갈 수 있다는 사실을 알게 된 충격적인 경험이 있네요^^ 하지만 학교 주변 10분거리에 Walgreens라는 대형 드럭 스토어가 있어 생활용품부터 의약품까지 웬만한 것들은 다 구할 수 있습니다. 아시안 음식이 드시고 싶으시면 House of Hunan이라는 레스토랑도 걸어서 갈 수 있는 거리에 있습니다. 한국 식료품을 판매하는 Oriental Market, 대형 식료품점 Target, Supersaver도 자가용으로 10분 거리에 있습니다. NWU에 가신다면 음식 적응에는 그렇게 걱정 안하셔도 됩니다. 라이드를 부탁하는게 자연스러운 미국 문화에서 친구를 사귀신다면 다들 흔쾌히 응해줄거에요.","교환학생들은 전부 Centennial 이라는 기숙사에서 살게 됩니다. 한 층에 소파, 티비가 있는 pod을 중심으로 독립적인 방들이 벽을 따라 붙어있는 형태입니다. 대부분 1인실이고 간혹 2인실이 있기도한데 본인이 신청할 수 있습니다. 1년동안 수학하실 계획이라면 작은 냉장고 정도는 렌트하시는 것을 추천합니다. 큰 냉장고와 전자렌지가 구비되어있는 키친이 1층에 있긴 하지만 엘리베이터가 없어 약간 불편할 수 있습니다. 세탁은 지하에 있는 빨래방을 이용하게 됩니다. ISEP학생은 풀 밀플랜을 신청하게 되며 카페테리아에서 하루에 3번 식사를 하실 수 있습니다. 학교에 식당이 하나밖에 없는 단점이 있지만 뷔페 형식으로 메뉴가 다양합니다. 매일 점심과 저녁 때는 아시안 푸드가 조리되는 것이 장점입니다.","저는 영어영문학과 수업 2개, 경제학과 수업 1개, 미술 수업 1개를 수강했습니다. NWU이 작은 liberal arts university이기 때문에 선택할 수 있는 전공의 폭은 그렇게 넓지 않지만 대부분 소규모 토론 위주의 수업이기 때문에 수업에 참여할 수 있는 기회가 많을 것임을 확신합니다. 초반에는 토론 문화에 적응하기 힘들수도 있겠지만 적극적으로 자신의 의견을 표현하며 speaking 실력을 기르고, 미국 친구들과 대화를 하며 생각의 폭을 넓히기에는 최고의 환경이라고 생각합니다. 특히 영문학과 수업은 교수대 학생 비율이 1:15인만큼 교수님이 학생들의 얼굴과 이름 하나하나를 기억하려고 하시며 잘 챙겨주십니다. 교환학생으로서 도움을 요청하면 흔쾌히 도와주시며 수업 따라가는데 지장이 없게 해주십니다. 어느 교수님께서는 페이퍼를 제출할 때마다 따로 부르셔서 문장 별로 첨삭을 도와주시기도 했습니다. 도서관은 규모가 작고 장서 수도 많지 않지만 대부분 학기 초 학관에 있는 북스토어에서 필요한 교재를 미리 대여하기 때문에 이용할 일이 별로 없었습니다. 저는 주로 친구와 스터디, 혹은 혼자 공부하는 용도로 이용했습니다. 4층에는 현지 학생이 근무하며 writing speaking 첨삭을 해주는 cooper center라는 곳이 있습니다. 과제할 때 도움이 필요하다면 방문하는 것을 추천합니다.","파견대학 확정 후부터 파견 종료까지 국제처 담당자인 Yoko가 모든 일들을 처리해주십니다. 오리엔테이션 때 NWU에 적응하는데 필요한 모든 정보가 담겨있는 두꺼운 책자를 받으실거고, 기타 문의가 있으시면 이메일이나 페이스북 메시지를 통해 Yoko에게 알리고 도움을 청하실 수 있습니다. 국제처 산하 동아리인 IRO는 국제학생들과 교환학생 프로그램에 관심이 있는 미국인 학생들이 모여 일주일에 한번씩 모여 친목을 다지고 회의를 하며 운영됩니다. 교환학생들은 자동으로 가입이 되나 참여여부는 개인에게 달려있습니다. IRO에서 매주 재미있고 흥미있는 프로그램을 기획하고 다른 친구들과 친해질 수 있는 기회를 제공하니 꾸준히 활동하시는 것을 추천합니다.","개강 후 하루 이틀정도 작은 동아리 박람회가 열립니다. 봉사동아리, choir, 운동동아리 등 다양한 동아리가 있었던 것으로 기억합니다. NWU에 다니시면 학교 메일 계정이 하나 생기실텐데 그것을 통해 학교의 모든 행사/소식이 전달됩니다. 짧은 강연, 뮤지컬, 세미나, 친목회 등 잘 찾아보시고 활용하시면 미국 친구를 하나라도 더 사귈 수 있는 좋은 통로가 될 것 같습니다.",문화충격을 받은 적은 크게 없었습니다.,"국제처 담당자인 Yoko를 통해 학교 생활 전반에 대해서, 교내 상담소에서 초기 정착으로 인한 정신적 스트레스에 대해, centennial 기숙사 내 담당 PA(peer assistant)에 생활 전반, 기숙사 관련 도움을 요청할 수 있습니다.","미국의 전형적인 시골 마을의 작은 사립학교, 백인이 절대 다수를 차지하는 NWU에는 문화적 다양성에 대해 인식하고 있는 친구들도 많지만 그렇지 않은 친구들도 많습니다. 하지만 동양인(특히 한국인)이 많지 않은 환경에서 영어에 쉽게 노출될 수 있고 영어로 말할 기회도 많습니다. 실제로 제가 파견됐을 때에는 다른 학교 출신 한국인 친구 한 명과 제가 유일한 한국인이어서 외국인 친구들과 함께 어울려 놀기도 하고, 서로 영어 발음을 교정해주기도 하며 한 학기를 잘 마무리할 수 있었습니다. 또한 NWU 학생들은 사투리가 없는 영어를 구사하기 때문에 정통 미국식 영어 발음을 배우기에도 최적의 환경이라고 할 수 있습니다. 짧은 한 학기였지만 미국 문화를 접하고 일상 회화 실력을 늘리기에 너무나도 적합한 곳이었기에, 한국인이 많지 않은 환경에서 영어회화실력을 기르고 싶은 목표를 가진 후배들에게 NWU를 강력히 추천합니다. 추가적으로 궁금한 사항이 있으시면 alic****@naver.com으로 연락주세요."
"Nebraska는 Chicago에서 비행기로 1~2시간 정도 걸리는 곳에 위치합니다. Capital city인 Lincoln과 Omaha가 대표적인 도시이고, Omaha가 상권이 발달 되어 있다면 Lincoln은 관공서가 위치한 중심 행정지라 할 수 있습니다. Wesleyan University는 Lincoln의 구 중심가에 위치하고 있어, 새로이 발달한 번화지인 University of Nebraska in Lincoln (UNL)과는 버스로 30분 정도 걸리는 곳에 자리하고 있습니다.","NWU는 Lincoln의 번화가에서 조금 떨어져 있어, 굉장히 조용하고 쾌적한 환경에 위치하고 있습니다. 가장 가까운 곳에 있는 마트는 Hyvee와 Walgreen으로 왠만한 물건과 먹을 거리들을 살 수 있습니다. 그 외에 큰 마켓들은 Supersaver, Target, BestBuy 등은 걸어서 30~40분 정도 되는 거리에 있어  조금 불편하기도 하지만, 미국인 친구들에게 부탁하면 차를 얻어 탈 수 있고, 버스를 타고 시내에 나가는 재미도 있으므로 크게 문제되었던 것 같지는 않습니다. 매번 차로 데려다 달라고 부탁하기는 어려우므로 시내에 나갔을 때 HayMarket주변의 information center에서 버스노선도를 구해서 Westfield, South Point등 영화관, 쇼핑센터가 있는 곳으로 나갈 수 있습니다.","국제학생들은 Centennial Hall이라는 기숙사에 머무르게 되고 식사는 Cafeteria에서 하게 됩니다. 매번 돈을 낼 필요 없이 meal plan을 사용하게 되며 매 주 23 번의 식사로 쓸 수 있습니다. 주로 샐러드와 피자와 햄버거, 디저트 등 전형적인 미국식 식사를 하게 되고, 간식으로는 지하에 있는 매점에서 샌드위치와 음료수를 받을 수 있습니다. 또, credit으로 살 수 있는 간식메뉴 이외에 매점에서는 식당에서보다 조금 더 다양한 메뉴의 음식을 팔기 때문에 교수님들도 자주 사 드십니다.","NWU의 영문과와 Theatre수업은 굉장히 만족스러웠고, 깊이 있는 토론과 Essay 작성을 통해 진정한 대학공부가 무엇인지를 경험 할 수 있었습니다. 일단, 외국인으로서 그 나라의 문학을 읽고 토론하는 것은 시간도 많이 걸리고 힘들었지만, 교수님들께서 굉장히 배려를 많이 해주시고, 배우는 것이 너무나도 많기 때문에  꼭 도전해 볼 만한 일이라고 생각합니다. 영문학 수업은 주로 해당 주에 reading material을 읽고, response paper을 제출하고 수업 땐느 학생 주도로 작품의 의미에 대한 깊은 분석과 토의가 이루어 집니다. 정답을 찾는 것이 아니라, 학생들 모두 각자의 독특한 해석을 이야기 하며 유쾌하게 토의에 참여하고, 교수님들 또한 굉장히 친근하시기 때문에, 제가 말을 많이 하지 못하더라도 즐겁게 토의를 즐길 수 있었습니다. 많은 작품을 겉만 핥는 방식으로 지나가는 것이 아니라, 1~3주에 한 작품을 하기 때문에 작품을 깊이있게 공부하고 생각해볼 수 있었습니다. Paper 또한 교수님들의 자세한 피드백을 받을 수 있기 때문에, 나중에 대학원에 진학해서 논문을 쓸 때 도움이 될 것이라 생각합니다.","IRO는 NWU의 가장 큰 동아리 중 하나로, 각 국에서 온 교환학생들과 외국의 문화에 관심있는 미국 학생들이 함께 활동을 하고 교환학생들의 적응을 돕는 일을 합니다. 매주 이벤트도 많고, 파티 등을 통해 재미있는 시간을 보낼 수 있습니다. NWU은 작은 학교이고, 학생 중심의 교육 철학을 가지고 있는 Liberal Arts School 이기 때문에 국제학생들에게도 많은 지원을 해 줍니다.",,"Lincoln이 다양한 인종이 모인 곳은 아니기 때문에, 아시안 학생들이 별로 없습니다. 때문에 처음엔 조금 이질감도 들기도 하지만, 자신감을 가지고 정체성을 지키는게 중요한 것 같습니다. 특히,문화적 차이점에 대해서 수업중이나, 평소 대화를 할 때 질문을 많이 받게 됩니다. 한국에 대해서 발표를 해야할 경우도 생기고, 한국 문화 수업을 진행해야 할 기회도 있을 수 있습니다. 따라서 평소에 한국에 대해서 생각을 하고, 어떻게 소개를 할 지 생각을 해놓는게 필요할 것 같습니다.",,
"Nebraska Wesleyan University는 미국 중부 Nebraska주의 주도 Lincoln시의 외곽지역에 위치하고 있는 작은 대학입니다. NWU의 학생수는 약 2000여명 정도이며 한국에는 잘 알려져 있지 않지만 Nebraska 주 내의 많은 대학중에서 랭킹 1~2위를 다투는 주 안에서는 꽤 잘알려진 사립대학입니다. Nebraska주는 미국 지도를 기준으로 동 서 남 북 거의 정확하게 중앙에 위치해 있습니다. 전형적인 미국 사회의 모습이며 인종은 거의 모두 백인입니다. Nebraska의 기후는 매우 변화무쌍합니다. 여름엔 기온이 섭씨 40도를 넘나들고 한국의 장마철보다 훨씬 다습하며 겨울엔 눈이 자주 그리고 많이 옵니다. Downtown은 학교에서 차로 약 20분정도 떨어져 있으며 그리 크진 않지만 기본적인 바와 클럽, 영화관 등의 여가를 즐길수 있는 시설은 다 갖춰져 있습니다. 다운타운에는 네브라스카 주립대가 위치해 있는데 학생수가 약 20000여 명 정도의 큰 대학입니다.",학교주위는 대부분 주택가이며 매우 조용한 편입니다. 주중에도 수업이 끝나는 오후부터는 조용한 편이며 특히 주말엔 정말 조용합니다. 도보로 가능한 거리에 기본적인 식재료와 DVD 대여소 및 여러 식당들이 있어서 크게 불편하지는 않습니다. 치안은 매우 좋은 편이고 학교에서도 자체 경비시스템이 갖춰져있어서 24시간 학교 주위를 감시하고 있으므로 안전합니다. 다만 너무 늦은 시간엔 기숙사 밖으로 다니지 않는 것이 좋겠습니다.,NWU에 배정된 교환학생들은 기본적으로 Centennial 이라는 기숙사에서 지내게 됩니다. 기숙사는 학교에 소속된 여러 기숙사들 중 시설면으로 제일 낙후되고 제일 오래된 기숙사 입니다. 미리납부하게 될 기숙사 비에서 추가비용을 지불하면 다른 기숙사로 갈수 있다고는 하지만 모든 교환학생들과 같은 건물에서 지낼 수 있으므로 굳이 옮길 필요는 없다고 생각합니다. 제가 있는동안 기숙사를 옮긴 교환학생은 단 한명도 없었습니다. 식사는 학교내에 학생식당에서 하게되며 기숙사와 마찬가지로 미리 meal plan을 제출하고 식비또한 미리 납부하게 되실 겁니다. 음식의 질과 맛은 나쁘지 않지만 2학기로 파견되실분은 나중에 느끼한 전형적인 미국 스타일의 음식에 질릴 수 있으므로 떠나실때 소량의 한국음식들을 가지고 가시면 좋을 듯 합니다. 음식이 질릴경우 학교에서 도보로 약 20분거리에 HYBEE라는 마트가 있는데 기숙사 1층에 취사가 가능한 부엌이 있으므로 여기서 식재료를 구입하여 요리를 해 드셔도 좋을 듯 합니다. 지역이 미국중부이고 대도시가 아니므로 고추장이나 기타 한국 식재료는 없습니다. 다만 HYBEE에 한국라면이 두 종류 있어서 개인적으로 음식이 질릴때면 가끔씩 사다 끓여먹곤 했습니다. 그 이외에 중국이나 일본 식재료들은 조금 있으나 차라리 미국음식을 드시길..학교에서 차로 약 20여분 정도 거리에 월마트가 있는데 더 싼가격에 다양한 재료를 구입할 수 있습니다.,"수업은 한국과 같은 학기제로 운영됩니다. 저는 첫학기에 12학점 두번째 학기에 15학점으로 도합 27학점을 수강하였습니다. 수업은 소규모로 이루어져 정말 큰 수업도 학생수가 40명을 넘지 않습니다. 따라서 연세대학교에서 100여명이 넘는 강의를 들을 때보다 훨씬 능률적인 수업을 경험할 수 있었습니다. 또한 학생수가 적으므로 교수님들도 모든 학생들의 이름을 외우고 강의를 하시고 학생들도 언제든지 자유롭게 수업에 참여할 수 있는 시스템을 갖추고 있어 좋았습니다. 수업의 난이도는 개인의 영어실력 및 기타요소에 따라 상대적으로 느끼겠지만 영어구사가 수월하다면 그럭저럭 따라갈 수 있는 정도의 난이도입니다. 다만 수업당 개인과제 및 그룹과제가 상당히(때로는 귀찮을 정도로) 많고 시험도 수업당 기본 3~4번씩은 보기 때문에 저처럼 졸업때문에 많은 학점이 필요한 경우가 아니라면 적당히 들으시고 외국친구들과의 교류생활에 더 많은 시간을 투자하는 것이 좋을 듯 합니다. 도서관은 3층규모로 그리크지 않고 소장도서도 많지 않으나 네브라스카 주립대를 비롯한 주 안의 타 대학들의 도서를 무료로 빌려볼 수 있는 시스템을 가지고 있습니다. 단 시험기간을 제외하고는 자정에 문을 닫습니다. 시험기간에도 1시간만 연장합니다. 도서관엔 대만에서 이민온 자넷 루 아줌마가 일하고 있는데 도움을 요청할 때마다 친절하게 도와줍니다. 친하게 지내시길 바랍니다.

첫학기엔 International Finance, Promotional Strategy, Financial Management, American Indian History 수업을 수강하였습니다.

International Finance: 기본적인 국제재무에 대해 배우게 되며, 각국의 환매매의 특징, 환율을 이용한 차익거래, 스왑, 옵션등의 내용을 배우게 됩니다. 

Promotional Strategy: 한국의 마케팅 전략 수업과 비슷한 내용을 배우게 되며 그룹과제 및 프리젠테이션이 꽤 많았던 것으로 기억합니다.

Financial Management: 한국의 재무관리 수업과 동일합니다.

American Indian History: 미국 인디언 원주민들의 역사에 대해 배웁니다. 한국에서는 쉽게 접할 수 없는 과목이기에 재미있었습니다. 두번의 큰 Research paper와 많은 시험 및 영화 감상평, 발표, 개인과제 등으로 후회도 했지만 돌아보면 기억에 크게 남는 수업이었습니다. 특히 담당교수인 Mathews 교수님은 항상 쾌활하고 때때로 찾아가 여러가지 사적인 질문 및 이야기도 나누거나 도움을 청할때마다 관심을 갖고 도와주셔서 좋았습니다.  

두번째 학기엔 Investment, International Marketing, Strategic Management, Contemporary India 수업을 들었습니다.

Investment: 한국의 투자론과 비슷하나 미국의 투자이론을 중심으로 하여 다소 다른 내용을 가지고 있습니다. 학문적인 과정과는 별도로 학교 후원금으로 교수님과 학생들이 직접 주식을 구입하고 투자에 대해 배우는 과정이 있어 인상적이었습니다. 단 주식투자를 위한 모임시간은 정규 수업시간에 포함되지 않아 일주일에 두시간씩 따로 시간을 내어 수업에 참가해야 합니다. 담당교수인 Jackman 교수님은 첫학기 재무관리 수업을 들을때도 담당교수여서 그런지 사적인 질문도 많이하고 친하게 지내서인지 더욱 기억에 남습니다.

International Marketing: 국제 마케팅에 대해 배우며, 한 클래스에 여러 조를 짜서 각 조마다 남아메리카의 나라들에 치약을 판매하는 회사를 설립하여 서로 경쟁하는 시뮬레이션 Management 게임을 중심으로 수업이 이루어집니다. 클래스에서 1등을 한 조는 기말시험을 프리젠테이션으로 대체할 수 있는 혜택이 주어집니다.

Strategic Management: 조를 나누어 소규모 항공사를 운영하는 Airline 시뮬레이션을 통하여 서로 경쟁하는 게임을 위주로 여러개의 프리젠테이션이 있고 여러 전략 케이스에 관한 퀴즈들을 바탕으로 합니다. 이 수업은 4학년만 수강할 수 있는 과목이고 수업을 듣기위해서 여러 선수과목들을 미리 수강해야 하므로 듣기가 쉽지 않을 과목이나 원어민들 앞에서 프리젠테이션 할 수 있는 기회가 많이 주어지므로 들어볼만한 과목입니다. 난이도도 생각보다 높지않은 과목이므로 가능하다면 꼭 들으시길..

Contemporary India: 말그대로 현대 인도의 종교 및 문화 그리고 경제에 대해 배우게 됩니다. 사실 타 과목에 비해 쉬워보여서 신청했던 과목인데 생각보다 재미있는 수업이었습니다. 개인적으로 과거 한국의 경제발전과 인도경제의 문제점을 비교하는 프리젠테이션을 했던게 기억에 남고, 인도의 '발리우드' 산 인도영화를 여러편 봤던것도 기억에 남습니다. 한번 수강할 만한 과목입니다. 인도영화 생각보다 재미있습니다. 수강한 학생수가 10명 남짓이어서 모두 친하게 지내고 교수님과 같이 주말에 같이 인도식당에 가고 영화도 봤던 기억이 납니다.
Hispanics and Latinos in America: 미국으로 이주한 히스페닉과 라틴인들이 미국에서 겪는 여러 문화적 여려움 및 인종차별에 관한 수업입니다. 한국에서 듣기 어려운 수업이니 한번 들어보시면 좋을 것입니다. 쉬운 수업입니다.

기본적으로 모든 교수님들이 친절하고 특히 교환학생들에게는 더욱 관심을 가져주십니다. 학생들도 대부분 친절하므로 원어민 및 타 국가 교환학생들과 재미있는 수업들으시길 바랍니다.",학생식당이 있는 Student Center의 1층에 교환학생처가 있으며 Dr. Inger 가 처장으로 있고 일본 출신의 Yoko와 함께 학생들을 돕고 있습니다. 두 분 다 정말 친절하고 사적인 이야기로 방문하여도 언제든지 환영해줍니다.,"교환학생처에서 주관하는 I-PAL (International Pal) 시스템이 있는데 이것을 통하여 자진 신청하여 미리 선발 된 미국 원어민 재학생들이 새로 온 교환학생 당 한 두명씩 짝지워져 초기에 겪게되는 언어적이나 문화적, 행정적으로 겪을 수 있는 문제를 도와주는 시스템입니다. 저도 개인적으로 제 미국인 친구가 출국전부터 이메일도 보내주고 도착 후에도 이 친구한테 정말 많은 도움을 받았습니다. 또한 교환학생에게 관심이 있는 미국인 친구들도 많아 필요시 라이드를 요청하면 언제든지 태워줍니다. 또한 국제교류처에선 매주 교환학생 및 미국학생들로 구성된 자치회 IRO를 열어 여러 이벤트와 여행를 준비하고 교류를 같는 시스템을 가지고 있습니다. 의무적으로 가입해야 하는 건 아니지만 가입하면 여러모로 좋으므로 꼭 가입하시길..
또한 원하는 경우엔 학교내에 한해서 아르바이트를 할 수 있습니다. 저도 긴 여름방학 기간에 교내에서 아르바이트를 했었는데, 미국인들과 할께 일하면서 돈도 벌고 영어실력도 늘릴수 있는 좋은 기회라고 생각합니다. 학교내엔 각 건물마다 컴퓨터 Lap실을 갖추고 있어 자리가 없어 출력을 하지 못하는 경우는 없으며 출력비는 무료입니다. 또한 학교내에 수영장 스쿼시 체력단련실 농구장...등등의 장소를 갖춘 커다란 체육관이 있는데 역시 무료로 언제든지 이용가능합니다. 학교 스타디움 천연잔디 위에서 축구를 즐길수도 있습니다.",다소 개인주의적인 미국인들의 성격과 태도에 때때로 당황한 적은 있었으나 딱히 기억할만한 큰 문제는 없었습니다. 오히려 자유로운 수업진행방식이 신선했었습니다.,위에 언급한 국제교류처에 도움을 요청할 수 있을 것입니다. 또한 링컨시 다운타운에 한인교회가 하나 있습니다. 그곳에 한국인이 약 30명 가량 있는 것으로 아는데 저는 가지 않았지만 나가신다면 필요시 도움을 청할 수 있을 것입니다.,"처음에 Nebraska Wesleyan University에 배정받았을때는 너무나 생소한 곳이라 당황했었고 후회도 하였으나 지난 1년간 경험해 보니 정말 좋은 곳이었다는 생각이 듭니다. 오히려 영어능력 향상을 위해서라면 최적의 장소라고 할 수 있습니다. 제가 갔을 때 첫학기엔 학교 내에 한국인이 단 한명도 없었고 두번째 학기엔 타 학교에서 오신 한분과 제가 한국인의 전부였습니다. 따라서 영어가 없이는 생활할 수 없는 환경이었기 때문에 한국인이 많은 다른 지역에 비해서 영어를 더 향상시킬 수 있으리라 생각합니다. 또한 저는 봄방학때 네브라스카 주 내 여행, 가을방학 때 라스베가스 와 그랜드 캐년 및 다른 캐년 일주, 추수감사절 연휴 때 워싱턴 D.C와 뉴욕을 다녀왔는데 시간나실때 마다 미국내의 다른 도시를 여행해 보시면 더욱 즐거운 교환학생 생활이 될 것 같습니다. 
깨끗한 자연환경과 언제나 친근한 사람들, 끝이 보이지 않을 정도로 펼쳐진 대평원을 느껴보시고 미국 내 최상의 질을 가지고도 값싸게 즐길 수 있는 네브라스카 산 스테이크도 마음껏 맛 보시며, 도심의 지옥같은 교통체증없이 반듯한 길을 수 시간 자유롭게 달려보시면 네브라스카와 NWU가 더욱 친근하게 다가올 것입니다. 돌아온지 얼마 되지도 않았는데 또 가고 싶네요. 멋진추억 많이 만드시길 바랍니다.

기타 질문사항 있으시면 rocknroll1552@hanmail.net으로 메일주시면 제가 아는 한 많은 정보 드리겠습니다."
