gen_info,env_info,food_info,study_info,office_info,facil_info,mhct_info,help_info,etc_info
"위치입니다. 크기도 확인할 수 있죠.
https://maps.google.co.kr/maps?ie=UTF-8&q=university+of+utah&fb=1&gl=kr&hq=university+of+utah&cid=15966664552946993518&ei=3aTXUpO2BOOgigf5woDYDQ&sqi=2&ved=0CKkBEPwS

학교가 참 큼니다. 학교 내에 셔틀버스가 돌아다니므로 타고 수업을 들으러 다니면 됩니다. 스케이트 보드나 자전거를 타고 다니는 학생이 많습니다.
저는 도착하자 마자 중고 자전거를 인터넷을 통해 구매해서 타고 다녔습니다.
한국 돌아오기 전에 다시 팔고 왔고요.
지도에서 안 보이는 점이 있죠. 학교가 산 위에 있습니다. 수업갈 때 자전거를 타고 가면 다운힐을 만끽할 수 있습니다. 다만,,, 기숙사로 돌아올 때는 땀 좀 빼야 할 것입니다.
만약 자전거를 산다면 중고로 사는 것보다 마트에서 세일하는 저렴한 자전거를 사는 것을 추천드립니다.

기후는 여름엔 엄청 덥고 겨울엔 엄청 춥습니다. 내륙이라 비가 거의 안 올 것이라 생각했는데 생각보다 비가 자주 왔습니다. 한학기만 가더라도 사계절 옷이 전부 필요합니다.","교통이 잘되어 있는 편입니다. 물론 대한민국 대중교통과 비교하자면 굉장히 열악합니다. 유타 대학생은 모든 대중교통을 무료로 이용할 수 있습니다. 가장 많이 이용하게될 교통수단은 경전철입니다. 가까운 마트부터 시내, 공항까지 중요 지점들은 경전철을 이용해서 갈 수 있습니다. 구글 길찾기를 통해 경로를 알아 볼 수 있으나 역이름과 노선이름이 약간 다릅니다. 
 처음 학교에 찾아갈 때 비싼 택시나 셔틀버스를 이용하지 마시고 저렴한 트렉스를 이용하면 좋습니다~! 저는 트렉스를 이용해서 학교로 찾아갔었습니다.

 제가 거의 학교내에서만 지내서 학교 주변환경이 어떤지는 잘 모르겠습니다!","따로 요청을 안 한다면 보통 2인실 기숙사에 살게 될 것 입니다. 하지만 따로 요청을 한다면 1인실, 학교 내 아파트(부엌이 있음), 자취를 할 수 있습니다. 자취가 제일 저렴할 수 있으나 다양하게 신경 쓸 것도 많고 귀찮으니 기숙사를 추천 드립니다. 기숙사는 기숙사별로 분위기가 굉장히 다릅니다. 제가 살았던 기숙사(chapel glen)는 신입생들이 많이 사는 곳으로 굉장히 시끌벅적한 곳입니다. 
 룸메이트와 잘 안 맞을 수도 있습니다. 그럴땐 RA(층장)에게 말하면 도움을 받을 수 있습니다. 제 룸메이트는 이제 갓 대학생이된 미국인이었습니다. 새벽 4시쯤 들어와 아침 늦게 일어나는 룸메와 일찍자고 일찍 일어나는 저는 생활패턴이 맞지 않았습니다. 룸메이트가 방을 바꾸고 싶다고 RA에게 말을 해서 다른 방의 친구와 방을 바꿨습니다. 새로온 룸메이트는 다행이 저와 생활패턴이 매우 유사해서 친하게 잘 지냈습니다.

 기숙사에 산다면 meal plan을 반드시 신청해야 합니다. 보통 12 meal plan을 신청합니다. 저는 예외적으로 19 meal plan을 신청했습니다. 일주일에 19끼를 학식을 먹겠다는 의미입니다. 하루에 한끼를 transfer라고 해서 학교내 다른 식당 등에서 먹을 수 있습니다. 학식은 기숙사 근처에 있고 수업하는 곳에서는 꽤 먼 편입니다. 저는 아침과 저녁밥을 학식에서 먹었고 점심은 보통 Union이라는 수업하는 곳에서 가까운 빌딩에서 먹었습니다.
 보통은 도저히 못먹겠다면서 일주일에 12끼 먹는 것도 힘들어하니 본인의 성향에 따라 신청하면 됩니다.
 학교내에서 그냥 사먹으면 한끼에 보통 5~9달러 정도 듭니다.","수업은 15학점까지 무료로 들을 수 있습니다. 더 듣고 싶다면 돈을 더 내야합니다. 저는 14학점을 수강하였습니다. 광학(4학점), 고체물리(3학점), 열물리(3학점), Camping and Cooking(2학점), Circuit training(2학점)을 들었습니다.
 캠핑 수업은 캠핑 한 번 다녀오면 2학점이나 주는 날로먹는 수업입니다. 가면 정말 여유롭게 요리를 하며 캠핑을 즐기다 옵니다. 솔직히 저는 무엇인가 활동적인걸 하는 것을 좋아하기 때문에 너무 아무것도 안해서 별로였습니다. 카약이나 등산을 하는 것이 더 즐거울뻔 했습니다.
 Circuit training은 그냥 운동수업이었습니다. 매번 영혼이 빠져나갈만큼 힘들었던것 빼면 좋았습니다. 사실,,, 크로스핏 수업이 진짜 힘든 수업이고 제가 들었던 수업은 쉬운편입니다. 제가 체력이 부족했을 뿐,,,,, 
 물리수업들은 한국과 비슷합니다. 난이도는 학부와 대학원 수업차이가 심했습니다. 고체물리 한과목이 대학원 수업이었는데 정말 굉장히 어려웠습니다. 제가 느끼기로는 학부생과 대학원생의 수준차이가 상당했습니다. 대학원생들이 물리에 대한 열정도 있고 실력도 있었습니다. 
 학점받기는 쉬우니 크게 걱정 안 해도 됩니다.",,유타대학에는 공부만 할 수있는 자습실이 따로 없습니다. 보통 도서관에서 많이 공부하는 데 도서관은 기숙사에서 멀고 주말에는 일찍 닫아 불편했습니다. 제가 추천하는 곳은 학식건물 뒤에 있는 벤치마크라는 컴퓨터실입니다. 한쪽 구석에 노트북을 위한 좌석이 있습니다. 그 곳을 자습실처럼 이용하면 됩니다. 조용하고 책상도 넓습니다.,,,"저는 교환학생 기간중에 학부연구생으로 연구실에 들어가있었습니다. 학과사무실에도 문의해보고 다양한 방법을 시도했었습니다. 가능한 것은 직접 교수님을 찾아뵙는 방법밖에 없습니다. 두 번 거절 당하고 세 번 째 찾아간 교수님이 허락을 해주셨습니다. 
 유타에서 GRE physics 시험을 저 말고 또 볼 사람이 없을 것 같지만, 정보를 적습니다. GRE physics 시험이 이상하게도 시험을 신청하기 전까지는 정확한 장소를 알 수 없던데 유타대학 내에서 시험을 봅니다. 만약 교환학생 가서 GRE subject를 볼 생각이 있다면 걱정하지 말고 신청하면 됩니다.

다른 궁금한점 있으면 luen7344로 카톡주세요.

luen7344@naver.com 
여기로 이메일을 주셔도 됩니다만 메일은 확인 못 할 수도 있습니다."
"이 학교는 도시 전체에서 대학이 차지하는 비중이 클 만큼 교내의 크기도 굉장히 큽니다. 캠퍼스는 크게 South와 North campus로 나뉘어져 있는데 학교 생활의 중심이 되는 Union과 Library건물은 아마 south에 위치해 있던걸로 기억합니다. 기숙사와 식당 및 같은 교환학생들과 많이 만나게 되는 Heritage center는 아마 North에 속했던 걸로 기억합니다. 
때문에 날씨가 풀리는 2월말이 되면 굉장히 많은 스케이터보더를 캠퍼스에서 만나볼 수 있고 자전거를 타고 캠퍼스를 다니는 학생도 많습니다. 그 외에 15분에 한대씩 4개 루트의 셔틀이 계속 순회하기 때문에 아마 기숙사에서 학교 수업이 있는 south로 넘어갈때는 5분에 한대씩 셔틀버스를 타실 수 있을 겁니다. 날이 추운 겨울에는 주로 버스를 탔는데 날이 풀리고부터는 가끔 걸어다니기도 했습니다. 걸어서 union까지는 아마 15분정도 걸렸던것 같아요. 
The U(보통 이곳 사람들은 이렇게 부릅니다)가 위치해 있는 솔트레이크 시티는 아마 동계올림픽이 한번 개최되었기 때문에 한번쯤은 들어본 적이 있을겁니다. 6개월간 살아본 느낌은 굉장히 살기 적합한 중소도시의 느낌이라는 겁니다. 무엇보다 좋았던 점은 솔트레이크시티가 속해있는 유타주가 중서부에 위치해 있고 흔히 말하는 서부의 자연경관을 모두 관통하는 한 가운데에 위치해 있어서 봄방학과 학기 끝나고 한달간 지내면서 여기저기 구경다니기가 좋았다는 것입니다.
보통 미국에서의 여행은 10시간 이내의 거리는 자동차로 가는 로드트립이 보편적인데 유타의 경우 옆으로 캘리포니아, 밑으로 라스베가스가 이동거리안에 포함되어 있습니다. 특히 라스베가스는 이곳 애들도 자주 갈정도로 근접성이 좋습니다. 
또한 4~6시간 거리에 Moab라는 관광도시가 있고 영화 127시간의 배경이 되었던 Canyonland, 3대 캐년중 하나인 Arches NP, Zion이 4시간 내에 위치해 있어서 주말이나 공휴일이 낀 연휴에 친구들과 같이 캠핑으로 여행갈 수 있습니다. 때문에 다른 지역은 모르겠지만 제가 느꼈던 바로는 도시보다는 자연경관, 캠핑을 좋아하시는 분들에게는 아주 만족스러운 위치가 될 것 같습니다.
기후는 전형적인 사막기후입니다. 처음 도착했던날이 1월2일부터인데 이때부터 1월말~2월초까지는 눈도 굉장히 자주오고 날씨도 꽤 춥습니다. 대신 한국의 눈과 달리 설질이 굉장히 좋고 블리자드가 온다해도 몇시간내로 바로 제설이 되어서 한국에서 보던 눈과 달리 조금 ''관광용'' 느낌의 보기 좋은 눈의 느낌이 납니다. 또한 해가 강하기 때문에 겨울에도 몇일을 제외하면 체감온도는 한국보다 분명 낮아서 조금 의아했던 기억이 납니다. 겨울날씨는 2월 중순이 되면 풀려서 이때부턴 캠퍼스와 도시 전체를 덮던 눈이 순식간에 사라집니다. 아마 3월부터는 흔히 말하는 한국의 4,5월 날씨가 계속 이어집니다. 이곳에서 가장 좋았던 점이 사막기후라 비가 안온다는 점, 구름 한점 없이 깨끗한 하늘이 내내 유지된다는 점이었습니다. 아마 여름까지 있으신다면 3,4월과 달리 조금 많이 더워지긴 하지만 무엇보다 습기가 하나도 없기 때문에 체감지수나 불쾌지수는 0에 가깝습니다.","우선 교환학생 생활을 하시면 모든 생활의 중심은 아마 Heritage center와 Union이 될 것입니다. 흔히 HC라고 말하는 데 이곳에서는 친구들과 같이 저녁을 항상 먹었고 끝나고 가끔 포켓볼이나 풋살게임을 했습니다. 또한 기숙사 열쇠를 잃어버리거나 냉장고, 전구고장 등 문제가 발생해도 항상 이곳에 와서 말하면 해결해 주었습니다. Union은 아마 주중의 학교수업을 하면 주로 점심을 먹거나 만남의 장소 같은 개념이었습니다. 이곳에서 각종 행사도 많이 이뤄지고 주마다 무언가를 전시하는 행사가 있었던것 같습니다. 
학교 밖으러 나가면 미국의 대다수 도시가 그렇듯 다운타운내에서 주로 활동을 합니다. 우선 이곳에 가장 큰 쇼핑몰인 City creek center는 지어진지 얼마 안된 건물인데 우리나라의 타임스퀘어 같은 느낌이라고 보시면 됩니다. 다만 조금도 외부와 어우러져 있고 규모도 그만큼 컸던것으로 기억합니다. 좀 비싼 음식점이나 가게가 많고 한 두번 관광차 볼거리도 좋은 것 같은데 친구들과는 이곳은 많이 안간 것 같습니다. Gateway라는 복합쇼핑몰이 하나 더있는데 이곳이 약간 더 보편적으로 많이 찾는 곳이었던것 같습니다. 영화관, 음식점, 티모빌같은 통신사 등 어지간한 것들은 여기 다 있어서 다운타운에 놀러가면 주로 여길 갔던것 같습니다.
마지막으로 트롤리라는 곳이 있는데 이곳에 스미스라는 큰 마켓이 있어서 생필품을 사러 자주 갔던것 같습니다. 아마 처음 가시면 핸드폰이 가장 먼저 필요하실텐데 여기 가서 하시면 됩니다. 또는 오티첫째주에는 통신사, 은행 등 직원들이 알아서 와서 부스설치하고 교환학생들 맞아줍니다. 
위에 말한 모든 곳은 다 Trax를 타고 이동하시면 됩니다. 차를 살수가 없는 교환학생의 특성상 Trax는 이동을 용이하게 해주는 아주 좋은 수단입니다. 학교카드가 있으면 공짜입니다. 지금 생각해보면 학교크기도 크고 트랙스도 한국 대중교통처럼 곳곳을 가지는 못하니 자전거가 한대 있으면 학교돌아다니기도 편하고 Trax타고 여기저기 다니기도 편할것 같네요.","저의 경우는 ISEP을 통해 파견된 것이라서 기숙사와 밀플랜은 모두 정해져 있었습니다. 지금 생각해보니 ISEP이 파견전까지는 하나부터 열까지 모두 혼자 처리한다는게 조금 힘들수 있는데 막상 파견가고 나면 ISEP이 굉장히 좋은 프로그램이란걸 깨달았습니다. 미국으로 오는 교환학생은 주로 유럽애들이 많은데 제가 아는 애들은 전부 ISEP으로 왔던걸로 기억합니다. 혹시 ISEP 프로그램에 대해 궁금하면 따로 알려드리겠습니다. 
이곳에는 기숙사 종류가 여러개 있는데 ISEP학생들은 모두 SAGE Point에 살았던 걸로 기억합니다. 때문에 기숙사 건물은 SAGE Point 밖에 알지 못합니다. 이 곳은 Double, Single, Single deluxe가 있던걸로 기억하는데 저는 Single deluxe가 기본으로 배정되어 있습니다. suit mate 4명이 거실을 공유하고 2명씩 bathroom을 공유하였는데 한학기 동안 아주 만족하였습니다. 시설은 아주 깨끗하고 좋습니다. 아마 나중에 방 형태는 말하면 바꿔주는 걸로 아는데 단순히 Double을 룸메랑 친해게 지내야지 라는 생각으로 고려하신다면 절대 비추합니다. 
식사는 밀플랜 신청대로 19,15,12로 나뉘어져 있는데 15는 추가로 200달러, 19와 12는 Transfer가 하루에 한번씩 됩니다. 이걸로 일주일을 먹을 수 있는데 주로 저녁 한끼, union에서 transfer로 점심한끼를 먹기때문에 12면 충분했던 것 같습니다. 특히 transfer가 굉장히 유용하기 때문에 12밀플랜을 하시는게 가장 무난하실 것입니다. 식사는 뷔페식입니다. 흔히 말하는 모든 양식이 항상 나오고 가끔 스페셜요리 같은게 나왔던걸로 기억합니다. 근데 한학기 내내 먹을려면 조금 질리기도 합니다.","수업은 전공3개, 운동과목2개, 필드트립 1개 해서 총 15학점을 들었습니다. 
애초에 수업 점수에 크게 의미를 두고 교환을 간것은 아니었기 때문에 수업에 크게 집중을 안했는데 몇가지 말씀드리고 싶은 것은 수강체제가 우리학교와 완전히 다르기 때문에 잘 알아보시고 가시라는 것입니다.
개강 2주까지도 수강등록과 드랍이 가능하고 철회도 우리학교에 비해 상당히 깁니다. 다만 이기간을 놓치면 변경불가합니다. 때문에 이 기간동안 여러 수업 들어가보시고 자기 목적에 맞다 싶으면 들으시길 바랍니다.
3000단위나 4000단위는 토론위주라 조금 벅찼던것 같습니다. 수업하나하나에 대한 내용은 각각 너무 다르기때문에 직접 들어가보시고 결정하는게 가장 좋습니다.
다만 필드트립수업은 꼭 하나정도는 들으시길 추천합니다. 저의 경우 카약킹 수업을 들었는데 2박3일간 Moab일대를 돌며 카약킹을 했습니다. 이외에도 한국에서 흔히 접하기 힘든 액티비티가 이곳엔 수업으로 굉장히 많이 있기 때문에 이렇게 2박3일간 필드트립으로 참여하셔서 경험해보시면 좋은 추억이 될것 같습니다.","이것도 저는 ISEP으로 파견된 경우라 흔히 인터내셔널 학생들이 가는 4층의 IC센터와 1층의 Learning abroad를 둘다 갔습니다. 근데 보통은 4층에 있는 IC센터를 가면 어려움을 겪는 내용에 대해 알려주는 경우가 다반사입니다.
다만 많은 기대는 하지 않는게 좋습니다. 친절하게 알려주시기는 하는데 어차피 알려주는 내용이 이미 다 아는 내용입니다. 그래도 일단 무슨일이 생기면 이곳에 가는게 제일 맘이 편한것 같습니다.","처음 학교 오티에 가면 2,3일간 아이멘토라고 하는 프로그램이 있습니다. 처음에 적응하고 친구들 만나는데 학교에서 이렇게 만들어주니 참 좋았습니다. 
그리고 부대시설중에 ORP라는 곳이 있는데 이곳에서 스키, 스노우보드, 스키복, 헬멧, 리프트권 등 겨울철 레저관련 모든것, 카약, 자전거대여, 캠핑도구 대여 등 여름 아웃도어 모든것이 다 구비되어 있고 또 굉장히 싸기때문에 자주 이용하시면 도움이 될 것입니다.",컬쳐쇼크는 크게 없었던것 같습니다.,"앞에 말씀드린 4층 IC, 혹은 이곳은 무조건 본인 일은 본인이 찾아서 백방으로 알아보는게 가장 합리적인 방법입니다.","막상 경험보고서를 쓰려고 보니 파견 전 학교를 고르면서 수도 없이 여러 교환보고서를 읽어봤던 기억이 납니다. 분명한 것은 정말 그때는 상상도 못했던 많은 일들이 짧고도 긴 이 6개월간 일어났던 것입니다. 이런말이 너무나 추상적일지 모르지만 정말 모든일은 언제 어디서 무엇이 벌어질지 모르는 것 같습니다. 만약 이곳에 가시게 된다면 모든지 적극적으로 최선을 다해서 부딪혀 보십시오. 그리고 항상 ''이곳에서의 생활이 얼마나 소중한지를'' 마음에 새기면서 소중히 보내시길 바랍니다. 그곳에서의 생활은 만약 미국에 다시 가지 않는다면 다시는 겪지 못할 소중하고 귀중한 추억이 되실겁니다. 만약 이 곳으로 가시게 되는 분이 혹 있으시다면 처음의 설렘과 함께 그곳에서 잊지못할 추억 만드시고 돌아오시길 바랍니다.

더 궁금하신점 있으시면 메일 주시면 아는데로 도움이 되면 좋겠네요.
jjongmoya@gmail.com"
