gen_info,env_info,food_info,study_info,office_info,facil_info,mhct_info,help_info,etc_info
"CSUF는 LA에서 차로 막히지 않을 때 40분, 기차로 30분 정도의 거리에 있는 Fullerton이라는 곳에 위치해 있습니다. Fullerton의 기후는 햇빛이 강하고 온도도 높지만 습도가 높지 않아 매우 더운 여름에도 선탠하는 느낌 정도로 견딜만 했습니다. 그늘을 잘 이용하신다면 오랜 시간 돌아다니는 데 무리는 없습니다. 아침에 창문으로 들어오는 햇빛이나 노을질 때쯤 금빛으로 반짝이는 장관은 매우 아름답습니다. 아직도 그리울 정도입니다. CSUF의 크기는 연세대와 비슷한 편이었습니다. 연강일 경우 쉬는 시간 동안 대학의 끝과 끝인 체육대학에서 커뮤니케이션 대학으로 걸어가는 데 조금 벅찰 정도였습니다. 체육대학에서 커뮤니케이션 대학 간의 거리는 공학관에서 위당관 정도의 거리였습니다.","Fullerton은 고도로 발달한 도시는 아니어서 높은 건물이 많지 않습니다
대부분 1층에서 2층 높이로 서울과 같은 도시 경관을 상상하신다면 살짝 실망할 수 있습니다. 하지만 잔디나 꽃, 나무와 같은 조경이 잘 다듬어져 있어 자전거 타고 달리면 기분전환하기 딱입니다. 학교에서 걸어서 20분 거리에 Target, Albertson이라는 큰 마트가 있어 식재료, 간식, 심플한 옷, 주방기구, 전자기기, 약까지 구하는데 전혀 어려움이 없습니다. 타겟, 알버슨에서 하겐다즈, 밀라노 등의 간식을 종류별로 사먹어 보는 것이 소소한 취미였습니다. 그리고 차를 이용하면 10분 내외 거리에 있는 Brea라는 지역에 영화관, 쇼핑몰, 식당, 바와 같은 시설들이 많아 한국에서 누리던 환경과 견주어 불편함은 없었습니다. 딱 한가지 답답한 점을 꼽으라면 교통편이었습니다. 집 앞에는 버스 하나, 학교 앞에는 정확히 기억은 나지 않지만 서너 종류의 버스가 다녔습니다. 학교 앞 버스들은 배차 간격이 그리 크지 않았지만, 집 앞에 오는 버스는 1시간 간격이라 버스 시간에 모든 스케쥴을 맞춰야 했습니다. 또한 Fullerton Downtown쪽에 학생들이 많이 방문하는 바(bar)들과 음식점들이 많아 교환학생 파티가 정기적으로 열리기도 했습니다. 학교 주변에 패스트푸드 체인이나 음식점들도 꽤 있어 외식하기 좋았습니다.","저는 학교 바로 앞의 기숙사(UV)에 들어가지 못해 근처의 Homestead라는 아파트를 계약했습니다. 함께 파견된 후배와 방 2개가 딸린 집에서 살았는데 둘이 살기에 월세가 꽤 센 집이었습니다. 학기가 시작되기 전 룸메이트를 두명 더 구할 계획이었는데 구해지지 않아 돌아올 때까지 단 둘이 재밌게 지내다 왔습니다. 거실, 화장실, 주방을 공유하고 각방을 쓸 수 있어서 편한 점이 많았습니다. 같은 학교에 한국인이었기 때문에 음식도 거의 공유할 수 있었고, 의사소통에도 문제가 없어서 마음 편히 지냈습니다. 물론 기숙사처럼 자연스럽게 외국 친구를 만나고 사귈 수는 없었지만 기숙사에 사는 친구의 집에 놀러가기도 하고 동아리, 파티 등의 기회를 통해서 좋은 친구들을 많이 만날 수 있었습니다. Homestead는 학교 운동장까지 걸어서 20분 거리에 위치해있고 Target이라는 마트 바로 앞에 있습니다. Albertson도 정문에서 한블록 거리에 있고 바로 앞에 일본 음식점도 있어서 매우 편리했습니다. 내부에 자쿠지, 헬스센터, 세탁실 등의 시설도 완비되어 있습니다. CSUF 학생들 뿐만 아니라 가족들도 많이 살고 있어 편안하고 평화로운 분위기입니다.","저는 파견 당시 중문과 소속이었지만 CSUF에서는 Radio/TV/Film 전공 과목들을 수강했습니다. Experimental Cinema, Critical Studies: TV, Cinematography, Digital Foundations이라는 전공 4과목과  Aerobic Exercise and Weight Control(1학점)이라는 체육 과목을 수강했습니다. 
Experimental Cinema는 영화가 발명되던 시기부터 현대에 이르는 방대한 양의 실험 영화를 다룹니다. 대부분 교수님이 먼저 시기와 영화에 대한 설명을 하시고, 그룹으로 나누어 토론을 하거나 전체적으로 함께 영화에 대한 의견을 나눕니다. 그리고 수업 중 시청한 영화 중 하나에 대한 의견을 다음주 수업 전까지 포탈과 같은 사이트에 올려야 합니다. 교수님이 매우 열정적이시고 올려주시는 자료 양도 많습니다. 영어로 토론하는 것은 어렵고 부담스러워 피하게 되기도 했습니다. 그래도 교수님이 착하셔서 계속 참여를 격려해주시고 학기말쯤 스스로 짧은 실험영화를 제작하는 과제가 있는데, 한국에서 해보지 못한 새롭고 즐거운 경험이었고 교수님이 주시는 세세한 피드백에 감동을 받았습니다. 실험영화를 좋아하시고 열심히 참여하시려는 의지만 있다면 영화에 대한 새로운 지평을 넓히기에 딱인 수업이라고 생각합니다. 
Critical Studies: TV는 TV 프로그램에 대한 비평, 편성표 분석, 방송 및 촬영 기법 분석 등 방송과 관련된 모든 분야에 대해 분석하고 비평하는 법을 배웁니다. 기본 교재 한 권에 기초해 수업이 진행되고, 세 번의 비평 페이퍼가 과제로 주어집니다. 페이퍼 가이드라인을 주실 뿐만 아니라 제출된 과제에 대해서는 꼼꼼히 피드백을 해주시고 다시 한번 수정해 제출할 기회도 주십니다. 이 과정을 통해 어떤 방식으로 비평을 해야 하는지 제대로 배울 수 있습니다. 매주 한 번의 쪽지 시험이 있었습니다. 낮은 단위의 수업이라 방송에 대한 기본적 지식이 있다면 그다지 어렵지 않습니다. 교수님은 시크하게 이쁘시지만 말하시면 너무 귀여우십니다. 학생들의 발언도 많은 편이고 가벼운 분위기에서 수업이 진행됩니다. 
Cinematography는 영화 촬영 기법에 관련된 수업인데 실제 cinematographer로 활동하셨던 여자 교수님이 가르쳐주십니다. 완전 호탕하시고 업계에서 실제로 경험하신 내용도 많이 말씀해 주십니다. 블랙스완을 촬영한 cinematographer가 CSUF 출신이라 이에 대해 자부심이 크셨습니다. 실제 cinematographer 단체를 방문해 전문가들에게 직접 이야기를 들을 기회도 있습니다. 영화 촬영에 대한 수업이라 그런지 실제로 촬영 경험이 많은 학생들이 수강하고, 처음에 조를 이루어 촬영하기 때문에 같은 조 학생들에게 몰랐던 부분을 많이 배울 수 있습니다. 세 번의 촬영 과제가 주어지는데 첫째는 영화 초창기에 사용되던 필름 카메라로 직접 필름을 구입해 촬영, 편집하는 과제이고 둘째는 interior lighting, 셋째는 exterior lighting에 대한 자유 영상을 만드는 과제입니다. 촬영 전에 교실에서 필름 사용 방법과 조명에 대한 기본적인 수업이 이루어지고, 수업 외의 시간에 따로 촬영한 뒤 수업 시간에 시사회를 하는 방식으로 진행됩니다. 직접 필름 카메라를 사용해보면서 카메라의 기본 원리에 대해서 배울 수 있고, 조명 설치 및 효과에 대한 지식을 배울 수 있어서 뜻깊은 수업입니다. 학생들끼리 대부분 아는 사이이고, 첫째 과제를 조로 진행하기 때문에 친구를 사귀기에 좋은 수업이었습니다. 필름 카메라 Arri S, 조명 등은 학교 기자재로 빌릴 수 있고, 두번째과제부터는 룸메이트나 조원의 DSLR을 빌려 촬영했습니다.
Digital Foundations는 이미지 작업을 할때 사용하는 프로그램에 대한 기초적 지식들을 배우는 수업입니다. 켄터키 치킨 아저씨같이 푸근한 교수님이 수업을 하시고, 항상 끊임없이 농담을 던지셔서 수업 분위기는 좋습니다. 포토샵, 일러스트레이터, 드림위버 등 프로그램에 대한 내용과 잡지, 홈페이지 등 이미지 레이아웃 작업을 할 때 고려해야 하는 이론들을 배웁니다. 그렇게 어렵지 않고 즐겁고 쉬운 수업입니다.
Aerobic exercise and Weight control은 유산소와 웨이트를 한 시간 동안 끊임없이 하는 수업입니다. 윗몸일으키기, 푸쉬업, 킥복싱 등 다양한 운동 방식을 결합해 교수님과 함께 수업 시간 내내 움직입니다. 때론 학교 축구 경기장이나 숲길과 같은 야외에서 계단 오르내리기나 짧은 마라톤을 할 때도 있습니다. 학생들이 남녀 할 것 없이 체력이 모두 좋고(미국에서는 기본적으로 대부분의 학생들이 운동을 즐겨했습니다) 운동량이 많기 때문에 기초 체력이 없으시다면 따라가기 힘들 수도 있습니다. 사실 출석 문제 때문이기도 하지만, 너무 힘들어서 중도에 drop했습니다. 교수님도 수업 내용도 너무 좋지만 한 시간 쉬지 않고 운동하고 나면 힘들어 다음 수업 때 종종 졸기도 했습니다. 그래도 학기 중반까지 꾸준히 운동하면서 체력도 근육도 많이 늘었었습니다. 의지가 있다면 헬스장을 가지 않아도 되는 좋은 수업입니다.","UH라는 건물에 있었는데 카운터 같은 곳에 보통 한두분이 앉아계시고 온 차례대로 궁금한 점을 문의할 수 있습니다. 제가 있을 땐 동양계 남자분이 한분 계셨는데 정말 친절하시고, 교환학생이라 언어가 서툰 점도 충분히 배려해서 천천히 들어주십니다. 도움이 필요한 부분을 말하면 필요한 서류, 찾아가야 하는 곳, 담당자 등에 대한 정보를 다 알려주십니다. 수강 변경은 어떻게 하냐부터 그 외 사소한 질문들도 부담없이 방문하여 물을 수 있습니다.","우선 학교 부대시설 중 좋았던 곳들을 꼽자면 SRC라고 운동장 앞쪽에 헬스센터같은 곳이 있습니다. 농구장, 스쿼시장부터 웨이트트레이닝 기구까지 운동을 위한 모든 시설들이 갖춰져 있습니다. 수영장도 있고 샤워장도 있습니다. 심지어 암벽등반 시설까지 있었습니다. 저는 한번도 해보진 못했는데 같이 파견되었던 학생 중 한명은 직접 암벽등반을 해보기도 했습니다. 간단한 가입절차만 거치면 CSUF 학생은 무료로 이용할 수 있습니다. 
그 다음으로 SHCC(Student Health&Counseling Center)이라는 학교 보건소와 같은 곳이 있는데, 다치게 되는 경우를 대비해 꼭 알아두어야 하는 곳입니다. 보험이 없기 때문에 병원 가는 것이 고민되는데 이곳에서는 무료로 치료를 받을 수 있습니다. 
그리고 PL이라는 도서관이 있는데 일층에 컴퓨터와 프린터가 있어 꼭 공부하기 위해서가 아니라도 자주 방문하게 되는 곳입니다. 물론 컴퓨터는 별로 좋지 않지만 간단한 레포트를 쓰거나 인터넷 서핑에는 문제가 없습니다. 인쇄하는 과정이 처음에는 어려웠는데 학생증에 돈을 충전하고, 쓰던 컴퓨터에서 인쇄를 누른 뒤 프린터 앞에 있는 컴퓨터에 자신의 프린트물을 누르고 카드기에 학생증을 긁으면 됩니다(제가 기억하기론 이 과정들을 거쳤던 것 같은데 직접 시도해보실 때 조금 다를 수 있습니다;). 인쇄를 기다리는 사이 다른 학생들과 대화를 나눌 시간도 있습니다. 저는 로컬 친구 한명을 프린터 앞에서 만났습니다. 
TSU(Titan Student Union)라는 건물 앞쪽에 서점, 문구점이 합쳐져 있는 형태의 건물이 있습니다. 2층은 서점으로 교재를 구입할 수 있습니다. 새책뿐만 아니라 중고 서적들까지 살 수 있어 새책같은 깨끗한 책을 찾으면 돈을 아낄 수 있습니다. 학기가 끝나고 낙서, 필기가 없는 깨끗한 책은 다시 되팔수도 있습니다. 저는 중간에 수강과목을 변경해서 필요없는 교재가 생겨 그대로 반품했는데 쿨하게 바로 환불해주었습니다.
학기가 시작되고 얼마 있으면 동아리 박람회 같은 게 진행되는데 QUAD라는 곳에서 여러 동아리들이 데스크를 두고 신입생들에게 동아리를 홍보하는 이벤트입니다. 체육, 철학, 영화, 음악 동아리 등 다양한 동아리가 있고 전 그 중에 Fullerton Film and Media Arts Association이라는 영화 동아리와 ETC(Entertainment&Tourism Club)라는 커뮤니케이션 학부 동아리를 들었습니다. ETC 먼저 이야기하자면 학부 동아리이고 다양한 경험 기회와 엔터테인먼트 등의 업계에 진출한 선배와의 만남 기회 등을 제공하기에 인기가 많습니다. 매학기 많은 이벤트들이 준비되어있고 동아리원들은 원하는 이벤트에 줄을 서 등록하면 됩니다. 이벤트 날짜가 미리 정해져 있기 때문에 자신의 스케쥴에 맞춰 등록하고 참여해야 합니다. 저는 Emmy Award 참석과 LA stadium에서 진행된 이벤트들을 등록했는데, 실제로는 에미 어워드만 참여했습니다. 설마 진짜 에미 어워드일까 반신반의하면서 친구차를 얻어타고 LA에 도착했는데 정말 방송에 나오는 에미 어워드였습니다. 교환학생 중 가장 짜릿했던 경험 중 하나이기도 합니다. 저희 동아리는 방청객 혹은 자리를 채우는 엑스트라 정도로 참여한 것인데 앞쪽에서 자리가 비는 곳이 생길 때마다 지시에 따라 자리를 옮겨 다니는 역할이었습니다. 저는 운 좋게 두번째 줄까지 가서 앉았는데 주변에 실제 헐리웃 스타들이 앉아있어 가슴이 두근두근했습니다. 나오는 길에 유명한 감독들과 우연히 이야기도 나누고 평생 기억에 남을 경험이었습니다. FFMAA는 영화를 좋아하는 사람들이 모인 동아리로 주변에서 열리는 영화제를 함께 관람하고 실제 팀을 나누어 영화를 만든다고 했습니다. 하지만 ETC에 비해 연락망이 약했고 몇번 모임을 빠지다보니 자연스럽게 나가지 않게 되었습니다. 그래도 Radio/TV/Film 전공 동아리로 학과장님의 관심도 많이 받고 과 선배들과의 모임(특히 블랙스완의 촬영감독이 CSUF 출신임을 엄청 강조하셨습니다)이 있어 희망 업계의 선배들과 직접 만날 수 있습니다.","미드를 즐겨보고 대다수 한국인들이 공감하는 컬쳐쇼크에 대해 들어왔기때문에 특별히 충격받은 일은 없었던 것 같습니다. 특이하다고 생각했던 점을 말하면, 환불 과정이 굉장히 빠르다는 것이었습니다. 학교 서점뿐만 아니라 여타 쇼핑몰에서도 환불 과정은 굉장히 간단하고 어떤 불평, 불만도 오가지 않고 진행되었습니다. 손님에게 정말 편리한 환불문화였습니다.
이건 컬쳐쇼크라고 할 수 있을까 모르겠지만 도시에서 살다가 Fullerton이라는 비교적 한적한 동네에 오니 교통편이 너무나 불편했습니다. 차가 없으면 갈 수 없는 곳이 많았고 몇대 있지 않은 버스도 배차간격이 큽니다. Fullerton이 큰 도시가 아니어서 지나다니는 택시도 거의 없습니다. 택시는 인터넷에서 번호를 찾아서 콜을 해야 합니다. 주소를 말할 때 우리나라처럼 어느 동네 어디입니다라고 말하기보다 번지수까지 포함된 구체적 주소나 길 이름을 이용해 말해야 합니다. 미국의 길들은 주로 바둑판 모양으로 교차점이 있어 길 이름을 이용해 말하는 것을 선호하는 것 같습니다. 예를 들면, A bl.과 B st.의 사이에 있습니다라고 말해야 알아듣습니다. 미국에 오면 차 있는 친구를 사귀라는 말이 백배 공감갑니다. 저는 운 좋게도 같이 파견된 친구가 미국에서 면허를 따고 차를 구입해 그 친구 덕에 한인마트도 종종 다니고 정말 많은 도움을 받았습니다. 라스베가스, 식스플래그 등 먼 곳도 차로 놀러갈 수 있어서 정말 고마웠습니다! 
아, 한 가지 더 새로웠던 점은 파티문화였습니다. 보통 아는 사람들과 앉아서 이야기하며 마시는 우리 문화와 달리 음식과 음료를 준비해 서서 자유롭게 새로운 사람과 게임하고 대화를 나누며 노는 파티 문화가 처음에는 조금 당황스러웠습니다. 무엇을 해야할지 모르겠고 어색했는데 부담없이 말을 거는 주변 사람들과 이야기를 하다보면 어느새 게임도 하고 있고 소개로 또 다른 친구를 만나기도 하고 파티 자체를 즐기게 됩니다. 그러다 또 다른 파티에 초대받기도 합니다. 저는 학교나 주변 친구들로부터 초대받은 파티는 왠만하면 모두 참가하라고 권해주고 싶습니다. 다양한 국적의 사람들을 만나면서 예기치 못한 재밌는 경험을 할 수 있는 기회이기 때문입니다.",도움이 필요하다면 우선 학교 관련 일이라면 국제처에 먼저 연락해볼 수 있고 교수님께 도움을 요청할 수도 있습니다. 국제처에서 지역 주민과 교환학생을 연결해주는 프로그램을 시행하고 있기에 신청하면(첫 오티 모임때 신청서를 나눠주었던 것 같습니다) 호스트 패밀리와 친분을 쌓고 여러 도움을 받을 수도 있습니다. 또는 학교에서 만난 친구들로부터 혹은 지역 교회로부터도 도움을 받을 수 있습니다. 수업에서 어려운 점은 같이 수업을 듣는 친구들로부터 도움을 많이 받았습니다. 야외로 촬영가거나 무거운 촬영 장비를 빌릴 때 라이드를 제공해주겠다는 친구가 있어 편하게 다닐 수 있었습니다. 지역 교회에서는 국제 학생들이 적응할 수 있도록 소셜파티를 열기도 하고 필요없는 가구를 공짜로 나눠주는 이벤트를 하기도 합니다. 물론 배달도 교회 주민분들께서 차로 직접 해주셨구요. 저와 룸메는 여기서 소파를 득템했습니다. 도움을 요청할 용기만 있다면 주변에 도와주겠다는 분들은 많습니다. 도움을 받고 감사의 표시로 커피나 밥 한끼 정도 사는 센스만 갖춘다면 여러 사람들과 더 친해질 수 있는 기회기도 합니다.,"교환학생의 묘미는 영어 실력을 늘리고 다양한 국적의 친구들을 만날 수 있다는 것에 있기도 하지만 교환학생의 꽃은 단연 여행인 것 같습니다. 한국에서 왔다갔다 하는 비행기표도 비싸고 큰 맘 먹지 않는 이상 미국 전역을 여행할 기회는 쉽게 오지 않잖아요. 저는 학기중 holidays와 방학을 이용해 라스베가스, LA, 샌프란시스코, 샌디에고(씨월드만 갔어요), 시카고, 뉴욕을 여행하고 돌아왔습니다. 서부에서 뉴욕까지 가는 비행기표가 비싸고 일정이 짧아 미루고 다음에 제대로 여행할까도 했지만 한국에 돌아와서 힘들어도 갔다오길 잘했다는 생각이 끊이질 않습니다. 돌아오자마자 취업준비에 스펙쌓기에 정신 없어서 미국 여행을 다시 간다면 적어도 몇년 후가 될 것 같기 때문입니다. 여행을 갈까 말까 고민이된다면 갔다 오는 것을 추천합니다. 물론 사전에 할인, 여행코스, 안전정보에 대한 리서치를 많이 하셔야겠죠! 특히 숙소는 조금 비싸시더라도 안전한 곳에 잡으세요. 구글에 숙소 이름을 치면 몇몇 평가 사이트에 숙소에 대한 평이 나옵니다, 꼭 후기 보고 방문하세요! 그리고 사진을  많이 찍으세요! 남는건 사진밖에 없더라구요! 더 궁금한 점 있으시면 메일 주세요. kitaw@hanmail.net입니다. 제 나름껏 성실히 답해드릴께요 &#9786; 밑에 사진은 아름다운 Fullerton 노을입니다"
"역시 캘리포니아라서 햇볕이 쨍쨍하고 습기가 별로 없었어요. 제가 8월에 파견되었는데, 그 때는 정말 선글라스와 선크림을 가지고 다니지 않으면 살 수 없을 정도로 더운 날씨였습니다. 여름이 지나도 낮엔 모두 반팔로 다닐만큼 더운 곳이지만, 살기에는 정말 쾌적한 곳이었어요!
대학교 크기는 연세대학교의 3분의 2정도 되는 크기였어요. 꽤 큰 편이라 자전거, 스케이트 등을 타는 사람이 많았는데 전 걸어다닌게 더 편해서 걸어다녔습니다.","LA에서 차로 약 1시간 떨어져 있는 거리라서 도시에서 좀 벗어난 곳이라고 보면 됩니다. 전 차를 빌리거나 사지 않아서 주변 친구 것을 빌려 탄 적이 많았는데, 그러다 보니 제가 원할 때 원하는 곳에 가지 못하는 불편함이 있었습니다. 대학교에서 가장 가까운 슈퍼까지 걸어서 왕복 1시간 걸리니까, 운동은 많이 됐지만요^_^","학교 근처에 있는 University Village에서 살았습니다. 그 안에 Cafeteria가 있어서 점심, 저녁을 해결할 수 있었어요. 다만 주말에는 식사가 제공이 되지 않기 때문에 그 때만 요리하면 됩니다.","전반적으로 수업 내용 자체는 그렇게 어렵지 않았어요. 하지만 제 전공 특성상 책을 읽거나 토론하는 수업이 많아서 용어들이 조금 어려웠던 것 같습니다. 하지만 1학기 지나면 금방 익숙해지니까 괜찮아요. 다만 수업들이 중간, 기말만 보는 것이 아니라 거의 매주 숙제가 나가기 때문에 성실해야 합니다 ^^;","J-1비자 학생들을 담당하는 Mrs. Hotta라는 Advisor 한 분이 계셨는데, 수업 과목들이나 여타 주의점들에 대해서 상세하게 설명해주세요. 딱히 International Office에 찾아갈 필요가 없어서 많이 만나지 않았지만, 친절한 분이세요.",전 Japanese Culture Club이라는 동아리에 들었었습니다. 한국에 관한 동아리에 들고 싶었지만 기독교 동아리밖에 없어서 아쉽게도 일본 문화 동아리만 들었어요. 아시아에 관심이 있는 동아리 사람들을 많이 만나서 친구들을 꽤 만들 수 있었습니다. 역시 공통의 관심사가 있으면 더 친해지기 쉬운 것 같아요~,총을 든 무장강도가 학교에 뛰어든 사건이 제일 인상에 남네요. 그 때 시험을 보려고 교실 안에 들어와 있었는데 갑자기 경고벨이 울리더니 꼼짝하지 말라고 하더라구요. 다들 문 앞에 의자와 책상을 쌓고 불 끄는데 너무 긴장해서 정말 심장소리가 들리더라구요. 진짜 저 문을 열고 강도가 총을 쏠까봐 ㅠ.ㅠ 하지만 다행히 경찰에 검거되서 아무일도 없었습니다. 그 때 위험하다고 기숙사까지 차 태워준 반친구 덕분에 안전하게 집으로 올 수 있었습니다.,"역시 가장 도움을 받을 수 있는 분은 부모님이겠죠...?
농담이고, 주위 친구들을 많이 사귀면 힘들 때 도움을 많이 받을 수 있습니다.
학교 내에서는 경찰이 항상 있기 때문에 그 분들에게 도움을 청하면 되지만
학교 밖에서는 길을 잃는다든가 돈이 떨어진다든가 하는 일이 발생할 수도 있기 때문에 그 땐 친구들에게 전화하세요. 하지만 친구들이 전화받지 않을 때는 International Office에 연락해서 도움을 구하면 됩니다. 다만 오피스 아워가 있기 때문에 안 받을 수도 있다는 점...!","kwonjy28@naver.com
작년에 열심히 학교를 찾아봤던 기억이 나네요~
도움이 되었으면 좋겠습니다. 묻고 싶은 것이 있으면 언제든 연락해주세요!^_^"
