gen_info,env_info,food_info,study_info,office_info,facil_info,mhct_info,help_info,etc_info
"Hendrix 대학교는 미국 중남부의 아칸소주에 있는 작은 liberal arts college 입니다. 학교의 한쪽 끝에서 다른 쪽까지의 거리가 연세대학교 정문부터 백양로 삼거리까지의 거리 정도가 될 것 같습니다. 모든 수업 교실, 학생회관, 기숙사가 (몇몇 하우스 제외) 작은 캠퍼스 안에 있기 때문에 모든 공간이 도보로 짧은 시간내에 이동 가능합니다. 아칸소주의 기후는 덥고 습한 여름으로 유명한데요, 6월-8월까지는 기온이 40도 이상으로 오르면서 아주 덥습니다. (그래서 저는 방학 동안 다른 지역에 다녀왔습니다.) 겨울은 한국보다 훨씬 덜 춥고 눈도 한두번 아주 조금 왔습니다. 하루에도 기온변화가 심하지만 기숙사가 아주 가까운 거리에 있기 때문에 수업 쉬는 시간에 옷을 자주 갈아입어 큰 어려움은 없었습니다.","Hendrix는 아칸소주의 주도 little rock 에서 차로 30분 정도 떨어진 Conway라는 타운 안에 있습니다. 대학 바로 옆에 빵집, 레스토랑, 서점이 있고 조금만 더 걸어나가면 Walmart와 여러 레스토랑이 있습니다. 전형적인 미국의 시골 마을이라고 생각하시면 됩니다. 대중 교통은 전무하고 사실 캠퍼스 밖으로 나갈 일이 자주 있는 건 아닙니다. 대도시에서 살다 오신 분들은 엄청 지루하게 느끼실 수도 있는 환경입니다. 기본적으로 필요한 것은 모두 Walmart에서 살 수 있지만, 쇼핑을 하기 위해선 친구 차를 타고 30분 거리에 있는 Little Rock 이라는 도시에 나가야 합니다.","모든 학생이 캠퍼스 안에 있는 기숙사에서 생활 합니다. 저는 자동으로 3개의 여학생 기숙사 중에 Veasey에 배정되었는데, 모두 2인 1실이 기본입니다. 기숙사에 부엌이 있긴 하지만 ISEP 으로 Hendrix에 가는 교환학생들은 모두 Unlimited meal plan을 받아 매끼를 학교 카페테리아에서 먹을 수 있습니다. Hendrix 카페테리아(뷔페 식)는 좋은 음식과 다양한 이벤트로 상도 많이 받고 학생들도 만족스러워 할 정도로 음식이 좋습니다. 샐러드바, 피자, 샌드위치류, 밥, 씨리얼, 디저트 등등 원하시는 대로 골라 드시면 됩니다.","Liberal Arts College 답게 한 수업 안에 있는 학생수가 정말 작습니다. 제가 들었던 수업 중에 가장 많았던 수업도 30명 내외였습니다. 따라서 기본이 되는 수업 방식은 토론, 발표, 대답입니다. 모든 학생들이 적극적으로 질문하고 토론에 참여하기 때문에 많이 힘든 점도 있었지만, 그만큼 적극적으로 공부하는 방법을 배우게 된 것 같습니다. 한 학기에 기본적으로 4개의 academic 수업과 한 개의 체육 수업을 듣는데, 연세대학교의 수업보다 수업 전에 꼭 읽어가야 할 리딩의 양이 엄청나게 많고 (영문학과의 경우) 글도 많이 써야 하기 때문에 저는 수업 하나를 줄였습니다. 과에 따라 공부하는 스타일이 많이 달라질 수 있겠지만 저 같은 경우엔 엄청나게 많은 리딩과 글쓰기를 끝내기 위해 잠을 줄이는 날들도 많았습니다. 하지만 한국과는 분명히 다른 수업 스타일이 미국의 크고 유명한 대학 대신에 Hendrix가 가지는 가장 큰 장점 중의 하나입니다. 교수님들은 항상 질문들을 반기시고 친절히 대답해 주시고, 또 많은 학생들이 office hour 을 이용하여 교수님과 상담도 하고 프로젝트에 대한 얘기도 나눕니다. 시험 방식은 수업마다 다르지만, 에세이 쓰기가 많았고 글쓰기 과제로 시험을 대체하는 과목도 있었습니다. 무엇보다, 상대평가가 아니기 때문에 같은 수업을 듣는 친구들끼리 스터디도 많이 하고 교환학생인 저를 도와주는 친구들도 많았습니다. 
Hendrix 대학에서 개인적으로 가장 아쉬웠던 부분이 도서관입니다. 작은 학교답게 도서관도 아주 작습니다. 하지만 시설이나 분위기가 별로 인 것은 절대 아니고 책이 엄청 부족합니다. 보고서를 쓸 때 항상 도서관에서 책을 참고하는 것은 생각지 않았던 것 같습니다. 대신 주변에 있는 UCA (주립대학)에 있는 도서관을 쉽게 이용할 수는 있습니다.","국제학생과 국제관련 행사를 담당하는 학교 부서와 동아리가 따로 있어서 학기 중에 이벤트도 많고 어려움이 있으면 도움을 청하기도 싶습니다. Hendrix에서는 매 학기마다 International Week 라고 Food bazaar, fashion show 등의 행사가 있는데 food bazaar 때는 김밥, 불고기, 파전 등을 만들어서 학교 친구들에게 대접하기도 했습니다. 교환학생과 국제학생들을 위한 Orientation이 있어 서로 친해질 기회도 많고 서류적인 면이든, 생활에 대해서든 질문이 있거나 도움이 필요할 마다 적극적으로 도와주셔서 빨리 해결할 수 있었습니다.","게임 시설, 텔레비전이나 비디오를 시청할 장소, 친구들과 모일 장소들은 대부분 학생회관 격인 한 건물에 모두 모여있습니다. 그 안에 우체국도 있어서 편지를 받거나 소포를 보낼 때 편리하게 이용할 수 있었습니다. 음악 건물의 경우엔 피아노 연습실도 충분히 있어 제가 원할 때 가서 자유롭게 피아노를 치기도 했습니다. 동아리는 종교 동아리, 봉사활동 동아리, 문화 동아리 등이 있지만 연세대 만큼 분야가 다양하지도 많지도, 활발하지도 않은 것 같습니다.","성별에 관계없이 기숙사 방에 자유롭게 드나드는 것과 파티 문화가 처음엔 많이 낯설었습니다. 하지만 파티 같은 경우에는 오히려 남들이 어떻게 입는지, 어떻게 춤을 추고 노는지 신경 쓰지 않고 신나게 노는 문화가 나중에 편하게 느껴졌습니다. 의상, 교수님들과의 관계, 성에 대한 개방적인 문화, 공부하는 방법들이 많이 다르지만 충격적이거나 거부감이 들 정도로 다른 것은 아니고 오히려 그런 다름을 느끼는 것이 흥미로웠습니다.","파견 초기에 통장개설, 기숙사 문제, 생활 용품 구매와 같은 일들은 국제학생부에서 적극적으로 도와주시고 그 이외의 수업에 관한 문제들은 advisor, 수업 담당 교수님, 또는 학업에 대한 상담만 따로 하시는 교수님의 도움도 받을 수 있습니다. 모든 교수님들께서 office hour에 찾아와 제가 어떻게 수업을 듣고 있는지, 어려운 점은 없는지에 대한 얘기를 해 드리면 항상 더 도와줄 수 있는 일은 없는지 물으시며 너무나도 사려 깊게 생각해주셨습니다.","항상 Arkansas에서 공부를 한다고 하면 한국인이든 미국인이든 거기를 왜 갔냐는 질문을 제일 먼저 던지는 것 같습니다. 그런데 저는 처음부터 Hendrix College가 제 2순위 학교였고, 일년전으로 다시 돌아간다고 해도 똑 같은 선택을 내릴 겁니다. 교환학생의 첫 번째 목표가 영어 실력 향상이었기 때문에 저에게는 한국인이 거의 살지 않는 이 지역이 영어 공부에 가장 좋은 환경이었고, 대학을 둘러싼 시골 마을도 제가 자라온 곳과 비슷했기 때문에 큰 답답함 없이 학교 내에서의 생활 만으로도 굉장히 만족스러울 수 있었습니다. 또한 연세대학교와 다르게 아주 작은 학교이기 때문에 교수님 한 분이 담당하는 학생수가 지극히 소수이고, 이러다 보니 연세대학교에서는 듣기 힘든 10명 내외의 소규모 수업, 토론 수업, 그리고 교수님들과의 친밀한 대화 등이 가능했습니다. 자신의 목적에 따라 학교를 선택하는 것이 가장 만족스러운 선택이 될 것 같습니다. 
더 궁금하신 점이 있으면 mar510@hanmail.net 로 메일 주세요."
"학교는 연세대학교에 비하면 그리 큰 학교는 아닙니다. 작은 규모의 학교이지만 아주 아름답고 풀밭에서 다람쥐가 뛰노는 학교입니다. 미국 남부 Arkansas에 위치해 있고, 여름은 무척 덥지만 겨울은 그다지 춥지 않습니다. 다시 말씀드리지만 매우 아름다운 학교입니다.","시골에 위치한 학교라고 합니다만, 주위 환경을 봐서는 농촌은 아닙니다. 학교에서 자주 걸어갈 수 있는 곳은 wal mart, something brewing이라 하는 coffee shop, 그리고 downtown도 그다지 멀지 않아서 시간이 날 때 다녀올 수 있습니다. wac이라고 하는 gym은 학교에서 구름다리를 건너면 있는데, 매우 크고 시설도 좋아서 저는 자주 이용했었습니다.","거의 모든 학생들이 기숙생활을 함께 합니다. 남자 기숙사, 여자 기숙사, 남녀 공용 기숙사가 여럿 있는데 저는 그 중에서 Raney 라는 기숙사를 이용했습니다. 제가 머무를 때 sltc라는 건물이 새로 지어져서 저는 그 곳에 있는 cafeteria를 이용했는데, 학생들 스스로도 그 식당을 좋아하며 영화 Harry potter에 나오는 식당과 비슷하다고 합니다. 모든 음식은 부페형이고, isep으로 가신다면 하루에 열번, 스무 번도 이용할 수 있는 unlimited 식권을 부여받게 될 겁니다.","수업은 제가 전공이 영문학이라서 그런지 정말 힘들었습니다. 전공과는 비교적 반대로 교양 수업은 그다지 힘든 편은 아니지만 마찬가지로 공부량은 적지 않습니다. Hendrix 의 최대 장점은 음악대학 개인 레슨이 모든 학생에게 개방되어 있다는 것입니다. 저는 두 학기 동안 Dr. Krebs, Dr. Boehm 교수님으로부터 피아노 레슨을 받았는데 정말 만족스러웠습니다.","국제교육부라는 것은 따로 존재하지 않는 것 같지만 international students와  저 같은 exchange students를 관리해 주는 부서는 있고, 담당자는 Kesha 입니다. 또한 exchange students의 adviser는 Dr. Gess입니다.",학교생활이 시작되자마자 저는 1학년 학생들이 하는 Dance competition인 shirt tails에 참여했습니다. 교환학생이면 누구나 참여 가능하지만 온 몸에 멍이 들 정도로 연습량이 과도합니다. 중도에 그만두는 친구들도 많지만 좋은 경험이었다고 생각합니다.,특별한 문화충격은 없었습니다.,kesha나 Dr.Gess의 office에 찾아가시면 언제든지 도움을 받을 수 있습니다. 찾아뵙기 전에 메일을 보내는 것도 좋은 방법입니다.,Music Lesson을 적극적으로 추천합니다. Lesson fee는 한 학기 150-300$정도입니다. 열의를 보인다면 교수님께서도 적극적으로 가르쳐 주실 겁니다.
"헨드릭스는 Arkansas라는 익숙하지 않은 주에 있는 작은 사립대학입니다. 학생수도 무척이나 적어서 한학기만 지내도 학생들의 얼굴을 거의 익힐수 있을 정도랍니다. 날씨는 서울보다 좀더 따듯한것 같아요. 하지만 굉장히 날씨가 변덕이 심해서 하루에도 해가 쨍쨍 나다가, 비가 오는 그런 이상한 날씨랍니다. 텍사스와 테네시 사이에 있는 미국의 중남부 쯔음에 위치해 있는 Arkansas의 Conway라는 시에 있습니다.","대학주변에는 거의 아무것도 없고, 학교 하나만 덩그러니 있는 식이라고 생각하시면 됩니다. 신촌에 비하면 정말 근처에 놀만한 곳은 아무데도 없답니다. 차를 타고 40-45분 걸리는 주도 Little Rock에 가야 좀 도시같은 분위기가 납니다. 학교 주변에는 한인교회가 아닌 미국교회 여러개가 있구요, 월마트는 걸어서 10분정도 걸리는 거리에 있구요. 참고로 말씀드리자면 conway에서는 술을 사실수 없습니다. 술을 안파는 county거든요. 하지만 전혀 다운타운같지 않은 10분 거리의 다운타운에 가면 bar도 있긴 하답니다.","기본적으로 여자기숙사 3개, 남자기숙사 3개가 있구요. House라고 기본 기숙사보다는 조금 더 규모가 작긴 하지만 cozy한 공간이 있습니다. 대부분의 교환학생들은 거의 기숙사에 배정을 받긴 하지만, 1년 교환하는 학생중에는 두번째 학기때 house에 배정받는 학생도 운이 좋으면 있습니다. 학교 캠퍼스 자체가 무척 작기 때문에 기숙사에서 강의실까지의 시간은 5분이 채 안걸리구요. 저는 galloway에 살았는데, 운좋게 handicapped room에 배정이 되어서 저는 방 안에 개인화장실이 있었습니다. 제가 다녔던 학기에는 handicapped 학생이 없어서, 정말 운이 좋게 그냥 그방에 배정된거랍니다. 그래서 한학기 내내 공동화장실,공동샤워실에는 한번도 가본적이 없었는데요. 한층에 한,두개씩 공동샤워실과 화장실이 있어서 기숙사에 사시면 대부분 그곳을 이용해야 합니다. 들어가보긴 했는데, 낡긴했지만 깨끗합니다. 식사는 거의 학교식당을 이용하게 되실 텐데요, isep으로 가시면 unlimited mealplan이 제공됩니다. 그래서 정말 무제한으로 학교식당을 이용하실수 있습니다. 토요일 저녁은 학교식당에서 제공이 안되지만, burrow라는 매점 비슷한 공간에서 음식을 사먹으실수도 있구요, 대부분의 학생은 학교밖 레스토랑에 간답니다. 참고로 금요일 저녁 식사는 항상 동일한 메뉴가 제공되서 금새 질리실겁니다. 학교식당의 메뉴는 무척 다양하구요, 맛도 있습니다.","12학점, 4과목을 듣게 되실텐데요. 수업의 수준은, 연세대학교에 비해 현저하게 힘든 수준은 아닙니다. 저는 4000단위 2개, 2000단위 2개를 들었는데요, 그닥 힘들다고 느끼진 못했습니다. 물론 숙제가 여기보다 훨씬 많이, 그리고 자주 있긴 합니다. 참고로 헨드릭스는 인터넷에서 실라버스를 확인하실수 있는 시스템이 갖춰져있지 않습니다. 인터넷에 가시면 아마 교수이름, 강의시간, 과목명만을 확인하실수 있으실겁니다. 후에 연대에서의 학점인정을 위해 실라버스의 확인이 필요하시다면 학교 사이트에서 교수님의 이름을 확인해 이메일주소를 찾으신 후에, 교수님께 직접 contact해서 실라버스를 받아내셔야 합니다. 저도 그렇게 해서 실라버스를 몇개 받았구요, 대부분의 교수님들께서 친절하게 답장해주십니다. 그리고 학기가 끝나고 떠나시기 전에 fausset hall의 transcript담당하는 창구에 가셔서 추가성적표를 부쳐달라고 요청하시면 공짜로 원하시는 매수로 official한 추가성적표를 부쳐줍니다. 저는 참고로 언제 또 필요할지 몰라 5부나 집으로 먼저 발송해놨답니다. (제 친구는 10장을 부치더군요;;) 도서관은 연대 도서관과는 비교도 할수없을만큼 작습니다. 당연히 서장도서수도 현저히 적구요. 하지만 24시간 열려있는 컴퓨터랩이 있구요, 인쇄도 공짜입니다. 도서관 안에 있는 writing center에서 저는 기말paper를 쓸때 몇번 도움을 받았습니다. 이용해보셔도 좋을듯 하네요. 혹시라도 도움이 될까 싶어 제가 들었던 과목도 적을께요.
- evolution with lab (4000 course) - Dr. Harper
연대에는 없는 진화론 과목입니다. 4학년 코스였고, 20명의 학생이 들었습니다. 자연과학 과목에는 모두 다 실험시간이 딸려서 나오는데요, 실험은 일주일에 한번 4시간 연속 진행합니다. 물론 항상 그 시간을 다 채우진 않구요. 실험은 추가 credit이 아니라 그냥 과목에 포함된 것이니 시간표에 따로 lab이라고 찍혀나와도 credit인정 안됩니다. 생물과목중 시간표 맞는 것이 없어 들었는데, 상당히 intense 하지만 interesting 했던 과목입니다. 화석채취하러 산에도 다녀오구요, 1학기동안 진화에 관한 토픽으로 논문작성 해야합니다. 개인 10분 프레젠테이션 한번 있구요, 시험은 총 4번 진행하고, 마지막 기말은 내용누적 시험입니다. 하지만 매 시험마다 study sheet라고 해서 공부해야할 내용을 지정해주기 때문에 그리 힘들진 않습니다. 기본교과서 뿐만 아니라 별도로 2권의 책이 있고, 그건 그냥 숙제로 읽고 항상 discussion 진행합니다.  
- Statistics in Business Major - Dr. Stanley- 2000course
2학년 과목이고 경영전공의 통계입니다. 심리학쪽에 동일과목이 하나 더 있는걸로 기억합니다. 필수과목 수준이라 40명이 수업들었습니다. 헨드릭스에선 최대로 학생수 많은 수준의 과목입니다. 시험 3번, 매주 숙제 있는데 그리 어려운 과목은 아니었습니다. 스탠리 교수님께서는 아마 내년에 안식년으로 강의를 하지 않으신다고 들었습니다.
- Music in Film - 2000course - Dr.Boehm.
음악전공의 과목입니다. 하지만 음악적인 기초지식이 없어도 수강할수 있습니다. 영화음악의 trend에 대해 배우고, 기본적으로 매시간 영화의 하이라이트 장면을 감상합니다. 1번의 그룹프레젠테이션이 있고 시험은 3번 있습니다. 스터디 쉬트 있어서 공부하기 어렵지 않습니다. 
- Corporate Stratege - Dr. Oxner - 4000course
경영 과목의 전략경영입니다. 저까지 포함해서 7명의 senior들이 수업을 들어서 거의 가족분위기의 수업입니다. 매주 케이스스터디와 숙제, 디스커션으로 진행되는 수업이구요, 시험은 총 3번 있으나 마지막 기말은 그 전까지의 성적이 마음에 들면 pass할수 있습니다. 경영전략 게임을 반학기동안 진행하구요, 20분 개인프레젠테이션 있습니다.","Mrs.Kesha 혹은 Dr.Gess가 담당자가 되어주실텐데요, 다들 무척 친절하시고 도움도 많이 주십니다. 국제학생들을 위한 행사가 한학기에 5-6번정도 진행이 되는데 무척 재미있고, 주로 주말에 진행되니 적극적으로 참여해보시는걸 추천합니다. 처음 도착하면 공항에서 픽업도 이쪽 부서에서 담당해서 해결해주십니다. 하지만 떠날때 공항까지 가는 것은 대부분 친구에게 부탁하고 10-20$의 gas fee를 주는 것이 보통입니다.","저는 hendrix choir에 한학기동안 있었는데요, Dr.Fleming이 담당교수님이십니다. 일주일에 1시간30분씩 3번 연습을 하고 한학기에만해도 4번정도의 공연이 있습니다. 특히나 봄학기에는 Arkansas의 다른 대학합창단과 Arkansas주립교향악단과 협연을 하는 공연이 있어서 정말 색다른 경험을 하실수 있습니다. 노래하는걸 좋아하시는 분들은 정말 후회하지 않으실거라고 확신합니다.","그다지 큰 문화충격은 없었습니다. 말그대로 미국이니만큼 성적소수자라고 한국에서 불리는 친구들이 많이 있었고, 개방적으로 자신을 드러내 생활하는걸 볼수 있었습니다. 저는 룸메이트가 남자친구네 방으로 가서 별로 그런일이 없었지만, 남자 혹은 여자친구 일 때문에 당황하는 동양교환학생 친구들도 보긴 했습니다. 또 마리화나도 정말 쉽게 접하실수 있습니다.","제가 갔을때는 2.3.4학년에 한국여자학생들이 있었는데요, 지금 4학년 아라언니는 졸업을 해서 아마 1학년으로 새로운 한국학생이 들어오지 않는한 2명의 한국여학생이 있을겁니다. 학교식당에 미미이모가 counter에서 일하시구요. 도움이 필요하시다면 제일먼저 Mrs.Kesha에게 가는 것이 빠를거라고 생각됩니다.","저는 4학년 1학기에 교환학생을 가서 한학기밖에 있을수 없었지만, 늦게나마 다녀오기로 결심했던걸 정말 잘한 결정이라고 생각합니다. 말씀드렸듯이 정말 미국에서도 별로 유명하지 않은 주에 위치해 있어서 한국학생들이 거의 없는 편입니다. 그래서 저는 한학기동안 ''''영어만'''' 말그대로 쓸수 있었구요. 대도시의 학교에는 이제 거의 한국학생들이 없는 학교가 없는데, 아직 헨드릭스는 한국학생들이 별로 없습니다. 제가 1년동안 유일한 한국 교환학생이었어요. 영어가 교환학생가는 priority라면 적극 추천할만한 학교입니다. 그에 반해 국제학생들의 출신국가는 상당히 다양한 수준이라 여러 곳에서 온 다른 친구들을 만나실수 있습니다. 저는 항상 도시에서만 자라왔고, 3년동안 연속되온 학기에 지쳐있던 떠라 조금 생각할 시간도 갖고 여유를 갖고 이 시간을 지내고 싶어 헨드릭스를 선택했고, 지금도 제 선택에 후회를 갖진 않습니다. 영어가 중요사항이고, 스트레스 없는 자기만의 시간을 갖길 원하신다면 저는 헨드릭스를 추천해드립니다."
