gen_info,env_info,food_info,study_info,office_info,facil_info,mhct_info,help_info,etc_info
"우선 학교의 전체적인 면적은 연세대학교와 비슷한데 대부분이 주차장이나 운동경기장 등으로 이루어져 있어 실제 이용하게 되는 면적은 정문에서 본관까지의 거리라고 할 수 있다. 학교가 있는 Fullerton이라는 도시 자체는 잘 알려져 있지 않지만, LA와 30분 거리에 있으며 디즈니랜드가 있는 Anaheim과도 매우 가깝다. 캘리포니아의 특성상 1년 내내 맑은 날씨가 계속되고 여름에는 특히 햇살이 강하고 무덥다. 캘리포니아로 교환학생이나 어학연수를 가는 주변 친구들로부터 여름옷에 긴팔 스웨터 정도만 있으면 1년 지내기에 어려움이 없다는 말을 많이 들었는데 아무리 따뜻한 곳이라해도 겨울에는 우리 나라 가을에 입을 법한 옷을 입어야 하며 그곳에서 태어난 학생들의 경우 부츠에 목도리, 장갑까지 착용하기도 해 어느 정도의 겨울옷 준비는 필요하다고 할 수 있겠다.",대학 주변 환경은 신촌과 너무나 다르다. 학교 주변은 아파트들이 대부분이고 큰 길이 만나는 곳마다 대형마트나 패스트푸드 체인점들이 몇 개 모여있는 정도이다. 특히 차가 없으면 갈 수 있는 곳이 매우 제한적이기 때문에 1년 동안 거주하게 될 경우 저렴한 중고차라도 구입하길 추천한다. 차가 없을 경우 학교 앞에서 57번 버스를 타면 15분 거리의 Brea Mall에 갈 수 있고 26번 버스를 타면 Downtown Fullerton까지 가는데 클럽이나 바에 갈 수 있다. 개인적으로 Fullerton보다는 Brea의 다운타운이 깔끔한 편이며 음식점도 더 많고 영화관도 있어서 자주 들르게 됐다. 차를 타고 15분 정도 거리에 있는 Buena Park이나 Diamond Bar에 가면 한국마트가 있어 한국음식도 쉽게 구할 수 있다.,"학교에 처음 도착해서 가장 먼저 놀란 것은 수업 후 학교에 남는 사람이 거의 없을 정도로 썰렁해진다는 사실이다. 실제로 Commuter school이라 불릴 정도로 학교 주변에 사는 학생들보다 집에서 통학하는 학생들의 비중이 훨씬 큰데, Fullerton에 거주하는 학생들은 대부분 학교 근처 아파트에서 룸을 얻어 친구들과 함께 산다. 기숙사에 사는 학생들은 선택받았다고 해도 될 만큼 들어가기가 힘들며, 기숙사를 원할 경우 2차 서류를 내자마자 학교에 신청하길 추천한다. 어드미션을 받기 전에도 기숙사 신청이 가능하다고 하고 5월 초면 거의 마감된다고 한다. 홈스테이는 구하기가 비교적 쉬운데 어드미션을 받은 후 국제학생 오피스에 신청을 하면 된다. 식사를 신청하지 않아도 한달에 600불의 렌트가 들어 주변 시세보다 비싼 편이다. 가장 추천할만한 방법은 국제학생 오피스에 temporary housing을 신청해서 3~4일간 홈스테이를 하면서 주변의 아파트를 구해 들어가는 것이다. 나의 경우 첫학기에는 홈스테이를 하고 다음학기는 룸메이트를 얻어 아파트로 이사했는데 렌트가 400불로 줄어들어 좋았고 룸메이트들과 놀면서 영어가 많이 늘어 더 좋았다. craigslist.com에 들어가면 룸메이트를 구하는 포스팅을 찾을 수 있다. 이 싸이트에서는 중고품도 매매할 수 있어 한국으로 돌아올 때 도움이 된다. 나 역시 쓰던 가구들, 자전거를 올 때 좋은 조건에 팔 수 있었다. 
식사는 거의 학교에서 하게 된다. TSU라고 학생회관 같은 건물이 있는데 그 곳에 푸드코트에서 많은 학생들이 점심을 해결한다. 하지만 한 끼에 평균 7불 정도가 들어서 점심을 매일 사먹긴 경제적으로 부담이 된다. 집에서 도시락을 싸오는 아시아계 학생들이 많으며, TSU에 전자레인지도 여러 대 있어서 냉동식품을 가져와 먹을 수도 있다. 1~2불이면 스파게티나 라자냐 같은 냉동식품을 마트에서 구입할 수 있어서 점심으로 많이 이용했다. 이 밖에 학교에서 가까운 St.college와 Chapman이 만나는 곳에 음식점이나 카페 같은 곳이 들어서 있으며 Chapman과 Placentia가 만나는 곳에 In-n-out이라는 햄버거 가게가 있는데 캘리포니아에만 있는 버거라고 해서 유명하다. 한번쯤 꼭 들려볼만 하다.","본전공은 행정이지만 경제를 이중전공하고 있어서 교환대학에서는 경제학을 위주로 들었다. 아무래도 에세이와 토론 중심인 행정학보다는 강의와 시험 위주의 경제학이 영어로 듣기 무난했다. 
첫학기는 연극, 댄스, 행정학개론, 비교경제학, 경제발전론을 들었는데 그 중 연극수업을 추천한다. 파트너와 함께 하는 과제가 많아 친구도 많이 사귀게 되고 대본암기가 많아서 영어회화에도 도움이 된다. 다음학기는 경제학 전공만 들었는데 국제무역론, 계량경제학, 수리경제학, 산업조직론을 들었다. 
수업 난이도는 연세대와 비교해 볼 때 매우 평이하다. 미국 학생들보다 특히 강점이 있는 수학에 관련된 전공이어서 그런지 수업을 듣는 데는 큰 어려움이 없었다. 하지만 그 외 과목의 경우는 토론이나 발표 수업이 많아서 언어장벽의 애로사항이 있었다.
도서관은 컴퓨터실을 주로 이용했었다. 개인적으로 도서관보다 학생회관과 같은 개방돼있는 공간에서 공부하는 걸 좋아하는 스타일이어서 도서관엔 출입할 일이 자주 없었다. 연세대처럼 2,3층은 자료열람실이지만 공부할 수 있는 책상도 마련되어 있고 4층부터는 공부만 할 수 있게 만들어놔서 이 곳에서 공부하는 학생들도 제법 많다. 하지만 개방시간이 10시30분까지이며 금요일에는 5시에 문을 닫아버리기 때문에 시험기간에 밤샘 공부를 원하는 학생들은 TSU에서 하는 All night study에 참여해보길 추천한다. 밤 10시나 12시에는 학생회에서 간식이나 기념품 등을 나눠주고 있어 일석이조다.","CSU의 다른 캠퍼스의 경우 국제교육부에서 월간 행사도 주최하는 등 국제학생에 대한 관심도 많고 거기에 따른 배려도 크다. 하지만 CSUF의 경우 국제학생생수가 다른 캠퍼스들에 비해 압도적으로 많아 눈에 띠는 배려는 없다. 매주 수요일 낮에 International coffee break를 하고 있어 다른 국제 학생들도 만날 수 있지만 대부분의 학생들이 학교에 적응이 끝나고 나면 나오지 않는다. 국제학생부의 도움을 받았던 경험은 수강신청 때였다. 수강신청의 압박을 받지 않고 원하는 리스트를 한 과목당 1지망 분반, 2지망 분반까지 적어 내면 2지망 내에서는 반드시 들을 수 있었다.","학교 자체로서는 국제학생이 적응하기 꽤 어려운 환경이었던 것이 사실이다. 특히 아시아계 국제학생들이 워낙 많아 큰 관심이나 배려 등을 기대할 수 없고 학생들 대부분이 방과 후엔 아르바이트를 하러 가거나 집으로 돌아가기 때문에 학교에서 하는 행사들도 많지 않다. 개인적으로 그런 점 때문에 초기에는 많이 힘들었으나 학교 동아리를 여러개 들어 친구들을 다양하게 사귈 수 있었다. 종교가 기독교라서 CCC에 들었는데 매주 동아리 모임이 있으며 격주로 여러가지 행사를 하고 학기별로 수련회도 있다. 전공관련 학회로는 Economic Association에 가입했는데 다른 비지니스 관련 학회들보다 회비도 저렴하고 인원이 소규모라 부담이 없어 좋았으나 행사의 대부분이 현지에서 취직하는 것에 초점이 맞춰져 있어 나 스스로는 얻은 게 별로 없었다. 하지만 경제 전공의 특성상 수업에서 친구를 만들기 어렵기 때문에 학회 친구들과 자연스럽게 수업을 같이 들을 수 있어 좋았다. 가장 재밌었던 동아리 활동은 Sailing club이다. 내가 교환을 간 학기에 처음 개설된 동아리라 처음 기반잡는 일에 함께 한다는 점이 좋았다. 격주로 20분 거리에 있는 Long Beach에 가서 직접 보트로 항해 연습도 해 볼 수 있었다. 무엇보다 한국에서 하기 힘든, 캘리포니아에서의 특별한 경험이었다는 점이 좋았다.","학교에서 받은 충격은 이 곳의 여학생들이 학교에 오는 복장 때문에서였다. 미국에서 맞는 치수를 구할 수 없어 신발, 옷 등은 99% 한국에서 가져온 것이었는데 반바지에 나시티, 슬리퍼 차림에 커다란 백팩을 매고 다니는 그 곳 여학생들이 가끔씩 약속이 있을 때나 입는 옷인 것을 알고는 정말 당황스러웠엇다. 지역마다 학교마다 다르겠지만 내가 갔던 학교의 경우 정말 편안하고 활동적인 차림으로 다니는 여학생들 뿐이라 미국 드라마나 영화에서 나오는 학생들의 이미지는 매우 과장된 것이었음을 느꼈다. 
다른 국제학생들이 한국어를 너무 잘 알고 있을 때도 깜짝 놀랐던 적이 많다. 고등학교 때 배웠던 중국어 외에는 그 어떤 언어의 한 마디도 할 줄 모르는 내가 부끄럽기도 했다. 유럽계 학생들도 한국 인삿말 정도는 할 줄 알며, 아시아계 학생들은 적지 않은 한국어 표현들을 알고 있어서 나를 깜짝 놀라게 했다. 나와 다른 문화에 대해 좀 더 관심을 가져야겠다는 생각을 하게 됐다.","도움을 받을 일은 차가 없었기 때문에 라이드에 관련된 게 대부분이었다. 정말 필요할 땐 룸메이트나 친구들의 도움을 받았는데 부탁하는 걸 불편해 하는 성격이라 가능한 거리는 버스로 해결했다. 한국 교환학생은 나 혼자였었고 학교 앞 ALP라는 어학연수 프로그램에 오는 한국학생들과는 접할 기회가 없어 한국친구가 별로 없었다. 대신 주일에는 한인교회를 나갔는데, 일주일에 한번 한국음식도 먹을 수 있었고 한국인들을 만나 얘기하는 것이 향수병을 잊는 데 큰 도움이 됐다.","흔히 말하는 ''스펙''을 만들기 위한 노력 중 하나로 교환학생도 가게 된 것이 사실이다. 학점도 높아야 하고, 인턴 경험에 어학점수에 봉사활동 경험이며 자격증까지 요즘 대학생들에겐 학기 중은 물론이고 방학에도 여유란 찾아볼 수가 없다. 교환학생을 가있는 1년 동안은 학업에 대한 부담 없이 미래에 대한 걱정 없이 여행도 이곳 저곳으로 자유롭게 다녔고 주말엔 공원이나 해변을 찾아 피크닉도 떠나면서 태어나 처음으로 자유를 느꼈다. 하고 싶은 걸 다 해보고 그에 대해 내가 책임지면서 많이 성숙해져서 돌아온 것 같다. 교환학생을 가는 모든 연세학우들이 어느 곳에 얼마 만큼의 기간을 가든 스스로 후회하지 않을 만큼 값진 경험을 풍부하게 하고 돌아오길 바란다."
크기는 본교와 비슷하다고 생각된다. 하지만 캘리포니아 지역의 특성상 1인당 차가 1대씩 있기 때문에 주차장이 교내 1/3을 차지한다고 할 수 있다. CSFU는 LA 와 샌디에고 중간에 있는 Fullerton이라는 씨티에 있는 주립대이다. 텔레비전에서 항상 보던 뜨거운 햇살이 내리찌는 비치가 있는 캘리포니아이기에 햇살이 매우 강해서 한여름에는 섭씨 36를 넘는 날씨가 계속되기도 한다. 캘리포니아 사람들 사망률 1위가 피부암이라고 하니 그 정도를 가늠해 볼 수 있을 것이다. 고로 선글라스나 선블럭은 필수로 항상 챙기는 것이 좋겠다.,"걸어서 갈수 있는 곳중에선 식당은 chipotlle, 후식은 yogurt land를 추천한다. 그리고 Bank of america가 있으므로 차가 없는 사람들은 그 곳에서 계좌를 만들면 편리할 것이다. 학교 바로 주변에는 아파트들이 많고 식당이나 조그만 마트들이 많은 편이라 걸어서 갈 수 있는 거리에서 할 수 있는 것들은 그리 많지 않다. 
차가 있다면 갈 수 있는 곳이 좀 많아진다. 가장 가까운 몰은 프리웨이 57번 North 를 타고 5분만 가면 Brea mall이 있다. 그리고 Imperial과 kraemer가 만나는 길에도 월마트나 여러 마트들이 많아서 다양한 것들을 구할 수 있다. 다른 쇼핑몰로는 Coata mesa에 있는 South coast plaza가 Brea보다는 크고 괜찮다. 한시간 15분 정도 떨어진 거리에 Cabazon desert hills outlet이 있는데 대폭 할인된 물건이 많아서 가볼만 하다. 그 곳에 가면 이 주변에 있는 한국 사람 다 모였구나 하는 생각이 든다. 
쇼핑 말고도 디즈니랜드도 가깝고 Knott's berry farm이나 6 Flag magic mountain같은 놀이공원도 있다. 디즈니랜드는 캐릭터 위주의 곳이고 knott's 는 약간의 캐릭터와 놀이기구 6 Flag는 놀이기구 위주이다. 놀이기구 타는 것을 즐긴다면 6 flag를 추천한다. 엎드려서 타는 롤러코스터나 서서 타는 롤로코스터 등 재미있는 기구가 많다.","CSFU의 가장 큰 단점이 기숙사에서 살기가 힘들다는 것이다. 기숙사가 너무 작아서 자리를 구하기 쉽지 않다. 또한 UV라고 University village라는 곳이 있는데 그 곳도 교환학생이 들어가기엔 힘들다고 한다. 그래서 대부분이 교환학생들이 아파트를 구해서 살거나 홈스테이를 한다. 홈스테이를 하고싶은 경우는 한국에서 출발하기 전에 그 학교 국제교육부쪽에 문의를 하면 홈스테이 담당자가 구해주는 것으로 알고 있다. 나 같은 경우에는 학기가 시작하기 전에 좀 일찍 가서 아파트를 구했다. 가격은 싼 경우 원베드룸이 900불 정도 비싸면 1300정도 한다. 혼자 쓰기는 부담스러우므로 룸메이트를 찾을 것을 권유한다. 나 같은경우에는 처음 갔을 때는 아는 사람이 없어서 혼자 살았는데 나중에는 룸메이트를 얻어서 같이 생활하였다. 처음에 아는 사람이 없어서 룸메이트를 찾기 힘들다면 국제교육부 사무실 앞에 게시판에 보면 룸메이트를 찾는 사람들이 글을 써놓은 것이 있다. 그것을 참고하면 보다 쉽게 구할 수 있을 것이다. 그 외에 전자제품이나 차 같은 것을 사고 파는 것도 붙어있으니 잘 챙겨보기 바란다. 
식사는 주로 집에서 요리를 해먹었다. 처음엔 TSU에서 사먹었는데 맛도 없고 가격도 비싸다. 주변 음식점들은 그나마 괜찮은 편이지만 지출이 만만치 않아서 직접 Albertson같은 마트에 가서 재료를 사가지고 해먹는 것이 가장 좋다. 차를 타고 20분 정도 거리에 한남체인이라고 한인마트도 있어서 한국 음식 해먹는 것도 어렵지 않다. State college blvd에서 chapman길을 타고 쭉 15분 정도 가면 Chapman길이 Malvern으로 바뀌고 그 길과 Beach blvd가 만나는 길에 한인마트가 있다.","나는 수업은 경영학 전공과 운동 과목들을 들었다. 가을학기에는 Buyer behavior, Marketing Resrch Methods, Principles of Advertising, Basic Hatha Yoga, Aerobic Ex And Wgt Contrl을 들었는데 그다지 어렵지는 않았다. 전공 과목들은 운이 좋게도 시험들이 주로 객관식으로 이루어져 있어서 시험도 꽤 잘 볼 수 있었다. 전공 수업이라 배경지식이 있어서 영어를 알아듣는 것도 그리 어렵지는 않다. 다만 교수님 중에 미국분이 아니라 다른 나라에서 오신 분들이 있으신데 그런분들은 억양때문에 교환학생들이 알아듣기 힘들기도 하다고 한다. 봄학기에는 International Marketing,  Marketing Info Technology, Intermediate Accounting, Fitness Walking, Intermediate Hatha Yoga 를 들었다. 역시 전공과목들은 기초 지식이 있어서 그리 어렵지 않았고 운동과목들은 차를 타고 다녀서 움직일 기회가 많이 없는 캘리포니아 생활에서 도움이 되는 수업인듯 하다.
도서관은 지하 1층에는 컴퓨터실이 있고 1, 2 층은 컴퓨터와 공부하는 곳이 같이 있으며 3층은 조용하게 공부를 할 수 있는 곳이다. 4층은 칸막이가 있는 도서관용 책상이 아니라 테이블이 있는 곳이라 조모임을 할 때 많이 이용하였다.",국제교육부의 도움을 가장 크게 필요로하는 때는 수강신청할 때가 아닌가 싶다. 수강신청은 미리 리스트를 작성해서 오피스에 넘겨주면 그쪽에서 대신 신청을 해준다. 우리가 하고싶어도 여러가지 HOLD 걸려있는 것들이 많기 때문에 쉽지 않다. 그리고 출국하기 전에 미리 예방주사를 맞아서 그 증명서를 가지고 갈 것을 권한다. 예방주사를 맞지 않으면 우리 학교 포탈이라고 할 수 있는 Titan online에 Hold가 걸려서 수강신청에 지장이 많다. 나는 증명서를 가지고 가지 않았기 때문에 학교 내의 Health center에서 MMR을 맞으러 갔는데 한국에서 맞은 적이 있다면 혈액검사를 해서 확인하는 방법도 있다.,국제 학생들을 위한 단체에는 ICF나 ISA가 있다. 처음에 갔을때는 그 곳의 도움을 받는 것도 좋을 것 같다. 행사도 많이 주최하고 TSU에서 1주일에 한번씩모임도 가지므로 다양한 사람들을 만날 수 있다.,딱히 충격이라고 부를만한 것들은 없었다. 그냥 우리와 다르기 때문에 그런것이라고 생각하면 크게 놀랄만한 것들은 없었다. 오히려 우리나라에서보다 다양한 것들을 경험할 수 있는 곳이라고 생각한다. 약간은 한국에서와 달리 일탈을 즐길 수도 있을 듯하다. 다르다고 두려워하거나 겁먹지 말고 오히려 즐기려고 해보아라.,나는 주로 IEE 오피스에서 도움을 받았다. 학교 관련 일이 아닌 경우에는 수업을 들으면서 혹은 동아리 같은 곳에서 친해진 친구들의 도움을 많이 받았다.,"개인적으로는 캘리포니아에서의 생활을 재미있게하려면 차를 구입하는 것을 추천한다. 중고차를 구하는 것도 쉽기 때문에 차를 구해서 타다가 한국으로 돌아올 때 팔고 오면 된다. 상황이 여의치 않다면 아이들이 대부분 차가 있으므로 친구들과 친해져서 같이 다녀도 무방하다. 
나 같은 경우에는 3년정도 다닌 학교생활에 지쳐있다가 교환학생을 가게 된 것이었다. 캘리포니아에서 생활은 그런 나에게 여유를 가져다 준 시간이 아니었나 생각된다. 학교 수업에 그리 매달리지 않아도 되고 기분나는대로 여기저기 차타고 돌아다닐 수 있는 자유로운 날들이었다. 교환학생을 가려는 사람들에게 자유와 여유를 마음껏 즐기고 오라는 말을 하고 싶다."
"교환대학의 크기는 연대와 비교해 봤을 때, 연대 정문에서부터 연희관까지 정도라고 생각하시면 비슷할 것입니다. 주차장이나 다른 시설들을 합치면 물론 더 크지만, 이동거리는 그 정도로 충분하다고 생각합니다. 경영학과 건물은 두 개, 새로 지어서 올해 가을부터 열릴 건물까지 세 개인데 모두 정문 바로 앞에 있어서 학교 안을 많이 돌아다닐 필요도 없습니다. CSU에서 학생 수만으로는 가장 크다고 할 수 있겠지만 캠퍼스는 거의 가장 작은 편에 속합니다. 지리적으로 Fullerton의 가장자리에 위치해 있는 학교입니다. 기후는 캘리포니아라서 햇살이 언제나 강하며 여름에는 특히 덥습니다. 한국에 비해 습한 것이 없어서 좀 덜하지만 강렬한 햇살 때문에 일 년 내내 선그라스가 필수품입니다. 겨울에는 한 달 정도 비가 자주 내리는 시기가 있고, 이 때에는 바람도 많이 불어 꽤 춥습니다. 겨울에도 따뜻한 편이라서 가을 같지만, 밤에는 추워서 두꺼운 옷이 필요하기는 합니다.",대학 주변에는 아파트가 대부분이고 차를 타고 15분 거리에 다운타운이 있지만 굉장히 작은 편입니다. 학교에서 가장 가까운 은행은 Bank of America이어서 여기서 학생들이 계좌를 많이 엽니다. 학교 옆에 57번 프리웨이가 있습니다.,"저는 한 학기는 학교 근처의 아파트에서 혼자 살았고, 다음 학기는 미국인 룸메이트를 얻어 이사하였습니다. 보통 많은 학생들이 근처 아파트에서 삽니다. 기숙사는 방학에 비워줘야하기 때문에 아예 신청할 필요가 없습니다. 1학기 가는 것이라 하여도 기숙사에 들어가는 것은 굉장히 힘들어서 근처 아파트에 렌트하시는 것이 가장 좋은 방법입니다. 학교 내에 TSU라는 연대의 학관 같은 곳에 음식점이 있습니다. 그렇지만 가격이 비싸기 때문에 많은 학생들이 도시락을 준비해옵니다. 한인마트는 학교에서 차를 타고 30분 정도 거리에 있습니다. 저는 차가 없었기 때문에 보통 Yorba Linda Blvd에 있는 Arbertson에서 보통 시장을 보았습니다.","수업은 기본 1시간 15분 수업으로 1교시가 이루어집니다. 수업에 따라 다르겠지만 연대와 비교하여 난이도는 크게 어렵지 않았습니다. 제가 들은 수업은 1학기 Human Resource Management , Intro Info Sys & Appli, Principles Macroeconomics, Business Finance, Acting for Non-Majors  2학기는 Personal Finacial management, Intro to Investments, Business Calculus, Theory of Corperate Finance, Introduction to Dance  였습니다. 특히 Calculus는 정말 쉬웠고, 재무수업들도 쉬운 편입니다. 하지만 투자론은 큰 프로젝트도 있었고, 시험들도 굉장히 어려워서 한 학기 내내 고생했던 과목입니다. 도서관은 TSU와 경영건물들 사이에 있는데, 자리도 널직하고 컴퓨터를 이용하기도 편해 자주 갔었습니다. 다만 4층에는 학생들이 조모임을 갖거나 해서 시끄러운 편입니다.","국제 교육부에서 Jean Hotta라는 분이 교환학생 담당자이십니다. 그 전에는 연대에서도 공부한 경험이 있는 분이셨지만 제가 간 후 한 학기만에 바뀌었습니다. 가면 친절하게 도움을 주시는 분이지만, 항상 바쁘셔서 만나기 힘드므로 약속을 미리 잡고 만나는 것이 좋습니다. 참고로 수강신청은 교환학생 본인이 할 수가 없으므로 듣고 싶은 희망과목을 이메일로 보내서 부탁드려야 합니다. 저 같은 경우는 봄학기 이후에 제가 한국으로 돌아간 줄 알고 수강신청을 안해주셔서 난감한 적이 있었는데 약속을 잡는 것이 조금 힘들었던 기억이 있습니다.","저는 Finance Association을 2학기에 가입하였습니다. 동아리라기 보다는 가입비를 내고 실제 일하시는 분들을 모셔서 스피치를 듣거나 질문을 할 수도 있는 시간을 제공하는 곳입니다. 덕분에 유익한 것들을 많이 알 수 있었지만, 졸업 후의 진로에 대해 초점을 맞추는 것이라 한국으로 돌아오는 교환학생들에게는 다소 낯선 것이 많을 수 있습니다. 
학교 내에 운동을 할 수 있는 피트니스가 있습니다. 거기서 플러튼 학생들은 무료로 사용할 수 있어서 저도 자주 이용하였습니다.","각국에서 모인 교환학생들과 친구가 되면서 내가 당연하게 받아들이는 것이 그들에게 전혀 새로운 것일 수 있다는 것, 또 내 의도가 다르게 받아들여질 수 있다는 것이 신기하였습니다. 오히려 그런 것들을 보면서 반대로 한국, 한국사람에 대해서 많이 생각하게 해주었습니다. 고정관념을 가지고 있으면서 가지고 있는 것 자체를 몰랐던 것도 많이 깨달았습니다. 내가 가진 생각의 틀을 깰 수 있는 기회들이 항상 주변에 기다리고 있습니다. 쇼크라기 보다는 조금더 넓고 다양하게 생각할 수 있는 것들이 많았다고 생각하고 있습니다.",아까 언급한 국제 교육부에 가시면 도움을 얻을 수 있습니다. 학교 안에 Health Care Center가 있으니 아플 때 가서 이용하셔도 됩니다.,
